错句,作文编码,国籍,性别,考试时间,作文题目,口试分数,作文分数,听力分数,阅读分数,综合分数,总分,证书
两年的图书[F書]馆工作{CQ的}经验使我不但[B单]{CD只}学会{CQ了}不同的图书[F書]知识[F識]，而且{CC更加}使我建立起自信[BQ，]{CD及}为以后的人际关系打下了良好的基础。,199412104625100634,葡萄牙,1,199412,记对我影响最大的一个人,80,85,70,65,84,378,B,
以孩子来说，母亲是最伟大的人，我母亲也是。,199412104525200102,日本,2,199412,记对我影响最大的一个人,80,85,73,69,76,377,B,
既使有好吃的东[F東]西、有漂亮的衣服，也不吃不穿。,199412104523200645,韩国,2,199412,记对我影响最大的一个人,65,65,49,40,59,262,未参加,
当时由二十岁的大哥来扶养。,199412104523100633,韩国,1,199412,记对我影响最大的一个人,65,55,73,65,61,301,C,
总[F總]之，对[F對]我来[F來]说，学[F學]习[F習]汉[F漢]语，乐[F樂]多于[F於]苦，甚至不觉[F覺]其苦，只觉[F覺]其乐[F樂]，其乐[F樂]无[F無]穷[F窮]。,199409543501100209,中国,1,199409,学习汉语的苦与乐,80,95,76,79,99,425,B,
还[C]好，香港的小学[F學]也开[F開]始教普通话[F話]了。,199409543501100210,中国,1,199409,学习汉语的苦与乐,80,60,76,68,79,350,C,
渐渐地{CC的}，家里环境改善了，父亲尽一切能力送我们兄弟姐妹人人上学{CC入学}读书。,199500533533100032,新加坡,1,199500,记对我影响最大的一个人,80,85,70,73,78,380,B,
父亲[F親]因一生安逸{CC悠逸}，此时[F時]一家之计[F計]，全靠母亲[F親]一人了。,199500533501200078,中国,2,199500,记对我影响最大的一个人,95,90,83,71,82,420,A,
一天，当我如常到他家去时，桌上留[Y畄]了一封信[Y伩]，信[Y伩]上说：“亲[F親]爱的，我要去中国的上海去做另一项研究，恐怕要[C]在那儿呆上三、五年，带你去恐怕不方便，不敢当面告诉你是怕你伤心，珍重，再见！,199500533533200087,新加坡,2,199500,记对我影响最大的一个人,85,90,68,67,84,390,B,
你应该承认错误，以后不可再这么做{CQ了}。,199500533540200112,印度尼西亚,2,199500,记对我影响最大的一个人,65,65,75,73,82,344,C,
现在，我可长大了，也进入{CC出来}社会工作了。,199500533533200134,新加坡,2,199500,记对我影响最大的一个人,95,70,68,38,55,320,未参加,
母亲[F親]总是先为哥哥着想，没有{CJ-sy尽到}好好地{CC的}侍[B待]候丈夫本身{CQ应}做的责[F責]任。,199500533540200138,印度尼西亚,2,199500,记对我影响最大的一个人,85,70,39,46,43,274,未参加,
他的学问[C]、修养[F養]都足为[F為]我一生之榜样[F樣]，尤[C]其是他那种[F種]学而不倦、活到老学到老的的精神，最值得[L]我们[C]敬[C]佩和学习[F習]。,199510512634100531,英国,1,199510,记对我影响最大的一个人,80,65,81,75,86,375,B,
世界{CD上[C]}越来越失去人情味，所以他们找不到需要的{CJ-zxy东西}。,199510550523100908,韩国,1,199510,如何看待“安乐死”,75,65,40,44,35,246,未参加,
很多人会说，我们是人，不能那么无情。,199510550523200912,韩国,2,199510,如何看待“安乐死”,80,75,67,37,61,311,未参加,
所以说[F說]“[BC「]安乐死”[BC」]这[F這]种[F種]制度很难[F難]说[F說][BD，]好或者是不好。,199510550523200928,韩国,2,199510,如何看待“安乐死”,90,85,48,58,57,335,C,
从{CC在}法律的观[C]点[C]上{CQ来看}，杀[F殺]人者必须受到制裁，这[F這]包括在死者要求下的情况。,199511543501100514,中国,1,199511,如何看待“安乐死”,75,90,81,66,86,392,B,
法律是为[F為]了保障每一个人的安全、[BC，]自由等权利，这[F這]是法律的可贵之处[F處]。,199511543501100514,中国,1,199511,如何看待“安乐死”,75,90,81,66,86,392,B,
在此，随函附上学历影印本一份，槟榔艺术学院广告设计毕业证书影印本一张以及参与海报及班级布[F佈]告板设计比赛所获得之奖状影印本一份，敬请查收。,199503681519200549,马来西亚,2,199503,一封求职信,90,90,79,66,82,405,B,
×××4，JalanNyaman12，TamanBukitIndah，58200KualaLnmpur.季翔先生，精美服装公司1995年3月19日季先生应聘服装设计师：我在[BQ《]星洲日报[BQ》]看到贵公司的招聘启事，故兹特致函应征服装设计师一职。,199503680519200526,马来西亚,2,199503,一封求职信,80,75,69,70,91,376,B,
所以，我在高中毕业的时候，报考中文系。,199505550523100904,韩国,1,199505,记对我影响最大的一个人,70,65,62,69,65,317,C,
这一切都应归功于我那表姐。,199505550523200909,韩国,2,199505,记对我影响最大的一个人,95,80,65,40,74,350,未参加,
我[C]提前什么也没有准备，所以看{CQ着}问[C]题也不能回答。,199505104501100025,中国,1,199505,记对我影响最大的一个人,65,70,52,50,45,268,未参加,
他总是把对儿子的教育放在第一位。,199505104523100065,韩国,1,199505,记对我影响最大的一个人,70,70,75,65,72,340,C,
我的将[C]来，一是为了我的梦，二是为了我妈妈的梦。,199505104525200067,日本,2,199505,记对我影响最大的一个人,85,90,65,71,78,385,B,
我听{CQ了}这种话，决定了来中国学习。,199505104525200070,日本,2,199505,记对我影响最大的一个人,60,80,62,65,67,321,C,
我被欺负的时候，救了我的就是他，我们{CQ在}这件事情以后{CC以来}交了朋友[BQ。]我们一起上课，一起玩，[BC.]我做不好的事情的时候，他批评我，他做坏事的时候，我也批评{CD了}他。,199505104525100073,日本,1,199505,记对我影响最大的一个人,60,65,54,63,78,303,未参加,
他对别人很[C]宽容，但是对自己的要求很严格。,199505104523200122,韩国,2,199505,记对我影响最大的一个人,70,75,68,61,55,318,C,
他叫王术学，是我[C]的小学历史老师。[BC，],199505104624200143,挪威,2,199505,记对我影响最大的一个人,80,75,70,69,76,361,B,
他从小一直听美国音乐，同时{CD只}一个人开始练习弹乐器。[BC.],199505104525100159,日本,1,199505,记对我影响最大的一个人,65,55,41,48,45,236,未参加,
听到这个消息，父亲感到格外高兴，好像[B象]比我更高兴。,199505104525200155,日本,2,199505,记对我影响最大的一个人,65,90,70,83,80,379,B,
他既是我的长辈又是我的好朋友。[BC.],199505104525200166,日本,2,199505,记对我影响最大的一个人,70,85,60,71,67,345,C,
我第一次和他见面的时候我就可以感觉到这个{CC位}人与{CC和}众不同：他的目光炯炯，神采奕奕。,199505104606100181,比利时,1,199505,记对我影响最大的一个人,75,65,65,40,41,273,未参加,
结婚以后，父亲是一个大好人，因此经常上当。,199505104523100196,韩国,1,199505,记对我影响最大的一个人,85,80,86,67,86,397,B,
现[C]在我也不再是{CC3不跟}以前那[C]样内向的人。,199505104523200202,韩国,2,199505,记对我影响最大的一个人,80,85,78,69,72,378,B,
说到挺容易可做事很难。,199505104523200229,韩国,2,199505,记对我影响最大的一个人,70,60,57,44,55,271,未参加,
比任何人{CJX}他给我的影响{CJX}{CQ都}大。,199505104525100258,日本,1,199505,记对我影响最大的一个人,65,55,75,75,61,313,C,
我很感谢他给我的帮助和友谊。,199505104523200269,韩国,2,199505,记对我影响最大的一个人,75,65,70,61,45,303,C,
在我[C]一生中我[C]亲[C]爱的亚[C]婆[C]是[C]很[C]重[C]要[C]的[C]一个人，我[C]永远[C]记得她[C]。,199505104801100281,澳大利亚,1,199505,记对我影响最大的一个人,75,80,52,34,43,275,未参加,
母亲小时候[L]就失去母爱，她由舅舅带大，生活虽清苦，但却很快乐。,199508682519200502,马来西亚,2,199508,记对我影响最大的一个人,85,80,89,75,82,404,B,
以往{CC过往}我常会为自己选择不当、选择错误而伤心、失望，但在母亲的影响{CD力}下我终于{CC2终}从深渊中勇敢爬起，重振希望。,199508682519200502,马来西亚,2,199508,记对我影响最大的一个人,85,80,89,75,82,404,B,
”林老师是良师也是益友，他的爱心与负责任的精神深深地{CC的}感动了我。,199508683519100511,马来西亚,1,199508,记对我影响最大的一个人,85,85,75,71,84,395,B,
她也把家里打扫得一尘不染。,199508680519200535,马来西亚,2,199508,记对我影响最大的一个人,80,90,70,69,78,382,B,
而我守时的习惯[BD，]是从开始进入学府时[BD，]被父亲{CD所}培养{CQ出}的。,199508682519200543,马来西亚,2,199508,记对我影响最大的一个人,90,85,73,55,69,369,B,
只有在我遇到××----一个对我影响最大的人后，我才开始晓得探讨生命的真谛，我才懂得不少的{CD做}道理。,199508682519200547,马来西亚,2,199508,记对我影响最大的一个人,85,80,89,71,78,396,B,
发[F發]生在亲[F親]人、朋友或身边周围[F圍]的人{CJ-zxy身上}，往往让{CC给}我感受到爱[F愛]情和婚姻是需要好好的思考和好好的准[F凖]备[F備]的，万[F萬]万[F萬]不能掉以轻[F輕]心。,200010801501150016,中国,1,200010,我对离婚问题的看法,70,75,61,80,78,353,C,
第一个是由本来多少也有需要而有的声音组成的噪音，第二个是由本身[D什]没有什么意[B议]声音组成的噪音。,200005108525100281,日本,1,200005,关于用自然之声取代噪声的建议,70,70,67,75,72,342,C,
以前一个韩国的公司，LG的经理说，“我们公司已经发明了自然之声的手机铃声。,200005108523200338,韩国,2,200005,关于用自然之声取代噪声的建议,65,60,45,60,48,261,未参加,
我们的心理，大脑[B恼]找不到可以休息的地方。,200005108523200367,韩国,2,200005,关于用自然之声取代噪声的建议,65,60,50,44,37,239,未参加,
反而那些大自然声音让人快乐，生机勃勃。,200005108520200694,蒙古国,2,200005,关于用自然之声取代噪声的建议,75,70,64,57,63,318,C,
人类[F類]是{CD一}群居的动[F動]物，每个[F個]人自小到大，从[F從]生到{CC自}死，总[F總]是无[F無]法脱离[F離]社会，独[F獨]自放逐在深山野岭[F嶺]，也因此，生活在{CC1环[F環]境}周[F週]遭的朋友在生活中扮演了一极[F極]为[F爲]重要之角色。,199711802501100022,中国,1,199711,我选择朋友的标准,90,85,74,83,82,411,A,
可是我认为不论是城市还是乡村，自己住得来的地方是最好住的。,199705104525200002,日本,2,199705,我的城市/乡村生活,60,80,58,60,75,320,C,
只是看表面的东西，很{CC好}不容易能达到世界上潜在的又美丽又感人的许多事情。,199705104525200085,日本,2,199705,我的城市/乡村生活,70,75,77,63,63,337,C,
我在汉城的一个小区出生、[BC，]长大的。,199705104525200119,日本,2,199705,我的城市/乡村生活,70,50,30,54,54,241,未参加,
我们住在城市的人每天都过着极[F極]为[F爲]紧張而繁忙的生活。,199705529529251023,泰国,2,199705,我的城市/乡村生活,75,80,46,63,37,292,未参加,
城市里的生活比乡村的生活，要紧张得多，在乡村，一早起来，郊外的景色好，空气很好，没有工厂，没有污水，没有污气，但是，现[F現]在世界各方面，关于科学，电脑什么都进[F進]步得多了，天所太热了，就装置有空调，能使室内凉爽，太冷了，也可以调节内暖乡村与城市的生活，各有千秋，在城市生活，工钱多，现[F現]代化，出外有公共气車，富豪的也有轿车[F車]，各方面都方便，乡村人也可以自乐为乐[F樂]，反正，适应什么环境，跟每个人的生活习惯[B贯[F貫]]。,199705529529153008,泰国,1,199705,我的城市/乡村生活,65,70,17,24,49,211,未参加,
他们[F們]的这[F這]一生就废[F廢]了。,199810801634150023,英国,1,199810,如何面对挫折,90,80,78,78,59,380,B,
而这[F這]种[F種]挫折，除了家人的关[F關]怀[F懷]，朋友的谅解{CC開解}之外，也要个[F個]人的心理成长[F長]经[F經]验[F驗]才[F纔]可把挫折一一解决{CJZR}。,199810801634250020,英国,2,199810,如何面对挫折,70,80,51,71,75,337,C,
但是老毛病还伴随着我，那就是写汉字。,199804123529200042,泰国,2,199804,学习汉语的苦与乐,80,85,72,76,86,393,B,
在韩国学习中国历史时，那个内容比在中国书店世界找到的内容很短{CJbi}。,199804123523100188,韩国,1,199804,学习汉语的苦与乐,70,60,36,57,62,270,未参加,
每天每天{CJcd}我很努力学习发音和声调，可是越学越难，原因是我们韩国语和汉语的语法和语序{CC语顺}不一样，还有从{CC在}韩国语上看，没有声调，没有ch，sh，zh的发音，所以跟中国人一起对话的时候中国人常常听不明白。,199804123523200182,韩国,2,199804,学习汉语的苦与乐,65,70,60,62,34,277,未参加,
我们上课的时候一共有三位老师，一位是女的老师。,199804123523100245,韩国,1,199804,学习汉语的苦与乐,75,70,54,49,52,289,未参加,
这样更容易得到较好的成就，我因此{CC2之所以}很重视和中国人的交流，但是我在北京留学的这段时间里跟中国人{CJX}能接触的机会不太多，所以还是不太了解中国和中国人。,199804123523200271,韩国,2,199804,学习汉语的苦与乐,65,65,57,59,48,278,未参加,
另一方面的听力，是{CC1再说}我们学习写、读、听、说中最容易、[BC，]最快学到的，而且没有规定的学法。,199804124523200393,韩国,2,199804,学习汉语的苦与乐,75,80,57,30,54,287,未参加,
以前有困难时不敢说、[BC，]不爱说[BQ，]可知道父母的心以后[BQ，]大的小的都跟父母{CJX}一起说、[BC，]商量等。,199904123523200030,韩国,2,199904,如何面对挫折,65,65,59,62,54,289,C,
不要一遇到它就唉声叹气，怨天尤人，从而变得一蹶不振，{CD从}这个情况{CJ+zhuy他}可以说明这个人很怕遇到困难或挫折，一遇到他就不知{CC不会}怎么样解决，想不出{CD的}办法就更害怕了。,199904123542200028,越南,2,199904,如何面对挫折,70,70,29,29,61,247,未参加,
当然考虑克服困难的办法时，可以听听别人的想法，但是决定{CC2进}其办法{CQ的}还是自己。,199904123525200117,日本,2,199904,如何面对挫折,75,75,70,80,69,359,B,
在遇到挫折过程当中，不少人一无所得，但最重要的这些人能否从失败中吸取教训呢{CJs}。,199904123530100247,土耳其,1,199904,如何面对挫折,65,65,53,29,54,250,未参加,
困难和挫折，其实能够从失[B矢]败中吸取教训，而且让人们强一些，经验越来{CC过}越多的话可以成为生活的强者。,199904124523200291,韩国,2,199904,如何面对挫折,65,60,37,50,43,238,未参加,
我们生活当中有些困难或挫折是不可回避的。{CP我个人认为这种困难和挫折{CD是},199904124523200332,韩国,2,199904,如何面对挫折,65,55,67,65,67,301,C,
这个时候有一个机会到北京学习汉语。{CP虽然考不上大学，也没有好事，但没有挫折而{CQ从},199904124523200365,韩国,2,199904,如何面对挫折,70,65,56,60,48,285,C,
这是靠着上帝克服时，更多的掌握{CJ?}。,199904124523200377,韩国,2,199904,如何面对挫折,65,70,45,55,54,275,未参加,
