错句,作文编码,国籍,性别,考试时间,作文题目,口试分数,作文分数,听力分数,阅读分数,综合分数,总分,证书
男生与男生多来往会懂得什么是绅士风度，而女生与女生多来往，多多少少也会比较温柔，体贴。,200504534533250118,新加坡,2,200504,我对男女分班的看法,70,80,81,69,82,372,B,
在现代的社会里，思想开通根[B跟]本就不需[B须]要男女分班了。,200504534533250122,新加坡,2,200504,我对男女分班的看法,70,70,70,76,55,329,C,
女生和男生的性格{CC格性}都不同。,200504534533250163,新加坡,2,200504,我对男女分班的看法,75,70,65,65,64,328,C,
家长也是怕{CC想}孩子因一时冲动而做出错误的选择。,200504534533250164,新加坡,2,200504,我对男女分班的看法,75,85,70,58,70,351,B,
父母是每个孩子的第一任老师。,200505109540100476,印度尼西亚,1,200505,父母是孩子的第一任老师,65,50,46,40,54,236,未参加,
如果孩子[L]没一些基本的条件，如足够的食品、[BC，]衣服[BD、]等，不管他以后有多少个出色的老师，他的前途还会受到一定的限制。,200505109922101361,美国,1,200505,父母是孩子的第一任老师,80,65,60,51,64,308,C,
孩子的好坏不仅仅是因为父母是怎么样的人，也是因为父母的教育方式是否正确，因为父母的教育方式对孩子们的成长也很重要。,200505109540201395,印度尼西亚,2,200505,父母是孩子的第一任老师,65,85,64,37,64,305,未参加,
孩子肯定看父母[C]的行为{CC姿态}。,200505109525101708,日本,1,200505,父母是孩子的第一任老师,45,55,50,53,47,228,未参加,
爸爸安排我家{CJX}经常去旅游，学习课外的知识。,200505109922102031,美国,1,200505,父母是孩子的第一任老师,80,60,52,39,67,285,未参加,
父母是孩子的第一任老师父母是孩子的第一任老师，也是孩子在成长过程中最重要的老师。,200505109525102401,日本,1,200505,父母是孩子的第一任老师,95,90,78,80,97,439,A,
他们{CC它们}的[C]言语、作风、行为都是榜样的[C]存在。,200505109525102433,日本,1,200505,父母是孩子的第一任老师,60,60,41,49,58,250,未参加,
即使在工作或人际关系方面有问题和不满{CJ-zxy的时候}，也不要在孩子的面前抱怨。,200505109525202421,日本,2,200505,父母是孩子的第一任老师,60,80,50,77,78,332,未参加,
丈夫与[C]孩子交流的时候用日语说话。,200505109525102483,日本,1,200505,父母是孩子的第一任老师,60,65,46,45,43,242,未参加,
因为我也是受{CJ+buy到}父母的影响而长大的。,200505109525202587,日本,2,200505,父母是孩子的第一任老师,65,60,63,49,69,289,未参加,
以后我也会当妈妈。,200505109512202592,菲律宾,2,200505,父母是孩子的第一任老师,90,90,71,55,67,371,B,
有的人[BD、]偏偏就是做不好父母。,200505204520200391,蒙古国,2,200505,父母是孩子的第一任老师,90,75,65,59,52,335,C,
就如前几年在全国被通缉姓马的杀人犯的父母所说的那样，他们怎么{CC如何}也不能明白自己的儿子怎么会成为一个罪犯。,200505205626200296,瑞典,2,200505,父母是孩子的第一任老师,95,85,84,81,93,436,A,
中国人有一句话“父母是孩子的第一任老师”。,200505212542100030,越南,1,200505,父母是孩子的第一任老师,80,55,54,31,58,264,未参加,
有的社会学专家、心理专家认为因孩子以父母的日常生活行为为教材的缘故，父母用自己的动作表示美德比让孩子读孔子的《论语》等对培养孩子的道德有更好{CC1优秀}的效果。,200505224922100102,美国,1,200505,父母是孩子的第一任老师,65,70,50,53,45,269,未参加,
对于[F於]每个人来说[BQ，]随[F隨]着年龄[F齡]的增长[F長][BQ，]都必须[B需]要接触[F觸]异[F異]性。[BC，],200505522522150039,缅甸,1,200505,最理想的结交方式,70,75,73,69,84,360,B,
总之，我认为父母的确是孩子的第一任老师{CC父母}，因此父母一定要给孩子{CJ-sy树立}好的榜样。,200505201540200302,印度尼西亚,2,200505,父母是孩子的第一任老师,60,80,71,63,69,330,C,
孩子是我们的未来。,200505209922100152,美国,1,200505,父母是孩子的第一任老师,60,55,54,65,67,282,未参加,
家庭里捧了小皇帝、[BC，]小公主，摘星星不给摘月亮，抱在手里怕摔了，[BC。]含[B唅]在嘴里怕化了。,200505502540200050,印度尼西亚,2,200505,父母是孩子的第一任老师,80,70,44,59,56,299,未参加,
我认为父母确实{CJ-sy是}孩子的第一任老师。,200505332540200024,印度尼西亚,2,200505,父母是孩子的第一任老师,75,65,67,67,83,344,C,
从父母的生活方式、行为、解决问题的态度和方法{CJ-zxy中}[BQ，]孩子[L]也可以学会不少东西。,200505024634100375,英国,1,200505,父母是孩子的第一任老师,75,85,58,43,54,308,C,
在子女的幼儿阶段父母就开始担起了一个“老师”的责任。,200509801801250002,澳大利亚,2,200509,父母是孩子的第一任老师,85,70,69,85,94,394,C,
对于[F於]各历史名胜古迹[C]也{CD有}研究过。,200509534533150026,新加坡,1,200509,一封求职信,55,75,52,44,59,270,未参加,
我廿五岁时毕业于[F於]美国加州大学语[F語]言系后，便开始在小型的旅行社上班。[BC，],200509534922250070,美国,2,200509,一封求职信,65,70,70,62,82,335,C,
我对导游一职深感兴趣，也受过这方面的训练，在假期中也曾兼职，可说有些少经验[C]。,200509534533250078,新加坡,2,200509,一封求职信,60,85,63,60,68,325,C,
此致[C]敬礼！,200509534533150080,新加坡,1,200509,一封求职信,75,85,66,44,68,331,C,
本人名为××，生于1975年，本人从小一直在新加坡求学，精通中文与英文，还会一点法语。,200509534533150105,新加坡,1,200509,一封求职信,85,80,86,75,95,414,B,
本人相貌端正，常常以[BD‘]笑[BD’]来接待从四面八方到新加坡来旅游的游客。,200509534533250130,新加坡,2,200509,一封求职信,60,70,77,69,82,343,C,
很幸运的{CQ是}，现在的{CC3现任}公司挑选我去{CQ了}英国深造及交流。,200509534533250136,新加坡,2,200509,一封求职信,75,70,88,66,84,372,B,
我也考获全球英语水平考试第十一级。,200509534519250148,马来西亚,2,200509,一封求职信,85,70,75,77,88,386,B,
毕业后，便在“佳佳旅游公司”里担任一名全职的广告设计师。,200509534533250146,新加坡,2,200509,一封求职信,70,65,70,55,77,323,C,
我身高1.7米，相貌端正，表达能力也强。,200509534533250194,新加坡,2,200509,一封求职信,65,70,73,71,84,349,C,
中国有句古话叫“爱乌及屋”[BQ，]就是说你喜欢那只鸟连鸟住的巢都一块喜欢上了。,200510111801200201,澳大利亚,2,200510,我看流行歌曲,95,90,79,83,100,446,A,
我们通过那些歌曲也可以了解{CC认识}一些别人的想法。,200510111523200415,韩国,2,200510,我看流行歌曲,70,75,65,71,79,349,C,
程度上有问题，追求明[B名]星的[C]程度太过分的话，会放弃学习，放弃该做的事。[BC，],200510111523100419,韩国,1,200510,我看流行歌曲,60,65,56,42,62,268,未参加,
几年前，某歌手的演唱会中死了{CD有}一个歌迷，很多歌迷要看那个歌手而{CC中}造成{CC发生}的。,200510111523200426,韩国,2,200510,我看流行歌曲,55,60,30,24,37,187,未参加,
学生学习当中听音乐就分散{CC散满[C]}注意力，而且学生们经常模[B摸[C]]仿[B方]歌手穿的样子，就{CJX}将[B桨]来学生[B习]们失去了创造[B忆]力等等.流行歌曲中有不好的歌曲，就是歌手说性感[BQ，]可[C]是人们认为有点色，所以这样也对学生不好[BQ。],200510111523100794,韩国,1,200510,我看流行歌曲,55,50,46,34,55,219,未参加,
那首歌的题目就是《[BC“]勇气》[BC”][BD。]原来我喜欢的歌曲是节奏不那么快的，歌的内容是关于爱情方面的。,200510111523200845,韩国,2,200510,我看流行歌曲,70,65,65,52,64,302,C,
很多人，一边听流行歌曲，[BC、]一边使自已轻松、减[C]轻负担。,200510111523200848,韩国,2,200510,我看流行歌曲,70,70,63,32,52,275,未参加,
所以……不知不觉过了很长时间。,200510111523200864,韩国,2,200510,我看流行歌曲,55,55,25,50,35,200,未参加,
比如说{CD就}几个朋友在一块儿聚会，十有八九的情况都要有音乐，那么个人都有个人喜欢的音乐种类或歌曲，我们就通常放一些比较流行的、大家都赞赏{CC赞同}的歌曲来听。,200510111922200867,美国,2,200510,我看流行歌曲,85,65,67,61,84,351,C,
我每次参加他们的演唱会。,200510111523201072,韩国,2,200510,我看流行歌曲,55,75,56,61,69,301,未参加,
但是有的时候看她，她爱他们的程度太过分了。P},200510111523201100,韩国,2,200510,我看流行歌曲,65,70,60,50,50,281,C,
第三是电视台的错误。,200510111523101127,韩国,1,200510,我看流行歌曲,70,65,70,54,55,300,C,
本来我的{CC在}韩国生活当中，天天和音乐在一起工作、学习、开车等。,200510111523201856,韩国,2,200510,我看流行歌曲,80,60,44,38,59,268,未参加,
但是听流行歌曲的时候，他们的心情舒[C]服起来。,200510111523201858,韩国,2,200510,我看流行歌曲,50,65,53,24,52,225,未参加,
听音乐的时候，很安静[C]，所以一点儿压力[B历]也没有。,200510111523201858,韩国,2,200510,我看流行歌曲,50,65,53,24,52,225,未参加,
如果没有这样的能力，那么你没有享受这样的权力。,200510111523101863,韩国,1,200510,我看流行歌曲,60,60,60,52,62,276,未参加,
如果父母本身的行为[F為]已经[F經]是很差{CQ了}，那他们[F們]的孩子也很有可能变[F變]坏[F壞]{CD了}。,200510919919150015,加拿大,1,200510,父母是孩子的第一任老师,70,75,47,60,66,307,C,
我小的时候也非常喜欢流行歌曲[BQ，]因为到处都可以听到，也可以说年青人对看电视听音乐这些方面很有感兴趣，[BC。]所以喜欢听流行音乐。,200510261635200021,俄罗斯,2,200510,我看流行歌曲,65,65,44,34,45,237,未参加,
一来，听了之后我觉[F覺]得心情反而更糟[B遭]。,200510205919100142,加拿大,1,200510,我看流行歌曲,95,60,67,65,91,369,C,
貴国[F國]的三字经[F經]说[F說]的最巧：[BQ“]养[F養]不教，父之过[F過]、教不严[F嚴]，师[F師]之惰[B隨]！[BQ],200510950922150001,美国,1,200510,父母是孩子的第一任老师,85,50,53,54,38,266,未参加,
父母对孩子的影响是非常重要的。[BC，],200510956922130002,美国,1,200510,父母是孩子的第一任老师,80,85,74,52,71,356,C,
作曲时小心使用歌词、内容，[BC、]考虑情绪后才会成为好的流行歌曲。,200510302523200006,韩国,2,200510,我看流行歌曲,60,65,53,32,59,252,未参加,
这个问题很简单，就是非常流行的歌曲。,200510302523100029,韩国,1,200510,我看流行歌曲,40,60,65,44,77,263,未参加,
我觉得这是不对的现象。{CP现代社会上有很多明星，所以很多人喜欢他们。P},200510302523100041,韩国,1,200510,我看流行歌曲,65,60,51,59,62,280,未参加,
我喜欢的歌曲是《月亮代[B达]表我的心》。,200510302523200062,韩国,2,200510,我看流行歌曲,70,50,44,32,35,214,未参加,
流行歌也是一样，它只是一个没有感动的歌曲而一过短暂的时间就被人们立刻忘掉的一种歌曲{CJZR}。,200510302523200080,韩国,2,200510,我看流行歌曲,70,90,60,59,79,351,C,
相反流行歌曲比较简单，易于{CC善于}人们唱。,200510302523100086,韩国,1,200510,我看流行歌曲,80,85,83,65,84,391,B,
流行歌曲总是有非常多的听众。,200510302523100097,韩国,1,200510,我看流行歌曲,70,65,42,44,69,276,未参加,
总之，我希望我们用正确的办法来发展[C]流行歌曲。,200510302523200125,韩国,2,200510,我看流行歌曲,70,75,53,32,40,259,未参加,
歌手用讽刺的歌词来描述社会，比如，韩国著名的歌手师太之编唱的《我是超人》讽刺了有权力，有金钱的人的行为，还有美国歌手goldlinger也用讽刺的歌曲描述了社会。,200510302523100128,韩国,1,200510,我看流行歌曲,85,70,74,61,79,360,C,
还有，流行歌是每次都{CJ-sy有}新的感觉。,200510302523200198,韩国,2,200510,我看流行歌曲,75,65,35,28,32,222,未参加,
我个[B各]人呢并不建{CQ议}你抛弃流行音乐。,200510206516100115,老挝,1,200510,我看流行歌曲,75,80,63,28,64,301,未参加,
我{CD自己}从小就开始喜欢听流行歌曲。,200510627627150001,瑞士,1,200510,我看流行歌曲,75,55,74,63,79,331,C,
大众基[L]本使用流行歌曲当一个普通的发财工具，流行歌曲目前垄断了全世界的音乐市场。,200510206610100153,法国,1,200510,我看流行歌曲,85,50,49,38,59,267,未参加,
但现代音乐是用现代{CC科学}乐器{CJ-wy演奏}的。,200510529529151026,泰国,1,200510,我看流行歌曲,65,70,70,52,79,322,C,
这类歌曲有时代的命脉，有时代的豪[C]迈，它是歌曲界的姣姣者，听或唱时代歌{CJ+sy是}意味着我们正与时代同步，我指的是有价值有代表性的时代歌曲。[BC.],200510529529151036,泰国,1,200510,我看流行歌曲,55,75,70,56,94,335,C,
其实我自己很喜欢听流行歌曲，可是不是全部流行歌曲我都喜欢听。,200510540540200005,印度尼西亚,2,200510,我看流行歌曲,65,80,49,48,62,292,未参加,
尤[B由]其是老人家。,200510540540200053,印度尼西亚,2,200510,我看流行歌曲,70,65,70,69,64,324,C,
我父亲[F親]是希腊人，母亲[F親]是中国北京人。,200505634631200124,希腊,2,200505,最理想的结交方式,0,90,59,53,77,279,未参加,
孩子是需要父母的悉[Pxi]心照顾，有时的开导{CC开道}关心{CJsd}，在适当{CC适[B试]合}的时候，该罚[Pfa]也得罚[Pfa]。,200509602801250014,澳大利亚,2,200509,父母是孩子的第一任老师,65,75,85,58,77,347,C,
妈妈的身体状况最近如何？,200104124542200029,越南,2,200104,一封写给父母的信,85,85,82,70,88,405,A,
因为我最近很想念父母。,200104124525200056,日本,2,200104,一封写给父母的信,70,65,47,47,45,260,未参加,
你们想来中国吗？[BC，],200104124542200090,越南,2,200104,一封写给父母的信,60,65,36,25,38,207,未参加,
下个星期，我就搬到学校更便宜的宿舍{CQ去}。,200104124540200184,印度尼西亚,2,200104,一封写给父母的信,70,85,52,39,67,305,未参加,
亲爱的爸爸、[BC，]妈妈！,200104124542100194,越南,1,200104,一封写给父母的信,80,85,63,68,76,366,B,
我很长时间没给你们写信了{CC吧}。,200104124540200212,印度尼西亚,2,200104,一封写给父母的信,70,65,27,23,38,209,未参加,
我有{CC想}很多事[BD，]想跟你们说，但这次就写到这儿。,200104124525200240,日本,2,200104,一封写给父母的信,70,65,68,63,76,328,C,
亲爱的父母[BQ：]你们好吗，来北京一个月{CQ了}[BQ，]这是我第一次写信给你们。,200104124540200244,印度尼西亚,2,200104,一封写给父母的信,65,85,52,54,72,318,C,
我还{CJ-zy要}说：[BC，]“感谢老师”[BQ。],200104124523200334,韩国,2,200104,一封写给父母的信,75,60,47,32,42,242,未参加,
”听到这样的话，我高兴极了。{CP你们的教育好，女朋友也是一个好人。P},200104124525100424,日本,1,200104,一封写给父母的信,65,65,36,39,42,231,未参加,
祖父、祖母还好吗？,200104124529200441,泰国,2,200104,一封写给父母的信,85,90,68,82,85,406,B,
虽然这些衣服是{CJ-dy我们班的}共同作品，但在制[F製]作设计中，我是{CC做}{CD了}班长，[BC。]我做{CC下}了设计好坏的最后决定。,199200204525100041,日本,1,199200,一封求职信,,,0,0,0,0,未参加,
当服装模特的时候，在中国{CQ的}全国服装模特大会上我获得了第一名，我{CD的}身高1米82，也可以当服装模特。,199200204525100048,日本,1,199200,一封求职信,,,0,0,0,0,未参加,
本公司服装模特包括男人，{CD有}两名，身高1.80米以上，相貌端正；[BC，]女人也要{CC有}两名，{CD她们}身高1.70米以上，相貌端正。,199200204712200011,刚果,2,199200,一封求职信,,,0,0,0,0,未参加,
长车司机没送{CJ+zy到}他{CJ-buy到医院}{CJ-zy就}逃走了。,199604124523200045,韩国,2,199604,如何看待“安乐死”,70,60,66,66,47,293,C,
所[C]以，自己的家属{CC家族}成[C]了植物人，这[C]事情意[C]味着全家的破产。,199604123525100313,日本,1,199604,如何看待“安乐死”,60,65,29,52,31,220,未参加,
丈夫杀死妻子之后，[BC.]装作帮助她的自杀。,199604123525100164,日本,1,199604,如何看待“安乐死”,60,60,42,54,47,245,未参加,
比如说，[BC。]有一{CQ个}家庭有了一个残疾的孩子。,199604123523200293,韩国,2,199604,如何看待“安乐死”,50,60,48,57,49,243,未参加,
我看了这篇[B编]“安乐死”的文章。,199604124525200073,日本,2,199604,如何看待“安乐死”,50,60,32,42,49,212,未参加,
读完这一段短文以后[BQ，]我的心[C]里[B理]感[C]到非常不平静。,199604124636200101,乌克兰,2,199604,如何看待“安乐死”,75,60,45,49,42,256,未参加,
倘若无法达成共识，则双方互相让一步，不就海阔天空了吗？,199610512512250001,菲律宾,2,199610,如何解决“代沟”问题,95,95,94,83,92,458,A,
“代沟[F溝]”问[F問]题[F題]是当[F當]今社会[F會]避[L]免不了的，所以代与代之间[F間]必须[F須]创造机会[F會]好好地沟[F溝]通，使代与代之间[F間]的“代沟[F溝]”缩减{CC减少}到最小。,199610512501150006,中国,1,199610,如何解决“代沟”问题,75,85,83,69,82,387,B,
也许[F許]长[F長]辈们[F們]的工作是非常的忙碌，回到家里已经[F經]非常累了，咱们[F們]这[F這]些晚辈就要主动地跟父母们[F們]多多沟通，讲[F講]些笑话[F話]逗他们[F們]笑，好减[F減]少他们[F們]在工作方面的压[F壓]力，还可增加两代间[F間]的密切关[F關]系[F係]。,199610512501150012,中国,1,199610,如何解决“代沟”问题,80,80,60,57,53,322,C,
不然的话[F話]，双方{CC两[F兩]方}坚[F堅]持各自的原则[F則]，情况[F況]非但{CJ-zy不}会[F會]改善，反而会[F會]恶[F惡]化。,199610512512150014,菲律宾,1,199610,如何解决“代沟”问题,75,90,89,71,74,393,B,
总而言之{CC终而言之}，父母与[F與]子女{CD的}谈[F談]话[F話]、游[F遊]玩，[BC；]父母也想子女的问[F問]题[F題]，子女也想父母的问[F問]题[F題]，那就会使社会变成良好的社会。[BC，],199610550523190027,韩国,1,199610,如何解决“代沟”问题,60,70,54,44,41,254,未参加,
当然这样的代沟，很自然的{CJsd}。{CP不管什么时代发生这种代沟，很平常的事[C]情。P},199610550523190038,韩国,1,199610,如何解决“代沟”问题,65,50,75,34,61,266,未参加,
然后我们互相谈话就解决了，{CQ又}买了一个电视机。,199610550523290061,韩国,2,199610,如何解决“代沟”问题,55,70,62,50,55,276,未参加,
因为[F為]现[F現]代社会[F會]已经[F經]个[F個]体化了，而且每个[F個]人都很忙，所以家人之间[F間]、[BC，]朋友之间[F間]、[BC，]同事之间[F間]都{CC1一切}没有谈[F談]话[F話]的时[F時]间[F間]。,199610550523290074,韩国,2,199610,如何解决“代沟”问题,65,60,54,53,45,260,未参加,
二〕生活的{CC和}态[F態]度{CD上}也是引起两[F兩]代不满[F滿]而冲[F衝]突{CJ-zxy的原因}。[BC，],199611543501100505,中国,1,199611,如何解决“代沟”问题,90,85,75,69,78,394,B,
在任何国家，[BC、]包括我出生的日本，[BC、]都有代沟问题，[BC。]而且代沟引起的家庭内部{CC2内}的问题、学校里的事件都从来没有减[F減]少过。,199611543525100511,日本,1,199611,如何解决“代沟”问题,85,75,60,73,76,361,B,
这[F這]些人是想群体{CC2群}中会有某某人会去做事，自己坐享其成便是了。,199603533533200013,新加坡,2,199603,由“三个和尚没水喝”想到的……,85,90,83,58,82,394,B,
{CD由}“三个和尚没水喝”这个故事，使我想到人与人之间的相处之道。,199603533533200017,新加坡,2,199603,由“三个和尚没水喝”想到的……,90,90,74,56,72,380,B,
挑了水自己喝，不给别人喝，不就得了吗？,199603533533200028,新加坡,2,199603,由“三个和尚没水喝”想到的……,90,90,49,70,99,396,C,
打个比方说，公司没有请[F請]煮开水的阿婶，谁要喝水，就得自己用电壶[F壺]煮水，电壶[F壺]公司供应，可煮水的可要大家合作才行，可偏偏出了许[F許]多人煮好开水之后，有许[F許]多人会[F會]排队，泡茶的泡茶，冲咖啡的冲咖啡，喝开水的倒了就远离{CC离开}而去，最后剩下一个空壶[F壺]。,199603533533200033,新加坡,2,199603,由“三个和尚没水喝”想到的……,85,90,77,60,80,388,B,
一切都很平常，也没问题。,199603533533200048,新加坡,2,199603,由“三个和尚没水喝”想到的……,90,70,55,58,65,331,C,
他们就坐在庙堂上念[B唸]经。,199603533533200048,新加坡,2,199603,由“三个和尚没水喝”想到的……,90,70,55,58,65,331,C,
邻居们都跑来帮忙。,199603533533200056,新加坡,2,199603,由“三个和尚没水喝”想到的……,90,80,71,72,94,402,B,
有了伙伴的生活，日子也比较[F較]容易打发了。,199603533533100059,新加坡,1,199603,由“三个和尚没水喝”想到的……,95,80,71,72,94,408,B,
三个和尚没水喝，时间一久，各自都感到口渴难忍。,199603533533100065,新加坡,1,199603,由“三个和尚没水喝”想到的……,90,65,69,72,91,378,C,
人的性格，特别弱{CC柔}的地方很难改一改{CJcd}。,199605104525200019,日本,2,199605,由“三个和尚没水喝”想到的……,65,60,63,56,44,271,未参加,
最可怜的是，一个和尚每天拿来的水，大家都要，和尚也只好给大家。[BC，],199605104525200073,日本,2,199605,由“三个和尚没水喝”想到的……,60,60,49,38,35,224,未参加,
既勤劳又{CJ-sy有}独立性。,199605104523200121,韩国,2,199605,由“三个和尚没水喝”想到的……,60,60,24,56,44,226,未参加,
从古至今{CC从早到晚}[BQ，]我们人类{CJ-zy都}是社会动物，应该协调。,199605104523100129,韩国,1,199605,由“三个和尚没水喝”想到的……,70,70,41,67,54,290,未参加,
第一个和尚说：[BC，]“我想帮[C]他的生活{CJjy}”。,199605104525100135,日本,1,199605,由“三个和尚没水喝”想到的……,55,55,49,54,37,230,未参加,
他{CJ+zy本来}{CQ算命}很便宜，说得很{CC太}随便，可是人们愚昧[BQ，]很相信他。,199605104525200155,日本,2,199605,由“三个和尚没水喝”想到的……,50,70,52,67,65,287,未参加,
他[C]们生活的主要任务应该可以三个人互相合作、互相解决了吧！,199605104540200201,印度尼西亚,2,199605,由“三个和尚没水喝”想到的……,70,60,69,42,46,272,未参加,
第一个和尚认为这是他自己找到的，他有权利留在这。[BC，],199605104525200230,日本,2,199605,由“三个和尚没水喝”想到的……,60,55,46,70,75,287,未参加,
还是你们俩去挑水来{CQ吧}。,199605104523100276,韩国,1,199605,由“三个和尚没水喝”想到的……,60,55,30,54,65,245,未参加,
我觉得{CC2说}不对。,199605104525200290,日本,2,199605,由“三个和尚没水喝”想到的……,60,70,58,65,61,299,C,
过了一会儿{CD以后}我听到了姐姐的{CJX}{CJ-zy很}大声音。,199605104525200321,日本,2,199605,由“三个和尚没水喝”想到的……,55,65,38,58,56,254,未参加,
我想人们应该选后者的意思。,199605104525200323,日本,2,199605,由“三个和尚没水喝”想到的……,65,80,66,67,70,336,C,
这里是很高的山。,199605550523290008,韩国,2,199605,由“三个和尚没水喝”想到的……,70,65,55,65,68,309,C,
但是[C]有些佛寺[C]是[C]建在[C]高山[B上]森林中，一切必[C]须[C]品[C]就不能跟城里的{CD一起}并[F並]论；如果是[C]建在[C]穷乡僻壤{CC疆[C]远[F遠]}的村里，住的人家又很稀[B希]落，什么都不方便；可是[C]，[BC；]佛教中的教导[C]，是[C]要[C]当和尚的刊[C]“苦行[B刊]僧[B曾]”。,199605529529250146,泰国,2,199605,由“三个和尚没水喝”想到的……,65,80,35,33,51,252,未参加,
这时候，佛寺如果没有学徒给和尚挑水去，和尚一定要[C]缺水，因此信徒们任岁起布[F佈]施[C]，每年在[C]一定的时间中有布[F佈]施礼节，有的就[C]带一些[C]和尚必须[F須]品去赠[F贈]给佛寺，有出[C]钱[F錢[C]]的，出[C]力的，应[C]有尽有。,199605529529250146,泰国,2,199605,由“三个和尚没水喝”想到的……,65,80,35,33,51,252,未参加,
第一个和尚没觉得很[C]累。,199605529529250166,泰国,2,199605,由“三个和尚没水喝”想到的……,65,65,19,38,27,198,未参加,
我的童年并{CJX}过得不是很好。,200110540540250137,印度尼西亚,2,200110,我的童年,70,80,49,37,51,277,未参加,
一九六六年毕业后，即在本地一间百货公司任售货员[L]。,199312533533100024,新加坡,1,199312,一封求职信,90,80,78,72,82,397,B,
我拥有各等级有效的驾驶执照[C]。,199312533533200060,新加坡,2,199312,一封求职信,8,8,50,70,78,198,未参加,
我在报上看了贵公司的招聘启事后，对导游一职深感兴趣，有意应聘。,199312533533100082,新加坡,1,199312,一封求职信,90,75,85,70,75,389,B,
