错句,作文编码,国籍,性别,考试时间,作文题目,口试分数,作文分数,听力分数,阅读分数,综合分数,总分,证书
此外，吸入二手烟的人，健康状况比吸烟的人更为恶劣！,200405680519150050,马来西亚,1,200405,吸烟对个人健康和公众利益的影响,70,95,74,72,89,393,B,
但可悲的是，理想与现实往往是背道而驰——人民漠视了一切。,200405680519150051,马来西亚,1,200405,吸烟对个人健康和公众利益的影响,70,95,66,79,87,390,C,
但是，如果这些中学将学生男女分班，这其实对学生的成长和心理状况{CC况态}是不健康的。,200504534533250062,新加坡,2,200504,我对男女分班的看法,65,75,78,84,75,364,B,
我发现{CJ+buy到}一些同学开始有同性恋的迹象。,200504534533150076,新加坡,1,200504,我对男女分班的看法,75,90,84,86,82,411,A,
青春期对异[F異]性的好感，尤其男生的攻击性行为，正随[F隨]着年龄的增长[F長]而日益加剧{CC扩张}，女生也随着由{CQ对}父亲[F親]的崇拜而转向同类型的同龄男生，男女同班的好处就是能让[C]他们{CD能}在成长[F長]中，慢慢地{CC的}学习男女相处之道，不至于{CD可}到了成年后出现空白，以致[B至]容易对异[F異]性产生误解。[BC.],200504534533150080,新加坡,1,200504,我对男女分班的看法,70,80,78,67,84,369,B,
但是男女生早恋问题，在校园中可说是司空见惯，见怪不怪。,200504534533250116,新加坡,2,200504,我对男女分班的看法,95,75,76,78,86,405,B,
不仅只有表面上的这些，有些学生更会因为与同性相处的时[B事]间久了，而产生一种对另一性别的害怕心理。[BC.],200504534533250170,新加坡,2,200504,我对男女分班的看法,80,80,65,80,82,379,B,
那是因为他小时候{CC3小时}在学校都是和自己同性的朋友合作[BQ，]所以与异性合作可能会有些不习惯。,200504534533150178,新加坡,1,200504,我对男女分班的看法,70,75,67,69,66,336,C,
一个孩子一出生就开始受到父母亲的影响{CC印象}。,200505109634200017,英国,2,200505,父母是孩子的第一任老师,75,85,51,71,67,342,C,
我可以很自信地说我母亲给我的影响是很大的。,200505109525100467,日本,1,200505,父母是孩子的第一任老师,65,85,53,59,71,323,C,
果然，女儿的声音以及语调象妈妈的是一个非常普遍的现象。,200505109610200730,法国,2,200505,父母是孩子的第一任老师,95,65,66,56,79,353,C,
他们应该树立{CJX}{CQ给}孩子{CD的}好的榜样。,200505109525200865,日本,2,200505,父母是孩子的第一任老师,65,85,66,65,87,358,C,
孩子们一直看父母的一言一行{CC一生一为[F為]}。,200505109525201003,日本,2,200505,父母是孩子的第一任老师,60,65,39,43,62,252,未参加,
所[C]以我同意“父母是孩子的第一任老师[F師]”这个说法{CC问题}。,200505109525201090,日本,2,200505,父母是孩子的第一任老师,55,55,50,37,36,213,未参加,
我小时候经常看到爸爸为穷人捐一些钱、一些衣服。,200505109529201097,泰国,2,200505,父母是孩子的第一任老师,80,70,60,58,71,329,C,
我认为孩子出生后第一次接触的人{CJ-wy是父母}，就是说孩子的父母要慎重对待孩子。,200505109525201338,日本,2,200505,父母是孩子的第一任老师,75,70,66,58,64,322,C,
中学生时已[B巳]决[F決]定我上高中考驾驶证。,200505109525201457,日本,2,200505,父母是孩子的第一任老师,60,80,57,37,45,266,未参加,
后果放弃[F棄]孩子，{CQ所以}虐待孩子的事件日益增多。,200505109525201713,日本,2,200505,父母是孩子的第一任老师,70,65,61,77,78,337,C,
父母是孩子的老师，是孩子的模范，孩子们会仔细地观察父母的行为，孩子们虽然从父母身[C]上学会许[C]多东西，但他们也会学到父母的不好的习惯[B贯]。,200505109525201752,日本,2,200505,父母是孩子的第一任老师,50,85,76,49,67,314,未参加,
我的姐姐也有很大的个性。,200505109525101792,日本,1,200505,父母是孩子的第一任老师,65,65,52,67,74,307,C,
说实话，我很讨厌自己这种性格，虽然当然有些部分我比较满意。,200505109525101851,日本,1,200505,父母是孩子的第一任老师,70,65,37,75,76,309,未参加,
所[C]以他目前会说日语与台湾话。,200505109525201906,日本,2,200505,父母是孩子的第一任老师,55,75,41,55,52,263,未参加,
因此我[C]{CD向}现代年青人{CJX}要求仔细观察自己的行为。,200505109525102121,日本,1,200505,父母是孩子的第一任老师,85,60,71,71,80,355,C,
我回国以后要开始找工作。,200505109525202335,日本,2,200505,父母是孩子的第一任老师,70,75,66,72,73,345,C,
父母还是自己的最好的老师。,200505109525102439,日本,1,200505,父母是孩子的第一任老师,75,65,56,55,65,303,C,
英文的“母语”这个词就从这里来的。,200505109922102502,美国,1,200505,父母是孩子的第一任老师,65,45,29,21,34,173,未参加,
父母的确是孩子的第一任老师。,200505109922202601,美国,2,200505,父母是孩子的第一任老师,80,65,61,71,74,339,C,
绝[B决]大多数的动物它们只{CD能}会喂[B喟]养它们的孩子。,200505275529100108,泰国,1,200505,父母是孩子的第一任老师,75,70,63,63,67,327,C,
正因为[F為]自己辛苦得回来的所以便会[F會]懂得{CD了}“珍惜”，珍惜自己所谓[F謂]的“幸福”，而不让[F讓]它轻[F輕]易地{CC的}从[F從]手中溜走{CC溜手}。,200505522522150002,缅甸,1,200505,最理想的结交方式,90,75,75,66,77,377,B,
所以我认为应该三思！,200505522522250008,缅甸,2,200505,最理想的结交方式,70,65,45,35,66,267,未参加,
人生中重要{CQ的}也可以说婚姻的事{CJs}[BQ。]有些还没结婚的王老五、[BC，]老处女说世界上不娶[B取]老婆，不出嫁[B家][BQ，]一个人的幸福是最好的。[BC.],200505522522250022,缅甸,2,200505,最理想的结交方式,50,60,23,33,39,185,未参加,
网[F網]恋是一个新名词，也是高科技的产物，男女双方可能见[F見]过[F過]，互相认[F認]识[F識][BQ，]也可能完全不相识[F識]。[BC，],200505522522110015,缅甸,1,200505,最理想的结交方式,70,80,77,71,93,381,B,
男女之间相识的方式有很多，有的是{CQ通过}亲戚朋友的介绍、有的是因为在共同的单位工作而相识的……[BD。]但在相识的方式[C]中[BQ，]我觉得最理想的结交方式是和从小一起长[F長]大的玩伴结交。,200505522522110017,缅甸,1,200505,最理想的结交方式,65,75,84,64,88,363,C,
此外，有很多父母常常喝酒、赌钱导致孩子也有同样的习惯。{CD从},200505209542200100,越南,2,200505,父母是孩子的第一任老师,70,90,78,71,78,380,B,
目前生活节奏更为加快，当父母的人也有的不能有足够的时间来教养孩子，就把孩子托在别人的身上，{WWJ},200505219529100021,泰国,1,200505,父母是孩子的第一任老师,75,55,54,63,76,308,未参加,
因为父母是要照顾孩子的，所以和其他的家人、亲戚相比，父母跟孩子在一起的时间更长。,200505207525200015,日本,2,200505,父母是孩子的第一任老师,55,45,52,55,76,260,未参加,
我家大姐的孩子是被[B破]我父母养大的，对孩子来说是她外公和外婆[Ppo]。,200505206547200132,哈萨克斯坦,2,200505,父母是孩子的第一任老师,80,60,56,55,50,288,未参加,
孩子会说{CQ的}第一个词汇也就是由{CC从}妈妈教的，大部分不是“妈妈”就{CJ-sy是}“爸爸”[BQ，]那也{CJ+sy是}表现了父母对孩子的成长{CC长生}有很大的影响。,200505332529200014,泰国,2,200505,父母是孩子的第一任老师,60,65,46,43,52,249,未参加,
这种学习精神深深地打动了我。,200505332540200024,印度尼西亚,2,200505,父母是孩子的第一任老师,75,65,67,67,83,344,C,
自小灌输[F輸]的观念，文化的熏陶{CC栽培}，兴[F興]趣的培养，直[B什]至做人处[F處]世的观[F觀]点[F點]和态度都是父母无[F無]言间[F間]留在心里的烙印。,200509801801250001,澳大利亚,2,200509,父母是孩子的第一任老师,70,70,74,67,72,341,C,
本人恳请{CC2诚恳地邀请}贵公司慎[B谨]重地考虑我的求职要求，相信我的热情与十足的干劲能为贵公司注入新的活力。,200509534533250024,新加坡,2,200509,一封求职信,85,80,84,73,86,401,B,
我的工作经验[C]，语[F語]言能力都适[F適]合当导游{CD这份行業}。,200509534533150060,新加坡,1,200509,一封求职信,75,75,79,64,75,358,B,
本人不仅有很好的工作经验，也与下属关系融洽。,200509534533150105,新加坡,1,200509,一封求职信,85,80,86,75,95,414,B,
学生时代也代表大学参加过国际华语大专辩论会，荣获全场最佳辨员一荣誉。,200509534533250118,新加坡,2,200509,一封求职信,75,70,88,73,88,383,B,
我持有[C]一张十一级的高等汉语水平文凭。,200509534533250130,新加坡,2,200509,一封求职信,60,70,77,69,82,343,C,
此外，我从中学时代，就爱上了欧洲的历史。,200509534533250188,新加坡,2,200509,一封求职信,0,65,77,55,91,281,未参加,
流行歌曲总是有着非常多的听众。,200510111523100784,韩国,1,200510,我看流行歌曲,55,60,35,40,42,213,未参加,
喜欢什么音乐都是自己的自由。[BC、],200510111523200800,韩国,2,200510,我看流行歌曲,80,85,70,50,82,361,C,
随着社会的发展，流行音乐也{CD是}继续发展。,200510111523100830,韩国,1,200510,我看流行歌曲,55,55,39,30,52,211,未参加,
所以过了很长时间后听也没什么问题。,200510111523200874,韩国,2,200510,我看流行歌曲,55,60,44,48,50,238,未参加,
这个也可以说，每个人都不会喜欢一个东西。,200510111523201096,韩国,2,200510,我看流行歌曲,70,50,51,42,42,238,未参加,
歌曲内容不好的话也有问题。,200510111523201245,韩国,2,200510,我看流行歌曲,60,70,63,38,59,275,未参加,
——[BC一]幸福{CD是}不是成绩排列。,200510111523101248,韩国,1,200510,我看流行歌曲,50,55,42,38,50,214,未参加,
虽然它们的歌不好，可是电视上每天播出这首歌。,200510111523201275,韩国,2,200510,我看流行歌曲,65,70,58,50,64,293,C,
但两个人都知[C]道当时流行{CQ的}歌的话容易沟通，更会亲密。,200510111523201872,韩国,2,200510,我看流行歌曲,60,60,60,48,69,279,未参加,
因此，父母一定要做一个好的榜样来培养新一代的孩子们，让他们成为祖国的栋梁，让他们为祖国迎接未来的挑战。,200510919501250006,中国,2,200510,父母是孩子的第一任老师,75,95,86,87,100,437,A,
当[F當]我们[F們]还[F還]小{CQ的}时[F時]候，我们[F們]的父母教我们[F們]一些正确[F確]的待{CC对}[F對]人态[F態]度：什[F甚]么[F麼]时[F時]候说[F說]“谢[F謝]谢[F謝]”，看到人的时[F時]候要有礼[F禮]貌地说[F說]“早安”，{CQ以及}一些基本但非常重要的东[F東]西。,200510919919150015,加拿大,1,200510,父母是孩子的第一任老师,70,75,47,60,66,307,C,
然而，流行音乐所拥有的庞大市场，也造就了它的一个优[B忧]势。,200510204533200349,新加坡,2,200510,我看流行歌曲,85,90,72,77,96,416,B,
如果说父母在平时很习惯读书[BQ，]孩子也会学做同样的事情，从而养成他或她的习惯。,200510956501230005,中国,2,200510,父母是孩子的第一任老师,90,95,68,63,91,405,C,
但是我还是认为弊大于利。,200510302523100009,韩国,1,200510,我看流行歌曲,60,60,63,44,37,246,未参加,
当然不是。,200510302523200048,韩国,2,200510,我看流行歌曲,85,70,65,56,69,336,C,
现在，不管是在大街上，还是公共汽车里，普遍可以看到一些青少年带着耳机听音乐的情景。,200510302523100067,韩国,1,200510,我看流行歌曲,80,75,72,69,100,387,B,
现在{CD有}大部分人听音乐、听流行歌曲。,200510302523100068,韩国,1,200510,我看流行歌曲,65,60,70,42,79,299,未参加,
我是喜欢听流行歌曲的人。,200510302523100090,韩国,1,200510,我看流行歌曲,60,65,67,67,72,314,C,
你们做完在你的前边的事{CJ+sy做完}之后{CQ对}歌星达到痴迷的行动[C]也能理解，但是大人们不理解青少年的这样的行动就是做[C]{CJX}没[C]完自己的[C]事，只喜欢他们。,200510302523100117,韩国,1,200510,我看流行歌曲,60,65,39,36,42,225,未参加,
我们大家一起保护古代歌曲，还有流行歌曲，我们发挥优[B扰]势{CJX}的{CJX}韩国文化。,200510302523200207,韩国,2,200510,我看流行歌曲,85,70,46,44,52,288,未参加,
在韩国很有名[L]的老师们说“[BC‘]如果你要更好[D好]学习某种{CC个}外语的话，你应该听该国{CC其国}的流行歌曲，用来{CJX}流行歌曲学习外语的话，进步非常大。,200510302523200221,韩国,2,200510,我看流行歌曲,65,65,46,46,52,258,未参加,
因为现代的年轻人都以{CC用}那{CC哪}些广告和宣传{CC传闻}比较比较{CJcd}新出现{CC出世}的歌曲。,200510302523200239,韩国,2,200510,我看流行歌曲,70,55,65,59,67,300,C,
尤[B由]其是老人家。,200510540540200053,印度尼西亚,2,200510,我看流行歌曲,70,65,70,69,64,324,C,
在什么[F麼]都不懂，刚[F剛]要学[F學]习[F習]的情况下，父母自然成为[F為]子女的第一个[F個]榜样，处[F處]处[F處]教导[F導]他们[F們]。,200509602801250007,澳大利亚,2,200509,父母是孩子的第一任老师,80,60,66,74,82,349,C,
其实你们现在很想知道我为什么搬家吧。{CD这},200104124523200032,韩国,2,200104,一封写给父母的信,65,70,60,42,54,277,未参加,
我最喜欢的季节是春天。,200104124525200058,日本,2,200104,一封写给父母的信,70,75,38,37,45,254,未参加,
我真没运气。,200104124523200075,韩国,2,200104,一封写给父母的信,75,70,63,58,47,302,C,
妈！,200104124523200075,韩国,2,200104,一封写给父母的信,75,70,63,58,47,302,C,
你们在那边怎么样了？,200104124540200136,印度尼西亚,2,200104,一封写给父母的信,75,90,44,28,45,276,未参加,
她知道了美国的好，也知道了日本的好。,200104124525200265,日本,2,200104,一封写给父母的信,65,75,55,47,61,290,未参加,
如果你们去看樱花，请寄给我一张照片。,200104124525200276,日本,2,200104,一封写给父母的信,70,80,74,61,56,331,C,
马上到夏天了，[BC。]你们{CJ-zy要}注意身体。,200104124523200370,韩国,2,200104,一封写给父母的信,65,80,63,51,51,298,C,
我是位女学生[BQ，]因此我和别的女孩子一样喜欢美的衣服、吸引[L]人的广告，我很喜欢服装设计。,199200204525200006,日本,2,199200,一封求职信,,,0,0,0,0,未参加,
在{CD学习}业余大学[BQ，]我开始做{CC作}模特工作。,199200204604100030,奥地利,1,199200,一封求职信,,,0,0,0,0,未参加,
看这一方面的话不能允[B充]许这个人。,199604123523200285,韩国,2,199604,如何看待“安乐死”,65,75,45,44,42,258,未参加,
大夫理解父母的心情，给孩子一种{CC个}特殊的药。,199604123525100061,日本,1,199604,如何看待“安乐死”,55,60,56,47,49,248,未参加,
它是没有治疗的办法、对病人来说，死比生好的特别情况。,199604124525100072,日本,1,199604,如何看待“安乐死”,60,50,32,39,62,222,未参加,
我想人们都有生存权，那么与此相反可以有选择性的死亡权。,199604124525200059,日本,2,199604,如何看待“安乐死”,70,65,71,74,67,332,C,
目前不管是什么样的国家[C]，什么样的社会都出现了这种痛苦而悲[C]哀的事情。,199604124523100139,韩国,1,199604,如何看待“安乐死”,65,65,63,54,44,275,未参加,
第二种{CC个}看法是[BQ：]在某一些条件下，各国的政府{CJ+zy应当}为了保护病人的自由的权利起见[BQ，]让他向医生求助，让医生帮助他“安乐而死”。,199604123630100222,西班牙,1,199604,如何看待“安乐死”,85,65,40,47,62,288,未参加,
而且，身体和心理[B里]也受不能忍受{CJ+buy到}的痛苦。,199604123523200165,韩国,2,199604,如何看待“安乐死”,60,60,61,61,44,268,未参加,
首先还[F還]是要回顾[F顧]过[F過]去，以展望[C]未来[F來]。,199610550523290007,韩国,2,199610,如何解决“代沟”问题,70,65,65,48,65,299,C,
应该需要这种态度，先听然后想想，对是什么不对是什么。,199610550523290011,韩国,2,199610,如何解决“代沟”问题,70,65,65,69,67,322,C,
我想代沟这个问[B门]题是无[F無]论什么地方、什么时[F時]候都存在着的。,199610550523290053,韩国,2,199610,如何解决“代沟”问题,75,65,57,55,59,298,C,
那时，我想“不要谈了”[BQ，]就出去或者到我的房子里去。,199610550523290061,韩国,2,199610,如何解决“代沟”问题,55,70,62,50,55,276,未参加,
问题出现了，究竟如何解决[F決]？,199611543501200503,中国,2,199611,如何解决“代沟”问题,80,90,78,75,82,400,B,
到头来，吃亏的还是自己。,199603533533200012,新加坡,2,199603,由“三个和尚没水喝”想到的……,65,75,74,65,91,357,C,
尤其是在公司里，你等我，我等你，工作将无法顺利完成。,199603533533200022,新加坡,2,199603,由“三个和尚没水喝”想到的……,85,95,74,54,72,376,B,
而在这种情况下，如何合理的、公平的分配与分担工作是重要{CC必要}的，否则每个人都想让别人去完成工作，自己可闲[B间]下来，自得其乐。,199603533533200032,新加坡,2,199603,由“三个和尚没水喝”想到的……,85,90,77,72,99,419,B,
假设人类有如故事里头的三个和尚那样，那么人类就不会有今天了。,199603533533100036,新加坡,1,199603,由“三个和尚没水喝”想到的……,80,95,71,72,99,412,B,
和尚甲和和尚丙知道原来和尚乙并不蠢。,199603533533200096,新加坡,2,199603,由“三个和尚没水喝”想到的……,90,70,74,76,91,394,B,
他们可能平分[BQ，]采取分工的方法。,199605104501200008,中国,2,199605,由“三个和尚没水喝”想到的……,75,65,52,60,63,302,C,
于是从那时候起他们三个人就一起下山去挑水，[BC。]高高兴兴地{CC的}团结起来[BQ，]有什么事呢[BQ，]就互相帮助。,199605104513100013,柬埔寨,1,199605,由“三个和尚没水喝”想到的……,65,60,35,31,51,225,未参加,
我[C]还认为，中国故事大多{CC大概}{CQ都}有{CJ+dy什么}教育意义{CC4教训}，所以我们不能只是理解表面上的意思，还要学习这样{CQ的}{CD谚语}故事所含的[BD“]深奥[BD”]的意思。,199605104525200048,日本,2,199605,由“三个和尚没水喝”想到的……,65,70,66,81,82,350,C,
我们的世界已经有了各种政府形态，还有联合国、红十字{CJ+zxy会}等{CD的}国际性组织，[BC。]它们{CD组织}都是为了统一我们的思想{CC思考}[BD，]进行讨论{CC议论}的场所。,199605104525100068,日本,1,199605,由“三个和尚没水喝”想到的……,60,50,52,81,58,281,未参加,
通过这个故事，我感到和尚的利己[B已]心。,199605104523200087,韩国,2,199605,由“三个和尚没水喝”想到的……,65,65,58,54,65,291,C,
后来又来了第三个和尚，大家都希望别人去山下抬水，于是，人多了，反而没有水喝了。,199605104523200098,韩国,2,199605,由“三个和尚没水喝”想到的……,65,45,71,56,54,270,未参加,
有三个和尚就没有水喝了。,199605104523100112,韩国,1,199605,由“三个和尚没水喝”想到的……,70,70,77,67,68,340,C,
{CJ-zhuy社会}越来越现代化，更严重{CJX}这样的问题。,199605104523200172,韩国,2,199605,由“三个和尚没水喝”想到的……,50,40,46,45,44,200,未参加,
这样{CD地}过了很长时间，{CJ-zy又}来了一个和尚。,199605104523100179,韩国,1,199605,由“三个和尚没水喝”想到的……,60,60,63,49,32,246,未参加,
但是，我认为[B伪]，对人类最重要的东西是无关时代的。,199605104525200180,日本,2,199605,由“三个和尚没水喝”想到的……,65,60,58,60,68,294,C,
这段短文还反映了人们在社会上的消极的方面。,199605104523200187,韩国,2,199605,由“三个和尚没水喝”想到的……,65,55,88,56,72,318,C,
我从小时候到现在常常听到“克己”这个词{CC字}，因为[F為]我爸爸经常告诉{CD过}我克己的重要性。,199605104523100283,韩国,1,199605,由“三个和尚没水喝”想到的……,65,70,58,65,61,305,C,
这样一来，没有人不觉得{CC2觉}口渴。,199605104523200280,韩国,2,199605,由“三个和尚没水喝”想到的……,70,65,74,72,68,335,C,
我认为现在我们的生活状态也这样{CJs}，不是吗？,199605104523100291,韩国,1,199605,由“三个和尚没水喝”想到的……,60,60,44,54,35,235,未参加,
自私、[BC，]懒惰[BD，]是人的天性中的明显{CC显明}的坏习[BQ。],199605104542200312,越南,2,199605,由“三个和尚没水喝”想到的……,75,85,71,58,84,366,B,
”{CD但是}结果这火更大，最后连自己的家也都烧掉了。,199605104523200328,韩国,2,199605,由“三个和尚没水喝”想到的……,80,70,66,58,63,327,C,
某个{CC2在那个}家庭，生了三个孩子，当然父母特别高兴，尤其他们的孩子都是儿子。,199605104634200326,英国,2,199605,由“三个和尚没水喝”想到的……,75,80,63,76,58,343,B,
麻烦了。,199605104525200330,日本,2,199605,由“三个和尚没水喝”想到的……,75,75,55,63,56,314,C,
就[C]这样，现在的生活[C]里也有这样的事情。,199605104525200333,日本,2,199605,由“三个和尚没水喝”想到的……,60,65,60,83,77,328,C,
水桶里水也不多，因为水桶歪的时候，水桶里的水倒了点儿。,199605104523200346,韩国,2,199605,由“三个和尚没水喝”想到的……,70,65,66,47,54,288,C,
很多人一起干一个工作的时候，如果一个人不太努力也{CJX}有的时候没人知道。,199605104525200355,日本,2,199605,由“三个和尚没水喝”想到的……,75,60,66,70,68,325,C,
这个和尚比他们两个还年轻点。,199605104540200352,印度尼西亚,2,199605,由“三个和尚没水喝”想到的……,75,70,44,42,58,278,未参加,
要是让我们同胞{CD的}住在一起的话，我校考虑到：我们肯定用我们自己的语言来交谈、聊天儿。,199605104540100359,印度尼西亚,1,199605,由“三个和尚没水喝”想到的……,70,65,58,54,54,287,C,
第二个是三个人都要去山下抬水。,199605104525200394,日本,2,199605,由“三个和尚没水喝”想到的……,70,55,52,63,56,280,未参加,
从社会进步的观点看的话，这样的确态度和心理很危险的{CJsd}。,199605550523190016,韩国,1,199605,由“三个和尚没水喝”想到的……,60,55,44,60,63,263,未参加,
[BQ”]可是，每个人{CC各个[B各]人}都这样，谁也不做，这“三个和尚没水喝”{CQ的}故事也说了{CC着}这种想法。[BC，],199605550523290032,韩国,2,199605,由“三个和尚没水喝”想到的……,55,50,33,38,44,199,未参加,
这种推卸责任的现象，在蔓[B漫]延利己主义的现今社会上，常常成为严重的社会问题。,199605550523190040,韩国,1,199605,由“三个和尚没水喝”想到的……,60,70,71,72,82,340,C,
可是不想去山下抬水。,199605550523290053,韩国,2,199605,由“三个和尚没水喝”想到的……,60,60,66,47,32,247,未参加,
他们三个和尚[C]也不是{CJX}最后圆满解决[B觉]自己的误会吗{CJdp}？,199605550523290074,韩国,2,199605,由“三个和尚没水喝”想到的……,60,65,60,54,39,261,未参加,
结果取决于你选择了那一种思维方式。,199605550523290075,韩国,2,199605,由“三个和尚没水喝”想到的……,70,70,80,67,77,352,C,
有了这样的少数{CJ-zxy人}{CJ-zhuy工作}才能有效，有意义{CC意味}。,199605550523290081,韩国,2,199605,由“三个和尚没水喝”想到的……,65,80,80,67,70,350,B,
但真没想到，妈妈这么{CQ说}更使我内疚{CC为难}：“没关系。,199704123523200033,韩国,2,199704,记对我影响最大的一个人,65,85,65,54,53,312,C,
也许是我的动作很有趣吧。,200110540540250049,印度尼西亚,2,200110,我的童年,70,90,71,49,85,358,C,
我共有姐弟九人，[BC。]三位叔父、两位姑姑[C]。,200110540540250082,印度尼西亚,2,200110,我的童年,75,85,74,47,92,366,C,
我们那时幼小{CC还小}的心灵，以为她永远死了，想不到还会保存她的生命，而至今这个记忆永遠在我脑海里永驻！,200110540540250114,印度尼西亚,2,200110,我的童年,65,80,55,61,90,339,C,
一年后在朋友的介绍下，进入另一较有规模的广告公司，在这里主要负责设计的工作，到这时，我才得以发挥我在设计上的才华。,199312533533200013,新加坡,2,199312,一封求职信,80,95,69,70,82,392,B,
最后，本人诚恳地希望贵公司能考虑我的申请。,199312533533200027,新加坡,2,199312,一封求职信,90,85,69,76,87,404,B,
半年前，几位同窗邀我加入他们刚成立的一间旅游公司当会计部经理，我应允了。,199312533533100031,新加坡,1,199312,一封求职信,90,90,76,87,92,433,A,
如能被安排面试，将不胜感谢之至[B致]。[BC.],199312533533100032,新加坡,1,199312,一封求职信,80,70,71,76,87,374,B,
自毕业后，本人当过三年的律师，其后四年在旅游[F遊]促进局里担任高级行政官员。,199312533533100102,新加坡,1,199312,一封求职信,95,85,81,78,78,415,A,
还有待遇是怎么样的。,199312123525100108,日本,1,199312,一封求职信,45,55,25,48,45,195,未参加,
