错句,作文编码,国籍,性别,考试时间,作文题目,口试分数,作文分数,听力分数,阅读分数,综合分数,总分,证书
我的父亲是个技术工人。,199412123523200095,韩国,2,199412,记我的父亲,50,55,46,48,49,227,未参加,
小时候，他总是把我带去大海、[BC，]原野{CC野原}，山[BD，]等{CD的}大自然{CJ-zxy之处}。,199412124525100012,日本,1,199412,记我的父亲,65,55,60,50,53,265,未参加,
他不便是好像河里的水流{CJ？}。,199412124519100038,马来西亚,1,199412,记我的父亲,60,55,52,34,32,214,未参加,
他说“无论男女都应该去更大的地方学习。,199412104523200658,韩国,2,199412,记对我影响最大的一个人,65,70,52,50,49,272,未参加,
可是，越长大，我的心情越改变，{CD然而}上大学以后改变得更多、[BC，]更厉害。,199412104523200638,韩国,2,199412,记对我影响最大的一个人,60,55,60,63,53,272,未参加,
听到这段话，我常常和自己说，我不能让[B认]他失望。,199412104540200686,印度尼西亚,2,199412,记对我影响最大的一个人,75,60,68,44,57,290,未参加,
可是，最近我的生活十分充实，心情格外舒畅。,199412104523200662,韩国,2,199412,记对我影响最大的一个人,65,65,70,63,55,302,C,
现在，我这么{CJX}长大了，[BC。]她还是对我担心不止。,199412104523200692,韩国,2,199412,记对我影响最大的一个人,70,70,68,67,72,335,C,
这个意思是他（我爸爸的上司）说，[BQ“]你们的孩子中那个中间的老三卖{CQ给}我吧。,199412104525100649,日本,1,199412,记对我影响最大的一个人,60,60,39,48,57,246,未参加,
那会儿[BQ，]我的父亲连一顿饭也不吃，在她的跟前看护了十五天。,199412104523100646,韩国,1,199412,记对我影响最大的一个人,60,70,81,73,69,338,C,
可是他对我说[BQ：]“我的女儿，你去中国学习吧。,199412104523200678,韩国,2,199412,记对我影响最大的一个人,55,60,68,46,49,259,未参加,
此外，汉[F漢]语发[F發]音，也比广[F廣]州话[F話]麻烦。,199409543501100209,中国,1,199409,学习汉语的苦与乐,80,95,76,79,99,425,B,
当[F當]我们[F們]在学[F學]习[F習]汉[F漢]语[F語]时[F時]，苦乐[F學[C]]参[F參]半{CD存在}。,199409543634200207,英国,2,199409,学习汉语的苦与乐,80,75,45,50,73,314,未参加,
我还依稀记得那位接见我的林校长，她在学校里{CJ+zy都}得到老师与学[C]生们的{CJ-zy一致}爱戴。,199500533533100005,新加坡,1,199500,记对我影响最大的一个人,90,75,70,75,80,384,B,
原本母亲是一位家庭主妇，把家务事处理得井井有条，对我们的起居饮食也照顾得无微不至，由于环境所逼，她不得不外出{CC出外}找{CJ+dy份}工作补贴家用，因父亲已减少我们的家用。,199500533533100006,新加坡,1,199500,记对我影响最大的一个人,95,85,46,53,61,338,未参加,
父亲[F親]；你虽[F雖]然已离[F離]我远[F遠]去；可是现[F現]在我不知道有多少后悔的话[F話]要向你说[F說]，使你在有[L]生之时[F時]令你为我操心{CJjy}。,199500533519100039,马来西亚,1,199500,记对我影响最大的一个人,95,65,70,61,65,348,C,
一来可闻到四周的花菜的香味，二来我又可有更多的机会阅读一些课外读物。,199500533533200043,新加坡,2,199500,记对我影响最大的一个人,95,90,52,53,76,365,未参加,
妈妈不但在我思想上影响我，也在我的行为及谈吐上对我有显著的影响。,199500533533200064,新加坡,2,199500,记对我影响最大的一个人,90,90,73,71,76,398,B,
林老师还是一位见义勇为，舍已为公的人。,199500533540200108,印度尼西亚,2,199500,记对我影响最大的一个人,60,95,49,61,86,341,未参加,
很多人都只多看到表面的她而忽视了内心的她。,199500533533200119,新加坡,2,199500,记对我影响最大的一个人,90,70,75,71,74,373,B,
爸爸以礼待人的处事原则也让我在工作岗位上发挥{CQ得}淋漓尽致，记得我的前任主管在我离开公司的那一天告诉[F訴]我，他对于我那种孜孜不倦，对人有礼貌[L]的工作态度很赞赏{CC激赏}，我想这也是从小就被爸爸训练的吧！,199500533533200120,新加坡,2,199500,记对我影响最大的一个人,90,90,89,79,84,430,A,
我小时候非常[C]不听话，又贪玩，总[C]是不肯做功课。,199500533533100132,新加坡,1,199500,记对我影响最大的一个人,90,80,83,75,65,388,B,
在求[B救]学的年代{CD时[C]}，总[C]会有老师让每个人留下好或坏的印象{CC影响}，可见百年树人的责任有多重呀！,199500533533100146,新加坡,1,199500,记对我影响最大的一个人,95,80,89,87,82,429,A,
何况他们[F們]今[C]天来[F來]此也[C]是不得已的，我们[F們]生活虽[F雖]苦，但比起他们[F們]要好得多，还[C]是要多[C]为别人想吧，一席话[F話]把我羞得满脸[F臉]通红，再也说[F説]不出话[F話]来[F來]。[BC，],199510512501100507,中国,1,199510,记对我影响最大的一个人,90,95,55,48,82,368,未参加,
他们也多商量。{CP然后[F後]他们决[B结]定了。所以我也{CJX},199510550523100910,韩国,1,199510,如何看待“安乐死”,50,50,16,27,26,147,未参加,
法律也不应[F應]该[F該]为[F為]安乐死的家属[F屬]制造{CC制做}另一个悲剧。,199511543501100514,中国,1,199511,如何看待“安乐死”,75,90,81,66,86,392,B,
有人说[F說]协[F協]助他人“安乐[F樂]死”是杀[F殺]人的罪行，亦有人认[F認]为[F為]“安乐[F樂]死”是个[F個]人的{CJX}自愿[F願]，协[F協]助的人不应[F應]受到制裁。,199511543634200539,英国,2,199511,如何看待“安乐死”,85,85,67,75,93,400,B,
如果{CC若果}医生断定{CC评[C]定}了病人已毫无[F無]生存希望，又何必要病人苟延残喘{CC久延残[F殘]喘}？,199511543634200562,英国,2,199511,如何看待“安乐死”,80,90,76,81,95,417,B,
3、已于[F於]五年前开始从事广告设计这一行业，[BC。]并[F並]于[F於]工作{CC工暇}之余[F餘]，进修夜间部广告设计班，已于[F於]三年前毕业，[BC。]并[F並]获得{CC考获}甲等文凭[C]。,199503680519100543,马来西亚,1,199503,一封求职信,80,85,74,77,88,398,B,
5、我以诚恳的心要求您能给予{CC允许}我{CD的}此{CC一}职。,199503681519200554,马来西亚,2,199503,一封求职信,85,90,74,75,86,406,B,
他是日本著名作家{CC作者}夏日[B目]漱石的关门弟子，而且{CJ-sy是}夏日[B目]最疼爱的弟子之一。,199505104525200026,日本,2,199505,记对我影响最大的一个人,70,75,75,69,69,347,B,
对我来说，这[C]个方面我很尊[B遵]重他，甚至于崇拜他。,199505104523200049,韩国,2,199505,记对我影响最大的一个人,60,60,57,42,47,248,未参加,
整[C]天都在学校里。,199505104525100083,日本,1,199505,记对我影响最大的一个人,60,65,39,32,39,218,未参加,
所以我一直觉得{CC认为}他是我的亲生{CC2亲}父亲{CC2父}。,199505104523100089,韩国,1,199505,记对我影响最大的一个人,60,60,86,69,55,312,未参加,
我这样说当然别人{CJ-zy会}怀疑[C]我父[L]亲是什么非凡的人，可[C]是我父亲只不过是一位普普通通的韩国中年男人。,199505104523100105,韩国,1,199505,记对我影响最大的一个人,60,50,78,65,57,290,未参加,
这[C]{CQ件}事以后，我的生活方式变了。,199505104523100129,韩国,1,199505,记对我影响最大的一个人,55,70,65,53,69,296,未参加,
现在回忆起来，他对我的忠告给我很大的影响。,199505104525200131,日本,2,199505,记对我影响最大的一个人,80,80,81,77,69,379,B,
母亲[C]去世以后，其实最悲[C]痛的人就是[C]父亲。,199505104523100163,韩国,1,199505,记对我影响最大的一个人,70,80,73,59,76,348,C,
搞工作。P},199505104525100168,日本,1,199505,记对我影响最大的一个人,70,65,44,48,53,266,未参加,
最重要的原因是因为我未婚夫是一个中国人。,199505104614200175,荷兰,2,199505,记对我影响最大的一个人,80,65,44,42,49,268,未参加,
虽然两年的时间，[BC、]我的辅[B搏]导老师不能把她所知道的东西全部告诉我，但我觉得有一点{CD的}知识比没有好。[BC.],199505104540200200,印度尼西亚,2,199505,记对我影响最大的一个人,75,65,70,55,45,297,C,
对我影响最大的人大概是我的父母。,199505104604100233,奥地利,1,199505,记对我影响最大的一个人,80,80,60,55,65,332,C,
毕业{CJX}研究生以后[F後]，我在大学工作了两[C]年，然[C]后[F後]有机[F機]会[F會]到{CQ了}法国去读[F讀]博士。,199505104523100268,韩国,1,199505,记对我影响最大的一个人,75,65,57,75,63,322,C,
我[C]一下子就[C]可[C]以想起{CJ-zy好}几个。,199505104608100304,波兰,1,199505,记对我影响最大的一个人,85,65,78,48,63,328,C,
记得在那年年尾，他还因为课程来不及教而为我们这级{CQ学生}道歉。,199508682519100544,马来西亚,1,199508,记对我影响最大的一个人,75,85,86,73,84,396,B,
对[F對]不起！,200010543501250003,中国,2,200010,我第一次……,85,90,80,58,87,396,B,
为[F為]了追求短短数[F數]月的快乐[F樂]，然后[F後]换来[F來]长[F長]久的分离[F離]！,200010543501250003,中国,2,200010,我第一次……,85,90,80,58,87,396,B,
首先，感情是不可以衡量的，它没有一个[F個]标准去度量它的浓[F濃]淡度。,200010602543250009,香港地区,2,200010,我对离婚问题的看法,85,85,100,90,95,450,A,
那新问题就是因为要在机器{CJ+zy已经}固[B故]有的声音上，又要实行{CC加装}某些措施而要做出{CC何出}自然之声，第一违背“最高效率原则”，第二，浪费环境资源。,200005108523100283,韩国,1,200005,关于用自然之声取代噪声的建议,70,65,70,65,72,328,C,
环境保护部门的这种努力是值得表扬{CJsd}。,200005108523200280,韩国,2,200005,关于用自然之声取代噪声的建议,70,75,83,90,72,379,B,
但是，在房间里小河的流水声突然响过来的话，肯定会觉得不自然、不习惯。,200005108525200307,日本,2,200005,关于用自然之声取代噪声的建议,65,75,70,85,82,364,B,
）,200005108523100631,韩国,1,200005,关于用自然之声取代噪声的建议,70,65,48,60,54,283,C,
我认为国际现代化反而{CC2反}比例大于{CC2于}大自然。,200005108525200645,日本,2,200005,关于用自然之声取代噪声的建议,60,65,53,55,61,277,未参加,
我从小时候一直在城市长大{CD了}。,199705104525100006,日本,1,199705,我的城市/乡村生活,70,70,60,63,58,309,C,
我是个东京姑[B故]娘。,199705104525200023,日本,2,199705,我的城市/乡村生活,75,60,58,54,54,287,C,
我首先说城市生活，对于孩子的教育方面来说，城市生活比乡村生活好得多一些，因为城市的是老师的教方法比乡村老师的更好，还有得到信息的接触也很多。,199705104523100052,韩国,1,199705,我的城市/乡村生活,70,65,63,54,68,306,C,
春天、秋天也好。,199705104523200135,韩国,2,199705,我的城市/乡村生活,70,65,46,54,44,265,未参加,
我想城市生活和乡村生活的区别主要是在城市生活多种多样的{CJsd}[BQ，]而乡村生活比较单一的{CJsd}。,199705104636100184,乌克兰,1,199705,我的城市/乡村生活,80,80,55,60,63,330,C,
都让我享受城市生活的乐趣。,199705104523200196,韩国,2,199705,我的城市/乡村生活,75,80,66,58,75,345,C,
而且自己真正{CC正真}地想做的事情以外没做过。,199705104525200524,日本,2,199705,我的城市/乡村生活,50,50,60,51,58,247,未参加,
围着公园内的羊肠[F腸]小径缓步慢跑是城市居民习以为常而又十分有效的运动。,199705610501100007,中国,1,199705,我的城市/乡村生活,90,85,71,75,95,413,B,
尤其是到北[BD·]语来上学后，才发现我真正的汉语水平。,199804123523100160,韩国,1,199804,学习汉语的苦与乐,65,50,45,54,58,253,未参加,
天天反复想来想去怎么弄好呢。,199804123525200158,日本,2,199804,学习汉语的苦与乐,70,70,45,35,52,260,未参加,
中国历史悠长，中国文化很丰富，非常有意思，所以学习这些我赞扬中国，喜欢{CC欣赏}上课。,199804123635200210,俄罗斯,2,199804,学习汉语的苦与乐,60,55,48,32,46,222,未参加,
”这样做，别人看见我的时候{CC时间}，感觉特别不好意思，声音不由得小起[B越]来。,199804124525100283,日本,1,199804,学习汉语的苦与乐,85,75,57,81,80,370,C,
既然我在中国学习，生活，当然听力和口语是应该掌握{CJsd}，但对我来说这是最不拿手的。,199804124525200319,日本,2,199804,学习汉语的苦与乐,65,80,81,64,72,350,C,
我个人来说，学汉语的时候最讨厌的是[BD，]那无法数清的简[B减]称。,199804124523200379,韩国,2,199804,学习汉语的苦与乐,75,80,45,54,50,295,未参加,
为了增加自己的汉语词汇，我每天尽可能地多看电视节目、多听广播节目，有的时候跟中国朋友聊天。,199804124525100374,日本,1,199804,学习汉语的苦与乐,90,90,69,69,62,378,B,
”“{CQ哪个}国家{CD吗}？,199804124523200432,韩国,2,199804,学习汉语的苦与乐,65,65,72,57,44,287,C,
自古，我们中国[F國]固有传[F傳]统{CJ-wy是}，男主外，女主内{CJ+zxy的美德}，现也渐[F漸]为清谈。[BC，],199805529501151006,中国,1,199805,如何看待“妻子回家“,85,65,70,49,59,317,C,
比如开放思想、[BC，]得到好经验等。,199904123523200030,韩国,2,199904,如何面对挫折,65,65,59,62,54,289,C,
老百姓遇到了很多困难，可是人还是人，世界还是一样的世界[BQ，]没有变化，应该想一想，努力。P},199904123536100027,伊拉克,1,199904,如何面对挫折,55,60,37,27,46,206,未参加,
第二[BQ，]怕困难、[BC，]怕挫折的人绝不可能成社会需要的人{CC1人物}，因为国家机关、[BC，]社会各部门需要的人是又有能力、[BC，]又有勇气的人。,199904123523100077,韩国,1,199904,如何面对挫折,65,70,50,62,50,283,C,
我有绝对不会忘记的事情，我刚刚到这所学校，学校给我安排一个班。,199904123523200161,韩国,2,199904,如何面对挫折,65,70,45,60,54,280,未参加,
从此以后{CC以来}，我在{WWJ},199904123525200267,日本,2,199904,如何面对挫折,65,55,53,65,78,298,未参加,
因为在这个世界上[BD，]没有十全十美的人。,199904124540200293,印度尼西亚,2,199904,如何面对挫折,65,75,39,42,48,256,未参加,
以没上大学的人为失败者，[BC。]有这样的观点的国家不可能{CC2能}发展得快，[BC。]应该给每个人机会。,199904124523100385,韩国,1,199904,如何面对挫折,70,70,48,55,50,281,C,
我一定“不到黄河不死{CQ心}”.,199909684542200050,越南,2,199909,如何面对挫折,70,65,54,38,65,278,未参加,
