错句,作文编码,国籍,性别,考试时间,作文题目,口试分数,作文分数,听力分数,阅读分数,综合分数,总分,证书
每天放学后，{CJ-zhuy我}就坐在电视面前看节目。,200110540540250137,印度尼西亚,2,200110,我的童年,70,80,49,37,51,277,未参加,
小弟曾上过语文课程和语言表达课程。,199312533533100058,新加坡,1,199312,一封求职信,85,70,60,70,75,352,C,
本人也热爱旅行，每到之处，必深入了解当地风[F風]俗人情，探讨各方面的知识。[BC，],199312533519200070,马来西亚,2,199312,一封求职信,95,80,50,69,85,375,C,
本人{CC2敝}姓×，名××，[BC；]现年三十岁，[BC；]{CD在}中华大学导游系{CJX}毕业于一九八四年。,199312533540100105,印度尼西亚,1,199312,一封求职信,75,90,64,72,92,387,B,
我身高1.63米，体重48kg，长[F長]的头发，没戴[B带]眼镜[L][BQ，]有双眼皮，[BC.]脸比较白。[BC.],199312123523200709,韩国,2,199312,一封求职信,55,50,25,39,43,191,未参加,
到中国以后我在语言学院学习汉语四年多了[BQ，]而且成绩也很好[BQ，]所以我[C]汉语也不错[BQ，]{CD对[C]}当导游很合适。,199312123747100803,坦桑尼亚,1,199312,一封求职信,46,60,32,30,34,180,未参加,
我很喜欢人，[BC。]男女老少都喜欢，特别喜欢老人跟孩子，因为[C]看到孩子就可以看得出{CC去}明天的太阳[C][BQ，]看见老人我就想到昨[B作]天的月亮，看太阳[C]的时候[B后]我会把手掌握我的脸{CJba}，看月亮的时候[B后]我会想唐代的李白，跟我的说法与对人也是这样{CJ？}。,199410550523202903,韩国,2,199410,一封求职信,70,60,71,35,44,265,未参加,
我这时回忆{CJ-buy起}以前的很多事儿。,199412123525100023,日本,1,199412,记我的父亲,50,70,36,42,45,226,未参加,
他从前是一位建筑家，虽然不出名但他在工作时最{CJX}感到满意。{CP拿自己的家来说，不只是造房子{CC屋子},199412123525200048,日本,2,199412,记我的父亲,75,60,54,40,49,264,未参加,
虽然我出生在农村，不过那时候我的家那个村里最富有{CJsd}，父亲经常把我带{CJ-buy到}城市去让我看电影，吃好的东西，给我买好[C]玩具。,199412123523100100,韩国,1,199412,记我的父亲,50,60,36,38,37,201,未参加,
他鼓励我们学习，谁学习好，谁当他的朋友，学习成绩不好的人挨打挨骂。,199412124719200034,喀麦隆,2,199412,记我的父亲,80,55,49,32,45,247,未参加,
我原来不相信宗教、[BC，]迷信之类的事情{CC5的种类}，所以冷淡地{CC的}看她们{CJ-zxy的举动}。,199412124525200061,日本,2,199412,记对我影响最大的一个人,60,65,62,57,55,282,C,
你去汉城学习吧。,199412104523200658,韩国,2,199412,记对我影响最大的一个人,65,70,52,50,49,272,未参加,
她的生日那天，我送给她很漂[B票]亮的蜡烛。,199412104523200637,韩国,2,199412,记对我影响最大的一个人,80,70,70,71,76,357,B,
有一位日本的小姑娘[BD，]{CD他}进入入境检查时，他对那位姑娘非常热情。,199412104525200624,日本,2,199412,记对我影响最大的一个人,50,50,57,48,41,224,未参加,
那么什么是茶道精神呢？,199412104525200626,日本,2,199412,记对我影响最大的一个人,70,55,57,63,78,307,未参加,
我们俩从小就爱吵架。,199412104525200656,日本,2,199412,记对我影响最大的一个人,70,80,65,63,74,342,C,
他的英语[F語]成绩[F績]最{CC成}好，经[F經]常帮[F幫]助我，但他的数[F數]学[F學]就不及英语[F語]了。[BC，],199412104625100364,葡萄牙,1,199412,记对我影响最大的一个人,70,85,81,63,74,365,C,
经[F經]过[F過]这件事{CC2次}[BQ，]我觉[F覺]得，自己对[F對]人好，其他[B它]人自然会[F會]感受到，他们[F們]也会[F會]这样[F樣]对[F對]自己。,199412104625200371,葡萄牙,2,199412,记对我影响最大的一个人,55,80,68,48,57,294,未参加,
从收到二哥的来信的那天开始[BQ，]{CJ-zhuy我}准各考大学。,199412104523100109,韩国,1,199412,记对我影响最大的一个人,60,70,54,65,74,308,未参加,
但汉字是方块[F塊]字，不能像拼音文字那样[F様]，凭[F憑]记[F記]音就很快可以上手，而且笔[F筆]划[F劃]繁多，初学时[F時]要吃{CC捱}的苦头实在不少。,199409543634100214,英国,1,199409,学习汉语的苦与乐,85,85,83,73,91,413,A,
时间过得真快，署[B署]假过后我又重回校园了。,199500533533100005,新加坡,1,199500,记对我影响最大的一个人,90,75,70,75,80,384,B,
他教[Y敎]诲[F誨]{CD着[F著]}我无[F無]论[F論]遇上什么[F麽]挫折艰[B堅]辛，都要努力不懈地{CC的}做好每一件事情，那就是成功。,199500533533200012,新加坡,2,199500,记对我影响最大的一个人,85,90,100,77,90,438,A,
就是再辛苦，他也要让一家{CD三餐[C]}温饱，也要让我们上学念书[F書]。,199500533533100025,新加坡,1,199500,记对我影响最大的一个人,80,90,78,71,90,404,B,
如今我仍是单[C]单[C]就[C]为着[C]教育下一代，为[F為]了饮[F飮]水思源[C]，为[F為]了苦[C]难的丹心，我不会离[F離]开[C]这所培育{CC培植}穷[F窮]苦[C]学[F學]生的学校。,199510512501200508,中国,2,199510,记对我影响最大的一个人,90,95,48,48,61,340,未参加,
为[F為]何局外人决定当[F當]事人该[F該]否继[F繼]续[F續]承受绝[F絕]症带来[F來]的痛苦呢？,199511543634200520,英国,2,199511,如何看待“安乐死”,85,80,81,73,75,387,B,
在他们看来，[BC.]生不如死。[BC.],199511543501100526,中国,1,199511,如何看待“安乐死”,85,95,81,77,99,433,B,
“安乐死”究竟可不可取呢？,199511543634100534,英国,1,199511,如何看待“安乐死”,90,85,57,52,70,351,未参加,
有人说[F說]协[F協]助他人“安乐[F樂]死”是杀[F殺]人的罪行，亦有人认[F認]为[F為]“安乐[F樂]死”是个[F個]人的{CJX}自愿[F願]，协[F協]助的人不应[F應]受到制裁。,199511543634200539,英国,2,199511,如何看待“安乐死”,85,85,67,75,93,400,B,
一是病人提出{CJsd}，二也可以减[F減]少患病的痛苦。,199511543501100561,中国,1,199511,如何看待“安乐死”,90,85,64,52,79,367,C,
对于服装方面，本人亦有相当{CQ的}研究。,199503680519200515,马来西亚,2,199503,一封求职信,80,85,67,68,86,380,B,
因此，本人相信本人能够[C]胜任贵公司广告设计师的职位。,199503681519200549,马来西亚,2,199503,一封求职信,90,90,79,66,82,405,B,
我对服装设计有{CC1抱美}很大的抱负与理想，因此常常在设计上以独特及前卫的风格出现，在竞[F競]争激烈的服装设计学上得以脱颖而出，屡次在比赛中获奖，包括象征最高荣誉的世界大学服装设计奖冠军。,199503680519100531,马来西亚,1,199503,一封求职信,85,90,59,73,84,387,B,
汉语是联合国五大语言之一，不但是十多亿[F億]中国大陆[F陸]人民通用的语言，同时更是海外众[F衆]多华侨通用的语言。,199505529529100001,泰国,1,199505,学习汉语的苦与乐,60,85,40,48,64,286,未参加,
因为泰国政府限制华教很久了，这[F這]几年要找教汉语的教师[F師]实如海中觅针很难[F難]找到，而且在社会上或商场上来往也{CJ+sy是}很少用到汉语，所以在学校里[F裏]学习来的汉语都{CJ+sy是}没有机会去实用。,199505529529100008,泰国,1,199505,学习汉语的苦与乐,55,75,38,48,64,265,未参加,
这[C]部电影拍摄[C]的方法{CC办法}和其[C]他电影不大一样，而且，台词也少，可有一种说[C]不出来{CQ的}美，给我的[C]印象[C]非常深。,199505104523200017,韩国,2,199505,记对我影响最大的一个人,65,85,68,67,69,344,C,
我很想学她[C]的这一点。,199505104523200038,韩国,2,199505,记对我影响最大的一个人,70,80,60,57,53,310,C,
母{WWJ},199505104533100053,新加坡,1,199505,记对我影响最大的一个人,85,60,52,46,78,309,未参加,
一定学好汉语{CD吧}！,199505104525200096,日本,2,199505,记对我影响最大的一个人,65,70,60,40,53,274,未参加,
不是永远[F逺]不变的。,199505104523200110,韩国,2,199505,记对我影响最大的一个人,80,60,70,75,63,335,C,
我母亲二十二岁的时候生了我哥哥，五年后又生了一个女[C]孩子[BQ，]就是我。,199505104525200109,日本,2,199505,记对我影响最大的一个人,80,75,68,61,67,342,C,
虽然父亲永远[C]离开{CQ了}我们，可他永远[C]留在我的心里。,199505104523100130,韩国,1,199505,记对我影响最大的一个人,70,90,78,75,76,382,B,
他{CQ的}教法主要的特点就是要坚持保持一种客观的研究、学习方[B去]法。,199505104801100137,澳大利亚,1,199505,记对我影响最大的一个人,80,75,54,53,47,300,未参加,
你们的生活虽然艰苦[BQ，]但{CJ-zy还要}帮助别人，还有{CC还是}，千万别[C]用违法的方法挣钱。[BQ”],199505104523100142,韩国,1,199505,记对我影响最大的一个人,70,50,52,40,45,240,未参加,
尤其是母亲。,199505104525100145,日本,1,199505,记对我影响最大的一个人,65,60,78,83,78,347,C,
可是那么短的时间学不了多少，果然没考上。,199505104525200182,日本,2,199505,记对我影响最大的一个人,75,90,70,61,61,351,B,
小孩儿不到一岁的时候，她就是我的钟表。,199505104525200189,日本,2,199505,记对我影响最大的一个人,60,70,68,67,53,303,C,
她已经不在人世了。[BC.],199505104525200190,日本,2,199505,记对我影响最大的一个人,70,80,86,79,67,372,B,
有两个原因；第一个是我们俩{CD的}互相尊敬{CD和}[BQ，]友谊很深厚{CC深刻}，所以在我独立{CD的}生活中[BQ，]我还愿意听{CJcd}她的意见。,199505104634100228,英国,1,199505,记对我影响最大的一个人,70,55,52,57,65,283,未参加,
这[C]个意[C]思[C]简单地说就是我现在做的事，{CQ也}就是留学。,199505104525200235,日本,2,199505,记对我影响最大的一个人,65,65,68,59,47,288,C,
他个子非常高，一般来说个子高的人{CC1人们}动作很慢，可是他动作比别人快，为什么呢？,199505104525100251,日本,1,199505,记对我影响最大的一个人,70,65,44,55,49,269,未参加,
这样从简[C]单[C]的事情开始，我能够积累{CC增加[C]}{CD了}工作上需[C]要的各种知[C]识和经验。,199505104525200245,日本,2,199505,记对我影响最大的一个人,70,60,68,65,63,311,C,
那个时候[BQ，]我的5个兄弟姐妹都是学生，所以每个月的学费和零用钱{CJ-sy需要}不少。[BC，],199505104523100259,韩国,1,199505,记对我影响最大的一个人,70,60,57,59,45,276,未参加,
而这次舅父的到来，主要就是让我有机会到镇上读书[BQ。]而后，舅父和爸妈商量一定要我去求学，如此我才有念[F唸]书的机会。[BC，],199508680519200532,马来西亚,2,199508,记对我影响最大的一个人,85,85,41,40,47,293,未参加,
我童年没有纷纷灿烂的日子，但平淡当中亦有不少令我无法忘怀的事物、小时[F時]候，因为父母亲[F親]都要上班，所以就交托外祖母來照顾[F顧]我。,200009542542200002,柬埔寨,2,200009,我的童年,65,70,69,74,96,360,C,
既然法律允许离婚，那么为什么不可以呢？,200010512501250009,中国,2,200010,我对离婚问题的看法,75,80,89,80,98,413,B,
离婚后，两夫妻还是可以继续做朋友，双方的事业又很成功，这不是皆大欢喜吗？,200010512501250011,中国,2,200010,我对离婚问题的看法,80,85,83,75,93,410,B,
家里不是很富裕，[BC.]但足够五个人吃饭。,200010543525250009,日本,2,200010,我第一次……,70,65,67,63,66,317,C,
他们[F們]并[F並]没有想到当[F當]两[F兩]个[F個]人成为[F為]夫妻后[F後]，双方都应[F應]对[F對]对[F對]方作出{CD了}责任的承诺[F諾]。,200010801543250007,香港地区,2,200010,我对离婚问题的看法,80,70,29,75,61,305,未参加,
吓死我了，感觉非常不好。,200005108525200301,日本,2,200005,关于用自然之声取代噪声的建议,65,70,70,72,59,322,C,
特别在北京这样大城市里边车非常多{CJs}。,200005108525100319,日本,1,200005,关于用自然之声取代噪声的建议,65,65,75,83,69,341,C,
像上述的那妇女那样损害了精神的人在世界上可真不少。,200005108525200357,日本,2,200005,关于用自然之声取代噪声的建议,70,75,50,67,69,320,C,
没有大海、怎么听到大海的波涛声呢？,200005108525200699,日本,2,200005,关于用自然之声取代噪声的建议,65,80,70,72,65,340,B,
想买就什么物品也买得到，想学习的话有各种各样的可用设[B施]备，比如美术馆（附属阅览室）、博物馆、图书馆和资料室等等。,199705104525200003,日本,2,199705,我的城市/乡村生活,70,85,52,58,80,337,C,
住在东京那城市的活，人家可以过很无所谓而快乐的生活。,199705104525200003,日本,2,199705,我的城市/乡村生活,70,85,52,58,80,337,C,
早上起来就到地里干活，晚上回来，全家席地而坐，谈一谈。,199705104523100020,韩国,1,199705,我的城市/乡村生活,65,75,69,65,58,319,C,
有人说童年是在人生中最美好的一段。,199705104523200097,韩国,2,199705,我的城市/乡村生活,60,60,69,70,77,318,未参加,
在家里我有爸爸妈妈，一个哥哥和一个姐姐，数[B属]我年龄最小。,199705104523200126,韩国,2,199705,我的城市/乡村生活,80,60,60,70,84,341,C,
所以我每天都会[F會]做医[F醫]生要求的运[F還]动[F動]。,199810801634150023,英国,1,199810,如何面对挫折,90,80,78,78,59,380,B,
我喜欢中国人[BQ，]尤其是我每{CQ一}位曾经教过我的汉语老师。,199804123529200138,泰国,2,199804,学习汉语的苦与乐,85,75,54,49,66,321,未参加,
去年由于事业的关系休学了一年，[BC。]我以前的同学们都上了四年级，他们现在时时刻刻{CJ-zy都}非常紧张[BQ，]因为马上要写毕业论文，要顺利地通过答辩。,199804123525200158,日本,2,199804,学习汉语的苦与乐,70,70,45,35,52,260,未参加,
我才明白学校里学的普通话，并不能完全通用于中国。,199804124523100355,韩国,1,199804,学习汉语的苦与乐,70,70,45,57,54,284,未参加,
前面[L]描写{CQ的}两个是学习汉语的{CC是}很苦的难点。,199804124523200398,韩国,2,199804,学习汉语的苦与乐,65,55,75,45,46,268,未参加,
我快要毕业了。,199804124523200441,韩国,2,199804,学习汉语的苦与乐,85,85,78,67,80,390,B,
对我的性格来说，我得到的太少了吧，我认为学汉语，学外语的目的是有很多{CJs}，可是对我来说，语言是一种工具，不是目的的{CJs}。,199804124525100473,日本,1,199804,学习汉语的苦与乐,55,65,42,69,50,263,未参加,
于是我考虑到调{CC1改变}到一年级的事。,199904123525200085,日本,2,199904,如何面对挫折,65,65,56,80,72,322,C,
苏轼[B试]写过一首诗说：“人有悲欢[B伤]离合，月有阴晴圆缺{CC阴晴[B情]缺圆}”[BQ，]人生不会有十全十美的。,199904124529200294,泰国,2,199904,如何面对挫折,75,75,80,62,59,341,B,
比如我们学习当中，或者工作当中经常发生麻烦的事情[BQ，]人们第[B弟]一次面对着挫折时会感到{CC得到}伤心[BQ，]{CD而且}感到痛苦，但是我觉得面对一些困难{CD只}光感到痛苦{CJ+zxy的感觉}就放弃自己追求{CQ的}东西的话，这真是成了一个失败者，我们首先不应该害怕{CC2畏}困难，不要厌[B言]憎挫折，应该主动地克服挫折并且{CQ在}跟这些挫折和自己战斗{CC斗战}{CJ-zxy的过程}中反省着“我为什么遇到{CC见到}了挫折呢？,199904124523200332,韩国,2,199904,如何面对挫折,65,55,67,65,67,301,C,
后来他们安心了，后来{CC就来}互相了解，问题就解决了。,199909529529251011,泰国,2,199909,如何面对挫折,80,85,48,52,50,309,未参加,
