错句,作文编码,国籍,性别,考试时间,作文题目,口试分数,作文分数,听力分数,阅读分数,综合分数,总分,证书
如果情投意合，甚至是能够互相了解，进一步迁就对方的缺点，那么这就为往后{CD能否}融洽地相处打下稳固的基础。,200410534533150115,新加坡,1,200410,最理想的结交方式,95,90,77,83,96,440,A,
就拿陈木生的例子来说：已经年过三十的他，如果要凭着自己的缘分来寻找另一半，相信他可能要等上几个月或几个年头。,200410534533250135,新加坡,2,200410,最理想的结交方式,85,90,52,70,100,393,C,
自古以来，“两小无猜”、“青梅竹马”不是告诉我们吗？,200410534533250136,新加坡,2,200410,最理想的结交方式,90,85,55,70,96,393,C,
不过那些与[B于]众不同的运动员则可以成为富人。,200404140540200146,印度尼西亚,2,200404,运动员收入,70,85,81,69,72,369,B,
除此以为，吸烟者的身体免疫[C]力都会大大降低{CC减底}{CD了}。,200405680519150014,马来西亚,1,200405,吸烟对个人健康和公众利益的影响,70,65,66,83,84,354,C,
但肯定[D的]将来他们都必须踏入社会工作，而这个社会却是男女共存的，所以中学生活里的小插曲可能也能促进他们将来在社会上更容易地[B的]与人相处和沟[F溝]通。,200504534533250025,新加坡,2,200504,我对男女分班的看法,75,80,70,78,84,378,B,
我是从男子中学毕[F畢]业出来的，记得读中三、四时，我们同学都会到对面的女校找机会，约对面女校的女生去看戏，搞得{CC的}校长[F長]一声令下，不许我们进[F進]学校。[BC，],200504534533150080,新加坡,1,200504,我对男女分班的看法,70,80,78,67,84,369,B,
在{CC到}某一个程度{CQ上}，我同意家长的看法。,200504534533250118,新加坡,2,200504,我对男女分班的看法,70,80,81,69,82,372,B,
我也很喜欢这种做法，因为，可以见识[B视]到更多不同种类的人和事物{CC4人事物}。[BC.],200504534533250126,新加坡,2,200504,我对男女分班的看法,70,75,67,62,73,336,C,
虽然有些家长是为了避[B辟]免学生早恋，但是我认为家长的顾虑是多余的。,200504534533150146,新加坡,1,200504,我对男女分班的看法,40,80,81,71,77,331,未参加,
但如果一个老师教一班女同学，有时也会太安静，令教书很不自在。,200504534533250148,新加坡,2,200504,我对男女分班的看法,75,75,62,45,70,317,C,
长久以来，中国一直都是男女混合式的教育。[BC.],200504534533150177,新加坡,1,200504,我对男女分班的看法,70,75,65,54,68,321,C,
于是我从父母身上体会到了爱，学会了爱。,200505109510200529,朝鲜,2,200505,父母是孩子的第一任老师,85,95,74,79,72,401,A,
不过和学校的老师不同的{CJ+zxy事}是孩子们不能选择[B泽[C]]他们的父母。,200505109525100578,日本,1,200505,父母是孩子的第一任老师,65,65,79,72,64,329,C,
孟子的母亲也是他的老师[F師]。,200505109922200576,美国,2,200505,父母是孩子的第一任老师,75,60,63,51,69,304,未参加,
这说明父母对孩子的影响非常大，而且还会持续到死。,200505109610200730,法国,2,200505,父母是孩子的第一任老师,95,65,66,56,79,353,C,
如果有人问我：“你为什么喜欢帮助别人？,200505109529201097,泰国,2,200505,父母是孩子的第一任老师,80,70,60,58,71,329,C,
”或者“谁是你的伟大老师”。,200505109529201097,泰国,2,200505,父母是孩子的第一任老师,80,70,60,58,71,329,C,
由于这[C]个缘故，我[C]母亲含[C]辛茹[C]苦，省吃俭[C]用把我[C]一直[C]抚养成[C]成[C]人。,200505109525101153,日本,1,200505,父母是孩子的第一任老师,75,80,62,78,78,364,B,
首先，父母的任务比其它的老师还要重得多。,200505109922101361,美国,1,200505,父母是孩子的第一任老师,80,65,60,51,64,308,C,
比如：幼[C]年时代，我不喜欢吃鱼类的食品{CD之类}，一看就感到不舒[C]服，[BC、]可是那时候，[BC、]我还没吃过鱼，那[BD、]为什么不喜欢吃鱼呢？,200505109525201598,日本,2,200505,父母是孩子的第一任老师,45,60,46,45,41,216,未参加,
孩子需要什么样的老师呢？,200505109821201592,新西兰,2,200505,父母是孩子的第一任老师,60,75,52,61,65,299,未参加,
我认为父母应该成为在家庭生活中、社会生活中的孩子的榜样。,200505109525101707,日本,1,200505,父母是孩子的第一任老师,65,60,54,73,65,300,未参加,
因为外婆的文化水平和她所[C]经历{CC通过}的经验[C]比父母[C]多{CC高}{CQ得}多，我常常跟外婆说话从而{CC2和}吸收[C]了许多东西。,200505109525101792,日本,1,200505,父母是孩子的第一任老师,65,65,52,67,74,307,C,
如果父母和孩子在红绿灯不允许他们过马路{CQ时}，{CD然而}自己违规{CC犯法}，那就是不可思议{CJsd}。[BC，],200505109634201925,英国,2,200505,父母是孩子的第一任老师,65,65,61,45,54,274,未参加,
作为一个老师，父母应该教[C]导自己的孩子。,200505109525202113,日本,2,200505,父母是孩子的第一任老师,70,75,56,69,74,333,C,
比如说，我心情不好的时候会去逛街，而且买很多东西。,200505109525202353,日本,2,200505,父母是孩子的第一任老师,70,70,76,76,80,360,C,
由此看来，我们应该记住父母是孩子的第一任老师。{CJ-zhuy这句话},200505109525202398,日本,2,200505,父母是孩子的第一任老师,60,65,41,56,62,267,未参加,
可见，[BC、]父母的[C]压力太大。,200505109525102433,日本,1,200505,父母是孩子的第一任老师,60,60,41,49,58,250,未参加,
其实我觉得我的父母是我的“人生之先辈”。,200505109525202583,日本,2,200505,父母是孩子的第一任老师,65,90,46,53,69,314,未参加,
我从小有很多机会看这些书。,200505109525102597,日本,1,200505,父母是孩子的第一任老师,70,80,37,57,65,299,未参加,
孩子{CD也}选自己的爱好也是按父母的看法[B发]来选。{CJsd},200505217651200234,,2,200505,父母是孩子的第一任老师,80,75,54,57,58,315,C,
言语教学教出知识，生命教学教出智慧。,200505205922200332,美国,2,200505,父母是孩子的第一任老师,80,95,76,79,80,405,B,
这[F這]样[F樣]两[F兩]人都可以减少{CC少到}很多的问[F問]题[F題]和得到相同的{CJ-zxy观点}。,200505951501250011,中国,2,200505,最理想的结交方式,55,55,73,55,68,286,未参加,
有的喜欢[F歡]用书[F書]写[F寫]的方式[BD，]来结[F結]交朋友，[BC。]有的却[F卻]喜欢[F歡]借用新科技[BD，]来结[F結]识[F識]朋友。,200505522522210002,缅甸,2,200505,最理想的结交方式,70,85,86,71,97,401,B,
预先没有透彻[F徹]地{CC的}了解对方，凭[C]着一时[F時]的好奇，{CJ-sy抱着}试[F試]试[F試]看又怎么样[F様][BD？]{CJ-zxy的态度}的情侣们到后来还是分开{CC散开}了。,200505522522250041,缅甸,2,200505,最理想的结交方式,65,65,68,58,79,319,C,
我们也可以说，家庭是孩子的第一所学校。,200505201542200068,越南,2,200505,父母是孩子的第一任老师,95,75,67,51,89,372,C,
可能在将来他会遇到真正的邮票专[B传]家，那个人会教给他很多关于邮票{CQ的}知识，可是让他爱上邮票懂得邮票{CQ的}不是他父亲吗？,200505201542200419,越南,2,200505,父母是孩子的第一任老师,80,70,56,59,80,335,C,
因此，父母肯定{CC难免}是孩子最熟悉的人。,200505502540100040,印度尼西亚,1,200505,父母是孩子的第一任老师,80,65,50,43,52,278,未参加,
我认为他们确[B却]是我的[L]第一任老师。,200505502643100003,立陶宛,1,200505,父母是孩子的第一任老师,80,60,56,53,56,292,未参加,
喜欢动[B运]物我是跟妈妈学的。,200505332529100001,泰国,1,200505,父母是孩子的第一任老师,60,55,71,67,54,288,未参加,
父母是我们生活中重要的人物。,200505332540200012,印度尼西亚,2,200505,父母是孩子的第一任老师,65,60,52,53,47,260,未参加,
这样的条件如果孩子能做得到，父母就会觉得满足极[B级]了。,200505332529200039,泰国,2,200505,父母是孩子的第一任老师,65,50,48,33,47,224,未参加,
每年不是全班第一名，就是全[L]班的第二名。,200509534533150002,新加坡,1,200509,一封求职信,65,70,77,55,61,314,C,
所以，我在服务业这一行可算是经验丰富了。,200509534533250003,新加坡,2,200509,一封求职信,60,80,75,53,55,310,未参加,
祝：安康。,200509534533250022,新加坡,2,200509,一封求职信,65,70,57,33,66,277,未参加,
我毕业于新加坡国立大学艺术学院广告系。,200509534533250029,新加坡,2,200509,一封求职信,75,85,66,69,88,376,B,
近{CQ日}阅报获悉贵公司招聘广告设计师，特致[B至]函征[C]之。,200509534533250031,新加坡,2,200509,一封求职信,55,75,77,53,70,315,未参加,
快乐家庭旅游公司人力资源部经理：看到贵公司的招聘启事，本人对导游一职非常感兴趣。,200509534533250118,新加坡,2,200509,一封求职信,75,70,88,73,88,383,B,
我曾经获得中国汉语水平考试的证书{CC承认}。,200509534519250148,马来西亚,2,200509,一封求职信,85,70,75,77,88,386,B,
李文先生：您好！,200509534533250146,新加坡,2,200509,一封求职信,70,65,70,55,77,323,C,
我看了贵公司刊登的招聘启事，了解贵公司有意聘请女导游。,200509534533250152,新加坡,2,200509,一封求职信,70,70,82,64,86,360,C,
×××2005-09-17,200509534533250172,新加坡,2,200509,一封求职信,60,70,88,58,91,352,C,
在求学期间，本人也选择修读日语，因此才能到东京大学继续求学。,200509534533250174,新加坡,2,200509,一封求职信,55,70,75,69,91,344,C,
就拿我来说吧。,200510111523200414,韩国,2,200510,我看流行歌曲,60,70,60,48,64,287,未参加,
有的子女对父母的孝[B教]{CJs}，有的学生对老师的感恩{CJs}，有的是提倡[B昌]环境保护的。,200510111523200415,韩国,2,200510,我看流行歌曲,70,75,65,71,79,349,C,
可是有些人特别喜欢流行歌曲，甚至对自己喜欢的歌星达到痴迷的程度。,200510111523200426,韩国,2,200510,我看流行歌曲,55,60,30,24,37,187,未参加,
但是有些人不喜欢流行歌曲，甚至还有人非常蔑视流行歌曲{CD的}。,200510111523200770,韩国,2,200510,我看流行歌曲,80,80,63,69,69,353,B,
有的人说，流行歌曲没有多大{CC很[C]大}的价值，但我不同意他们的看法。[BC，],200510111626200711,瑞典,2,200510,我看流行歌曲,85,95,60,61,74,371,C,
我在家或者在走路的时候经常听着音乐。,200510111523101055,韩国,1,200510,我看流行歌曲,60,60,53,34,47,236,未参加,
人活着毕竟都要尝试和接[C]受新的东西，[BC。]这样才能更能溶[B容]入社会文化。{CD对于},200510111922201107,美国,2,200510,我看流行歌曲,90,95,53,73,62,371,C,
有些人特别喜欢流行歌曲，甚至对自己喜欢的歌星达到痴迷的程度。,200510111540201626,印度尼西亚,2,200510,我看流行歌曲,65,65,42,48,67,271,未参加,
她那时候好像不知道自己的身份似的，[BC。]于是连课都不上了。,200510111523201632,韩国,2,200510,我看流行歌曲,65,75,60,42,69,298,C,
他们可以称得上是孩子的第一任老师。,200510919501250019,中国,2,200510,父母是孩子的第一任老师,90,95,89,79,100,451,A,
孩子的人格成长[F長]及未来{CQ的}发[F發]展[BD，]与[F與]父母的兴[F興]趣愛好、思想观念、行为[F為]举[F舉]止，往往有绝[F絕]对[F對]正面的关[F關]联[B连[F連]]。,200510919919150002,加拿大,1,200510,父母是孩子的第一任老师,60,90,74,71,88,373,C,
我不太喜欢跟着[F著]潮[B朝]流，我比较喜欢以各人的品位来决定是否喜欢一首歌。,200510204512200272,菲律宾,2,200510,我看流行歌曲,70,55,83,52,77,321,未参加,
那时我住在台北，大部分歌星是住在首都{CJs}。,200510204540200350,印度尼西亚,2,200510,我看流行歌曲,60,90,60,46,74,320,未参加,
由音乐而诞生的街舞是最近开始流行的舞种。,200510205540200020,印度尼西亚,2,200510,我看流行歌曲,60,85,77,71,91,373,C,
他就是的独特的曲风外加R&B的唱调深深吸引着大家。,200510205919200076,加拿大,2,200510,我看流行歌曲,90,95,86,69,87,425,A,
对他们歌星们来说也是一样的，他们想要唱什么就唱什么，有的人听了就喜欢，他们也觉得高兴。,200510205540100087,印度尼西亚,1,200510,我看流行歌曲,60,70,65,50,57,287,未参加,
比如说，我[C]国现在大多数的女学生都喜欢一个歌星，[BC。]所以为了看他唱歌，女学生们差不多两天以上在演场的入口等他{CJX}，[BC。]所以很多女学生去病院就住院{CJ？}。,200510302523100025,韩国,1,200510,我看流行歌曲,55,60,56,40,50,242,未参加,
成绩下降了，会常常与父母{CJ-sy有}代沟[C]，这也会影响家庭的健康，甚至影响整个社会的健康。,200510302523200035,韩国,2,200510,我看流行歌曲,75,80,74,59,79,358,B,
在韩国曾经有过这样的事：[BC，]有个学生，他认为他经常听的歌曲内容跟他很相似，所以他听{CQ到}了歌曲的主人公[B工]自杀的时侯，他也{CQ用}跟歌曲的主人公[B工]一样的方法自杀了。,200510302523100041,韩国,1,200510,我看流行歌曲,65,60,51,59,62,280,未参加,
流行歌曲的短处是容易被上瘾。,200510302523100046,韩国,1,200510,我看流行歌曲,90,65,72,71,91,380,B,
所以我不喜欢流行歌曲。P},200510302523100109,韩国,1,200510,我看流行歌曲,50,40,42,34,52,193,未参加,
特别一般的年轻人非常喜欢流行歌曲，所以我们常常能听见流行歌曲。,200510302523200129,韩国,2,200510,我看流行歌曲,65,60,49,48,52,257,未参加,
这是由{CC从}两个时代文化差异[B弃]产生{CC发生}的。,200510302523200237,韩国,2,200510,我看流行歌曲,65,65,58,40,62,274,未参加,
一个人在生活中如果没有欣赏音乐的情趣，这个人的生活一定很孤[C]独寂寞。,200510529529251006,泰国,2,200510,我看流行歌曲,50,55,42,67,32,225,未参加,
非常快乐，也非常不爽的一种感觉。,200510540540200001,印度尼西亚,2,200510,我看流行歌曲,80,70,42,24,47,253,未参加,
可见{CC2这见得}流行歌曲对现代的青年真是一种渴求的音乐。,200510540540200033,印度尼西亚,2,200510,我看流行歌曲,60,65,46,44,72,270,未参加,
妈妈还记得吗？,200104124525200056,日本,2,200104,一封写给父母的信,70,65,47,47,45,260,未参加,
最近忙不忙？,200104124545100108,乌兹别克斯坦,1,200104,一封写给父母的信,70,80,30,30,56,256,未参加,
解决。P},200104124523200190,韩国,2,200104,一封写给父母的信,65,65,47,28,47,236,未参加,
学习难不难？{CJ-zhuy您},200104124523200256,韩国,2,200104,一封写给父母的信,70,75,41,42,45,262,未参加,
亲爱的爸爸、妈妈[BQ：]你们好！,200104124523200258,韩国,2,200104,一封写给父母的信,70,65,60,58,56,295,C,
我现在也常常写{CJX}给父母一封信。,200104124523200282,韩国,2,200104,一封写给父母的信,70,70,60,61,72,321,C,
我七岁的时候父亲去世了，[BC。]那时我{CD的}家一下子失去了欢声笑语{CC观声大语}。,200104124523100332,韩国,1,200104,一封写给父母的信,75,55,30,49,47,241,未参加,
有的时候，我想早{CD就}没{CC不}来就好了。,200104124523200456,韩国,2,200104,一封写给父母的信,70,70,71,51,63,313,C,
服装模特{CJ-zxy的要求}男女不同。,199200204525100027,日本,1,199200,一封求职信,,,0,0,0,0,未参加,
我家离你们公司比较远，[BC、]我家住在虹口区，从你们公司到我家，坐公共汽车去的话，要40分钟才{CC就}可以到{CD了}。,199200204525100039,日本,1,199200,一封求职信,,,0,0,0,0,未参加,
这个时候您{CD自亲}可以看到{CC知道}，我的相貌{CQ很}端正。,199200204616200026,德国,2,199200,一封求职信,,,0,0,0,0,未参加,
于是，[BC、]我想所有的人都有权利{CJ-sy选择}如何度过自己的一生。,199604123525200166,日本,2,199604,如何看待“安乐死”,80,75,63,88,83,380,B,
第一，由于没有办法的病情，为了解除病人的痛苦，病人主动地要求死亡。,199604124525200176,日本,2,199604,如何看待“安乐死”,80,90,77,81,83,406,B,
若不能跟一般人一样生活，至少形式上{CC3意思表示}也不可以的话，只维持生命有什么意义{CC意味}呢？,199604123523200355,韩国,2,199604,如何看待“安乐死”,65,60,66,74,62,310,C,
这可不容易。,199604124512100091,菲律宾,1,199604,如何看待“安乐死”,60,65,40,44,34,226,未参加,
这样只给亲戚{CC2亲戚人}添[C]麻烦而且她继续{CC续继}受到痛苦，最好应该早自己结束自己的生命{CC命运}。,199604123542200141,越南,2,199604,如何看待“安乐死”,70,60,32,49,0,195,未参加,
我认为“安乐死”是不可取的。,199604124623200135,南斯拉夫,2,199604,如何看待“安乐死”,65,65,63,61,49,287,C,
从我本身的经验，我觉得父母亲和子女应该多点沟通。,199610801533200013,新加坡,2,199610,如何解决“代沟”问题,90,70,75,48,43,319,C,
不然自己的态度不对，诚[C]心诚[C]意地{CC的}改变一下。P},199610550523190005,韩国,1,199610,如何解决“代沟”问题,65,70,62,73,59,315,C,
我想代沟问题是受到时代的影响而产生的。,199610550523190008,韩国,1,199610,如何解决“代沟”问题,75,70,68,77,76,355,C,
根据某一家杂志的调查来说，{CD在}家庭问题大半是从家长和孩子之间出现的，而且现在的社会变化影响[B向]着他们。,199610550523190021,韩国,1,199610,如何解决“代沟”问题,70,70,68,50,57,303,C,
第二，一起享受共同的爱[F愛]好活动。,199610550523290064,韩国,2,199610,如何解决“代沟”问题,75,65,36,59,47,269,未参加,
可是父母{CD世代}完全理解[C]子女{CD世代}也是不容易的事情{CC问[C]题}。,199610550523190071,韩国,1,199610,如何解决“代沟”问题,65,70,54,40,41,256,未参加,
我以为代沟问题的最主要的原因就是小家庭制度。,199610550523190081,韩国,1,199610,如何解决“代沟”问题,70,70,36,44,61,269,未参加,
最近“代沟”问题成{CC1浮上}了热门话题。,199610550523290084,韩国,2,199610,如何解决“代沟”问题,60,60,57,67,65,291,未参加,
所谓[F謂]代沟，是其中一方对另一方的行为[F為]或思想提出疑问{CC问号}，认[F認]为[F為]对方所做的或所想的并[F並]不应该[F該]出现[F現]。,199611543533100520,新加坡,1,199611,如何解决“代沟”问题,90,70,97,79,80,409,B,
上一辈经历[B立]过的和下一辈经历[B立]过的总是不同的。,199611543533100530,新加坡,1,199611,如何解决“代沟”问题,90,80,70,48,53,336,C,
以本人{CQ的}看法{CJ+sy认[F認]为[F為]}，对[F對]待这[F這]个[F個]问[B间[F間]]题——代沟，不应该[F該]采[F採]取逃避或者推卸责任的态[F態]度，[BC；]应该[F該]采[F採]取正面和积[F積]极[F極]的处[F處]理方法，[BC。]那就是：对[F對]老人应该多些尊重，体[F體]谅[F諒]上一辈[F輩]的艰难，奉劝{CC劝[F勸]喻}他们[F們]多参[F參]与[B于[F於]]社会[F會]活动[F動]，别把自己关[C]在家里[F裡]，这[F這]样[F樣]可令老年人身心得到健康、[BC，]缩短{CC接近}与[F與]子女的距离[F離]。,199611543501200512,中国,2,199611,如何解决“代沟”问题,90,80,81,55,92,393,B,
代沟{CJ-zxy问题}唯一的解决[F決]{CJX}{CJ-zxy方法}就是双方{CJ-zy都}让[F讓]一步，互相接近，互相承认[F認]对方，也要互相学习对方，就是了解对方。,199611543501100513,中国,1,199611,如何解决“代沟”问题,90,80,73,57,72,367,B,
心里突然有一种不祥的预感，赶紧奔出屋外。,199603533533200056,新加坡,2,199603,由“三个和尚没水喝”想到的……,90,80,71,72,94,402,B,
跟着{CD了}。,199603533533200062,新加坡,2,199603,由“三个和尚没水喝”想到的……,95,85,52,74,89,393,C,
里头加我，整{CQ个}公司就只有三个人。,199603533533200064,新加坡,2,199603,由“三个和尚没水喝”想到的……,90,80,63,70,80,378,B,
如李鹏、李兴隆、李登辉、李宁、李嘉诚[F誠]？,199603533533100106,新加坡,1,199603,由“三个和尚没水喝”想到的……,90,80,69,74,63,371,B,
后来又来了一个和尚，于是两{CQ个}人就抬水喝。,199604680519100513,马来西亚,1,199604,由“三个和尚没水喝”想到的……,85,70,63,83,91,383,C,
我看来很多人[#]这个，[BC。]所以很多生活场面感受到不顺利{CY}。{CP不管[B关]什么国家，什么人，[BC。]{CJ+zhuy人},199605104525200019,日本,2,199605,由“三个和尚没水喝”想到的……,65,60,63,56,44,271,未参加,
在实际的生活当中这种事情是常见的。,199605104525200060,日本,2,199605,由“三个和尚没水喝”想到的……,70,65,63,63,80,327,C,
如果现在你只有一个人在漂浮{CC2漂}{CQ的}船上，周围都大海{CJs}，连鱼都没有，难道[B到]你不觉得{CC2能}孤独吗？,199605104523200095,韩国,2,199605,由“三个和尚没水喝”想到的……,60,65,55,54,54,271,未参加,
从这些情况下{CJZR}，谁让给谁是最大的问题。,199605104525100252,日本,1,199605,由“三个和尚没水喝”想到的……,70,60,66,67,72,320,C,
其实我这样的女孩不好，我也知道。,199605104523200278,韩国,2,199605,由“三个和尚没水喝”想到的……,70,70,71,51,51,301,C,
第一个和尚说：“上帝不喜欢我们这样做，应该靠我们自己的努力才会得到水。,199605104540200277,印度尼西亚,2,199605,由“三个和尚没水喝”想到的……,65,65,44,33,58,249,未参加,
如果像这样的事情在我身边发生的话，我会如何处理{CC行动}呢？,199605104523200295,韩国,2,199605,由“三个和尚没水喝”想到的……,70,80,63,63,68,334,C,
由这篇短文{CJ-zhuy我}想到两点{CC1种想法}。,199605104525200314,日本,2,199605,由“三个和尚没水喝”想到的……,65,60,46,63,58,275,未参加,
最先来的和尚正经地对最晚来的和尚说[BQ：]“水不够三个人喝，按道理{CD上}说您到山下[D下]喝水，好不好？,199605104523100324,韩国,1,199605,由“三个和尚没水喝”想到的……,80,55,63,76,75,335,C,
那[C]这位和尚也明显明白，[BC、]要是他[B她]每天要[C]到山底下自己挑[B桃]水喝的话，{CJ-zhuy他}会活下去，[BC。]会生存下去。,199605104525100343,日本,1,199605,由“三个和尚没水喝”想到的……,80,70,44,49,42,275,未参加,
这[C]种心理是{CJX}虽然人情味，但还是需要人们{CJ+zy生动地}做事情时[BD，]那样[C]做。,199605104525200350,日本,2,199605,由“三个和尚没水喝”想到的……,65,55,63,70,58,293,C,
另一个和尚想起办法来，就开始挖地。,199605104525100371,日本,1,199605,由“三个和尚没水喝”想到的……,55,50,46,58,68,256,未参加,
而且我没有力量，要管{CD也}对别人来说，{CQ也}不会是帮[C]助。,199605104525200393,日本,2,199605,由“三个和尚没水喝”想到的……,60,65,58,81,77,324,C,
因此，他们的生活越来[F來]越懒[L]惰[C]{CJ+buy起来[F來]}。[BC，],199605550523190036,韩国,1,199605,由“三个和尚没水喝”想到的……,60,60,63,58,63,286,未参加,
可是问题在于怎么决定次序呢。,199605550523190038,韩国,1,199605,由“三个和尚没水喝”想到的……,60,55,21,47,42,206,未参加,
但是他们[F們]三个和尚如果每[C]一个人都{CJ-wy生活}在别的地方的话[F話]，每[C]一个人都会做自己所[C]做的工作了。,199605550523190061,韩国,1,199605,由“三个和尚没水喝”想到的……,65,70,33,56,65,275,未参加,
他可能在生活上没什么麻烦的事情，就自己平稳地过日子。,199605550523190063,韩国,1,199605,由“三个和尚没水喝”想到的……,70,60,77,54,54,300,C,
上车的时候，买票的时候都需要秩序。,199605550523190065,韩国,1,199605,由“三个和尚没水喝”想到的……,70,80,52,60,68,320,C,
为[F爲]了{CJ-sy克服}这些缺点，我们社会就离开不了[C]教育，要通过{CC从[F從]}教育培养出优秀的人生观[F覌]。[BC，],199605529529150155,泰国,1,199605,由“三个和尚没水喝”想到的……,70,65,60,15,61,257,未参加,
肯定有同学写自己的父亲或母亲是这个人，也许是某个国家的总统、[BC，]某民族英雄，甚至某流行音乐的明[B名]星。,199704123616200106,德国,2,199704,记对我影响最大的一个人,85,85,56,47,73,341,未参加,
我以为老师又会批评我。,199704124525200322,日本,2,199704,记对我影响最大的一个人,85,90,84,89,79,423,A,
就在那时，我认识了一位屠夫的孩子，他叫阿满，他长得粗壮结实，头脑却[F卻]不太灵活，表情也是傻里傻气的样子，只因胆子比我大，我就叫他[BC「]阿蛮[BC」]。,200110540540150105,印度尼西亚,1,200110,我的童年,65,85,68,51,90,349,C,
星期日或假日父亲喜欢带我们到对海的小岛[F島]游泳，所以，我们从小就学会游泳，喜欢运动，又因为我是家中的长女，没有兄长，所以性格趋向男生，比较[F較]外向，喜欢活动。[BC；],200110540540250109,印度尼西亚,2,200110,我的童年,80,85,71,70,88,388,B,
就因为这样，下午时分，我开始头疼了，先是昏沉沉，[BC；]后来身体开始微热，但我不以为然，也没告诉父母。,200110540540250111,印度尼西亚,2,200110,我的童年,70,80,58,61,83,342,C,
