错句,作文编码,国籍,性别,考试时间,作文题目,口试分数,作文分数,听力分数,阅读分数,综合分数,总分,证书
这种安排对我们社会的家庭结合力有{CD这}一种很大的帮助。,200504534533150089,新加坡,1,200504,我对男女分班的看法,70,60,70,62,55,302,C,
我不以为然。,200504534533250104,新加坡,2,200504,我对男女分班的看法,65,70,65,47,57,290,C,
现在的人，应该有着一个开放的心。,200504534533250126,新加坡,2,200504,我对男女分班的看法,70,75,67,62,73,336,C,
好动的他们也会喜欢户外活动如游泳或球类运动。,200504534533250157,新加坡,2,200504,我对男女分班的看法,80,75,76,78,79,379,B,
孩子只能{CQ在}人与人的关系[F係]{CQ中}才[B干]能[C]学会语言。,200505109525100082,日本,1,200505,父母是孩子的第一任老师,70,70,74,77,69,348,C,
经常聊[C]天儿，交换一些想法什么的。,200505109525200893,日本,2,200505,父母是孩子的第一任老师,80,75,55,65,64,330,C,
除了{CC随[F隨]了}{CJX}父母要引导{CC引渡}孩子的兴趣外，也要灌[C]輸正确[F確]的思想观[B对]念。,200505109634200961,英国,2,200505,父母是孩子的第一任老师,65,80,57,47,62,299,未参加,
所以说{CD母亲}父母的小时候的教育很重要。,200505109525201002,日本,2,200505,父母是孩子的第一任老师,65,50,64,56,64,280,未参加,
我现在也忘[C]不了那时母亲冲着我说的话。,200505109525201084,日本,2,200505,父母是孩子的第一任老师,60,70,53,56,66,290,未参加,
我从小[C]{CD时候}爱看书，我现在想这就是因为我家里有很多书，我可以随便拿一本翻一翻，有时妈妈带我去书店和我一起选择小[C]人书，这时也让我自由地选择。,200505109525201089,日本,2,200505,父母是孩子的第一任老师,60,80,73,78,76,354,C,
我是独生[B身]子，从小受到父母的关爱长大的。,200505109525101130,日本,1,200505,父母是孩子的第一任老师,85,60,60,68,78,339,C,
不过[C]，[BC、]父母{CD也}有了孩子后从孩子{CQ那里}学[C]到[C]的东[C]西也不少[C]。,200505109525201210,日本,2,200505,父母是孩子的第一任老师,80,75,73,62,69,350,B,
那么只爱孩子而什么也不提醒他们就行吗？,200505109525201357,日本,2,200505,父母是孩子的第一任老师,75,70,60,56,57,307,C,
等我有了自己的孩子，我就象我父母一样会教我的孩子做好人。,200505109637201503,白俄罗斯,2,200505,父母是孩子的第一任老师,85,75,61,47,72,332,C,
在那样的家庭里长大的孩子，他成年以后有家庭的时候，他们自己用暴力的倾向{CJy}。,200505109525201663,日本,2,200505,父母是孩子的第一任老师,40,75,54,63,72,285,未参加,
我的姐姐也有很大的个性。,200505109525101792,日本,1,200505,父母是孩子的第一任老师,65,65,52,67,74,307,C,
我也赞[C]成“父母是孩子的第一任老师”这个看法。,200505109525101851,日本,1,200505,父母是孩子的第一任老师,70,65,37,75,76,309,未参加,
父母亲也应该认识{CJ-buy到}自己是老师，不能忽略标准的形式，随便地说孩子在学校有老师，不必自己做好的模范，甚至在孩子的面前随随便便。,200505109634201925,英国,2,200505,父母是孩子的第一任老师,65,65,61,45,54,274,未参加,
我还记得我小时候有一天吃饭的时候，我一边吃饭一边看电视。,200505109525202301,日本,2,200505,父母是孩子的第一任老师,70,70,54,55,74,311,C,
所以通过[C]对话[C]好好交流，有的时候跟孩[C]子一起[C]去旅[C]游，[BC．]这样做可以互相尊重，互相理解[C]，我认为父母是孩[C]子的第一任老师。,200505109525102483,日本,1,200505,父母是孩子的第一任老师,60,65,46,45,43,242,未参加,
父亲是典型的客家人，在梅杲出生{CC出身}。[BC，],200505212540200053,印度尼西亚,2,200505,父母是孩子的第一任老师,60,65,50,49,80,287,未参加,
人类是一种有情的动物。,200505522522150023,缅甸,1,200505,最理想的结交方式,80,90,84,64,84,397,B,
很奇怪有些人一见[F見]就彼此相爱[F愛]，人们都说这是“一见[F見]钟情”。,200505522522250032,缅甸,2,200505,最理想的结交方式,50,70,41,53,48,245,未参加,
父母的兴趣爱好，思想观念，行为举止，无一{CQ不}是从幼年就开始在孩子心目中打下深深的烙印。,200505201542200069,越南,2,200505,父母是孩子的第一任老师,85,85,67,49,76,357,C,
所以父母始终需要小心一点说话，小心一点行动。,200505209922100152,美国,1,200505,父母是孩子的第一任老师,60,55,54,65,67,282,未参加,
一般[B半]父母当什么，做什么，孩子会跟着学。,200505501540200079,印度尼西亚,2,200505,父母是孩子的第一任老师,60,70,56,63,36,270,未参加,
所谓[BQ“]上梁不正[BD、]下梁歪[BQ”]，[BC、][BQ“]孩子学好三年，学坏三秒[BD”]，{CQ可见}父母对{CQ孩子}早期的成长产生重大的影响。,200505215519230112,马来西亚,2,200505,父母是孩子的第一任老师,75,95,69,57,67,357,C,
当我们小的时候，第一任教我们说话、散步、写字{CQ的}是父母，他们也让我们学哪些好，哪些不好。,200505332540200005,印度尼西亚,2,200505,父母是孩子的第一任老师,70,60,37,33,43,228,未参加,
他们所教的都是好的，为了孩子能做好人{CJ+zxy的身份}，父母{CJ+zy都}用了各种各样的办法来解决{CD的}{CJ-by问题}。,200505332540200041,印度尼西亚,2,200505,父母是孩子的第一任老师,65,60,48,39,72,267,未参加,
可是在那期间，我还是充实{CQ了}自己，学了韩语。,200509534533250007,新加坡,2,200509,一封求职信,70,75,88,62,86,370,C,
也因为{CQ与}同学们的分享而了解了更多国外的名胜及特色，[BC。]更在假期中到过各国游览。{CJ-zhuy我},200509534533250021,新加坡,2,200509,一封求职信,85,70,82,66,86,380,B,
现附上我个人简历，大学毕业证书和有关工作经验的简介。,200509534533250052,新加坡,2,200509,一封求职信,85,80,77,73,95,403,B,
所以我对中、日、印[C]的环境都非常[L]了解。,200509534533150060,新加坡,1,200509,一封求职信,75,75,79,64,75,358,B,
我今年30岁，男士，身高5尺8寸[B吋]，毕业于国立大学文学系。,200509534533150066,新加坡,1,200509,一封求职信,65,70,63,60,44,288,C,
谢谢。,200509534533150097,新加坡,1,200509,一封求职信,75,70,86,60,77,357,C,
谢谢，我等待您的好消息！,200509534533250124,新加坡,2,200509,一封求职信,65,65,68,49,77,308,C,
我善于演讲，曾经在演讲比赛中夺{CQ过}冠。,200509534533250125,新加坡,2,200509,一封求职信,55,70,79,75,75,338,C,
本人的带团范围较广，无论是亚洲的民俗习惯还是{CC到}西方的文化节庆都略知一二。,200509534533250176,新加坡,2,200509,一封求职信,75,65,82,69,73,351,B,
我一向最喜欢旅游，所以很了解作为一个旅客对旅游公司有着什么样的要求。,200509534533250178,新加坡,2,200509,一封求职信,75,70,82,75,86,377,B,
本人也是清华大学辩论员。,200509534533250190,新加坡,2,200509,一封求职信,70,70,84,62,77,351,C,
我热衷于服务大众。,200509534533250192,新加坡,2,200509,一封求职信,70,70,77,62,91,358,C,
我的地址已[B以]加在信前。,200509534533250194,新加坡,2,200509,一封求职信,65,70,73,71,84,349,C,
因此有人更喜欢{CD上}它，有人更看不起它。,200510111523200022,韩国,2,200510,我看流行歌曲,65,70,65,54,69,309,C,
他们每天每一秒钟都一直希望与他们的歌星见面，与他们在一起，并不喜欢有人说他们的坏话，甚至觉得[B的]如果那些{CJ-zxy人}{CD是}再{CC已}{CJX}不有名了，世界就末日了。,200510111540200778,印度尼西亚,2,200510,我看流行歌曲,75,75,72,69,74,355,B,
那么，听流行歌曲，怎么能让人家知道当代的追求[C]或[B惑]者[B着]要求呢？[BC。],200510111523100795,韩国,1,200510,我看流行歌曲,65,50,46,44,69,255,未参加,
喜欢什么音乐都是自己的自由。[BC、],200510111523200800,韩国,2,200510,我看流行歌曲,80,85,70,50,82,361,C,
换一句话说，如果我现在向往比较强劲的音乐、歌曲，那么新的歌曲如是摇滚之类的，我就会对它特别地感兴趣。,200510111922200867,美国,2,200510,我看流行歌曲,85,65,67,61,84,351,C,
特别是中学生和高中生。{CD一},200510111523200888,韩国,2,200510,我看流行歌曲,55,60,60,42,59,257,未参加,
那么，这是哪来的？,200510111523101054,韩国,1,200510,我看流行歌曲,60,70,63,46,57,281,未参加,
其中我是喜欢流行歌曲的人之一。,200510111523201067,韩国,2,200510,我看流行歌曲,55,45,56,38,52,223,未参加,
”在我的生活中{CD能}常见这[C]样的对话。,200510111523201093,韩国,2,200510,我看流行歌曲,75,90,63,54,59,335,C,
但是应该{CQ在}不太过分的范围内听，要不，流行歌曲是个毒药。,200510111523201255,韩国,2,200510,我看流行歌曲,70,80,70,67,74,351,B,
其实对流行歌的否定的看法{CC视刻}就是那种盲目地喜欢歌星的人引起的。,200510111523201263,韩国,2,200510,我看流行歌曲,60,60,28,40,55,225,未参加,
现在很多家长都反对孩子达到这种程度。,200510111523101346,韩国,1,200510,我看流行歌曲,70,85,53,61,67,328,C,
在韩国有很多各种各样的歌手[BQ，]每个歌手都有自己的歌迷[BQ，]“谁的歌迷多就{CJX}谁是最好的歌手”[BQ，]一般的韩国人都这么想。,200510111523101576,韩国,1,200510,我看流行歌曲,65,65,56,56,59,285,C,
第一，歌词是反映{CC反应}现实社会或反映{CC反应}大众生活{CJsd}。,200510111523201620,韩国,2,200510,我看流行歌曲,75,85,56,56,64,329,C,
我失恋的时候听悲歌，我不开心的时候听有意[B音]思的歌，当面对[L]压力的时候我听很吵的歌。,200510111523201622,韩国,2,200510,我看流行歌曲,80,75,65,56,69,336,C,
可是她喜欢流行歌曲。,200510111523201855,韩国,2,200510,我看流行歌曲,60,50,25,26,32,173,未参加,
我最近听流行歌曲，我想起来我经历{CD的}{CJX}以前的日子。,200510111523201873,韩国,2,200510,我看流行歌曲,55,55,32,46,47,215,未参加,
生育后[B很]，父母应[F應]留意自己的思想行为[F為]是否得当{CC不当[F當]}。,200510919543250005,香港地区,2,200510,父母是孩子的第一任老师,65,90,50,82,77,355,C,
我认[F認]为[F爲]，如今的流行歌曲并[F並]不是人们[F們]口中所说[F說]的“[BC「]不知所谓[F謂]”[BC」]和“[BC「]意识[F識]不良”[BC」]吧！,200510512634250001,英国,2,200510,我看流行歌曲,90,95,74,75,82,414,B,
一次一个同学买了随身听到学校听流行歌曲。,200510302523200012,韩国,2,200510,我看流行歌曲,85,90,86,79,89,425,A,
像上面的女生那样自己不想自己应该要做什么[BQ，]只听音乐。,200510302523100050,韩国,1,200510,我看流行歌曲,75,70,63,40,55,292,未参加,
那么人们为什么喜欢听流行歌曲？,200510302523100052,韩国,1,200510,我看流行歌曲,95,70,67,61,91,378,C,
特别{CJ-sy是}流行歌曲[BQ，]是每个人都很容易感受到的。,200510302523200048,韩国,2,200510,我看流行歌曲,85,70,65,56,69,336,C,
可是我不是都喜欢{CJX}什么流行歌曲。,200510302523200061,韩国,2,200510,我看流行歌曲,70,50,46,44,59,252,未参加,
他不太喜欢流行歌曲。,200510302523100079,韩国,1,200510,我看流行歌曲,65,60,60,50,55,273,未参加,
在1998年韩国有特别受欢迎的歌手，在中国也是很出名的。,200510302523100093,韩国,1,200510,我看流行歌曲,65,65,56,52,47,269,未参加,
这样的问题可能带来社会不好的影响。,200510302523200094,韩国,2,200510,我看流行歌曲,60,75,67,46,62,296,未参加,
我看[D来]，他们大部分是成年人。,200510302523100098,韩国,1,200510,我看流行歌曲,75,75,65,48,77,330,C,
现在生活中最热门的就是流行歌曲，很多人爱听这类曲子。,200510302523200107,韩国,2,200510,我看流行歌曲,75,60,77,46,82,326,未参加,
因为现在大部分家庭都[C]是独[C]生子女[C]，所[C]以经常发生一些矛盾。,200510302523200125,韩国,2,200510,我看流行歌曲,70,75,53,32,40,259,未参加,
流行歌曲有历史性。,200510302523200126,韩国,2,200510,我看流行歌曲,85,75,74,48,52,326,C,
不管{CC不仅}是{CQ在}韩国还是外国，甚至全国各地，哪儿也缺不了流行歌曲和{CC1而且也有}很多听众，但我却认为流行歌曲对于成长{CQ中}的青少年来说，没有多大的好处，反而坏处很多。,200510302523100152,韩国,1,200510,我看流行歌曲,90,70,77,54,77,361,C,
不管少年或者老年，都喜欢听流行歌曲。,200510302523100195,韩国,1,200510,我看流行歌曲,75,70,56,54,64,308,C,
对我来说，很多{CQ时间}久的歌曲比流行歌曲好听多了。,200510540540200005,印度尼西亚,2,200510,我看流行歌曲,65,80,49,48,62,292,未参加,
曲子的改变，声调轻松的、[BC，]严肃的、[BC，]或是悲哀的，都有不同的形式的表达，让我随着它的音律欣赏[BQ，]慢慢的感到惬然的闲适。,200510540540200042,印度尼西亚,2,200510,我看流行歌曲,60,65,44,40,67,259,未参加,
梭罗的教联{CD有}组织歌咏，我的先生很喜欢中国歌，所以我们也就参加了教联的歌咏队。,200510540540200071,印度尼西亚,2,200510,我看流行歌曲,65,65,46,52,69,281,未参加,
社会本身是由两种性别组成的，婚姻是社会组成的重要成分[B份]。,200505610610250011,法国,2,200505,最理想的结交方式,70,90,82,75,95,405,B,
这样大家不仅能够很容易找到话题，而且还可以寻得一个知趣相投的伴侣，何乐不为呢？,200505680519150025,马来西亚,1,200505,最理想的结交方式,70,90,75,77,86,391,B,
在小孩的眼里，父母就是世界的一切。,200509602801250002,澳大利亚,2,200509,父母是孩子的第一任老师,70,70,33,42,54,257,未参加,
这个问题我个人认[B任]为父母的确是孩子们的第一任老师。,200509602801250015,澳大利亚,2,200509,父母是孩子的第一任老师,70,65,66,63,51,301,C,
我自小就热爱体育。,200510600919225002,加拿大,2,200510,父母是孩子的第一任老师,90,95,68,74,96,421,B,
虽然我在中国，但这样的机会非常难得的{CJsd}。,200104124525200054,日本,2,200104,一封写给父母的信,60,60,44,42,65,253,未参加,
我最喜欢的季节是春天。,200104124525200058,日本,2,200104,一封写给父母的信,70,75,38,37,45,254,未参加,
身体还好吗？,200104124523100172,韩国,1,200104,一封写给父母的信,70,60,38,49,54,256,未参加,
注意健[B建]康，再见！,200104124523200226,韩国,2,200104,一封写给父母的信,70,70,52,35,49,264,未参加,
天安门广场是世界最大{CJ-zxy的广场}之一。,200104124540100249,印度尼西亚,1,200104,一封写给父母的信,70,75,49,44,65,292,未参加,
”我在中国的生活很好。,200104124523200329,韩国,2,200104,一封写给父母的信,70,55,38,39,56,242,未参加,
但是，我家不太富有，还有{CC2更}{CJ-zhuy我}不敢[B管]向我妈说我{CJ+zy要}想做的事情{CJ-zxy的原因}是：[BC，]当时是一九九七{CC7}年，就是{CC说}亚洲金融危[Pwēi]机时期。,200104124523100332,韩国,1,200104,一封写给父母的信,75,55,30,49,47,241,未参加,
这里舒适、干净，请你们不要担心。,200104124523200366,韩国,2,200104,一封写给父母的信,70,90,66,77,81,377,C,
我真的想{CJ-zy和你们}见面。,200104124523200428,韩国,2,200104,一封写给父母的信,70,75,33,37,31,235,未参加,
因为南方北方的寺庙风格真的不一样。,200104124525200438,日本,2,200104,一封写给父母的信,65,90,71,54,56,327,C,
2001415儿子×××,200104124523100457,韩国,1,200104,一封写给父母的信,70,85,49,61,51,308,C,
我在日本的时候，{CQ在}{CJ+sy有}一家服装店做过{CC了}推销员，那时，我对服装根本不懂{CC1摸门}。,199200003525200005,日本,2,199200,一封求职信,,,0,0,0,0,未参加,
我看了贵公司的招聘启事。,199200003525200012,日本,2,199200,一封求职信,,,0,0,0,0,未参加,
我认为自己是个很能干的人。,199200205525200017,日本,2,199200,一封求职信,,,0,0,0,0,未参加,
从这点来说，我觉得对您公司{CQ来说}我就是很有用，而且[L]是很有利{CJsd}。,199200008525100003,日本,1,199200,一封求职信,,,0,0,0,0,未参加,
因为那家公[B工]司的体制[B质]非常落后，不让年轻人做重要的事[C]情，{WWJ},199200008525100009,日本,1,199200,一封求职信,,,0,0,0,0,未参加,
虽然得了十分痛苦的不治之病，到自然死为止，不可能放弃生命的尊[C]严性和人伦[B论]道德。,199604123523100236,韩国,1,199604,如何看待“安乐死”,70,60,77,61,67,319,C,
那时[C]候，她的人生中有两[C]种路。,199604123523200331,韩国,2,199604,如何看待“安乐死”,55,60,66,54,26,242,未参加,
白天难以持续{CC持继}，夜里难以睡眠，天天衰弱而且还要忍受这种痛苦，[BC、]等到真正死去的那一天，[BC、]他肯定宁愿早日死去，摆脱痛苦而得到安乐。,199604123540200319,印度尼西亚,2,199604,如何看待“安乐死”,70,70,63,69,70,328,C,
如果他希望继续治疗的话，那应该{CJX}就继续治疗。[BC.],199604123525100204,日本,1,199604,如何看待“安乐死”,60,70,42,49,49,254,未参加,
中国俗话中“人命在天”就是人的生命是不能掌握在{CC3管理}一个人的手里的意思[BQ，]东方国家的思想中人的生命是一种神奇和神秘的东西{CC思想}。[BQ.],199604123523100246,韩国,1,199604,如何看待“安乐死”,60,60,42,49,34,227,未参加,
但是更重要的是“怎样生活”这样的问题。,199604123523200351,韩国,2,199604,如何看待“安乐死”,80,65,71,76,70,350,B,
大家想想看，[BC、]如果某一个国家对“安乐死”制定这[C]种法律规定：“病人{CC他人}得了不治之症十分痛苦，在这种情况下，病人{CC他人}家族在病人{CC他人}同意的情况下，可采取{CC2取}‘安乐死’。,199604124525100075,日本,1,199604,如何看待“安乐死”,80,55,66,54,67,308,C,
时间延长的话，现在不治之症也有了新治[C]疗{CJX}的[C]办法。,199604123523200146,韩国,2,199604,如何看待“安乐死”,70,55,50,61,34,253,未参加,
家庭的支持对任何一个人都{CC也}很重要，所以试[F試]想想，如果可以避免代沟的出现，那么多[C]好啊{CC呢}！,199610802543200020,香港地区,2,199610,如何解决“代沟”问题,90,85,65,46,63,346,C,
第二，到了星期天，父母跟子女一起到公园去玩儿。,199610550523190012,韩国,1,199610,如何解决“代沟”问题,80,70,52,46,49,287,未参加,
这样的代沟{CJ-zxy的产生}可能是我们长大的生活环[B坏]境[C]不同[C]的原因吧[B把]。,199610550523190038,韩国,1,199610,如何解决“代沟”问题,65,50,75,34,61,266,未参加,
目前两代[C]人之间[B门]有个问题。,199610550523190043,韩国,1,199610,如何解决“代沟”问题,70,65,73,40,57,291,未参加,
但另一方面，一些学生们确实不足{CJX}保护或者维护自身的能力。,199610550523290051,韩国,2,199610,如何解决“代沟”问题,80,75,52,57,69,324,C,
要是互相不知道怎么了解[C]，就谈到那儿[F兒]。,199610550523290064,韩国,2,199610,如何解决“代沟”问题,75,65,36,59,47,269,未参加,
在传统时[F時]代[C]的家庭制度里，子女{CD是}在父母的管制下唯唯诺诺。,199610550523290073,韩国,2,199610,如何解决“代沟”问题,70,70,68,59,47,302,C,
还有传媒也要做{CC1担当}一些工作，就是播出各种节目来帮助两者了解双方的立场。,199610550523290101,韩国,2,199610,如何解决“代沟”问题,75,80,73,75,76,370,B,
如果他觉得{CC2想}工作是最重要的，就不能奢望{CC2想}孩子们会{CC1应该}听他的话{CC2说}；[BC。]如果他觉得{CC2想}家庭比工作重要，他应该一个星期之中最少两天早一点儿回家。,199611543525100531,日本,1,199611,如何解决“代沟”问题,65,60,44,48,55,255,未参加,
但是在街道与祖屋之间的公共场所却无人问津，垃圾满地。,199603533501200026,中国,2,199603,由“三个和尚没水喝”想到的……,90,85,91,79,89,431,A,
传说古时候，在一座高山上的一座庙里，有一个和尚，他每天都要到山底下自己挑水喝，后来又来了一个和尚，于是两个人就抬水喝。,199603533533100047,新加坡,1,199603,由“三个和尚没水喝”想到的……,75,55,38,58,63,274,未参加,
我妈妈是大媳妇而且{CC2而}儿女多，自然很多事务都无法全面照料妥当，其他的媳妇离娘家{CC产婆家}很近，都找机会{CC3乘机}借故纷纷回娘家小住。,199603533533200082,新加坡,2,199603,由“三个和尚没水喝”想到的……,85,85,66,60,72,363,C,
大家都在等待{CD彼此}，希望对方先采取行动。,199603533533100105,新加坡,1,199603,由“三个和尚没水喝”想到的……,90,85,83,79,75,409,A,
那三位和尚的自私心理，也使他们一再等待。,199603533533200108,新加坡,2,199603,由“三个和尚没水喝”想到的……,70,70,85,65,84,362,C,
因此当我和其他三人同做一物时总是懒了点[BQ。],199604680519100521,马来西亚,1,199604,由“三个和尚没水喝”想到的……,80,60,63,58,84,332,C,
太简[B间]单了。,199605104512100025,菲律宾,1,199605,由“三个和尚没水喝”想到的……,55,50,58,47,46,235,未参加,
又或者发生事情了，各领导推卸责任，最后事情没个了结。,199605104533200022,新加坡,2,199605,由“三个和尚没水喝”想到的……,90,95,88,56,87,414,B,
我说的是一件很常见的事，容易体会到的事情。,199605104523200090,韩国,2,199605,由“三个和尚没水喝”想到的……,60,65,80,63,61,312,C,
后来又来了第三个和尚，大家都希望别人去山下抬水，于是，人多了，反而没有水喝了。,199605104523200098,韩国,2,199605,由“三个和尚没水喝”想到的……,65,45,71,56,54,270,未参加,
”第二和尚勉强地同意{CQ了}。,199605104922100099,美国,1,199605,由“三个和尚没水喝”想到的……,80,55,49,40,46,256,未参加,
后来又{CC还}有一个{CJ-zxy和尚}来了。,199605104523200159,韩国,2,199605,由“三个和尚没水喝”想到的……,65,65,55,54,65,288,C,
那样的话，不仅{CQ能}得到{CC取得}水而且能得到{CC取得}别的东西。,199605104523200159,韩国,2,199605,由“三个和尚没水喝”想到的……,65,65,55,54,65,288,C,
耶苏看到她，知道她心里很不安[BQ，]就跟她说：“我能给你活水喝！,199605104801200167,澳大利亚,2,199605,由“三个和尚没水喝”想到的……,90,70,63,51,61,328,C,
古时候，有一个和尚，他在一座高山上的一座庙里。,199605104523200178,韩国,2,199605,由“三个和尚没水喝”想到的……,65,55,60,45,46,253,未参加,
后来又来了第三个和尚。,199605104525200230,日本,2,199605,由“三个和尚没水喝”想到的……,60,55,46,70,75,287,未参加,
传说古时候，在一座高山上的一座庙里，有一个和尚，他每天都要到山底下自己挑水喝，后来又来了一个和尚，于是两个人就抬水喝。,199605104540200277,印度尼西亚,2,199605,由“三个和尚没水喝”想到的……,65,65,44,33,58,249,未参加,
我们社会也一样。,199605104523200307,韩国,2,199605,由“三个和尚没水喝”想到的……,55,50,46,47,63,240,未参加,
在一座高山上的一座庙里，有三个和尚，大家都希望别人去山下抬水，后来，没有水喝了。,199605104523200308,韩国,2,199605,由“三个和尚没水喝”想到的……,70,70,49,54,61,292,C,
我们学生时候和将社会活#时候一定产生{CC愣到}依靠别人的思想和想法[BQ，]我们一定协[F協]助团结那么更容易地{CC的}解决我们的问题[B是][BQ。]如果[B过]三个和尚制定{CC2制}次序每天[B矢]一个和尚挑水的话[BQ，]他们一定省{CJ+dy他们的}力百分之二，但享有以前一样的生活。[BC，],199605104523100331,韩国,1,199605,由“三个和尚没水喝”想到的……,60,60,63,54,37,256,未参加,
我认[B让]为现在我们非常缺乏这样的公共意识。,199605104525100332,日本,1,199605,由“三个和尚没水喝”想到的……,75,65,66,70,70,333,C,
第三，在[C]社会上，有时候需要规定。,199605104525200364,日本,2,199605,由“三个和尚没水喝”想到的……,70,70,69,54,54,305,C,
如果三个和尚按照我所想的想法来行动的话[F話]，他们肯定不{CQ会}走到{CC2处[F處]}没水可喝的地步了。,199605550523190061,韩国,1,199605,由“三个和尚没水喝”想到的……,65,70,33,56,65,275,未参加,
当然[BQ，]他会说一口流利的潮州话，[BC。]会说一点普通话。,199704123529200041,泰国,2,199704,记对我影响最大的一个人,80,90,62,56,62,345,C,
我喜欢上学的日子，因为学校里教师和同学{CJ-sy相处得}都很融洽。,200110540540250082,印度尼西亚,2,200110,我的童年,75,85,74,47,92,366,C,
本人除了有符合贵公司的要求的学历程度外，而且也通晓英语、日语、泰语、巫语。,199312533533200001,新加坡,2,199312,一封求职信,90,95,57,54,62,357,C,
我相信这能使我对导游一职胜任有余。,199312533533200026,新加坡,2,199312,一封求职信,90,80,74,81,100,420,B,
