错句,作文编码,国籍,性别,考试时间,作文题目,口试分数,作文分数,听力分数,阅读分数,综合分数,总分,证书
理想的伴侣是从生活中来的，是从生活细节中培养的，只有彼此了解、迁就、礼让、爱护[F護]才能建立一个美满的家庭，一切幸福的来源在于爱、在于牺牲。[BC，],200410534533150013,新加坡,1,200410,最理想的结交方式,70,90,66,49,63,331,C,
这一句话虽偏袒于女性，但最基本的含义{CC意念}还是警惕年轻男女在结交异性朋友方面要小心谨慎，以防落入婚姻的陷阱，更要防止{CC4更防}重演家庭的悲剧。,200410534533150017,新加坡,1,200410,最理想的结交方式,85,90,69,70,96,406,B,
让他们自由地在工作、生活中去慢慢地互相了解对方，[BC；]逐渐相爱，对对方的言谈举止、思想、爱好有深一步的了解后，自己才能决定对方是不是{CJ-zhuy自己}所寻找的伴侣，对方的条件是不是符[B否]合自己的要求。,200410534533250061,新加坡,2,200410,最理想的结交方式,90,95,66,72,96,417,B,
常言道：“[BC《]婚姻是爱情的坟[B愤]墓[B暮]”[BC》]。,200410534533250063,新加坡,2,200410,最理想的结交方式,85,85,60,47,82,354,C,
认识的时间越久，夫妻间的容忍和适应就越没有大问题。,200410534533250067,新加坡,2,200410,最理想的结交方式,95,95,58,67,99,413,B,
说到女的，她则有澳洲大学学士学历，月入千元，家境富裕[B欲]，又是柔道高手。,200410534533250090,新加坡,2,200410,最理想的结交方式,80,85,74,47,72,352,C,
当然我也不排除其中{CC个中}有例外的情况，可是那也得经过在一起生活后才能把感情培养得更为深厚{CC深切}呀！,200410534533150105,新加坡,1,200410,最理想的结交方式,95,95,85,85,99,458,A,
如果思想上不太能够沟通，双方就停留在朋友的关系上。,200410534533150115,新加坡,1,200410,最理想的结交方式,95,90,77,83,96,440,A,
每年人们因为抽烟而患上各种疾病，花了成千上万的金钱[F錢]来治病，真是得不偿[F償]失。,200405680519150001,马来西亚,1,200405,吸烟对个人健康和公众利益的影响,60,95,52,74,68,339,未参加,
鉴[C]于吸烟是个人的习惯，也不能明文规定禁烟买卖，因此，许多国家不惜任何代价，通过地方政府，推出在公共场合禁止吸烟[F煙]的长期运动。,200405680519150004,马来西亚,1,200405,吸烟对个人健康和公众利益的影响,80,90,55,63,87,370,C,
这是由于在不久的将来，若学习毕业了，都各奔东西。,200504534533150039,新加坡,1,200504,我对男女分班的看法,70,70,73,45,62,308,C,
打好了基础以后，在求知识的过程{CQ中}就更为容易了。,200504534533250056,新加坡,2,200504,我对男女分班的看法,75,85,62,60,77,352,C,
现在社会风气不同了，如果把现在的学生放在女儿国里，她们有可能都变成同性恋，但这还不算最糟糕的呢。,200504534533250123,新加坡,2,200504,我对男女分班的看法,75,75,78,82,73,373,B,
我认为，孩子的父母肯定不会要自己的宝贝儿子或女儿在成人时期会{CJX}也有同样的现象[B像]吧！,200504534533250135,新加坡,2,200504,我对男女分班的看法,60,75,51,60,66,298,未参加,
他们从小便只和女生相处，一直都没有机会与异[F異]性相处。[BC.],200504534533250181,新加坡,2,200504,我对男女分班的看法,65,70,76,62,73,332,C,
而就是因为这样，男女更应该在同班、同校里读书。,200504534533250182,新加坡,2,200504,我对男女分班的看法,65,65,59,69,59,301,C,
总的来说，父母是孩子的第一任老师反映[B央]的是孩子上学之前自然{WWJ},200505109801100147,澳大利亚,1,200505,父母是孩子的第一任老师,65,50,42,42,62,242,未参加,
第一，在人生中父母就是第一个认识的人。,200505109525100621,日本,1,200505,父母是孩子的第一任老师,60,50,58,67,64,279,未参加,
第一；从小到现在为[C]止我一直尊敬父母[C]。,200505109525200600,日本,2,200505,父母是孩子的第一任老师,65,75,58,56,74,315,C,
{CQ在}世界上出生的时候，所有的人都新的{CJs}。,200505109525200833,日本,2,200505,父母是孩子的第一任老师,60,55,36,47,38,217,未参加,
但我父母比较重视的是不许给{CC对}别人添[C]麻烦这一点。,200505109525200907,日本,2,200505,父母是孩子的第一任老师,80,90,87,58,79,389,B,
如果父母不太理想的话，孩子可以找别的老师，能够寻求指导。[BC．],200505109525200920,日本,2,200505,父母是孩子的第一任老师,65,55,69,51,66,288,未参加,
因此父母的责任非常大，他们在教育孩子中要注意自己的话、行为等等。,200505109623200924,南斯拉夫,2,200505,父母是孩子的第一任老师,70,65,52,47,59,279,未参加,
还有一次我取得了99分的时候，我爸爸说“99分跟80分差不多，100分跟99分的差别{CC2差}却很大”。,200505109525201084,日本,2,200505,父母是孩子的第一任老师,60,70,53,56,66,290,未参加,
长大后我的性格是消极，安静，爱听别人的[C]话，少有自己想法的了。,200505109525101130,日本,1,200505,父母是孩子的第一任老师,85,60,60,68,78,339,C,
最大的负担就是怎么样教育孩子，当然每个父母很希望自己的孩子出人头地{CC望子成龙}，[BC。]所以从小给孩子好的教育。,200505109540101118,印度尼西亚,1,200505,父母是孩子的第一任老师,70,65,55,35,62,273,未参加,
这里我们当然选中国大陆[F陸]市内的生活。,200505109616101113,德国,1,200505,父母是孩子的第一任老师,70,50,53,43,57,256,未参加,
这样看来对儿童时期的父母{CJX}的教育是特别重要，上幼[C]儿园[B圆]以前孩子们跟父母常常在一起生活，孩子们都看到父母做事情{CD时}怎么做{CD呢}。[BC？],200505109510101332,朝鲜,1,200505,父母是孩子的第一任老师,75,65,57,51,48,283,未参加,
现在的人们往往只是看挣[B持]钱是最重要，因此有不少的家庭里出现了错误[B吴]的观点，现在的大多数父母认为，只要在经济方面没有问题那么孩子的成[B曾]长就不会有问题。,200505109540101396,印度尼西亚,1,200505,父母是孩子的第一任老师,70,90,64,35,71,323,未参加,
小的时候，{CQ对}孩子最重要的两个人无疑是他的父母。,200505109821101858,新西兰,1,200505,父母是孩子的第一任老师,80,55,63,47,63,294,未参加,
除这些间接教育方式以外，还有直接给孩子{CQ的}教育方式。,200505109821101858,新西兰,1,200505,父母是孩子的第一任老师,80,55,63,47,63,294,未参加,
所以我现在感谢父母。,200505109525201979,日本,2,200505,父母是孩子的第一任老师,60,65,50,49,61,268,未参加,
孩子天天都{CQ和}父母生活在一起，不知不觉受到父母的教育、思想观念、对事物所保持的态度和兴趣爱好{CJ-zxy的影响}。,200505109520202058,蒙古国,2,200505,父母是孩子的第一任老师,65,65,48,49,69,280,未参加,
因为我觉得教育[C]不是只指学校教[C]育的，而且{CC宁愿}家庭教育是最重要的。,200505109525102151,日本,1,200505,父母是孩子的第一任老师,60,45,39,65,58,245,未参加,
父母所说的话不是都对的，但大部分是{CJX}都很有道理的。,200505109525202389,日本,2,200505,父母是孩子的第一任老师,55,65,73,45,50,270,未参加,
首先，从语言方面也好，生活习惯也好，孩子都向父母学习。,200505109525202443,日本,2,200505,父母是孩子的第一任老师,70,65,56,61,61,299,C,
我的父母并不是严格，可是他们经常说：[BC，]“你该对自己的言语{CC发言}与行动负责任。,200505109525202452,日本,2,200505,父母是孩子的第一任老师,65,65,48,51,67,280,未参加,
但[BD，]随[F隨]着[B著]时[F時]代的进步，科技的发达，人们的思想也不那么保守了，随[F隨]意吧！,200505522522250001,缅甸,2,200505,最理想的结交方式,80,90,36,51,66,318,未参加,
这是{CC些}因为父母对孩子的爱心不多。,200505201540100303,印度尼西亚,1,200505,父母是孩子的第一任老师,60,60,48,37,45,232,未参加,
因此，作为父母，应该时时刻刻为孩子着想。,200505201542200068,越南,2,200505,父母是孩子的第一任老师,95,75,67,51,89,372,C,
所以父母始终需要小心一点说话，小心一点行动。,200505209922100152,美国,1,200505,父母是孩子的第一任老师,60,55,54,65,67,282,未参加,
正如我国传统儒家思想所言：子不养，父之过。,200505219519100018,马来西亚,1,200505,父母是孩子的第一任老师,75,85,73,67,91,384,B,
由于受到我{CD的}妈妈{CD的}工作{CQ的}影响，我和我的两个妹妹在大学时的专业全部都是会计[B什]。,200505501540200079,印度尼西亚,2,200505,父母是孩子的第一任老师,60,70,56,63,36,270,未参加,
为什么呢？,200505332540200030,印度尼西亚,2,200505,父母是孩子的第一任老师,60,65,50,45,52,255,未参加,
但是到底[B低]有什么不好的影响呢？,200509105922200009,美国,2,200509,吸烟对个人健康和公众利益的影响,80,65,71,63,65,332,C,
父母在孩子生活中占[Y]着最重要的部分[B份]。,200509801801250001,澳大利亚,2,200509,父母是孩子的第一任老师,70,70,74,67,72,341,C,
×××二00五年九月十七日,200509534533150015,新加坡,1,200509,一封求职信,65,65,77,53,93,337,C,
先此谢谢！,200509534519250027,马来西亚,2,200509,一封求职信,70,80,86,62,82,370,C,
我在旅游业已经服务了六年，如今在顶尖旅游公司担任经理。,200509534533150069,新加坡,1,200509,一封求职信,65,75,77,64,82,350,C,
承[B沉]蒙应允，则感激不尽。,200509534533150097,新加坡,1,200509,一封求职信,75,70,86,60,77,357,C,
曾经获得公司颁发的诚实奖状一张、表现奖章二枚、获得上司的表扬。,200509534533250092,新加坡,2,200509,一封求职信,65,70,63,42,70,296,C,
但近日公司因被外国公司欠下许多债务而只好把{CD我}薪金太高的职务裁掉{CJbei}，所以{CQ只好}另谋高就。,200509534533250093,新加坡,2,200509,一封求职信,65,75,43,42,61,273,未参加,
我持有[C]一张十一级的高等汉语水平文凭。,200509534533250130,新加坡,2,200509,一封求职信,60,70,77,69,82,343,C,
谢谢。,200509534533250175,新加坡,2,200509,一封求职信,75,70,77,73,95,379,B,
我已在后边附上自己的大学文凭以及一些个人资料。,200509534533250195,新加坡,2,200509,一封求职信,0,75,75,51,75,272,未参加,
很伤心的时候，听流行歌曲可以给我们带来安慰，很高兴的时候，可以使我们更加快乐。,200510111523200423,韩国,2,200510,我看流行歌曲,75,85,74,77,84,388,B,
我只是喜欢听音乐。,200510111523100433,韩国,1,200510,我看流行歌曲,65,55,42,26,42,212,未参加,
我刚才说了大众歌手，比如韩国大部分歌手是大众歌手，他们出{CD来}光盘以后普通的市民都喜欢他们的歌曲，但他们不是真正的歌手，我想谁是真正的歌手呢？,200510111523100801,韩国,1,200510,我看流行歌曲,60,65,42,24,37,211,未参加,
放大声的歌曲时，自我感觉良好。,200510111523200826,韩国,2,200510,我看流行歌曲,75,80,72,52,82,352,C,
我也常常听流行歌曲，所以我喜欢流行歌曲。,200510111523200844,韩国,2,200510,我看流行歌曲,60,70,51,50,52,268,未参加,
其实我对流行歌曲没有什么特别大的感觉。,200510111523100863,韩国,1,200510,我看流行歌曲,70,65,53,36,57,267,未参加,
我认为小的时候谁也还没形成{CC成立}价[B介]值观，[BC、]还不懂事，可以狂热地喜欢歌手。,200510111523200870,韩国,2,200510,我看流行歌曲,65,65,63,52,52,281,C,
有的说爱情很美好；有的说爱情太难；有的说别相信爱情；甚至有的说跟人家上床之类的黄色内容[C]。,200510111523201036,韩国,2,200510,我看流行歌曲,90,90,70,75,89,412,B,
有人说过；“玫瑰花不是玫瑰的全部，玫瑰还有叶、枝根等，这些比花还重要。,200510111523101041,韩国,1,200510,我看流行歌曲,60,75,86,75,62,344,C,
流行歌曲有什么理由怎么会吸引那么多的人{CC人家}呢{CJZR}？,200510111523201066,韩国,2,200510,我看流行歌曲,60,65,49,42,52,251,未参加,
谢谢大家[C]{CD到}现在听我的看法。,200510111523101101,韩国,1,200510,我看流行歌曲,55,65,51,28,47,228,未参加,
青少年需要管教的时期{CJs}，总是听这些的话，父母、[BC，]老师说什么的时候会产生反感。,200510111523201257,韩国,2,200510,我看流行歌曲,70,65,60,34,69,284,未参加,
当你心情低落时，可尝试播放一些抒情歌曲，让自己大哭一场，然后再把不愉快的事给忘了。,200510111533201792,新加坡,2,200510,我看流行歌曲,95,95,70,73,94,426,B,
其实高中生的话，他们的情况跟成人不一样，高中生能喝酒吗？,200510111523201859,韩国,2,200510,我看流行歌曲,65,65,44,42,67,267,未参加,
所以，爸妈[F媽]的生活环[F環]境对[F對]孩子{CQ的}性格有一定的影响[F響]。,200510919919105302,加拿大,1,200510,父母是孩子的第一任老师,80,90,74,76,91,406,B,
因此说[F說]，父母对[F對]我就如第一任老师[F師]。,200510919919105304,加拿大,1,200510,父母是孩子的第一任老师,75,95,53,79,96,392,C,
我觉得不喜欢流行歌曲的人一大部分是老人。,200510302523100013,韩国,1,200510,我看流行歌曲,65,70,65,54,69,309,C,
比如说韩国2002年界世界[L]杯[B环]的时候我们一般都唱的是为韩国足球选手的{CJX}加油歌。,200510302523200022,韩国,2,200510,我看流行歌曲,70,75,65,44,72,315,C,
流行歌曲是指歌星唱的歌曲叫做流行歌曲{CJZR}。[BC，],200510302523100052,韩国,1,200510,我看流行歌曲,95,70,67,61,91,378,C,
当你悲哀生气的时候，听那些快歌、[BC，]欢快的歌{CC快}来改善{CC提高}自己的心态。,200510302523100090,韩国,1,200510,我看流行歌曲,60,65,67,67,72,314,C,
确[B却]实，现在在Rock这一类歌曲中有许多关于信仰的内容。,200510302523100152,韩国,1,200510,我看流行歌曲,90,70,77,54,77,361,C,
有的唱片公司用长地帅[B师]，长得美的新歌星，推{CJ-by之}上市。,200510529529251012,泰国,2,200510,我看流行歌曲,75,65,49,48,57,281,未参加,
这两个理由是古典音乐和现代音乐的{CJ+dy大大}差别。,200510529529151026,泰国,1,200510,我看流行歌曲,65,70,70,52,79,322,C,
有些人喜欢听音乐，肯定是因为那个歌曲很好听，所以他们很喜欢，但是有些人只喜欢歌星就认为不好听的音乐也{CC1成为}好听。,200510540540200004,印度尼西亚,2,200510,我看流行歌曲,70,60,39,30,42,226,未参加,
说实话，我一点也不喜欢流行歌曲。,200510540540200045,印度尼西亚,2,200510,我看流行歌曲,70,80,65,50,82,337,C,
因为它就是我的精神支[B之]柱、精神武器了。,200510540540200062,印度尼西亚,2,200510,我看流行歌曲,70,75,60,44,84,322,C,
这则信息很真实地道出了男女在感情路上相识、结交的甜酸苦辣。,200505680519250005,马来西亚,2,200505,最理想的结交方式,75,95,82,75,84,405,B,
时间不早了，我该睡觉了{CC吧}，以后我再给你们写信吧。,200104124523200001,韩国,2,200104,一封写给父母的信,65,75,44,54,56,281,未参加,
时间过得真快，我来中国已经两年多了。,200104124542100145,越南,1,200104,一封写给父母的信,65,90,55,42,65,308,未参加,
特别是我的周围有很多中国朋友，[BC。]他们对我{CQ的}帮助很大，比如，课堂上我有什么问题，我一个人解决{CC决解}不了、[BC，]不会做、[BC，]不明白的时候，他们{CJ-zy会}很热情地{CC的}告诉我，我听了他们的话以后，{CJ+zhuy我}{CJ-zy很}容易明白，我的问题都解决{CC决解}了。,200104124523200252,韩国,2,200104,一封写给父母的信,60,65,58,18,54,238,未参加,
好久没见{CQ了}，你们身体好吗？,200104124525200267,日本,2,200104,一封写给父母的信,65,70,58,61,67,307,C,
你[B您]们休息一段时间吧！,200104124523200284,韩国,2,200104,一封写给父母的信,65,60,25,28,45,206,未参加,
你的女儿，××[BD。],200104124523200304,韩国,2,200104,一封写给父母的信,70,70,55,49,54,286,未参加,
我生活在离你们很远的北京，但无时无[B不]刻都想着你们。,200104124523200308,韩国,2,200104,一封写给父母的信,65,70,77,58,81,337,C,
妈妈这次{CJ-zy就}到这儿吧！,200104124523200312,韩国,2,200104,一封写给父母的信,70,70,74,63,58,323,C,
面对困难，我有时{CQ会}灰[B恢]心，但一想起你们，想起你们对我的爱，[BC、]对我的关怀，[BC、]我就有了克服困难的力量，我很感谢你们。,200104124542200356,越南,2,200104,一封写给父母的信,90,75,77,58,88,382,B,
另外，这儿的保安{CQ也}很严格。,200104124523100415,韩国,1,200104,一封写给父母的信,65,70,41,30,54,246,未参加,
我这{CQ个}暑[B署]假会让他来印尼旅游的，我一定要把他介绍给你们！,200104124540200411,印度尼西亚,2,200104,一封写给父母的信,80,85,66,58,76,359,C,
这次我{CQ就}写到这儿吧。,200104124525200429,日本,2,200104,一封写给父母的信,70,90,58,68,61,340,C,
虽然在这里也有樱花树，可是……[BC…]还是对我来说不一样。,200104124525200444,日本,2,200104,一封写给父母的信,70,65,66,54,63,304,C,
我们就自己当模特。{CP因为我很喜欢当模特[BQ，]而自己的条件较好（我身高1.81米，相貌端正）所以以后上大学时临时也继续当模特（在维也纳有名的服装公司[BD。][BQ）]P},199200003801200010,澳大利亚,2,199200,一封求职信,,,0,0,0,0,未参加,
我想在贵公司做{CC作}{CD一些}“服装设计”这一类{CQ的}工作。,199200204525200019,日本,2,199200,一封求职信,,,0,0,0,0,未参加,
姓名{CC名字}[BQ：]×××，1970年10月1日出生，身高1.82米[BQ，]体重65公斤，1988年高中毕业后在广告关系的公司里工作{CC作工}。[BC，],199200204525100043,日本,1,199200,一封求职信,,,0,0,0,0,未参加,
现在我讲英语讲得比较流利{CC流理}。,199200008616200021,德国,2,199200,一封求职信,,,0,0,0,0,未参加,
我觉得“安乐死”应该{CJ+sy看待}肯定的。,199604124523200045,韩国,2,199604,如何看待“安乐死”,70,60,66,66,47,293,C,
其实给{CC对}病人、家属都带来了极大的痛苦和困难，[BC。]尤其是给{CC对}家属。,199604124523200045,韩国,2,199604,如何看待“安乐死”,70,60,66,66,47,293,C,
我这么说因为人们都有选择的权利{CC权力}，所以每个人按自己的想法去选择死还是活。,199604124525200059,日本,2,199604,如何看待“安乐死”,70,65,71,74,67,332,C,
最重要的是，他们不是不能控制自己的青少年，[BC。]而是{CC就是}有自己的一定的思考来决定自己的命运{CC运命}的完整体。,199604124523200153,韩国,2,199604,如何看待“安乐死”,70,65,69,74,42,305,C,
“安乐死”这个词[C]，听起来让人家感到一种很可惜的感觉{CJZR}。,199604123523200167,韩国,2,199604,如何看待“安乐死”,60,60,42,39,49,232,未参加,
不能摆脱债务。,199604123525100084,日本,1,199604,如何看待“安乐死”,60,60,42,52,42,238,未参加,
要是妻子不要求死去的时候太夫把她杀死的话，丈夫应该受到惩罚。,199604124525200176,日本,2,199604,如何看待“安乐死”,80,90,77,81,83,406,B,
人生毕竟不会过得完善。,199604123540200276,印度尼西亚,2,199604,如何看待“安乐死”,70,55,71,61,67,307,C,
我认为“安乐死”是不可取的。,199604124623200135,南斯拉夫,2,199604,如何看待“安乐死”,65,65,63,61,49,287,C,
觉得他们教得没[B每]错。,199610801533200013,新加坡,2,199610,如何解决“代沟”问题,90,70,75,48,43,319,C,
家庭的支持对任何一个人都{CC也}很重要，所以试[F試]想想，如果可以避免代沟的出现，那么多[C]好啊{CC呢}！,199610802543200020,香港地区,2,199610,如何解决“代沟”问题,90,85,65,46,63,346,C,
其次，双方应力求找出他们的分歧点[Y奌]，求同存异。,199610512501150007,中国,1,199610,如何解决“代沟”问题,95,90,78,81,94,437,A,
我们爸爸时代，生长在很困难的环[B坏]境[C][BQ，]可是我们时代托我们爸爸[L]时代{CQ的福}，生活在比较好的环[B坏]境[C]了。,199610550523190038,韩国,1,199610,如何解决“代沟”问题,65,50,75,34,61,266,未参加,
怎样解[C]决代沟{CQ问题}呢？,199610550523190092,韩国,1,199610,如何解决“代沟”问题,60,65,54,55,61,278,未参加,
解决代沟{CJ-zxy问题}必须从了解{CC明白}对方思维着手，设身处地{CC切身处地}从{CC用}对方的角度去思考问题{CC事物}，理解{CC认[F認]识}[C]对方行为[F為]的基本意思。,199611543533100520,新加坡,1,199611,如何解决“代沟”问题,90,70,97,79,80,409,B,
被邀请[F請]{CQ的}一方也要开阔心[L]胸去了解对方的生活，这[F這]样[F樣]有助{CQ于}理解对方的生活态[F態]度，从[F從]而由理解走向关[C]怀[F懷]对方。,199611543501100505,中国,1,199611,如何解决“代沟”问题,90,85,75,69,78,394,B,
现今的社会，分工细，大家为了一个大整体，做出自己的贡献，每个人都象一颗螺丝[F絲]钉一般，做[B作]好自己的本分，谁做不好就会影响整体的表现。,199603533533200002,新加坡,2,199603,由“三个和尚没水喝”想到的……,90,85,85,65,84,406,B,
但为什么会“没水喝”呢？,199603533533100043,新加坡,1,199603,由“三个和尚没水喝”想到的……,85,70,74,74,91,385,B,
我觉得这则传说实实在在地表现了人类{CQ的}惰性{CJ+zxy的坏习惯}。,199603533533100043,新加坡,1,199603,由“三个和尚没水喝”想到的……,85,70,74,74,91,385,B,
而组长[F長]也只要人奉[B捧]承，因此业务每况日下。,199603533533100075,新加坡,1,199603,由“三个和尚没水喝”想到的……,85,70,55,33,42,276,未参加,
农业方面来看，“改革开放”以前，各个农民属于{CC属在}“人民公社”[BD，]而为了人民公社劳动。,199605104525100002,日本,1,199605,由“三个和尚没水喝”想到的……,60,65,77,79,54,318,C,
你们看，我的能力最强，吃的，睡觉都{CJX}我[C]最强，[BC。]所以你们俩应该要负责{CC负担}。[BQ”],199605104523100028,韩国,1,199605,由“三个和尚没水喝”想到的……,65,60,60,56,51,275,未参加,
想个办法吧。,199605104523100112,韩国,1,199605,由“三个和尚没水喝”想到的……,70,70,77,67,68,340,C,
为什么要有的人干得多，[BC？]有的人干得少？,199605104529200120,泰国,2,199605,由“三个和尚没水喝”想到的……,85,90,99,65,99,434,B,
但是随着社会的发展，人类素质的提高，[BC。]那“按劳分配”也应该可以取消了。,199605104529200120,泰国,2,199605,由“三个和尚没水喝”想到的……,85,90,99,65,99,434,B,
这点，我们值[C]得想一想。[BC？],199605104523100128,韩国,1,199605,由“三个和尚没水喝”想到的……,60,65,66,56,72,302,C,
那现在仔细地谈这两个问题吧。,199605104523100156,韩国,1,199605,由“三个和尚没水喝”想到的……,65,75,52,49,63,291,未参加,
他们两个人一起吃饭[B馆]，一起修行{CC修养}，[BC。]可是他们{CC2他}觉得抬水的事情太辛苦了，[BC。]所以他们两个人商量商量{CJcd}以后，马上决定了“今天你去，明天我去”[BQ。]他们觉得{CJ-zhuy这}有道理的方法啊{CJs}。,199605104523200164,韩国,2,199605,由“三个和尚没水喝”想到的……,70,60,49,63,49,276,未参加,
这么过{CQ了}好[C]几天又来了第三个和尚，那位和尚愿意跟他们在一起。,199605104523200189,韩国,2,199605,由“三个和尚没水喝”想到的……,65,50,46,40,44,226,未参加,
对自己所做的事情应该用责任对待[C]。,199605104525200211,日本,2,199605,由“三个和尚没水喝”想到的……,55,80,55,54,80,310,未参加,
一方面，很多人{CC多数人}一起爬山的话大家都想“别人{CC2另外人}一定决定走路，计划”[BQ，]所以真是很危险[F險]的P}。,199605104525100385,日本,1,199605,由“三个和尚没水喝”想到的……,70,60,44,74,46,279,未参加,
第三个是，三个人都不去山下，下雨时把三个碗[C]放在地上{CC下}，然后碗[C]里水多了就可以喝了。,199605104525200394,日本,2,199605,由“三个和尚没水喝”想到的……,70,55,52,63,56,280,未参加,
有人反驳说：[BC，]“那不可能，谁愿抬那么[C]多{CD量}的水呢？,199605550523290008,韩国,2,199605,由“三个和尚没水喝”想到的……,70,65,55,65,68,309,C,
最近，在我们韩国的社会里——特别是大学生{CD之间}不想做麻烦的事情的情况是{CJ+zy已经}普遍[B变]的。,199605550523290014,韩国,2,199605,由“三个和尚没水喝”想到的……,70,65,66,60,61,308,C,
我觉得这篇[B编[F編]]故事对越来[F來]越懒[L]惰{CD起}的人类，让他们看看互相相信，依靠性的一种启[B祈]示，而且最近越来[F來]越难以生活的，懒[L]惰的人们再想一想这篇[B编[F編]]故事的真正的意思是什么。,199605550523190036,韩国,1,199605,由“三个和尚没水喝”想到的……,60,60,63,58,63,286,未参加,
