错句,作文编码,国籍,性别,考试时间,作文题目,口试分数,作文分数,听力分数,阅读分数,综合分数,总分,证书
如何解决“代沟”问题呢？,200209550523250261,韩国,2,200209,如何解决“代沟”问题,70,60,63,47,46,271,未参加,
我觉得这一个问题最重要是互相的理解。,200209550523250300,韩国,2,200209,如何解决“代沟”问题,60,60,33,49,46,230,未参加,
因为，人们都认为孩子应该听从父母的安[B按]排，这就是天经地义的事情。,200209550523250333,韩国,2,200209,如何解决“代沟”问题,80,65,60,74,72,339,C,
随着社会发展，人们生活水平提高，家人的来往与接触[B楚]的机会越来越少。,200209550523250338,韩国,2,200209,如何解决“代沟”问题,65,70,30,54,42,247,未参加,
人离不开人际关系[C]。,200209550523250342,韩国,2,200209,如何解决“代沟”问题,65,75,51,62,66,306,C,
第二是社会的努力。,200209550523250866,韩国,2,200209,如何解决“代沟”问题,70,70,81,76,62,347,C,
在外边{CC屋外}都用光了自己的时间和力气，这样的现实下在家里一家人团圆[B园]{CD的}对话是真的难[C]以做到的。,200209550523250897,韩国,2,200209,如何解决“代沟”问题,70,60,66,57,54,292,C,
{CJ-sy是}接受之后应有的过程。,200209550523250900,韩国,2,200209,如何解决“代沟”问题,75,65,69,74,50,320,C,
下面，简单地谈谈我的看法。,200209550501250922,中国,2,200209,如何解决“代沟”问题,60,85,63,74,78,349,C,
总[B兑]之，解决“代沟”问题的方法就是改[B己]善两代人之间的关系。,200209550523250920,韩国,2,200209,如何解决“代沟”问题,65,75,48,67,44,286,C,
如在研究探讨中若没声音的话何来一切发明，世界的一切停顿在未开发当中，因此声音是对人体{CJ-sy有}很大的影响{CJsd}。,200304522522250015,缅甸,2,200304,静音环境对人体的危害,65,75,80,70,82,359,B,
因为静音时[BD，]我们通常是一个人自处的时候[B后]，那时{CQ在}安静的空间待久了会给人带来某些精神上的负担，例如早上受到某人的叫骂[F罵][BD，]受了气，这时火气全冒出来了，火气没法子消，就越想越气，便造成健[B建]康上的一些危害了。,200304522522210006,缅甸,2,200304,静音环境对人体的危害,70,65,61,78,89,349,C,
再次[B此]，[BC.]我们一般人不知道这些蔬[C]菜或水果放了农药没有，卖的人会说没放农药，可是这一些话都没法相信。[BC.],200307109523100065,韩国,1,200307,绿色食品与饥饿,65,65,64,41,53,272,未参加,
使用化肥和农药到底好不好呢？,200307109523200086,韩国,2,200307,绿色食品与饥饿,80,90,78,56,84,383,B,
这个加工的食品叫做“绿色食品”。,200307109523100146,韩国,1,200307,绿色食品与饥饿,60,55,30,9,21,156,未参加,
最近，在韩国，{CP很多城[B成]市人{CC1人们}在自己的家里种菜，还有，大部分的学校[B效]，幼[C]儿园[B院]等等。P},200307109523200155,韩国,2,200307,绿色食品与饥饿,70,60,70,38,44,267,未参加,
从{CC在}这方面来看，[BQ“]绿色食品[BQ”]的弊[B蔽]端[L]就是不能{CC不可}{CJ-sy满足}需求{CC2求}{CJX}饥饿的{CJ-zxy人}。,200307109523100197,韩国,1,200307,绿色食品与饥饿,65,70,64,49,79,313,C,
发达国家面临的问题是保护环境和身体健康，而落后国家想的是吃饱的问题。[BC.],200307109523200237,韩国,2,200307,绿色食品与饥饿,65,80,62,64,56,315,C,
还有应该人们{CJX}提示这个食品是不是“绿色食品”。,200307109525200244,日本,2,200307,绿色食品与饥饿,65,70,64,51,58,294,C,
我认为不挨饿比吃“绿色食品”更[C]重要。,200307109540100285,印度尼西亚,1,200307,绿色食品与饥饿,60,65,56,38,27,229,未参加,
这种情况意味着人类[B娄]的灭亡。,200307109523200296,韩国,2,200307,绿色食品与饥饿,65,85,67,70,76,353,C,
一般人的话，都想过这样的问题。,200307109523200396,韩国,2,200307,绿色食品与饥饿,60,65,40,22,32,202,未参加,
当然，我知道“绿色食品”也给我们伤害{CC损害}。,200307109525200469,日本,2,200307,绿色食品与饥饿,65,70,64,54,64,303,C,
又吃了“[BC《]绿色食品”[BC》]一定会健康吗？P},200307109523200476,韩国,2,200307,绿色食品与饥饿,65,55,54,64,58,278,未参加,
问题是怎样产量{CJX}增[C]加又不会有害于人的健康。,200307109523100532,韩国,1,200307,绿色食品与饥饿,70,65,75,62,64,322,C,
同时也要考虑到挨[B埃]饿的问题。[BC.],200307109523200617,韩国,2,200307,绿色食品与饥饿,80,70,70,54,79,343,C,
绿色食品{CD种种}让社会产生一些问题，绿色食品的含意是[BD。]没有化肥和农药的是绿色食品，我们现在喝的牛奶也是加工过{CC而}{CJX}在我们的前面。[BC，],200307217523100004,韩国,1,200307,绿色食品与饥饿,65,60,40,22,35,205,未参加,
第二点就是，要是用了那么多的农药，“绿色食品”能是新鲜的吗？,200307217523100014,韩国,1,200307,绿色食品与饥饿,70,60,27,43,35,220,未参加,
现在人们的生活水平也提高了，人们开始注[C]意健康{CQ了}所以不少人开始吃绿色食品了。,200307217523100033,韩国,1,200307,绿色食品与饥饿,70,60,67,35,79,296,未参加,
一般人都认为理想{CJ-zxy的情况}是吃绿色食品而不挨饿，我也认为这样{CJs}。,200307204525100015,日本,1,200307,绿色食品与饥饿,55,70,40,54,53,256,未参加,
随着科学的发展，农业部分的发展也{CJ-zy很}多。,200307204523200037,韩国,2,200307,绿色食品与饥饿,60,60,48,51,64,265,未参加,
我认为吃“绿色食品”和不挨饿的问题之间占第一位的就是不挨饿的问题。,200307204523100060,韩国,1,200307,绿色食品与饥饿,60,75,43,49,56,269,未参加,
而且，使用化肥和农药的农作物不但危[C]害人的身体，而且还会导致环境污染等社会问题。,200307204523100080,韩国,1,200307,绿色食品与饥饿,65,80,78,62,70,343,C,
可是在世界上我们可以吃的东西不是只有“绿色食品。,200307205523200009,韩国,2,200307,绿色食品与饥饿,60,60,62,41,38,243,未参加,
当时，在[C]节目中主持人和有关这[C]方面的专家认为这[C]些使农产品的产量大大提高的[C]现代的农业方法{CC农法}是应当促进的{CC其}办法，可是我认为虽然这[C]些办法确实{CJ-zy能}提高农产品的产量，可是我们应当了解它会带来的负面影响[F響]。[BC.],200307205525100034,日本,1,200307,绿色食品与饥饿,65,75,83,83,90,383,B,
但是我们也{CJX}最近[C]发现越来越多的{CC得]}[C]污[L]染问题。,200307205525200030,日本,2,200307,绿色食品与饥饿,75,65,67,43,61,298,C,
我认为对人的健康问题来说{CC看}，[BC、]吃“绿色食品”是第一位的。,200307205525200059,日本,2,200307,绿色食品与饥饿,70,70,64,67,58,317,C,
不过{CC过不}[C]现在的先进[C]社会[C]，知道[C]那个危险[C]的程度[C]，[BC、]对这[C]些[C]食[C]品有[C]一定的法律上的限[C]制。,200307205525100085,日本,1,200307,绿色食品与饥饿,75,80,72,62,99,379,B,
再次，农民也要尽量去用天然肥料。,200307205523200113,韩国,2,200307,绿色食品与饥饿,80,65,67,59,90,349,C,
这不能随便说哪一个是第一位的。,200307205523200149,韩国,2,200307,绿色食品与饥饿,65,75,67,59,73,326,C,
现在大部分的农作物会受到化肥和农药的污染。,200307205525100177,日本,1,200307,绿色食品与饥饿,65,60,46,64,47,265,未参加,
如果我选“绿色食品”的话，[BC、]那一定是{CQ以}可以吃的饮食为前提来说的。[BC.],200307212523100003,韩国,1,200307,绿色食品与饥饿,65,70,75,56,61,313,C,
也许他们能吃多一点的食物，[BC、]但他们的身体{CJ-zxy情况}会越来越恶化。[BC.],200307212523200021,韩国,2,200307,绿色食品与饥饿,70,80,67,62,90,359,C,
世界的农民都要用农药了。,200307201523100005,韩国,1,200307,绿色食品与饥饿,60,60,38,25,32,197,未参加,
跟健康直接关联{CC连[C]关}的是人们吃的习惯。,200307201523100055,韩国,1,200307,绿色食品与饥饿,65,60,46,49,61,264,未参加,
谁也不能保证我们的未来是怎样的。,200307201523200062,韩国,2,200307,绿色食品与饥饿,70,70,67,54,64,313,C,
所[C]以虽然绿色食品对人们很好，但是我觉得如果一般农作物{CC作品}没什么害处{CC有害}的话[BQ，]先救[B求]饿死的人。,200307201523100094,韩国,1,200307,绿色食品与饥饿,65,60,67,59,53,287,C,
因此，绿色食品是越来越讨人喜欢。,200307201523100095,韩国,1,200307,绿色食品与饥饿,60,60,62,59,73,296,未参加,
先进[C]的农作物技术也一定跟别的国家共同享受。[BC.],200307302523200016,韩国,2,200307,绿色食品与饥饿,70,60,62,67,90,334,C,
我觉得跟一般使用化肥和农药的食品差不多。,200307302523200054,韩国,2,200307,绿色食品与饥饿,65,60,70,54,58,290,C,
我认为应该先考虑饥饿问题。,200307302523200108,韩国,2,200307,绿色食品与饥饿,65,65,72,49,67,302,C,
这样的食物有百害而无一利。,200307206525200074,日本,2,200307,绿色食品与饥饿,70,65,72,62,67,322,C,
我提倡绿[C]色食品。,200307215448250023,维吾尔族,2,200307,绿色食品与饥饿,95,85,83,70,93,424,A,
人有东西吃，{CD肚子}就不会挨饿，[BC。]这样就能保存他{CQ的}生命。,200307332540200010,印度尼西亚,2,200307,绿色食品与饥饿,70,65,56,38,50,265,未参加,
总之{CC总[C]结}[BQ，]我还是认[F認]为男女同班比较[F較]好。,200309529529151013,泰国,1,200309,我对男女分班的看法,65,65,30,61,83,288,未参加,
分班能让中学男女专[F專]心读书，不分心。,200309529529251014,泰国,2,200309,我对男女分班的看法,65,60,63,39,65,275,未参加,
我是永远不会{CQ让}分班{CJX}学生{CC2每一个人}{CJsd}！,200310520520250008,蒙古国,2,200310,我对男女分班的看法,65,65,38,21,38,211,未参加,
我觉得这也可以说成长的必经阶段{CJs}。[BC，],200310576525100011,日本,1,200310,我对男女分班的看法,65,65,41,42,58,255,未参加,
人们认为一个女人{CJ+zxy的社会地位}只能是一个依靠丈夫的家庭妇女。{CD可是},200310602801250006,澳大利亚,2,200310,我对男女分班的看法,70,70,79,65,65,337,C,
通常，我喜欢在开始阅读之前先看目录[F錄]，这样能让我对书中大纲有所认识，对书中大意{CC文义[B议]}也能理解{CC理惠}得{CC的}更好。,200310540540150003,印度尼西亚,1,200310,谈有效阅读,70,75,59,40,57,290,未参加,
所以汉语拼音{CJ+zxy这一门}必须掌握好。,200310540540150040,印度尼西亚,1,200310,谈有效阅读,65,70,36,44,79,280,未参加,
其实书籍含有的知识是无限的，[BC。]只要我们好好{CJ+sy去}观察，仔细分析，就可以从书籍{CQ中}挖出来珍贵的资料。,200310540540150085,印度尼西亚,1,200310,谈有效阅读,65,65,57,51,82,304,未参加,
两三年过去，我才慢慢地发觉自己对汉语[BD、]越来越感兴趣，我{CJ-zy渐渐}喜欢它了。,200304131529200021,泰国,2,200304,我学汉语是为了……,65,70,47,38,60,266,未参加,
我学习汉语快要五年了。,200304131539200040,印度,2,200304,我学汉语是为了……,70,70,33,49,63,273,未参加,
从此我在印尼开始学汉语。,200304131540200048,印度尼西亚,2,200304,我学汉语是为了……,65,75,47,65,63,302,C,
中国文化可以说是世界文化的重要组成部分。,200304131529200111,泰国,2,200304,我学汉语是为了……,80,65,59,54,82,328,C,
让孩子们[BD，]正常地、[BC，]自由地学习，不是很好吗？,200306680519250002,马来西亚,2,200306,我对男女分班的看法,90,90,87,75,94,434,A,
为什么呢？,200306680519150023,马来西亚,1,200306,我对男女分班的看法,75,85,80,72,81,386,B,
因此，男女应保持互相了解，互相认识，互相谅解和体谅，同心协力建立一个健全的男女关系，才不会导致那么多宗离婚[B分]事件发生。,200306680519250041,马来西亚,2,200306,我对男女分班的看法,75,70,39,37,55,265,未参加,
其中包[B抱]括很多类型[B形]的食品。,200307271523100084,韩国,1,200307,绿色食品与饥饿,75,65,75,70,81,353,B,
我的妈妈买菜的时候就买绿色食品，我小的时候不懂为什么买绿色食品，因为绿色食品比使用农药和化肥的食品贵。,200307271523100105,韩国,1,200307,绿色食品与饥饿,70,60,62,46,44,267,未参加,
警察{CC2警察员}在街上看看{CJcd}有没有边走边抽烟的人。,200405109525200477,日本,2,200405,吸烟对个人健康和公众利益的影响,70,70,76,68,66,338,C,
吸烟不是{CJ-zy只}对{CC给}一个人{CJ-sy有}不好的影响。,200405109523100617,韩国,1,200405,吸烟对个人健康和公众利益的影响,70,60,48,35,46,244,未参加,
这样的[C]时代还存在吸烟者，真[C]遗憾，[BC.]所以[C]吸烟者应该戒烟了{CC吧}。,200405109523200660,韩国,2,200405,吸烟对个人健康和公众利益的影响,75,60,71,62,53,307,C,
以前在公司里经常发生这样的情况，一个女职员工作的时候，常常被动吸烟，大概25年以后她得了肺炎。,200405109523100681,韩国,1,200405,吸烟对个人健康和公众利益的影响,75,65,69,56,53,305,C,
。,200405109523200682,韩国,2,200405,吸烟对个人健康和公众利益的影响,80,60,50,64,55,296,未参加,
第{CC则}一，吸烟不仅损害个人的健康、还损害周围的人。,200405109525100891,日本,1,200405,吸烟对个人健康和公众利益的影响,75,70,57,52,48,291,未参加,
吸烟不仅有这个问题，还存在一个问题就是影响不吸烟的人。,200405109523100986,韩国,1,200405,吸烟对个人健康和公众利益的影响,50,60,31,46,44,211,未参加,
[BD，]吸[C]烟{CQ的}很多坏处，政府采取{CD其}措施，减少吸烟者是很好的措施。,200405109523100999,韩国,1,200405,吸烟对个人健康和公众利益的影响,70,70,69,64,68,329,C,
吸烟对人体来说，确实百害无益的{CJsd}。,200405109523101000,韩国,1,200405,吸烟对个人健康和公众利益的影响,65,65,62,52,64,292,C,
根据某市政[B城]府的一项规定，在公共场所边走边抽烟的人将被罚款。,200405109523201012,韩国,2,200405,吸烟对个人健康和公众利益的影响,75,65,79,70,59,335,C,
总之我觉得双方让步一下是最好的办法。,200405109525201009,日本,2,200405,吸烟对个人健康和公众利益的影响,70,65,67,73,70,331,C,
社会和经济发展[C]过程中，产生了环境问题，[BC。]所以[C]人们关心{CD在}健康。P},200405109523201052,韩国,2,200405,吸烟对个人健康和公众利益的影响,50,65,57,39,37,229,未参加,
最近韩国女性吸烟率越来越高。,200405109523201150,韩国,2,200405,吸烟对个人健康和公众利益的影响,65,65,57,62,61,294,C,
而吸烟者常常把烟头扔在地上，人家看到这样{CC次}都觉得不满意P}。,200405109523101395,韩国,1,200405,吸烟对个人健康和公众利益的影响,60,60,52,50,53,257,未参加,
以前还没有{CJX}法律上这种{CC这样}的规定的时候，不吸烟者虽然{CJ+zhuy他们}不愿意吸烟味，但没有方法避免[B面]。,200405109523201399,韩国,2,200405,吸烟对个人健康和公众利益的影响,50,65,59,52,59,266,未参加,
为了青少年养成良好的想法{CJjy}，他们上高中时{CJ-zy要}看几个片子。,200405109523201402,韩国,2,200405,吸烟对个人健康和公众利益的影响,70,70,59,46,53,286,C,
最近，韩国男性，特别是青少年的吸烟率已[B以]达到了百分之五十以上。,200405109523101432,韩国,1,200405,吸烟对个人健康和公众利益的影响,70,65,67,66,70,324,C,
希望人们能够做到。[BC，],200405109523201472,韩国,2,200405,吸烟对个人健康和公众利益的影响,75,75,48,39,35,262,未参加,
这个是个人怎么想的问题。,200405109525201509,日本,2,200405,吸烟对个人健康和公众利益的影响,75,70,36,33,30,233,未参加,
最近出现{CC发生}很多的怪{CC奇}病，[BC。]这样的现象告诉我们健康的重要性。,200405109525201640,日本,2,200405,吸烟对个人健康和公众利益的影响,65,55,50,62,61,275,未参加,
现在吸烟的人越来越多，除了满18岁的人以外，高中生、初中生都吸烟。,200405109525101682,日本,1,200405,吸烟对个人健康和公众利益的影响,55,70,57,60,57,283,未参加,
我认为公共场所是一种娱乐的地方。,200405109525101741,日本,1,200405,吸烟对个人健康和公众利益的影响,70,60,38,50,64,267,未参加,
我觉得这一新措施是完美的。,200405109525201798,日本,2,200405,吸烟对个人健康和公众利益的影响,75,75,55,64,66,325,C,
因为经济[B齐]发展的影[B印]响[B像][BQ，]人们的生活[B话]水平也越来越高，[BC。]所以人们重视{CC认为}自己的健康。,200405109523201846,韩国,2,200405,吸烟对个人健康和公众利益的影响,60,60,50,37,46,235,未参加,
禁止{CJ-sy做}广告之后，香烟[B咽]的销售额[C]逐年减[C]小，美国政府的税收{CC收税[C]}也日益减[C]小了，因此，终[C]于[C]提[C]出了一条香烟立[C]法规定。P},200405109523101860,韩国,1,200405,吸烟对个人健康和公众利益的影响,50,75,62,60,66,297,未参加,
如果这样的话，在公共场所抽烟的人越来越少，而且可以保持市容整洁。,200405109523201898,韩国,2,200405,吸烟对个人健康和公众利益的影响,80,70,62,58,70,330,C,
吸烟是对人的身体和公众利益的最不好的{CJX}影响。,200405109523201899,韩国,2,200405,吸烟对个人健康和公众利益的影响,60,65,31,39,39,217,未参加,
在公共场所边走边抽烟，这一行动不仅由于{CC2由}其副流烟，即往周围环境流出的烟，影响别人健康，而且有可能由于{CC2由}他拿着的烟火影响其他走路人的安全。,200405109525100051,日本,1,200405,吸烟对个人健康和公众利益的影响,80,65,88,68,83,372,B,
创造一个良好的社会，对坏习惯的限制是必然的，而这样的限制一定服从于科学的办法。,200405109525100051,日本,1,200405,吸烟对个人健康和公众利益的影响,80,65,88,68,83,372,B,
当然害处比好[C]处多一点。,200405109523200525,韩国,2,200405,吸烟对个人健康和公众利益的影响,70,70,50,66,75,319,C,
之所以禁示在公共场[F場]合吸烟，主要可以分成两[C]方面的原因。,200405109523100538,韩国,1,200405,吸烟对个人健康和公众利益的影响,90,85,88,60,87,407,B,
而且人随便吸烟的话会给别人带来副流烟，[BC。]这也不利于公众的利益。,200405109525200534,日本,2,200405,吸烟对个人健康和公众利益的影响,85,70,64,79,80,369,C,
那样的方法{WWJ},200405109523200560,韩国,2,200405,吸烟对个人健康和公众利益的影响,65,60,36,52,49,245,未参加,
这都是现在在城市生活的因扰{CD来}引起的，[BC、]或者{CQ在}孩子的时候[BD，]没{CC不}受到良好的教育[C]，或者从{CC响}父母{CQ那}来{CJX}学习的不好的习惯。,200405109523100622,韩国,1,200405,吸烟对个人健康和公众利益的影响,70,65,76,70,66,333,C,
第二，[BC.]吸烟[C]对[C]青[C]少[B小]年的情绪[B序[C]]{CJ-zxy的影响}不好，[BC、]可以说，[BC、]如果青[C]少[B小]年吸烟的话，[BC、]他们的性格方面{CJ-zy会}受到{CC2有}影[C]响[C][BQ。]{CP因此，我{CJ-wy想}{CQ对}不吸烟者说[BQ：]“你们不吸烟{CD还}好吗{CC了}，为了您[C]的爱人，[BC、]为了您[C]的可爱的孩子[B了]，[BC。]不抽烟可以保[C]护您[C]的身[C]体[BQ。]”P},200405109523200616,韩国,2,200405,吸烟对个人健康和公众利益的影响,65,70,54,48,56,279,未参加,
其次[BQ，]现在的青少年的吸烟[B咽]率越来越高，年龄[B领]也越来越小[B少]。,200405109523200677,韩国,2,200405,吸烟对个人健康和公众利益的影响,60,60,56,58,39,255,未参加,
有些不吸烟者因为被动吸烟得{CQ了}肺[C]病。,200405109523201417,韩国,2,200405,吸烟对个人健康和公众利益的影响,60,60,52,56,58,268,未参加,
我认为，实施{CC进行}{CQ对}在公共场所吸烟者罚款的措施必须持续，同时[BD，]给人们介绍{CC提倡}吸烟对人身的影响{CJX}严重，又提倡戒烟，介[B价]绍一些戒烟的方法，这样做，人们对吸烟的情况更了解。,200405109525200252,日本,2,200405,吸烟对个人健康和公众利益的影响,75,65,74,58,75,334,C,
总而言之，吸烟是一种不好的习惯，最好{CJX}吸烟者马上开始戒烟。,200405109525200395,日本,2,200405,吸烟对个人健康和公众利益的影响,65,65,54,70,70,308,C,
这个问题，包括各种情况{CC因素}。,200405204525200151,日本,2,200405,吸烟对个人健康和公众利益的影响,70,70,82,61,58,329,C,
这一新措施的内容是在公共场所[C]边走抽烟的人将被罚款。,200405204525200244,日本,2,200405,吸烟对个人健康和公众利益的影响,65,75,49,54,72,302,C,
最近，在很多公共场所，[BC、]{CQ像}饭馆和饭店等等[BQ，]允许抽烟的地方越来越少了。,200405204525200253,日本,2,200405,吸烟对个人健康和公众利益的影响,65,60,33,56,47,244,未参加,
依我看来，[BC、]吸烟有害而没有利。,200405204525200266,日本,2,200405,吸烟对个人健康和公众利益的影响,70,65,33,44,51,249,未参加,
我相信实施这样的措施一定会给人民带来又健康又舒服的日子。,200405204525100275,日本,1,200405,吸烟对个人健康和公众利益的影响,65,65,63,61,67,305,C,
要是烟的价格更昂贵的话，[BC、]{CD越来越}这个问题会解决的。,200405204525100277,日本,1,200405,吸烟对个人健康和公众利益的影响,65,60,58,65,65,296,C,
另外一个{CJ-zxy意思}是拿着烟走路也是有很大的危害性{CJsd}。,200405204525100332,日本,1,200405,吸烟对个人健康和公众利益的影响,70,60,55,58,61,289,未参加,
吸烟当然对吸烟者的身体有害，而且也对周围人的身体有害。,200405204525200326,日本,2,200405,吸烟对个人健康和公众利益的影响,65,60,52,56,72,288,未参加,
给人们很多疾病{CD的}。P},200405204525200418,日本,2,200405,吸烟对个人健康和公众利益的影响,60,60,52,49,58,261,未参加,
可是，有些人忽视了“吸烟对个人健康和公众利益的影响”。,200405204525100464,日本,1,200405,吸烟对个人健康和公众利益的影响,60,75,66,75,61,323,C,
不过吸烟在很多方面有危害{CC2弊}，这个是没有错儿。,200405205525100013,日本,1,200405,吸烟对个人健康和公众利益的影响,60,80,49,61,72,309,未参加,
吸烟人自己选择吸烟，[BC。]所以吸烟对自己有什么影响也都该他们{CQ自己}负责。,200405205525200084,日本,2,200405,吸烟对个人健康和公众利益的影响,60,75,44,61,58,284,未参加,
抽烟的人的死亡率、发病率比不抽烟的人更高。,200405205525200165,日本,2,200405,吸烟对个人健康和公众利益的影响,60,70,52,65,56,288,未参加,
如[B奴[C]]果某个人实在{CC实[C]际}忍不住{CC经不住}抽烟，到自己个人的地方去抽烟就好。,200405205525200175,日本,2,200405,吸烟对个人健康和公众利益的影响,65,75,47,58,51,283,C,
每个人都很自觉，能考虑[C]到别人{CC人家}的话，世界会变成很美的。,200405205525100211,日本,1,200405,吸烟对个人健康和公众利益的影响,65,75,47,37,49,260,未参加,
大家都知道吸烟对身休健康的不良影响。,200405684542200002,越南,2,200405,吸烟对个人健康和公众利益的影响,60,65,25,32,51,216,未参加,
虽然朋友的交往与夫妻[C]不同，但日常的接触能使你见到{CQ的}不只是对方的表现，也可以观察他处事待人的方式，生活的态度。,200410534533250066,新加坡,2,200410,最理想的结交方式,90,85,83,70,96,421,A,
这就犹[B尤]如蒲[B莆]公英，十公分的{CJ-zxy茎}成长在泥土上，土里竟有三十公分扎实的根。,200410534519150074,马来西亚,1,200410,最理想的结交方式,65,90,66,67,82,361,C,
反过来说，运动员也是非常痛苦的职业，他们每天都要训练、不能喝酒、不能抽烟等。,200404140529200248,泰国,2,200404,运动员收入,70,65,49,40,59,269,未参加,
如果问人们运动员的月收入有多高，恐怕没有几个人可以说得上来。,200404140520200300,蒙古国,2,200404,运动员收入,80,90,91,63,74,393,B,
”。,200405680519250017,马来西亚,2,200405,吸烟对个人健康和公众利益的影响,70,95,71,60,94,383,C,
因此政府推动任何的反吸烟措施，都值得国人大力支持。,200405680519150036,马来西亚,1,200405,吸烟对个人健康和公众利益的影响,80,95,85,83,94,432,A,
这种烟称为“二手烟”。,200405680519250055,马来西亚,2,200405,吸烟对个人健康和公众利益的影响,65,90,55,60,80,341,C,
除了以上针对学生自身需要的理由，我认为男女学生分班好处多以外，站在父母和师长的立场上，他们一定也希望学校根据学生的性别，设计适合他们的需要的课程，让他们得到最好的栽培。,200504534533250022,新加坡,2,200504,我对男女分班的看法,80,85,73,84,95,411,B,
过度的限制反而会带来反效[C]果，青少年要结交异性的欲望有可能会更加强烈！,200504534519150064,马来西亚,1,200504,我对男女分班的看法,80,80,84,89,93,418,B,
到了高中和大学阶段，我认为男女应该以混合式受教育。[BC.],200504534533250056,新加坡,2,200504,我对男女分班的看法,75,85,62,60,77,352,C,
