错句,作文编码,国籍,性别,考试时间,作文题目,口试分数,作文分数,听力分数,阅读分数,综合分数,总分,证书
每[C]当放假回国去，我看到他比前一年还老了，我的心充满{CD被}一种痛苦的感觉{CC理想}。,199412124520200019,蒙古国,2,199412,记我的父亲,60,70,52,42,57,266,未参加,
爸爸[C]经常来信说不[C]要气馁，铁杆磨成针，只要努力就能成功，信中爸爸[C]还[C]是无微不[C]至地{CC的}关怀[C]我，我怎么能只顾自己呢？[BC，],199412124529200027,泰国,2,199412,记我的父亲,95,75,60,46,61,332,C,
我的妈妈生完{CC出生}孩子后，休息{CQ了}一段时期。,199412104525200650,日本,2,199412,记对我影响最大的一个人,65,65,62,55,57,288,C,
她常常跟{CC给}我说，你应该找到一个自己喜爱的工作，然后把精神都投入{CQ到}那个工作{CQ中}。,199412104525200650,日本,2,199412,记对我影响最大的一个人,65,65,62,55,57,288,C,
现在我很感谢她，因为她给我{CJX}了很大的兴趣和关心。,199412104523200680,韩国,2,199412,记对我影响最大的一个人,75,70,78,65,61,338,C,
”就完{CQ了}。,199412104525200689,日本,2,199412,记对我影响最大的一个人,75,80,81,65,65,357,B,
这两个方面，她对我的影响特别大。,199412104525200102,日本,2,199412,记对我影响最大的一个人,80,85,73,69,76,377,B,
不知道的话，用{CC把}毛巾蒙上眼睛。,199412104525100652,日本,1,199412,记对我影响最大的一个人,70,80,52,53,78,323,未参加,
很多事情都可以自己决定，不会令母亲[F親]操心。,199412104625200369,葡萄牙,2,199412,记对我影响最大的一个人,65,75,70,65,80,342,C,
从那个时候[BQ，]我的成绩都跟着我的学习兴趣慢慢地好起来了。,199412104523200115,韩国,2,199412,记对我影响最大的一个人,60,50,70,48,55,263,未参加,
他叫XXXX。,199412104525100119,日本,1,199412,记对我影响最大的一个人,65,55,36,65,69,272,未参加,
两年前[BQ，]他的著作《清贫的思想》使他{CQ成为}目前{CD在}日本最著名的作家之一{CD了}。{CJ+zhuy我},199412104525100120,日本,1,199412,记对我影响最大的一个人,65,65,81,71,74,340,C,
汉[F漢]语[F語]又不是拼音文字，不好记[F記]又不好写[F寫]，而且我从[F從]小不是生活在汉[F漢]语[F語]言的社会[F會]里面，不要说[F説]学[F學]起来[F來]事倍功半，根本可能学[F學]不会[F會]。,199409543634100201,英国,1,199409,学习汉语的苦与乐,75,80,67,73,95,381,B,
原本母亲是一位家庭主妇，把家务事处理得井井有条，对我们的起居饮食也照顾得无微不至，由于环境所逼，她不得不外出{CC出外}找{CJ+dy份}工作补贴家用，因父亲已减少我们的家用。,199500533533100006,新加坡,1,199500,记对我影响最大的一个人,95,85,46,53,61,338,未参加,
他们说我把大自然融入字体里，{CJ+zy很}别具一格{CC独树一格}。,199500533533100047,新加坡,1,199500,记对我影响最大的一个人,90,90,89,77,84,428,A,
我们[F們]常常跟母亲说[F說]：这种[F種]人不要的[B得]好，为[F為]何不离婚？,199500533533200045,新加坡,2,199500,记对我影响最大的一个人,90,90,91,67,78,414,A,
”于是，她又喊我[BQ：][BQ“]坐下，坐下。[BQ”],199500533519200096,马来西亚,2,199500,记对我影响最大的一个人,85,60,57,55,65,310,未参加,
谁说恋爱非得要激动呢？,199500533533200102,新加坡,2,199500,记对我影响最大的一个人,85,80,83,79,76,396,B,
参加了这课[F課]程后，给了我很大的启[F啓]发，也改变了我的人生观[F觀]，使我对任何事都有信心。,199500533540200115,印度尼西亚,2,199500,记对我影响最大的一个人,60,80,68,57,76,328,C,
以{CC从}一个人的改革去影响一个社会、一个国家，最后是整[B怎]个世界的改革。,199500533533200130,新加坡,2,199500,记对我影响最大的一个人,95,65,78,59,69,358,C,
这[F這]一{CD人}生中，怎可能忘怀[F懷]家母为[C]我{CD而[C]}带来的一切呢？,199510512512200501,菲律宾,2,199510,记对我影响最大的一个人,85,75,62,41,59,314,未参加,
我哭泣！,199510512501200508,中国,2,199510,记对我影响最大的一个人,90,95,48,48,61,340,未参加,
她视学[F學]生如同亲[F親]生儿[F兒]女，人人尊敬她。,199510512501200508,中国,2,199510,记对我影响最大的一个人,90,95,48,48,61,340,未参加,
其实，我从[F從]小就很热爱祖国，经常从报纸上看有关祖国的消息，{CD对}祖国的日新月异的伟大成就对{CC给}我们这些侨居在异国他乡的华人来说是一种无比的自豪感[C]。,199510512512100502,菲律宾,1,199510,记对我影响最大的一个人,80,85,59,66,73,357,B,
如今您虽[F雖]离[F離]我远[F遠]去，但女儿[F兒]每星期天都{CQ带}全家到您陵[B灵[C]]墓上去看望您。,199510512501200515,中国,2,199510,记对我影响最大的一个人,90,85,50,54,68,344,C,
那么死的痛苦也是一样[F樣]，必然的。,199510550523200922,韩国,2,199510,如何看待“安乐死”,80,85,76,70,75,380,B,
相比之下，包抱韩国在内的大部分的东方国家对此[B比]问题保持更慎重的态度。,199510550523200933,韩国,2,199510,如何看待“安乐死”,80,80,52,68,57,329,C,
在病人的那一方看问题[F題]，病人的想法[C]可能是——既然是不治之症，又何[B可]必多留世上，受{CC1接受}病魔的纠[B久]缠，痛苦的煎熬，浪费了社会的资源，又使得家人忧[F憂]心忡[B冲]忡[B冲]，食不知味，倒不如了此残生，免得害已害人。P},199511543634100505,英国,1,199511,如何看待“安乐死”,80,85,71,73,84,387,B,
就是病人没有感觉[F覺]，他的至亲[F親]的家人、好友{CQ友好}仍要{CJ+zy为[F為]他}伤心{CC悲苦}地陪伴他，无[F無]心工作、学习{CC向学[F學]}，也是一种[F種]悲哀！,199511543634200508,英国,2,199511,如何看待“安乐死”,75,85,36,58,70,317,未参加,
解决[F決]问[F問]题[F題]的核心来[F來]自于[F於]决[F決]定权力在哪[B那]里。,199511543922200530,美国,2,199511,如何看待“安乐死”,95,75,43,44,57,309,未参加,
故此，如能让[F讓]这[F這]个[F個]垂死的病人安祥[F詳]地离[F離]开[F開]这[F這]个[F個]世界，相信绝大多数人也不会[F會]觉[F覺]得不能接受。,199511543501100542,中国,1,199511,如何看待“安乐死”,80,90,71,81,93,410,B,
以上三种[F種]意见[F見]，有赞[F贊]成安乐死的，也有反对[F對]的，彼此各不相让，在近来讨论得可说[F說]是十分激烈。,199511543501100547,中国,1,199511,如何看待“安乐死”,90,85,81,79,93,425,A,
⑤马[F馬]来[F來]西亚[F亜]政府文凭[F憑]。,199503682519100530,马来西亚,1,199503,一封求职信,80,85,76,62,88,385,B,
这{CJ+sy是}跟{CC1由於}当时我所处在的环境有关，家庭、社会、家乡的所在地等等，在这里就不[C]一一说明。,199505529529100002,泰国,1,199505,学习汉语的苦与乐,80,85,79,77,86,401,B,
我[C]还[C]记[C]得[C]我[C]的汉语老师。{CJ-zhuy她},199505104523200012,韩国,2,199505,记对我影响最大的一个人,60,55,54,36,35,221,未参加,
今后[C]不做坏[B怀]事，[BC。]而且为{CC对}人民服务。,199505104501100025,中国,1,199505,记对我影响最大的一个人,65,70,52,50,45,268,未参加,
可[C]妈妈不同意，所以我给妈妈解[C]释了半年后，才得到{CC接受}了妈妈的允许。,199505104523200045,韩国,2,199505,记对我影响最大的一个人,55,75,36,30,53,234,未参加,
他是个很好的朋友。{CD人},199505104523100050,韩国,1,199505,记对我影响最大的一个人,0,80,62,53,53,245,未参加,
他说话不多，但做事[C]很认真。,199505104525100063,日本,1,199505,记对我影响最大的一个人,65,85,65,55,74,334,C,
我是{CJ-dy一个}今年二十七岁的男人。,199505104523100107,韩国,1,199505,记对我影响最大的一个人,65,55,28,59,55,244,未参加,
从小四到小六的三年，真由美老师是我们的班主任{CD了}。,199505104501200135,中国,2,199505,记对我影响最大的一个人,65,70,46,61,65,293,C,
他开设了一个独立公司，是“[BC《]中山产业贸易公司”[BC》]。{CP我是个年轻学生，[BC、]可我当了个公司经理。别说，[BC、]我全力以赴{CC兴奋起来},199505104525100168,日本,1,199505,记对我影响最大的一个人,70,65,44,48,53,266,未参加,
不过什么时候{CJ+zhuy我}看他，我{CJ+zy什么时候}都{CC也}能感到他理解[C]我的全部。,199505104523200173,韩国,2,199505,记对我影响最大的一个人,55,70,62,55,63,289,C,
后来，还有{CD了}非常悲惨{CC难过}的事，就是我哥哥{CJ-sy得了}难治{CQ的}病，我家境没有那么富有，越来越{CC愈来愈}需[C]要{CJ+dy很多}钱，我不得不放弃考大学。,199505104523200187,韩国,2,199505,记对我影响最大的一个人,75,60,57,50,57,285,未参加,
当是我是刚[F剛]上大学的新[C]生，他是我的师哥。,199505104523200214,韩国,2,199505,记对我影响最大的一个人,65,65,83,55,78,330,C,
自然我对学习方面的兴趣越来[C]越小{CC1减少}了。,199505104523100216,韩国,1,199505,记对我影响最大的一个人,65,70,89,79,80,369,C,
如果那时候没有那位老师那会没有现在的我。,199505104523200218,韩国,2,199505,记对我影响最大的一个人,70,70,60,63,67,318,C,
要是我有我的办法的话，他跟我一起[C]讨[C]论[C]这[C]个{WWJ},199505104525200245,日本,2,199505,记对我影响最大的一个人,70,60,68,65,63,311,C,
他是我上汉城大学的研究生的时候认[F認]识[F識]的一位宗教学专[F專]家[C]。,199505104523100268,韩国,1,199505,记对我影响最大的一个人,75,65,57,75,63,322,C,
我现在也还{CJ-zy能}清楚地想起来她{CD的}讲课{CJ-zxy的情景}。{CJ+zhuy我},199505104525200282,日本,2,199505,记对我影响最大的一个人,75,75,49,53,61,303,未参加,
现在我己经毕业了，在英国的伦教[C]大学读了理工系[C]的机械[C]工程，要不是因为他给我的鼓励、[BC，]教育和帮助[BQ，]我现在[BD，]也许就是个普普通[C]通[C]的经济家。,199505104940100285,秘鲁,1,199505,记对我影响最大的一个人,85,60,62,46,49,290,未参加,
有时有的同学病了[C]，她着[C]急[B贤]地带他/她去医院。,199505104513100292,柬埔寨,1,199505,记对我影响最大的一个人,70,55,28,46,49,232,未参加,
有一个人对我影响最大——他就是我的二哥；他有一种很率直的性格，不论做什么事情他都一丝不苟、刚正不阿[B让]。,199508680519100501,马来西亚,1,199508,记对我影响最大的一个人,75,60,83,63,82,349,C,
在这一生中，我曾接触过{CC了}许许多多的人，但若说对我{CQ影响}最大的一个人，那肯定是我父亲了。,199508682519100514,马来西亚,1,199508,记对我影响最大的一个人,90,90,75,77,82,412,B,
至少他要像我父亲一样地{CC的}爱我，照护[F護]家庭[BD，]{CD和}当{CC是}一个好父亲、[BC，]好丈夫。,199508680519200525,马来西亚,2,199508,记对我影响最大的一个人,85,75,68,46,51,317,C,
我二哥没有替我做什么，只是以他的命换回{CC2换}我的。,199508681519100524,马来西亚,1,199508,记对我影响最大的一个人,80,80,65,69,76,362,B,
每个人都过着平凡的生活，但也有人过着不平凡的生活。,199508682519200531,马来西亚,2,199508,记对我影响最大的一个人,80,85,89,69,80,397,B,
若不是伯伯的教导，我的华文程度可说是低得无法想象。,199508683519100548,马来西亚,1,199508,记对我影响最大的一个人,85,95,81,77,78,412,B,
在城市生活的人可能大概是这样，但是在乡村生活的人可能不是这样，因为他们生活在大自然里。,200005108525200303,日本,2,200005,关于用自然之声取代噪声的建议,65,75,75,80,82,364,B,
城市里的生活也美丽。,200005108523100414,韩国,1,200005,关于用自然之声取代噪声的建议,65,65,67,67,63,311,C,
我相信个[F個]性相合是许[F許]多人的共同标[F標]准[F準]，因为[F爲]个[F個]性能有更多的共同{CC同共}话[F話]题[F題]及喜好，而且更容易了[F瞭]解彼此，减少摩擦。,199711801501200004,中国,2,199711,我选择朋友的标准,90,80,80,67,80,392,B,
大家愿[F願]意聆听[F聽]对[F對]方的需要，也要互相关心及互相沟[F溝]通，千万不要因小误[F誤]会[F會]而令友情受到伤[F傷]害。,199711801634200030,英国,2,199711,我选择朋友的标准,80,80,71,70,70,363,B,
比如，跟他人交往而带给双方面的不和，这就不做朋友还好过了。,199711801801100033,澳大利亚,1,199711,我选择朋友的标准,75,65,58,58,49,292,C,
我们一到那生活方式和游戏全部都变。,199705104523200060,韩国,2,199705,我的城市/乡村生活,80,65,80,42,61,316,C,
感谢您们。,199705104525100081,日本,1,199705,我的城市/乡村生活,65,60,55,67,39,269,未参加,
所以，因此我们都能了解到城市的生活在各种各样的方面都比乡村丰富多了。,199705104610100121,法国,1,199705,我的城市/乡村生活,90,70,66,42,49,310,C,
我想在中国和在乡村生活有一些相同的感觉，因为我认为乡村生活是很少受到外部的影响的，而城市生活是会受到好大的影响的。,199705104525200524,日本,2,199705,我的城市/乡村生活,50,50,60,51,58,247,未参加,
但是，现在接触的人多了，自己要处理的事多了，“碰壁”的次数也多了。,199810602801250008,澳大利亚,2,199810,如何面对挫折,95,80,87,91,95,444,A,
我损失了看卡通节目的时间来学几个汉字。,199804123919200050,加拿大,2,199804,学习汉语的苦与乐,75,70,63,67,72,336,C,
现在我学习汉语中最苦的就是语法{CC语言}等等。,199804123523100147,韩国,1,199804,学习汉语的苦与乐,60,65,36,62,31,237,未参加,
虽[F雖]然时[F時]代已变，可是那种[F種]“女人当[F當]嫁”或“嫁鸡[F鷄]随[F隨]鸡[F鷄]，嫁狗随[F隨]狗”的观念仍是在东[F東]方人的心里[F裡]根深蒂[B地]固[B故]的存在。,199805529529151002,泰国,1,199805,如何看待“妻子回家“,60,60,59,47,55,263,未参加,
最近几年，中国都市出现了妇[F婦]女辞职的现象。{CP如果她[B他]们[F們]辞职了，那就应该做一个{CJ+zy以妻为责的},199809542542200024,越南,2,199809,如何看待“妻子回家“,65,65,24,46,64,248,未参加,
依我看这[F這]样的看法在一般上也很好.做成这[F這]样都不错[F錯].但是说[F説]，还有一些辞职回家的妇[F婦]女默默无闻地操持家务，教育孩子等。[BC，],199809542542200024,越南,2,199809,如何看待“妻子回家“,65,65,24,46,64,248,未参加,
考试的几个月之前他既努力学习又打工。,199904123633200079,意大利,2,199904,如何面对挫折,70,75,45,57,65,301,未参加,
以后这种{CC2这}强度的困难出现{CC到}在我的身边，那时候我的心里是一动不动的{CJsd}。,199904123523200213,韩国,2,199904,如何面对挫折,65,65,42,52,54,262,未参加,
人在生活和工作中，或多或少总要遇到许多困难或挫折。,199904124529200290,泰国,2,199904,如何面对挫折,85,85,80,83,93,421,A,
