错句,作文编码,国籍,性别,考试时间,作文题目,口试分数,作文分数,听力分数,阅读分数,综合分数,总分,证书
并[B关]且，边走边抽烟非批评[B抨]不可的行为{CJs}。,200405204525200266,日本,2,200405,吸烟对个人健康和公众利益的影响,70,65,33,44,51,249,未参加,
而且这害处{CC2害}{CJ+sy是}不是只是影响自己，而是大家。,200405204525200278,日本,2,200405,吸烟对个人健康和公众利益的影响,60,70,36,37,51,239,未参加,
吸烟开始容易[BQ，]戒时[B是]难。,200405204525200318,日本,2,200405,吸烟对个人健康和公众利益的影响,65,70,44,47,29,241,未参加,
但是{CJ+zhuy我们}为了良好的空气[BQ、]良好的习惯[BQ、]良好的城市[BQ，]我们努力执行这种规定{CQ吧}。,200405204525200318,日本,2,200405,吸烟对个人健康和公众利益的影响,65,70,44,47,29,241,未参加,
吸烟者之中想戒烟的人，{CP他们都有戒烟的经验，觉得两三天{CD的话}可以戒烟，怎么戒也戒不掉{CJ+by烟}，P}那样的话我觉得更伤害他们的身体。{CJ+sy吸},200405205525100033,日本,1,200405,吸烟对个人健康和公众利益的影响,60,70,52,42,45,254,未参加,
如果把吸烟和吸毒等同{CC同视}{CJ-buy起来}，那么吸烟{CC香烟}是应该被禁止的。,200405205525100069,日本,1,200405,吸烟对个人健康和公众利益的影响,65,75,60,58,63,308,C,
我认为这个对吸烟[B引]者的措施有一定的效[F効]果和好处。,200405205525200102,日本,2,200405,吸烟对个人健康和公众利益的影响,60,85,55,61,70,320,未参加,
香烟里的有害物质会导致吸烟的人得各种致死的疾病{CC2病}，包括癌[C]症、[BC，]肺炎等。,200405201523200192,韩国,2,200405,吸烟对个人健康和公众利益的影响,60,70,30,44,40,229,未参加,
男女相识自是缘。,200410534533250029,新加坡,2,200410,最理想的结交方式,75,90,55,54,82,350,C,
在上大学时，最好男女双方都是同一所{CC间}大学，[BC、]学习同一科、当然最重要的是，最好住在大学的宿舍里。,200410534533250092,新加坡,2,200410,最理想的结交方式,85,90,69,72,80,392,B,
离婚的事不是没可能的{CD一会事}。,200410534533250095,新加坡,2,200410,最理想的结交方式,50,75,69,56,70,304,未参加,
结识异性朋友的方式有很多种。,200410534533250099,新加坡,2,200410,最理想的结交方式,95,80,83,65,91,410,B,
以下就从{CC以}个人方面{CJX}及公众利益来[F來]加以论[F論]说[F說][BD，]吸烟给[F給]人们带来的影响及改进办[F辨]法[F法]。,200405680519150027,马来西亚,1,200405,吸烟对个人健康和公众利益的影响,70,90,58,65,94,370,C,
许多社会人士因为遭受到工作和生活压力，以抽烟的方式来麻醉自己。,200405680519250033,马来西亚,2,200405,吸烟对个人健康和公众利益的影响,75,95,49,70,75,358,C,
每当我逛街购物时，都会看见很多年轻人、[BC，]中年人甚至老年人正在抽烟，经过他们身边时，我往往会有一种想呕吐的感觉。,200405680519250049,马来西亚,2,200405,吸烟对个人健康和公众利益的影响,65,95,55,65,89,360,C,
把这些优良的品质和品德培[B陪]养好也是提高中学生的品格修养。,200504534533250056,新加坡,2,200504,我对男女分班的看法,75,85,62,60,77,352,C,
虽然男女分班被认为可以避免学生早恋，但是我认为男女分班弊大于利。[BC.],200504534533150076,新加坡,1,200504,我对男女分班的看法,75,90,84,86,82,411,A,
如果你早期把男女分班的话，因接触少，他们以后可能与异性在沟[C]通和了解方面上会出现问题。,200504534533150101,新加坡,1,200504,我对男女分班的看法,65,70,76,65,70,332,C,
很明显地，家长也支持分班的。,200504534533250118,新加坡,2,200504,我对男女分班的看法,70,80,81,69,82,372,B,
我觉得分班是可在学校避免学生早恋，但这样不是最好的做法。,200504534533250159,新加坡,2,200504,我对男女分班的看法,65,70,65,73,70,329,C,
孩子很多东西都是[C]和父母[C]学的，所以在小的时候父母[C]做什么事情，孩子都会看在眼[C]睛[C]里[C]记[C]在心里的。{CP所以{CC而且},200505109525201280,日本,2,200505,父母是孩子的第一任老师,95,75,78,68,88,399,B,
他们带给孩子的影响将会关系{CC波及[B极]}到孩子的成功于否。,200505109610201293,法国,2,200505,父母是孩子的第一任老师,80,70,66,47,76,329,C,
我认为把自己的孩子{WWJ},200505109525101365,日本,1,200505,父母是孩子的第一任老师,75,70,64,64,71,333,C,
但是谁会{CQ给他们}打{CJ-buy下}最深刻的烙印呢？,200505109801201857,澳大利亚,2,200505,父母是孩子的第一任老师,60,45,61,49,69,262,未参加,
不管家长与子女接触的时间长，还是短，父母的生活习惯、工作、思想观念，肯定给孩子带来影响。,200505109525202087,日本,2,200505,父母是孩子的第一任老师,75,70,71,59,61,325,C,
因为对[C]孩子们来[C]说[BQ，]印象更深刻[C]的不是父母说什么，而是父母做什么。,200505109525202113,日本,2,200505,父母是孩子的第一任老师,70,75,56,69,74,333,C,
慎重自己的行动。,200505109525202220,日本,2,200505,父母是孩子的第一任老师,70,60,56,67,78,316,未参加,
而且我父母每年都会带我去[C]国外走一走。,200505109525202311,日本,2,200505,父母是孩子的第一任老师,90,80,63,59,72,359,C,
孩子看自己父母长大，如果父母没有遵守社会规律（比如，排队）孩子也不遵守。,200505109525202473,日本,2,200505,父母是孩子的第一任老师,60,50,48,59,63,260,未参加,
我的家庭有三口人。,200505109525202500,日本,2,200505,父母是孩子的第一任老师,70,60,56,69,74,314,未参加,
虽然这样做，有时感到有点不自在，但对于孩子来说，父母是他第一任老师，因此父母在孩子的面前所采取的态度是很重要的。,200505109525102544,日本,1,200505,父母是孩子的第一任老师,60,60,58,65,72,297,未参加,
所[C]以我现在[C]在做某件事之前，都会先[C]考[C]虑再做。,200505109525202606,日本,2,200505,父母是孩子的第一任老师,70,80,71,59,87,357,C,
这种看法没有错{CC1错误}。,200505205616200069,德国,2,200505,父母是孩子的第一任老师,65,65,58,59,67,298,C,
令我记忆犹[B忧]新、[BC，]印象{CC深刻}最深的是，当我四岁[B年]那年刚[D开]读小学时，父亲教我一笔一划的汉字。,200505212540200053,印度尼西亚,2,200505,父母是孩子的第一任老师,60,65,50,49,80,287,未参加,
如若不然，只有等缘[F緣]分[B份]到了。,200505522522150023,缅甸,1,200505,最理想的结交方式,80,90,84,64,84,397,B,
心理[B里]教育书多得很，使用的方法{CC2答}却很少。,200505209616200042,德国,2,200505,父母是孩子的第一任老师,90,65,48,57,72,323,C,
一到晚上要睡觉[BQ，]非要妈妈讲故事不可。[BD”],200505332529100001,泰国,1,200505,父母是孩子的第一任老师,60,55,71,67,54,288,未参加,
毫无[F無]疑问[F問]，政府推出的政策是有利于社会[F會]的。,200509105919200005,加拿大,2,200509,吸烟对个人健康和公众利益的影响,80,70,80,74,65,359,B,
我希望你们贵公司能让我有这{CQ个}机会，在你们的公司当广告设计师。,200509534519250012,马来西亚,2,200509,一封求职信,70,70,75,47,64,314,C,
因此，若贵公司能聘用我，我有信心在经理这{CQ个}职务上{CD能}发挥[F揮]我的优势。,200509534533150035,新加坡,1,200509,一封求职信,70,75,73,53,68,328,C,
工作勤奋、认真是我的优点。{CJ-zhuy我},200509534533250037,新加坡,2,200509,一封求职信,75,75,75,64,70,349,B,
[BD，]最使我{CC人}想要做导游的原因是因为我非常{CJ-sy喜欢}和人交谈，{CQ从而}从交谈中吸取新的知识。,200509534533250038,新加坡,2,200509,一封求职信,60,75,75,58,66,320,C,
毕业{CQ于}新加坡国立大学。,200509534533150056,新加坡,1,200509,一封求职信,70,80,52,49,77,318,未参加,
我的地址是123大明路。,200509534533250134,新加坡,2,200509,一封求职信,70,70,63,66,82,339,C,
本人叫×××，近日在《实况民报》中得知贵公司因业务发展的需要，有意招聘女导游，而本人又对这份工作有莫大兴趣，因此特致[B至]函前来。,200509534533250160,新加坡,2,200509,一封求职信,70,65,77,73,88,359,C,
在翻阅报纸时，看到了你刊登的招聘启事，于是决定写一封求职信，希望你会给我机会加入您的公司。,200509534533250161,新加坡,2,200509,一封求职信,70,70,75,64,84,351,C,
对于欧洲的各个{CC各各}旅游胜地，如称为浪漫都市的巴黎，称为古城的罗马与现为繁华都市的伦敦等都略有所闻。,200509534533250188,新加坡,2,200509,一封求职信,0,65,77,55,91,281,未参加,
一来，对生长期的学生们感情方面影响{CD了}{CD虚况}{CJy}，还影响学习方面。,200510111523200014,韩国,2,200510,我看流行歌曲,60,80,67,52,52,298,未参加,
我在山东省烟台市的师范[B氾]大学里学过汉语{CJX}一年。,200510111523100771,韩国,1,200510,我看流行歌曲,50,65,49,40,42,227,未参加,
学生应该踏实地专心学习。,200510111523200800,韩国,2,200510,我看流行歌曲,80,85,70,50,82,361,C,
那[BD，]不是直接说，但是[BD，]有很大的效果。,200510111523200844,韩国,2,200510,我看流行歌曲,60,70,51,50,52,268,未参加,
爱听流行歌曲的许多同学在学习的时候一边听流行歌曲，一边学习。,200510111523101041,韩国,1,200510,我看流行歌曲,60,75,86,75,62,344,C,
但这样的事情消除{CQ了}我的压力[B历]，而且带来了幸福感。,200510111523201072,韩国,2,200510,我看流行歌曲,55,75,56,61,69,301,未参加,
很多人喜欢听流行歌曲，特别是年轻朋友们几乎都喜欢，我也是其中之一。,200510111523101346,韩国,1,200510,我看流行歌曲,70,85,53,61,67,328,C,
这反映到社会中，而引起人类的共鸣{CC2共感带}。,200510111523101367,韩国,1,200510,我看流行歌曲,65,85,65,50,59,314,C,
我觉得这个方法很有效果。,200510111523201575,韩国,2,200510,我看流行歌曲,65,55,51,38,45,236,未参加,
他们被流行歌曲仍伤心{CJ？}。,200510111523201846,韩国,2,200510,我看流行歌曲,65,60,51,40,52,251,未参加,
他们认为流行歌曲是{CJX}基本上用爱情做，所以使大众容易记住容易感动{CJjy}，让人很容易买音乐。,200510111523201850,韩国,2,200510,我看流行歌曲,55,65,51,50,67,270,未参加,
当时，我好像不明白流行歌曲的内容似的。,200510111523201873,韩国,2,200510,我看流行歌曲,55,55,32,46,47,215,未参加,
我绝对[F對]认[F認]同父母是孩子的第一任老师[F師]，从[F從]小孩一张[F張]开[F開]眼睛{CQ开始}，父母便担[F擔]起了这[F這]份责任。,200510919919105302,加拿大,1,200510,父母是孩子的第一任老师,80,90,74,76,91,406,B,
极端消极的歌{CD中}和对世事带有报怨的歌曲是我讨厌的流行歌曲。,200510205919100142,加拿大,1,200510,我看流行歌曲,95,60,67,65,91,369,C,
但是我的一个朋友告诉我，她听了林俊杰的《[BC]会有那么一天》[BC]，她就对爱情又有信心了。,200510520520250007,蒙古国,2,200510,我看流行歌曲,75,70,56,71,69,330,C,
我不仅在心情好的时候，而且在心情不好的时候也听流行歌曲，它使我高兴的时候更加喜悦，悲伤的时候给我安慰。,200510302523200020,韩国,2,200510,我看流行歌曲,75,70,72,75,89,370,B,
我们应该爱我们的流行歌曲。,200510302523100026,韩国,1,200510,我看流行歌曲,60,65,42,38,52,240,未参加,
一些学生上课时偷着听流行歌曲而不听讲课。,200510302523100028,韩国,1,200510,我看流行歌曲,80,65,65,46,64,308,C,
艺术包含歌曲、文学、画儿。,200510302523100034,韩国,1,200510,我看流行歌曲,60,65,67,65,79,319,C,
孩子们整天学习，父母都希望自己的孩子望子成龙{CJZR}。,200510302523200039,韩国,2,200510,我看流行歌曲,75,60,53,30,52,256,未参加,
再次，但我觉得最重要的是[BD，]喜欢的程度。[BC，],200510302523200044,韩国,2,200510,我看流行歌曲,80,70,60,40,69,309,未参加,
特别{CJ-sy是}流行歌曲[BQ，]是每个人都很容易感受到的。,200510302523200048,韩国,2,200510,我看流行歌曲,85,70,65,56,69,336,C,
我们在非常紧张的社会里生活，在这样的生活当中我们不可避免紧张的心态，在这样的情况下人们听自己喜欢的音乐会让自己的心情放松一些。,200510302523100054,韩国,1,200510,我看流行歌曲,75,70,58,48,82,322,C,
但流行歌曲不会受到{CJX}百分之百听众的喜爱，[BC。]也有的人不爱听流行歌曲，[BC。]他们{CJX}因为不喜欢跟随流行，喜欢主张自己的意见。,200510302523200066,韩国,2,200510,我看流行歌曲,75,50,74,52,74,309,未参加,
也有的人{CJ-sy是}因为不喜欢被歌手痴迷。,200510302523200066,韩国,2,200510,我看流行歌曲,75,50,74,52,74,309,未参加,
一般人也很难唱。,200510302523100086,韩国,1,200510,我看流行歌曲,80,85,83,65,84,391,B,
所以流行歌曲对我们生活有一定的帮助。,200510302523100090,韩国,1,200510,我看流行歌曲,60,65,67,67,72,314,C,
但{CQ在}周围的人的指导下，我们可以正确地认识流行歌曲。,200510302523200094,韩国,2,200510,我看流行歌曲,60,75,67,46,62,296,未参加,
这又影响了最{CD流行}敏感的青少年的思想{CC主意}。,200510302523200103,韩国,2,200510,我看流行歌曲,90,55,65,63,72,334,C,
多好！,200510302523200104,韩国,2,200510,我看流行歌曲,75,70,44,40,47,265,未参加,
像这样很多人对流行歌曲有着各种各样的态度。,200510302523200159,韩国,2,200510,我看流行歌曲,70,70,56,46,69,299,未参加,
这是我为什么喜欢听流行歌曲的原因。,200510302523200208,韩国,2,200510,我看流行歌曲,95,80,83,65,77,396,B,
还有唱也好听。,200510302523200240,韩国,2,200510,我看流行歌曲,75,70,42,34,50,260,未参加,
我非常小基本不知道歌词的内容什么的，就喜欢它{CD的歌曲}。,200510302523200242,韩国,2,200510,我看流行歌曲,70,60,56,32,37,240,未参加,
流行歌虽然在{CC当}流行时很多人{CD的}喜爱，但是，过时间就像本来没有的歌一样消失了。,200510302523100245,韩国,1,200510,我看流行歌曲,65,70,53,44,57,275,未参加,
歌曲的内容，[BC、]如果内容比较新，从来没听过的内容就容易受欢迎了。,200510501529200076,泰国,2,200510,我看流行歌曲,70,65,51,38,50,260,未参加,
因为学习是一件对小孩来说{CJ+sy是}非常闷的事情，[BC。]如果他觉得{CC2觉}听音乐比学习有趣，[BC。]那就使他不认真学习了。,200510529529151026,泰国,1,200510,我看流行歌曲,65,70,70,52,79,322,C,
不过你走到那里也常会听到有人播放这首歌。,200510540540200014,印度尼西亚,2,200510,我看流行歌曲,45,70,60,48,57,262,未参加,
对我来说，流行歌曲是一些比较容易学习的歌曲[BQ，]非常普遍的{CJsd}，有{CQ很}多种类，有轻快的[BQ，]有慢节奏{CC2奏}的[BQ，]都能带来轻松心情[BQ。]还有其优点除了创作较易，又能跟随潮流走，且走得快。,200510540540200050,印度尼西亚,2,200510,我看流行歌曲,75,50,60,46,87,302,未参加,
有一天走在街上，不小心被人打劫{CC打抢}，幸亏有一个见义勇为{CC见义有为}的男子出手相助，从此一颗心就系在他身上……诸如此类的相恋模式是小说{CC小话}戏剧首选的题材。,200505680519250002,马来西亚,2,200505,最理想的结交方式,80,90,91,82,91,429,A,
时下的男女，请珍惜自己和某某的缘啊！,200505680519250003,马来西亚,2,200505,最理想的结交方式,80,80,66,53,82,353,C,
在恋爱时可能为了讨好对方，能互相迁就，但结婚后长期如此就会觉得痛苦，[BC；]{CQ以}分手收场。,200505680519250004,马来西亚,2,200505,最理想的结交方式,85,90,79,75,86,411,B,
父母的行为可以深深地{CC的}改[B该]变一个人。,200509602801250014,澳大利亚,2,200509,父母是孩子的第一任老师,65,75,85,58,77,347,C,
好吧，我先写这么多，现在我要上课去{CQ了}。,200104124542200026,越南,2,200104,一封写给父母的信,80,80,60,51,54,317,C,
但有时候，我也觉得很寂寞[Pjimo]，但给我朋友{WWJ},200104124540200193,印度尼西亚,2,200104,一封写给父母的信,65,60,25,30,31,194,未参加,
我在北京的生活很好，环境也不错，虽然学习方面有些困难可是到目前为止我可以克服它。,200104124540200244,印度尼西亚,2,200104,一封写给父母的信,65,85,52,54,72,318,C,
这几年来，我一直没有生病，每年冬天流行什么感冒，我只照顾别人。,200104124525200268,日本,2,200104,一封写给父母的信,70,80,44,54,54,292,未参加,
所以我觉得用不着写信给你们了{CC呢}。,200104124525200303,日本,2,200104,一封写给父母的信,75,65,77,70,79,353,B,
所以我用这个学期来用功学习，好好生活。,200104124523200370,韩国,2,200104,一封写给父母的信,65,80,63,51,51,298,C,
我{CC在}这儿的天气变化大一点儿，所以得{CD了}感冒的人很多。,200104124523200458,韩国,2,200104,一封写给父母的信,65,80,36,23,27,219,未参加,
爸爸工作怎么样，[BC？]一切都顺利吗？,200104124523100463,韩国,1,200104,一封写给父母的信,65,65,38,25,42,219,未参加,
以前我在日本京都外国语大学学过三年中文。,199200206525100012,日本,1,199200,一封求职信,,,0,0,0,0,未参加,
现在{CD的}上海的行业前景{CC社会风气}来看，服装是最有希望的行业{CC公司}。,199200204525100023,日本,1,199200,一封求职信,,,0,0,0,0,未参加,
我在去年刚刚{CQ从}学校毕业，所以经验方面，比其他[B它]设计师较差{CJbi}，但[BD，]我{CQ一定}为贵公司的发展[BD，]发挥所有的力量，做出贡献。,199200204525100032,日本,1,199200,一封求职信,,,0,0,0,0,未参加,
我已大学毕业了，身高1.75米，已[B己]有了当模特的经验。,199200204539200042,印度,2,199200,一封求职信,,,0,0,0,0,未参加,
我希望得{CQ到}{CQ这}份工作[BQ，]主要是因为我对商业[L]很感兴趣[BQ，]也比较重视产品的质量。,199200204729100005,马里,1,199200,一封求职信,,,0,0,0,0,未参加,
现在{CC接着}，让我介绍我的简历。,199200008525200020,日本,2,199200,一封求职信,,,0,0,0,0,未参加,
丈夫帮助心爱{CC情爱}的妻子自杀，这是很难理解。,199604124635200109,俄罗斯,2,199604,如何看待“安乐死”,65,50,29,39,34,197,未参加,
一直到现在还没一定的答案。,199604124529100259,泰国,1,199604,如何看待“安乐死”,70,65,32,27,52,231,未参加,
从法律上来看[C]，“安乐死”是违[C]法{CJsd}。,199604123523100268,韩国,1,199604,如何看待“安乐死”,60,55,42,42,47,227,未参加,
因此佛教对[C]这[C]种问题“安乐死”的看[C]法[C]肯[C]定表示十分不同意。,199604123529200274,泰国,2,199604,如何看待“安乐死”,97,65,50,57,47,307,C,
有生命而生活下去，包括[B抱]面对死的态度。,199604123523200286,韩国,2,199604,如何看待“安乐死”,65,60,74,54,67,303,C,
妻子得了不治{CD之}的重病，非常痛苦而自己知道她迟早总会死的，[BC。]所以对她来说早点儿死也无所谓。,199604124520200093,蒙古国,2,199604,如何看待“安乐死”,65,75,45,64,44,280,未参加,
即使感情上这么办觉得不合适，还是要制裁，法律上是这样的。,199604123525100218,日本,1,199604,如何看待“安乐死”,65,65,53,47,42,256,未参加,
所以，父母与[C]子女之间往往有代沟的问题[F題]出现。,199610802543200020,香港地区,2,199610,如何解决“代沟”问题,90,85,65,46,63,346,C,
代沟[F溝]的问题[F題]才能解决。,199610802543200022,香港地区,2,199610,如何解决“代沟”问题,85,80,78,79,84,399,B,
中国随着经济建设提高了人们的生活水平，年轻一代的就会{CJX}{CJ+sy出现}生活态度和上一代的有所不同。,199610512501250009,中国,2,199610,如何解决“代沟”问题,70,80,65,42,65,312,C,
这不是很可惜[C]的吗？,199610550523290040,韩国,2,199610,如何解决“代沟”问题,70,60,68,63,59,305,C,
对代沟我的看法是这种现[C]象是免不了的。,199610550523190055,韩国,1,199610,如何解决“代沟”问题,70,75,0,50,53,237,未参加,
随着时代的变化，我们的想法跟旧思想的想法不同、有矛盾。,199610550523290076,韩国,2,199610,如何解决“代沟”问题,65,60,36,32,41,217,未参加,
在这一过程中，我们的长辈立下了汗马功劳，以公而忌私的精神置自身的利益[C]于不顾，为国家经济发展，全力以赴、作出努力。,199610550523290083,韩国,2,199610,如何解决“代沟”问题,80,85,68,71,76,374,B,
如果父母能对[F對]子女在外的生活和表现[F現]有{CJX}多一些理解，对[F對]消除{CC改善}代沟[F溝]有一定的帮[F幫]助。,199611543501100526,中国,1,199611,如何解决“代沟”问题,75,85,78,73,88,392,B,
其实[F實]，只要大家能够尊重对方不同的看法和处[F處]事方法，从[F從]对方的立场[F場]来[F來]考虑[F慮]同一件事情{CC事件}，接受不同意见[F見]的存在，问题就不会存在。,199611543501100524,中国,1,199611,如何解决“代沟”问题,80,85,99,73,84,415,B,
不消一年光景，陈老伯所遗留下的这间杂货店生意一落千丈，最后关门大吉。,199603533533200008,新加坡,2,199603,由“三个和尚没水喝”想到的……,85,80,58,58,77,351,C,
你希望得到所要的。,199603533533100018,新加坡,1,199603,由“三个和尚没水喝”想到的……,85,65,58,76,82,355,C,
大家为美好的明天而努力。,199603533533200037,新加坡,2,199603,由“三个和尚没水喝”想到的……,90,90,66,70,82,396,B,
原来是人多了，大家都希望别人下山去抬水。,199603533533100059,新加坡,1,199603,由“三个和尚没水喝”想到的……,95,80,71,72,94,408,B,
在一个小镇[F鎮[C]]上，秀秀是经[C]营[F營]卖[F賣]义烧[F燒]包生意的。,199604680519200520,马来西亚,2,199604,由“三个和尚没水喝”想到的……,80,75,63,42,61,312,C,
大家都渴{CJ+buy起来}了，没有力气，而且话{CJX}也没说，[BC。]大家都互相看别人的脸上表情{CC4脸色}。,199605104523100016,韩国,1,199605,由“三个和尚没水喝”想到的……,75,60,63,60,56,300,C,
过{CQ了}一段时间，新来的和尚当中最年轻的一个和尚向那个讲话的和尚说[BQ：]“我们来这里来得比你[C]晚是对{CJsd}，但是，你[C]呢，比我们喝水喝得更多吧，所以，你应该为我们喝{CQ得}少的和尚服务，你{CJX}应该去山下抬水，[BC。]对不对[BQ？]”听完他的话，别的和尚[C]都同意了，来得最早的和尚无法{CD继续}反对，[BC。]他一个人去山下抬水了。,199605104523100016,韩国,1,199605,由“三个和尚没水喝”想到的……,75,60,63,60,56,300,C,
和尚们[BD，]{CJ+zhuy他们}都不愿意去山下抬水，而是{CC而且}都希望别人去山下抬水。,199605104525200024,日本,2,199605,由“三个和尚没水喝”想到的……,65,75,49,67,89,332,C,
这种局面产生“谁也不行动”的问题。,199605104634200038,英国,2,199605,由“三个和尚没水喝”想到的……,90,70,63,74,87,377,C,
现[F現]在{CD在}地球上的资源，比如石油资源[BQ，]是有限的。,199605104525100055,日本,1,199605,由“三个和尚没水喝”想到的……,70,55,66,54,44,273,未参加,
虽然生活上已经习惯了，没有问题，可是我心里{CD上}{CJ+sy有}一片空虚。,199605104523100113,韩国,1,199605,由“三个和尚没水喝”想到的……,65,65,74,54,63,305,C,
但是我猜想它{CQ是}提醒我们不应该嫌麻烦，{CD和}应该负责任。,199605104525200180,日本,2,199605,由“三个和尚没水喝”想到的……,65,60,58,60,68,294,C,
人想达到{CC得到}目的，或者满足需要的时候，如果只有自己一个人，除了自己以外，连一个人也没有可依靠{CC2靠}的，他只好自己动手达到{CC得到}目的[BD，]或满足需要。,199605104525100195,日本,1,199605,由“三个和尚没水喝”想到的……,65,55,66,74,75,317,C,
几个人一起做某件{CC个}事情，[BC。]经常发生这些问题，[BC。]我们的目的一样，[BC。]可是谁也不想{CJ-sy花}自己的劳力、[BC，]钱等等。,199605104525100224,日本,1,199605,由“三个和尚没水喝”想到的……,65,65,46,45,42,247,未参加,
大部分的人把这个靠别人的办法或者意思误解{CQ了}；大部分的人轻易地采取简单的办法。,199605104525100286,日本,1,199605,由“三个和尚没水喝”想到的……,65,70,35,49,42,247,未参加,
这精神是否{CQ和}中国传统的“个人主义”有关？,199605104525200303,日本,2,199605,由“三个和尚没水喝”想到的……,65,65,41,58,68,281,未参加,
那时如果我明白他帮助自己的原因是图钱[C]什么的话，我一定觉得难[C]受。,199605104525100347,日本,1,199605,由“三个和尚没水喝”想到的……,80,60,35,54,51,267,未参加,
后来又来{CQ了}一个和尚，于是两个人就抬水喝。,199605104610100357,法国,1,199605,由“三个和尚没水喝”想到的……,55,50,27,42,27,180,未参加,
将[C]自己的事推给别人{CC人家}做。,199605550523290022,韩国,2,199605,由“三个和尚没水喝”想到的……,70,60,77,76,56,324,C,
