错句,作文编码,国籍,性别,考试时间,作文题目,口试分数,作文分数,听力分数,阅读分数,综合分数,总分,证书
那么，两代人之间存在的“代沟”问题如何解决呢？,200209550523250791,韩国,2,200209,如何解决“代沟”问题,70,70,48,71,50,297,C,
代沟在我们日常生活里是经常有的。,200209550501250861,中国,2,200209,如何解决“代沟”问题,75,75,78,69,76,363,B,
在公司里，经过谈话，老板跟职员可以说出自己的意见、要求事项、不满的事情。,200209550523250894,韩国,2,200209,如何解决“代沟”问题,70,60,51,81,54,301,未参加,
对年青人来说，父母总是说{CJX}这样，不努力理解自己的孩子[B了]，怎{CD能}可以当孩子的“[BC‘]朋友”[BC’]。,200209550523250933,韩国,2,200209,如何解决“代沟”问题,65,70,57,59,50,287,C,
今日的年轻人是电脑时代。,200209550523250942,韩国,2,200209,如何解决“代沟”问题,65,65,45,47,42,248,未参加,
谈话是重要的解决[C]方法之一。,200209550523250968,韩国,2,200209,如何解决“代沟”问题,75,65,60,64,68,319,C,
代沟由于父母与子女之间在行为方式、生活态度、价值观念[C]等方面存在的差异而产生。,200209550523250970,韩国,2,200209,如何解决“代沟”问题,65,60,48,62,48,266,未参加,
对我来说，最大的挫折是考不上大学{CC高考}。,200205109542200002,越南,2,200205,如何面对挫折,70,75,65,54,68,321,C,
这样状况下丈夫不让妻子去世就是不人道。,200205271525100098,日本,1,200205,如何看待“安乐死”,75,80,35,54,63,298,未参加,
为了避免痛苦，把自己的生命自己{CJX}放弃{CJba}，我认为对生命太不尊重。,200205271525100113,日本,1,200205,如何看待“安乐死”,70,85,74,70,70,361,B,
我们人类在世界上生活，都会受到不同外界{CQ条件}影响，人与[F於]人之间的相处[F處]都会受到彼此的伤[F傷]害，而这些伤害都可能是我们想象不到的。,200304522522110015,缅甸,1,200304,静音环境对人体的危害,65,65,42,55,63,274,未参加,
而且要继续开发没有害的农药。,200307109523100047,韩国,1,200307,绿色食品与饥饿,70,70,83,64,76,351,C,
但是理解“绿色食品”的意思的人都拼命地买中国有机蔬菜[L]。,200307109525100042,日本,1,200307,绿色食品与饥饿,65,75,59,51,61,298,C,
总得来说，在“绿色食品”和“不挨饿”的问题当中，“不,200307109523200077,韩国,2,200307,绿色食品与饥饿,65,70,64,62,56,303,C,
使用化肥和农药的农作物肯定对身体不好。,200307109523200102,韩国,2,200307,绿色食品与饥饿,65,65,48,41,64,267,未参加,
这[C]也是经济发展优先[C][BD，]还[C]是保护环境优先的问题[B提]吧。[BC.],200307109523200125,韩国,2,200307,绿色食品与饥饿,65,70,70,62,79,332,C,
把这样的食品给挨饥饿的人民，就是雪上加霜，[BC。]对他们的身体也有严重的影响。,200307109523100197,韩国,1,200307,绿色食品与饥饿,65,70,64,49,79,313,C,
如果人们少食[BQ“]绿色食品[BQ”]的话，那些[BQ“]绿色食品[BQ”][BD，]会剩下来，那么我们可以分给那些挨饿的几亿人口。,200307109523200200,韩国,2,200307,绿色食品与饥饿,65,60,80,51,81,320,未参加,
这样的话，我[C]们[L]应该限制化肥和农药[B它]的使用。[BC.],200307109523200265,韩国,2,200307,绿色食品与饥饿,65,80,78,64,76,351,C,
第一，各国政府应该努力发展农业。,200307109523200271,韩国,2,200307,绿色食品与饥饿,70,85,83,78,81,389,B,
粮食的缺乏问题应该依靠当今这么快速发展的科学技术的进步，谋求更适当的方法。,200307109523200319,韩国,2,200307,绿色食品与饥饿,65,85,67,56,76,339,C,
那我们可以利用这些{CC这[C]样}过[C]量的食品[BD，]或材料[BQ，]捐给别的国家{CJba}，尤其是现在挨饿的国家{CC怎么样}？,200307109525200329,日本,2,200307,绿色食品与饥饿,65,85,78,64,73,355,C,
据各类资料表明，随着环境污染的加重{CC深}，使那些破坏农作物的物质对农药的抵抗力增强，[BC、]迫使人们用更加厉害的农药与化肥来培养农作物。,200307109523200364,韩国,2,200307,绿色食品与饥饿,80,90,88,75,93,421,B,
另[B别]外，大家要注[B主]意的就是食物垃圾的问题。[BC.],200307109523200393,韩国,2,200307,绿色食品与饥饿,65,75,70,67,70,334,C,
我觉得吃绿色食品不如解决饥饿问题更重要。,200307109523100394,韩国,1,200307,绿色食品与饥饿,65,80,59,41,61,294,未参加,
饥饿的问题也是其中之一。,200307109523200447,韩国,2,200307,绿色食品与饥饿,65,90,75,70,90,381,B,
虽然[BD，]我们要解决饥饿的问题，但是[BD，]为了人类[B娄]的未来，我们还坚持生产绿色食品。,200307109523200447,韩国,2,200307,绿色食品与饥饿,65,90,75,70,90,381,B,
并且[BD，]目前流行的有机生产{CC农法}农作物也是很受欢迎的。,200307109523200457,韩国,2,200307,绿色食品与饥饿,70,65,67,70,76,334,C,
十几年前，在日本的熊本县发生了严重的环境污[C]染问题。,200307109525200450,日本,2,200307,绿色食品与饥饿,65,80,83,59,67,342,C,
价[B阶]格比一般的食品贵的“绿[C]色食[C]品”可能给很多老百姓增加{CC添加}金钱[C]上的负担。[BC.],200307109523100548,韩国,1,200307,绿色食品与饥饿,75,70,78,64,76,352,C,
饥饿和绿色食品有什么关系呢?[BD。]{CP如果我们要绿色食品不{CD能}用化肥和农药，[BC.]这是农业生产品减[B咸]{CJ-buy少}了很多{CJjy}。,200307109523100606,韩国,1,200307,绿色食品与饥饿,60,55,40,38,53,227,未参加,
但是，非洲[B州]的情况却正好相反，{CQ对}他们来说“饥饿”是一种灾难，每年由于饥饿死去的人数达到成千上万，许多先进国家无条件去帮助他们，但还是不够的。[BC，],200307217523100017,韩国,1,200307,绿色食品与饥饿,80,65,78,72,81,364,B,
不过[C]农药问题也人类不能忽[C]视，因为这[C]是对人类长期的危胁。[BC.],200307217523200059,韩国,2,200307,绿色食品与饥饿,60,70,88,70,84,357,C,
因为这样的食品好好洗也洗不掉{CC了}农药，所以吃洗{CJX}没干净{CC完}的食品的人体内化学成分就越来越多。{CP如果这[C]样的人生孩子的话，这[C]个孩子也会有问题{CC不好},200307217523100072,韩国,1,200307,绿色食品与饥饿,50,60,38,27,27,182,未参加,
所以在短时间内人类要合理利用耕地，等待科学有进一步的发展。,200307217523100077,韩国,1,200307,绿色食品与饥饿,60,70,75,64,90,344,C,
因为[C]不用化肥和农药不能吃也增加饥饿。[BC.],200307217523200080,韩国,2,200307,绿色食品与饥饿,60,60,59,30,56,247,未参加,
我自己的想法[B思]，[BC？]有一些嫌化学食[C]品，但是，[BC.]现代社会里应该要吃吧,200307204525100093,日本,1,200307,绿色食品与饥饿,60,50,51,46,61,248,未参加,
两者都有益有害。,200307205525100046,日本,1,200307,绿色食品与饥饿,70,65,64,56,96,337,C,
虽然如此，使用了化学物品的农作物，由于受到了不同程度上的污染，吃了会有害于人的身体健康。,200307205523100065,韩国,1,200307,绿色食品与饥饿,65,65,70,70,90,344,C,
用化肥和农药，虽然能给农民带来很多收益。,200307205523200074,韩国,2,200307,绿色食品与饥饿,70,65,56,49,61,287,未参加,
但他们[B门]没办法{CD有}处理问题。,200307205523100125,韩国,1,200307,绿色食品与饥饿,65,60,35,33,38,214,未参加,
为了尽量地减少这些痛苦不堪的人，为了解救他们，最好的办法就是尽量提高产量，而为了提高产量，就须使用化肥和农药，就无法生产绿色食品。[BC.],200307212523100024,韩国,1,200307,绿色食品与饥饿,75,90,80,75,93,407,B,
虽然“绿色食品”也是通[C]过[C]机器或者人的加工而生产的，但现代人们[C]的生活上成为了不可缺乏[B泛]的东西了。,200307212523100062,韩国,1,200307,绿色食品与饥饿,70,75,70,56,64,324,C,
饥饿的程度很厉害，[BC、]甚至是几秒钟死掉一个小孩。,200307212525200063,日本,2,200307,绿色食品与饥饿,70,70,51,49,64,292,未参加,
我们对农药的理解深刻，就会考虑到不饿的问题。,200307209525100056,日本,1,200307,绿色食品与饥饿,65,65,59,67,70,310,C,
每天每时，感觉到挨饿。[BC.],200307201523200023,韩国,2,200307,绿色食品与饥饿,70,60,54,35,41,245,未参加,
但在有一些发达国家，他们的粮食足够，所以只追求{CC需求}高质量的食品，也就是“绿色食品”[BQ。]有的人主张“绿色食品”更好，有的人认为不挨饿还是人类能生存的唯一渠道。,200307201523200059,韩国,2,200307,绿色食品与饥饿,75,65,80,64,87,358,C,
随着科技的发展，人们的生活水平{CC素质}大大提高了。,200307201523100067,韩国,1,200307,绿色食品与饥饿,65,65,70,70,84,338,C,
为了解决这一重要的、影响我们生存的问题，现在我们人类不得不采用大量生产的方式。,200307201525100101,日本,1,200307,绿色食品与饥饿,65,70,62,54,81,318,C,
为了解决整个地球的挨饿现象，我觉得还是饥饿问题放在首位{CJba}。,200307302523100003,韩国,1,200307,绿色食品与饥饿,80,65,70,59,73,335,C,
能解决这[C]个问题。,200307302523100093,韩国,1,200307,绿色食品与饥饿,70,60,64,51,61,291,未参加,
还有最后的方法是，可以直接收购[BD，]已加工好的食品。,200307206523100022,韩国,1,200307,绿色食品与饥饿,80,80,70,62,87,371,B,
可是吃绿色食品也很重要。,200307206523200042,韩国,2,200307,绿色食品与饥饿,65,65,59,54,67,294,C,
这[C]是比你选择今晚吃什么还要重要的事。,200307206523200067,韩国,2,200307,绿色食品与饥饿,75,85,72,59,84,368,B,
可是如果我们[C]不用化肥和农药[C][BQ，]农作物的产量又会大大地{CC的}降低，[BC、]{CP这{CC那}[C]是因为如果{CC2如}我们用化肥或者{CC还[C]是}{CD用}农药[C][BQ，]{CQ就}好像[B象]给[C]植物{CC动物}加了一点营养{CC2养}。P},200307332540100002,印度尼西亚,1,200307,绿色食品与饥饿,70,55,30,14,30,183,未参加,
如果我们一直坚[F堅]持使用化肥和农药来提高农作物的生产[F產]量的话，会使全球人民的健康受到很大的危害，还不如让这世界上一部分[B份]{CD的}人挨饿。,200307332523100024,韩国,1,200307,绿色食品与饥饿,60,75,80,78,73,352,C,
有什么理由？,200310576525100004,日本,1,200310,我对男女分班的看法,70,75,36,63,67,300,未参加,
日本也是{CJX}大部分学校采用男女混合式教育，尤其是在公立学校{CD方面}，除了几所女子大学以外都是采用男女混合式教育，但是在私立学校{CD方面}，从小学开始采用男女分班式教育的学校也不少。[BC，],200310576525100020,日本,1,200310,我对男女分班的看法,60,70,79,58,63,315,C,
有人说，学生应在青年时代享受青春，我也同意。,200310576525100023,日本,1,200310,我对男女分班的看法,65,65,66,70,74,324,C,
我家乡在新泻县村上市。,200310576525100069,日本,1,200310,我对男女分班的看法,80,65,68,75,74,350,C,
现代的生活{CD节奏}太过紧张{CC紧凑}，所以我们在作一个学富五车的人之余，也要懂得怎样“有效阅读”。,200310540540250051,印度尼西亚,2,200310,谈有效阅读,65,90,77,73,95,391,B,
我们阅读的时候，不要在吵闹的地方，应该找安静的地方。,200310540540250077,印度尼西亚,2,200310,谈有效阅读,65,70,59,53,68,301,C,
为了增加我们的学识，提高我们的素质，阅读是我们不可缺的了。,200310540540250082,印度尼西亚,2,200310,谈有效阅读,65,70,59,44,86,310,C,
而这个世界上，除了英语之外，我觉得汉语是第一要掌握的。,200304131540200110,印度尼西亚,2,200304,我学汉语是为了……,85,85,50,57,80,352,C,
是以[BD，]各取所长，各补其[B期]短，是{CD效诸}全人类所应共有的学习态度，哪怕是向[B何]大自然学习，亦是必须的。,200306680519150023,马来西亚,1,200306,我对男女分班的看法,75,85,80,72,81,386,B,
男女学生在学校相处的时间有限，而基本上学校都{CQ有}校规，男女学生不见得可以随心所欲在大庭广众前谈情说爱。,200306680519150056,马来西亚,1,200306,我对男女分班的看法,80,80,77,68,90,387,B,
我们每天都需要吃一些食品，来抵抗{CC补充}我们的饥饿。,200307271523100084,韩国,1,200307,绿色食品与饥饿,75,65,75,70,81,353,B,
我认为，吃“绿色食品”和不挨饿这[C]两个目标都是我们应该实现的。,200307271525200082,日本,2,200307,绿色食品与饥饿,70,70,64,72,84,348,C,
随着人们生活水平{CQ的}提高，人们的健康意识也日益提高{CC2高}。,200405109523200352,韩国,2,200405,吸烟对个人健康和公众利益的影响,70,75,52,60,57,303,C,
吸烟者常常说吸烟后就感觉很舒服，所以很多吸烟者起床后、吃饭后{CQ就}马上吸烟，这对身体非常不好。,200405109523200531,韩国,2,200405,吸烟对个人健康和公众利益的影响,85,70,59,64,53,322,C,
我们在街上走路的时候，{CD就}很容易看到不少的人一边走路一边抽烟。,200405109523200548,韩国,2,200405,吸烟对个人健康和公众利益的影响,95,65,71,64,68,355,C,
不仅如此，他们为了自身{CC2自己本身}的[C]健康，最好不要吸烟，寻找能消除压力{CC大力}，有助于{CC3助于}交流的方式。{CP吸烟[C]毕竟是个人的爱好，但是他们[C]学会着想{CJX},200405109523200561,韩国,2,200405,吸烟对个人健康和公众利益的影响,90,70,67,60,55,335,C,
众所周知，吸烟对个人健康非常不好，而且威胁周围人的健康。,200405109523200564,韩国,2,200405,吸烟对个人健康和公众利益的影响,90,65,69,46,66,327,C,
首先，吸烟对个人健康有不好[C]的影响。,200405109523100587,韩国,1,200405,吸烟对个人健康和公众利益的影响,80,60,48,58,55,288,未参加,
一周前[C]，我在网上看了烟里的几百{CQ种}有害的原料，[BC。]其中有几个原料{CQ如}尼古[L]丁[L]可以使[C]人死亡{CC2死}。,200405109523200590,韩国,2,200405,吸烟对个人健康和公众利益的影响,65,55,57,50,59,268,未参加,
但是现在呢？,200405109523100604,韩国,1,200405,吸烟对个人健康和公众利益的影响,70,65,50,50,39,260,未参加,
因为，如[C]果我家人吸烟的话，虽然我不吸烟，但是我很可能[C]得各种各样的病，[BC。]所以我觉得随便吸烟的习惯应该改变。,200405109523200601,韩国,2,200405,吸烟对个人健康和公众利益的影响,70,65,43,56,57,277,未参加,
比如说在公共场所很多人抽烟以后乱扔烟头和烟灰引[B因]起了环境问题，特别是在人口密集的商业中心容易{CJX}常常因吸烟者乱扔的烟头引[B因]起{CD了}很大的火[B人]灾。,200405109523100614,韩国,1,200405,吸烟对个人健康和公众利益的影响,70,70,71,66,75,340,C,
不利的影响的话，{CJ+zxy这件事[C]}请[C]政府替别的人保护{CC保持}他们的权[B传]力，他们的从吸烟可以离[C]开的自由{CJ？}。P},200405109523100617,韩国,1,200405,吸烟对个人健康和公众利益的影响,70,60,48,35,46,244,未参加,
不喜欢烟味儿，[BC。]不过跟抽烟的人在一起的话，他们不得不离开{CC2离不开}这个地方，[BC。]但{CD在}他们的心里{CD上}希望离开这个地方。,200405109523100624,韩国,1,200405,吸烟对个人健康和公众利益的影响,90,60,55,60,57,312,未参加,
我听说，在韩国的某一条路{CQ上}也不能随便[B边]抽烟。,200405109523100624,韩国,1,200405,吸烟对个人健康和公众利益的影响,90,60,55,60,57,312,未参加,
可是，世界上{CC中}一定有不能保护{CC保持}环境的人{CC1人民}。,200405109525100675,日本,1,200405,吸烟对个人健康和公众利益的影响,70,65,33,31,44,229,未参加,
为了保持市容整洁也需要{CJ-by禁烟}！{CD这样},200405109523100687,韩国,1,200405,吸烟对个人健康和公众利益的影响,55,65,50,46,59,257,未参加,
吸烟者虽然第一次吸烟时不知道体内的变化，但是越抽越感觉到身体变弱了。,200405109523200699,韩国,2,200405,吸烟对个人健康和公众利益的影响,65,60,67,60,50,285,C,
最近在所有的办公楼、饭店等很多公共场所不准[C]抽烟，但在有些餐[C]厅还是随时随处[C]可以抽烟，[BC。]这种事情{CJ+sy是}我希望改革。,200405109525100750,日本,1,200405,吸烟对个人健康和公众利益的影响,65,60,43,54,48,253,未参加,
所以吸烟者在哪儿可以抽烟等等[C]{CJ-wy需要考虑}。,200405109525200780,日本,2,200405,吸烟对个人健康和公众利益的影响,60,60,28,35,23,188,未参加,
抽烟[B咽]是对人很不好的东西{CJZR}，[BC。]而[C]且根本{CJX}各种各样的病基础{CJX}的{CJs}。,200405109523200813,韩国,2,200405,吸烟对个人健康和公众利益的影响,50,60,26,29,39,184,未参加,
为什么呢？,200405109525100891,日本,1,200405,吸烟对个人健康和公众利益的影响,75,70,57,52,48,291,未参加,
吸烟当然损害自己的身体，而且长期持续{CC继续}吸烟的话，得严重的病的可能性特别大。,200405109525200932,日本,2,200405,吸烟对个人健康和公众利益的影响,55,60,43,48,41,228,未参加,
边走边吸烟确[C]实[B是]太麻烦。,200405109525200960,日本,2,200405,吸烟对个人健康和公众利益的影响,80,60,64,73,68,332,C,
害处之四是对怀[C]孕的[C]人以及她将来的孩子也有不[C]利作用[BQ。]P}以[C]上这{CJX}方面[C]四[D上]说明了吸烟的害处[BQ。],200405109523201148,韩国,2,200405,吸烟对个人健康和公众利益的影响,60,60,55,56,55,268,未参加,
但[BD，]其实{CJX}禁烟这种事情非常难。,200405109523201383,韩国,2,200405,吸烟对个人健康和公众利益的影响,60,60,48,39,41,230,未参加,
比如，使在不允许吸烟的地方吸烟的人{CC2者}付很多的罚,200405109523201388,韩国,2,200405,吸烟对个人健康和公众利益的影响,60,65,64,50,46,268,未参加,
随后{CC随之}，很多发展中国家发布有关规定的情况也屡见不鲜。,200405109525201406,日本,2,200405,吸烟对个人健康和公众利益的影响,90,65,76,68,84,374,B,
政府的“公共场所不准吸烟”{CQ的}规定是应该的。,200405109523101432,韩国,1,200405,吸烟对个人健康和公众利益的影响,70,65,67,66,70,324,C,
全世界早已有了戒烟的潮流，而最近，中国也加入{CC列入}了其队伍。,200405109523201475,韩国,2,200405,吸烟对个人健康和公众利益的影响,85,90,59,83,91,404,B,
最后，吸烟对社会健康有害。,200405109523201475,韩国,2,200405,吸烟对个人健康和公众利益的影响,85,90,59,83,91,404,B,
吸烟本来对{CC给}有些人{CJ-sy产生}精神安定的作用。,200405109525201498,日本,2,200405,吸烟对个人健康和公众利益的影响,75,75,64,60,64,328,C,
那么吸烟者都不知道吸烟时{CJ-zhuy烟}对健康和公众利益的影响吗？,200405109523101528,韩国,1,200405,吸烟对个人健康和公众利益的影响,50,60,40,44,48,222,未参加,
吸烟者应该体会{CC4让给}非吸烟者痛[B通]苦的感觉。,200405109523201544,韩国,2,200405,吸烟对个人健康和公众利益的影响,60,60,55,58,46,261,未参加,
吸不吸烟是个人的问题，应该自己选择。,200405109525101687,日本,1,200405,吸烟对个人健康和公众利益的影响,70,65,50,70,57,298,C,
现在由国家来负责，应该解决吸烟的问题。,200405109525201689,日本,2,200405,吸烟对个人健康和公众利益的影响,60,65,52,56,61,277,未参加,
吸烟可以得肺癌[C]，呼吸器不正常{CJjy}。,200405109523201792,韩国,2,200405,吸烟对个人健康和公众利益的影响,65,60,55,54,46,263,未参加,
一旦[C]得{CC发生}肺癌，{CQ就}难以恢[B回]复。,200405109523201799,韩国,2,200405,吸烟对个人健康和公众利益的影响,70,70,55,64,55,302,C,
现[C]在的[C]变化对他们来说，很[C]高兴{CJcd高高兴兴}的[C]。P},200405109523201823,韩国,2,200405,吸烟对个人健康和公众利益的影响,65,75,83,68,53,331,C,
我想这次{CQ的}决定可能出于对别人健康的考虑[F慮]，我也有所理解{CJX}{CQ对}这一点。,200405109525201876,日本,2,200405,吸烟对个人健康和公众利益的影响,70,80,76,73,75,364,B,
健康对人来说，很重要的{CJsd}。,200405109523101883,韩国,1,200405,吸烟对个人健康和公众利益的影响,65,65,28,44,44,230,未参加,
比如对工作人员来说，吸烟具有减[C]少工作压力等作用。,200405109523201886,韩国,2,200405,吸烟对个人健康和公众利益的影响,60,75,69,70,84,344,C,
吸烟不仅对个人健康没有好处，而且对公众利益也没有好处。,200405109525200437,日本,2,200405,吸烟对个人健康和公众利益的影响,70,70,62,58,68,316,C,
据[C]我{CC所}了解，吸烟都有害{CC2害}{CJX}对{CC于}身体各个方面{CC总[C]体方面}。,200405109523200557,韩国,2,200405,吸烟对个人健康和公众利益的影响,65,75,70,70,78,345,B,
所以，我[C]们应该理解吸烟是吸烟者的无奈的选[C]择[C]。,200405109523100656,韩国,1,200405,吸烟对个人健康和公众利益的影响,85,65,58,75,80,352,C,
规定来约[B受]束人民的事也有不太好的一面，可是，为了大部分的人，有时需要严格的规,200405109523200669,韩国,2,200405,吸烟对个人健康和公众利益的影响,65,65,48,50,68,280,未参加,
因为吸烟是一种中毒性{CJ-zxy行为}，如果不吸烟，他[C]们{CQ会}很着急[C]。,200405109523200795,韩国,2,200405,吸烟对个人健康和公众利益的影响,65,70,48,58,66,293,C,
而且很小的香烟会导致{CC发[C]生}很[C]大的火灾[C]。,200405109523200795,韩国,2,200405,吸烟对个人健康和公众利益的影响,65,70,48,58,66,293,C,
我看{CJ-buy完}这篇{CC个}文章立刻联想到社会环境和公民习惯的密切关系。,200405109525101145,日本,1,200405,吸烟对个人健康和公众利益的影响,70,75,58,48,68,308,C,
不过，随着经济发展{CD了}，我们的心理上的压力也越来越重了。,200405109525100283,日本,1,200405,吸烟对个人健康和公众利益的影响,55,65,21,62,45,230,未参加,
我看到这个题目后，很失望{CD了}。,200405109525100366,日本,1,200405,吸烟对个人健康和公众利益的影响,45,70,46,73,65,281,未参加,
世界上的任何东西{CQ的}都{CC也}不应该使用{CJX}{CD为}让人不舒服。,200405204525100243,日本,1,200405,吸烟对个人健康和公众利益的影响,65,60,30,58,63,259,未参加,
法律上{CJ-sy规定}直到二十岁才能吸烟。,200405204525200248,日本,2,200405,吸烟对个人健康和公众利益的影响,60,60,33,47,49,231,未参加,
所以多数的男人说：[BC，]“女性不要吸烟。,200405204525200279,日本,2,200405,吸烟对个人健康和公众利益的影响,60,60,30,39,49,220,未参加,
所以我希望那些吸烟者知道，在公共场所还有很多不吸烟的人。,200405204525200284,日本,2,200405,吸烟对个人健康和公众利益的影响,90,90,85,84,94,441,A,
如果有人不愿[C]意[C]吸烟[C]，他说不定被嘲[B潮]笑为{CC其}小气。,200405204525100320,日本,1,200405,吸烟对个人健康和公众利益的影响,60,60,55,73,61,291,未参加,
因此，不仅{CJ-zy要}靠国家的措施，而且我们消费者也应该多多考虑一下如何消灭香烟，如何处理现在在{CD做}香烟{CD的}工厂{CJ-zxy工作}的人的以后的生活。,200405204525200331,日本,2,200405,吸烟对个人健康和公众利益的影响,65,70,66,65,63,315,C,
”[BC」]这可以说是很{CC太}不负责任{CC4任性}的说法。,200405204525200467,日本,2,200405,吸烟对个人健康和公众利益的影响,60,55,82,68,79,325,未参加,
也许如有这种惩罚措施的话一定{CQ会}减少在公共场所抽烟的人数{CC5抽烟人}，一般的不抽的人们感[C]觉很舒服，那抽烟人的呢？,200405205525100170,日本,1,200405,吸烟对个人健康和公众利益的影响,55,65,30,47,33,212,未参加,
边走边{CJ-sy抽}烟[C]很危险。,200405201525200300,日本,2,200405,吸烟对个人健康和公众利益的影响,60,70,60,58,51,284,C,
吸烟不仅影响直接吸烟[B因]者还影响周围的人。,200405024542100292,越南,1,200405,吸烟对个人健康和公众利益的影响,60,75,47,44,54,266,未参加,
我想政府不断地{CC的}颁[B办]布严格的措[B错]施一定能让社会吸烟者越来越少。,200405024542200304,越南,2,200405,吸烟对个人健康和公众利益的影响,80,70,63,37,65,305,未参加,
由此而知，结交的过程中，男女双方真诚的感情投入[BD，]和对彼此的了解{CC识认}，才是最重要的。,200410534533150026,新加坡,1,200410,最理想的结交方式,70,85,69,76,84,376,C,
这是一种理智的作法，从学生时代到成熟的成人，他们对彼此已有一定程度的了解，加上经营，是可以共创幸福的生活{CJsd}。,200410534533250030,新加坡,2,200410,最理想的结交方式,75,85,71,72,96,392,B,
熟悉{CC相熟}的朋友多少了解[C]我的爱好和脾[C]气，他们[B他]也知道我的缺点，所以能够[F夠]适合{CC适当}做介绍。,200410534533250068,新加坡,2,200410,最理想的结交方式,85,70,69,56,44,315,C,
在很多时候他们的认识都是通过朋友介绍，我觉得这个方式是很理想的，但不是绝对的好。[BC，],200410534540250070,印度尼西亚,2,200410,最理想的结交方式,65,70,71,51,84,327,C,
