错句,作文编码,国籍,性别,考试时间,作文题目,口试分数,作文分数,听力分数,阅读分数,综合分数,总分,证书
做为一个日本[C]人，我想这是日本人的长处，也是缺点。,199605104525100360,日本,1,199605,由“三个和尚没水喝”想到的……,65,70,80,72,80,353,C,
这[C]个简单的故事让人知道[C]人为什么如此长时[C]间就资[C]源问题引起了许许多多的战争，这[C]就[C]是人的一种贪心，自己一个人要占领给{CC对}自己带[C]来利益的东[C]西的[C]很自私的心理。,199605104525200372,日本,2,199605,由“三个和尚没水喝”想到的……,90,65,58,83,84,371,C,
在家里父母娇惯我，而且姐姐，甚至我弟弟也替我做我的{CC得}自己做的事情。,199605104525200375,日本,2,199605,由“三个和尚没水喝”想到的……,65,70,77,60,80,338,C,
因为不管成绩好不好，每一个人都要去山下一趟。,199605550523190038,韩国,1,199605,由“三个和尚没水喝”想到的……,60,55,21,47,42,206,未参加,
没有一个人喜欢自己{CD来}承坦某件事{CD干}。,199605550523290060,韩国,2,199605,由“三个和尚没水喝”想到的……,65,60,71,67,72,318,C,
我们再想一想吧。,199605550523190065,韩国,1,199605,由“三个和尚没水喝”想到的……,70,80,52,60,68,320,C,
这句俗话与这个故事没有关系。,199605550523190071,韩国,1,199605,由“三个和尚没水喝”想到的……,60,65,58,70,63,299,C,
靠天吃饭[F飯]有饿[F餓]死；靠人打战[F戰]要失败[F敗]。,199605529529150141,泰国,1,199605,由“三个和尚没水喝”想到的……,60,95,58,58,70,331,C,
一推开门，就看见一位姑娘正在严肃地批评其中一个小伙子。,199704123529200101,泰国,2,199704,记对我影响最大的一个人,70,80,65,82,75,362,C,
而我自己对绘画{CQ也}有浓厚的兴趣。,199704124540200318,印度尼西亚,2,199704,记对我影响最大的一个人,70,80,53,60,70,323,C,
我是听{CC从}他唱的摇篮{CC摇遥}曲长大的。,199704124542200314,越南,2,199704,记对我影响最大的一个人,95,80,67,84,70,392,B,
三四岁开始有记[F記]忆时，全家搬来棉兰定居。,200110540540150047,印度尼西亚,1,200110,我的童年,70,80,74,63,88,365,C,
问题是因为语文属重要的科目{CJZR}。,200110540540250083,印度尼西亚,2,200110,我的童年,70,80,68,63,83,354,C,
当时我自己也不明白到底在哪[B那]儿错，直到有一天我去北京学习，我才知道我们讲的华语实在大差，尤其四声很多都不对。,200110540540250126,印度尼西亚,2,200110,我的童年,75,90,60,61,83,363,C,
我会书写英文、华文、日文以及马来文。,199312533533200008,新加坡,2,199312,一封求职信,90,90,57,61,75,371,C,
现将学历、工作经验、[BC，]本人的特长等简介如下。,199312533533100025,新加坡,1,199312,一封求职信,90,75,76,74,80,389,B,
祝生意蒸蒸日上×××敬上一九九三年十二月四日,199312533501200042,中国,2,199312,一封求职信,65,80,69,74,85,361,C,
顾客们也对我[C]非常满意。,199312123525200207,日本,2,199312,一封求职信,50,60,46,48,41,224,未参加,
我等贵公司的回信。,199312123525200402,日本,2,199312,一封求职信,70,65,69,48,48,287,C,
每个月差不多3000块钱，一辆汽车，就够了。,199312123523100501,韩国,1,199312,一封求职信,65,50,57,41,36,230,未参加,
尤其是我的性格很{CC直}活沷[F潑]，开朗{CC明朗}极了。,199410550523202907,韩国,2,199410,一封求职信,70,55,45,39,37,230,未参加,
青年、[BC，]中年时代的父亲性格刚强，根本不知道妥协[F恊]，他的座[B左]右铭就是诚实、率直、自律。,199412123523100034,韩国,1,199412,记我的父亲,65,80,62,75,72,342,C,
他在澡堂{CC2洗澡场}用自己的手洗{CJ-buy完}澡{CQ就}{CJ-sy帮}我们三个弟兄[BQ，]以后他的脸上有了满足感。[BC，],199412123523100063,韩国,1,199412,记我的父亲,55,55,46,42,43,221,未参加,
我是{CJX}在家里{CD中}最{CJX}年纪小的，[BC。]因此我父亲非常疼爱我。,199412123523100094,韩国,1,199412,记我的父亲,65,55,60,50,57,269,未参加,
不算{CJX}他是一个老人，但是他的病太多了，这几个月我特别着急，因为他住院{CC2住医院}{CQ了}，那儿给他做{CC作}{CQ了}手术[BQ，]现在[B再]我放心{CJ+buy好}了，三天前他{CJ-zy给我}打了电话。,199412123635100088,俄罗斯,1,199412,记我的父亲,45,50,60,34,57,223,未参加,
我上学时，他也陪着我做功课{CC2课}，这样让我对课文[L]的内容感兴趣起来。,199412123636200092,乌克兰,2,199412,记我的父亲,70,55,39,34,51,233,未参加,
姐姐是老大，[BC.]虽然她有工作，但是还没找对象时，父亲很担心。,199412124523200018,韩国,2,199412,记我的父亲,60,75,54,40,78,293,未参加,
他是个汉语教师[C]。,199412124529200027,泰国,2,199412,记我的父亲,95,75,60,46,61,332,C,
就是中国人听到我的汉语{CQ时}[BQ，]也{CC可}听{CQ不}出来我是外国人。,199412104523200662,韩国,2,199412,记对我影响最大的一个人,65,65,70,63,55,302,C,
因为她觉得哥哥有好好儿照顾妹妹的责任。,199412104523200659,韩国,2,199412,记对我影响最大的一个人,60,70,73,48,63,299,未参加,
先说苦吧。,199409543501100217,中国,1,199409,学习汉语的苦与乐,85,85,69,73,88,396,B,
故我母亲时常劝我必须容忍，将来长大了才{CQ能}自己创造自己的生活。,199500533533200007,新加坡,2,199500,记对我影响最大的一个人,90,75,62,48,67,336,C,
多少次的掏心倾谈，不但让彼此洞悉{CC窥探}了对方的人生观、心理状况，也因着对方的正面鼓励而在思想上、心理{CD建设}上获得{CQ了}提升。,199500533533200013,新加坡,2,199500,记对我影响最大的一个人,80,85,89,81,80,409,A,
父亲于两年前因肝癌去世，他遗留下的事业及产业十分可观，但他的精神更是对子女们难以磨灭的一股力量！,199500533533200065,新加坡,2,199500,记对我影响最大的一个人,85,85,91,73,94,423,A,
他的决定也改变了我处事待人的方式及{CJ-sy教会我}如何做个好决定。,199500533519200139,马来西亚,2,199500,记对我影响最大的一个人,95,75,81,67,78,391,B,
美国与西方一些国家已承[C]认安乐死的合法性。,199510550523200933,韩国,2,199510,如何看待“安乐死”,80,80,52,68,57,329,C,
而不是我们[F們]有别于[F於]其他动[F動]物的身体[F體]。P},199511543501200531,中国,2,199511,如何看待“安乐死”,85,90,55,60,70,356,C,
{CP杀人者{CQ即使}是在死者的要求下进行，也很难有白纸黑字{CC白字黑字}（死者签[F簽]名同意）的凭[F憑]据。P},199511543634200564,英国,2,199511,如何看待“安乐死”,80,85,76,62,88,385,B,
能为贵公司服务，将是本人的荣幸。,199503680519200552,马来西亚,2,199503,一封求职信,75,85,83,70,95,401,B,
季翔先生，精美服装公司负责人。,199503680519100534,马来西亚,1,199503,一封求职信,80,75,74,70,84,374,B,
当我怀疑结婚与爱情的关系{CD的}时，有一个人的故事给{CQ了}我足够的希望和信心。,199505550523100914,韩国,1,199505,记对我影响最大的一个人,70,70,70,73,74,345,C,
可我的表姐不厌[C]其烦一遍又一遍地耐心教，直到正确为止。,199505550523200909,韩国,2,199505,记对我影响最大的一个人,95,80,65,40,74,350,未参加,
但，硬要提一个人，那么，就是我的父亲。,199505550523200917,韩国,2,199505,记对我影响最大的一个人,80,65,86,79,80,378,B,
母语当然会比外语容易，这是每个人的感想。,199505529529100054,泰国,1,199505,学习汉语的苦与乐,65,80,57,50,82,322,未参加,
乐也，就是学汉语之后[F後]，增加了在[C]泰语中所没有的成语故事的知识{CC成语}，如叶公好龙，不入虎穴，焉得虎子，中国的俗语如：望子成龙，珠联璧[C]合等[C]……。,199505529529100066,泰国,1,199505,学习汉语的苦与乐,85,90,57,41,57,326,未参加,
。P},199505104525200027,日本,2,199505,记对我影响最大的一个人,70,60,44,65,59,283,未参加,
现在开始解[C]释。,199505104523100064,韩国,1,199505,记对我影响最大的一个人,55,60,68,69,51,284,未参加,
我在刚刚转学的{CD那}时候，不习惯于新学校的气氛，什么{CJX}做都没有意思，因此我没能交朋友，有的时候被同班同学欺负。[BC.],199505104525100073,日本,1,199505,记对我影响最大的一个人,60,65,54,63,78,303,未参加,
按她年轻[B经]的时候的日本的社会观念来说，女性一成家就{CQ要}放弃自己的事业，在家庭里做[B作]家庭妇女才对。,199505104525200081,日本,2,199505,记对我影响最大的一个人,65,60,65,65,59,297,C,
放假，没有什么事的时候，一天都靠在她的身边。,199505104525200102,日本,2,199505,记对我影响最大的一个人,55,60,39,42,39,216,未参加,
但她身体{CD怎么}不舒服的时候也不说，自己一个人在忍耐。,199505104525200116,日本,2,199505,记对我影响最大的一个人,80,85,68,65,67,359,C,
虽然{CJ-sy做}不到我母亲的水平，但是我是{CD个}她的女儿。P},199505104525200132,日本,2,199505,记对我影响最大的一个人,65,65,17,48,47,226,未参加,
从小四到小六的三年，真由美老师是我们的班主任{CD了}。,199505104501200135,中国,2,199505,记对我影响最大的一个人,65,70,46,61,65,293,C,
当时我没有汉语老师。[BC.],199505104525200166,日本,2,199505,记对我影响最大的一个人,70,85,60,71,67,345,C,
今年的决定，就是{CD说}在中国住和工作，{CJ-zhuy这}是我一辈子{CD的}最重要的决定。,199505104614200175,荷兰,2,199505,记对我影响最大的一个人,80,65,44,42,49,268,未参加,
她要奶就要给奶，她方[B放]便就要给她处理，她哭了夜里{CJ-zhuy我}也睡不{CQ了}觉。,199505104525200189,日本,2,199505,记对我影响最大的一个人,60,70,68,67,53,303,C,
但是他说的事都是对的。[BC.],199505104525200194,日本,2,199505,记对我影响最大的一个人,60,75,23,46,59,249,未参加,
有一天，他到我房间来。,199505104523100213,韩国,1,199505,记对我影响最大的一个人,55,60,52,44,55,247,未参加,
这[C]次，自己想[C]学什么就学什么，效果{CC成果}也一定很大。,199505104525200243,日本,2,199505,记对我影响最大的一个人,80,65,68,73,63,337,C,
{CP我心里有许多话想对爸爸说的，我想在这张纸上写一段话，这就是对我爸爸的，对我自己的，还是按照考题的。P},199505104523100257,韩国,1,199505,记对我影响最大的一个人,70,55,62,46,47,264,未参加,
当我中学毕[F畢]业后，我选读了美术专科。,199508680519200515,马来西亚,2,199508,记对我影响最大的一个人,85,80,83,79,84,404,A,
父亲在十七年前，因肺癌逝世。,199508682519200527,马来西亚,2,199508,记对我影响最大的一个人,85,80,81,67,88,394,B,
妈妈的青少年时期又适逢第二次世界大战{CC7世界第二次战}后期[BQ，]所以日子更是苦不堪言。,199508680519200533,马来西亚,2,199508,记对我影响最大的一个人,90,85,73,69,82,396,B,
如果真的不能挽回，夫妻俩应该心平气和地谈，千万不要吵架。,200010512501250011,中国,2,200010,我对离婚问题的看法,80,85,83,75,93,410,B,
这样，会引起人们的工作量高一点{CJjy}，对整个经济发展得快{CJjy}。,200005108523200274,韩国,2,200005,关于用自然之声取代噪声的建议,75,75,78,72,74,364,B,
先说结论，我反对用自然之声取代噪声。,200005108525200307,日本,2,200005,关于用自然之声取代噪声的建议,65,75,70,85,82,364,B,
如今，每个家庭都有属于自己的车，但是，许多人为了自己车的安全设置{CC设备}防盗铃。,200005108523200413,韩国,2,200005,关于用自然之声取代噪声的建议,70,70,70,75,74,347,C,
当然，这种建议也存在一些问题，例如汽车的喇叭声，因为汽车的喇叭声是为了提醒别人或司机这里有车危险，所以喇叭声音要很大又容易提起别人的注意。,200005108523200710,韩国,2,200005,关于用自然之声取代噪声的建议,85,85,83,83,91,422,A,
记[F記]得国[F國]小五年级[F級]时[F時]，需要{CC2在}回答一个[F個]问[F問]题[F題]--你觉[F覺]得要具备[F備]什么[F麽]条[F條]件才适[F適]合当[F當]你的朋友。,199711802501100022,中国,1,199711,我选择朋友的标准,90,85,74,83,82,411,A,
我也把乡村当成精神上的母亲。,199705104523200105,韩国,2,199705,我的城市/乡村生活,70,75,74,58,80,346,C,
邻居之间的友谊，有事来找他商量，没事也聊天儿，而且空气也很好对人的身体多么好啊！,199705104523200106,韩国,2,199705,我的城市/乡村生活,70,75,52,56,70,312,C,
将来{CC出来[F來]}{CJ+zxy的事}，遇[B过[F過]]上挫折的机[F機]会[F會]相比童年和现在{CD却}也会{CC是}差得多吧{CC了}。,199810801634150023,英国,1,199810,如何面对挫折,90,80,78,78,59,380,B,
我来中国已经两年多了。,199804123523100196,韩国,1,199804,学习汉语的苦与乐,60,55,27,40,44,207,未参加,
学汉语是很难。,199804123523200254,韩国,2,199804,学习汉语的苦与乐,70,65,63,71,44,299,C,
三年前，有一天我跟中国朋友一起去商店，[BC。]当时我不会骑自行车，因此坐在她自行车的后边，那时候天气真好[BQ，]觉得真舒服，要到商店的时候，我的中国朋友对我说“寿真，真凉快吧！,199804124523200411,韩国,2,199804,学习汉语的苦与乐,80,75,54,57,58,315,C,
跟他说话，所以一开始说“你好”，那他也跟我说“你好”[BQ，]然后，就说“上学吗？,199804124523200432,韩国,2,199804,学习汉语的苦与乐,65,65,72,57,44,287,C,
但说到如何看待妻子的回家。,199809542542100003,越南,1,199809,如何看待“妻子回家“,60,60,48,37,64,251,未参加,
我认为虽然人们遇到困难但{CC并}不要{CJ-sy感到}挫折。,199904123523200005,韩国,2,199904,如何面对挫折,70,65,37,60,46,264,未参加,
最后，我期[B其]中考试的时候，得了第十名，那时候，高兴得不得了，而且懂了很多事情，到现在我遇到挫折的时候，想这句话：成功是失败的母亲”[BQ，]{CJ-zhuy我们}应该面对挫折。,199904123523200010,韩国,2,199904,如何面对挫折,65,70,70,50,48,289,C,
除了冷静以外，你应该找快乐的事情。,199904123525100097,日本,1,199904,如何面对挫折,65,70,53,60,63,297,C,
我想到这点，就{CC而}来北语{CJX}开始学习汉语{CQ了}。,199904123525200117,日本,2,199904,如何面对挫折,75,75,70,80,69,359,B,
我的汉语水平越来越差。[BC.],199904123523200238,韩国,2,199904,如何面对挫折,60,65,31,27,39,205,未参加,
而且每个人面对自己的失败的方法都不一样。,199904124540200293,印度尼西亚,2,199904,如何面对挫折,65,75,39,42,48,256,未参加,
我还记着考大学的时候的失败[B拍]。,199904124523100399,韩国,1,199904,如何面对挫折,55,65,61,39,41,243,未参加,
我接到考不上大学消息的那一天，真的感到说不出来的一种感觉，并且总对心里[B理]说‘为什么’这三个字。,199904124523100399,韩国,1,199904,如何面对挫折,55,65,61,39,41,243,未参加,
不要怕，要忍下去，目前的生活比不上以前的生活，因为现在想要做什么事情，都要靠自己的能力，好好去想，去做，才会把生活下去{CJba}。[BC，],199909529529251002,泰国,2,199909,如何面对挫折,70,70,27,37,34,226,未参加,
我父母也说[BQ：]“你愿意走这条路，那么一直走吧，可是千万别放弃{CC退路}[BD、]{CD弯路}，[BC。]要看正面{CJX}坚持走自己选择的路”在朋友和父母的帮助下，我今天也走{CQ着}自己的路。,199909529525251015,日本,2,199909,如何面对挫折,65,75,51,71,62,311,C,
