错句,作文编码,国籍,性别,考试时间,作文题目,口试分数,作文分数,听力分数,阅读分数,综合分数,总分,证书
人们[C]知道[C]很多人吃不到东西会饿死，[BC。]不过[C]人们想的是一刹[C]那。,200307109523100328,韩国,1,200307,绿色食品与饥饿,60,65,67,35,70,280,未参加,
首先[B选]解决{CQ了}全世界人民的温饱问[C]题，其次它给我们[C]带来新的饮食结构。,200307109523100386,韩国,1,200307,绿色食品与饥饿,65,75,59,38,58,282,未参加,
你们觉得做绿色食品的想法对吗？,200307109523200387,韩国,2,200307,绿色食品与饥饿,65,65,48,51,50,263,未参加,
但是有没有想过世界上有几亿人因缺少粮食而挨饿的真相？,200307109523200438,韩国,2,200307,绿色食品与饥饿,70,90,78,72,87,390,B,
可是越来越高{CC1上升}了。[BC.],200307109523200460,韩国,2,200307,绿色食品与饥饿,65,60,62,54,70,294,C,
我认为，世界上最宝贵的是生命。,200307109525200461,日本,2,200307,绿色食品与饥饿,80,95,80,75,93,418,B,
现在我们说“绿色食品”可以说我们的生活水平提高了。{CP人们买菜时，[BC、]如果有绿色食品的标志{CC表示},200307109525100528,日本,1,200307,绿色食品与饥饿,70,65,67,67,64,319,C,
还不合适。P},200307109523200536,韩国,2,200307,绿色食品与饥饿,70,60,59,56,70,300,C,
通常人们把用未经污染的农产品加工的食品叫做“绿色食品”，我认为吃“绿色食品”是{CC当}第一位。,200307109523100541,韩国,1,200307,绿色食品与饥饿,70,65,48,41,47,257,未参加,
比如说，你饿了三天，很想吃肉。,200307109523200562,韩国,2,200307,绿色食品与饥饿,80,70,80,64,76,360,C,
由于他领率的军次次胜利，因此当时他的君主刘备从他的马中挑选[B造]出两匹马，一匹是世人皆知的名马，另一匹是一匹普通的马。,200307217523100015,韩国,1,200307,绿色食品与饥饿,70,65,72,62,76,331,C,
像非洲的许多国家，印度那样的国家，每年上千万个孩子由于{CC由}饥饿而渐渐熄灭{CC消灭}生命的火。,200307217523100018,韩国,1,200307,绿色食品与饥饿,65,65,62,70,84,330,C,
跟别的生物一样只有吸收足够的营养，才能生活下去。,200307217523200025,韩国,2,200307,绿色食品与饥饿,80,80,83,70,70,375,B,
我觉得除了过[C]量的农药以外少量的农药不会{CC能}害人的健康。,200307217523200085,韩国,2,200307,绿色食品与饥饿,65,75,70,54,50,301,C,
我认为目前不“不挨饿”是第一位的。,200307217510200129,朝鲜,2,200307,绿色食品与饥饿,70,75,83,80,90,387,B,
这样一来{CC以来}我们[C]的社会{CJ-zy才能}发[C],200307204523100116,韩国,1,200307,绿色食品与饥饿,80,65,72,49,61,315,C,
随着人类的发展，人们一直想把农作物的产量增加，而且把这个农作物的质量做的更完善[C][BQ。]最后，想出的办法就是用化肥。,200307205523100001,韩国,1,200307,绿色食品与饥饿,80,70,64,51,61,316,C,
但是，这样的看法{CD是}，我觉得，包[B抱]含富有国家的自私的态度。,200307205523200077,韩国,2,200307,绿色食品与饥饿,70,60,62,49,47,273,未参加,
我希望这种问题{CJ-ZY应该}赶快解决。,200307205523100125,韩国,1,200307,绿色食品与饥饿,65,60,35,33,38,214,未参加,
不但{CC无论}农作物，[BC.]所[C]有的生产品都{CC是}应该安全是第一。[BC.],200307205525100128,日本,1,200307,绿色食品与饥饿,70,65,54,59,58,292,C,
一个人的生存权是在所[C]有的权利[B力]之中最基本的、最重要的。,200307205523200152,韩国,2,200307,绿色食品与饥饿,75,70,88,75,87,384,B,
因为人只有{CC总得}吃东西，才{CJ-zy能}维持生命这[C]世界上有什么比生命更重要？[BC。],200307205523200159,韩国,2,200307,绿色食品与饥饿,60,65,54,59,70,291,未参加,
如果绿[C]色食品对人体无害，我们也应该接受它，可不能让身体,200307212529100015,泰国,1,200307,绿色食品与饥饿,65,75,80,54,64,325,C,
让大家一起努力奋斗去消除挨饿,200307212523100029,韩国,1,200307,绿色食品与饥饿,70,70,70,70,96,364,C,
其次{CC二次}，各个[B各]国家也应该降低化肥和农药的产品，尤其是缺少生产{CC产生}罐[C]头的食品。,200307212540200041,印度尼西亚,2,200307,绿色食品与饥饿,60,60,35,35,56,228,未参加,
所以我们现在只能盼望未来，希望科学赶[B敢]快发达，使地球上的所有人民每人都能吃到“绿色,200307212523200067,韩国,2,200307,绿色食品与饥饿,75,85,78,62,73,366,B,
非[C]洲国家却没有吃的东西!绿色食品是第二个问题。,200307212525200063,日本,2,200307,绿色食品与饥饿,70,70,51,49,64,292,未参加,
其中不要的农作物是没有用的，更高质量{CC高质化}是生存的办法。,200307209523200015,韩国,2,200307,绿色食品与饥饿,60,60,64,41,30,237,未参加,
其次是挨饿的{CJX}解决问题。,200307209525200035,日本,2,200307,绿色食品与饥饿,65,75,70,64,67,328,C,
用了农药后，最终也还是人类受苦受累。,200307201523200008,韩国,2,200307,绿色食品与饥饿,75,75,70,75,81,366,B,
政府应提高以农业为主的公民的收入、生活条件。,200307201523100017,韩国,1,200307,绿色食品与饥饿,90,60,62,49,76,327,未参加,
第一，各个国家的政府应该制定‘绿色食品高价政策’。,200307201523100022,韩国,1,200307,绿色食品与饥饿,75,65,67,67,79,340,C,
所以最好用“绿色食品”[BQ。]我选择用“绿色食品”对待全世界人的{CD食品}生活。,200307201523200044,韩国,2,200307,绿色食品与饥饿,70,65,64,43,61,289,C,
这[C]样的话对我们的身体非常好。,200307201523200061,韩国,2,200307,绿色食品与饥饿,60,60,48,27,35,212,未参加,
可是如果我们的水已经面临{CC当面}着污染现象怎么办呢？,200307201523200066,韩国,2,200307,绿色食品与饥饿,60,60,67,62,58,289,未参加,
那么应不应该用化肥和农药呢？,200307302523200028,韩国,2,200307,绿色食品与饥饿,85,70,67,70,76,359,C,
就是吃的问题。,200307302523100034,韩国,1,200307,绿色食品与饥饿,65,55,51,41,44,238,未参加,
因为它们生长过程[B呈]中不使用对身体有害的化肥和农药，所以有利于人的健康[B隶]。,200307302523200041,韩国,2,200307,绿色食品与饥饿,70,60,78,51,76,320,未参加,
那如何解决这个问题呢？,200307302523200094,韩国,2,200307,绿色食品与饥饿,70,65,67,56,79,323,C,
反正，现在，发达[C]国家的国民都要绿色食品，但另一方面，贫困国家需要食粮。,200307302523200105,韩国,2,200307,绿色食品与饥饿,75,75,75,78,87,380,B,
其中，最重要的是在吃{CC食}方面的。,200307302523200108,韩国,2,200307,绿色食品与饥饿,65,65,72,49,67,302,C,
当然，这个时候也不能乱用或过多用那种农药。,200307302523100125,韩国,1,200307,绿色食品与饥饿,65,65,56,54,61,285,C,
为什么呢？,200307302523200126,韩国,2,200307,绿色食品与饥饿,65,65,70,35,70,289,未参加,
使用化肥和农药能提高产量，[BC、]但对健康却构成了致命的打击。,200307302523200144,韩国,2,200307,绿色食品与饥饿,70,80,86,72,93,391,B,
我们首先应该解决饥饿问题，然后再说绿色食品的研究。,200307206525200004,日本,2,200307,绿色食品与饥饿,70,70,54,38,53,273,未参加,
普及“绿色食品”还要很多时间呢。,200307206525200017,日本,2,200307,绿色食品与饥饿,65,65,64,56,73,307,C,
但任何东西都有两面性{CD的}，绿色食品也有它的缺[C]点，就是与{CQ用}化肥和农药生产的农[B家]作物比产量会大大降低。,200307206501200061,中国,2,200307,绿色食品与饥饿,70,70,80,59,73,340,C,
因为世界上还有几亿人因缺少粮食而挨饿。,200307206525100063,日本,1,200307,绿色食品与饥饿,65,85,51,49,58,298,未参加,
我认为“绿色食品”对我们的身体和健康很有好处。,200307206525100063,日本,1,200307,绿色食品与饥饿,65,85,51,49,58,298,未参加,
很平等！,200307206525100068,日本,1,200307,绿色食品与饥饿,65,60,38,46,44,236,未参加,
在80年代，“杂交水稻[C]之父[C]”袁隆平先生不是成功地缓解了当时中国面临的粮食缺口问题吗？,200307215448250022,维吾尔族,2,200307,绿色食品与饥饿,95,90,78,83,96,441,A,
这样的人会有美好的将来吗？,200307332525200013,日本,2,200307,绿色食品与饥饿,65,70,78,67,67,333,C,
其实{CD回首}想想这[C]么些年来[BQ，]我们也吃[B只]了不少有化肥农药[C]的农作物。,200307332540200014,印度尼西亚,2,200307,绿色食品与饥饿,90,85,72,67,90,401,B,
我以前听说过这种说法，就是一般[B船]的小孩子大约八、九岁以后开始感受异[F異]性。,200310576525200002,日本,2,200310,我对男女分班的看法,60,65,63,49,54,274,未参加,
还有就是一些我们需[B须]要的，因为这样读起来{CJ-zhuy我们}会更感兴趣，[BC。]也更能领悟{CC意会}。,200310540540250008,印度尼西亚,2,200310,谈有效阅读,60,60,54,49,84,289,未参加,
但在看书的同时加以思考，才会觉得自己看的书并{CQ不}多，多{CQ的}只在于[F於]数量而不在于[F於]质量。,200310540540150014,印度尼西亚,1,200310,谈有效阅读,70,60,41,58,86,300,未参加,
此外，在医院或各单位等候排队时也能手持一书而充分{CC充份}地{CC的}利用时间。,200310540540250074,印度尼西亚,2,200310,谈有效阅读,70,75,79,73,93,379,B,
我想，学汉语一定会带来很多的好处。,200304131540200002,印度尼西亚,2,200304,我学汉语是为了……,65,65,68,52,74,308,C,
那时我再一次跟父母说我想去中国学中文，那时父亲很高兴[BQ，]是因为我们是中国人，却{CC所以}只{CD少}会说一点点汉语。,200304131540100202,印度尼西亚,1,200304,我学汉语是为了……,70,70,65,38,52,283,未参加,
由此可见，在{CC随着}现今男女平等的社会里头，人人都要求平等。,200306680519250041,马来西亚,2,200306,我对男女分班的看法,75,70,39,37,55,265,未参加,
自古以来，中国就有“男女授受不亲”的观念，作为一种尺度，认为男女之间不应该太亲密，以免引起误会及尴尬。,200306680519150058,马来西亚,1,200306,我对男女分班的看法,80,90,62,58,85,370,C,
但是，不用化肥和农药对农作物的产量影响很大。,200307271523100030,韩国,1,200307,绿色食品与饥饿,70,60,46,56,73,290,未参加,
不必考虑的问题{CC间}{CJX}是。[BC.],200307271523200050,韩国,2,200307,绿色食品与饥饿,65,65,62,38,67,281,未参加,
现在韩国还有很多发达国家已经流行“绿色食品”，还有产量也不算少。,200307271523200070,韩国,2,200307,绿色食品与饥饿,75,75,67,80,79,366,B,
也就是说人的生存应该被看成是最重[L]要的。,200307271523100091,韩国,1,200307,绿色食品与饥饿,65,60,54,46,67,275,未参加,
虽然我们都明明知道[C]我们世界许多第三界国家面临的问题，虽然口头非常乐意帮助他们而不愿[B原]意牺牲我们已习惯享受的东西去解决{CC决解}他们的问题。,200307271636200092,乌克兰,2,200307,绿色食品与饥饿,75,75,62,38,61,301,未参加,
因为我们不能轻视环,200307271523200103,韩国,2,200307,绿色食品与饥饿,70,60,62,38,58,273,未参加,
还[C]有那样找绿色食品的人可能是比较有钱的人吧。,200307271523200104,韩国,2,200307,绿色食品与饥饿,65,65,62,49,64,289,C,
随便扔掉[B悼]烟头也是我们不想{CC要}看{CJ-buy到}的习惯。,200405109525100132,日本,1,200405,吸烟对个人健康和公众利益的影响,70,60,55,54,53,277,未参加,
这样的话，孩子不能买烟，限制{CC免得}青少年买烟、[BC，]{CJ+dy青少年的}吸烟。,200405109525200146,日本,2,200405,吸烟对个人健康和公众利益的影响,85,65,38,60,50,287,未参加,
吸烟的时候{CC2话}，在烟{CC1吸烟}中{CC1当中}产生的两种物质{CJ-zy会}给身体{CJ-sy带来}严重的损害，会引起呼吸困难和肺癌{CC2肺[C]器官[B关]}等{CD的}病。,200405109523100321,韩国,1,200405,吸烟对个人健康和公众利益的影响,65,75,76,64,50,317,C,
虽然人们{CD对}{CJX}吸烟的习惯会给安慰[C]感，但是我个人觉得吸烟带来的坏处{CC2不好处[C]}实在太多了。,200405109523100374,韩国,1,200405,吸烟对个人健康和公众利益的影响,50,65,55,50,59,260,未参加,
虽然对个人的健康[BD，]没有好处，但是负责任{CJX}{CQ对}自己的身体才吸烟的话，我不能勉强想要吸烟的人。,200405109525200481,日本,2,200405,吸烟对个人健康和公众利益的影响,65,60,43,52,48,251,未参加,
据说，烟有害无利，抽烟不仅对抽烟者的身体有害，而且对周围人{CC者}的身体更有害。,200405109525200482,日本,2,200405,吸烟对个人健康和公众利益的影响,65,70,69,73,66,329,C,
既然如此，抽烟者应该遵[B尊]守社会规律。,200405109525200482,日本,2,200405,吸烟对个人健康和公众利益的影响,65,70,69,73,66,329,C,
吸烟者享受他们的嗜[Pshī]好，[BC。]可他们应该考虑[C]，吸烟是{CJX}不仅自己本人，而且公众也受到不利[C]的影响。P},200405109523100529,韩国,1,200405,吸烟对个人健康和公众利益的影响,65,60,67,58,57,290,C,
所以，目前在公共场所允许抽烟的地方越[B起]来越少的现象是[BD，]{CJX}想想{CJcd想}吸烟的不好的影响的话，应该的。,200405109523200522,韩国,2,200405,吸烟对个人健康和公众利益的影响,65,55,59,58,61,280,C,
以前，抽烟者随处{CC随地}抽烟{CD了}，比如说，在路上想抽烟就抽烟，还有在车上，在大楼里面等等。[BC，],200405109523100632,韩国,1,200405,吸烟对个人健康和公众利益的影响,60,60,50,37,53,242,未参加,
路上还好一些，但一旦在屋子里，比如候机室、医院、[BC，]电影院和餐厅等封闭的公共场所里，面积越少抽烟损害{CC2害}他人健康的机率越高。,200405109525200889,日本,2,200405,吸烟对个人健康和公众利益的影响,85,90,79,70,79,399,B,
其实这个问题有几个论点。,200405109525200979,日本,2,200405,吸烟对个人健康和公众利益的影响,75,60,55,46,48,270,未参加,
而且更严重{CC注重}的是吸烟危害的不仅是个人的身体健康，也危害周围[C]人们的健康。,200405109525101314,日本,1,200405,吸烟对个人健康和公众利益的影响,55,65,55,46,66,269,未参加,
本人也吸烟者之一{CJs}。,200405109523101395,韩国,1,200405,吸烟对个人健康和公众利益的影响,60,60,52,50,53,257,未参加,
我最后[C]想说，吸烟不会{CC没有}对人类有什么好处[BQ，]最好少吸烟，[BQ。]而且别影响公众利益。,200405109523201452,韩国,2,200405,吸烟对个人健康和公众利益的影响,65,65,55,50,57,276,未参加,
在报纸上报着间[B简]接吸烟者受的影响率比[C]吸烟者的高三倍。,200405109523101558,韩国,1,200405,吸烟对个人健康和公众利益的影响,70,60,40,56,46,257,未参加,
所以说，我对这俗话的看法是反对的。,200405109525101627,日本,1,200405,吸烟对个人健康和公众利益的影响,55,70,71,56,61,297,C,
这是不公平的。,200405109523101772,韩国,1,200405,吸烟对个人健康和公众利益的影响,70,70,59,66,50,303,C,
据2002年4月15日[BQ《]韩国日报[BQ》]说；非吸[C]烟者{CC人}也是跟吸[C]烟者{CC人}一样影响{CJX}{CQ受}到{CJX}呼[B户]吸[C]器官{CC机关}。,200405109523201850,韩国,2,200405,吸烟对个人健康和公众利益的影响,65,60,62,46,39,255,未参加,
可以帮助青少年养成良好的习惯，而且不会影响其它人。,200405109525101854,日本,1,200405,吸烟对个人健康和公众利益的影响,75,60,52,31,53,257,未参加,
女人不是要生孩子吗？[BC…],200405109523201870,韩国,2,200405,吸烟对个人健康和公众利益的影响,65,85,55,52,53,300,未参加,
不吸[C]烟[C]的人也在[C]吸[C]烟人的[C]周[C]围[B伟]{CD中}吸了烟。,200405109523100563,韩国,1,200405,吸烟对个人健康和公众利益的影响,55,65,46,52,56,256,未参加,
因为这个规定意味着现在能抽烟的地方越来越少了，对吸烟者来说，非常麻烦的{CJsd}。[BC，],200405109523200796,韩国,2,200405,吸烟对个人健康和公众利益的影响,65,85,72,73,66,351,B,
我听完这消息以后很高兴，因为我本身就不喜欢吸烟{CJ+zxy行为}。,200405109523100816,韩国,1,200405,吸烟对个人健康和公众利益的影响,70,70,76,52,73,329,C,
总而言之，我对这样一项规定感到很满意，希望[C]全世界的人都不抽烟，为了{CC2为}青少年养成一个好习惯，也[C]为了健康，大家都把烟毫不客气地{CC的}扔掉吧，把世界变得{CC换成}更美丽、更幸福、更美好、更健康吧{CJba}！,200405109523100830,韩国,1,200405,吸烟对个人健康和公众利益的影响,70,80,66,58,68,332,C,
我认为，社会为让吸烟者{CJjy}制定{CC2做}出很多规定，虽然可以减少吸烟者，但是这给吸烟者带来很多心理[B里]的疾病。,200405109523201419,韩国,2,200405,吸烟对个人健康和公众利益的影响,65,60,76,58,56,298,C,
拿日本采取的措施为例。,200405109525200242,日本,2,200405,吸烟对个人健康和公众利益的影响,85,70,67,75,82,370,C,
其次，吸烟者会影响戒[B节]烟者和对吸烟有好奇心的未吸烟者，尤其是青少年。,200405109523100359,韩国,1,200405,吸烟对个人健康和公众利益的影响,70,70,64,54,77,323,C,
税是为了我们公民来{CC以}用的，[BC。]对我们好。[BC，],200405109525101257,日本,1,200405,吸烟对个人健康和公众利益的影响,75,55,57,77,57,306,未参加,
众所周知，吸烟者的早期死亡率比不{CC1没有}吸烟者的高很多。,200405204525100199,日本,1,200405,吸烟对个人健康和公众利益的影响,60,75,27,35,51,234,未参加,
第三，对不吸烟者的公平。,200405204525200236,日本,2,200405,吸烟对个人健康和公众利益的影响,65,60,68,58,79,313,C,
为了国家的利益必须要给{CC对}抽烟者{CC3抽烟}压[C]力。,200405204525200252,日本,2,200405,吸烟对个人健康和公众利益的影响,60,65,55,54,42,259,未参加,
你危害着周围的朋友呢。,200405204525100277,日本,1,200405,吸烟对个人健康和公众利益的影响,65,60,58,65,65,296,C,
反正吸烟者自身愿意去承担这个风险的话别人也没什么理由去阻止他。,200405204525200284,日本,2,200405,吸烟对个人健康和公众利益的影响,90,90,85,84,94,441,A,
即[B既]使是自身不吸烟，由于别人吸烟，{CJ-zy也会}对他的健康造成{CD了}极大的影响。,200405204525200284,日本,2,200405,吸烟对个人健康和公众利益的影响,90,90,85,84,94,441,A,
在日本有一句俗语{CC常语}：“烟有百弊，没有好处[BQ。]”[BD。]我们为了保护个人的健康，为了实现公众的利益，应该努力地改掉{CC改善}抽烟习惯，要不然未来的结果应该是不好的。,200405204525100323,日本,1,200405,吸烟对个人健康和公众利益的影响,65,75,55,70,72,324,C,
因为即使我们看到有人在公共场所吸烟，如果没有法律规定禁止此类行为的话，我们每个人自己去提醒这个吸烟的人也没用的{CJsd}，他不一定听别人{CC人家}的话，甚至会有可能生气。,200405204525200345,日本,2,200405,吸烟对个人健康和公众利益的影响,75,75,77,63,76,356,B,
吸烟对个人健康不好，这个看法是已[B己]经{CJX}大家都知道的事，所以某一个人在没有别人的地方抽烟，这个是每个[D个]人按自己的想法做的事。,200405204525100367,日本,1,200405,吸烟对个人健康和公众利益的影响,65,55,47,58,61,268,未参加,
可是我觉得大概下面的理由是比较多{CJsd}。,200405205525200162,日本,2,200405,吸烟对个人健康和公众利益的影响,65,75,60,44,54,285,C,
但同时，也就有义务去遵[C]守[B受]吸烟的道德[C]。,200405205525100212,日本,1,200405,吸烟对个人健康和公众利益的影响,90,85,79,75,94,420,B,
婚姻乃[B仍]终身大事，马虎不得，婚前必须对对方之出身，性格，思想行为，处世观[F觀]念，经济基础[F礎]有一个全面的，深入的了[F瞭]解，才能保证婚后生活美满，白[B百]头偕[C]老。,200410534533150004,新加坡,1,200410,最理想的结交方式,80,75,58,83,91,378,B,
武火式是指男女在一个偶然的机会{CC机遇}里彼此倾心，肯定对方是理想的意中人而定下山盟海誓，完成婚约。,200410534533150016,新加坡,1,200410,最理想的结交方式,75,90,66,56,82,363,C,
如果能把科技和电脑一起派上用场[C]，那么效果和成功率就会更好更高。{CP世界个个发展及发展中国家都有社会老年化{CC5老化},200410534533150091,新加坡,1,200410,最理想的结交方式,85,75,41,60,63,316,未参加,
男的虽然长得相貌堂堂，一表人才，但是却有哮喘病，家境大属小康之家，工资才七百元新币，学历才中四。,200410534533250090,新加坡,2,200410,最理想的结交方式,80,85,74,47,72,352,C,
但在当今社会，运动已不仅[F僅]仅[F僅]是一种运动，它还是一种现今社会的主流，就是时尚。,200404140522200303,缅甸,2,200404,运动员收入,90,65,83,77,88,394,B,
在公众利益{CQ方面}，吸烟更是影响深切。,200405680519150009,马来西亚,1,200405,吸烟对个人健康和公众利益的影响,75,90,66,81,80,386,B,
所以，政府更应该积极{CC极积}地推行“禁烟”运动，[BC。]以便保障个人和公众的利益。,200405680519250034,马来西亚,2,200405,吸烟对个人健康和公众利益的影响,70,95,69,79,82,388,C,
试想想一个国家的劳动生产者全都是体弱多病、沉迷于吞云吐雾的一群，那他们怎样生产足够的产品以满足人类的需求呢？,200405680519150051,马来西亚,1,200405,吸烟对个人健康和公众利益的影响,70,95,66,79,87,390,C,
而一个人能否戒烟{CD革命}成功，就得瞧瞧他的毅力{CC根量}，毕竟“失败的落魄者是那些毫无自制力的人！,200405680519250056,马来西亚,2,200405,吸烟对个人健康和公众利益的影响,70,90,44,79,87,363,未参加,
三、现在的电视节目多播放男女之间的交往。,200504534533150027,新加坡,1,200504,我对男女分班的看法,70,75,76,67,84,361,B,
至于对高年龄层的学生，男女分班的学习环境也许可以避免孩子过早{CC及早}涉及早恋，但是整体来看并不尽然。,200504534533250032,新加坡,2,200504,我对男女分班的看法,60,85,59,65,79,337,C,
我们不应该再走回头路，固步自封、[BC，]食古不化，担心男女同班会产生一些不良的后果，如男女生过早谈恋爱，未婚先孕，或道德思想腐朽等等。,200504534533150055,新加坡,1,200504,我对男女分班的看法,65,85,81,58,66,345,C,
第二，孩子单一性别的相处，也{CQ会}造成日后他们不晓得如何与异性相处{CJ-zxy的后果}。,200504534519250082,马来西亚,2,200504,我对男女分班的看法,70,90,87,82,77,399,B,
我相信同意与反对看法都有益处和坏处。[BC.],200504534540250087,印度尼西亚,2,200504,我对男女分班的看法,60,65,65,43,53,269,未参加,
男生也许会欺负女生，使女生伤心流泪。,200504534533250102,新加坡,2,200504,我对男女分班的看法,80,75,65,62,64,337,C,
他日被讽刺，也会坚强地面对。,200504534533250102,新加坡,2,200504,我对男女分班的看法,80,75,65,62,64,337,C,
我的看法是家长和学者都在{CQ从}不同的出发点{CD来}看待这个问题。,200504534519250124,马来西亚,2,200504,我对男女分班的看法,80,70,78,67,82,367,B,
分班后，学生没有了‘目标’可能在外面认识一些不务正业的人。,200504534533250162,新加坡,2,200504,我对男女分班的看法,70,75,70,78,64,346,B,
我认为，男女分班对学生本身并没有任何的好处。,200504534533150174,新加坡,1,200504,我对男女分班的看法,75,75,73,82,77,372,B,
父母的行为思想是从幼年就开始在孩子心目中打下深深的烙印{CJsd}。,200505109529200011,泰国,2,200505,父母是孩子的第一任老师,65,80,56,54,64,307,C,
孩子在不知不觉中受父母的影响，包括{CC不管}父母的兴趣爱好、[BC，]思想观念等都有很大的影响。,200505109540200542,印度尼西亚,2,200505,父母是孩子的第一任老师,65,65,63,35,48,260,未参加,
我认为父母是孩子的第一任老师。,200505109525200624,日本,2,200505,父母是孩子的第一任老师,70,70,79,74,61,342,C,
孩子早晚需要独立，一定要[C]在社会上生活。,200505109525100643,日本,1,200505,父母是孩子的第一任老师,85,65,79,70,79,367,B,
现在我[C]研[C]究中国[C]古[C]代史、古文字学。,200505109525100922,日本,1,200505,父母是孩子的第一任老师,65,70,28,65,56,270,未参加,
有的父母喜欢打网球，孩子从小时[C]候跟父母[C]打球，那么那个孩子可能善于打网球。,200505109525201080,日本,2,200505,父母是孩子的第一任老师,60,55,50,58,66,270,未参加,
父母对我来说不仅是我的第一任老师，也是我一生的老师。,200505109801101134,澳大利亚,1,200505,父母是孩子的第一任老师,95,65,89,70,73,384,B,
其次，要考虑[C]到不好的影响。,200505109525201138,日本,2,200505,父母是孩子的第一任老师,60,75,57,62,78,318,未参加,
孩子变成怎样的人是在{CC从}家里教养的，所以作为父母应该记住[B注]他们是孩子的第一任老师。,200505109540201169,印度尼西亚,2,200505,父母是孩子的第一任老师,75,90,46,35,45,285,未参加,
