错句,作文编码,国籍,性别,考试时间,作文题目,口试分数,作文分数,听力分数,阅读分数,综合分数,总分,证书
请多多关照，[BC、]谢谢合作[BQ。]×××93年12月20日,199312123525100108,日本,1,199312,一封求职信,45,55,25,48,45,195,未参加,
在一九九0年大学毕业后进入一家旅行社当导游。,199312123523200202,韩国,2,199312,一封求职信,55,55,50,45,50,235,未参加,
快乐家庭旅游公司李文先生：您好！,199312123525200305,日本,2,199312,一封求职信,55,60,50,54,50,250,未参加,
我的第二外语是日语。,199312123525200510,日本,2,199312,一封求职信,60,65,46,59,39,253,未参加,
本人1985年某某大学毕[F畢]业以后到美国[BQ，]在加洲[C]斯坦[Ptēn]波特大学专学习观光旅游学[BQ，]写{CQ了}一篇论文取得了硕[Pshùo]士[B师]学位。,199312123523200604,韩国,2,199312,一封求职信,55,45,48,43,34,202,未参加,
有的时候在课堂上无意地看外面就看到[C]父亲的笑容，[BC。]因为他不放心来{CJX}偷偷看我。,199412123523200005,韩国,2,199412,记我的父亲,50,65,60,53,55,264,未参加,
大学毕业后为了看病我特意{WWJ},199412123523200025,韩国,2,199412,记我的父亲,55,50,54,46,53,237,未参加,
还有，他喜欢开玩笑。,199412123525200029,日本,2,199412,记我的父亲,55,85,36,28,41,233,未参加,
我家也一样。,199412123523100058,韩国,1,199412,记我的父亲,80,75,44,69,67,326,未参加,
身体、[BC，]精神也不怎么好，我每次想家的时候不知道为什么那么心疼。,199412123523200095,韩国,2,199412,记我的父亲,50,55,46,48,49,227,未参加,
现在我认为他对我的教[C]育{CQ方式}方针是对的。,199412123525100107,日本,1,199412,记我的父亲,65,55,44,40,51,237,未参加,
我们的国家是个社会主义的国家。{CD在},199412124914100036,古巴,1,199412,记我的父亲,50,60,41,34,37,202,未参加,
他不是我的真正{CC真真[C]}的父亲。,199412124525200051,日本,2,199412,记我的父亲,65,65,52,48,41,255,未参加,
有一天，我还是无精打彩地睡不{CQ着}觉[F覺]。,199412123523100068,韩国,1,199412,记对我影响最大的一个人,55,60,49,50,51,246,未参加,
反正我从她{CQ身上}学到{CC学习}了：[BC，]人，如果想变，拼命努力的话[BQ，]一定能变。,199412124525200061,日本,2,199412,记对我影响最大的一个人,60,65,62,57,55,282,C,
我当[F當]时[F時]年纪小，不禁有一种[F種]害羞{CJ-zxy的心理}[BQ，]{CQ因为}自己家里[F裏]穷[F窮]。,199412104625200632,葡萄牙,2,199412,记对我影响最大的一个人,70,80,60,50,80,330,C,
我和他在私人关系方面交流{CJX}深入{CQ还}{CD的}是{CD有}一位{CJX}我认识的中国朋友来我们大学留学以后的事。,199412104525100623,日本,1,199412,记对我影响最大的一个人,55,65,68,46,61,277,未参加,
不过[F過]，它的优[F優]点[F點]就是文法简[F簡]单[F單]和一字一音一义[F義]，{CD用}外文长[F長]篇大论[F論]的，用汉[F漢]语[F語]则[F則]言简[F簡]意赅[F賅]，十分方便，而且用它写[F寫]诗[F詩]，就活像一幅美丽[F麗]的图[F圖]画[F畫]。,199409543501100205,中国,1,199409,学习汉语的苦与乐,90,70,50,75,91,369,C,
故此在工作时常有各种磨擦、[BC，]冲突出现。,199500533533200122,新加坡,2,199500,记对我影响最大的一个人,95,90,78,69,90,421,B,
我相信在她漫长的婚姻生活里，总是有对父亲的失望和伤感{CJsd}，但她却有技巧{CC3技巧}地、传统式地[BD、]把不满深藏在心底，从不对她的子女哭诉或讨功。,199500533533200143,新加坡,2,199500,记对我影响最大的一个人,95,90,83,67,72,406,A,
实[F實]际[F際]上许[F許]多病人引[B因]起许[F許]多社会[F會]问[F問]题[F題]，尤[B由]其是那些没有意识[F識]的病人，所谓[F謂]脑[F腦]死状[C]态[F態]应[F應]该[F該]被法律规[F規]定，解决[F決]许[F許]多人的痛苦[C]，而且这[F這]种脑[F腦]死状[C]态[F態]病人可以为[F爲]社会[F會]，贡献{CC2贡[F貢]}出他们[F們]的器官{CC脏[B藏]器}可以供[B共]给许多人新生命，新希望。,199510550523100905,韩国,1,199510,如何看待“安乐死”,65,70,50,60,59,290,C,
最后[F後]，众[F眾]所周知，现[F現]在我们[F們]生活的社会[F會]是“[BC「]多元化”[BC」]、[BC，]“[BC「]多变[F變]化”[BC」]的社会。,199510550523200926,韩国,2,199510,如何看待“安乐死”,80,85,62,79,66,366,B,
故此谁[C]人有权[F權]安排病人「安乐[F樂]死」是最重要的——病人的亲[F親]属[F屬]还[F還]是医[F醫]生或法官？,199511543501100557,中国,1,199511,如何看待“安乐死”,75,75,76,73,93,382,B,
与[C]其看着至爱的人痛苦的挣扎，不如让[F讓]他平静[F靜]的离[F離]去。,199511543501200559,中国,2,199511,如何看待“安乐死”,80,90,76,75,82,398,B,
顺便也附上本人大学毕业成绩单（甲等）让您过目。,199503680519100502,马来西亚,1,199503,一封求职信,90,95,62,56,79,380,C,
现[F現]在{CD也在}哲学界尊敬他叫退溪先生。[BC.],199505550523100901,韩国,1,199505,记对我影响最大的一个人,60,55,36,55,55,242,未参加,
他太爱学问，当时朝鮮国王的入仕邀请{CC要请}，也不接受{CC容纳}，只在山谷里念书、穷[F窮]理居敬，培训弟子，终于成为万岁[F歲]之师，可不好吗？{CP我也跟着他的思想，在公司里工作时，平常尊敬别人，尽最大{CC善},199505550523100901,韩国,1,199505,记对我影响最大的一个人,60,55,36,55,55,242,未参加,
韩国大部分的母亲都很强，但她们不愿意生女儿。[BC.],199505550523200910,韩国,2,199505,记对我影响最大的一个人,70,65,60,71,63,315,C,
一般学校都不准[F凖]教外语[F語]。,199505529529100006,泰国,1,199505,学习汉语的苦与乐,80,90,69,70,77,381,B,
等到能够了解汉语[F語]的文法构[B沟[F溝]]造，这时候已[B己]是很接近进[F進]入容易的阶[B揩]段了。,199505529529100039,泰国,1,199505,学习汉语的苦与乐,75,80,50,56,75,327,C,
所以要我找出学汉语的[C]苦处{CC苦趣}，实在是一个难题[F題]。,199505529529100058,泰国,1,199505,学习汉语的苦与乐,75,90,81,75,93,408,B,
因为[C]{CJ-zy原来}以为{CC2想}他站起来的原因是推荐[C]别人{CC2谁[C]}。,199505104523100021,韩国,1,199505,记对我影响最大的一个人,70,75,60,50,55,299,C,
可以说是，她的想法过于理想，所以很难了解，很难同[C]意她的想[C]法。[BC，],199505104523100064,韩国,1,199505,记对我影响最大的一个人,55,60,68,69,51,284,未参加,
我们等我们班的老师，等了半[C]天，{CJ-dy一位}半[C]白头发的老教[C]师进来了。[BC，],199505104523200079,韩国,2,199505,记对我影响最大的一个人,65,65,36,40,53,243,未参加,
我的一位女的朋友是她的朋友，所以经常跟她见面，谈话等，自然地产生了一份{CC片}好感{CC2爱情情绪}。,199505104523100099,韩国,1,199505,记对我影响最大的一个人,55,50,65,67,63,279,未参加,
在韩[C]国很多人学{CJ+buy会}钢[Pgāng]琴，从小上私立学院。[BC，],199505104523200139,韩国,2,199505,记对我影响最大的一个人,70,60,44,48,67,274,未参加,
我每次就想应该做[B作]好事情，不能失望{CC失败}{CJX}{CQ让}马立司老师。{CP虽然她只是一个普通的老师，可是在我的心里她是伟大的人，就像[B象]藤[C]野先生对鲁迅[B逍]那么好！P},199505104730200136,毛里求斯,2,199505,记对我影响最大的一个人,70,80,62,32,32,266,未参加,
他总是跟我们三个兄弟说，“你们在社会生活中{CC时}，{CJ-zy要}正正当当地行动，宁死不屈。,199505104523100142,韩国,1,199505,记对我影响最大的一个人,70,50,52,40,45,240,未参加,
当时按照经济方面来说不应该有太多的孩子，但是她[B他]坚[F堅]持{CJX}还要生我。,199505104529200153,泰国,2,199505,记对我影响最大的一个人,80,65,70,67,55,325,C,
可是对我爸爸的位置[B直]{CD跟}什么也比不上。,199505104523200173,韩国,2,199505,记对我影响最大的一个人,55,70,62,55,63,289,C,
现在呢？,199505104523200176,韩国,2,199505,记对我影响最大的一个人,70,60,65,63,57,300,C,
我一句话不说{CC话}，但我知道{WWJ},199505104523200199,韩国,2,199505,记对我影响最大的一个人,80,65,89,73,72,367,B,
她是一个我大学的{CJX}同班同学。,199505104523200215,韩国,2,199505,记对我影响最大的一个人,75,60,83,71,76,351,C,
回答这个问题时，我并不需[B须]要很长时间去{CC在}想一想是谁对我有最大的影响；我可以马上回答“是我母亲”[BQ。]我和我母亲在很多方面一样：我们的思想相同，我对某一些事情的态度[L]常常和我妈妈的类似。,199505104634100228,英国,1,199505,记对我影响最大的一个人,70,55,52,57,65,283,未参加,
最终{CC终于}父亲叫醒{CJ-by我}说[C][BQ：]“[BC‘]跟我出去吧”[BQ。]我有点不甘心，但是也没法反抗。[BC，],199505104523100234,韩国,1,199505,记对我影响最大的一个人,70,65,54,53,49,277,未参加,
从现在我想管我爸爸叫他。,199505104523100257,韩国,1,199505,记对我影响最大的一个人,70,55,62,46,47,264,未参加,
我[C]的善良、爱劳动也有{CC是}他的影子。,199505104540100288,印度尼西亚,1,199505,记对我影响最大的一个人,65,80,65,59,63,320,C,
当时[C]日本已[C]经开始侵略亚洲国[C]家，日本经济情况转坏了，特别是[L]农民生活变得一天{CQ比一天}没有[C]吃的了。,199505104525100301,日本,1,199505,记对我影响最大的一个人,75,55,41,63,72,291,未参加,
虽自小失怙，却不被恶烈环境压倒，反而肩负{CC付}起长子养家[C]的责任。,199508682519100528,马来西亚,1,199508,记对我影响最大的一个人,85,70,91,79,84,400,B,
在一个下着濛濛細雨的晚上，我看到一位戴着雨帽穿着雨衣裳的小学[F學]生，手提着一个[F個]袋子匆[B怱]匆[B怱]的走过我的眼前，原来她是上夜校{CC夜学[F學]}，这情景，使我回忆[F憶]{CQ起}三十年前童年的我。,200009542542200006,柬埔寨,2,200009,我的童年,70,85,30,42,35,254,未参加,
我觉得如果没有了感情的夫妻要离婚也是应该的，对他们两人都有好处，因为勉强没有幸福。,200010602801250007,澳大利亚,2,200010,我对离婚问题的看法,65,70,48,65,61,295,C,
在城市生活的人可能大概是这样，但是在乡村生活的人可能不是这样，因为他们生活在大自然里。,200005108525200303,日本,2,200005,关于用自然之声取代噪声的建议,65,75,75,80,82,364,B,
噪声也是一种公害。,200005108525100319,日本,1,200005,关于用自然之声取代噪声的建议,65,65,75,83,69,341,C,
反而那些大自然声音让人快乐，生机勃勃。,200005108520200694,蒙古国,2,200005,关于用自然之声取代噪声的建议,75,70,64,57,63,318,C,
由于[F於]这[F這]共同的嗜好，我和朋友之间的友谊[F誼]一天比一天坚固{CC挚固}。,199711801501200015,中国,2,199711,我选择朋友的标准,85,70,94,79,96,415,B,
更要彼此尊重，当[F當]大家立场[F場]不同時，要互相尊重对[F對]方的意愿[F願]，那么[F麽]友情一定长[F長]久，而且相处[F處]愉快。,199711801634200030,英国,2,199711,我选择朋友的标准,80,80,71,70,70,363,B,
我从[F從]小念[F唸]小学[F學]的时[F時]候，很喜欢[F歡]跟成绩[F績]比我好，做人处[F處]事比我成熟的人在一处[F處]，我想这[F這]是童年心理。,199711802543200005,香港地区,2,199711,我选择朋友的标准,90,65,55,54,70,325,C,
人生活在社会中，总会交朋友。,199711802801200002,澳大利亚,2,199711,我选择朋友的标准,80,75,66,56,63,331,C,
我所感觉到的最大的差异就是别人{CC人家}的意识。,199705104525100006,日本,1,199705,我的城市/乡村生活,70,70,60,63,58,309,C,
等我毕业后，我真希望成为一名在社会上有用的人，在都市里发挥的我能力。,199705104523200078,韩国,2,199705,我的城市/乡村生活,70,75,77,63,87,361,C,
她画了包着一个小小孩子和长的很漂亮的男子，看起来{CQ像}一个家庭。,199705104543200086,香港,2,199705,我的城市/乡村生活,90,80,77,83,94,419,B,
我走在路上看到一个可爱的小孩儿就想起我的童年时代。,199705104543200086,香港,2,199705,我的城市/乡村生活,90,80,77,83,94,419,B,
我曾经想过放弃自己，不接受亲人的安慰，感觉前途一片黑暗，生存亦失去了意义，心里已做[B作]了最坏的打算。,199810801519150033,马来西亚,1,199810,如何面对挫折,85,80,67,82,75,382,B,
跟我们国家气候不一样，生活方式也不一样。,199804123523100034,韩国,1,199804,学习汉语的苦与乐,70,55,57,40,38,244,未参加,
如果别人向我说：“你的汉语水平提高了。,199804123525200494,日本,2,199804,学习汉语的苦与乐,60,65,57,67,64,296,未参加,
我来中国以前没接触过汉语，所以不太清楚汉语是什么样的语言。,199804124523100491,韩国,1,199804,学习汉语的苦与乐,70,60,51,37,46,249,未参加,
所以妇女很容易受到伤害.我认为做一个女人都要有自己的工作.这样夫妻俩之间就不会发生太大的问题{CC部题}了。,199809542542200010,越南,2,199809,如何看待“妻子回家“,65,65,43,52,68,277,未参加,
以前{CC从来}，我也遇到了许多困难和挫折。,199904123525100017,日本,1,199904,如何面对挫折,55,65,26,32,37,197,未参加,
我{CD有}遇到的困难的时期是在生活中最完美的时期。,199904123523200145,韩国,2,199904,如何面对挫折,60,65,48,52,39,247,未参加,
人们生活中一定{CJ-zy会}遇到挫折，[BC。]可是应该克服挫折后前进人生{CJjy}。,199904123525100143,日本,1,199904,如何面对挫折,45,65,53,70,37,250,未参加,
这给了我很大的自信和自豪感。,199904123525200133,日本,2,199904,如何面对挫折,65,70,42,67,69,299,未参加,
有的人遇到{CC面对}了困难就唉声叹气，怨天尤人，并想不出来什么好办法。,199904123540200216,印度尼西亚,2,199904,如何面对挫折,65,70,48,42,41,252,未参加,
其次，每个人都只有{CC只要}依靠自己本身，而不依靠别人，才能达到目的。,199904123640200205,亚美尼亚,2,199904,如何面对挫折,65,55,42,44,56,244,未参加,
在学习上，从小学到初中的{CJ-zxy时候}{CJ-zhuy我}总觉得自己的路是很平很顺利的。,199904124529200290,泰国,2,199904,如何面对挫折,85,85,80,83,93,421,A,
你一放弃就什么事都办不成，[BC.]面对挫折，害怕、[BC，]犹豫是免不了的，但我们应该坚持下去，要大胆地做，你才能尝到什么是成功什么是胜利。,199904124623200324,南斯拉夫,2,199904,如何面对挫折,80,65,70,65,78,346,C,
我真羡慕那些面对挫折时还持着一种不畏困难，不怕挫折的精神的人.我也为那些一碰钉子就唉声叹气，怨天尤人的人而感到可怜。,199909684542200051,越南,2,199909,如何面对挫折,80,75,62,48,67,323,C,
