错句,作文编码,国籍,性别,考试时间,作文题目,口试分数,作文分数,听力分数,阅读分数,综合分数,总分,证书
可以说父母是孩子第一任老师这个观点包括两个方面：父母既[B即]要关心和指导孩子，又要给孩子自由，让他积累自己的经验，从生活中得到自己的教训。,200505109635101213,俄罗斯,1,200505,父母是孩子的第一任老师,95,85,60,51,71,360,C,
只顾自己：“再也受不了”。,200505109748101351,突尼斯,1,200505,父母是孩子的第一任老师,90,80,41,35,55,296,未参加,
我开始学习中文、中国历史、文化。,200505109525101618,日本,1,200505,父母是孩子的第一任老师,80,75,37,57,61,301,未参加,
那时候，他们给我重要的提醒。,200505109525101681,日本,1,200505,父母是孩子的第一任老师,50,75,50,55,67,281,未参加,
她跟我差不多的年龄{CC年岁}。,200505109525101792,日本,1,200505,父母是孩子的第一任老师,65,65,52,67,74,307,C,
有的人说，自己性格不好是因为父母的教育不好。,200505109525202066,日本,2,200505,父母是孩子的第一任老师,80,90,78,83,87,413,B,
虽然我对生理学不感兴[B心]趣，但努力打喜欢的棒[C]球了。,200505109525102146,日本,1,200505,父母是孩子的第一任老师,60,55,54,45,43,238,未参加,
我认为老师是给别人教有用的事情的人，也是能改[C]正人的错误的人。,200505109525202470,日本,2,200505,父母是孩子的第一任老师,70,70,48,61,69,306,C,
对孩子来说父母是日常生活当中最主要的人物。,200505109922202602,美国,2,200505,父母是孩子的第一任老师,85,60,58,53,56,300,未参加,
事实证明，大部分小孩子会讲的第一句话是“爸爸”或“妈妈”。,200505204540200573,印度尼西亚,2,200505,父母是孩子的第一任老师,65,45,69,49,69,276,未参加,
她今年刚2岁。,200505261635200060,俄罗斯,2,200505,父母是孩子的第一任老师,65,55,29,41,34,206,未参加,
所以我完全同意[B以]{CD跟}我们谈论的题目。,200505261635200060,俄罗斯,2,200505,父母是孩子的第一任老师,65,55,29,41,34,206,未参加,
例如，我的父母教{CD了}我尊敬老人，也不欺负{CC2动}小孩{CC小人}。,200505261635100153,俄罗斯,1,200505,父母是孩子的第一任老师,60,60,37,35,47,221,未参加,
我从小就热爱运动，身材[B才]也因此比别人高大许多，[BC。]原因在于我父亲。,200505205533200045,新加坡,2,200505,父母是孩子的第一任老师,70,90,78,61,65,357,C,
另外我家里的这个孩子，包括我的艺术都是很不错的，问来问去才知道，其实我母亲读书的时候是一个画画高手。,200505212529100029,泰国,1,200505,父母是孩子的第一任老师,85,75,58,45,72,327,C,
这句话真有道理。,200505212542200032,越南,2,200505,父母是孩子的第一任老师,80,65,58,49,58,298,C,
所以如果要选[F選]择[F擇]自己的另一半时[F時][BQ，]一定要慎重。,200505522522150002,缅甸,1,200505,最理想的结交方式,90,75,75,66,77,377,B,
上帝创造人类时，就把性别分{CC1分开}为男[D男]女[D女]，我认为这是有意识[L]的，想让我们大家在这大千世界中寻[F尋]觅各自的伴侣，各自创造一段{CC一番}美丽的爱情故事。,200505522522250010,缅甸,2,200505,最理想的结交方式,80,85,63,77,82,381,B,
”妈妈和善的脸{CQ上}{CJ-sy带着}微笑{CD着}说：[BC，][BQ“]妈说出来，你们不会相信的。,200505522522250015,缅甸,2,200505,最理想的结交方式,50,70,43,51,57,254,未参加,
因为世上没有[L]百分百完美的，就像我刚才提到过[F過]的，万事都会[F會]有偶然，有预[F預]想不到的结果，但我认[F認]为，无[F無]论[F論]遇到什么样的事情，我们[F們]应以平常心去冷静地分析、[BC，]思考，使自己到最后不至[B致]于[F於]后悔。,200505522522250025,缅甸,2,200505,最理想的结交方式,85,70,68,60,88,362,C,
在他们[F們]度过{CC经过}的岁月里[F裡]，酸的、甜的什么味道都有，但他们还是互相信任、互相依赖[F賴]，坚持{CD的}走到现[F現]在。,200505522522250034,缅甸,2,200505,最理想的结交方式,60,75,70,66,84,341,C,
父母是最早对孩子的成长产生重大影响的人。,200505209542200100,越南,2,200505,父母是孩子的第一任老师,70,90,78,71,78,380,B,
小孩在{CC从}出生时，最多{CJX}接触[B确]的人是父母，他们的兴趣，爱好，思相观念，行为举止，无一不是从幼年就开始在孩子心目中打{CJ-buy下}深深的烙印。,200505201542200419,越南,2,200505,父母是孩子的第一任老师,80,70,56,59,80,335,C,
如果要我跟她[B他]学[F學]习[F習][BQ，]那我去死好了！,200505226939100080,巴西,1,200505,父母是孩子的第一任老师,40,65,67,51,56,257,未参加,
现为提升待遇和获得更多{CC1广大}的经验，所以愿意到贵公司谋求新的工作机会，如蒙不弃[C]。,200509534519150025,马来西亚,1,200509,一封求职信,70,70,79,84,95,386,C,
我性格较外向，爱说爱唱，中学时还得过演讲比赛的冠军，自认有一些表达能力。,200509534533250077,新加坡,2,200509,一封求职信,80,75,82,80,93,401,B,
我经常{CD有多}阅读课外书，以加强我对这些语言{CC语文}的认识和了解。,200509534533250124,新加坡,2,200509,一封求职信,65,65,68,49,77,308,C,
我在大学休[B体]读旅游课程。,200509534533250127,新加坡,2,200509,一封求职信,60,70,79,49,77,320,未参加,
在大学就读时，本人的成绩不俗。,200509534533250155,新加坡,2,200509,一封求职信,70,75,77,75,88,374,B,
我的母亲是日本人，所以我会用日语沟[B勾]通。,200509534533250165,新加坡,2,200509,一封求职信,70,65,73,55,84,333,C,
我于日前在报章上看见贵公司的招聘启事，因此来信应聘{CC应征}广告设计师一职。,200509534533250173,新加坡,2,200509,一封求职信,70,80,79,80,86,385,B,
其次[BQ，]你要听流行歌曲，可以提高唱歌的能力。,200510111523200010,韩国,2,200510,我看流行歌曲,60,75,42,44,59,266,未参加,
因为流行歌曲不但反映当代社会的现象，而且它的比较{CQ有}情感的歌曲让人开心、[BC，]感动。,200510111523200022,韩国,2,200510,我看流行歌曲,65,70,65,54,69,309,C,
但是，有些人不喜欢流行歌曲，甚至还有人非常蔑视流行歌曲。,200510111523200414,韩国,2,200510,我看流行歌曲,60,70,60,48,64,287,未参加,
因为流行歌曲可以让我享受各[B个]种感情，也可以让我知道一些当代整个社会的追求[C]或[B惑]要求。,200510111523100795,韩国,1,200510,我看流行歌曲,65,50,46,44,69,255,未参加,
有时候买CD，常常听。,200510111523200834,韩国,2,200510,我看流行歌曲,75,60,56,52,57,286,未参加,
对我来说，流行歌曲是在我生活中必要的一种必需品。,200510111523100886,韩国,1,200510,我看流行歌曲,55,65,67,61,55,285,C,
有的时候，已经过时{CC过}的{CC得}流行歌曲{CJX}听时，我想[B相]起来以前和朋友在教室谈一谈{CJcd}的内容。,200510111523201062,韩国,2,200510,我看流行歌曲,60,60,35,24,25,186,未参加,
所以他们开演唱会时也以{CC对}歌迷为重心。,200510111523201113,韩国,2,200510,我看流行歌曲,75,65,37,42,62,268,未参加,
刚[B冈]开始在KTV吧[B巴]唱歌的时候，我像我的朋友一样也选择了最流行的歌曲，有的时候像疯子似的一边唱歌一边喊{CC吹}：“我们爱你，什么什么星星。,200510111604101118,奥地利,1,200510,我看流行歌曲,75,65,60,42,62,291,C,
我对流行歌曲的看法是偏于赞同的[C]，这主要看流行歌曲与人的情绪的问题。[BC，],200510111523201243,韩国,2,200510,我看流行歌曲,70,75,70,75,62,341,B,
现在流行的歌曲大部分是为年轻人的。,200510111523201265,韩国,2,200510,我看流行歌曲,65,70,56,54,59,290,C,
这时代的青少年大部分有MP3和CD机[BQ，]他们都听{CD了}流行歌曲。,200510111523201573,韩国,2,200510,我看流行歌曲,60,60,30,20,40,192,未参加,
对我来说，我也是算小女孩，喜欢听歌喜欢玩[C]的。,200510111523201619,韩国,2,200510,我看流行歌曲,70,70,72,50,59,309,C,
其实，流行不流行并不重要，最重要的是哪个歌曲最适合自己。,200510111540201626,印度尼西亚,2,200510,我看流行歌曲,65,65,42,48,67,271,未参加,
如果没有这样的能力，那么你没有享受这样的权力。,200510111523101863,韩国,1,200510,我看流行歌曲,60,60,60,52,62,276,未参加,
我很喜欢听用乐器演奏{CC2演}的歌曲，特别是小提琴和二胡。,200510111940201867,秘鲁,2,200510,我看流行歌曲,80,55,58,38,40,257,未参加,
出生于80年代之后的人通常都喜欢听音乐。,200510204512200272,菲律宾,2,200510,我看流行歌曲,70,55,83,52,77,321,未参加,
有的流行歌曲让[B认]我回忆到过去的美好时光。,200510204919200383,加拿大,2,200510,我看流行歌曲,90,75,65,56,84,364,C,
别人听流行歌曲都有自己喜欢的歌星，[BC。]我也不例外{CC例别}。[BC，],200510520520250004,蒙古国,2,200510,我看流行歌曲,75,45,53,30,47,232,未参加,
我觉得从自己的爱好来看流行歌曲很有意义。,200510302523200037,韩国,2,200510,我看流行歌曲,75,80,51,54,79,330,C,
我的三个姐姐下课后，常常在家放流行歌曲。,200510302523200072,韩国,2,200510,我看流行歌曲,75,80,70,61,72,349,B,
流行歌曲虽[B随]然是生活中的绿洲[B州]，但这也不是主要的[BQ。]我们要管好{CC挑好}自己的情感，使我们{CQ的}生活更加有意义[L]更加愉[B娱]快。,200510302523200107,韩国,2,200510,我看流行歌曲,75,60,77,46,82,326,未参加,
流行{CJ+sy是}过{CJ-dy一些}时候再回来。,200510302523100127,韩国,1,200510,我看流行歌曲,65,55,30,28,32,192,未参加,
例如{CD什么}学生们去旅游啦[C]，可是没有音乐那有什么好玩呢？,200510302523200140,韩国,2,200510,我看流行歌曲,50,45,46,26,35,178,未参加,
我20岁左右的那时候歌曲是几乎动一点人们的感情{CJ？}，只听也会掉眼泪的那种感觉{CJy}。,200510302523200215,韩国,2,200510,我看流行歌曲,75,65,53,34,45,259,未参加,
你们有没有感到不同的时代{CQ的}人感{CC有}兴趣的音乐也不一样。,200510302523200237,韩国,2,200510,我看流行歌曲,65,65,58,40,62,274,未参加,
就很少人听。,200510302523100245,韩国,1,200510,我看流行歌曲,65,70,53,44,57,275,未参加,
我认为流行歌曲总是有着非常多的听众。,200510529529251004,泰国,2,200510,我看流行歌曲,60,60,53,56,72,283,未参加,
流行歌曲是随着{CC根据}时代的潮流，{CJ+sy体现[F現]出}人们当[F當]时所喜爱的歌曲。,200510529529251018,泰国,2,200510,我看流行歌曲,65,50,53,40,35,224,未参加,
唱歌像说话一样，没有节奏，只要歌手长得好看一点就能上台唱歌，声音也不怎么样，好像没有好好训练过似的。,200510540540200002,印度尼西亚,2,200510,我看流行歌曲,85,95,63,56,67,362,C,
所以，我对流行歌曲也好，艺术歌曲也好，都很喜欢。,200510540540100043,印度尼西亚,1,200510,我看流行歌曲,65,80,70,44,91,338,C,
如果有人问道，什么音乐可以象征[B证]年轻人，毫无疑问所有的人会说“当然是流行[B星]歌曲!”我今年才二十六岁，还算可以列入到年轻人的阶段吧，因此我也不例外，当然喜欢流行[B星]歌曲。,200510540540200038,印度尼西亚,2,200510,我看流行歌曲,65,65,65,52,77,308,C,
虽然，每个人都知道，唱歌是一种艺术的表演，好听的歌、好听声音是比相貌更重要[BQ。]但在现今的社会，一切都是速食的，只要敢，只要有影迷，只要有钱，艺术已不重要。,200510540540200066,印度尼西亚,2,200510,我看流行歌曲,95,70,72,71,91,393,B,
你们过得愉快吗？,200104124525200024,日本,2,200104,一封写给父母的信,70,60,52,51,49,267,未参加,
爸爸、妈妈，你们好！,200104124523200085,韩国,2,200104,一封写给父母的信,65,50,58,61,63,278,未参加,
我真的有福。,200104124523200158,韩国,2,200104,一封写给父母的信,70,90,58,35,56,302,未参加,
平时跟妈妈{CJX}想说的话都打{CD个}电话说了。,200104124523200191,韩国,2,200104,一封写给父母的信,55,60,41,28,38,203,未参加,
万事如意！,200104124540200184,印度尼西亚,2,200104,一封写给父母的信,70,85,52,39,67,305,未参加,
一天比一天{CJX}我想回国去看我的朋友们[B门]，[BC、]{CQ很想}见父母，[BC。]很想回国。,200104124523100195,韩国,1,200104,一封写给父母的信,60,65,36,35,47,226,未参加,
爸爸、[BC，]妈妈工作{CC公做}怎么样？,200104124523200284,韩国,2,200104,一封写给父母的信,65,60,25,28,45,206,未参加,
××××2001年4月15日,200104124525200273,日本,2,200104,一封写给父母的信,65,90,79,80,81,386,B,
不管多么忙，我至少还得一个星期练三天，让他放心吧，下个星期我有考试，考完以后就是中国的“五一”，学校要放七天{CJ-zxy假}。,200104124529200300,泰国,2,200104,一封写给父母的信,80,80,49,54,54,309,C,
最重要事是你们的健康。,200104124523200329,韩国,2,200104,一封写给父母的信,70,55,38,39,56,242,未参加,
姑姑和姑丈呢？,200104124529200441,泰国,2,200104,一封写给父母的信,85,90,68,82,85,406,B,
“安乐死”这个问题不但医学界、[BC，]法学界议论纷纷，一般人们也很关注这个问题。,199604123523200287,韩国,2,199604,如何看待“安乐死”,75,80,53,71,60,329,C,
我{CQ从}间[F間]接的{CC地}经验者的立场上来看，我们生活当中有时也需[B须]要采取安乐死。,199604124523200183,韩国,2,199604,如何看待“安乐死”,50,45,56,42,52,220,未参加,
因为{WWJ},199604123529200196,泰国,2,199604,如何看待“安乐死”,50,50,29,37,37,179,未参加,
这[C]不是说明我赞成[C]“[BC”]安乐死”的方法。,199604124635200099,俄罗斯,2,199604,如何看待“安乐死”,60,55,61,44,47,248,未参加,
P}看来，这种的情况不少，[BC、]在我们国家也有这种情况。[BC，],199604123523100262,韩国,1,199604,如何看待“安乐死”,60,55,29,57,31,213,未参加,
那么如果人类实行安乐死的话，{CD岂}抗生素还会被发明吗？,199604123619100506,罗马尼亚,1,199604,如何看待“安乐死”,80,65,66,83,52,334,C,
即使感情上这么办觉得不合适，还是要制裁，法律上是这样的。,199604123525100218,日本,1,199604,如何看待“安乐死”,65,65,53,47,42,256,未参加,
丈夫并没有恶意，反而他为了解脱妻子的病苦{CJs}，这是不应该受到法律的制裁{CJsd}。,199604123525100164,日本,1,199604,如何看待“安乐死”,60,60,42,54,47,245,未参加,
当然不一样。,199604124525200342,日本,2,199604,如何看待“安乐死”,65,80,77,79,88,377,B,
父母因此应[F應]引领[F領]子女用灵[F靈]活的学[F學]习[F習]{CJ-zxy方法}，使他们容易学到应[F應]有的知[B智]识[F識]。,199610802801200008,澳大利亚,2,199610,如何解决“代沟”问题,80,80,60,65,72,349,C,
现今，父母与子女之间[F間]普遍存在着代沟问题。,199610512501250005,中国,2,199610,如何解决“代沟”问题,80,90,91,75,74,405,B,
其次{CC2次}是，要了解[C]对方的心理[B里]。,199610550523290011,韩国,2,199610,如何解决“代沟”问题,70,65,65,69,67,322,C,
人们[C]为了生活下去只干活儿不知道什么浪漫。,199610550523290060,韩国,2,199610,如何解决“代沟”问题,65,60,49,50,53,260,未参加,
也就是说[F說]，今天的资[F資]讯[F訊]比以前多，比以前丰[F豐]富，今天的小孩子也{CJX}懂的事情比他们[F們]父母小时[F時]候[B后[F後]]懂的多。,199611543922100518,美国,1,199611,如何解决“代沟”问题,90,70,57,46,57,313,未参加,
以上建议[F議]都是很概要的，若落实[L]到生活里[F裡]面则{CQ要}多为[F為]对方着想，多想对方为何如此，从[F從]而找出办[F辦]法，用一{CQ种}积极[F極]的态[F態]度去处[F處]理就一定可以把问[F問]题解决。,199611543501100505,中国,1,199611,如何解决“代沟”问题,90,85,75,69,78,394,B,
这是为了自己的利益着想{CC起见}。,199603533533100019,新加坡,1,199603,由“三个和尚没水喝”想到的……,90,85,80,74,94,420,B,
有人做了就会利用，在没有的利用的时候{CC情候}就让[B浪]它空着，这种自私自利，懒散的人，处处可见，可我们千万不要有这种想法去利用别人，懒散是要不得的。,199603533533200033,新加坡,2,199603,由“三个和尚没水喝”想到的……,85,90,77,60,80,388,B,
这位年轻{CC青年}和尚说完了这段话后，挺身拿起挑水工具，去{CC往}山下抬水去。[BC，],199603533533200050,新加坡,2,199603,由“三个和尚没水喝”想到的……,90,95,66,76,82,407,B,
人多意见[F見]杂[F雜]，人事纷争{CC纷事}多。,199603533533200090,新加坡,2,199603,由“三个和尚没水喝”想到的……,90,90,66,70,87,401,B,
在这时候，第一个法[L]号为智定的和尚为大家想出了一个办法{CD来}。,199604680519100513,马来西亚,1,199604,由“三个和尚没水喝”想到的……,85,70,63,83,91,383,C,
主持把所有的和尚都召到大厅{CD上}，端正地{CC的}坐在上座对所有的和尚说：“本人年纪已大了，已不久{CQ于}人世了，所以此主持的位子也将传给{CC由}你们这一代了。,199604680519100515,马来西亚,1,199604,由“三个和尚没水喝”想到的……,90,70,66,79,77,375,C,
你累了，就轮到另一个和尚接班。,199604680519100516,马来西亚,1,199604,由“三个和尚没水喝”想到的……,95,75,66,72,84,387,B,
那个和尚去附近的树后边，观察{CC2看}情况。,199605104525100035,日本,1,199605,由“三个和尚没水喝”想到的……,75,55,69,56,61,301,C,
这故事是比较幽默{CJxw}/{CJsd}，可是它表现了我们日常生活当中能碰见的问题，而这种问题实际{CQ上}毫无幽默性。,199605104634200038,英国,2,199605,由“三个和尚没水喝”想到的……,90,70,63,74,87,377,C,
后来又来了第三个和尚。,199605104523100041,韩国,1,199605,由“三个和尚没水喝”想到的……,75,75,77,56,63,336,C,
人类因为把石油用了{CC得}很多，而且石油{CD原来}是个有限{CC2有限制}的东西，所以{CQ像}故事中的小水流一样没有了，[BC。]这是最后阶[F階]段。,199605104525100059,日本,1,199605,由“三个和尚没水喝”想到的……,65,60,58,72,68,306,C,
{CJ-zhuy我}由“三个和尚没水喝”想到的是社会上{CC3人间}的个人主义现象，[BC。]这就是一种社会{CC人间}的坏现象{CC3坏处}。,199605104523100071,韩国,1,199605,由“三个和尚没水喝”想到的……,65,55,33,51,44,230,未参加,
张和尚走了，[BC。]李和尚也走了，[BC。]最后孟和尚走了。,199605104525200078,日本,2,199605,由“三个和尚没水喝”想到的……,65,60,52,60,42,262,未参加,
所以说：“三个[F個]和尚没水喝这[F這]道理，我们[F們]必须[F須]紧[F緊]记[F記]，不要犯这[F這]毛病，免得把事情弄糟，弄失败[F敗]了，而且更把彼此间[F間]的友谊[F誼]也破坏[F壞]{CQ了}。,199605104543200122,香港地区,2,199605,由“三个和尚没水喝”想到的……,85,95,71,81,84,412,A,
很简单，他只不过是一个穷[C]和尚[C]，而且他的说教也不怎么样，老百姓终于不理他了。,199605104525100144,日本,1,199605,由“三个和尚没水喝”想到的……,65,65,46,74,68,302,C,
再说表面上取得自己的小利益，实际上{CQ会}损失更大的利益。,199605104523200159,韩国,2,199605,由“三个和尚没水喝”想到的……,65,65,55,54,65,288,C,
这样各个的义务让他们束缚决不能犯罪{CJjy}。,199605104523100205,韩国,1,199605,由“三个和尚没水喝”想到的……,60,45,33,67,46,229,未参加,
他早一点起来偷偷地一个人到山底下，[BC。]{CJ+zhuy他}打算不让别的和尚知道的情况下自己挑水一个人喝。,199605104523100235,韩国,1,199605,由“三个和尚没水喝”想到的……,70,55,69,54,51,283,C,
以前我刚到中国的时候，对学校的情况[BD，]一无所知。,199605104523100289,韩国,1,199605,由“三个和尚没水喝”想到的……,55,70,60,45,49,263,未参加,
这篇短文告诉我们人追求方便和利益。,199605104523100291,韩国,1,199605,由“三个和尚没水喝”想到的……,60,60,44,54,35,235,未参加,
这样需要环境即条件的人没有考虑过这环境即条[F條]件。,199605104523100378,韩国,1,199605,由“三个和尚没水喝”想到的……,65,65,58,42,49,263,未参加,
在中国，孩子们看了这篇故事以后会怎么想{CD去}解决的办法呢？,199605104525200381,日本,2,199605,由“三个和尚没水喝”想到的……,70,65,80,65,63,329,C,
这篇传说告诉我们：[BC，]“每个人都具有这样的一面，不要忘记。,199605104525200396,日本,2,199605,由“三个和尚没水喝”想到的……,70,60,77,56,80,328,C,
其对策可分为两个。,199605550523290027,韩国,2,199605,由“三个和尚没水喝”想到的……,60,80,69,63,77,336,C,
这不是那么难而是慢慢小小的努力就[C]可以实现[BQ。],199605550523290035,韩国,2,199605,由“三个和尚没水喝”想到的……,65,50,55,35,42,228,未参加,
所以我从小上学就很勤奋。,200110540540150059,印度尼西亚,1,200110,我的童年,70,90,74,51,83,361,C,
勿里洞的海滨很美丽，白色的沙滩，清澈的海水很吸引人。,200110540540150059,印度尼西亚,1,200110,我的童年,70,90,74,51,83,361,C,
那时[F時]人情是挺浓厚的。,200110540540150061,印度尼西亚,1,200110,我的童年,60,90,47,68,90,345,未参加,
也不需要再参加什么补习班、辅导班，放了学做完作业，空余[F餘]的时间是那么多，但却没有交上坏朋友也没有染上什么恶习，因为我已满足于当时的状况。,200110540540250067,印度尼西亚,2,200110,我的童年,75,80,66,75,94,381,B,
我的童年，可以说是幸福的。,200110540540250101,印度尼西亚,2,200110,我的童年,80,90,77,73,74,389,B,
但是，如果您看过那段夺得十大最佳电视广告之一的“知度时”表[F錶]广告，[BC；]其设计及策划是我和另一位同事的杰作。,199312533533100051,新加坡,1,199312,一封求职信,95,85,78,76,87,419,B,
我最[C]擅长{CC特长}{CD是}电视广告，啤酒广告所说的话现在已流行为许多人都乐意引用{CJ-zxy的话}，而且{CC且而}商家也非常欣赏这广告，还邀请我为他做{CC作}一系列的广告，希望贵公司给予{CC于}机会，则感[C]激不尽。[BC.],199312533533200083,新加坡,2,199312,一封求职信,90,80,46,70,64,345,C,
×××敬上一九九三年十二月四日,199312533540200113,印度尼西亚,2,199312,一封求职信,80,90,67,78,94,404,B,
工作成绩优良，曾获该场“优秀”奖状。,199312533540100158,印度尼西亚,1,199312,一封求职信,85,95,55,72,68,373,C,
我上大学期间对文化和名胜古迹很{CJ-sy感}兴趣，[BC.]所以用节假日去别的地方旅游{CC游行}。[BC.],199312104523100007,韩国,1,199312,一封求职信,65,55,57,47,55,261,未参加,
我叫×××。,199312123525100201,日本,1,199312,一封求职信,50,55,34,56,36,209,未参加,
我知道[BD、]对一个导游来说，[BC、]最重要的是，表达能力和关于各国文化历史的了解。,199312123525100210,日本,1,199312,一封求职信,55,50,53,39,32,208,未参加,
我以前做过旅游业这个行业{CC2行}，可是还不满足于我的做旅游业之理想。,199312124523100246,韩国,1,199312,一封求职信,55,70,57,58,52,276,未参加,
看了以后你们一定感到我就是现在你们公司最需要的人。,199312123523200407,韩国,2,199312,一封求职信,60,55,50,36,34,216,未参加,
虽然我没有经验[BQ，]可是我有信心。,199312124525200432,日本,2,199312,一封求职信,50,55,74,70,66,293,未参加,
在学校毕业了以后[BQ，]按笔试的测验的成绩开始[C]担任中国旅游公司的经理[C]。,199312124635100429,俄罗斯,1,199312,一封求职信,60,70,60,76,62,313,C,
过[C]了两[C]年以后我又在语言[C]系学了我上面{CC以上}提到{CC提出}的三门语言。,199312123745200904,苏丹,2,199312,一封求职信,60,55,41,30,39,206,未参加,
我不知道[C][BD。]父亲的哥哥[C]是什么样的人，也不知道[C]父亲的妹妹[C]是什么样的人。{CP一般父亲这个情况不说了{CD呢},199412123525100002,日本,1,199412,记我的父亲,50,70,25,28,35,191,未参加,
我觉得他虽然是一个文盲，也没有什么特别的专业技能，但他不愧是一位好父亲。,199412123624200099,挪威,2,199412,记我的父亲,75,75,70,48,65,323,C,
我到中国的那天，我父亲的一句话给我带来了启发。,199412124525200011,日本,2,199412,记我的父亲,85,80,46,36,63,303,未参加,
可惜她的幻想并[F並]不是灿[B燃]烂的，却是悲惨的[BQ，]所以她的生活不那么愉快。[BC，],199412104523200627,韩国,2,199412,记对我影响最大的一个人,65,65,46,61,43,264,未参加,
”那[BD，]我呢，[BC？]肯定这样回答：[BC、]“我一直到现在最{CJX}印象[B像]深的人[BD、]就是[BD、]在上高中的时候[BD、]教国语的老师[BQ。]”也许[BD、]你会问[BQ：]“为什么？,199412104523200695,韩国,2,199412,记对我影响最大的一个人,60,60,54,44,55,255,未参加,
对我来说，{CJ-zhuy我}只爱看书，没有别的爱好。,199412104525200655,日本,2,199412,记对我影响最大的一个人,60,65,83,69,67,327,C,
