错句,作文编码,国籍,性别,考试时间,作文题目,口试分数,作文分数,听力分数,阅读分数,综合分数,总分,证书
男女同学能通过[L]各种课外活动，认识和了解对方。,200410534533150094,新加坡,1,200410,最理想的结交方式,90,70,66,63,84,366,C,
男女之间虽然不一定要求门当户对，但是我认为最重要还是要匹配。,200410534533250090,新加坡,2,200410,最理想的结交方式,80,85,74,47,72,352,C,
必定有很多时候对对方不满。,200410534533250095,新加坡,2,200410,最理想的结交方式,50,75,69,56,70,304,未参加,
比如在学校学习过程中认识，然后彼此在学习及成长[F長]的道路上互相扶持、认识、理解及建立共同的爱好。,200410534519250106,马来西亚,2,200410,最理想的结交方式,95,80,60,88,100,419,B,
我也有朋友和青梅竹马的玩伴走在一块，但我觉得这可能是出自一种习惯吧。,200410534533150115,新加坡,1,200410,最理想的结交方式,95,90,77,83,96,440,A,
退[B迟]休的运动员还能挣[B争]钱因为他会当有名的教练{CJs}，比如：退[B迟]体的羽毛球{CQ运动}员会培养年轻的羽毛球{CQ运动}员。,200404140540100082,印度尼西亚,1,200404,运动员收入,70,65,41,42,37,241,未参加,
那是运动员的特别专长[BQ。]运动员的运动专长不是天生就有的，他们是靠努力[B刀]和长久的刻苦练[B炼]习{CD中}得来的！,200404140522200302,缅甸,2,200404,运动员收入,85,60,75,79,84,371,C,
当少男少女被安排同处一室而长[F長]久产生肌体之亲[F親]，就难免引起各类[F類]{CD的}社会问题，诸如未婚产[F產]子，非礼强奸[F姦]等等。[BC.],200504534533150005,新加坡,1,200504,我对男女分班的看法,65,85,65,78,70,353,C,
学生{CC生学}不单要专注学业，[BC。]也得同时设法适应身体在发育期间所产生的种种变化。,200504534533250053,新加坡,2,200504,我对男女分班的看法,75,80,73,60,86,365,B,
在看待这个问题时，我赞成被采访的学者反对男女分班的观点，与此同时，我确实{CC2确}也能理解[L]父母亲对孩子和异性同班的顾虑。,200504534533250062,新加坡,2,200504,我对男女分班的看法,65,75,78,84,75,364,B,
其实，这是无可厚非的。,200504534533250088,新加坡,2,200504,我对男女分班的看法,70,80,70,89,91,390,B,
这不只影响了工作，还可能会影响到未来和丈夫或妻子的感情。,200504534533250130,新加坡,2,200504,我对男女分班的看法,70,85,70,73,64,354,B,
若我们改变角度来看，恋爱可以让学生们学习到一些人生道理，如尊重、[BC，]礼让。,200504534533150151,新加坡,1,200504,我对男女分班的看法,75,75,70,67,73,350,B,
男女分班也会令男女在投入社会工作[B做]后，由于不了解彼[B比]此的思想，合作起来也就比较难了。,200504534533250170,新加坡,2,200504,我对男女分班的看法,80,80,65,80,82,379,B,
这说法不是每个父母{CJ-zy都}会理解，可是以父母为第一任老师[BQ，]本人十分同意。{CP{CJ-zhuy孩子},200505109540100081,印度尼西亚,1,200505,父母是孩子的第一任老师,50,40,44,38,59,206,未参加,
为什么呢？,200505109540100476,印度尼西亚,1,200505,父母是孩子的第一任老师,65,50,46,40,54,236,未参加,
因为孩子就是模仿[B访]父母的行动成长的。,200505109525100849,日本,1,200505,父母是孩子的第一任老师,60,65,82,65,46,301,C,
不是别人强迫{CC2教}我，而是自已求学时，才能得到满意的结果。,200505109525200907,日本,2,200505,父母是孩子的第一任老师,80,90,87,58,79,389,B,
我同意这个观点。,200505109623200924,南斯拉夫,2,200505,父母是孩子的第一任老师,70,65,52,47,59,279,未参加,
如果开头好那结果一定也好。,200505109623200924,南斯拉夫,2,200505,父母是孩子的第一任老师,70,65,52,47,59,279,未参加,
我觉得现在的父母因为工作忙，因为父亲母亲都去上班，管不了孩子，孩子{CQ由}别人代替照顾。,200505109540101118,印度尼西亚,1,200505,父母是孩子的第一任老师,70,65,55,35,62,273,未参加,
但[C]在{CC从}父母传[C]给孩子的[C]知识[C]的[C]基础上，孩子自[C]己[C]会形成自[C]己[C]的[C]思[C]维[C]与性格。,200505109525201210,日本,2,200505,父母是孩子的第一任老师,80,75,73,62,69,350,B,
对于“父母是孩子的第一任老师”的问题我的意见就是赞成。,200505109525201368,日本,2,200505,父母是孩子的第一任老师,60,65,46,58,62,274,未参加,
我同意这个题目的看法。,200505109525101722,日本,1,200505,父母是孩子的第一任老师,60,60,31,55,39,227,未参加,
如果父母的思想有偏见什么的话，孩子的思想也会有偏见。,200505109525201852,日本,2,200505,父母是孩子的第一任老师,60,50,37,51,52,230,未参加,
父母无疑[C]是让孩子最信赖[C]的存在。,200505109525201852,日本,2,200505,父母是孩子的第一任老师,60,50,37,51,52,230,未参加,
所以我现在感谢父母。,200505109525201979,日本,2,200505,父母是孩子的第一任老师,60,65,50,49,61,268,未参加,
只有父母照顾孩子、教孩子，孩子才能活下去。,200505109525202284,日本,2,200505,父母是孩子的第一任老师,70,70,46,69,63,306,C,
孩子出生后，第一次认识的就是父母了。,200505109525202443,日本,2,200505,父母是孩子的第一任老师,70,65,56,61,61,299,C,
我会尽我最大的努力把我的孩子培养成龙或{CC与}凤。,200505109512202592,菲律宾,2,200505,父母是孩子的第一任老师,90,90,71,55,67,371,B,
尤其是在孩子上小学[F學]和初中的年龄[F齡]{CD中}，父母{CQ的}言行肯定会[F會]影响[F響]孩子在思想、心理等方面的发[F發]展。,200505109616102594,德国,1,200505,父母是孩子的第一任老师,90,70,46,45,72,316,未参加,
“父母是孩子的第一任老师”，[BC。]对我个[B各]人来说，我特别赞同这种说[B话]法。,200505204540200394,印度尼西亚,2,200505,父母是孩子的第一任老师,95,75,63,59,72,359,C,
第一，幼年的时候是一{CQ个}人最“开放”的时期。,200505205604200019,奥地利,2,200505,父母是孩子的第一任老师,75,65,52,47,56,282,未参加,
但是看尽[F盡]身边[F邊]朋友的分分分合合之后[F後]，我对[F對]一见[F見]钟[F鍾]情、干[F乾]柴烈火的事早就没有任何幻想。,200505951922250014,美国,2,200505,最理想的结交方式,95,90,93,80,97,454,A,
在我个人{CD的}认[F認]为[F為]人生最大的不幸就是家庭破裂[B烈]，最后[F後]弄得{CC的}妻离子散[B潵]，一发[C]不可收拾[B恰]，到时[F時]候一切后[F後]悔莫及，只有忍痛[C]悲伤[F傷]。[BC，],200505522522110020,缅甸,1,200505,最理想的结交方式,65,75,43,35,61,266,未参加,
孩子小的时候他还不懂什么是好，什么是坏的{CJsd}，当时小孩都模[B莫]仿[B妨]父母的动作和行为。,200505209542200106,越南,2,200505,父母是孩子的第一任老师,75,75,35,43,43,261,未参加,
我们的孩子会成为{CC长为}什么样的人取决{CC决定}于我们教给他们的基本知识。,200505207635200007,俄罗斯,2,200505,父母是孩子的第一任老师,80,85,44,55,67,325,未参加,
此时，父母必须对孩子进行启发和指导。,200505502540200050,印度尼西亚,2,200505,父母是孩子的第一任老师,80,70,44,59,56,299,未参加,
而且有一句[B几]话说[BQ“]有父{CJX}其必有其子[BQ；]有其{CC必}母必有其女[BQ]。,200505332540200042,印度尼西亚,2,200505,父母是孩子的第一任老师,70,50,41,31,36,211,未参加,
附上我的毕业证书、法语文凭[F凴]、简历以及新加坡理工学院校长和师长的评语影印[L]本各一份。,200509534533250086,新加坡,2,200509,一封求职信,70,70,63,66,88,345,C,
请和我以这{CQ个}地址联络：祥林路四号，新加坡邮区540197。,200509534533250139,新加坡,2,200509,一封求职信,70,80,91,80,93,404,B,
我是因薪水上和老板谈不拢，所以才另谋高就的。,200509534533250144,新加坡,2,200509,一封求职信,75,70,75,60,79,348,C,
而且，我相信我可以以创新的广告点子抓{CC捉}住年轻夫妻的心{CC1心灵}，让他们更渴望到日本度蜜[B密]月。,200509534533250165,新加坡,2,200509,一封求职信,70,65,73,55,84,333,C,
谢谢！,200509534533250186,新加坡,2,200509,一封求职信,70,70,77,80,82,367,C,
对本人的联系地址如下：88号裕廊大道#08-80新加坡邮区244886本人会期待李先生的答复。,200509534533250188,新加坡,2,200509,一封求职信,0,65,77,55,91,281,未参加,
我是要应征广告设计师的工作。,200509534533250189,新加坡,2,200509,一封求职信,75,70,73,49,64,320,C,
在它的名字[B子]上也能看得出来，它{CC他}只是流行的歌曲，是{CC会}流行到后代的可能性很少的歌曲{CJs}。,200510111523100012,韩国,1,200510,我看流行歌曲,75,85,67,54,64,338,C,
我虽然是个年轻人，但{CC人}我觉得像青少年一样盲目追求明星或是只听流行歌曲是不好的。,200510111523200016,韩国,2,200510,我看流行歌曲,75,75,65,46,69,320,C,
我听过他们的歌后感到很好听，有些地方我不太明白，但整体来看我觉[C]得还可以。,200510111523100430,韩国,1,200510,我看流行歌曲,70,70,37,26,55,246,未参加,
正应该刻苦地{CC的}学[C]习时由于听流行歌[C]曲而浪[Plàng]费时间是一件笨拙的事。,200510111523100435,韩国,1,200510,我看流行歌曲,65,65,74,69,67,324,C,
有些人特别喜欢流行歌曲，不仅是喜欢歌曲还疯[B风]狂地喜欢歌手。,200510111523200793,韩国,2,200510,我看流行歌曲,80,65,67,46,69,315,C,
但是我认为流行歌曲是对人们很有用的东[B动]西。,200510111523200828,韩国,2,200510,我看流行歌曲,65,70,63,42,52,278,未参加,
每个人都有享受自己[B已]的爱好的权[B劝]利。,200510111523200834,韩国,2,200510,我看流行歌曲,75,60,56,52,57,286,未参加,
我个人认为流行歌曲就像心里话一样，是一种方法{CJX}表达自己[C]的心里、观点等。,200510111523200846,韩国,2,200510,我看流行歌曲,65,70,74,50,59,304,C,
每个人都有自己的爱好，有的人喜欢看书，有的人喜欢听音乐。,200510111523100869,韩国,1,200510,我看流行歌曲,65,65,49,32,47,242,未参加,
一般东方的流行歌[B哥]曲的音乐节奏比[B北]较慢。,200510111523200879,韩国,2,200510,我看流行歌曲,55,90,53,40,67,294,未参加,
不管怎么样，我很喜欢听流行歌曲，我觉得流行歌曲是可以代表那{CQ个}时代的社会文代和潮[B朝]流的，而且可以代表人们的思想和感情。{CD可以},200510111523201032,韩国,2,200510,我看流行歌曲,75,80,58,46,67,317,C,
首先，喜欢听流行歌曲的人们，因为现在流行的歌曲能体会到现代音乐，还能体会以前所未体会过的新鲜感。,200510111523101253,韩国,1,200510,我看流行歌曲,75,85,72,67,55,347,B,
他[B它]们真诚地安慰我。,200510111523101267,韩国,1,200510,我看流行歌曲,65,65,56,30,50,250,未参加,
但是最重要的问题是控[B空]制自己{CD的}。,200510111523201849,韩国,2,200510,我看流行歌曲,60,60,51,56,64,273,未参加,
再如，个人在将来的发展趋向{CQ上}也是需要父母的引导和帮助{CJsd}。,200510919919150003,加拿大,1,200510,父母是孩子的第一任老师,80,95,71,71,99,411,B,
小孩在成长的过程总是会在模仿中学习。,200510919501150011,中国,1,200510,父母是孩子的第一任老师,85,90,86,74,94,425,A,
这种哲理认为，人天生就具备许多基本的思维能力，所以人可以做自己的第一任老师。,200510956501130001,中国,1,200510,父母是孩子的第一任老师,90,95,77,68,88,416,B,
我也非常喜欢流行歌曲，听着我喜欢的流行歌曲，自然地{CC的}高兴起来。,200510302523200002,韩国,2,200510,我看流行歌曲,75,75,65,59,72,336,C,
可是，听音乐只是爱好而已。,200510302523200045,韩国,2,200510,我看流行歌曲,75,75,58,52,74,324,C,
因为文化演奏[B秦]会的观众中有年轻人，也有老年人，所以上台的歌手也是各种年代的人。,200510302523200080,韩国,2,200510,我看流行歌曲,70,90,60,59,79,351,C,
可能这一点是所有喜欢流行[L]歌曲的人的共同的原因之一{CJZR}。,200510302523100098,韩国,1,200510,我看流行歌曲,75,75,65,48,77,330,C,
歌曲{CJ+sy是}有非常多的听众，我也很喜听流行歌曲。,200510302523200122,韩国,2,200510,我看流行歌曲,65,70,51,36,57,265,未参加,
我就是赞[F贊]成这[F這]一现[F現]象的学生。{CQ对},200510302523100197,韩国,1,200510,我看流行歌曲,80,75,58,44,62,310,C,
流行歌曲所带来的好处也有{CQ不少}。,200510302523200188,韩国,2,200510,我看流行歌曲,60,50,72,48,50,260,未参加,
因此，我对流行音乐的看法是可以喜欢，但不要达到痴迷的程度。,200510302523200199,韩国,2,200510,我看流行歌曲,95,90,67,69,87,407,B,
不太喜欢流行歌曲。,200510302523200216,韩国,2,200510,我看流行歌曲,60,45,42,28,57,210,未参加,
这{CD是}对你有很大的机会[BQ，]就是学习外语而且了解该国{CC其国}文化的机会。,200510302523200221,韩国,2,200510,我看流行歌曲,65,65,46,46,52,258,未参加,
听流行歌曲有很多好处。,200510302523100227,韩国,1,200510,我看流行歌曲,60,60,42,34,50,228,未参加,
流行歌曲总是有着非常多的听众，因为很熟悉而怜人越听越好{CJ？}，有些人特别喜欢流行歌曲。,200510529529251005,泰国,2,200510,我看流行歌曲,65,65,60,50,62,286,C,
根[B跟]本不像[B想]在唱歌，真怕他们会喊出病来，[B致]于词句呢，{CJ-zhuy字音}也咬不准，好像自己一个人站在台上嘀咕的自言自语，词不对曲的。,200510529529251008,泰国,2,200510,我看流行歌曲,65,75,42,36,50,255,未参加,
我从小{CJ+zxy的时候}到现在都对流行歌曲很喜欢{CC2好}。,200510529529251024,泰国,2,200510,我看流行歌曲,60,65,39,22,35,204,未参加,
我从小就喜欢听中文歌，虽然那时一句中文也听不懂，但是我好像能猜出歌的内容，那时我最爱听的是中文老歌，还记得每当我放录音带时，妈妈也会轻轻地唱，看妈妈高兴我心里便高兴了。,200510540540200036,印度尼西亚,2,200510,我看流行歌曲,65,65,60,34,67,275,未参加,
40年前，学校被关闭我才读六年级，但我是在爱国家庭里长大的，所以至今{CD到后}我还是喜欢发扬中国民族音乐和舞[B午]蹈，因为现在我最小的女儿还很喜欢跳民族舞[B午]呢，在我的汉语补习班里，我就时常教学生们唱新中国歌曲，还教他们儿歌。,200510540540200070,印度尼西亚,2,200510,我看流行歌曲,50,80,60,36,69,280,未参加,
只要你满面春风，笑容总挂在脸上，别人一定就{CJX}想做[B作]你的朋友，想把你当作他的意中人。,200505684542200005,越南,2,200505,最理想的结交方式,75,80,63,64,48,321,C,
彼此的感情可媲美兄妹或姐弟的感情{CJbi}。,200505680519250013,马来西亚,2,200505,最理想的结交方式,65,80,82,80,84,379,B,
所以说[F說]，有父母的孩子是{CC的}幸福的，因此不要忘了对[F對]自己的父母说[F說]声谢[F謝]谢[F謝]！,200509602801250011,澳大利亚,2,200509,父母是孩子的第一任老师,0,75,88,81,84,324,未参加,
爸呢，[BC？]{CJ-zhuy他}怎么样？,200104124523200075,韩国,2,200104,一封写给父母的信,75,70,63,58,47,302,C,
我好久没有给你写信，也许现在您很担心我，为什么没有给你写一封信，为了让你安心，我真的对不起你，不是我没有时间给你写信[BQ，]而是我怕你更担心我[BQ，]因为我的情况不太好，如果我我给你写信的话肯定{CJX}我会告诉你我在中国的情况[BQ。]再一次请你原[B愿]谅我，好吗，我不想[B要]多说了[BQ。]现在我想告诉你我在中国的情况[L]，我快要考试{CQ了}所以很忙，在这儿我认识很多外国人[BQ，]他们特别热情[BQ，]我常常说到妈妈[L]和爸爸[L]，他们很想认识妈爸，我也很自豪有这样的爸妈，还有现在我每天去游泳[B游]因为我怕我变[B恋]成“小猪”[BQ。]虽然我的身体对中国的天气不太[B态]适应但身体也很好。,200104124542200090,越南,2,200104,一封写给父母的信,60,65,36,25,38,207,未参加,
时间过得真快，我来北京已经两年多了。,200104124525100129,日本,1,200104,一封写给父母的信,70,80,44,42,56,282,未参加,
真不好意思，我是个不孝之子，很长时间没有给你们写信，对不起。,200104124525200215,日本,2,200104,一封写给父母的信,75,75,85,70,85,380,B,
我爱你们。,200104124523200272,韩国,2,200104,一封写给父母的信,65,70,36,23,49,229,未参加,
这几年来，我一直没有生病，每年冬天流行什么感冒，我只照顾别人。,200104124525200268,日本,2,200104,一封写给父母的信,70,80,44,54,54,292,未参加,
这儿的天气变化很大，这几天刮了大风，所以我现在不舒服，感冒了。,200104124523200284,韩国,2,200104,一封写给父母的信,65,60,25,28,45,206,未参加,
虽然你[B您]们比孩子出生以前老了，但你[B您]们的精神还跟过去一样好吧，我希望你[B您]们俩好好地过日子。,200104124525200296,日本,2,200104,一封写给父母的信,60,80,47,61,49,284,未参加,
我也好想回家，我也跟别的女孩子一样，{CJ-sy想}跟妈妈聊天。,200104124523200305,韩国,2,200104,一封写给父母的信,70,65,58,73,56,308,C,
我用剩下的时间再好好地学习。,200104124525100315,日本,1,200104,一封写给父母的信,75,65,30,30,40,227,未参加,
两天前你们给我打电话时，我高兴得说不出话来，我好想念你们！,200104124540200374,印度尼西亚,2,200104,一封写给父母的信,75,90,66,68,63,356,B,
我看了贵公司的招聘启事。,199200003525200012,日本,2,199200,一封求职信,,,0,0,0,0,未参加,
所以我在您的公司一定{CQ能}发挥自己的能力。,199200206525100013,日本,1,199200,一封求职信,,,0,0,0,0,未参加,
我希望在你们的公司当模特[BQ。]因为你{CC您}们的公司是很有名的。,199200204539200044,印度,2,199200,一封求职信,,,0,0,0,0,未参加,
此致{CC此处}1992年4月[C]7日×××北京市海[C]定区77号电话0722336,199200008525200014,日本,2,199200,一封求职信,,,0,0,0,0,未参加,
我国有法律，所有的人应该依靠法律。,199604123529100273,泰国,1,199604,如何看待“安乐死”,70,65,45,39,39,243,未参加,
如果可以实行安乐死的化[B话][BQ，]社会{CC2社}风气越来越不好，人不尊重{CC2重}人的生命[BQ。]现代社会的问题是什么呢？,199604124523100046,韩国,1,199604,如何看待“安乐死”,65,70,48,61,49,278,未参加,
在法律上，按照得了不治之症的妻子的要求来帮助她自杀的丈夫是罪人。,199604123525100161,日本,1,199604,如何看待“安乐死”,60,45,48,64,54,249,未参加,
比如说丈夫杀掉妻子以后，可以说，“她愿意死，所以我也没办法帮助她自杀。,199604123525200321,日本,2,199604,如何看待“安乐死”,60,70,63,61,39,277,未参加,
例如半个世纪以前结核是一种不治之症。,199604123619100506,罗马尼亚,1,199604,如何看待“安乐死”,80,65,66,83,52,334,C,
因为这[C]是个难题[BQ，]很多政府怕走第一步{CQ即}允许安乐死。[BC.],199604123634100260,英国,1,199604,如何看待“安乐死”,60,60,45,42,49,238,未参加,
如果有这样的情况：一个人病了，无药可救，而且这个病发展的过程当中他受了并继[C]续受很重的痛苦，那按他的要求法院应该解决这个问题。,199604124635100257,俄罗斯,1,199604,如何看待“安乐死”,60,55,53,44,39,232,未参加,
为什么发生了这种事呢？,199604123523200207,韩国,2,199604,如何看待“安乐死”,60,70,50,57,34,255,未参加,
人生毕竟不会过得完善。,199604123540200276,印度尼西亚,2,199604,如何看待“安乐死”,70,55,71,61,67,307,C,
青年的一代当[F當]然也要幸福快[C]乐。,199610802801100007,澳大利亚,1,199610,如何解决“代沟”问题,85,70,54,42,51,293,未参加,
我们都很清楚，我们的品性、[BC，]道德观、[BC，]生活习惯等种种的形成与定型，都和我们的生活环境有着重大牵连{CD的}。[BC，],199610512501150011,中国,1,199610,如何解决“代沟”问题,80,90,86,79,84,414,A,
一般的年青[B情]人如果在家里[F裡]发[F發]生这样[F樣]的问题，有可能把这样[F樣]的问题在外面泄[F洩]气{CJba}，这样[F樣]的话，他跟他的父母之间的代沟永远[F遠]不可解[C]决[F決]{CD的}。,199610550523190022,韩国,1,199610,如何解决“代沟”问题,60,70,44,40,49,248,未参加,
要充分地考虑父母的意见。,199610550523190033,韩国,1,199610,如何解决“代沟”问题,80,70,78,57,61,336,C,
最重要的必定大家要互相了解对方{CJs}。,199611543533100530,新加坡,1,199611,如何解决“代沟”问题,90,80,70,48,53,336,C,
为什么我做任何事，他们总是不放心，以为我一定不能{CJ+zy好好地}做好？,199611543501200519,中国,2,199611,如何解决“代沟”问题,90,85,94,71,90,427,A,
反观[F觀]现代社会，物质丰富，娱乐场[C]所、外埠旅行、家庭电脑[F腦]、小家庭观念等等，无[F無]一不促使{CC促成}物欲[F慾]主义[F義]、个人主义[F義]、享乐主义[F義]的产[F產]生。,199611543501100533,中国,1,199611,如何解决“代沟”问题,80,85,75,73,94,401,B,
我相信爱的力量是很大的。,199611543533200501,新加坡,2,199611,如何解决“代沟”问题,85,75,65,63,86,366,C,
”年近花甲的丙和尚说。,199603533533200030,新加坡,2,199603,由“三个和尚没水喝”想到的……,85,90,63,60,87,381,C,
大多数的人都有这么一个坏习惯，那就是依赖别人{CD的}{CD恶习}，就像“三个和尚没水喝”的例子一样，我也曾经历过。[BC，],199603533533200067,新加坡,2,199603,由“三个和尚没水喝”想到的……,90,85,66,70,77,385,B,
”这该怎么好！,199603533519200084,马来西亚,2,199603,由“三个和尚没水喝”想到的……,80,75,74,67,70,357,B,
不能滥用，无论[F論]任何事情都必分工合作，才能把事情完成。,199603533533200080,新加坡,2,199603,由“三个和尚没水喝”想到的……,85,70,69,51,75,341,C,
后来，他们都想终有一个会难受，而下山取水的。,199603533533200100,新加坡,2,199603,由“三个和尚没水喝”想到的……,75,85,38,47,68,306,未参加,
目前我[C]国[C]非常重视通货膨胀[C]的问题，政府派了很多{CC2各}人员调查那些乘机提高物品[C]的价格{CQ的}商人及小贩，通过{CC2在}电视广告[B吉]传达一些讯息给{CC1给予}人民一起抑制通货膨胀，也鼓励厂家、商家提高生产量，以免供不应[C]求。,199604680519200505,马来西亚,2,199604,由“三个和尚没水喝”想到的……,90,75,69,76,82,386,B,
一直到非常口渴后，而且无法再支持下去的情况下，[BC。]三个和尚{CJ-zy才}想到自己那种自私的心态，而且三个和尚都提出{CC报出}了自己的错误并请求{CC要求}对方的原谅。,199604680519100516,马来西亚,1,199604,由“三个和尚没水喝”想到的……,95,75,66,72,84,387,B,
可是，有一天第三个和尚来了[BQ，]以后他们的生活就变了，[BC.]就[B京]是喝的水都{CC却}没有了。{CP一般来说，同居的人增多了的话[BQ，]生活应该方便[B使]的，可是他们的[C]生活，特别{CQ是},199605104523100017,韩国,1,199605,由“三个和尚没水喝”想到的……,60,60,49,45,54,250,未参加,
人在世上，{CJ+zhuy人}总有跟他人{CQ的}关系，你应该尊重别人的意见，理解别人的心情。[BC，],199605104523100039,韩国,1,199605,由“三个和尚没水喝”想到的……,75,70,69,70,70,343,C,
改革开[B改]放以后中国政府逐渐实行允许私有财产、自由市场、私营企业的政策，[BC.]这是所有改变的主要原因。,199605104523100043,韩国,1,199605,由“三个和尚没水喝”想到的……,75,80,63,67,61,337,C,
你们马上去山下抬水！,199605104525200107,日本,2,199605,由“三个和尚没水喝”想到的……,65,65,55,70,75,314,C,
不管国家还是个人，必定需要{CC4必需}老百姓的协助合作{CC4协[F協]和}。,199605104523200196,韩国,2,199605,由“三个和尚没水喝”想到的……,70,60,38,65,84,302,未参加,
人们都喜欢新的东西[BQ，]所以我们如果想赚钱的话想像出新的东西，[BC。]这三个和尚就算[C]是自业自得了{CJ？}。,199605104525100227,日本,1,199605,由“三个和尚没水喝”想到的……,60,55,55,65,63,279,未参加,
我们是不是一起{CC公同}{CD的}坐[B做]船了吧？[BC，],199605104523200311,韩国,2,199605,由“三个和尚没水喝”想到的……,60,75,46,51,44,262,未参加,
去山下抬水的人太多了，[BC、]终于水没有了，[BC、]和尚们不{CJX}{CD能}喝{CJ-buy到}水了。,199605104525200322,日本,2,199605,由“三个和尚没水喝”想到的……,65,55,33,49,42,226,未参加,
也许还可以发现到一些精彩[B采]的事情，[BC。]像我学会了做[B作]饭、[BC，]做[B作]菜、[BC，]打扫卫生那样，[BC。]生活一定会更有趣的。,199605104525200330,日本,2,199605,由“三个和尚没水喝”想到的……,75,75,55,63,56,314,C,
