错句,作文编码,国籍,性别,考试时间,作文题目,口试分数,作文分数,听力分数,阅读分数,综合分数,总分,证书
第二，父母跟子女一起做某种活动，除[C]了吃饭，看电视以外，父母和子女一起生活的时间很[C]少[C]。,200209550523250225,韩国,2,200209,如何解决“代沟”问题,60,60,48,64,40,254,未参加,
只总[C]是说对方{CC互相}不好。,200209550523250231,韩国,2,200209,如何解决“代沟”问题,65,60,63,57,64,292,C,
这是最基本的方法{CC方案}，可是{CJ-sy是}最难的方案。,200209550523250232,韩国,2,200209,如何解决“代沟”问题,65,65,75,69,54,312,C,
引起这种现代问题的原因[C]是{CJX}可能他们之间的交流时间非常短。,200209550523250259,韩国,2,200209,如何解决“代沟”问题,65,60,39,62,56,265,未参加,
现[F現]代的人们[F們]，随[F隨]着[Y]文明的发[F發]展，他们[F們]已经[F經]产[F產]生了一种{CJ+dy新类[F類]的}新思维，这[F這]与[F與]古代人类[F類]的伦[F倫]理道德及观[F觀]念相比，已经[F經]是相差很多了{CC的}，所以在两[F兩]代思想代沟的问[F問]题[F題]上，最重要的就是互相理解，宽[F寛]容地{CC的}接受对方{CC互相}的想法，并[F並]且试[F試]着[Y]去理解另一代的思想，这[F這]是{CJX}对于[F於]{CC2对}[D对]代沟问题，一个非常好的解决[F決]方法。,200209550501150308,中国,1,200209,如何解决“代沟”问题,80,75,75,84,76,381,B,
其实[F實]代沟问[F問]题[F題]{CJ+zxy的解[C]决[F決][BD。]}并不是一个[F個]难[F難]题[F題]，它只是需要两[F兩]代人{CD们[F們]}互相将[F將]他们[F們]的爱[F愛]，转[F轉]换[F換]{CJ+buy成}{CD了}另一种形[B型]态[F態]，呈现[F現]给[F給]对方{CC互相}。[BC，],200209550501150308,中国,1,200209,如何解决“代沟”问题,80,75,75,84,76,381,B,
可是{CD该}当政治家才能“[BC‘]成龙”[BC’]？,200209550523250802,韩国,2,200209,如何解决“代沟”问题,70,75,54,62,62,312,C,
长辈和晚辈都有长处{CC好处}。,200209550523250847,韩国,2,200209,如何解决“代沟”问题,65,65,36,57,50,257,未参加,
只是因为我是他们的孙[C]女。,200209550523250863,韩国,2,200209,如何解决“代沟”问题,65,70,54,69,48,292,C,
因这个问题我常常{CD对妈妈}生气。,200209550523250865,韩国,2,200209,如何解决“代沟”问题,65,70,51,79,74,325,C,
这样双方之间才能沟通交流。,200209550523250900,韩国,2,200209,如何解决“代沟”问题,75,65,69,74,50,320,C,
哪怕父母不能了解我们的想法和行动，但是我们{CQ要}不断努力。,200209550523150917,韩国,1,200209,如何解决“代沟”问题,65,65,33,54,52,253,未参加,
如果没有对话的话，当然不能互相了解。,200209550523250934,韩国,2,200209,如何解决“代沟”问题,65,75,54,71,64,316,C,
随着社会的发[C]展，每天变化很大。,200209550523250948,韩国,2,200209,如何解决“代沟”问题,75,65,72,76,70,345,B,
对话时请坦白{CC开通}地{CC得}谈一下。,200209550523250949,韩国,2,200209,如何解决“代沟”问题,65,65,39,49,50,252,未参加,
一般的孩子觉得父母的想法跟他们根本不一样。,200209550523250953,韩国,2,200209,如何解决“代沟”问题,65,70,57,62,48,288,C,
以对方的立场看世界，他们可以明白了对方的想法与观念。,200209550523250958,韩国,2,200209,如何解决“代沟”问题,65,70,63,59,54,297,C,
那么什么样的解决{CJ-zxy方法}才{CQ能}得到互相满意的沟通与交流。,200209550523250971,韩国,2,200209,如何解决“代沟”问题,70,70,57,62,56,303,C,
但是随着社会的发展，我们找不到以前的“[BC‘]东方礼义之国”[BC’]的样子，最近我们常常听到因父母和孩子的意见不一致，{CD而}孩子杀父母的报道，这不是哪一个人的错事，平时父母{WWJ},200209550523250972,韩国,2,200209,如何解决“代沟”问题,70,55,54,64,46,273,未参加,
如果我得了绝症，完全没有希望恢复的话，我也有可能愿意安乐死。,200205271525100075,日本,1,200205,如何看待“安乐死”,80,75,55,60,80,341,C,
因为我们要与[B以]人沟[B构]通，共求发[F發]展，不能自己一个人{CD去}躲在无人的角落。,200304522522110002,缅甸,1,200304,静音环境对人体的危害,70,75,34,47,72,287,未参加,
有的{CC个}地区生产绿色食品，另外地区用化肥和农药生产{CC产生}大量的农产品。,200307109523200039,韩国,2,200307,绿色食品与饥饿,65,55,62,54,70,288,C,
随着科学的发展农药也是不断地发展下去{CC下来}的。,200307109523100047,韩国,1,200307,绿色食品与饥饿,70,70,83,64,76,351,C,
第一，每个人都有权利追[C]求自己的幸[B辛]福和健康，{CP人们既然知道化肥和农药对身体有极大的危害，继续使用它们会造[C]成很坏的后果。,200307109523200049,韩国,2,200307,绿色食品与饥饿,70,70,83,62,81,354,C,
随着全世界的人口增加，我们的粮[F糧]食问题也越来越严重了。,200307109525100048,日本,1,200307,绿色食品与饥饿,70,70,80,62,79,349,C,
那么我们应该怎样对待这个问题？,200307109523200074,韩国,2,200307,绿色食品与饥饿,65,65,67,46,53,280,C,
可是对生活水平低的人，饥饿是生存的问题。,200307109523100179,韩国,1,200307,绿色食品与饥饿,65,60,56,56,53,273,未参加,
我觉得[BQ“]绿色食品[BQ”]是跟饥饿另外的{CJ-zxy一件事}，因为[BQ“]绿色食品[BQ”]是为了有钱的或者对健康很有关心的人{CJ-sy生产}的。,200307109523100180,韩国,1,200307,绿色食品与饥饿,65,60,59,51,50,268,未参加,
其实[BQ“]绿色食品[BQ”]也很重要，环境也很重要{CC主要}，所以我们得发明一种{CC一个}不破害环境的化肥和农药[BQ，]那么也不担心挨饿[BQ，]也不担心关于环境的问题。,200307109523100231,韩国,1,200307,绿色食品与饥饿,65,80,56,51,64,304,未参加,
我们帮助他的事是先进国的道理{CJ?}。,200307109523200251,韩国,2,200307,绿色食品与饥饿,65,55,59,43,67,271,未参加,
但是不使用化肥和农药，农作物的产量会大大降低。,200307109523200350,韩国,2,200307,绿色食品与饥饿,75,90,80,59,90,388,B,
他们光照顾自己的满足，肯定没有为饥饿地区的人们着想。,200307109525200368,日本,2,200307,绿色食品与饥饿,60,65,59,54,70,291,C,
但当时农民对我说：他们也不得不使用化肥农药，[BC。]因为如果不使用化肥和农药的话，他们都不能生活下去。,200307109523200396,韩国,2,200307,绿色食品与饥饿,60,65,40,22,32,202,未参加,
这是我,200307109523200396,韩国,2,200307,绿色食品与饥饿,60,65,40,22,32,202,未参加,
但是[BD，]我们还有饥饿[L]的问题，这也是不能忽视的。,200307109523200447,韩国,2,200307,绿色食品与饥饿,65,90,75,70,90,381,B,
第二个好处就是：随着生产量的提高，粮食的价格会有所降低。,200307109523100464,韩国,1,200307,绿色食品与饥饿,70,90,75,70,84,382,B,
最近，我在各种媒[C]体中常常会看到绿色食品。,200307109523100466,韩国,1,200307,绿色食品与饥饿,70,80,80,56,64,340,C,
我认为{CD这}当然吃“绿色食品”是第一位的。,200307109523100467,韩国,1,200307,绿色食品与饥饿,65,65,62,59,79,314,C,
第二是[BD，]{CD找}要去贫困国家帮助他们，到那里去建房屋，照顾病人[BQ，]教{CC1教学}文盲的人、还传达卫生知识{CC部分}什么的。[BC.],200307109523200477,韩国,2,200307,绿色食品与饥饿,65,60,51,35,53,247,未参加,
所以现在的绿色食品的潮流是有点儿太自私[BQ，],200307109525100482,日本,1,200307,绿色食品与饥饿,65,75,70,54,81,332,C,
商家{CC產家}卖[F賣]食品的时[F時]候绿[F綠]色食品的价[F價]格相当[F當]贵[F貴]，有的商店卖[F賣]假冒的绿[F綠]色食品。,200307109525100505,日本,1,200307,绿色食品与饥饿,60,75,62,33,64,280,未参加,
人对健康的问题{CJX}是最重要的，[BC。]但我们对健康[C]太敏感也有问题，[BC。]这样人的抵抗力也会降低的。,200307109525100531,日本,1,200307,绿色食品与饥饿,70,60,72,72,76,335,C,
反过来说，对于一[L]个落后国家而言，像非洲一带的国家，她必须把不挨饿这个问题放在第一位。,200307109540200572,印度尼西亚,2,200307,绿色食品与饥饿,70,85,72,59,70,348,C,
“绿色食品”就是未经污染的农产品。,200307109523100579,韩国,1,200307,绿色食品与饥饿,60,60,46,38,41,227,未参加,
西方的人发展{CC2做}农业的时候用农机械[B戒]和科学理论，[BC。]非洲[B州]的人用自己的力气{CC气劲}和以前的方式，[BC。]这就[C]是必然的结果。,200307109523100606,韩国,1,200307,绿色食品与饥饿,60,55,40,38,53,227,未参加,
因为吃非污染食[L]品[L]的欲求是所有人的基本要求。,200307109523100611,韩国,1,200307,绿色食品与饥饿,65,60,54,56,58,276,未参加,
如果环境污染的程度厉害的话，当然我们吃的东西也受到影[B映]响。,200307217523200057,韩国,2,200307,绿色食品与饥饿,65,65,62,35,70,281,未参加,
因为[C]不用化肥和农药不能吃也增加饥饿。[BC.],200307217523200080,韩国,2,200307,绿色食品与饥饿,60,60,59,30,56,247,未参加,
以前的环境比现在好得多，所以古代人根本就不用想绿色食品。,200307217523200085,韩国,2,200307,绿色食品与饥饿,65,75,70,54,50,301,C,
既然如此，不应该为了一部分的人的快乐牺牲缺少粮食的人。{CQ在},200307204525100027,日本,1,200307,绿色食品与饥饿,70,80,59,78,70,347,C,
这样，人们[C]还[C]能不关心他们吗？,200307204523100053,韩国,1,200307,绿色食品与饥饿,60,60,62,59,70,293,未参加,
在已发达的环境下长大{CC成大}的人，[BC、]从以前到现在吃了可口的东西而且{CC而}在乎自己的身体。,200307204525200067,日本,2,200307,绿色食品与饥饿,65,75,59,56,67,309,C,
目前，无论是去什么地方，{CQ在}当地的超市里很容易看得到绿色食品。,200307204523100078,韩国,1,200307,绿色食品与饥饿,60,70,67,43,50,275,未参加,
现在我们的科学水平也很高{CC提高}{CJ+buy起}的。{CP所以对身体伤害{CC害},200307204523200132,韩国,2,200307,绿色食品与饥饿,60,65,64,41,32,245,未参加,
以前我们的先[B失]祖虽然吃和穿[C]的方面很困难{CD了}，但是他们的健康比[B从]现代人{CC1人家}好多了。,200307205523100033,韩国,1,200307,绿色食品与饥饿,65,65,67,43,56,280,C,
我不知道人类面[C]对[C]的这些问题是否能[C]解决。,200307205523200061,韩国,2,200307,绿色食品与饥饿,70,65,67,38,76,302,未参加,
当然我也认识到食品污染问题的重要性，最近在日本所谓“农药蔬菜”成为大家关注的社会问题。,200307205525100067,日本,1,200307,绿色食品与饥饿,70,80,67,75,76,358,C,
既然是这样，应该怎样来解决这个问题呢？,200307205540200088,印度尼西亚,2,200307,绿色食品与饥饿,75,65,54,51,53,285,未参加,
可是一部分人认为{CC以为}这样种植{CC2养}农作物的话，生产量会大幅[C]度下降，引起{CC造起}世界几亿人的饥[B饿]饿现象。,200307205523200153,韩国,2,200307,绿色食品与饥饿,65,60,80,51,79,318,未参加,
所以我们一定要走这[C]样一个道[C]路：“大力提倡无公害的‘绿色食品’市场，反对受污染的食品，大力支持科学的力量，反对危害人类身体健康的化肥和农药的侵犯”这[C]样我们才能够拥有一个并不是受污染，变污浊的世界，而是一个美丽、健康、[BC.]文明的绿,200307212523100043,韩国,1,200307,绿色食品与饥饿,75,70,78,70,84,366,B,
但是这个世界上还有很多的人连带有化学污染的食品也吃不到。[BC．],200307209523100002,韩国,1,200307,绿色食品与饥饿,65,65,75,64,81,334,C,
我们应该让一步给那些挨饿吃点东西才行{CJ?}。[BC.],200307209523100009,韩国,1,200307,绿色食品与饥饿,65,70,78,56,76,331,C,
所以我们先要了解他们到底用什么样的农药以及{CC并}这[C]些东[B束]西的作用等。,200307209525100056,日本,1,200307,绿色食品与饥饿,65,65,59,67,70,310,C,
现在世界上有几亿人{CQ因}缺少粮食挨饿。,200307201523100005,韩国,1,200307,绿色食品与饥饿,60,60,38,25,32,197,未参加,
如果要求从现在起[C]每一个农民都得开始不用化肥的话，那么只有有钱人买他们的菜而别人靠什么来生活呢？,200307201919200019,加拿大,2,200307,绿色食品与饥饿,70,70,70,49,79,326,C,
用那个的时候，虽然产量就会大大提高，但是吃这样的农作物时候，会有害于人的健康，[BC.]所以最近大部分[B份]的人都要吃未污染食品[BQ，]就是绿色食品。,200307201523200033,韩国,2,200307,绿色食品与饥饿,60,55,35,35,44,210,未参加,
一时{CJX}人人能吃得饱[B包]，但吃的食品里有对人类有害的因素。,200307201523100045,韩国,1,200307,绿色食品与饥饿,65,65,67,49,44,274,未参加,
为了我们的健康而生产{CC产生}了它。{CP可是反而很多人民没有粮食就挨饿了。P},200307201523200056,韩国,2,200307,绿色食品与饥饿,60,50,59,49,64,262,未参加,
第二，虽然现在我们人类能解决粮食{CC食粮}问题，但是我们吃的东西中有害于人的健康问题{CJ?}。,200307201523200102,韩国,2,200307,绿色食品与饥饿,60,60,54,56,47,259,未参加,
我们不要浪费粮食和钱，想着非[B菲]洲和中东地区的饥饿人口，向他们进行援助{CC2助振援[C]}活动。,200307302523100002,韩国,1,200307,绿色食品与饥饿,65,65,62,56,58,290,C,
而“绿色食品”[BD，]则和它相反，不经过化学物质[BD、]{CJ-zxy处理}保持原{CD固}有的营养，有利于人体健康。,200307302523200023,韩国,2,200307,绿色食品与饥饿,70,70,64,49,76,317,C,
不挨饿是国家发展的主要动力[BQ。]举一个例子[B了]来说的话[BQ，]发电场如果没有能源的话会怎么样呢？,200307302523100040,韩国,1,200307,绿色食品与饥饿,75,65,70,51,73,321,C,
所以，应该找出既[B即]能不饥饿又能吃绿色食品的方法。,200307302523200057,韩国,2,200307,绿色食品与饥饿,70,70,67,62,64,321,C,
所以我们要到农村干活。,200307302523100081,韩国,1,200307,绿色食品与饥饿,75,70,86,80,76,376,B,
如果我们继续这样吃用化肥和农药收获的农作物的话，就会发生很多问题。,200307302523200121,韩国,2,200307,绿色食品与饥饿,70,65,64,51,73,309,C,
饥饿的[C]问[C]题是个人类[B娄]的良心失踪的表现。[BC.],200307302523100146,韩国,1,200307,绿色食品与饥饿,70,60,59,51,32,257,未参加,
可是人们的希望和现在的情况不一样。,200307206523200013,韩国,2,200307,绿色食品与饥饿,65,60,56,33,50,247,未参加,
自己的生活情况也不错，比较自以为是。,200307206525200034,日本,2,200307,绿色食品与饥饿,65,80,67,51,70,321,C,
我觉得现在人们先考虑绿色食品的问题的话，自然地{CQ就会}轻视世界上发生的粮食不足的问题。,200307215523250005,韩国,2,200307,绿色食品与饥饿,65,70,62,56,79,318,C,
[BC”]我也知道人是最重要{CJsd}，没有人就没法创造现在这种发达的社会。{CP我们经过了漫长的历史，一些没有用的人死于历史中，挨饿其实是可以克服的。P},200307332523100018,韩国,1,200307,绿色食品与饥饿,80,70,75,70,70,355,B,
饥饿的原因是什么？,200307332525200023,日本,2,200307,绿色食品与饥饿,65,60,59,62,61,290,C,
在市场上，东西很少，价格上升，[BC。]这会带来经济危机。{CP从这里我们可以看到，农民不可能不使用化肥和农药。{CQ但是},200307332540200021,印度尼西亚,2,200307,绿色食品与饥饿,60,60,54,27,53,236,未参加,
我认为这[C]种{CD的}现象，不光在我身上，而且{CC2而}在很多人身上{CQ都}会有的。,200307332523200026,韩国,2,200307,绿色食品与饥饿,75,65,62,72,79,340,C,
因为[B可]{CD在年龄[F齡]}年轻[B情]时候大概在12到20岁[F歲]左右{CJ？}，或是在中学期间。[BC，],200309529529251012,泰国,2,200309,我对男女分班的看法,60,60,52,25,47,226,未参加,
男女混合式教育和男女分班教育都有它[B他]的优点{CC好点}与[F與]缺点{CC坏点}。,200309529529151027,泰国,1,200309,我对男女分班的看法,65,60,25,32,40,205,未参加,
男女之间，身材、[BC，]想法、[BC，]能力诸如此类{CC诸此之类}{CD等}有很多不同。,200310576525100061,日本,1,200310,我对男女分班的看法,60,70,47,44,47,253,未参加,
所谓的{CD为了}避免早恋只是家长的一个借口。,200310602801250006,澳大利亚,2,200310,我对男女分班的看法,70,70,79,65,65,337,C,
当然，小孩子该阅读什么书籍，作为师长，我们是应该帮他们挑选的，这样{CC2这}才能做到有效的阅读。,200310540540250013,印度尼西亚,2,200310,谈有效阅读,65,70,79,53,88,341,C,
如果{CC谈到}小说里人物的人生观及他们所遇[C]到的一些事跟我们日常生活有关连，还{CC也}有他们如何{CJ+zy能}解决，或是{CQ因}他们所犯的过错[BD，]而造成{CQ了}不良后果，我们更应记得[BQ，]故必须记下来[BQ，]可以与朋友分享。,200310540540250045,印度尼西亚,2,200310,谈有效阅读,65,70,32,60,61,274,未参加,
阅读有多种，就拿[Y]看报[F報]来说，报[F報]纸上内容丰富，有国内[BQ、]外新闻，有副刊上的小说。[BC；],200310540540150058,印度尼西亚,1,200310,谈有效阅读,70,65,61,75,82,339,C,
它要注意之处有很多，如：语音{CC语言}、语气等。,200304131540200002,印度尼西亚,2,200304,我学汉语是为了……,65,65,68,52,74,308,C,
我的梦想已[B以]经初步实现了，现在我的最大梦想就是可以成为一个中国通。,200304131542200159,越南,2,200304,我学汉语是为了……,65,80,44,24,29,230,未参加,
除此之外，现在印尼政府也开始批准印尼人学习汉语，不再禁止汉语{CQ在}印尼的发展。,200304131540200191,印度尼西亚,2,200304,我学汉语是为了……,75,85,83,60,91,387,B,
我们也不清楚，因为他们的所有举动，我们不能观察，相处的时间很短。,200306680540250014,印度尼西亚,2,200306,我对男女分班的看法,80,75,62,65,70,343,C,
不管怎样，我们的孩子将来进入{CC出来}社会，组织自己的家庭，一定要面对由男女共同组成的群体。,200306680519150045,马来西亚,1,200306,我对男女分班的看法,80,85,82,77,96,414,B,
我想绿色食品也是其中之一吧。,200307271523100007,韩国,1,200307,绿色食品与饥饿,65,65,80,62,79,335,C,
因为价格上的差异所导致[B制]的。,200307271523100013,韩国,1,200307,绿色食品与饥饿,70,70,80,67,84,359,C,
所以本人认为绿色食品{WWJ}。,200307271523100042,韩国,1,200307,绿色食品与饥饿,70,65,67,59,58,305,C,
因为那些国家的大部分人民经济状况不怎么好，而且有些，百分之五十以上的人们都极[B及]其贫困，天天都忧虑着生活问题，所以他们比较欢迎那些产量高，而低价的产品。,200307271523100048,韩国,1,200307,绿色食品与饥饿,70,70,75,64,81,348,C,
而且，对饥饿问题也要重视。,200307271525200062,日本,2,200307,绿色食品与饥饿,70,80,56,59,53,308,C,
绿色食品是指{CJ-sy用}未经污染的农产品加工的食品，就是拿没使用化肥和农药的农产品来加工的食品，如果不用化肥和农药的话，虽然无害于[B与]人的健康，但是农作物的产量大大降低，而现在世界上有几亿人因缺少[B小]食物而挨饿，那么绿色食品和不挨饿，哪一个应该放在第一位上呢？,200307271523100077,韩国,1,200307,绿色食品与饥饿,70,70,75,54,61,318,C,
有很大{CC多}的一部分人，都在讲究自己食用的食品是不是[BD“]绿色[BD”]的。,200307271523100084,韩国,1,200307,绿色食品与饥饿,75,65,75,70,81,353,B,
但这种情况下也起码必须[B需]制定化肥和农药的使[C]用量，并且限制使[C]用的化肥和农药的种类。,200307271525200097,日本,2,200307,绿色食品与饥饿,70,70,78,59,64,329,C,
我觉得实际上那么讲究吃的人不多。,200307271523200107,韩国,2,200307,绿色食品与饥饿,70,70,75,72,70,345,C,
听说，吸烟{CJ+zxy的时候}对旁[C]边{CQ的}人身体不好。,200405109523200317,韩国,2,200405,吸烟对个人健康和公众利益的影响,55,65,26,37,50,215,未参加,
最近各个地方{CJ-zy都}不让吸烟。,200405109523200542,韩国,2,200405,吸烟对个人健康和公众利益的影响,65,65,52,41,44,251,未参加,
关于吸烟有这样一句话“有百害而无一利”[BQ，]但是，越[C]来越[C]多[C]{CQ的}人{CJX}到[C]底为什么吸烟。,200405109523200561,韩国,2,200405,吸烟对个人健康和公众利益的影响,90,70,67,60,55,335,C,
烟味不仅造成空气污染，吸完之后的烟也是个环境污染的重要因素。,200405109523200575,韩国,2,200405,吸烟对个人健康和公众利益的影响,75,0,74,64,82,289,未参加,
吸烟不是对吸烟的人有害[C][BQ，]就是对接近的{CJ-zxy人}有害。,200405109523200590,韩国,2,200405,吸烟对个人健康和公众利益的影响,65,55,57,50,59,268,未参加,
我觉得{CJX}也在公共场所[L]抽烟不太好[BQ，]因为{CD在}公共是什么意思呀？,200405109523200755,韩国,2,200405,吸烟对个人健康和公众利益的影响,70,65,45,35,35,236,未参加,
香烟这个东西虽然给人们带来了一种{CC个}享受，比如说我来到中国以后常常被{CC1受到}别人{CD的}劝烟。,200405109525100890,日本,1,200405,吸烟对个人健康和公众利益的影响,75,70,55,56,66,311,C,
而且那些孩子比没有吸烟者的家庭里长[C]大的孩[C]子{CD更多的}，长[C]大以后更容易学会{CC学学}吸烟。,200405109523201053,韩国,2,200405,吸烟对个人健康和公众利益的影响,60,65,81,64,75,328,C,
我吃了一惊，我一时不明白他说什么。,200405109525101412,日本,1,200405,吸烟对个人健康和公众利益的影响,65,60,64,58,68,298,C,
社会发展后，人们的压力越来越大了，[BC。]抽烟的人也是越来越多了。,200405109523201425,韩国,2,200405,吸烟对个人健康和公众利益的影响,65,60,24,23,35,190,未参加,
从{CC对}我个人主观的意见来说，我的身体不能接受烟。{CP如果有人在我的旁边儿抽烟，我不由得开始咳嗽[B嗍]，不能停下来。P},200405109525201510,日本,2,200405,吸烟对个人健康和公众利益的影响,55,60,50,68,59,273,未参加,
所以，政府也需要实行法律上的措施，而且人们也{CQ要}从自己实践{CQ出发}为大家{CQ的}健康{CD的}{CJ-sy开展}不吸烟{CQ的}运[C],200405109523201559,韩国,2,200405,吸烟对个人健康和公众利益的影响,70,65,57,77,66,321,C,
我认为这次政府开始采取对吸烟者的措施是特别好，{CD而}非常赞成。,200405109525201636,日本,2,200405,吸烟对个人健康和公众利益的影响,60,65,43,37,61,249,未参加,
第二、对孩子给坏影响[F嚮]{CJy}。,200405109525201670,日本,2,200405,吸烟对个人健康和公众利益的影响,60,65,59,66,48,281,C,
还有，从城市的卫生问题来看，吸烟人扔掉的烟也破坏{CC损害}大街小巷的美观{CC景观}。,200405109525101813,日本,1,200405,吸烟对个人健康和公众利益的影响,75,70,62,70,66,332,C,
因此，为了保护抽烟者的权利{CC权力}，也同时保护不抽烟者的权利{CC权力}，政府应该准备公共抽烟所。,200405109525101885,日本,1,200405,吸烟对个人健康和公众利益的影响,85,90,64,64,53,352,C,
吸烟者看不见他们吗？,200405109525200078,日本,2,200405,吸烟对个人健康和公众利益的影响,80,70,52,60,56,308,C,
据说市政府出台该措施是为了保持市容整洁，并帮助青少年养成良好的习惯。,200405109525200473,日本,2,200405,吸烟对个人健康和公众利益的影响,70,75,72,77,95,378,B,
这个也算爱国的一种办法。[BC.],200405109523100621,韩国,1,200405,吸烟对个人健康和公众利益的影响,65,65,50,48,56,268,未参加,
谁也知道吸烟对自己的身体不好，尤其[BD，]对吸烟者周[C]围的间接[C]吸烟者更不好。,200405109523100656,韩国,1,200405,吸烟对个人健康和公众利益的影响,85,65,58,75,80,352,C,
这[C]也许是因为法律对他们起不到任何作用吧！[BC？],200405109523100791,韩国,1,200405,吸烟对个人健康和公众利益的影响,65,80,68,60,73,334,C,
在一个{CD某个}网吧{CD我}一个空间是为了不抽烟的人{CJy}，[BC。]我觉得这个方法是不错{CJxw}。,200405109523200801,韩国,2,200405,吸烟对个人健康和公众利益的影响,60,60,46,37,44,229,未参加,
他们认为忘记压力和烦恼[B脑]是他们自己{CJ+dy那样}想安慰自己的一种心理作用{CJZR}。,200405109523200802,韩国,2,200405,吸烟对个人健康和公众利益的影响,80,90,68,75,75,383,B,
原来如此，她得病的原因是她的丈夫。,200405109523200821,韩国,2,200405,吸烟对个人健康和公众利益的影响,65,60,62,60,58,288,C,
他们想抽就抽，[BC、]不管旁人{CC邻人}。,200405204525200154,日本,2,200405,吸烟对个人健康和公众利益的影响,60,65,30,51,45,234,未参加,
不但吸烟者{CC3吸烟的本人}而且{CD对}周围的人{CJ-zy都}会受特大的影响。,200405204525200246,日本,2,200405,吸烟对个人健康和公众利益的影响,60,55,38,58,54,246,未参加,
