错句,作文编码,国籍,性别,考试时间,作文题目,口试分数,作文分数,听力分数,阅读分数,综合分数,总分,证书
他们也难免会被{CC面临}同学嘲笑自己来自单亲家庭，饱受歧视。,200103533533250019,新加坡,2,200103,我对离婚问题的看法,80,90,70,51,85,371,C,
第二，我觉得每一个人对结婚的看法不一样。,200103533525250034,日本,2,200103,我对离婚问题的看法,75,75,65,75,74,354,B,
加上六年级那年父亲因饮酒得{CC发}了肝炎，家里的担子就落在我和母亲的肩上，也就这样结束了我的童年。,200110540540250007,印度尼西亚,2,200110,我的童年,70,90,77,73,88,391,B,
爸爸、[BC，]妈妈、[BC，]五个哥哥和我。,200110540540250017,印度尼西亚,2,200110,我的童年,70,85,71,63,76,357,C,
”直到现在我还很留恋我的童年生活，因为我在童年获得了人生最大的爱：父爱和母爱。,200110540540150142,印度尼西亚,1,200110,我的童年,70,90,36,51,90,330,未参加,
这个假期丰富了我的生活。,200111512512250003,菲律宾,2,200111,我的一个假期,80,95,87,75,98,430,B,
如今，手指上还有一道浅浅的疤痕。,200103680519201611,马来西亚,2,200103,我的童年,90,85,94,90,95,451,A,
老爸的“[BC‘]哲学”[BC’]总是绕在我脑海里，无时无刻{CQ不}让我提醒自己做人与处事的道理。,200103680519101616,马来西亚,1,200103,我的童年,85,70,67,78,80,371,C,
为什么呢？,200104124520200319,蒙古国,2,200104,一封写给父母的信,70,65,47,49,85,302,未参加,
虽[B随]然这次‘母亲[F親]节’全家人一起吃{CQ了}一顿团圆[B元]饭[BQ，]而我和妹妹准备了一些礼物，但是这些饭和礼物一定是远远不足的。,200105550523150012,韩国,1,200105,一封写给父母的信,70,60,79,65,74,333,C,
每天想你们，[BC、]每时担[B但]心你们的健康，时间过得真快，快要夏[B复]天了，注意[B义]身体健康，以后，我常常联系你们，还有下星期，我打算去老家，再见。[BC、],200105550523150017,韩国,1,200105,一封写给父母的信,60,65,44,49,54,255,未参加,
亲爱的爸爸，妈妈：你们{CD一向}日子过得好吗？,200105550523250039,韩国,2,200105,一封写给父母的信,65,75,66,49,65,307,C,
现在我不是那时的孩子，我已经成为懂事的孩子了。,200105550523150055,韩国,1,200105,一封写给父母的信,70,70,55,47,67,297,未参加,
爸好！,200105550523250329,韩国,2,200105,一封写给父母的信,75,70,52,44,58,288,未参加,
实在太感动了。,200105550523250337,韩国,2,200105,一封写给父母的信,70,65,66,54,65,306,C,
请你们替我向他们问候一下。,200105550523150462,韩国,1,200105,一封写给父母的信,65,65,47,37,61,259,未参加,
到处可以看见[BD，]边赏花边喝酒的人。,200105212525200037,日本,2,200105,我的一个假期,70,75,47,61,55,297,C,
我很久以前就参加工作{CC公司}了。,200105224525200026,日本,2,200105,我的一个假期,70,70,52,54,46,280,C,
我一定会再去苏州。,200105201525200010,日本,2,200105,我的一个假期,70,85,82,72,90,391,B,
不过，对汉语、对周围环境，我慢慢地习惯了。,200105201525200016,日本,2,200105,我的一个假期,65,65,55,65,61,295,C,
天津遗存{CC残留}着各国租界的面貌，又同时保留着中国传统的风采。,200105201525200077,日本,2,200105,我的一个假期,70,75,44,39,50,267,未参加,
但放寒假的第一天，妈妈给我打电话来告诉我，爸爸从东京站的楼梯上摔倒了，而且胳骨骨折了，他要住院{CJ-sy进行}手术治疗。,200105201525200084,日本,2,200105,我的一个假期,70,85,85,82,85,399,B,
或者说，他们会想到应该采取值班的制度，这样的话，也有避免为了小事而发生矛盾的作用。,200105109525100592,日本,1,200105,由“三个和尚没水喝”想到的……,70,55,61,58,73,301,C,
我认为这个故事教我们“别依靠别人，应该有独立心”。,200105109525200597,日本,2,200105,由“三个和尚没水喝”想到的……,65,70,61,55,57,294,C,
这样，两个人的目的一样的情况下，互相帮助、[BC，]互相协助{CC协力}是一种很好的方法。,200105109525200599,日本,2,200105,由“三个和尚没水喝”想到的……,70,70,48,62,53,291,C,
为了达成自己的欲望，不断{CC继续}努力和忍耐。,200105109525200694,日本,2,200105,由“三个和尚没水喝”想到的……,65,80,54,60,53,300,C,
由[BQ“]三个和尚没水喝[BQ”]想到的是和尚们为了{CD更}得到{CQ更多的}水而最后得不到了{CJX}水，我的理解是这样的。,200105109525100709,日本,1,200105,由“三个和尚没水喝”想到的……,65,50,54,51,53,254,未参加,
同种[F種]生物的人数多，{CD就是}这个同种[F種]是发展。,200105109525100712,日本,1,200105,由“三个和尚没水喝”想到的……,65,55,43,42,39,226,未参加,
他们都不想自己一个人吃苦，也不想做{CJX}为他人好的事。,200105109525200739,日本,2,200105,由“三个和尚没水喝”想到的……,70,80,66,75,79,360,C,
我认为，虽然这篇文章篇幅很短{CC少}，但是包含{CC含蓄}的内容较多，现代人也应该悟到[B道]的。,200105109525200822,日本,2,200105,由“三个和尚没水喝”想到的……,75,65,84,77,91,379,B,
通常遇到麻烦的时候才知道没水喝的痛苦，所以我们[F們]检[F檢]讨一下自己的过错[F錯]时会发[F發]现[F現]这[F這]种[F種]情况{CD的}。,200102522522150023,缅甸,1,200102,由“三个和尚没水喝”想到的……,85,65,74,62,77,352,C,
在北半球的枫叶国度（加拿大），住着{CC了}一名年龄与我相似的男生。,200203533533250009,新加坡,2,200203,记对我影响最大的一个人,85,80,74,83,93,408,B,
《安乐死》风波此篇文章涉及到非常耐人寻味的问题。{CJ-zhuy安乐死},200205204610200022,法国,2,200205,如何看待“安乐死”,80,90,66,76,77,384,B,
我觉得安乐死应该立法，要法律规定{CJy}。,200205204525200104,日本,2,200205,如何看待“安乐死”,65,80,44,58,37,272,未参加,
自己的家人、朋友等受到痛苦时，帮不了他们，只好看他们受到痛苦，这样情况是谁都忍不住的。,200205204525200167,日本,2,200205,如何看待“安乐死”,70,55,71,88,63,331,C,
谁也不想看最爱的人的痛苦，{CJ+zxy不好的状态}。,200205224525200040,日本,2,200205,如何看待“安乐死”,50,75,46,47,51,253,未参加,
我个人怎么说呢，因为我以前在上海医科大学念过书，所以对{CD这}此话题有一点敏感。,200205209525100016,日本,1,200205,如何看待“安乐死”,75,70,33,58,54,279,未参加,
我们{CQ不能}把这个宝贵的东西亲手放弃。,200205209525200101,日本,2,200205,如何看待“安乐死”,75,75,41,67,72,320,未参加,
可是，本人已经没有意识[B织]，什么也不懂。,200205201525200147,日本,2,200205,如何看待“安乐死”,80,80,55,56,44,307,C,
我认为，她追求的是出名而已，这样的话，她的行为肯定不能理解的{CJbei}。,200205215635100009,俄罗斯,1,200205,如何看待“安乐死”,80,85,69,63,75,366,C,
但是，我认为代沟的形成是因为长[F長]辈[F輩]和晚辈[F輩]沟通不够和社会的发展比长[F長]辈[F輩]的思想发展较[F較]快{CJbi}。,200210602801250022,澳大利亚,2,200210,如何解决“代沟”问题,70,70,73,76,82,359,C,
好让对方都觉得你是在爱护{CC爱怀}着他[BQ，]{CD也}把大家的感情变得[B的]更好。,200210801519150013,马来西亚,1,200210,如何解决“代沟”问题,70,65,78,82,68,349,C,
所以往往就会产生不同的观点、[BC，]不同的思想所引{CC因}起的冲突。,200210540540150069,印度尼西亚,1,200210,如何解决“代沟”问题,80,65,76,65,55,329,C,
所以父母应[B因]该了解到这一点。,200210540540150069,印度尼西亚,1,200210,如何解决“代沟”问题,80,65,76,65,55,329,C,
青年人对老年人的看法有一点儿改变，也许有一些是从西方{CC3西洋文化}传进来的。,200210540540150072,印度尼西亚,1,200210,如何解决“代沟”问题,60,70,48,69,44,276,未参加,
有人说，听话的孩子，可是也有一句话：听孩子的话。,200210540540150073,印度尼西亚,1,200210,如何解决“代沟”问题,60,70,53,62,79,309,未参加,
做长辈的[L]就该从小时候起教育孩子们，教他们怎样做人和尊敬老人，做一个有用的人。,200210540540250076,印度尼西亚,2,200210,如何解决“代沟”问题,80,70,84,71,77,372,B,
家庭若不产生“代沟”社会也就……{WWJ},200210540540250089,印度尼西亚,2,200210,如何解决“代沟”问题,65,85,65,82,75,362,C,
不读[F讀]英文书，也可以。,200203522522210010,缅甸,2,200203,记对我影响最大的一个人,70,65,57,64,61,303,C,
考试失败等于[F於]我前途完蛋了，我当时是这么想的。,200205109519200480,马来西亚,2,200205,如何面对挫折,80,90,73,65,75,378,B,
她们在汶莱工作顺利吗？[BC。],200205680519150008,马来西亚,1,200205,一封写给父母的信,70,65,60,63,65,309,C,
我有一个{CC项[F項]}好消息要向你们报告，我在上个月参加的华文歌唱比赛得了第三名。,200205680519250009,马来西亚,2,200205,一封写给父母的信,75,85,70,71,78,372,B,
大校校园内也准许学生在图[F圖]书[B韦]馆内值勤，但是有时候太多人应征[B微]，所以机会不大。,200205680519150014,马来西亚,1,200205,一封写给父母的信,75,75,83,77,82,382,B,
当然，我们最想看到的就是近打河这以锡矿最为丰富的地方。,200205680519250016,马来西亚,2,200205,一封写给父母的信,75,75,54,59,72,325,C,
话说得再怎么样，还不如一个实在的举动，爸、[BC，]妈，就让时间来证明我这个儿子，到底能不能做到[D了]。,200205680519150022,马来西亚,1,200205,一封写给父母的信,85,75,73,75,69,369,B,
女儿字,200205680519250028,马来西亚,2,200205,一封写给父母的信,80,65,68,77,72,350,C,
作者{CJ-sy是}陆西昱。[BQ《],200305533519250020,马来西亚,2,200305,我最喜欢读的一本书,70,60,44,63,49,271,未参加,
这本书由于作者以中国有名的《[BC「]十八史略》[BC」]来编{CD独自}小说，因此对{CQ对}中国历史文化感兴趣的我最为合适，[BC、]可以说是一举两得的经典。,200305533525250030,日本,2,200305,我最喜欢读的一本书,60,65,49,56,72,285,未参加,
理论结合实践是学以致用的学习目标。,200305533533150032,新加坡,1,200305,我最喜欢读的一本书,65,65,55,63,83,315,C,
这使我明白我还没找到那本我这{CQ一}生中挚爱的书。,200305533533250026,新加坡,2,200305,我最喜欢读的一本书,75,65,90,73,92,382,B,
它是一本幻想小说，叙述了哈利从一名平凡的小孩变成魔法学校的学生而变成魔法师的过程。,200305533533250039,新加坡,2,200305,我最喜欢读的一本书,65,70,77,82,74,354,C,
因此，我看日本企业一定要会说汉语的人，[BC。]所以我将来回国找工作时，学好汉语一定能成为有利条件。,200304131525200022,日本,2,200304,我学汉语是为了……,65,65,77,74,82,347,C,
我从小时候{CQ起}{CQ就}对外国有兴趣，[BC。]很喜欢跟外国人交流。,200304131525200080,日本,2,200304,我学汉语是为了……,65,60,36,41,40,225,未参加,
那个忘不了的回忆[B仡]让我做为了中国人和中国的未来{CJ-zxy的事}。,200304131525200225,日本,2,200304,我学汉语是为了……,70,70,41,41,46,256,未参加,
没有声音，[BC、]那{CC这}就是孤[B狐]独。,200305576525100019,日本,1,200305,静音环境对人体的危害,65,65,36,63,74,287,未参加,
总之，[BC、]我认为完全没有声音的地方是绝不可能的。,200305576525200022,日本,2,200305,静音环境对人体的危害,65,65,41,60,68,283,未参加,
把一个人放在完全没有声音的空间里。{CP最初他没有表示任何不舒[C]服的感觉{CC态度},200305576525200035,日本,2,200305,静音环境对人体的危害,70,65,65,52,71,309,C,
但我想问他们，他们是否知道，他们在公共场所吸烟是多么自私的表现。{CD据},200405109529200697,泰国,2,200405,吸烟对个人健康和公众利益的影响,90,80,81,75,77,398,B,
我也不想说对人的眼睛烟起什么样的作用，[BC。]还有环保问题。[BC：],200405109633200975,意大利,2,200405,吸烟对个人健康和公众利益的影响,70,65,57,46,46,270,未参加,
我本人实在十分赞成，因为[F為]，我自己就{CD是}讨[F討]厌在人多的街道上、商场里，人们一边走路一边抽烟。,200405109627200792,瑞士,2,200405,吸烟对个人健康和公众利益的影响,70,70,78,81,92,379,C,
还有一个问题，那{CJ-zy就}是青少年看成人吸烟会{CD更愿意}自己开始吸。,200405204634100335,英国,1,200405,吸烟对个人健康和公众利益的影响,70,85,30,28,27,232,未参加,
为了{CJ-sy保证}公民{CC社会}健康[BQ，]政府也应该采取一些措施，[BC。]比如处罚措施。,200405204635200366,俄罗斯,2,200405,吸烟对个人健康和公众利益的影响,85,75,49,51,63,315,未参加,
以前，吸烟只是个[B各]人的问题，但吸烟所造成的影响越来越大，政府也不得不立即采取措施了[BQ。]吸烟对个人健康的影响也许不用再提了。,200405212540200108,印度尼西亚,2,200405,吸烟对个人健康和公众利益的影响,75,90,58,42,56,315,C,
最近社会上发生{CJX}有些问题。,200505109525100037,日本,1,200505,父母是孩子的第一任老师,60,70,49,61,67,292,未参加,
跟其它动物比较起来，可以说小孩子从父亲和母亲{CQ那儿}能学会的事情比其它动物不很少{CJbi}。,200505109525200282,日本,2,200505,父母是孩子的第一任老师,50,50,51,48,62,239,未参加,
拿我给[B结]个例子。[BC；],200505109525200295,日本,2,200505,父母是孩子的第一任老师,60,65,69,73,74,324,C,
不管父母的观念好坏，它都大大影响孩子。,200505109525200296,日本,2,200505,父母是孩子的第一任老师,65,80,60,79,76,348,C,
回来以[B一]后，他对我一句话也不说，直着看我的眼睛，只是哭了。,200505109525101108,日本,1,200505,父母是孩子的第一任老师,90,80,62,64,64,355,C,
孩子最听谁的话？,200505109525201392,日本,2,200505,父母是孩子的第一任老师,60,80,50,66,55,298,未参加,
在什么时候都要意识到孩子的目光。,200505217525100152,日本,1,200505,父母是孩子的第一任老师,60,70,50,67,63,295,未参加,
我们如果没有父母的话，不能长大、不能生活。,200505217525100210,日本,1,200505,父母是孩子的第一任老师,65,65,58,51,78,301,C,
朋友也是可以当人生的好教练[C]、又当模范{CC模仿[F倣]}{CJsd}。,200505204525100156,日本,1,200505,父母是孩子的第一任老师,60,60,48,47,69,266,未参加,
妈妈有一天做了汤[B荡]，然[C]后对我说：“这个汤[C]是我妈妈教我做的汤[B荡]。,200505204525200197,日本,2,200505,父母是孩子的第一任老师,70,80,56,55,52,303,C,
另一个是父母的态度不太好，不能算是个好榜样，但[BD，]孩子看他们的样子和后果，就能得到一个教训。,200505204525200328,日本,2,200505,父母是孩子的第一任老师,85,80,61,59,80,358,C,
生{CC1产生}出来的时候什么都不懂。,200505204525200587,日本,2,200505,父母是孩子的第一任老师,45,70,46,53,52,248,未参加,
幸亏我考上了自己理想{CC希望}的大学，我想这一次暑假一定会愉快的。,200105205525200027,日本,2,200105,我的一个假期,65,75,50,65,68,310,C,
到山顶的{CC1之间}路走得不容易，但我们努力{CQ地}走，走到山的十分之八的{CC5八成}地方，我们在那里的小宾馆住了一天。[BC，],200105205525200057,日本,2,200105,我的一个假期,70,80,65,51,66,322,C,
在那天，他是最后一名离开跳蚤市场的清洁工。,200110602501150003,中国,1,200110,我的一个假期,85,85,82,72,94,413,A,
因为[F為]很久没有尝[F嘗]试[F試]地道的点心，所以胃口特别好。,200110919919200014,加拿大,2,200110,我的一个假期,80,80,57,65,87,361,C,
他们[F們]每个都很健康。,200110919919200014,加拿大,2,200110,我的一个假期,80,80,57,65,87,361,C,
百闻不如一见，亲眼看到的敦煌，远远超越我的想像，真让人产生{CC感到}游在梦乡的感觉。,200105271525100095,日本,1,200105,我的一个假期,75,90,70,87,94,410,B,
怎样过有限的假期，我认为这就是平时生活的能源，[BC。]幸福人生的真谛。,200105204525200033,日本,2,200105,我的一个假期,70,80,82,72,76,370,B,
我利用今年的“黄金周”去南斯拉夫看望{CC2看}了我的老师。,200105204525200044,日本,2,200105,我的一个假期,70,90,80,58,70,361,C,
喝一点儿酒没关系。,200105550523250075,韩国,2,200105,一封写给父母的信,70,75,63,63,49,309,C,
但是看起来好像病人似的，脸色有点白。,200105550523150107,韩国,1,200105,一封写给父母的信,65,70,41,63,49,274,未参加,
有了你们这么大的爱{CC1爱情}，我们能好好长大了。,200105550523250108,韩国,2,200105,一封写给父母的信,65,70,79,58,54,312,C,
坦率地说[BQ，]我自己没什么问题的时候[BQ，]平时不给你们打电话[BQ，]而我有艰苦的事情时才向你们问好。,200105550523250124,韩国,2,200105,一封写给父母的信,70,80,58,51,54,303,C,
妈妈、爸爸[BQ，]最近你们身体很累吧？,200105550523250137,韩国,2,200105,一封写给父母的信,70,75,49,70,49,302,C,
有时我感到悲哀{CC悲感}。,200105550523150155,韩国,1,200105,一封写给父母的信,65,60,33,63,47,251,未参加,
你给我的爱{CC1爱情}太大，你为我所牺[F犧]牲的太多。,200105550523250185,韩国,2,200105,一封写给父母的信,60,65,63,70,76,317,C,
我很担心，没事儿吧！,200105550523250187,韩国,2,200105,一封写给父母的信,65,65,44,47,47,252,未参加,
爸爸作工作怎么样？,200105550523250187,韩国,2,200105,一封写给父母的信,65,65,44,47,47,252,未参加,
我离家一个人生活{CC2活}，没有妈妈的照顾，才让我学会一个人生活，做菜呀，洗衣服呀，什么是都得自己做主{CC为主}，以前在家里生活的时候{CC2时}一点儿也没考虑过{CD没有}妈妈，只有自己来做。,200105550523250188,韩国,2,200105,一封写给父母的信,65,70,58,61,47,287,C,
我准备了这么小的一件事，但是您那么高兴，让我感到好大的父母的心了。,200105550523250202,韩国,2,200105,一封写给父母的信,65,65,58,39,51,262,未参加,
爸爸，您也知道吧？,200105550523250216,韩国,2,200105,一封写给父母的信,80,75,79,73,76,374,B,
你跟爸爸离了婚以后为了我们每天一直很辛苦。,200105550523250228,韩国,2,200105,一封写给父母的信,70,65,52,61,65,299,C,
年纪这么大都不想结婚。,200105550523150256,韩国,1,200105,一封写给父母的信,80,65,71,56,79,339,C,
为什么平时不能跟你们说谢谢呢？,200105550523250279,韩国,2,200105,一封写给父母的信,75,70,58,47,47,286,C,
我没告诉你们我爱[F愛]爸爸和妈妈。,200105550523250302,韩国,2,200105,一封写给父母的信,65,70,33,49,51,254,未参加,
妈妈已{CD给}帮助我毕业{CLH}大学了。,200105550523250370,韩国,2,200105,一封写给父母的信,65,70,47,25,51,244,未参加,
我不知道您对我的计划满不满意。,200105550523250386,韩国,2,200105,一封写给父母的信,55,65,60,70,56,288,C,
我们也{CJ-zy会}像你们一样为了你们和我子女的幸福一辈子努力。,200105550523250388,韩国,2,200105,一封写给父母的信,70,70,52,63,58,301,C,
我过得这么舒服你们不用再担[B但]心我{CQ了}。,200105550523250394,韩国,2,200105,一封写给父母的信,75,70,66,51,54,305,C,
明年我该毕业就更忙{CQ了}，时间就现在还比较多{CC多着呢}。,200105550523150435,韩国,1,200105,一封写给父母的信,65,60,38,37,45,228,未参加,
您俩特别是母亲对我的就业问题{CJ+zy太}担心着呢{CQ吧}。,200105550523150453,韩国,1,200105,一封写给父母的信,65,75,58,61,56,302,C,
但是有一天下雨{CQ了}。,200105550523250454,韩国,2,200105,一封写给父母的信,70,75,52,51,63,300,未参加,
妈、爸，不要担心我。,200105550523250457,韩国,2,200105,一封写给父母的信,70,85,63,68,74,352,C,
我已不再是从前整天哭哭啼啼的{CC地}小女孩{CQ了}，[BC。]我已成熟长大了，我会自己保护自己而且已适应这儿的生活{CQ了}，并且认识了很多朋友，韩国的生活已不再孤独、[BC，]难过了。,200105550523250472,韩国,2,200105,一封写给父母的信,95,85,74,70,88,410,B,
最近，身体{CD健康}怎么样？,200105550523250510,韩国,2,200105,一封写给父母的信,65,55,60,61,49,272,未参加,
2001、5、12×××,200105550523250523,韩国,2,200105,一封写给父母的信,70,70,38,49,47,262,未参加,
我一到汉城机场就感到很怕。,200105206525200003,日本,2,200105,我的一个假期,75,80,62,58,61,327,C,
回福冈[F岡]的那天，我坐出租车去北海道机场了。,200105206525100025,日本,1,200105,我的一个假期,70,70,50,46,57,281,未参加,
但是今年的五月一日到五月七日的黄金周我觉得与众不同{CC4有别}。,200105206525100032,日本,1,200105,我的一个假期,65,70,77,68,63,329,C,
因此许多人不明白自己在社会上起的作用，到底真的能为社会{CJ-sy做}{CJ-dy什么}贡献。,200105109525100022,日本,1,200105,由“三个和尚没水喝”想到的……,70,85,70,69,86,372,B,
三个和尚既能喝上水，又很公平、合理。,200105109525200091,日本,2,200105,由“三个和尚没水喝”想到的……,95,90,66,69,84,403,B,
这个故事是很久以前的。,200105109525100102,日本,1,200105,由“三个和尚没水喝”想到的……,65,70,61,73,77,332,C,
这表明我们三个人不断地成长，我们的独立自主的思想越来越强{CC1发展}。,200105109525100114,日本,1,200105,由“三个和尚没水喝”想到的……,65,80,59,73,75,340,C,
要不然我们永远不能自立。,200105109525200120,日本,2,200105,由“三个和尚没水喝”想到的……,65,75,54,75,82,338,C,
我们应该主动地做事情，[BC。]不要等别人做。,200105109525200244,日本,2,200105,由“三个和尚没水喝”想到的……,65,70,52,60,59,292,C,
我认为孩子自己会做的事情尽量让他自己做，不要替他去做。,200105109525200275,日本,2,200105,由“三个和尚没水喝”想到的……,70,80,79,71,86,376,B,
一起争[B征]得第一！,200105109523100409,韩国,1,200105,由“三个和尚没水喝”想到的……,80,60,77,55,64,323,C,
帮别人的忙，虽然自己不用费劲儿，但是结果没有达到目的。,200105109525200394,日本,2,200105,由“三个和尚没水喝”想到的……,65,65,57,53,68,292,未参加,
如果实行“轮流{CC别人}去山下挑水”规则的话，能够避免“没水”的状况。,200105109525200412,日本,2,200105,由“三个和尚没水喝”想到的……,65,55,30,49,61,242,未参加,
如果你想跟她相处得[B的]好，你应该先好好的考虑她，帮助她。,200105109525200422,日本,2,200105,由“三个和尚没水喝”想到的……,65,55,88,73,84,347,C,
那么两{CC二}个人一对，每天一对去抬水，就{CJX}这么做三个和尚之中，一个和尚能够一天{CJX}休息。,200105109525200581,日本,2,200105,由“三个和尚没水喝”想到的……,65,60,52,55,55,270,未参加,
三个和尚想方设法，商量了很长时间。,200105109525200702,日本,2,200105,由“三个和尚没水喝”想到的……,65,65,39,58,66,277,未参加,
我很理解那位丈夫的心情，在病人的旁边只能{CJcd看看}病人十分痛苦，这是难过极了。,200205205525200025,日本,2,200205,如何看待“安乐死”,75,65,46,47,54,274,未参加,
我以前看过一本书，是写一位医生，在战争时期，给快要不行的士兵们实行了安乐死，结[B给]果死去的士兵都很感谢这位医生的故事。,200205205525100058,日本,1,200205,如何看待“安乐死”,75,80,77,70,77,370,B,
其实现在在很多地方发生{CQ过}这样的事情。,200205206525100011,日本,1,200205,如何看待“安乐死”,70,65,49,42,58,270,未参加,
那么，“安乐死”究竟可不可取呢？,200205206525100056,日本,1,200205,如何看待“安乐死”,75,70,60,63,80,337,C,
那时候，任何电视新闻节目里{CJ-zy都}{CJ-zy能}听到“安乐死”这{CC那}三个字。,200205206525200080,日本,2,200205,如何看待“安乐死”,65,65,33,56,44,247,未参加,
我认为随着高科技[B枝]术迅速发展，在社会上代沟问题越来越{CC3更}严重。,200209550523250059,韩国,2,200209,如何解决“代沟”问题,75,65,72,71,74,344,B,
千万不要{CQ用}训斥{CC劝告}的语气{CC2语}来说话。,200209550523250093,韩国,2,200209,如何解决“代沟”问题,65,65,48,54,56,272,未参加,
反过来说，前一代人也尊重下一代人的生活态度，价值观。,200209550523250103,韩国,2,200209,如何解决“代沟”问题,60,65,48,52,48,256,未参加,
所以在时间和空间的流动中{CC内}存在的人类也是{CD从}它们{CJX}受到影响，每{CD个}代人都各有思想[B思]、观念和生活方式。,200209550523250107,韩国,2,200209,如何解决“代沟”问题,65,65,57,69,52,292,C,
我们知道有什么问题时，最好的方法是对话[B活]。,200209550523250130,韩国,2,200209,如何解决“代沟”问题,65,60,36,62,50,256,未参加,
