错句,作文编码,国籍,性别,考试时间,作文题目,口试分数,作文分数,听力分数,阅读分数,综合分数,总分,证书
我就在这样的传统气氛中度[B渡]过了我的童年，一年一度的春节是最令我开心的事。,200110540540150091,印度尼西亚,1,200110,我的童年,65,85,52,63,88,343,C,
镇上的居民大概有五千多{CD个}人口{CJZR}，大部分是华人。,200110540540250113,印度尼西亚,2,200110,我的童年,75,85,55,54,76,338,C,
电话：5648067传呼机号码：2105960谨此，向贵公司达万二分之谢意。,199312533540100020,印度尼西亚,1,199312,一封求职信,90,90,67,70,78,393,B,
考试成绩优异{CC优越}，我修的是中文系，对于中国的古诗词、古典文学等有很深的研究，[BC.]课余我时常阅读各种书籍，因此，在面对游客时，我相信我有充分[B份]的信心。[BC.],199312533533200034,新加坡,2,199312,一封求职信,85,90,64,80,85,401,B,
請[F请]给予[B于]面试的会。,199312533533200139,新加坡,2,199312,一封求职信,95,65,83,63,96,395,C,
因为我觉得学好中文以后肯定有用。[BC.],199312123523200101,韩国,2,199312,一封求职信,75,55,60,59,45,279,未参加,
我对[C]中国历[F歴]史文化非常感兴趣。,199312123529200105,泰国,2,199312,一封求职信,90,60,57,43,45,285,未参加,
但是，当时我不会说汉语，所以我对中国文化和中国人很感兴[L]趣，可无法交流，觉得很遗憾。,199312124525200240,日本,2,199312,一封求职信,55,75,60,56,68,299,C,
那首先简单地介绍{CC绍介}我自己。{CJ-zhuy我},199312124523100245,韩国,1,199312,一封求职信,55,65,60,70,55,288,C,
快乐家庭旅游公司：我叫×××，[BC。]1960年11月22号出生，[BC。]今年33岁。,199312124525200323,日本,2,199312,一封求职信,55,65,43,43,62,251,未参加,
现在我有六年开车的经验，以前我在北京某一家公司工作，[BC.]那时候的工作对我来说没有特别的意识，因为每天做的事都差不多一样，[BC.]而且都我自己一个人要做的事{CJs}，[BC.]在这样的情况下幸亏我看到了贵公司的好消息。[BC.],199312123523100502,韩国,1,199312,一封求职信,45,50,43,37,39,190,未参加,
我[C]早就知道贵公司的信誉和成绩。,199312123525200505,日本,2,199312,一封求职信,75,60,74,58,73,326,C,
以前我对您公司的一切{CD实行}很感兴趣。[BC.],199312123523200709,韩国,2,199312,一封求职信,55,50,25,39,43,191,未参加,
快乐家庭旅[C]游公司！,199312123542200923,越南,2,199312,一封求职信,50,50,46,37,39,199,未参加,
他教{CJX}给学生们[C]英语。,199412123525200039,日本,2,199412,记我的父亲,55,80,60,48,51,280,未参加,
对这个问题，您不要再{CD次}担[B但]心了{CC吧}！,199412123523100051,韩国,1,199412,记我的父亲,50,55,28,59,43,214,未参加,
父亲有十二个兄弟姐妹，父亲是老十。,199412123529200054,泰国,2,199412,记我的父亲,50,55,49,55,57,245,未参加,
我永远都不会把他忘记的。,199412123625200056,葡萄牙,2,199412,记我的父亲,80,85,54,28,37,278,未参加,
如今我跟他也好了。,199412123529100085,泰国,1,199412,记我的父亲,55,55,46,30,26,192,未参加,
”。,199412124525100033,日本,1,199412,记我的父亲,65,65,52,46,45,257,未参加,
那时候去日本，他的身上并没有钱[BQ，]而且这是不合法的行为[BQ。]所以如果被发现的话，他的生命就{CD会}没有了。,199412104523200684,韩国,2,199412,记对我影响最大的一个人,70,60,62,57,61,295,C,
我相信我们的友谊也永远继续。,199412104525200651,日本,2,199412,记对我影响最大的一个人,60,70,54,59,61,289,未参加,
我自己感觉我的环境非常好。,199412104525100118,日本,1,199412,记对我影响最大的一个人,60,55,25,59,37,217,未参加,
有的时候，我听烦了，不想听她的话，我{CQ以后}决不能这样做。,199412104523200692,韩国,2,199412,记对我影响最大的一个人,70,70,68,67,72,335,C,
在我上大学[F學]的时[F時]候，他已转[F轉]投一家电[F電]脑[F腦]公司工作，我们[F們]俩[F倆]有几年没有见[F見]面{CQ了}。[BC，],199412104625100368,葡萄牙,1,199412,记对我影响最大的一个人,65,80,89,75,74,371,B,
先父虽离我而去已有三年多，但他的人生哲学，生前教诲及对我的期望还是时时刻刻地{CC的}伴着我，影响着我每日的思想行动。,199500533533100014,新加坡,1,199500,记对我影响最大的一个人,90,90,89,63,76,406,B,
他在我失败受挫时，鼓励我，支持我；他并不主张[F張]以金钱物质来激励，但是他所付出的精神与[C]爱心是绝对远{CJcd}超{CJ-buy过}这些{CD有些}物质的。,199500533533200120,新加坡,2,199500,记对我影响最大的一个人,90,90,89,79,84,430,A,
当时我家境不富裕。,199500533533200127,新加坡,2,199500,记对我影响最大的一个人,95,85,86,73,90,427,A,
”他的那两句话，至今仍然深{CJcd}烙{CC烙[B骆]印}在我的脑海里，也是我这些日子来处事的座右铭[B名]。,199500533533100135,新加坡,1,199500,记对我影响最大的一个人,95,85,83,71,80,412,A,
但是这个教训{CC经验}并没有“吓[F嚇]”倒我，我依然如故。,199500533533100140,新加坡,1,199500,记对我影响最大的一个人,95,80,91,77,82,421,B,
不过我最不服气[F氣]的一种遗传[F傳]，则[F則]是从[F從]母亲血液里[F裡]传过[C]来的糖尿病。,199510512512200501,菲律宾,2,199510,记对我影响最大的一个人,85,75,62,41,59,314,未参加,
父亲[#][#]应考，结果[BD，]考上了大学，他在大学把机械技术学好，赶上改[C]革开放[C]，自己开办机械厂，今天他成功了。,199510512501100504,中国,1,199510,记对我影响最大的一个人,90,90,81,79,73,411,A,
另一方面，照顾工作已经使家人及社会负担过重{CC累不负[F負]荷}。[BC.],199511543501100526,中国,1,199511,如何看待“安乐死”,85,95,81,77,99,433,B,
这[F這]一类[F類]的病人，如果早已为[C]他们{CC2他}进行{CQ了}安乐[F樂]死，那岂[F豈]不是把[C]他们{CC2他}推向死亡吗[F嗎]？,199511543501200541,中国,2,199511,如何看待“安乐死”,90,90,64,83,99,424,B,
）但是这件事，[BC.]我也经常听到{CD的}。,199511543525200574,日本,2,199511,如何看待“安乐死”,80,70,52,54,53,299,C,
谢谢。,199503680519100541,马来西亚,1,199503,一封求职信,85,85,81,83,91,420,A,
本人目前担任丽美时装有限公司推销员一职，在服装推销方面具有4年经验。,199503680519100533,马来西亚,1,199503,一封求职信,80,80,74,83,95,404,B,
我是一个喜欢[F歡]学习汉语的人，感受{CC2受[C]}到了{CJ-sy学习}汉语的苦[C]与乐。,199505529529100104,泰国,1,199505,学习汉语的苦与乐,70,60,24,41,44,224,未参加,
我做事考虑[C]问题都不能随[C]便，也不能在社会上混日子。,199505104525200023,日本,2,199505,记对我影响最大的一个人,65,80,52,61,65,311,C,
最恐怖的是，最挖潜我的看法越象母亲的了！{CY},199505104525200027,日本,2,199505,记对我影响最大的一个人,70,60,44,65,59,283,未参加,
从小时候{CQ起}，{CD对}我妈妈{CQ就}是我的最[C]好的朋友，最[C]严格的老师，而且，{CD还是}我最[C]尊敬的人之一。,199505104523200062,韩国,2,199505,记对我影响最大的一个人,70,65,65,55,55,296,C,
原来他的父母反对这次婚姻{CC结婚}，[BC。]他冒着父母的反对坚决跟她结婚。,199505104523100129,韩国,1,199505,记对我影响最大的一个人,55,70,65,53,69,296,未参加,
她是{CJ+dy一位}我们的妈妈以外{CC以前}，可以说{CJ-sy还是}一位伟大的人。,199505104523200148,韩国,2,199505,记对我影响最大的一个人,80,60,49,53,63,292,未参加,
那时，我常常看到他正在念书，准备下次[C]课的内容的场面。,199505104523200161,韩国,2,199505,记对我影响最大的一个人,70,75,73,63,57,327,C,
我也很希望{CQ拥有}和平的世界。,199505104525100159,日本,1,199505,记对我影响最大的一个人,65,55,41,48,45,236,未参加,
我从出生的时候{CQ起}一直受到她的照顾。,199505104523200167,韩国,2,199505,记对我影响最大的一个人,65,65,49,46,53,262,未参加,
我认为对一个女孩来说，她的爸爸从来{CQ就}是最重要的人之一。,199505104614200175,荷兰,2,199505,记对我影响最大的一个人,80,65,44,42,49,268,未参加,
这[C]样，过[C]了3年以后，她一张{CJX}翻译成的纸[C]{CQ上}没有{CQ了}红笔{CJ-zxy印记}，而且获得[C]了第[C]一名。,199505104523200201,韩国,2,199505,记对我影响最大的一个人,75,55,70,69,49,303,C,
说到挺容易可做事很难。,199505104523200229,韩国,2,199505,记对我影响最大的一个人,70,60,57,44,55,271,未参加,
如果家庭不稳定，就会影响{CJ-by我}。,199505104525200242,日本,2,199505,记对我影响最大的一个人,60,75,44,48,49,262,未参加,
我是1992年到上海来了{CJsd}，已经三年了。,199505104635100249,俄罗斯,1,199505,记对我影响最大的一个人,65,70,70,55,61,307,C,
我[C]从五岁起他几乎每[C]天带[C]我去村{CQ外}的一个小山，锻炼我的身体，锻炼{CC教炼}各种各样的[C]运动项目。[BC，],199505104523100260,韩国,1,199505,记对我影响最大的一个人,65,40,49,67,61,260,未参加,
在这样的[D的]情况下，许多[C]农民不得{CC能}不当兵或者到城市去卖身。,199505104525100301,日本,1,199505,记对我影响最大的一个人,75,55,41,63,72,291,未参加,
所以[BQ，]在我的心[C]里[BQ，]我姐姐是{CQ对}我{CJX}唯一影响力最大的人。,199505104525200303,日本,2,199505,记对我影响最大的一个人,0,75,86,65,76,298,未参加,
当我们接受他人的一切时，在你面前，你会发现[F現]有更多广阔{CC阔廣}的道路迎面而来，而你的智慧就愈变{CQ愈}丰硕[F碩]。,199508681519200541,马来西亚,2,199508,记对我影响最大的一个人,95,85,78,77,80,413,B,
所以说[F說]，请在离婚前，先想想后果。,200010512512250005,菲律宾,2,200010,我对离婚问题的看法,70,80,78,83,91,392,B,
有些人说[F說]“没有爱[F愛]情的婚姻是不道德的[BD，]”的说[F說]法是对[F對]的，因为[F為]没有爱[F愛]情还{CC什}能夠生活{CQ在}一起，这[F這]不单[F單]生活{CJs}，而且{CC2而}是互相的关[F關]怀[F懷]和照顾[F顧]，如果没有爱[F愛]情，那可以把婚姻和家庭绑[F綁]在一起。,200010801543250010,香港地区,2,200010,我对离婚问题的看法,60,70,39,62,52,268,未参加,
刺耳的飞机喇叭声换成大河的波涛声。,200005108525100323,日本,1,200005,关于用自然之声取代噪声的建议,65,70,75,57,54,307,C,
我先将噪声分为有用噪声和无用噪声。,200005108525100409,日本,1,200005,关于用自然之声取代噪声的建议,70,75,53,80,69,336,C,
多元化即是国际化，国际化就是现代化。,200005108525200645,日本,2,200005,关于用自然之声取代噪声的建议,60,65,53,55,61,277,未参加,
这位美国人是我爸爸的同事，他当时30岁左右的样子，个子很高、长得很帅[B筛]、穿着{CC得}一套漂亮的西服。,199705104525100077,日本,1,199705,我的城市/乡村生活,65,55,46,35,58,241,未参加,
由于我从小就居住在城市里，很少有机会到乡村郊游。,199705104523100091,韩国,1,199705,我的城市/乡村生活,80,70,69,76,89,374,C,
爬山爬到山顶，心里自然会觉得舒适、满足，也会产生“我已经征服了这座山了。,199705104523100091,韩国,1,199705,我的城市/乡村生活,80,70,69,76,89,374,C,
当时我不管教什么东西，很努力地找一找明天讲课的题[B提]目。,199705104525200118,日本,2,199705,我的城市/乡村生活,65,55,46,58,63,269,未参加,
我们可以说是城市里长大的，所以有点羡慕堂弟和堂妹。,199705104525200131,日本,2,199705,我的城市/乡村生活,65,55,44,58,68,272,未参加,
因为我最怕的事是天气热的{CJsd}。,199705529529251018,泰国,2,199705,我的城市/乡村生活,85,75,44,42,57,295,未参加,
但因每次{CC個}挫折{CJ-zy都}会令人有更多的不同经[F經]历[F歷]和体[F體]验[F驗]，所以每个[F個]挫折都要勇敢去面对[F對]。,199810801543150034,香港地区,1,199810,如何面对挫折,65,70,51,73,70,315,C,
最苦的事是对别人不能表示我的想法{CC思考}，[BC。]因为{CJ-zhuy我}连一句话也不会说，[BC。]所以我不敢出去。,199804123523100034,韩国,1,199804,学习汉语的苦与乐,70,55,57,40,38,244,未参加,
”答：“十月十九号。,199804123525100038,日本,1,199804,学习汉语的苦与乐,70,70,39,28,36,231,未参加,
学习汉语的时候[BQ，]我认为[C]开始学习汉语的时候呢，—苦的地方是发音。,199804123523200051,韩国,2,199804,学习汉语的苦与乐,70,55,39,47,48,243,未参加,
现在，我敢说自己{CD说}汉语的发音还不错，其实呢，不知道真的好{CJs}，还不是{CJs}。,199804123523200155,韩国,2,199804,学习汉语的苦与乐,70,80,54,67,60,321,C,
学习汉语的苦就是听。,199804123525100229,日本,1,199804,学习汉语的苦与乐,65,65,39,47,40,240,未参加,
这样的快乐之中产生了好多误会，因为我总是说错，得罪人家。,199804124523200324,韩国,2,199804,学习汉语的苦与乐,75,75,60,52,54,306,C,
谢谢各位老师，谢谢中国文化给我这么多机会，让我在正式地走上人生的道路之前能够体验自己。,199804124542200343,越南,2,199804,学习汉语的苦与乐,70,85,75,67,72,361,B,
这句话对于每一个现代人来说都有着极重要{CQ的}意义。,199804124542200376,越南,2,199804,学习汉语的苦与乐,80,80,60,67,78,357,B,
所以我认为，女性结婚必须要过主妇生涯的说法是不能接受的.如果是为了家里没有人打理.我建议可请工人.而无须要辞去工作.尤[C]其，[BC.]妇女们亦要为自己的未来着想一下.若能和丈夫和谐共处一生的话，也没什么，一旦有“[BC《]亮红灯”[BC》]的危那妇女们该怎么办？,199809542542100019,越南,1,199809,如何看待“妻子回家“,80,90,57,58,91,371,C,
然后仔细分析我失败的原因究竟何在？,199904123523200008,韩国,2,199904,如何面对挫折,75,70,37,65,59,295,未参加,
但已经丢失的关系是回复不了的。,199904123525100034,日本,1,199904,如何面对挫折,60,65,45,65,43,261,未参加,
听了他{CQ的}话以后，我改变了我的那个想法，[BC、]而决心上大学继续学习。,199904123525100052,日本,1,199904,如何面对挫折,65,70,48,78,67,314,C,
“失败是成功之母。,199904123525100093,日本,1,199904,如何面对挫折,60,60,45,62,56,265,未参加,
在人生中，人一定{CJ-zy会}遇到许多困难，有的人用所有的{CJX}自己的能力试试{CJcd}克服困难，也有的人完全逃避。,199904123525100093,日本,1,199904,如何面对挫折,60,60,45,62,56,265,未参加,
我原来的想法是：不要给别人添麻烦。,199904123525200113,日本,2,199904,如何面对挫折,65,75,48,52,46,273,未参加,
先考虑怎样能克服这个挫折，然后就坚持{CC2进}这个办法，一直坚持下去。,199904123525200117,日本,2,199904,如何面对挫折,75,75,70,80,69,359,B,
前年放假的时候大部分学生回国了。,199904123523200211,韩国,2,199904,如何面对挫折,55,55,56,24,37,207,未参加,
我在外国公司工作，[BC.]上午学习下午工作，[BC.]没有时间学习。[BC.],199904123523200238,韩国,2,199904,如何面对挫折,60,65,31,27,39,205,未参加,
当时，我来中国学汉语[BQ，]只学{CQ了}一年{CJ+zxy的水平}。,199904123523200250,韩国,2,199904,如何面对挫折,60,60,34,44,37,217,未参加,
当时我也很难过，但{CD包括}我的父母和周围的人比我痛苦。,199904124523200327,韩国,2,199904,如何面对挫折,65,65,50,52,52,268,未参加,
我是从{CC在}韩国“夜大”毕业的。,199904124523200397,韩国,2,199904,如何面对挫折,65,75,78,65,74,344,C,
我们经常在生活当中遇到各种各样[L]的意想不到{CC没意想{C思}到}的事情。,199904124523200407,韩国,2,199904,如何面对挫折,60,65,70,57,50,285,C,
如前人说：能忍得苦中苦，才是人上人。,199909529529151012,泰国,1,199909,如何面对挫折,70,80,39,30,56,265,未参加,
