错句,作文编码,国籍,性别,考试时间,作文题目,口试分数,作文分数,听力分数,阅读分数,综合分数,总分,证书
年年越[C]来越[C]{CJX}身体大的学生们[C]吃饭也不少。,199605104525100348,日本,1,199605,由“三个和尚没水喝”想到的……,50,50,46,42,39,205,未参加,
这个事是{CJX}对他们三个人很理所当然{CC4当然}的，还有，他们当中每[B没]个人都想到{CJ+zhuy三个和尚}没水喝的情况[C]．[BC，]过了几天，{CJ+zy几月以后}，他们三个人来{CJ-buy到}了这儿（一座高山）（跟平时一样）。,199605550523290024,韩国,2,199605,由“三个和尚没水喝”想到的……,60,50,21,35,23,169,未参加,
我想要说[BQ：]{CJ-zhuy做事情}最好不要拖三拉四的，{CJ-wy不要}把自己该负的责任推卸{CC拖卸[C]}{CQ给}别人{CJba}，做人该做到自己该做的。,199605550523290026,韩国,2,199605,由“三个和尚没水喝”想到的……,75,65,52,65,65,309,C,
这不是那么难而是慢慢小小的努力就[C]可以实现[BQ。],199605550523290035,韩国,2,199605,由“三个和尚没水喝”想到的……,65,50,55,35,42,228,未参加,
凡事不求人，自己才是最可靠的。,199605529529150141,泰国,1,199605,由“三个和尚没水喝”想到的……,60,95,58,58,70,331,C,
这篇[B扁]文章好像[B象]反映我们的现在社会现象。,199605550523290083,韩国,2,199605,由“三个和尚没水喝”想到的……,65,60,44,63,51,266,未参加,
其实人越来{CC越}多，可以[C]分工合作，[BC、]你今天下山抬水，[BC、]明天就该[F該]我了，这[F這]样才是合理{CJsd}[BQ，]不是吗[F嗎]？,199605529529250160,泰国,2,199605,由“三个和尚没水喝”想到的……,80,80,66,60,77,355,C,
父亲还为此事生大哥的气很多年。,200110540540150056,印度尼西亚,1,200110,我的童年,70,85,55,54,90,346,C,
那时[F時]，我时[F時]常想，若我有像别人那样[F樣]疼他们[F們]自己的小孩的父母，那有多好。,200110540540250062,印度尼西亚,2,200110,我的童年,75,90,77,70,83,389,B,
比如：一步一步上学校，慢慢走到校门口；看见老师行个礼，看见同学握握手。,200110540540150099,印度尼西亚,1,200110,我的童年,75,80,52,56,88,342,C,
并[F並]希望能继续在旅游事业有所突破，如蒙厚爱，当尽力为贵公司服务。,199312533533200005,新加坡,2,199312,一封求职信,75,85,50,67,78,348,C,
在[C]此，我希望[C]能[C]早日接到贵公司的回信[Y伩]，我的住址是廿[C]四号幸福街新加坡邮区九四一八我的电话[C]号码是二九四三七六谢谢！,199312533533100047,新加坡,1,199312,一封求职信,85,55,62,63,57,310,未参加,
我从小就喜欢参观名[B明]胜古迹[C]，因此参观了不少{CJ-zxy地方}{CD啊}。[BC！],199312124635100149,俄罗斯,1,199312,一封求职信,70,65,43,39,43,247,未参加,
李文先生{CC生先}[BD。]把以上简单的介绍[BD，]参考后给我答复{CC回答}。,199312123523100504,韩国,1,199312,一封求职信,60,60,64,67,52,285,未参加,
李先生：我从北京日报招聘启事中得悉[BQ，]贵公司正招聘广告设计师，故特来信应聘。,199312123634200908,英国,2,199312,一封求职信,80,95,69,80,98,418,B,
他考理科、我考文科。,199410550523101905,韩国,1,199410,一封求职信,75,65,48,58,46,280,C,
那时我的业务[F務]是{CD在}贸易部内管理在中国的分公司的情况[C]。,199410550523202907,韩国,2,199410,一封求职信,70,55,45,39,37,230,未参加,
这样写的话，有人觉得我爸爸没缺点{CC坏[B怀]处}。,199412123525200029,日本,2,199412,记我的父亲,55,85,36,28,41,233,未参加,
可是爸爸没想到“糖[B唐]”对孩子{CJ-sy是}不合理[B埋]的{CQ这件}事情，我每次喝奶的时候，爸爸不知道怎么配合，他觉得自己喝时好喝[BQ，]{CD就}孩子{CJ-zy也}{CJ-sy觉得}好喝……。,199412123523200110,韩国,2,199412,记我的父亲,60,55,44,42,41,223,未参加,
夏天见{CC看}他的时候我突然发现{CD了}他老了，头发大部分都花白{CC白花}了。,199412123619200071,罗马尼亚,2,199412,记我的父亲,60,55,39,32,37,204,未参加,
每次放假，父亲都带我和弟弟去很多地方[BQ，]了解{CC2看}那边的生活条件，环境特色，或者某一{CD种}地方的当时情况。,199412123619200080,罗马尼亚,2,199412,记我的父亲,55,60,54,44,47,241,未参加,
的[C]时候总是跟着爸爸去爬[C]山，我父亲年纪都六十五岁{CC1岁数}了，我应{CD对}父母{CJX}好好儿地{CC的}孝顺[BQ。]P}谢谢！[BC，],199412123523100094,韩国,1,199412,记我的父亲,65,55,60,50,57,269,未参加,
之所以让孩子们去国外留学，是因为他的工作的关系。[BC，],199412124525200023,日本,2,199412,记我的父亲,65,70,62,65,47,295,C,
因为爸爸爱我们才给我们提供这么好的机会，才给我们安排这么美好的前途。,199412124719200034,喀麦隆,2,199412,记我的父亲,80,55,49,32,45,247,未参加,
今年我的母亲四十五岁。,199412104523200653,韩国,2,199412,记对我影响最大的一个人,60,60,52,48,45,247,未参加,
{CD记}对我{CQ有}影响的人是很多[BQ，]{CJxw}/{CJsd}比如说：老师、一些伟人、朋友、父母、学长，还有学弟等等多的是。,199412104523200645,韩国,2,199412,记对我影响最大的一个人,65,65,49,40,59,262,未参加,
我是一个生长[F長]在{CC于}马[F馬]来西亚[F亞]的华裔，汉语对我来说[F説]，可以说[F説]是我的母语。,199409543519100218,马来西亚,1,199409,学习汉语的苦与乐,75,70,71,75,82,362,B,
他小时候读的是古书，热爱书法，看了好多书，到后来更沉迷于[F於]武侠小说，看完后便将故事说给我们听，因此我们姐弟们都爱听他讲故事，从故事中，他灌输了我们对仁义道德的观[F觀]念[C]{CJshb}，从济公的故事里[C]，他告诉{CD了}我们要有孝心等等。,199500533533200015,新加坡,2,199500,记对我影响最大的一个人,95,90,94,77,88,443,A,
从我懂事[C]到现[F現]在，对我影响最大的——是我的大舅父。,199510512501100510,中国,1,199510,记对我影响最大的一个人,90,90,55,68,86,387,C,
记得妈妈常对我说：“任何东西别人都可能会抄走，只有知识，任何人也抄不走。,199510512501200521,中国,2,199510,记对我影响最大的一个人,90,90,91,75,91,435,A,
大概病人也不愿[F願]意太多[D久]{CJX}受到苦痛[B通]{CJ+zxy的时间}。,199510550523200913,韩国,2,199510,如何看待“安乐死”,0,60,31,31,35,149,未参加,
生死不是由天定的吗[F嗎]？,199511543634100537,英国,1,199511,如何看待“安乐死”,85,90,69,79,97,416,B,
」但是你觉得有人真的愿意死吗？,199511543525200551,日本,2,199511,如何看待“安乐死”,80,85,50,62,66,337,C,
在哪[B那]种[F種]情况[F況]下死去，才算是“安乐[F樂]死”？,199511543501100555,中国,1,199511,如何看待“安乐死”,85,85,76,83,95,419,A,
然而一个[F個]患上不治[B冶]之症的人，病魔无[F無]情残[F殘]酷地折磨着他，是何等的痛苦？,199511543501200554,中国,2,199511,如何看待“安乐死”,85,90,88,68,93,420,A,
」佛教认[F認]为[F為]人生所遭遇的一切全部都离[F離]不开[F開]因果报[F報]应[F應]的理论[F論]。,199511543634100558,英国,1,199511,如何看待“安乐死”,85,90,55,70,99,395,C,
法律不外乎人情，何必要让[F讓]这么多人陷入痛苦的深[C]渊[F淵]中？,199511543634200562,英国,2,199511,如何看待“安乐死”,80,90,76,81,95,417,B,
季翔先生，精美服装公司1995年3月19日季先生：应征[F徵]服装设计师得知贵公司招聘上述人员，现寄上本人简历表一份，敬请收纳。,199503680519200524,马来西亚,2,199503,一封求职信,75,85,79,66,84,382,B,
我也曾在多个服装表演赛{CD会}及选美赛{CC会}中荣获殊荣。,199503681519200551,马来西亚,2,199503,一封求职信,95,90,76,73,88,421,B,
上学后我做过很多事。,199505550523200903,韩国,2,199505,记对我影响最大的一个人,75,65,41,50,49,267,未参加,
我真感[C]谢[C]他，祝他当有名的哲学家。,199505104523100042,韩国,1,199505,记对我影响最大的一个人,70,80,89,71,59,359,B,
整天在家，洗衣服，做饭做菜，赡养{CC扶养[F飬]}奶奶等。,199505104523200062,韩国,2,199505,记对我影响最大的一个人,70,65,65,55,55,296,C,
”我觉得父亲很可怜，同情他[BQ，]但[BD，]他在那种情况下绝不骂我母[C]亲，何况，他{CJ-zy正}默默工作着{CC1下去}。,199505104525100063,日本,1,199505,记对我影响最大的一个人,65,85,65,55,74,334,C,
父亲说“我养着你们，我的工资都是你们的生活费。,199505104525200087,日本,2,199505,记对我影响最大的一个人,50,65,49,59,65,269,未参加,
他原来想当一个律师，{CQ但}由于种种原因，一直[C]在小学里教书。,199505104523100130,韩国,1,199505,记对我影响最大的一个人,70,90,78,75,76,382,B,
结果，她决定去法国学法语。,199505104523200154,韩国,2,199505,记对我影响最大的一个人,60,80,70,75,53,325,C,
决定什么？,199505104523200162,韩国,2,199505,记对我影响最大的一个人,70,65,57,50,41,269,未参加,
我认为他说这样的话对我是一种鼓励。,199505104614200175,荷兰,2,199505,记对我影响最大的一个人,80,65,44,42,49,268,未参加,
因为我认为学外语时不仅{CQ要}学语言，还要了解语言的背景，还{CQ要}坚持友好的态度去理解外国文化。,199505104525200183,日本,2,199505,记对我影响最大的一个人,90,90,83,77,86,424,A,
我承[B诚]诺我将要参加他的研究工作。,199505104606100181,比利时,1,199505,记对我影响最大的一个人,75,65,65,40,41,273,未参加,
我永远忘不了你的帮助{CC帮忙}！,199505104523100224,韩国,1,199505,记对我影响最大的一个人,65,75,62,57,63,309,C,
我大学三年级的时候认识他的{CC了}。,199505104525200256,日本,2,199505,记对我影响最大的一个人,70,65,81,77,86,365,C,
当我有困难{CQ时}他经常帮助我，使{CD到}我有美满的生活。,199505104529200266,泰国,2,199505,记对我影响最大的一个人,55,50,49,38,39,210,未参加,
所以，我们[C]班的其他的同学跟他，常常发生{CD了}矛盾。,199505104525200279,日本,2,199505,记对我影响最大的一个人,65,60,54,48,37,247,未参加,
因此毅然辞[F辭]别母亲[F親]，不辞[F辭]劳[F勞]苦，走遍以色列大小乡镇[F鎮]，传讲博爱[F愛]的道理。,199508682519100528,马来西亚,1,199508,记对我影响最大的一个人,85,70,91,79,84,400,B,
好久，好久，{CJ-zhuy我}也哭累了。,199508682519200529,马来西亚,2,199508,记对我影响最大的一个人,90,85,81,75,88,416,B,
回想起初见{CC会}罗老师的那一刻，只见他貌不出众的那幅样子，再加上其因小儿麻痹症而走路一拐一拐的模样，我们这一群初出茅庐[C]的小家伙都对他的教学法打了一个大问号。,199508680519200537,马来西亚,2,199508,记对我影响最大的一个人,90,90,83,77,84,422,A,
有时在街边看到乞丐或残障人士，她也会拿些钱给他[B她]们。[BC，],199508682519200545,马来西亚,2,199508,记对我影响最大的一个人,85,85,78,71,84,398,B,
而且{CD给}邻居们互相提醒，努力转告的话，将来的我们的环境会改变的。,200005108523200314,韩国,2,200005,关于用自然之声取代噪声的建议,65,70,50,70,48,289,C,
（162Z）,200005108523200339,韩国,2,200005,关于用自然之声取代噪声的建议,65,70,72,57,54,304,C,
环境污染，其中噪音污染很厉害的{CJX}{CQ在}生活当中{CJsd}，更重要的。,200005108523100392,韩国,1,200005,关于用自然之声取代噪声的建议,60,65,56,62,54,280,未参加,
例如[B比]，洗衣服的时候，过达实用洗分制{CJ?}。,200005108525100523,日本,1,200005,关于用自然之声取代噪声的建议,65,80,53,75,72,333,C,
街上的垃[B拉]圾[B及]换成草原上的小花，城市里的建筑物换成大自然的山林“多么好！,200005108525200645,日本,2,200005,关于用自然之声取代噪声的建议,60,65,53,55,61,277,未参加,
首先，将马路上的汽车喇叭声音换成波涛声，这样的话，人们在开车的时候，很安全地开车，可以互相让步，在交通上会有规律。,200005108523200652,韩国,2,200005,关于用自然之声取代噪声的建议,65,70,50,60,63,294,C,
首先，我想环境保护部门提出的自然之声不是自然的而是人工的，虽然原来的大自然中录音的各种声音{CJs}，但一录进磁带、就成人工的声音。,200005108525200699,日本,2,200005,关于用自然之声取代噪声的建议,65,80,70,72,65,340,B,
我觉得城市生活和乡村生活都有自己的长处和短处。,199705104523200123,韩国,2,199705,我的城市/乡村生活,60,70,66,67,68,316,C,
他的家座落在一个小村子里，[BC；]没有几户人家[B间]，但很美，房后是花园、花园后[C]面是一条运河，河的两岸有许多小树[C]林，[BC、]在河边经常有钓鱼的人，再往远处，是一片片广阔的田野，[BC、]而且有养鹿厂[BQ，]远远看去，有时会有一些鹿[BD.]在田野、树林边跳窜，这真一片农村景色，那么宁静，那么不同于城市，中午，他请我吃野餐，他架起了烤肉的炉子，把牛肉、猪肉串烤在上上面，大约几[C]分钟就熟了，我吃得津津有味。,199705610501200005,中国,2,199705,我的城市/乡村生活,95,95,59,73,77,398,B,
”当然这个问题我没提过{CJX}出！,199804123540200054,印度尼西亚,2,199804,学习汉语的苦与乐,65,65,30,49,36,229,未参加,
各人的才能不一样，有的学生进步快，有的学生进步比较慢，但不管进步多快，我们都应该努力不断提高汉语水平。,199804123635200210,俄罗斯,2,199804,学习汉语的苦与乐,60,55,48,32,46,222,未参加,
有的时候，他们纠正{CC修改}我说话的语法上的错误。,199804123525200272,日本,2,199804,学习汉语的苦与乐,60,60,48,62,36,248,未参加,
但校外的北京人似乎听不懂我的话，我感到很苦。,199804124523100355,韩国,1,199804,学习汉语的苦与乐,70,70,45,57,54,284,未参加,
不管怎么说，外语呀！,199804124523100391,韩国,1,199804,学习汉语的苦与乐,65,85,54,47,42,283,未参加,
从1995年到现在我一直在北京学汉语，整[B正]整[B正]三年了。,199804124523200477,韩国,2,199804,学习汉语的苦与乐,75,70,57,59,40,290,未参加,
因此女性自毕业[F業]后[F後]{CD出}来社会工作的情况比以前{CC前}多了许多倍，尤其是{CQ对}未婚的少女更{CJX}{CJ-zhuy这}是必经的途径，不但学以致用而且在经济上不用{CC得}依靠他人.这种能够自立的情况实为女性带来无[F無]限的优越感和[C]自豪。,199805529529251003,泰国,2,199805,如何看待“妻子回家“,60,55,51,51,41,239,未参加,
我童年的日子是这样{CQ的}痛苦、悲惨，你的童年是否快乐，有趣？,199910512501150004,中国,1,199910,我的童年,65,90,36,47,64,293,未参加,
童年，是多么令人难忘，多么令人迷恋啊！,199910512501150011,中国,1,199910,我的童年,75,95,66,62,74,366,C,
这就是说我们不要怕困难，[BC。]我们应该面对挫折。,199904123719100033,喀麦隆,1,199904,如何面对挫折,70,65,26,32,46,225,未参加,
我被分到药水车间，[BC。]当初早在工作岗位的一些工人还欢迎我，[BC。]后来他们对我的态度越来越坏。,199904123522200055,缅甸,2,199904,如何面对挫折,80,75,70,70,76,362,B,
人在在活中总要遇到许多困难或挫折。,199904123540200131,印度尼西亚,2,199904,如何面对挫折,70,60,70,60,56,301,C,
那时我太小了[BQ，]以为世界是很美{CJsd}[BQ，]一旦发现世界太大、[BC，]社会很可恶就想逃[B挑]走，但那怎么行！,199904124529200294,泰国,2,199904,如何面对挫折,75,75,80,62,59,341,B,
我很赞同这个道理，我{CJ+zy要}举例子来说明吧。,199904124529200297,泰国,2,199904,如何面对挫折,75,60,70,57,69,317,C,
我对这种做法绝对反对，是因为人和动物{CQ的}区别在于{CC2在}{CQ是否}有脑子。,199904124523200321,韩国,2,199904,如何面对挫折,65,65,42,39,52,247,未参加,
我{CJ-sy感到}非常耻[F恥]辱。,199904124525200349,日本,2,199904,如何面对挫折,70,70,45,55,50,278,未参加,
人在生活中，肯定{CJ-zy会}遇到很多困难和挫折。,199904124922100432,美国,1,199904,如何面对挫折,85,80,72,57,82,369,B,
