错句,作文编码,国籍,性别,考试时间,作文题目,口试分数,作文分数,听力分数,阅读分数,综合分数,总分,证书
就是那些有毒的东[B动]西让人离[B理]不开烟，所以你虽然知道[BD，]烟有害人的健康，但是因为{CC2因}有了[C]这有毒[C]的东[B动]西，你就很难戒烟了。P},200405109523100952,韩国,1,200405,吸烟对个人健康和公众利益的影响,80,65,69,58,82,342,C,
烟里面的尼古丁{CC尼克丁}是对人没有好处的，[BC。]特别是对小孩子、[BC，]青少年来说很危险的{CJsd}。,200405204525200002,日本,2,200405,吸烟对个人健康和公众利益的影响,60,65,52,54,45,259,未参加,
据科学{CJ-zxy研究}，{CJ-zhuy吸烟}确实{CC一定}会有这个作用，但同时，我们应该关注的是{CJ+dy吸烟的}烟[F煙]给周围的人带来的副[B负]作用。,200405204525200027,日本,2,200405,吸烟对个人健康和公众利益的影响,70,70,63,47,49,287,C,
因为我认为谁都{CC也}知道在车箱里不允许抽烟，所以我{CJ-zy很}吃惊{CD了}。,200405204525200272,日本,2,200405,吸烟对个人健康和公众利益的影响,70,70,71,44,54,297,C,
还有需要慢慢的跟{CC往}下一代讲烟是对身体有害的，千万不要接触{CC2动}。,200405204525200317,日本,2,200405,吸烟对个人健康和公众利益的影响,80,65,38,42,51,264,未参加,
比如说，以前在我的国家5岁的小孩子被这样的人拿的香烟的火烧伤{CC2受了火伤}。,200405204525200319,日本,2,200405,吸烟对个人健康和公众利益的影响,65,70,55,70,67,313,C,
我觉得这个惩罚措施是很好的规定。,200405204525200334,日本,2,200405,吸烟对个人健康和公众利益的影响,60,55,22,49,42,209,未参加,
自己抽烟是自己的事。,200405204525100384,日本,1,200405,吸烟对个人健康和公众利益的影响,60,75,71,73,88,353,C,
虽然有人说：“很累的时候，比如说刚刚下班的时候或者做完一些很辛苦的事情的时候，我一定要吸烟。,200405204525200417,日本,2,200405,吸烟对个人健康和公众利益的影响,65,75,60,58,58,303,C,
她说[BQ：]“我父亲是一个非常爱抽烟的人。,200405204525200460,日本,2,200405,吸烟对个人健康和公众利益的影响,60,60,58,65,61,286,未参加,
如果把吸烟和一般食品等同起来{CC4一样看}的话，不需要对它那么严格吧。,200405205525100069,日本,1,200405,吸烟对个人健康和公众利益的影响,65,75,60,58,63,308,C,
社会意识的进步和改善对所有的人来说是{CD个}有好无坏的。{CP吸烟不仅影响市容，还对青少来说是有害{CC2要学习意识},200405201525100008,日本,1,200405,吸烟对个人健康和公众利益的影响,65,75,66,68,79,340,C,
边走边{CJ-sy抽}烟[C]很危险。,200405201525200300,日本,2,200405,吸烟对个人健康和公众利益的影响,60,70,60,58,51,284,C,
这是一句千年古语。{CD当},200410534533150046,新加坡,1,200410,最理想的结交方式,75,85,63,54,54,324,C,
男女衣[B表]冠整齐与介绍人和彼此家长来个饭局，从{CC1从而}交谈中去了解对方的家世与背景。,200410534533250084,新加坡,2,200410,最理想的结交方式,85,90,71,67,72,381,B,
也许一说到运动员的收入{CQ就}会有不同的意见。,200404140542200007,越南,2,200404,运动员收入,75,70,46,59,61,300,C,
然而许多吸烟者却置之[B知]不理。,200405680519250017,马来西亚,2,200405,吸烟对个人健康和公众利益的影响,70,95,71,60,94,383,C,
父母长[F長]辈不可避开此类[F類]话题，而提供更多此类[F類]{CD的}知识。[BC.],200504534533150005,新加坡,1,200504,我对男女分班的看法,65,85,65,78,70,353,C,
在那{CQ个}年代，很少有男女学生谈恋爱的问题。,200504534533150011,新加坡,1,200504,我对男女分班的看法,85,85,70,82,77,394,B,
但在一个开放时代，这种想法似乎有些单纯。,200504534533250100,新加坡,2,200504,我对男女分班的看法,70,85,81,73,86,387,B,
例如女生做事较细心，男生却不拘[Pjū]小节。,200504534533250115,新加坡,2,200504,我对男女分班的看法,75,80,84,71,88,389,B,
那些从小就没有与[B于]异性朋友一起上课的[D的]同学会显得比较保守，认为凡事都只能与[B于]同性的人说。,200504534533250132,新加坡,2,200504,我对男女分班的看法,65,70,53,54,73,301,C,
其实他们也不知道，他们不听父母的话，父母是很伤心的。,200504534533250138,新加坡,2,200504,我对男女分班的看法,65,65,59,71,62,306,C,
我认为我们现代的年青人早恋也不算什么。,200504534533250150,新加坡,2,200504,我对男女分班的看法,55,70,62,60,62,293,C,
调查显示，在女校或男校同性恋者的发生{CC巴仙}率比男女[B好]混合学[L]校的高出许[C]多。,200504534533250181,新加坡,2,200504,我对男女分班的看法,65,70,76,62,73,332,C,
孩子通[C]过[C]{CD受到}父母的教育，可以学习怎么适应{CD到[C]}社会，那时[C]，父母的价值观、思想、道[C]德[C][BD、]都反[C]映出来。,200505109525100466,日本,1,200505,父母是孩子的第一任老师,75,90,76,52,67,354,C,
如果[C]每[C]个孩子都受到[C]{CQ同}一个父母[C]的影响[F響]的话，这就是指每[C]个孩子也没有个性。,200505109525100561,日本,1,200505,父母是孩子的第一任老师,60,45,36,47,40,206,未参加,
父母的态度与孩子的性格之形成也有关系。,200505109525100578,日本,1,200505,父母是孩子的第一任老师,65,65,79,72,64,329,C,
常说“[BC‘]看孩子就可以看到他父母是怎么样[C]的人”[BC’]我觉得这句话讲[C]的特别有道理，因为孩子是看着父母长大的。,200505109525200624,日本,2,200505,父母是孩子的第一任老师,70,70,79,74,61,342,C,
我认为“父母是孩子的第一任老师”的说法是对的。,200505109513200752,柬埔寨,2,200505,父母是孩子的第一任老师,70,70,44,40,51,263,未参加,
他们为了我长大，经历过{CC3经过}很多辛苦。,200505109525201003,日本,2,200505,父母是孩子的第一任老师,60,65,39,43,62,252,未参加,
父母毕竟{CC究竟}就是孩子们有机会接触{CC接受}的第一个人，因此他们对孩子的成长产生重大的影响。,200505109529201322,泰国,2,200505,父母是孩子的第一任老师,65,65,41,43,64,262,未参加,
这主要是为了使他们拥有健康的身心，所以父母有极大的任务。,200505109610201293,法国,2,200505,父母是孩子的第一任老师,80,70,66,47,76,329,C,
他们并不是父母{CJ-wy当成父母}而已{CJba}，而是当作一个老[C]师。,200505109525101621,日本,1,200505,父母是孩子的第一任老师,80,65,52,63,69,317,C,
父母是对孩子来说最初[C]的老师。,200505109525101621,日本,1,200505,父母是孩子的第一任老师,80,65,52,63,69,317,C,
父母平常的行为直[C]接就会在孩子的身[C]上反映出来，父母要[C]批评孩子前好好想[C]一想[C]自己的平常的行为，要想[C]改变孩子的不好的习惯的话要从自身上改变。,200505109525201752,日本,2,200505,父母是孩子的第一任老师,50,85,76,49,67,314,未参加,
”听了爸爸的话，他不得不把礼[C]物放到[C]自己的包[C]里。,200505109525201871,日本,2,200505,父母是孩子的第一任老师,55,65,52,41,67,262,未参加,
这是最能{CC1好一点}反映{CD着}父母是老师这个看法{CQ的}。,200505109922201930,美国,2,200505,父母是孩子的第一任老师,80,65,67,59,74,333,C,
父母常常梦想孩子的将来的{CD多彩}成功，{CJ-zhuy孩子}从很小时候就开始{CJ-sy接受}过于丰富的各种教育。,200505109525202131,日本,2,200505,父母是孩子的第一任老师,70,60,52,69,85,321,未参加,
我找工作时，先考虑[F慮]的是，“这份工作是不是帮助别人{CJsd}？,200505109525202335,日本,2,200505,父母是孩子的第一任老师,70,75,66,72,73,345,C,
从孩子一落地，他就开始认[B让]识世界{CQ了}。,200505109922202388,美国,2,200505,父母是孩子的第一任老师,75,55,66,62,41,284,未参加,
我父亲在大学时学农[C]业学，现在是{CC当}环境问题的[C]专家{CC专者}。,200505109525202398,日本,2,200505,父母是孩子的第一任老师,60,65,41,56,62,267,未参加,
我没有受到{CC2受}音乐[F樂[C]]的教育的原因是因为我父母对音乐根本不{CC1没有}感[C]兴趣。{CP我被[C]父母强迫也好，如果我从小[C]时候开始学习弹钢琴或者拉{CC弹},200505109525102455,日本,1,200505,父母是孩子的第一任老师,65,65,39,51,72,276,未参加,
所以通过[C]对话[C]好好交流，有的时候跟孩[C]子一起[C]去旅[C]游，[BC．]这样做可以互相尊重，互相理解[C]，我认为父母是孩[C]子的第一任老师。,200505109525102483,日本,1,200505,父母是孩子的第一任老师,60,65,46,45,43,242,未参加,
我觉[C]得我对[C]父母的[C]态度还要改善一些，因为有时候我也有对[C]父母不能理解，了解的[C]，但现[C]在想起来都是为我好{CQ才}做的[C]，我希望这辈子一直尊敬父母，这思想是不会变的。,200505109525102517,日本,1,200505,父母是孩子的第一任老师,55,60,50,67,63,276,未参加,
我们{CQ的}{CD本}性[B心]格，母[B月]语[BD，]等等就从父母{WWJ},200505109922102502,美国,1,200505,父母是孩子的第一任老师,65,45,29,21,34,173,未参加,
可能是交给小学的老师、家人或朋友。,200505109922102567,美国,1,200505,父母是孩子的第一任老师,85,75,48,47,45,292,未参加,
第一，不能不上学；[BC，]第二，不能上课的时候说话；[BC，]第三[BQ，]不明白[B百]的题问[B间]老师；[BC，]第四，每[B母]天回家的[B白]时候复习学过的课目。,200505271736100124,尼日利亚,1,200505,父母是孩子的第一任老师,90,55,65,43,43,285,未参加,
当然是父母。,200505261635100153,俄罗斯,1,200505,父母是孩子的第一任老师,60,60,37,35,47,221,未参加,
我估计每一个人都曾看过孩子完全不像父母的这种家庭。,200505261635200064,俄罗斯,2,200505,父母是孩子的第一任老师,65,60,67,67,78,320,C,
父母不再是他们的老师，[BC。]孩子们的思想也不一样了，[BC。]爱好行为也不一样了。,200505212540200006,印度尼西亚,2,200505,父母是孩子的第一任老师,75,50,31,39,50,229,未参加,
童年时，每当临睡{CD在床}前，我们兄弟姐妹常常听妈妈讲过去的事，讲她的母亲[BQ——]外婆是怎样在当年被媒人劫[B节]来[BD，]人生地不熟、[BC，]举目无亲{CJ-sy到}的{CJX}南洋。,200505212540200053,印度尼西亚,2,200505,父母是孩子的第一任老师,60,65,50,49,80,287,未参加,
这[F這]样的结[F結]交{CJ-zxy方式}[BD、]我想大家都不会想要。,200505522522250012,缅甸,2,200505,最理想的结交方式,60,90,77,64,82,363,C,
我跟他说：“结了婚不能在家呆着，还{CQ像}没结婚以前那样在学校教电脑课。,200505522522250016,缅甸,2,200505,最理想的结交方式,65,70,52,49,73,295,未参加,
每到晚上，我想他的种种好处时，我自言自语地说：“我最理想的结交方式是他跟我刚遇见的那样。,200505522522250017,缅甸,2,200505,最理想的结交方式,70,70,59,75,77,339,C,
父母的教育比学校的教育广，父母不仅给孩子知[B智]识、思想、[BC，]兴趣等[BQ。]父母对孩子很{CC的}关爱，有时与孩子们谈谈心，了了解解{CJcd}孩子的心思，开导开导他们，让他们知道什么是对的什么是错的{CQ以及}为什么，这是特别{CC极特}重要的。,200505209542200083,越南,2,200505,父母是孩子的第一任老师,85,85,56,55,65,341,C,
如果从小到大孩子常常能跟父母一起听音乐，跟父母去展览馆[B官]看画，跟父母{CQ去}旅游等[BQ，]孩子慢[B漫]慢[B漫]会对这方面产生感[B成]情，很可能很喜爱这些方面。,200505201542200069,越南,2,200505,父母是孩子的第一任老师,85,85,67,49,76,357,C,
父母是我的第一任老师，[BC。]没有他们的榜样，{CQ就}没有我的今天。[BC、],200505501540200079,印度尼西亚,2,200505,父母是孩子的第一任老师,60,70,56,63,36,270,未参加,
通常他们的需要或家庭服务都是父母包办代替，一味满足。,200505502540200050,印度尼西亚,2,200505,父母是孩子的第一任老师,80,70,44,59,56,299,未参加,
听完我的话，他就很奇怪，为什么要去问他们，他们肯定不知道。,200505332529100013,泰国,1,200505,父母是孩子的第一任老师,70,90,58,45,54,310,C,
父母的兴趣爱好影响着孩子，就是因为姚明父母亲的爱好与职业，姚明从小就被父母亲{CD的}影响，而造就{CQ了}当今美国NBA蓝球职业的明星球员。[BC，],200505332512100051,菲律宾,1,200505,父母是孩子的第一任老师,70,90,58,65,80,356,C,
报章上家喻户晓的“保健旅游身心乐”便是我的创作。,200509534533250008,新加坡,2,200509,一封求职信,85,90,84,80,97,432,A,
致此，祝贵公司：业务蒸蒸日上×××先生启2005年9月17日,200509534533150046,新加坡,1,200509,一封求职信,75,70,68,58,77,337,C,
我今年23岁，未婚，新加坡人。,200509534533250054,新加坡,2,200509,一封求职信,80,60,73,51,82,333,未参加,
本人看到贵公司的招聘启事，诚恳地“毛遂自荐”，应征快乐家庭旅游公司导游职位。,200509534533150073,新加坡,1,200509,一封求职信,90,90,91,82,95,446,A,
本人{CD对}贵公司{CD于[F於]}2005年9月1日刊登于[F於]星洲日报{CQ的}{CD上}招聘广告上{CQ所}招聘{CQ的}导游之职{CJX}有意申请。,200509534533250072,新加坡,2,200509,一封求职信,80,80,68,64,86,370,C,
出生于一九七六年，今年二十九岁。,200509534533150095,新加坡,1,200509,一封求职信,80,75,77,53,91,367,C,
附上是我本人的简历{CJs}：名字：×××国藉：新加坡年龄：二十五生日：一九八零年六月十八精通的语言：中文、英文、日文与马来文。,200509534533150117,新加坡,1,200509,一封求职信,60,55,82,69,82,329,未参加,
我在旅游业的经验虽然不多，但很有诚意向贵公司学习，希望贵公司能给我这个机会。,200509534533250123,新加坡,2,200509,一封求职信,75,70,84,58,75,351,C,
我认为能为大众服务是我的荣幸。,200509534519250148,马来西亚,2,200509,一封求职信,85,70,75,77,88,386,B,
我于日前在报章上看见贵公司的招聘启事，因此来信应聘{CC应征}广告设计师一职。,200509534533250173,新加坡,2,200509,一封求职信,70,80,79,80,86,385,B,
第一，喜欢流行歌曲可以让{CC把}我们的生活更完美一些，比如说，和朋友一起玩儿的时候，我们可以唱现在流行的歌。,200510111523200015,韩国,2,200510,我看流行歌曲,60,90,65,42,62,309,未参加,
有些歌听起来让人很高兴。,200510111523100430,韩国,1,200510,我看流行歌曲,70,70,37,26,55,246,未参加,
我说{CC学}的{CC得}问题是喜欢程度。,200510111523200426,韩国,2,200510,我看流行歌曲,55,60,30,24,37,187,未参加,
对他们来说听流行歌曲也许能使他们发奋{CC俗[C]}。,200510111624200519,挪威,2,200510,我看流行歌曲,85,80,81,56,59,354,B,
可是我觉得流行歌曲的好处比坏处多。,200510111523200836,韩国,2,200510,我看流行歌曲,65,70,53,52,57,283,未参加,
我个人认为流行歌曲就像心里话一样，是一种方法{CJX}表达自己[C]的心里、观点等。,200510111523200846,韩国,2,200510,我看流行歌曲,65,70,74,50,59,304,C,
我想他们还没有感觉到它的真正魅[B魁]力才会说这些话的。,200510111523200894,韩国,2,200510,我看流行歌曲,60,85,53,61,67,315,未参加,
那时候我想，我到底[B低]在中国还是在韩国呢？,200510111523201073,韩国,2,200510,我看流行歌曲,55,70,44,36,32,221,未参加,
中学、高中时的我，很喜欢流行歌[C]曲，当时我出门时没拿录音机的话，心里{CQ就}不安静[B精]。,200510111523201235,韩国,2,200510,我看流行歌曲,55,60,37,42,37,212,未参加,
对我来说，听流行歌是一种交朋友的方法。,200510111523101249,韩国,1,200510,我看流行歌曲,60,65,51,50,72,281,未参加,
喜欢流行歌曲的人大部分是青少年。,200510111523201278,韩国,2,200510,我看流行歌曲,80,90,67,56,79,367,C,
虽然人们的要求越来越高，[BC。]但在人们心中永远存在的歌就是流行歌曲，真[C]正的歌曲{WWJ},200510111523101576,韩国,1,200510,我看流行歌曲,65,65,56,56,59,285,C,
这调查可以看出，流行歌给{CC是}人们带来了很大的影响。,200510111523201599,韩国,2,200510,我看流行歌曲,60,65,46,44,47,245,未参加,
歌[C]曲是不管国籍和年龄[B领][BD，]流行的。,200510111523101633,韩国,1,200510,我看流行歌曲,65,70,63,52,40,276,未参加,
女朋友喜欢唱歌，我决定我也要唱流行歌曲，这样很容易找到共同话题。,200510111419101651,哈萨克族,1,200510,我看流行歌曲,75,75,56,48,67,311,未参加,
随着音乐走入梦中……我个人觉得它就这么一个作用。,200510111542201697,越南,2,200510,我看流行歌曲,90,75,67,56,62,344,C,
有些人特别喜欢流行歌曲。,200510111523201847,韩国,2,200510,我看流行歌曲,65,65,37,46,50,247,未参加,
如果有人问“你对流行歌曲的看法如何”人们怎么回答？,200510302523100013,韩国,1,200510,我看流行歌曲,65,70,65,54,69,309,C,
可能她精神上有些情结所以变成这样，那样不太好。,200510302523200014,韩国,2,200510,我看流行歌曲,65,75,51,44,77,299,未参加,
有人可以用这样的方式来安慰自己。,200510302523200033,韩国,2,200510,我看流行歌曲,75,80,65,44,62,317,C,
比如说，跟朋友们见面时，特别是年轻人很喜欢说流行歌曲。,200510302523100054,韩国,1,200510,我看流行歌曲,75,70,58,48,82,322,C,
那个人不能进入{CC进去}社会活动。,200510302523100079,韩国,1,200510,我看流行歌曲,65,60,60,50,55,273,未参加,
”虽然我喜欢流行歌曲，但是爸爸的话也对的{CJsd}。,200510302523100108,韩国,1,200510,我看流行歌曲,60,60,56,50,62,270,未参加,
大部分人有特别烦、有特别生气的事{CQ的时候}听一些静的流行歌，把激动{CC兴奋}的心情静下来。,200510302523200104,韩国,2,200510,我看流行歌曲,75,70,44,40,47,265,未参加,
这[C]些事并不难吧！,200510302523200236,韩国,2,200510,我看流行歌曲,75,80,72,50,69,337,C,
据某一个社会团体[L]调查统计，近三年内出现{CC出世}的歌内容中，百分之八十以上的爱情{CD歌}{CJs}。,200510302523200244,韩国,2,200510,我看流行歌曲,65,75,51,36,64,278,未参加,
现代人的日常生活是非常无聊[B了]的。,200510302523100267,韩国,1,200510,我看流行歌曲,50,55,49,40,47,220,未参加,
痴迷一个名星很危险……[BC…],200510206610100153,法国,1,200510,我看流行歌曲,85,50,49,38,59,267,未参加,
我一进车上就直接听车上的收音机，一边开车一边听流行歌曲。,200510540540200007,印度尼西亚,2,200510,我看流行歌曲,75,90,56,50,74,339,未参加,
流行歌曲也是一个文化的交流嘛[B吗]。,200510540540200019,印度尼西亚,2,200510,我看流行歌曲,50,55,60,38,79,261,未参加,
摇滚乐的流行歌曲可以激发人们{CD对}生活中的一些观念，就{CD好}像[B象]在九十年代的一个摇滚乐团[BD，]“BEYOND”，[BC。]青少年，甚至成年人都对这个乐团有一定的崇拜。,200510540540200052,印度尼西亚,2,200510,我看流行歌曲,85,65,79,61,74,353,C,
如果我有孩子，我也会用{CC跟}我爸妈的教育方式教育我的孩子。,200509602801150003,澳大利亚,1,200509,父母是孩子的第一任老师,75,60,71,65,63,320,C,
所以说[F說]，有父母的孩子是{CC的}幸福的，因此不要忘了对[F對]自己的父母说[F說]声谢[F謝]谢[F謝]！,200509602801250011,澳大利亚,2,200509,父母是孩子的第一任老师,0,75,88,81,84,324,未参加,
每个星期天去中国教堂，我很喜欢去韩国教堂但[BD，]这个也是{CQ为了}接触一下中国的信仰。,200104124523200005,韩国,2,200104,一封写给父母的信,75,70,58,47,45,284,C,
今天写到这儿，我盼望你们回信。,200104124525200124,日本,2,200104,一封写给父母的信,70,85,66,63,45,321,C,
我自[L]从来到中国以后，很想给父母用中文来写信。,200104124523200160,韩国,2,200104,一封写给父母的信,70,60,55,21,38,229,未参加,
我以前没想到{CD了}三{CC3}年级这么难学，[BC。]所以最近有点儿难受。,200104124523200183,韩国,2,200104,一封写给父母的信,75,85,38,47,40,278,未参加,
我知道你们很辛苦。,200104124523200202,韩国,2,200104,一封写给父母的信,65,50,47,32,45,220,未参加,
对不起，应该经常跟他们联系才对，只考虑[B虚]我自己，不常跟他们联系{CC问候}，今天借这次机会我想间[B简]接地向奶奶和爷爷问候，请转告他们。,200104124523200390,韩国,2,200104,一封写给父母的信,70,80,52,44,42,278,未参加,
现在北京的天气非常好，[BC。]不冷不热，{CJ-zhuy我}过得很好。,200104124523200454,韩国,2,200104,一封写给父母的信,65,80,27,23,33,216,未参加,
您好！{CJX},200104124523200458,韩国,2,200104,一封写给父母的信,65,80,36,23,27,219,未参加,
我在电视台的时候，跟[BD，]你们公司已经联系过了[BQ，]{CD为了}为{CC1为了}拍{CQ过}{CJX}[B排]贵{CC本}单位{CD的}广告[D影]。,199200204729100031,马里,1,199200,一封求职信,,,0,0,0,0,未参加,
以前{CJ-zhuy我}{CQ在}报纸上看过你们公司的名字。,199200204530100002,土耳其,1,199200,一封求职信,,,0,0,0,0,未参加,
他的妻子愿意“安乐死”。,199604123523200035,韩国,2,199604,如何看待“安乐死”,60,80,29,32,29,217,未参加,
切肤之痛的病人自己要安乐死的话{CJ-sy说明}他已经忍受不了痛苦而自己也明白自己的病没有希望。,199604124523200345,韩国,2,199604,如何看待“安乐死”,70,60,66,54,52,286,C,
杀人或帮自杀的人，这都是重罪，但我觉得“安乐死”是自己愿意而死的[BQ，]所以帮助自杀是无罪{CJsd}。,199604123523200165,韩国,2,199604,如何看待“安乐死”,60,60,61,61,44,268,未参加,
就是“人间有没有自己决定死期的权利？,199604123525100204,日本,1,199604,如何看待“安乐死”,60,70,42,49,49,254,未参加,
如果病人不知自己的病是不治的[BD，]就死的话，他的人权哪儿去了{CC呢}？,199604123525100204,日本,1,199604,如何看待“安乐死”,60,70,42,49,49,254,未参加,
人总抱{CC绕}着过去的观念，最终{CC究竟}没有什么变化。,199604124525200223,日本,2,199604,如何看待“安乐死”,45,55,35,49,39,200,未参加,
古人说[F說]“不听老人言，吃亏[F虧]在眼前”并[F並]不是没[F沒]有道理的。,199610802501200013,中国,2,199610,如何解决“代沟”问题,95,95,100,85,88,462,A,
孝顺父母是中华民族的传统美德，作[B做]子女的不应忤逆父母，[BC。]而当长[F長]辈的也不能“倚老卖老”，也要尊重年轻人的观[F覌]点，在和睦的气氛中求同存异。,199610512501150007,中国,1,199610,如何解决“代沟”问题,95,90,78,81,94,437,A,
晚辈不敢跟长辈说，不愿意跟长辈讨论。{CP一说话就听{CQ到},199610550523290011,韩国,2,199610,如何解决“代沟”问题,70,65,65,69,67,322,C,
孩子中学或高中生的话，那时大部分的学生想想{CJcd}他自己的未来，我长大以后干什么什么……。,199610550523190015,韩国,1,199610,如何解决“代沟”问题,60,55,28,46,32,202,未参加,
那时候我爸爸常常跟我说[BQ：]“你不要去中国，去中国干吗？,199610550523290037,韩国,2,199610,如何解决“代沟”问题,60,70,44,48,47,254,未参加,
但有时候反[B友]抗[B杭]前辈的事情也发生。,199610550523190065,韩国,1,199610,如何解决“代沟”问题,60,55,62,38,37,233,未参加,
因为韩国具有儒教思想，年龄[C]小{CQ的}人要尊重年龄[C]大{CQ的}人，还有重男轻女，可是在这里{CC这段}的主要内容是儒教的五伦[C]“长幼有序”。,199610550523290076,韩国,2,199610,如何解决“代沟”问题,65,60,36,32,41,217,未参加,
对此，我们要回顾[C]传统社会有没有代沟问题。,199610550523290099,韩国,2,199610,如何解决“代沟”问题,70,70,36,44,37,245,未参加,
如果遇着子女们[F們]又没有尊重长[F長]辈[F輩]的观[F觀]念，那就会造成更大的代沟。,199611543501200528,中国,2,199611,如何解决“代沟”问题,80,75,62,55,63,326,C,
这三兄弟从此各怀鬼胎，老二没有货送出，{CJba}{CD而}却把客户订购的货品拿回家中去。[BC，],199603533533200008,新加坡,2,199603,由“三个和尚没水喝”想到的……,85,80,58,58,77,351,C,
原来，她为了搏[B博]得校长（上司）的赞扬才答应我。{CJsd},199603533533200014,新加坡,2,199603,由“三个和尚没水喝”想到的……,90,70,69,70,80,372,C,
同时[F時]，也不可懒惰，要不然，受[B收]害的还是自己。,199603533533200048,新加坡,2,199603,由“三个和尚没水喝”想到的……,90,70,55,58,65,331,C,
第二是自己的周围还{CC再}有另一个人的时候，以两个人为{CJ-by单位}思考及行动。,199605104501200008,中国,2,199605,由“三个和尚没水喝”想到的……,75,65,52,60,63,302,C,
听{CJ-buy完}这个故事后，谁都{CC也}觉得那俩小伙子{CD怎}是{CD个}愚人。,199605104523200005,韩国,2,199605,由“三个和尚没水喝”想到的……,75,60,71,63,54,309,C,
如果三个人以上的话呢，“三个和尚没水渴”得到{CC受到}的是这样的结果。,199605104525200012,日本,2,199605,由“三个和尚没水喝”想到的……,65,65,60,88,84,346,C,
