错句,作文编码,国籍,性别,考试时间,作文题目,口试分数,作文分数,听力分数,阅读分数,综合分数,总分,证书
在现在的世界里能{CJX}唯一了解你、和你志同道合的人再也不只是同性了。,200504534533250130,新加坡,2,200504,我对男女分班的看法,70,85,70,73,64,354,B,
男女分班可能造成少数同性恋。,200504534533150151,新加坡,1,200504,我对男女分班的看法,75,75,70,67,73,350,B,
女生的特点就是心思细腻，做事总是三思而后行。,200504534533250157,新加坡,2,200504,我对男女分班的看法,80,75,76,78,79,379,B,
长期以来，中国的学校大多是男女混合{CQ的}。,200504534533150165,新加坡,1,200504,我对男女分班的看法,55,70,67,54,70,300,C,
喜欢学习的父母生喜欢学习的孩子，医生的孩子很可能要成为医生。,200505109922100247,美国,1,200505,父母是孩子的第一任老师,65,55,39,29,49,219,未参加,
父母是孩子的第一任老师父母是孩子的第一任老师，我认为这说法很道理。,200505109525100466,日本,1,200505,父母是孩子的第一任老师,75,90,76,52,67,354,C,
下面我想介绍一下父母教我的三个重要知识。,200505109525200907,日本,2,200505,父母是孩子的第一任老师,80,90,87,58,79,389,B,
我[C]认为人怎么长大是由父母创造{CC制作}的生活环境来决定的。,200505109525200998,日本,2,200505,父母是孩子的第一任老师,60,50,39,37,66,232,未参加,
我基本上同意这种看法。,200505109525201312,日本,2,200505,父母是孩子的第一任老师,60,70,50,43,64,272,未参加,
如果父母每天都在忙碌着，[BC、]而不顾孩子的成长，[BC、]孩子就变得消极，[BC、]不喜欢学习，[BC、]因为他不知道学习到底是为了什么？,200505109513101449,柬埔寨,1,200505,父母是孩子的第一任老师,75,55,73,56,90,334,C,
”这些文章和我妈妈的生活方式一样。,200505109525201477,日本,2,200505,父母是孩子的第一任老师,55,60,55,56,55,262,未参加,
我的爱好（棒球）帮助我交了很多朋友。,200505109525101681,日本,1,200505,父母是孩子的第一任老师,50,75,50,55,67,281,未参加,
但是他理解了我的话，还{CC1还有}对我说：“这个话让我感动了。,200505109525202041,日本,2,200505,父母是孩子的第一任老师,65,70,52,67,72,312,C,
那么当成孩子的第一任老师的父母在教育当中应该注意什么呢？,200505109525102400,日本,1,200505,父母是孩子的第一任老师,55,65,46,51,64,263,未参加,
父母负担着这神圣的任务。,200505217519100138,马来西亚,1,200505,父母是孩子的第一任老师,75,65,73,59,76,335,C,
像孟子的母亲一样，迁移到合适的地方{CC地区}学习、[BC，]成长。,200505205533200167,新加坡,2,200505,父母是孩子的第一任老师,60,70,61,53,78,307,未参加,
对孩子来说，从小时候{CQ开始}父母的一举一动{CJ-zy就}有很大的影响。,200505212542200032,越南,2,200505,父母是孩子的第一任老师,80,65,58,49,58,298,C,
现在还有很多女孩子找男朋友想找一个像她们的爸爸一样[C]{CJ-zxy的人}，{CD所以}也有很多男孩找女朋友也想找一个人像他们的妈妈一样[C]。,200505212542200041,越南,2,200505,父母是孩子的第一任老师,65,75,41,51,58,277,未参加,
可是，不需要整天粘在一起。,200505522522250012,缅甸,2,200505,最理想的结交方式,60,90,77,64,82,363,C,
从[F從]友情慢慢地{CC的}变[F變]成爱[F愛]情，中间[F間]需要很长[F長]的一段时[F時]间[F間]。[BC.],200505522522250024,缅甸,2,200505,最理想的结交方式,90,75,70,51,68,348,C,
不管用什么方式结[F結]交，最初还是希望自己能够有一个[F個]最理想的家庭。,200505522522250026,缅甸,2,200505,最理想的结交方式,70,75,70,60,73,337,C,
老实[F實]说[F説]，以上几种[F種]都有各自的优[F優]缺点[Y奌]，在生活繁忙的现[F現]今社会，很多人都不想把时[F時]间[F間]花在感情上[BQ，]所以借[B籍]由相亲[F親]不仅[F僅]可减[Y減]省时间[BQ，]也不麻烦[F煩]。,200505522522110019,缅甸,1,200505,最理想的结交方式,65,80,77,73,88,371,B,
若是父母在家庭里表现得不好，例如吵架，说脏话诸如此类，孩子就会向父母学习。,200505502540200050,印度尼西亚,2,200505,父母是孩子的第一任老师,80,70,44,59,56,299,未参加,
因为要考{CD上}大学{CD了}，所以那{CC这}段时间我父母管我比较严。,200505332529100013,泰国,1,200505,父母是孩子的第一任老师,70,90,58,45,54,310,C,
偶然见[F見]面的时[F時]后[B候]，[BC、]很难[F難]知道他是不是合适{CC符合}的人，[BC、]可是慢慢{CC2越来越}可以知道。,200505650634250184,英国,2,200505,最理想的结交方式,70,50,34,47,37,221,未参加,
首先，父母应该以身作[B做]则。,200505024922200379,美国,2,200505,父母是孩子的第一任老师,75,65,63,57,76,323,C,
本人自认是个细心入微的人，并深信能胜任这份工作。,200509534533250017,新加坡,2,200509,一封求职信,80,85,75,58,79,371,B,
李文：我名叫××，今天二十五岁。,200509534533250038,新加坡,2,200509,一封求职信,60,75,75,58,66,320,C,
本人毕业于[B与]新加坡国立大学商物管理系，并拥有荣誉学位。,200509534533150105,新加坡,1,200509,一封求职信,85,80,86,75,95,414,B,
本人今年28岁，在行义旅游公司工作。,200509534533250123,新加坡,2,200509,一封求职信,75,70,84,58,75,351,C,
凭[B执]着我对旅游的兴趣，我成功考获导游的执照，并已有两年的导游经验。,200509534533250152,新加坡,2,200509,一封求职信,70,70,82,64,86,360,C,
本人会随这封信附上成绩单，也会在信的后面写上联系地址。,200509534533250155,新加坡,2,200509,一封求职信,70,75,77,75,88,374,B,
本人对广告设计师的这{CC一}份工作持有热忱，并且对旅游[D方]广告的需[B须]求有所了解。,200509534533250157,新加坡,2,200509,一封求职信,75,75,82,73,88,383,B,
她们生活中最大的一部分是听流行歌曲{CD的}。,200510111523200014,韩国,2,200510,我看流行歌曲,60,80,67,52,52,298,未参加,
流行歌[B哥]曲有很多种：[BC，]有的流行歌[B哥]曲表示爱情有的流行歌[B哥]曲表示离[B里]别，有的流行歌[B哥]曲表示好人的方式。,200510111523200055,韩国,2,200510,我看流行歌曲,60,65,39,44,35,226,未参加,
中国的歌对我来说不好听懂，觉得很难把声调听得清楚，而且在歌曲里使用的汉语中{CQ的}书面话比较多更难听懂。,200510111523100424,韩国,1,200510,我看流行歌曲,70,85,70,71,84,372,B,
有些歌听起来让人很高兴。,200510111523100430,韩国,1,200510,我看流行歌曲,70,70,37,26,55,246,未参加,
就是说，他们听不懂、看不明白也可以喜欢韩国流行歌[B哥]曲。,200510111523101054,韩国,1,200510,我看流行歌曲,60,70,63,46,57,281,未参加,
我长大以后也是这样。,200510111523101105,韩国,1,200510,我看流行歌曲,50,60,65,46,47,248,未参加,
说到流行歌曲，人们都认为它是一种给年轻[B清]人听的，说的{CC地}也有道理。,200510111542101184,越南,1,200510,我看流行歌曲,55,60,60,50,57,263,未参加,
第一是，学生在学习中他们一边听音乐一边学习。,200510111523201244,韩国,2,200510,我看流行歌曲,55,60,30,48,55,229,未参加,
我认为流行歌曲给人们的影响不好。,200510111523201278,韩国,2,200510,我看流行歌曲,80,90,67,56,79,367,C,
我们可以欣赏他的才华，但不能过于去崇拜他。,200510111519201751,马来西亚,2,200510,我看流行歌曲,95,80,90,63,87,411,B,
因为再好的幼苗离开{CQ了}父母的呵护，最终也会枯萎的。,200510919919150003,加拿大,1,200510,父母是孩子的第一任老师,80,95,71,71,99,411,B,
孔子曰：[BC「]养不教，父之过[BC」]，可见[BC「]教导[F導][BC」]{CJ-by孩子}是中国人认为合乎义理的事情。,200510919543250023,香港地区,2,200510,父母是孩子的第一任老师,60,80,36,54,82,299,未参加,
音乐对我而言是生活中不可缺少的一部分[B份]。,200510512512250012,菲律宾,2,200510,我看流行歌曲,90,90,77,65,77,397,B,
我总认为，没有了流行歌曲我便不知该向那里[F裏]发泄[B洩]我的心情，[BC、]没有了它我便无法抒发我自己的情绪。[BC，],200510512512250012,菲律宾,2,200510,我看流行歌曲,90,90,77,65,77,397,B,
不仅如此有时流行歌曲还能把不好的情绪或气氛给调节{CC改}过来，例如，我遇到了不快乐的事情，独自在房间里，心里非常沉闷，只要把节奏比[B毕]较快{CJ-zxy的歌曲}给放出来，很快情绪都会慢慢好起来，或者[B着]在气氛非常一般的晚会里，只要把流行歌曲放出来[L]都会把沉闷{CC平凡}的气氛变得很热闹，等等。,200510212529100002,泰国,1,200510,我看流行歌曲,80,65,72,48,77,330,C,
但是，{CQ即使}{CD連}有才能的人也不一定算得上好老師。,200510950922150001,美国,1,200510,父母是孩子的第一任老师,85,50,53,54,38,266,未参加,
小孩子就像白纸一样[F樣]，看什么[F麽]就学[F學]什么[F麽]，听[F聽]什么[F麽]就说[F說]什么[F麽]。,200510950922250003,美国,2,200510,父母是孩子的第一任老师,85,75,71,68,57,348,B,
我们不应[F應]该[F該]过份重视[F視]歌星，而{CC反而}应[F應]该[F該]注重他的音乐[F樂]，现在的娱乐公司很懂得做。,200510543801200001,澳大利亚,2,200510,我看流行歌曲,80,95,58,56,74,358,C,
我想喜欢流行歌曲就够了，不要像我的同学那样，也不学习，也不干别的，整天只被流行歌迷的不得了{CJbei}。,200510302523200002,韩国,2,200510,我看流行歌曲,75,75,65,59,72,336,C,
流行歌曲能代表人们的人情、人们各种各样的故事。,200510302523200006,韩国,2,200510,我看流行歌曲,60,65,53,32,59,252,未参加,
从这方面上来说，我非常喜欢流行音乐，我希望它继续发展下去，得到[L]更多人的喜爱。,200510302523200014,韩国,2,200510,我看流行歌曲,65,75,51,44,77,299,未参加,
那么人们为什么听流行歌曲呢？,200510302523200021,韩国,2,200510,我看流行歌曲,60,70,60,48,57,280,未参加,
所以，{CJ-zhuy流行歌曲}自然[C]吸引人们。,200510302523100026,韩国,1,200510,我看流行歌曲,60,65,42,38,52,240,未参加,
那么比现在更好！,200510302523100032,韩国,1,200510,我看流行歌曲,65,55,44,32,59,237,未参加,
后代的我们看当时写作的艺术作品猜测[F測]当时的背景、[BC，]情况。,200510302523100034,韩国,1,200510,我看流行歌曲,60,65,67,65,79,319,C,
普普通通的歌，由于唱的歌星长得帅，长得漂亮，因此就成为非常有名的歌曲。[BC，],200510302523100052,韩国,1,200510,我看流行歌曲,95,70,67,61,91,378,C,
那么如果自己对流行歌曲没有感兴趣的话，在朋友的面前没什么可说的，所以以至{CC致至}被社会淘汰。,200510302523100054,韩国,1,200510,我看流行歌曲,75,70,58,48,82,322,C,
我高中的时候常常看到这些歌迷，[BC。]为了看喜欢偶像[B象]的演[B寅]唱会，一整天等在门口。,200510302523200084,韩国,2,200510,我看流行歌曲,65,60,63,48,55,274,未参加,
比如说，在韩国70～80年代的歌曲大部分讽刺{CC2唱}了那时的国家的政治{CD讽刺}。,200510302523200135,韩国,2,200510,我看流行歌曲,65,70,51,40,74,286,未参加,
还记得，小时候是妈妈唱什么歌，我也就唱什么歌。,200510302523200150,韩国,2,200510,我看流行歌曲,85,55,81,73,99,380,C,
这些理由，我同意流行歌曲。,200510302523100195,韩国,1,200510,我看流行歌曲,75,70,56,54,64,308,C,
我对流行歌曲是{CJX}还比较喜欢的，因为它以我的心情{CJX}可以改变我那时候的心理状况。,200510302523200257,韩国,2,200510,我看流行歌曲,65,70,46,59,77,303,C,
流行歌曲含[B拿]有教育性{CJX}也{CD有}，最重要是听众要分辨{CC分别}好的歌曲{CJs}，还是坏的，有黄色北京的流行歌曲我们可以拒绝，尤其是年轻人{CC3年轻儿女}们，千万不要着迷。,200510529529151016,泰国,1,200510,我看流行歌曲,65,80,74,61,77,345,C,
所以我希望流行歌曲{CQ的}内容[BD、]应该有利于培养青年人，[BC、]应用些道德来引导他们走向前方{CC前影}。[BC，],200510529529251028,泰国,2,200510,我看流行歌曲,65,65,51,52,50,267,未参加,
可是二十年后的今天，我已不太喜欢流行歌曲。,200510540540200018,印度尼西亚,2,200510,我看流行歌曲,70,75,51,40,62,287,未参加,
所以我认为男女之间相识的最好方式就是自己在一个偶然的机会相遇，随着时间的经过，慢慢了解，从而落入了情网。,200505684542200003,越南,2,200505,最理想的结交方式,75,70,43,51,79,307,未参加,
两小无猜经常在一起玩，彼此之间的友谊之情经过了时间的淬炼{CC练粹}，升华成了没有血缘关系的亲情。,200505680519250002,马来西亚,2,200505,最理想的结交方式,80,90,91,82,91,429,A,
诚然，这也牵[F牽]涉到结交的方式。,200505680519250019,马来西亚,2,200505,最理想的结交方式,65,80,79,60,79,351,C,
你们最近好吗？,200104124542200029,越南,2,200104,一封写给父母的信,85,85,82,70,88,405,A,
我是你们的宝贝[B贵]儿子×××。,200104124523100074,韩国,1,200104,一封写给父母的信,75,60,68,54,45,288,C,
这样，我靠{CC借}许多人的帮助来生活。,200104124525200101,日本,2,200104,一封写给父母的信,70,50,33,42,47,225,未参加,
敬礼！,200104124525200101,日本,2,200104,一封写给父母的信,70,50,33,42,47,225,未参加,
我认为跟他们在一起，能{CC为}了解中国人的思想、[BC，]生活方式。,200104124523100172,韩国,1,200104,一封写给父母的信,70,60,38,49,54,256,未参加,
不要太担心我。,200104124523200190,韩国,2,200104,一封写给父母的信,65,65,47,28,47,236,未参加,
考试题目是《[BC“]一封写给父母的信》[BC”]所以我趁这个机会写{CJX}给您{CD的}信。,200104124523200191,韩国,2,200104,一封写给父母的信,55,60,41,28,38,203,未参加,
过去我家五口人每逢这个季节来临都{CQ会}一起去到郊外赏樱花。,200104124525200215,日本,2,200104,一封写给父母的信,75,75,85,70,85,380,B,
我的留学生活快要结束了。,200104124525200240,日本,2,200104,一封写给父母的信,70,65,68,63,76,328,C,
我平时很少写信给你们，所以有点儿不好意思{CD了}，不知道谈什么才好。,200104124525200273,日本,2,200104,一封写给父母的信,65,90,79,80,81,386,B,
那时候我弟弟上的高等学校不在{CD于}我们家的附近，他住在学校里，所以只能一个月一次回{CJ+buy到}家{CLH}{CD里}。,200104124525200318,日本,2,200104,一封写给父母的信,75,65,66,49,40,282,未参加,
今天弟弟该考大学了吧？,200104124529200335,泰国,2,200104,一封写给父母的信,65,70,55,28,40,244,未参加,
如果你们{CC您们}能抽出一点时间，我很想要你们{CC您们}参加这次的毕业典礼，并与我在北京感受{CC享受}外国留学生的毕业气氛。,200104124529200338,泰国,2,200104,一封写给父母的信,70,90,60,42,65,320,C,
我无话可说了，祝你们身体健康，过美好的日子。,200104124540200352,印度尼西亚,2,200104,一封写给父母的信,75,85,38,37,42,270,未参加,
在韩国读书时，{CJ-zhuy我}常常听不懂，而且不敢开口。,200104124523200369,韩国,2,200104,一封写给父母的信,70,60,63,56,67,301,C,
妈，为我高兴吧？,200104124523100447,韩国,1,200104,一封写给父母的信,80,85,49,65,74,347,C,
周末的时候，跟中国朋友一起学习。,200104124523200454,韩国,2,200104,一封写给父母的信,65,80,27,23,33,216,未参加,
但不要担心，{CD却}现在已经习惯了。,200104124525200459,日本,2,200104,一封写给父母的信,65,65,41,65,45,265,未参加,
我的简历是：一九八九年长[F長]崎大学中文系毕业{CD了}；[BC，]一九八九年九月考入{CC入学}复旦大学经济系[BQ；]一九九二年七{CC7}月准备回日本，(但是如果贵公司雇我的话，我还可以在中国生活[BQ。])[BD，]上面曾说过了，上大学时，{CQ工作了}四年{CJX}作为临时工[BD，]在较大的时髦服装店。,199200204525200034,日本,2,199200,一封求职信,,,0,0,0,0,未参加,
在法国{CJ-zhuy我}努力{CC猛烈}地学习，还能说法语了。,199200008525200014,日本,2,199200,一封求职信,,,0,0,0,0,未参加,
所谓万物之灵长的生命能用自己的判断来决[F決]定的吗？,199604123523100236,韩国,1,199604,如何看待“安乐死”,70,60,77,61,67,319,C,
他不是已经被判死{CJ-zxy刑}了吗？,199604123540200319,印度尼西亚,2,199604,如何看待“安乐死”,70,70,63,69,70,328,C,
医学的技[B记]术为什么需要进[C]步呢？,199604123523100208,韩国,1,199604,如何看待“安乐死”,60,60,63,42,52,259,未参加,
反过来想一想[BQ，]如果你是病[C]人[BQ，]你愿意怎么样？[BC.],199604123523100213,韩国,1,199604,如何看待“安乐死”,65,60,50,49,49,256,未参加,
中国俗话中“人命在天”就是人的生命是不能掌握在{CC3管理}一个人的手里的意思[BQ，]东方国家的思想中人的生命是一种神奇和神秘的东西{CC思想}。[BQ.],199604123523100246,韩国,1,199604,如何看待“安乐死”,60,60,42,49,34,227,未参加,
因为人的生命是上帝给我们的，所以我们没有权利扔掉我们的生命。,199604124523100235,韩国,1,199604,如何看待“安乐死”,85,60,79,81,77,370,C,
总之，我觉得法院的决定是对的，但是将[C]来如果人们支持安乐死的现象，法律也{CJ-sy会}有改变。,199604123525100218,日本,1,199604,如何看待“安乐死”,65,65,53,47,42,256,未参加,
从{CC在}法律上来说他故意杀的妻子{CJs}，虽然{CC无论}是他的妻子要求他伤害她，他是死者的丈夫，妻了得了一种不能治好的病，十分痛苦，[BC。]{CQ但}他也不能干这些事儿。,199604123529200193,泰国,2,199604,如何看待“安乐死”,70,60,29,47,47,237,未参加,
有的患者不能自己自杀，不得不请别人帮助自杀。[BC.],199604123525200242,日本,2,199604,如何看待“安乐死”,65,60,58,57,75,298,C,
虽然法律上不承认，法院认为[C]是{CD个}故意杀人罪，可是先得了解本人和家[C]里人的痛苦。,199604123523200145,韩国,2,199604,如何看待“安乐死”,60,60,58,61,44,265,未参加,
那么[F麽]，当[F當]然要靠两[F兩]代人或三代人之间的通力合作，才能{CD达[F達]到}使{CC令}代沟在家里[C]消失得无[F無]影无[F無]踪。,199610802801200014,澳大利亚,2,199610,如何解决“代沟”问题,85,85,73,75,84,397,B,
利用“对话”来交换了解对方[C]和先辈或晚辈的话[C][BQ，]可能全世界哪里都{CC1一定会}找不到“代沟”问题呢。,199610550523190005,韩国,1,199610,如何解决“代沟”问题,65,70,62,73,59,315,C,
但是他满不在乎。,199610550523190013,韩国,1,199610,如何解决“代沟”问题,60,65,75,67,59,309,C,
我看，代沟[C]{CJX}解决的最好的方案是相互理解，相互协助[BQ。],199610550523290009,韩国,2,199610,如何解决“代沟”问题,65,50,54,55,65,270,未参加,
以前也有{CD了}代沟。,199610550523190055,韩国,1,199610,如何解决“代沟”问题,70,75,0,50,53,237,未参加,
所以在家庭生活方面{CJ+zxy的看法}，这个问题[F題]是{CD在}父母跟儿子的谈得不够{CJX}的原因。,199610550523190062,韩国,1,199610,如何解决“代沟”问题,55,60,44,34,41,215,未参加,
他们[C]的思想受到{CC收到}时代的影响。,199610550523290060,韩国,2,199610,如何解决“代沟”问题,65,60,49,50,53,260,未参加,
可是长辈{CD是}不{CD爱}喜欢新潮[B朝]流，那么怎样解[C]决呢？[BC，],199610550523290077,韩国,2,199610,如何解决“代沟”问题,65,55,54,57,65,278,未参加,
如果我的太太{CQ能}更{CQ地}学{CJ-buy会}好{CJX}我母亲想传授{CC传达}的做菜的秘诀，[BC、]代沟的感觉也不会这么大，而且对别的问题也{CJX}双方能宽容些。{CP总而言之，我认为代沟问题不是简单{CD地},199611543525100511,日本,1,199611,如何解决“代沟”问题,85,75,60,73,76,361,B,
其中一个队员细声对我说：“我家里的厕所都没洗过，这几个抽水马桶，就由{CC有}你来清洗吧。,199603533533100025,新加坡,1,199603,由“三个和尚没水喝”想到的……,85,85,49,76,77,367,C,
人，是高等动物，很多动物的优点却是我们人类无法比拟的，狗的忠诚，牛、马的任劳任怨，[BC、]蜜蜂、蚂蚁的群策群力，想起{CJ-by这些}我们都会感到汗颜。,199603533533200028,新加坡,2,199603,由“三个和尚没水喝”想到的……,90,90,49,70,99,396,C,
{CQ然而}时时刻刻想占别人便宜的人，却{CC也}可信手拈来。,199603533533200028,新加坡,2,199603,由“三个和尚没水喝”想到的……,90,90,49,70,99,396,C,
而以三个和尚来看呢，如果第一个和尚在第二与第三和[D和]尚分别到来后，还肯牺牲小我[BQ，]{CD的}去挑水来喝，为大伙儿设想的话，这样就不会导致{CC导使}彼此间推卸职责，[BC、]总也希望{CC巴望}别人先去作，到头来反而没水喝了，这多么可悲可叹呀！,199603533519100039,马来西亚,1,199603,由“三个和尚没水喝”想到的……,75,70,63,72,87,356,C,
那么，人多时，不但好办事，也能办得更好，更快，所谓[BD，][BQ“]团结就是力量[BQ”]。,199603533533200090,新加坡,2,199603,由“三个和尚没水喝”想到的……,90,90,66,70,87,401,B,
为什么这么快就想到这种负面价值观的词呢？,199604680519100514,马来西亚,1,199604,由“三个和尚没水喝”想到的……,65,85,69,79,100,388,C,
从小的方面来看，这样影响我们每天工作学习的日程；从大的方面来看，会{CC能}耽误社会发展进程。,199605104634200038,英国,2,199605,由“三个和尚没水喝”想到的……,90,70,63,74,87,377,C,
想起来了一个成语：[BC。]爱莫能助{CC爱能助莫}。,199605104523100047,韩国,1,199605,由“三个和尚没水喝”想到的……,65,60,35,56,46,245,未参加,
三个和尚都不愿意到山底下挑水喝，{CQ于是}很慎重地{CJ-sy进行}选择{CJX}{CJ+buy下去}了。,199605104523200056,韩国,2,199605,由“三个和尚没水喝”想到的……,70,55,85,60,68,322,C,
古时[C]候，在{CC有}一座高山山顶{CQ上}有一座庙{CC1庙子}。{CP有一个叫甲的和尚想：“因为山上没有龙[C]提水{CY},199605104525100085,日本,1,199605,由“三个和尚没水喝”想到的……,65,50,41,38,49,224,未参加,
水没[C]了。,199605104523100128,韩国,1,199605,由“三个和尚没水喝”想到的……,60,65,66,56,72,302,C,
每{CC个}个人研究自己有兴趣的事情，把知道的内容在每周一次的活动中{CC时}发表{CJ-buy出来}。,199605104525100177,日本,1,199605,由“三个和尚没水喝”想到的……,65,70,66,74,65,326,C,
还有人多就没有水喝了，[BC。]他们在这里生活{CQ得}很不错，不愿意因为水找去{CJX}别的地方，不想离开这儿。,199605104523200189,韩国,2,199605,由“三个和尚没水喝”想到的……,65,50,46,40,44,226,未参加,
那时候，我也才想起来了以前我母亲告诉我的一句话，“比你健康、身体{CC身材}好的人很多，为什么你常常去献血？,199605104525200185,日本,2,199605,由“三个和尚没水喝”想到的……,65,65,55,63,56,288,C,
有的人去山下抬水，有的打扫寺庙{CC庙里}，[BC。]在参拜[C]者的帮助下，这座庙也越来越好了。{CD还是},199605104525100245,日本,1,199605,由“三个和尚没水喝”想到的……,65,50,38,51,39,224,未参加,
第一，是因为很多人在一起的时候，做[B作]任何决定用的时间{CQ都}太长了，而且很难找到一个适合大家的办法。,199605104633200268,意大利,2,199605,由“三个和尚没水喝”想到的……,65,55,60,45,37,244,未参加,
人少了就{CJX}每一个人的生活水平提高了。,199605104633200268,意大利,2,199605,由“三个和尚没水喝”想到的……,65,55,60,45,37,244,未参加,
三位和尚中{CQ的}一位是每天都要到山底下自己挑水喝{CJsd}，[BC。]但他越来越生气了。,199605104523100275,韩国,1,199605,由“三个和尚没水喝”想到的……,60,55,24,29,23,172,未参加,
我们应该不是为了自己，而是为了别人，我们的{CD心理上的}个人主义心理应该摒除{CC扔掉}。,199605104523200273,韩国,2,199605,由“三个和尚没水喝”想到的……,60,65,49,54,58,269,未参加,
但是原来是小学生，自己喜欢的菜自己盒[B皿]子里放了多{CJX}一点，自己不爱吃的菜自己盒[B皿]子里放了少{CJX}一点。,199605104525100348,日本,1,199605,由“三个和尚没水喝”想到的……,50,50,46,42,39,205,未参加,
什么事情都靠别人来做。,199605104525200375,日本,2,199605,由“三个和尚没水喝”想到的……,65,70,77,60,80,338,C,
可是{CQ在}那么多的高山当中，后来来到那座庙的另外两个和尚为什么偏偏来{CJ-buy到}了那座庙呢？,199605550523290043,韩国,2,199605,由“三个和尚没水喝”想到的……,65,75,80,60,75,342,C,
世世代代……[BC…],199605550523290072,韩国,2,199605,由“三个和尚没水喝”想到的……,60,55,38,45,44,223,未参加,
