错句,作文编码,国籍,性别,考试时间,作文题目,口试分数,作文分数,听力分数,阅读分数,综合分数,总分,证书
不是因为她长得老而显得像[B象]妈妈辈儿的人而这样说，而是因为她对我这个妹妹的关心和爱护以及无私的付出[BQ，]致使别人看{CC认}不出她只是一个与妹妹和睦相处的姐姐[BQ，]而竟误认为她是我的亲生妈妈。,199704123523200139,韩国,2,199704,记对我影响最大的一个人,75,80,53,73,68,340,C,
学校放假，我们16家的“小鬼”总有做不完的玩艺儿，像踢球啦，[BC、]跳绳啦，[BC、]捉迷藏啦，我们都做过了。,200110540540150053,印度尼西亚,1,200110,我的童年,70,85,82,70,92,391,B,
我的童年{CD的}时代，{CD那个年代}[BD，]没有电脑游[Y遊]戏机，凡是高科机的游戏都没有。,200110540540250060,印度尼西亚,2,200110,我的童年,80,90,55,47,85,352,未参加,
母爱——那时我小小心灵也已感觉出呢！,200110540540250064,印度尼西亚,2,200110,我的童年,70,90,77,63,83,376,C,
不过我还小的时候还记得我的奶奶。,200110540540150071,印度尼西亚,1,200110,我的童年,65,85,52,49,58,299,未参加,
因为我的身边有爸爸、妈妈和兄弟姐妹，他们都爱我，尤其是我的爸爸，他老人家常常带我到城里去看望他的朋友们，因那时我们是住在乡村里。,200110540540250076,印度尼西亚,2,200110,我的童年,70,90,36,47,76,312,未参加,
同时，他还答应我，如果我们的学业成绩好，他将买更多的好书供我们阅读。,200110540540250147,印度尼西亚,2,200110,我的童年,70,95,60,63,88,369,C,
又由于我本身性情爽朗，爱说笑话，唱歌弹吉他都行，所以每次全旅游团{CC旅游全团}的人总是趁兴而来尽兴而归。,199312533540100100,印度尼西亚,1,199312,一封求职信,90,90,71,78,87,414,A,
此外，本人也为酒店促进其与其他同行的交流。,199312533533200152,新加坡,2,199312,一封求职信,75,80,62,58,73,339,C,
说外语也可以。,199312124525200151,日本,2,199312,一封求职信,45,45,18,27,45,154,未参加,
我在大学专门学习经济，除此之外，还研究过广告设计，我对广告方面很感兴趣，因此，毕业以后在一家公司里专门设计广告。,199312123525200401,日本,2,199312,一封求职信,60,70,57,54,62,288,未参加,
我性格开朗[B郎]，爱活动，爱说话。,199312123525200403,日本,2,199312,一封求职信,70,50,60,52,45,260,未参加,
我是一个二十岁的男子{CC男的}，[BC。]现在我在找工作。,199312123525100701,日本,1,199312,一封求职信,60,45,41,41,39,204,未参加,
这是我的简历。,199312123525200905,日本,2,199312,一封求职信,65,55,46,36,36,220,未参加,
我爸很快就变成百万户。P},199412123606100012,比利时,1,199412,记我的父亲,55,65,54,36,37,229,未参加,
他常常[C]生我的气。,199412123525200073,日本,2,199412,记我的父亲,60,60,54,63,67,286,未参加,
我父亲，{CP他虽然没挣过很多钱，也没得过社会的{CJ-dy好}名声，我尊敬他。[BC.],199412124523100002,韩国,1,199412,记我的父亲,70,75,81,71,78,364,B,
虽然我已经这么大{CC1长大}了{CC的}，但是我只能听父亲{CD的}讲道理，没提过我的想法。,199412124523200039,韩国,2,199412,记我的父亲,60,65,57,48,53,266,未参加,
我来中国留学已经三年了，这三年的时间里，我回了三次国，[BC。]一次大概停留一个月。,199412124525200044,日本,2,199412,记我的父亲,55,75,62,55,45,277,未参加,
他在公[C]司里对部下比较严格。[BC，],199412124523100052,韩国,1,199412,记我的父亲,70,55,57,46,57,269,未参加,
听说她自杀[F殺]了。,199412104523200654,韩国,2,199412,记对我影响最大的一个人,60,65,68,65,57,298,C,
除了建筑[F築]用的玻璃以外，汽车用的玻璃、电视机用的玻璃为主[BQ，]所有的玻璃都坏[F壞]了。,199412104525100665,日本,1,199412,记对我影响最大的一个人,65,65,54,73,53,294,C,
就是看我们生活太辛苦{CJ+zxy的样子}[BQ，]有人对父母说，[BQ“]我可以帮助你们。[BQ”],199412104525100649,日本,1,199412,记对我影响最大的一个人,60,60,39,48,57,246,未参加,
他是一个大学[F學]生，是这家公司的人事部主任。,199412104625200367,葡萄牙,2,199412,记对我影响最大的一个人,65,65,57,69,69,309,C,
战争结束以后，他的父亲摆脱不掉{CC4离不开}失去妻子的悲哀，就{CJX}不久也去世了。,199412104523100633,韩国,1,199412,记对我影响最大的一个人,65,55,73,65,61,301,C,
我不知道有什么原因。,199412104523200628,韩国,2,199412,记对我影响最大的一个人,80,75,70,55,63,334,C,
结果[BD，]被揭穿{CC拆穿}。,199500533533100028,新加坡,1,199500,记对我影响最大的一个人,90,70,83,55,74,365,C,
现在的我已[B己]不在[B再]文与商之间徘徊。,199500533533200035,新加坡,2,199500,记对我影响最大的一个人,85,75,73,73,90,388,B,
每次要交的作业就这样过关了。,199500533533200098,新加坡,2,199500,记对我影响最大的一个人,90,90,57,69,84,388,C,
你应该承认错误，以后不可再这么做{CQ了}。,199500533540200112,印度尼西亚,2,199500,记对我影响最大的一个人,65,65,75,73,82,344,C,
虽说我现在仍是一个很平凡很平凡的小女人，但过去的际遇使我永难{CC不}忘怀。,199500533533200126,新加坡,2,199500,记对我影响最大的一个人,90,80,70,59,78,372,B,
在我五岁那一年，我爸爸妈妈不知是为了什么事而离了婚。,199500533533200134,新加坡,2,199500,记对我影响最大的一个人,95,70,68,38,55,320,未参加,
每逢客人来[F來][BQ，]我们[F們]兄妹三人就[B最]得挤[F擠]在一张[F張]小床上，常为[F為]此生病不能上[C]学[C]。[BC，],199510512501100507,中国,1,199510,记对我影响最大的一个人,90,95,55,48,82,368,未参加,
贪[F貪]玩的我在门[F門]前的杨[F楊]桃树[F樹]{CQ上}爬上爬下，以前虽有人警告过[F過]我，但我常当[F當]做耳边[F邊]风。,199510512501200511,中国,2,199510,记对我影响最大的一个人,90,90,79,66,82,405,B,
不能生活的时候，早点儿让他们死。,199510550523100908,韩国,1,199510,如何看待“安乐死”,75,65,40,44,35,246,未参加,
在这个[F個]世纪初，{CJ+zhuy那时候}医学[F學]没有现在这样先进[F進]{CD的时}，根本就没有“安乐[F樂]死”这个[F個]名词。,199511543501100511,中国,1,199511,如何看待“安乐死”,80,90,79,73,93,410,B,
因为[F為]要求“安乐死”的人大都在死亡的边缘，他们[F們]可能在表达自己的意思上有困难[F難]，而在进行“安乐死”的过程中，也可能没有别人在场[C]，所以在法律的观[C]点上，是很难[F難]证明{CJsd}。[BC，],199511543634200564,英国,2,199511,如何看待“安乐死”,80,85,76,62,88,385,B,
然而，我认[F認]为[F為]“安乐[C]死”在某些情况下是可行的。,199511543501200572,中国,2,199511,如何看待“安乐死”,75,85,40,68,61,322,未参加,
，如果{CC2如}我能担任{CC担上}贵{CC该}公司的广告设计师，{CJ+zhuy本人}必定全力以赴，一定做得最好！,199503682519200517,马来西亚,2,199503,一封求职信,90,85,69,77,95,413,B,
本人现急需这份工作，因家中尚有妻儿要养，希望您能够早日答复{CC覆信}。,199503680519100521,马来西亚,1,199503,一封求职信,80,75,71,70,77,364,B,
所以虽然我很爱我妈，可是一直害怕她的性格[BQ。]我妈这样抚养我{CJX}了。[BC.],199505550523200911,韩国,2,199505,记对我影响最大的一个人,70,65,62,57,39,279,未参加,
母亲先教我读汉语拼音，再认汉字。,199505529529200035,泰国,2,199505,学习汉语的苦与乐,90,95,76,81,99,439,A,
我认[C]为，他对工作，家庭的热情告诉我做什么事情{CJ-zy都}不应该忘[C]记“认真”。,199505104525200023,日本,2,199505,记对我影响最大的一个人,65,80,52,61,65,311,C,
其中，我想[C]要写对初中老师{WWJ}。,199505104523100051,韩国,1,199505,记对我影响最大的一个人,70,60,54,55,37,261,未参加,
在小学的那段时间里，由于我母亲不停的教诲，使得现[C]在的我，不管是在语言上还是精[C]神上，都是一个完整的韩国人。,199505104523100092,韩国,1,199505,记对我影响最大的一个人,80,90,81,73,82,401,B,
好好加油吧！,199505104523200093,韩国,2,199505,记对我影响最大的一个人,80,80,65,50,51,318,C,
因为我的祖父母在北京生活过十几年。,199505104525200115,日本,2,199505,记对我影响最大的一个人,50,70,44,61,49,257,未参加,
她想干什么，就按自己的想法去{CC来}干什么。,199505104523200154,韩国,2,199505,记对我影响最大的一个人,60,80,70,75,53,325,C,
她经过失恋[C]，结婚，战争以后便成了一个事业性很强，很有主见的女强人。,199505104523200165,韩国,2,199505,记对我影响最大的一个人,60,60,68,67,59,296,未参加,
母亲听到自己的病情很严重，哭了好几周。,199505104525200182,日本,2,199505,记对我影响最大的一个人,75,90,70,61,61,351,B,
他分在我{CD的}前面的位置，始终笑容满面，教我工作的方法[W2ABC]。,199505104525200245,日本,2,199505,记对我影响最大的一个人,70,60,68,65,63,311,C,
我[C]的性格多半是他给{CC省}的[C]。,199505104525100297,日本,1,199505,记对我影响最大的一个人,70,55,62,69,67,307,C,
他回忆[C]{CJ-buy起}那时候{CC时[C]代[C]}，曾经对[C]我说{CJ+buy过}：“我作为农民[C]出生在人间，离开土地怎么能活着呢，农民[C]生产人吃的，那么吃的不足是能[C]怪农民[C]不努力工作的。{CJsd},199505104525100301,日本,1,199505,记对我影响最大的一个人,75,55,41,63,72,291,未参加,
犹记得念中学时，我这个一见数理科就头疼、[BC，]大叫饶命的黄毛丫头，对那永远难以理解、[BC，]纠缠不清的数学符号总是退避三舍。,199508680519200537,马来西亚,2,199508,记对我影响最大的一个人,90,90,83,77,84,422,A,
就因为这样，我每当看到乞丐也会给钱。,199508682519200545,马来西亚,2,199508,记对我影响最大的一个人,85,85,78,71,84,398,B,
我回头看桌上相架里的照片，相片[L]中的人是我一生里最尊敬的父亲，他是影响我最大的一个人。,199508683519100550,马来西亚,1,199508,记对我影响最大的一个人,85,85,86,81,82,414,A,
离[F離]婚现[F現]在好像已不是什么[F麽]大事了，在澳州的离[F離]婚率达[F達]五成，那是相当[F當]惊人的数[F數]字。,200010602543250005,香港地区,2,200010,我对离婚问题的看法,90,85,83,80,93,428,A,
恢复自然环境的方案当中，用优美的自然之声来代替噪声的想法听起来很新鲜。,200005108523200280,韩国,2,200005,关于用自然之声取代噪声的建议,70,75,83,90,72,379,B,
最近环境保护部门建议，征集几十种动听的自然之声，以取代生活中经常听到的声音。,200005108525100318,日本,1,200005,关于用自然之声取代噪声的建议,70,70,64,80,89,361,C,
因为[F爲]性格相反是很难[F難]找到话[F話]题[F題]，而进[F進]一步去了[F瞭]解对[F對]方{CJs}。,199711801801100019,澳大利亚,1,199711,我选择朋友的标准,75,75,71,45,37,293,未参加,
不过郊区生活没有城市那么方便.在城市我觉得好像没什么东西买不到的，可是在郊区，因为离城市很远，想买也没有东西。,199705104525100004,日本,1,199705,我的城市/乡村生活,75,65,52,65,68,312,C,
我没有住在乡村的经验，不过可以猜一下因为我母亲是从农村嫁给父亲来的。,199705104525200001,日本,2,199705,我的城市/乡村生活,65,75,55,67,61,310,C,
我认为城市生活和乡村生活有很多区别。,199705104523100019,韩国,1,199705,我的城市/乡村生活,65,70,66,60,46,293,C,
冬天我还到小河，跟朋友们一起滑冰，下了雪，我们在那辽[B了]阔的水田上打雪仗。,199705104523100071,韩国,1,199705,我的城市/乡村生活,60,60,66,79,70,317,未参加,
差不多在家呆了一个多月，我那时真的很伤心。,199705104525200082,日本,2,199705,我的城市/乡村生活,50,55,69,90,87,330,未参加,
我的家乡四面环绕着大海{CJbei}，从任何地方{CC2地}看{CQ都}能看到蓝色的大海。,199705104523200098,韩国,2,199705,我的城市/乡村生活,70,65,58,56,70,305,C,
我跟朋友夏天在河里游泳、钓[B掉]鱼。,199705104523200135,韩国,2,199705,我的城市/乡村生活,70,65,46,54,44,265,未参加,
那种妈妈的味道，对孩子来说永远也忘不了。,199705104523100173,韩国,1,199705,我的城市/乡村生活,60,40,13,42,32,164,未参加,
而不怕挫折的人，大多数[F數]是在{CC从[F從]}现[F現]实[F實]生活中成长[F長]，他们[F們]在[F現]实[F實]的齿[F齒]轮[F輪]下不断[F斷]进[F進]步;他们[F們]知道齿[F齒]轮[F輪]会[F會]把自己淘汰出社会[F會];他们[F們]知道失败[F敗]不怕，但是失败[F敗]后[F後]，留在原地才可怕;他们[F們]知道要找出为[F爲]什么[F麽]失败[F敗]，下一次才会[F會]成功或增加成功的机[F機]会[F會]。,199810602801150005,澳大利亚,1,199810,如何面对挫折,65,70,76,73,66,336,C,
首先我觉得写汉字很有意思，然后我发现了写汉字很麻烦，很多词我不知道怎么写，也有很多字我不知道怎么念，已经学过的字我很容易忘记，所以我每天要复习和学习写字。,199804123623200053,南斯拉夫,2,199804,学习汉语的苦与乐,70,65,42,45,46,254,未参加,
不过，正因为汉语这些特性{CC独特}而让人学来趣味无穷。,199804123542100058,越南,1,199804,学习汉语的苦与乐,90,90,69,89,99,435,B,
所以我觉得在口语方面有一点儿差，所以最近我一般跟中国朋友去玩一玩儿{CJcd}，我觉得学习一种语言是很不容易的。,199804123523200179,韩国,2,199804,学习汉语的苦与乐,65,65,42,45,38,239,未参加,
留学生生活当中发生了很多事情，对我来说，学习汉语是很有意思的，刚来的时候连一句话都不会说，只能说[BQ“]谢谢[BQ”]、[BC，][BQ“]你好[BQ”]……[BD。]可现在怎么样？,199804123523100216,韩国,1,199804,学习汉语的苦与乐,75,55,45,49,56,265,未参加,
特别是放[B方]假回国的时候，[BC。]如果电视上有香港[B卷]歌手等来访[B方]韩时一个翻译[Pyī]的翻译[Pyī]之前我已经听懂的告诉妹妹{CJba}。,199804123523200225,韩国,2,199804,学习汉语的苦与乐,75,75,48,59,40,287,未参加,
学习汉语是妈妈的希望。,199804123523200240,韩国,2,199804,学习汉语的苦与乐,70,65,30,49,36,236,未参加,
学习汉语中最难的还是发音，[BC。]跟中国朋友聊天的时候，他们一听我说的话就知道我是日本人，[BC。]就是{CQ因为}发音的问题。,199804123525200249,日本,2,199804,学习汉语的苦与乐,65,75,51,54,44,276,未参加,
刚刚开始学发音与语调，对我个人来说最难。,199804124523100489,韩国,1,199804,学习汉语的苦与乐,70,65,69,52,60,302,C,
有一天他把他的名字和电话号码写给我{CD了}。,199804123525200493,日本,2,199804,学习汉语的苦与乐,70,60,57,71,46,289,未参加,
而我，在面对挫折时，便选择了后者。,199904123801200051,澳大利亚,2,199904,如何面对挫折,90,85,89,85,91,437,A,
后来家里人的关系也越来越疏远，[BC。]妈妈更背着爸爸跟别的人走了。,199904123801200051,澳大利亚,2,199904,如何面对挫折,90,85,89,85,91,437,A,
不要相信命运。,199904123525100097,日本,1,199904,如何面对挫折,65,70,53,60,63,297,C,
怀着这样的想法再{CQ在}前进{CJX}生活中，最终就成为生活的强者。,199904123523200213,韩国,2,199904,如何面对挫折,65,65,42,52,54,262,未参加,
很多卖菜的人都是看着我{CJs}，我很不好意思，我想赶快离开这儿但走不动，我该怎么办呢？,199904123523200252,韩国,2,199904,如何面对挫折,65,60,45,52,26,231,未参加,
人在生活中遇到困难和挫折是不可避免的。,199904124623200296,南斯拉夫,2,199904,如何面对挫折,65,75,75,57,80,339,C,
