错句,作文编码,国籍,性别,考试时间,作文题目,口试分数,作文分数,听力分数,阅读分数,综合分数,总分,证书
我们是地球人，应该考虑地球{CQ上}的朋友才对。,200307109525200166,日本,2,200307,绿色食品与饥饿,65,70,75,59,61,316,C,
我拿环境的重要性来讲，说说{CC说了}我{CQ的}想法的原因。,200307109523200189,韩国,2,200307,绿色食品与饥饿,60,60,67,49,76,294,未参加,
有一次{CC天}，我为了减肥，饿过三天，饿得快要疯掉了。[BC.],200307109523100222,韩国,1,200307,绿色食品与饥饿,65,80,43,51,58,285,未参加,
农作物对环境的影响，这[C]是近[C]二十年来为世界所关注的焦点。,200307109523100305,韩国,1,200307,绿色食品与饥饿,60,85,59,51,70,314,未参加,
为什么？,200307109523100307,韩国,1,200307,绿色食品与饥饿,60,65,43,49,32,232,未参加,
有些消费者只购买[BQ“]绿色食品[BQ”]，没有安全标志的食品宁可{CC宁肯}不买。,200307109525200348,日本,2,200307,绿色食品与饥饿,70,95,78,67,99,402,B,
所以我们都多用[B甲]绿色食品。[BC.],200307109523200404,韩国,2,200307,绿色食品与饥饿,60,55,46,49,38,229,未参加,
逐渐[B掀]人们{CQ开始}关注{CD着}自己的健康。,200307109523200411,韩国,2,200307,绿色食品与饥饿,60,50,38,30,38,196,未参加,
这样一来，有钱人一边{CJX}能吃绿色食品、不担心自己的健康，一边{CD能}帮助挨饿的人。,200307109523100468,韩国,1,200307,绿色食品与饥饿,65,70,78,64,64,327,C,
我想应该{CJ+zy要}{CJX}适当合理的做法是最好的方法。,200307109525100531,日本,1,200307,绿色食品与饥饿,70,60,72,72,76,335,C,
在这样的经济[C]{CJ-zxy状况}下，[BC、]完全不用农药的非常贵{CC1价[C]钱[C]}的食品被很受欢迎{CJZR}。,200307109525200564,日本,2,200307,绿色食品与饥饿,75,55,75,59,70,319,C,
“绿色食品”是用未经污染的农产品加工的食品，[BC、]因为没{CC无}用化肥和农药，[BC、]所以产量比较少。,200307109523200574,韩国,2,200307,绿色食品与饥饿,65,50,59,30,35,220,未参加,
世界上有两种农作物，使用化肥和农药的和不使用的。,200307109523200604,韩国,2,200307,绿色食品与饥饿,75,75,75,59,56,330,C,
现代人对健康非常敏感。,200307109525200624,日本,2,200307,绿色食品与饥饿,60,70,56,49,56,276,未参加,
这{CD是}[BD，]不是个人的问题。{CP全世界上的人都吃污染食品，不限于自己、[BC，]子女，[BC、]甚至孙子也可能受到深刻的影响，[BC。]可能引起人类生存能力的降低，人口减[C]少。P},200307217525200090,日本,2,200307,绿色食品与饥饿,65,60,54,59,58,279,未参加,
因为{CJ-sy种植}绿色食品的速[C]度比较慢。,200307217523200102,韩国,2,200307,绿色食品与饥饿,65,65,83,62,81,340,C,
不要提高价格，有什么办法给我们“绿色食品”呢？,200307217523100112,韩国,1,200307,绿色食品与饥饿,60,60,48,38,53,241,未参加,
第一个是大人应该教孩子。,200307204525200012,日本,2,200307,绿色食品与饥饿,60,60,40,43,53,238,未参加,
上述的内容是{CD为了}用化肥和农药[C][BD，]增加农作物量的一个方法。,200307204523100043,韩国,1,200307,绿色食品与饥饿,60,60,51,41,38,232,未参加,
相对来说{CC4相比说}不挨饿是第一位的。,200307204523100055,韩国,1,200307,绿色食品与饥饿,60,65,51,43,70,272,未参加,
，而是为了了解现在{CD的}全世界的饮食{CC2食}环境，我应该选[C]择[C]{CD了}“绿色食品”。P},200307204525200079,日本,2,200307,绿色食品与饥饿,60,80,70,59,64,320,C,
所[C]以我认为按照自己的生活条件、价值观{CC价值感}来选一个对自己最合适的答案,200307205525200026,日本,2,200307,绿色食品与饥饿,65,70,64,51,73,309,C,
相反的，我认为没有了健康{CD相似}{CD与}[BQ，]不能完完整整地度过[C]人生。,200307205533200027,新加坡,2,200307,绿色食品与饥饿,85,75,83,59,100,394,B,
现在世界上有很多人因缺少粮食而挨饿。,200307205523200074,韩国,2,200307,绿色食品与饥饿,70,65,56,49,61,287,未参加,
这样，岂不是成了人类食用自己制造出来的“毒药”了吗？,200307205523200141,韩国,2,200307,绿色食品与饥饿,85,80,72,70,99,399,B,
为了农作物的产量高，[BC.]很多农夫使用化肥和农药。[BC.],200307212523200009,韩国,2,200307,绿色食品与饥饿,70,60,64,56,61,296,C,
甚至在一个国家内，每家户也有这[C]样的现象。,200307212523200050,韩国,2,200307,绿色食品与饥饿,65,70,72,62,58,313,C,
俗话说：“身体是革命的本钱。,200307209523200005,韩国,2,200307,绿色食品与饥饿,70,70,70,59,67,324,C,
最后，我要说世界各个国家[L]的合作和团结的重要性。,200307209523100031,韩国,1,200307,绿色食品与饥饿,65,65,80,54,50,298,C,
如果现在赞同另一方的话，这[C]说明只考虑现在，不考虑我们[C]和后代的未来。,200307209523200029,韩国,2,200307,绿色食品与饥饿,60,65,80,72,90,350,C,
比如说有一个喜欢吃肉[BQ，]还有一个人喜欢吃各种素[B索]菜[BQ，][C]两个人比较的时候[BQ，]素[B索]菜{CJX}吃的人比吃肉的人{CJ+zy很}健[C]康[BQ，]因为绿色食品里面的各种材料是代替肉{CJsd}[BQ，]最后[B搂][C]我们的社会{CJX}看一看[BQ，]路上走的人是{CJX}大部分吃汉堡[B泡]和可乐[BQ，]这[C]样的食品是吃的时候好吃[BQ，]平常{CC平炉[C]}有{CJX}很方便[BQ，]但是吃以后呢?人们的身体{CD上}{CJX}给{CJ-sy带来}不好的影响[B象]。[BC.],200307201523100013,韩国,1,200307,绿色食品与饥饿,75,65,24,17,15,183,未参加,
所以人们发明的化肥和农药使用[B有]得{CC的}过多，后果对人没有{CC不}好处。,200307201523100049,韩国,1,200307,绿色食品与饥饿,60,60,70,41,56,269,未参加,
总之，“绿色食品”不如不挨饿重要。{CP解决饥饿的办法是一边降低粮食的价格，一边不用化肥和农药。这样的话能保证人们的健康而且能解决饥饿现象的。P},200307201523100067,韩国,1,200307,绿色食品与饥饿,65,65,70,70,84,338,C,
现在市场上最热卖[B买]的食品，[BC.]人们的环境污染的意识改变引起一种新的现象。[BC.],200307201523100097,韩国,1,200307,绿色食品与饥饿,60,60,64,46,38,250,未参加,
所以，更现实地来看，这吃“绿色食品”和“不挨饿”的选择问题，我的立场是选“不挨饿”一方。,200307201525100101,日本,1,200307,绿色食品与饥饿,65,70,62,54,81,318,C,
所以，为了给他们提供粮食，也不得不使用这些化肥和农药。,200307302523200049,韩国,2,200307,绿色食品与饥饿,80,75,75,62,93,376,B,
可是有些农村地区却得{CC受}不到食品，所以他们拨在地上的绿色草，把草在水里煮，然后就吃。{CJ+zhuy人},200307302523200056,韩国,2,200307,绿色食品与饥饿,75,60,67,54,70,312,C,
第二，饥饿的原因不是绿色食品。,200307206523200002,韩国,2,200307,绿色食品与饥饿,70,70,67,75,50,320,C,
大家都不知道这个问题什么时候才可以解决，所以到那时候，我们尽量想办法而解决问题。,200307206525200034,日本,2,200307,绿色食品与饥饿,65,80,67,51,70,321,C,
我可要[C]知道，[BC、]在这世上，[BC、]有多少孩子[L]们饿死。,200307215525150012,日本,1,200307,绿色食品与饥饿,70,75,70,70,87,361,B,
为什么？,200307215523150024,韩国,1,200307,绿色食品与饥饿,60,60,62,51,38,253,未参加,
没{CC未}来{CD到}中国之前我几乎没有听过“绿色食品”这个词，最近两三年我才听人家说过[C]。,200307332540100003,印度尼西亚,1,200307,绿色食品与饥饿,75,65,86,59,87,359,C,
男女同校，{CJ-zhuy他们}自幼一起长大，许[F許]多人正是在这[F這]种有利的条件下，种下爱苗，学成长大后[F後]，结婚成家的。{CD这[F這]个},200309529529151007,泰国,1,200309,我对男女分班的看法,60,75,41,49,79,290,未参加,
大家或许[F許]认[F認]为[F為]男女分班就不会胡思乱想，{CQ就会}专心于[F於]学业{CC课[F課]业[C]}，但是却[F卻]忽略{CC疏略}了学[F學]生的想法。[BC，],200309529529251009,泰国,2,200309,我对男女分班的看法,65,65,74,49,85,322,C,
但不是{CD我}全世界[B男]只有女人，那是不可能的。,200309529529251023,泰国,2,200309,我对男女分班的看法,60,65,55,44,56,263,未参加,
谁{CJ-zy都}{CJ+sy有}有爱和被爱的权利{CC权力}，[BC。]所以{CC就连}学生也应有这样的权利{CC权力}。,200310520520250007,蒙古国,2,200310,我对男女分班的看法,85,70,85,73,83,387,B,
上男女分班的学校是上名牌大学的捷径吗？,200310576525100021,日本,1,200310,我对男女分班的看法,60,70,49,70,67,301,未参加,
但人是应该恋爱的。,200310576525100029,日本,1,200310,我对男女分班的看法,50,70,36,35,45,219,未参加,
不然的话，学生很可能毁掉{CC限制}自己的将来、前途，[BC、]甚至事业{CC成功}。,200310576525100040,日本,1,200310,我对男女分班的看法,60,80,68,63,65,323,C,
所以我觉得把男女分开的想法就是不对的。,200310576525100056,日本,1,200310,我对男女分班的看法,65,60,27,44,56,235,未参加,
中等教育和高等教育{CD等}的[B得]目的是培养出新一代的年青人走进新社会工作，从而建设祖国。,200310602801250008,澳大利亚,2,200310,我对男女分班的看法,70,65,77,39,72,309,未参加,
因为我是爱好阅读的，不管是{CJ+sy阅读}报纸的新闻、经济还是{CC或者}小说，{CJ-zhuy我}都喜欢看，但是我最喜欢看的是小说。,200310540540250025,印度尼西亚,2,200310,谈有效阅读,65,80,43,44,70,290,未参加,
要真正做到“有效阅读”必须对书中章节做[B作]有效分析：哪些重要，哪些次要；[BC？]哪些急要，哪些不那么急要。[BC？],200310540540250048,印度尼西亚,2,200310,谈有效阅读,65,70,75,66,91,353,C,
我们跟着社会潮流一起走，也{CC又}就是说我们不会落后了。{CP为[F為]此{CD对},200310540540150061,印度尼西亚,1,200310,谈有效阅读,60,60,23,20,44,189,未参加,
这是我的看法和理由。,200310540540250078,印度尼西亚,2,200310,谈有效阅读,65,65,48,58,86,306,C,
男女分班的问题不只是在中国引起{CC吸引}了激烈的争论，[BC。]在英国的传统过去中，{CJ-zy也}有很多男女分班的情况。,200310650634150044,英国,1,200310,我对男女分班的看法,65,65,49,49,56,268,未参加,
但是学了两年汉语{CJ+zxy的那段时间}{CQ后}，我慢慢地发现我不{CC1不要}只是为了自己而学汉语。,200304131542200061,越南,2,200304,我学汉语是为了……,65,75,59,49,57,292,C,
由于我是印尼华人，因此我从小就{CD应该}学汉语，然而在我国，学汉语的环境不利。,200304131540200088,印度尼西亚,2,200304,我学汉语是为了……,75,65,65,38,57,287,未参加,
我来中国以后，对北京的印象{CC影响}非常好。,200304131540100202,印度尼西亚,1,200304,我学汉语是为了……,70,70,65,38,52,283,未参加,
其[B共]实我读的专业是冷门专业，跟汉语没有关系，[BC。]大学毕业[L]后又找不到好的工作。,200304131542200199,越南,2,200304,我学汉语是为了……,75,80,71,60,88,365,B,
我在泰国学了两个月汉语，[BC。]觉得{CD为什么}汉语怎么这么难。,200304131529200222,泰国,2,200304,我学汉语是为了……,65,70,53,52,52,278,未参加,
可那时候我只是坐着，因为电视里的节目我根本看不懂，[BC。]那电影里的人物讲的语言我从来没听过。,200304131540200243,印度尼西亚,2,200304,我学汉语是为了……,85,80,80,76,82,396,B,
因此，中国陆续{CC纷纷}出现了50多所女子中学，并且有某些中学进行男女分班实[B试]验的现象。,200306680519250003,马来西亚,2,200306,我对男女分班的看法,80,85,77,79,96,411,B,
理由有以下两点：㈠失去与异性相处及互相学习的机会。,200306680519250003,马来西亚,2,200306,我对男女分班的看法,80,85,77,79,96,411,B,
我的第一个反应：为何实施男女分班？,200306680519150045,马来西亚,1,200306,我对男女分班的看法,80,85,82,77,96,414,B,
应该消除放农药的方法。,200307271523100020,韩国,1,200307,绿色食品与饥饿,65,65,70,59,53,296,C,
这[C]个问题应该先从国家开始{CC起}解决。,200307271523200098,韩国,2,200307,绿色食品与饥饿,65,65,64,56,70,304,C,
还[C]有那样找绿色食品的人可能是比较有钱的人吧。,200307271523200104,韩国,2,200307,绿色食品与饥饿,65,65,62,49,64,289,C,
抽烟连不抽烟者也受到带来健康的影响{CJjy}。,200405109525200143,日本,2,200405,吸烟对个人健康和公众利益的影响,50,65,57,52,57,262,未参加,
大家都知道吸烟习惯对个人健康有不好的影响。,200405109525100190,日本,1,200405,吸烟对个人健康和公众利益的影响,75,75,45,73,64,322,未参加,
我要先看这个方法合适不合适。,200405109525100190,日本,1,200405,吸烟对个人健康和公众利益的影响,75,75,45,73,64,322,未参加,
总而言之，如果我们考虑{CJ-by抽烟问题}[BQ，]必须得考虑抽烟的各[B个]种影响。,200405109525200148,日本,2,200405,吸烟对个人健康和公众利益的影响,80,70,79,68,77,364,B,
得病的人吸烟的话很不好，[BC。]还有青少年养成良好的习[C]惯{CJX}一定要。,200405109523200317,韩国,2,200405,吸烟对个人健康和公众利益的影响,55,65,26,37,50,215,未参加,
对吸烟人来说很辛苦，但我觉得好。,200405109525200316,日本,2,200405,吸烟对个人健康和公众利益的影响,60,70,64,73,59,311,C,
所以，我[C]国最近{CJX}政府出台了一项规定，在公共场[C]所不能吸烟。,200405109523200351,韩国,2,200405,吸烟对个人健康和公众利益的影响,60,65,52,48,48,256,未参加,
警察{CC2警察员}在街上看看{CJcd}有没有边走边抽烟的人。,200405109525200477,日本,2,200405,吸烟对个人健康和公众利益的影响,70,70,76,68,66,338,C,
这意味着一个人不能控制自己了，这比对人体健康的直接影响还要[C]严重。,200405109523200607,韩国,2,200405,吸烟对个人健康和公众利益的影响,90,75,79,81,77,396,B,
因此，有的国家和{CC或}企业最近采取“在公共场所内不许吸烟[BD，]”的措施。{CP对这一个措施，我{CD一},200405109523100663,韩国,1,200405,吸烟对个人健康和公众利益的影响,65,60,57,33,57,255,未参加,
在全世界[BQ，]数以万[C]计的人因为吸烟导致的病[BD，]死亡。,200405109523200739,韩国,2,200405,吸烟对个人健康和公众利益的影响,70,65,69,54,59,303,C,
要是{CQ在}公共场所抽烟的人{CJgd}，就{CQ会}被罚款。,200405109523200739,韩国,2,200405,吸烟对个人健康和公众利益的影响,70,65,69,54,59,303,C,
现在吸烟的人不少，特别在中国还很多。,200405109525100939,日本,1,200405,吸烟对个人健康和公众利益的影响,90,70,64,64,64,345,C,
因为吸烟的人也具有吸烟的权力，[BC。]可是没有{CJX}别人也受{CC被}你影响{CC吸烟}的权力，[BC。]这是应该被罚款的事情。{CP我们国家也是这样的情况，对抽烟的人来说，越来越少{CC1没有},200405109523100992,韩国,1,200405,吸烟对个人健康和公众利益的影响,60,60,57,48,44,251,未参加,
因为吸烟的时候产生{CC发生}的烟气也会{CC1可以}影响到别人，[BC。]特别是[BD，]对非吸烟者来说这[C]种烟气难以忍受{CC2受不了}的{CJsd}。,200405109523201003,韩国,2,200405,吸烟对个人健康和公众利益的影响,70,65,55,56,55,287,C,
很多城市的政府己经开始{CJ-sy实施}禁止在公共场所{CD的}抽烟的措施。,200405109525101011,日本,1,200405,吸烟对个人健康和公众利益的影响,75,65,50,58,64,299,C,
但是现在的香烟{CJ+zxy的立场}是从老百姓到国王都喜爱的产品。,200405109525101032,日本,1,200405,吸烟对个人健康和公众利益的影响,45,60,40,52,50,226,未参加,
开会也不能缺少那支烟{CJ+zxy的原因}，我就几乎[B呼]放弃[B充]了呼吸{CC吸收}新鲜空气的幸福。{CP因为有些政府规定，在公共场所不允许抽烟，如果[L]抽烟要严厉地{CC的},200405109523201413,韩国,2,200405,吸烟对个人健康和公众利益的影响,60,70,67,46,57,285,未参加,
惩罚吸烟者，但因为国家政府{CD都}不能管理每一个吸烟者{CD的原因}[BQ，]在小{CD生活}单位里是没有什么效果{CJsd}P}。,200405109523201413,韩国,2,200405,吸烟对个人健康和公众利益的影响,60,70,67,46,57,285,未参加,
不论青少年或者[B着]老人和大人{CC5老大人}都按照禁烟规定不要吸烟。,200405109523101427,韩国,1,200405,吸烟对个人健康和公众利益的影响,55,60,38,41,35,210,未参加,
新闻{CD上}常常播出{CC到}没有吸烟的妇女[BD，]因丈夫得了肺癌[C]而死{CJ-zxy的消息}[BD……]。{CD吸},200405109523201430,韩国,2,200405,吸烟对个人健康和公众利益的影响,75,70,62,54,64,314,C,
罚{CD大}款是一件小事，人家担心的是[C]大家的健康，而不是要采取各种罚款措施要吸烟者的钱。,200405109523101450,韩国,1,200405,吸烟对个人健康和公众利益的影响,55,65,62,60,70,294,C,
”我觉得这种想法太目空一切了。,200405109525201501,日本,2,200405,吸烟对个人健康和公众利益的影响,65,60,28,58,44,238,未参加,
，而且在公共场所吸烟，这样对不吸烟者也有弊。P},200405109525201524,日本,2,200405,吸烟对个人健康和公众利益的影响,70,65,71,54,64,310,C,
如果真的是这样，那我们应该怎么办才好呢？,200405109523201527,韩国,2,200405,吸烟对个人健康和公众利益的影响,70,65,50,62,59,292,C,
，而且影[C]响{CJX}我吸烟的时{CJX}[C]我周围的朋友或者人家P}。{CP吸烟者每[C]一个人都有戒[Pjìan]烟的经验，但现在你们的书[C]包{CQ里},200405109523201560,韩国,2,200405,吸烟对个人健康和公众利益的影响,60,65,55,48,44,255,未参加,
吸烟是有害无益的，而且给社会的影响也不小{CC少}，所以我们人类都要重视吸烟带来的各种各样的事情。,200405109525101576,日本,1,200405,吸烟对个人健康和公众利益的影响,65,65,69,66,75,324,C,
以前，大部分男人吸烟。,200405109525201602,日本,2,200405,吸烟对个人健康和公众利益的影响,55,75,48,58,50,271,未参加,
我希望社会观[C]念一直提高{CD变}到任何地方也不许吸烟的[C]程度。,200405109523201823,韩国,2,200405,吸烟对个人健康和公众利益的影响,65,75,83,68,53,331,C,
我不抽烟，所以一闻{CC1呼[C]吸}烟味就很难受，整{CD个}天头疼、[BC，]头晕，[BC。]不想跟吸烟者一起活动，[BC。]还想远离{CC避免}有{CC吸}[C]烟空间，这是我的{CJX}不益利。,200405109523201827,韩国,2,200405,吸烟对个人健康和公众利益的影响,70,70,43,48,46,265,未参加,
目前，吸烟对社会的影响已经成了社会{CQ的}重要问题。,200405109523101888,韩国,1,200405,吸烟对个人健康和公众利益的影响,60,70,38,41,53,247,未参加,
所以女人更{CJ-sy应该}注意到这一点。,200405109523200027,韩国,2,200405,吸烟对个人健康和公众利益的影响,60,60,48,46,66,262,未参加,
我是不吸烟的，所以有不吸烟的权利和保护自己的健康的权利。,200405109525200588,日本,2,200405,吸烟对个人健康和公众利益的影响,70,70,60,81,68,337,C,
他得了肺癌以后才知道吸烟的危害性。,200405109523200623,韩国,2,200405,吸烟对个人健康和公众利益的影响,90,65,70,77,85,378,B,
这一新措施在人口密集的商业中心已开始实施。,200405109523201392,韩国,2,200405,吸烟对个人健康和公众利益的影响,75,70,78,81,75,368,B,
无论是什么原因，抽烟对个人健康来说是非常不好的。,200405109523201392,韩国,2,200405,吸烟对个人健康和公众利益的影响,75,70,78,81,75,368,B,
吸烟的时候吸烟者呼{CC吸}的烟比吸{CC收}的烟更不好，如果禁[B楚]烟者吸{CC收}这个烟的话，比吸烟者更不好的影响{CJbi}。,200405109523201396,韩国,2,200405,吸烟对个人健康和公众利益的影响,55,55,48,41,34,213,未参加,
但吸烟者该考虑其后果。,200405109525101405,日本,1,200405,吸烟对个人健康和公众利益的影响,85,80,82,75,85,400,B,
抽烟对肺等{CD所有的}部分不好。,200405109525200213,日本,2,200405,吸烟对个人健康和公众利益的影响,70,70,64,79,57,328,C,
听别人说，吸烟的原因很多。,200405109523100824,韩国,1,200405,吸烟对个人健康和公众利益的影响,70,70,57,39,45,269,未参加,
这样看来，这些规定对个人[BQ、]对公众利益有很多好影响。,200405204525200006,日本,2,200405,吸烟对个人健康和公众利益的影响,65,60,49,49,56,262,未参加,
但是我的观点{CC想法}就是，很同意这个规定。,200405204525200104,日本,2,200405,吸烟对个人健康和公众利益的影响,65,70,47,54,63,285,C,
他们虽然知道吸烟对个人身体有多坏，但是还是不能戒烟。,200405204525200240,日本,2,200405,吸烟对个人健康和公众利益的影响,70,60,17,42,61,235,未参加,
最近在日本很多香烟商{CD厂}销售{CC卖出}微{CC少}烟、[BC，]无味{CC少臭}的香烟。,200405204525200245,日本,2,200405,吸烟对个人健康和公众利益的影响,65,65,52,49,56,271,未参加,
吸烟对身体非常有害。,200405204525200278,日本,2,200405,吸烟对个人健康和公众利益的影响,60,70,36,37,51,239,未参加,
在所有的屋内公共场所不可以抽烟。,200405204525200338,日本,2,200405,吸烟对个人健康和公众利益的影响,65,70,58,61,61,301,C,
由此可见，{CJ+zhuy我们}{CJ+zy能够}{CJ+sy知道}该市的发展已经远远超过起步阶[B价]段。,200405204525200344,日本,2,200405,吸烟对个人健康和公众利益的影响,70,75,79,63,74,350,C,
而且吸烟者的形象{CC体面}也不好。,200405204525100356,日本,1,200405,吸烟对个人健康和公众利益的影响,65,50,38,35,47,216,未参加,
虽然有些人认为吸烟为了一时解闷{CJs}，减少生活上的种种压力，但看得远一点，还是{CJX}这种想法{CJ+sy是}不对的。,200405204525200415,日本,2,200405,吸烟对个人健康和公众利益的影响,65,60,63,61,65,297,C,
比如像[B象]这条消息一[L]样，在公共场所边走边[C]抽烟的人将被罚款。,200405204525200415,日本,2,200405,吸烟对个人健康和公众利益的影响,65,60,63,61,65,297,C,
让社会上的有良知{CC良识}{CQ的}成人，把自己的恶习惯{CJX}尽量不{CJ-zy要}给青少年看。,200405204525100435,日本,1,200405,吸烟对个人健康和公众利益的影响,60,80,66,56,70,319,C,
不过很多抽烟的人已[B巳]知道此习惯{CD之}有害，但因为上瘾{CC中毒}{CQ了}，戒不了烟。,200405204525200431,日本,2,200405,吸烟对个人健康和公众利益的影响,65,75,79,82,79,367,B,
有些人吸{CJ-buy完}后，还随地扔[B仍]烟头{CC2烟}。,200405204525100464,日本,1,200405,吸烟对个人健康和公众利益的影响,60,75,66,75,61,323,C,
抽烟时产生{CC出来}的烟不但危害抽烟者，还会危害周围的人的健康。,200405205525200102,日本,2,200405,吸烟对个人健康和公众利益的影响,60,85,55,61,70,320,未参加,
他一天从起来到睡[C]觉，几乎[B呼]放不下{CC3不放}烟。,200405205525200175,日本,2,200405,吸烟对个人健康和公众利益的影响,65,75,47,58,51,283,C,
“[BC「]大家都[B到]会这样的呀，你假如管我的话，每个人都要管的。,200405205525100211,日本,1,200405,吸烟对个人健康和公众利益的影响,65,75,47,37,49,260,未参加,
随着社会的进步我们对吸烟这件事情也有了较深的了解{CC理解}。,200405205525200196,日本,2,200405,吸烟对个人健康和公众利益的影响,60,85,68,58,88,348,C,
首先吸烟对个人健康无疑有害。,200405201525100074,日本,1,200405,吸烟对个人健康和公众利益的影响,70,80,66,44,63,313,C,
更不好的事{CJ-sy是}，旁边儿的人吸的烟比正在吸烟者吸的烟更有害[C]。,200405201525200224,日本,2,200405,吸烟对个人健康和公众利益的影响,60,65,58,37,51,254,未参加,
可是它可不能成为我们的好朋友。,200405201525200305,日本,2,200405,吸烟对个人健康和公众利益的影响,60,75,74,75,67,337,C,
吸烟者对不{CQ吸}烟者来说，是个很大的麻烦，如果是夫妻、同事、同学，有时，你们必须共栖一处，此时的不吸烟者，将被迫吸二手烟，此危害之大，大于一手烟，带来对{CC的}身体与精神的{CJ-zxy伤害}也不言而喻。,200405332616200047,德国,2,200405,吸烟对个人健康和公众利益的影响,65,65,79,77,97,367,C,
在这些结交方式中，我认为通过亲戚朋友的介绍是最理想的。,200410534533150056,新加坡,1,200410,最理想的结交方式,80,90,66,85,100,416,B,
而如果有从小一起长大的经历，深厚的感情{CC5感情厚度}将成为维系婚姻的良好基石，白头偕老，百年好合自不在话下。,200410534519150074,马来西亚,1,200410,最理想的结交方式,65,90,66,67,82,361,C,
他们都不了解对方的身世、学历、家境，但是却被对方的一举一动所吸引了。,200410534533250123,新加坡,2,200410,最理想的结交方式,95,95,55,67,100,411,C,
他不只{CC2只不过}有名，他的技能也非常高。,200404140727200237,马达加斯加,2,200404,运动员收入,60,75,49,40,59,269,未参加,
