错句,作文编码,国籍,性别,考试时间,作文题目,口试分数,作文分数,听力分数,阅读分数,综合分数,总分,证书
毕业后，我也要当记者[BQ。]今年我父亲{CJ+sy是}四十五岁。,199412123635100088,俄罗斯,1,199412,记我的父亲,45,50,60,34,57,223,未参加,
我真没有想到父亲和女儿双双成了“汉语迷”！,199412124525200016,日本,2,199412,记我的父亲,70,75,75,65,82,356,C,
可是我从来没去过那些地方。,199412124525200041,日本,2,199412,记我的父亲,55,75,65,65,72,317,C,
她等我二十岁{CQ了}，看我的思想基本定下{CQ来}了，{CQ才}开始跟我谈她对他们的评价。,199412104525200102,日本,2,199412,记对我影响最大的一个人,80,85,73,69,76,377,B,
他们的负担更重{CC多}{CQ了}。,199412104523100648,韩国,1,199412,记对我影响最大的一个人,65,65,41,46,35,236,未参加,
时间过得真快，一转眼过去了{CJX}七年的时间。,199412104525200691,日本,2,199412,记对我影响最大的一个人,65,65,57,59,57,287,C,
在我个[F個]人来说，初学的时[F時]候是乐[F樂]多于[F於]苦，因为[F為]分不出错[F錯]和对，但慢慢就有些苦了，因为[F為]不大敢说[F說]，怕被人取笑。,199409543634100220,英国,1,199409,学习汉语的苦与乐,90,80,76,68,79,388,B,
她还是一如既往{CC4如此}投入在工作中。,199500533533100005,新加坡,1,199500,记对我影响最大的一个人,90,75,70,75,80,384,B,
他二十出[C]头就远渡重洋到新加坡找工作{CC3找工}，只提了一个行李，靠着他的聪明才智{CC智慧}和创业的精神，从底层{CC基本}做起到成为上司级，当然是经历过不少的困苦{CD事迹}。,199500533533100046,新加坡,1,199500,记对我影响最大的一个人,80,85,73,59,78,369,B,
我看不起{CC3小看}以向{CC跟}上司讨好而升级的他们。,199500533533100060,新加坡,1,199500,记对我影响最大的一个人,80,75,52,65,74,337,C,
他今年六十五岁[BQ，]是一位日本人。,199500533533200130,新加坡,2,199500,记对我影响最大的一个人,95,65,78,59,69,358,C,
每当我回想起我在南洋理工大学读书的时候，我就会想起我的一位好友兼同窗——[BC，]盈芬。,199500533533100140,新加坡,1,199500,记对我影响最大的一个人,95,80,91,77,82,421,B,
经[F經]过[F過]这一番{CC一段}慈爱的教训[F訓]，我就乖乖地{CC的}去上学{CQ了}，而且{CC而就}很顺[F順]利地{CC的}从[F從]小学、中学、大学、硕士、直[B至]到博士{CD的}学位。,199510512512100506,菲律宾,1,199510,记对我影响最大的一个人,90,95,55,54,57,349,C,
我认[F認]为[F為]人的定义[F義]也是很混乱{CJxw}[BQ，]就是{CQ得了}一种不治之症的人{CJ+sy是}不算人吗[F嗎]？,199510550523100917,韩国,1,199510,如何看待“安乐死”,65,55,62,48,53,265,未参加,
人因身体[F體]的衰老或疾病的感染等因素，导[F導]致病痛而躺卧[C]在床[F牀]上。[BC，],199510550523200919,韩国,2,199510,如何看待“安乐死”,90,85,74,68,77,391,B,
争论的主要焦点在于如何处理好法律与[C]人之常情{CC人事常情}{CQ的}关系。,199511543634100504,英国,1,199511,如何看待“安乐死”,85,85,71,70,86,392,B,
我现在长这么大还那么内向是因为姐姐对我厉[B励]害的缘故吧。,199505550523200902,韩国,2,199505,记对我影响最大的一个人,60,50,62,50,53,255,未参加,
在现在的社会[C]{CD上}[BQ，]在生活中光说自己的母语，可不行了。,199505529529100054,泰国,1,199505,学习汉语的苦与乐,65,80,57,50,82,322,未参加,
中文词[B河]语除了丰富还具有很细的词意分别，[BC。]对外国人{CQ来说}{CJ-zhuy这}是比较不[C]容易理解的语言方面。,199505529529100054,泰国,1,199505,学习汉语的苦与乐,65,80,57,50,82,322,未参加,
这[C]本书就是内田百间的代表作《百间随笔》。,199505104525200026,日本,2,199505,记对我影响最大的一个人,70,75,75,69,69,347,B,
我高中二年级的时候，我爸爸去世了。,199505104523200045,韩国,2,199505,记对我影响最大的一个人,55,75,36,30,53,234,未参加,
虽然这些故事都乱七八糟，可是外祖父耐心地听了。,199505104525200060,日本,2,199505,记对我影响最大的一个人,65,90,65,67,67,345,C,
我从小在她的身边看她的生活。,199505104525200081,日本,2,199505,记对我影响最大的一个人,65,60,65,65,59,297,C,
我舅舅{CJ-dy对我}的影响比较深。,199505104523200110,韩国,2,199505,记对我影响最大的一个人,80,60,70,75,63,335,C,
但我不服气，为了准备考试拼命刻苦学习。,199505104525200182,日本,2,199505,记对我影响最大的一个人,75,90,70,61,61,351,B,
这次我到北京大学学习，正是{CQ因为}85岁的她的坚定支持。,199505104533100221,新加坡,1,199505,记对我影响最大的一个人,95,95,75,79,96,439,A,
我的十二年的空姐生活中，对我影响最大的人是浅野[C]四郎先生。,199505104525200231,日本,2,199505,记对我影响最大的一个人,70,75,75,55,69,333,C,
但他每次遇[C]到我{CJ-zy都}对我说“孩子[BQ，]学习怎[C]么样，[BC。]作业做好了没有。,199505104525100264,日本,1,199505,记对我影响最大的一个人,60,70,54,67,61,297,未参加,
他早已{CC早年}去世了。,199505104525100271,日本,1,199505,记对我影响最大的一个人,70,65,65,73,80,339,C,
从小到大她不停{CC不时}地指导[C]我[C]。,199505104540200278,印度尼西亚,2,199505,记对我影响最大的一个人,75,80,49,57,63,315,C,
亚婆[C]在澳大利己经二十多年了。,199505104801100281,澳大利亚,1,199505,记对我影响最大的一个人,75,80,52,34,43,275,未参加,
我的父亲{CD是}出生于农村{CD的}很穷的家庭，因为韩国战争那{CQ个}时期的一般人民的生活很苦，我父亲[C]也是没有办法上学[BQ，]从年青的时候[B后]{CQ就}为了家里的生活而干活。,199505104523200291,韩国,2,199505,记对我影响最大的一个人,65,50,39,53,49,237,未参加,
从祖母口中知悉三叔是全{CD个}市镇唯一的大学生，在那个时代可{CC要}算是了不起了。,199508680519200504,马来西亚,2,199508,记对我影响最大的一个人,85,85,83,75,92,415,A,
在我的一生中，对我影响最大的[BD，]可以说是我最敬爱的外公了。,199508681519200506,马来西亚,2,199508,记对我影响最大的一个人,90,80,78,69,84,396,B,
二哥对我情深义[F義]重，也影响且改变了我的一生。,199508681519100524,马来西亚,1,199508,记对我影响最大的一个人,80,80,65,69,76,362,B,
中国是我的第二个故[B古]乡。,200010543922250004,美国,2,200010,我第一次……,80,75,67,44,57,314,C,
现[F現]代的人很容易便会离婚，为什么[F麽]他们不看看古代的人，没有离婚，感情仍然很好，互相照顾[F顧]，那又是什么[F麽]原因，因为他们不知什么[F麽]是离婚，所以，他们便会接受对方的缺点和优[F優]点，但现[F現]代的人只看不合得来[F來]便离婚[BQ，]这[F這]是一个[F個]不良的现[F現]象。,200010801543250005,香港地区,2,200010,我对离婚问题的看法,60,80,20,32,54,233,未参加,
就因为[F為]他们[F們]还[F還]年青，没有为[F為]自己的下一代着想，因而造成{CC做成}很多年青人流浪街头[F頭]、无[F無]所事事，离婚了的爸爸和妈[F媽]妈[F媽]没有钱供他们[F們]进[F進]中学或大学读[F讀]书[F書]。,200010801501250014,中国,2,200010,我对离婚问题的看法,65,70,26,44,52,243,未参加,
有时，我想上厕所，但是想起那厕所是什么样的，我连上都不想上了。,200005108525200300,日本,2,200005,关于用自然之声取代噪声的建议,80,65,50,70,54,307,C,
大家可能都有在电影院看电影的时候别人的手机响，觉得不舒服的经验吧。,200005108525200306,日本,2,200005,关于用自然之声取代噪声的建议,65,65,80,83,69,346,C,
我看原因在这一点儿。,200005108525200307,日本,2,200005,关于用自然之声取代噪声的建议,65,75,70,85,82,364,B,
但除了这样的好处以外，也带来坏处，[BC。]就是环境污染问题。,200005108523200335,韩国,2,200005,关于用自然之声取代噪声的建议,70,75,83,72,76,365,B,
所以认为这是一个良好的政策[Pcè]。,200005108523100414,韩国,1,200005,关于用自然之声取代噪声的建议,65,65,67,67,63,311,C,
当然，无用噪声能减则减，能灭亡就灭亡，谈不上[BD，]自然之声取代无用{CC无能}噪声。,200005108525100409,日本,1,200005,关于用自然之声取代噪声的建议,70,75,53,80,69,336,C,
感觉上{CQ和}在北京市内一样吵。,200005108525200410,日本,2,200005,关于用自然之声取代噪声的建议,70,65,70,78,76,345,C,
现今社会实[F實]在太多虚伪[F僞]朋友！,199711801501100014,中国,1,199711,我选择朋友的标准,75,80,60,74,87,367,B,
不管如何，我会用心去交朋友，交朋友之道贵[F貴]乎坦白和诚实[F實]，出自一颗[F顆]真诚[F誠]的心。,199711801501100014,中国,1,199711,我选择朋友的标准,75,80,60,74,87,367,B,
有人喜欢[F歡]跟自己性格相同的，有些人就刚[F剛]刚[F剛]相反。,199711801801100019,澳大利亚,1,199711,我选择朋友的标准,75,75,71,45,37,293,未参加,
有了朋友之后[F後]，日子相处久了，我们会表现[F現]各有不同的性格，品德及知识水准[F凖]，所以在选择朋友的标[B村]准[F凖]上，相信每个[F個]人都持有不同的见[F見]解。,199711801801100022,澳大利亚,1,199711,我选择朋友的标准,75,80,52,49,54,301,未参加,
白天我随着池河散散步，周围都是山，什么人影也看不见。,199705104525100005,日本,1,199705,我的城市/乡村生活,60,80,71,67,80,345,C,
人与人之间的关系也十分复杂。,199705104523100020,韩国,1,199705,我的城市/乡村生活,65,75,69,65,58,319,C,
我{WWJ},199705104540200036,印度尼西亚,2,199705,我的城市/乡村生活,65,85,49,54,58,301,C,
很多城市生活者说“城市的生活让人厌倦，每天重复{CC反复}一样的事情。,199705104523100088,韩国,1,199705,我的城市/乡村生活,70,65,80,45,46,292,C,
有时候，我去韩国的首都汉城[BQ，]因为在汉城有朋友有事。,199705104523100092,韩国,1,199705,我的城市/乡村生活,65,70,66,65,51,303,C,
我之所以这么想是因为小时候没有什么担心的事，很多人认为自己的童年很幸福。,199705104525200111,日本,2,199705,我的城市/乡村生活,60,60,44,60,49,255,未参加,
我的父母都是老师。,199705104525200118,日本,2,199705,我的城市/乡村生活,65,55,46,58,63,269,未参加,
现[F現]在随[F隨]着岁月的成长[F長]，生活环[F環]境的改造需求，慢慢地往城市来讨[F討]生活，而至现[F現]今結婚生子．社会也变得脱离[F離]现实，除了紧[F緊]张[F張]的生活和追求人生的理想外，空间时[F時]间有限，城市虽[F雖]然豪华[F華]，怎样[F樣]也是经[F経]由人工建设[F設]的，故乡[F鄉]的情象全是自然景观[F觀]，生活家意，故我还[F還]是怀[F懷]念过去孩童的生活。,199705529529151013,泰国,1,199705,我的城市/乡村生活,80,75,57,32,51,286,未参加,
水中混有无[F無]数[F數]的垃[B拉]圾[B扱]。,199705529529253002,泰国,2,199705,我的城市/乡村生活,75,65,31,44,43,245,未参加,
但是现在我有一个问题，就是经常写错汉字。,199804123525200170,日本,2,199804,学习汉语的苦与乐,70,70,54,45,62,289,未参加,
老师很了解我这样的情况，就跟我谈话，劝我应该怎么学习才能得到好效果。,199804123542200164,越南,2,199804,学习汉语的苦与乐,60,65,48,52,44,252,未参加,
来中国初我以为只有学习汉语而已，[BC。]可是我的性格是很乐天的。,199804123523100196,韩国,1,199804,学习汉语的苦与乐,60,55,27,40,44,207,未参加,
他们是来中国之前一次也没看过汉字，所以学习的时候更费劲。,199804123523200240,韩国,2,199804,学习汉语的苦与乐,70,65,30,49,36,236,未参加,
比如，声调方面啊，语法方面啊很成问题，我最害怕的声调是三声加二声，例如，小王xiǎowáng这样的发音我总是发{CC叫}二声加二声，而且，对语法方面我还没掌握，韩国的语言顺序是主语，宾语，谓语这样组[B主]成的{CC了}，但，汉语的结构是主谓宾的，所以，我常常混淆了。,199804124523200339,韩国,2,199804,学习汉语的苦与乐,70,70,51,47,44,270,未参加,
谁都会这么想吧。,199804124525100327,日本,1,199804,学习汉语的苦与乐,65,70,27,35,46,229,未参加,
一会儿我突然想起爸爸星期天买的巧克力放在冰箱里，于是就有了独吞的念头。,199910512501150003,中国,1,199910,我的童年,75,90,81,76,72,388,B,
可我改变了主意来到了中国会{CJX}学了汉语。,199904123523200005,韩国,2,199904,如何面对挫折,70,65,37,60,46,264,未参加,
从幼年到老年[D一]人人都会经历各种各样的生活。,199904123520200020,蒙古国,2,199904,如何面对挫折,65,65,42,29,37,222,未参加,
当我遇到这些{CD的}压力{CJ-zxy的时候}，我哭了，我不想上课、……但{CD又}想想每个人都有自己的难事，我们应该勇敢地对付它[B他]才能强起来。,199904123540200107,印度尼西亚,2,199904,如何面对挫折,65,75,59,52,61,299,C,
很多卖菜的人都是看着我{CJs}，我很不好意思，我想赶快离开这儿但走不动，我该怎么办呢？,199904123523200252,韩国,2,199904,如何面对挫折,65,60,45,52,26,231,未参加,
经过一年的准[F準]备[F備]{CD期间}，我考上了一所大学，但那儿的{CC地}专业我并不喜欢。,199904123525200267,日本,2,199904,如何面对挫折,65,55,53,65,78,298,未参加,
还记得当时我考大学的那一年，带着紧张和恐惧的心理进场时，一点信心都没有，我最终{CC终于}没考上{CC考不上}大学，痛苦之际，我不知所措，总以为我的前途到此为止{CC到此为终}了。,199904123542200268,越南,2,199904,如何面对挫折,70,75,59,72,85,350,C,
曾经有人说，“天才是只有1％的灵感，和90％的努力和用功，才完成的”[BQ，]如果我们会以失败为成功，认真地努力，[BC。]没有不能{CC无能}做的事情，而且，我们自己会改变不幸的命运。,199904124523200387,韩国,2,199904,如何面对挫折,55,65,50,57,46,255,未参加,
就拿我们经历来说吧，我是一个村姑，读完了初中就到城市来工作。,199909684542200053,越南,2,199909,如何面对挫折,80,60,57,38,61,283,未参加,
我常听到一些高龄的长辈们聚会[B合]喝茶聊天时，往往谈起他们当初到那里{CC国来}“开垦[B恳]”时候的故事，有的苦得连一餐都{CC还}难找{CJ+buy得下肚子}，有的连病带饿地打工等等，想起来他们个个都了不起的{CJsd}。,199909529529151006,泰国,1,199909,如何面对挫折,70,75,51,42,58,285,未参加,
我的挫折中，我会[F會]思考犯{CC到}的过错[F錯]，不会[F會]是唉声叹气{CJsd}，怨天尤人，不[F會]变得一蹶不振，而是{CC就是}要双倍的努力，把以往丰收的经验[F驗]思考{CJba}，从零开[F開]始算起，有不知之处[F處]，{CQ就}该[F該]请[F請]教别人，例如：有{CD开[F開]}座谈会{CC座谈[F談]话[F話]}或演[F講][F會]，应[F應]打听[F聽]，增取新的知识[F識]，来运[F運]用{CJ-buy到公司}及改正自己公司的错[F錯]误[F誤]，我想这[F這]办[B辨]法，应[F應]该[F該]不难[F難]吧！,199909529529151013,泰国,1,199909,如何面对挫折,70,80,27,37,52,256,未参加,
