错句,作文编码,国籍,性别,考试时间,作文题目,口试分数,作文分数,听力分数,阅读分数,综合分数,总分,证书
自古妻子{CQ受}必须[F須]三从[B重]四德、[BC，]嫁夫随[C]夫[BD，]等等的教义，深深地{CC的}影响了以往的人对婚姻的态度，加上早期在经济上不那么富裕，哪[B那]去{CJX}有太多的时间理这[F這]码事{CD吗}？,200103533533150033,新加坡,1,200103,我对离婚问题的看法,85,75,85,68,79,384,B,
根据母亲的说法是因为[L]战争。,200110540540150010,印度尼西亚,1,200110,我的童年,70,85,71,49,92,359,C,
还有父亲的待人慈祥、礼貌，也影响了我长大后的处事为[B得]人。,200110540540150141,印度尼西亚,1,200110,我的童年,60,95,41,39,85,310,未参加,
一有空闲{CJ+zxy时}，我就拉着我的父亲陪我玩。,200103680519101601,马来西亚,1,200103,我的童年,75,80,61,72,85,364,B,
”“知道了，不要扔下我。,200103680519201608,马来西亚,2,200103,我的童年,90,90,89,88,98,453,A,
这种玩意儿是考眼力，考功夫的。,200103680519201610,马来西亚,2,200103,我的童年,75,90,70,78,98,405,B,
前两天我收到了您的信，看到您常常对我说的那番话，心里有点不是个滋味儿。,200104124501200069,中国,2,200104,一封写给父母的信,90,75,55,49,72,335,未参加,
有山有水，空气新鲜，好像{CJX}使我感到在国内一样[BQ，]很亲切。,200104124520200255,蒙古国,2,200104,一封写给父母的信,65,85,52,44,65,301,未参加,
替我向她问[L]好，还有一定把我这封信读给她听。,200104124547100232,哈萨克斯坦,1,200104,一封写给父母的信,75,65,63,39,65,294,未参加,
我希望他早日恢复。,200104124506100419,巴基斯坦,1,200104,一封写给父母的信,75,85,58,51,65,327,C,
有时我感觉到我的心现在像石头{CC2石}一样硬，但想起你们时，我的眼泪不由得会流下来。,200104124635100402,俄罗斯,1,200104,一封写给父母的信,75,65,49,51,63,290,未参加,
最近我的心情真不好。,200105550523250006,韩国,2,200105,一封写给父母的信,65,60,52,42,38,240,未参加,
我觉得还是自己注意身体健康，听您的话吧，不是吗？,200105550523250009,韩国,2,200105,一封写给父母的信,65,70,60,68,56,305,C,
我{CQ家}老小是正在准备高考的{CJ-zxy学生}，[BC。]所以妈妈很关心他。,200105550523250046,韩国,2,200105,一封写给父母的信,70,65,52,61,56,290,C,
但是，我这么大年纪[B级]了自己觉得还不懂事，有时候经常让您费心，让您被我的小事一天到晚操心不尽{CJbei}，所以每年{CC每天}到了母亲节的时候，这个节日总提醒我好几次。,200105550523250346,韩国,2,200105,一封写给父母的信,70,70,49,68,61,306,C,
但是你却{CC也}这样做，我很难受。,200105550523250353,韩国,2,200105,一封写给父母的信,65,70,38,44,56,259,未参加,
爸爸您身体好吗？,200105550523150517,韩国,1,200105,一封写给父母的信,70,70,47,44,47,266,未参加,
她外表{CC外面}、内心{CC内面}都没有变化，所以人群中我很快找到{CQ了}她。,200105212525200027,日本,2,200105,我的一个假期,70,75,52,61,57,304,C,
那时候我问了一位服务员我要去的车站，然后他跟我说，要坐几号的公共汽车。,200105212540200041,印度尼西亚,2,200105,我的一个假期,75,75,65,63,48,316,C,
我现在在中国留学。,200105209525100055,日本,1,200105,我的一个假期,65,70,34,63,57,275,未参加,
我回老家了。,200105209525200066,日本,2,200105,我的一个假期,75,75,65,58,68,331,C,
而如果在日本发生了同样的事情，我看[BD，]就很少{CJ-sy有}人管，很多日本人会想就算我不管也总会有一个人去拦住打架。,200105109525100590,日本,1,200105,由“三个和尚没水喝”想到的……,70,75,68,71,75,348,C,
饮[F飲]用这个水，三个和尚活下去了。,200105109525100735,日本,1,200105,由“三个和尚没水喝”想到的……,75,55,63,75,73,326,C,
我们往往以为像水、[BC，]石油、[BC，]空气一样的自然资源是无限、[BC，]永远存在的东西。,200105109525200738,日本,2,200105,由“三个和尚没水喝”想到的……,65,70,57,73,50,301,C,
我觉得“水没有了”，表示人们的“没有考虑而引起不好的事”[BD，]这样的特点。,200105109525200816,日本,2,200105,由“三个和尚没水喝”想到的……,65,60,59,58,79,304,C,
这个故事虽是简单而短小{CC简便}{CJs}，但它曾有着很大的教育意义[BQ，]教导了学生[BQ、]中年人以[B于][F於]及大人必须认清楚在{CC有}家庭中、学校中、社会上常遇见的实况[BQ。]每个事情或每个工作都要同心合力，才能使工作搞得{CC的}好，搞得有一定的成就。[BC，],200102522522150018,缅甸,1,200102,由“三个和尚没水喝”想到的……,90,85,38,31,53,294,未参加,
老师[F師]经[F經]常说[F說]：[BD┏]我们的地球是用数学来创[F創]造的。[BD┓],200203522522250030,缅甸,2,200203,记对我影响最大的一个人,75,75,28,31,41,240,未参加,
在我小六离校的那一天，我依依不舍地向王老师告别。,200203533533250022,新加坡,2,200203,记对我影响最大的一个人,90,85,71,66,77,386,B,
首先，家人对这问题的看法如何？,200205204525100019,日本,1,200205,如何看待“安乐死”,60,65,35,45,37,225,未参加,
关于“安乐死”这个问题有一些人会错误的理解它。,200205204525200134,日本,2,200205,如何看待“安乐死”,80,70,85,65,84,374,C,
我觉得他们的痛苦有两种：[BC。]一种是身体的痛苦；[BC，]一种是精神的痛苦。,200205204525100144,日本,1,200205,如何看待“安乐死”,60,75,38,58,35,252,未参加,
在我们国家有很像这件事情的故事。,200205212525100004,日本,1,200205,如何看待“安乐死”,65,65,49,65,56,284,C,
第二，病人有意识时亲自表明{CC面}自己同意“安乐死”。,200205212525200022,日本,2,200205,如何看待“安乐死”,75,65,83,81,75,366,B,
我个人对“安乐死”不怎么赞成。,200205212525200037,日本,2,200205,如何看待“安乐死”,80,75,74,79,77,376,B,
这样规定的话，我相信承认“安乐死”也不会发生问题。,200205209525100022,日本,1,200205,如何看待“安乐死”,70,80,46,60,44,290,C,
他们的行为是“我行我素”有的甚至到“目无尊长”的地步。,200210540540150064,印度尼西亚,1,200210,如何解决“代沟”问题,70,65,51,60,73,305,C,
第二个原因，一般来说，男女结婚的年龄是迟了些。,200210540540150072,印度尼西亚,1,200210,如何解决“代沟”问题,60,70,48,69,44,276,未参加,
他们说我作{CC做}为家长有点儿保守、[BC，]落后及不能跟年轻[B青]人谈心。,200210540540150073,印度尼西亚,1,200210,如何解决“代沟”问题,60,70,53,62,79,309,未参加,
妈，你一定想像不出我工作和睡觉的地方是多么地荒凉与落后。,200205680519250032,马来西亚,2,200205,一封写给父母的信,85,75,68,75,92,387,B,
这本书的原文于1995年发表，中文翻译版迟至2000年才在中国出版。,200305533533250018,新加坡,2,200305,我最喜欢读的一本书,80,70,74,84,90,388,B,
一位是作者的外祖母，[BC、]一位是作者的母亲，一位是作者本人。,200305533525250038,日本,2,200305,我最喜欢读的一本书,65,65,68,75,65,322,C,
》。,200305533533250037,新加坡,2,200305,我最喜欢读的一本书,65,65,77,80,90,361,C,
不过由于这几百年的历史中日两国的交流少多了。,200304131525100098,日本,1,200304,我学汉语是为了……,65,75,53,30,24,234,未参加,
其实，我来中国留学的第一个目的是去国内旅游。,200304131525200104,日本,2,200304,我学汉语是为了……,60,65,53,60,74,295,未参加,
我很高兴，来到中国亲眼{CJX}可以看到真正的中国。,200304131525200154,日本,2,200304,我学汉语是为了……,65,65,74,68,77,333,C,
总之，我认为一个完全没有声音的环境会对人体健康产生危害。,200305576525100007,日本,1,200305,静音环境对人体的危害,65,70,47,41,74,283,未参加,
但是特别奇怪的是[B事]，暑假{CC夏暇}回家的时候，我很{CJX}感到安静。,200305576525200014,日本,2,200305,静音环境对人体的危害,70,65,50,54,54,279,未参加,
因为我们一旦出生到这个世界[BQ，]到迎接死亡为止[BQ，]谁也离不开声音。,200305576525200022,日本,2,200305,静音环境对人体的危害,65,65,41,60,68,283,未参加,
吸烟已不{CQ仅}是成年人所喜欢的东西。,200405109540100892,印度尼西亚,1,200405,吸烟对个人健康和公众利益的影响,75,85,74,60,66,353,B,
吸烟对吸烟者是有十分大的影响{CJy}。,200405109540200810,印度尼西亚,2,200405,吸烟对个人健康和公众利益的影响,75,70,55,52,55,296,未参加,
其实，[BC、]在公共场所不允许抽烟，也是一种对青少年教育{CQ的}正确的观[F觀]念和{CD思想的}有效手段。{CQ要},200405109627200792,瑞士,2,200405,吸烟对个人健康和公众利益的影响,70,70,78,81,92,379,C,
根据某市政府出台的一项规定，在公共场所边走边抽烟的人将被罚款。,200405109540200206,印度尼西亚,2,200405,吸烟对个人健康和公众利益的影响,75,80,67,46,67,326,C,
不过采取措施之前需要考虑的问题是：人为什么要抽烟？[BC，],200405219610100004,法国,1,200405,吸烟对个人健康和公众利益的影响,90,50,63,51,67,309,未参加,
你抽烟时，你旁边的人也会吸到烟雾，而且烟雾于{CC为}二手吸烟者[B着]更有伤害性。,200405204540200103,印度尼西亚,2,200405,吸烟对个人健康和公众利益的影响,70,70,58,47,63,296,C,
我非常支持这个新措施。,200405212529100011,泰国,1,200405,吸烟对个人健康和公众利益的影响,75,65,36,39,61,263,未参加,
最重要的目的是让青少年不抽或戒烟，养成良好的习惯。,200405212540200018,印度尼西亚,2,200405,吸烟对个人健康和公众利益的影响,65,60,60,51,61,280,未参加,
香烟本身有{CD了}吸引{CQ人}的成分，所以想离开它是一件很难的事。,200405212542200001,越南,2,200405,吸烟对个人健康和公众利益的影响,75,75,66,58,70,334,C,
政府应该采取措施，不然如果这些现象一直延续{CC演续}下去，后果不敢[B感]想像。,200405212540200057,印度尼西亚,2,200405,吸烟对个人健康和公众利益的影响,90,70,66,68,81,368,C,
措施的第一个好处是维护了公民的健康。,200405205922100198,美国,1,200405,吸烟对个人健康和公众利益的影响,80,90,68,77,99,409,B,
这种说法{CC说的}是对{CJsd}。,200405522522250025,缅甸,2,200405,吸烟对个人健康和公众利益的影响,70,65,44,47,49,261,未参加,
我认为这是一件利国利民{CC于国于民}的大好事。,200405522522110003,缅甸,1,200405,吸烟对个人健康和公众利益的影响,65,95,71,92,100,414,B,
有些人甚至导致肺[C]癌，失去生命。,200405522522110003,缅甸,1,200405,吸烟对个人健康和公众利益的影响,65,95,71,92,100,414,B,
烟使我们忍受了八国联军[F軍]的侵略，没有能力反抗，真是很丢人，又有损[F損]国家的形象，这[F這]些耻辱，应该深刻地还{CJX}烙在大家心中吧！,200405522522110004,缅甸,1,200405,吸烟对个人健康和公众利益的影响,70,80,55,60,68,323,C,
因为成[C]年人的行为特别会影响到少年的行为。,200405209606200061,比利时,2,200405,吸烟对个人健康和公众利益的影响,65,65,60,16,67,257,未参加,
再说{CC加说}，对小孩儿应该有专门的课{CD为了}给他们介绍一下吸烟会有什么样的后果。,200405209633200060,意大利,2,200405,吸烟对个人健康和公众利益的影响,60,60,44,23,42,211,未参加,
他在日本的大公司工作。,200505109525100180,日本,1,200505,父母是孩子的第一任老师,70,85,53,40,64,304,未参加,
那么，父母是什么样的老师呢？,200505109525100396,日本,1,200505,父母是孩子的第一任老师,70,65,65,54,59,299,C,
也可以说孩子跟他们的父母过的时间比较多。,200505109525200403,日本,2,200505,父母是孩子的第一任老师,70,70,44,40,45,257,未参加,
因为我刚刚成了一个女儿的爸爸。,200505217525100086,日本,1,200505,父母是孩子的第一任老师,55,65,80,53,63,298,未参加,
刚出生的孩子的思想好像一张白布一样，就是容易被父母思想的颜色染{CJ-buy成}{CJ-by别的颜色}。,200505217525100184,日本,1,200505,父母是孩子的第一任老师,70,80,52,65,78,335,C,
但是，动物和人类的孩子之间，最明显[C]的差异之一是跟父母一起生活的时间{CC期间}的长短。,200505217525200167,日本,2,200505,父母是孩子的第一任老师,55,50,41,57,69,251,未参加,
就[C]是，随[C]着社会的发展，给{CC对}人们的生育观念也带{CJ-buy来}了巨大变化。,200505204525200027,日本,2,200505,父母是孩子的第一任老师,60,60,52,51,52,257,未参加,
我认为孩子以父母为{CJ-by榜样}决定怎样成长{CC成大}。,200505204525200032,日本,2,200505,父母是孩子的第一任老师,60,65,41,51,61,261,未参加,
我从小的时候一直到现在我们家做菜的不是母亲而是父亲。,200505204525100110,日本,1,200505,父母是孩子的第一任老师,65,65,63,43,74,294,C,
我觉得每个{CJX}我的选择都有父母的影响。,200505204525200151,日本,2,200505,父母是孩子的第一任老师,60,85,54,79,67,334,未参加,
我们不是在周末跟父母出去{CC去出}吗？,200505204525200262,日本,2,200505,父母是孩子的第一任老师,65,65,39,53,56,262,未参加,
越练越好，这也是上小学以后第八回小学生钢琴比赛里获[C]得了冠军{CJ-zxy的原因}。,200505204525200264,日本,2,200505,父母是孩子的第一任老师,55,55,52,43,56,241,未参加,
但是父亲的鼓励[C]比任何东西还要可靠。,200505204525200502,日本,2,200505,父母是孩子的第一任老师,75,75,63,59,65,327,C,
我在美国获得的东西，除了语言方面以外还有很多很多。,200105205525200056,日本,2,200105,我的一个假期,75,85,80,63,85,381,B,
当时我钢琴练得比平常多得不得了，所以我准备得充分。,200112576525200006,日本,2,200112,如何面对挫折,65,65,57,67,57,295,C,
我想：到今天，我没有旷[Pkuàng]过课，而且考过一些{CC有些}汉语考试，一直认真地学汉语。,200112576525200012,日本,2,200112,如何面对挫折,60,65,39,63,80,290,未参加,
洋弓看起来很简单。,200112576525200020,日本,2,200112,如何面对挫折,65,65,54,73,69,310,C,
我从来不知道经济是这么容易破坏{CC2坏}的东西。,200105271525100029,日本,1,200105,我的一个假期,80,75,67,79,94,386,B,
第二个原因是我比较喜欢冷。,200105271525200022,日本,2,200105,我的一个假期,70,75,60,58,55,307,C,
从格尔木到西藏是最困难的路，因为我有了高山反应。,200105271525100041,日本,1,200105,我的一个假期,70,70,42,46,63,279,未参加,
五天的放假期{CC之}间，我和一个朋友一起去旅游。,200105217525200070,日本,2,200105,我的一个假期,65,75,52,63,59,301,C,
到7月份不{WWJ},200105217525200072,日本,2,200105,我的一个假期,65,60,67,56,41,272,未参加,
我已经去过老挝{CQ了}[BQ，]是夏天的时候。[BC，],200105204525200029,日本,2,200105,我的一个假期,65,75,55,39,37,258,未参加,
我打工时经理天天让我练习，[BC。]但是能做好吃的炒饭{CJ-zhuy我}花了两个星期左右。,200105204525100076,日本,1,200105,我的一个假期,60,65,17,21,52,198,未参加,
我自己感觉到我是个成人。,200105550523250070,韩国,2,200105,一封写给父母的信,65,70,27,28,40,216,未参加,
可妈不一样。,200105550523250079,韩国,2,200105,一封写给父母的信,75,80,63,65,72,346,C,
父亲，母亲你们好。,200105550523150104,韩国,1,200105,一封写给父母的信,60,60,30,47,54,233,未参加,
祝您身体健康！,200105550523250115,韩国,2,200105,一封写给父母的信,70,70,49,56,51,284,C,
请别怪您这个儿子。,200105550523150122,韩国,1,200105,一封写给父母的信,90,75,77,68,81,385,B,
不过有一位老师有点坏，经常批评我们水平不如以前的学兄学姐，又经常不上课。,200105550523150122,韩国,1,200105,一封写给父母的信,90,75,77,68,81,385,B,
爸爸，妈妈！,200105550523250134,韩国,2,200105,一封写给父母的信,65,70,44,39,49,253,未参加,
我那时还不懂[B董]事，不太理解我家的情况，经常要买东西。,200105550523250141,韩国,2,200105,一封写给父母的信,75,75,49,56,58,303,C,
我认为世上有许多种的爱。,200105550523250141,韩国,2,200105,一封写给父母的信,75,75,49,56,58,303,C,
以后用笔和纸把我的心情告诉你们。,200105550523150177,韩国,1,200105,一封写给父母的信,70,65,49,39,47,256,未参加,
祝您们身体健康。,200105550523250176,韩国,2,200105,一封写给父母的信,70,65,58,47,74,300,C,
不过对你们还是小时候那更好{CJ？}。,200105550523250190,韩国,2,200105,一封写给父母的信,65,70,52,44,58,275,未参加,
爹，我今年2月份毕业，毕业之后要服兵役。,200105550523150201,韩国,1,200105,一封写给父母的信,65,60,47,56,63,274,未参加,
已经把工厂都建筑好了[BQ，]还有把生产流线也准备{CC设备}得差不多了。,200105550523250205,韩国,2,200105,一封写给父母的信,65,70,58,49,63,291,C,
亲爱的爸爸，妈妈！,200105550523250226,韩国,2,200105,一封写给父母的信,65,60,27,32,49,216,未参加,
我已经找到工作。,200105550523250237,韩国,2,200105,一封写给父母的信,70,60,41,47,56,259,未参加,
新爱的爸爸，妈妈我也不知道先说些什么，从小学毕业以后没给你们写信，真不好的女儿{CJs}，是不是？,200105550523250241,韩国,2,200105,一封写给父母的信,65,60,38,37,47,230,未参加,
您们不用担心。,200105550523150301,韩国,1,200105,一封写给父母的信,80,70,52,47,63,302,未参加,
你能不能理解我的心情？,200105550523150304,韩国,1,200105,一封写给父母的信,70,70,66,51,56,301,C,
看到你马上入睡我心里特别难受。,200105550523150304,韩国,1,200105,一封写给父母的信,70,70,66,51,56,301,C,
5月8日是父母节。,200105550523250302,韩国,2,200105,一封写给父母的信,65,70,33,49,51,254,未参加,
还有弟弟[BD、]妹妹都好吗？,200105550523250457,韩国,2,200105,一封写给父母的信,70,85,63,68,74,352,C,
不过从小就习惯了，现在很难改过来。,200105550523250480,韩国,2,200105,一封写给父母的信,70,70,60,61,54,303,C,
我打算{CC估计}明年开始工作以后每周陪你们去好玩的地方，有时候{CJ-zy还}可以给{CC送}零[B领]用钱{CJshb}。,200105550523150488,韩国,1,200105,一封写给父母的信,65,65,33,54,40,241,未参加,
平时每逢假期回国探亲的我，去年寒假却没有回国，留在{CQ了}中国过中国的春节。,200105206525200001,日本,2,200105,我的一个假期,70,85,87,63,76,373,C,
人们这样做的话一定{CJ-zy会}{CQ让}世界更幸福、愉[B谕]快。,200105109525100317,日本,1,200105,由“三个和尚没水喝”想到的……,75,70,41,47,57,279,未参加,
除了目前的缺乏自然资源以外[BQ，]{CJ-zhuy其他事}也可以说明这篇小说的意义。,200105109525100332,日本,1,200105,由“三个和尚没水喝”想到的……,65,60,50,64,50,272,未参加,
我看这篇故事想到的是[BQ:]全世界的人几乎像这个和尚一样。,200105109525200672,日本,2,200105,由“三个和尚没水喝”想到的……,60,70,43,55,70,283,未参加,
我认为要实现安乐死，首先应该{CD有}人们同意医院进行安乐死。,200205205529200061,泰国,2,200205,如何看待“安乐死”,75,70,71,74,54,333,C,
只要政府同意，安乐死就能实现。,200205205529200061,泰国,2,200205,如何看待“安乐死”,75,70,71,74,54,333,C,
丈夫决定让妻子安乐死也一种爱情的表现{CJs}。,200205205525100086,日本,1,200205,如何看待“安乐死”,65,65,33,70,65,282,未参加,
每个国家都是按照法律来办事的。,200205206525100019,日本,1,200205,如何看待“安乐死”,90,80,30,65,75,335,未参加,
我所知道的[BQ，]对美国人来说{CJ-sy选择}安乐死也是人民的{CJ+dy死的}权利。,200205332540200009,印度尼西亚,2,200205,如何看待“安乐死”,70,85,60,47,61,315,C,
我不想跟我妈一起看电视。,200209550523250020,韩国,2,200209,如何解决“代沟”问题,65,65,81,79,74,348,C,
代沟问题不只是父母和子女之间的问题，而是社会普遍{CC全面}的问题。,200209550523250039,韩国,2,200209,如何解决“代沟”问题,65,70,54,84,74,333,C,
小时候父母叫我干什么，我就干什么。,200209550523150066,韩国,1,200209,如何解决“代沟”问题,65,60,39,40,44,231,未参加,
回到我的屋想，可能是双方{CC互相}的时代不一样，引起的时情{CJ？}，父母那时候，非得学习才有好的工作，现在我这个时代，有一项，你干得好，你就{CJ-sy能}成功{CD的}。,200209550523150066,韩国,1,200209,如何解决“代沟”问题,65,60,39,40,44,231,未参加,
其次，长辈和晚辈该找很多机会{CD两个}一起参加{CD的}一些活动。,200209550523250072,韩国,2,200209,如何解决“代沟”问题,75,70,66,69,56,325,C,
社会发展得{CC地}快，而且{CJ-zhuy变化}大，所以孩子的意思不能和以前大人的{CJ-sy一样}。,200209550523250082,韩国,2,200209,如何解决“代沟”问题,65,65,33,40,36,223,未参加,
我觉得代沟问题很严重{CC大}，而且世界各国都有这个问题。,200209550523150102,韩国,1,200209,如何解决“代沟”问题,65,70,63,62,46,292,C,
两代人都{CJ-sy应该}了解[C]对方。,200209550523250139,韩国,2,200209,如何解决“代沟”问题,60,55,42,59,54,251,未参加,
要不然连[C]互相交流的机会也会没有。,200209550523150149,韩国,1,200209,如何解决“代沟”问题,65,70,72,74,68,335,C,
还有，全家{CC家族}常常去旅游。,200209550523250168,韩国,2,200209,如何解决“代沟”问题,60,60,57,59,56,274,未参加,
有的人认为，这是能解[C]决的的问题。,200209550523250171,韩国,2,200209,如何解决“代沟”问题,65,65,54,59,56,283,C,
现在都有我们需要的东西{CJX}。,200209550523150227,韩国,1,200209,如何解决“代沟”问题,65,60,45,45,34,232,未参加,
了解了{CJX}他。,200209550523250248,韩国,2,200209,如何解决“代沟”问题,65,60,51,45,36,240,未参加,
如果有的女人她要跟外国人结婚，父母肯定不同意。,200209550523250264,韩国,2,200209,如何解决“代沟”问题,70,65,66,71,54,312,C,
我要说，“那绝对不行”。,200209550523250282,韩国,2,200209,如何解决“代沟”问题,70,65,81,84,64,350,C,
年长者说年青人总是不听话，很难管。,200209550523150287,韩国,1,200209,如何解决“代沟”问题,65,60,66,52,60,286,未参加,
这样的话可以理解对方的心理。,200209550523250291,韩国,2,200209,如何解决“代沟”问题,65,65,69,71,58,312,C,
我们想我们的父母不了解我们。,200209550523150361,韩国,1,200209,如何解决“代沟”问题,65,60,54,42,42,246,未参加,
通过语言交流，无论是年轻人还是老年人，都可以了解对方。,200209550523250776,韩国,2,200209,如何解决“代沟”问题,80,70,63,67,72,342,C,
依我看，两代人之间发生了很多矛[B毛]盾，代沟是很自然的。,200209550523150901,韩国,1,200209,如何解决“代沟”问题,70,65,33,49,38,241,未参加,
不过我没有经历过他们的年代，所以有的地方会产生{CJ+dy互相}矛盾[BQ，]我宁肯{CD愿意}互相交谈。,200209550523250945,韩国,2,200209,如何解决“代沟”问题,70,70,69,59,54,310,C,
这样日子一久{CD了}我们的发音器官就会失灵。,200304522522250009,缅甸,2,200304,静音环境对人体的危害,60,90,64,62,76,342,C,
因为用化肥和农药长出的农产品{CC农作品}会出另外的问题，[BC、]对于人的健康也没有好处，[BC、]这样的农产品{CC农作品}会影响到人体。,200307109523200027,韩国,2,200307,绿色食品与饥饿,65,60,67,64,79,318,C,
那么只有“活”才[C]有意义吗？,200307109523200039,韩国,2,200307,绿色食品与饥饿,65,55,62,54,70,288,C,
但是我们不应该盲目地追[C]求绿色食品,200307109523100047,韩国,1,200307,绿色食品与饥饿,70,70,83,64,76,351,C,
虽然不使用化肥和农药时产量就会降低[BQ，]但是为了我们的身体健康，吃[BQ“]绿色食品[BQ”]是最佳[B卦]的选择。,200307109523200104,韩国,2,200307,绿色食品与饥饿,65,70,70,49,64,304,C,
我相信，在不远的未来，我们的科学肯定会发明{CD了}既{CC又}卫生、又{CC既}产量多的“绿色食品”。,200307109523200109,韩国,2,200307,绿色食品与饥饿,70,85,80,75,84,386,B,
这样的话，会影[B景]响落后[L]国家的饥饿者。,200307109523200122,韩国,2,200307,绿色食品与饥饿,60,75,78,64,64,327,C,
这[C]个原因之[C]一是由于化肥和农药{CJ-sy造成了}{CD的}土壤污染，{CP首先我们考虑{CD除了}保护环[B坏]境，[BC。]人类不能继续存在污染{CD的}环境。P},200307109525100135,日本,1,200307,绿色食品与饥饿,70,60,54,64,70,303,未参加,
“绿色食品”对人当然有好处，可是我们应该先照顾好饥饿的人，然后再找[C]“绿色食品”也不晚吧！,200307109523200151,韩国,2,200307,绿色食品与饥饿,60,55,67,43,56,262,未参加,
