错句,作文编码,国籍,性别,考试时间,作文题目,口试分数,作文分数,听力分数,阅读分数,综合分数,总分,证书
打扫卫生{CD时间}的[C]时候，我们十几个人都{CQ去}踢足球[C]，捉[C]迷藏[L]了{CC1等等}。,199605550523190046,韩国,1,199605,由“三个和尚没水喝”想到的……,65,65,60,70,61,305,C,
大多数人都会有这一毛病，不想比别人做多。,199605529529150145,泰国,1,199605,由“三个和尚没水喝”想到的……,80,90,77,88,94,424,B,
有几{CC些}天，妈妈睡不着觉，她跟爸爸商量关于钱不足的问题。,199704123529200042,泰国,2,199704,记对我影响最大的一个人,65,85,56,67,48,311,C,
悲痛于母校的被关闭，悔恨于在校时期我不加倍努力去吸取中华文化的精化。,200110540540150039,印度尼西亚,1,200110,我的童年,75,85,77,87,88,405,B,
我还记得，每天上学的时候妈妈就给我很多好吃东西让我带到学校去。,200110540540250033,印度尼西亚,2,200110,我的童年,70,70,44,32,42,246,未参加,
她挂着笑容的脸庞{CC脸蛋}，留给我深刻的印象。,200110540540150063,印度尼西亚,1,200110,我的童年,70,90,52,51,92,348,未参加,
唯有等待别人捉到了，再小心地交给妈[F媽]妈[F媽]，用红线[F線]扎住蜻蜒的尾巴，使它不能飞[F飛]高。,200110540540250079,印度尼西亚,2,200110,我的童年,80,95,77,61,88,396,B,
我的父亲是电器修理工人，我们一家共有十一人，父母亲及九个{CC位}儿女，我排行第二，上{CQ面}有一个{CC位}姐姐。,200110540540150093,印度尼西亚,1,200110,我的童年,65,85,63,70,83,356,C,
×××十二月十四日一九九三年,199312533519100003,马来西亚,1,199312,一封求职信,0,80,55,78,78,287,未参加,
本人在联[B职]合早报[F報]中，知悉贵公司由于业务的蓬勃发展，现欲招聘员[F員]工，特此修函申请男司机一职。,199312533533100002,新加坡,1,199312,一封求职信,80,75,50,69,66,331,C,
虽然，我“年事”已高，超过了贵公司所定的三十岁，可是，我自问在体力和应付难题的方面是绝[B决]对没问题的。,199312533533200008,新加坡,2,199312,一封求职信,90,90,57,61,75,371,C,
虽然我没有什么工作经验，但是我还年轻，我会争取一分一秒的时间，充实自己，多多进修以提高自己的工作能力。[BC.],199312533533200034,新加坡,2,199312,一封求职信,85,90,64,80,85,401,B,
期盼好消息[C]并{CC与}能与您[C]合作。,199312533533200061,新加坡,2,199312,一封求职信,80,75,69,80,89,384,B,
李文先生：阅读贵报的招聘启事后，我很希望能成为贵公司的导游，为贵公司效力。,199312533533200094,新加坡,2,199312,一封求职信,85,60,50,50,80,314,未参加,
快乐家庭旅游公司联系人李文先生：看到贵公司招聘启事，本人非常希望能为贵公司当起导游这一职位。,199312533501200132,中国,2,199312,一封求职信,75,55,62,69,75,321,未参加,
本人特别喜欢旅游，也去过很多地方。,199312124523200156,韩国,2,199312,一封求职信,65,65,57,56,57,285,C,
我对这个工作很感[C]兴趣。,199312124506200236,巴基斯坦,2,199312,一封求职信,70,70,50,37,41,256,未参加,
从一九八三年到现在[BQ，]经[B近]过[C]好多努[C]力才{CJ+zy能}当上{CC2当}导游[C]，但我还[C]有一个希望[BQ，]是为[C]了我国的快乐{CJ？}[BQ。]我想[C]在你们的公司工作{CC公业}[BQ，]因为[C]在历史上你们的公司有[C]了{WWJ},199312124747100314,坦桑尼亚,1,199312,一封求职信,50,45,29,28,39,166,未参加,
李文先生：您好！,199312124525100320,日本,1,199312,一封求职信,75,70,69,70,73,346,C,
我看了贵公司的招聘启事，希望在贵公司工作，因此报名。,199312123525200405,日本,2,199312,一封求职信,75,70,64,59,64,321,C,
会儿[F兒]我偶然地看到[C]了贵[F貴]公司征[C]求经[F經]理一个[C]人，忽然觉[F覺]得高兴[F興]极[F極]了，这[F這]{CJ+zy也}是为[F為[C]]什么呢？,199410550523101906,韩国,1,199410,一封求职信,55,60,31,62,57,246,未参加,
吃的东西也没有了。,199412123523100004,韩国,1,199412,记我的父亲,45,90,39,38,35,234,未参加,
孩子都喜欢跟爸爸和妈妈一起去玩儿。,199412123922100009,美国,1,199412,记我的父亲,55,65,44,32,47,225,未参加,
他写了好几本书，有关于教育子女的和关于生活{CD的}{CJX}了解的{CD也有}。,199412123506100022,巴基斯坦,1,199412,记我的父亲,60,80,41,28,30,226,未参加,
我父亲说如果要好好儿理解生活，只要理解下面的一句话就能生活得好一些。,199412123506100022,巴基斯坦,1,199412,记我的父亲,60,80,41,28,30,226,未参加,
青年、[BC，]中年时代的父亲性格刚强，根本不知道妥协[F恊]，他的座[B左]右铭就是诚实、率直、自律。,199412123523100034,韩国,1,199412,记我的父亲,65,80,62,75,72,342,C,
为了给我更好的生活条[F條]件和学习条[F條]件他不得不下了班[B办]以后，{CQ还}{CD找}帮朋友工作。,199412123625200056,葡萄牙,2,199412,记我的父亲,80,85,54,28,37,278,未参加,
我非常尊敬父亲。[BC，],199412123525200090,日本,2,199412,记我的父亲,60,60,49,30,47,228,未参加,
她对我说爸爸的坏话，我觉得这不应该的。,199412104525200676,日本,2,199412,记对我影响最大的一个人,65,75,65,67,57,316,C,
一看考试题目《对我影响[B向]最大的一个人》就想起来一张{CC个}脸。,199412104523200639,韩国,2,199412,记对我影响最大的一个人,65,60,60,57,55,280,C,
她大学毕业以后，按她素来的愿望当了一名英语老师。,199412104523200685,韩国,2,199412,记对我影响最大的一个人,70,75,70,61,78,343,C,
可是对我来说，她的看法很保守，[BC。]稳定地走人生的路。,199412104525200657,日本,2,199412,记对我影响最大的一个人,60,60,57,55,47,261,未参加,
我爸爸是一个很伟大的父亲。,199412104540200686,印度尼西亚,2,199412,记对我影响最大的一个人,75,60,68,44,57,290,未参加,
爸爸要出去找工作，去了香港，一去便几[F幾]个[F個]月，妈[F媽]妈[F媽]独[F獨]自{CC力}带着我们[F們]几[F幾]个[F個]艰[F艱]苦地{CC的}生活。,199412104625200632,葡萄牙,2,199412,记对我影响最大的一个人,70,80,60,50,80,330,C,
教师们除了{CQ教}考大学的内容以外，{CQ还}经常鼓励我们。{CJ-zhuy我们班},199412104525200621,日本,2,199412,记对我影响最大的一个人,70,60,57,50,51,273,未参加,
我相信他在天国的哪个{CC一}地方看着我好好儿生活{CC生长}{CJ+zxy的过程}。,199412104523200103,韩国,2,199412,记对我影响最大的一个人,60,60,68,53,65,288,未参加,
可是那个时代[BQ，]作为一个女人，养活两个孩子的{CD过}日子实在不简单。,199412104525100104,日本,1,199412,记对我影响最大的一个人,65,65,62,48,74,298,C,
这回可糟了，四个人——一个家庭[BQ，]可没人愿意把房间租给我们了。,199500533533200075,新加坡,2,199500,记对我影响最大的一个人,95,90,62,61,76,383,C,
就这样，罗老师继续成为我的华文老师直[B至]到我初中毕业为止。,199500533519200092,马来西亚,2,199500,记对我影响最大的一个人,95,90,83,85,92,444,A,
她不幸患上了心脏病，也得了高血压，但她还是不停地工作，不停地为了我能过得好点儿而努力。,199500533533100125,新加坡,1,199500,记对我影响最大的一个人,95,85,60,57,76,371,C,
母亲[F親]是位普通的中国[F國]妇女，但她的人格、[BC，]为[F為]人处[C]事的方法影响了我的一生。,199510512501100507,中国,1,199510,记对我影响最大的一个人,90,95,55,48,82,368,未参加,
薪金方面可商量。,199503682519100507,马来西亚,1,199503,一封求职信,50,0,64,52,77,231,未参加,
只是{CQ靠}一个女人的劳[F勞]动来[F來]养[F養]育{CD了}我们。[BC.],199505550523100906,韩国,1,199505,记对我影响最大的一个人,65,60,39,48,39,234,未参加,
实际生活当中的他只有一个人在身旁，那就是44{CD个}年来一起生活的妻子。,199505550523100914,韩国,1,199505,记对我影响最大的一个人,70,70,70,73,74,345,C,
开始[C]想去中国留学，继续学习中国历史和语言。,199505104525200070,日本,2,199505,记对我影响最大的一个人,60,80,62,65,67,321,C,
她有吸引人的能力，[BC。]感[C]到郁闷{CC闷恨}，无聊的人们都到咖啡店和她聊一聊。,199505104525200102,日本,2,199505,记对我影响最大的一个人,55,60,39,42,39,216,未参加,
从小的时候{CQ起}，她{CQ的}意志和个性{CQ就}很强，而且很聪明。,199505104523200154,韩国,2,199505,记对我影响最大的一个人,60,80,70,75,53,325,C,
我和我父亲还[C]有一个共同[C]点。,199505104523200176,韩国,2,199505,记对我影响最大的一个人,70,60,65,63,57,300,C,
老师[BD“]加油[BD”][BQ！],199505104523100224,韩国,1,199505,记对我影响最大的一个人,65,75,62,57,63,309,C,
当时我们过得很开心，两[F兩]个人互相帮[F幇]助实在是过得很开心{CD了}。,199505104523100227,韩国,1,199505,记对我影响最大的一个人,60,60,65,59,51,277,未参加,
我想，如果没有三叔，就没有今天的我。,199508680519200504,马来西亚,2,199508,记对我影响最大的一个人,85,85,83,75,92,415,A,
一九七二年进入中学初中一年级，那时每个月都得交学费，又需[B须]要买课本及其他用具，实在好难捱。,199508683519100507,马来西亚,1,199508,记对我影响最大的一个人,90,90,70,77,86,411,B,
二十年的日子里，都是母亲负责我们兄弟们的生活起居与做学问。,199508680519100523,马来西亚,1,199508,记对我影响最大的一个人,85,80,81,73,84,396,B,
当时，80年代的中国经济刚开放不久，很多建设和设备都是处[F處]于刚起步。,200010543501250008,中国,2,200010,我第一次……,70,75,67,51,76,328,C,
然而现今的社会，很多女性也要求经[F經]消独[F獨]立。,200010602801250002,澳大利亚,2,200010,我对离婚问题的看法,80,75,75,83,85,389,B,
结婚后的夫妻往往都会有自己的孩子。,200010801801250015,澳大利亚,2,200010,我对离婚问题的看法,85,70,94,85,85,410,B,
还有夏天雨季的时候那怎么办?[BC。]下雨的声音和车的声音是肯定听不清楚。,200005108523200313,韩国,2,200005,关于用自然之声取代噪声的建议,65,70,78,44,48,291,C,
所以不仅比以前安全而且电车也不会误点。,200005108525200308,日本,2,200005,关于用自然之声取代噪声的建议,70,70,45,67,48,288,未参加,
提议内容如下两点：一，家庭有小孩子，小孩子听到飞机的噪声以后，就醒了{CC起}并{CC而}哭起来，为了孩子的健全成长{CC生长}，禁止{CC拒绝}机场晚上工作{CC开业}，即保护个人的日常生活；二，机场所在的地方是{CJX}本来西北机区，机场建设是后来地方政府{CJ+zy就}决定的，有了机场，对于商业来说，有好处，但存在着{CC于}不利的因素。,200005108525100323,日本,1,200005,关于用自然之声取代噪声的建议,65,70,75,57,54,307,C,
现在城市生活节奏很快，所以一般老百姓[B性]不但没有时间享受自然的{WWJ}（162Z）,200005108523200335,韩国,2,200005,关于用自然之声取代噪声的建议,70,75,83,72,76,365,B,
我就是住在那，去年的这个时间，我们学校的留学生是每天晚上，不只是晚上吧，整[B正]天都是不能做什么不能干什么，为了中国的建立五十周年[BQ，]王府井旁边的所有路上或者是所有的东西都重新{CC从来}开始{CD开始}修理了，这样的情识上我们一直能听到噪声而汽车喇叭声因为所有的路上要开始修理自然会发现小车的{CJ?}，那时后[F後]我们对学校建议了不少但他们的话[B瓜]就是“没[B设]办法”。,200005108523200353,韩国,2,200005,关于用自然之声取代噪声的建议,65,60,61,44,35,248,未参加,
可是我认为要改造这方面的技术，一定需要很长时间的，我们等看情况。,200005108525200393,日本,2,200005,关于用自然之声取代噪声的建议,75,80,70,75,63,354,B,
生活中，我们每天听到几十种的噪声。,200005108523100692,韩国,1,200005,关于用自然之声取代噪声的建议,65,70,59,70,59,309,C,
他说话时，百分之八十都不是真心话，这种人我永远不了解，也不想了解。,199711802801100007,澳大利亚,1,199711,我选择朋友的标准,75,60,44,60,54,279,未参加,
据我所知汉城的空气污染程度排在世界城市中的前位。,199705104523100012,韩国,1,199705,我的城市/乡村生活,70,75,74,70,61,339,C,
如果我得到{CC做到}那乡村人的生活的话，我一辈子肯定过得很快乐的。,199705104523100020,韩国,1,199705,我的城市/乡村生活,65,75,69,65,58,319,C,
因为、想起童年，[BC、]他们{WWJ},199705104523100076,韩国,1,199705,我的城市/乡村生活,70,45,44,42,56,238,未参加,
他们不在的家的时候，只有我一个人在家而已，因为我就是我家人当中最小的，哥哥们和姐姐也到外地挣钱去了。,199705104525100070,日本,1,199705,我的城市/乡村生活,60,60,55,47,54,258,未参加,
在那我发现了一只鸭子，我问：“妈妈，鸭子怎么不在水上，而在草坪上呀？,199705104523200096,韩国,2,199705,我的城市/乡村生活,60,60,66,38,46,252,未参加,
我是个韩国人，因爸爸的生意[B义]而来到中国。,199705104523200128,韩国,2,199705,我的城市/乡村生活,65,65,71,60,54,299,C,
也许[F許]是在城市久居之故，使我厌[F厭]倦了城市的生活和环境。,199705529529151007,泰国,1,199705,我的城市/乡村生活,80,85,91,77,90,417,B,
巴黎人周末也喜欢[F歡]出去呼吸{CC2呼}新鲜空气[F氣]。,199705610610100013,法国,1,199705,我的城市/乡村生活,65,70,62,48,44,275,未参加,
有些人遇到不如意的时[F時]候，总会唉声叹气、[BC，]怨天尤人，而我觉得困难[F難]和挫折是生命的一部分[BQ，]是不可{CD不}缺少{CC小得}的。[BC，],199810801801150015,澳大利亚,1,199810,如何面对挫折,70,60,40,56,48,259,未参加,
我就在这一年重新的站起来，很努力{CC用力}{CD的}地学习，把我以前的坏习惯都改过来。,199810602634150009,英国,1,199810,如何面对挫折,70,65,78,71,77,347,C,
还[F還]有，大多数[F數]的结果{CC成果}都是成功的，因为[F爲]挫折和各种{CC过[F過]中}问[F問]题[F題]，都有别人承担{CC成担[F擔]}了和解决[B缺]了。,199810602801150005,澳大利亚,1,199810,如何面对挫折,65,70,76,73,66,336,C,
但是越学汉语越可以理解中国人说的话，通过他们说的话，可以理解中国人的看法、[BC，]想法、[BC，]价值观念等等。,199804123525100152,日本,1,199804,学习汉语的苦与乐,80,65,57,71,66,327,C,
几天前我跟朋友谈话的时候，他问我，“你来中国干什么就是{WWJ},199804123523100196,韩国,1,199804,学习汉语的苦与乐,60,55,27,40,44,207,未参加,
那么，我对学中文很感兴趣，也觉得很有意思。,199804123523200271,韩国,2,199804,学习汉语的苦与乐,65,65,57,59,48,278,未参加,
我们做某件事都一样[BQ，]没有经过{CC通过}苦不能得到真正的乐。,199804124523200384,韩国,2,199804,学习汉语的苦与乐,65,60,60,62,56,286,C,
从那时候{CQ到现在}已经过了几年了。,199804124523200459,韩国,2,199804,学习汉语的苦与乐,70,80,72,69,58,339,C,
男人女人有一样的权利和义务[F務]，对家庭有共同的责[F責]任和负[F負]担。,199809542542200028,越南,2,199809,如何看待“妻子回家“,75,90,71,64,82,376,B,
在生活上遇到了困难是不多{CJs}，只是学习上如果学习成绩不好，别人不愿意跟我玩儿真的我们高中学校比较有名的{CJ?}。,199904123523200149,韩国,2,199904,如何面对挫折,60,65,37,47,41,233,未参加,
反正自己的人生是自己决定的。,199904123523200222,韩国,2,199904,如何面对挫折,70,65,56,70,76,323,C,
如果自己不能想出来办法，我去看一看同学。,199904123818100228,瓦努阿图,1,199904,如何面对挫折,65,75,48,37,32,244,未参加,
我想人生的道路，无论上学{CD了}、工作还是生活方面，总是会{CD给你}遇到{CC受到}挫折的。,199904124529200285,泰国,2,199904,如何面对挫折,70,75,70,39,61,304,未参加,
我们在这个{CC2这}世纪，这个{CC2这}社会里活着的时候会遇到数万的人。,199904124523200334,韩国,2,199904,如何面对挫折,70,65,59,60,56,296,C,
有的人勇敢与生活奋斗，不怕出力，[BC。]这种人才是生活的强者。,199904124623200324,南斯拉夫,2,199904,如何面对挫折,80,65,70,65,78,346,C,
有一天，家里只有我跟妈两个人在一起。,199904124523200407,韩国,2,199904,如何面对挫折,60,65,70,57,50,285,C,
冷静地总结经验，吸取教训。,199909529529151004,泰国,1,199909,如何面对挫折,85,90,88,93,95,447,A,
