错句,作文编码,国籍,性别,考试时间,作文题目,口试分数,作文分数,听力分数,阅读分数,综合分数,总分,证书
”和尚A喝水喝得很香{CD的}，而B、C却只能眼巴巴地看着。,200105109525100574,日本,1,200105,由“三个和尚没水喝”想到的……,70,70,70,62,97,357,C,
因为大家依靠别人，所以谁也不挑水{CJX}去。,200105109525200622,日本,2,200105,由“三个和尚没水喝”想到的……,60,55,45,47,41,229,未参加,
随着时间的推移，却{CJX}我们的想法变得很{CJ-buy不同}。,200105109525100703,日本,1,200105,由“三个和尚没水喝”想到的……,70,70,63,69,70,330,C,
太麻烦的事情谁也不敢做，但不{CC1没有}做{CJ-zy就}一直不能{CC没有}解决问题{CD了}。,200105109525200699,日本,2,200105,由“三个和尚没水喝”想到的……,65,60,48,38,55,249,未参加,
我想这样的情况亚洲[B州]比欧洲[B州]多。,200105109525200710,日本,2,200105,由“三个和尚没水喝”想到的……,70,75,70,62,73,339,C,
对于“安乐死”，我也很难说出如何看待好。,200205205525200028,日本,2,200205,如何看待“安乐死”,80,60,46,42,58,273,未参加,
如果这些事实正式地写在纸上、还有签个名，[BC、]然后跟医生谈一谈情况来决定，[BC、]就应该会得到社会的理解。,200205205525200084,日本,2,200205,如何看待“安乐死”,70,80,44,54,56,294,未参加,
不过，我想这个法律判得不对，[BC。]不能这样判。,200205205525200131,日本,2,200205,如何看待“安乐死”,70,75,71,60,63,328,C,
最近“死”和“活”的临界越来越模[B漠]胡了。,200205205525200136,日本,2,200205,如何看待“安乐死”,75,70,91,70,80,375,B,
病人的心情会给病情{CC病况}带来影响，所以要让她忘记这个烦恼。,200205302540200034,印度尼西亚,2,200205,如何看待“安乐死”,75,70,52,47,68,301,未参加,
对1994年初在中国农村发生的一切，我也觉得[BQ：]因为丈夫为了妻子进行了“安乐死”，所以他不应该受到法律的制裁。,200205206525100030,日本,1,200205,如何看待“安乐死”,80,75,41,76,75,338,未参加,
我家人说“如果我面对这种情况，我就毫[L]不犹[B忧]豫地选择[L]安乐死。,200205206525200033,日本,2,200205,如何看待“安乐死”,60,60,52,65,75,294,未参加,
虽然在世界上，对安乐死的看法有很多，但如果自己遇到{CC遭遇}了这种{CC件}事，比如自己的父母或家人得了一种不治之症[B病]，而且病人要求安乐死的话。,200205206525100040,日本,1,200205,如何看待“安乐死”,70,70,69,70,65,332,C,
有的人不想死，[BC。]受{CD到}多么{CJ-dy大的}痛苦也想活，{CJ+zhuy他}要活也一种选择[B译]{CJs}。,200205206525200042,日本,2,200205,如何看待“安乐死”,60,60,66,60,51,279,未参加,
这样病人怎么能安稳{CC安慰}地过日子呢？,200205206525200043,日本,2,200205,如何看待“安乐死”,60,60,71,60,58,291,未参加,
那时我{CJ-zy很}难受，我想如果把机器关掉，他{CJ-zy就}会死，那勉[B免]强让他活{CQ着}有意思吗？,200205206525200060,日本,2,200205,如何看待“安乐死”,55,50,71,72,87,314,未参加,
但是当时[B是]我想现在没什么办法。,200209550523250083,韩国,2,200209,如何解决“代沟”问题,65,60,51,47,50,256,未参加,
这时，最重要的是你先听对方的所有{CC全套}话。,200209550523250101,韩国,2,200209,如何解决“代沟”问题,60,60,63,62,54,281,未参加,
现在的年轻人在较富裕的物质社[C]会上享受{CC享[C]有}快乐的生活。,200209550523150117,韩国,1,200209,如何解决“代沟”问题,60,65,33,54,56,251,未参加,
自然产生{CC发[F發]生}心情{CJX}愉快{CC娱乐[F樂]}，也{CJX}自然父母与子女的谈话。,200209550501150142,中国,1,200209,如何解决“代沟”问题,65,65,24,32,36,206,未参加,
最后，最重要的是很深{CC大}的了解。,200209550523250154,韩国,2,200209,如何解决“代沟”问题,65,70,27,42,31,221,未参加,
但是那天我有要办的事情。,200209550523250206,韩国,2,200209,如何解决“代沟”问题,65,65,48,59,48,269,未参加,
因为爸爸连一次也没说过打我的理由。,200209550523250222,韩国,2,200209,如何解决“代沟”问题,70,60,60,52,38,265,未参加,
先{CJX}我们自己跟家人谈话吧。,200209550523150229,韩国,1,200209,如何解决“代沟”问题,65,65,42,54,48,258,未参加,
可以说不同的年龄的人们构成了一个家庭。,200209550523150234,韩国,1,200209,如何解决“代沟”问题,65,65,66,57,58,295,C,
因为什么人都有自己的想法，自己的看法。,200209550523250239,韩国,2,200209,如何解决“代沟”问题,65,60,54,45,56,263,未参加,
这意味着我们已经知道解决的办法。,200209550523250290,韩国,2,200209,如何解决“代沟”问题,65,60,54,62,48,272,未参加,
而我以为，这种态度才是最根本的，必须达[F達]到共识的。,200209550501150321,中国,1,200209,如何解决“代沟”问题,95,75,78,86,84,413,B,
只要我们都具有了解对方的想法就可以了。,200209550523250320,韩国,2,200209,如何解决“代沟”问题,65,65,78,79,70,341,C,
那么现在呢？,200209550523250334,韩国,2,200209,如何解决“代沟”问题,65,70,63,67,62,313,C,
有时候，倾听是最好的沟通。,200209550523250787,韩国,2,200209,如何解决“代沟”问题,65,80,51,64,62,310,C,
到底为什么和长辈们发生这些问题呢？,200209550523150820,韩国,1,200209,如何解决“代沟”问题,70,80,57,54,58,309,C,
”就是这句话。,200209550523150935,韩国,1,200209,如何解决“代沟”问题,70,65,63,64,56,304,C,
别忘记，最重要的是你们和我们的心。,200209550523250958,韩国,2,200209,如何解决“代沟”问题,65,70,63,59,54,297,C,
就是双方不承[C]认这现象为理所当然的。,200209550523250960,韩国,2,200209,如何解决“代沟”问题,70,60,78,81,68,342,C,
现在，[BC、]西方的很多国家承[B成]认[B任]“安乐死”，[BC。]但这个{CQ对}东方国家来说，大部分不承[B成]认[B任]。,200205271525100037,日本,1,200205,如何看待“安乐死”,65,65,58,51,42,265,未参加,
安乐死，在现代社会上常常听到的很重要的问题{CJs}。,200205271525200090,日本,2,200205,如何看待“安乐死”,65,85,71,74,63,348,B,
环境问题目前是世界各国十分重视的一个问题。,200306542542230012,越南,2,200306,口香糖与环境卫生,50,50,24,30,21,153,未参加,
我认为这个办法不恰当，这不是只有我们国家[BQ，]听说{CJ-dy另}一些国家也有同样的事情。[BC，],200307109523100006,韩国,1,200307,绿色食品与饥饿,65,60,64,46,64,282,未参加,
为了解决这个问题，政府应控制生产。,200307109523200020,韩国,2,200307,绿色食品与饥饿,70,90,80,70,84,387,B,
但我还是反对这种行为。,200307109523200041,韩国,2,200307,绿色食品与饥饿,60,60,54,35,18,209,未参加,
所以[BD、]为了我们健康我[C]们应该决心吃“绿色食品。,200307109525100040,日本,1,200307,绿色食品与饥饿,65,65,56,56,64,290,C,
生产量太少，[BC。]真是供不应求。[BC.],200307109523200103,韩国,2,200307,绿色食品与饥饿,70,75,54,46,70,304,未参加,
所以我们也可以利用科学来解决由{CC用}化学物食品引[L]起的副作用{CJ-by的问题}。,200307109523100196,韩国,1,200307,绿色食品与饥饿,80,85,75,72,90,396,B,
我们应该{CC首先}发明{CJ-sy种植}农作物的新方法。,200307109523200214,韩国,2,200307,绿色食品与饥饿,60,50,46,43,53,232,未参加,
现在我们不满足于吃饱，而重视吃什么。,200307109523200236,韩国,2,200307,绿色食品与饥饿,65,65,70,46,81,311,C,
但是没有限制地使用很可能破坏生物链{CC3物链[B连]}，结果环境破坏严重，人的体内也积累化学物质，以致增加{CJX}病人。,200307109525100262,日本,1,200307,绿色食品与饥饿,80,85,51,62,79,351,C,
这样在韩国产生没有消费的米来能挨饥饿{CJ?}。,200307109523100331,韩国,1,200307,绿色食品与饥饿,65,80,64,67,76,340,C,
我们很难找{CJ-buy到}真正的[BQ“]绿[C]色食品[BQ”]。,200307109523100378,韩国,1,200307,绿色食品与饥饿,60,60,46,22,44,214,未参加,
我认为{CD使}“绿色食品”这个事业好好发展下去，可以帮助那些饥饿的人。,200307109523200375,韩国,2,200307,绿色食品与饥饿,65,80,86,54,73,346,C,
我家一般买“绿色食品”。,200307109523200430,韩国,2,200307,绿色食品与饥饿,65,95,80,59,93,383,C,
{CP现在{CQ的}时代吧[BQ，]很多地方的各方面的发展[B岁]{CJ-sy很快}[BQ，]所以污染严重{CC2大}[BQ。]P}我们{CQ的}食品都是污染的[BQ。]{CJ-zhuy我们}不得[C]不用农[B衣]药[BQ，]可是我们的健[C]康[BQ、]我们的空间是不安全的[BQ。]空气噪[C]音等等{WWJ}对不起我是没有写过作文{CC文}[BQ，]以后再{CC在}考{CD的}时多学学好好地{CC的}写作文{CC文}[BQ。]谢[C]谢[C]。[BC.],200307109523100440,韩国,1,200307,绿色食品与饥饿,50,40,46,11,24,146,未参加,
首先，我还是重视绿色食品的意义。,200307109525200481,日本,2,200307,绿色食品与饥饿,65,80,72,64,79,348,C,
虽然使用化肥与农药的农作物的大量生产有害于我们的健康，我们也不能牺[F犧]牲我们的朋友们。,200307109525200495,日本,2,200307,绿色食品与饥饿,65,55,67,67,70,306,C,
因此在粮食的生产过程中，“绿色食品”更居重要位置的{CJsd}。,200307109523200522,韩国,2,200307,绿色食品与饥饿,85,90,75,72,93,411,B,
人得有饮食才能活下去。,200307109523200542,韩国,2,200307,绿色食品与饥饿,75,65,56,35,56,274,未参加,
什么是“绿色食品”呢？,200307217523100016,韩国,1,200307,绿色食品与饥饿,85,70,75,75,87,383,B,
但我们提醒[C]一下我们同胞[B饱]们。[BC.],200307217523200032,韩国,2,200307,绿色食品与饥饿,65,60,62,41,53,264,未参加,
你想一想吧！{CQ在},200307217523200051,韩国,2,200307,绿色食品与饥饿,65,65,72,62,73,321,C,
所以为了处理这[C]些问题，自己好好儿决定{CD总[C]}自己[B白]已的无污染食品。[BC.],200307217523100060,韩国,1,200307,绿色食品与饥饿,65,60,51,46,73,278,未参加,
那应该先解[C]决哪个问题呢？,200307217523200059,韩国,2,200307,绿色食品与饥饿,60,70,88,70,84,357,C,
为了解决这个问题，还需要政府的支援[B缓]。[BC.],200307217523200084,韩国,2,200307,绿色食品与饥饿,65,60,86,56,81,331,C,
为了适应人们多[C]样的要求制造出来的就是绿色食品。,200307217523100106,韩国,1,200307,绿色食品与饥饿,65,65,62,51,61,288,C,
看不起西部吗？,200307217523100117,韩国,1,200307,绿色食品与饥饿,65,55,64,70,58,294,C,
我想对人类来说健康是最重要的因素{CC要素}。,200307217523200114,韩国,2,200307,绿色食品与饥饿,60,65,67,56,61,292,C,
在农作物的生长过程中使用化肥和农药[BD.]能使农作物产量高，[BD.]可是对身体不好。,200307217523200126,韩国,2,200307,绿色食品与饥饿,70,70,75,46,81,330,C,
人们越来越喜欢这[C]样的食品，[BC.]可是世界上有很多挨饿{CQ的}人{CC1人们}，[BC.]哪[B那]一个问题更重要呢？{CP我觉得人们一直研究着有关食品的东西，这[C]样的活动很重要，一定要把它进[C]行{CJ-buy下去},200307204523100023,韩国,1,200307,绿色食品与饥饿,60,65,59,46,56,269,未参加,
世界上的东西原来是自然的，[BC。]所以应该不用钱的。,200307204525200065,日本,2,200307,绿色食品与饥饿,55,65,38,43,24,207,未参加,
尽管[BD，]在世界上有很多人还[C]没有饭吃，我们应[C]该帮助他们。[BC、],200307204525100123,日本,1,200307,绿色食品与饥饿,80,85,72,64,81,376,B,
有能力的人，在好的环境下能生活时，不可以以此{CC2他具有的}骄[Pjiào]傲[Pāo]，而得考虑[C]到周围有没有人有{CC1经过}困难。,200307205523200014,韩国,2,200307,绿色食品与饥饿,60,65,72,56,76,312,C,
我认为不要只顾个人，而要考虑[F慮]全球规模的人类之问题。,200307205525100049,日本,1,200307,绿色食品与饥饿,70,60,70,56,67,308,C,
我们每个人{CD得}要保护它们[BQ，]{CJ-sy使}{CJ-by它们}恢[B回]复[B腹]自己再生的能力{CJjy}。,200307205523200078,韩国,2,200307,绿色食品与饥饿,70,70,64,46,44,282,C,
我过去工作也非常困难。,200307212525100001,日本,1,200307,绿色食品与饥饿,65,65,56,51,70,291,未参加,
是一目了然的。[BC.],200307212523100027,韩国,1,200307,绿色食品与饥饿,65,70,51,43,67,282,未参加,
世界上正大力推广绿色食品，即是无公害食品。,200307212523100043,韩国,1,200307,绿色食品与饥饿,75,70,78,70,84,366,B,
如果没钱买不了食品，[BC、]没有什么吃的东西而不能吃的话，我觉得这[C]个是最难受的。,200307212523200050,韩国,2,200307,绿色食品与饥饿,65,70,72,62,58,313,C,
人类吃的东西[BQ，]对人类来说最重要[BQ，]我觉得先{CJX}粮食的产量增加以后，[BC.]{CQ再}讲究生产的粮食的质量[BQ。]人类[C]是以食为主的[BQ，]如果没有粮食，不够{CJX}粮食的{CQ话}[BQ，]{CJ-zy会}给人类带来很大的影响。,200307209523100024,韩国,1,200307,绿色食品与饥饿,60,60,51,43,53,249,未参加,
过一段的时间后没有效果。,200307209523100031,韩国,1,200307,绿色食品与饥饿,65,65,80,54,50,298,C,
对于绿色食品和饥饿的问题，我认为还[C]是绿色食品是重要的。,200307209525200035,日本,2,200307,绿色食品与饥饿,65,75,70,64,67,328,C,
其中，对食来说，比别的条件更重要的{CJbi}。,200307201523200025,韩国,2,200307,绿色食品与饥饿,65,60,59,46,41,254,未参加,
还[C]有这[C]一个绿色食品没用农药，所以，被虫子破坏{CC坏}的地方比较多。,200307201523200061,韩国,2,200307,绿色食品与饥饿,60,60,48,27,35,212,未参加,
人们认为在农作物的生长过程中，为了增加收获量{CQ而}使用一些农药[BQ，]{CQ结果}给{CC对}人体带来了不好的影响。{CD面},200307201523200072,韩国,2,200307,绿色食品与饥饿,65,70,78,72,87,358,C,
所以对身体{CJ-sy有}好处是当然的。,200307302523200013,韩国,2,200307,绿色食品与饥饿,70,60,51,41,41,248,未参加,
还是选择人们的饥饿呢？,200307302523200049,韩国,2,200307,绿色食品与饥饿,80,75,75,62,93,376,B,
这些都是因为现存在的科技水平的限制，还有人们的意识上的问题。,200307302523200072,韩国,2,200307,绿色食品与饥饿,80,70,67,59,64,330,C,
在这种情况下，没有可治疗的药的话，那个人只有等待死亡[C]的日期。,200307302523200121,韩国,2,200307,绿色食品与饥饿,70,65,64,51,73,309,C,
我认为绿色食品是应该有的。[BC.],200307302523100143,韩国,1,200307,绿色食品与饥饿,65,65,56,49,58,277,未参加,
食品是人类[C]生存的[C]重要因素之一，[BC.]但是每个国家的[C]经济水平不一样，[BC.]也{CJX}生活水平不平等[BQ，]讲究“绿色食品”好像是发达[C]国家的[C]潮流{CJ+zxy的话题}。[BC.],200307302523100146,韩国,1,200307,绿色食品与饥饿,70,60,59,51,32,257,未参加,
第二，为了避免饥饿，发达{CC开发}地区的人帮助贫困地区的人的经济上的问题，不让贫困地区的人为了生存随便破坏[B害]自然环境。,200307215523250005,韩国,2,200307,绿色食品与饥饿,65,70,62,56,79,318,C,
总的来说[F說]这已[B乙]成为{CC形成}一种普遍现[F現]象[B相][BQ，]{CQ并}为[C]社会所接受。,200309529529151006,泰国,1,200309,我对男女分班的看法,60,65,49,42,72,271,未参加,
我认为先要看各个国家的教育系统是怎么样{CC怎么分}呢{CJsd}。[BC？],200309529529251016,泰国,2,200309,我对男女分班的看法,60,65,47,35,42,232,未参加,
只要父母亲能信任自己的儿女，男女分不分班又有什么问题呢？,200310512512250017,菲律宾,2,200310,我对男女分班的看法,65,80,71,65,90,359,C,
不管是什么样的人，接受新的“文化”时，{CQ会}感到不安。,200310576525200047,日本,2,200310,我对男女分班的看法,65,70,44,44,54,263,未参加,
虽这么说，但{CQ也}有许多例外{CD的}。,200310602801250003,澳大利亚,2,200310,我对男女分班的看法,65,65,60,61,72,307,C,
{CJ-zhuy他}不得意[BQ，]潦倒不堪{CC4潦倒}，下决心努力再勤读[F讀][BD，]兵书，最后{CJ-sy成为}能统领六国的宰相，这就是阅读的好处。,200310540540150020,印度尼西亚,1,200310,谈有效阅读,65,65,45,40,55,254,未参加,
当然这么多的书籍{CJ+zxy丛}里，包含着各种不同的种类。,200310540540150065,印度尼西亚,1,200310,谈有效阅读,65,65,43,58,79,294,未参加,
可是早恋有什么不好的呢？{CP比如说，我要是找到了一位我喜欢的人，他成[C]为我的男朋友，这就说明我不会认真学习了吗？从一位学生的角度来看，我不会喜欢父母把我放到一个女子学校的。父母应该[B因]{CJ+sy学到},200311956922250004,美国,2,200311,我对男女分班的看法,60,60,47,14,38,201,未参加,
很久以前，男女在社会上的地位不同，[BC。]当[F當]女性好不容易可以追求知识[F識]的时[F時]候，男女还得保持一定的距离[F離]。,200311952922230010,美国,2,200311,我对男女分班的看法,75,80,74,70,85,375,B,
虽然我的汉语水平不太高[BQ，]可是我不会放弃[B齐]汉语的。,200304131539200040,印度,2,200304,我学汉语是为了……,70,70,33,49,63,273,未参加,
我{WWJ},200304131539200040,印度,2,200304,我学汉语是为了……,70,70,33,49,63,273,未参加,
由于我是印尼华人，因此我从小就{CD应该}学汉语，然而在我国，学汉语的环境不利。,200304131540200088,印度尼西亚,2,200304,我学汉语是为了……,75,65,65,38,57,287,未参加,
原因是因为最近几年中国经济日益发展，所以汉语就越来越热{CC红}了。,200304131529200125,泰国,2,200304,我学汉语是为了……,65,75,36,38,57,258,未参加,
来中国之前，我并不知道汉语是什么样的语言，我只听别人说，汉字像图画一样，很美，很神秘[B密]。,200304131542200091,越南,2,200304,我学汉语是为了……,90,85,68,63,77,380,C,
在任何校际比赛，包括学术和课外活动，男女生会很自然地强调男权主义或女权主义，希望在竞争中{CC下}争取胜利，宣扬各自性别的胜利。,200306680519250006,马来西亚,2,200306,我对男女分班的看法,85,80,77,77,92,404,B,
这是因为该项制度会对男女学生的互相了解及沟通[BD，]构成一定的障碍，在男女之间形成一种隔阂，进而衍生出种种棘手的社会问题，诸如同性恋、性别歧视以及性别优越主义等，实在多不胜数，不能尽录。,200306680519150036,马来西亚,1,200306,我对男女分班的看法,85,90,77,72,96,416,B,
对男女分班{CJ+zxy的看法}，我是不赞成的。,200306680519250052,马来西亚,2,200306,我对男女分班的看法,90,90,82,77,94,431,A,
他们[C]选择使用化肥[B服]和农药的办法。,200307271523200002,韩国,2,200307,绿色食品与饥饿,65,60,56,25,56,245,未参加,
随着人们生活水平的发展，很多人注重了自己的健康。,200307271523100027,韩国,1,200307,绿色食品与饥饿,70,70,59,56,70,313,C,
虽然绿色食品，对人的身体有好处。,200307271523200031,韩国,2,200307,绿色食品与饥饿,75,65,70,49,73,319,C,
不过最近几年，中国政府也意识到吸烟的坏处[C]和对人的身体健康有影响[F嚮]。,200405109525100130,日本,1,200405,吸烟对个人健康和公众利益的影响,70,70,57,58,59,302,C,
这个问题不仅是环[F環]境污染{CJ-zxy问题}，还涉及到青少年{CJ-zxy习惯}养成的问题，[BC。]还有被动{CC2副}吸烟的问题。,200405109525100168,日本,1,200405,吸烟对个人健康和公众利益的影响,60,60,45,31,41,219,未参加,
所以对社[C]{WWJ},200405109523200372,韩国,2,200405,吸烟对个人健康和公众利益的影响,50,65,69,46,57,268,未参加,
为了提高人们思想素质、[BC，]公共道德，我们必须采取严厉[B历]的惩罚措施。,200405109525200404,日本,2,200405,吸烟对个人健康和公众利益的影响,75,70,57,70,73,334,C,
最严[F嚴[C]]重的事，{CJ-sy是}有的人走着抽烟时，不小心把烟头{CQ碰}在小孩子的脸上{CD摸[B膜]了}。,200405109525100480,日本,1,200405,吸烟对个人健康和公众利益的影响,55,65,45,56,59,262,未参加,
真不知道为什么大男人大多{CC大概}都吸烟。,200405109523200590,韩国,2,200405,吸烟对个人健康和公众利益的影响,65,55,57,50,59,268,未参加,
还有我上次看报纸上的报道，[BC。]每年递增[C]{CJX}肺癌{CC1癌症}患[C]者，而大部分是长期吸烟者。,200405109523200639,韩国,2,200405,吸烟对个人健康和公众利益的影响,65,60,57,60,50,275,未参加,
这样，在社会上不会{CC能}出现互相的利益矛盾的现象。,200405109523100696,韩国,1,200405,吸烟对个人健康和公众利益的影响,70,65,52,56,68,297,C,
所以现代全世界先进国家为了保护人们[C]的健康，用法律来控制吸烟者的吸烟范围。,200405109523200753,韩国,2,200405,吸烟对个人健康和公众利益的影响,65,65,59,48,48,269,未参加,
现在人们的生活水平{CJ+wy是}比以前高，还有各[B个]个方面的教[C]育也很[C]高，所以人们都知道吸[C]烟对自己的影响很不好。{CP第二，吸[C]烟的问题不但{CJ-sy是},200405109523200961,韩国,2,200405,吸烟对个人健康和公众利益的影响,70,0,36,35,37,171,未参加,
第一，吸烟对个人健康毫无好处。,200405109523200996,韩国,2,200405,吸烟对个人健康和公众利益的影响,75,65,67,70,79,343,C,
吸烟对公众利益也有影响。,200405109525201024,日本,2,200405,吸烟对个人健康和公众利益的影响,70,60,33,56,59,263,未参加,
这是为了公众利益和保洁{CJX}城市环境{CQ并}取得{CC大}了很大的成果。,200405109525201065,日本,2,200405,吸烟对个人健康和公众利益的影响,70,65,69,70,68,328,C,
一辆{CC个}公共汽[L]车里充满{CC2满}着黑烟，[BC。]人们都带着口罩{CC布}很痛苦的样子。,200405109523201430,韩国,2,200405,吸烟对个人健康和公众利益的影响,75,70,62,54,64,314,C,
我觉得这是一个好的选择[B译]。{CP当[C]然抽烟的人多，但还是少于不抽烟的人。在公共场所里{CD应该},200405109523101438,韩国,1,200405,吸烟对个人健康和公众利益的影响,80,70,57,50,55,302,未参加,
在公共场所，大家都关心[L]自己的事情[BQ。]可是旁[B傍]边的人一直抽烟，那么肯定是有影响了。,200405109523201446,韩国,2,200405,吸烟对个人健康和公众利益的影响,70,65,55,39,57,272,未参加,
因为我非常担心[BD，]青少年的吸烟者的增加，青少年是国家的未来，损害未来的东西我们不能忽视。,200405109525201447,日本,2,200405,吸烟对个人健康和公众利益的影响,75,60,52,46,55,274,未参加,
从{CC对}我个人主观的意见来说，我的身体不能接受烟。{CP如果有人在我的旁边儿抽烟，我不由得开始咳嗽[B嗍]，不能停下来。P},200405109525201510,日本,2,200405,吸烟对个人健康和公众利益的影响,55,60,50,68,59,273,未参加,
好多人都想戒{CD吸}烟。,200405109523201559,韩国,2,200405,吸烟对个人健康和公众利益的影响,70,65,57,77,66,321,C,
为什么不许吸烟呢？,200405109523201851,韩国,2,200405,吸烟对个人健康和公众利益的影响,70,65,69,58,59,307,C,
在公共场所{CD当中}能吸烟的地方越来越少{CC小}，这{CJ+wy是}对爱烟者是一个不好的消息，但是除[B处]了个人的健康之处，对{CC1为了}他人的健康和公共场所的环[B坏]境美化和清洁{CJ-zy也}是必要的{CJX}一个活动。{CJ-sy吸},200405109523101869,韩国,1,200405,吸烟对个人健康和公众利益的影响,55,75,55,27,44,241,未参加,
据[B剧]一个调查显示，50岁的非吸烟者的身体状况相当于40岁的吸烟者。,200405109523200558,韩国,2,200405,吸烟对个人健康和公众利益的影响,85,80,56,56,66,336,C,
总之，吸烟对个人健康和公众利益的影响很大，[BC。]而且{CC还有}都是不好的影响。,200405109523200644,韩国,2,200405,吸烟对个人健康和公众利益的影响,80,65,58,77,73,341,C,
假如在世界上消失了{CJX}香烟，他们就不能冷静、很容易发脾气，什么时候都感到烦躁，[BC。]所以没有香烟就不能正常地生活。[BC.],200405109525100685,日本,1,200405,吸烟对个人健康和公众利益的影响,75,65,60,73,75,335,C,
同时，们要教育人们，让大家拥有环境保护的观念，了解{CC理解}吸烟的坏处。,200405109525200773,日本,2,200405,吸烟对个人健康和公众利益的影响,70,70,68,75,73,344,C,
吸烟者在人口密集的商业中心抽烟的话，周围[C]的人当然会闻到他或她抽的烟。,200405109525100789,日本,1,200405,吸烟对个人健康和公众利益的影响,65,70,62,48,73,304,C,
伴随这些潮流，戒烟运动也逐渐扩展，有些机关[B官]采取形形色色的措施来扩展戒烟或减少吸烟活动，同时保持市容整洁。,200405109523201152,韩国,2,200405,吸烟对个人健康和公众利益的影响,65,85,74,70,75,359,B,
可以导致很多的病，[BC。]尤[B优]其是他们成了成人，很可能{CJ+zy容易}得严重的病而死去，[BC。]更何况{CJ+wy是}女青少年会影响到下一代的健康。P},200405109523200357,韩国,2,200405,吸烟对个人健康和公众利益的影响,65,65,74,75,85,348,C,
