错句,作文编码,国籍,性别,考试时间,作文题目,口试分数,作文分数,听力分数,阅读分数,综合分数,总分,证书
曾任职于大华旅游公司二年，职位是经理。,199312533533100059,新加坡,1,199312,一封求职信,90,80,76,74,80,395,B,
一九八七年毕业于新加坡理工学院广告系，同年获学院毕业文凭和全系广告设计比赛第[B弟]三名。,199312533533100066,新加坡,1,199312,一封求职信,85,65,76,76,78,371,B,
祝生意兴[F興]隆×××1993{CQ年}12{CQ月}04日,199312533533100071,新加坡,1,199312,一封求职信,60,55,48,69,62,275,未参加,
期待您的提拔与栽培，谢谢。,199312533533100153,新加坡,1,199312,一封求职信,85,70,76,80,89,392,B,
我在日本高中毕业后，上了中国研修学校，修学了两年半的汉语基础以及一些翻译技巧，成绩一向优良，全勤。,199312124525100244,日本,1,199312,一封求职信,65,80,76,67,87,363,B,
而且我在大学时专门学习中国历史。,199312123525200402,日本,2,199312,一封求职信,70,65,69,48,48,287,C,
同志[BQ，]如果你们给我工作{CC2面[C]}我当然很高兴[BQ，]同时请你们给我写信，来[C]告诉我什么工作可以干，从什么时候[C]开始，每[C]个月的收[B受]入。[BC，],199312123914100409,古巴,1,199312,一封求职信,40,55,20,37,39,167,未参加,
我的第二外语是日语。,199312123525200510,日本,2,199312,一封求职信,60,65,46,59,39,253,未参加,
我在日本高中毕业以后，[BC、]进了英语专门学校学了两年的英语。[BC.],199312123525200913,日本,2,199312,一封求职信,60,55,43,56,50,245,未参加,
果然我父亲与他的父亲没感情{CC不切情}。,199412123922100009,美国,1,199412,记我的父亲,55,65,44,32,47,225,未参加,
我是一个女孩子，但从小时候{CQ起}常常跟[C]父亲谈话、玩儿。,199412123525200101,日本,2,199412,记我的父亲,55,60,41,44,59,240,未参加,
第二天他还买来关于中国的书，自己研究中国的情况，我不禁叹地说[BQ：]“不是你去中国[BQ，]但，你的好奇心和研究心越老越大。,199412123525200101,日本,2,199412,记我的父亲,55,60,41,44,59,240,未参加,
他总想让我多听音[C]乐，多看书，早一点儿明白人生道理。,199412124520200049,蒙古国,2,199412,记我的父亲,60,75,70,63,76,330,C,
当然他{CD的}公司的产品受到了老百姓的欢迎，松下电器公司最后成为{CD那么}名驰国内外的大企业了。,199412124525100058,日本,1,199412,记对我影响最大的一个人,80,80,81,57,76,366,B,
不过[BQ，]知道×××××的逸事{CQ后}，我深深地感到了给人民、社会做出贡献的重要性。,199412124525100058,日本,1,199412,记对我影响最大的一个人,80,80,81,57,76,366,B,
能听他的课，令人多么幸福啊！,199412104525200664,日本,2,199412,记对我影响最大的一个人,70,65,70,71,67,329,C,
我也经常听到{CC2听}这种话。,199412104525200661,日本,2,199412,记对我影响最大的一个人,60,60,57,57,47,263,未参加,
不过过一会就好了。,199412104525200657,日本,2,199412,记对我影响最大的一个人,60,60,57,55,47,261,未参加,
因为我对{CC的}社团的生活太认真，所以我不爱学习专业方面的学业。,199412104523200654,韩国,2,199412,记对我影响最大的一个人,60,65,68,65,57,298,C,
每一个[F個]小孩子当[F當]看见旁边其[B期]他小孩所玩着的玩具或吃着的糖果{CJ-zxy的时候}[BQ，]都会[F會]想过[F過]去叫妈[F媽]妈[F媽]买给[F給]他，我也是一样[F樣]，同样[F樣]有这[F這]种[F種]想法，但当[F當]我每次开[F開]口叫妈[F媽]妈[F媽]买[F買]时[F時]，她总[F總]不买[F買]，还[F還]说：“小宝[F寶]宝[F寶]，你常常看见[F見]人家买[F買]什么[F麼]，就要买[F買]什么[F麼]，这[F這]是不行的。,199412104625200111,葡萄牙,2,199412,记对我影响最大的一个人,60,70,39,38,57,249,未参加,
他今年七十多岁的已退休整整七年的老教授{CJs}。,199412104523100667,韩国,1,199412,记对我影响最大的一个人,55,60,81,75,67,319,未参加,
那时，出乎我们意料的事情发生了。,199412104523200678,韩国,2,199412,记对我影响最大的一个人,55,60,68,46,49,259,未参加,
那是一次很难[F難]忘的经历{CC经验[F驗]}。,199409543634200212,英国,2,199409,学习汉语的苦与乐,90,65,67,75,88,377,C,
至于[F於]学[F學]习[F習]汉[F漢]语[F語]乐[F樂]的方面，当[F當]我们[F們]在学[F學]习[F習]期间，我们[F們]定当[F當]由循序渐[F漸]进[F進]式地学[F學]习[F習]到汉[F漢]语[F語]，{CJ-zhuy这}使我们[F們]可以掌握到一些修辞[F辭]技巧，知识[F識]水平上升，能用精简[F簡]的字句道出一些要表达[F達]的意思等。,199409543634200207,英国,2,199409,学习汉语的苦与乐,80,75,45,50,73,314,未参加,
而我就找出一个既有趣，又能提高我的汉语水平的方法，那就是收听[F聽]中国的相声艺术[F術]{CD了}。,199409543634200225,英国,2,199409,学习汉语的苦与乐,90,90,76,79,91,424,A,
可就不当他那样的老师[BD。]！[BD”],199500533540200112,印度尼西亚,2,199500,记对我影响最大的一个人,65,65,75,73,82,344,C,
为此，我还与她起了好多次争执，经常[C]闹得不欢而散。,199500533533200124,新加坡,2,199500,记对我影响最大的一个人,95,90,99,75,90,448,A,
妈[F媽]妈[F媽]希望你能识[F識]字，能懂得做生意，能有很多钱[F錢]，以后[F後]我们[F們]老了，你就能来孝顺[F順]我们[F們]，让[F讓]我们[F們]享受人生[BQ”]。,199510512512100506,菲律宾,1,199510,记对我影响最大的一个人,90,95,55,54,57,349,C,
她那种任劳[F勞]任怨的品德，使我十分钦[F钦]佩。,199510512512200522,菲律宾,2,199510,记对我影响最大的一个人,90,95,64,58,91,396,C,
我本人认[F認]为[F為]“安乐死”是一个可解决[F決]病人痛苦的{CJ+dy一个}方法。,199511543501100513,中国,1,199511,如何看待“安乐死”,75,90,36,35,61,291,未参加,
以下是本人的简历：一、资历：毕业于马来亚艺术学院广告设计班。,199503680519100534,马来西亚,1,199503,一封求职信,80,75,74,70,84,374,B,
二、经验：曾任国家电视台广告部助理一年。,199503680519100534,马来西亚,1,199503,一封求职信,80,75,74,70,84,374,B,
本人目前担任丽美时装有限公司推销员一职，在服装推销方面具有4年经验。,199503680519100533,马来西亚,1,199503,一封求职信,80,80,74,83,95,404,B,
他太爱学问，当时朝鮮国王的入仕邀请{CC要请}，也不接受{CC容纳}，只在山谷里念书、穷[F窮]理居敬，培训弟子，终于成为万岁[F歲]之师，可不好吗？{CP我也跟着他的思想，在公司里工作时，平常尊敬别人，尽最大{CC善},199505550523100901,韩国,1,199505,记对我影响最大的一个人,60,55,36,55,55,242,未参加,
其实这个理由是拿忙做借口而已。[BC.],199505550523200910,韩国,2,199505,记对我影响最大的一个人,70,65,60,71,63,315,C,
有苦当[F當]然{CJ-zy也}有乐，我大学毕[F畢]业后[F後]，我到了一个[F個]大公司找工作，那公司无[C]条[F條]件地{CC的}录取{CQ了}我，因为[F為]我会讲[F講]汉语。,199505529529100006,泰国,1,199505,学习汉语的苦与乐,80,90,69,70,77,381,B,
现在，我已可以代笔为他人写信，流利地{CC的}交谈。,199505529529100016,泰国,1,199505,学习汉语的苦与乐,80,85,83,70,86,398,B,
一般來说，“[BC「]学[F學]习[F習]”[BC」]本身{CD里[F裡]面}就已经[F經]包含了“[BC「]挣[F掙]扎”[BC」]的[C]意义[F義]。,199505529529100071,泰国,1,199505,学习汉语的苦与乐,75,90,74,70,88,391,B,
人人都有自己的母亲[C]，但我的母亲[C]与别人的母亲[C]不同，因为我的父亲[C]{CQ在}我{CD从}小[B少]时[C]候[B后]去世[B死]，母亲[C]自己工作抚养{CC2养}四个孩子。[BC，],199505104523100033,韩国,1,199505,记对我影响最大的一个人,65,65,49,42,51,256,未参加,
所以她对于养孩子的方面{CJX}知识、经验很少。,199505104525200087,日本,2,199505,记对我影响最大的一个人,50,65,49,59,65,269,未参加,
听我姨母说，我母亲好几次跟我父亲吵架。,199505104525200087,日本,2,199505,记对我影响最大的一个人,50,65,49,59,65,269,未参加,
因为，[BC、]我的母亲也是这样活过来的。,199505104525200115,日本,2,199505,记对我影响最大的一个人,50,70,44,61,49,257,未参加,
他从初中毕业以后上了A高中。,199505104525100160,日本,1,199505,记对我影响最大的一个人,70,75,81,71,74,360,B,
外祖母去逝后的{CD有}一天，母亲说：外祖母住院的时候，还想{CC1考虑}着孙女。,199505104525200190,日本,2,199505,记对我影响最大的一个人,70,80,86,79,67,372,B,
他二十三岁的时候跟妈妈结了婚{CD了}。,199505104525200203,日本,2,199505,记对我影响最大的一个人,70,60,60,57,65,297,C,
他作为一个工作人员走遍了什么非洲[B州]哇，南美洲{CC3南州}，中近东，欧洲[B州]等等，有石油的地方都去了。,199505104525100208,日本,1,199505,记对我影响最大的一个人,60,60,39,53,63,257,未参加,
我们俩{CC两}一直受到{CD了}她各[B个]方面的影响{CC响影}。,199505104922100209,美国,1,199505,记对我影响最大的一个人,80,65,60,61,47,301,C,
最重要的是，他让我明白到，人的生命是有限，随[F隨]时要珍惜时间，做一些不会让自己以后后悔的事，跟猪大哥相处了差不多一年，我发现自己散漫的习惯改了不少，待人接物也比以前积极了。,199505104919200220,加拿大,2,199505,记对我影响最大的一个人,90,70,89,79,88,409,B,
我[C]一个人孤孤单单地过日子。,199505104523100227,韩国,1,199505,记对我影响最大的一个人,60,60,65,59,51,277,未参加,
听说他现在{CJ-zy在}读研究生。,199505104523200280,韩国,2,199505,记对我影响最大的一个人,70,60,83,67,78,343,C,
我有一个姐姐和一个弟弟，我和我弟弟年龄离的很近{CC小}，[BC、]所以经常打架{CC2打}、吵架{CC2吵}，但是我和我姐姐年龄[L]差7岁，所以从小就有些疏[C]远。[BC，],199505104525200303,日本,2,199505,记对我影响最大的一个人,0,75,86,65,76,298,未参加,
他肯给予[B于]我很大的自主权来选择选修的学科而不一味[B昧]为了“钱途”而要求我选修一些我不喜欢的科目。,199508680519200519,马来西亚,2,199508,记对我影响最大的一个人,85,90,94,69,76,410,A,
她会一边洗衣服{CC2衣}，一边告诉我她家乡的一切，当时我只有六岁，不是很懂，却也多少了解一些。,199508682519200545,马来西亚,2,199508,记对我影响最大的一个人,85,85,78,71,84,398,B,
我回头看桌上相架里的照片，相片[L]中的人是我一生里最尊敬的父亲，他是影响我最大的一个人。,199508683519100550,马来西亚,1,199508,记对我影响最大的一个人,85,85,86,81,82,414,A,
的事情。,200010801801250013,澳大利亚,2,200010,我对离婚问题的看法,80,70,67,70,65,342,C,
婚姻是一辈[F輩]子的承诺[F諾]，是圣[F聖]洁的，一旦[B但]对[F對]了另一个[F個]人有这[F這]种[F種]承诺[F諾]，就不能轻[F輕]易的放弃[F棄]。,200010602543250005,香港地区,2,200010,我对离婚问题的看法,90,85,83,80,93,428,A,
每天听到这些声音会使我们的脑子受到{CC收到}不好的影响，如果有一天叫我们把这些噪声当成自然的声音，那你说这是可能的吗？,200005108501200278,中国,2,200005,关于用自然之声取代噪声的建议,85,90,70,39,52,332,未参加,
我很赞同他们的做法。,200005108523100284,韩国,1,200005,关于用自然之声取代噪声的建议,75,85,83,88,91,415,A,
但是，目前我们到哪儿去都躲避不开噪音。,200005108525200286,日本,2,200005,关于用自然之声取代噪声的建议,70,85,78,83,82,390,B,
我已经说这个办法不能真正解决噪声问题。,200005108525200307,日本,2,200005,关于用自然之声取代噪声的建议,65,75,70,85,82,364,B,
我为什么这么赞成这个计划呢？,200005108525200395,日本,2,200005,关于用自然之声取代噪声的建议,70,75,80,78,78,370,B,
我要写关于自然之声取代噪声的建议。,200005108523200401,韩国,2,200005,关于用自然之声取代噪声的建议,60,60,18,42,48,210,未参加,
每一个人在生活上所使用的电器产品为例，制造商生产某一产品的时候，为使用者著想{CQ从}生产的东西本身的功能来说不必要发出声音，但，实际上加上一个功能却{CC而}造成了噪音的问题了。,200005108525100633,日本,1,200005,关于用自然之声取代噪声的建议,70,65,61,47,50,279,未参加,
可是现在呢？,200005108525200704,日本,2,200005,关于用自然之声取代噪声的建议,70,70,70,83,50,331,C,
因此我们在像一个火锅似的又闷又热的教室里学习。,200005108523200708,韩国,2,200005,关于用自然之声取代噪声的建议,70,70,70,50,48,296,C,
”每个[F個]人的生活环[F環]境，成长[F長]背景均不同，所以个[F個]人必有个[F個]人的优缺点[Y奌]，为[F爲]此，只要无[F無]不良嗜好者，一般均可为[F爲]友，就算有不良嗜好者，如赌[F賭]、烟[F煙]、酒，点[Y奌]头[F頭]之交，未尝[F嘗]不可。,199711802501100022,中国,1,199711,我选择朋友的标准,90,85,74,83,82,411,A,
尽量给我小宝贝我和我爱人的爱{CC1爱情}。,199705104523100173,韩国,1,199705,我的城市/乡村生活,60,40,13,42,32,164,未参加,
我是在曼谷首都出生长[F長]大的。,199705529529151007,泰国,1,199705,我的城市/乡村生活,80,85,91,77,90,417,B,
现在我的发音水平提高了，因为我在中国留学以来，中国老师耳提面命，很认真地教学生们，在老师的指导[F導]下，我{CJ+zy能}认为自己的汉语水平越来越提高了。,199804123525200170,日本,2,199804,学习汉语的苦与乐,70,70,54,45,62,289,未参加,
学习汉语{CJ-zxy的过程}中我有好多苦，可是我{CJ-zy也}拥有了不少的快乐。,199804124523200324,韩国,2,199804,学习汉语的苦与乐,75,75,60,52,54,306,C,
很难克服这一点了，我周围的朋友都是韩国人，我觉得可惜，但是我觉得在上课当中，能跟老师、同学们交流，一起学习给我很大的进步、[BC，]帮助。,199804124523200412,韩国,2,199804,学习汉语的苦与乐,80,55,51,54,56,282,未参加,
这时候我的心里[B理]很复杂。,199904123523200030,韩国,2,199904,如何面对挫折,65,65,59,62,54,289,C,
为了我们[BQ，]父母的努力很大，父母对孩子的爱极大。,199904123523200030,韩国,2,199904,如何面对挫折,65,65,59,62,54,289,C,
可我们大多数人对这些年轻人{CC轻年人}十分不理解，而说{CC叫}他们“坏！,199904123548200032,塔吉克斯坦,2,199904,如何面对挫折,65,70,34,32,41,228,未参加,
每个人勇敢地对付自己的困难的话，他最终{CC终于}{CJ-zy能}得到很宝贵的成果。,199904123523100077,韩国,1,199904,如何面对挫折,65,70,50,62,50,283,C,
”听{CQ了}朋友{CQ的}话后我重新开始学习了，那时比以前更努力学习，[BC.]终于考上后期大学了。,199904123523100217,韩国,1,199904,如何面对挫折,65,60,39,55,43,245,未参加,
下次我要买什么东西的话，我应该靠自己，[BC。]这样决定以后，[BC.]开始努力学习，[BC。]过了几天，我再去五道口市场，[BC.]但那天还是{CC2也}{CJX}我不能跟他们说话，[BC。]其实[B是]我去五道口市场以前，努力准备了跟他们说的几句话，[BC.]但到他们的面前，我什么都说不出{CD话}来，因为我怕他们听不懂我说的话，更怕的事是我认为对他们开始说话的{CJ-zxy时候}肯定{CJX}他们都笑，[BC。]所以我又没{CC不}跟他们说话，[BC。]回家的路上，我自己骂自己，[BC。]那时候，有一位小姐对我说{WWJ},199904123523200252,韩国,2,199904,如何面对挫折,65,60,45,52,26,231,未参加,
那时候我已经变得没有精神、整天垂头丧气的。,199904124523100307,韩国,1,199904,如何面对挫折,75,65,80,75,72,354,B,
如果这样我们的生活和工作，就没有坚持，遇到困难时，有的人比平常更{CJX}会坚强，有的人更{CJX}会软弱，我觉得挫折是我们的老师，在这里面有着很多可学到的东西，我们可以体会到很多教训。,199904124523200377,韩国,2,199904,如何面对挫折,65,70,45,55,54,275,未参加,
我是{CQ用}双手起家的年轻[F輕]人，过去{CC过[F過]往}的日子，赚[F賺]钱相当[F當]容易，一打电话[F話]，就可赚[F賺]几[F幾]千[Y仟]铢，那现[F現]在呢！,199909529529151013,泰国,1,199909,如何面对挫折,70,80,27,37,52,256,未参加,
