错句,作文编码,国籍,性别,考试时间,作文题目,口试分数,作文分数,听力分数,阅读分数,综合分数,总分,证书
晚[C]辈{CD子}真让我们不满意{CC满足}。,200209550523150153,韩国,1,200209,如何解决“代沟”问题,65,65,48,57,50,269,未参加,
从古代到现在{CJ-zy都}很难解决的问题{CJs}。,200209550523250189,韩国,2,200209,如何解决“代沟”问题,60,65,69,59,50,286,C,
这个时候子女容易陷入不好{CQ的}环[B坏]境。,200209550523250207,韩国,2,200209,如何解决“代沟”问题,65,65,57,62,60,293,C,
那么如何解决“代沟”问题？,200209550523250208,韩国,2,200209,如何解决“代沟”问题,65,60,36,62,58,264,未参加,
”这是最好{CQ的}解决问题的办法。,200209550523150217,韩国,1,200209,如何解决“代沟”问题,65,65,45,49,36,244,未参加,
所以我们在每天的生活当中按照我上面所说的方法去做，我想一定会解决代沟问题。,200209550523250214,韩国,2,200209,如何解决“代沟”问题,80,75,72,86,72,376,B,
{CJ-zhuy衣服}有点旧了就不穿的人最近很多{CD的}吧。,200209550523150223,韩国,1,200209,如何解决“代沟”问题,65,60,48,45,34,235,未参加,
现代的经济比以前好多了。,200209550523150227,韩国,1,200209,如何解决“代沟”问题,65,60,45,45,34,232,未参加,
最[C]后，在社[C]会上，要营造{CC组成[C]}家庭{CC家族}中心的气氛[B分]。,200209550523250230,韩国,2,200209,如何解决“代沟”问题,65,65,60,54,52,280,C,
所以，跟妈妈一起{CJ-sy看}电视的时候，我一句话[B说]也不说。,200209550523150270,韩国,1,200209,如何解决“代沟”问题,70,65,39,52,64,276,未参加,
不理解让双方的距离[B里]更远。,200209550523250291,韩国,2,200209,如何解决“代沟”问题,65,65,69,71,58,312,C,
现在的年轻人喜欢打破常规，还有常常不听老人的话，甚至，年轻人不愿意跟老人谈话，这样一来，年轻人和老人之间产生差异是理所当然{CJsd}。,200209550523250298,韩国,2,200209,如何解决“代沟”问题,70,65,33,62,50,266,未参加,
那么，这样{CC这儿}问题是容易解决了{CJsd}。,200209550523150361,韩国,1,200209,如何解决“代沟”问题,65,60,54,42,42,246,未参加,
第一是需要个人的努力。,200209550523250866,韩国,2,200209,如何解决“代沟”问题,70,70,81,76,62,347,C,
要解决“代沟[F溝]”当[F當]然不是一件简单[F單]的事，但我个[F個]人相信这[F這]亦不是没有方法解决的，最重要的是尊重他人想法和有心去尝[C]试[F試]在他人立场[F場]设[F設]想。,200209550523150896,韩国,1,200209,如何解决“代沟”问题,65,70,54,86,86,347,C,
对代沟问题，我觉得需要{CC必要}两代人之间的对话。,200209550523250934,韩国,2,200209,如何解决“代沟”问题,65,75,54,71,64,316,C,
父母和子女的关系一般[B搬]是不能由自己来选择的。,200209550523250960,韩国,2,200209,如何解决“代沟”问题,70,60,78,81,68,342,C,
但是我妈对我这个样子太不满意了。,200209550523250961,韩国,2,200209,如何解决“代沟”问题,65,65,48,59,44,265,未参加,
对我们来讲，怎样生存有时候比生死成为{CJX}更深刻的问题。,200205271525200097,日本,2,200205,如何看待“安乐死”,80,85,66,76,87,388,B,
可是，对安乐死这种行为，我还有一个印象比较深的想法。,200205271525100108,日本,1,200205,如何看待“安乐死”,80,85,60,79,70,368,B,
在农作物的生长过程中，[BC、]重视做未经污染的食品[BQ(]就是“绿色食品”[BQ)]还是重视农作物的大量生产免于人们的饥饿{CJjy}？,200307109525200038,日本,2,200307,绿色食品与饥饿,65,70,54,43,64,282,未参加,
如果已充足的话[B化]我们选{CQ的}发展方向是“绿色食品”[BQ，]如果还不足的话[B化]我们选{CQ的}发展方向是生产量大，生产量提高的方向。,200307109523100060,韩国,1,200307,绿色食品与饥饿,60,60,54,59,64,279,未参加,
虽[C]然有的人还是吃不{CC无}放农药的东西，[BC.]但是会很贵的，也就是小部分的人吃这些东西。P},200307109523100065,韩国,1,200307,绿色食品与饥饿,65,65,64,41,53,272,未参加,
我们都要吃到健康的食品[BQ，]才会有健康的精神,200307109523200086,韩国,2,200307,绿色食品与饥饿,80,90,78,56,84,383,B,
找“绿色食品”的人大多数不挨饿的人{CJs}，怎么常挨饿的人{CJX}吃“绿色食品”呢？,200307109523200098,韩国,2,200307,绿色食品与饥饿,65,75,64,51,58,300,C,
随着社会的发展，人们的素质{CJ-zy不断}提高，很多方面都提倡高质量的产品。,200307109523200155,韩国,2,200307,绿色食品与饥饿,70,60,70,38,44,267,未参加,
因为毕竟{CC还[C]是}比较安全、[BC，]经济。[BC.],200307109523200165,韩国,2,200307,绿色食品与饥饿,80,60,80,64,76,347,C,
可是，再好好看看{CC2看}，还[C]是有很多人没法吃饭，天天饿死。,200307109523100223,韩国,1,200307,绿色食品与饥饿,75,75,51,33,47,271,未参加,
随着经济发展，人们生活水平提高，现在不再担心在自己家里有没有吃的东西，考虑吃什么样{CC要}的东西。{CP这就是在饮食的方面，人们重视健康了，所以绿色食品{CQ的},200307109523200277,韩国,2,200307,绿色食品与饥饿,60,45,64,56,44,247,未参加,
多生产[F產]粮食，减[C]少饥饿，没有挨{CC把}饿的人的时候，再去想那个“绿色食,200307109525100315,日本,1,200307,绿色食品与饥饿,85,90,83,67,87,408,A,
他们应{CD向}该向{CC为}贫困国家和饥饿人民{CJ-sy提供}帮助。[BC.],200307109523100341,韩国,1,200307,绿色食品与饥饿,65,60,59,46,67,280,未参加,
我觉得应该找[C]别的办法。,200307109523200352,韩国,2,200307,绿色食品与饥饿,55,50,56,33,18,191,未参加,
如果怀孕的妈妈吃了过量使用农药的食品，农药会累积在身体上，[BC。]这给孩子的影响非常大。[BC.],200307109523200473,韩国,2,200307,绿色食品与饥饿,65,85,78,70,70,358,B,
也不要太崇拜“绿色食品”。[BC.],200307109525200470,日本,2,200307,绿色食品与饥饿,65,90,75,67,81,369,B,
世界上还有很多面临中国这样问题的国家，有些国家为解决[B解]类似问题而大量使用有害人类健康的化肥[BD，]来增大生产量。,200307109523200522,韩国,2,200307,绿色食品与饥饿,85,90,75,72,93,411,B,
我认为在农作物的生长过程中使用化肥和农药是不可避[C]免的。,200307109523200535,韩国,2,200307,绿色食品与饥饿,70,65,67,70,87,345,C,
目前人们渐渐有了意识，{CJ-sy认识到}绿色食品的必要，从电视里或广播里经常听到绿色食品，到商场也能{CC会}{CD来}亲眼看到绿色食品{CD了}。,200307109525200607,日本,2,200307,绿色食品与饥饿,65,65,75,62,81,332,C,
所以我希望各国政府让农民使用正常的农药。[BC、],200307109525100620,日本,1,200307,绿色食品与饥饿,60,65,51,51,64,274,未参加,
于是人们开始考虑环境污染，很自然地找绿色食品了。,200307109523100626,韩国,1,200307,绿色食品与饥饿,70,70,83,51,76,338,C,
农业生产科学技术发展到以绿色食品{CD给}人们满足{CJX}的话，人们又不挨饿，又不用{CC要}吃那些污染的,200307217523200010,韩国,2,200307,绿色食品与饥饿,65,65,83,70,84,351,C,
好多专家都承认这样{CC这[C]些}使用农药，化肥生产的食品给我们的健康很大的影响。,200307217525100041,日本,1,200307,绿色食品与饥饿,65,60,75,51,67,301,未参加,
我觉得不挨饿是第一位{CQ的}。,200307217525200035,日本,2,200307,绿色食品与饥饿,60,70,54,38,56,263,未参加,
第二[BQ，]人们{CJX}提高粮食{CC食粮}问题的意识，珍惜{CC珍重}食品。,200307217525200081,日本,2,200307,绿色食品与饥饿,65,60,62,72,70,312,C,
我们发达[C]国家[C]有很多多余的粮食{CC食粮}，[BC。]有的到“扔掉”的地步。{CP拿这[C]“扔掉”的行为来说，它不仅仅是“多余”的理由[B有]，却为了“企业的利润”成了它的关键{CJZR},200307204525200063,日本,2,200307,绿色食品与饥饿,60,85,56,70,73,333,未参加,
所以现在，日本的消费者都感兴趣{CJX}{CQ对}农药和土力、[BC，]甚至饥饿的问题。,200307204525200079,日本,2,200307,绿色食品与饥饿,60,80,70,59,64,320,C,
我至今{CD以来}根本就没有对这个问题考虑过，[BC。]也没有想到化肥和农药的优点，[BC。]只是认为{CC以为}使用化肥和农药的农作物对身体不利{CC不益}。,200307204501200094,中国,2,200307,绿色食品与饥饿,65,95,75,80,81,387,B,
现在在日本没有土地也可以种菜[B采]，[BC、]没有阳光也可以种水果。,200307204525100107,日本,1,200307,绿色食品与饥饿,60,65,75,43,56,282,未参加,
但缺点在于吃了已用过农药的食物后，就会危害{CC2害}到人的健康。,200307205523200003,韩国,2,200307,绿色食品与饥饿,75,70,78,43,64,319,C,
考虑到自己子孙{CC孙子}的将来，即使很多人挨饿，也应该首先彻[C]底解决环境污染问题。[BC.],200307205525200006,日本,2,200307,绿色食品与饥饿,70,80,64,67,87,358,C,
我认为挨饿是一个可以控制的现象。,200307205533200027,新加坡,2,200307,绿色食品与饥饿,85,75,83,59,100,394,B,
我们别为{CC考虑}自己而考虑。{CQ从},200307205523100041,韩国,1,200307,绿色食品与饥饿,60,60,62,46,53,263,未参加,
韩国土地{CC地士}这么少{CC小}，人口却这么[C]多，没办法不使用化肥和农药。,200307205523100107,韩国,1,200307,绿色食品与饥饿,65,65,56,49,61,280,未参加,
因缺少粮食而挨饿[B俄]的人们呢[Pne]。,200307205523100170,韩国,1,200307,绿色食品与饥饿,65,60,51,38,41,238,未参加,
是非常重要东西{CJX}{CJ-zhy它们}。[BC.],200307212523200008,韩国,2,200307,绿色食品与饥饿,60,60,38,35,27,202,未参加,
我认为，应尽量地少用化肥与农药的同时，应努力去发明一种“绿色化肥”，能达到产量多，质量好的无害化肥。,200307212523100024,韩国,1,200307,绿色食品与饥饿,75,90,80,75,93,407,B,
其实[B时]两个都差不多。,200307209523200003,韩国,2,200307,绿色食品与饥饿,70,65,72,41,84,318,未参加,
现在世界上还有很多人{CQ因}缺少粮食而挨饿，正在{CJX}他们需要的不是绿色食品而是粮食，可能对他们来说，绿色食品是{CJ-sy超}过消费{CJ-zxy能力}的。,200307209523200042,韩国,2,200307,绿色食品与饥饿,65,70,59,46,47,273,未参加,
让{CC使}我们所生活的社会变成“绿[C]色社会”，“绿色世,200307201523100017,韩国,1,200307,绿色食品与饥饿,90,60,62,49,76,327,未参加,
这些农民{CD也}{CD是}最先考虑[C]到的是怎么在最短的时间里富起来。[BC.],200307201919200019,加拿大,2,200307,绿色食品与饥饿,70,70,70,49,79,326,C,
用那个的时候，虽然产量就会大大提高，但是吃这样的农作物时候，会有害于人的健康，[BC.]所以最近大部分[B份]的人都要吃未污染食品[BQ，]就是绿色食品。,200307201523200033,韩国,2,200307,绿色食品与饥饿,60,55,35,35,44,210,未参加,
因此，[BC.]到目前为止，人类为了获取更多的食粮[C]，{CJ-zy应该}坚持不断地努力。,200307201523100053,韩国,1,200307,绿色食品与饥饿,65,70,75,72,96,364,C,
绿色食品是人们把用未经污染的农产品{CJba}。,200307201523200068,韩国,2,200307,绿色食品与饥饿,60,60,51,27,30,210,未参加,
如果{CQ在}没有一顿饭的人面前提起这个话题，难免挨骂。,200307201523100073,韩国,1,200307,绿色食品与饥饿,70,75,56,62,76,328,C,
“绿色食品”这[C]个概念第一次在西方国家出现。,200307302635200099,俄罗斯,2,200307,绿色食品与饥饿,75,50,51,35,44,239,未参加,
爱惜？,200307302523100103,韩国,1,200307,绿色食品与饥饿,70,75,83,67,84,368,B,
比如身体已经被化学污染了，所以想要吃肉类的[B得]东西时[BQ，]身体已经受到了影响[BQ，]所以不能吃。,200307206523100028,韩国,1,200307,绿色食品与饥饿,80,65,67,70,70,340,C,
我[C]的观点{CJs}[BQ，]为了世界人类共同发展，考虑[C]吃什么之前，先要考虑[C]大家都能吃{CJ-buy饱}，不挨饿的问题。,200307215523150002,韩国,1,200307,绿色食品与饥饿,60,50,62,59,61,272,未参加,
我们现[C]在要做的事是考虑清楚[BQ：]为了后代怎么{CJ-sy进行}环保{CC保环[B坏]}{CJ+buy下去}。,200307332525200023,日本,2,200307,绿色食品与饥饿,65,60,59,62,61,290,C,
我有几个朋友上了男校，[BC。]他们之中{CD那样}跟异性交流时{CC上}发生问题的人比较多。,200310576525100034,日本,1,200310,我对男女分班的看法,65,65,36,68,51,269,未参加,
因为你不知道什么样的人适合自己。,200310576525200062,日本,2,200310,我对男女分班的看法,60,75,71,65,54,311,C,
男和女的想法是不一样的。,200310576525200072,日本,2,200310,我对男女分班的看法,60,70,25,32,49,221,未参加,
识字之后一直到成年，[BC、]{CJ-dy阅读}需求量更大。[BC、],200310540540250044,印度尼西亚,2,200310,谈有效阅读,70,75,32,29,44,239,未参加,
第三，要读好书、有意义的书。,200310540540150058,印度尼西亚,1,200310,谈有效阅读,70,65,61,75,82,339,C,
在印尼，[BC、]特别是雅加达，交通{CD的}阻塞是一个{CC一项}严重的问题。,200310540540250074,印度尼西亚,2,200310,谈有效阅读,70,75,79,73,93,379,B,
每个国家的人，如果有机会上学，必须[B需]要学外语，比如英语。{CD拿[B那]英语来说},200304131529100010,泰国,1,200304,我学汉语是为了……,60,65,18,19,29,174,未参加,
我现在是{CC1学习}三年级下半期。,200304131529200252,泰国,2,200304,我学汉语是为了……,70,85,65,60,66,338,C,
可那时候我只是坐着，因为电视里的节目我根本看不懂，[BC。]那电影里的人物讲的语言我从来没听过。,200304131540200243,印度尼西亚,2,200304,我学汉语是为了……,85,80,80,76,82,396,B,
再者，男女分班制也可能导致学生产生同性倾向或对异性产生恐惧或自卑的心理。,200306680519250001,马来西亚,2,200306,我对男女分班的看法,75,85,87,75,92,407,B,
若我们强制孩子只局限在与同性相处与交往，对孩子而言，实在是大大地扼杀了他们学习与成长的机会。,200306680519250040,马来西亚,2,200306,我对男女分班的看法,85,95,87,75,100,438,A,
发达国家应该帮助发展中国家，而且一起合作{CJX}为了找到合适的办法。[BC.],200307271637100012,白俄罗斯,1,200307,绿色食品与饥饿,75,70,59,33,35,261,未参加,
大街上豪华的饭店都是享受饮食的概念引起的，特别是绿色食品。,200307271523100022,韩国,1,200307,绿色食品与饥饿,75,70,78,54,79,345,C,
我觉得过量使用农药一定会引起人类的灭绝{CC绝灭}。,200307271525200062,日本,2,200307,绿色食品与饥饿,70,80,56,59,53,308,C,
使用农药的农作物不能看成是食物，而是一种[B和]含有一种[B和]毒的东西。,200307271523100085,韩国,1,200307,绿色食品与饥饿,70,65,51,41,50,263,未参加,
我们能培[C]养比以前产量多的农作物。[BC.],200307271523200095,韩国,2,200307,绿色食品与饥饿,65,65,78,67,87,346,C,
我不理解这样{CQ的}人想什么，所以政府实施在公共场所不让吸烟的措施，我很赞成{CC同意}。,200405109525200152,日本,2,200405,吸烟对个人健康和公众利益的影响,65,70,64,64,59,308,C,
某市政府出台了{CC的}一项规[C]定，在公共场所边走边抽烟的人将被罚款。,200405109523200536,韩国,2,200405,吸烟对个人健康和公众利益的影响,65,65,36,31,57,238,未参加,
不只是伤害自己的身体，更[B便]重要的是伤害别人的健康。,200405109523200625,韩国,2,200405,吸烟对个人健康和公众利益的影响,85,65,45,62,48,294,未参加,
随着生活水平的提高，人们对健康{CQ的}关心也更多{CC强}。,200405109523200671,韩国,2,200405,吸烟对个人健康和公众利益的影响,55,55,50,52,41,233,未参加,
这些措施都是{CQ为}人们的健康而进行的。,200405109523200673,韩国,2,200405,吸烟对个人健康和公众利益的影响,80,65,55,62,55,305,C,
但是烟民们一定要记住，[BC。]因为自己{CD的}吸烟，害了很多人的健康，[BC。]连自己也包含{CJ-buy在内}。,200405109523200690,韩国,2,200405,吸烟对个人健康和公众利益的影响,70,65,59,50,48,278,未参加,
发生这种{CC这样}情况{CC风景}的许多原因中{CQ的}一个{CD是}{CJ-zxy原因}就是上{CD一}文说的。,200405109523100808,韩国,1,200405,吸烟对个人健康和公众利益的影响,55,60,45,44,50,235,未参加,
还有一个现象[BD。]是女人的吸烟率迅速{CC2特别快点}提高了。,200405109523200954,韩国,2,200405,吸烟对个人健康和公众利益的影响,70,65,45,39,48,253,未参加,
生存的，而很多人一起生存的。P},200405109523200982,韩国,2,200405,吸烟对个人健康和公众利益的影响,65,65,74,70,75,333,C,
我可以理解{CC了解}，人生中有什么不好的事情发生的时候人们常常依靠{CC2靠}一些{CC什么}东西的{CJsd}，[BC。]香[C]烟就{CC也}是一种那样的东西，[BC。]可我们不能让不吸烟的人吸烟的{CJsd}。,200405109523100992,韩国,1,200405,吸烟对个人健康和公众利益的影响,60,60,57,48,44,251,未参加,
因为人们通过吸烟释放{CC解[C]决}自己[C]的压抑。,200405109523201159,韩国,2,200405,吸烟对个人健康和公众利益的影响,70,50,48,62,57,270,未参加,
如今，在公共场所，允许抽烟的地方越来越少了，这样的趋[C]势，对我来说[C]是很好的现象。,200405109523101466,韩国,1,200405,吸烟对个人健康和公众利益的影响,75,65,57,52,53,289,未参加,
虽然戒烟太难了，可是没什么不好的。,200405109523201477,韩国,2,200405,吸烟对个人健康和公众利益的影响,60,70,59,48,57,279,未参加,
随着经济的发展，中国人的吸烟率也翻了一番，{CJ-zhuy中国}已成了世界{CQ上}{CJ-sy拥有}{CD早}最多{CD的}“烟民”的国家{CC3之国}。,200405109523101481,韩国,1,200405,吸烟对个人健康和公众利益的影响,85,75,71,58,61,342,B,
然后{CJ-sy谈谈}对公众利益的影响。,200405109525101551,日本,1,200405,吸烟对个人健康和公众利益的影响,75,65,57,60,59,303,C,
什么事情都不会{CC要}一下子{CD都会}成功，[BC。]慢慢来。,200405109523201560,韩国,2,200405,吸烟对个人健康和公众利益的影响,60,65,55,48,44,255,未参加,
购买毒品，损害自己的健康，这也是个人的问题。,200405109525101665,日本,1,200405,吸烟对个人健康和公众利益的影响,60,65,38,44,44,234,未参加,
我作为一个吸烟者，对此感到十分惭愧。,200405109523101809,韩国,1,200405,吸烟对个人健康和公众利益的影响,75,75,52,50,66,308,未参加,
可是，最近在很多地方都禁止吸烟，所以也有过专门找可以吸烟的餐厅或咖啡厅的时候。,200405109523201836,韩国,2,200405,吸烟对个人健康和公众利益的影响,80,70,38,48,50,276,未参加,
不过我[C]前边[C]已经说了，[BC。]吸烟是{CD个一}个人的爱好。{CP烟鬼们[C]对政府要求{CC2要},200405109523201841,韩国,2,200405,吸烟对个人健康和公众利益的影响,70,55,48,37,41,235,未参加,
我还认为只[C]有[C]提高人们的公共意识才[C]能达到{CC达成[C]}这个目的{CD了}。,200405109523101860,韩国,1,200405,吸烟对个人健康和公众利益的影响,50,75,62,60,66,297,未参加,
吸烟现在{CJ-wy是}世界的公共问题，[BC。]还有这是人的人格问题。,200405109523201875,韩国,2,200405,吸烟对个人健康和公众利益的影响,60,70,40,35,46,236,未参加,
除了这些以外，还有健康的问题。,200405109523101883,韩国,1,200405,吸烟对个人健康和公众利益的影响,65,65,28,44,44,230,未参加,
吸烟的人也按照规定{CC规律}不能{CC要}在公共场所吸烟。,200405109525100472,日本,1,200405,吸烟对个人健康和公众利益的影响,65,65,58,62,63,297,C,
在公共场所边走边抽烟的行为会增加发生火灾的可能性，导致多人死亡。,200405109525200473,日本,2,200405,吸烟对个人健康和公众利益的影响,70,75,72,77,95,378,B,
你知道吗？{CQ在},200405109525200596,日本,2,200405,吸烟对个人健康和公众利益的影响,75,65,62,58,73,320,C,
现在无论哪个国家都为吸烟而伤脑筋，许多国家逐步地制定新的有关吸烟{CQ的}措施来降低吸烟率。,200405109523200678,韩国,2,200405,吸烟对个人健康和公众利益的影响,80,65,82,77,80,372,B,
不仅仅为了保持市容整洁，还为了他人的健康。,200405109525200817,日本,2,200405,吸烟对个人健康和公众利益的影响,65,75,54,68,70,319,C,
我觉得吸烟是很不好的事情{CC东西}。,200405109523200836,韩国,2,200405,吸烟对个人健康和公众利益的影响,60,55,54,58,54,262,未参加,
第三个原因是减少吸烟{CD者}人口。{CP吸烟是对本人健康不好{CJxw},200405109523201420,韩国,2,200405,吸烟对个人健康和公众利益的影响,65,65,34,54,39,241,未参加,
再说吸烟对吸烟者自己的健康也没有一点好处。,200405109523200364,韩国,2,200405,吸烟对个人健康和公众利益的影响,60,80,87,68,72,354,C,
最近在社会{CQ上}对{CC1对于}吸烟问题的讨论{CC议论}很热烈{CC2热}。,200405109523200380,韩国,2,200405,吸烟对个人健康和公众利益的影响,80,70,57,70,70,337,C,
我上面提到了吸烟对个人的{CJX}健康影响。,200405204525200151,日本,2,200405,吸烟对个人健康和公众利益的影响,70,70,82,61,58,329,C,
在公共场所不允许抽烟，对社会环境有好处。,200405204525200238,日本,2,200405,吸烟对个人健康和公众利益的影响,60,60,27,77,51,257,未参加,
不过，我可以猜测他们的{CJ-zxy想法}。,200405204525100255,日本,1,200405,吸烟对个人健康和公众利益的影响,60,60,44,42,36,224,未参加,
既对你自身不好，又对你的{CJX}周围人{CJ+zy也}不好，怎么你还继续吸烟呢？,200405204525100277,日本,1,200405,吸烟对个人健康和公众利益的影响,65,60,58,65,65,296,C,
我不是抽烟的爱好者{CC家}，而是觉得{CJ-zhuy抽烟}非常讨厌[C]，所以对最近共公场所[BD、]允许抽烟的地方越来越少，我很赞成。,200405204525200280,日本,2,200405,吸烟对个人健康和公众利益的影响,60,65,36,39,45,228,未参加,
。P},200405204525200363,日本,2,200405,吸烟对个人健康和公众利益的影响,70,60,33,39,51,238,未参加,
吸烟[B咽]对个人的健康没有好处{CC利益}。,200405205525200101,日本,2,200405,吸烟对个人健康和公众利益的影响,60,85,55,63,58,310,未参加,
从医学的角度来看，吸烟损害{CC2害}人的健康是很明确的。,200405205525200162,日本,2,200405,吸烟对个人健康和公众利益的影响,65,75,60,44,54,285,C,
我一直说反对吸烟。,200405201523100306,韩国,1,200405,吸烟对个人健康和公众利益的影响,65,70,66,58,67,312,C,
现在因为吸烟而患这种病，甚至死去的人越来越多。,200405201525200305,日本,2,200405,吸烟对个人健康和公众利益的影响,60,75,74,75,67,337,C,
另外，我觉得我们应该进行宣传[BQ，]吸烟是不但影响了身体健康，而且还影响公众利益{CJs}。,200405684542200001,越南,2,200405,吸烟对个人健康和公众利益的影响,65,90,38,37,51,272,未参加,
以上是我的经验之谈。,200410534519250071,马来西亚,2,200410,最理想的结交方式,90,95,85,81,100,449,A,
只能说彼此有缘无份吧！,200410534533250084,新加坡,2,200410,最理想的结交方式,85,90,71,67,72,381,B,
从朋友变为相爱的情侣，更让各自有更多机会与时间[BD，]观察与了解对方，[BC。]这才能使一段感情更持久。,200410534533250110,新加坡,2,200410,最理想的结交方式,95,70,77,76,82,394,B,
所以我的婚姻可以维持这么久，而且很幸福。,200410534533250123,新加坡,2,200410,最理想的结交方式,95,95,55,67,100,411,C,
可是在亲朋好友的协助下，陈木生立刻就在“合心意、再了解”的基础上找到对象。,200410534533250135,新加坡,2,200410,最理想的结交方式,85,90,52,70,100,393,C,
现在这样的事不是件{CC个}不常见{CC看}的事情。,200404140540200216,印度尼西亚,2,200404,运动员收入,60,75,46,40,55,262,未参加,
回忆{CC2忆}起年轻的我[D时]，因长得[B的]还可以，当时就被学校的男同学追求。,200504534533250031,新加坡,2,200504,我对男女分班的看法,60,60,56,56,66,280,未参加,
因此很多女校生就会看起来较粗鲁，像[B象]小子一般没有淑女形象。[BC.],200504534540250051,印度尼西亚,2,200504,我对男女分班的看法,75,75,76,80,86,382,B,
打好了基础以后，在求知识的过程{CQ中}就更为容易了。,200504534533250056,新加坡,2,200504,我对男女分班的看法,75,85,62,60,77,352,C,
虽然男女分班被认为可以避免学生早恋，但是我认为男女分班弊大于利。[BC.],200504534533150076,新加坡,1,200504,我对男女分班的看法,75,90,84,86,82,411,A,
在新加坡，单一的女子或男子学校已所剩无己。,200504534533250091,新加坡,2,200504,我对男女分班的看法,75,80,76,80,93,395,B,
这是因为，男女本来就是不同的，当他们混在一起时，彼此就会知道得更多一些，[BC。]如：知识，兴趣等。,200504534533250126,新加坡,2,200504,我对男女分班的看法,70,75,67,62,73,336,C,
