错句,作文编码,国籍,性别,考试时间,作文题目,口试分数,作文分数,听力分数,阅读分数,综合分数,总分,证书
我就想[C]{CD着}人们的生活多么不平等，每天吃三顿饭的人和连一顿饭都不能[C]吃的人的情况有多大{CC多么}差距，他们[C]都不是愿[B原]意发生这[C]样{CC1一些}事情的，就是地理环境不同[C]，而其[B某]他原因下这[C]样过日子的{CJ}。[BC，],200307109523200226,韩国,2,200307,绿色食品与饥饿,70,65,64,56,56,297,C,
因为每个农家知道消费者的要求是什么，所以他们拼命地用一些化肥和农药。,200307109525200230,日本,2,200307,绿色食品与饥饿,65,80,59,43,32,267,未参加,
{CJ-zhuy我}认为吃“绿色食品”和不挨饿都重要，不能说哪个是第一位的。,200307109523200408,韩国,2,200307,绿色食品与饥饿,60,80,72,64,79,342,C,
最重要的是生命。,200307109523200431,韩国,2,200307,绿色食品与饥饿,60,80,64,38,64,293,未参加,
在农作物的生长过[C]程中使[C]用农药会有害于人的健康。[BC.],200307109523200441,韩国,2,200307,绿色食品与饥饿,70,80,86,70,61,357,B,
这样一定有利于解决饥饿的问题。,200307109523200447,韩国,2,200307,绿色食品与饥饿,65,90,75,70,90,381,B,
在农作物的生长过程中，如果使用化肥和农药，那么产量就会大大提高。,200307109523200452,韩国,2,200307,绿色食品与饥饿,90,60,78,62,79,359,C,
那么我们首先改善饮食{CC2食}习[C]惯，这[C]样至少{CJ-zy可以}保护自己的健康。[BC.],200307109523200583,韩国,2,200307,绿色食品与饥饿,75,60,72,56,84,333,C,
多少，[BC。]重视吃食品的质量。P},200307109523100611,韩国,1,200307,绿色食品与饥饿,65,60,54,56,58,276,未参加,
我的核心观[B关]点就是科学家们要发明{CC发达}一种天然{CD性}无害的农药来解决这个问题，虽然发明{CC发达}这种样的农药很难，资金也高，但是我们要想全球几亿人的痛苦，人的生命是用钱买不到的，所以我们要发展这种的农药来解决这个问题。,200307217523100001,韩国,1,200307,绿色食品与饥饿,70,65,59,62,84,326,C,
而是说，人应该懂得知足，在没有条件吃到绿色食品的情况下，学会把眼睛放低一点，一般食品虽不及绿色食品好，也不至于吃了会中毒吧!所以这句话，从根本上来说[BD.]是不正确的。[BC.],200307217523200007,韩国,2,200307,绿色食品与饥饿,70,90,75,83,93,404,B,
我也赞成吃绿色食品，还有应该发展下去，但我们还[C]{CJ-zy应该}想另外的很,200307217523100031,韩国,1,200307,绿色食品与饥饿,65,60,62,30,56,256,未参加,
因为在日本，“绿色食品”和“无农药食品”不是一码事儿。,200307217525200056,日本,2,200307,绿色食品与饥饿,65,70,64,51,76,312,C,
比如说，平时节食的食品助给他们，或者通过大家的努力收来一笔钱来救助他们等等。,200307217523200067,韩国,2,200307,绿色食品与饥饿,55,65,72,64,93,331,C,
我们在这种情况下先要提倡这一观点，[BC、]然后这种挨饿的情况变得好了，那么我们就可以慢慢地{CC得}提高“绿色食品”的产量{CC生产}。,200307217523100108,韩国,1,200307,绿色食品与饥饿,75,70,62,43,81,320,C,
解决这个问题的话我觉得必须{CC必要}{CJX}世界上所[C]有人们的心里想通。,200307217525100110,日本,1,200307,绿色食品与饥饿,70,65,62,41,58,282,未参加,
随着时间的推移，现代科学正高速发展着，以前认为是“幻想”的事，如今已成为事实。,200307217510200129,朝鲜,2,200307,绿色食品与饥饿,70,75,83,80,90,387,B,
同时生活在这个世界上的我们，但{CJ+dy其}生活水平有那么大的差距，真是不公平。,200307204525200046,日本,2,200307,绿色食品与饥饿,65,80,78,64,96,371,C,
按照各个[B各]国家的状[B壮]况{CJ+zy都要}采取合适的方法。,200307204523100078,韩国,1,200307,绿色食品与饥饿,60,70,67,43,50,275,未参加,
于是人们慢慢地开始关心到健康的问[B门]题。,200307204523200086,韩国,2,200307,绿色食品与饥饿,65,60,75,49,50,282,未参加,
如果有人批评{CC排平}这是太奢侈{CJxw}[BQ，]或者世界上饥饿的人都消失以前不能享[C]受的话，这就是太盲目的行为。,200307204523200086,韩国,2,200307,绿色食品与饥饿,65,60,75,49,50,282,未参加,
很多国家有这样的“绿色食品热[BQ”]。,200307204523100105,韩国,1,200307,绿色食品与饥饿,60,60,56,35,35,228,未参加,
这[C]样的肥料{CC材料}是人参等中医药材料，不危害{CC2害}人体，而且更有益,200307205523200013,韩国,2,200307,绿色食品与饥饿,70,65,78,62,84,345,C,
首先考虑保护自然环境，保护{CC2做}好可以生产对人的身体没有危害{CC危险}的农作物的土地等环境。,200307205525200038,日本,2,200307,绿色食品与饥饿,65,70,64,75,81,341,C,
许多科学家很早{CQ就}推测到工业的发展会引起人的健康问题，[BC。]当然，也有许多科学家已说到该如何解决这些问题的答案{CJZR}，{CJ-sy生产}绿色食品就是其中之一{CJX}的办法。,200307205523200061,韩国,2,200307,绿色食品与饥饿,70,65,67,38,76,302,未参加,
我每天吃好吃的肉，但他们没有机会{CJ-sy过}这样的生活，所以我们{CJ-zy应该}节约食品。,200307205523100117,韩国,1,200307,绿色食品与饥饿,65,65,56,43,67,280,未参加,
如果等到没有挨饿的人，再开始吃绿[B绝]色食品的话可能要等好几十年了。,200307205523200112,韩国,2,200307,绿色食品与饥饿,75,75,67,41,76,324,未参加,
在现代社会中，逐渐破坏农作物{CJbei}。,200307205523100124,韩国,1,200307,绿色食品与饥饿,65,60,43,30,53,234,未参加,
先把那个问题解[C]决{CJ-buy好}。,200307205525100184,日本,1,200307,绿色食品与饥饿,60,60,59,49,58,268,未参加,
然而它因质[C]最好，成本也[B地]高。,200307205525200181,日本,2,200307,绿色食品与饥饿,90,80,83,83,99,430,A,
是一目了然的。[BC.],200307212523100027,韩国,1,200307,绿色食品与饥饿,65,70,51,43,67,282,未参加,
我相信有各种各样的想法。,200307212540100040,印度尼西亚,1,200307,绿色食品与饥饿,65,65,59,46,44,263,未参加,
世界上有好多水土好、环境好而适合于生长农作物。,200307212525200063,日本,2,200307,绿色食品与饥饿,70,70,51,49,64,292,未参加,
当然啦，全世界都知道这一[B～]点。,200307209628200049,圣马力诺,2,200307,绿色食品与饥饿,65,65,40,9,61,224,未参加,
所以，我想是这样，按自己的要求，办自己最适合的事。,200307201523100034,韩国,1,200307,绿色食品与饥饿,60,60,67,54,76,299,未参加,
因为在生命上面任何东西不能存在。,200307201523100052,韩国,1,200307,绿色食品与饥饿,65,60,64,67,76,315,C,
而且，能解决环境[B竟]污染的问题[C]。,200307201523200061,韩国,2,200307,绿色食品与饥饿,60,60,48,27,35,212,未参加,
我们都知道使用化肥可以加快农作物生长，使用农药就能杀死害虫，从而使农作物的产量大大提高。,200307201523100069,韩国,1,200307,绿色食品与饥饿,70,70,67,75,99,369,C,
随[C]着环[B坏]境的污染，人们对健康的关心{CJX}也越来越{CD大}。,200307302523100037,韩国,1,200307,绿色食品与饥饿,55,45,62,35,50,224,未参加,
我们所说的绿色食品是农产品加工的一种食品。[BC.],200307302523200052,韩国,2,200307,绿色食品与饥饿,70,65,51,46,44,262,未参加,
绿色食品比普通的食品小，人们吃食品后很快就能感觉到饿，所以使用化肥和农药的食品和绿色食品各有各的缺点和优点，我觉得不挨饿还是第一位{CJsd}。[BC.],200307302523200052,韩国,2,200307,绿色食品与饥饿,70,65,51,46,44,262,未参加,
{CP因为化肥和农药，缺少了粮食而挨饿。P},200307302523200078,韩国,2,200307,绿色食品与饥饿,65,65,62,38,44,258,未参加,
最近我们在市场或商店买的大部分的农作物是使用化肥和农药{CQ出}来{CJX}生长的。,200307302523200090,韩国,2,200307,绿色食品与饥饿,65,70,32,49,53,255,未参加,
很可能导致[B至]社会混乱。,200307302523100101,韩国,1,200307,绿色食品与饥饿,85,65,78,67,58,342,B,
这[C]是我个人对“绿色食品”的观[F覌]点。,200307302523200114,韩国,2,200307,绿色食品与饥饿,70,65,75,56,87,339,C,
如果绿色食品和不挨饿[BD，]这[C]两个问题相比，我还[C]是绿色食品放在第一位{CJba}。,200307206525100018,日本,1,200307,绿色食品与饥饿,70,60,62,46,73,296,未参加,
可是我听说这样的人很容易生病。,200307206525200026,日本,2,200307,绿色食品与饥饿,65,65,30,51,56,251,未参加,
可能不少人士会反应这种想法太自私，因为这样等于好东西给自己，次品给别人吃。,200307206525200033,日本,2,200307,绿色食品与饥饿,70,85,75,67,84,373,B,
其实绿[C]色食品普及的问题也在一线[C]上。,200307215523250003,韩国,2,200307,绿色食品与饥饿,65,60,72,54,87,321,C,
我可要[C]知道，[BC、]在这世上，[BC、]有多少孩子[L]们饿死。,200307215525150012,日本,1,200307,绿色食品与饥饿,70,75,70,70,87,361,B,
不知道什么时候会普及起来，但是我认为这还是不是个{WWJ},200307215523250028,韩国,2,200307,绿色食品与饥饿,55,60,59,43,64,262,未参加,
还{CC也}有另一{CD个}对儿[BQ，]他们除了谈恋爱也{CD有}做[B作]爱，后来{CC然后}那个女生怀孕了{CC3在她身里有了一个孩子}。,200309529529151017,泰国,1,200309,我对男女分班的看法,60,60,30,16,31,179,未参加,
在学校的生活中可以理解男女平等的看法。,200310576525200041,日本,2,200310,我对男女分班的看法,60,65,63,51,47,269,未参加,
可见阅读能丰富一个人的内在生命，亦能提升一个[F個]人的内在{CC外在}修养，因此有关当局应该积极地{CC的}、广泛地{CC的}推行与倡导{CC教导}“有效阅读”活动{CC运动}。,200310540533250037,新加坡,2,200310,谈有效阅读,75,75,66,77,91,374,B,
即[B既]多一点接触能帮助学习者{CC3学者}{CD的}记忆和掌握字里[F裡]行间的真意。,200310540540150040,印度尼西亚,1,200310,谈有效阅读,65,70,36,44,79,280,未参加,
我每次买书的时候，每当在书的封面上看到能吸引我的标题{CQ时}，我一定先翻阅几页[F頁]，看看它写些什么，若还能吸引我就再翻阅几页[F頁]看看才决定该不该买这本书，然后再{CC又}思虑一下我看了这本书有无[C]益处，才决定买不买它。,200310540540250076,印度尼西亚,2,200310,谈有效阅读,65,65,73,62,84,333,C,
{CD从}中国改革开放以后，随着中国的经济迅速发展，中国在世界的地位越来越重要。,200304131529200023,泰国,2,200304,我学汉语是为了……,80,60,74,71,77,349,C,
我的代价就是汉语！,200304131547200028,哈萨克斯坦,2,200304,我学汉语是为了……,75,65,62,63,77,329,C,
②总体{CC普遍}上来讲，男生在课业上会对理科较感兴趣，而女生则是倾向于商科或文科。,200306680519150022,马来西亚,1,200306,我对男女分班的看法,80,80,87,87,94,420,B,
男女分班所带来的利弊，目前尚有争论。,200306680519150054,马来西亚,1,200306,我对男女分班的看法,85,85,90,75,92,422,A,
这样下去，一旦进入{CC出来}社会，我们还能期望男女合作，创造更美好的未来{CC将来}吗？,200306680519250051,马来西亚,2,200306,我对男女分班的看法,85,85,87,72,96,420,A,
这是不可分割{CC并不分割}的。,200307271523100035,韩国,1,200307,绿色食品与饥饿,65,70,62,51,58,292,C,
有的专家说，吸烟对周围人的影响比对吸烟者的影响还严重。,200405109525200061,日本,2,200405,吸烟对个人健康和公众利益的影响,85,75,71,77,68,368,B,
吸烟不仅危害{CC2害}人体，[BC、]也危害{CC2害}我们的生活环境。,200405109523200638,韩国,2,200405,吸烟对个人健康和公众利益的影响,70,60,59,58,53,285,C,
我认为某市政府出台的这项规定对保护公众利益很有帮助。,200405109525200689,日本,2,200405,吸烟对个人健康和公众利益的影响,60,65,57,56,61,282,未参加,
吸烟对人的健康有害。,200405109525200693,日本,2,200405,吸烟对个人健康和公众利益的影响,80,50,55,58,57,285,未参加,
首先吸烟给{CC对}人类带来了严重的健康问题。,200405109523200753,韩国,2,200405,吸烟对个人健康和公众利益的影响,65,65,59,48,48,269,未参加,
这[C]样当然不能成为[C]很[C]好的成[C]人了{CC吧}。,200405109523100811,韩国,1,200405,吸烟对个人健康和公众利益的影响,70,65,55,41,50,267,未参加,
不管怎么样，我[C]们[C]的生活里最重要的问[C]题是健康和公共利益。,200405109523200961,韩国,2,200405,吸烟对个人健康和公众利益的影响,70,0,36,35,37,171,未参加,
还有香烟是点火抽的，[BC。]在人口密集的地方抽着烟走的行为相当{CC相等}于边甩着打火机边走，十分危险。,200405109525200960,日本,2,200405,吸烟对个人健康和公众利益的影响,80,60,64,73,68,332,C,
吸烟对别人不好的影响{CJy}。,200405109523201150,韩国,2,200405,吸烟对个人健康和公众利益的影响,65,65,57,62,61,294,C,
我父亲得过心脏[C]病。,200405109525201190,日本,2,200405,吸烟对个人健康和公众利益的影响,75,60,62,66,73,322,C,
所以我们应该戒[Pjiè]烟，吸烟对个人健康有很不好的影响。,200405109523201397,韩国,2,200405,吸烟对个人健康和公众利益的影响,60,65,38,39,57,242,未参加,
可是我觉得人们应该想一想对方{CC互相}的健康、利益[BD、]等等。,200405109525101404,日本,1,200405,吸烟对个人健康和公众利益的影响,60,60,48,60,53,263,未参加,
如果任何地方都允许抽烟的话，{CD会}街上{CD有}被扔的烟太多了。,200405109523201446,韩国,2,200405,吸烟对个人健康和公众利益的影响,70,65,55,39,57,272,未参加,
青少年是我们国家的未来，也是{CC而是}我们[C]国家的希望[C]，[BC。]所以我[C]们应该保护青少年的健康。,200405109523101460,韩国,1,200405,吸烟对个人健康和公众利益的影响,75,70,62,62,68,326,C,
同时，不仅危害{CC2害}吸烟的人的健康，而且危害{CC2害}吸烟周围人的健康。,200405109525101685,日本,1,200405,吸烟对个人健康和公众利益的影响,60,55,31,58,66,251,未参加,
这样的想法并不是{CJX}只吸烟者{CJ-zy应该}想的，而是我在生活中得经常要注意的。,200405109525101775,日本,1,200405,吸烟对个人健康和公众利益的影响,70,70,55,68,55,306,C,
所有{CC尽管}有危害的、对人不利的行为应该禁止。,200405109523201781,韩国,2,200405,吸烟对个人健康和公众利益的影响,75,85,74,64,73,364,B,
很多吸烟者说，吸烟也有好处。,200405109523201793,韩国,2,200405,吸烟对个人健康和公众利益的影响,70,65,57,50,50,278,未参加,
我对边走边抽烟的人将被罚款的措施感到赞同。{CJ-zhuy这},200405109525201798,日本,2,200405,吸烟对个人健康和公众利益的影响,75,75,55,64,66,325,C,
我呢？,200405109523101828,韩国,1,200405,吸烟对个人健康和公众利益的影响,60,70,48,46,50,259,未参加,
现在随着社会的发展，各个[B各]国家都重视人们的健康，这时应该{CJX}最先考虑的是吸烟，吸烟对人们的健康{CJ-sy有}很直接的影响，而且对不吸烟的人也有{CC1受到}不好的影响。,200405109523201834,韩国,2,200405,吸烟对个人健康和公众利益的影响,60,60,48,37,48,235,未参加,
现在，在韩国没有有关禁止在公共场所，或街上吸烟的规定。,200405109523201843,韩国,2,200405,吸烟对个人健康和公众利益的影响,65,60,62,39,35,244,未参加,
在公共场所吸烟最严重的[C]问题就在于间接吸烟。,200405109523101872,韩国,1,200405,吸烟对个人健康和公众利益的影响,70,95,81,73,70,382,B,
吸烟是一种[B咱]中毒性疾病。,200405109523201889,韩国,2,200405,吸烟对个人健康和公众利益的影响,60,90,64,64,64,332,C,
所以政府用很多方法，可是差不多没用{CD了}。{CP我认为最好的方法{CJ-sy是},200405109523201895,韩国,2,200405,吸烟对个人健康和公众利益的影响,55,70,43,44,32,228,未参加,
而且他们给{CC对}别人带来不好的影响。P},200405109523200523,韩国,2,200405,吸烟对个人健康和公众利益的影响,75,65,52,33,51,263,未参加,
何况周边的人是孩子的话[C]，可能{CC应该}产生更[C]严重的[C]后果[C]。,200405109523200526,韩国,2,200405,吸烟对个人健康和公众利益的影响,80,65,56,68,73,330,C,
听吸烟者说{CC1说话}，心里[B理]着急、复[B腹]杂的时候[BQ，]抽烟有效的{CJsd}。,200405109523200667,韩国,2,200405,吸烟对个人健康和公众利益的影响,65,60,54,56,73,291,未参加,
但是还不够成熟的未成年人{CC们}学会抽烟，比重{CC比数}越来越大{CC1增加}。[BC，],200405109523100791,韩国,1,200405,吸烟对个人健康和公众利益的影响,65,80,68,60,73,334,C,
吸烟的人要戒烟的话，{CQ会}发生{CJ+sy有}特殊的情况[C]，他的性格变得{CD很}急而暴[B爆[C]]，[BC。]经常发火，而且不能集中{CJ-zxy精力}。,200405109523200802,韩国,2,200405,吸烟对个人健康和公众利益的影响,80,90,68,75,75,383,B,
从青少年起开始抽烟比{CQ从}成人起{CQ开始}抽烟{CJ+zxy的人}{CQ对}身体有更多坏,200405109523201419,韩国,2,200405,吸烟对个人健康和公众利益的影响,65,60,76,58,56,298,C,
在那里，对吸烟的人的规定{CC规则}较多。,200405204525100169,日本,1,200405,吸烟对个人健康和公众利益的影响,60,60,44,63,54,263,未参加,
在我的国家{CD的}规定，从20岁起可以吸烟。,200405204525200148,日本,2,200405,吸烟对个人健康和公众利益的影响,60,75,49,44,47,261,未参加,
地{CD上}不是他们的。,200405204525200248,日本,2,200405,吸烟对个人健康和公众利益的影响,60,60,33,47,49,231,未参加,
烟的{CJ-zxy价格}一半甚至一半以上的部分是税。,200405204525100268,日本,1,200405,吸烟对个人健康和公众利益的影响,65,65,58,58,63,293,C,
这是我的心理{CC心里}上、本能上的拒绝。,200405204525100270,日本,1,200405,吸烟对个人健康和公众利益的影响,75,65,71,44,58,300,C,
然[C]而现在群众对这陋习的看法，跟以往迥[C]然[C]不同了。,200405204525100320,日本,1,200405,吸烟对个人健康和公众利益的影响,60,60,55,73,61,291,未参加,
我们来市场的目的是买东西，所以当然{CJX}跟商人说话很有意思。,200405204525100353,日本,1,200405,吸烟对个人健康和公众利益的影响,70,60,44,54,49,262,未参加,
但是我想这个魅力是最可怕{CC害迫[C]}的。,200405204525200354,日本,2,200405,吸烟对个人健康和公众利益的影响,65,60,22,47,54,231,未参加,
“吸烟”是{CJX}对吸烟者来说一种放松法。,200405204525200418,日本,2,200405,吸烟对个人健康和公众利益的影响,60,60,52,49,58,261,未参加,
{CQ在}街上{CJ-zhuy人们}常常会看到吸烟者。,200405205525200070,日本,2,200405,吸烟对个人健康和公众利益的影响,55,65,52,35,54,243,未参加,
所以我很支持这个措施。,200405205525200102,日本,2,200405,吸烟对个人健康和公众利益的影响,60,85,55,61,70,320,未参加,
据规定在公共场所边走边抽烟的人将被罚款。,200405205525200125,日本,2,200405,吸烟对个人健康和公众利益的影响,60,80,55,63,67,312,未参加,
这是对公共场所的第一个害处{CC2害}。,200405205525100177,日本,1,200405,吸烟对个人健康和公众利益的影响,65,80,55,56,63,307,C,
因此吸烟者身边的人，[BC、]特别是妻子最容易得肺[C]病，[BC、]所以我个人认为不管在哪里{CC那里}，为自己为他人尽量不要吸烟[C]。,200405205525100209,日本,1,200405,吸烟对个人健康和公众利益的影响,65,80,74,65,58,330,C,
不然，不仅[B尽]危害了他人的健康，还[C]影响了社会风气。,200405205525100212,日本,1,200405,吸烟对个人健康和公众利益的影响,90,85,79,75,94,420,B,
其中最[C]高的是肺癌{CC2肺[C]绝症}。,200405205525200215,日本,2,200405,吸烟对个人健康和公众利益的影响,65,75,60,54,61,302,C,
这项规定是不是合理的？,200405205525200218,日本,2,200405,吸烟对个人健康和公众利益的影响,65,70,52,63,70,306,C,
社会在发展，观[C]念在更新，越来越多的人将更[C]注重健康。,200405205525200229,日本,2,200405,吸烟对个人健康和公众利益的影响,60,90,85,80,90,395,C,
所以很多国家采取了措施。,200405201523100212,韩国,1,200405,吸烟对个人健康和公众利益的影响,75,75,55,56,56,307,C,
我常常对他说吸烟没有一点好处您还是把它戒了吧。,200405024529100307,泰国,1,200405,吸烟对个人健康和公众利益的影响,45,70,55,35,70,257,未参加,
他们之间太熟悉彼此的个性，优缺点，相处太久而失去结婚心态上的新鲜感，大家容易在环境改变下，喜新厌旧而经常吵架，未来的生活不易融洽。,200410534533150016,新加坡,1,200410,最理想的结交方式,75,90,66,56,82,363,C,
现今的年青一代，往往自行其事，常常以感觉为依归，看到较为倾心的异性，便认定是注定的另一半，往往没有进一步地{CC的}了解便陷入热恋中，一发而不可收拾。,200410534519150039,马来西亚,1,200410,最理想的结交方式,75,90,85,88,100,432,A,
男人女人都是奇怪的情感动物。,200410534533250069,新加坡,2,200410,最理想的结交方式,85,80,60,76,58,352,B,
有许多男女在交往时，往往只看对方的外表，不管知识水平{CC4知识}与理想是否一致，便草率地坠入{CC随入}情网，最后因性格理想的不合而分离。,200410534533250116,新加坡,2,200410,最理想的结交方式,90,70,74,60,63,350,C,
从语[F語]言而言，不会产生误[F誤]解，从风俗习[F習]惯[L]而言也不会造成差距。{CP共同的环境，共同的习[F習]惯，对后代、对父母亲戚，都能维持一个美好的人生！P},200410534519150129,马来西亚,1,200410,最理想的结交方式,70,85,49,54,77,327,C,
这样说的话，运动员特别是那些明星运动员，如果他们的年收入比本国的总统还高[BQ，]这不是一件怪事儿了。,200404140540200217,印度尼西亚,2,200404,运动员收入,60,75,60,55,51,287,C,
为什么呢{CC那}？,200404140542100289,越南,1,200404,运动员收入,65,75,70,36,63,296,未参加,
讲完了你自身健康受损外，再看看你抽烟如何影响他人。,200405680519150045,马来西亚,1,200405,吸烟对个人健康和公众利益的影响,75,95,74,90,99,427,B,
理由很简单：其一，青少年时期的人们心里对各种新鲜的事都怀有好奇心，所以给自己一个理由，说试一下就够了。,200405680519150050,马来西亚,1,200405,吸烟对个人健康和公众利益的影响,70,95,74,72,89,393,B,
同时，我也认为学者的反应太夸张了一些。,200504534533250100,新加坡,2,200504,我对男女分班的看法,70,85,81,73,86,387,B,
但如果从另一方面想，这能使女生坚强起来。,200504534533250102,新加坡,2,200504,我对男女分班的看法,80,75,65,62,64,337,C,
第五个原因是：我们现在处于二十一世纪，那种男女分班的看法可以说是过时了。,200504534533250126,新加坡,2,200504,我对男女分班的看法,70,75,67,62,73,336,C,
其[B起]实，男女分班有利也有弊。,200504534533250136,新加坡,2,200504,我对男女分班的看法,70,70,51,56,57,292,C,
三，不分班而让学生恋爱也不一定是一件坏事。,200504534533250162,新加坡,2,200504,我对男女分班的看法,70,75,70,78,64,346,B,
我本身认为这种现象有它的利与弊。[BC.],200504534533150177,新加坡,1,200504,我对男女分班的看法,70,75,65,54,68,321,C,
成绩必然会突飞猛进，那何尝[C]不是件好事呢？,200504534533250173,新加坡,2,200504,我对男女分班的看法,75,85,78,84,88,403,B,
我很同意这个说法；你的父母实在{CJ-sy是}你的第一个老师[F師]。,200505109634200017,英国,2,200505,父母是孩子的第一任老师,75,85,51,71,67,342,C,
第一，西方人认为孩子一岁时才可以算他是一个人。,200505109542200499,越南,2,200505,父母是孩子的第一任老师,70,70,50,33,69,280,未参加,
我对[BD《]父母是孩子的第一任老师[BD》]的看法不管[C]怎么说，我认为给孩子带来的影响最大的是父母。,200505109525100892,日本,1,200505,父母是孩子的第一任老师,65,65,52,49,61,276,未参加,
我是看着他们生活{CC长大}的。,200505109525200893,日本,2,200505,父母是孩子的第一任老师,80,75,55,65,64,330,C,
但是，我认为“父母是孩子的第一任老师”，可是不是唯一的老师，而且孩子的人生不属于孩子的父母。[BC．],200505109525200920,日本,2,200505,父母是孩子的第一任老师,65,55,69,51,66,288,未参加,
我完全同意父母是孩子的第一任老师。,200505109942100928,厄瓜多尔,1,200505,父母是孩子的第一任老师,75,45,52,31,46,231,未参加,
孩子出生以后他父母一直[C]照顾他，不仅是{CD有}快乐的时候而且{CD有}艰苦的时候也{CJX}他们都陪着自己的孩子。,200505109525101151,日本,1,200505,父母是孩子的第一任老师,65,60,53,53,55,269,未参加,
出生以后到现在还是{CJX}家里人都在一起坐车出去玩。,200505109525201457,日本,2,200505,父母是孩子的第一任老师,60,80,57,37,45,266,未参加,
