错句,作文编码,国籍,性别,考试时间,作文题目,口试分数,作文分数,听力分数,阅读分数,综合分数,总分,证书
现[F現]在在西方[B法]的有些国家的法律上只要病人要求医生安乐死，[BC、]医生就可以帮病人让病人解脱痛苦，我认为如果有一个人得了一种不治[B冶]之症的话早晚病人一定会死，[BC、]而且死的时候病人会受很大的痛苦，[BC、]那还不如让病人自己选择自己的生死{CC生命}。,200205271525200076,日本,2,200205,如何看待“安乐死”,70,70,74,72,68,342,C,
若房间里没有任何声响，静得几乎可以听到心跳的声音，行走时[B時]关节的摩擦声和衣服的沙沙声时我会感到一种孤[B弧]独[F獨]、害怕、失望、无[F無]生机[BQ，]而觉得人生无[F無]意义[F義]。,200304522522250002,缅甸,2,200304,静音环境对人体的危害,65,75,39,47,59,272,未参加,
有的人吃口香糖已成了一种习惯，没有口香糖，嘴巴闲着会受不了。,200306542542230012,越南,2,200306,口香糖与环境卫生,50,50,24,30,21,153,未参加,
在刚出生的婴儿当中，有{CC1具有}畸[B奇]形的疾[B痴]病{CJ+dy而生出来}的婴儿数大大增加，同时发现未有过的一些病状。,200307109523100007,韩国,1,200307,绿色食品与饥饿,65,65,78,62,67,321,C,
卖菜的人都说有些是“无农药”[BD，]{CQ的}[BQ“]绿色食品”[BC“]。,200307109523200141,韩国,2,200307,绿色食品与饥饿,70,60,62,46,38,261,未参加,
不用化肥和农药{CD的}[BQ，]农作物的产量会越来越低{CC1下降}。,200307109523200158,韩国,2,200307,绿色食品与饥饿,60,70,67,62,73,317,C,
因为人的生命是最宝贵的，{CD而}没有东西可[B呆]以替代它。,200307109523200190,韩国,2,200307,绿色食品与饥饿,65,60,75,67,76,326,C,
我曾看过[C]一本{CC篇}杂志，在杂志里写着：[BC.]现在因科技发展，[BC.]尤其是基因方面的研究非常多{CC1丰富}[BQ，]科学家们利用{CC应用}这[C]些研究资[Pzī]料发明了用基因做出来的蔬菜。[BC.],200307109523200199,韩国,2,200307,绿色食品与饥饿,70,75,72,49,76,331,C,
首先，我们[C]只有一个地球[B求]。,200307109523100211,韩国,1,200307,绿色食品与饥饿,70,70,88,78,76,370,C,
还有有{CJcd}人说，如果用化肥和农药，产量就会大大提高，就可以消除{CC消去}{CD了}饥饿。,200307109523200216,韩国,2,200307,绿色食品与饥饿,65,65,54,35,44,247,未参加,
我希望全世界可以早解决饥,200307109525100243,日本,1,200307,绿色食品与饥饿,65,80,62,80,90,365,C,
活着，健康地{CC得}过日子，这[C]是所有人最大的[C]愿望。P},200307109523200245,韩国,2,200307,绿色食品与饥饿,60,65,64,33,64,269,未参加,
我们的想法自然会改变。,200307109523200260,韩国,2,200307,绿色食品与饥饿,65,75,75,62,67,331,C,
很久[B我]以前[BQ，]没有现代这么科学发展的时代也没用像化肥{CC肥药}和农药一样的化学物质吧。,200307109501100287,中国,1,200307,绿色食品与饥饿,60,75,48,49,84,302,未参加,
现在世界上的饥饿问题也不亚于环境问题，因此有的人对于{CC由于}{CJ-zhuy人们}缺少粮食而挨饿的问题而提出先{CD提高}{CJX}该增[B曾]加农作物产量。,200307109523200289,韩国,2,200307,绿色食品与饥饿,70,80,70,54,53,317,C,
你一定吃不是绿色食品的。,200307109525100312,日本,1,200307,绿色食品与饥饿,60,80,67,59,41,294,未参加,
那[BD，]这种{CC这样}矛盾从哪儿来的呢？,200307109525200345,日本,2,200307,绿色食品与饥饿,65,75,64,62,70,323,C,
我们一有了富余就会忘掉世界上有不少人吃不到饭的{CJ-zxy现象}。,200307109525100358,日本,1,200307,绿色食品与饥饿,70,85,72,56,79,354,C,
要吃“绿色食品”是其中之一。,200307109523200408,韩国,2,200307,绿色食品与饥饿,60,80,72,64,79,342,C,
现在有很多的国家都用化肥和农药，那是因为使用化肥和农药的效果好，但因为它们对人体有害[BQ，]所以现在很多的国家不愿意使用它来作农作物。{CP但那样做{CC作},200307109523100418,韩国,1,200307,绿色食品与饥饿,65,90,64,62,84,356,C,
一边提高产量，一边保护生态环境。,200307109523200433,韩国,2,200307,绿色食品与饥饿,60,65,59,46,56,269,未参加,
因此，我觉得吃“绿色食品”是更重要的。,200307109523200543,韩国,2,200307,绿色食品与饥饿,70,80,67,46,70,323,C,
那么人们都追[C]求[BQ“]绿色食品[C]”[BQ，]怎么解决饥饿问题呢？,200307109523200578,韩国,2,200307,绿色食品与饥饿,75,65,75,59,87,348,C,
我认为吃“绿色食品”比不挨饿更重要。,200307109523200585,韩国,2,200307,绿色食品与饥饿,65,65,75,51,70,310,C,
不过我们要用更远的视角看待我们的将来、地球的未来。,200307109523200617,韩国,2,200307,绿色食品与饥饿,80,70,70,54,79,343,C,
我觉得有两个方法。,200307109525100620,日本,1,200307,绿色食品与饥饿,60,65,51,51,64,274,未参加,
现代人对健康非常敏感。,200307109525200624,日本,2,200307,绿色食品与饥饿,60,70,56,49,56,276,未参加,
绿色食品{CD种种}让社会产生一些问题，绿色食品的含意是[BD。]没有化肥和农药的是绿色食品，我们现在喝的牛奶也是加工过{CC而}{CJX}在我们的前面。[BC，],200307217523100004,韩国,1,200307,绿色食品与饥饿,65,60,40,22,35,205,未参加,
这样继续向全世界各地的人发出“健康”的倡导，“绿色食品”将会取代被污染食品的地位。,200307217523100016,韩国,1,200307,绿色食品与饥饿,85,70,75,75,87,383,B,
但是我并不是说全世界的人都要吃被污染的食品。,200307217525200054,日本,2,200307,绿色食品与饥饿,65,60,64,62,76,310,C,
所以人们买菜的时候也开始讲究无公[B工]害的[BD，]绿色食品。,200307217523100076,韩国,1,200307,绿色食品与饥饿,65,65,75,59,64,312,C,
不过为了饥饿我们不能忽视农药对{CC1关于}环境和人们健康的危害。,200307217523200096,韩国,2,200307,绿色食品与饥饿,65,65,64,46,53,277,未参加,
我们现{CQ从}自身做起，无论是在家里吃饭，还是外面吃，要做到不浪费食物，不要剩下过多的食物。,200307217523100101,韩国,1,200307,绿色食品与饥饿,70,70,75,62,81,346,C,
不要只顾自己的身体而要尽量{CC尽管}多生产绿色食品。{CJ-zhuy我},200307217523200102,韩国,2,200307,绿色食品与饥饿,65,65,83,62,81,340,C,
人的最重要的事是衣、食、住，所以国民吃饱以后才能想环境[B意]，技[B机]术发达[C]以后也可以环境{CJjy使}[B竟]恢[B回]复[BQ。]可人死亡以后不可以回来。[BC.],200307217523100115,韩国,1,200307,绿色食品与饥饿,65,60,30,14,35,187,未参加,
我不要以后世界人都生病。,200307217523200120,韩国,2,200307,绿色食品与饥饿,65,55,46,38,58,244,未参加,
到时候{CC之前}，我们人类都应该多多关心现在{CQ快}饿死,200307217523100130,韩国,1,200307,绿色食品与饥饿,65,65,54,46,70,284,未参加,
由此可见，此问题并不容易解决。,200307204523100018,韩国,1,200307,绿色食品与饥饿,65,65,75,54,70,313,C,
上述的内容是{CD为了}用化肥和农药[C][BD，]增加农作物量的一个方法。,200307204523100043,韩国,1,200307,绿色食品与饥饿,60,60,51,41,38,232,未参加,
现在科学技术越来越发达，[BC。]所以有一天能[L]夠解决这两个矛[C]盾,200307204523200070,韩国,2,200307,绿色食品与饥饿,60,65,80,75,70,333,C,
我们现在应该有{CC要}新的{CC地}要[C]求。,200307204525200066,日本,2,200307,绿色食品与饥饿,60,75,46,46,64,277,未参加,
你觉得[B的]这[C]公平吗?所以我想[C]就算用化肥和农药，也要作物的产量提高。[BC.],200307204523100087,韩国,1,200307,绿色食品与饥饿,60,70,75,46,70,306,未参加,
人的生活的最基本的条件是衣、食、住。,200307204525200089,日本,2,200307,绿色食品与饥饿,60,65,54,41,64,267,未参加,
从生物学的角度来看这个问题的话，问题不会变成这么大，[BC.]{CD则}现代的生物学、遗传学可以通过{CC受取}遗传细胞[B包]的变更来解决{CQ这}两个问题。,200307204523100096,韩国,1,200307,绿色食品与饥饿,60,60,75,54,79,310,未参加,
我是韩国人，几百年前没有农药和化肥的时候，当时的农民用{CC把}饭食垃[B拉]圾和大小便来代替[C]化肥和农药。,200307204523100097,韩国,1,200307,绿色食品与饥饿,60,60,67,25,58,252,未参加,
我们[C]应该采取这种保持供[B共]求平衡[C]的措[B错]施。,200307204523100116,韩国,1,200307,绿色食品与饥饿,80,65,72,49,61,315,C,
还有{CD在}媒体上经常播出关于绿色食品或者无公害、有机商品什么的。,200307204523200131,韩国,2,200307,绿色食品与饥饿,60,65,67,54,64,293,C,
不过[C]，在地球上另一方面的人正在面临[C]“饥饿”。,200307205523200005,韩国,2,200307,绿色食品与饥饿,65,75,64,54,67,312,C,
以前很多国家为了提高农作物的生产量，用了很多化肥和农药。,200307205523200013,韩国,2,200307,绿色食品与饥饿,70,65,78,62,84,345,C,
无论绿色{CD是否}不{CC没}绿色，吃东西对生命来说很{CC都}重要。,200307205525200054,日本,2,200307,绿色食品与饥饿,60,70,59,64,73,311,C,
在现在的科学水平下，[BC、]我把“不挨饿”放在第一位。,200307205525200120,日本,2,200307,绿色食品与饥饿,65,75,62,72,90,351,C,
我认为“绿色食品”是第一位的。,200307205525200171,日本,2,200307,绿色食品与饥饿,65,70,56,51,76,304,未参加,
实际上种植[B值]“绿[C]色食品”的农民把传统的农业作法改进了{CC改进化}。,200307209610200019,法国,2,200307,绿色食品与饥饿,70,65,72,51,58,302,C,
问题是不仅仅添加剂，[BC、]化肥和农药也是一个问题，[BC、]它们虽然带来农作物的增产，[BC、]但是也带来{CD的}化学污染[BQ，]{CD和}伤害人们的健康。,200307209525100023,日本,1,200307,绿色食品与饥饿,65,70,70,62,56,309,C,
要提高自己的生活，就得用农药和化肥。,200307209628200050,圣马力诺,2,200307,绿色食品与饥饿,60,65,43,33,56,240,未参加,
眼前的[C]效果也应该是重要{CJsd}。,200307201523100045,韩国,1,200307,绿色食品与饥饿,65,65,67,49,44,274,未参加,
我们应该关心还[C]在饥饿中为生存努力的人们，为了解决这[C]一切需要世界人民的共同[C]努力和关心。,200307302523100025,韩国,1,200307,绿色食品与饥饿,80,75,86,78,93,403,B,
对他们来说，“吃”是最重要的问题。,200307302523200042,韩国,2,200307,绿色食品与饥饿,70,60,54,51,70,290,未参加,
我认为吃“绿色食品”是第一位，假如人们继续生产那些未经过检疫的产品或使用化肥和农药的话，这会影响我们的健康问题。,200307302523200063,韩国,2,200307,绿色食品与饥饿,70,65,78,49,56,304,C,
挨饿也是{CD个}世界粮食{CC食粮[B料]}问题之一{CD而已}。,200307206525100018,日本,1,200307,绿色食品与饥饿,70,60,62,46,73,296,未参加,
如果这样{WWJ},200307206525200017,日本,2,200307,绿色食品与饥饿,65,65,64,56,73,307,C,
因为它没有化学污染，所以没有害。,200307206525200024,日本,2,200307,绿色食品与饥饿,65,65,48,38,41,241,未参加,
两个问题都矛盾，我却认为可以完[C]满地解决。,200307206525100037,日本,1,200307,绿色食品与饥饿,65,65,80,54,73,321,C,
如是否根据[F據]现[F現]代人的生活方式配合？{CP现[F現]在一家两[F兩]口都必须[F須]工作，否则[F則]生活（消费[F費]、住费[F費]、保险[F險]费[F費]）{CJ+zxy水平},200307206627100060,瑞士,1,200307,绿色食品与饥饿,75,65,62,43,58,290,C,
我们都要关心坐在暗暗的地方的人。[BC.],200307215523250019,韩国,2,200307,绿色食品与饥饿,65,70,51,59,87,318,C,
这里我所说的“交际能力”是与别人建立{CC建成}良好关系，避免争端的能力，“[BC‘]良好的关系”[BC’]当然也包括{CD着}男女之间的恋爱关系。,200310576525200003,日本,2,200310,我对男女分班的看法,65,75,68,65,67,327,C,
那[BD，]坏处[F処]是什么呢？[BC。],200310576525200024,日本,2,200310,我对男女分班的看法,70,70,60,61,61,310,C,
为什么成年男人把少年强暴{CJba}，他为什么对成年{CC成人}女人没兴趣？,200310576525200063,日本,2,200310,我对男女分班的看法,60,65,52,68,63,291,未参加,
什么是因人而异[B己]呢？,200310540540250021,印度尼西亚,2,200310,谈有效阅读,70,80,61,49,93,343,C,
从{CD对}一个人喜欢不喜欢阅读就可体现出这个人的文化知识和涵[B函]养。,200310540540250034,印度尼西亚,2,200310,谈有效阅读,60,75,61,47,88,317,未参加,
我认为，阅读是需要我们认真一点去理解{CJsd}。,200310540540250041,印度尼西亚,2,200310,谈有效阅读,60,70,48,40,48,251,未参加,
首先，我来[F來]说{CC1讨[F討]论[F論]}一下为[F為]什么有人会赞[F贊]成男女分班。,200311952922230010,美国,2,200311,我对男女分班的看法,75,80,74,70,85,375,B,
总的来说，男女分班的教育方式尚须加以研[B严]究。,200306680519250003,马来西亚,2,200306,我对男女分班的看法,80,85,77,79,96,411,B,
再者，学校犹如社会缩影。,200306680519250052,马来西亚,2,200306,我对男女分班的看法,90,90,82,77,94,431,A,
从人道主义的角度来看，我们应该生产很多的农作物给他们提供{CC2供}吃的食品。[BC.],200307271523200034,韩国,2,200307,绿色食品与饥饿,65,75,78,62,96,363,C,
那样的话，我觉得没有意义{CJX}生产绿色食品。,200307271525200032,日本,2,200307,绿色食品与饥饿,65,70,72,78,84,355,C,
人们就希望自己在这个世界多呆一天，想要享[B亨]受这世界的文明。,200307271523100072,韩国,1,200307,绿色食品与饥饿,65,65,72,64,96,346,C,
所以人们觉得要变化。[BC.],200307271523200068,韩国,2,200307,绿色食品与饥饿,65,65,51,46,64,275,未参加,
我认为发扬{CC提高}好的方面，排除不好的方面是最好的办法。,200405109525200119,日本,2,200405,吸烟对个人健康和公众利益的影响,75,70,62,68,64,328,C,
吸烟{CJ+zxy的人}不仅影响自己[C]的身体，而且{CJ-zy也}对不吸烟的人的身体{CJ-wy产生}深刻的影响。,200405109523100323,韩国,1,200405,吸烟对个人健康和公众利益的影响,50,60,59,56,61,266,未参加,
吸烟是{CJ+dy一种}人类最喜爱的习惯之一。,200405109523100371,韩国,1,200405,吸烟对个人健康和公众利益的影响,55,70,59,52,59,279,未参加,
我也以前有过这种情况。,200405109525100577,日本,1,200405,吸烟对个人健康和公众利益的影响,85,60,57,64,70,324,未参加,
对经济来说{CC看}，吸烟的买卖对公众事业发展有影响。,200405109523100696,韩国,1,200405,吸烟对个人健康和公众利益的影响,70,65,52,56,68,297,C,
现在吸烟威[C]胁[Pxíe]着很多人的健康[BQ，]同时[C]已成了严重的社会问题了。,200405109523200812,韩国,2,200405,吸烟对个人健康和公众利益的影响,65,65,76,66,68,324,C,
对我来说，吸烟对个人健康有害。{CP据一般调查的结果，无论对吸烟的本人，而且对吸烟{CD的},200405109525200814,日本,2,200405,吸烟对个人健康和公众利益的影响,65,65,31,52,46,243,未参加,
大家都知道吸烟是对身体不好的毒品，[BC。]但是我觉得大家{CC人家}都误会一个事情，[BC。]不是只有吸烟的人损害健康、{CJ-sy受害}更严重的人[BD、]就是周围的人。,200405109525100891,日本,1,200405,吸烟对个人健康和公众利益的影响,75,70,57,52,48,291,未参加,
其实，我自己也有吸烟的习惯。,200405109525200960,日本,2,200405,吸烟对个人健康和公众利益的影响,80,60,64,73,68,332,C,
为了自己，更为了大家，应该快点儿戒烟。,200405109523101001,韩国,1,200405,吸烟对个人健康和公众利益的影响,75,65,67,60,66,320,C,
但再想一想{CC想一次}，[BC。]我们的孩子把你当作{CC2做}自己的榜样。,200405109523201012,韩国,2,200405,吸烟对个人健康和公众利益的影响,75,65,79,70,59,335,C,
吸烟是{CJX}对人肯定不好的坏习惯。,200405109525201024,日本,2,200405,吸烟对个人健康和公众利益的影响,70,60,33,56,59,263,未参加,
所以周围有不抽烟的人就不抽，周围有感冒的人就不抽，开始吃饭就不抽，抽烟的人一定要考虑周围{CJ-zxy的人}。,200405109525101123,日本,1,200405,吸烟对个人健康和公众利益的影响,75,65,43,56,50,276,未参加,
这项规定施行时[F時]有很多人反对，第一个就是卖烟的商店，这样会减少他们的收入。,200405109525101306,日本,1,200405,吸烟对个人健康和公众利益的影响,75,70,69,60,84,347,C,
可见，吸烟对我们没有什么好处。{CD我们},200405109523201424,韩国,2,200405,吸烟对个人健康和公众利益的影响,75,55,48,44,66,273,未参加,
戒{CQ了}烟的人找{CQ到了}另外{CQ的}爱,200405109523201425,韩国,2,200405,吸烟对个人健康和公众利益的影响,65,60,24,23,35,190,未参加,
所以青少年容易得到烟。,200405109523101445,韩国,1,200405,吸烟对个人健康和公众利益的影响,65,70,52,50,50,273,未参加,
国家政府、[BC，]市[C]政府、[BC，]个个公益[C]单位都负有{CC2负}对一般老百姓[B性]的健[C]康{CD的}责任。,200405109523101466,韩国,1,200405,吸烟对个人健康和公众利益的影响,75,65,57,52,53,289,未参加,
这个措施不但能保持市容整洁，帮助青少年养成良好习惯，还能保住[B注]很多人,200405109523101545,韩国,1,200405,吸烟对个人健康和公众利益的影响,85,75,79,79,88,398,B,
麻药当然对身体有不少的损害，比如说，得癌症，嗓子发炎，心脏[C]有负重。,200405109525201689,日本,2,200405,吸烟对个人健康和公众利益的影响,60,65,52,56,61,277,未参加,
现在吸烟{CD者}很困难。,200405109525201833,日本,2,200405,吸烟对个人健康和公众利益的影响,60,55,50,48,53,247,未参加,
吸烟，我[C]可[C]能[C]受到不少健康损失，那么，在[C]哪[C]可[C]以得到{CC受到}健康损失赔偿[C]呢？,200405109523201861,韩国,2,200405,吸烟对个人健康和公众利益的影响,60,75,57,48,44,270,未参加,
我特别担心她，[BC…]因为我看了几个{CC种}事[C]例[BQ，]吸烟的人生的孩子是什么样{CC怎么样}的，[BC。]有的是没有手，有的是没有脚等等。,200405109523201870,韩国,2,200405,吸烟对个人健康和公众利益的影响,65,85,55,52,53,300,未参加,
从这一方面来看，我们可以知道青少年的吸烟观念。,200405109523201882,韩国,2,200405,吸烟对个人健康和公众利益的影响,85,80,64,54,48,324,C,
吸烟对人体没有任[B仁]何[Phé]好处。,200405109523200831,韩国,2,200405,吸烟对个人健康和公众利益的影响,65,60,62,54,68,292,C,
还有如果女[C]生抽烟的话[BQ，]将来那女[C]生的孩子会有毛病。,200405109523200836,韩国,2,200405,吸烟对个人健康和公众利益的影响,60,55,54,58,54,262,未参加,
他们还出台别的规定，就是晚上11点以后不卖烟草（在日本{CD在}路上有许多自动售货机）和不允许将烟草卖给未成年人。,200405109525200242,日本,2,200405,吸烟对个人健康和公众利益的影响,85,70,67,75,82,370,C,
现在很多国家，很多城市已实行对在公共场所吸烟者{CQ的}惩罚措施，这个措施有很多好处：第一个是保护不吸烟者的健康；[BC：]第二个是保护城市外观整洁；第三个是对青少年养成好习惯{CJjy}，他们成大后不在公共场所吸烟。,200405109525200252,日本,2,200405,吸烟对个人健康和公众利益的影响,75,65,74,58,75,334,C,
我觉得应该以电视播送、小中学生{CC的}课堂上教育等方式，让更多的人了解情况。,200405109525201317,日本,2,200405,吸烟对个人健康和公众利益的影响,60,65,69,68,62,307,C,
二是吸烟{CJ-wy产生}的二手烟{CC副流烟}对周围的人有影响。,200405204525200008,日本,2,200405,吸烟对个人健康和公众利益的影响,60,65,60,58,51,277,未参加,
{CD对}吸烟这个话题议论{CJX}的时候，可以从几个方面来思考。,200405204525200236,日本,2,200405,吸烟对个人健康和公众利益的影响,65,60,68,58,79,313,C,
将[F將]来这些对抽烟的人的规定肯定越来越严格吧。,200405204525100242,日本,1,200405,吸烟对个人健康和公众利益的影响,65,65,47,54,51,266,未参加,
可是，还有很多不管道德、[BC，]规定{CC规则}随地吸烟的人。,200405204525200264,日本,2,200405,吸烟对个人健康和公众利益的影响,60,60,44,56,40,242,未参加,
吸烟对人的身体毫无疑问不好{CJX}{CJsd}。,200405204525200267,日本,2,200405,吸烟对个人健康和公众利益的影响,60,65,49,65,49,271,未参加,
可是，其可怕{CC害怕}之处不止如此{CC不处于这}，只有吸烟的本人得病，那大家不会那么在意。,200405204525100314,日本,1,200405,吸烟对个人健康和公众利益的影响,70,60,38,61,56,270,未参加,
那么为什么不改呢？,200405204525200310,日本,2,200405,吸烟对个人健康和公众利益的影响,70,70,30,39,45,242,未参加,
即使抽了烟，[BC.]也只会危害自己的身体，不是吗？,200405204525100384,日本,1,200405,吸烟对个人健康和公众利益的影响,60,75,71,73,88,353,C,
对吸烟者来说，不能随便吸烟，只能{CQ在}固定的地方吸烟了。,200405205525100085,日本,1,200405,吸烟对个人健康和公众利益的影响,65,80,52,39,63,287,未参加,
虽然[C]他们有他们的理由，有时在街上{CD没[C]有}找不到垃圾箱，但是把它随意扔掉[C]的[C]行为还是不文明的。,200405205525200125,日本,2,200405,吸烟对个人健康和公众利益的影响,60,80,55,63,67,312,未参加,
我认为，各政府应该施行这些措施，保持市容整洁，形成良好的社会风气。,200405205525200133,日本,2,200405,吸烟对个人健康和公众利益的影响,60,80,68,73,61,329,C,
这样，{CD有}一个人吸烟对公众的危害性也太大了。,200405205525200134,日本,2,200405,吸烟对个人健康和公众利益的影响,65,80,79,75,79,366,B,
只有他们受到吸烟的影响的话，没有那么多人反对，可是现实是不是的。,200405205525200143,日本,2,200405,吸烟对个人健康和公众利益的影响,65,75,44,61,76,308,未参加,
对爱吸烟的人来说，允许抽烟的地方越来越少了。,200405205525200167,日本,2,200405,吸烟对个人健康和公众利益的影响,55,65,44,42,49,237,未参加,
“吸烟”是人类的一种爱好。,200405201525100049,日本,1,200405,吸烟对个人健康和公众利益的影响,65,75,52,44,70,293,未参加,
不让随便吸{CJ-by烟}的另一个好处呢，能够保持美好的风景{CJs}。,200405201525100141,日本,1,200405,吸烟对个人健康和公众利益的影响,70,75,49,42,47,272,未参加,
这样，我就好像没有空气吸还有，另外一个方法偶然见面—这样是有危险的{CY}。,200410534533250003,新加坡,2,200410,最理想的结交方式,65,60,19,40,30,197,未参加,
但，最终却[B確]不欢而散。,200410534519250041,马来西亚,2,200410,最理想的结交方式,75,85,80,67,82,382,B,
无论我们身处什么环境之下，鸟语花香的公园{CD也好}，如诗如画的山野风光，{CD或是}简陋的小车站、小巷，还是人潮汹涌的购物中心里。,200410534533250137,新加坡,2,200410,最理想的结交方式,85,75,80,79,100,411,B,
虽[B贵]然总统也有生命危险，但那个危险是比不上运动员的危险{CJsd}。{CP虽[B贵]然运动员的收入是最高的，我还是希望运动员们不得意[B高]忘形，是因为他们高的收入是有理由的。P},200404140540200251,印度尼西亚,2,200404,运动员收入,70,65,44,50,53,268,未参加,
另外，吸烟者常会在吞云吐雾时影响身旁的人。,200405680519250005,马来西亚,2,200405,吸烟对个人健康和公众利益的影响,95,95,74,83,91,437,A,
每当在街上走动时，或在百货公司闲逛都会有意无意地[B的]发现到许多的年青人站在一旁吸烟，弄得整个地方乌烟瘴[B障]气，令人呼吸困难，甚至还要用手遮着鼻子。{CD在环境污染及许多人},200405680519250035,马来西亚,2,200405,吸烟对个人健康和公众利益的影响,65,90,49,63,80,338,C,
某市政府为了保持市容整洁，并帮助青少年养成良好的习惯，已于日前规定在公共场所边走边抽烟的人将被罚款。,200405680519250038,马来西亚,2,200405,吸烟对个人健康和公众利益的影响,80,95,77,90,87,424,B,
俗语说‘饭后一支烟，快乐似神仙’，而我只想说‘每日一包烟，早日做神仙’。,200405680519150045,马来西亚,1,200405,吸烟对个人健康和公众利益的影响,75,95,74,90,99,427,B,
所以家长不必太担心学校混合式教育会{CQ带}来早恋。[BC.],200504534533250004,新加坡,2,200504,我对男女分班的看法,70,70,56,62,66,312,C,
首先，男女就会更加保守，他们只喜欢和同性别的学生交往。,200504534533150043,新加坡,1,200504,我对男女分班的看法,75,70,81,82,86,383,B,
但在一个开放时代，这种想法似乎有些单纯。,200504534533250100,新加坡,2,200504,我对男女分班的看法,70,85,81,73,86,387,B,
[BQ《]圣经[BQ》]上记载，上帝先造了亚[B近]当再用其肋骨造成夏娃。,200504534533250116,新加坡,2,200504,我对男女分班的看法,95,75,76,78,86,405,B,
