错句,作文编码,国籍,性别,考试时间,作文题目,口试分数,作文分数,听力分数,阅读分数,综合分数,总分,证书
为此，不是为了考试看古代经典[C]，而是为了培养人{CQ才}精读，也是很好的办法。,200505109525102121,日本,1,200505,父母是孩子的第一任老师,85,60,71,71,80,355,C,
平时[C]的习惯常常会在孩子面前暴[C]露[C]出来的。,200505109525202353,日本,2,200505,父母是孩子的第一任老师,70,70,76,76,80,360,C,
[BD《]父母是孩子的第一任老师[BD》]父母是孩子的第一任老师，这句话是完全对的。,200505109525202474,日本,2,200505,父母是孩子的第一任老师,65,70,48,67,72,308,C,
我也是受到父母的很大影响的孩子之[C]一。,200505109525202494,日本,2,200505,父母是孩子的第一任老师,60,50,44,41,52,227,未参加,
所以这个看法我完全赞成。,200505205542200114,越南,2,200505,父母是孩子的第一任老师,55,50,50,39,47,220,未参加,
倘若[BD，]现[F現]代男女结[F結]婚之前能更加了解对[F對]方，就不会[F會]造成日后[F後]须面对[F對]是否该[F該]离[F離]婚之抉择[F擇]。,200505951501150008,中国,1,200505,最理想的结交方式,85,90,79,82,93,425,A,
又有些男女则在一个偶然的机会相遇，彼此一见倾心，都认为{CJ-zhuy对方}就是自己理想中的那一个，从而迅速落入情网，这种婚姻全是靠偶然，{CQ对}双方情形、[BC，]学问、[BC，]待人接物一概不知，这类婚姻{WWJ},200505522522150005,缅甸,1,200505,最理想的结交方式,65,65,39,40,59,252,未参加,
那时[F時]如果你不能接受她或他的缺点[F點]，[BC、]就会因此而不快乐。,200505522522250012,缅甸,2,200505,最理想的结交方式,60,90,77,64,82,363,C,
不要去太挑剔自己心爱的人，把{CC用}不满和指责[BD，]变成{CC换为[F為]}宽容谅解，还要{CC还有}有耐心{CC耐性}，才能保持{CJ+buy好}彼此{CC你们}之间的恋情或夫妻关系[F係]。,200505522522150029,缅甸,1,200505,最理想的结交方式,65,70,63,71,79,334,C,
所以这方面就得交给他们的父母、亲朋好友来做了。,200505522522110006,缅甸,1,200505,最理想的结交方式,70,75,66,73,91,364,C,
然后在学校会发展{CJ+buy到}交流的方法。,200505332540200030,印度尼西亚,2,200505,父母是孩子的第一任老师,60,65,50,45,52,255,未参加,
我相信我能够把您的广告打造得很好并且能够帮助您。,200509534533250004,新加坡,2,200509,一封求职信,80,80,77,53,64,346,C,
除中英文{CC语}外，我也能书写法文，马[F馬]来文等，曾为百思乐[F樂]公司设计广告并[F並]获得香港常年广告（一九九九）银[F銀]牌学，新加坡大华银[F銀]行举办{CQ的}二零零三年度广告大奖，现附上简[F簡]历及近照一张，敬请[F請]早日答复[B覆]，谢[F謝]谢[F謝]。,200509534533250031,新加坡,2,200509,一封求职信,55,75,77,53,70,315,未参加,
更对许多国家的文化，艺术，历史等等都有相当的了解{CC认[F認]识[F識]}。,200509534533250072,新加坡,2,200509,一封求职信,80,80,68,64,86,370,C,
在中国居住的那{CC这}段日子内，我的华文更是逐[C]日进步。,200509534533250132,新加坡,2,200509,一封求职信,65,65,68,62,86,330,C,
我是一名25岁的待业毕业生，xx。,200509534533150141,新加坡,1,200509,一封求职信,70,70,48,51,46,273,未参加,
我曾参加探讨家庭关系的课程。,200509534519250148,马来西亚,2,200509,一封求职信,85,70,75,77,88,386,B,
我毕业于新加坡国立大学，还得了优异成绩奖。,200509534533250144,新加坡,2,200509,一封求职信,75,70,75,60,79,348,C,
最近因为家里出现了一些经济问题，只好回国找份工作补贴家用。,200509534533250168,新加坡,2,200509,一封求职信,70,75,86,71,88,379,B,
在我到美国深造前，在新加坡时也学过{CD了}日语。,200509534533250168,新加坡,2,200509,一封求职信,70,75,86,71,88,379,B,
各种各样{CC个众人样}的。,200510111540200586,印度尼西亚,2,200510,我看流行歌曲,50,40,30,16,20,131,未参加,
现代的歌曲是很直接的，很容易看到，很容易听到，这是对未成年人{CC未成年者}来说，很危[Pwēi]险[Pxiǎn]的，咱[B自]们应该注意未成年人{CC未成年者}的安全，保护他们具有的好想法，这是我们年轻人的义务，应该注意到抵制{CC感览[Blán]}流行歌曲的坏[B怀]处。,200510111523100791,韩国,1,200510,我看流行歌曲,60,60,53,30,37,222,未参加,
我觉得流行歌曲{CD是}反映[B应]了当时的社会问题和热点，当然大部分歌曲的主题[B体]就是爱。,200510111523100895,韩国,1,200510,我看流行歌曲,55,60,37,50,52,235,未参加,
我喜欢他的时候，我和我的父母有了矛盾。,200510111523201053,韩国,2,200510,我看流行歌曲,45,65,49,46,50,235,未参加,
在世界上没有个性的话怎么区[B去]别我和你呢。,200510111523201073,韩国,2,200510,我看流行歌曲,55,70,44,36,32,221,未参加,
有些人听歌曲，也{CQ有}一些人唱歌曲缓解{CC解决}心理[B里]压力[B里]。,200510111523101104,韩国,1,200510,我看流行歌曲,50,60,46,46,47,229,未参加,
大部分韩国老人觉得歌星迷是不学习的、不听父母的话[C]的不好的年轻人。,200510111523101112,韩国,1,200510,我看流行歌曲,55,70,60,38,50,257,未参加,
平时走路的时候，别听流行歌曲，听听力口语内容。,200510111523101240,韩国,1,200510,我看流行歌曲,45,50,30,30,37,169,未参加,
有些女孩儿喜欢歌星{CJX}太过分。,200510111523201579,韩国,2,200510,我看流行歌曲,65,60,51,36,45,240,未参加,
每当我放学后，因为发生某些事而感到心情低落的时候，我就戴[B载]上耳机开始放些慢但不悲伤[F傷]的歌曲。,200510205919100142,加拿大,1,200510,我看流行歌曲,95,60,67,65,91,369,C,
有时候，真的不明白为什么[F麽]有些人拒绝流行歌[L]曲。,200510205919100143,加拿大,1,200510,我看流行歌曲,80,70,53,59,67,319,C,
而赶时代生活的人，就会很活跃、[BC，]快乐，因为他们有思想，不像那些“木头人”一样，他们感受到世界正在变，生活日益改善，好的东西不断地出现{CC出来}，为人类创造幸福，帮人们充满希望地过日子。{CP我认为人活着，就应该有个活人味儿，就像活水一样，纯洁而欢迎[C]。P},200510520520250001,蒙古国,2,200510,我看流行歌曲,70,70,60,61,52,301,C,
人们已经迷在了他们的肖像而不是唱歌唱的多好{CJ-zxy上面}。,200510302523100007,韩国,1,200510,我看流行歌曲,75,70,58,52,72,316,C,
比如说喜欢某人，如果你非常喜欢一个女人或者是男人，你可以在不侵犯对方或任何人的权力的情况下{CD可以}自由地爱她，也可以自由地表达你的感情，但要是你超过了一定的限度，达到痴迷的程度，那么你的爱不能再称为爱了。,200510302523100023,韩国,1,200510,我看流行歌曲,70,70,67,65,89,349,C,
所以我赞成喜欢流行歌曲。,200510302523200048,韩国,2,200510,我看流行歌曲,85,70,65,56,69,336,C,
所以对控制不住自己的孩子来说，容易达到痴迷的程度。,200510302523100054,韩国,1,200510,我看流行歌曲,75,70,58,48,82,322,C,
我觉得别的人的想法跟我差不多。,200510302523200061,韩国,2,200510,我看流行歌曲,70,50,46,44,59,252,未参加,
比如，有一天我跟朋友一起去唱歌，可是我一个流行歌也不会唱的话我就不能拥有{CC共有}和他们一样的快乐感。,200510302523100077,韩国,1,200510,我看流行歌曲,65,65,67,54,74,309,C,
虽然流行歌曲符合人们的胃口而被人们喜欢，但我认为它却没有缊含着那种希望。,200510302523200080,韩国,2,200510,我看流行歌曲,70,90,60,59,79,351,C,
这是第三种原因。,200510302523100086,韩国,1,200510,我看流行歌曲,80,85,83,65,84,391,B,
我们自然而然地{CC的}会接收一些美丽的诗歌。,200510302523200094,韩国,2,200510,我看流行歌曲,60,75,67,46,62,296,未参加,
我觉得流行歌曲给{CC对}生活上带来很多好处。[BC，],200510302523100108,韩国,1,200510,我看流行歌曲,60,60,56,50,62,270,未参加,
你们做完在你的前边的事{CJ+sy做完}之后{CQ对}歌星达到痴迷的行动[C]也能理解，但是大人们不理解青少年的这样的行动就是做[C]{CJX}没[C]完自己的[C]事，只喜欢他们。,200510302523100117,韩国,1,200510,我看流行歌曲,60,65,39,36,42,225,未参加,
我喜欢流行歌曲，流行歌曲也是一种优美的音乐之一{CJZR}。,200510302523200209,韩国,2,200510,我看流行歌曲,60,65,60,50,50,268,未参加,
老人或年龄较大的人对此[B比]表示很不理解，他们说：“现在的人怎么都喜欢听那样的歌呢？,200510302523200260,韩国,2,200510,我看流行歌曲,75,80,74,67,94,381,B,
听的就更{CC便}多了，所以把这明星唱的歌曲当作一个流行的歌曲。,200510302523200261,韩国,2,200510,我看流行歌曲,60,65,51,44,55,258,未参加,
歌曲真的流行吗？,200510532529250004,泰国,2,200510,我看流行歌曲,75,80,25,38,25,234,未参加,
梭罗的教联{CD有}组织歌咏，我的先生很喜欢中国歌，所以我们也就参加了教联的歌咏队。,200510540540200071,印度尼西亚,2,200510,我看流行歌曲,65,65,46,52,69,281,未参加,
在这种情况下怎么能找{CJ-buy到}爱情？,200505610610150016,法国,1,200505,最理想的结交方式,60,70,36,60,50,261,未参加,
双方通过慢慢了解，逐渐相爱，不仅是对他人，也是对自己负责任，[BC。]对自己的未来生活负责任，因为对方毕竟是{CQ与}我们{CJX}要一起生活下半生的人，所以肯定是要很慎重。,200505610610250011,法国,2,200505,最理想的结交方式,70,90,82,75,95,405,B,
很多时候，父母的言行举[F舉]止[B指]也可以影响小孩子的成长[F長]。,200509602801250011,澳大利亚,2,200509,父母是孩子的第一任老师,0,75,88,81,84,324,未参加,
我很担心爸、妈{CQ的}身体健康。,200104124523200005,韩国,2,200104,一封写给父母的信,75,70,58,47,45,284,C,
你们也知道我不喜欢主食却喜欢零食，以前我常常以饼干代替主食，但现在不是这样{CQ了}。{CJ-zhuy我},200104124523200008,韩国,2,200104,一封写给父母的信,65,80,58,58,63,312,C,
在生活中，幸亏我没有什么问题。,200104124525200018,日本,2,200104,一封写给父母的信,70,75,38,47,58,277,未参加,
我总是对不起你们，家庭条件不算好，我还在这儿轻松地过日子。,200104124523200085,韩国,2,200104,一封写给父母的信,65,50,58,61,63,278,未参加,
生活中{CD的}“吃”和“住”的方面都已经习惯了。,200104124525100129,日本,1,200104,一封写给父母的信,70,80,44,42,56,282,未参加,
这个暑[B署]假我打算回国看您和爷爷奶奶，您看怎么样？,200104124542100109,越南,1,200104,一封写给父母的信,80,65,77,51,67,328,C,
记得我在青春期时，我觉得您说的话都不顺耳{CC顺听}，动不动{CQ就}翻脸，发脾气。,200104124525200221,日本,2,200104,一封写给父母的信,70,65,85,82,81,369,C,
我在这儿也很好，所以你们别担心。,200104124540200212,印度尼西亚,2,200104,一封写给父母的信,70,65,27,23,38,209,未参加,
亲爱的妈妈[BQ：]最近你过得怎么样，[BC？]身体好吗？,200104124523200451,韩国,2,200104,一封写给父母的信,70,70,52,25,45,250,未参加,
亲[F親]爱[F愛]的妈妈、[BC，]爸爸：你们好吗？,200104124525200459,日本,2,200104,一封写给父母的信,65,65,41,65,45,265,未参加,
我本来对服装{CQ就}很感兴趣。,199200204525200008,日本,2,199200,一封求职信,,,0,0,0,0,未参加,
女人穿的衣服越来越高雅，花钱也越来越多。,199200204525100023,日本,1,199200,一封求职信,,,0,0,0,0,未参加,
男人也如此。,199200204525100023,日本,1,199200,一封求职信,,,0,0,0,0,未参加,
我申请[B神]请{CD于}“广告设计师”的职位{CC地位}，我在人民大学{CJ-sy学}的是贸易系的国际广告专业，我的成绩[B级]都很好。,199200008919200023,加拿大,2,199200,一封求职信,,,0,0,0,0,未参加,
每个人都有自己的情况、感觉和想法。,199604123525200284,日本,2,199604,如何看待“安乐死”,80,65,82,81,70,366,B,
因为丈夫帮助妻子自杀，是在死者的要求{CQ下}进行的，是为了解脱死者和家人的痛苦，不应该受到法律的制裁。,199604123523200331,韩国,2,199604,如何看待“安乐死”,55,60,66,54,26,242,未参加,
但[BD、]不幸的是[B事]，[BC、]得病后[C]不一定会治好的。,199604123525200163,日本,2,199604,如何看待“安乐死”,60,70,74,76,65,329,C,
无论你怎[C]么好，你造[C]{CQ成}人死亡的原因[C]是多么善良都是犯法的。,199604123542200095,越南,2,199604,如何看待“安乐死”,80,70,56,69,60,324,C,
所[C]以，自己的家属{CC家族}成[C]了植物人，这[C]事情意[C]味着全家的破产。,199604123525100313,日本,1,199604,如何看待“安乐死”,60,65,29,52,31,220,未参加,
看这本小说时，我对那位大夫感到很尊敬。,199604124523200238,韩国,2,199604,如何看待“安乐死”,60,80,61,81,67,336,C,
可是我们没[C]办法，只是看看{CJcd}他痛[C]苦[BQ。],199604123525200203,日本,2,199604,如何看待“安乐死”,70,55,58,71,60,297,C,
这么大的社会问题似乎没有最好的处置{CJ-zxy方法}。,199604124525200223,日本,2,199604,如何看待“安乐死”,45,55,35,49,39,200,未参加,
因为我认为生命是世界上最宝贵的，跟什么东西也换不成。,199604123523100504,韩国,1,199604,如何看待“安乐死”,80,65,61,59,77,330,C,
但人是一个不完全的动物，{CD也是}在一个特别的情况下一定会发生这样可悲的事情。,199604123523200334,韩国,2,199604,如何看待“安乐死”,70,85,71,69,52,337,C,
{CP我认为，那个丈夫他的妻子要[C]求帮助自杀了，但是法律上不能帮助自杀，那[C]么不应该帮助。P},199604123523100039,韩国,1,199604,如何看待“安乐死”,55,45,45,69,26,217,未参加,
各个国家，各个宗教都对安乐死的看法不一样。,199604123523200145,韩国,2,199604,如何看待“安乐死”,60,60,58,61,44,265,未参加,
天下的父母，谁不疼自己的子女。,199610801533200013,新加坡,2,199610,如何解决“代沟”问题,90,70,75,48,43,319,C,
解[C]决“代沟”问题的关键是父母和子女间的共同语言的{CJs}。,199610550523290069,韩国,2,199610,如何解决“代沟”问题,0,50,25,40,41,146,未参加,
解[C]决[F決]“代沟”问[F問]题[F題]，最好的方法就是彼此沟[F溝]通，多互相了解[C]。,199610550523190091,韩国,1,199610,如何解决“代沟”问题,65,70,65,75,78,339,C,
咱们年青人对社会变化反应{CC对应}速度比较快。,199610550523190092,韩国,1,199610,如何解决“代沟”问题,60,65,54,55,61,278,未参加,
我想很少知道。,199610550523290097,韩国,2,199610,如何解决“代沟”问题,65,55,39,44,35,220,未参加,
此外，讲道理时[F時]，也要摆事实[F實]，给他示范[F範]一下洗衣机、干[F乾]衣机的方便，让[C]他亲历其境，那种[C]做法当然比吵架和争[F爭]论好得多。,199611543634100532,英国,1,199611,如何解决“代沟”问题,70,80,78,71,90,379,B,
第二，了解。,199611543523100507,韩国,1,199611,如何解决“代沟”问题,75,70,46,42,43,265,未参加,
他们期望别人会去完成，自己{CC他们}就可坐享其成。,199603533533100011,新加坡,1,199603,由“三个和尚没水喝”想到的……,85,80,71,81,91,401,B,
同样的，单位与单位之间，甚至地区与地区之间，应该抱着互相帮助{CC相辅相成}的态度。,199603533533100019,新加坡,1,199603,由“三个和尚没水喝”想到的……,90,85,80,74,94,420,B,
就这样，苦的便是那个最小的和尚。,199603533533200040,新加坡,2,199603,由“三个和尚没水喝”想到的……,85,65,66,76,84,365,C,
就拿新加坡来说吧，国人常说“新加坡的清洁，花园城市”的美誉[C]，都是政府在{CC通过}罚款制度下而得的，但是，很多人，包括我家人，他们常在公共{CC共用}场所故意[L]丢纸张，（没政府人员在的情况下）他们会说，地是由清洁工人扫的，丢了纸张，工人会打扫，那是应该的。,199603533533200067,新加坡,2,199603,由“三个和尚没水喝”想到的……,90,85,66,70,77,385,B,
这是大家都{CD能}知道的了。,199605104523200005,韩国,2,199605,由“三个和尚没水喝”想到的……,75,60,71,63,54,309,C,
当然最初用石油的人很少，这阶[F階]段是故事中的第一个和尚{CY}。,199605104525100059,日本,1,199605,由“三个和尚没水喝”想到的……,65,60,58,72,68,306,C,
他们之间没有利他主义思想{CC心理}。,199605104523200079,韩国,2,199605,由“三个和尚没水喝”想到的……,70,60,63,63,56,297,C,
我来说一下由“三个和尚没水喝”想到的我的感受{CC感觉}。,199605104523200136,韩国,2,199605,由“三个和尚没水喝”想到的……,65,65,52,58,63,287,C,
这篇文章含有的意思是{CC的}什么？,199605104523200136,韩国,2,199605,由“三个和尚没水喝”想到的……,65,65,52,58,63,287,C,
但如果有可能别人{CJX}替自己去做，就希望别人去。,199605104525200171,日本,2,199605,由“三个和尚没水喝”想到的……,75,60,69,79,80,349,C,
还我[C]非常盼望，中国[F國]和世界没有这样的人，[BC。]没有这样的国[F國]家。,199605104523100181,韩国,1,199605,由“三个和尚没水喝”想到的……,80,65,77,54,75,339,C,
这个结果是很可悲{CC可怜}的，不过这原因是人的热情{CC热亲}行为{CC行动}。,199605104525200176,日本,2,199605,由“三个和尚没水喝”想到的……,55,55,58,60,58,266,未参加,
谁都不愿意去做事，将来的社会会变成什么样呢？,199605104523200208,韩国,2,199605,由“三个和尚没水喝”想到的……,80,70,69,72,89,370,C,
他们[C]三位和尚都没想出来别的办法，[BC。]能想出来那[#]可能不会没有了{CJX}喝{CJX}水。,199605104525200243,日本,2,199605,由“三个和尚没水喝”想到的……,55,50,55,45,35,219,未参加,
第二，人多了就有自然资源{CC2源}的问题。,199605104633200268,意大利,2,199605,由“三个和尚没水喝”想到的……,65,55,60,45,37,244,未参加,
一天，两天，三天过去了，走廊还是黑洞洞的，没有人去把事情解决。,199605104542200312,越南,2,199605,由“三个和尚没水喝”想到的……,75,85,71,58,84,366,B,
谁卖菜，谁做什么菜，谁洗盘子。,199605104525200323,日本,2,199605,由“三个和尚没水喝”想到的……,65,80,66,67,70,336,C,
光阴似箭[B煎][BQ，]但是没有新来的和尚。,199605104616100327,德国,1,199605,由“三个和尚没水喝”想到的……,85,65,44,33,56,272,未参加,
因为那时[C]像[B修]这[C]么[C]启蒙[C]的办法闻所闻[C]那[C]个寺庙产生了很大的吸[C]引力。,199605104616100327,德国,1,199605,由“三个和尚没水喝”想到的……,85,65,44,33,56,272,未参加,
父母为{CC1为了}这件事感到很高兴，总是跟邻居们说：“你看我们这个儿子多么好啊！,199605104634200326,英国,2,199605,由“三个和尚没水喝”想到的……,75,80,63,76,58,343,B,
我想在故事里面的和尚也是[BQ。]如果一个人的话，那就应该谁也不管你的事情，谁也不照顾。,199605104525100343,日本,1,199605,由“三个和尚没水喝”想到的……,80,70,44,49,42,275,未参加,
那么在家里呢{CC那}？,199605104525200355,日本,2,199605,由“三个和尚没水喝”想到的……,75,60,66,70,68,325,C,
只是这刚来的和尚{CJ+zy比较}瘦[C]点。,199605104540200352,印度尼西亚,2,199605,由“三个和尚没水喝”想到的……,75,70,44,42,58,278,未参加,
然后决定去{CD向}山下挑水是修炼内容{CC4练巧}之一，{CJ+zy以后}和尚们{CJ-zy才}无精打采[B彩]地到{CC向}山下挑水去了。,199605104525100371,日本,1,199605,由“三个和尚没水喝”想到的……,55,50,46,58,68,256,未参加,
连我这样文化程度比较高的人也这样想，这可的确{CC明明}是毛病。,199605550523190031,韩国,1,199605,由“三个和尚没水喝”想到的……,60,60,52,58,51,263,未参加,
三个和尚没水喝，想到{CD的}怎么办[F辦]好，可以得到水。[BC，],199605550523190034,韩国,1,199605,由“三个和尚没水喝”想到的……,0,60,35,38,35,160,未参加,
双方相互合作时[F時]，会得到更高{CC好}的效率。[BC，],199605550523190034,韩国,1,199605,由“三个和尚没水喝”想到的……,0,60,35,38,35,160,未参加,
所以三个人都希望[C]别人去山下抬水喝。,199605550523190036,韩国,1,199605,由“三个和尚没水喝”想到的……,60,60,63,58,63,286,未参加,
这文章虽然不[C]长[BQ，]不[C]过可以看出来{CQ包含}很大的思想。[BC，],199605550523290035,韩国,2,199605,由“三个和尚没水喝”想到的……,65,50,55,35,42,228,未参加,
和尚是信佛的，{CD而}离开俗世的所有的杂念修炼{CC休养}自己的人，[BC。]他们在{CC当}修炼{CC休养}中，肯定有好多苦闷和烦恼[B脑]。,199605550523290043,韩国,2,199605,由“三个和尚没水喝”想到的……,65,75,80,60,75,342,C,
我们[C]这样做[C]真好。,199605550523290051,韩国,2,199605,由“三个和尚没水喝”想到的……,55,55,30,38,32,190,未参加,
我们个人应该先想后{CJ+sy去}做。,199605550523290064,韩国,2,199605,由“三个和尚没水喝”想到的……,65,65,55,51,56,276,未参加,
可是，后来又来了一个和尚，然后又来了第[B弟]三个和尚，人越来越多，大家都不想辛[B幸]辛[B幸]苦苦地到山底下抬水喝，只希望别人去山下抬水。,199605550523290083,韩国,2,199605,由“三个和尚没水喝”想到的……,65,60,44,63,51,266,未参加,
让我写对我影响最大的人，那花不了几分{CQ钟}就想起来我的妈妈{CQ了}。,199704123523200033,韩国,2,199704,记对我影响最大的一个人,65,85,65,54,53,312,C,
我在大学{CD的}读书时，在一家书店打工{CLH}过。,199704124525200319,日本,2,199704,记对我影响最大的一个人,70,80,70,80,77,367,B,
从此以后{CC之后}，我下{CD了}决心继续学习汉语，喜欢上了学汉语，{CD而}{CQ现在}终于来到北京学习汉语了。,199704124525200322,日本,2,199704,记对我影响最大的一个人,85,90,84,89,79,423,A,
小学毕[F畢]业后我就到棉兰攻读初中，进[F進]了三山中学直[B至]到高中毕[F畢]业为止，都在那里读书[F書]。,200110540540250042,印度尼西亚,2,200110,我的童年,70,85,49,51,79,326,未参加,
身为父母，我觉得只把孩子生出来。{WWJ},200110540540250137,印度尼西亚,2,200110,我的童年,70,80,49,37,51,277,未参加,
每年的旱季卡江的水不深。,200110540540150143,印度尼西亚,1,200110,我的童年,80,85,79,65,88,391,B,
两个人拿着不放，结果把花瓶打破了。,200110540540250155,印度尼西亚,2,200110,我的童年,65,65,58,61,67,300,C,
电话：5648067传呼机号码：2105960谨此，向贵公司达万二分之谢意。,199312533540100020,印度尼西亚,1,199312,一封求职信,90,90,67,70,78,393,B,
在这三年当中，我时[F時]常接待海外侨[F僑]胞及旅客，也带队[F隊]去了很多名胜[F勝]古迹[C]{CJ+zxy的地方}，对我国的历史及地理、[BC.]风[F風]土民情了解了一些，也增进[F進]了很多见识[F識]及经验[F驗]，对这个工作充满了信心。,199312533533200062,新加坡,2,199312,一封求职信,90,80,74,76,75,390,B,
请以下列地址联络：中华街2十2号。,199312533533100082,新加坡,1,199312,一封求职信,90,75,85,70,75,389,B,
也懂英文，能讲利{CQ的}英语。,199312533533200086,新加坡,2,199312,一封求职信,90,70,60,61,75,349,C,
曾经在北京生活了十年[BQ，]会说普[C]通话[BQ。]我是北[C]京男居民[BQ，]我在中国广告赛{CQ上}取得了第一名，[BC.]还有参加世界广告赛了[BQ。]一九九0年一月一日,199312104523100008,韩国,1,199312,一封求职信,0,40,39,37,34,136,未参加,
我的联系地址是：埼玉县所泽市绿町3-29-20。,199312123525200102,日本,2,199312,一封求职信,55,70,50,74,80,313,未参加,
希望得到您的支持{CC持支}和帮助。,199312123542100412,越南,1,199312,一封求职信,55,50,46,45,41,216,未参加,
经过三天的考虑，我决定了要入贵公司，[BC.]我愿意当司机。[BC.],199312123523100502,韩国,1,199312,一封求职信,45,50,43,37,39,190,未参加,
我现在住在新世界饭店505号房间，电话号码是753-2388转343.5。,199312123523200912,韩国,2,199312,一封求职信,65,65,78,70,55,318,C,
因为他已经老了。,199412123525100002,日本,1,199412,记我的父亲,50,70,25,28,35,191,未参加,
”,199412123506100022,巴基斯坦,1,199412,记我的父亲,60,80,41,28,30,226,未参加,
我看见他躺在病床上，突然流泪{CC眼}了，他的脸[C]那么苍白，他再也不结实的人{CQ了}{CJs}。,199412123523200053,韩国,2,199412,记我的父亲,65,85,36,42,61,279,未参加,
可是我不要它{CD了}，我以为在商店[B占]里还有更好的东西。[BC.],199412123523100100,韩国,1,199412,记我的父亲,50,60,36,38,37,201,未参加,
我14岁时开始跟朋友出去玩，可是他不让我和她们在一起。,199412124727200007,马达加斯加,2,199412,记我的父亲,55,65,46,38,30,216,未参加,
