错句,作文编码,国籍,性别,考试时间,作文题目,口试分数,作文分数,听力分数,阅读分数,综合分数,总分,证书
随此信附上结业证书。,199312533540100100,印度尼西亚,1,199312,一封求职信,90,90,71,78,87,414,A,
我曾经在文娱旅游公司担任兼职导游长达两年之久，相信本身的能力能够称职，所以冒昧应聘女导游，希望有机会为贵公司效劳。,199312533533200128,新加坡,2,199312,一封求职信,90,80,62,72,75,374,B,
7）具有上进心及勤奋好学。[BC.],199312533533200128,新加坡,2,199312,一封求职信,90,80,62,72,75,374,B,
×××敬一九九三年十二月五日,199312533533100141,新加坡,1,199312,一封求职信,90,70,55,69,85,362,C,
本人先致以万{CD二}分的谢意。,199312533533200155,新加坡,2,199312,一封求职信,90,85,81,80,92,425,A,
最后想说，[BC.]希望贵公司好[C]运[C][BQ、]繁[C]荣[C]、[BC，]发展。[BC，],199312104523100017,韩国,1,199312,一封求职信,60,50,62,34,39,225,未参加,
可以说现在我的特长一门外语{CJX}是中文。[BC.],199312123523200101,韩国,2,199312,一封求职信,75,55,60,59,45,279,未参加,
今年10月份[BD、]辞职。,199312123525200208,日本,2,199312,一封求职信,60,55,53,43,39,231,未参加,
我看见贵公司的招聘，想参加贵公司的工作。,199312123525200402,日本,2,199312,一封求职信,70,65,69,48,48,287,C,
××××93，12，20,199312123525100701,日本,1,199312,一封求职信,60,45,41,41,39,204,未参加,
我应该给他幸福的好好[C]{CJcd}生活。,199412123525100002,日本,1,199412,记我的父亲,50,70,25,28,35,191,未参加,
我衷心地祝他健康长[C]寿。,199412123523100062,韩国,1,199412,记我的父亲,60,85,52,53,61,300,未参加,
每个家庭的户主{CC家长}都是父亲。,199412123619200080,罗马尼亚,2,199412,记我的父亲,55,60,54,44,47,241,未参加,
{CP现在我发现许多家庭，虽然父亲还活着，可是对家庭影响不好。[BC.],199412123523100100,韩国,1,199412,记我的父亲,50,60,36,38,37,201,未参加,
跟父亲分开{CD了}差不多一年了。,199412123525200106,日本,2,199412,记我的父亲,50,50,46,57,51,232,未参加,
他不抽烟[F煙]，不喝酒，{CD但}偶尔{CC偶然}遇上高兴的事情，便喝几口啤酒，高兴高兴{CD吧}。,199412124634200009,英国,2,199412,记我的父亲,70,85,62,53,61,323,C,
那句话还刻在我心中。,199412124525200011,日本,2,199412,记我的父亲,85,80,46,36,63,303,未参加,
但是我和爸相聚{CC相[C]会}时间越短，他给{CC对}我的印象越深刻。,199412124636100025,乌克兰,1,199412,记我的父亲,60,60,39,34,49,224,未参加,
责任{CQ是}人{CC1人生}得活下去，要活下去得找生活手段——工作。,199412104525200694,日本,2,199412,记对我影响最大的一个人,65,60,78,75,72,333,C,
我在宣[B鲜]纸[C]上写{CQ了}几个字以后，爷爷把{CQ它}带到我家附近的图书馆{CQ的}老人厅给朋友们看看。,199412104523200103,韩国,2,199412,记对我影响最大的一个人,60,60,68,53,65,288,未参加,
高中毕业后，我越来越能看清{CC2看}这个广大世界了。,199412104525200660,日本,2,199412,记对我影响最大的一个人,70,60,54,61,65,295,未参加,
她还是一如既往{CC4如此}投入在工作中。,199500533533100005,新加坡,1,199500,记对我影响最大的一个人,90,75,70,75,80,384,B,
从孩提至今，我和外婆的关系是非常地{CC的}密切。[BC；],199500533533200002,新加坡,2,199500,记对我影响最大的一个人,85,80,73,63,72,366,B,
承他的遗言，我们无需将食物供拜了之后才吃，而是大家趁热一起吃，只需留一个位给他便成了。,199500533533200015,新加坡,2,199500,记对我影响最大的一个人,95,90,94,77,88,443,A,
打从我懂事以后，就知道他起早摸黑，日赶[F趕]夜赶[F趕]地{CC的}挣钱养家。,199500533533100025,新加坡,1,199500,记对我影响最大的一个人,80,90,78,71,90,404,B,
与不同的人在一起，会受{CC起}着不同影响。,199500533533100037,新加坡,1,199500,记对我影响最大的一个人,80,65,91,67,86,377,B,
我的理想可说是吴老师帮我确立的。,199500533533200035,新加坡,2,199500,记对我影响最大的一个人,85,75,73,73,90,388,B,
我为[F為]母亲[F親]的成功而自豪，暗暗立下决心，要以母亲[F親]为[F為]榜样。,199500533533200084,新加坡,2,199500,记对我影响最大的一个人,70,95,70,59,86,373,C,
}我俩的友谊能长存而我亦能在他的影响下成为企业界的一个有“[BC￢]实用价值”[BC﹂]的佼佼者。,199500533533200102,新加坡,2,199500,记对我影响最大的一个人,85,80,83,79,76,396,B,
从早到晚，我就跟在她身边，看着她打扫整个房子。,199500533533100125,新加坡,1,199500,记对我影响最大的一个人,95,85,60,57,76,371,C,
记得在求学时，临测验、考试前的晚上，她总是再三地替我们温课，甚至还出题目给我们做，必须确定我们都熟悉了考试{CC考测}内容才让上床。[BC，],199500533533200124,新加坡,2,199500,记对我影响最大的一个人,95,90,99,75,90,448,A,
是陈老师将{CJ-dy我}那封锁已久的思维打开了。,199500533533200145,新加坡,2,199500,记对我影响最大的一个人,90,85,65,63,84,384,C,
父亲魁[B槐]梧的身躯，布满五线谱的面庞[C]，加上一脸的络缌胡子，给{CC让}人第一眼的印象是严肃，好像[B象]很不易[C]相处。,199510512501100504,中国,1,199510,记对我影响最大的一个人,90,90,81,79,73,411,A,
毕业后我想出国留[C]学，恳请大舅父支持。,199510512501100510,中国,1,199510,记对我影响最大的一个人,90,90,55,68,86,387,C,
在我的一生中，父[F親]对我影响最大。,199510512501200513,中国,2,199510,记对我影响最大的一个人,95,80,83,70,79,403,B,
比如在床上贴个“床”字，在灶上贴个“灶”字，在冰箱上贴个“冰箱”的条子，藉此使我们多认识汉字。,199510512512200520,菲律宾,2,199510,记对我影响最大的一个人,90,90,74,73,91,416,B,
这个对社[C]会有好处[B外]。,199510550523100908,韩国,1,199510,如何看待“安乐死”,75,65,40,44,35,246,未参加,
我们应该把[C]“安乐死”的印象改好才对{CJba}。,199510550523200912,韩国,2,199510,如何看待“安乐死”,80,75,67,37,61,311,未参加,
如果病人杀[F殺]的话[C][BQ，]{CJbei}这{CD也是}怎么审[C]查[BQ？],199510550523100917,韩国,1,199510,如何看待“安乐死”,65,55,62,48,53,265,未参加,
难道爱是{CQ有}罪的吗？,199510550523100930,韩国,1,199510,如何看待“安乐死”,60,70,24,33,35,207,未参加,
{CP所以{CD已}“安乐死”风波{CD的}一事{CC事情}，即使其妻子怎样[F樣]要求，从{CC在}人道立场[F場]来[F來]看，这是违[C]反了的，甚[B什]至[B致]是一种[F種]不[C]可宽恕[C]的行为[C]。P},199511543501200527,中国,2,199511,如何看待“安乐死”,70,80,36,50,55,281,未参加,
作为[F為]丈夫的，怎么{CC怎样}{{CJ-zy会}舍得自己的妻子。,199511543501100561,中国,1,199511,如何看待“安乐死”,90,85,64,52,79,367,C,
学习汉语的人{CC1人们}{CJ+sy有}不少，对外国人来说，是比较困难{CJsd}。,199505529529100105,泰国,1,199505,学习汉语的苦与乐,0,70,50,39,48,202,未参加,
一看到“汉语”这两个字就使我自然地产生一种贴心感。,199505529529200108,泰国,2,199505,学习汉语的苦与乐,75,85,45,56,77,331,未参加,
你现[C]在不去留学[BQ，]你学的两年汉语{CJ-sy用}到哪[C]里去呢？,199505104525200031,日本,2,199505,记对我影响最大的一个人,75,65,68,61,67,323,C,
在{CC这}初中时期[C]，我的老师绝[C]对不让我上军官学校，而且他让我扩[C]大我的眼界{CC眼睛}[BQ，]走向{CC2走}大世界，后来我发[F發]现{CD了}他是个知识分子一类的人{CC4类似}。,199505104523100051,韩国,1,199505,记对我影响最大的一个人,70,60,54,55,37,261,未参加,
有一天，她的母亲和弟弟从美国路过日本要回中国。,199505104525200088,日本,2,199505,记对我影响最大的一个人,80,80,83,67,74,376,B,
通过一些{CC有些}规模{CJX}大的治水灌溉工程，他拯救了许多人民的困[B因]难{CJZR}，也可以说实践了他所主张的“慈悲思想”。[BC.],199505104525100195,日本,1,199505,记对我影响最大的一个人,65,65,68,71,67,320,C,
其实事情不是那么容易[C]的{CJsd}。[BC，],199505104523200206,韩国,2,199505,记对我影响最大的一个人,50,60,57,67,53,267,未参加,
”于是，从母亲那儿我学到见了长辈要打招呼，因为广东话有云：“入屋要叫人，入庙拜神。,199505104533100221,新加坡,1,199505,记对我影响最大的一个人,95,95,75,79,96,439,A,
我在幼儿[C]园的时候她搬过来的。,199505104525200242,日本,2,199505,记对我影响最大的一个人,60,75,44,48,49,262,未参加,
对我影响最大的一个人应该说是我妈妈。,199505104614100255,荷兰,1,199505,记对我影响最大的一个人,65,80,52,46,69,300,未参加,
婆婆是个饱经沧桑的女人，她经历了从中国迁徒到南洋的漂泊，饱尝[F嘗]第二次世界大战的折磨{CC抱磨}，又因公公早逝，在贫困生活中一手把七个孩子扶养长大。[BC.],199508680519200518,马来西亚,2,199508,记对我影响最大的一个人,90,85,97,79,88,436,A,
虽然我家的家境{CC处境}并不是十分富裕，但母亲宁愿自己辛劳，也不愿我为了家庭而辍学，反而鼓励我努力求学，为弟妹竖立一个好榜样。,199508680519200536,马来西亚,2,199508,记对我影响最大的一个人,85,90,89,73,76,409,A,
当我们接受他人的一切时，在你面前，你会发现[F現]有更多广阔{CC阔廣}的道路迎面而来，而你的智慧就愈变{CQ愈}丰硕[F碩]。,199508681519200541,马来西亚,2,199508,记对我影响最大的一个人,95,85,78,77,80,413,B,
我常跟子女们说[F說]我要带他们再到黄山去。,200010543501250008,中国,2,200010,我第一次……,70,75,67,51,76,328,C,
然而现今的社会，很多女性也要求经[F經]消独[F獨]立。,200010602801250002,澳大利亚,2,200010,我对离婚问题的看法,80,75,75,83,85,389,B,
现代社会的发展很快，生活节奏[B凑]也很快，特别[BD，]在城市里，人们整天[L]忙碌地走来走去。,200005108523100296,韩国,1,200005,关于用自然之声取代噪声的建议,70,70,70,50,76,324,C,
我觉得现在人的生活太紧张，压力太多，大家都着急地做事情。,200005108525200294,日本,2,200005,关于用自然之声取代噪声的建议,70,70,59,50,52,289,C,
如果要把自然之声多起来的话{CJba}，应该把真正的自然环境变好。,200005108525200315,日本,2,200005,关于用自然之声取代噪声的建议,65,70,48,70,74,313,C,
举电话{CQ的}例子来说，电话本身给我们带来极大的{CC地}方便，但是它也给我们带来{CC有些}麻烦，你想一想，有一个朋友给你打电话，但是你正忙{CD在}于学习{CD上}，突然，电话刺耳地响了响，那么，不但不愿意接电话，而且感到{CJ+zy令人}反感，反过来说，如电话的响声以鸟声或其他动物的声音取代的话呢，电话不但给我带来方便，而且让人舒服。,200005108523100695,韩国,1,200005,关于用自然之声取代噪声的建议,70,60,70,60,82,327,C,
比如说：我家有奶奶，今年96岁，她身体不好，每次来电话响声给{CC让}她带来了很多的害处，睡觉时突然响的电话铃声把她叫起来，很长时间不能睡而且心跳得{CC的}很快，让家里人很担心她。,200005108523200700,韩国,2,200005,关于用自然之声取代噪声的建议,70,65,64,57,63,305,C,
周日，真的休息，为了休息而休息，多没劲。,199705104525100005,日本,1,199705,我的城市/乡村生活,60,80,71,67,80,345,C,
可是农村里的孩子们不是这样。,199705104523200011,韩国,2,199705,我的城市/乡村生活,70,65,55,63,63,302,C,
现代社会里我认[F認]为最重要的因素是速度。,199705104519100022,马来西亚,1,199705,我的城市/乡村生活,90,55,71,79,84,368,C,
我的老家前面有一条小河，后面有一座小山，可以说是一间“背山临水”的家。,199705104523100071,韩国,1,199705,我的城市/乡村生活,60,60,66,79,70,317,未参加,
我小时候的有一天，我跟平时一样在水田摘野草，野花。,199705104525100089,日本,1,199705,我的城市/乡村生活,65,65,46,45,49,254,未参加,
我刚到那个班级时班级里也没有韩国人，所以我的语言一点也不通，我心理很烦躁[B噪]。,199705104525100095,日本,1,199705,我的城市/乡村生活,60,60,55,60,80,297,未参加,
所以很多乡村里的年轻人希望在城市里工作，因此发生城市人口集中的现象[B像]。,199705104523200196,韩国,2,199705,我的城市/乡村生活,75,80,66,58,75,345,C,
确实[B是]如此[BQ。]我在合肥生活了三年多了，这三年里给我的印象很不错。,199705104523200535,韩国,2,199705,我的城市/乡村生活,65,75,66,67,54,314,C,
对我来说学汉语是一种快乐。,199804123523200149,韩国,2,199804,学习汉语的苦与乐,75,75,66,52,40,298,未参加,
用很长时间读完了中国短篇小说，了解{CQ了}一点中国人民的生活和文化，交中国朋友的时候[L]也有{CJX}比以前自信{CC2自信感}{CQ了}。,199804123523100177,韩国,1,199804,学习汉语的苦与乐,60,50,48,52,31,221,未参加,
经常读书的时候，我想别的事情。,199804123523100196,韩国,1,199804,学习汉语的苦与乐,60,55,27,40,44,207,未参加,
您想一想，当时我的心情如何！,199804123523100226,韩国,1,199804,学习汉语的苦与乐,70,75,88,84,76,382,B,
有的中国人对懂汉语的外国人非常亲切，[BC。]我也能快乐地交流{CJX}{CQ跟}中国人。,199804123525200255,日本,2,199804,学习汉语的苦与乐,85,80,63,81,80,382,B,
最近我改变了注意，在中国学汉语的目的就是通过学习汉语了解中国的文化，所以我每天把五十个词语记下来{CJba}，又{CC而}重新学汉语的基本语法。,199804124523200328,韩国,2,199804,学习汉语的苦与乐,70,60,39,52,31,237,未参加,
我现在敢说如果我以前没有那样的经历{CC经验}现在的我{CJX}也没了。,199904123523200004,韩国,2,199904,如何面对挫折,65,70,31,50,46,248,未参加,
回头想，{CJ+sy学}汉语是真值得学{CJsd}，让我得到信心。,199904123523200005,韩国,2,199904,如何面对挫折,70,65,37,60,46,264,未参加,
我觉得人的毅力很重要。,199904123639100201,阿塞拜疆,1,199904,如何面对挫折,75,70,26,24,52,236,未参加,
在{CC1还过}我上高中的时候突然{CJX}这两句话出现{CC雕刻}在心里{CC2心地上}，因为那时候[BD，]对我来说，可以算“黯期”[BQ，]经常跟朋友们有矛盾。{CD一},199904123523200213,韩国,2,199904,如何面对挫折,65,65,42,52,54,262,未参加,
社会发展到了今天，每个人都经历过{CC3经过}很多事情。,199904124523200375,韩国,2,199904,如何面对挫折,75,70,37,55,46,272,未参加,
例如我妈妈得了重病的时候[BQ，]我一定不会让她发现我着[B差]急的样子。,199904124608200464,波兰,2,199904,如何面对挫折,65,70,34,37,48,240,未参加,
{CQ通过}一次失败[F敗]，可以总结教训，{CQ通过}一次挫折，可以汲取一次经验，以不怕{CC最}困难，穷于进取的拼博精神去开拓新的未来。,199909529529151001,泰国,1,199909,如何面对挫折,75,90,60,52,95,366,C,
工作时，和别人相处，工作本身的问题，也是挫折。,199909529529251014,泰国,2,199909,如何面对挫折,65,85,51,54,66,311,C,
