错句,作文编码,国籍,性别,考试时间,作文题目,口试分数,作文分数,听力分数,阅读分数,综合分数,总分,证书
快乐家庭旅游公司李文先生：应聘书我在××杂志上看到贵公司的招聘启事。,199312533525200043,日本,2,199312,一封求职信,80,90,76,81,89,411,B,
希望您能考虑我的申请。,199312533533100059,新加坡,1,199312,一封求职信,90,80,76,74,80,395,B,
本人一向对小孩特别喜爱，小孩同团相偕而游，必定找上我这个大姐姐。,199312533533200087,新加坡,2,199312,一封求职信,85,90,62,76,78,388,B,
快乐家庭旅游公司李文先生：本人看到贵{CC本}公司招聘[C]启[F啟]事，非常高兴。,199312533540200106,印度尼西亚,2,199312,一封求职信,65,60,34,45,62,249,未参加,
快乐家庭[C]旅[C]游公司贵[C]公司：在报纸[C]上我读过你们的广告。,199312123914100212,古巴,1,199312,一封求职信,55,50,18,32,39,173,未参加,
现在我跟丈夫两个人一起生活，还没有孩子。,199312123525200404,日本,2,199312,一封求职信,50,50,29,47,34,187,未参加,
请您好好考虑让{CC给}我听好的结果吧。,199312123525100507,日本,1,199312,一封求职信,60,50,39,58,41,228,未参加,
我上过大学三年[C]多[C]了[BQ，]而且我的成绩不错。[BC；],199312123747100803,坦桑尼亚,1,199312,一封求职信,46,60,32,30,34,180,未参加,
如果贵公司让我{CJ-sy做}导游的话[BQ，]一定{CJX}{CQ对}公司有很多好处。,199312123525200921,日本,2,199312,一封求职信,60,60,32,54,43,231,未参加,
如今{CC当今}我更了解我父亲，随着一家人的鼓励他现在会表现{CC表示}他的感情。,199412123922100009,美国,1,199412,记我的父亲,55,65,44,32,47,225,未参加,
我一想{CJ-buy起}我父亲就{CJX}心里感到疼的感觉{CJy}。,199412123523200025,韩国,2,199412,记我的父亲,55,50,54,46,53,237,未参加,
我们[C]很尊重我的父亲。,199412123525200039,日本,2,199412,记我的父亲,55,80,60,48,51,280,未参加,
我父亲已经近60岁了。,199412123529200068,泰国,2,199412,记我的父亲,70,65,33,34,39,227,未参加,
姐姐是老大，[BC.]虽然她有工作，但是还没找对象时，父亲很担心。,199412124523200018,韩国,2,199412,记我的父亲,60,75,54,40,78,293,未参加,
她们打得非常潇洒，但她们向更高的目标{CC地方}不停地前进。,199412104525200668,日本,2,199412,记对我影响最大的一个人,55,65,78,69,76,325,C,
当时老师就跟我说：“我今天回家考虑{CJcd}，你也回家考虑一下吧。,199412104525200689,日本,2,199412,记对我影响最大的一个人,75,80,81,65,65,357,B,
”我非常爱他，所以不愿意离开他。,199412104523200678,韩国,2,199412,记对我影响最大的一个人,55,60,68,46,49,259,未参加,
”我一定努力学习[BQ，]以后{CC后来}一定给爸爸幸福。,199412104523200678,韩国,2,199412,记对我影响最大的一个人,55,60,68,46,49,259,未参加,
但由于我家境不富裕，工作的收入又不多，我是没法入大学[F學]的。,199412104625200370,葡萄牙,2,199412,记对我影响最大的一个人,75,85,94,77,82,406,B,
书写[F寫]汉字，定会享受这分乐趣。,199409543634100222,英国,1,199409,学习汉语的苦与乐,50,60,48,62,70,269,未参加,
这一个事实，我实在不接受。,199500533533200021,新加坡,2,199500,记对我影响最大的一个人,95,90,62,63,67,376,C,
他说“不入虎穴，焉[C]得虎子[B了]”，况且我们还年轻，“塞翁失马，焉[C]知非福”，{WWJ},199500533533200027,新加坡,2,199500,记对我影响最大的一个人,80,85,78,59,86,382,B,
在处理感情的问题{CC事项}上，于先生谨慎、大度及顾及他人心理的心态使我认识到能够冷[F靜]、明智地{CC的}谈情说爱亦是一种微妙的感觉。,199500533533200102,新加坡,2,199500,记对我影响最大的一个人,85,80,83,79,76,396,B,
它又一幕幕地{CC的}在我眼前飘过。,199500533540200114,印度尼西亚,2,199500,记对我影响最大的一个人,55,60,46,46,63,251,未参加,
虽[F雖]然后[F後]来[F來]他转[F轉]行从[F從]政，他仍然抱着教导[F導]学[C]子的态[F態]度来[F來]领[F領]导[F導]他的属[F屬]下，[BC。]使我增加了不少的知识[F識]和经验[F驗]。,199500533533200133,新加坡,2,199500,记对我影响最大的一个人,95,70,68,59,72,358,C,
父亲过去经历比较曲[C]折坎坷，他九岁就成为孤儿，又加上当时[F時]的社会环境，尽管天生聪明的他出生{CQ于}一个书香门第，但因家穷[F窮]，无法上[C]学。[BC，],199510512501100504,中国,1,199510,记对我影响最大的一个人,90,90,81,79,73,411,A,
对我影响最大的人有好几[F幾]位，家中的父母、兄姐都是。[BC，],199510512501200508,中国,2,199510,记对我影响最大的一个人,90,95,48,48,61,340,未参加,
”[BC」]爷[F爺]爷[F爺]的那慈祥的声[F聲]音，使我不论[F論]多忙也要放在一边{CD地}去见[F見]他。,199510512634200530,英国,2,199510,记对我影响最大的一个人,90,90,67,58,61,364,C,
{CP因为[C]先进[F進]国[C]家注重人权[F權]，有好的法律结[C]构[F構]，更能执[F執]行，并[F並]且一视[F視]同仁[B行]。[BC，],199511543501200527,中国,2,199511,如何看待“安乐死”,70,80,36,50,55,281,未参加,
医学界人士认为人的心脏[F臟]一天未[C]停止{CC停顿[F頓]}{CJ-by跳动}，{CQ就}还算是生存。,199511543501200533,中国,2,199511,如何看待“安乐死”,95,90,83,83,99,449,A,
其实[F實]“安乐死”亦不失为[F為]一{CQ种}解决病人和其家人之痛苦的{CC之}最后[F後]手段。,199511543634200548,英国,2,199511,如何看待“安乐死”,85,90,74,79,99,423,A,
而且受折磨者亦非只患者本人，更还[F還]有其家属朋友！{CP试[F試]想，眼看亲[F親]人受尽[F盡]折磨，且明知其康复[F復]无[F無]望，只是苟延残喘{CC久延残[F殘]喘},199511543634200548,英国,2,199511,如何看待“安乐死”,85,90,74,79,99,423,A,
人心肉做，他们如何面对病人日日夜[C]夜[C]要求死亡{CJ-zxy的现实}？,199511543634200562,英国,2,199511,如何看待“安乐死”,80,90,76,81,95,417,B,
今年二十四岁。,199503680519100537,马来西亚,1,199503,一封求职信,75,75,69,62,68,339,C,
不过我爱[F愛]我父亲的平凡，朴实[F實]、有爱[F愛]的行动。[BC.],199505550523100905,韩国,1,199505,记对我影响最大的一个人,70,65,89,59,69,338,C,
小时候，父亲[C]总是规定我每天学习一定数量的汉字，[BC。]而母亲总是教我背诵一些短小易懂的古诗词。,199505529529100015,泰国,1,199505,学习汉语的苦与乐,90,95,88,87,99,457,A,
我爸虽说是地位不太高，但是，他{CD真}是个清白的公务员。,199505104523100004,韩国,1,199505,记对我影响最大的一个人,80,80,60,48,61,321,C,
因为他不分昼夜[C]都要开车，特别[C]辛苦，[BC。]并且身[C]体也不太好。,199505104523200002,韩国,2,199505,记对我影响最大的一个人,80,85,65,67,57,348,B,
不过对现在年轻人的梦来说，很有道理。,199505104523100064,韩国,1,199505,记对我影响最大的一个人,55,60,68,69,51,284,未参加,
从那时候起[L]我开始[C]睁{CJ+buy开}大眼睛。,199505104523100074,韩国,1,199505,记对我影响最大的一个人,65,70,73,67,67,328,C,
但是，在这样不讲礼[C]貌，不讲人情[C]的人当中，只有一个人讲礼貌、讲人情[C]－－{CJ-zhuy这个人}就[C]是我的父亲[F親]。,199505104523200122,韩国,2,199505,记对我影响最大的一个人,70,75,68,61,55,318,C,
如果她对我{CJX}没提一个意见，也许我一辈[F輩]子不会说汉语，也不能够了解{CC理解}我{CQ的}祖国了。,199505104501200135,中国,2,199505,记对我影响最大的一个人,65,70,46,61,65,293,C,
原来我是国际营[C]业系的学生，[BC、]有点知识，[BC、]可没有经验[F驗]。,199505104525100168,日本,1,199505,记对我影响最大的一个人,70,65,44,48,53,266,未参加,
幸亏他的帮助，我的留学终于实现了。,199505104525200166,日本,2,199505,记对我影响最大的一个人,70,85,60,71,67,345,C,
到商[C]店去买饼干，然[C]后[BQ，]回家时，我才知道我做{CC作}{CQ了}坏[C]人的行为，可是已经来不及了。,199505104523100177,韩国,1,199505,记对我影响最大的一个人,65,65,52,48,47,261,未参加,
她一般给我们[C]讲{CC听}有趣的故事来说明{CJ－by道理}。,199505104525200235,日本,2,199505,记对我影响最大的一个人,65,65,68,59,47,288,C,
他带我去某个地方的时候，还准备一个故事，给我讲完故事后，又把那个{CJ-dy故事的}意思解释{CJ-buy给我听}{CJba}。[BC，],199505104523100257,韩国,1,199505,记对我影响最大的一个人,70,55,62,46,47,264,未参加,
这[C]是一件{CC个}{CJX}好几年前的[C]事情，但至今仍深深地刻在我的[C]心里。,199505104540100263,印度尼西亚,1,199505,记对我影响最大的一个人,55,40,83,53,65,272,未参加,
喜欢{CQ到}什么程度呢？,199505104525200270,日本,2,199505,记对我影响最大的一个人,70,60,65,53,57,290,未参加,
虽说[C]我[C]的外貌[C]和妈妈的很像，但是我[C]们的[C]性格完全相反。,199505104525200287,日本,2,199505,记对我影响最大的一个人,60,65,41,75,69,293,未参加,
我基本上同意这个建议。,200005108525200303,日本,2,200005,关于用自然之声取代噪声的建议,65,75,75,80,82,364,B,
只有把这些问题解决掉，我们才能营造{CC赢得}这种没有噪音的社会。,200005108525100318,日本,1,200005,关于用自然之声取代噪声的建议,70,70,64,80,89,361,C,
而是有时妨碍{CC加害}人之间的交流。,200005108523200342,韩国,2,200005,关于用自然之声取代噪声的建议,70,70,61,70,54,313,C,
不然的话，难免遭遇{CC遭到}交通事故。,200005108523100634,韩国,1,200005,关于用自然之声取代噪声的建议,65,65,45,70,56,285,未参加,
譬如说[F説]：争吵；看不起对方；难[F難]于[F於]体[F體]谅[F諒]对方，或是利用对方的情况出现[F現]。,199711802625200003,葡萄牙,2,199711,我选择朋友的标准,85,80,46,72,89,365,C,
因为在城市生活的人们比较喜欢个人的生活。,199705104523100019,韩国,1,199705,我的城市/乡村生活,65,70,66,60,46,293,C,
我追求日新月异的变化。,199705104525200023,日本,2,199705,我的城市/乡村生活,75,60,58,54,54,287,C,
我母亲{CD对我}很生气。,199705104523100076,韩国,1,199705,我的城市/乡村生活,70,45,44,42,56,238,未参加,
我记得农村的那片安静的气氛始终使我更无聊，甚至让我狐独，而在都市里生活我不感到{CD这种}寂寞。,199705104523200078,韩国,2,199705,我的城市/乡村生活,70,75,77,63,87,361,C,
可以说在自己周围的自然条件是丰富多彩的。,199705104523200130,韩国,2,199705,我的城市/乡村生活,70,65,71,56,61,309,C,
我有三个哥哥八个姐姐，加上我一共十二{CC一二}个孩子，所以相对地说，[BC、]我就是家里的最可爱{CQ得孩子}之一。,199705104523100136,韩国,1,199705,我的城市/乡村生活,75,75,55,54,84,333,C,
在上班的时候几乎每个道路变成停车场[BQ。]至于城市的环境问题，汉城的环境日益恶化，已达到令人担心的水平，比如空气[C]污染和河水污染非常严重，在这种日趋恶劣的情况下，[BC。]人情味逐渐消失，到目前为止，在汉城已经感觉不了世代相传的传统友谊。,199705104523100180,韩国,1,199705,我的城市/乡村生活,65,65,60,49,68,291,C,
在这一带的居民，有的人另买[F買]房子，作爲周[F週]末住家。,199705529529251008,泰国,2,199705,我的城市/乡村生活,70,65,39,18,43,221,未参加,
我看到在我公司的另外一个经理就没有此看法了。,199810602801150007,澳大利亚,1,199810,如何面对挫折,65,75,81,84,91,383,B,
现在想苦的地方也可以说乐的地方{CJs}。,199804123523200051,韩国,2,199804,学习汉语的苦与乐,70,55,39,47,48,243,未参加,
带着好奇心学下汉字来真是让人兴奋不已{CC莫名其妙}。,199804123523200085,韩国,2,199804,学习汉语的苦与乐,60,65,48,49,56,261,未参加,
因为司机把我拉到首都剧场了。,199804123523100162,韩国,1,199804,学习汉语的苦与乐,70,70,57,45,54,284,未参加,
学习汉语，虽然有一定的苦{CC1苦读}，但是一想到那天告别{CC告辞}的场面和周围人的坚持，什么{WWJ},199804123529200267,泰国,2,199804,学习汉语的苦与乐,65,55,54,62,46,264,未参加,
一般{CJ-zxy人}的心里什么都不想做，或者干脆放弃了，但这样以后没什么前途的。,199904123525100031,日本,1,199904,如何面对挫折,60,55,31,52,39,218,未参加,
我还小{CC少}的时候住在农村，那个村里的邻居们比较穷，可是我们之间{CD的}互相理解、[BC，]互相帮助{CD的}[BQ，]关系非常好，可能富裕[B余]的城镇居民不是这样。,199904123523100114,韩国,1,199904,如何面对挫折,50,65,48,57,56,257,未参加,
我有个朋友他以前在工厂工作，[BC。]那时朋友很丧气{CC生气}，但后来他开始做买卖，开始的时候虽然遇到了很多困难，但终于学会了怎么做买卖，他现在很有钱，有自己的商店，他之[B只]所以这样成功，因为毅力很强{CJs}，可以面对挫折。,199904123639100201,阿塞拜疆,1,199904,如何面对挫折,75,70,26,24,52,236,未参加,
如果同学们帮助不了我，我才向我的老师提我的问题。,199904123818100228,瓦努阿图,1,199904,如何面对挫折,65,75,48,37,32,244,未参加,
我考上了一所大学，可几乎每天都要加班。,199904124525200308,日本,2,199904,如何面对挫折,75,80,78,88,85,397,B,
这样的性格就表现在[B出]面对困难和挫折的方面。,199904124523200334,韩国,2,199904,如何面对挫折,70,65,59,60,56,296,C,
但每个人的看法是不同的。,199909684542100044,越南,1,199909,如何面对挫折,65,50,33,20,26,175,未参加,
