错句,作文编码,国籍,性别,考试时间,作文题目,口试分数,作文分数,听力分数,阅读分数,综合分数,总分,证书
从此妈是严父慈母了。[BC；],200110540540250027,印度尼西亚,2,200110,我的童年,75,90,63,58,61,341,C,
晚上外公还常租三轮车，我们就坐在三轮车上，一边迎风纳凉，一边听外公讲些生活上的趣事[BD、]或故事。,200110540501250129,中国,2,200110,我的童年,80,90,68,49,92,374,C,
也是慈父的教诲，使我的童年在美好的记忆中度[B渡]过。,200110540540150141,印度尼西亚,1,200110,我的童年,60,95,41,39,85,310,未参加,
当时由[B尤]于住在自家的园地里，因此从小就非常好动。,200103680519101601,马来西亚,1,200103,我的童年,75,80,61,72,85,364,B,
小时候，当我的母亲给我戴上一个奇怪的东西时，我很好奇地{CC的}顺从我母亲让她为我佩戴。,200103680519201605,马来西亚,2,200103,我的童年,85,85,15,80,85,345,未参加,
每当看到它，我仿佛回到童年时代。,200103680519201610,马来西亚,2,200103,我的童年,75,90,70,78,98,405,B,
4.15×,200104124501200069,中国,2,200104,一封写给父母的信,90,75,55,49,72,335,未参加,
其他的没有什么可提的，都是老样子[B了]。,200104124619100227,罗马尼亚,1,200104,一封写给父母的信,70,75,68,58,72,332,C,
我明白了一个道理，{CP为了将来过好日子，才能作为一个真正的人。P},200104124520200319,蒙古国,2,200104,一封写给父母的信,70,65,47,49,85,302,未参加,
所以我必须好好地复习一些课目。,200104124520200378,蒙古国,2,200104,一封写给父母的信,70,85,58,49,54,308,C,
在中国，我最想念的就是你们。,200105550523250005,韩国,2,200105,一封写给父母的信,70,70,38,42,54,262,未参加,
我们离别已经七个月了。,200105550523250023,韩国,2,200105,一封写给父母的信,65,70,58,65,76,320,C,
我已经长大了，还有找到了好工作，快要到了{CJX}幸福的一天，为了这一天，你们保重身体。,200105550523150054,韩国,1,200105,一封写给父母的信,70,65,58,58,49,286,C,
我好久没回家了。,200105550523150056,韩国,1,200105,一封写给父母的信,70,65,58,54,74,307,C,
所以您们不用担心我和姐姐了。,200105550523250057,韩国,2,200105,一封写给父母的信,70,70,79,68,70,345,C,
陆战队的纪[B记]律使我比以[B已]前强得多了。,200105550523150334,韩国,1,200105,一封写给父母的信,75,75,63,75,81,359,B,
近来生活过得怎么样？,200105550523250529,韩国,2,200105,一封写给父母的信,65,65,55,61,63,293,C,
我绝对不辜[L]负父母对我的厚望。,200105550523250529,韩国,2,200105,一封写给父母的信,65,65,55,61,63,293,C,
那时候正好{CC偶然}去襄樊的长途汽车快要出发了，[BC。]我马上买票{CJX}就上车了。,200105212525100015,日本,1,200105,我的一个假期,75,70,75,75,74,358,B,
以后我跟他们不能在一起{CQ了}，我应该珍惜这种机会。,200105224525200016,日本,2,200105,我的一个假期,70,70,77,61,63,329,C,
比如说，要找睡觉的地方，晚上有很多蚊子等等。,200105209525100059,日本,1,200105,我的一个假期,70,70,67,65,66,326,C,
这样一来谁都不想去。,200105109525100697,日本,1,200105,由“三个和尚没水喝”想到的……,70,55,61,60,75,305,C,
”他们一听到他说的女人的样子{CC形容}，[BC、]就想看她了。,200105109525200704,日本,2,200105,由“三个和尚没水喝”想到的……,75,65,73,53,86,339,C,
每一次{CJ-zy都}没有人想做[B作]。{CP我那时候有这样的想法：[BC；]如果我做[B作]我吃苦，可是我哥哥们不{CQ需},200105109616100722,德国,1,200105,由“三个和尚没水喝”想到的……,70,65,48,44,50,263,未参加,
但是，没过多久，山下的人也过{CJX}不来了。,200105109525100735,日本,1,200105,由“三个和尚没水喝”想到的……,75,55,63,75,73,326,C,
我们本来约好星期二大家在一起把系里交给的任务干好。,200105109542200734,越南,2,200105,由“三个和尚没水喝”想到的……,70,75,54,44,77,309,未参加,
若一个和尚自己挑水喝，两个和尚抬水喝，那三个和尚聚集起来的话，能抬起比两个人时更多的水{CD喝}。,200105109525100751,日本,1,200105,由“三个和尚没水喝”想到的……,65,60,50,62,82,302,未参加,
他对两个和尚说：“[BC[]我们这样下去的话有可能会干死的。,200105109525100757,日本,1,200105,由“三个和尚没水喝”想到的……,65,55,57,58,55,272,未参加,
一个人不能做的事情如果{CC也}大家一起办的话，就容易解决。,200105109525200814,日本,2,200105,由“三个和尚没水喝”想到的……,65,65,43,69,64,290,未参加,
中国总人口将会（已经？,200105109525200834,日本,2,200105,由“三个和尚没水喝”想到的……,65,50,66,58,55,275,未参加,
同学的电话才知道的{CJsd}。,200105109525200846,日本,2,200105,由“三个和尚没水喝”想到的……,60,55,21,40,41,198,未参加,
到了考试那一天，[BC。]我考试准备得好（不是自己做{CJsd}）我同学说可以看书，所以我很放心了。,200105109525200846,日本,2,200105,由“三个和尚没水喝”想到的……,60,55,21,40,41,198,未参加,
现[F現]在我们[F們]身为{CC生为}学生，住在宿舍里，老师[F師]好比我们的父母，常常教我们做人的道理，也常常跟我们讲[F講]关[F關]于[F於]“三个和尚没水喝”的故事。,200102522522250013,缅甸,2,200102,由“三个和尚没水喝”想到的……,80,80,48,39,50,289,未参加,
我妈妈兄弟姐妹又多，家里的经济又不好，又是老大，外婆生一个孩子她就要休一次学，因此她就毕不了业。,200203522522250024,缅甸,2,200203,记对我影响最大的一个人,85,85,69,73,68,375,B,
我完全同意采取{CC2取}安乐死。,200205204525200036,日本,2,200205,如何看待“安乐死”,65,65,52,56,54,276,未参加,
有一天弟弟发现[BD、]自己得了不治之症，哥哥从外边回来{CQ的}时候{WWJ},200205212525100004,日本,1,200205,如何看待“安乐死”,65,65,49,65,56,284,C,
“安乐死”也是一个道德问题。,200205209525100060,日本,1,200205,如何看待“安乐死”,65,65,46,58,58,276,未参加,
不然的话，现在{CD也}很多病人和伤人从早到晚痛苦，真可怜。,200205201525100144,日本,1,200205,如何看待“安乐死”,80,75,35,33,44,258,未参加,
我们要敬爱，做一个好榜样[F樣]给他们看，久而久之孩子会从旁看到，很自然的，他们就会成为[F爲]一个好的孩子，那么将[F將]来他们当然会是一位好的青[C]年了。,200210529529251019,泰国,2,200210,如何解决“代沟”问题,70,65,42,60,0,223,未参加,
也应该试着放下长辈的身份和晚辈谈心做朋友，[BC。]去了解他们的想法。,200210540615250010,捷克,2,200210,如何解决“代沟”问题,85,85,53,71,84,373,C,
上述{CJ-zhuy情况}{CD所}{CD造成}的原因，就是“代沟”{CD所}{CJ+sy造成的}。[BC，],200210540540150059,印度尼西亚,1,200210,如何解决“代沟”问题,85,65,59,58,84,340,C,
希望老一辈人“好自[B之]为之”，谨慎为要。,200210540540250062,印度尼西亚,2,200210,如何解决“代沟”问题,70,70,70,60,73,331,C,
我的父亲管教方式并不严厉，每当我做错一件事，他只会很耐心地指出我的错和应该怎样{CC什样}才对。,200205109919200622,加拿大,2,200205,如何面对挫折,85,85,76,67,77,385,B,
在中国学习期间，我遇到了很多困难。,200205109610101141,法国,1,200205,如何面对挫折,75,70,53,65,62,314,C,
绿草如茵，栽花莳木，再加上许许多多的男女老少{CC年幼老少}散步，构成了一幅美丽的图画。,200205680519250016,马来西亚,2,200205,一封写给父母的信,75,75,54,59,72,325,C,
××,200205680519150023,马来西亚,1,200205,一封写给父母的信,90,80,70,75,88,398,B,
在过去的中国，人们{CC2人}认为婚姻的质量低、[BC，]稳[B隐]定{CD高}比较重要。,200206570616250002,德国,2,200206,我对离婚问题的看法,80,65,60,55,51,299,C,
特别是描写祖母的段落，中国正处于清朝末期，[BC、]由于儒教思想的影响[F響]，女人出嫁前必须[B需]尊父，出嫁后[F後]{CJ-sy有}从夫，从子的习惯{CC惯[F慣]习}。,200305533525250038,日本,2,200305,我最喜欢读的一本书,65,65,68,75,65,322,C,
我是一个爱看书的人，尤其爱看侦探小说。,200305533533250036,新加坡,2,200305,我最喜欢读的一本书,80,65,85,80,90,388,B,
我最喜欢读的一本书是《菊与刀》。,200305533533250042,新加坡,2,200305,我最喜欢读的一本书,70,65,77,65,83,346,C,
说到[B道]我最喜欢的一本书，我只记得书名为[BQ《]追忆[BQ》]，作者是谁呢？,200305533533250044,新加坡,2,200305,我最喜欢读的一本书,65,70,71,56,56,304,C,
犹记得在念中学时，从电视上看到这部电视剧，我就被它的精彩剧情和演员们精湛的演技所深深地吸引，也因此促使我去买了这本书来读。,200305533533250046,新加坡,2,200305,我最喜欢读的一本书,70,70,38,70,88,324,未参加,
为了了解他们的情况，我决定学汉语。,200304131525100014,日本,1,200304,我学汉语是为了……,60,60,44,24,40,210,未参加,
另外，虽然上述说的是最大的目的，但是我来到中国以后发现，如果我会说汉语，我就可以跟近十三亿中国人交流。,200304131525200147,日本,2,200304,我学汉语是为了……,65,75,47,74,60,308,C,
因为我看这个“静音环境”就是说“无声”的问题是跟“没有任何的污染”等于“无菌状态”，跟这个状态比较相似。,200305576525200039,日本,2,200305,静音环境对人体的危害,65,60,36,30,46,220,未参加,
所以我认为人有五感才能正常生活，脑子不{CC没有}混乱。,200305576525100055,日本,1,200305,静音环境对人体的危害,60,60,47,54,57,260,未参加,
这一点会引起什么就{CC可}不用说了。,200405109542200574,越南,2,200405,吸烟对个人健康和公众利益的影响,65,75,62,39,57,285,未参加,
公共汽车上、体育场、商店、饭店现在{CJ-zy都}是不欢迎吸烟者的地方。,200405109919200958,加拿大,2,200405,吸烟对个人健康和公众利益的影响,90,85,62,54,68,356,C,
今天，许多青少年喜欢边走边吸烟，但这已不再是个[B各]人的事，而已是会危害公众健康的事了。,200405217533200091,新加坡,2,200405,吸烟对个人健康和公众利益的影响,80,75,85,82,92,405,B,
就象其它嗜好一样，人们总有许多借口、理由为自己的嗜好欲望作种种的辩护。,200405522522150011,缅甸,1,200405,吸烟对个人健康和公众利益的影响,95,95,71,67,91,418,B,
说不定身边的小孩或老人有病在身。,200405522522150021,缅甸,1,200405,吸烟对个人健康和公众利益的影响,85,80,60,47,70,335,C,
吸烟活动开始于美洲大陆[F陸]，后传到世界各地，受到广大人民的喜爱，曾经风行全世界。,200405522522150033,缅甸,1,200405,吸烟对个人健康和公众利益的影响,70,90,77,81,91,402,B,
其次，当你得了肺[C]癌，国家对你的治疗也会浪费金钱，这些金钱本来可以用来发展国家，不该浪费在只顾自己的乐趣而抽烟的人身上。,200405209529200059,泰国,2,200405,吸烟对个人健康和公众利益的影响,70,70,74,63,72,337,C,
后者也被称为[L]“被动吸烟者”。{CD通过},200405209606200061,比利时,2,200405,吸烟对个人健康和公众利益的影响,65,65,60,16,67,257,未参加,
此外，吸烟人还会给身边不吸烟的人带来伤害。,200405610610250009,法国,2,200405,吸烟对个人健康和公众利益的影响,80,80,77,63,90,382,B,
旁人{CC旁上}再三劝[F勸]他们[F們]要戒掉抽烟，可是是在对牛弹琴{CC对[F對]牛谈[F談]琴}，根本{CC更本}没有影响[F響]力了。,200405610610250017,法国,2,200405,吸烟对个人健康和公众利益的影响,0,80,71,56,70,274,未参加,
我想父母确实是第一个老师，不过这位老师对孩子有正面和反面的作用。,200505109525200093,日本,2,200505,父母是孩子的第一任老师,60,75,67,59,81,328,C,
他回来的时候我常常说，“爸爸，回来了！,200505109525100334,日本,1,200505,父母是孩子的第一任老师,55,55,42,44,45,221,未参加,
因此，父母的爱好、思想和行为举止影响到自己的孩子是理所当然的事情。,200505109525200304,日本,2,200505,父母是孩子的第一任老师,65,75,58,54,74,313,C,
第三，我跟母亲[C]的对待别人的态度有点儿相[B像]似。,200505109525200441,日本,2,200505,父母是孩子的第一任老师,70,80,60,54,69,323,C,
此外，[BC、]跟父母聊聊天是孩子的操{WWJ},200505109525100733,日本,1,200505,父母是孩子的第一任老师,50,55,52,65,69,270,未参加,
对还没成熟的孩子来说，父母的思想观念是一种规范或目标。,200505217525100006,日本,1,200505,父母是孩子的第一任老师,45,75,44,61,69,277,未参加,
可能以为孩子不能理解，[BC、]不能记住咱们做{CQ了}什么。,200505217525200050,日本,2,200505,父母是孩子的第一任老师,55,50,48,37,41,210,未参加,
但[C]是呢，我有一点不能同意他{CD了}。,200505204525100123,日本,1,200505,父母是孩子的第一任老师,65,70,48,51,69,289,未参加,
因此我想父母是孩子的第一任老师。,200505204525100129,日本,1,200505,父母是孩子的第一任老师,75,55,44,57,54,270,未参加,
”当初不同意他们的意见，自己就找工作就业了。,200505204525200327,日本,2,200505,父母是孩子的第一任老师,65,70,56,55,54,286,C,
甚至对有的家长来说所谓教育是指在学校上的课，对家庭教育一点都[C]没有重视。,200505204525200504,日本,2,200505,父母是孩子的第一任老师,80,80,69,67,96,384,B,
第二方面是我母亲[C]对我的影响。,200505204525200519,日本,2,200505,父母是孩子的第一任老师,55,70,69,53,76,307,未参加,
在这些情况下，父母[C]当孩子的老师应该并不难。,200505204525100589,日本,1,200505,父母是孩子的第一任老师,70,75,71,73,83,361,B,
每一个孩子都会想到自己的父母。,200505204525200587,日本,2,200505,父母是孩子的第一任老师,45,70,46,53,52,248,未参加,
我的{CJX}对待挫折看法是“只要每天过充实的时间、就不怕遇到挫折”{CJX}这样的。,200112576525200020,日本,2,200112,如何面对挫折,65,65,54,73,69,310,C,
下次我再研究北京的历史、文化、政治，我看{CJ-buy到}的北京会变成{CC2变}另外一个城市，而{CJ-zhuy我}会更喜欢北京的。,200105204525100035,日本,1,200105,我的一个假期,70,80,70,46,72,328,C,
但是中甸的藏族、中甸的大自然{CD使}我{CJX}吸引了。,200105204525200048,日本,2,200105,我的一个假期,70,75,60,54,55,303,C,
借口是很多。,200105550523250075,韩国,2,200105,一封写给父母的信,70,75,63,63,49,309,C,
她不体贴。,200105550523250079,韩国,2,200105,一封写给父母的信,75,80,63,65,72,346,C,
是！,200105550523250094,韩国,2,200105,一封写给父母的信,70,65,49,39,45,254,未参加,
你们等一下，一年以后，我一定要给你们世界上最好的礼物。,200105550523250097,韩国,2,200105,一封写给父母的信,65,70,44,56,58,279,未参加,
下次再写好吗？,200105550523150104,韩国,1,200105,一封写给父母的信,60,60,30,47,54,233,未参加,
过几年后，我们都在社会上已经认定吗{CJ？}。,200105550523150112,韩国,1,200105,一封写给父母的信,80,65,60,56,58,307,C,
可是对我来说，你的期待是一种打气，捧场。,200105550523150117,韩国,1,200105,一封写给父母的信,70,65,38,56,45,260,未参加,
所以在北京一年生活中，我天天努力地学习，经常给父母问候。,200105550523250127,韩国,2,200105,一封写给父母的信,75,70,60,49,49,292,C,
我现在{CC至今}要考研究生考试。,200105550523250141,韩国,2,200105,一封写给父母的信,75,75,49,56,58,303,C,
我的毕业论文几乎完成了。,200105550523150170,韩国,1,200105,一封写给父母的信,70,65,41,39,61,262,未参加,
身体好吗？,200105550523250171,韩国,2,200105,一封写给父母的信,70,70,74,61,63,326,C,
你们别担[B胆]心吧！,200105550523150235,韩国,1,200105,一封写给父母的信,65,70,41,54,70,286,未参加,
有人说，“身在福中不知福”。,200105550523250257,韩国,2,200105,一封写给父母的信,75,65,52,63,54,296,C,
我以前从来没有这么热心地学习，以前我不知道怎么学习好呢？,200105550523150267,韩国,1,200105,一封写给父母的信,65,75,44,25,51,247,未参加,
亲爱的父亲，母亲：您们好！,200105550501250306,中国,2,200105,一封写给父母的信,75,90,66,77,83,385,B,
请您别担心，您的独生女日子过得{CJ-zy很}舒服的，是您给我的精神力量{CD支}帮助我一天比一天过得幸福愉快，可我一想起在家乡一个人一天到晚忙忙碌碌地跑来跑去工作的我可怜的妈妈，心里就难过{CJ-sy觉得}很对不起你。,200105550523250370,韩国,2,200105,一封写给父母的信,65,70,47,25,51,244,未参加,
但是现在我对{CD连}什么{CC2一点小}事也没感到困难。,200105550523250391,韩国,2,200105,一封写给父母的信,65,70,52,68,65,306,C,
[BD，]父母节{CJ-wy快乐}，我爱[C]你们，天长地久！,200105550523250393,韩国,2,200105,一封写给父母的信,70,65,66,49,51,287,C,
我忍受不了。,200105550523250399,韩国,2,200105,一封写给父母的信,70,80,74,70,79,363,B,
一封写给父母的信我最尊敬的爸爸、[BC，]妈妈：我在考试中给你们写一封信。,200105550523150411,韩国,1,200105,一封写给父母的信,80,75,79,61,74,360,B,
可是现在没办法。,200105550523250441,韩国,2,200105,一封写给父母的信,65,75,44,56,38,265,未参加,
现在在上海外国语大学学习。,200105206525100043,日本,1,200105,我的一个假期,70,70,72,51,59,310,C,
这样的话不是很好吗？,200105109525200091,日本,2,200105,由“三个和尚没水喝”想到的……,95,90,66,69,84,403,B,
我不知道和尚的生活是怎么样{CJsd}。,200105109525200111,日本,2,200105,由“三个和尚没水喝”想到的……,65,70,45,64,44,274,未参加,
他们{CQ又}想以后自己得病[BD，]怎么办？,200105109525100362,日本,1,200105,由“三个和尚没水喝”想到的……,65,65,32,62,61,269,未参加,
但是早来学校的人一天比一天少，晚上准备菜的人也越来{CC了}越少，最后连中午吃饭时也不关心它了。,200105109525200363,日本,2,200105,由“三个和尚没水喝”想到的……,65,80,70,51,68,322,C,
最后只有原来住的和尚，他一个人没{CC不}离开。,200105109525200702,日本,2,200105,由“三个和尚没水喝”想到的……,65,65,39,58,66,277,未参加,
这个故事也{CQ有}含义，{CJ-sy表现出}在我们生活的现代社会里也经常发生的一个真理。,200105109525200857,日本,2,200105,由“三个和尚没水喝”想到的……,70,70,59,73,75,335,C,
现在有关“安乐死”的法律，哪个国家都缺[C]少，[BC。]日本的法律里也没有。,200205217525200011,日本,2,200205,如何看待“安乐死”,65,65,52,72,51,289,C,
这个{CC件}问题是特别复杂[F雜]而一言难尽的{CD事}。,200205217525200064,日本,2,200205,如何看待“安乐死”,65,70,55,49,37,262,未参加,
我们家人不忍心{CC忍不住}看她{CJ-dy痛苦}的样子，[BC。]{CQ因为}这[D样]时，我们什么也不能做。,200205217525200094,日本,2,200205,如何看待“安乐死”,65,75,30,60,54,271,未参加,
”他答应了。,200205205525200003,日本,2,200205,如何看待“安乐死”,60,65,58,60,49,275,未参加,
为什么不可以呢，为什么不同意{CJ+by她}呢，难道我们不让她解脱痛苦吗？,200205205626200005,瑞典,2,200205,如何看待“安乐死”,70,60,71,49,51,286,未参加,
现在就决[F決]定合法的安乐死是会有一些问题。,200205205525200038,日本,2,200205,如何看待“安乐死”,75,70,66,60,49,309,C,
我个人的意见，[BC、]那个丈夫遇到这个情况，[BC、]妻子说帮助自杀的时候，[BC、]他不应该答应。,200205205525200081,日本,2,200205,如何看待“安乐死”,65,70,46,56,51,274,未参加,
但是，这样的人生有意义吗？,200205205525200095,日本,2,200205,如何看待“安乐死”,80,80,85,70,94,401,B,
根据这个案例，[BC、]对患者来说，实在{CJ-zy很}痛苦而且得了一种不治之症，除了患者以外谁也不知道患者的心理[B里]。,200205205525100116,日本,1,200205,如何看待“安乐死”,60,65,44,47,61,260,未参加,
但在荷兰这样的法律{WWJ},200205205525100143,日本,1,200205,如何看待“安乐死”,70,75,55,79,82,350,C,
因为是中国已经发展{CQ中}国家之一{CJs}。,200205302525100013,日本,1,200205,如何看待“安乐死”,65,60,60,56,44,268,未参加,
即使本人要求“安乐死”，也不应该实施。,200205206525100036,日本,1,200205,如何看待“安乐死”,70,65,38,35,63,257,未参加,
会不同意吗？,200205206525100040,日本,1,200205,如何看待“安乐死”,70,70,69,70,65,332,C,
四年前，我的一个老同学因为{CJ+sy发生}交通事故而受了重{CC大}伤，而且他从那时{CC2此}到现在一直没有醒过[BQ，]变成植物人了。,200205206525100061,日本,1,200205,如何看待“安乐死”,70,65,49,63,68,301,C,
我想为[F為]解决这[F這]个[F個]问[F問]题[F題]，{CJ-zy应该}让{CC依}两[F兩]三位医[F醫]生，心理{CQ学家}与[F與]法律专[L]家等{CD专[F專][D业[F業]]家}一起来[F來]讨[F討]论[F論]，那样[F樣]可以制定以[L]合理和合法{CC合适}为[F為]标[F標]准[F準]，通过[F過]立法者[D为[F為]]制定合法{CC合商}的法律体系{CC体[F體]制}，以保护[F護]每个[F個]人的合理与[F與]合法{CQ的}权利{CD为[F為]目的[BQ。]},200205206627100065,瑞士,1,200205,如何看待“安乐死”,80,75,46,42,37,271,未参加,
所以“代沟”问题[C]是很难解[C]决[B诀]的。,200209550523150023,韩国,1,200209,如何解决“代沟”问题,60,60,36,57,56,251,未参加,
这些差异[B导]是因为生活背景，特别是生长背景的差异[B导]{CJ-sy而产生的}。,200209550523250052,韩国,2,200209,如何解决“代沟”问题,60,65,60,40,62,270,未参加,
所以有时候跟父母无法沟通。,200209550523250091,韩国,2,200209,如何解决“代沟”问题,65,60,63,59,56,286,C,
如果父母尊[B遵]重孩子的看法，而且给他们有点儿自由的话，代沟问题并不是难以解决的问题。,200209550523250128,韩国,2,200209,如何解决“代沟”问题,65,75,60,71,56,314,C,
只要{CC只有}父母和子女努力互相了解，互相爱，代沟的问题就会慢慢解决的。,200209550523250128,韩国,2,200209,如何解决“代沟”问题,65,75,60,71,56,314,C,
所以我以为这种问题{CJX}解决的方法中最好[C]的是谈话。,200209550523250137,韩国,2,200209,如何解决“代沟”问题,60,60,39,67,64,272,未参加,
同时，前辈还要鼓励[B厉]后辈。,200209550523250160,韩国,2,200209,如何解决“代沟”问题,60,70,57,67,54,293,未参加,
家人一起看电影以后，互相发表自[C]己的意见{CC感觉}，家人都看书[C]以后，发表读后感。,200209550523150175,韩国,1,200209,如何解决“代沟”问题,70,60,57,69,52,293,未参加,
这种年轻[B青]人[L]的心理就是缺乏[B法]对老人的理解{CC立场}。,200209550523250182,韩国,2,200209,如何解决“代沟”问题,70,65,57,67,56,301,C,
为了解决父母和子女之间的问题最重要的是对话。,200209550523250189,韩国,2,200209,如何解决“代沟”问题,60,65,69,59,50,286,C,
代沟是现代社会的一个{CC种}难以解[C]决的问题。,200209550523250210,韩国,2,200209,如何解决“代沟”问题,70,65,54,67,58,300,C,
我们听他们的看法以后一定{CQ会}了解他们的想法。,200209550523150217,韩国,1,200209,如何解决“代沟”问题,65,65,45,49,36,244,未参加,
很长时间{CQ以来}没有解决的一{CC这}个问题[BQ。]怎么做好呢？,200209550523250212,韩国,2,200209,如何解决“代沟”问题,60,60,48,64,44,258,未参加,
他们不管国籍，如果真的爱他，别的都没关系。,200209550523250264,韩国,2,200209,如何解决“代沟”问题,70,65,66,71,54,312,C,
不管怎么样，两代人也是血缘关系。,200209550523150362,韩国,1,200209,如何解决“代沟”问题,70,70,60,67,58,313,C,
父母也压抑子女的想法，这样的话，代沟问题越来越严重{CC深刻}。,200209550523250358,韩国,2,200209,如何解决“代沟”问题,65,65,45,76,46,281,未参加,
为了促进两代间的相互理解，首[B守]先我们应该理解对方所经历的时代具有什么历史上的特性。,200209550523250771,韩国,2,200209,如何解决“代沟”问题,80,70,75,89,86,390,B,
第二，两代人应该{CQ以}真诚的态度关心对方，尽量找出共同的兴趣[BQ，]如听音乐、做运动、看电影或去旅游[F遊]。,200209550523250771,韩国,2,200209,如何解决“代沟”问题,80,70,75,89,86,390,B,
可是男孩儿跟爸爸的关系不是这样的。,200209550523250920,韩国,2,200209,如何解决“代沟”问题,65,75,48,67,44,286,C,
所以法律制裁是正确{CC的确}的。,200205271525200052,日本,2,200205,如何看待“安乐死”,75,70,60,65,56,315,C,
