错句,作文编码,国籍,性别,考试时间,作文题目,口试分数,作文分数,听力分数,阅读分数,综合分数,总分,证书
”我真的不知道在这一生中我能不能再一次跟我父亲见[F見]一面，让他抱[B包]我在他的怀里{CJba}。,199412124542100015,越南,1,199412,记我的父亲,90,70,86,53,67,359,C,
现在呢？,199412124914100036,古巴,1,199412,记我的父亲,50,60,41,34,37,202,未参加,
”可是，我有了别的孩子{CD们[C]}享受不到的快乐。,199412124525200041,日本,2,199412,记我的父亲,55,75,65,65,72,317,C,
我一说起{CC2想}“对我影响最大的人”，就想起来我的茶道老师。,199412104525200626,日本,2,199412,记对我影响最大的一个人,70,55,57,63,78,307,未参加,
对我来说，他只对我宽容{CC放松}。,199412104523200640,韩国,2,199412,记对我影响最大的一个人,70,70,54,59,61,302,C,
记对我影响最大的一个人我想对我影响最大的还是我的爸爸。,199412104523100633,韩国,1,199412,记对我影响最大的一个人,65,55,73,65,61,301,C,
那时候我不爱听父母的话，甚至{CQ连}老师的话也置之不理，真是天生{CC2天性来}的脾气。,199412104523200115,韩国,2,199412,记对我影响最大的一个人,60,50,70,48,55,263,未参加,
对于刚开始学习汉字的人来说，简体字实在是一项伟大的发明。,199409543501200224,中国,2,199409,学习汉语的苦与乐,85,90,88,68,99,427,A,
再者，我们[F們]学[F學]好汉[F漢]语[F語]，成为[F為]文字沟通上的桥[F橋]梁[F樑]。,199409543634200207,英国,2,199409,学习汉语的苦与乐,80,75,45,50,73,314,未参加,
目前我{CQ已}在香港落地生根。,199409543634100204,英国,1,199409,学习汉语的苦与乐,90,55,43,44,55,276,未参加,
她爱讲经典里的故事给我听。,199500533533100026,新加坡,1,199500,记对我影响最大的一个人,95,80,68,63,80,382,C,
我懂事以来，我爷爷就一直教[Y敎]导我。,199500533533100047,新加坡,1,199500,记对我影响最大的一个人,90,90,89,77,84,428,A,
王老师，在此我要谢谢你，你是影响我对华文爱好最深的人。,199500533533200043,新加坡,2,199500,记对我影响最大的一个人,95,90,52,53,76,365,未参加,
还有一点的是，她常对我说，我们生活在一个充满爱心，互相关怀的世界里，凡事都要献出自己一份力量，为不幸的大众服务，除此之外，我们个人的生活起居，只要自己能做到的，便要自己去做，决不要依靠他人，从小她便教我好何扫地，烧饭和缝纫编织{CC4缝编}衣服。,199500533533100054,新加坡,1,199500,记对我影响最大的一个人,90,90,78,63,65,384,B,
我深深地被感动{CQ了}，于是我就接受她的帮助，结果，我小学会考及格并[F並]考上中学。,199500533533100068,新加坡,1,199500,记对我影响最大的一个人,90,80,57,65,72,359,C,
但好景不长[B常]，父亲[F親]善心为[F為]人作保，被保的亲[F親]戚经[F經]商不善破产[F產]，导[F導]致我家家产[F產]尽[C]赔[F賠]。,199500533501200078,中国,2,199500,记对我影响最大的一个人,95,90,83,71,82,420,A,
她叫我[C]别伤心、别放弃，再考{CJ+buy过}就是了。,199500533533200097,新加坡,2,199500,记对我影响最大的一个人,95,70,78,69,76,382,B,
小学三年级时学校就规定要写大楷字了。,199500533533200098,新加坡,2,199500,记对我影响最大的一个人,90,90,57,69,84,388,C,
我姓×，叫××.我出生在一个平平凡凡的家庭。,199500533540200107,印度尼西亚,2,199500,记对我影响最大的一个人,85,80,62,57,55,332,C,
特别是在野炊的时候，他和我们玩得可开心了。,199510512501100503,中国,1,199510,记对我影响最大的一个人,85,85,81,85,100,431,A,
病人是经[F經]过[F過]医[F醫]生的诊[F診]断[F斷]后{CC下}，认[F認]为[F為]是无[F無]药[F藥]可救{CJbei}，只是用药[F藥]物或仪[F儀]器来{CC求}维持生命或尽[F儘]量减轻{CC减[F減]低}病者的痛苦，那样[F樣]，如在病人的要求下，医[F醫]生或亲[F親]人有权[F權]可以为[F為]病人进[F進]行安乐[F樂]死，因为[F為]这[F這]样[F樣]既可以了断[F斷]病人的痛苦，也可以使其亲[F親]人不必承受长[F長]期心理上的痛苦。P},199511543634100510,英国,1,199511,如何看待“安乐死”,70,90,74,73,82,382,B,
在现[F現]今科学[F學]发[F發]达[F達]，医学[F學]发达{CC昌明}的社会[F會]里[Y裡]，无[F無]论[F論]在物质[F質]上的条[F條]件还是{CC2及}生活的程度上，肯定要比[C]我们[F們]人类[F類]的祖先超出千千万[F萬]万[F萬]倍，人类[F類]的寿[F壽]命亦很自然在这[F這]些充裕的条[F條]件下{CC上}得到「延长[F長]」，甚至应[F應]该[F該]更正为[F為]「过[F過]长[F長]」。[BC，],199511543634100517,英国,1,199511,如何看待“安乐死”,80,90,64,54,82,365,C,
再说，本人对市场学略懂[C]一些，因此或许本人可帮得上贵公司的业务发展{CQ的忙}。,199503680519100537,马来西亚,1,199503,一封求职信,75,75,69,62,68,339,C,
每一个人的心中都有对自己{CQ有}影响的人，其中对我来讲[F講]我母亲[F親]是一位伟[F偉]大且对我影响最大的人{CD一位}。[BC.],199505550523100906,韩国,1,199505,记对我影响最大的一个人,65,60,39,48,39,234,未参加,
书的世界非常广阔，我认识到另外一个不同的世界。,199505529529200035,泰国,2,199505,学习汉语的苦与乐,90,95,76,81,99,439,A,
苦呢？[BC！],199505529529200085,泰国,2,199505,学习汉语的苦与乐,70,80,52,41,59,292,未参加,
另外一个是在我打工的时候认识的。,199505104525200006,日本,2,199505,记对我影响最大的一个人,75,55,73,44,67,299,未参加,
来客人时我听她们俩的聊天，有这样{CQ的}机会，我对社会的形势越来越了解[C]了。,199505104525200102,日本,2,199505,记对我影响最大的一个人,55,60,39,42,39,216,未参加,
我当初[C]中生的时候[BQ，]我们家的经济情况开始好一点儿，到现在我们家比较有钱{CQ了}。,199505104523100120,韩国,1,199505,记对我影响最大的一个人,55,70,52,59,49,269,未参加,
对我影响最大的是一位大学教授。,199505104525100141,日本,1,199505,记对我影响最大的一个人,60,60,62,59,65,288,未参加,
他的讲义的特点是内容很深，观点新鲜，他常常介绍有意思的{CJX}有关研究的书。,199505104525100141,日本,1,199505,记对我影响最大的一个人,60,60,62,59,65,288,未参加,
我的家庭[C]的历[B厉]史没有那么好。,199505104523200148,韩国,2,199505,记对我影响最大的一个人,80,60,49,53,63,292,未参加,
对我影响最大的人就是我的姐姐。,199505104523200154,韩国,2,199505,记对我影响最大的一个人,60,80,70,75,53,325,C,
我深深懂得，我的进步是离不开他的帮助的。,199505104542200192,越南,2,199505,记对我影响最大的一个人,85,80,44,38,65,305,未参加,
”{CD为[C]}一句话使我鼓起勇气，{CD推}到香港留学。,199505104525200212,日本,2,199505,记对我影响最大的一个人,75,75,65,48,65,318,C,
但我还{CQ是}觉得我妈妈对我的教育和培养不{CD是}一般。[BC；],199505104634100228,英国,1,199505,记对我影响最大的一个人,70,55,52,57,65,283,未参加,
他的很多爱好也教给{CC形成}了我现在如何待人接物{CJ-zxy的道理}。,199505104604100233,奥地利,1,199505,记对我影响最大的一个人,80,80,60,55,65,332,C,
如果，我没遇[C]到他的话，也许现在我不会{CC能[C]}在中国。,199505104525200256,日本,2,199505,记对我影响最大的一个人,70,65,81,77,86,365,C,
以前留学生也过的艰苦的生活几乎没有[C]了。,199505104525200256,日本,2,199505,记对我影响最大的一个人,70,65,81,77,86,365,C,
大学毕业后[F後]，我换{CQ了}我的专业，考上{CQ了}研究生。,199505104523100268,韩国,1,199505,记对我影响最大的一个人,75,65,57,75,63,322,C,
他常说：“打你是为你好。,199508680519100501,马来西亚,1,199508,记对我影响最大的一个人,75,60,83,63,82,349,C,
没有玩伴，没有人在场[F場]，生命的转[F轉]折[C]点就是那个时[F時]候。,199508681519100524,马来西亚,1,199508,记对我影响最大的一个人,80,80,65,69,76,362,B,
她[B他]生活俭朴，热爱丈夫和儿女，她[B他]默默耕耘，[BC。]辛苦了一辈子。[BC，],199508682519200527,马来西亚,2,199508,记对我影响最大的一个人,85,80,81,67,88,394,B,
我每天上午上课[F課]，下午补[F補]习[F習]外语[F語]，还参加一些课[F課]外活动，如文艺表演、话[F話]剧等等。,200009542542200002,柬埔寨,2,200009,我的童年,65,70,69,74,96,360,C,
再者，既然结[F結]了婚后[F後]又要离[F離]婚，那么[F麽]，为[F為]什么[F麽]不在结[F結]婚以前想清楚呢？,200010602543250009,香港地区,2,200010,我对离婚问题的看法,85,85,100,90,95,450,A,
而且，这样一来人的健康也会有好转{CC好展}了。,200005108523100279,韩国,1,200005,关于用自然之声取代噪声的建议,80,75,70,80,61,357,B,
其中一个很严重的问题是一个环境保护的问题，我们的生活当中最容易见到的是经常听到的噪声。,200005108523100326,韩国,1,200005,关于用自然之声取代噪声的建议,70,65,31,50,37,239,未参加,
可是这电话的声音也不那么好听，所以应该换好听的声音。,200005108523200327,韩国,2,200005,关于用自然之声取代噪声的建议,65,65,45,29,43,231,未参加,
而随着交通工具的不断发展，{CD而}人类享受方式的不断变化。,200005108525100323,日本,1,200005,关于用自然之声取代噪声的建议,65,70,75,57,54,307,C,
环境保护部门是直接管理噪音控制的部门。,200005108543100322,香港地区,1,200005,关于用自然之声取代噪声的建议,70,90,78,72,98,401,B,
我们一般听汽车喇叭声的时候，心里产生了一种[B和]反感，特别是堵车的时候，会这样，如果汽车喇叭声都那么可爱，我们很高兴地让路，而且自己开车的时候，特别是堵车时我们发脾[B啤]气的状况也可能越来越少。,200005108523100347,韩国,1,200005,关于用自然之声取代噪声的建议,65,75,75,72,67,341,B,
每天很多车往来，我觉得我的家的生活环境非常不好。,200005108523100687,韩国,1,200005,关于用自然之声取代噪声的建议,60,60,53,42,43,240,未参加,
这是一个我童年的幸福[B服]。,199705104525200082,日本,2,199705,我的城市/乡村生活,50,55,69,90,87,330,未参加,
首先，城市生活虽然复杂压力很重，但可以享受到文明社会的各种环境。,199705104523200123,韩国,2,199705,我的城市/乡村生活,60,70,66,67,68,316,C,
因为我从小一直到现在都在城市里长大，去乡村的机会不多。,199705104523200123,韩国,2,199705,我的城市/乡村生活,60,70,66,67,68,316,C,
我生长在日本干叶县的千叶市。,199705104525100523,日本,1,199705,我的城市/乡村生活,50,75,60,67,65,301,未参加,
可是，我越长[F長]大我就越知道大都市有不可轻[F輕]视[F視]的坏[F壞]处[F處]。,199705529529151011,泰国,1,199705,我的城市/乡村生活,50,75,23,36,30,198,未参加,
每个人都为[F爲]为自己的生活而忙碌，一切都是为[F爲]自己打算．我不喜欢城市里的生活。,199705529529151015,泰国,1,199705,我的城市/乡村生活,75,65,49,42,59,277,未参加,
山里是绿绿的森林，即使是热带的气候，都能感觉到很清凉和怡神。,199705610610200017,法国,2,199705,我的城市/乡村生活,85,75,64,73,88,377,B,
我希望在剩下的时间内，我的汉语水平会比现在提高，不论哪个方面。,199804123529200042,泰国,2,199804,学习汉语的苦与乐,80,85,72,76,86,393,B,
跟中国人打交道也是如此。,199804123548100204,塔吉克斯坦,1,199804,学习汉语的苦与乐,75,75,48,35,46,269,未参加,
从我的经历{CC经验}来说，我要打出租去剧场，但司机听错了。,199804124523200398,韩国,2,199804,学习汉语的苦与乐,65,55,75,45,46,268,未参加,
在泰国的朋友们都{CJ-zy很}吃惊{CJX}{CQ对}我来华留学，他们都说“汉字太难了！,199804124529200427,泰国,2,199804,学习汉语的苦与乐,80,90,60,59,58,342,C,
可以说我学习汉语的时间不短，然而我一旦不注意声调，中国人{CJ-zy就}听不懂我说的话。,199804124523200441,韩国,2,199804,学习汉语的苦与乐,85,85,78,67,80,390,B,
我也能说、[BC，]听、[BC，]写汉语，因此，有很多中国朋友，跟他们在一起，我亲自体会到中国人的特性。,199804124523200455,韩国,2,199804,学习汉语的苦与乐,70,60,54,59,58,286,未参加,
再说，学习汉语对韩国人来讲比别的国家{CQ的}人学习比较容易一些{CJbi}。,199804124523100474,韩国,1,199804,学习汉语的苦与乐,65,60,57,57,40,262,未参加,
在我看来，妇女还是应该投身社会，尤其是文化水平高的妇女。,199809542542200008,越南,2,199809,如何看待“妻子回家“,70,90,67,79,84,383,C,
因为家庭就是社会的一份子也是促进社会的关键所在。,199809542542200028,越南,2,199809,如何看待“妻子回家“,75,90,71,64,82,376,B,
这是我开始学汉语的时候{CQ的}事情。,199904123523200012,韩国,2,199904,如何面对挫折,70,55,53,34,43,239,未参加,
通过老师的教法，我得到了自信[B心]。,199904123523200012,韩国,2,199904,如何面对挫折,70,55,53,34,43,239,未参加,
那时候我们都异[B一]口同声叹气：“唉”[BQ。]对！,199904123523200060,韩国,2,199904,如何面对挫折,55,65,23,29,22,176,未参加,
当时我回顾{CD看}关于我多想的日子，我要什么，我以后要当什么，我要怎么做我会什么等等，我对{CC给}正在遇到困难的人说：“[BC、]你们不要紧，过了一段时间你们也{CJ-zy会}跟我想的一样‘遇到困难的时期是最完美的时期’”。,199904123523200145,韩国,2,199904,如何面对挫折,60,65,48,52,39,247,未参加,
现在我还是喜欢学汉语，我自己都变了样。,199904123523200214,韩国,2,199904,如何面对挫折,70,65,59,27,56,263,未参加,
每个人从小时开始[B时]受到父母的影响。,199904124523100315,韩国,1,199904,如何面对挫折,75,55,42,32,35,224,未参加,
说得对[BQ，]他们有的时候也会死的，可是他们不管，为了找到自我精神，或是为了社会的发展，他们不怕挫折，能够从失败中吸取教训。,199904124523200320,韩国,2,199904,如何面对挫折,70,65,45,34,43,243,未参加,
现在他有工作，还有自己的房子。,199904124523200321,韩国,2,199904,如何面对挫折,65,65,42,39,52,247,未参加,
我就利用这个机会来中国上大学了。,199904124523100385,韩国,1,199904,如何面对挫折,70,70,48,55,50,281,C,
