错句,作文编码,国籍,性别,考试时间,作文题目,口试分数,作文分数,听力分数,阅读分数,综合分数,总分,证书
随着公众保健{CC健卫}知识的提升，吸取二手烟会影响个人健康，甚至导致肺癌已成为众所周知{CC众所皆知}的医学常识。,200405680519150016,马来西亚,1,200405,吸烟对个人健康和公众利益的影响,90,95,74,79,99,435,A,
所以，在解决学习上的问题或处事方面，男女同学之间可以互相学习。,200504534533250042,新加坡,2,200504,我对男女分班的看法,80,85,76,84,93,412,B,
话说回来，我觉得男女同班更好，为什么呢？,200504534533250070,新加坡,2,200504,我对男女分班的看法,60,75,51,65,68,305,未参加,
因为他们会先站在异性的角度看待问题及解决方法。,200504534519250093,马来西亚,2,200504,我对男女分班的看法,70,80,78,78,79,375,B,
一直以来，我对男女分班这种做法是极为赞同的。,200504534519250110,马来西亚,2,200504,我对男女分班的看法,80,90,84,71,70,390,B,
这样我们才可以教育出能应付现实{CC现}需要[D件]的下一代。,200504534533250113,新加坡,2,200504,我对男女分班的看法,70,75,87,73,70,364,B,
因为他们长期对着同性已发生对同性的好感，演[B眼]变成同性恋。,200504534533250122,新加坡,2,200504,我对男女分班的看法,70,70,70,76,55,329,C,
不如把他们放在[B才]同个班里，让他们相处、合作和培养出那种默契[B气]。,200504534533250182,新加坡,2,200504,我对男女分班的看法,65,65,59,69,59,301,C,
他向狗{CJX}开始走去{CC开走}，我朋友打着孩子说：“不！,200505109922100247,美国,1,200505,父母是孩子的第一任老师,65,55,39,29,49,219,未参加,
父母是孩子的第一任老师而也是一辈子[L]最重要的老师并给孩子伟大影响。,200505109630200579,西班牙,2,200505,父母是孩子的第一任老师,60,50,50,31,27,198,未参加,
我[C]没有受到像其他同学那么多的父母[C]的关心。,200505109525200609,日本,2,200505,父母是孩子的第一任老师,80,70,69,65,77,351,C,
出生的那天{CQ起}一般都是母亲不但[B旦]给孩子喂[B母]奶[B乃]，而[B两]孩子刚刚离开了母亲的肚子加入了我们比较[B校]冷的叫人间的世界。[BC，],200505109626200926,瑞典,2,200505,父母是孩子的第一任老师,65,45,36,28,22,175,未参加,
这是什么原因，[BC、]我先不提。,200505109523201266,韩国,2,200505,父母是孩子的第一任老师,55,75,57,39,52,263,未参加,
我的一个朋友以前说过{CD我}：[BC；]“我的爸爸是个酒鬼。,200505109525201312,日本,2,200505,父母是孩子的第一任老师,60,70,50,43,64,272,未参加,
他们是最亲的人，也是靠他们孩子才能正常地{CC的}成长{CC生长}。,200505109610201293,法国,2,200505,父母是孩子的第一任老师,80,70,66,47,76,329,C,
孩子从父母打基础以后，还[C]要随[C]着[C]他[B它]{CD的}{CQ跟}人们{CQ的}交往{CC交流}。,200505109525101750,日本,1,200505,父母是孩子的第一任老师,65,60,50,55,65,278,未参加,
换个说法，如果这段时期父母对孩子教育不好的话，{CQ对}孩子的将来会有不好的影响。,200505109525202041,日本,2,200505,父母是孩子的第一任老师,65,70,52,67,72,312,C,
我认为就是父母同孩子的关系。,200505109633102070,意大利,1,200505,父母是孩子的第一任老师,70,70,48,47,58,281,未参加,
现代年青人在受到这种社会思潮的影响中，都觉得自己不想要孩子了。,200505109525202099,日本,2,200505,父母是孩子的第一任老师,70,60,61,67,72,315,C,
可以说如果父母不怎么样[BQ，]孩子多半也不能成为什么人，该打好这一基础{CC2点}[BQ。]孩子的兴趣爱好、[BC，]思想观念、[BC，]行为举止多半是向父母学习的。{CQ因为},200505109542202132,越南,2,200505,父母是孩子的第一任老师,65,60,46,41,43,238,未参加,
但是现在的父母特别是年轻的父母中不能当孩子的老师的人比较多。,200505109525202353,日本,2,200505,父母是孩子的第一任老师,70,70,76,76,80,360,C,
[BD《]父母是孩子的第一任老师[BD》]父母可以说是孩子的第一任老师。,200505109525102597,日本,1,200505,父母是孩子的第一任老师,70,80,37,57,65,299,未参加,
父母不应该把自己的没有实现的希望转到孩子上而让他必须{CC必定}这样做[B作]。,200505217651200234,,2,200505,父母是孩子的第一任老师,80,75,54,57,58,315,C,
下面我就以我父亲对我所产生的影响为例。,200505204635200497,俄罗斯,2,200505,父母是孩子的第一任老师,95,80,71,65,74,381,B,
从那时开始我也就开始学起爸爸的作[B做]风。,200505212529200021,泰国,2,200505,父母是孩子的第一任老师,95,70,76,61,63,359,C,
让一个学生能够获得好成绩就要看他们的第一任老师是怎么教的了。,200505212542200016,越南,2,200505,父母是孩子的第一任老师,85,65,73,65,74,351,C,
当两个人在彼[B比]此倾心之后，必须经过一段时间的了解，不能盲目地[B的]步入婚姻。,200505951501250004,中国,2,200505,最理想的结交方式,65,55,82,73,97,354,C,
婚姻是自己的终身大事，所以，结交时[F時]一定要谨[F謹]慎选择，有些从[F從]小一起长大，也就是所谓[F謂]的青梅竹马，小时不懂经常挂在嘴上{CC里}，结果长大以后[F後]，{CQ由于}更了解了各人的个性{CC性向}的原因，分手了。,200505522522250001,缅甸,2,200505,最理想的结交方式,80,90,36,51,66,318,未参加,
他认识我三年，还不敢表达他对我的爱意，[BC。]怕我生气{CD他}。,200505522522250017,缅甸,2,200505,最理想的结交方式,70,70,59,75,77,339,C,
但我认为这样下去的人生活是很不方便的。[BC.],200505522522250022,缅甸,2,200505,最理想的结交方式,50,60,23,33,39,185,未参加,
也许你们会说这是一种“一见钟情”的恋爱方式，是不实际的。,200505522522210004,缅甸,2,200505,最理想的结交方式,75,85,77,75,88,393,B,
现实社会里[F裡]，无论是男或女，我认[F認]为从[F從]最初的相识、[BC，]然[L]后到相爱[BD，]并[F並]能步入婚姻殿堂[BD，]而能白首谐老[BD，]{CQ的}是少数，大多数人的经历是很坎坷的。,200505522522110013,缅甸,1,200505,最理想的结交方式,70,70,73,49,77,327,C,
人长得越大{CD从}别人{CJX}受的影响越小。,200505209919100149,加拿大,1,200505,父母是孩子的第一任老师,70,50,54,57,47,261,未参加,
父母对他们的孩子想法不一样。,200505201540100303,印度尼西亚,1,200505,父母是孩子的第一任老师,60,60,48,37,45,232,未参加,
在生活中，父母常常对孩子不太了解。,200505201540100303,印度尼西亚,1,200505,父母是孩子的第一任老师,60,60,48,37,45,232,未参加,
生活中最应该尊重的是父母，因为父母为了孩子付出了不少艰辛{CC关心}、[BC，]关爱，甚至所有{CJ+sy付出了}孩子所想要的东西他们都能给孩子。,200505332540200041,印度尼西亚,2,200505,父母是孩子的第一任老师,65,60,48,39,72,267,未参加,
要做好这样的老师并不容易，父母不但要用心观察孩子的兴趣动向和行为举止并适时给予教导，还必须[B需]以身作则，给孩子树立好榜样。,200509801801250002,澳大利亚,2,200509,父母是孩子的第一任老师,85,70,69,85,94,394,C,
现将本人情况略作介绍。,200509534533250052,新加坡,2,200509,一封求职信,85,80,77,73,95,403,B,
让大家都高兴地{CC的}来，快乐地[B的]去。,200509534533150066,新加坡,1,200509,一封求职信,65,70,63,60,44,288,C,
今年二十四岁。,200509534533150113,新加坡,1,200509,一封求职信,70,70,68,60,79,335,C,
我所要应征的职位是{CD一名}经理，我是从哈佛大学毕业于旅游专业{CC2业}的，除此以外，我也曾在米兰啊旅游{CD业}学校深造过。,200509534533150151,新加坡,1,200509,一封求职信,50,70,70,69,82,324,未参加,
谢谢。,200509534533250172,新加坡,2,200509,一封求职信,60,70,88,58,91,352,C,
因为成绩优秀，获得了奖学金，因此到美国继续深造[B诰]，在美国一所顶尖的大学，荣获{CQ了}最高荣誉奖。,200509534533250189,新加坡,2,200509,一封求职信,75,70,73,49,64,320,C,
如果贵公司肯聘请我，相信{CC信相}对你们来说是{CJ-sy有}百利而无一弊的。,200509534533250192,新加坡,2,200509,一封求职信,70,70,77,62,91,358,C,
流行歌曲是什么?我想的{CC得}流行歌曲是[BD，]当时的人们很喜欢的{CC得}，还有几乎没有人不知道的就是流行歌曲。,200510111523100012,韩国,1,200510,我看流行歌曲,75,85,67,54,64,338,C,
正应该刻苦地{CC的}学[C]习时由于听流行歌[C]曲而浪[Plàng]费时间是一件笨拙的事。,200510111523100435,韩国,1,200510,我看流行歌曲,65,65,74,69,67,324,C,
我认为每{CQ个}年代，每{CQ个}种类的音乐都有自己的特性和价值[B直]。,200510111523200770,韩国,2,200510,我看流行歌曲,80,80,63,69,69,353,B,
比如，{CQ对}喜欢的歌星达到痴迷的程度[BD。]{CQ而}影响学习。,200510111523200770,韩国,2,200510,我看流行歌曲,80,80,63,69,69,353,B,
随着社会的发展，流行音乐也{CD是}继续发展。,200510111523100830,韩国,1,200510,我看流行歌曲,55,55,39,30,52,211,未参加,
不该{WWJ},200510111523100830,韩国,1,200510,我看流行歌曲,55,55,39,30,52,211,未参加,
有的人非常喜欢流行歌曲，甚至达到痴迷的程度。,200510111523200828,韩国,2,200510,我看流行歌曲,65,70,63,42,52,278,未参加,
现在很多歌词的内容很[C]不错。,200510111523200848,韩国,2,200510,我看流行歌曲,70,70,63,32,52,275,未参加,
这样的理由，我很喜欢听流行歌曲，对流行歌曲一点也没有什么反感{CJZR}。,200510111523201032,韩国,2,200510,我看流行歌曲,75,80,58,46,67,317,C,
这样一来，我们可以知道，在生活中{CC时}常常会遇到{CD什么}困难的问题。,200510111523201035,韩国,2,200510,我看流行歌曲,70,70,56,36,59,279,未参加,
我认为这是缓[B环]解压力的一种好办法。,200510111523201047,韩国,2,200510,我看流行歌曲,90,70,67,56,69,345,C,
”旁边的人也喜欢那首歌的话，它就成为一个话题{CQ了}！,200510111523201056,韩国,2,200510,我看流行歌曲,70,85,70,44,55,316,C,
强国的意思就是文化大国。,200510111523201066,韩国,2,200510,我看流行歌曲,60,65,49,42,52,251,未参加,
文化生活中最简单的生活是听音乐。,200510111523201103,韩国,2,200510,我看流行歌曲,55,60,42,32,40,210,未参加,
我心情不高兴的时候，听了这些令人高兴的音乐，就{CJX}心情好起来。,200510111523101115,韩国,1,200510,我看流行歌曲,55,60,60,38,59,253,未参加,
有一个歌星可能会把人们要“听”的东西唱出来。,200510111727201149,马达加斯加,2,200510,我看流行歌曲,80,65,51,46,57,287,未参加,
我[C]也注意社会上流行的歌曲。,200510111419101651,哈萨克族,1,200510,我看流行歌曲,75,75,56,48,67,311,未参加,
所以一个人是否能成才，除了自身后天的努力程度{CQ以外}，{CQ与}在成长期[BD，]父母对他们如何{CQ进行}教育有很大的关系。,200510919501150011,中国,1,200510,父母是孩子的第一任老师,85,90,86,74,94,425,A,
父母就像孩子的老师[F師]，我觉[F覺]得[B的]孩子的生活环[F環]境[BD，]{CQ和}品性{CD上}都是父母最在乎的。,200510919919150029,加拿大,1,200510,父母是孩子的第一任老师,80,70,53,38,57,288,未参加,
相对于老人，年轻人是比较容易接受[B收]新鲜事物。,200510205540200020,印度尼西亚,2,200510,我看流行歌曲,60,85,77,71,91,373,C,
养成自控力和分辨力，知道谁是谁非，谁轻谁重。,200510302523200012,韩国,2,200510,我看流行歌曲,85,90,86,79,89,425,A,
首先[B选]我认为听轻松、[BC，]不要费脑筋[B径]的歌曲{CJ+sy是}对孩子们的精神健康{CD上}有好处。,200510302523200042,韩国,2,200510,我看流行歌曲,75,75,70,54,89,353,B,
我认为流行歌曲有好的方面，同时存在不好的方面。,200510302523100076,韩国,1,200510,我看流行歌曲,70,75,65,54,57,310,C,
可是对我来说流行歌曲是我生活当中很重要的一部分。,200510302523100077,韩国,1,200510,我看流行歌曲,65,65,67,54,74,309,C,
让我们听流行歌曲吧。,200510302523200126,韩国,2,200510,我看流行歌曲,85,75,74,48,52,326,C,
可他们呢？,200510302523100138,韩国,1,200510,我看流行歌曲,50,55,72,38,62,256,未参加,
我们不能只尊重自己喜欢的。,200510302523100219,韩国,1,200510,我看流行歌曲,65,65,72,48,77,311,C,
中国主席曾说过人才就是力量。,200510302523100222,韩国,1,200510,我看流行歌曲,75,75,81,63,79,363,B,
大部分都是学生。,200510302523200242,韩国,2,200510,我看流行歌曲,70,60,56,32,37,240,未参加,
如果人类没有了音乐，[BC、]就不知道怎么生活了。,200510501529200076,泰国,2,200510,我看流行歌曲,70,65,51,38,50,260,未参加,
你看近年涌出的不少流行歌手。,200510206516100115,老挝,1,200510,我看流行歌曲,75,80,63,28,64,301,未参加,
音乐是好是坏，这是在{CC在于}每个人的心里面{CJsd}。,200510529529151026,泰国,1,200510,我看流行歌曲,65,70,70,52,79,322,C,
而在众多流行歌曲中，偶像派多于实力派，而年轻人跟随着偶象来选服饰、发型，我们作为父母的如经济能力许可还可满[B洒]足他（她）们的要求，但要是{CQ买}不到的年轻人多是走向堕落或学坏{CC坏处}。[BC，],200510540540200064,印度尼西亚,2,200510,我看流行歌曲,75,75,60,59,89,348,C,
甚至对对方没有{CJ+sy存在着}任何的忍耐度。,200505680519250024,马来西亚,2,200505,最理想的结交方式,60,60,45,60,88,295,未参加,
也因为[F為]如此，父母的兴趣和爱好，思想和观[F觀]念，行为[F為]和举[F舉]止，都是正在牙牙学[F學]语[F語]的孩子们[F們]唯一能学习和效仿{CJ-zxy的对象}。,200509602801250006,澳大利亚,2,200509,父母是孩子的第一任老师,80,70,80,88,84,392,B,
明年一起去赏樱花吧。,200104124525200017,日本,2,200104,一封写给父母的信,70,65,68,80,63,332,C,
最近梦里常梦见{CC2见}你，我有点儿担心，您是不是哪不舒服，所以为了让我知道常出现{CJ-buy在我梦里}呢？,200104124523200075,韩国,2,200104,一封写给父母的信,75,70,63,58,47,302,C,
你们去赏花了吗？,200104124525200215,日本,2,200104,一封写给父母的信,75,75,85,70,85,380,B,
其次，我们又去了上海、杭州、苏州与南京。,200104124540200241,印度尼西亚,2,200104,一封写给父母的信,70,85,68,44,67,326,C,
××女儿2001年4月15日,200104124529200338,泰国,2,200104,一封写给父母的信,70,90,60,42,65,320,C,
我这里呢，不必担心了。,200104124523200390,韩国,2,200104,一封写给父母的信,70,80,52,44,42,278,未参加,
在大学的时候，我对老年人穿的衣服感兴趣{CC兴起}，[BC。]我觉得中国的老年人穿的衣服太简单，不漂亮。,199200008525200012,日本,2,199200,一封求职信,,,0,0,0,0,未参加,
我觉得[C]是她自己自杀了，不是他的丈[B大]夫杀了他的妻子。,199604124606200349,比利时,2,199604,如何看待“安乐死”,65,55,56,66,65,289,未参加,
无论什么情况，得了什么病，不应该自杀而且没有信心。[BC.],199604123523200250,韩国,2,199604,如何看待“安乐死”,60,50,61,49,44,243,未参加,
还有我对那位大夫、[BC，]无数的痛苦挣扎的患者和其家属感到非常同情。,199604124523200238,韩国,2,199604,如何看待“安乐死”,60,80,61,81,67,336,C,
也不可[C]以滥用实行安乐死这[C]个办法。,199604123523200288,韩国,2,199604,如何看待“安乐死”,65,80,82,71,85,371,B,
还有一件事可以让我们[C]想。,199604123523200334,韩国,2,199604,如何看待“安乐死”,70,85,71,69,52,337,C,
不管[B关]什么法律，你自己来决定。,199604124512100091,菲律宾,1,199604,如何看待“安乐死”,60,65,40,44,34,226,未参加,
可是这个问题很难说，一个人死了，法院认为当然要受法律的制裁，这是很自然的。,199604124525200342,日本,2,199604,如何看待“安乐死”,65,80,77,79,88,377,B,
随着医术的发达，许多病会克服。,199604124523200005,韩国,2,199604,如何看待“安乐死”,70,80,74,64,60,337,C,
还有{CQ在}一{CQ个}短的时间里只有痛苦的话，病人会没有活的希望吧。,199604124523200004,韩国,2,199604,如何看待“安乐死”,60,60,48,42,42,234,未参加,
我看了这篇[B编]“安乐死”的文章。,199604124525200073,日本,2,199604,如何看待“安乐死”,50,60,32,42,49,212,未参加,
比如男的朋友们一起去很远的地方呀，把牛仔裤撒开着穿呀等等。,199610550523290028,韩国,2,199610,如何解决“代沟”问题,65,55,65,42,53,262,未参加,
这[F這]样[F樣]的个[B各]人主义造成了代沟[C]的问[B门]题，互相没时[F時]间[F間]谈话，讨[C]论[F論]各人的详细琐[B销]事。,199610550523290064,韩国,2,199610,如何解决“代沟”问题,75,65,36,59,47,269,未参加,
代沟并[C]不是什么了不起的{CJ-by问题}，是不是？,199610550523290064,韩国,2,199610,如何解决“代沟”问题,75,65,36,59,47,269,未参加,
但，没有别的办法吧！,199610550523190065,韩国,1,199610,如何解决“代沟”问题,60,55,62,38,37,233,未参加,
每逢星期假日才能一家团聚。,199603533533200056,新加坡,2,199603,由“三个和尚没水喝”想到的……,90,80,71,72,94,402,B,
职份分明，分配公平，人人完成自己岗位的工作，按劳计酬，人人各得其所，发挥所长，为集体做出贡献。{CP故‘三个和尚是否能喝到水’“载舟”或是“覆[C]舟”，关键系人做事的态度与制度上啊。P},199603533533100063,新加坡,1,199603,由“三个和尚没水喝”想到的……,90,95,71,65,96,415,B,
于是我很生气{CC3一时之气}，认为自己的工资这么少，[BC。]还需做大量工作，我便学起他们{CJ-zy也}慢条斯理地做，[BC。]结果公司的业务渐渐下降{CC趋下}。,199603533533200064,新加坡,2,199603,由“三个和尚没水喝”想到的……,90,80,63,70,80,378,B,
自私——小则能够令个人丧失亲友，孤苦伶仃；[BC，]大则能够危[B威]害整个国家。,199603533533200081,新加坡,2,199603,由“三个和尚没水喝”想到的……,85,85,77,76,82,400,B,
他用了两根小木柴顶住了眼皮。,199603533533200096,新加坡,2,199603,由“三个和尚没水喝”想到的……,90,70,74,76,91,394,B,
最先住在庙里的那位和尚开口说：“我是这间庙的住持，而你们俩是后来才来的，所以你们应该到山底下挑水给我喝。,199604680519200502,马来西亚,2,199604,由“三个和尚没水喝”想到的……,85,75,77,83,89,401,B,
把我从睡梦中吵醒{CQ了}。,199604680519200502,马来西亚,2,199604,由“三个和尚没水喝”想到的……,85,75,77,83,89,401,B,
但是清洁工作人常常{CC往往}认真打扫，为了保持干净{CJX}的{CC地}{CJX}文明城市，[BC。]如果没有他们[BQ，]{CJ-zhuy我们住的城市}就变成肮脏{CC恶坏}的城市{CQ了}。,199605104525100092,日本,1,199605,由“三个和尚没水喝”想到的……,60,55,46,42,39,223,未参加,
从此我再{CC就}把某件{CC种}事情让孩子做时，{CQ就}把工作任务分给每个孩子，一定要让孩子知道自己应该做的事。,199605104525200096,日本,2,199605,由“三个和尚没水喝”想到的……,90,80,69,58,77,369,C,
假如当时[F時]我能不顾[F顧[C]]一切，能做出别人不想[C]做的事，那么[C]其结果肯定是很{CJ-zy令人}满意{CC满[C]足}的。,199605104523100197,韩国,1,199605,由“三个和尚没水喝”想到的……,75,70,71,54,65,324,C,
虽然他一个人每天挑水喝[BQ，]但是一点儿也没感觉到累{CJ+zxy的感觉[C]}。,199605104523200212,韩国,2,199605,由“三个和尚没水喝”想到的……,65,60,33,24,23,188,未参加,
和尚们都嫌麻烦，一有了别人就开始依靠别人，尽管要让别人办事，总是要占便宜。,199605104525200215,日本,2,199605,由“三个和尚没水喝”想到的……,80,75,52,72,72,342,C,
这样人口{CC人类}多的话，人间关系[C]会{CC1应该}{CJ-sy呈现}复杂和多样[C]的情况。,199605104523100242,韩国,1,199605,由“三个和尚没水喝”想到的……,55,50,35,45,23,187,未参加,
大家不愿意干麻烦的工作。,199605104525100249,日本,1,199605,由“三个和尚没水喝”想到的……,60,65,38,54,56,256,未参加,
例如，[BC、]人们应该完善{CC修样}自己、在生活各方面{CD上}乐意帮助别人，[BC。]因为故事上提的{CC得}是和尚——不是一般的人呢！,199605104523200271,韩国,2,199605,由“三个和尚没水喝”想到的……,65,70,55,60,46,282,C,
走廊灯泡坏了，那怎么[L]办呢？,199605104542200312,越南,2,199605,由“三个和尚没水喝”想到的……,75,85,71,58,84,366,B,
为了别人{CJX}可以做一件事情时，我觉得可以实现真正{CD的}和睦的社会。{CP现在的很多人不知道帮助别人后可以感觉到{CD的},199605104523200318,韩国,2,199605,由“三个和尚没水喝”想到的……,65,60,74,54,80,316,C,
谢谢,199605104523200339,韩国,2,199605,由“三个和尚没水喝”想到的……,65,55,33,33,46,214,未参加,
到外地去旅[C]游，我们不约而同{CC不同而约}地说：“[BC‘]坐火车去。,199605104525100345,日本,1,199605,由“三个和尚没水喝”想到的……,70,80,55,79,89,363,C,
没想到，在他们三个和尚心目中产[C]生了一种不好的想法{CC心情}。,199605104525100353,日本,1,199605,由“三个和尚没水喝”想到的……,70,65,38,76,80,315,未参加,
可[C]是社会在提高人们的文化水平、道德水平{CJ-zxy方面}起了很大的作用。,199605104525200393,日本,2,199605,由“三个和尚没水喝”想到的……,60,65,58,81,77,324,C,
人们都想{CJX}只享用权力，不想做{CC作}事情{CC任务}。,199605550523190046,韩国,1,199605,由“三个和尚没水喝”想到的……,65,65,60,70,61,305,C,
在我们现实生活中也有这种现象[C]的{CJsd}。,199605550523290057,韩国,2,199605,由“三个和尚没水喝”想到的……,65,50,58,42,61,257,未参加,
从此他们每天都一起到山底下挑水，互相帮助，日子过得很好。,199605529529250142,泰国,2,199605,由“三个和尚没水喝”想到的……,80,80,66,70,75,363,B,
终于，他们三个人都快要死了。,199605550523290080,韩国,2,199605,由“三个和尚没水喝”想到的……,65,65,49,47,56,266,未参加,
在学校做个[F個]好学生，在家里[F裡]做个[F個]好孩子，不再受到父母亲[F親]的打骂[F罵]。,200110540540150036,印度尼西亚,1,200110,我的童年,70,90,44,37,76,310,未参加,
我的父亲[F親]是一位中学[F學]教师[F師]，母亲[F親]是一位古典型的家庭主妇[F婦]，家中有一位姐姐，两位哥哥，生活得{CC的}非常簡[F简]單[F单]朴[F樸]实[F實]。,200110540540250078,印度尼西亚,2,200110,我的童年,90,90,79,77,85,419,B,
到过的国家包括{CD了}日本、美国、英国等。,199312533533100057,新加坡,1,199312,一封求职信,85,75,78,70,87,388,B,
了解市场[F塲]以及创[F創]新，这[F這]是我的专长{CC专[F專]作}。,199312533533100071,新加坡,1,199312,一封求职信,60,55,48,69,62,275,未参加,
快乐家庭旅游公司李文经理：本人对贵公司在一九九三年十二月一日在报章刊登的招聘导游[F遊]的启事感兴趣，特此写信求职，望贵公[L]司能加以考虑。,199312533533200129,新加坡,2,199312,一封求职信,85,80,62,70,71,362,B,
以下是本人的简历。,199312533533200159,新加坡,2,199312,一封求职信,80,90,60,50,57,332,C,
首先，我觉得很荣幸[B兴]，向{CC对}你们公司投简历{CC3志愿}。[BC.],199312104523100016,韩国,1,199312,一封求职信,60,55,57,37,52,242,未参加,
我会说三种语言：泰语、汉语，英语，在泰国已取得了大学学历，在本国当过两年导游。[BC，],199312124529200157,泰国,2,199312,一封求职信,65,50,60,50,55,261,未参加,
我希望贵{WWJ},199312123525200405,日本,2,199312,一封求职信,75,70,64,59,64,321,C,
我曾经是北京大学[BD、]文科系的学生。,199312123801100704,澳大利亚,1,199312,一封求职信,65,60,46,48,50,252,未参加,
它是国家公务员，所以办事应{CJ-sy遵守}光明{CC公命}正大、[BC，]公平的原则，需要工作上{CJ-sy坚持}严肃的风格。,199412123523100007,韩国,1,199412,记我的父亲,60,65,70,61,69,308,C,
叫一次，叫两次[BQ，]我不答应。,199412123523200011,韩国,2,199412,记我的父亲,50,80,54,42,47,258,未参加,
可是我有一次撒{CQ了}大谎[C]。,199412123525100023,日本,1,199412,记我的父亲,50,70,36,42,45,226,未参加,
我上面有两个哥哥，他们也都已[B己]经结婚了。,199412123525200048,日本,2,199412,记我的父亲,75,60,54,40,49,264,未参加,
今年我快{CD近}二十五岁了。,199412123529200054,泰国,2,199412,记我的父亲,50,55,49,55,57,245,未参加,
我记得{CC的}{CJ+sy是}，他永远对我表现他无微不至的疼爱和关怀。,199412123523100066,韩国,1,199412,记我的父亲,50,90,49,46,67,290,未参加,
我上学时，他也陪着我做功课{CC2课}，这样让我对课文[L]的内容感兴趣起来。,199412123636200092,乌克兰,2,199412,记我的父亲,70,55,39,34,51,233,未参加,
