错句,作文编码,国籍,性别,考试时间,作文题目,口试分数,作文分数,听力分数,阅读分数,综合分数,总分,证书
但还有其他原因会{CD能}给那些运动人员这么高的收入，[BC：]就是他的努力。,200404140727200237,马达加斯加,2,200404,运动员收入,60,75,49,40,59,269,未参加,
因为他有技术和能力，他能打出非常好的球[BQ，]让观众喜欢他[BQ，]所以观众愿意付钱来看他打球。[BC，],200404140542100289,越南,1,200404,运动员收入,65,75,70,36,63,296,未参加,
不过，惩罚措施只是解决吸烟问题的其中{CC其}一部分[B份]，尚未是个理想、全面的处理方法。,200405680519150006,马来西亚,1,200405,吸烟对个人健康和公众利益的影响,80,95,69,85,84,408,B,
然而，以新加坡为例[B列]，早在40年代，当时的新加坡学校已施行男女混合{CQ制}。[BC.],200504534533150011,新加坡,1,200504,我对男女分班的看法,85,85,70,82,77,394,B,
通常男性同学在讨论功课上比较理性而女性同学则比较感性。,200504534533250025,新加坡,2,200504,我对男女分班的看法,75,80,70,78,84,378,B,
所以，在解决学习上的问题或处事方面，男女同学之间可以互相学习。,200504534533250042,新加坡,2,200504,我对男女分班的看法,80,85,76,84,93,412,B,
我本身并不赞成男女分班教学法。,200504534519250059,马来西亚,2,200504,我对男女分班的看法,80,75,76,84,91,397,B,
我对于分班的做法[L]是不怎么看好{CQ的}，但分班也不是完完全全{CD的}没有益处{CC4不受益}的！,200504534533250166,新加坡,2,200504,我对男女分班的看法,85,80,70,60,55,343,B,
他们不勉强我去不去。,200505109525200005,日本,2,200505,父母是孩子的第一任老师,65,60,46,44,62,260,未参加,
我认为，我的性格很像我的父亲。,200505109513200752,柬埔寨,2,200505,父母是孩子的第一任老师,70,70,44,40,51,263,未参加,
父母[C]应该对孩子照顾到孩子成年人的时候，[BC。]给孩子吃饭、洗衣服、给孩子买东西等等。,200505109525100764,日本,1,200505,父母是孩子的第一任老师,55,70,20,35,33,197,未参加,
父母应该多跟孩子在一起，少发脾气{CC4少怒}。,200505109525100994,日本,1,200505,父母是孩子的第一任老师,70,55,78,66,85,338,C,
我现在也忘[C]不了那时母亲冲着我说的话。,200505109525201084,日本,2,200505,父母是孩子的第一任老师,60,70,53,56,66,290,未参加,
那小孩开始[C]说“我也要看机器[C]猫的节目？,200505109525201372,日本,2,200505,父母是孩子的第一任老师,70,75,57,53,59,303,未参加,
所以只有父母在孩子面前试着表现出最好的一面，再加上孩子后天的努[Pnǔ]力，孩子{CQ才}不会成为一个失败的社会分子。,200505109919201445,加拿大,2,200505,父母是孩子的第一任老师,65,80,78,76,90,377,B,
我也同意这样的想法。{CP因为不管你的父亲或母亲是否很富有{CC2有富的},200505109614201497,荷兰,2,200505,父母是孩子的第一任老师,70,60,41,37,41,234,未参加,
因为孩子出生之后第一次接触的人就是父母，所以父母对孩子的影响最{CC绝}大而且责任也相当重。,200505109525201541,日本,2,200505,父母是孩子的第一任老师,80,70,69,67,78,354,C,
做父母的应该努力提高自己的生活，让孩子觉得幸福，因为性格的最基本的部分是学校的老师们并不能改变的。,200505109525101851,日本,1,200505,父母是孩子的第一任老师,70,65,37,75,76,309,未参加,
这个看法虽然[C]有道理的，但是在孩子成长的过程以及生活环境中也有很多给孩子{CD受到}影响的东西。,200505109525201823,日本,2,200505,父母是孩子的第一任老师,60,60,46,69,65,282,未参加,
每个家庭[C]的孩子有每个不同的性格。,200505109525201854,日本,2,200505,父母是孩子的第一任老师,45,50,41,35,52,200,未参加,
但是还是大同小异了{CJsd}。,200505109922102123,美国,1,200505,父母是孩子的第一任老师,85,60,69,61,76,339,C,
对我来说那个样子是有点儿过分的。,200505109525202301,日本,2,200505,父母是孩子的第一任老师,70,70,54,55,74,311,C,
同时，我也跟朋友一起去很多地方玩儿。,200505109525102400,日本,1,200505,父母是孩子的第一任老师,55,65,46,51,64,263,未参加,
我一家人一起吃饭时，父母首先听了我和弟弟的话，今天在学校有了什么事情{CC事件}呀，和朋友怎么玩儿的。,200505109525202399,日本,2,200505,父母是孩子的第一任老师,55,60,64,64,71,295,未参加,
对我来讲，我的父母就是独一无二{CC惟一无二}的人物、最理解我的老师。,200505109525102439,日本,1,200505,父母是孩子的第一任老师,75,65,56,55,65,303,C,
我赞成这一问题的看法。,200505109525102455,日本,1,200505,父母是孩子的第一任老师,65,65,39,51,72,276,未参加,
我本[C]人就[C]像这[C]样长大了。,200505109525202452,日本,2,200505,父母是孩子的第一任老师,65,65,48,51,67,280,未参加,
如果有一个学生在学习上有错误，那时候老师改[C]正他的错误是当然的。,200505109525202470,日本,2,200505,父母是孩子的第一任老师,70,70,48,61,69,306,C,
他们都亲自告诉我{CJ-by这些}。,200505109529202511,泰国,2,200505,父母是孩子的第一任老师,70,65,56,53,50,280,未参加,
比如说，爸爸喜欢打棒球，孩子也喜欢打棒球。,200505109525202583,日本,2,200505,父母是孩子的第一任老师,65,90,46,53,69,314,未参加,
”要不是他的父母[BQ，]父母怎么能确定孩子[L]在学习什么。,200505109922102567,美国,1,200505,父母是孩子的第一任老师,85,75,48,47,45,292,未参加,
我就会慢慢一步一步地爬[B抓]起来，继续努力下去。,200505109512202592,菲律宾,2,200505,父母是孩子的第一任老师,90,90,71,55,67,371,B,
我也同意孩子要有自己的道路。,200505217651200234,,2,200505,父母是孩子的第一任老师,80,75,54,57,58,315,C,
比如两岁的{CJX}一个孩子，当他妈妈说“吃奶了”[BQ，]他马上就去找奶粉[BQ。]还有到他学说话时，父母会很认真地{CC的}纠正他们的话，{CD对}某一个简单的东西给孩子们{CJX}介绍。{CJba},200505212542100030,越南,1,200505,父母是孩子的第一任老师,80,55,54,31,58,264,未参加,
婴儿靠着他的父母，而不依靠别人。,200505275634100049,英国,1,200505,父母是孩子的第一任老师,75,70,41,33,39,247,未参加,
到了正式交往的时候，两个[F個]人都会[F會]合拍。,200505951922250006,美国,2,200505,最理想的结交方式,60,65,70,69,79,326,C,
”做好人这一句我深深地记住了，也觉得做到了，感谢她[B他]那一天的教训吧！,200505332529100001,泰国,1,200505,父母是孩子的第一任老师,60,55,71,67,54,288,未参加,
尊敬的李文先生：您好，本人×××近日在报刊上看见贵公司的招聘启事。,200509534519250010,马来西亚,2,200509,一封求职信,70,85,66,60,75,348,C,
本人求学时期曾到过韩国做短期的文化交流生，对当地的风俗人情有相当的了解。,200509534533250017,新加坡,2,200509,一封求职信,80,85,75,58,79,371,B,
我本人也喜欢看书。,200509534533250038,新加坡,2,200509,一封求职信,60,75,75,58,66,320,C,
对于贵公司刊登于新报上的征聘广告{CQ中}的导游一职，本人深感兴趣。,200509534533150051,新加坡,1,200509,一封求职信,95,90,84,89,95,452,A,
求学期[B其]间还是学生会主席，有着丰富的领导经验。,200509534533150105,新加坡,1,200509,一封求职信,85,80,86,75,95,414,B,
至今，我到过的国家多达二十个，其中还包括了中国、美国和澳洲等国家。,200509534533250134,新加坡,2,200509,一封求职信,70,70,63,66,82,339,C,
在这期间，我也掌握了英语的正确使用，加深{CQ了}我对英语的的认识。,200509534533250136,新加坡,2,200509,一封求职信,75,70,88,66,84,372,B,
本人今年二十五岁，在本地出生及成长，在二零零零年从东京大学毕业。,200509534533250174,新加坡,2,200509,一封求职信,55,70,75,69,91,344,C,
人们都有自己所喜欢的歌手或歌曲，其中我也喜欢流行歌曲的那一类。,200510111523200416,韩国,2,200510,我看流行歌曲,65,55,58,42,59,261,未参加,
我觉得流行歌曲也算是个现在的时尚，因为年轻人喜欢追时尚所以很多年轻人喜欢流行歌曲。,200510111523200434,韩国,2,200510,我看流行歌曲,70,45,86,65,79,326,未参加,
她的工作特[C]别累，[BC、]特[C]别忙，所以她下班之后回到家只想休息，觉得音乐打扰她的休息。,200510111626200711,瑞典,2,200510,我看流行歌曲,85,95,60,61,74,371,C,
还有睡不着的时候，听一些慢[B漫]的歌曲，就舒服起来，马上能睡觉[BQ，]而且跟朋友一起玩的时候，有我们所喜欢的流行歌曲，觉得更高兴，气氛更好。,200510111523200803,韩国,2,200510,我看流行歌曲,75,75,63,65,74,342,C,
我认为流行[B星]歌曲是一种好听的音乐，因为它正反映着现实的流行和年轻人的想法。,200510111523200866,韩国,2,200510,我看流行歌曲,90,80,77,65,72,379,B,
所以一听就听腻[C]呢，我不喜欢。,200510111523200874,韩国,2,200510,我看流行歌曲,55,60,44,48,50,238,未参加,
有些人说，听流行歌曲是不好{CJsd}，[BC。]歌词都差不多，它带来的坏处比好处{CC长处}多。,200510111523100896,韩国,1,200510,我看流行歌曲,65,60,58,63,57,286,C,
还有很多的学生追求他们。,200510111523201071,韩国,2,200510,我看流行歌曲,60,65,60,38,37,243,未参加,
在美国有一次流行过[BQ“]死之赞美[BQ”]的歌曲，其声音和歌词古怪，因此美国许多年青人听着这歌开枪自杀{CC自亡}。,200510111523101097,韩国,1,200510,我看流行歌曲,80,60,81,69,84,361,C,
总有一天你会成为这个时代的主人公的！,200510111523101120,韩国,1,200510,我看流行歌曲,95,85,67,75,84,404,B,
第一，{CQ拿}现在流行的歌的歌词来讲吧。,200510111523201123,韩国,2,200510,我看流行歌曲,60,75,70,52,64,307,未参加,
其中有的歌曲是大多数人喜欢[B观]听的，我也有自己喜欢[B观]的，不过那个歌曲不是很受欢[B观]迎的。[BC，],200510111523101277,韩国,1,200510,我看流行歌曲,55,45,35,38,52,202,未参加,
随着社会发展越来越快{CC1扩大}，我们的余暇[B假]生活[C]也有很多种类。,200510111523201347,韩国,2,200510,我看流行歌曲,60,65,44,46,37,235,未参加,
一般来说，流行歌曲听起来非常舒服，歌词啊节奏[B凑]啊都给听众留下深刻的印象。,200510111523201570,韩国,2,200510,我看流行歌曲,70,75,53,59,82,328,C,
所以我希望{CC2想}很多人听现在的流行歌曲，让自己高兴吧！,200510111523201570,韩国,2,200510,我看流行歌曲,70,75,53,59,82,328,C,
这个社会并{CC却}不是由{CC以}年青年来组成的，也不是由{CC以}中老年人来组成的，而{CC就}要以这两部分的人来组成。,200510111523201619,韩国,2,200510,我看流行歌曲,70,70,72,50,59,309,C,
其次，流行歌曲促进{CC帮助}父母和孩子之间的关系。,200510111523201630,韩国,2,200510,我看流行歌曲,60,80,49,52,72,300,未参加,
因为，流行歌曲吗，代表很多年轻人的心愿。,200510111419101651,哈萨克族,1,200510,我看流行歌曲,75,75,56,48,67,311,未参加,
流行歌曲很好听，所以才流行的。,200510111523201847,韩国,2,200510,我看流行歌曲,65,65,37,46,50,247,未参加,
转眼间，孩子已经是一个22岁的女孩了，她独自在异国生活，遇到{CQ了}不同的人，经历了不同的事，每次在做任何一件重要的事的时候，总会想到小时候爸妈的教诲。,200510919501250016,中国,2,200510,父母是孩子的第一任老师,75,85,95,79,99,426,A,
很多人认为，孩子们在学校里接受知识教育、树立良好的行为规范，因此学校里的老师对自己的孩子很重要。,200510919501250019,中国,2,200510,父母是孩子的第一任老师,90,95,89,79,100,451,A,
其实不仅是我，所有的人都{CQ在}很大程度{CQ上}{CD地}被最初{CQ在}身边的人影响。,200510919501150001,中国,1,200510,父母是孩子的第一任老师,95,95,89,82,100,460,A,
而他们{WWJ},200510919919205308,加拿大,2,200510,父母是孩子的第一任老师,80,50,71,82,91,359,未参加,
我妈妈就不同意这些。,200510520520250002,蒙古国,2,200510,我看流行歌曲,65,80,51,40,47,271,未参加,
现在不管[B观]在公共汽[B气]车上，{CQ还是}[#]路上{CJ-zy都}很容易见到，一半的年青人，都拿着随身听，一边走，一边听着，他们都是听流行歌曲。,200510302523100005,韩国,1,200510,我看流行歌曲,80,70,65,38,55,298,未参加,
产生流行{CQ歌}曲的原因不再[B在]是流行歌曲好听，而真正的原因在于有名的歌星。,200510302523100007,韩国,1,200510,我看流行歌曲,75,70,58,52,72,316,C,
那样的话，他也许不感{CD到}兴趣。,200510302523100008,韩国,1,200510,我看流行歌曲,65,50,42,30,42,210,未参加,
随着社会的发展，现在很多{CJX}有流行的歌曲。,200510302523100025,韩国,1,200510,我看流行歌曲,55,60,56,40,50,242,未参加,
这样的一些人不能自己控制自己就会做些想象不到、[BC，]一般人不能理解的事。,200510302523200048,韩国,2,200510,我看流行歌曲,85,70,65,56,69,336,C,
这样不但耽[C]误自己的时间而且最后没有理想的成果。,200510302523200066,韩国,2,200510,我看流行歌曲,75,50,74,52,74,309,未参加,
这就是我对流行音乐的看法。,200510302523100095,韩国,1,200510,我看流行歌曲,65,85,77,65,87,369,C,
歌手只唱新歌，所以古典音乐也在人脑中慢慢消失。,200510302523100128,韩国,1,200510,我看流行歌曲,85,70,74,61,79,360,C,
其次{CC再次}，歌中含有许多“杂乱的东西”。,200510302523100152,韩国,1,200510,我看流行歌曲,90,70,77,54,77,361,C,
每年每月每日都有新的流行歌曲在音乐市场上上市{CC上线}。,200510302523200168,韩国,2,200510,我看流行歌曲,75,80,74,67,87,374,B,
平时，感到孤独、悲哀、难过时，一听流行歌曲，那种感情就消失了，而且流行歌曲给我们带来一些生活的活力和快乐。,200510302523200243,韩国,2,200510,我看流行歌曲,65,75,53,48,77,305,未参加,
这些不但会使我不喜欢而{CQ且}让我产生一种反感。,200510501922100127,美国,1,200510,我看流行歌曲,85,45,60,32,57,263,未参加,
我对流行歌曲{CD这个现象}没有任何[B可]蔑视的态度。,200510627616250003,德国,2,200510,我看流行歌曲,65,50,58,30,69,253,未参加,
关于第一个原因，大部分的现代歌曲都象美国的一样。,200510529529251039,泰国,2,200510,我看流行歌曲,60,60,42,30,45,219,未参加,
我的爸爸，在他过世之前，是很喜欢流行歌曲{CJs}，每天都可以听到他放{CC开}流行歌曲给我们听。,200510540540200001,印度尼西亚,2,200510,我看流行歌曲,80,70,42,24,47,253,未参加,
常言道：“男大当婚，女大当嫁”。,200505680519150015,马来西亚,1,200505,最理想的结交方式,60,70,75,53,84,327,未参加,
那个成绩拿给你们看看。,200104124523100074,韩国,1,200104,一封写给父母的信,75,60,68,54,45,288,C,
那么这次写到这里。{CJ-sy祝},200104124525200116,日本,2,200104,一封写给父母的信,70,50,38,30,36,207,未参加,
我还记得第一次来到北京时，在机场和你们告[B靠]别时的场面，可时间{CJ-sy过得}真快，已经过了四年{CQ了}。,200104124523200259,韩国,2,200104,一封写给父母的信,55,65,68,44,63,277,未参加,
但她用几句汉语来用力说明，大部分{CJ-zxy人}都明白她说[D话]的意思。,200104124523200261,韩国,2,200104,一封写给父母的信,65,60,55,47,56,266,未参加,
距离大概70多公里，两边路{CQ上}都是山和水，{CP当我们到了长城，我们就高高兴兴的走上了长城，整条路都{CJ-sy挤}满着国内外游客。P},200104124529100328,泰国,1,200104,一封写给父母的信,75,80,63,39,56,304,未参加,
我很努力。,200104124523200428,韩国,2,200104,一封写给父母的信,70,75,33,37,31,235,未参加,
我在服装专业{CC专门}学校念书时的成绩也是相当好的。,199200205525200017,日本,2,199200,一封求职信,,,0,0,0,0,未参加,
这次上海和平饭店开了一个服装展会。,199200204616200026,德国,2,199200,一封求职信,,,0,0,0,0,未参加,
那老人死亡以后，这医院另一个大夫提出这个问题[BQ。]因为老人还没有去世，那为什么杀死呢？,199604123525100079,日本,1,199604,如何看待“安乐死”,55,40,27,37,39,174,未参加,
而且，身体和心理[B里]也受不能忍受{CJ+buy到}的痛苦。,199604123523200165,韩国,2,199604,如何看待“安乐死”,60,60,61,61,44,268,未参加,
因{WWJ},199604123525100161,日本,1,199604,如何看待“安乐死”,60,45,48,64,54,249,未参加,
过了几个月，母亲一天比一天瘦弱，没有体力，没有精神，身子的肉都没有了，只是骨头和皮肤，[BC。]简直不成{CC不是}样子了，然后母亲的意识也没有了。,199604123525200191,日本,2,199604,如何看待“安乐死”,90,70,48,42,39,280,未参加,
即使有空与小孩子在一起[BQ，]也不知要和他们说什么。,199610512501250003,中国,2,199610,如何解决“代沟”问题,95,90,91,79,92,446,A,
有的{CJ-zxy孩子}生活可能是太丰富了，家长们过于疼爱，就养成了会顶嘴的坏习惯。,199610512501250004,中国,2,199610,如何解决“代沟”问题,80,80,44,38,53,287,未参加,
这[F這]是我的几点[Y奌]浅见[F見]。,199610512501150007,中国,1,199610,如何解决“代沟”问题,95,90,78,81,94,437,A,
我也并不时袒[B谈]护年青人，但老一代的人该了解[C]我们。,199610550523190003,韩国,1,199610,如何解决“代沟”问题,65,60,73,67,61,309,C,
这个问题[F題]需要很多时间，所以不要着[C]急！,199610550523290019,韩国,2,199610,如何解决“代沟”问题,75,65,36,38,41,242,未参加,
父母和孩子彼此不能了解[C]，因此发[F發]生代沟的问[F問]题[F題]。,199610550523290026,韩国,2,199610,如何解决“代沟”问题,65,65,52,63,53,282,C,
可是我想除了“[BC‘]了解心”[BC’]以外，{CQ还}需要别的方法。,199610550523290026,韩国,2,199610,如何解决“代沟”问题,65,65,52,63,53,282,C,
这件事情很难解决，因为父母跟子女的世代的差异，所以他们之[C]间的想法无疑是不同{CJsd}。,199610550523290076,韩国,2,199610,如何解决“代沟”问题,65,60,36,32,41,217,未参加,
但是，我是个大学生，还有我觉得我的文化水平比他的高得多{CC高}，还有，他是我的父亲。[BC，],199610550523190094,韩国,1,199610,如何解决“代沟”问题,65,65,62,67,67,310,C,
可是也有改善老一代的态度的必要。,199610550523290093,韩国,2,199610,如何解决“代沟”问题,70,70,75,46,65,314,C,
这样妈[F媽]就乐了，也更安心{CQ了}。,199611543501200516,中国,2,199611,如何解决“代沟”问题,85,85,94,75,88,422,A,
在长[F長]辈[F輩]来[F來]看，这[F這]些物质[F質]享受{CJ+zy在他们[F們]眼中}可能{CJ+sy觉[F覺]得}是奢侈品，[BC。]生活中，缺少这[F這]些享受也无[F無]关[F關]痛痒[B痕]。,199611543634200535,英国,2,199611,如何解决“代沟”问题,75,90,41,63,74,337,未参加,
商业[F業]机构[F構]或传[F傳]媒亦应肩负一些道义责任，尽力提倡有利{CQ于}伦[F倫]理的活动。,199611543501100533,中国,1,199611,如何解决“代沟”问题,80,85,75,73,94,401,B,
[BD…]人多了，反而没有水喝了。,199603533533200013,新加坡,2,199603,由“三个和尚没水喝”想到的……,85,90,83,58,82,394,B,
子女大了，不能靠父母，当父母退休后，那就“没水喝了”。,199603533501200026,中国,2,199603,由“三个和尚没水喝”想到的……,90,85,91,79,89,431,A,
在社会中，各个行业都是相辅相成，各个部门都是互为{CQ帮助}的。,199603533501200026,中国,2,199603,由“三个和尚没水喝”想到的……,90,85,91,79,89,431,A,
由“三个和尚没水喝”{CJ-zxy的故事}，使我想到一个问题{CJjy}：当初只有一个和尚时，为了生存，必须每天都要到山底下自己挑水喝，解决{CC决解}喝水的问题，这是自己劳动换回来的成果。,199603533533100046,新加坡,1,199603,由“三个和尚没水喝”想到的……,85,55,63,56,82,328,C,
从这故事中{CJ-zhuy我们}也能了解到责任的重要性。,199603533519100058,马来西亚,1,199603,由“三个和尚没水喝”想到的……,85,90,63,74,77,385,B,
最后老二想起他曾经看过江星酒家，是在新桥路那{CC这}一带，靠近初级法院，附近是一间大众书局。[BC，],199603533519200084,马来西亚,2,199603,由“三个和尚没水喝”想到的……,80,75,74,67,70,357,B,
人脑的某些功[B工]能，开始进入“退休”状况。,199603533533200104,新加坡,2,199603,由“三个和尚没水喝”想到的……,90,75,80,72,96,407,B,
本来的嘛，三个臭皮匠就是一个诸葛亮，既然[L]都是为了喝水，目地本来都是一{CD个}样，坐享其成，各自为己[BQ，]没有合作之心，三个臭皮匠依然是三个臭皮匠，非但没有同坐一条船之众心，反而怀着自救的私心。,199604680519200510,马来西亚,2,199604,由“三个和尚没水喝”想到的……,85,65,69,88,87,383,C,
一段时间{CQ后}，我的朋友谢家和想和我合伙做[B作]饭吃。[BC，],199605104525100014,日本,1,199605,由“三个和尚没水喝”想到的……,65,75,77,74,61,339,C,
在生活当中，我们常常遇到这样的情况。,199605104523200026,韩国,2,199605,由“三个和尚没水喝”想到的……,60,65,69,58,70,305,C,
这样我的汉语水平没有提高，反而{CC2而}降低了。,199605104523200037,韩国,2,199605,由“三个和尚没水喝”想到的……,80,80,69,70,58,349,B,
但[BD，]三个人分担工作的时候，工作的效果比一个人工作、[BC，]两个人工作时更大{CJdp}。,199605104523100041,韩国,1,199605,由“三个和尚没水喝”想到的……,75,75,77,56,63,336,C,
到这时还有一定的勤劳干活的本性，还有{CJ+sy负}责任也明确。,199605104523200042,韩国,2,199605,由“三个和尚没水喝”想到的……,85,65,63,70,65,337,C,
我们[C]{CD的}以前的房间[C]问题呢？,199605104525200080,日本,2,199605,由“三个和尚没水喝”想到的……,60,60,33,45,37,217,未参加,
按照这个故事，我[D们]觉得{CQ在}团体生活当中我们每个人应该发挥自己的积极性，否则团体生活不如个人生活。,199605104523100182,韩国,1,199605,由“三个和尚没水喝”想到的……,70,65,60,67,44,292,C,
为了纠正{CC打破}这样的坏毛病我们应该先跟{CC给}别人主动地交谈，主动地跟同学们打招[C]呼，[BC。]这样才会觉得虽然生活很忙，可是又快乐又幸福。,199605104523200220,韩国,2,199605,由“三个和尚没水喝”想到的……,70,70,71,49,49,297,C,
反过来说，没有缺点就没有优点。,199605104525200233,日本,2,199605,由“三个和尚没水喝”想到的……,70,80,74,88,94,396,B,
像这段文章那样的事情，社会上经常看到{CJ+zxy的事情}。,199605104525100240,日本,1,199605,由“三个和尚没水喝”想到的……,65,60,41,42,65,256,未参加,
由“三个和尚没水喝”想到的是我哥哥的一件事。,199605104525100249,日本,1,199605,由“三个和尚没水喝”想到的……,60,65,38,54,56,256,未参加,
人们己经不善于照应别[C]人，而只善于照顾自己的利[C]益，甚至为了满足自己的利益，有的人欺骗别[C]人，有的人不择手段地伤害别[C]人。,199605104523200258,韩国,2,199605,由“三个和尚没水喝”想到的……,60,65,66,65,75,314,C,
我读这短文{CQ后}马上想到的是年轻人的特征[F徵]。,199605104525200265,日本,2,199605,由“三个和尚没水喝”想到的……,75,65,58,47,58,290,C,
这个传说给我们{CQ的}启示{CC2唤醒的}是什么呢？,199605104523200328,韩国,2,199605,由“三个和尚没水喝”想到的……,80,70,66,58,63,327,C,
三个和[C]尚都高兴极了。,199605104610100357,法国,1,199605,由“三个和尚没水喝”想到的……,55,50,27,42,27,180,未参加,
自己这样的烦恼[B脑]应该自己解决{CC决解}。,199605104523100366,韩国,1,199605,由“三个和尚没水喝”想到的……,55,65,55,49,63,269,未参加,
”,199605104525200365,日本,2,199605,由“三个和尚没水喝”想到的……,70,55,41,51,56,257,未参加,
还有努力研究自己的目的是什么。,199605104523100378,韩国,1,199605,由“三个和尚没水喝”想到的……,65,65,58,42,49,263,未参加,
这虽是一个故事，但说明了一个人，不要只顾[F頋]个人的利益，要考虑全局。,199605104525100392,日本,1,199605,由“三个和尚没水喝”想到的……,90,70,88,65,72,378,C,
我想，这样的情况和试卷上的短文完全一样。,199605550523290014,韩国,2,199605,由“三个和尚没水喝”想到的……,70,65,66,60,61,308,C,
妈妈常教我们处世待人的道理，也不时{CQ地}灌输{CQ给}我们正确的价值观，免得我们不慎走向歪路。,199704123533200107,新加坡,2,199704,记对我影响最大的一个人,95,90,62,65,77,388,C,
我们就立刻向他们道歉。,200110540540250144,印度尼西亚,2,200110,我的童年,70,80,36,37,49,262,未参加,
