错句,作文编码,国籍,性别,考试时间,作文题目,口试分数,作文分数,听力分数,阅读分数,综合分数,总分,证书
有一部分人主张吸烟是个人的自由，想吸烟，就吸烟，也有相当多的一部分[B份]人主张吸烟对身体不好，而且也{CJX}对公众利益的影响很大。[BC，],200405109523100613,韩国,1,200405,吸烟对个人健康和公众利益的影响,65,75,64,60,56,307,C,
根[B跟]据[B局]前边人们的争论，我比较赞成[C]后者的立场。[BC，],200405109523100618,韩国,1,200405,吸烟对个人健康和公众利益的影响,80,60,58,44,61,290,未参加,
为[C]了我们{CQ的}身体，我们都不要吸烟。,200405109523200795,韩国,2,200405,吸烟对个人健康和公众利益的影响,65,70,48,58,66,293,C,
吸烟的人比不吸烟的人容易患癌症等严重疾[C]病，孕[C]妇{CD的}吸烟更不好，不仅对孕[C]妇自己受{CJ-buy到}不好影响，胎儿也受更严重的影响，妈妈{CD的}吸烟很有可能损害胎儿身体的正常机能。,200405109525200790,日本,2,200405,吸烟对个人健康和公众利益的影响,70,75,72,68,73,347,B,
不过吸烟者认为这也算自己的权利，不让{CQ在}公共{CC共公}场所吸烟是轻视吸烟者的权利。,200405109523101160,韩国,1,200405,吸烟对个人健康和公众利益的影响,75,60,64,58,56,299,C,
吸烟就不妨[B访]说百害无益的东西{CJs}。,200405109523201155,韩国,2,200405,吸烟对个人健康和公众利益的影响,55,60,64,68,83,311,未参加,
由此一个人的生活面临严重的障[B章]碍。,200405109523101407,韩国,1,200405,吸烟对个人健康和公众利益的影响,80,75,78,60,70,354,B,
第二：对生孩子{CJ+zxy的时候}的影响。,200405109525200149,日本,2,200405,吸烟对个人健康和公众利益的影响,70,70,72,66,55,321,C,
吸烟除了{CQ对}吸烟的本人{CJ-wy有害}以外，对周围的人也有害。,200405204525200215,日本,2,200405,吸烟对个人健康和公众利益的影响,65,65,55,51,67,287,未参加,
可是我觉得{CQ在}{CD如}电影里看到{CJ-by这种情形}时，看起来越吸越{CJX}心情不安。,200405204525200235,日本,2,200405,吸烟对个人健康和公众利益的影响,60,65,25,32,49,214,未参加,
最近{CD的}青少年的吸烟方法是真不好看，这个问题是{CD在}公共道德上的{CJ-zxy问题}。,200405204525100247,日本,1,200405,吸烟对个人健康和公众利益的影响,65,60,36,39,36,219,未参加,
这样的措施{CC行动}对公众肯定有利的{CJsd}。,200405204525100271,日本,1,200405,吸烟对个人健康和公众利益的影响,65,65,25,49,51,239,未参加,
麻烦你们[BQ，]可以到外边抽吗？,200405204525200272,日本,2,200405,吸烟对个人健康和公众利益的影响,70,70,71,44,54,297,C,
也{CC又}在饭馆里吸烟，饭菜的香味都变成烟味了。,200405204525200369,日本,2,200405,吸烟对个人健康和公众利益的影响,70,60,52,63,72,302,未参加,
我也可以理解，在人口密集{CQ的}街上，行人{CC2走路人}边走边抽烟不一定是好习惯。{CQ在},200405204525100433,日本,1,200405,吸烟对个人健康和公众利益的影响,70,90,68,65,79,365,C,
这个团体的目的是减少边走边抽{CJ-by烟}的人。,200405205525200106,日本,2,200405,吸烟对个人健康和公众利益的影响,60,75,38,51,49,259,未参加,
可是我觉得大概下面的理由是比较多{CJsd}。,200405205525200162,日本,2,200405,吸烟对个人健康和公众利益的影响,65,75,60,44,54,285,C,
一个是短消息里也有的{CC了}严厉的惩罚，用这个规定{CJ-zy可以}防止吸烟，保持干净的城市。,200405201525100053,日本,1,200405,吸烟对个人健康和公众利益的影响,60,65,27,63,56,254,未参加,
以前有些人把“吸烟”作为自己风格的代表，而如今{CC到今}人们对吸烟的观念有所改变。,200405332529200038,泰国,2,200405,吸烟对个人健康和公众利益的影响,65,50,52,30,54,232,未参加,
人生如果就这样结束的话，是否短了一些？,200405332519100053,马来西亚,1,200405,吸烟对个人健康和公众利益的影响,60,70,47,44,56,262,未参加,
怀着一股好奇与冲动，比较积极的一方就会采取下一步骤，找个借口，伺机与对方接触。,200410534533250123,新加坡,2,200410,最理想的结交方式,95,95,55,67,100,411,C,
我想，抽烟[F煙]虽然没有{CJX}和它直接扯上关[F關]系[F係]，但直[F間]接的占着[F著]重要一点[F點]。,200405680519150019,马来西亚,1,200405,吸烟对个人健康和公众利益的影响,85,95,63,81,77,397,B,
在马来西亚，癌症是仅次于车祸的第二号杀手，其死亡人数高居不下，而口腔癌与肺癌便是常见的癌症种类。,200405680519150026,马来西亚,1,200405,吸烟对个人健康和公众利益的影响,65,95,74,85,96,406,B,
男女分班，是在开历史倒车。,200504534533150028,新加坡,1,200504,我对男女分班的看法,70,70,84,62,77,351,C,
时至今日，男女混合式和男女分班式教育却已平分秋色了。,200504534533250108,新加坡,2,200504,我对男女分班的看法,70,80,76,69,73,358,B,
这是因为男女的思想不同。,200504534533150176,新加坡,1,200504,我对男女分班的看法,85,70,70,80,70,366,B,
最重要的人是谁呢？,200505109419200312,哈萨克族,2,200505,父母是孩子的第一任老师,80,75,53,54,76,329,C,
我也觉得父母是孩子的第一任老师。,200505109525100621,日本,1,200505,父母是孩子的第一任老师,60,50,58,67,64,279,未参加,
孩子们不是当妈妈，[BC、]她们想{CD当}养狗、养猫。,200505109525200833,日本,2,200505,父母是孩子的第一任老师,60,55,36,47,38,217,未参加,
父母所做的事情对他们的孩子有一定的影响。,200505109520200918,蒙古国,2,200505,父母是孩子的第一任老师,75,85,60,63,72,348,C,
现在日本的一部分年轻父母没有十分理解“做父母”是怎么回事，没有{CJX}心理上充分{CC十分}准备而做父母。,200505109525201713,日本,2,200505,父母是孩子的第一任老师,70,65,61,77,78,337,C,
爸爸安排我家{CJX}经常去旅游，学习课外的知识。,200505109922102031,美国,1,200505,父母是孩子的第一任老师,80,60,52,39,67,285,未参加,
为此，不是为了考试看古代经典[C]，而是为了培养人{CQ才}精读，也是很好的办法。,200505109525102121,日本,1,200505,父母是孩子的第一任老师,85,60,71,71,80,355,C,
有时候跟孩子一起运动、一起去玩、一起去旅游[C]。,200505109525202434,日本,2,200505,父母是孩子的第一任老师,70,75,61,73,72,340,C,
她的哥哥和母亲的性格差不多[C]。,200505109525202469,日本,2,200505,父母是孩子的第一任老师,65,75,58,59,80,324,C,
孩子看自己父母长大，如果父母没有遵守社会规律（比如，排队）孩子也不遵守。,200505109525202473,日本,2,200505,父母是孩子的第一任老师,60,50,48,59,63,260,未参加,
有父母不就行了吗？,200505109523102613,韩国,1,200505,父母是孩子的第一任老师,80,75,41,47,63,297,未参加,
有个中国{CJX}著名的小故事叫“孟母三迁”[BQ。]孟子是中国一位思[B细]想家。,200505217519100138,马来西亚,1,200505,父母是孩子的第一任老师,75,65,73,59,76,335,C,
“父母是孩子的第一任老师”，这种说法我很同意。,200505204540200573,印度尼西亚,2,200505,父母是孩子的第一任老师,65,45,69,49,69,276,未参加,
如果父母要凭自己的举止行为和好{CC1正义}的榜样影响孩子来面对这社会的败[B贩]坏，是微乎其[B几]微的影响。,200505205533200167,新加坡,2,200505,父母是孩子的第一任老师,60,70,61,53,78,307,未参加,
因为孩子成长的时候是他最容易吸收别人的习惯的时间。,200505275545100095,乌兹别克斯坦,1,200505,父母是孩子的第一任老师,75,65,63,57,72,319,C,
人的一生中，[BC、]寻[F尋]找自己的另一半是很重要的一个环[F環]节[F節]，字面上我们[F們]说[F説]是寻[F尋]找，[BC、]可是一个[F個]自己所爱[F愛]的人、一个[F個]陪伴自己终身的人，仿[F彷]佛[F彿]是冥冥中早已注定的，总[F總]是那么[F麼]奇妙。,200505522522150004,缅甸,1,200505,最理想的结交方式,90,90,73,73,95,419,B,
还有父母爱学习，爱看书这也会引导他们学习的兴趣。,200505209542200083,越南,2,200505,父母是孩子的第一任老师,85,85,56,55,65,341,C,
父母对子女的影响极大，但父母经常没意识到他们所说的话、所做的动作都被孩子听到、看到。,200505206919200029,加拿大,2,200505,父母是孩子的第一任老师,80,75,71,55,74,346,B,
只要父母存在，父母就会不断[B段]地对孩子有重大的影响。,200505206616200124,德国,2,200505,父母是孩子的第一任老师,95,80,65,47,63,346,C,
我今年二十一岁，毕业自新加坡国立大学中文系，拥有荣誉学位。,200509534533250032,新加坡,2,200509,一封求职信,85,75,91,84,95,422,A,
每逢学校假期，父母都会带我到世界各地去旅游。,200509534533250054,新加坡,2,200509,一封求职信,80,60,73,51,82,333,未参加,
在此，本人将简历、文凭、照片和相关的复印文件附[B符]上，还有我的电话：六八一四五二，您{CC1联系人}也可以联系本人的地址：门牌十六号，华东路六段。,200509534519250107,马来西亚,2,200509,一封求职信,75,70,73,60,68,335,C,
我想到贵公司工作是因为贵公司能让我在设计这{CQ个}领域上有很大的发展，也使我有机会在海外工作。,200509534533250139,新加坡,2,200509,一封求职信,70,80,91,80,93,404,B,
素闻贵公司一直是国家旅游业的代表。,200509534519250156,马来西亚,2,200509,一封求职信,70,75,79,77,95,385,B,
我所要应征的职位是{CD一名}经理，我是从哈佛大学毕业于旅游专业{CC2业}的，除此以外，我也曾在米兰啊旅游{CD业}学校深造过。,200509534533150151,新加坡,1,200509,一封求职信,50,70,70,69,82,324,未参加,
因此我希望贵公司能聘请我，一起为贵公司的发展而合作。,200509534533250152,新加坡,2,200509,一封求职信,70,70,82,64,86,360,C,
此致敬礼！,200509534533150166,新加坡,1,200509,一封求职信,65,70,61,66,84,332,C,
我从您的店里看到{CC2看}导游{CC导旅}的招聘启事，所以写这封信正式向贵公司申请这份工作。,200509534533250172,新加坡,2,200509,一封求职信,60,70,88,58,91,352,C,
我在高中时候很喜欢听流行歌曲，甚至当过一名歌手的歌迷。,200510111523200009,韩国,2,200510,我看流行歌曲,60,60,53,40,35,230,未参加,
如果有一个歌手长得好看，对他们来说，唱歌好不好已经不是大的问题。,200510111523100012,韩国,1,200510,我看流行歌曲,75,85,67,54,64,338,C,
每当[F當]我跟家人意见[F見]不合，跟朋友闹[F鬧]翻，亦或是跟男朋友分手时[F時]，都会[F會]想要听[F聽]听[F聽]我喜欢[F歡]的流行歌曲，不管是快歌或者是慢歌都让[F讓]我感觉[F覺]心里[F裏]舒服而且安心。,200510111512200333,菲律宾,2,200510,我看流行歌曲,75,85,77,67,84,381,B,
一件事物能够在社会上流行起来，必定有它的原因和道理。,200510111801200201,澳大利亚,2,200510,我看流行歌曲,95,90,79,83,100,446,A,
我对流行歌曲的看法呢，非常喜欢流行歌曲，因为{CQ从}流行歌曲可以知道人们的情绪[C]、[BC，]经济情况、[BC，]季[B李]节的变[C]化，[BC.]而且人们之间没有什么事也可以交流，就是说一种交流的手段[B断]{CJs}。[BC.],200510111523100794,韩国,1,200510,我看流行歌曲,55,50,46,34,55,219,未参加,
但我更喜欢中国的流行歌曲。,200510111523200793,韩国,2,200510,我看流行歌曲,80,65,67,46,69,315,C,
我感觉喜不喜欢的问题是自由的。,200510111523100825,韩国,1,200510,我看流行歌曲,65,70,44,40,47,252,未参加,
听音乐是为了高兴，解闷等等。,200510111523200833,韩国,2,200510,我看流行歌曲,70,70,67,40,64,299,未参加,
目前，从{CC在}流行歌曲的趋向看，我个人觉得绝大多[B都]数流行歌曲都是面对年轻人制造的。,200510111523200861,韩国,2,200510,我看流行歌曲,60,65,65,61,52,286,C,
听流行歌曲时自己的心情会轻松，怎么不能喜欢听流行歌曲呢？,200510111523201035,韩国,2,200510,我看流行歌曲,70,70,56,36,59,279,未参加,
比如正在谈恋爱的话越来越表现深的感情，有的人分手的话按照流行歌[B哥]曲能变动自己的感情。{CP流行歌[B哥]曲对人们很快乐的气氛[B分]{CJ？},200510111523101055,韩国,1,200510,我看流行歌曲,60,60,53,34,47,236,未参加,
。,200510111523101055,韩国,1,200510,我看流行歌曲,60,60,53,34,47,236,未参加,
那，从现在开始{CQ说说}流行歌曲有什么特点。,200510111523201274,韩国,2,200510,我看流行歌曲,65,65,65,48,69,296,C,
随着现代经济越来越发展，人民的观念也{CQ有了}很大变化。,200510111523201578,韩国,2,200510,我看流行歌曲,65,65,51,34,62,261,未参加,
第二是“恋情歌”，很多的流行歌曲[B由]的内容都是男女之间的爱情。,200510111523201620,韩国,2,200510,我看流行歌曲,75,85,56,56,64,329,C,
其实我也不知道，跟他们的想不一样的原因？,200510111523201877,韩国,2,200510,我看流行歌曲,50,50,42,32,42,194,未参加,
是父母给了孩子一个独特的性格。,200510919501150018,中国,1,200510,父母是孩子的第一任老师,85,90,80,71,94,416,B,
世界上，每个人有自己{CQ的}看法{CJX}对流行歌曲。,200510201747100323,坦桑尼亚,1,200510,我看流行歌曲,55,45,23,26,28,154,未参加,
首先[B选]我认为听轻松、[BC，]不要费脑筋[B径]的歌曲{CJ+sy是}对孩子们的精神健康{CD上}有好处。,200510302523200042,韩国,2,200510,我看流行歌曲,75,75,70,54,89,353,B,
听了{CJ+by音乐}以后心情{CC心理}舒畅，心情放松这才是听音乐的目的。,200510302523200124,韩国,2,200510,我看流行歌曲,65,75,51,46,67,291,未参加,
随{CQ着}社会的发展，歌曲也变化了，我们称它流行歌曲。,200510302523100128,韩国,1,200510,我看流行歌曲,85,70,74,61,79,360,C,
我们[C]的周围很多这样的情况。,200510302523200129,韩国,2,200510,我看流行歌曲,65,60,49,48,52,257,未参加,
所以我觉得做流行歌曲的作[B做]曲家要注意，而且{CJ-zhuy长辈}给青少年{CJX}多多教育流行歌曲的好[B优][BQ、]坏处，老师们每天[B母]精心挑选歌曲内容好的音乐给青少年听。,200510302523200210,韩国,2,200510,我看流行歌曲,75,65,65,46,67,305,C,
对经济的发展也好处{CJy}。,200510302523100214,韩国,1,200510,我看流行歌曲,70,65,58,61,59,299,C,
所以我喜欢流行歌曲。,200510302523100214,韩国,1,200510,我看流行歌曲,70,65,58,61,59,299,C,
现在在我们班每个人都有自己喜欢的歌星[BD，]或歌曲。,200510302523200226,韩国,2,200510,我看流行歌曲,60,60,56,36,47,241,未参加,
所以，我们应该要知道{CC识道}这是对人们给好影响{CJ？}。,200510302523200231,韩国,2,200510,我看流行歌曲,65,50,32,20,25,173,未参加,
快或者慢，安静或者兴奋，只说爱[C]情。,200510302523200238,韩国,2,200510,我看流行歌曲,70,65,60,24,35,240,未参加,
我希望，写很多美丽的歌词，给人们幸福的感觉{CC感情}。,200510302523200244,韩国,2,200510,我看流行歌曲,65,75,51,36,64,278,未参加,
现在的社会中，我们会发现{CC找到}很多问题和很多困难，但是提出解决的方案{CQ后}，没有人民群众的鼓励，这个方案是无法实现的，所以充分利用流行歌曲也是一种好的方[C]法。,200510302523200258,韩国,2,200510,我看流行歌曲,55,65,63,65,82,312,C,
作为一个到现在还没有男朋友的我想跟你讲一讲我对最初相识的要求，你想听吗？,200505684542200002,越南,2,200505,最理想的结交方式,80,75,70,71,88,375,B,
在这个日新月异的时代里，社会上不同的男女走在街[D头]上，可说是形形色色，男女之间的关系从古至今{CJ+zy对我来说}有很大的差别{CC差距}。,200505680519250003,马来西亚,2,200505,最理想的结交方式,80,80,66,53,82,353,C,
我希望我们都{CJX}以后也这么互相照[B招]顾，互相爱护{CC爱}。[BC，],200104124523200001,韩国,2,200104,一封写给父母的信,65,75,44,54,56,281,未参加,
亲爱的爸爸、妈妈：你们好！,200104124545100108,乌兹别克斯坦,1,200104,一封写给父母的信,70,80,30,30,56,256,未参加,
爸爸、妈妈！,200104124523200183,韩国,2,200104,一封写给父母的信,75,85,38,47,40,278,未参加,
我以前没想到{CD了}三{CC3}年级这么难学，[BC。]所以最近有点儿难受。,200104124523200183,韩国,2,200104,一封写给父母的信,75,85,38,47,40,278,未参加,
祝你们身体健康！,200104124542200230,越南,2,200104,一封写给父母的信,70,75,60,54,83,331,C,
所以爸爸、妈妈也别担[B但]心我，我已经不是个小孩子{CQ了}。,200104124523200305,韩国,2,200104,一封写给父母的信,70,65,58,73,56,308,C,
还好吗？,200104124525200444,日本,2,200104,一封写给父母的信,70,65,66,54,63,304,C,
尊敬的爸爸、妈妈：你们{CC您们}好，在举笔之际先祝你们{CC您们}身体健康，心想事成。,200104124529200441,泰国,2,200104,一封写给父母的信,85,90,68,82,85,406,B,
有一天，中国朋友请我一起吃饭，他介绍给我好多[BD，]好吃的中国菜。,200104124523200454,韩国,2,200104,一封写给父母的信,65,80,27,23,33,216,未参加,
在课堂上，老师讲的课程几乎都能听懂，他们讲课讲得很有意思，其内容丰富涉及面比较广所以我得到了不少启发与收获。,200104124542100448,越南,1,200104,一封写给父母的信,75,90,66,73,83,381,B,
那么爸爸、[BC，]妈妈再见。,200104124523100463,韩国,1,200104,一封写给父母的信,65,65,38,25,42,219,未参加,
我们要知道很多跟中国有关的知识，{CQ如}历史啊，经济啊，还有跟文学有关的知识{CQ如}文学史啊{WWJ},200104124523200460,韩国,2,200104,一封写给父母的信,60,70,49,32,58,254,未参加,
做{CC作}商业就要看青年人的要求和渴望。,199200204539100038,印度,1,199200,一封求职信,,,0,0,0,0,未参加,
我同意“安乐死”。,199604124523200153,韩国,2,199604,如何看待“安乐死”,70,65,69,74,42,305,C,
例如，我对此还可以这么理解，丈夫之所以帮助妻子自杀，是因为他不愿意看妻子十分痛苦，何况也没有别[C]的办法能够疗[C]好她的病。,199604124635200114,俄罗斯,2,199604,如何看待“安乐死”,55,60,42,25,39,202,未参加,
目前不管是什么样的国家[C]，什么样的社会都出现了这种痛苦而悲[C]哀的事情。,199604124523100139,韩国,1,199604,如何看待“安乐死”,65,65,63,54,44,275,未参加,
我认为为了病人自己可以采取安乐死。,199604124523200345,韩国,2,199604,如何看待“安乐死”,70,60,66,54,52,286,C,
周围的人绝对不会决定。,199604123525100204,日本,1,199604,如何看待“安乐死”,60,70,42,49,49,254,未参加,
我的观点[C]不是赞[C]成自杀，而是听死人的话。,199604123523100292,韩国,1,199604,如何看待“安乐死”,65,60,35,52,39,234,未参加,
这样才叫为人民的法律。,199604123501200335,中国,2,199604,如何看待“安乐死”,65,60,35,49,42,234,未参加,
从另一个方面来看，“安乐死”这个现象不符[B服]合自然发展的逻辑。,199604124635200106,俄罗斯,2,199604,如何看待“安乐死”,60,65,63,52,52,275,未参加,
在这样的情况中“安乐死”是比较人道的。[BC.],199604124636200100,乌克兰,2,199604,如何看待“安乐死”,65,70,53,66,49,288,C,
许[F許]多专[F專]家都认[F認]为[F爲]，如果父母能多花一些时[F時]间[F間]与孩子在一起，将[F將]有助于[F於]两代之间[F間]的关系[F係]。,199610512501150006,中国,1,199610,如何解决“代沟”问题,75,85,83,69,82,387,B,
他（她）们[F們]赶不上现[F現]代的生活方式，所以会引起两代间[F間]的“代沟”问[F問]题[F題]。,199610512501150012,中国,1,199610,如何解决“代沟”问题,80,80,60,57,53,322,C,
代沟，意思是指两代人（父母与子女）之间在行为方式、生活态度以及价值观念等方面存在的差异。,199610512501250013,中国,2,199610,如何解决“代沟”问题,85,95,97,77,90,440,A,
为[F爲]什么[F麽]呢?代沟[F溝]产[F産]生时[F時]，年长[F長]的一方通常比较[F較]固执[F執]，所以不肯让[F讓]步，而且年长[F長]的也拉不下脸[F臉]来[F來]与[F與]年青的沟[F溝]通。,199610512512150014,菲律宾,1,199610,如何解决“代沟”问题,75,90,89,71,74,393,B,
我觉[C]得代沟问题主要产生于如下儿种{CJ-zxy原因}：[BC；]一是成长的背景不一样。,199610550523190002,韩国,1,199610,如何解决“代沟”问题,60,55,49,53,72,270,未参加,
第三，不要说让子女学习。,199610550523190012,韩国,1,199610,如何解决“代沟”问题,80,70,52,46,49,287,未参加,
所以他们情[B请]愿辛苦地劳动挣钱，让{CC给}孩子多学知识。,199610550523190013,韩国,1,199610,如何解决“代沟”问题,60,65,75,67,59,309,C,
第一个方法呢[BQ，]{CD无论}父母、子女两方必须理解[C]对方。,199610550523190017,韩国,1,199610,如何解决“代沟”问题,75,60,46,55,57,279,未参加,
所以父母与[F與]子女剪断了思想，而终[F終]于[F於]发[F發]生父母与子女的互斥现[F現]象；反言之，现[F現]在子女生活得{CC著}安乐[F樂]无[F無]思，不想父母的苦劳与[F與]恩德[C]，而就知道[C]自己。[BC，],199610550523190027,韩国,1,199610,如何解决“代沟”问题,60,70,54,44,41,254,未参加,
就拿我来说吧，我们家包括我一共有四口人，爸、[BC，]妈还有我的妹妹。,199610550523190063,韩国,1,199610,如何解决“代沟”问题,60,80,54,79,59,319,未参加,
就是说不可能完全解决。{CP只要他们之间[B门]有更多的理解，才好了一点儿。P},199610550523190081,韩国,1,199610,如何解决“代沟”问题,70,70,36,44,61,269,未参加,
所以，老一辈{CC老[B车]辈子}和年轻人的思想之[C]间有较[B效]大的差异。,199610550523190100,韩国,1,199610,如何解决“代沟”问题,55,65,33,44,53,232,未参加,
基于[F於]以上种种的不同，以致{CD到}后[F後]辈[F輩]不能了解上一辈[F輩]的生活方式，长[F長]辈[F輩]也不明白晚辈[F輩]的处[F處]事态[F態]度。,199611543501100524,中国,1,199611,如何解决“代沟”问题,80,85,99,73,84,415,B,
以上建议[F議]都是很概要的，若落实[L]到生活里[F裡]面则{CQ要}多为[F為]对方着想，多想对方为何如此，从[F從]而找出办[F辦]法，用一{CQ种}积极[F極]的态[F態]度去处[F處]理就一定可以把问[F問]题解决。,199611543501100505,中国,1,199611,如何解决“代沟”问题,90,85,75,69,78,394,B,
中国的传说大部分[B份]{CJ-zy都}富有教育意义[L]，譬[B辟]如“寓言”这一类的故事更是发人深省。,199603533533200077,新加坡,2,199603,由“三个和尚没水喝”想到的……,80,85,85,76,100,420,B,
对个人、家庭、社会都造成不良的影响，不但毁灭[F滅]自己也影响其他人，[BC。]甚至{CC什甚}整个国家。,199603533533200080,新加坡,2,199603,由“三个和尚没水喝”想到的……,85,70,69,51,75,341,C,
两个人一起玩儿的话好投气。,199603533525200087,日本,2,199603,由“三个和尚没水喝”想到的……,75,70,58,56,54,302,C,
每一个国家都有一个领导人，而每个领导人底下也有着许多的小领导人。,199604680519100512,马来西亚,1,199604,由“三个和尚没水喝”想到的……,90,90,66,70,91,405,B,
他向第二和尚问：“如果一个小村发生了灾难，你{CC他}会怎么做？,199605104922100099,美国,1,199605,由“三个和尚没水喝”想到的……,80,55,49,40,46,256,未参加,
如果一个人单独在危难的情况下，那个人肯定自己变强{CC加强}，什么事都{CQ也}能做到{CD的}。,199605104523100113,韩国,1,199605,由“三个和尚没水喝”想到的……,65,65,74,54,63,305,C,
这个故事的意思，我不太明白。,199605104525200180,日本,2,199605,由“三个和尚没水喝”想到的……,65,60,58,60,68,294,C,
没有责任心，不负责任，不能体贴别人，[BC。]我觉得这样的世界太枯燥[C]了。,199605104525200211,日本,2,199605,由“三个和尚没水喝”想到的……,55,80,55,54,80,310,未参加,
我认为人本是自私的存在。,199605104523200214,韩国,2,199605,由“三个和尚没水喝”想到的……,70,55,69,65,63,306,C,
后来，又来了一个和尚，第一个和尚觉得应该告诉他挑水的地方，不能一个人占便宜[B易]，他们{CC我们}是同甘共苦的，[BC。]所以第一个和尚带后来的{CC了}和尚去挑水了。,199605104525200230,日本,2,199605,由“三个和尚没水喝”想到的……,60,55,46,70,75,287,未参加,
我认为，[BC、]人的秉性是善良的、勤[C]劳的。,199605104525100336,日本,1,199605,由“三个和尚没水喝”想到的……,65,80,60,65,89,347,C,
其次，对于“帮助的心”，我觉得{CC2看}人应该考虑到自己要的时候，别人也要{CJ+zxy的观[C]点}，而且还{CJ-zy应该}考虑到哪怕自己吃点亏，也{CJ-zy要}帮助别人{CJ+zxy的看法}。,199605104525200335,日本,2,199605,由“三个和尚没水喝”想到的……,60,65,74,65,63,310,C,
他本来每天起得很早，可能在这座庙里的和尚之中起得最早吧。,199605104525200342,日本,2,199605,由“三个和尚没水喝”想到的……,70,60,63,70,63,311,C,
