错句,作文编码,国籍,性别,考试时间,作文题目,口试分数,作文分数,听力分数,阅读分数,综合分数,总分,证书
要是有人帮助{CC帮忙}他，心理上依赖{CC2靠}那个人，[BC。]那个人也当然依赖{CC2靠}他了，[BC。]所以工作的成果{CC效[C]果}减少了。,199605104525200019,日本,2,199605,由“三个和尚没水喝”想到的……,65,60,63,56,44,271,未参加,
后来又来了一个和尚，[BC。]他们互相帮助把他们该做的事情都做好{CC1出来}。,199605104523100046,韩国,1,199605,由“三个和尚没水喝”想到的……,55,75,52,63,65,295,未参加,
当然最初用石油的人很少，这阶[F階]段是故事中的第一个和尚{CY}。,199605104525100059,日本,1,199605,由“三个和尚没水喝”想到的……,65,60,58,72,68,306,C,
我想这是不好{CC太坏}的想法，[BC。]对自己的生命很重要的事不可以依靠别人{CJ+zxy的行为}。{CP在社会上的小的麻烦的事即便让别人做也{CJX},199605104525200060,日本,2,199605,由“三个和尚没水喝”想到的……,70,65,63,63,80,327,C,
在世界上没有一个人[L]不愿意[C]享受轻[B清]松的生活。,199605104523100075,韩国,1,199605,由“三个和尚没水喝”想到的……,70,70,60,70,65,323,C,
后来，又来了一和尚，依我看，可能两个人的时候还可以互相协作或者也许两{CC二}个和尚合得来，因此，[BC、]两个人一起下山抬水喝。,199605104525200106,日本,2,199605,由“三个和尚没水喝”想到的……,80,70,74,67,68,349,B,
总的来说，不要怕人多。,199605104523100112,韩国,1,199605,由“三个和尚没水喝”想到的……,70,70,77,67,68,340,C,
他们俩每天跟你们一样，[BC。]所以最后{CC终于}都饿死了。,199605104523200153,韩国,2,199605,由“三个和尚没水喝”想到的……,55,50,55,38,49,226,未参加,
勤[B谨]劳的人多，那国家的将来也{CQ会}很好{CC大}。,199605104523200159,韩国,2,199605,由“三个和尚没水喝”想到的……,65,65,55,54,65,288,C,
由“三个和尚没水喝”我产生{CC2有}这样的想法：[BC。]和尚一个人生活时，因为只能靠自己过日子，所以他天天都不懈地努力工作。,199605104525200244,日本,2,199605,由“三个和尚没水喝”想到的……,65,70,66,67,80,334,C,
我读完“三个和尚没水喝”之后，就回忆起来我刚到中国的生活{CC情节}。,199605104525100263,日本,1,199605,由“三个和尚没水喝”想到的……,60,65,30,49,54,241,未参加,
你们还年轻，而且应该好好儿学习。,199605104525200365,日本,2,199605,由“三个和尚没水喝”想到的……,70,55,41,51,56,257,未参加,
在中国，孩子们看了这篇故事以后会怎么想{CD去}解决的办法呢？,199605104525200381,日本,2,199605,由“三个和尚没水喝”想到的……,70,65,80,65,63,329,C,
”,199605104525100399,日本,1,199605,由“三个和尚没水喝”想到的……,55,70,71,70,63,313,C,
我[C]感到的最后一点{CC一个}是现在我要说的这一点。,199605550523290014,韩国,2,199605,由“三个和尚没水喝”想到的……,70,65,66,60,61,308,C,
现在我们的环境污染{CJ-zxy问题}非常难{CC难以}解决。,199605550523290064,韩国,2,199605,由“三个和尚没水喝”想到的……,65,65,55,51,56,276,未参加,
所[C]以，应该互相帮助。,199605550523290083,韩国,2,199605,由“三个和尚没水喝”想到的……,65,60,44,63,51,266,未参加,
像一般可爱的儿童一样，我也曾经有过那段黄金時代，可是，就好比黄鹤[F鶴]楼的黄鹤[F鶴]，全都飞走了。,200110540540150055,印度尼西亚,1,200110,我的童年,70,95,66,68,81,373,C,
所以他们[F們]就为[F為]我请[F請]了家教，希望可以教我华[F華]语[F語]。,200110540540250062,印度尼西亚,2,200110,我的童年,75,90,77,70,83,389,B,
那儿有好多游[Y遊]乐摊子，有掷皮球套奖摊、丢藤[Y籘]圈、玩把戏、天车[F車]、旋转木马等五花八门的{CC之}玩意儿都有{CJZR}。,200110540540150077,印度尼西亚,1,200110,我的童年,70,95,66,51,83,358,C,
顺祝贵公司业务蒸蒸日上敬安一九三年十二月四日,199312533533200006,新加坡,2,199312,一封求职信,90,75,67,63,73,362,C,
我拥有大学理科学士文凭，由于对旅游有兴趣，因此又继续修读由我国旅游促进局所主办的“导游课程”。,199312533533200019,新加坡,2,199312,一封求职信,90,90,60,70,80,388,B,
×××大牌一一八门牌#07-266武吉巴峇六道新加坡邮区2365快乐家庭旅游公司李文先生：本人于九三年十二月三日在报章上得知贵旅游公司因业务发展需要，招聘员工。,199312533533200055,新加坡,2,199312,一封求职信,80,75,57,63,85,351,C,
×××九三年四月二日,199312533533200095,新加坡,2,199312,一封求职信,90,80,69,78,75,387,B,
*1992年至今：任印尼雅[B邪]加达信心旅游公司业务部经理。,199312533540100115,印度尼西亚,1,199312,一封求职信,90,95,69,61,92,406,C,
我很愿意{CQ在}有希望的贵公司里工作。,199312123525200401,日本,2,199312,一封求职信,60,70,57,54,62,288,未参加,
因为我已符合{CC2满}贵社向我们提的所有的条件。,199312123525100507,日本,1,199312,一封求职信,60,50,39,58,41,228,未参加,
相貌端正，爱说话，性格开朗[B良]。,199312123523200708,韩国,2,199312,一封求职信,55,60,50,36,41,223,未参加,
我今年28岁[BQ，]北京人，北京语[C]言学院的毕业生。,199312123542100924,越南,1,199312,一封求职信,60,60,67,27,48,244,未参加,
除了学导游方面的知识以外，我[C]还会[C]三种外语：英[C]语，法语，俄[B饿]语。,199312123542200925,越南,2,199312,一封求职信,50,50,57,39,43,216,未参加,
本人会等待贵公司联[C]络。,199410550523101902,韩国,1,199410,一封求职信,80,65,62,54,82,332,C,
所以我对[F對]这家公司[BD，]导游工作方面很感兴趣。,199410550523202901,韩国,2,199410,一封求职信,85,60,55,58,75,322,未参加,
本人{CD是}二十八岁，{CQ是}已当兵的韩国男子。,199410550523101904,韩国,1,199410,一封求职信,65,60,43,64,50,265,未参加,
还有去年9月在汉城一所有名饭店做第{CQ一}届中——韩机械[B戒]合作会议翻译{CC通译[F譯[C]]}员[F員]。,199410550523101904,韩国,1,199410,一封求职信,65,60,43,64,50,265,未参加,
有的时候，他对儿子管得特别严{CC严格}，有的时候，他很尊重{CC敬重}儿子的意见。{CP所以我们兄弟特别听父亲的话，我的哥哥们都成为了人材。[BC，]我父亲的爱好是爬山，我小{CC1小孩子},199412123523100094,韩国,1,199412,记我的父亲,65,55,60,50,57,269,未参加,
我的父亲对我与我妹妹总是特别温和。,199412123619100083,罗马尼亚,1,199412,记我的父亲,55,65,62,32,59,255,未参加,
这些[B此]都是我13岁之前{CQ的事}。,199412124727200007,马达加斯加,2,199412,记我的父亲,55,65,46,38,30,216,未参加,
你身体{CJ-zy还}好吧？,199412124635200014,俄罗斯,2,199412,记我的父亲,90,70,65,61,72,351,C,
长大了以后，我爱登山，爱滑雪，爱自然{CD了}。,199412124525200040,日本,2,199412,记我的父亲,55,70,57,71,59,296,未参加,
他平时不爱说话，不过什么事情都还是由他来决定的。,199412124525200044,日本,2,199412,记我的父亲,55,75,62,55,45,277,未参加,
现在回忆起来{CJX}自己的童年时代，我就不知对{CC为}你们对我的爱、[BC，]教养怎么表示感谢。,199412124520200049,蒙古国,2,199412,记我的父亲,60,75,70,63,76,330,C,
那个地方{CJ+sy是}在日本的西南边儿，[BC。]虽然天气比较温暖{CD的}，不过经[C]济不发达[BQ，]贫[C]穷[C]的地方{CJs}。,199412124525200051,日本,2,199412,记我的父亲,65,65,52,48,41,255,未参加,
因为，[BQ“]孩子们都是{CC从}上帝赐{CC借}给我们的。,199412104525100649,日本,1,199412,记对我影响最大的一个人,60,60,39,48,57,246,未参加,
谢谢父母！,199412104523200645,韩国,2,199412,记对我影响最大的一个人,65,65,49,40,59,262,未参加,
她常常用“爱[F愛]”字教育{CC2教}我。,199412104625200369,葡萄牙,2,199412,记对我影响最大的一个人,65,75,70,65,80,342,C,
整天工作18至20个小时。,199412104523100109,韩国,1,199412,记对我影响最大的一个人,60,70,54,65,74,308,未参加,
所谓吃得苦中苦，方为人上人就是一句很好的名言。,199500533533200003,新加坡,2,199500,记对我影响最大的一个人,95,80,78,55,69,373,B,
打算进入吃粉笔这一行列，我想也只有父亲的影响力了。,199500533533200098,新加坡,2,199500,记对我影响最大的一个人,90,90,57,69,84,388,C,
话[F話]說回來，人有权利{CC权[F權]力}选[F選]择[F擇]死亡，也有权利{CC权[F權]力}选[F選]择[F擇]生活下去{CD的}，所以我个[F個]人绝[F絕]对[F對]赞[F贊]成“安乐[F樂]死”合法化，但{CC而}不是强[F強]制执[F執]行。,199511543501200516,中国,2,199511,如何看待“安乐死”,65,85,69,70,82,361,C,
所谓长[F長]寿[F壽]是一种[F種]福气[F氣]，所以有鉴[C]于[F於]此我们[F們]珍[B真]惜自己的生命的，同样[F樣]地也{CC却}[F卻]应[F應]该[F該]尊重别人的生命。[BC，],199511543501200527,中国,2,199511,如何看待“安乐死”,70,80,36,50,55,281,未参加,
在这{CQ种}心态下选择[F擇]了「安乐[C]死」，就不是逃避[C]，而是积极[F極]面对，主动迎战[F戰]，让[F讓]自己活着之时[F時]体现[F現]尊严[F嚴]。[BC，],199511543634100537,英国,1,199511,如何看待“安乐死”,85,90,69,79,97,416,B,
有人说[F說]协[F協]助他人“安乐[F樂]死”是杀[F殺]人的罪行，亦有人认[F認]为[F為]“安乐[F樂]死”是个[F個]人的{CJX}自愿[F願]，协[F協]助的人不应[F應]受到制裁。,199511543634200539,英国,2,199511,如何看待“安乐死”,85,85,67,75,93,400,B,
由于天气不好，别的人就不{CJ-zy再}去海里打鱼，但我爸爸还[C]是冒着风雨，照样去。,199505104525200007,日本,2,199505,记对我影响最大的一个人,75,85,73,65,78,369,B,
打网球、[BC，]打棒球[C]都[C]{CJX}是{CJX}他的拿手，除了这些以外[C]，所有[C]的[C]体育运动他都做得[C]很{CC真}好。,199505104525100029,日本,1,199505,记对我影响最大的一个人,70,80,62,75,65,342,C,
有的比我[C]大二[BD、]三十岁，有的比我[C]还小。,199505104523200035,韩国,2,199505,记对我影响最大的一个人,60,65,78,67,72,325,C,
有时候{CC有一天}他讲{CD了}故事，有时候{CC有一天}讲{CD了}笑话。,199505104523100040,韩国,1,199505,记对我影响最大的一个人,65,60,68,57,39,272,未参加,
留学前，对战争赔偿[C]事情[C]，我认[B任]为我国有责任，[BC。]可并没有想到关于此事{CQ要}与韩国人讨论。,199505104525200057,日本,2,199505,记对我影响最大的一个人,60,75,99,79,72,371,C,
说话全是事实，这[C]倒不是诚恳，是把自己的心倒卖给人家{CD的}。,199505104525200057,日本,2,199505,记对我影响最大的一个人,60,75,99,79,72,371,C,
有一天，她的母亲和弟弟从美国路过日本要回中国。,199505104525200088,日本,2,199505,记对我影响最大的一个人,80,80,83,67,74,376,B,
我自己做的菜味道跟母亲给我做过{CQ的}一样，我要花钱时我也考虑值得不值得，有没有必要。,199505104529200098,泰国,2,199505,记对我影响最大的一个人,70,80,52,57,61,310,C,
P}一年半以前我来中国的时候，我开始练习{CC锻炼}武术。,199505104525200194,日本,2,199505,记对我影响最大的一个人,60,75,23,46,59,249,未参加,
从那时候{CQ起}我一直{CJX}对父亲的感情呢，[BC。]有点变化了，我也爱他。,199505104523100234,韩国,1,199505,记对我影响最大的一个人,70,65,54,53,49,277,未参加,
从外祖父生病开始，我[C]妈妈的苦命也开始了。,199505104523200238,韩国,2,199505,记对我影响最大的一个人,60,70,75,61,74,325,C,
因为我对中国文化、[BC，]风俗和历史[C]很感[C]兴趣[BQ，]我[C]不断地向亚[C]婆[C]问关于这[C]方面的问题。,199505104801100281,澳大利亚,1,199505,记对我影响最大的一个人,75,80,52,34,43,275,未参加,
说[F說]实[F實]在的，离婚比结[F結]婚更难[F難]。,200010512512250012,菲律宾,2,200010,我对离婚问题的看法,80,80,61,55,67,335,C,
其实这个问题可从两[F兩]方面来[F來]分析：婚姻是两[F兩]个人一起快乐生活，既然没有愛情，也就别勉[B免]强[F強]两[F兩]人一起，亦不会难为孩子。,200010602543250001,香港地区,2,200010,我对离婚问题的看法,80,75,70,62,80,358,B,
目前，我们实际上不可能排除所有的噪声。,200005108525200286,日本,2,200005,关于用自然之声取代噪声的建议,70,85,78,83,82,390,B,
（162Z）,200005108523200327,韩国,2,200005,关于用自然之声取代噪声的建议,65,65,45,29,43,231,未参加,
可现在除了农村以外，我很少感到那热乎乎的人情味了。,200005108523200329,韩国,2,200005,关于用自然之声取代噪声的建议,85,65,59,60,59,317,C,
那铃声的音量和小河的流水声的音量一样的话，效果是一样的。,200005108525200330,日本,2,200005,关于用自然之声取代噪声的建议,75,70,50,70,54,308,C,
如果这次的发明普及到世界的话，有一些噪声问题将要解决{CC决解}。,200005108523200338,韩国,2,200005,关于用自然之声取代噪声的建议,65,60,45,60,48,261,未参加,
比如：将刺耳汽车喇叭声换成大海的波涛声，将恼人的电话铃声换成小河的流水声等等。,200005108525100640,日本,1,200005,关于用自然之声取代噪声的建议,65,65,56,47,43,260,未参加,
因为我比较喜欢鸟声，所以我就把电话铃声换成了鸟声。,200005108523100643,韩国,1,200005,关于用自然之声取代噪声的建议,65,70,72,62,56,311,C,
比如说，题目里提出的将汽车喇叭声换大海的波涛声。,200005108525200701,日本,2,200005,关于用自然之声取代噪声的建议,70,80,86,83,82,391,B,
因此，我对城市生活和乡村生活有所了解。,199705104636100184,乌克兰,1,199705,我的城市/乡村生活,80,80,55,60,63,330,C,
我的家庭是住在南部邦闹市里，做着电[F電]器商品的生意，一早便有很多顾[F顧]客在店前等候着来做买[F買]卖，有的买[F買]新的电[F電]器用品，有的拿了发生故障的电器来修理，还有一些拿已买[F買]去的电器来调[F調]换取合用的中意的回去用，店中还有对顾[F顧]客分期付款。,199705529529153005,泰国,1,199705,我的城市/乡村生活,70,75,44,26,32,236,未参加,
不用说日常生活中购买的方便，最主要的{CD还}它提供工作的能力要比乡村大得多{CJs}。,199705610501100002,中国,1,199705,我的城市/乡村生活,90,90,74,79,95,426,A,
当学生的时候，我每日早出晚归，大清早起来，糊糊涂涂的吃了一顿不像样的早餐，就往学校冲去，经常准时到达却永远也不会早到，同学们都说，你就不能早到一些吗？,199705610610200012,法国,2,199705,我的城市/乡村生活,85,80,74,75,82,389,B,
现在我的理想{WWJ}。,199804123525200035,日本,2,199804,学习汉语的苦与乐,65,60,48,37,40,233,未参加,
还有声调问题，[BC。]汉语有4个声调，[BC。]有表示声调的字我们容易念下去。{CD但是},199804123523200122,韩国,2,199804,学习汉语的苦与乐,65,65,33,25,44,216,未参加,
”肯定有一些原因，可我不敢正视现实。,199804124523200299,韩国,2,199804,学习汉语的苦与乐,75,80,51,59,58,314,C,
其实，学汉语也不一定全都是苦的。,199804124625100410,葡萄牙,1,199804,学习汉语的苦与乐,80,65,69,49,74,325,C,
学汉语的苦怎么比得上学汉语的乐呢？,199804123525100496,日本,1,199804,学习汉语的苦与乐,65,65,57,59,58,288,C,
但说到如何看待妻子的回家。,199809542542100003,越南,1,199809,如何看待“妻子回家“,60,60,48,37,64,251,未参加,
哪一个美满幸福之小家庭[BD、]{CJ+zhuy谁}愿[F願]把这美满幸福之家无意中失去？[BC，],199809542542200004,越南,2,199809,如何看待“妻子回家“,55,65,45,50,59,256,未参加,
最近我找到了如何面对挫折{CJ-zxy的方法}。,199904123639100063,阿塞拜疆,1,199904,如何面对挫折,75,65,20,44,39,230,未参加,
我头一次感到挫折的{CJ-zxy时候}是1995年9月，就是{CJ-zhuy我}头一次来中国的时候。,199904123525200113,日本,2,199904,如何面对挫折,65,75,48,52,46,273,未参加,
于是在骄傲中，我开始自我放纵，整天只想到吃喝玩乐，对功课置之不理。,199904123730200109,毛里求斯,2,199904,如何面对挫折,85,85,89,88,93,435,A,
这次做不好下次我会做得好，为什么要逃[B挑]避[B壁]呢?[BC。]就像[B象]中国的[BQ“]失败是成功之母[BQ”]，[BC。]这是最好的一句话。,199904123516200200,老挝,2,199904,如何面对挫折,60,65,59,32,56,255,未参加,
我就利用这个机会来中国上大学了。,199904124523100385,韩国,1,199904,如何面对挫折,70,70,48,55,50,281,C,
例如我妈妈得了重病的时候[BQ，]我一定不会让她发现我着[B差]急的样子。,199904124608200464,波兰,2,199904,如何面对挫折,65,70,34,37,48,240,未参加,
