错句,作文编码,国籍,性别,考试时间,作文题目,口试分数,作文分数,听力分数,阅读分数,综合分数,总分,证书
后来又来了第三个和尚，大家都希望別人去山上抬水，于是，人多了，反而没有水喝了。[BC，],199605529529250148,泰国,2,199605,由“三个和尚没水喝”想到的……,60,65,44,51,46,249,未参加,
后来一家人又到了法国。,199704123610100102,法国,1,199704,记对我影响最大的一个人,65,80,78,82,84,377,B,
父亲是一个知识分子[B份]子。,199704123533200109,新加坡,2,199704,记对我影响最大的一个人,95,85,78,80,88,424,A,
在跟她相处的那段时间里，我学到了不少东西，并把我的自私、冷淡[B谈]等都抛在一边。,199704123610200138,法国,2,199704,记对我影响最大的一个人,85,85,53,71,68,357,C,
他让我什么情况下也{CQ得}微笑。,199704124525200319,日本,2,199704,记对我影响最大的一个人,70,80,70,80,77,367,B,
我也因此带着这种内心的缺憾走过我的童年。,200110540540250030,印度尼西亚,2,200110,我的童年,70,80,77,77,90,384,B,
因此，我是没{CC不}上一年级的，[BC。]第二年才上二年级。,200110540540150098,印度尼西亚,1,200110,我的童年,75,85,68,70,85,376,B,
目前，我是大好旅游公司的经理。,199312533533100012,新加坡,1,199312,一封求职信,95,85,78,70,92,418,B,
我担任此职位已有三年的时间，在这期间，我将该公司的业务成绩提高了百分之三十五{CD个八仙率}。,199312533533100012,新加坡,1,199312,一封求职信,95,85,78,70,92,418,B,
本人五年前毕业于新加坡国立大学之商业管理系。,199312533533200050,新加坡,2,199312,一封求职信,90,80,62,67,75,369,B,
目前担任三种语言的补[F補]习家庭教师{CC老师}。,199312533540200113,印度尼西亚,2,199312,一封求职信,80,90,67,78,94,404,B,
我看完[C]{CD对}公司的招聘启事后，我对贵公司有很感兴趣[C]{CJy}。,199312104523100017,韩国,1,199312,一封求职信,60,50,62,34,39,225,未参加,
我曾看到您公司招聘启事。,199312123525100201,日本,1,199312,一封求职信,50,55,34,56,36,209,未参加,
对女导游[C]的职位，我有很[C]大的兴趣。,199312123919200918,加拿大,2,199312,一封求职信,60,55,39,52,48,235,未参加,
当时的经历给我留下了很深的印象。,199410550523202905,韩国,2,199410,一封求职信,95,95,86,75,95,446,A,
后来，全班同学和老师关系{CQ变得}很好了。,199412124525100055,日本,1,199412,记对我影响最大的一个人,65,60,60,53,49,270,未参加,
他也对我说“还小，你知道什么？,199412104523200638,韩国,2,199412,记对我影响最大的一个人,60,55,60,63,53,272,未参加,
用难听的话{CC4坏话}说，是个{CQ把别人的话当}耳旁风{CC旁听风}的人。,199412104525200694,日本,2,199412,记对我影响最大的一个人,65,60,78,75,72,333,C,
而且{CJ-zhuy我}是个独生子[BQ，]不得不任性。,199412104525200694,日本,2,199412,记对我影响最大的一个人,65,60,78,75,72,333,C,
就是一次的人生嘛[B吗]！,199412104525200694,日本,2,199412,记对我影响最大的一个人,65,60,78,75,72,333,C,
我的妈妈生完{CC出生}孩子后，休息{CQ了}一段时期。,199412104525200650,日本,2,199412,记对我影响最大的一个人,65,65,62,55,57,288,C,
有的时[F時]候学习的压力让我透不过气来，[BC。]身体也渐渐地不好了[BQ，]很想家，很想放弃学业，[BC。]整天闷闷不乐。,199412104523200662,韩国,2,199412,记对我影响最大的一个人,65,65,70,63,55,302,C,
因为爸爸穿的衣服是很旧式的，我在学校里躲{CQ起来}了。,199412104523100648,韩国,1,199412,记对我影响最大的一个人,65,65,41,46,35,236,未参加,
他总结{CC结论}道[BQ：][B到]所以日本的宋明理学是日本化的产物{CC2产生物}，[BC、]从另一方面来看[BQ，]可以说中国的宋明理学还没有引进到日本。,199412104525100644,日本,1,199412,记对我影响最大的一个人,55,60,68,63,65,292,未参加,
看{CJcd}{CD来}他的样子：[BC，]个子不高，还有一点儿胖。,199412104523100663,韩国,1,199412,记对我影响最大的一个人,55,60,75,48,51,270,未参加,
回到家以后，我把零分的考卷给妈妈看，妈妈看了以后一点儿也不骂{CJ-by我}，反而鼓励我说[BQ：]“孩子，我相[B想]信你。,199412104525100622,日本,1,199412,记对我影响最大的一个人,75,80,81,65,55,347,B,
我最感兴趣的就是学习各地的方言，因为能够学到某处的方言，{CD那}在与人交谈时，可以与[B于]人更有亲切感，而且更像在跟别人{CD在}说话，而不{CQ像}是在念文章。,199409543501200224,中国,2,199409,学习汉语的苦与乐,85,90,88,68,99,427,A,
本来，要学[F學]习[F習]一种外语，对每一个[F個]初学[F學]者来说，都有一定程度上的障碍[C]和苦恼[F惱]，但是只要能把握学习[F習]的方法；在学习[F習]中肯[B垦]求一些趣[C]味，那么[F麼]，不但可以提高学[F學]习[F習]的效率和水平，还可以为[F為]自己增[C]添[C]一些情趣呢{CC吧}！,199409543634200225,英国,2,199409,学习汉语的苦与乐,90,90,76,79,91,424,A,
有时候，我每做一件事，而失败后，我都学我母亲一样{CJZR}，不怕任何困难，可能从小就受到她的影响。,199500533519100016,马来西亚,1,199500,记对我影响最大的一个人,70,65,54,44,53,272,未参加,
可是令人感动的是，他总是很有耐心地批改我在课外时间交给他的文章，同时还亲自拨出时间，仔仔细细地告诉{CD了}我我的文章哪一处需要改进。,199500533533200035,新加坡,2,199500,记对我影响最大的一个人,85,75,73,73,90,388,B,
五年级过后，罗老师继续担任我们六年经的华文老师。,199500533519200092,马来西亚,2,199500,记对我影响最大的一个人,95,90,83,85,92,444,A,
我父亲认为我们应该继续学习华语，就让我们兄弟姐妹在家自修，我们没有一定的温课时间，但每个人都会很好地{CC的}分配时间进修，父亲要求我们平日交谈都用华语，离家时写家信[C]也用华语，[BC。]多听收音机广播[BQ，][BD「]六十年代我们总是收听中国北京电台广播[BD」]，也要我练习中国新闻社播放的新闻记录[F錄]。,199500533540200109,印度尼西亚,2,199500,记对我影响最大的一个人,85,95,78,65,84,403,B,
每逢佳节来临时，总会抽{CC拨}出些时间，告诉我们这些节日的意义和庆祝[C]方式。,199500533533100146,新加坡,1,199500,记对我影响最大的一个人,95,80,89,87,82,429,A,
”遗憾的是，我从上小学起成绩就一直{CC一起}都不理想，可是我对知识的热爱和重视至到今天也没有减少。,199510512501200521,中国,2,199510,记对我影响最大的一个人,90,90,91,75,91,435,A,
再加上，社会的资源有限，[BC.]与[C]其投[C]在[C]一个完全没有希望的人身上，何不把金钱[F錢]、人力、物力，放在更加有建设性的地方呢？,199511543634100506,英国,1,199511,如何看待“安乐死”,75,95,71,70,70,375,B,
P},199511543501100526,中国,1,199511,如何看待“安乐死”,85,95,81,77,99,433,B,
我认为“安乐死”并[F並]不可取。,199511543501200566,中国,2,199511,如何看待“安乐死”,95,85,83,81,93,435,A,
19.3.95致：精美服装公司季翔先生应征[F徵]广[C]告设计师获悉{CC2悉}贵公[L]司[#]聘请[F請]广告设计师，谨[F謹]持书函应征[F徵]，兹将本人履历简略介绍如下：（一）本人目前在天皇广[C]告公司担任广[C]告设计师，拥有十二年商业广[C]告设计经验，尤擅长{CC专长}服装广[C]告设计[BQ。]（二）本人曾于1990年及1993年获[F獲]得国际最优秀金笔广[C]告设[F設]计奖。,199503680519100503,马来西亚,1,199503,一封求职信,75,75,57,58,79,334,C,
盼能高抬贵手，在此铭志于心。,199503680533200535,新加坡,2,199503,一封求职信,75,75,62,54,75,331,C,
一般來说，“[BC「]学[F學]习[F習]”[BC」]本身{CD里[F裡]面}就已经[F經]包含了“[BC「]挣[F掙]扎”[BC」]的[C]意义[F義]。,199505529529100071,泰国,1,199505,学习汉语的苦与乐,75,90,74,70,88,391,B,
再拿他对工作的态[C]度来说，他很认真。,199505104525200007,日本,2,199505,记对我影响最大的一个人,75,85,73,65,78,369,B,
后来妈妈改嫁{CQ给}一个日本人。,199505104523200017,韩国,2,199505,记对我影响最大的一个人,65,85,68,67,69,344,C,
{CP我相信我把这[C]朵花让老师{CC教师}看，他一定会高兴的。P},199505104525200019,日本,2,199505,记对我影响最大的一个人,50,60,52,48,61,251,未参加,
她就[C]是对我影响最大的恩人。,199505104501100025,中国,1,199505,记对我影响最大的一个人,65,70,52,50,45,268,未参加,
随[C]着时[C]间[C]的[C]推移，我[C]到[C]了不大不小{CC不上不下}的年龄[C]。,199505104525200034,日本,2,199505,记对我影响最大的一个人,75,85,68,57,61,339,C,
他用他的做[B作]法提[C]醒我努力学习，[BC、]并且{CC而且}使我丰富地了解{CC理解}社会。,199505104523100042,韩国,1,199505,记对我影响最大的一个人,70,80,89,71,59,359,B,
当然他的学习方面的成绩[B积]非常好，可是我尊敬爸爸的主要原因不在于他出色的成绩[B积][BQ，]而在于他对我的影响。,199505104523100065,韩国,1,199505,记对我影响最大的一个人,70,70,75,65,72,340,C,
她对我们只要求{CC2要}好好学习，身体健[B建]康，能[C]够成为社会上有用的好儿子。,199505104523100075,韩国,1,199505,记对我影响最大的一个人,70,65,70,61,65,317,C,
我在刚刚转学的{CD那}时候，不习惯于新学校的气氛，什么{CJX}做都没有意思，因此我没能交朋友，有的时候被同班同学欺负。[BC.],199505104525100073,日本,1,199505,记对我影响最大的一个人,60,65,54,63,78,303,未参加,
不知{CJ-zy会不会}有人朝我一笑说：”你这个没有男子汉{CJ-zxy气概}的，提自己的女朋友当对你最{CJ-sy有}影响的人，真笨！,199505104523100099,韩国,1,199505,记对我影响最大的一个人,55,50,65,67,63,279,未参加,
我二十岁的时候入大学了。,199505104523100107,韩国,1,199505,记对我影响最大的一个人,65,55,28,59,55,244,未参加,
若别人问我这种{CD的}问题[C]{CD时}，我该说那个人就是我的父亲[F親][BQ。]虽然[L]其他[C]大部分的人也{CJX}对父亲[F親]影响很大，但我相信{CC自信}比别的人对我父亲[F親]的影响{CD很}大{CJZR}。,199505104523100127,韩国,1,199505,记对我影响最大的一个人,50,50,44,38,30,190,未参加,
我非常喜欢他工作的态度，很清廉，格外地努[C]力工作，对老百[F佰]姓很公平。,199505104523100142,韩国,1,199505,记对我影响最大的一个人,70,50,52,40,45,240,未参加,
请你一直看着我吧！,199505104525200190,日本,2,199505,记对我影响最大的一个人,70,80,86,79,67,372,B,
过了一段时间后我们有机会两个人一起去旅游。[BC.],199505104525200204,日本,2,199505,记对我影响最大的一个人,65,65,57,63,61,295,C,
在韩国他本身有{CD了}老家{CC老乡}的朋友[BQ，]所以他过日子过得还可以。,199505104523100227,韩国,1,199505,记对我影响最大的一个人,60,60,65,59,51,277,未参加,
看我在学校成绩很好，他会很高兴地点点头并劝我不要自满，要继续努力，取得更好的成绩。,199505104540200275,印度尼西亚,2,199505,记对我影响最大的一个人,75,70,62,65,76,337,C,
这个公司里边的气氛比我想象得好得多，{CJ-sy是}共有五名{CJ-zxy员工}的一个小公司，外观不太起眼{CC2了不起}，但其实发展速度越来越快，大家很认真地负责{CJ-dy他}自已的任务。,199505104523200290,韩国,2,199505,记对我影响最大的一个人,75,60,52,50,55,278,未参加,
因此，他的责任比别的人大。,199505104523200291,韩国,2,199505,记对我影响最大的一个人,65,50,39,53,49,237,未参加,
可[C]能我[C]的性格像我[C]爸爸的。,199505104525200287,日本,2,199505,记对我影响最大的一个人,60,65,41,75,69,293,未参加,
这全部都{CC就}是父亲给予的培养[BQ，]可以说父亲对我的影响是最大的。,199505104540100289,印度尼西亚,1,199505,记对我影响最大的一个人,70,55,49,32,35,225,未参加,
由于经济状况不佳，{CJ-zhuy我}上学后必须出外工作以帮忙补贴家用；在此情况下成绩低落也就在所难免{CC势所难免}。,199508681519100509,马来西亚,1,199508,记对我影响最大的一个人,75,90,75,79,84,397,B,
当然这些风浪在一位成年人的眼中只不过{CQ是}{CD只}沧海一粟，不值一提。[BC，],199508680519100526,马来西亚,1,199508,记对我影响最大的一个人,85,75,75,77,76,380,B,
宣化上人的教导，对[F對]我一生起了巨大的、良好的作用。,199508680519200534,马来西亚,2,199508,记对我影响最大的一个人,85,75,75,65,76,368,B,
我只能说没有她，就没有今天的我。,199508682519200547,马来西亚,2,199508,记对我影响最大的一个人,85,80,89,71,78,396,B,
比如，红绿灯[F燈]的声音换[B挽]成鸟声，听起来让人感到过路放[B方]心。,200005108523100288,韩国,1,200005,关于用自然之声取代噪声的建议,70,70,70,67,61,326,C,
我们听起来也舒服、好听，也可以用这样的方式提醒人们对保护环境的想法，这就有一举两得的效果，所以我赞同这种观[B关]点。,200005108523200329,韩国,2,200005,关于用自然之声取代噪声的建议,85,65,59,60,59,317,C,
我有一个建议。,200005108525100359,日本,1,200005,关于用自然之声取代噪声的建议,70,60,48,50,67,280,未参加,
但是开始放音乐后奇怪的是人都不着急上车了。,200005108525200395,日本,2,200005,关于用自然之声取代噪声的建议,70,75,80,78,78,370,B,
比如，“叮当[C]”这样的声音钢琴声的话，我们生活中的噪声肯定比现在少得多。,200005108523200629,韩国,2,200005,关于用自然之声取代噪声的建议,70,70,64,65,63,320,C,
我绝对同意环境保护部门的计划，在城市里生活的我，整天听到的是汽车喇叭声之类噪声。,200005108523200651,韩国,2,200005,关于用自然之声取代噪声的建议,75,80,70,88,82,386,B,
朋友的地位身份其实不太重要，只要价[F價]值观相同，互相能认[F認]同对方，这些才是重要的。,199711802543200004,香港地区,2,199711,我选择朋友的标准,85,65,69,67,68,343,C,
当[F當]时[F時]年纪[F紀]小，一下子心直口快，不加思索就道：“文武双全”。,199711802501100022,中国,1,199711,我选择朋友的标准,90,85,74,83,82,411,A,
因为我从小到现在，一直在城市里生活{CD过}{CD了}，虽然我几次去乡村但是每次觉得不太习惯。,199705104523100019,韩国,1,199705,我的城市/乡村生活,65,70,66,60,46,293,C,
第一次上学的时候，汉城的学生的想法新鲜，口语标[F準]，长得好看。,199705104523100055,韩国,1,199705,我的城市/乡村生活,85,70,63,76,72,357,C,
真是太高兴了。,199705104525100081,日本,1,199705,我的城市/乡村生活,65,60,55,67,39,269,未参加,
”这种{CD的}感觉。,199705104523100091,韩国,1,199705,我的城市/乡村生活,80,70,69,76,89,374,C,
这样我们度过日子了。,199705104525200119,日本,2,199705,我的城市/乡村生活,70,50,30,54,54,241,未参加,
我修读[F讀]的是经济学。,199810602634150009,英国,1,199810,如何面对挫折,70,65,78,71,77,347,C,
一是在发音上，二是听力上，三是在翻译上[BQ，]每[B海]天要花[B化]很长时间来{CC为}翻译一篇小文章，真辛苦，四是一直会存在{CQ的}问题就是[BD，]汉字{CJZR}，记汉字，写汉字，有些字是多义{CC2多意思}的，多音的，而有[D有]些汉字一看就懂，而其它，怎么[L]看，怎么[L]记也很难记得{CJ-buy住}这没完没了的汉字，我认为连中国人也不会把全部的汉字都记住{CJba}。,199804123508100146,巴林,1,199804,学习汉语的苦与乐,70,45,42,47,36,221,未参加,
所以很辛苦。,199804123523100193,韩国,1,199804,学习汉语的苦与乐,65,75,51,52,34,264,未参加,
不过，我想写一下在学习汉语过程当中各种各样的经验。,199804123523100220,韩国,1,199804,学习汉语的苦与乐,80,55,54,49,54,278,未参加,
特别是跟中国人说时一定注意发音和声调。,199804123523100244,韩国,1,199804,学习汉语的苦与乐,65,70,75,62,68,326,C,
我刚刚开始学汉语时[BQ，]让我感到最为难的是汉语的发音，一开始练习，我的嘴和舌头累得很，而且有声调，我觉得说汉语好像是唱歌一样。,199804124525200387,日本,2,199804,学习汉语的苦与乐,70,60,63,67,68,313,C,
乐呢？,199804124512200436,菲律宾,2,199804,学习汉语的苦与乐,75,65,51,62,58,298,C,
为什么呢？,199804124523200441,韩国,2,199804,学习汉语的苦与乐,85,85,78,67,80,390,B,
难怪她一时没有回答。,199804124523200459,韩国,2,199804,学习汉语的苦与乐,70,80,72,69,58,339,C,
我继父的病死给我们一家带来了很多的困难。,199904123525100053,日本,1,199904,如何面对挫折,75,75,67,83,89,379,B,
那时的我的选择还是考大学。,199904123525100053,日本,1,199904,如何面对挫折,75,75,67,83,89,379,B,
同事{CC岗[B冈]事}方面[C]，[BC；]也得有感情，处处为别人着想，将人心比已心，这样一定得到同事{CC冈事}们的感情，对自己的工作，也许会有很多的帮助。,199909529529251014,泰国,2,199909,如何面对挫折,65,85,51,54,66,311,C,
