错句,作文编码,国籍,性别,考试时间,作文题目,口试分数,作文分数,听力分数,阅读分数,综合分数,总分,证书
而他们甜蜜地在一起。,200103533533250025,新加坡,2,200103,我对离婚问题的看法,75,85,77,75,70,375,B,
各式各样的游戏都做过。,200110540540250025,印度尼西亚,2,200110,我的童年,70,90,66,63,76,358,C,
但始[B此]终在我心坎里最深刻的是父亲在我十岁那年离开了我和母亲。,200103680519201606,马来西亚,2,200103,我的童年,85,85,64,70,74,373,B,
常感谢母亲让我有机会体会一个不同的童年，那雨天嬉水、[BC，]热天晒被的情景常泛现{CQ在}我的脑海，久久不能忘。,200103680519201612,马来西亚,2,200103,我的童年,85,85,86,83,93,427,A,
我会[B合]等你们的回信。,200104124538200134,伊朗,2,200104,一封写给父母的信,80,65,47,44,45,269,未参加,
你们知道，中国的大学制度与西班牙的大学制度完全不一样。,200104124630200404,西班牙,2,200104,一封写给父母的信,65,75,38,37,49,251,未参加,
现在我已算不出来我们没见面多久{CJX}。,200104124635100402,俄罗斯,1,200104,一封写给父母的信,75,65,49,51,63,290,未参加,
我首[B手]先想说“父亲{CC父母}，母亲！,200105550523250005,韩国,2,200105,一封写给父母的信,70,70,38,42,54,262,未参加,
那时，我上高中二年级，成绩又不那么理想[BQ，]能不能考上大学也是不知道的。,200105550523150015,韩国,1,200105,一封写给父母的信,75,75,71,54,65,330,C,
我为了考大学而离开你们才两个多月{CD了}，但是每天我都想念你们。,200105550523250014,韩国,2,200105,一封写给父母的信,85,75,79,63,65,359,B,
”这是我小时候你们送给我一张世界地图，然后指着那张地图{CQ时}说的。,200105550523250035,韩国,2,200105,一封写给父母的信,70,75,68,56,74,332,C,
好的父母{CD下}有好的女儿。,200105550523250051,韩国,2,200105,一封写给父母的信,70,70,47,49,49,273,未参加,
你去世{CC世去}以后我们家的生活…没得说，苦难极了。,200105550523250298,韩国,2,200105,一封写给父母的信,70,75,38,61,56,289,未参加,
妈妈你不要担心[BQ，]我从来没有脱离过正常的轨道，[BC、]以后{CC向后}也一样。,200105550523250349,韩国,2,200105,一封写给父母的信,70,65,52,54,65,292,C,
俗语说“前三十爱子，后三十爱父”。,200105550523250350,韩国,2,200105,一封写给父母的信,65,70,55,49,49,274,未参加,
你还记得吗？,200105550523250353,韩国,2,200105,一封写给父母的信,65,70,38,44,56,259,未参加,
我真对不起你！{CP从来不知道您那么辛[B幸]苦地挣来{CC钱},200105550523150467,韩国,1,200105,一封写给父母的信,70,60,49,47,47,258,未参加,
我们马上把照相机拿出来拍照拍照{CJcd}。,200105212540200001,印度尼西亚,2,200105,我的一个假期,80,80,80,70,74,376,B,
我在这几年度过的假期当中，印象最深刻的是去年，即2000年的2月，在泰国过的寒假。,200105212525100017,日本,1,200105,我的一个假期,70,75,72,63,68,337,C,
找到车到集美的时候我以为我已经{CQ可以}放心了。,200105212540200041,印度尼西亚,2,200105,我的一个假期,75,75,65,63,48,316,C,
我后悔了为什么来韩国？,200105201525200050,日本,2,200105,我的一个假期,70,70,57,54,41,280,未参加,
我们边吃边喝[BQ，]度过高兴的时间。,200105215525100004,日本,1,200105,我的一个假期,70,65,60,82,74,337,C,
当应该{CC因该}对世界发表自己的意见时，日本人的这个性格是有点不利的。,200105109525200474,日本,2,200105,由“三个和尚没水喝”想到的……,65,80,48,66,82,329,C,
其实，坐上滑杆之前我朋友跟小伙子讨价还价了一气{CD的}，小伙子要25，我朋友说20就够，小伙子反反复复地嘟嚷着大叫：就是25嘛！,200105215525200003,日本,2,200105,我的一个假期,75,80,65,58,72,341,C,
”两个和尚听他说话的时候，不知道为什么他提出这个建议，但是他们觉得无论他能不能喝水对他们来说无所谓，只要他们能喝水就可以了。,200105109525100485,日本,1,200105,由“三个和尚没水喝”想到的……,75,65,70,75,77,349,B,
如果眼前没水了，那么分成三分之一，各人喝[B渴]三分之一就可以了。,200105109525100592,日本,1,200105,由“三个和尚没水喝”想到的……,70,55,61,58,73,301,C,
要这样的情况{CJX}解决{CC决解}的话，应该{CQ在}那个集团中决定领导。,200105109525100708,日本,1,200105,由“三个和尚没水喝”想到的……,60,55,54,62,55,267,未参加,
他很不满意地说：[BQ“]算了，我们今天就不做了，等到什么时候我们班的同学都来咱们再{CC就}做[BQ”]。,200105109542200734,越南,2,200105,由“三个和尚没水喝”想到的……,70,75,54,44,77,309,未参加,
后来又来了第三个和尚，大家都希望别人去山下抬水，于是，人多了，反而没有水喝了。{CJ-zhuy我},200102522522150015,缅甸,1,200102,由“三个和尚没水喝”想到的……,85,90,43,68,82,364,未参加,
我认为对我影响最大的人应该是我的母亲吧。,200203533533250016,新加坡,2,200203,记对我影响最大的一个人,90,80,71,81,88,405,B,
然而，我个人认为此问题绝不能一概而论。,200205204610200022,法国,2,200205,如何看待“安乐死”,80,90,66,76,77,384,B,
第一，接照法律的规定，[BC。]法院判定{CC决定}丈夫犯了故意杀人罪。,200205204525100066,日本,1,200205,如何看待“安乐死”,50,55,27,47,35,193,未参加,
如果这个病人一直睡而不能醒过来的话，谁能选择“安乐死”呢？[BC。],200205204525100177,日本,1,200205,如何看待“安乐死”,65,65,44,56,58,272,未参加,
所以我认为，还是尊重病人自己的意见而决定采不采取安乐死是最好的。,200205212525200016,日本,2,200205,如何看待“安乐死”,80,80,44,63,70,329,未参加,
我听到他的病时心理非常难受{CC2不平衡}，想马上跑回日本。,200205212525200037,日本,2,200205,如何看待“安乐死”,80,75,74,79,77,376,B,
他跟××××一样，明治时代的很有名的作家又是军医。,200205201525200145,日本,2,200205,如何看待“安乐死”,80,80,49,58,46,305,C,
他们[F們]不但没有吸收新观念，却[F卻]把旧[F舊]思想加扣在年青人身上。,200210602801250023,澳大利亚,2,200210,如何解决“代沟”问题,75,75,76,80,79,375,B,
我认为要解决“代沟”的问题，最好的方法就是加强两代人的相互沟通。,200210529529151028,泰国,1,200210,如何解决“代沟”问题,95,80,87,84,93,435,A,
因为现代的年青人有自己的立场，有自己的生活态度，对人生也有自己的观念，他们认为父母亲[F親]太“{CJ+zy老}顽[F頑]固”，太“固执己见”，太保守，不能随[F隨]着[F著]新时[F時]代潮流而上进[F進]，因此，在晚辈[F輩]的眼{CC1眼光}中，父母对他们的管制太严[F嚴]，从而产生对父母反抗的心理[BQ。]而父母呢{CC吗}？,200210540540150097,印度尼西亚,1,200210,如何解决“代沟”问题,65,70,51,58,77,307,C,
他们就成了孩子的父母。,200210540540250114,印度尼西亚,2,200210,如何解决“代沟”问题,75,60,40,38,55,254,未参加,
面对挫折，有的人唉声叹气，怨天尤人，从而变得衰[B哀]弱、[BC，]无能。,200205109542200302,越南,2,200205,如何面对挫折,75,75,84,73,77,374,B,
但是我个人认为这种想法不但对不起把我们培育成人的父母、[BC，]老师，更对不起我们自己！,200205109634200676,英国,2,200205,如何面对挫折,85,80,81,80,84,403,B,
所以，[BC！]这不是一个{CJ-dy简单的}问题，{CQ但}我们可以一起想、[BC，]一起解决。[BC，],200205109540201084,印度尼西亚,2,200205,如何面对挫折,70,60,45,38,48,246,未参加,
其次，有另外一部分人老不怕挫折，而且能把挫折变成动力。,200205109610101076,法国,1,200205,如何面对挫折,80,80,65,71,57,345,B,
我不多说了，暂且搁笔，下次再聊。,200205680519250004,马来西亚,2,200205,一封写给父母的信,85,85,81,69,86,401,B,
我是世上最应感恩的人，因为我的际遇、幸福、环境昨你们{WWJ}……女儿上,200205680519250007,马来西亚,2,200205,一封写给父母的信,75,75,70,79,90,379,B,
我已抵达{CC抵步}一[L]个多月，父亲的感冒想必已经痊愈了。,200205680519250035,马来西亚,2,200205,一封写给父母的信,90,80,75,77,90,407,B,
这部小说中有两{CC一}位我最喜欢的人物就是姜子牙和申公豹[C]。,200305533519250020,马来西亚,2,200305,我最喜欢读的一本书,70,60,44,63,49,271,未参加,
中国是个很有趣的国家。,200304131525200051,日本,2,200304,我学汉语是为了……,70,70,56,68,77,329,C,
可大部分的日本人不会说汉语。,200304131525200104,日本,2,200304,我学汉语是为了……,60,65,53,60,74,295,未参加,
我学好汉语以后，想做用汉语{CQ的}工作，想当中国和日本的桥梁。,200304131525200128,日本,2,200304,我学汉语是为了……,65,80,56,38,40,267,未参加,
如果在日本，可能没有机会跟这么多的外国人接触。,200304131525200147,日本,2,200304,我学汉语是为了……,65,75,47,74,60,308,C,
我学汉语的原因很多，[BC。]最大的原因是为了了解中国的文化{CD的}。,200304131525200151,日本,2,200304,我学汉语是为了……,65,65,27,54,35,230,未参加,
另外，人类是总归{CQ要}跟自己周围的人交流的。,200305576525200012,日本,2,200305,静音环境对人体的危害,75,85,83,60,91,387,B,
另{CJ-dy一}个原因是孤独感。,200305576525200027,日本,2,200305,静音环境对人体的危害,65,65,50,52,60,276,未参加,
当然，很大的噪音是对人体健康有害的。,200305576525200047,日本,2,200305,静音环境对人体的危害,70,80,74,87,88,389,B,
有的国家想禁止在自己的家里{CC2家}吸烟。,200405109922100688,美国,1,200405,吸烟对个人健康和公众利益的影响,65,70,71,56,61,309,C,
让妈妈放心吧！,200405109604201526,奥地利,2,200405,吸烟对个人健康和公众利益的影响,70,75,45,35,50,264,未参加,
不只是对个人身体{CJ-sy有害}，而且{CC2而}对周围人们的身体和健康也{CC都}有着非常大的影[Pyíng]响。,200405109616201811,德国,2,200405,吸烟对个人健康和公众利益的影响,75,90,88,79,82,408,A,
年轻[B青]人知道吸烟对身体不好。,200405109508101863,巴林,1,200405,吸烟对个人健康和公众利益的影响,50,65,28,25,30,179,未参加,
时间长{CQ了}，吸烟会导致肺癌{CC痱[C]艾}。,200405610610150012,法国,1,200405,吸烟对个人健康和公众利益的影响,60,60,74,58,65,299,未参加,
父母乐于助人的孩子也这样。,200505109525200178,日本,2,200505,父母是孩子的第一任老师,75,60,76,67,69,333,C,
小时候在学校在{CC对}同学面前一个人发表{CJ-by讲话}时，特别紧张[BQ，]说一句{CC口}也说不出来，妈听{CQ了}这事情之后无理地{CC的}批评我，[BC、]当时我摸[B莫]不着头脑，一般发生这种事情，母亲是不是该安慰[Pwèi]孩子呢{CC啊}？,200505109525100277,日本,1,200505,父母是孩子的第一任老师,65,55,46,46,57,251,未参加,
而且我很喜欢看小说。,200505109525200283,日本,2,200505,父母是孩子的第一任老师,55,70,37,65,59,270,未参加,
每天孩子亲[C]眼看到，父母怎么对待事情，怎么对待别人。,200505109525200296,日本,2,200505,父母是孩子的第一任老师,65,80,60,79,76,348,C,
我个人认为父母还是最早对孩子的成长[C]产生重大影响的人，他们是孩子的第一任老师。,200505109525200304,日本,2,200505,父母是孩子的第一任老师,65,75,58,54,74,313,C,
我愿意，将来自己也以像他一样的态度来对待自己的孩子。,200505109525200949,日本,2,200505,父母是孩子的第一任老师,60,85,64,62,85,345,C,
当时的我在[C]日本报社里工作。,200505217525200032,日本,2,200505,父母是孩子的第一任老师,65,90,61,63,67,337,C,
因此我原来上每周一次的课变成每周二次的课，专心学游泳。,200505217525200213,日本,2,200505,父母是孩子的第一任老师,70,80,67,65,78,350,C,
所以父母的兴趣爱好、思想观念、行为都能影响{CC看见}自己的孩子。{CP看自己的孩子就{CJ-sy知道},200505204525100052,日本,1,200505,父母是孩子的第一任老师,60,60,52,47,45,246,未参加,
他常常让我[C]读字。,200505204525100088,日本,1,200505,父母是孩子的第一任老师,60,70,54,55,56,280,未参加,
因而父母的兴趣爱好、思想观念、行为举止，[BC、]在孩子心目中打下深深的烙印。,200505204525200073,日本,2,200505,父母是孩子的第一任老师,60,70,56,25,47,243,未参加,
所以我想对此加上{CJ+sy有}些我自己的想法。,200505204525100395,日本,1,200505,父母是孩子的第一任老师,90,55,44,63,74,315,未参加,
拿我来说，我自己认为我这个人受到爸爸的影响。,200505204525200398,日本,2,200505,父母是孩子的第一任老师,60,55,33,49,56,234,未参加,
我非常看得起我父母。,200505204525200445,日本,2,200505,父母是孩子的第一任老师,60,65,39,45,56,248,未参加,
现在回想我在不知不觉中受到了父母的影响。,200505204525200496,日本,2,200505,父母是孩子的第一任老师,70,75,61,59,72,326,C,
第二天早晨，我们坐高速艇船出发去潜水。,200105205525200064,日本,2,200105,我的一个假期,70,75,67,70,63,334,C,
我是作为第一次接受机关的职员，搞接受中国研修生的业务的。,200112576525100004,日本,1,200112,如何面对挫折,70,60,65,67,74,321,C,
当然我也体验过。,200112576525200005,日本,2,200112,如何面对挫折,70,65,60,63,72,316,C,
因为[BD，]这{CQ个}村位于东京{CJX}接近的山丘[B岳]地带，而且东京的夏天又热又湿，不能生产做{CC用}沙拉的素菜，所以夏天也{CJ-zy很}凉快的这{CQ个}村的夏天[BD，]很忙。,200105204525200022,日本,2,200105,我的一个假期,65,65,22,42,52,230,未参加,
我寒假的时候去了老挝。,200105204525200029,日本,2,200105,我的一个假期,65,75,55,39,37,258,未参加,
我展开一张地图看着看着，说道：“好，我去厦门！,200105204525200042,日本,2,200105,我的一个假期,65,75,50,51,70,298,未参加,
如果我{CD会}有时间我只是想睡觉，在房间里休息休息，以前我不会这样过{CJ+by时间}，我只在房间{CQ里}{CJ-zy会}感觉到无聊而且{CC2而}觉得浪费时间。{CP每个周末我{CJ-zy都},200105204525200058,日本,2,200105,我的一个假期,70,70,47,35,59,269,未参加,
对历史感{CC有}兴趣的人有机会可以看一下。,200105204525100095,日本,1,200105,我的一个假期,75,75,50,58,74,322,C,
我真正爱你们，尊重你们。,200105550523250066,韩国,2,200105,一封写给父母的信,75,75,68,56,61,325,C,
亲爱的爸爸、妈妈：[BC。]你们好！,200105550523150089,韩国,1,200105,一封写给父母的信,65,70,36,35,49,241,未参加,
我早就30岁了，不知把现在我的情况向你们说{CJba}，要求你们的理解呢。,200105550523150104,韩国,1,200105,一封写给父母的信,60,60,30,47,54,233,未参加,
亲爱的爸爸，妈妈：[BC。]虽然天气暖和了，早晚{CC早夕}还冷的{CJX}这几天，爸爸，妈妈最近过得怎么样？,200105550523150109,韩国,1,200105,一封写给父母的信,65,65,60,44,61,279,未参加,
所以不太想跟韩国人交朋友。,200105550523250120,韩国,2,200105,一封写给父母的信,65,65,49,49,45,257,未参加,
当时我很担心{CD了}你的健康。,200105550523150147,韩国,1,200105,一封写给父母的信,65,70,49,54,51,275,未参加,
除了{CC只有}您以外谁说这句话呢？,200105550523250153,韩国,2,200105,一封写给父母的信,70,70,52,49,56,285,未参加,
我很担心您。,200105550523250163,韩国,2,200105,一封写给父母的信,70,75,33,32,38,237,未参加,
您知不知道您的儿子多么爱您？,200105550523150167,韩国,1,200105,一封写给父母的信,70,70,27,58,45,258,未参加,
没有你们，我一天都不能活！,200105550523250171,韩国,2,200105,一封写给父母的信,70,70,74,61,63,326,C,
但你们向我{CJX}一句话也没说[BQ，]只能说担心我的健康。,200105550523250190,韩国,2,200105,一封写给父母的信,65,70,52,44,58,275,未参加,
这样的个性经常让我感动了[BQ。]因此，我们之间有矛盾时，有时争吵了，可是一般不是这样。,200105550523250194,韩国,2,200105,一封写给父母的信,65,65,14,37,45,210,未参加,
现在这里好冷呀！,200105550523150204,韩国,1,200105,一封写给父母的信,70,75,68,42,72,316,C,
好象天下只有他们俩[B两]似的[BQ，]甚至[B之]跟父母不常联系。,200105550523250220,韩国,2,200105,一封写给父母的信,70,65,44,35,63,263,未参加,
我这样写信的时候也{CJX}你是很忙吧！,200105550523250228,韩国,2,200105,一封写给父母的信,70,65,52,61,65,299,C,
父亲母亲！,200105550523250230,韩国,2,200105,一封写给父母的信,65,65,44,54,61,273,未参加,
而且我到英国的检桥大学提出了我的研究计划书。,200105550523150235,韩国,1,200105,一封写给父母的信,65,70,41,54,70,286,未参加,
吃，穿都不用担心。,200105550523250232,韩国,2,200105,一封写给父母的信,75,80,66,75,85,372,B,
爱你们。,200105550523250241,韩国,2,200105,一封写给父母的信,65,60,38,37,47,230,未参加,
爸爸，妈妈你们俩为我做出那么多事情，帮助我学习，我有心事都鼓励了我。,200105550523250275,韩国,2,200105,一封写给父母的信,80,75,63,56,63,328,C,
爸爸还说：“我做的菜不好吃吧？,200105550523250275,韩国,2,200105,一封写给父母的信,80,75,63,56,63,328,C,
星期日我有考试，而且下个星期一也有考试，所以我没有打个电话的时间，对不起你们。,200105550523250276,韩国,2,200105,一封写给父母的信,65,65,19,39,40,212,未参加,
几天以前我们过了5月8日。,200105550523250289,韩国,2,200105,一封写给父母的信,70,65,66,42,58,287,C,
为了过这人生第一个难关，我只能把我的全部精力投入到学习事业上，因而我由于精神上，身体上的疲劳，对父母生过不少气。,200105550523150320,韩国,1,200105,一封写给父母的信,75,75,66,73,81,360,B,
我突然想起{CC2想起来}小的时候，[BC。]我当[F當]兵的时候爸妈流眼泪。,200105550523150372,韩国,1,200105,一封写给父母的信,70,75,36,39,45,254,未参加,
我要努力{CD的}。,200105550523250369,韩国,2,200105,一封写给父母的信,65,75,60,73,51,311,C,
我相信[BD，]相信我的你们。,200105550523250369,韩国,2,200105,一封写给父母的信,65,75,60,73,51,311,C,
这使我更坚强，更有自信心。,200105550523250473,韩国,2,200105,一封写给父母的信,85,75,71,65,70,358,B,
妈妈，您最近过得怎么样？,200105550523250475,韩国,2,200105,一封写给父母的信,65,80,63,49,58,303,C,
妈妈，您虽然不跟我和我姐姐说这些话，但我们都知道您的说不出来的一些苦衷。,200105550523250489,韩国,2,200105,一封写给父母的信,80,70,71,47,63,321,C,
我每次向您表示反驳：[BC；]“你这样下去，你这儿子绝对不会成龙{CC2作成子望龙}！,200105550523150521,韩国,1,200105,一封写给父母的信,65,65,52,28,51,245,未参加,
更加美好的假期{CQ会}使我天天过得{CC的}更充满活力的。,200105206525200009,日本,2,200105,我的一个假期,85,80,72,63,63,356,B,
第二，每个人应该具有责任感。,200105109525200006,日本,2,200105,由“三个和尚没水喝”想到的……,70,85,54,44,50,295,未参加,
一是个人的意识问题。,200105109525200064,日本,2,200105,由“三个和尚没水喝”想到的……,70,80,59,60,79,338,C,
没想到，新来的人来参加我们组，竟然{CJ+zy也}给我们添了不少麻烦。,200105109529200211,泰国,2,200105,由“三个和尚没水喝”想到的……,75,70,73,64,84,355,C,
老师对我们说：“所以你们应该首先关心别人，跟朋友不要吵架。,200105109525200246,日本,2,200105,由“三个和尚没水喝”想到的……,65,75,45,62,46,280,未参加,
表面上他们的劳动比别人少，得到了好处，{CD可是}其实，他们一点儿都没有得到好处。,200105109525200316,日本,2,200105,由“三个和尚没水喝”想到的……,70,65,59,66,79,325,C,
为了{CJ-sy提高}这个家餐厅的总体服务，{CJ-zhuy我}跟他们谈过几次。,200105109525200512,日本,2,200105,由“三个和尚没水喝”想到的……,65,70,66,82,79,348,C,
我去！,200105109525100574,日本,1,200105,由“三个和尚没水喝”想到的……,70,70,70,62,97,357,C,
并且那时{CD存}水桶里的水早已干了。,200105109525100641,日本,1,200105,由“三个和尚没水喝”想到的……,85,65,68,66,82,355,C,
在这一点{CQ上}我表示怀疑。,200205217525100013,日本,1,200205,如何看待“安乐死”,70,85,60,63,70,340,C,
”我认为“安乐死”应该是可取的。,200205205525200015,日本,2,200205,如何看待“安乐死”,75,80,58,67,70,341,B,
虽然[BD，]爱莫能助，{CQ但是}可以尽量滿足病人要求，如他们喜欢的食物，叫亲人多接近他，如金钱允许的话，一家人可以让病人出国旅行，享受天伦之乐，也对得起[L]自己的良心和美好记忆[F憶]{CJZR}。{CD如果},200205205533200007,新加坡,2,200205,如何看待“安乐死”,75,80,60,51,77,334,C,
法律是死的，但它是我们定下来的。,200205205525100102,日本,1,200205,如何看待“安乐死”,85,75,85,74,63,374,B,
如果我是那{CC这}位医生，我也许也会那么{CC这么}做。,200205206525200002,日本,2,200205,如何看待“安乐死”,80,75,60,79,80,365,B,
但是应该受到法律{CQ的}制裁。,200205206525100017,日本,1,200205,如何看待“安乐死”,80,70,52,56,51,299,C,
日本现在也开始{CJ-sy讨论}{CD对}安乐死在法律上的问题了。,200205206525200010,日本,2,200205,如何看待“安乐死”,80,75,55,51,51,303,未参加,
目前，因为“安乐死”是不合{CC2异}法{CJsd}，很多不{CJ-sy是}故意犯罪的人当{CJ-buy成了}犯人{CJbei}。,200205206525200042,日本,2,200205,如何看待“安乐死”,60,60,66,60,51,279,未参加,
互相了解[C]是解决“代沟”最有效的方法。,200209550523250020,韩国,2,200209,如何解决“代沟”问题,65,65,81,79,74,348,C,
因为通过一种经历我已经得到了某种方法所以我可以自信地说“代沟[C]”问题不算是永远解决不了的。,200209550523250030,韩国,2,200209,如何解决“代沟”问题,65,65,57,62,70,303,C,
可是互相理解[C]虽说得容易，但却是{CJX}做起来{CC得}{CD很}难。,200209550523250037,韩国,2,200209,如何解决“代沟”问题,65,55,57,57,40,256,未参加,
特别是如今世界流行的‘信息技术’的广泛普及，造成了日益加剧{CJX}的“代沟”问题。,200209550523150054,韩国,1,200209,如何解决“代沟”问题,70,65,69,86,70,346,C,
但，想一想吧！,200209550523250111,韩国,2,200209,如何解决“代沟”问题,65,60,48,59,60,275,未参加,
我们先考虑[C]为什么发生这样的问题呢？,200209550523250130,韩国,2,200209,如何解决“代沟”问题,65,60,36,62,50,256,未参加,
发生这样的事以后，我马上就{CD要}后悔。{CD最近},200209550523250138,韩国,2,200209,如何解决“代沟”问题,65,65,33,54,40,241,未参加,
父母是{CQ为了}让儿女好[BD、]所以{CQ才}说教的。,200209550523250157,韩国,2,200209,如何解决“代沟”问题,65,65,54,52,48,268,未参加,
第一，每个人都要认识{CJ-buy到}别人有自己{CC个自}的个性。,200209550523250191,韩国,2,200209,如何解决“代沟”问题,65,65,51,71,62,298,C,
我认为解决这代沟的问题首先必须{CC必要}{CJ+zy互相}对话。,200209550523250194,韩国,2,200209,如何解决“代沟”问题,65,65,66,49,50,279,未参加,
最重要的部分呢，我们不能{CC要}一下子解决问题。,200209550523250232,韩国,2,200209,如何解决“代沟”问题,65,65,75,69,54,312,C,
人们认为“代沟”这个问题解决[L]的办法是互相了解{CJ+wy是最好的方法}。,200209550523150242,韩国,1,200209,如何解决“代沟”问题,65,55,48,42,48,240,未参加,
因为父母年代的人想外国人没几个干净的，不能对话，不能幸福地生活{CC活}下去。,200209550523250264,韩国,2,200209,如何解决“代沟”问题,70,65,66,71,54,312,C,
“妈妈！,200209550523250315,韩国,2,200209,如何解决“代沟”问题,70,65,51,52,42,266,未参加,
对话是最好的办法。{CJ-zhuy节奏},200209550523250315,韩国,2,200209,如何解决“代沟”问题,70,65,51,52,42,266,未参加,
第二，多谈话、以谈话来拉近互相的代沟。,200209550523150322,韩国,1,200209,如何解决“代沟”问题,65,60,54,64,50,276,未参加,
具有互相{CJX}不同见解的人之间最要紧的是先要理解对方的正确想法。,200209550523250323,韩国,2,200209,如何解决“代沟”问题,70,70,45,79,66,318,未参加,
生长环境不同，怎么能不存在代沟呢？,200209550523250337,韩国,2,200209,如何解决“代沟”问题,70,65,69,84,64,338,C,
其次，为了减少两代人之间的距离，应该努力沟通[B同]感情，使孩子不要害怕或远[C]离父母.而是把父母当成自己的朋友，能够与父母谈心。,200209550501250755,中国,2,200209,如何解决“代沟”问题,70,70,88,76,88,380,C,
