错句,作文编码,国籍,性别,考试时间,作文题目,口试分数,作文分数,听力分数,阅读分数,综合分数,总分,证书
在那儿[F兒]，我便和[B合]我的表兄妹们在屋外放风筝，到小河里去钓鱼[BQ，]及到林里去捕捉小鸟等活动{CJZR}。,200103680519101602,马来西亚,1,200103,我的童年,80,85,61,47,76,343,C,
常常因为逛太久了而遭到大人们的责备。,200103680519201604,马来西亚,2,200103,我的童年,85,90,83,83,100,437,A,
所以很快会再见面。,200104124538200134,伊朗,2,200104,一封写给父母的信,80,65,47,44,45,269,未参加,
我敢说我已经适应{CC适就}了这里的生活，[BC。]可是刚来的时候没有现在这么适应。,200104124545100462,乌兹别克斯坦,1,200104,一封写给父母的信,70,80,41,37,42,260,未参加,
对不起，妈妈。,200105550523150003,韩国,1,200105,一封写给父母的信,70,70,60,63,61,312,C,
开始的时候，他们（特别老年人）很难接受我。,200105610610250209,法国,2,200105,我的一个假期,70,80,57,61,63,321,C,
如果没有你们的恩情{CC爱情}，现在不会有我{CQ这}个人，希望你们长命百岁{CC长寿百岁}，看我多么孝顺你们。,200105550523150007,韩国,1,200105,一封写给父母的信,75,80,74,56,72,348,B,
我呢，今年三月份，长达六个月的国际刑警的训练已经结束了。,200105550523250023,韩国,2,200105,一封写给父母的信,65,70,58,65,76,320,C,
前几年，父亲[F親]，你为了我，为了我的教育费，不得不{CC逸得}去越南。,200105550523250024,韩国,2,200105,一封写给父母的信,65,65,38,18,49,219,未参加,
再见2001年5月12日儿：××,200105550523150032,韩国,1,200105,一封写给父母的信,65,75,60,51,67,305,C,
爸爸每次给我打电话的时候，我真{CQ觉得}对不起你们，[BC。]因为应该我先给你们打电话问候{CD是对}的{CJsd}。,200105550523250040,韩国,2,200105,一封写给父母的信,70,70,66,63,56,313,C,
旁边的我总觉得不好意思。,200105550523150048,韩国,1,200105,一封写给父母的信,70,80,58,47,76,321,C,
我答应你们，以后不会让你们失望，掉眼泪[F淚]，相信我吧！,200105550523250050,韩国,2,200105,一封写给父母的信,65,70,36,42,49,248,未参加,
尊敬的父母：[BC。]{CP最近天气这么热，我希望{CC想}你们一定{CC必}身体健康。P},200105550523250051,韩国,2,200105,一封写给父母的信,70,70,47,49,49,273,未参加,
请到{CD那个时候}忍耐一下。,200105550523150297,韩国,1,200105,一封写给父母的信,70,70,71,56,63,318,C,
但是我的年龄越来越大，相比{CC2比}[D以]以前对父母的想法改变了。,200105550523250335,韩国,2,200105,一封写给父母的信,70,70,49,44,54,275,未参加,
你们在我们的心里{CJ-sy是}一条生命，不会消掉的一线光明。,200105550523250342,韩国,2,200105,一封写给父母的信,70,70,55,61,42,286,C,
这不是民族歧视吗？,200105212525100005,日本,1,200105,我的一个假期,70,85,70,68,81,366,B,
靠山就是一座泰国佛殿，佛殿门口的柱子上镶两条龙，[BC。]还写一些泰国语什么的。,200105212542200008,越南,2,200105,我的一个假期,85,80,65,46,74,343,C,
虽然我来中国以后，已经过了九个月左右，但我还没去过{CJX}旅行，[BC。]觉得有点儿遗憾。,200105201525200014,日本,2,200105,我的一个假期,60,70,52,54,57,278,未参加,
当时我在中国只有{CC过}半年，我的中文不太好，我心里有点儿不安，但是多亏遇到了许多热情的中国人，我过得很愉快。,200105201525200083,日本,2,200105,我的一个假期,70,80,50,49,61,300,未参加,
现在的日本人最应该重视人情味。,200105109525100590,日本,1,200105,由“三个和尚没水喝”想到的……,70,75,68,71,75,348,C,
对他们来说，主要是“玩”，次要是工作，就是社会上自己的任务{CJ？}。,200105109525200606,日本,2,200105,由“三个和尚没水喝”想到的……,70,70,54,62,53,297,C,
我想日本随着步入{CC走入}现代化，{CJ-zy已经}不知道{CD了}互相帮助的重要性，因为日本在经济发展的过程中建了很多高楼大厦，在那里住的人们非常自私，只顾自己的利益忘记了互相帮助的重要性和人与人之间的关系。,200105109525100815,日本,1,200105,由“三个和尚没水喝”想到的……,70,70,61,60,77,326,C,
现在，在地球上有很多环境问题，[BC。]{CQ如}骚音、环境污染、酸性雨等等。,200105109525100859,日本,1,200105,由“三个和尚没水喝”想到的……,65,70,50,69,64,304,C,
所以他们常常叫我们学华文，要[C]增[B参]加知[B智]识，认真[C]学习华文，华文是很重要的，总有一天会{CC为}变成全世界通用{CQ的}。,200102522522250017,缅甸,2,200102,由“三个和尚没水喝”想到的……,70,75,33,44,26,237,未参加,
爸爸他更会忍让兄弟们，以前为公司方面的一些问题{CJ-zhuy我}不服爸爸，但是爸爸从不会跟他们计[B记]较；也不会与他们争吵。,200203522522150007,缅甸,1,200203,记对我影响最大的一个人,85,95,69,56,88,389,C,
身为长女，从小我就必须[F須]为弟妹们树立起好榜样，我必须[F須]是独立坚强且不可犯错{CJsd}。,200203533533250014,新加坡,2,200203,记对我影响最大的一个人,80,70,81,79,86,386,B,
为什么我会说“父亲”是影响我最大的一个人{CQ呢}[BQ？]{CP那是因为在我成长过程中，“父亲”一直在我身边[B过]开导我，教我很多做人的道理[BQ，]处事待人或者遇到困难不要逃避，要面对困难解决困难，他怎么影响我呢？[BC！],200203533533250018,新加坡,2,200203,记对我影响最大的一个人,75,65,43,46,64,280,未参加,
例如{CC假如}，父母，对象，孩子[BD；]等等。,200205204525100044,日本,1,200205,如何看待“安乐死”,70,70,52,45,58,283,未参加,
我希望快制定[BQ.]我认为安乐死是不得不承认的。,200205204525100142,日本,1,200205,如何看待“安乐死”,70,65,27,47,35,230,未参加,
有些国家在法律上{CQ认定实施安乐死}是杀人罪的。,200205212525200016,日本,2,200205,如何看待“安乐死”,80,80,44,63,70,329,未参加,
我认为最重要的是安乐死为了谁这件事。,200205212525200016,日本,2,200205,如何看待“安乐死”,80,80,44,63,70,329,未参加,
本人认为任何一个人除了上帝以外没有权利结束{CD任何}别人的生命。,200205209525100073,日本,1,200205,如何看待“安乐死”,65,60,60,38,49,255,未参加,
在日本也常常提到安乐死的问题，可是还没有结论。,200205201525100144,日本,1,200205,如何看待“安乐死”,80,75,35,33,44,258,未参加,
我觉得这个是因为他们重视人间的生命。,200205201525200147,日本,2,200205,如何看待“安乐死”,80,80,55,56,44,307,C,
我们要敬爱，做一个好榜样[F樣]给他们看，久而久之孩子会从旁看到，很自然的，他们就会成为[F爲]一个好的孩子，那么将[F將]来他们当然会是一位好的青[C]年了。,200210529529251019,泰国,2,200210,如何解决“代沟”问题,70,65,42,60,0,223,未参加,
并[F並]且要学习中国人的传统[D好]习俗。,200210529529251030,泰国,2,200210,如何解决“代沟”问题,70,80,78,76,86,380,B,
他们的年龄相差四五十岁左右。,200210540540150073,印度尼西亚,1,200210,如何解决“代沟”问题,60,70,53,62,79,309,未参加,
”我猜大家曾经听过这么一句话吧。,200205109634200788,英国,2,200205,如何面对挫折,80,80,87,84,70,393,B,
我十分想念你们。,200205680519250009,马来西亚,2,200205,一封写给父母的信,75,85,70,71,78,372,B,
我的室友{CC房友}丽文也经常陪我到图书馆[B管]温[B湿]习功课，与我一起讨论功课上的难题，真是非谢谢他不可。,200205680519250018,马来西亚,2,200205,一封写给父母的信,90,80,57,61,86,369,C,
对于[F於]生活在常年如夏的马来西亚的我来说，这可是新鲜又好奇的经历{CC经验}呢！,200205680519250026,马来西亚,2,200205,一封写给父母的信,85,85,81,77,88,411,B,
后悔的是为什么我总是那样任性[D过][BQ、]伤透你们的心？,200205680519250029,马来西亚,2,200205,一封写给父母的信,80,80,60,65,76,353,C,
从书箱[B相]里拿出这本书之后{CC前}看了一下，没发觉这本书有什么特别，只不过是一本普通的书籍，在我的好奇心{CC好奇}下[BQ，]我终于打开这本书开始看起来，就是这本“我最喜欢读的一本书”——[BC，]《[BC“]我最尊敬的父亲》[BC”]。,200305533533250006,新加坡,2,200305,我最喜欢读的一本书,65,65,47,51,49,261,未参加,
采访被断章取义，整个事件只{CC只有}能用“雪上加霜”来形容。,200305533533150049,新加坡,1,200305,我最喜欢读的一本书,75,65,77,80,70,354,B,
我还喜欢看中国电影，[BC。]看电影后又可以了解一些中国文化、传统习惯、中国的特点等。,200304131525200046,日本,2,200304,我学汉语是为了……,70,75,59,43,63,299,C,
但[BD，]过了这样生活{CJX}一个星期以后，我感到有点儿痛苦。,200304131525100270,日本,1,200304,我学汉语是为了……,65,70,47,35,38,241,未参加,
我回到日本以后，对汉语的兴趣越来越强{CC多}。,200304131525100270,日本,1,200304,我学汉语是为了……,65,70,47,35,38,241,未参加,
”可是越长{CC过}{CJX}时间，越没有注意力{CC集中力}。,200305576525200001,日本,2,200305,静音环境对人体的危害,70,65,74,65,85,345,C,
我每天只用电脑聊天，没有机会接触别人，没有机会说话。,200305576525200016,日本,2,200305,静音环境对人体的危害,70,85,80,76,71,374,B,
所以我认为有声音的环境是正常的，那么没有声音的就是不正常的。,200305576525200034,日本,2,200305,静音环境对人体的危害,70,70,44,63,63,298,未参加,
虽然医生大声提出{CC呼吁}了吸烟伤害身体[B休]{CD了}的说法{CC后果}，很多公司{CQ还是}继续做广告和大量卖他们的产品。,200405109619101291,罗马尼亚,1,200405,吸烟对个人健康和公众利益的影响,55,60,46,46,57,245,未参加,
因此，某市政府出台的新规定，无疑是在解救吸烟的人，同是也解救了无辜{CQ的}不吸烟的人。,200405217533200091,新加坡,2,200405,吸烟对个人健康和公众利益的影响,80,75,85,82,92,405,B,
于是他戒[C]了烟，后来他们生了个白白胖胖的孩子。,200405522522250024,缅甸,2,200405,吸烟对个人健康和公众利益的影响,90,85,77,60,75,384,B,
所以为了人们身体健康，环境整洁，[BC、]空气没有污[F汙]染，{CJ-zhuy我们}一定要努力。,200405522522250034,缅甸,2,200405,吸烟对个人健康和公众利益的影响,65,85,69,60,77,346,C,
“请勿吸烟”这些汉字到处都能看到，吸烟还是不吸烟也开始吸引大家的注意。,200405209608200074,波兰,2,200405,吸烟对个人健康和公众利益的影响,70,60,60,61,58,294,C,
父亲是农村人，母亲是城市人。,200505109525100344,日本,1,200505,父母是孩子的第一任老师,60,65,46,61,47,262,未参加,
除了我以外，别的客人、餐厅的服务员，看起来很不舒服。,200505109525200457,日本,2,200505,父母是孩子的第一任老师,60,60,60,61,71,294,未参加,
所以我们叫自己最熟悉的语言“母语”。,200505109525100543,日本,1,200505,父母是孩子的第一任老师,60,70,71,61,64,311,C,
所以我认为父母是{CD对}孩子最基本{CC2初}、[BC，]最重要{CC2重}的老师。,200505109525200603,日本,2,200505,父母是孩子的第一任老师,75,85,77,72,59,361,B,
但是千万不能忘记，父母对孩子的影响力非常大。,200505109525200693,日本,2,200505,父母是孩子的第一任老师,85,75,85,67,97,401,B,
他们比我多活了二十多年，我不能{CJX}用一辈子的时间{CQ也}学好。,200505109525100728,日本,1,200505,父母是孩子的第一任老师,70,55,60,44,51,264,未参加,
至今我结婚后仍然努力工作。,200505217525200196,日本,2,200505,父母是孩子的第一任老师,85,70,86,77,91,400,B,
虽然父母[C]对孩子的影响比较深，可孩子做[B走]{CJ-buy出}恶[C]行的原因应在孩子的身上。{CP目前日本发生如下一些问题，就是“谁来负责”？[BC？][BC”][BD。]P},200505204525100021,日本,1,200505,父母是孩子的第一任老师,60,60,39,59,65,265,未参加,
如果不负责的话，将来孩子走错他{CC它}的人生。,200505204525200016,日本,2,200505,父母是孩子的第一任老师,70,65,73,69,67,330,C,
这样来说，我认为可以说父母是孩子的[C]第一任老师。,200505204525200032,日本,2,200505,父母是孩子的第一任老师,60,65,41,51,61,261,未参加,
这是[C]我父亲喜欢绘画{CD的}影响来的。,200505204525200264,日本,2,200505,父母是孩子的第一任老师,55,55,52,43,56,241,未参加,
我爸虽然严格，但是平时非常开朗、[BC，]爱讲话的人{CJs}。,200505204525200347,日本,2,200505,父母是孩子的第一任老师,65,90,58,57,61,322,C,
他常常{CJ+sy带}邀请中国朋友我们家交流{CJjy}，所以我还是渐渐对外国有兴趣[B起]了，而且我也特别喜欢中国了。,200505204525200398,日本,2,200505,父母是孩子的第一任老师,60,55,33,49,56,234,未参加,
父母作为第一任{CC1任务}老师，他们并不是教孩子英语或数学的，而他们教的就是，孩子们在学校不能学到的东西。,200505204525200400,日本,2,200505,父母是孩子的第一任老师,75,60,50,63,58,292,未参加,
{CJ-sy是}我父母说的规定，我长大以后也想这样。,200505204525100438,日本,1,200505,父母是孩子的第一任老师,55,70,48,59,52,268,未参加,
每个父母有时候对付这些事情{CJX}觉得{CJ-zy很}麻烦，但是如果这时父母认真地听小孩子的要求，孩子能体会到[C]父母关心我，确认我可以做他们的孩子。,200505204525100500,日本,1,200505,父母是孩子的第一任老师,70,70,58,75,74,335,C,
所以，那个假期虽然{CJ-zy只}做好一件事，但收获是丰富多彩{CJsd}。,200105205525200017,日本,2,200105,我的一个假期,70,80,55,35,52,282,未参加,
我在北大学了一年汉语，通过{CC考上}HSK9级考试。,200112576525200005,日本,2,200112,如何面对挫折,70,65,60,63,72,316,C,
那时候的回忆是最深刻的了！,200105271525100016,日本,1,200105,我的一个假期,65,70,55,51,61,288,未参加,
这种情况下我听到了孩子的哭声{CC声音}。,200105217525200012,日本,2,200105,我的一个假期,70,85,52,37,35,271,未参加,
那次旅行给我留下了非常深刻的印象，通过那次旅行，产生了{CJX}对少数民族的兴趣。,200105271525100096,日本,1,200105,我的一个假期,70,75,72,61,79,346,C,
有观[B欢]光{CJX}{CQ到}哈尔滨[B宾]的宿愿。,200105217525200017,日本,2,200105,我的一个假期,70,85,70,65,85,367,C,
这儿{CD地方}的主要农产品{CC农产物}是做{CC用}沙拉的素菜。,200105204525200022,日本,2,200105,我的一个假期,65,65,22,42,52,230,未参加,
那时候，我还不知道，后来那些日子是对我来说非常难忘{CD的}[BD，]而珍贵{CC珍惜}的，[BC。]因为我外婆后来{CC以后}过了不久{CQ就}去世了，对我们来说非常意外。,200105204525200077,日本,2,200105,我的一个假期,60,70,60,49,59,283,未参加,
那时，每次你们在我的身边照顾我。,200105550523150076,韩国,1,200105,一封写给父母的信,70,75,52,44,51,281,未参加,
我错误的时候，爸不打也不讲大道理。,200105550523250079,韩国,2,200105,一封写给父母的信,75,80,63,65,72,346,C,
你们真不用担心弟弟。,200105550523150130,韩国,1,200105,一封写给父母的信,65,75,44,47,49,267,未参加,
亲爱的爸爸、妈妈我一想你们就感到对不起，尤[B无]其我刚上大学的时候[BQ，]常做让你们但心的事情。,200105550523250142,韩国,2,200105,一封写给父母的信,70,60,33,30,42,220,未参加,
他还是白天睡觉，晚上起来出去，我{CD好好}知道，他本性好，性格好，朋友多，有女朋友也不会搞错的。,200105550523250173,韩国,2,200105,一封写给父母的信,75,65,58,51,47,283,C,
比什么时候{CJbi}，真想看爸爸和妈妈。,200105550523250174,韩国,2,200105,一封写给父母的信,65,65,22,30,29,195,未参加,
我说非要去，去以后马上写信[BQ，]这里很不好的内容的信，现在回头想我有点[F點]过分[B份]。,200105550523250186,韩国,2,200105,一封写给父母的信,60,70,60,51,54,280,未参加,
过两个月我会看您们去的。,200105550523250221,韩国,2,200105,一封写给父母的信,80,75,47,47,83,323,未参加,
您记得{CC住}吗？,200105550523250244,韩国,2,200105,一封写给父母的信,65,60,41,51,45,245,未参加,
但爸[BQ，]我想和你一样的是个有能力的{CJ-zxy人}，而且{CJ-sy是}给别人信心的好人。,200105550523250244,韩国,2,200105,一封写给父母的信,65,60,41,51,45,245,未参加,
我们原来打算这个星期日到你们那儿跟你们吃饭聊天儿等。,200105550523250260,韩国,2,200105,一封写给父母的信,65,70,63,49,51,284,C,
我现在每天在图书馆学习汉语，跟几个同学{CD们}[B门]组织小学术会一起讨论。,200105550523150267,韩国,1,200105,一封写给父母的信,65,75,44,25,51,247,未参加,
因为今年有大学考试嘛[B吗]。,200105550523150317,韩国,1,200105,一封写给父母的信,65,60,11,25,40,184,未参加,
我一个人住在汉城以后，才了解对女儿{CJX}父母的心情。,200105550523250311,韩国,2,200105,一封写给父母的信,70,60,38,44,38,235,未参加,
现在我处在{CC进行}我的人生中又重要又吃力的阶段{CC过程}。,200105550523250377,韩国,2,200105,一封写给父母的信,70,70,52,61,58,299,C,
尤其是对爸爸的态度不好。,200105550523250408,韩国,2,200105,一封写给父母的信,65,65,30,47,51,242,未参加,
到那时候，我想坐火车回老家，[BC。]到我们再见面{CJX}{CD的}那天{CQ吧}！[BC，],200105550523250425,韩国,2,200105,一封写给父母的信,70,70,49,73,61,311,C,
那时候才知道真正的爱{CC1爱情}。,200105550523250455,韩国,2,200105,一封写给父母的信,65,70,58,49,63,291,C,
我下次再告诉旅游故事{CJshb}。,200105550523250481,韩国,2,200105,一封写给父母的信,70,75,36,51,51,272,未参加,
妈妈，祝身体健康，永远幸福。,200105550523250489,韩国,2,200105,一封写给父母的信,80,70,71,47,63,321,C,
我是您儿子××，过{CJ+dy前}几天是韩国的“[BC‘]母亲节”[BC’]。[BC，],200105550523150501,韩国,1,200105,一封写给父母的信,65,65,66,44,42,266,未参加,
我{CJ+zy才}成了真正的大人了。,200105550523250494,韩国,2,200105,一封写给父母的信,75,65,71,47,54,299,C,
我高兴极了，带她去好玩的地方。,200105206525200041,日本,2,200105,我的一个假期,65,70,50,42,52,265,未参加,
我认为，现在社会就是竞[F競]争社会。,200105109525100022,日本,1,200105,由“三个和尚没水喝”想到的……,70,85,70,69,86,372,B,
但从这一段传说看出来的三个和尚的实质{CC态}不一定是适合宗教界的。,200105109525100058,日本,1,200105,由“三个和尚没水喝”想到的……,80,75,68,77,73,364,B,
但是，如果只考虑为了自己一个人的好事情，结果也不好的{CJsd}。,200105109525200028,日本,2,200105,由“三个和尚没水喝”想到的……,65,60,54,55,44,261,未参加,
我不知道和尚的生活是怎么样{CJsd}。,200105109525200111,日本,2,200105,由“三个和尚没水喝”想到的……,65,70,45,64,44,274,未参加,
在人生中，肯定出现很多困难。,200105109525200305,日本,2,200105,由“三个和尚没水喝”想到的……,65,65,45,51,61,271,未参加,
”但现代社会{CD是}人的意识逐渐改变了，因有很多原因我认为教育方面问题是很重要{CJ？}。,200105109525100360,日本,1,200105,由“三个和尚没水喝”想到的……,70,60,39,55,50,259,未参加,
而且我们到了超市，{CD那么}我们四个人可以买到自己喜欢的东西。,200105109525100381,日本,1,200105,由“三个和尚没水喝”想到的……,65,65,59,66,64,303,C,
过了不久，又来了第三个和尚，是一个老和尚。,200105109529200371,泰国,2,200105,由“三个和尚没水喝”想到的……,85,75,63,58,70,343,C,
由“三个和尚没水喝”想到人性的罪[B醉]恶[F惡]，自私及互相依赖的心理，以及现今社会中常出现“人多反误事”的情形。,200105109634200446,英国,2,200105,由“三个和尚没水喝”想到的……,85,80,77,75,84,394,B,
由“三个和尚没水喝”这个故事{CJ-zhuy我}得到{CQ了}很好的启发，就是[BQ：]{CD当}人们在困难的时候都能坚持克服困难，坚强{CC2艰难困苦}地生活着。,200105109540200506,印度尼西亚,2,200105,由“三个和尚没水喝”想到的……,85,85,54,53,77,349,未参加,
我想，和尚的故事里包含的道理也是一样的。,200105109525200515,日本,2,200105,由“三个和尚没水喝”想到的……,70,75,77,69,86,366,B,
教育是国家的根本。,200105109525100538,日本,1,200105,由“三个和尚没水喝”想到的……,75,65,50,55,66,298,C,
空气污染{CD的}严重影响{CQ了}人类的身体，河水也都不能喝了。,200105109525200541,日本,2,200105,由“三个和尚没水喝”想到的……,70,65,45,40,59,265,未参加,
有这么多的人的知识、[BC，]智慧[B惠][BQ，]我们一定会解决的。,200105109525200554,日本,2,200105,由“三个和尚没水喝”想到的……,70,65,63,53,66,303,C,
说：[BQ“]与人方便自己方便。[BQ”],200105109506200644,巴基斯坦,2,200105,由“三个和尚没水喝”想到的……,65,65,43,29,30,216,未参加,
“三个和尚没水喝”的故事也如此。,200105109525100770,日本,1,200105,由“三个和尚没水喝”想到的……,65,65,66,77,68,325,C,
如果他表示在什么样的情况都想活下去的话，任何人{CJ-zy都}没有权利剥夺{CC停止}他{CD的}“活”的权利。,200205217525200084,日本,2,200205,如何看待“安乐死”,70,80,83,60,51,334,C,
最后，我觉得“安乐死”{CJ+zhuy这}不是国家的问题，而是我们人民的问题。,200205206525100003,日本,1,200205,如何看待“安乐死”,75,70,52,56,51,293,C,
安乐死这个难题，难就{CC是}难在其定义上，同时这个问题会涉及到“死亡”的概念。,200205206525200082,日本,2,200205,如何看待“安乐死”,75,70,63,81,77,355,C,
我们可知道，在他妻子向他提出这个要求的时候，他起初也许不同意，因为{CQ对}一个与自己一生{CJX}同甘共苦的妻子，谁能忍心下手[BD，]去做这么一件{CC个}无良知的事？[BC。],200205332513100014,柬埔寨,1,200205,如何看待“安乐死”,75,80,63,56,84,349,C,
但是，现在的我，都理解{CC了解}他们的话{CC1说话}。,200209550523250002,韩国,2,200209,如何解决“代沟”问题,60,60,27,47,29,205,未参加,
”但是，这样的情况下我的心情很难过。,200209550523250025,韩国,2,200209,如何解决“代沟”问题,65,65,57,40,48,259,未参加,
所以他们的意见{CC见意}相当部分有道理{CC理所}。,200209550523250034,韩国,2,200209,如何解决“代沟”问题,65,60,54,67,50,279,未参加,
很多人感觉到“代沟”问题。,200209550523250036,韩国,2,200209,如何解决“代沟”问题,60,60,63,49,42,256,未参加,
我想能解[C]决这两代人之间存在的“代沟”问题的唯一的办法就是“对话”。,200209550523250044,韩国,2,200209,如何解决“代沟”问题,65,60,66,54,52,280,C,
然后，慢慢开始{CJ-sy说}互相之间想说的矛盾或建议。,200209550523250046,韩国,2,200209,如何解决“代沟”问题,60,65,63,52,64,287,未参加,
周末也不例外。,200209550523150085,韩国,1,200209,如何解决“代沟”问题,60,75,45,57,62,285,未参加,
反过来[BQ，]最近的年青人从来不知道[C]吃苦是什么。,200209550523250148,韩国,2,200209,如何解决“代沟”问题,65,75,78,69,74,348,B,
我哥哥已[B巳]经大学毕业了。,200209550523250159,韩国,2,200209,如何解决“代沟”问题,60,70,24,42,42,223,未参加,
为什么现在{CJ-sy能}解决那时候的年轻[B经]人和老年[C]人的对立？[BC。],200209550523250178,韩国,2,200209,如何解决“代沟”问题,65,60,60,54,42,264,未参加,
2002年9月1日,200209550523250182,韩国,2,200209,如何解决“代沟”问题,70,65,57,67,56,301,C,
那么，这样的“代沟”是怎么产生{CC发生}的，还有怎样解决呢？,200209550523250190,韩国,2,200209,如何解决“代沟”问题,65,65,57,64,50,285,C,
真是[B吃]的。,200209550523250191,韩国,2,200209,如何解决“代沟”问题,65,65,51,71,62,298,C,
所以我们应该知道的是两代人根[B据]本[C]不一样。,200209550523250192,韩国,2,200209,如何解决“代沟”问题,60,65,60,67,64,299,C,
比如说在爱好方面，拿{CC对}我来说吧。,200209550523250193,韩国,2,200209,如何解决“代沟”问题,60,60,36,45,40,223,未参加,
谁都经历{CC经验[C]}过[C]{CD的}。,200209550523150199,韩国,1,200209,如何解决“代沟”问题,65,70,45,52,48,266,未参加,
我觉[C]得我[C]们首先[BD，]{CJ-sy应该}认识双方{CC对方}的差别是一个很重要[L]的条件。,200209550523150199,韩国,1,200209,如何解决“代沟”问题,65,70,45,52,48,266,未参加,
现在他们俩过得很好。,200209550523250222,韩国,2,200209,如何解决“代沟”问题,70,60,60,52,38,265,未参加,
