错句,作文编码,国籍,性别,考试时间,作文题目,口试分数,作文分数,听力分数,阅读分数,综合分数,总分,证书
但随着周围环境的变化[BQ，]很多年轻子女们追流行是很平常的事情，很多父母们也可能{CJX}他们年轻时追过流行所以应该理解{CC了解}子女。,200209550919150902,加拿大,1,200209,如何解决“代沟”问题,65,70,39,57,52,269,未参加,
父母与[F與]小孩子之间[F間]的代沟[F溝]，双[F雙]方必须[F須]试[F試]着[F著]去了解彼此的生活。,200209550523250910,韩国,2,200209,如何解决“代沟”问题,90,80,60,64,76,365,C,
她常常说，女人应该尊重男人。,200209550523250918,韩国,2,200209,如何解决“代沟”问题,70,80,54,52,44,290,未参加,
那么，可能会容易解决“代沟”问题，他们与上一辈之间的沟通与交流的困难也会减少。,200209550523250928,韩国,2,200209,如何解决“代沟”问题,65,60,48,47,44,247,未参加,
长者一定有过小时[F時]间。,200209550523150937,韩国,1,200209,如何解决“代沟”问题,65,65,57,64,42,277,未参加,
我感觉{CD得}这样的办法对孩子也有教育方面的好处。,200209550523250961,韩国,2,200209,如何解决“代沟”问题,65,65,48,59,44,265,未参加,
别说{CC别是}自己父母，就是各种方面的人都会给我很{CJ-zxy多}帮助。,200209550523250969,韩国,2,200209,如何解决“代沟”问题,75,65,51,69,72,319,C,
“安乐死”是在病人去世之前，为了解脱病人的痛苦而帮助病人自杀，或者特意进行“特殊”治疗[F療]而导致病人死亡的行为。,200205271525100021,日本,1,200205,如何看待“安乐死”,70,85,49,85,87,368,C,
根据[F據]科学家的研究发现，我们知道了静音环境对人体的危害，我赞[B占]成这[B這]个意见，也赞[B占]成噪声对人体健康的危害。,200304522522250002,缅甸,2,200304,静音环境对人体的危害,65,75,39,47,59,272,未参加,
爸妈去他[B丧]家帮忙{CC2问长问短}。,200304522522250011,缅甸,2,200304,静音环境对人体的危害,70,65,45,39,54,259,未参加,
现在有很多慈善家[C]援[Pyuàn]助这[C]些国家。,200307109523100066,韩国,1,200307,绿色食品与饥饿,65,65,70,62,67,313,C,
由于世界各地发展程度的不同，很多人正在讨论[BQ“]绿色食品[BQ”]与饥饿的矛盾性问题。,200307109523200089,韩国,2,200307,绿色食品与饥饿,65,90,80,67,87,380,B,
人们{CJ-zy都}认为自然是无限[C]度的，但这是不对的，自然明明是有限[C]的。,200307109523200092,韩国,2,200307,绿色食品与饥饿,65,70,75,59,76,331,C,
那该{CQ用}什么方法来解决这个问题好呢？,200307109523200132,韩国,2,200307,绿色食品与饥饿,65,55,59,54,67,282,C,
这[C]个原因之[C]一是由于化肥和农药{CJ-sy造成了}{CD的}土壤污染，{CP首先我们考虑{CD除了}保护环[B坏]境，[BC。]人类不能继续存在污染{CD的}环境。P},200307109525100135,日本,1,200307,绿色食品与饥饿,70,60,54,64,70,303,未参加,
我觉得在这个世界上有很多事情使你感到幸福。,200307109523200194,韩国,2,200307,绿色食品与饥饿,80,85,88,67,76,390,B,
孩子们的成长过程中食品的影响最大。[BC.],200307109523200249,韩国,2,200307,绿色食品与饥饿,70,75,59,49,35,277,未参加,
在地球[B求]上有[C]的人没吃[C]{CJX}饭[C]而{CD不}能生存，可是有的人已经有自己的能力；厉以为自己生活的质量讲究食品问题{CJ?}。,200307109523200293,韩国,2,200307,绿色食品与饥饿,60,65,64,35,41,248,未参加,
我知道更多的人们还挨饿的情况，虽然如此，但我们不能生产{CQ有}害于人类的食品，这两点可以从短期长期{CC长短期间}来考虑。[BC，],200307109523100304,韩国,1,200307,绿色食品与饥饿,55,55,62,38,56,246,未参加,
如今在农作物的生长过程中用化肥和农药{CQ用}得{CC的}很多。,200307109523200310,韩国,2,200307,绿色食品与饥饿,60,50,6,22,18,136,未参加,
每{CC个}个人的生命是很珍贵的。,200307109523100380,韩国,1,200307,绿色食品与饥饿,65,65,48,41,35,238,未参加,
那吃绿色食品的话，不能解决世界饥饿问题吗？,200307109523100394,韩国,1,200307,绿色食品与饥饿,65,80,59,41,61,294,未参加,
人在长期内吃了不少受到化学污染的农作物的话，甚至会导致死亡。,200307109523100424,韩国,1,200307,绿色食品与饥饿,70,90,70,54,67,344,C,
实际上不使用化肥和农药的话，[BC、]食品的产量是会大大降低的，[BC、]这样的话容易出现挨饿的情况。,200307109523200484,韩国,2,200307,绿色食品与饥饿,65,65,56,43,70,283,未参加,
其实[BD、]这种食品不仅对健康好，[BC、]而且对环境也好。,200307109525200509,日本,2,200307,绿色食品与饥饿,65,50,59,67,81,303,未参加,
随着人们生活水平的不断提高，有钱人看重绿色食品，更重视绿色食品。,200307109523100532,韩国,1,200307,绿色食品与饥饿,70,65,75,62,64,322,C,
其实两个都不能忽视。P},200307109523200554,韩国,2,200307,绿色食品与饥饿,65,55,43,33,38,216,未参加,
所以，这样的饥饿问[B门]题发生了。,200307109525100605,日本,1,200307,绿色食品与饥饿,65,70,64,67,87,339,C,
科学越来越发展，而所得到的利益也一天比一天多。,200307217523200009,韩国,2,200307,绿色食品与饥饿,60,60,72,54,64,292,未参加,
虽然绿[C]色食品有化肥和农药的东西，但我们就靠着这个食物来生活。,200307217523200020,韩国,2,200307,绿色食品与饥饿,65,65,56,54,50,274,未参加,
我认为吃“绿色食品”是第一位的。,200307217525200056,日本,2,200307,绿色食品与饥饿,65,70,64,51,76,312,C,
现在很多食品含有{CC蕴含}农药、[BC。]化肥。,200307217523100064,韩国,1,200307,绿色食品与饥饿,60,65,64,59,70,301,C,
由于战争，灾难等的原因，五六、十{CC5，60}年代的人一般没有可吃的东西。{CQ随着},200307217523200085,韩国,2,200307,绿色食品与饥饿,65,75,70,54,50,301,C,
这样，能解决这个问题。,200307217523200087,韩国,2,200307,绿色食品与饥饿,65,55,72,59,56,289,C,
我也经常在电视里看到很多人在饥饿黑暗中呻吟。,200307217523100108,韩国,1,200307,绿色食品与饥饿,75,70,62,43,81,320,C,
最后这个题目给我带来很大的影响。,200307217525100110,日本,1,200307,绿色食品与饥饿,70,65,62,41,58,282,未参加,
是不是？,200307217523100116,韩国,1,200307,绿色食品与饥饿,65,75,78,59,87,351,C,
我认为“绿色食品”是第一位的。,200307217523200118,韩国,2,200307,绿色食品与饥饿,60,55,56,51,70,273,未参加,
为了解决[C]农作物的产量问题，[BC、]我们应该使用化肥和农药来大大提高产量。,200307204525100011,日本,1,200307,绿色食品与饥饿,60,65,56,62,70,296,未参加,
怎样解决这些问题呢？,200307204525200020,日本,2,200307,绿色食品与饥饿,65,80,83,67,99,382,B,
说中国，在北京、上海[C]、天津等地的富翁肯定选择[C]“绿色食品”，而西北地区的贫苦农民想吃的，我想不会是“绿色食品”。,200307204525100033,日本,1,200307,绿色食品与饥饿,60,70,70,62,73,320,C,
农药对人体有害的化学用品{CJs}，可是农民没有方法不得不{CC3要}使用，[BC.]为什么要用农药[C]呢？{CP避免{CC预防},200307204523100042,韩国,1,200307,绿色食品与饥饿,60,55,62,51,38,247,未参加,
这个问题{CJ-zy怎么}解决呢？,200307204523100045,韩国,1,200307,绿色食品与饥饿,60,60,64,49,41,256,未参加,
而且{CC而是}从经济学的角度来考虑[C][BQ，]饥饿的原因绝对不是食品不足{CJ+zxy的原因}，[BC、]而是不工作{CJ+zxy的原因}。,200307204525100107,日本,1,200307,绿色食品与饥饿,60,65,75,43,56,282,未参加,
因为我们可不能忽视那好几亿的因缺少粮食而挨饿的人们。,200307205523200115,韩国,2,200307,绿色食品与饥饿,65,85,83,70,81,374,B,
绿色食品的[C]概念应该是人吃饱了以后才考虑到的[C]“发展概念”。,200307205525200150,日本,2,200307,绿色食品与饥饿,60,65,56,49,61,274,未参加,
所以，不是想[C]我一个人，怎么生活，而是想我和别的人，比如说，穷{CC贫}的人，老人等等怎么一,200307205523100155,韩国,1,200307,绿色食品与饥饿,60,65,62,49,47,266,未参加,
不但{CC不便}重视工业化产业，而且对基本产业的农业收[B受]获[B莸]量极大[D化]关注了。,200307205523200157,韩国,2,200307,绿色食品与饥饿,60,60,75,64,67,308,未参加,
目前，世界的各个[L]国家已经发达了，而提[B题]高了生活水平。[BC.],200307212523100027,韩国,1,200307,绿色食品与饥饿,65,70,51,43,67,282,未参加,
不可想像[B象]。,200307212523100029,韩国,1,200307,绿色食品与饥饿,70,70,70,70,96,364,C,
住院的原因是中[B种]毒了。,200307212540200039,印度尼西亚,2,200307,绿色食品与饥饿,65,70,72,41,76,310,未参加,
由[B有]于人类大量地杀死鸟类，使一些鸟类濒临灭绝，使昆虫无节制地繁殖[B植]，因此粮食被昆虫取走。,200307201523200008,韩国,2,200307,绿色食品与饥饿,75,75,70,75,81,366,B,
人们在生活上必要的东西有很多。,200307201523200025,韩国,2,200307,绿色食品与饥饿,65,60,59,46,41,254,未参加,
绿色食品就是让这样的人们满足。,200307201523200032,韩国,2,200307,绿色食品与饥饿,60,60,54,70,61,287,未参加,
我们都知道这样的现实，不觉得总要绿色食品是会引起他们的更大的痛恨吗？,200307201523100047,韩国,1,200307,绿色食品与饥饿,70,70,72,64,61,325,C,
这种事[BD，]不是一两次而造成{CC盛增高}，这种{CJ-zxy事情}应该[B刻]不能再发生。[BC.],200307201523200093,韩国,2,200307,绿色食品与饥饿,65,60,64,38,67,277,未参加,
但是又想一想，虽然用化肥和农药的农作物{CC农产物}，产量会多得{CC的}多，可会危害人的健康，所以有很多人议论{CC议意}，到底该支持哪方呢？,200307302523200019,韩国,2,200307,绿色食品与饥饿,80,65,78,72,79,362,B,
这说明了使用很多的化肥和农药给人带来的一种问题。,200307302523100046,韩国,1,200307,绿色食品与饥饿,70,65,80,62,81,344,C,
我觉得“绿色食品”没有什么好处，而有很多坏处。,200307302523200054,韩国,2,200307,绿色食品与饥饿,65,60,70,54,58,290,C,
所以应该{CJX}我们都把中国变成绿[C]色的国家和绿色食品的农业产品国家。,200307302523100084,韩国,1,200307,绿色食品与饥饿,60,60,40,14,38,194,未参加,
这样一来，我们才能保持高{CC1高级}的生,200307302523200086,韩国,2,200307,绿色食品与饥饿,75,70,70,64,73,341,C,
无论什么国家都发生着这种情况。,200307302523200102,韩国,2,200307,绿色食品与饥饿,75,70,78,54,79,345,C,
但是如果现在开始不用这些破坏环境的农药和化肥的话，农作物产量也会大大降低，这样就{CJX}世界上的几亿口人缺少他们{CC2他}的粮食了。[BC.],200307302523100132,韩国,1,200307,绿色食品与饥饿,70,65,83,62,67,333,C,
再想一想如果不用农药{CD做}的话，产量就会受到影响。[BC.],200307302523200131,韩国,2,200307,绿色食品与饥饿,65,60,51,46,61,266,未参加,
因为绿色食品没有化肥或农药，所以食品里一般不含有害物质。,200307302523200136,韩国,2,200307,绿色食品与饥饿,75,75,67,78,79,364,B,
我们把用未经污染的农产品加工的食品叫做“[BC‘]绿色食品”[BC’]。[BC.],200307302523200138,韩国,2,200307,绿色食品与饥饿,70,65,46,49,35,251,未参加,
在韩国{CD里}有[C]的人为了健康要减肥不吃饭，在北朝鲜里有的人为了活着吃人肉。,200307302523200147,韩国,2,200307,绿色食品与饥饿,65,65,64,33,35,246,未参加,
这[C]样的话，已经{CC一且}解决的饥饿问题又出来，而且会更复杂。,200307206525200011,日本,2,200307,绿色食品与饥饿,65,65,67,75,90,346,C,
现代我们的生活经[C]济条件越来越好，我们的思想也有一点的变化。,200307206525200025,日本,2,200307,绿色食品与饥饿,70,65,51,70,73,315,C,
因为地球上的大部分人还[C]是有钱买饭的。,200307206523200046,韩国,2,200307,绿色食品与饥饿,80,75,70,70,79,365,B,
我们不帮谁来帮呢？[BD。],200307332540100009,印度尼西亚,1,200307,绿色食品与饥饿,75,70,64,51,61,310,C,
有的人认为{CQ可以}使用农药来提高产量{CC生产}，把这[C]些产品送[C]给没有东西吃的一些国家{CQ的}人。,200307332523200020,韩国,2,200307,绿色食品与饥饿,65,60,72,72,73,325,C,
除了学校、家长的协作{CC协[F協]合}，关键{CC主要}在学生自身{CC身上}。[BC，],200309529529251021,泰国,2,200309,我对男女分班的看法,75,70,66,65,83,348,C,
{CJ-zhuy大家}{CJ+zy一起}共同努力，才能教育出{CJ+dy一批}优秀的新一代。,200309529529251021,泰国,2,200309,我对男女分班的看法,75,70,66,65,83,348,C,
我那时十分伤心。,200310576525200027,日本,2,200310,我对男女分班的看法,65,65,44,51,74,283,未参加,
那从小在男女混合的情况下学习交流更好。,200310576525100034,日本,1,200310,我对男女分班的看法,65,65,36,68,51,269,未参加,
而且我想男人和女人互相交流后才能得到很宝贵的东西。,200310576525100057,日本,1,200310,我对男女分班的看法,60,70,47,44,61,267,未参加,
例如，手机{CD的}短信、[BC，]网络。,200310576525200060,日本,2,200310,我对男女分班的看法,60,65,49,54,51,262,未参加,
我觉得男人应该从小学会与异性{CJX}如何交流，如何对待女性。,200310576525200066,日本,2,200310,我对男女分班的看法,65,65,52,65,65,296,C,
阅读能锻[Pduàn]炼{CC练}我们的右左脑[B恼]，能使我们更精进。,200310540540250027,印度尼西亚,2,200310,谈有效阅读,65,60,36,38,55,237,未参加,
这是我对读长篇{CC2长}小说或历史小说的一点[C]看法{CC经验}。,200310540540250034,印度尼西亚,2,200310,谈有效阅读,60,75,61,47,88,317,未参加,
相应地，人们也增加了关于{CC2对}这些的理论知识，大量收集有关的书籍来阅读，进行研究和探讨。,200310540540250042,印度尼西亚,2,200310,谈有效阅读,65,60,43,33,84,268,未参加,
可是对我来说{CC看}，有效的阅读对我们不同年纪的{CJ-zxy人}{CJ+zhuy差别}有所不同。[BC，],200310540540250064,印度尼西亚,2,200310,谈有效阅读,55,60,50,35,64,245,未参加,
我认为有效阅读应当选择你喜欢{CC喜爱}看的书本，[BC。]有了喜欢要看的书一定使你有兴趣来阅读。[BC，],200310540540150081,印度尼西亚,1,200310,谈有效阅读,55,55,43,35,55,223,未参加,
在五花八门的社会影响下，中学生可以从杂志与光碟懂得恋爱之事而更蠢蠢欲动{CC蠢蠢一试}。,200306680519250010,马来西亚,2,200306,我对男女分班的看法,85,75,85,79,96,412,A,
当前资讯科技{CD的}发达，只要青少年有意寻找异性朋友，上网与异性朋友交往简直是易如反掌。,200306680519150030,马来西亚,1,200306,我对男女分班的看法,80,85,85,79,92,415,A,
在一个同性的学习环境中，儿女们都能专注于{CC在}学习与理解，而不是沉迷{CC陶醉}于{CC在}学生谈恋爱与抢争伴侣的事件中。,200306680519150050,马来西亚,1,200306,我对男女分班的看法,75,75,80,72,85,377,B,
最好是两个都得到，但{CQ在}熊掌和鱼不可兼得的现实选[C]择上，我觉得人类应该先把饥饿问题解决好。,200307271523200018,韩国,2,200307,绿色食品与饥饿,70,80,86,80,96,402,B,
比如说，为了保护身体健康，人们[C]每日吃有利于身体的绿[B绝]色食品。,200307271523100030,韩国,1,200307,绿色食品与饥饿,70,60,46,56,73,290,未参加,
所以人们说我们的生活空间就是“地[C]球[B求]村”。,200307271523200059,韩国,2,200307,绿色食品与饥饿,65,65,64,43,81,302,C,
为了社会、[BC，]为了孩子们[BQ，]成年人一定要{CJ+sy有}对自己行为{CD的}负责{CC责任}。,200405109525200477,日本,2,200405,吸烟对个人健康和公众利益的影响,70,70,76,68,66,338,C,
不[C]过人们开始吸烟后，过一段时间，不知不觉[BD，]就慢慢上瘾。,200405109523100570,韩国,1,200405,吸烟对个人健康和公众利益的影响,85,65,62,50,55,306,C,
我觉得{CJX}也在公共场所[L]抽烟不太好[BQ，]因为{CD在}公共是什么意思呀？,200405109523200755,韩国,2,200405,吸烟对个人健康和公众利益的影响,70,65,45,35,35,236,未参加,
吸烟是{CD对}给整个社会{CQ带来了}不[C]好的影响[B象]。,200405109523200786,韩国,2,200405,吸烟对个人健康和公众利益的影响,65,60,45,46,39,238,未参加,
香烟就是让我们的身体和健[B建]康越来越不好{CC衰弱}的不好的物品。,200405109523100823,韩国,1,200405,吸烟对个人健康和公众利益的影响,65,70,48,62,57,288,C,
比如，有吸烟者的家庭的孩子，他们的成长可难会受到{CC导致}消极的影响。,200405109523201053,韩国,2,200405,吸烟对个人健康和公众利益的影响,60,65,81,64,75,328,C,
我认为{CC以为}，特别是在中国比西方国家{CJX}在这方面现在{CJX}还差一点。,200405109525101363,日本,1,200405,吸烟对个人健康和公众利益的影响,55,60,57,52,55,260,未参加,
这是迄今为止对吸烟最为严厉的惩罚措施。,200405109523201449,韩国,2,200405,吸烟对个人健康和公众利益的影响,65,70,52,46,41,260,未参加,
为什么这样呢？,200405109523101466,韩国,1,200405,吸烟对个人健康和公众利益的影响,75,65,57,52,53,289,未参加,
抽烟的人经常自称“爱烟家”，他们不顾社会上有许多专家提醒吸烟的有害性，尤其是对呼吸道病患者和孕妇的影响，却说“我就要抽”，甚至说“我就不相信他们说的所谓‘有害性’”[BQ，]使人实在无可奈何。,200405109525201480,日本,2,200405,吸烟对个人健康和公众利益的影响,80,80,81,75,93,401,B,
如果现在你在公共场所吸烟，那么站在你的旁边的人也不得不吸你的烟。,200405109525201493,日本,2,200405,吸烟对个人健康和公众利益的影响,70,65,55,64,59,299,C,
抽烟的人{CD是}不仅伤害{CC受伤}自己的身[C]体[BQ，]而且伤害{CC受害]}到非吸烟者{CD人}。{CP抽烟是对身体特别不好{CJxw},200405109523201544,韩国,2,200405,吸烟对个人健康和公众利益的影响,60,60,55,58,46,261,未参加,
再说，吸烟对身体一点都没有好处，[BC。]吸多了会容易得癌[Pái]症，肺[C]炎[B谈]等{CD的}病。,200405109525101551,日本,1,200405,吸烟对个人健康和公众利益的影响,75,65,57,60,59,303,C,
有的人说抽烟是一种把自己不得不感受的压力{CC压迫}驱散{CC散心}的方法。,200405109525101556,日本,1,200405,吸烟对个人健康和公众利益的影响,75,60,43,52,55,271,未参加,
我认为最好是吸烟者努力戒烟，可是吸烟的权力属于{CC由于}个人，如果不能戒烟，他们应该在允许吸烟的地方去吸烟{CJld}。{CP既然有人要吸烟，政府应该保留允许吸烟的地方。P},200405109525201697,日本,2,200405,吸烟对个人健康和公众利益的影响,65,65,71,52,55,292,C,
一个小的公共场所，如果你走路的时候要吸烟，就{CJX}你的旁[B方]边有吸烟区，这样做[B故]的话[BQ，]不吸的人很欢迎，孩子们也不能看。,200405109523101777,韩国,1,200405,吸烟对个人健康和公众利益的影响,65,70,31,25,23,200,未参加,
在欧洲[B州]的一项调查表明，每年男性不孕患者日益增加从而{CC2而}引起[C]人口减少{CJ+zxy的难题}。{CP这是{CJX},200405109523201799,韩国,2,200405,吸烟对个人健康和公众利益的影响,70,70,55,64,55,302,C,
首先抽烟对个人健[B建]康有害。,200405109523201800,韩国,2,200405,吸烟对个人健康和公众利益的影响,70,75,67,66,61,328,C,
不过，我们应该看到，那二手烟以及令人讨厌的废[F廢[C]]烟头是否已经严重影响其他人的“不触烟”之自由？,200405109525201808,日本,2,200405,吸烟对个人健康和公众利益的影响,75,80,67,66,68,347,B,
这几个方面的贡献[B现]{CJ-wy是}现在我国吸烟者越来越少。,200405109523201875,韩国,2,200405,吸烟对个人健康和公众利益的影响,60,70,40,35,46,236,未参加,
据称，市[C]政府出台该[C]措施是[C]为保持市容整洁，并帮助青少年养成良好习惯。,200405109523100524,韩国,1,200405,吸烟对个人健康和公众利益的影响,90,95,88,79,100,450,A,
可是对不吸烟者来说{CJ-zhuy这}是一种委[C]屈。{CP不吸烟的人一般不喜欢[C]闻烟气，这{CD是},200405109523200530,韩国,2,200405,吸烟对个人健康和公众利益的影响,70,65,62,60,73,316,C,
据[B剧]一个调查显示，50岁的非吸烟者的身体状况相当于40岁的吸烟者。,200405109523200558,韩国,2,200405,吸烟对个人健康和公众利益的影响,85,80,56,56,66,336,C,
反过来说[BQ，]{CQ从}国家的{CJ+zxy方面}角度来看这种生意{CJX}应该需要的，[BC.]所以现在我在吸烟。[BC.],200405109523100621,韩国,1,200405,吸烟对个人健康和公众利益的影响,65,65,50,48,56,268,未参加,
第二，[BC.]吸烟[C]对[C]青[C]少[B小]年的情绪[B序[C]]{CJ-zxy的影响}不好，[BC、]可以说，[BC、]如果青[C]少[B小]年吸烟的话，[BC、]他们的性格方面{CJ-zy会}受到{CC2有}影[C]响[C][BQ。]{CP因此，我{CJ-wy想}{CQ对}不吸烟者说[BQ：]“你们不吸烟{CD还}好吗{CC了}，为了您[C]的爱人，[BC、]为了您[C]的可爱的孩子[B了]，[BC。]不抽烟可以保[C]护您[C]的身[C]体[BQ。]”P},200405109523200616,韩国,2,200405,吸烟对个人健康和公众利益的影响,65,70,54,48,56,279,未参加,
以前认为{CC1想}吸烟也是一种爱好，所以成人的话[BQ，]自己愿意{CC2要}就吸[C]烟，像喝[B渴]酒一样{CD的}。,200405109523200794,韩国,2,200405,吸烟对个人健康和公众利益的影响,50,65,40,31,49,216,未参加,
我作[B做]为一个不吸烟的人强调{CJ+sy说}一下，吸烟的人再一次好好考虑[C]吸烟引起的坏影响。,200405109525200790,日本,2,200405,吸烟对个人健康和公众利益的影响,70,75,72,68,73,347,B,
在东京的一个地区不允许走着抽烟，甚至那些人将被罚款。,200405109525100142,日本,1,200405,吸烟对个人健康和公众利益的影响,70,65,46,62,75,304,C,
吸烟是一种娱乐。,200405109525200263,日本,2,200405,吸烟对个人健康和公众利益的影响,65,70,59,75,65,320,C,
。,200405109523200354,韩国,2,200405,吸烟对个人健康和公众利益的影响,60,75,57,58,60,296,未参加,
世界进入21世纪以来，可以吸烟[B咽]的公共场所明显减[F減]少了。,200405204525200221,日本,2,200405,吸烟对个人健康和公众利益的影响,70,80,63,75,67,345,C,
这是一个严重的问题，[BC。]不但{CJX}他们轻视法律而且轻视社会。,200405204525100257,日本,1,200405,吸烟对个人健康和公众利益的影响,65,65,41,30,49,234,未参加,
因此{CC这样}吸烟对身体没有好处。,200405204525200279,日本,2,200405,吸烟对个人健康和公众利益的影响,60,60,30,39,49,220,未参加,
所以吸烟者应该考虑这样{CQ的}方面[BQ，]自己小心选择抽烟的地方。,200405204525200325,日本,2,200405,吸烟对个人健康和公众利益的影响,65,60,19,39,67,233,未参加,
我也是抽烟者，[BC、]所以这段消息跟我有关。,200405204525100350,日本,1,200405,吸烟对个人健康和公众利益的影响,65,80,58,56,38,285,未参加,
我以前听说过很悲[B非]哀的消息。,200405204525200359,日本,2,200405,吸烟对个人健康和公众利益的影响,65,65,52,51,67,284,未参加,
这样，其实[C]允许抽烟的地方越来越少了。,200405204525200419,日本,2,200405,吸烟对个人健康和公众利益的影响,65,75,63,65,74,329,C,
吸烟本来是一种个人的爱[B喝]好。,200405205525200146,日本,2,200405,吸烟对个人健康和公众利益的影响,65,60,52,61,61,282,未参加,
但是国家也并不是赞成吸烟，[BC。]还是不太同意很多人吸烟。,200405201525200018,日本,2,200405,吸烟对个人健康和公众利益的影响,70,80,68,47,72,327,C,
所以现在在公共场所限制{CJ-by吸烟}，或者禁止的{CJX}这样情况[BD。]就是理所当然的结果。,200405201525100083,日本,1,200405,吸烟对个人健康和公众利益的影响,70,65,44,28,31,224,未参加,
这就是说，年轻的时候应该多关心自己的身体，不能{CC不用}过多吸烟。,200405302636200200,乌克兰,2,200405,吸烟对个人健康和公众利益的影响,70,75,60,75,63,332,C,
想必大家都知道，吸烟对身体会带来很大的伤害。,200405501616200025,德国,2,200405,吸烟对个人健康和公众利益的影响,75,65,71,73,65,336,C,
众所周知吸烟对个人健康和公众利益给了不好的影响{CJy}。,200405332540100026,印度尼西亚,1,200405,吸烟对个人健康和公众利益的影响,60,60,38,51,58,249,未参加,
从我小的时候[B后]已经习惯[B贯]了看我父亲吸烟，那时觉得吸烟很酷。,200405332540200027,印度尼西亚,2,200405,吸烟对个人健康和公众利益的影响,65,65,41,39,45,239,未参加,
经常听到老人说：“会照顾，孝顺并尊重年长一辈的人，一定不会坏到什么程度。,200410534533250077,新加坡,2,200410,最理想的结交方式,95,90,63,74,82,403,B,
