错句,作文编码,国籍,性别,考试时间,作文题目,口试分数,作文分数,听力分数,阅读分数,综合分数,总分,证书
那么，两代之间存在的“代沟”问题如何解决呢？,200209550523250137,韩国,2,200209,如何解决“代沟”问题,60,60,39,67,64,272,未参加,
这样的现象恐怕{CQ会}造成父母和孩子之间的问题。,200209550523150147,韩国,1,200209,如何解决“代沟”问题,65,60,45,62,58,273,未参加,
上述[C]的内容的确[C]是因为{CC出于}父母跟子女的代沟。,200209550523250141,韩国,2,200209,如何解决“代沟”问题,65,65,48,52,46,260,未参加,
后辈应该{CC值得}把前辈的经历做榜样{CJba}。,200209550523250160,韩国,2,200209,如何解决“代沟”问题,60,70,57,67,54,293,未参加,
我觉得不管什么时代[BD，]都有代沟问题。,200209550523250198,韩国,2,200209,如何解决“代沟”问题,65,70,48,69,62,300,C,
大部分的父母们觉得自己是长辈，不愿意听孩子的话。,200209550523250205,韩国,2,200209,如何解决“代沟”问题,75,70,57,64,64,319,C,
孩子也没有办法理解父母。,200209550523250216,韩国,2,200209,如何解决“代沟”问题,65,65,63,62,56,295,C,
所以两代人的行为表现方式和价值观念的差异能克服{CJX}通过多对话，多沟通。,200209550523250239,韩国,2,200209,如何解决“代沟”问题,65,60,54,45,56,263,未参加,
最[C]好的办法就是父母和子女之间增加对话。,200209550523250241,韩国,2,200209,如何解决“代沟”问题,65,65,48,45,50,257,未参加,
要了解这想法里面的东西。{CP要这样的话一定要更多的对话。对话中一定得到的好感想这个人为什么这样想。可能得到。P},200209550523250248,韩国,2,200209,如何解决“代沟”问题,65,60,51,45,36,240,未参加,
通过“[BC‘]交流”[BC’]而得到“[BC‘]特性”[BC’]，再加以“[BC‘]研究”[BC’]，只有这些是不够的。,200209550523150254,韩国,1,200209,如何解决“代沟”问题,75,75,91,84,76,391,B,
我们已经理解了{CC过}对方，知道他站在怎样的立场上，那现在我们可以互相交流[C]意见了。,200209550523250276,韩国,2,200209,如何解决“代沟”问题,65,70,57,71,66,315,C,
因为代沟问题{CJX}的发生在互相的{CJX}不同环境[C]，不知道[C]别人对那些[B此]问[B间]题怎么想，所以解决这个问[B间]题的最好方法是父母和孩子们一起谈话。,200209550523150285,韩国,1,200209,如何解决“代沟”问题,65,65,36,37,38,225,未参加,
我觉得{CD对}代沟问题有一个惟一的答案，[BC、]就是互相多多说话和了解双方{CC互相}的差别。,200209550523150305,韩国,1,200209,如何解决“代沟”问题,65,70,66,81,62,330,C,
可是现在比不上了。,200209550523150782,韩国,1,200209,如何解决“代沟”问题,65,70,45,67,50,283,未参加,
但是难以解决[C]的问题也有答案。,200209550523250809,韩国,2,200209,如何解决“代沟”问题,70,70,54,79,56,317,C,
我想最重要的是常常通过谈话了解对方和彼此{CC互相}的立场。,200209550919150902,加拿大,1,200209,如何解决“代沟”问题,65,70,39,57,52,269,未参加,
我认为两代人之间互相了解的话，可以解决。[BC.],200209550523250918,韩国,2,200209,如何解决“代沟”问题,70,80,54,52,44,290,未参加,
有对话，努力的话，我们可以解决代沟[BQ，]我们试试吧！,200209550523250918,韩国,2,200209,如何解决“代沟”问题,70,80,54,52,44,290,未参加,
但是我还会说你用这个办法的话[BQ，]会成功的！,200209550523250930,韩国,2,200209,如何解决“代沟”问题,60,60,39,67,46,254,未参加,
我觉得[B的]一定要决定某种规则，按这个规则判断安乐死，违法的话，应该要惩罚。,200205271525200006,日本,2,200205,如何看待“安乐死”,65,80,60,81,82,356,C,
我认为“安乐死”是可取的。,200205271525200081,日本,2,200205,如何看待“安乐死”,65,70,46,38,44,249,未参加,
我认为“绿色食品”和不挨饿双方都是很重要的，[BC。]但是却觉得不挨饿要比“绿色食品”更加有一种现实性的需要。,200307109525100119,日本,1,200307,绿色食品与饥饿,85,90,75,62,87,395,B,
我认为不挨饿是第一位的。,200307109523200121,韩国,2,200307,绿色食品与饥饿,65,70,48,38,67,274,未参加,
最近常常听到“[BC‘]绿色汽车[BQ”]、[BC，][BQ“]绿色食品”[BC’]什么的。,200307109523200325,韩国,2,200307,绿色食品与饥饿,60,70,54,41,58,268,未参加,
所[C]以我的意见就是[BQ：][BD“]人们一定要吃无污[C]染食品[BD”]。,200307109525200329,日本,2,200307,绿色食品与饥饿,65,85,78,64,73,355,C,
但是，现在世界上有的国家每年有几十万{CJ+zxy人}饿[C]死[C]，[BC、]而有些[C]国家生产了{CC着}吃不完、卖不完的粮食。,200307109523100383,韩国,1,200307,绿色食品与饥饿,65,85,78,72,90,380,B,
虽然说现在的医学技术已经到了很高的水平，可还有很多病不能治好。,200307109523200390,韩国,2,200307,绿色食品与饥饿,60,70,62,49,64,290,未参加,
但当时农民对我说：他们也不得不使用化肥农药，[BC。]因为如果不使用化肥和农药的话，他们都不能生活下去。,200307109523200396,韩国,2,200307,绿色食品与饥饿,60,65,40,22,32,202,未参加,
首先[C]，为了我们的长寿我们应该吃绿色食品。[BC.],200307109523200410,韩国,2,200307,绿色食品与饥饿,60,70,62,35,58,270,未参加,
那么，我们面临的这种问题应该怎样解决{CD这个}{CD问题}？,200307109523100467,韩国,1,200307,绿色食品与饥饿,65,65,62,59,79,314,C,
我认为吃“绿色食品”是第一位的。,200307109523200473,韩国,2,200307,绿色食品与饥饿,65,85,78,70,70,358,B,
但生活上的便利带来了很多问题，[BC。]尤其是环境污染的问题。[BC，],200307109523200478,韩国,2,200307,绿色食品与饥饿,70,65,56,43,47,267,未参加,
看来他们的想法是很正常{CJsd}。,200307109523100537,韩国,1,200307,绿色食品与饥饿,70,65,80,72,81,354,C,
总而言之，为了我们和我们的后代，我们应该保护环境，吃“绿色食品”。[BC。],200307109523200543,韩国,2,200307,绿色食品与饥饿,70,80,67,46,70,323,C,
我们不要只看眼前的结果，应该想到未来的结果。[BC.],200307109523200593,韩国,2,200307,绿色食品与饥饿,65,70,70,70,76,337,C,
现在，在世界上有一些人吃了一些“绿色食品”以后，很多人得到了病[BQ，]因为{CD是}“绿色食品”上的一些农药。[BC，],200307217523100014,韩国,1,200307,绿色食品与饥饿,70,60,27,43,35,220,未参加,
以[C]后时间过去了有可能我们放[B方]心地{CC的}吃绿色食品[BQ，]但现在我感觉还是吃绿色食品的时候干净地{CC的}{CJX}洗以[C],200307217523100039,韩国,1,200307,绿色食品与饥饿,60,60,38,19,24,183,未参加,
以前不能用的农民也{CJX}现在能用了。,200307204525200124,日本,2,200307,绿色食品与饥饿,60,70,54,33,53,255,未参加,
所以能够吃绿色食[C]品的人们拿{CC付}一定的钱给贫穷[B欠]的国家或者人们的话，有一点公平的{CJsd}。,200307204523200132,韩国,2,200307,绿色食品与饥饿,60,65,64,41,32,245,未参加,
因为一个人几天不吃东西的话很可能会死。,200307205525100051,日本,1,200307,绿色食品与饥饿,65,65,56,30,67,267,未参加,
人们总把人权看作为第一，[BC.]就是因为这[C]一点我们[L]不能轻视他们的生活，[BC。]应[B因]该全心全意地帮助他们。,200307205523100089,韩国,1,200307,绿色食品与饥饿,75,60,62,64,56,303,C,
其中，人类的饮食文化也有了不少改进，现在人们对食品的要求与过去明显不同。,200307205523100093,韩国,1,200307,绿色食品与饥饿,70,85,72,70,84,373,B,
目前，[BC、]世界上还有几亿人因缺少粮食而挨饿，特别是在非洲。,200307205525100134,日本,1,200307,绿色食品与饥饿,65,70,43,51,64,279,未参加,
所[C]以，有些国家，绿色食品引起了大家{CC人家}的注意，[BC.]可是你想过吗？,200307205523200152,韩国,2,200307,绿色食品与饥饿,75,70,88,75,87,384,B,
我们在享受的同时{CC2此时此刻}东南亚、[BC，]非洲的很多居民，因为没那么一碗饭而死去…。,200307212523100029,韩国,1,200307,绿色食品与饥饿,70,70,70,70,96,364,C,
我认为人类的智慧{CC英智}能解决{CJX}不仅{CJX}使用农药和化肥的问题，还能解决饥,200307212525100037,日本,1,200307,绿色食品与饥饿,65,65,67,70,73,324,C,
首先使用化学肥料和农药吧。,200307209523200006,韩国,2,200307,绿色食品与饥饿,60,65,64,49,67,288,未参加,
所以我希望世界上很多国家中[BQ，]没有粮食[BQ，]没有吃的东西的国家[BQ，]先解决{CC决解}这个问题[BQ。]然后讲究绿色食品。,200307209523100024,韩国,1,200307,绿色食品与饥饿,60,60,51,43,53,249,未参加,
多么不公平的事啊{CC呢}?健[B建]康也是不能忽视的事，[BC.]可{CQ在}最基本条件满意以后才能谈的题目。,200307201523200023,韩国,2,200307,绿色食品与饥饿,70,60,54,35,41,245,未参加,
人们应该吃“绿色食品”和不挨饿哪个放在第一位{CJba}？,200307201523200040,韩国,2,200307,绿色食品与饥饿,55,65,72,46,64,284,未参加,
拿价格来说[BQ，]使那样天然的高级的饲料的贵了一倍[B陪]，[BC。]可是卖得{CD的}挺快[BQ，]而且成为[C]在超市里少不了的东西了。,200307201523200074,韩国,2,200307,绿色食品与饥饿,65,65,78,46,56,294,C,
一方面考虑自己的健康，[BC.]另一方面也得看好周围的饥饿的孩子们。,200307201523200074,韩国,2,200307,绿色食品与饥饿,65,65,78,46,56,294,C,
而现在世界上还有几亿人因缺少粮食而挨饿。,200307201523200080,韩国,2,200307,绿色食品与饥饿,60,65,54,56,61,279,未参加,
这样的话产量就会大大提高，产物的质量也会好了一些。,200307201523100092,韩国,1,200307,绿色食品与饥饿,60,60,59,51,56,268,未参加,
还有开发极大的农作物品种。[BC.],200307302523200016,韩国,2,200307,绿色食品与饥饿,70,60,62,67,90,334,C,
可是在这世界上有数不胜数的孩子、老人等没有粮食可吃，连续几天饥饿着。,200307302523200024,韩国,2,200307,绿色食品与饥饿,75,70,64,70,84,352,C,
因此，用化肥之前，应该想好怎样改良这[C]个土地。,200307302523100050,韩国,1,200307,绿色食品与饥饿,65,70,86,72,70,349,C,
所以应该{CJX}我们都把中国变成绿[C]色的国家和绿色食品的农业产品国家。,200307302523100084,韩国,1,200307,绿色食品与饥饿,60,60,40,14,38,194,未参加,
这样，很自然的能得{CC做}到绿色食品。,200307302523100091,韩国,1,200307,绿色食品与饥饿,65,75,78,51,73,329,C,
这[C]方面，[BC。]通过不断地研究，会{CJX}总有一天——世界各地人都享受绿色食品口福的一天{CJZR}。,200307302523200105,韩国,2,200307,绿色食品与饥饿,75,75,75,78,87,380,B,
运样下来，污染[B杂]加工食品越来越减少，[BC、]我们的社会{WWJ},200307302523200127,韩国,2,200307,绿色食品与饥饿,60,65,78,54,79,319,C,
大多数的人们这样认为，所以每天能吃。,200307206525100010,日本,1,200307,绿色食品与饥饿,65,70,46,43,84,294,未参加,
这两个问题我认为有好有坏。,200307206525100019,日本,1,200307,绿色食品与饥饿,65,65,46,51,41,252,未参加,
现在除了经济条件以外，所有的生活情况{CQ都}很好。,200307206523200027,韩国,2,200307,绿色食品与饥饿,70,65,72,38,81,312,未参加,
有一天全世界都能解决了温饱问题的时候，我们可以彻底实行绿色食品的全球化，我盼[C]望着这一天。,200307206525200033,日本,2,200307,绿色食品与饥饿,70,85,75,67,84,373,B,
我们全世界人不能忽视这样的情况。,200307206523200042,韩国,2,200307,绿色食品与饥饿,65,65,59,54,67,294,C,
还[C]有一个问题，是环境问题。,200307206523200046,韩国,2,200307,绿色食品与饥饿,80,75,70,70,79,365,B,
我认为，现在对我们人类[B娄]来说[BQ，]最重要的事就是，在世界上生存的所有人{CC1人们}一块生存。,200307215523250005,韩国,2,200307,绿色食品与饥饿,65,70,62,56,79,318,C,
希望大家好好地[B的]珍惜现在的{CD所有}一切。,200310512512250016,菲律宾,2,200310,我对男女分班的看法,65,70,58,35,49,263,未参加,
青年时代还不知道自己的性格，还不知道自己要走的方向。,200310576525100023,日本,1,200310,我对男女分班的看法,65,65,66,70,74,324,C,
二是不知道{CJ-zy怎么}对待{CC2对}恋爱。,200310576525100029,日本,1,200310,我对男女分班的看法,50,70,36,35,45,219,未参加,
我想这是真正地{CC的}把孩子教育{CJ-buy好}的方法。,200310576525100033,日本,1,200310,我对男女分班的看法,60,70,71,70,56,312,C,
学生因为他们还很小，所以还不会知道对象[B像]将来能否{CJ-zy和自己}在一起{CC3成就}。,200310576525100040,日本,1,200310,我对男女分班的看法,60,80,68,63,65,323,C,
我支持男女分班。,200310576525200046,日本,2,200310,我对男女分班的看法,55,70,49,61,65,284,未参加,
男的女的在一起，才{CJX}学到的东西{CD也}多。,200310576525200062,日本,2,200310,我对男女分班的看法,60,75,71,65,54,311,C,
特别在初中、[BC—]高中这个{CC2的}特别{CJX}精神敏感的时期，如果平时{CC日常}没有与异性交流的机会，{CD就}怎样能{CD体会}以自然的态度对待女性？,200310576525200066,日本,2,200310,我对男女分班的看法,65,65,52,65,65,296,C,
而且，许多男生女生都早已结为[B伪]形影不离的好朋友了。,200310602801250003,澳大利亚,2,200310,我对男女分班的看法,65,65,60,61,72,307,C,
怎么办呢？,200310540540150057,印度尼西亚,1,200310,谈有效阅读,65,80,61,53,86,333,C,
古[D代]时[F時]候，重男轻[F輕]女思想在英国[F國][BQ、]中国[F國]两个[F個]国[F國]家是很严[F嚴]重{CJsd}。,200310650634150041,英国,1,200310,我对男女分班的看法,70,60,63,44,56,278,未参加,
我也是想学汉语，想了解中国文化的（外国）人之一。,200304131645200064,克罗地亚,2,200304,我学汉语是为了……,65,70,59,32,54,266,未参加,
在这个方面{CD上}，我个人的看法{CD只}是学{CD会}好汉语才能{CD有能力}发展两个国家的关系，才能{CD有能力}解决{CD有}不同方面{CD会}发生的矛盾。,200304131745100071,苏丹,1,200304,我学汉语是为了……,55,65,44,49,57,252,未参加,
我看好了选择学汉语以后一定有用{CD的}。,200304131529200222,泰国,2,200304,我学汉语是为了……,65,70,53,52,52,278,未参加,
我个人认为，男女分班的制度是利多于弊。,200306680519250008,马来西亚,2,200306,我对男女分班的看法,90,85,77,63,90,402,B,
我认为如果家长们欲避免孩子早恋，应是自小循循善诱，而不是一昧阻拦孩子们认识异性。,200306680519250032,马来西亚,2,200306,我对男女分班的看法,70,75,75,77,87,373,B,
减少{CC缺少}了两性的困扰，使{CC1致使}学生有更好地专注{CQ于}学业的精神。,200306680519150050,马来西亚,1,200306,我对男女分班的看法,75,75,80,72,85,377,B,
大部分父母支持男女分班，认为此制度[L]能避免孩子早恋而专心{CC专勤}于课业，这可让父母大感放心。,200306680519250052,马来西亚,2,200306,我对男女分班的看法,90,90,82,77,94,431,A,
我认为{CJX}也吃“绿色食品”是第一位的。,200307271525100039,日本,1,200307,绿色食品与饥饿,65,75,67,51,64,309,C,
根据报告，只吃绿[B绝]色食品的人的劳动力比吃肉的低一些。[BC.],200307271637200049,白俄罗斯,2,200307,绿色食品与饥饿,65,65,32,30,50,226,未参加,
为了自己的健康不顾别人的困难是跟杀别人一样的事。,200307271523100051,韩国,1,200307,绿色食品与饥饿,90,65,51,43,53,293,未参加,
这种化肥和农药的污[C]染{CD水}也是引起上述[C]的问题的原因之一。,200307271525200097,日本,2,200307,绿色食品与饥饿,70,70,78,59,64,329,C,
所以[C]市政府出台该措施是为了保持市容整洁[C]，并帮助青少年养[C]成良好的习惯。,200405109523200514,韩国,2,200405,吸烟对个人健康和公众利益的影响,50,60,55,54,46,245,未参加,
随着经济水平日渐提高，人们的教育水平也提高{CQ了}，人们的思想观念也大大变化了。,200405109523200516,韩国,2,200405,吸烟对个人健康和公众利益的影响,60,70,48,52,46,261,未参加,
在马路上，如[C]果有人好意地跟抽烟的人说：[BC，]“在马路上抽烟的行为影[C]响到别人，所以请你不要[C]抽烟好吗？,200405109523200548,韩国,2,200405,吸烟对个人健康和公众利益的影响,95,65,71,64,68,355,C,
假如青少年从小[B少]抽烟的话，他们在学习，将来在工作[C]的时候[B们][D都]，他们能发挥的能力会减少。,200405109523100647,韩国,1,200405,吸烟对个人健康和公众利益的影响,70,65,62,62,66,311,C,
我是从高一开始抽的{CC了}烟{CJsd}。,200405109523100651,韩国,1,200405,吸烟对个人健康和公众利益的影响,80,75,52,54,53,305,C,
还[C]有，吸烟对公众利益的影响是什么？,200405109523200988,韩国,2,200405,吸烟对个人健康和公众利益的影响,65,60,48,48,50,254,未参加,
因为，中国政府也{CJ+sy是}慢[C]慢[C]意识到，抽烟虽然是个人的权力，[BC。]不过在公共[B工]场[C]合抽烟是损害公众{CJ-zxy利益}的行为。,200405109523201020,韩国,2,200405,吸烟对个人健康和公众利益的影响,70,65,79,58,61,319,C,
所以现在很多公共场合，比如[C]，很大的商场、[BC，]公司、[BC，]学校、[BC，]飞机、[BC，]火车等等，应该采取这种措施，快点实施。,200405109523201022,韩国,2,200405,吸烟对个人健康和公众利益的影响,70,65,67,68,64,320,C,
但是有人{CC人家}{CJX}还是吸烟[BQ，]损[B把]害自己的身体{CQ和}公众利益。,200405109523101395,韩国,1,200405,吸烟对个人健康和公众利益的影响,60,60,52,50,53,257,未参加,
这是迄今为止对吸烟者最为严厉的惩罚措施。,200405109523201434,韩国,2,200405,吸烟对个人健康和公众利益的影响,50,65,43,48,37,224,未参加,
为了自己的自由，损害{CC害}了别人的自由是不对的。{CJ-zhuy我},200405109523201446,韩国,2,200405,吸烟对个人健康和公众利益的影响,70,65,55,39,57,272,未参加,
”[BC”]烟里的成分都[C]是对健康不好的。,200405109523101455,韩国,1,200405,吸烟对个人健康和公众利益的影响,65,60,36,31,46,221,未参加,
最后，青少年的抽烟现象也逐渐成了重大问题。[BC.],200405109523201479,韩国,2,200405,吸烟对个人健康和公众利益的影响,75,70,76,75,73,358,B,
最近按[B安]照世界报道[BQ，]吸烟者越来越减少了。,200405109523201549,韩国,2,200405,吸烟对个人健康和公众利益的影响,65,60,28,52,48,236,未参加,
烟对孩子的身体一定有害处。[BC.],200405109525101687,日本,1,200405,吸烟对个人健康和公众利益的影响,70,65,50,70,57,298,C,
吸烟者损坏{CC害}自己的身体是没有办法，[BC。]因为他们知道烟是对身体有害的，不过停不了。{CP但如果自己控制不了吸烟[BQ，]损坏{CC害},200405109525201761,日本,2,200405,吸烟对个人健康和公众利益的影响,65,60,52,54,57,271,未参加,
不仅是{CQ给}吸烟的那个人{CD外}，还会给周围的人的个人健康带来不好的影响。,200405109525101821,日本,1,200405,吸烟对个人健康和公众利益的影响,75,85,81,64,86,384,B,
可是，这个观点{CC意见}只{CC就}是不吸烟者的话。,200405109525101844,日本,1,200405,吸烟对个人健康和公众利益的影响,65,60,33,52,57,250,未参加,
吸烟在现代生活中成为一种爱好。,200405109523101872,韩国,1,200405,吸烟对个人健康和公众利益的影响,70,95,81,73,70,382,B,
而且对不吸烟[C]的[C]人来讲，这样一口{CJX}的[C]{CJX}吸气带来的影响{CC损害}大大地{CC的}损害了{CC3影响}身体。,200405109523101872,韩国,1,200405,吸烟对个人健康和公众利益的影响,70,95,81,73,70,382,B,
首先我要说，我[C]同意这项规定。,200405109523201879,韩国,2,200405,吸烟对个人健康和公众利益的影响,60,70,57,46,55,273,未参加,
因为孩子们容易学[C]到一些东西。,200405109523200510,韩国,2,200405,吸烟对个人健康和公众利益的影响,75,65,54,54,51,286,C,
这样的方针对吸烟者来说真是受不了的。,200405109523200539,韩国,2,200405,吸烟对个人健康和公众利益的影响,90,65,54,52,66,318,未参加,
据说，女人吸了{CJ-zy很}多烟的话，有可能对她生的孩子有影响。,200405109525100533,日本,1,200405,吸烟对个人健康和公众利益的影响,85,65,62,68,54,323,C,
第二，可以减[C]少吸烟者。[BC，],200405109523200796,韩国,2,200405,吸烟对个人健康和公众利益的影响,65,85,72,73,66,351,B,
这可以说一个悲剧。,200405109525200817,日本,2,200405,吸烟对个人健康和公众利益的影响,65,75,54,68,70,319,C,
吸烟的时候吸烟者呼{CC吸}的烟比吸{CC收}的烟更不好，如果禁[B楚]烟者吸{CC收}这个烟的话，比吸烟者更不好的影响{CJbi}。,200405109523201396,韩国,2,200405,吸烟对个人健康和公众利益的影响,55,55,48,41,34,213,未参加,
由此可见，我反对吸,200405109523201400,韩国,2,200405,吸烟对个人健康和公众利益的影响,60,65,78,68,80,334,C,
这[C]样，吸烟的严重伤害怕被人们所知道的后果是有所好处的{CJ?}，这个事实影响了整个人民意识。,200405109523200314,韩国,2,200405,吸烟对个人健康和公众利益的影响,65,65,84,73,97,368,C,
连小孩都知道吸烟会伤害身体，[BC。]所以，关于健康不用说得那么多。,200405109525100366,日本,1,200405,吸烟对个人健康和公众利益的影响,45,70,46,73,65,281,未参加,
所以对吸烟[B咽]的人来说，这就是一种{CJ-dy放松的}办法。,200405204525200146,日本,2,200405,吸烟对个人健康和公众利益的影响,65,65,38,61,67,280,未参加,
可是{CJ+dy这个}吸烟也会带来负面{CC2反面的恶化}作用。,200405204525100199,日本,1,200405,吸烟对个人健康和公众利益的影响,60,75,27,35,51,234,未参加,
从公众利益的角度{CC利益}来看，我同意短消息上写的新措施。,200405204525200171,日本,2,200405,吸烟对个人健康和公众利益的影响,65,60,38,47,61,254,未参加,
如果我跟抽烟的朋友常常{CQ在}一起，我的肺也{CJ-zy会}受害{CD了}。,200405204525200239,日本,2,200405,吸烟对个人健康和公众利益的影响,65,65,36,54,40,244,未参加,
在{CJ+by我国}日本也是爱吸烟的人{CJX}很多。,200405204525100271,日本,1,200405,吸烟对个人健康和公众利益的影响,65,65,25,49,51,239,未参加,
从健康{CJ-zxy角度}来说，由于{CC2由}吸烟{CJ-zxy得病}的病人也肯定{CJ-zy会}减[C]少。,200405204525200269,日本,2,200405,吸烟对个人健康和公众利益的影响,60,60,36,30,58,226,未参加,
我平时感到害怕{CC2怕}烟时是看到一边吸烟，一边走路的人{CJ-zxy的时候}。,200405204525200348,日本,2,200405,吸烟对个人健康和公众利益的影响,60,65,44,28,42,222,未参加,
给朋友有害的烟是对朋友的命越来越短{CC少}{CJjy}。,200405204525100439,日本,1,200405,吸烟对个人健康和公众利益的影响,60,65,30,21,38,197,未参加,
吸烟[B咽]对个人的健康没有好处{CC利益}。,200405205525200101,日本,2,200405,吸烟对个人健康和公众利益的影响,60,85,55,63,58,310,未参加,
不然，不仅[B尽]危害了他人的健康，还[C]影响了社会风气。,200405205525100212,日本,1,200405,吸烟对个人健康和公众利益的影响,90,85,79,75,94,420,B,
朋友、哥哥姐姐{CC4兄[C]姐}影响他。,200405205525200223,日本,2,200405,吸烟对个人健康和公众利益的影响,60,65,44,49,51,252,未参加,
我认为并不能否定。,200405201525200018,日本,2,200405,吸烟对个人健康和公众利益的影响,70,80,68,47,72,327,C,
你可知道在我们社会上多少人在吸烟？,200405542542130004,越南,1,200405,吸烟对个人健康和公众利益的影响,65,65,22,21,47,204,未参加,
不过我认为更重要的是教育。,200405201525100074,日本,1,200405,吸烟对个人健康和公众利益的影响,70,80,66,44,63,313,C,
从古至今，可歌可泣的爱情故事多得不胜枚举，其中有很多可以被人们当成自己未来婚姻生活的借鉴。,200410534519250041,马来西亚,2,200410,最理想的结交方式,75,85,80,67,82,382,B,
其次，以文字结交的方式还能减[F減]少见[F見]面时引起的不悦与难为情。[BC.],200410534533250052,新加坡,2,200410,最理想的结交方式,75,90,69,65,58,351,C,
不过如果我们从一般男女婚姻失败的情况来看，或许可以给我们对“相识方式”{CJ-zxy的看法}一些启[C]示。,200410534533150060,新加坡,1,200410,最理想的结交方式,85,85,63,79,91,398,B,
我在超级市场任职，在我的周围有不少情侣，但是其中有一对很令人注目。,200410534533250090,新加坡,2,200410,最理想的结交方式,80,85,74,47,72,352,C,
在现实[F實]的生活中，会有很多鼓励对方的机会，能够[F夠]慢慢培[B部]养感情。,200410534533250095,新加坡,2,200410,最理想的结交方式,50,75,69,56,70,304,未参加,
