错句,作文编码,国籍,性别,考试时间,作文题目,口试分数,作文分数,听力分数,阅读分数,综合分数,总分,证书
考完以后我们就开始写毕业论文，这倒让我{CJ-sy有}一点紧张，可是我已经下定{CC好}决心把最后{CC最终}的一个学习任务完成。,200104124631200365,希腊,2,200104,一封写给父母的信,80,90,60,61,65,351,C,
亲爱的父亲和母亲！,200105550523250023,韩国,2,200105,一封写给父母的信,65,70,58,65,76,320,C,
我还年轻，身体也健康，[BC。]尤[B优]其是我有人生的目标。,200105550523250047,韩国,2,200105,一封写给父母的信,70,70,38,49,61,276,未参加,
她还在看你的照片，每天流下眼泪。,200105550523250298,韩国,2,200105,一封写给父母的信,70,75,38,61,56,289,未参加,
可是，你们知道吗？,200105550523250331,韩国,2,200105,一封写给父母的信,70,75,47,44,47,272,未参加,
因为爸爸的失业，我们家的经济不太好。,200105550523250465,韩国,2,200105,一封写给父母的信,60,75,38,49,51,259,未参加,
这个星期天{CC星期七}我中学朋友在大田结婚，我为了参加婚礼星期[B其]六晚上回家去。,200105550523250529,韩国,2,200105,一封写给父母的信,65,65,55,61,63,293,C,
让我感到乡愁。,200105212525200006,日本,2,200105,我的一个假期,70,80,60,68,68,336,C,
我一到他们家，就受到了他家里人的热烈欢迎。,200105212525100017,日本,1,200105,我的一个假期,70,75,72,63,68,337,C,
我想度假{CC2度假期}是一个很好的事情。,200105212525100023,日本,1,200105,我的一个假期,70,70,75,54,59,316,C,
因为，到那儿我就看到了穿得十分漂亮的少数民族，我兴奋得连坐长途汽车的疲劳也忘掉了。,200105209525200062,日本,2,200105,我的一个假期,75,70,77,70,83,364,B,
一天二十四个小时都是自己的，[BC。]想去哪里就去哪里，想吃什么就吃什么，[BC。]很自由。,200105224525200026,日本,2,200105,我的一个假期,70,70,52,54,46,280,C,
她有两个跟我差不多的女孩子。,200105201525200075,日本,2,200105,我的一个假期,65,80,60,51,50,294,C,
在西安我知道了中国历史有多么伟大。,200105201525200083,日本,2,200105,我的一个假期,70,80,50,49,61,300,未参加,
最后，我知道的是有一天在庙里发生了火灾。,200105109540200490,印度尼西亚,2,200105,由“三个和尚没水喝”想到的……,75,70,54,51,70,309,未参加,
这三个和尚则{CD呢}好像还没有清楚地{CC的}明白合作的原因。,200105109630100498,西班牙,1,200105,由“三个和尚没水喝”想到的……,75,60,41,33,55,250,未参加,
温暖的关系变成很冷淡的关系。,200105109525200689,日本,2,200105,由“三个和尚没水喝”想到的……,75,85,70,69,61,353,B,
要这样的情况{CJX}解决{CC决解}的话，应该{CQ在}那个集团中决定领导。,200105109525100708,日本,1,200105,由“三个和尚没水喝”想到的……,60,55,54,62,55,267,未参加,
每天两个人一起挑水。,200105109525100807,日本,1,200105,由“三个和尚没水喝”想到的……,55,70,48,49,64,270,未参加,
因为后来来的和尚是可以代替第一个和尚挑水{CJsd}，[BC。]但我不知道为什么他们俩一点也没有准备互相帮助。,200105109525100862,日本,1,200105,由“三个和尚没水喝”想到的……,65,65,66,58,61,299,C,
就像您——我的爸爸一样。,200203522522150007,缅甸,1,200203,记对我影响最大的一个人,85,95,69,56,88,389,C,
妈妈喜行善助人，影响{CD所致}我也觉得能助人是人生乐事。,200203533540250011,印度尼西亚,2,200203,记对我影响最大的一个人,85,80,79,77,95,409,B,
根据这文章，我们可以了解家人同意丈夫帮助她自杀，[BC。]所以我们也可以理解{CC了解}家人帮助她自杀。,200205204525100019,日本,1,200205,如何看待“安乐死”,60,65,35,45,37,225,未参加,
如对方要求帮助自杀，那么可以帮助自杀。,200205204525100031,日本,1,200205,如何看待“安乐死”,70,60,21,42,54,232,未参加,
我想没有人想让自己的爱人痛苦，[BC。]而且他妻子的要求下进行的行为{CJs}。,200205204525200035,日本,2,200205,如何看待“安乐死”,65,55,63,70,51,286,C,
在世界上这种问题日益增多。,200205204525100066,日本,1,200205,如何看待“安乐死”,50,55,27,47,35,193,未参加,
我觉得是因为人的生死并不是{CD本人}他一个人的问题，而是跟他周围的人，特别是跟亲威都有非常大的关系。,200205204525200080,日本,2,200205,如何看待“安乐死”,75,75,60,72,70,342,B,
我的阿姨是选择安乐死{CJ-zxy的人}之一。,200205204525100178,日本,1,200205,如何看待“安乐死”,65,70,21,60,46,248,未参加,
如果这件事发生在古代的话[BQ，]任何人都了解他的心情，而且支持他勇敢{CC敢}的行动。,200205204525100190,日本,1,200205,如何看待“安乐死”,65,55,33,65,37,237,未参加,
所以我认为，只能治身体上的病的医生，不管心理上的问题的医生，不应该叫医生。,200205201525200009,日本,2,200205,如何看待“安乐死”,70,75,55,63,68,320,C,
很多国家法律上还没承认[F認]“积极安乐死”。,200205201525200021,日本,2,200205,如何看待“安乐死”,65,70,77,65,68,331,C,
为什么这样做呢，就是为了避免自杀的发生。,200205201635200142,俄罗斯,2,200205,如何看待“安乐死”,90,75,58,63,63,343,C,
姐姐也爱妈妈，就要母亲[F親]欣赏自己的成就。,200210529529251002,泰国,2,200210,如何解决“代沟”问题,65,60,31,47,50,236,未参加,
然而，如今的社会是竞争的社会，是复杂的社会，人与人之间的交情、交往也不像[B象]以前那样能以最简单的方式去体会、解决，因此，{CD在上代人看来，}后一辈人的行为方式、[BC，]生活态度以及他们的价值观念在上一辈人看来[B人]，完全不一样。,200210529529251023,泰国,2,200210,如何解决“代沟”问题,75,85,78,91,93,415,B,
他们受了不少苦才养我们如此长大、如此有前途{CJba}。,200210529529251031,泰国,2,200210,如何解决“代沟”问题,70,70,53,54,57,292,C,
这些话都是我们常听到的。,200210540540250015,印度尼西亚,2,200210,如何解决“代沟”问题,70,65,62,71,86,340,C,
双方建立{CD在}有{CC1具有}共同的语言、[BC，]共同的心声、[BC。]共同的举动，才能双方协调，心平气和，欢聚一堂。,200210540540150050,印度尼西亚,1,200210,如何解决“代沟”问题,70,70,56,67,86,337,C,
也疏远了，所谓家庭教育也无法实行。P},200210540540250100,印度尼西亚,2,200210,如何解决“代沟”问题,65,70,51,45,48,265,未参加,
在家庭晚会{CQ上}可以{CC2能}谈谈每一个人的一星期活动和生活与朋友问题。,200210540922250106,美国,2,200210,如何解决“代沟”问题,60,65,42,38,41,229,未参加,
P}我们家人{CC一家}之间最难跟[B更]我们沟通的是小弟，因为{CC因}他{CD还}{CJ-sy有}和年轻一代的朋友一样的想法[BQ，]例如他同意现在的同居和试婚的风气，认为这样{CD的}{CQ有}助于以后婚姻生活的美满{CD建立}，还说{CD如}在{CJX}少女十三到十八岁已有性经验[F驗]{CD的}才好。,200210540540250110,印度尼西亚,2,200210,如何解决“代沟”问题,65,60,26,45,50,229,未参加,
在走投无路时，我差不多每个周末就上教育局去求情，[BC。]但每次总扫兴而归。,200205109519200479,马来西亚,2,200205,如何面对挫折,70,90,78,71,77,379,B,
不然就补考，到最后毕不了业，不仅自己找不到工作[BQ，]父母的脸也不知往哪搁{CC丢}。,200205109513200754,柬埔寨,2,200205,如何面对挫折,80,70,62,60,73,335,C,
当时，我很生气，也觉得没面子去见人，整天呆在房间里，连饭也不多吃。,200205109634200788,英国,2,200205,如何面对挫折,80,80,87,84,70,393,B,
这{CD个}一年虽然过得{CC的}很苦，可是我觉得我还是克服{CQ了}这个困难。,200205109548100901,塔吉克斯坦,1,200205,如何面对挫折,70,65,42,36,48,247,未参加,
不过，这个东西可别让爸吃了。,200205680519250017,马来西亚,2,200205,一封写给父母的信,90,85,81,77,92,422,B,
可能它们少了妈妈的味道。,200205680519250019,马来西亚,2,200205,一封写给父母的信,80,85,81,75,84,399,B,
祝您俩喜乐安康！,200205680519250031,马来西亚,2,200205,一封写给父母的信,75,80,65,75,88,374,B,
它充满着希望和梦。,200305533525250016,日本,2,200305,我最喜欢读的一本书,60,65,55,63,58,284,未参加,
[BQ]一直以来，我最喜欢也最有兴趣阅读的是有关于医学保健的书籍。,200305533533250012,新加坡,2,200305,我最喜欢读的一本书,60,55,63,56,54,269,未参加,
这让[Y]父亲[F親]{CD父親}很伤心。,200305533533250029,新加坡,2,200305,我最喜欢读的一本书,65,60,60,56,45,269,未参加,
如果去旅游的话，可以了解别的地方的文化、民族，[BC。]可以体会到很多事。,200304131525200101,日本,2,200304,我学汉语是为了……,60,70,30,43,26,214,未参加,
所以我想去外国试一试，哪一个国家适合我。,200304131525100141,日本,1,200304,我学汉语是为了……,65,70,44,38,57,260,未参加,
我学汉语的目的主要是为了了解中国人。,200304131525100162,日本,1,200304,我学汉语是为了……,70,70,56,63,91,338,C,
16岁时我高中退学了，当时我不知我要做什么才好，天天打工赚钱就去玩儿花钱。,200304131525100244,日本,1,200304,我学汉语是为了……,65,70,38,57,43,259,未参加,
综上所述，人绝对不可以在静音环境里生活。,200305576525200016,日本,2,200305,静音环境对人体的危害,70,85,80,76,71,374,B,
像开车那样{CQ的}大噪声对人体健康有害{CD的}。{CP那我们追求静音的环境去{CD很},200305576525200022,日本,2,200305,静音环境对人体的危害,65,65,41,60,68,283,未参加,
适量的声音使我们{CQ的}生活更加愉快、舒畅。,200305576525200047,日本,2,200305,静音环境对人体的危害,70,80,74,87,88,389,B,
这是我对这个法例在本地实行的个人意见。,200405109523200214,韩国,2,200405,吸烟对个人健康和公众利益的影响,40,70,16,27,44,177,未参加,
吸烟的人还有权在私人场[F場]所吸烟，可是在公共场[F場]所一定要管，{CJ-zhuy这}利于大众。,200405109922100688,美国,1,200405,吸烟对个人健康和公众利益的影响,65,70,71,56,61,309,C,
我们正在发展社会住{WWJ},200405109635201490,俄罗斯,2,200405,吸烟对个人健康和公众利益的影响,65,75,38,35,50,250,未参加,
我建议[B意]应[B已]该以{CC为}罚款[Pkuan]为本，我觉得{CC的}其他的措施像[B象]呆到警察[Pjingcha]局不是很合适{CC适合[B和]}。,200405109801101637,澳大利亚,1,200405,吸烟对个人健康和公众利益的影响,50,75,55,39,44,247,未参加,
科学研究表明香烟里的有害因素对不吸烟的人的健康也有很大的影响，而且他们受的影响比吸烟者受的还要大。,200405109608101881,波兰,1,200405,吸烟对个人健康和公众利益的影响,90,85,52,58,73,355,C,
”说这样的话的人就{CQ是}不了解现代社会的解桶{CJ?}。,200405109922101902,美国,1,200405,吸烟对个人健康和公众利益的影响,80,90,67,46,64,342,C,
首先，抽烟对吸烟者来说，会引起各种各样的疾病，一点儿好处都没有。,200405109540200206,印度尼西亚,2,200405,吸烟对个人健康和公众利益的影响,75,80,67,46,67,326,C,
每一个人应该从小养成良好的习惯。,200405109633200264,意大利,2,200405,吸烟对个人健康和公众利益的影响,55,80,51,35,50,257,未参加,
18岁之前禁止购卖烟的措施可以避免更[B便]多年青人开始吸烟。,200405219635200007,俄罗斯,2,200405,吸烟对个人健康和公众利益的影响,70,65,71,58,63,313,C,
所以要洁身自好{CC洁[F潔]生自爱[F愛]}，不要吸烟，这[F這]样不仅[F僅]对[F對]自己的身体无害，对[F對]公众的利益也有莫大的好处[F處]。,200405522522150016,缅甸,1,200405,吸烟对个人健康和公众利益的影响,85,85,74,74,82,395,B,
旁人也就不必多受罪了。,200405522522250012,缅甸,2,200405,吸烟对个人健康和公众利益的影响,85,95,74,70,75,395,B,
所以，对孩子最有责任的就是父母。,200505109525100037,日本,1,200505,父母是孩子的第一任老师,60,70,49,61,67,292,未参加,
现代社会上不负责任的父母也越来越多，也有的父母只顾孩子学习{CC学力}问题，不顾孩子全面成长，这种情况会导致孩子逃学、犯罪等一系列社会问题。,200505109525200093,日本,2,200505,父母是孩子的第一任老师,60,75,67,59,81,328,C,
跟学校的老师不同的地方是父母并没有意识把这些东西教给孩子。,200505109525200407,日本,2,200505,父母是孩子的第一任老师,75,85,65,67,76,361,B,
我长大了{CJX}{CQ在}这样的家庭。,200505109525200513,日本,2,200505,父母是孩子的第一任老师,60,60,50,56,51,259,未参加,
孩子会自然模仿{CC模范[F範]}父母的行动、[BC，]口气。,200505109525200575,日本,2,200505,父母是孩子的第一任老师,65,60,39,42,48,237,未参加,
回想起来，我现在的性格有很多地方都是受父母的影响而形成的，无论是从他们的言行{CC言动}还是从他们的兴趣爱好里，都{CJX}{CD使}我学到了很多很多珍贵的东西。,200505109525200731,日本,2,200505,父母是孩子的第一任老师,95,85,74,72,87,411,B,
我认为父母真的是孩子的第一老师，我觉得我的第一老师就是我的父母真是个好老师{CJZR}，如果我的第一老师不是他们，那么可能没有我这样的女孩，甚至我不在中国留学了。,200505109525201241,日本,2,200505,父母是孩子的第一任老师,65,75,53,51,59,290,未参加,
比如说，依赖[C]“妈妈助理”是最近出现的一种照顾孩子的新方法。,200505109525101476,日本,1,200505,父母是孩子的第一任老师,65,55,41,37,50,230,未参加,
到现在{CQ为止}，我完全没有结婚的打算，[BC、]也没有当家庭主妇的愿望。,200505217525200101,日本,2,200505,父母是孩子的第一任老师,65,90,73,63,74,356,C,
我来到中国以后，比以前{CJX}对父母亲的感激{CC2感谢情}增多了。,200505204525100090,日本,1,200505,父母是孩子的第一任老师,60,60,46,39,50,237,未参加,
他说[BQ：]“最近增加了{CJX}青少年犯罪的主要原因{CJ+zy主要}是传入欧美文化的影响，以前的传统教育思想{CC思[C]考}衰退了。,200505204525200112,日本,2,200505,父母是孩子的第一任老师,70,60,37,57,56,265,未参加,
如果父母在生活[C]上，不讲文明，做不好的事，孩[C]子一看父母[C]的行动就向父母学习。,200505204525200429,日本,2,200505,父母是孩子的第一任老师,75,75,41,49,65,295,未参加,
当一个人生下来时，第一次接触的人就是父母。,200505204525200483,日本,2,200505,父母是孩子的第一任老师,90,60,73,67,74,354,C,
但是他们对自己也非常严格。,200505204525100543,日本,1,200505,父母是孩子的第一任老师,55,50,50,49,76,259,未参加,
所以我从小到现在在这些快餐[C]{CQ店}吃饭的机会很少。,200505204525200575,日本,2,200505,父母是孩子的第一任老师,55,70,58,61,65,293,C,
这次我要谈[B淡]谈[B淡][BD，]我在家[B假]乡度假{CC度过}的方式{CC办法}。[BC，],200105205525100032,日本,1,200105,我的一个假期,70,70,52,61,50,291,C,
”爸爸笑笑说[BQ：]“是啊！,200110919919100011,加拿大,1,200110,我的一个假期,95,75,92,68,92,417,B,
例如我竟然不懂如何坐小巴，反而要向一位老婆婆问[F問]路。,200110919919200012,加拿大,2,200110,我的一个假期,75,85,50,58,74,335,C,
所以我有时间的话应该去帮她。,200105271525200005,日本,2,200105,我的一个假期,65,75,70,65,70,332,C,
在一年中能够收到最{CC很}多{CQ的}钱的一天。,200105271525200022,日本,2,200105,我的一个假期,70,75,60,58,55,307,C,
找了半天但找不到，我的好朋友××对我说：“××我们好像[B象]迷路了。,200105271525200024,日本,2,200105,我的一个假期,70,75,39,63,46,282,未参加,
第五天，我们坐上{CC2上}开往兰州的火车了。,200105271525200027,日本,2,200105,我的一个假期,65,70,60,68,63,312,C,
我们先坐空中缆[C]车到风景区，然后自己步行登山。[BC，],200105271525200071,日本,2,200105,我的一个假期,65,80,52,37,48,270,未参加,
她高中毕业以后，跟高中二年级时认识的{CC了}比她大五岁的男人结婚了。,200105217525200012,日本,2,200105,我的一个假期,70,85,52,37,35,271,未参加,
他{CD就}让我上车，[BC、]一直握着我的两[B二]只手说{CD了}[BQ：]“对不起，太冷了吧！,200105217525200080,日本,2,200105,我的一个假期,65,70,62,70,57,310,C,
海南再怎么{CC3如何}好玩儿{CJ+zxy的地方}，我一个人在海南过春节{CJ-zy也}肯定没意思。,200105204525200085,日本,2,200105,我的一个假期,65,75,42,56,68,293,未参加,
也喜欢花。,200105550523250070,韩国,2,200105,一封写给父母的信,65,70,27,28,40,216,未参加,
我想，世界上什么都莫过于健康重要。,200105550523250074,韩国,2,200105,一封写给父母的信,65,70,68,54,51,294,C,
当时我假装不{CC没有}知道。,200105550523150089,韩国,1,200105,一封写给父母的信,65,70,36,35,49,241,未参加,
我在一心一意地准备，可说不定{CQ是否}{CQ能}考得好。,200105550523150090,韩国,1,200105,一封写给父母的信,65,70,38,39,61,259,未参加,
母亲也每天担心，儿子的生活，吃的东西，穿的衣服等等。,200105550523150101,韩国,1,200105,一封写给父母的信,70,65,49,54,56,280,C,
想起来我4[BD～]５岁时，你们问了问，爸爸妈妈中谁{CJX}更喜欢。,200105550523150106,韩国,1,200105,一封写给父母的信,75,65,38,39,63,267,未参加,
我应该[B刻]要学习{CD关于}中国历史，中国文化和中国文学，还需要准备实用{CC用}汉语口考。,200105550523250138,韩国,2,200105,一封写给父母的信,65,75,27,39,49,242,未参加,
亲爱的爸爸、妈妈我一想你们就感到对不起，尤[B无]其我刚上大学的时候[BQ，]常做让你们但心的事情。,200105550523250142,韩国,2,200105,一封写给父母的信,70,60,33,30,42,220,未参加,
我以前不觉得我父母老了。,200105550523150147,韩国,1,200105,一封写给父母的信,65,70,49,54,51,275,未参加,
你们等着瞧就好了。,200105550523250149,韩国,2,200105,一封写给父母的信,70,70,52,42,70,292,未参加,
亲爱的爸和妈你们好！,200105550523250163,韩国,2,200105,一封写给父母的信,70,75,33,32,38,237,未参加,
不是每天每天很想见家人。,200105550523250163,韩国,2,200105,一封写给父母的信,70,75,33,32,38,237,未参加,
下次再聊了。,200105550523250163,韩国,2,200105,一封写给父母的信,70,75,33,32,38,237,未参加,
可是连一封信也没写，真对不起。,200105550523250175,韩国,2,200105,一封写给父母的信,70,70,52,56,61,297,C,
我动手术后不能{CJ-sy干}什么工作时，你们倒鼓励[B历]我。,200105550523150211,韩国,1,200105,一封写给父母的信,65,70,49,56,63,289,C,
我想给妈妈报恩的最佳方法就是找好的工作。,200105550523150215,韩国,1,200105,一封写给父母的信,70,65,60,49,67,297,C,
我很对不起你们，他那么痛，可我除了只会他想吃的菜{CJX}做以外什么都做不了。,200105550523250254,韩国,2,200105,一封写给父母的信,60,65,49,54,51,262,未参加,
这样你们能看到我取得成功的样子。,200105550523250277,韩国,2,200105,一封写给父母的信,75,75,60,63,74,337,C,
我要找个我会的事，你们别担心。,200105550523250369,韩国,2,200105,一封写给父母的信,65,75,60,73,51,311,C,
那时我觉得从{CC离}家到学校很远，一天在路上费[B废]的时间太[B态]多，所以我在学校附[C]近租[B组]一间房子比较好。[BC，],200105550523250392,韩国,2,200105,一封写给父母的信,70,65,52,49,65,287,未参加,
我非常爱你们。,200105550523250409,韩国,2,200105,一封写给父母的信,75,65,49,51,61,288,未参加,
哥哥呢，最近回来得很晚。,200105550523250410,韩国,2,200105,一封写给父母的信,60,70,49,37,42,243,未参加,
以每学期的奖[C]学金来解[C]决学费。,200105550523150418,韩国,1,200105,一封写给父母的信,65,65,58,68,76,316,C,
”但是我很紧张，听不懂他说话的意思。,200105550523250422,韩国,2,200105,一封写给父母的信,65,65,44,28,42,228,未参加,
”我自己也还不大清楚我的未来，现在我只{CJX}能做的是努力学习，关于我自己{CJ-zxy的事情}{CJX}想好。,200105550523250480,韩国,2,200105,一封写给父母的信,70,70,60,61,54,303,C,
经过岁月的风波已变得{CC变成}{CJ+dy一个}像龟[C]的背部似的裂[C]开着，黑乎乎的{CC地}，让我不知不觉地流下眼泪。,200105550523150500,韩国,1,200105,一封写给父母的信,70,65,41,39,61,262,未参加,
一直到现在我很忙，所以没给你们写信，真对不起。,200105550523150502,韩国,1,200105,一封写给父母的信,70,70,27,51,45,251,未参加,
我感到在个人的好友{CD关系}面前{CC之前}任何国境都不存在。,200105206525200003,日本,2,200105,我的一个假期,75,80,62,58,61,327,C,
通过这段传说，我可以得{CC学}到两个教训。,200105109525100058,日本,1,200105,由“三个和尚没水喝”想到的……,80,75,68,77,73,364,B,
对环境有破坏作用的产品{CC制品}，应该{CJX}大家都不使用。,200105109525200081,日本,2,200105,由“三个和尚没水喝”想到的……,65,80,52,64,91,340,C,
可是由于方便、省钱等{CD的}好处，很多人都还不主动采取为环保{CJX}{CD的}行为。,200105109525200081,日本,2,200105,由“三个和尚没水喝”想到的……,65,80,52,64,91,340,C,
大家都知道{CD的}这个故事，两个和尚一起挑水的话，没发生问题。,200105109525100205,日本,1,200105,由“三个和尚没水喝”想到的……,65,60,45,71,61,285,未参加,
是因为很多人在一起时，有些人觉得自己去做很麻烦，而替别人去做是对自己来说像吃亏{CC2吃亏损}一样没有道理{CJZR}，而且很麻烦。,200105109525200210,日本,2,200105,由“三个和尚没水喝”想到的……,70,75,57,69,73,333,C,
他们又想一想{CJcd}了别的办法。,200105109525200241,日本,2,200105,由“三个和尚没水喝”想到的……,65,60,50,64,61,283,未参加,
所以我认为这个故事告诉我们要{CJcd多多}做[B作]别人不愿意{CJ-sy做}的工作。,200105109525200259,日本,2,200105,由“三个和尚没水喝”想到的……,70,70,61,66,68,323,C,
虽然人都有自己的想法{CC考法}、[BC，]看法、[BC，]说法等。,200105109525100328,日本,1,200105,由“三个和尚没水喝”想到的……,65,60,32,35,41,216,未参加,
我看{CQ了}三个和尚没水喝的短文，就想起了{CD这}小学时的这{CC一}个教训。,200105109525200363,日本,2,200105,由“三个和尚没水喝”想到的……,65,80,70,51,68,322,C,
而且她又不是日本人。,200105109525200422,日本,2,200105,由“三个和尚没水喝”想到的……,65,55,88,73,84,347,C,
个人主义、利己也是可以理解的。,200105109525100524,日本,1,200105,由“三个和尚没水喝”想到的……,70,75,79,77,91,381,B,
希望别人做[B作]我该做[B作]的事情，尽量让别人做[B作]。,200105109525100525,日本,1,200105,由“三个和尚没水喝”想到的……,80,70,66,71,68,345,C,
还有在{WWJ},200105109530100576,土耳其,1,200105,由“三个和尚没水喝”想到的……,75,60,54,33,68,276,未参加,
他们能喝水了。,200105109525100617,日本,1,200105,由“三个和尚没水喝”想到的……,60,55,25,31,28,180,未参加,
对离婚的观念来说，各有各的看法及观念。[BC，],200109684542250001,越南,2,200109,我对离婚问题的看法,80,85,65,34,30,288,未参加,
在这样的情况下，人们要再找自己的幸福，但我认为离婚[B姻]不是唯一的办法，人们可以在自己的家庭里再找出自己的幸福，人们应该互相了解、互相尊重[BQ，]因为他们之间还有家庭责任感。,200109684542250002,越南,2,200109,我对离婚问题的看法,80,70,40,38,50,268,未参加,
按照法律，安乐死一定不可允许。,200205205525100010,日本,1,200205,如何看待“安乐死”,70,55,63,72,61,305,C,
主要有两个理由。,200205205525200024,日本,2,200205,如何看待“安乐死”,65,60,60,65,61,294,C,
这个技术给我们带来什么样的结果。,200205205525200038,日本,2,200205,如何看待“安乐死”,75,70,66,60,49,309,C,
我自己本人是很同意“安乐[F樂]死”的。,200205205525200106,日本,2,200205,如何看待“安乐死”,75,70,85,65,61,345,C,
这{CQ个}电视剧看完以后我{CJ-zy就开始}考虑“安乐死”{CJ-zxy的问题}。,200205206525200022,日本,2,200205,如何看待“安乐死”,80,75,41,54,49,290,未参加,
这样一来，我觉得安乐死的问题是很难解决，{CJsd}而且帮助病人自杀的人在法律上被认为是{CC4受到}故意杀人罪的话，非常麻烦。,200205206525200053,日本,2,200205,如何看待“安乐死”,60,60,27,49,46,224,未参加,
我是一个日本留学生。,200205206525200066,日本,2,200205,如何看待“安乐死”,90,80,83,90,91,429,A,
安乐死这个难题，难就{CC是}难在其定义上，同时这个问题会涉及到“死亡”的概念。,200205206525200082,日本,2,200205,如何看待“安乐死”,75,70,63,81,77,355,C,
