错句,作文编码,国籍,性别,考试时间,作文题目,口试分数,作文分数,听力分数,阅读分数,综合分数,总分,证书
当然我也有可爱乖巧的一面，例如爸爸工作回来，我会帮他换上他心爱的拖[B托]鞋[BQ；]妈妈如果不开心，我会想方设法地逗她笑；哥哥被爸妈责骂时，我会安慰他。,200110540540150002,印度尼西亚,1,200110,我的童年,75,95,90,73,79,406,B,
最有意思的是所包的糖果[D所]有很漂亮的糖纸，而且还有一些赠送品是加入半斤装的包装里，往往[BD，]那些小东西会令我们爱不释[B择]手。,200110540540250043,印度尼西亚,2,200110,我的童年,80,70,74,49,90,353,C,
小时候，由于父亲工作的缘[B原]故，所以，我们一家大小都迫于无奈地随着父亲工作的转换而一而再、再而三地迁动。,200103680519201604,马来西亚,2,200103,我的童年,85,90,83,83,100,437,A,
看见幼小的弟妹被人欺负，我这做二姐的有时也会帮他们出头，然而也遭到被打、被骂的命运。,200103680519201607,马来西亚,2,200103,我的童年,90,85,50,47,80,349,未参加,
我提个小竹篮，帮外婆拾鸭蛋去了。,200103680519201612,马来西亚,2,200103,我的童年,85,85,86,83,93,427,A,
我并不是出生于一个豪华富贵的家庭，可是，它是一个带给我安全和温暖的家。,200103680519201618,马来西亚,2,200103,我的童年,90,85,56,60,76,364,C,
我觉得我自己很笨，离着那么近，却看得不清楚。,200104124501200069,中国,2,200104,一封写给父母的信,90,75,55,49,72,335,未参加,
同时也加强政治学习力度。,200104124510100278,朝鲜,1,200104,一封写给父母的信,85,75,74,68,79,373,B,
一上来问一大堆问题。,200104124520200331,蒙古国,2,200104,一封写给父母的信,65,90,58,51,70,325,C,
车上时，我很想跟本地人聊天儿，打听这个节日的情况。[BQ，],200105610610250209,法国,2,200105,我的一个假期,70,80,57,61,63,321,C,
我春节回家。[BC、],200105550523150032,韩国,1,200105,一封写给父母的信,65,75,60,51,67,305,C,
那天，我没有时间而没买礼物，只给您钱了。,200105550523250299,韩国,2,200105,一封写给父母的信,60,65,41,44,49,242,未参加,
我常打电话问候时，妈妈的声音有生气，我也{CJX}心情变好。,200105550523250299,韩国,2,200105,一封写给父母的信,60,65,41,44,49,242,未参加,
我这样给你们写信好像[B象]{CJ-buy是}很久很久的事情了。,200105550523250331,韩国,2,200105,一封写给父母的信,70,75,47,44,47,272,未参加,
您非常不喜欢晚睡晚起。,200105550523250340,韩国,2,200105,一封写给父母的信,75,65,44,47,49,267,未参加,
对不起。[BC.],200105550523250354,韩国,2,200105,一封写给父母的信,65,70,41,54,54,270,未参加,
现在{CC到今}想起，我真想哭。,200105550523250469,韩国,2,200105,一封写给父母的信,65,70,49,70,63,303,C,
我们首先坐火车到敦煌去了。{CQ在},200105224525200008,日本,2,200105,我的一个假期,70,75,77,79,83,373,B,
真让我放松。,200105302525200046,日本,2,200105,我的一个假期,65,70,67,51,50,289,C,
我认为这个故事教我们“别依靠别人，应该有独立心”。,200105109525200597,日本,2,200105,由“三个和尚没水喝”想到的……,65,70,61,55,57,294,C,
这样，两个人的目的一样的情况下，互相帮助、[BC，]互相协助{CC协力}是一种很好的方法。,200105109525200599,日本,2,200105,由“三个和尚没水喝”想到的……,70,70,48,62,53,291,C,
比如说，什么时候，谁去山下抬{CC拾}水。,200105109525200599,日本,2,200105,由“三个和尚没水喝”想到的……,70,70,48,62,53,291,C,
很多国家正在讨论怎样解决环保问题。,200105109525200601,日本,2,200105,由“三个和尚没水喝”想到的……,70,75,73,64,59,330,C,
不过每个人有自己的想法。,200105109525200695,日本,2,200105,由“三个和尚没水喝”想到的……,65,65,36,55,50,255,未参加,
由于我们学校的关系，因此父亲一个人去外地做工作。,200105109525100790,日本,1,200105,由“三个和尚没水喝”想到的……,80,70,70,84,70,364,B,
我想，妇女的辞职回家是浪费有益的人才的。,200106570525150004,日本,1,200106,如何看待“妻子回家”,65,85,52,74,77,343,C,
老教授语重心长的一番话[BD，]深深地震撼了我，是的，启蒙教育不可儿戏。[BC？],200203533533250003,新加坡,2,200203,记对我影响最大的一个人,90,85,76,70,82,400,B,
比方说，已经自杀的人是{CD不是}杀人犯了吗？,200205204525100002,日本,1,200205,如何看待“安乐死”,65,60,63,51,44,266,未参加,
为了现在在这样的情况下的人，法院制定{CC决定}安乐死规则{CC规定}。,200205204525200045,日本,2,200205,如何看待“安乐死”,65,60,19,60,54,241,未参加,
我认为每个人都有自己做决定的权利，[BC。]要是有人选[F選]择“安乐死”的话，应[B因]该尊重他的决定。,200205204525200145,日本,2,200205,如何看待“安乐死”,60,65,55,47,32,242,未参加,
当然每个人都想要{CC需求}开开心心地{CC得}过日子，死去时也尽可能不痛苦{CD的}，像睡觉一样死是最好的。,200205204525200188,日本,2,200205,如何看待“安乐死”,65,70,69,58,61,309,C,
对此事件有种种的问题。,200205212525100009,日本,1,200205,如何看待“安乐死”,65,80,66,54,61,314,C,
我想表示我对“安乐死”问题的意见。,200205209525200101,日本,2,200205,如何看待“安乐死”,75,75,41,67,72,320,未参加,
第二，是病人的要求或者家属的要求，还有在法律上不是{CJ+dy一个}犯罪。,200205201540100083,印度尼西亚,1,200205,如何看待“安乐死”,80,80,35,54,65,306,未参加,
人们的生活肯定以{CC用}生存为{CC的}前提。,200205201525200094,日本,2,200205,如何看待“安乐死”,75,70,52,70,54,310,C,
所以我觉得{WWJ},200205201525100170,日本,1,200205,如何看待“安乐死”,75,65,16,49,51,243,未参加,
首先，父母跟孩子应该找时间来讨论问题，无论什么事都[L]可以商量。,200210529529251008,泰国,2,200210,如何解决“代沟”问题,70,65,51,40,53,265,未参加,
俗话说“环境造就人”[BQ，]人在好的环境中成长，会造就出一个优秀的人。,200210529529251022,泰国,2,200210,如何解决“代沟”问题,75,65,59,58,55,299,C,
做子女的就应该有高度的谅解而需有明显[F顯]的分析。P},200210540540150054,印度尼西亚,1,200210,如何解决“代沟”问题,70,65,28,58,68,275,未参加,
千万不要有：“养子防老”，或养子当成是一种“储蓄”的错误观念。{CP如有这种要不得的思想观念，那就是家庭{CD中},200210540540250062,印度尼西亚,2,200210,如何解决“代沟”问题,70,70,70,60,73,331,C,
老人从小就娇惯{CC惯[C贯]娇}他们{CJ+by不好的作风}，例如在食物的选择{CQ上}，正在发育成长的孩子都应该吃富有营养的食物，牛奶及多种维打命，使孩子成长为强壮[B状]和有智慧的接班人。P},200210540540250102,印度尼西亚,2,200210,如何解决“代沟”问题,75,65,65,65,50,307,C,
如果老一辈的人始终以自己勤俭自制的习惯{CC2心}{CQ在}各方面制约{CC约制}孩子（年青人），我想也太守旧一些吧。,200210540540250126,印度尼西亚,2,200210,如何解决“代沟”问题,65,70,51,65,91,328,C,
热爱生活的人知道他们必须面对困难，[BC。]活下去是最重要的。,200205109631200448,希腊,2,200205,如何面对挫折,80,65,42,47,41,263,未参加,
以后[BQ，]我相信无论有多大{CQ的}挫折[BQ，]我都会解决的。,200205109540200518,印度尼西亚,2,200205,如何面对挫折,75,65,78,69,57,331,C,
乐观主义[B意]者必定会把它看为一种挑战。,200205109634200788,英国,2,200205,如何面对挫折,80,80,87,84,70,393,B,
不是有一句著名的话说[BD：]“失败是成功的母亲”吗？,200205109610101076,法国,1,200205,如何面对挫折,80,80,65,71,57,345,B,
挫折是世上每一个人都会遇到的事，可是怎么去面对，[BC、]每一个人都有不同的方法。,200205109634201080,英国,2,200205,如何面对挫折,65,70,76,89,64,350,C,
到此搁笔！,200205680519250024,马来西亚,2,200205,一封写给父母的信,80,75,73,67,74,360,B,
请原谅我许久没给您们捎信。,200205680519150036,马来西亚,1,200205,一封写给父母的信,80,70,68,65,80,353,C,
女儿，××上5、2002,200205680519250035,马来西亚,2,200205,一封写给父母的信,90,80,75,77,90,407,B,
五年前我第一次来中国，那时候亲眼看到的中国人和以前想像的中国人是完全不一样的。,200304131525200128,日本,2,200304,我学汉语是为了……,65,80,56,38,40,267,未参加,
我已经3年级下，时间不太多，除了汉语以外，还要学习的事情很多。,200304131525100143,日本,1,200304,我学汉语是为了……,60,70,12,10,54,191,未参加,
以前{CD当}没有严格的规定时，人们经常在公共场所吸烟，比如车站，公用厕所，饭馆里面等。,200405109529201183,泰国,2,200405,吸烟对个人健康和公众利益的影响,90,80,74,58,73,370,B,
中国也在发展。,200405109548101733,塔吉克斯坦,1,200405,吸烟对个人健康和公众利益的影响,60,65,38,39,39,224,未参加,
不只是对个人身体{CJ-sy有害}，而且{CC2而}对周围人们的身体和健康也{CC都}有着非常大的影[Pyíng]响。,200405109616201811,德国,2,200405,吸烟对个人健康和公众利益的影响,75,90,88,79,82,408,A,
抽不抽烟毕竟是自己的选择。,200405109922101901,美国,1,200405,吸烟对个人健康和公众利益的影响,80,95,52,52,53,327,未参加,
我非常支持这[B过]一项规定。,200405109529200155,泰国,2,200405,吸烟对个人健康和公众利益的影响,70,75,64,50,77,325,C,
如果有人一边走一边抽烟，他就会被罚款得很严厉{CC严格}。,200405109633200264,意大利,2,200405,吸烟对个人健康和公众利益的影响,55,80,51,35,50,257,未参加,
还有一个问题，那{CJ-zy就}是青少年看成人吸烟会{CD更愿意}自己开始吸。,200405204634100335,英国,1,200405,吸烟对个人健康和公众利益的影响,70,85,30,28,27,232,未参加,
这样全国人民的生活水平也{CJ-zy会}提高起来，同时也{CJ-zy会}出现很多的人才。,200405522522250017,缅甸,2,200405,吸烟对个人健康和公众利益的影响,70,80,35,33,68,276,未参加,
还听说有一个女人因为抽烟，{CD所以}她的孩子一生下来就死了。,200405522522250024,缅甸,2,200405,吸烟对个人健康和公众利益的影响,90,85,77,60,75,384,B,
在公共场所，在路上一边走一边抽烟的人也将要被罚款。,200405522522250025,缅甸,2,200405,吸烟对个人健康和公众利益的影响,70,65,44,47,49,261,未参加,
3，吸烟是无益消费，造成国家的财力和物力白白地浪费。,200405522522110003,缅甸,1,200405,吸烟对个人健康和公众利益的影响,65,95,71,92,100,414,B,
吸烟可以使人兴奋，但是它对身体的危害是不可忽略的。,200405209616200089,德国,2,200405,吸烟对个人健康和公众利益的影响,80,95,79,68,85,402,B,
这样的话，那么吸烟者为何{CC如何}无缘无故地让别[B拿]人吸您的第二手[B首]烟？[BC。],200405209542200116,越南,2,200405,吸烟对个人健康和公众利益的影响,65,65,44,35,49,242,未参加,
这项规定如果起作用，那{CD就}对不抽烟的人来说[BQ，]{CJ-zhuy它}一定会带来好处{CC利益}。,200405206635200126,俄罗斯,2,200405,吸烟对个人健康和公众利益的影响,70,65,44,47,47,259,未参加,
这次我辞职{CC退职}来中国留学的事情只有她一个人赞成。,200505109525100180,日本,1,200505,父母是孩子的第一任老师,70,85,53,40,64,304,未参加,
我自己不知道我为什么改变了，什么时候开始的。,200505109525200197,日本,2,200505,父母是孩子的第一任老师,60,75,56,42,47,266,未参加,
从父母讲的话中，慢慢领会什么是好、什么是不好。,200505109525200218,日本,2,200505,父母是孩子的第一任老师,80,65,53,63,69,318,C,
希望他们的孩子都好好长大。,200505109525200546,日本,2,200505,父母是孩子的第一任老师,65,80,77,67,72,349,B,
我们国家有一句话“孩子是看父亲的背而长大{CJsd}”[BQ，]这句话的意思就是父亲的行为都会影响到孩子。,200505109525200581,日本,2,200505,父母是孩子的第一任老师,60,60,79,65,64,310,未参加,
还有不但是最早，而且最长时间{CJX}影响孩子的成长。,200505109525100709,日本,1,200505,父母是孩子的第一任老师,85,65,69,79,66,353,C,
但是他在家里不{CC没}说自己辛[B亲]苦的心情。{CP他喜欢{CJ+sy说},200505109525100710,日本,1,200505,父母是孩子的第一任老师,65,65,55,31,61,261,未参加,
首先，我拿自己的经验来说[BD，]父母可以给孩子好影响的情况。,200505109525200640,日本,2,200505,父母是孩子的第一任老师,75,70,69,58,59,320,C,
幼小{CC幼[C]少}时期{CC2期}受过父母的暴力的人，自己有了孩子以后比较容易对孩子用暴力{CD的}。,200505217525100093,日本,1,200505,父母是孩子的第一任老师,60,75,56,57,72,306,未参加,
我觉得每个人的看[C]法不一样[C]，[BC.]但对我来说，我父母的影[C]响是我的很重要的东西，这个东西什么东西都[C]不能[C]代替。[BC.],200505217525200096,日本,2,200505,父母是孩子的第一任老师,60,65,31,39,52,230,未参加,
人类社会上的生活，比如，学{CJ+buy会}用语言和别人沟通{CJ+by意[C]思[C]}时，他们非要向周围的人学语言或者模仿他们的会话不[C]可，P}这时{CD在}最靠近这孩子[BQ、]作为他学{CJ+buy到}言语的标[F標]准的人就是[C]他父母{CD的}。,200505204525100142,日本,1,200505,父母是孩子的第一任老师,60,65,52,57,52,269,未参加,
因为孩子还没看过别人，到底不懂整个社会。,200505204525200152,日本,2,200505,父母是孩子的第一任老师,60,60,33,53,54,242,未参加,
我从小时候{CQ起}，把目标[F標]一直指向{CC向到}我父母亲。,200505204525100260,日本,1,200505,父母是孩子的第一任老师,65,50,37,41,52,226,未参加,
另外，孩子在实际{CD上}的生活中一定{CJ-zy会}遇到各种各样的事情。,200505204525100406,日本,1,200505,父母是孩子的第一任老师,75,65,48,39,65,279,未参加,
但是{CD我的}在我的性格上有{CD在}小时候的父母教育的影响。,200505204525100533,日本,1,200505,父母是孩子的第一任老师,65,65,56,47,63,280,未参加,
我母亲也比较讲究礼仪。,200505204525200539,日本,2,200505,父母是孩子的第一任老师,80,90,65,83,91,404,B,
孩子要崇拜[C]自己的父母[C]，[BC。]要建立{CC成立}好关系得{CC是}靠父母的行动。,200505204525200587,日本,2,200505,父母是孩子的第一任老师,45,70,46,53,52,248,未参加,
说实话{CC实在}，我第一天就想去找朋友。,200105205525200071,日本,2,200105,我的一个假期,65,65,72,54,52,292,C,
第一是在日本寒假期间过元旦，对日本人来说元旦是{CJX}跟中国的春节一样特别重要的节日之一。,200105271525200022,日本,2,200105,我的一个假期,70,75,60,58,55,307,C,
要不然的话，你会淹死的。,200105271525100058,日本,1,200105,我的一个假期,60,60,29,42,50,223,未参加,
那个场面真是给我带[B代]来了极大的震[B慎]撼[B憾]！,200105217525200071,日本,2,200105,我的一个假期,85,75,92,70,90,404,B,
等着吧。,200105550523250079,韩国,2,200105,一封写给父母的信,75,80,63,65,72,346,C,
不过，你们不用为我担心。,200105550523150090,韩国,1,200105,一封写给父母的信,65,70,38,39,61,259,未参加,
新生的时候我每次给你们写信的内容就是“我要回家”。,200105550523150098,韩国,1,200105,一封写给父母的信,65,70,52,39,54,266,未参加,
我希望她恢[B回]复[B腹]得很快。,200105550523150116,韩国,1,200105,一封写给父母的信,65,65,27,25,38,204,未参加,
以[B次]后{CJ-dy我的}学习的生活费都用自己的钱。,200105550523150155,韩国,1,200105,一封写给父母的信,65,60,33,63,47,251,未参加,
我呢。,200105550523250168,韩国,2,200105,一封写给父母的信,65,65,27,32,61,234,未参加,
祝你们两位幸福地过日子。,200105550523250214,韩国,2,200105,一封写给父母的信,75,65,49,47,63,286,未参加,
我有一个事情一辈子都忘不了。,200105550523250229,韩国,2,200105,一封写给父母的信,65,70,44,63,70,298,未参加,
妈妈老是理解我这样的心理，因此你等我下课以后回家，给我做好吃的东西，并且对我充分表达妈妈的爱。,200105550523250231,韩国,2,200105,一封写给父母的信,70,70,38,35,47,248,未参加,
好久没有联系，最近过得怎么样？,200105550523250248,韩国,2,200105,一封写给父母的信,65,65,36,37,49,236,未参加,
听说最好多休息，多喝{CC吃}水。,200105550523250260,韩国,2,200105,一封写给父母的信,65,70,63,49,51,284,C,
可是你别忘了你多么喜欢汉语。,200105550523250269,韩国,2,200105,一封写给父母的信,70,70,58,61,61,308,C,
爸爸，妈妈你们俩为我做出那么多事情，帮助我学习，我有心事都鼓励了我。,200105550523250275,韩国,2,200105,一封写给父母的信,80,75,63,56,63,328,C,
我为什么常常不听你们的话呢？,200105550523250279,韩国,2,200105,一封写给父母的信,75,70,58,47,47,286,C,
办法颇为简单。,200105550523250287,韩国,2,200105,一封写给父母的信,70,60,47,68,67,297,未参加,
对[F對]了，在1993年的那一年，您差占失去您的生命时[F時]，我深深的了解到您对[F對]我们[F們]家人有多大的善意。,200105550523250323,韩国,2,200105,一封写给父母的信,70,80,60,56,40,296,未参加,
虽然身体累一点儿，但我很满意，整天在家照顾孩子做家务多么气闷呢！,200105550523250356,韩国,2,200105,一封写给父母的信,75,75,74,65,65,344,B,
父母节后{CD天}，我就觉得{CC想起}我是很坏而不善良的女儿。,200105550523250384,韩国,2,200105,一封写给父母的信,65,65,79,61,67,321,C,
不瞒[B满]您说，我对我现在的工作不太满意并且我不愿继续在这儿一个人过日子。,200105550523250386,韩国,2,200105,一封写给父母的信,55,65,60,70,56,288,C,
我很健康，很用功而且过得比{CQ在}韩国还愉快得多。,200105550523250400,韩国,2,200105,一封写给父母的信,70,70,49,51,61,289,未参加,
不在{CJX}爸爸以后头一次遇到的‘父母节’对我来说很难过。,200105550523250431,韩国,2,200105,一封写给父母的信,60,65,38,54,42,242,未参加,
”听您说的时候，我突然觉得{CC不知不觉}很对不起您，因为只是{CJX}我给你几千{CJ-zxy元}的花，还有那花不是那么好看的{CJs}。[BC，],200105550523150435,韩国,1,200105,一封写给父母的信,65,60,38,37,45,228,未参加,
趁着这次机会，[BC、]我想说：“我真的{CC真实}很{CC深}爱你们。,200105550523250450,韩国,2,200105,一封写给父母的信,60,55,38,42,63,239,未参加,
而且像一个顽皮的孩子{CC5玩儿皮}那样生父母的气，任意行动。,200105550523150500,韩国,1,200105,一封写给父母的信,70,65,41,39,61,262,未参加,
宁愿被你责怪，真不想看你沉默[B黑]的表情。,200105550523250496,韩国,2,200105,一封写给父母的信,70,70,49,54,63,294,C,
”那时我自己觉得这说法算是理直[B知]气壮[B状]的反驳，不顾您的心情。{CJ-zy现在},200105550523150521,韩国,1,200105,一封写给父母的信,65,65,52,28,51,245,未参加,
每天随心所欲地跟朋友玩。,200105206525100035,日本,1,200105,我的一个假期,65,70,52,51,68,292,未参加,
假期时大多数的人去外地旅游等等[BD……]，[BC。]我认为这件事，开始工作以后也可以做{CC去}。,200105206525100037,日本,1,200105,我的一个假期,65,60,39,46,44,237,未参加,
只有勤勉的人才能成功。,200105109525100022,日本,1,200105,由“三个和尚没水喝”想到的……,70,85,70,69,86,372,B,
第三个是，只有一个人的话，没有组织。,200105109525200293,日本,2,200105,由“三个和尚没水喝”想到的……,75,65,61,80,97,365,C,
神一定会告诉三个和尚更好的办法。,200105109525200333,日本,2,200105,由“三个和尚没水喝”想到的……,70,60,66,58,75,314,C,
要是在世界上的每个国家[BD。]{CJ-zy都}像这三个和尚{CQ这样}做，[BC、]这地球快{CJX}就完了。,200105109525100353,日本,1,200105,由“三个和尚没水喝”想到的……,65,80,39,40,55,267,未参加,
在路上有很多梅树。,200105109525100432,日本,1,200105,由“三个和尚没水喝”想到的……,70,65,54,69,73,317,C,
三个和尚突然发现屋顶上着{CC点}了火就拼[Ppin]命地跑到山下挑水救火。,200105109919100528,加拿大,1,200105,由“三个和尚没水喝”想到的……,70,60,59,49,59,282,未参加,
”[BD。]可是，这里是山上呀。,200105109525100545,日本,1,200105,由“三个和尚没水喝”想到的……,70,65,43,44,59,267,未参加,
如果我们态度自私{CJsd}，那么，我们有什么难处的时候，他也会同样自私的。,200105109530100576,土耳其,1,200105,由“三个和尚没水喝”想到的……,75,60,54,33,68,276,未参加,
这个情况却不能继续。,200105109922100618,美国,1,200105,由“三个和尚没水喝”想到的……,65,70,61,51,68,301,C,
两[B俩]个和尚[B倘]的关系越来越不好。,200105109525200652,日本,2,200105,由“三个和尚没水喝”想到的……,65,60,57,64,59,288,未参加,
三个和尚想方设法，商量了很长时间。,200105109525200702,日本,2,200105,由“三个和尚没水喝”想到的……,65,65,39,58,66,277,未参加,
世上{CJy有}{CD的}普遍[B编]的上司下级{CC下司}的利害关系，而且频繁{CQ地}发生这样的事件，[BC、]没什么不可思议[B意]的。,200105109525200776,日本,2,200105,由“三个和尚没水喝”想到的……,65,65,43,44,48,249,未参加,
有一个荷兰的律师[B士]说[BQ：]“人都有活的权[F權]利，同样有死的权[F權]利。[BQ”],200205217525100013,日本,1,200205,如何看待“安乐死”,70,85,60,63,70,340,C,
我认为关于安乐死的问题里还包[B抱]括很多{CJ+dy解决的}法律问题。,200205205525200078,日本,2,200205,如何看待“安乐死”,75,70,69,60,51,314,C,
所以现在安乐死还没有被社会接受{CD了}。,200205205525200084,日本,2,200205,如何看待“安乐死”,70,80,44,54,56,294,未参加,
解决安乐死的方法我觉得遗书有用。,200205206525100039,日本,1,200205,如何看待“安乐死”,65,65,52,67,51,284,C,
很多人认为现在代沟问题很严重。,200209550523250005,韩国,2,200209,如何解决“代沟”问题,75,70,78,79,72,363,B,
通过这些途径[C]可以增加对上一辈人{CC1人们}的了解[C]。,200209550523250050,韩国,2,200209,如何解决“代沟”问题,70,70,94,76,90,388,C,
比如，每天晚上吃饭的时间也可以成为{CC使用}他们相互意见{CJX}交流的时间。,200209550523250055,韩国,2,200209,如何解决“代沟”问题,65,65,81,67,56,318,C,
其次，我们应该持向别人学习的态度。,200209550523250078,韩国,2,200209,如何解决“代沟”问题,60,60,54,54,70,280,未参加,
那么怎么解决[C]这个问[B门]题呢[B尼]？,200209550523150096,韩国,1,200209,如何解决“代沟”问题,65,60,60,59,36,263,未参加,
这几十年来，科学迅猛{CC孟迅}发展了。,200209550523250137,韩国,2,200209,如何解决“代沟”问题,60,60,39,67,64,272,未参加,
对话不足的家庭肯定没有家人{CC家族}之间{CQ的}互相了解。,200209550523250145,韩国,2,200209,如何解决“代沟”问题,70,60,69,52,58,294,未参加,
很自然地人们之间{CJ-zy会}产生{CC发生}意思{CJ-wy交流}不通的问题。,200209550523250162,韩国,2,200209,如何解决“代沟”问题,65,60,39,52,56,255,未参加,
我说的了解的意思是不要{CQ以}一个人立场来看或者了解，因为父母生活的小时候{CJX}跟孩子的年代{CQ的}生活方式有{CC是}很多地方不一样{CJ-zxy的地方}，而且随着社会的发展现在的年轻人[L]的思想{CJ+zxy方面}{CJ+sy是}跟老年人的相差很远{CC4差得很}。,200209550523250185,韩国,2,200209,如何解决“代沟”问题,0,55,24,35,38,143,未参加,
但东方国家的父母是{CJX}大部分对孩子的事这样对待：[BC，]不{CC1没有}关心[BQ，]只说父母的想法从来不听孩子的话。[BC，],200209550523250187,韩国,2,200209,如何解决“代沟”问题,60,60,66,64,38,270,未参加,
总之，代沟这个问题的起因{CC2发[C]生点}就是互相缺少{CC2无}关心，我们应该多关心，多了解对方。,200209550523150196,韩国,1,200209,如何解决“代沟”问题,60,65,63,69,58,298,C,
但是哥哥想进{CC入}历史系。,200209550523250194,韩国,2,200209,如何解决“代沟”问题,65,65,66,49,50,279,未参加,
因为“代沟”问题不是个人或家庭[C]问题，{CJ+zhuy这}是严重的社会[C]问题。,200209550523250204,韩国,2,200209,如何解决“代沟”问题,70,75,66,81,72,353,C,
因为父母在听的时候，{CQ如果}只顾{CJX}不理解孩子的话，没[C]有耐心地生气，{CD如此}这样[BQ，]孩子绝对不{CJ-zy会}说自己的真心话{CC3真心}，所以父母的态度很重要。,200209550523250207,韩国,2,200209,如何解决“代沟”问题,65,65,57,62,60,293,C,
