错句,作文编码,国籍,性别,考试时间,作文题目,口试分数,作文分数,听力分数,阅读分数,综合分数,总分,证书
妈妈从不教我怎么做，她说吃过的东西舌头会记住，自己去挑战。,200505109525201207,日本,2,200505,父母是孩子的第一任老师,90,85,83,72,88,415,A,
正是因为母亲每天重复去做的事情，而在孩子心中深深地记下来，让孩子去懂得自己应该做的事情，这就是教育的起源[BQ。]相反，如果一些为人父母的人没有严格地{CC的}去要求自己，每天过于懒散，或是做了一件自己认为平常无奇的事情，却在孩子的心里根深蒂固。,200505109925201272,墨西哥,2,200505,父母是孩子的第一任老师,95,95,76,58,99,422,B,
现在的我在姐姐和姐夫，还有西方人的教育下成了一个独立自主的人。,200505109922201930,美国,2,200505,父母是孩子的第一任老师,80,65,67,59,74,333,C,
正是在这个意义上，可以说“父母是孩子的第一任老师”。,200505109542102008,越南,1,200505,父母是孩子的第一任老师,70,75,46,49,65,294,未参加,
以父母和孩子组成的核家庭是一般的家庭形态。,200505109525102110,日本,1,200505,父母是孩子的第一任老师,50,55,37,71,63,255,未参加,
因为通过父母的话，连小孩也感觉到父母对工作特别认真，有理想。,200505109525202399,日本,2,200505,父母是孩子的第一任老师,55,60,64,64,71,295,未参加,
父母是孩子的第一任老师。,200505109525202486,日本,2,200505,父母是孩子的第一任老师,65,60,46,65,80,299,未参加,
父母是否孩子的第一任老师{CJs}我基本上赞同“父母是孩子的第一任老师”这个看法。,200505109525202509,日本,2,200505,父母是孩子的第一任老师,65,60,39,69,78,294,未参加,
总之{CC结之}，[BC、]父母养孩子的时候一定要注意自己的家庭。,200505109525202522,日本,2,200505,父母是孩子的第一任老师,60,65,41,55,43,247,未参加,
我还教我的孩子们怎么提高他们的汉语口语水平。,200505271736100124,尼日利亚,1,200505,父母是孩子的第一任老师,90,55,65,43,43,285,未参加,
孩子正是通过家庭来确定未来，所以父母的教育、家庭环境[BD、]{CD情节}等种种因素对孩子成长又[B有]都起重要作用{CC角[C]色}，因而{CC2而}父母教育极[B及]其重要。,200505204520200495,蒙古国,2,200505,父母是孩子的第一任老师,65,65,52,53,80,299,未参加,
这种偶然的相遇，体现了情人间的深层联[B连]系，不只是朋友的介绍，也不是认识[B实]已久的朋友，而是在千人、[BC，]万人之中相互连结而产生共鸣的感情。,200505951501150009,中国,1,200505,最理想的结交方式,70,60,68,62,79,324,C,
他们[F們]从[F從]小就是读[F讀]同一所学[F學]校，长[F長]大后[F後]也同样[F樣]读[F讀]台大。,200505951501250011,中国,2,200505,最理想的结交方式,55,55,73,55,68,286,未参加,
没有激情，只有深刻的了解，至今已结婚七年，没有大声[F聲]相对[F對]过[F過]。,200505951922250014,美国,2,200505,最理想的结交方式,95,90,93,80,97,454,A,
最后[F後]，[BC、]我想告诉[F訴]大家，不论[F論]是以什么样的方式认[F認]识[F識]或结婚，[BC。]最重要的是婚后[F後]要“以和为[C]贵[F貴]”。,200505522522250012,缅甸,2,200505,最理想的结交方式,60,90,77,64,82,363,C,
通过亲戚介绍[F紹]慢慢了解，[BC。]{CJ-zhuy这}是我最理想的结[F結]交方式。,200505522522250026,缅甸,2,200505,最理想的结交方式,70,75,70,60,73,337,C,
如果你们[L]是在一个[F個]偶然的机[F機]会[F會]相遇，彼此一见[F見]倾[F傾]心，都认为对方是自己理想中的那一个[F個]，从而迅速落入了情网，那你就大错[F錯]特错[F錯]了。,200505522522250030,缅甸,2,200505,最理想的结交方式,45,65,48,49,44,231,未参加,
当然每个人的观点都不同，这只是以自己的方式来写的。,200505522522210012,缅甸,2,200505,最理想的结交方式,50,70,43,64,68,278,未参加,
比如我父母都是教外国语{CQ的}老师，他们教俄语。[BC，],200505209542200106,越南,2,200505,父母是孩子的第一任老师,75,75,35,43,43,261,未参加,
父母在家教导孩子好的，如果孩子的环境或者他们的朋友[B有]是坏的，有可能孩子会变坏，不过也有可能孩子不会受[Pshou]影响。[BC.],200505502540200051,印度尼西亚,2,200505,父母是孩子的第一任老师,65,65,46,47,43,250,未参加,
以前，父母的责任不外乎给孩子吃穿之类的东西，很多人{CQ的}观念{CJ-zxy里}照顾好孩子的吃穿就等于出色地完成当父母的使命。,200505332542200018,越南,2,200505,父母是孩子的第一任老师,85,65,56,65,74,334,C,
一出生谁培养你，谁陪你玩，谁帮你解决[B觉]任何问题呢？,200505332529200043,泰国,2,200505,父母是孩子的第一任老师,65,45,56,39,56,240,未参加,
需[B须]要的话，我的雇主可以给我写封推荐信给贵公司。,200509534533150056,新加坡,1,200509,一封求职信,70,80,52,49,77,318,未参加,
致工作愉快×××2005年9月17日,200509534533250089,新加坡,2,200509,一封求职信,60,60,75,44,88,309,未参加,
谢谢。,200509534533250134,新加坡,2,200509,一封求职信,70,70,63,66,82,339,C,
本人{CJ-sy叫}×××，新加坡人，今年32岁。,200509534533150159,新加坡,1,200509,一封求职信,75,75,79,77,82,378,B,
当中的广告多为平面广告，而且曾刊登于《天津都市报》、《上海财经报》、《南方时报》等。,200509534533150170,新加坡,1,200509,一封求职信,70,75,59,58,97,348,C,
我喜欢流行歌曲。,200510111523200006,韩国,2,200510,我看流行歌曲,75,75,49,56,55,300,C,
不但通过电视听流行歌曲[BQ，]甚至买票直接去广播厅看看，所谓[B胃]被称歌迷[B米]呀，追星呀，都跟我有关。,200510111523100432,韩国,1,200510,我看流行歌曲,75,55,67,73,74,329,C,
我也是很喜欢流行歌曲的，但是我还不太理解这种歌迷，我觉得歌星只是歌星，不是我们人生的全部。,200510111523100785,韩国,1,200510,我看流行歌曲,50,65,53,42,50,241,未参加,
我就从{CC在}朋友的这一点发现了流行歌曲的不好的一面。,200510111523100838,韩国,1,200510,我看流行歌曲,75,70,83,67,82,366,B,
我的朋友中也有这样的人。,200510111523200834,韩国,2,200510,我看流行歌曲,75,60,56,52,57,286,未参加,
但是有些重音乐是{CJX}只一部分人喜欢的，然而在公共场所放这样的音乐的话，反而{CD只}成为{CC2造成为}一种噪[B操]音。,200510111523200835,韩国,2,200510,我看流行歌曲,85,75,79,59,67,357,B,
我很喜欢流行歌曲。,200510111523200846,韩国,2,200510,我看流行歌曲,65,70,74,50,59,304,C,
我不住[C]在韩国的首都。,200510111523200864,韩国,2,200510,我看流行歌曲,55,55,25,50,35,200,未参加,
我听这歌曲后知道怎么解决问题了。,200510111523200892,韩国,2,200510,我看流行歌曲,50,85,46,52,52,272,未参加,
不[C]管歌好不好，他呈现{CC2做}出来年轻人们喜欢的歌星。,200510111523101068,韩国,1,200510,我看流行歌曲,60,55,37,40,42,215,未参加,
喜欢歌星的女孩子们为了去那位歌星的演[B寅]唱会，向父母说谎话、逃学。,200510111523201070,韩国,2,200510,我看流行歌曲,60,70,49,61,67,292,未参加,
而且他们是国家的未来。,200510111523201244,韩国,2,200510,我看流行歌曲,55,60,30,48,55,229,未参加,
很多人以听音乐或唱[B昌]歌解决情神上的压力。,200510111523201262,韩国,2,200510,我看流行歌曲,55,60,44,38,67,245,未参加,
流行歌曲可以给一些年轻人欢乐。,200510111523101268,韩国,1,200510,我看流行歌曲,65,60,79,48,57,292,未参加,
如果我谈恋[B变]爱，那么可以选爱情歌。,200510111523201271,韩国,2,200510,我看流行歌曲,70,70,42,40,62,272,未参加,
现在很多家长都反对孩子达到这种程度。,200510111523101346,韩国,1,200510,我看流行歌曲,70,85,53,61,67,328,C,
大众听歌曲很感动、[BC，]快乐就行了，即使作曲家利用大众的心理，大众听歌曲、[BC，]唱歌曲之后就心情好了不就得了。,200510111523201850,韩国,2,200510,我看流行歌曲,55,65,51,50,67,270,未参加,
有的人被流行歌曲迷住{CC会迷}{CD或}然后什么也不{CC没}做一直[C]追随[C]那个歌的明星。,200510111523101863,韩国,1,200510,我看流行歌曲,60,60,60,52,62,276,未参加,
除此以外，父母的行[F為]也对[F對]子女影响[F響]甚大。,200510919919105303,加拿大,1,200510,父母是孩子的第一任老师,75,80,24,79,96,345,未参加,
我想，这世界上没有不喜欢听流行歌曲的青年人。,200510520520250014,蒙古国,2,200510,我看流行歌曲,75,65,53,50,55,285,未参加,
而且{CC而}流行歌曲总是有着非常多的听众。,200510302523200049,韩国,2,200510,我看流行歌曲,85,80,46,61,77,342,C,
下面我说一说我喜欢流行歌曲的原因和对流行歌曲的看法。,200510302523200072,韩国,2,200510,我看流行歌曲,75,80,70,61,72,349,B,
当中他听了一首悲观{CC落[C]观}的歌儿[BQ，]一整天听了这首歌。,200510302523200139,韩国,2,200510,我看流行歌曲,70,60,37,40,50,242,未参加,
还有{CC也是}，改革开[B改]放以后[B候]外国音乐流入很多。,200510302523100196,韩国,1,200510,我看流行歌曲,75,50,42,40,37,228,未参加,
“假如没有了流行歌曲不会发生这件事”，这是那个{CC位}人的说法。,200510302523100213,韩国,1,200510,我看流行歌曲,75,70,63,54,79,330,C,
就很少人听。,200510302523100245,韩国,1,200510,我看流行歌曲,65,70,53,44,57,275,未参加,
彼此一见倾心的人不少，但能长期在一起{CQ的}却[B卸]不多。,200505610627250008,瑞士,2,200505,最理想的结交方式,70,65,43,22,32,218,未参加,
在个[F個]性上，人与[F與]人之间[F間]是不一样[F樣]的，相处[F處]也很难[F難]。,200505610610250012,法国,2,200505,最理想的结交方式,60,75,63,69,64,317,C,
我认同“父母是孩子的第一任老师”这个说法。,200509602801150003,澳大利亚,1,200509,父母是孩子的第一任老师,75,60,71,65,63,320,C,
我看朋友说：“我也得了病在家休息。,200104124523100081,韩国,1,200104,一封写给父母的信,65,60,33,21,40,202,未参加,
爸，你的上星期的感冒好了吗？,200104124540200171,印度尼西亚,2,200104,一封写给父母的信,65,70,30,25,42,218,未参加,
现在韩国的风景[B影]非常美丽吧！{CJ-zhuy你们},200104124523200183,韩国,2,200104,一封写给父母的信,75,85,38,47,40,278,未参加,
比以前我父母的头发变白了{CJbi}。,200104124525200269,日本,2,200104,一封写给父母的信,65,65,74,61,54,303,C,
我在留学时你们很担心我，不要担心我[BQ，]{CQ因为}{CJ-zhuy我}有这样的朋友们。,200104124523100397,韩国,1,200104,一封写给父母的信,70,55,44,49,49,251,未参加,
祝身体健康！,200104124525200429,日本,2,200104,一封写给父母的信,70,90,58,68,61,340,C,
精美服装公司李翔先生：前几天我拜读{CC拜[C]见}了贵公司{CC2司}{CQ的}招聘{CJ+by人员}广告。,199200003525200001,日本,2,199200,一封求职信,,,0,0,0,0,未参加,
可是今天就到这里。,199200003525200014,日本,2,199200,一封求职信,,,0,0,0,0,未参加,
那里我当经理的秘书，在这[B远]期间我又认识一位在一家合资企业工作的外国人，他肯{CC1肯于}教我英语，这么一来{CC一本}我们每个星期见面，对话。,199200008616200021,德国,2,199200,一封求职信,,,0,0,0,0,未参加,
你们可以想一个{CC口}完美的家庭：完美的主要的原因是爱情。,199604123605100294,保加利亚,1,199604,如何看待“安乐死”,80,65,45,52,49,279,未参加,
我从宗教人的角度看这个问题吧，一般[BD，]愿意“安乐死”的人大部分都是得了不治之症的。,199604124523200010,韩国,2,199604,如何看待“安乐死”,65,60,77,83,67,335,C,
我想[C]：女人想[C]要自杀，可能[C]因为她们找不到好办法来解[C]决问题。,199604123529100209,泰国,1,199604,如何看待“安乐死”,60,65,24,39,34,205,未参加,
如今，[BC、]医疗的进步非常快，[BC.]快要死的人也能生存不少时间，[BC.]这样的时代{WWJ},199604123525100164,日本,1,199604,如何看待“安乐死”,60,60,42,54,47,245,未参加,
拒绝[C]他不是显得自私吗？,199604123922100352,美国,1,199604,如何看待“安乐死”,65,40,50,22,29,184,未参加,
有些允许“安乐死”的国家之间也有[D所]不同的看法。,199604124525100075,日本,1,199604,如何看待“安乐死”,80,55,66,54,67,308,C,
这是不犯罪的。,199604123529200137,泰国,2,199604,如何看待“安乐死”,70,55,37,27,39,211,未参加,
不仅他自己感觉不到{CC4天觉}世界，也给家里人、[BC，]朋友们带来很大痛苦。[BC.],199604124636200100,乌克兰,2,199604,如何看待“安乐死”,65,70,53,66,49,288,C,
这个[F個]问[F問]题[F題]在现在{CC现[F現]今}的社会[F會]里[F裡]非常普遍。,199610802801100001,澳大利亚,1,199610,如何解决“代沟”问题,85,75,73,63,69,357,B,
”我认[B让]为引起代沟的最大的原因就是他们之间对话不足。,199610550523190006,韩国,1,199610,如何解决“代沟”问题,80,80,81,73,69,375,B,
（谢谢）,199610550523290037,韩国,2,199610,如何解决“代沟”问题,60,70,44,48,47,254,未参加,
年老的人一直保[B呆]守自己的看法，{CJ+zhuy那是}不像他年轻时看法那么轻松、[BC，]开朗。,199610550523290041,韩国,2,199610,如何解决“代沟”问题,65,65,57,57,53,281,C,
其实[F實]，只要大家能够尊重对方不同的看法和处[F處]事方法，从[F從]对方的立场[F場]来[F來]考虑[F慮]同一件事情{CC事件}，接受不同意见[F見]的存在，问题就不会存在。,199611543501100524,中国,1,199611,如何解决“代沟”问题,80,85,99,73,84,415,B,
其次，对{CC1关[F關]心}子女身边[F邊]{CD发[F發]生}的人、事、物也应[F應]抱了解、帮助、感同身受{CC身同感受}的态[F態]度。,199611543501100514,中国,1,199611,如何解决“代沟”问题,85,80,65,75,82,380,B,
[BD，]什么叫代沟？,199611543501200512,中国,2,199611,如何解决“代沟”问题,90,80,81,55,92,393,B,
在众人中，就属我与弟弟年纪最小，时常被表哥表姐们呼来唤去，倒茶啦，拿糖果啦，总之，跑来跑去的，根[B跟]本没时间坐下来享受[BD，]{CD享受}。,199603533533200056,新加坡,2,199603,由“三个和尚没水喝”想到的……,90,80,71,72,94,402,B,
那是在我小时候，由于家里姐妹多，父母都出外工作，因此，家里的杂务事，包括洗衣服，扫地，煮三餐[C]等等，都需[B须]由我们几姐妹做，{CJ-zhuy我们}经常为了些芝麻小事争吵。[BC，],199603533533200067,新加坡,2,199603,由“三个和尚没水喝”想到的……,90,85,66,70,77,385,B,
也许，这是人的本性吧。,199603533533100079,新加坡,1,199603,由“三个和尚没水喝”想到的……,80,75,60,79,82,367,B,
但是，如果来了个{CD一位}朋友，那情况就{CC会}不同了，她也会想到不拿水就不得了，她需要{CD用水}喝水的，她一定要去拿水，为[F為]了生活在世界上[BQ，]我们每一个人{CJ-zy都}离不开水，有水的地方就能使有生命的生物生存下去，是不是？,199603533540200109,印度尼西亚,2,199603,由“三个和尚没水喝”想到的……,65,80,49,49,61,292,未参加,
突然自身后的菩萨传来一阵声音：“你们这三个家[F傢]伙吵够了没有？[BC，],199604680519200502,马来西亚,2,199604,由“三个和尚没水喝”想到的……,85,75,77,83,89,401,B,
我觉得{CJ-sy产生}这种情况的根本原因是[BD，]首先缺乏积极性{CD的}，[BC。]第二个原[C]因是{CJ-sy存在}只顾自己不顾团体的观念。,199605104523100027,韩国,1,199605,由“三个和尚没水喝”想到的……,65,60,55,60,46,269,未参加,
多了一个人就自然而然产生依靠他人的心理{CC2懒惰心}，自己少做一点儿也没关系等{CQ的}依赖心。,199605104525200031,日本,2,199605,由“三个和尚没水喝”想到的……,90,90,77,74,91,420,B,
从这里我们可以知道应该往前想，不能{CC不用}{CJ-zy只}想满足{CC得到}目前的欲望。,199605104525200052,日本,2,199605,由“三个和尚没水喝”想到的……,70,55,44,67,68,288,未参加,
随着社会发展，个人主义思想越来越强{CC1扩大}[BQ。]{CP本来个人主义是好的，可是鉴于上面的情况，个人主义妨害人与人之间的{CC6人间}关系。P},199605104523100071,韩国,1,199605,由“三个和尚没水喝”想到的……,65,55,33,51,44,230,未参加,
三个和尚在庙里念经，[BC。]天天从早上到晚上一直念[C]经。,199605104525200078,日本,2,199605,由“三个和尚没水喝”想到的……,65,60,52,60,42,262,未参加,
过了几天了。,199605104525200107,日本,2,199605,由“三个和尚没水喝”想到的……,65,65,55,70,75,314,C,
在世界{CQ上}并没[C]有带着缺[C]点的东西。,199605104523100114,韩国,1,199605,由“三个和尚没水喝”想到的……,65,60,71,67,70,316,C,
他们{CJ+zy会}没什么不方便的问题。,199605104523100125,韩国,1,199605,由“三个和尚没水喝”想到的……,60,70,46,51,51,263,未参加,
请大家记住很好的社会不能一个人发展{CC作}起来的{CJsd}。,199605104523200136,韩国,2,199605,由“三个和尚没水喝”想到的……,65,65,52,58,63,287,C,
“严[F嚴]以律己，宽[F寬]以待人”，一件事情的成功可能{CJ+sy是}需要无[C]数人的帮助——团体的团结，如人人都自私地{CC的}先考虑[F慮]到自身的利益{CC益处}而不愿参与[C]，则[F則]成功又能正在眼前吗[F嗎]？,199605104501200166,中国,2,199605,由“三个和尚没水喝”想到的……,85,80,74,81,77,390,B,
我在大学读书的时候，{CJ+zhuy我}参加了献血动动俱乐部。,199605104525200185,日本,2,199605,由“三个和尚没水喝”想到的……,65,65,55,63,56,288,C,
妹妹和弟弟觉得我是老大而且工作的时间最长，应该我[C]掏出更多{CC很多}钱。,199605104525100224,日本,1,199605,由“三个和尚没水喝”想到的……,65,65,46,45,42,247,未参加,
还是你们俩去挑水来{CQ吧}。,199605104523100276,韩国,1,199605,由“三个和尚没水喝”想到的……,60,55,30,54,65,245,未参加,
这样的心思我也保持{CQ着}，每个人也{CJ-zy都}当然{CJX}抱着{CJ-by这种心思}，可是跟别人一起生活的时候{CQ要}忍耐{CJ+by这样感情}，尽量表现{CJ-buy出}让步、[BC，]牺[F犠]牲的精神。,199605104523100288,韩国,1,199605,由“三个和尚没水喝”想到的……,50,70,46,56,56,261,未参加,
”{CD但是}结果这火更大，最后连自己的家也都烧掉了。,199605104523200328,韩国,2,199605,由“三个和尚没水喝”想到的……,80,70,66,58,63,327,C,
我告诉他[BQ：]“我先来排队，你应该排在我后边。,199605104525100374,日本,1,199605,由“三个和尚没水喝”想到的……,70,70,49,76,68,321,C,
我个人认为每天不变化的生活，叫做{CC叫成}安定。,199605104525100380,日本,1,199605,由“三个和尚没水喝”想到的……,60,60,38,49,58,247,未参加,
因为一个人生存时，他无法靠别人，只能自立更生。,199605550523290006,韩国,2,199605,由“三个和尚没水喝”想到的……,75,75,63,51,61,315,C,
换[C]句{CJ-zxy话}而言，这就是爱。,199605550523190010,韩国,1,199605,由“三个和尚没水喝”想到的……,65,85,35,42,44,261,未参加,
忽然宣布说，“我喜[C]欢{CJX}通通！,199605550523190010,韩国,1,199605,由“三个和尚没水喝”想到的……,65,85,35,42,44,261,未参加,
有时候[B后]大家一起做事，都想着自己的舒服而[C]不做事，把自己的责任{CC负责}推{CC拖}给别人去当。,199605550523290042,韩国,2,199605,由“三个和尚没水喝”想到的……,80,70,46,47,56,289,未参加,
他们就{CC都}吵{CC1吵架}起来了。,199605550523190056,韩国,1,199605,由“三个和尚没水喝”想到的……,70,50,55,47,56,261,未参加,
因为[F爲]很多人为[F爲]{CQ了}自己要害别人所以很多{CJcd}发[F發]生灾[F災]难[F攤]的可能性。,199605550523190061,韩国,1,199605,由“三个和尚没水喝”想到的……,65,70,33,56,65,275,未参加,
对一个年轻[C]人来说，遇[C]到什么情况下都一个劲儿地努力，这不就是年轻人的姿态{CC姿势}吗？,199605550523190071,韩国,1,199605,由“三个和尚没水喝”想到的……,60,65,58,70,63,299,C,
{CJ+zy都}很容易变成[C]这[C]样，终于吵架、打架肯定社会每[C]况愈下，我们社会马上要解体了P}。,199605550523290074,韩国,2,199605,由“三个和尚没水喝”想到的……,60,65,60,54,39,261,未参加,
他常对我说：“儿子，学会汉语时你将来有好处，在我们住的城里很少{CQ有}人会说普通话[BQ。]”[BD。]可那时，我还想工作，给自己{CQ积累}{CD的}经验[BQ，]就不理他的话。,199704123529200041,泰国,2,199704,记对我影响最大的一个人,80,90,62,56,62,345,C,
很多时候，在处世待人之中，都好像[B象]可以隐纳地听到妈妈所给的金玉良言。,199704123533200107,新加坡,2,199704,记对我影响最大的一个人,95,90,62,65,77,388,C,
不管是朋友或陌生人，只要他有困难，她都会毫无犹豫地去帮助他、安慰他。,199704123610200138,法国,2,199704,记对我影响最大的一个人,85,85,53,71,68,357,C,
那里不算是一个大成市，也不算一个农村，只是一个小城市[BQ，]拥[F擁]有人情味儿的城市。,200110540540150040,印度尼西亚,1,200110,我的童年,75,75,49,49,61,299,未参加,
我也停学了。,200110540540150058,印度尼西亚,1,200110,我的童年,70,80,71,75,72,358,B,
父亲是一位高级职工，很关心子女的教育。,200110540540150059,印度尼西亚,1,200110,我的童年,70,90,74,51,83,361,C,
所以对安排旅游节目与有关的一切手续相当熟悉。,199312533533100024,新加坡,1,199312,一封求职信,90,80,78,72,82,397,B,
希望贵公司能给我一个机会。,199312533533200027,新加坡,2,199312,一封求职信,90,85,69,76,87,404,B,
本人也会作不错的平面设计。,199312533533100035,新加坡,1,199312,一封求职信,90,70,83,76,100,412,B,
所以有{CJX}绝对的导游工作经验，无须再培[B倍]训。,199312533533100082,新加坡,1,199312,一封求职信,90,75,85,70,75,389,B,
公司所要求的条件为女性——20-30岁，要有大学学历，而我[C]虽年届四十开外，而且只有高中程度，但{CJ-zhuy我}向来身体健康活力充沛[C]，而也自认为相貌还[C]端正，并且除印尼语外[C]，还[C]能讲一口流利的汉语{CC华语}和英语，对导游之事相当熟[C]稔[C]。P},199312533540200116,印度尼西亚,2,199312,一封求职信,85,95,25,69,96,368,未参加,
李先生钧[F鈞]鉴[F鑒]：应[F應]聘人姓名×××，申请[F請]应[F應]聘贵公司女性导游。,199312533501200133,中国,2,199312,一封求职信,90,90,81,70,75,404,B,
敬启者:[BC，]敝人对{CC在}贵旅游[F遊]公司于一九九三年十二月四日在联合早报上所刊登的招聘启事深感[C]兴趣。,199312533533100141,新加坡,1,199312,一封求职信,90,70,55,69,85,362,C,
×××永光路8座8楼50号新加坡2260邮区李文先生快乐家庭旅游公司淡申路101号大华广场26楼05号新加坡1130邮区李先生：[BC，]事关：应征经理职位我从12月4日的《联合早报》[BD，]知道贵公司打算招聘经理，所以特地写信应征。,199312533533100153,新加坡,1,199312,一封求职信,85,70,76,80,89,392,B,
93年12月4日,199312533533200159,新加坡,2,199312,一封求职信,80,90,60,50,57,332,C,
我是在韩国的忠北大学{CC2大学校}毕业{CD了}{CJsd}，我本来的[L]专[C]业{CD了}该校的中文系{CJs}。,199312104523100017,韩国,1,199312,一封求职信,60,50,62,34,39,225,未参加,
因而，对旅游业进行过研究。[BC.],199312124523200148,韩国,2,199312,一封求职信,80,65,74,45,57,310,C,
这恐怕还是运气来决定。,199312124542200235,越南,2,199312,一封求职信,95,80,76,48,50,345,C,
我打算到明年7月份学完汉语后，在这要工作。,199312123525100301,日本,1,199312,一封求职信,55,65,53,70,59,285,未参加,
我是1986年北京旅游大学旅游经营[C]科毕业{CJsd}，大学毕业时，我的成绩前三名{CD之一}，学校分配到新华旅游社，那时候开始做旅游业方面的经营[C]。[BC.],199312124523100246,韩国,1,199312,一封求职信,55,70,57,58,52,276,未参加,
特别是以前你们[C]公司的针对{CC2向}日本人民的旅游计划。[BC.],199312123523200709,韩国,2,199312,一封求职信,55,50,25,39,43,191,未参加,
一九九三年十二月二十日××××,199312123525200913,日本,2,199312,一封求职信,60,55,43,56,50,245,未参加,
他当一个学校的校长。,199412123523200043,韩国,2,199412,记我的父亲,65,55,36,38,51,227,未参加,
他工作很认真，[BC、]天天忙忙碌[Plù]碌[Plù]，[BC、]为人老实、诚实。,199412123525200039,日本,2,199412,记我的父亲,55,80,60,48,51,280,未参加,
可跟我家的这么有意思的情况相反，父亲公司的经济情况越来越不好，我父亲也不得不找个工作了。,199412123525200047,日本,2,199412,记我的父亲,70,80,54,61,49,304,C,
我父亲不知道对孩子怎么表达爱[BQ，]可是我从他对{CC给}我的行动上能了解[C]他爱我。,199412123525200076,日本,2,199412,记我的父亲,55,60,62,53,57,268,未参加,
