错句,作文编码,国籍,性别,考试时间,作文题目,口试分数,作文分数,听力分数,阅读分数,综合分数,总分,证书
其中有男的，女的，老的，幼的，无形中已形成社会的风气，严重的还会给人类环境带来影响……对此，某些国家的政府作出的“在公共场所吸烟者将受到严励惩罚”这一项规定是很切要的；因为当某个人在群众[F眾]{CJ-wy聚集}的地方吸烟时，他会把烟里面含有的尼[B泥]古丁喷出，透过空气进入其他人的鼻子而渗[F滲]入肺部，那不是已影响到其他人的身体了吗？,200405542542130003,越南,1,200405,吸烟对个人健康和公众利益的影响,75,80,47,23,67,283,未参加,
但是在公共场所{CD上}限制、[BC，]禁止{CJ-by吸烟}的时候，{CJ-zy要}从公平性、[BC，]权利看{CJ-zy怎么}安[B按]排。,200405201525100083,日本,1,200405,吸烟对个人健康和公众利益的影响,70,65,44,28,31,224,未参加,
时下很流行“婚姻是爱情的坟墓”这句“名言”，试想想“万丈高楼平地起”，没有坚实的地基又怎会建成经得住风吹雨打的高楼大厦呢？,200410534533250011,新加坡,2,200410,最理想的结交方式,70,90,91,83,100,427,B,
我觉得渐进式的感情是最理想的。,200410534540250035,印度尼西亚,2,200410,最理想的结交方式,75,90,85,81,84,409,A,
例如，有的是通过亲戚朋友的介绍，[BC、]有的是青梅竹马、[BC，]一起长大的玩伴，[BC、]有的则是偶然相[B想]遇而产生情愫等。,200410534533250047,新加坡,2,200410,最理想的结交方式,95,95,74,67,94,424,B,
所以，最理想的结交方式，应是从生活圈子里相识，可以是朋友之间，也可以是同事之间。,200410534533250098,新加坡,2,200410,最理想的结交方式,95,85,83,88,99,448,A,
在现代经济迅速{CD的}发展的情况下{CC4理}，想要在社会占有一席之地{CC5站一席地位}，就要从小的时候用功读书。,200410534533150107,新加坡,1,200410,最理想的结交方式,80,70,66,47,65,318,C,
但是认识的结果是相爱，相爱的结果是结婚，感情上共同经营{CC款道}，才是长[F長]远之计。,200410534519150129,马来西亚,1,200410,最理想的结交方式,70,85,49,54,77,327,C,
“打”了之后，却建立了无比坚固的信任、情谊，或许能使夫妻之间的爱情变得真挚长久。,200410534533150131,新加坡,1,200410,最理想的结交方式,95,80,60,83,99,413,B,
在那个时候才能真正地{CC真真的}克服这个问题。,200405680610150018,法国,1,200405,吸烟对个人健康和公众利益的影响,60,60,24,54,63,243,未参加,
例如你有一个男朋友，我也一定要一个，才可胜[C]你。,200504534533250015,新加坡,2,200504,我对男女分班的看法,60,60,62,47,50,261,未参加,
例如：某所{CC间}女校，就有女子扮成男子，一身男人样，她是“男”方，而女方，则小鸟依人的模样。,200504534533150028,新加坡,1,200504,我对男女分班的看法,70,70,84,62,77,351,C,
我觉得男女混合式的教育制度能够让孩子从小到大都在一个比较贴近现实社会的环境成长。,200504534533250033,新加坡,2,200504,我对男女分班的看法,75,85,78,86,84,401,B,
老子《清静经》中说了：男动女静，动与静本是一体两面，但是在单性的环境中，就没有了明显的相对面，在大自然的适者生存定律下，单性的族群中就会有部分产生变化而取代缺失的角色，故很可能产生另一种问题。,200504534533250041,新加坡,2,200504,我对男女分班的看法,80,75,81,73,93,393,B,
家长认为男女分班能避免学生早恋，但这只是逃避问题的做法。,200504534634250081,英国,2,200504,我对男女分班的看法,75,90,73,78,84,394,B,
在那儿，得学习之前完全没机会学到的男女互动关系。,200504534533150092,新加坡,1,200504,我对男女分班的看法,65,85,62,82,91,375,C,
使用男女分班的做法会使学生{CD有}进入社会时，使得{CC使到}两性双方感到很陌[B默]生，不知如何面对对方{CC双方}。,200504534519250124,马来西亚,2,200504,我对男女分班的看法,80,70,78,67,82,367,B,
人们担心如果班上有男有女，将会有学生早恋。,200504534533250163,新加坡,2,200504,我对男女分班的看法,75,70,65,65,64,328,C,
这样，早恋的问题仍然{CD还}没解决。[BC.],200504534533250171,新加坡,2,200504,我对男女分班的看法,65,85,56,47,66,309,未参加,
我对男女分班的看法是和许多学者一样{CQ的}，都不支[B技]持男女分班。,200504534533150178,新加坡,1,200504,我对男女分班的看法,70,75,67,69,66,336,C,
因为有了男女相反的一些性格，才会提升合作的效果及成就。,200504534533250180,新加坡,2,200504,我对男女分班的看法,55,80,84,80,84,369,C,
父母的一举一动是孩子的模范[BQ，]而且孩子只能效[B校]法它成为他们自己的一部分，不论好的还是[L]环的。,200505109540100476,印度尼西亚,1,200505,父母是孩子的第一任老师,65,50,46,40,54,236,未参加,
小时候一半的小孩子都认为在长大的时候他们千万不要像父母那样，但是长大时大多数人会发现自己的确很像父母。,200505109616200699,德国,2,200505,父母是孩子的第一任老师,80,75,44,40,66,296,未参加,
虽然有上学时的老师以及生活中的朋友的影响，我还是认为父母是孩子第一任老师。,200505109616200699,德国,2,200505,父母是孩子的第一任老师,80,75,44,40,66,296,未参加,
除了吃饭[C]等[C]家里{CD内}的生活之外，在外面跟别[C]人见面时的打[B招]招呼什么的。,200505109525200907,日本,2,200505,父母是孩子的第一任老师,80,90,87,58,79,389,B,
我在初中三年级的时候，考试考得不太好，当然{CJX}父母生气了。,200505109525201729,日本,2,200505,父母是孩子的第一任老师,65,75,44,45,63,279,未参加,
但千万不要忘记孩子一直会看父母的后背{CC背后}长大。,200505109525201824,日本,2,200505,父母是孩子的第一任老师,60,75,44,45,76,286,未参加,
日常生活{CD中}也是{CJX}对我来说比较紧张。,200505109525202301,日本,2,200505,父母是孩子的第一任老师,70,70,54,55,74,311,C,
父母是孩子的第一任老师我觉得[C]教育是很[C]重要{CJsd}。,200505109525202349,日本,2,200505,父母是孩子的第一任老师,60,60,39,47,48,236,未参加,
为什么呢？,200505109525102400,日本,1,200505,父母是孩子的第一任老师,55,65,46,51,64,263,未参加,
我特别赞同这个父母是孩子的第一任老师{CJ-zxy的观点}，因为从小到大，我一直跟着父母，所以他们抚养了我，教我{CD了}不少的东西。,200505109529202511,泰国,2,200505,父母是孩子的第一任老师,70,65,56,53,50,280,未参加,
不但父母的兴趣爱好、思想观念，而且生活态[C]度、学习态[C]度都对孩子产生重大影响。,200505109525202522,日本,2,200505,父母是孩子的第一任老师,60,65,41,55,43,247,未参加,
比如说，我父母喜欢{CC爱好}看书。,200505109525202587,日本,2,200505,父母是孩子的第一任老师,65,60,63,49,69,289,未参加,
据我所看，父母是孩子的第一任老师[F師]。,200505109922102598,美国,1,200505,父母是孩子的第一任老师,80,60,54,47,56,284,未参加,
因此[B些]，父母在教育孩子生命、生活、社会以及世界的道德中是起了一个很重要的作用{CJsd}，而这个接触是从孩子生下来的第一天开始的[BQ。]第二，父母随[F隨]着上述的过程{CD也是}对孩子的成长起了重要的作用。,200505109922202601,美国,2,200505,父母是孩子的第一任老师,80,65,61,71,74,339,C,
我是希望在相识[F識]后[F後]{CJs}，先成为[F為]朋友，等到我们[F們]相互[B户]了[F暸]解一段时间[F間]，有共同理想再[B在]自然而然地[B的]走在一起。,200505951922250010,美国,2,200505,最理想的结交方式,80,50,66,49,77,307,未参加,
”他全部都答应了。,200505522522250016,缅甸,2,200505,最理想的结交方式,65,70,52,49,73,295,未参加,
因为{CQ在}现在的社会{CQ中}我们所要面对[F對]的困难[F難]太多了[BQ，]所以一定要两颗{CC个}心慢慢了解[Y觧][BQ、]发[F發]现[F現]对[F對]方的优点[BQ、]逐渐相爱[F愛][BQ，]这[F這]样才能一起走近{CC走进[F進]}幸福[BQ，]也才能有足够的勇气面对[F對]新社会[BQ，]更有条[F條]件来培养我们的下一代[BQ。],200505522522110011,缅甸,1,200505,最理想的结交方式,65,60,57,35,53,253,未参加,
如果父母不给孩子良好的家庭教育[BQ，]说不定[D会]他们会走向{CJ+dy社会的}邪路。,200505209542200083,越南,2,200505,父母是孩子的第一任老师,85,85,56,55,65,341,C,
一位好的启蒙“老师”应该具备什么条件？,200505201533100408,新加坡,1,200505,父母是孩子的第一任老师,85,90,78,77,98,424,B,
长大的时候[BQ，]母虎{CC虎[B虑]母}就会教小虎[B虑]怎么样去捕猎{CC2猎}。,200505501540100078,印度尼西亚,1,200505,父母是孩子的第一任老师,65,45,35,39,34,197,未参加,
从此，孩子就会模仿[B防]父母的行为[BQ，]因为他们分不出什么是{CC3如何}真正{CQ的}好坏，而且会觉得如果父母也做，他们也可以。,200505206919200029,加拿大,2,200505,父母是孩子的第一任老师,80,75,71,55,74,346,B,
“父母是孩子的第一任老师”[BQ，]自古以来就是一个真理。,200505332542200018,越南,2,200505,父母是孩子的第一任老师,85,65,56,65,74,334,C,
本人大学毕业后在旅游公司先后干[C]了六年，主要职务是策划旅游路线，也兼做涉外导[C]游工作。,200509534533150035,新加坡,1,200509,一封求职信,70,75,73,53,68,328,C,
由于经济不景气，成了公司裁员中的牺牲品。,200509534533250037,新加坡,2,200509,一封求职信,75,75,75,64,70,349,B,
我在报纸上{CJ-sy看到}贵公司由于业务发展的需要，要招聘工作人员的广告，有兴趣应聘。,200509534533250077,新加坡,2,200509,一封求职信,80,75,82,80,93,401,B,
快乐家庭旅游公司李文先生：您好！,200509534533250092,新加坡,2,200509,一封求职信,65,70,63,42,70,296,C,
随信附上证书数份以示证明。,200509534519250148,马来西亚,2,200509,一封求职信,85,70,75,77,88,386,B,
它们包括{CD了}新加坡，马来西亚，中国，英国和法国。,200509534533250145,新加坡,2,200509,一封求职信,80,75,91,71,91,399,B,
贵公司的营业额已领先其他同行{CC同侪}许多。,200509534519250156,马来西亚,2,200509,一封求职信,70,75,79,77,95,385,B,
×××敬启2005年9月19日联系地址：文礼路，122座，#10-10,200509534533250187,新加坡,2,200509,一封求职信,70,75,77,64,86,361,C,
目前的情况变化很快，每天出来新的东西，所以人们觉得流行歌曲也这样发生就没有{CJ？}。,200510111523200009,韩国,2,200510,我看流行歌曲,60,60,53,40,35,230,未参加,
我希望流行歌曲向良好的方向发展，可以给听众带来一些情绪上的平静，[BC。]可以使听众得到安慰。,200510111523200415,韩国,2,200510,我看流行歌曲,70,75,65,71,79,349,C,
流行歌曲，如果一个人很难过[C]的时候听的话，难过[C]的感情会越来越轻，如果某一个人有很高兴的事时听，流行歌曲会让他更高兴，会给他带来一种更好的心情。,200510111523200418,韩国,2,200510,我看流行歌曲,70,70,60,54,67,309,C,
我对流行歌曲是这么一个观点，是非常喜欢听流行歌曲。,200510111523200772,韩国,2,200510,我看流行歌曲,85,70,67,75,84,372,C,
我也知道这样的歌词跟我一点儿也没有{CJX}关系。,200510111523200776,韩国,2,200510,我看流行歌曲,70,75,63,65,57,319,C,
有的歌迷甚至对自己喜欢的歌星达到痴迷的程度。,200510111540200778,印度尼西亚,2,200510,我看流行歌曲,75,75,72,69,74,355,B,
下面我就来谈一谈我对流行歌曲的看法。,200510111523100822,韩国,1,200510,我看流行歌曲,65,85,60,52,72,324,C,
总的{CC得}来说，当我们判断流行歌曲时，不要只考虑一面之词而听一听究竟[B境]{CJX}他们{CQ在}讲什么，也是一件有意义[L]的事情。,200510111523200866,韩国,2,200510,我看流行歌曲,90,80,77,65,72,379,B,
因为听音乐没有什么让别人不高兴的。,200510111523201049,韩国,2,200510,我看流行歌曲,55,55,60,44,64,258,未参加,
因此人们在听流行歌[B哥]曲时{CC中}有的人能{CQ留}下眼[C]泪[C]有的人觉得生气，[BC。]有的人能爱朋友。,200510111523101055,韩国,1,200510,我看流行歌曲,60,60,53,34,47,236,未参加,
那时，[BC、]流行歌曲是我们谈论的主题，[BC。]所以非常重要，但是考上大学之后，我们找到除了流行歌曲以外非常有意思的主题。,200510111523201062,韩国,2,200510,我看流行歌曲,60,60,35,24,25,186,未参加,
所以我们不能判断流行歌曲好不好。,200510111523201096,韩国,2,200510,我看流行歌曲,70,50,51,42,42,238,未参加,
结果，没有了自己的生活。,200510111523101115,韩国,1,200510,我看流行歌曲,55,60,60,38,59,253,未参加,
首先，它是大家都喜欢的，人们都可以接受[L]的那种音乐。,200510111523201121,韩国,2,200510,我看流行歌曲,80,75,60,50,50,306,C,
我也是个年轻[B经]人。,200510111523201124,韩国,2,200510,我看流行歌曲,75,65,56,44,57,284,未参加,
现在这个时代，我们{CJ+zy无论}何时何地都很容易听到流行歌曲。,200510111523201619,韩国,2,200510,我看流行歌曲,70,70,72,50,59,309,C,
人们都有自己的兴趣。,200510111523201627,韩国,2,200510,我看流行歌曲,70,70,51,50,59,288,未参加,
现在很多人喜欢流行歌曲。,200510111523101863,韩国,1,200510,我看流行歌曲,60,60,60,52,62,276,未参加,
在孩子还[F還]没真正进[F進]入社会[F會]和建立起自己的社会[F會]观[F觀]以前，父母应[F應]注意自己的行为[F爲]和表现[F現]。,200510950922250002,美国,2,200510,父母是孩子的第一任老师,90,90,65,79,88,410,B,
但这是一个人在的时候，因为我很害羞，不要笑我，我从小就和姐姐在一起的[BQ，]所以有些性格像女孩子罢了。,200510520520150003,蒙古国,1,200510,我看流行歌曲,70,60,60,44,62,281,未参加,
什么事都一样，但不能过度地{CC的}爱，这样会出现不好的现象，流行歌曲也一样，不用迷{CQ到}这个程度，而用喜欢听{CJ？}，我想这样的话就好了。,200510302523100005,韩国,1,200510,我看流行歌曲,80,70,65,38,55,298,未参加,
我也很[C]喜欢听流行歌曲，那么我来谈一下我对流行歌曲的看法吧！,200510302523100028,韩国,1,200510,我看流行歌曲,80,65,65,46,64,308,C,
孩子、老人没关系。,200510302523100032,韩国,1,200510,我看流行歌曲,65,55,44,32,59,237,未参加,
通过这样的过程{CC2事}形成流行歌曲。,200510302523100050,韩国,1,200510,我看流行歌曲,75,70,63,40,55,292,未参加,
我们自然而然地{CC的}会接收一些美丽的诗歌。,200510302523200094,韩国,2,200510,我看流行歌曲,60,75,67,46,62,296,未参加,
而喜欢歌星的人就不这么{CC怎么}想。,200510302523200153,韩国,2,200510,我看流行歌曲,80,75,63,69,82,360,B,
流行歌曲总是有着非常多的听众。,200510302523200159,韩国,2,200510,我看流行歌曲,70,70,56,46,69,299,未参加,
我从小就开始喜欢流行歌曲，[BC。]因为它让我{CJ+zxy的心情}快乐起来，[BC。]还有[C]那节奏[C]感{CD上上下下的}很有趣。,200510302523200205,韩国,2,200510,我看流行歌曲,75,60,65,44,89,319,未参加,
那唱流行歌曲或者听流行歌曲对人们有什么好处呢？,200510302523200223,韩国,2,200510,我看流行歌曲,65,60,74,50,84,316,未参加,
人们在现在分音乐为两组。,200510529529151026,泰国,1,200510,我看流行歌曲,65,70,70,52,79,322,C,
流行歌曲大部分都是很轻松的歌曲。,200510540540200040,印度尼西亚,2,200510,我看流行歌曲,70,80,53,40,57,290,未参加,
要是两个人互相喜欢的话，[BC、]并且{CC2也}同时认为他们想一辈子都生活在一起{CD的}，[BC、]那么别人{CC人家}不应该关心他们是怎么认识的。,200505651634150001,英国,1,200505,最理想的结交方式,85,65,39,44,53,275,未参加,
如今自己当了母亲，亲眼目睹{CQ了}自己儿女的成长，才深深体会到这一说法的真实性[L]。,200510600919225002,加拿大,2,200510,父母是孩子的第一任老师,90,95,68,74,96,421,B,
老大爷好像看我的样子太可笑了便大笑起来：“小姑娘苹果[Y]四块[B坏]钱一斤不是十块[B坏]钱一斤”。,200104124542200026,越南,2,200104,一封写给父母的信,80,80,60,51,54,317,C,
北京也好像快要到夏天了。,200104124525100057,日本,1,200104,一封写给父母的信,80,65,74,61,76,344,C,
看上去{CC看}你的先生也很不错。,200104124525200067,日本,2,200104,一封写给父母的信,65,75,44,39,33,243,未参加,
我在中国学习快两{CC二}年了，[BC。]是不是时间过得挺快{CQ的}？,200104124523200088,韩国,2,200104,一封写给父母的信,65,55,60,35,58,255,未参加,
好久不见了，你身体好吗？,200104124525200101,日本,2,200104,一封写给父母的信,70,50,33,42,47,225,未参加,
爸爸、妈妈身体健康[BQ。]再见{CQ！},200104124525200116,日本,2,200104,一封写给父母的信,70,50,38,30,36,207,未参加,
再见爸妈×××您们的女儿,200104124529200174,泰国,2,200104,一封写给父母的信,75,85,41,35,58,287,未参加,
爸爸、妈妈，当你们收到我的信后，一定{CQ要}给我回信，我好想收到你们的信啊，你们好久没有给我写信了吧。,200104124542200230,越南,2,200104,一封写给父母的信,70,75,60,54,83,331,C,
爸爸、妈妈都{CJ-zy要}保重身体。,200104124523200261,韩国,2,200104,一封写给父母的信,65,60,55,47,56,266,未参加,
因为我不知道我自己能做什么，[BC？]{CD还有}{CD跟}我适合{CC合适}的工作是什么，[BC？]还有我的汉语水平是到底怎么样{CJs}？,200104124525100262,日本,1,200104,一封写给父母的信,70,75,36,49,47,266,未参加,
因为做为一个老师来说，很可能是不能赚钱{CJX}太多，只是一个有体面的职业，但没有钱{CJX}太多。,200104124529200270,泰国,2,200104,一封写给父母的信,75,70,60,28,61,283,未参加,
你们已经知道，我说的不是经济上的支持，而是精神上的支持。,200104124523200304,韩国,2,200104,一封写给父母的信,70,70,55,49,54,286,未参加,
现在已经上四年级了，再学一年，写完论文就毕业了。,200104124523200304,韩国,2,200104,一封写给父母的信,70,70,55,49,54,286,未参加,
我{CJ-zy会}在中国好好学习，保持身体健康。,200104124523200313,韩国,2,200104,一封写给父母的信,70,65,44,44,49,258,未参加,
小时候，我以为这是应该的，[BC。]但到了现在我才明白你们的辛苦，[BC。]因此不知以后{CJ-zy该}怎么报答你们才好。,200104124523100416,韩国,1,200104,一封写给父母的信,80,90,52,51,51,319,未参加,
你们也是很好吧{CJsd}！,200104124523100422,韩国,1,200104,一封写给父母的信,65,70,30,28,38,217,未参加,
新的同屋来以后她到什么时候住在我们的房间{CJX}。,200104124525200429,日本,2,200104,一封写给父母的信,70,90,58,68,61,340,C,
我对贵公司很有信心{CC期望}。,199200204525100023,日本,1,199200,一封求职信,,,0,0,0,0,未参加,
我出生在日本国山形鼎[C]，高中毕业以后在东京上了大学，学了经济学。,199200008525100009,日本,1,199200,一封求职信,,,0,0,0,0,未参加,
这件事的问题就是这个。,199604123525200198,日本,2,199604,如何看待“安乐死”,65,40,69,74,52,278,未参加,
谁敢保证她这样安乐地死了以后，家人也可以安乐地活下去。,199604123542200097,越南,2,199604,如何看待“安乐死”,75,90,61,52,65,336,C,
我强调同意安乐死不是犯罪的行为，[BC.]而且帮助好好死的{WWJ},199604124523200041,韩国,2,199604,如何看待“安乐死”,50,60,42,30,44,205,未参加,
三是生活条件不一样。,199610550523190002,韩国,1,199610,如何解决“代沟”问题,60,55,49,53,72,270,未参加,
常常看到有些家庭中，天天有大小争[F爭]吵，各自说各的，缺少尊重与爱心。,199610550523290032,韩国,2,199610,如何解决“代沟”问题,90,80,78,73,74,390,B,
我国封建时代以前，大家庭制度是主要的社会制度。,199610550523190081,韩国,1,199610,如何解决“代沟”问题,70,70,36,44,61,269,未参加,
只是我觉得自己越来[F來]越大，需要好好地找寻[F尋]自己的生活、[BC，]出路，所以忽略了他们。,199611543501200519,中国,2,199611,如何解决“代沟”问题,90,85,94,71,90,427,A,
现今的社会，分工细，大家为了一个大整体，做出自己的贡献，每个人都象一颗螺丝[F絲]钉一般，做[B作]好自己的本分，谁做不好就会影响整体的表现。,199603533533200002,新加坡,2,199603,由“三个和尚没水喝”想到的……,90,85,85,65,84,406,B,
古人常说：[BQ“]一寸光阴[F陰[C]]不可轻[BQ”]，是有一定的道理的。,199603533533200022,新加坡,2,199603,由“三个和尚没水喝”想到的……,85,95,74,54,72,376,B,
若我努力去做，得到的成绩及老师的赞许是要平分给其他人{CC各人}的，又不是我一人独享，为什么要便宜他人呢？,199603533543200024,香港地区,2,199603,由“三个和尚没水喝”想到的……,85,85,58,60,94,377,C,
由于这个想法，他只挑[B排]了一个人份量的水回去，不与其他二[B工]人分享{CD了}。,199603533533100065,新加坡,1,199603,由“三个和尚没水喝”想到的……,90,65,69,72,91,378,C,
以前“大锅饭”流行时，中国工人和农民缺乏了积极性，也就是说“干与不干一个样，多干与少干一个样”[BQ。]因为是“大锅饭”，所以中国的工人和农民缺乏积极性。,199605104523100043,韩国,1,199605,由“三个和尚没水喝”想到的……,75,80,63,67,61,337,C,
那么出了事怎么办呢？,199605104525200070,日本,2,199605,由“三个和尚没水喝”想到的……,60,50,58,51,61,260,未参加,
每天晚上我们俩人躺[C]在床上，都希望另一人起来去关灯，有好多天开着灯睡。,199605104523200088,韩国,2,199605,由“三个和尚没水喝”想到的……,55,80,83,67,80,351,C,
我想这个故事描写{CQ了}人的缺点。,199605104525200146,日本,2,199605,由“三个和尚没水喝”想到的……,55,65,52,65,82,301,未参加,
”。,199605104801200167,澳大利亚,2,199605,由“三个和尚没水喝”想到的……,90,70,63,51,61,328,C,
我们应该考虑最重要的是什么。,199605104525200180,日本,2,199605,由“三个和尚没水喝”想到的……,65,60,58,60,68,294,C,
虽然觉得有点麻烦，但反正总是有人{CJ+zy一定}要干的。,199605104525200191,日本,2,199605,由“三个和尚没水喝”想到的……,90,70,55,74,77,359,C,
一个人的时候，如果生活很{CC挺}辛苦也只好忍住。,199605104525100246,日本,1,199605,由“三个和尚没水喝”想到的……,55,75,60,65,56,296,C,
所以说，人和水（自然资源）不能分离{CC分析}的{CJsd}。,199605104523200272,韩国,2,199605,由“三个和尚没水喝”想到的……,55,60,38,38,46,218,未参加,
{CJ-zhuy我}{CQ会}比以前更小心。{CJ-zhuy这},199605104523200278,韩国,2,199605,由“三个和尚没水喝”想到的……,70,70,71,51,51,301,C,
其实，在现实的生活中完全不是如此。,199605104525100274,日本,1,199605,由“三个和尚没水喝”想到的……,70,55,69,70,65,313,C,
看起来，这个社[C]会问题是很难对付的。,199605104525100332,日本,1,199605,由“三个和尚没水喝”想到的……,75,65,66,70,70,333,C,
先说星期天不要说死，谁自愿谁来做，后来谁也不干了，[BC。]{CD是}因为大家不愿意自己多付出一些，[BC。]这[C]样没有水喝了。,199605104523200337,韩国,2,199605,由“三个和尚没水喝”想到的……,85,70,80,72,75,373,B,
但是一下子{CC一趟人}增加到{CC了}三个人，人有了{CC感到}因为除了自己以外还有两个人，所以不必要亲自来干活，肯定两个人之中的一个人给自己办理{CJ-by事情}，这样{CQ的}想法{CC心情}。,199605104525200368,日本,2,199605,由“三个和尚没水喝”想到的……,65,55,52,67,68,289,未参加,
另外的两组和尚[C]听了，不好意思，就纷纷都去挑水，这[C]一来大家都有水喝，[BC。]庙里的生活情形也转[F轉]好了。,199605529529250144,泰国,2,199605,由“三个和尚没水喝”想到的……,65,70,21,33,46,221,未参加,
他们[F們]就没有水喝。,199605529529250166,泰国,2,199605,由“三个和尚没水喝”想到的……,65,65,19,38,27,198,未参加,
她就与公司的老板谈道理{CD与}{CD能}[BQ、]说服老板，公司仍然接{CQ收}那个工人工作，做一些打扫[F掃]{CQ的}工作，还负责他至他可活的日子。,199704123529200101,泰国,2,199704,记对我影响最大的一个人,70,80,65,82,75,362,C,
然而，{CJ-zhuy妈妈}在管教我们方面却是非常严厉的。,199704123533200107,新加坡,2,199704,记对我影响最大的一个人,95,90,62,65,77,388,C,
我想每个人都有一两个对他颇有影响[L]的人。,199704123512100237,菲律宾,1,199704,记对我影响最大的一个人,75,80,73,51,66,336,C,
在我的记忆中，给我留下最早也最深刻的童年印象是当母亲把我送进中华学校时的那一刻。,200110540540150039,印度尼西亚,1,200110,我的童年,75,85,77,87,88,405,B,
