错句,作文编码,国籍,性别,考试时间,作文题目,口试分数,作文分数,听力分数,阅读分数,综合分数,总分,证书
在韩国有一句话，就是“十年过去，江山也会变。,200209550523250233,韩国,2,200209,如何解决“代沟”问题,70,60,60,64,60,299,C,
因此，我们，即[C]晚辈应该认真地考虑[B滤]父母的意见和看法。,200209550523250244,韩国,2,200209,如何解决“代沟”问题,70,70,63,59,58,308,C,
解决代沟问题不是毫无希望{CC无可奈何}的。,200209550523250244,韩国,2,200209,如何解决“代沟”问题,70,70,63,59,58,308,C,
众所周知我们这个社会里{CD并}存在着代沟[C]问题。,200209550523150253,韩国,1,200209,如何解决“代沟”问题,70,70,63,59,50,300,C,
其次父母成长的时候他们的学习方法也是古老的，可现在孩子的教[B效]育方法十分好。,200209550523250261,韩国,2,200209,如何解决“代沟”问题,70,60,63,47,46,271,未参加,
那么，怎样解决代沟问题呢？,200209550523150280,韩国,1,200209,如何解决“代沟”问题,70,60,48,62,60,285,未参加,
第三，很少谈话也是一个原因。,200209550523250289,韩国,2,200209,如何解决“代沟”问题,70,70,63,69,72,332,C,
要了解对方的话需要跟不同年岁的人多接触，还要从媒体上了解{CC获息}不同年代{CQ的}生活方式、思想观念等等。,200209550523250295,韩国,2,200209,如何解决“代沟”问题,65,70,48,64,56,289,C,
但是越来越{CJX}儒[B需]教思想弱化，{CD和}社会发展得很快，两代人之[L]间的差异越{CQ来越}大。,200209550523250303,韩国,2,200209,如何解决“代沟”问题,65,60,57,59,58,282,未参加,
承认这一点是非常重要的。,200209550501150321,中国,1,200209,如何解决“代沟”问题,95,75,78,86,84,413,B,
可是，时间的变化是不可抗拒{CC抗力}的。,200209550523150359,韩国,1,200209,如何解决“代沟”问题,65,65,48,57,62,281,C,
我上高中的时候，妈妈总是让我教[C]女人的道理{CJZR}。,200209550523250356,韩国,2,200209,如何解决“代沟”问题,65,70,60,59,56,296,C,
我们常常听到长者抱怨说，今天的晚辈不听话，难以管教。,200209550523250757,韩国,2,200209,如何解决“代沟”问题,75,90,72,76,90,397,B,
反过来，年青人怎么这样？,200209550523250933,韩国,2,200209,如何解决“代沟”问题,65,70,57,59,50,287,C,
我所不承认的安乐死是为了{CJX}完全追求家人自己的方便的。,200205271525200006,日本,2,200205,如何看待“安乐死”,65,80,60,81,82,356,C,
如果病人自己愿意或者亲人真正了解病人的心情，[BC、]医生可以进行{CJX}帮助他{CD的}安乐死。,200205271525100075,日本,1,200205,如何看待“安乐死”,80,75,55,60,80,341,C,
妻子已经决定了自杀。,200205271525100098,日本,1,200205,如何看待“安乐死”,75,80,35,54,63,298,未参加,
可是国外生活的确是不容易，[BC。]没有依靠的人就觉得孤独而难受。,200205271525200086,日本,2,200205,如何看待“安乐死”,65,70,44,54,54,273,未参加,
当然，这件事应该跟家人、[BC，]朋友和医生等人{CJX}尽量好好地商量，最后决定。,200205271525200097,日本,2,200205,如何看待“安乐死”,80,85,66,76,87,388,B,
假如说[F說]：有人与[F興]他们[F們]说[F說]话[F話]，谈天论地，会[F會]把他们[F們]的思绪[F緒]拉回现[F現]实[F實]人生，又如；他们[F們]听[F聽]到音乐，会[F會]让他们的心神快活起来，开[F開]心起来。,200304522522250018,缅甸,2,200304,静音环境对人体的危害,75,75,39,44,61,284,未参加,
但是理解“绿色食品”的意思的人都拼命地买中国有机蔬菜[L]。,200307109525100042,日本,1,200307,绿色食品与饥饿,65,75,59,51,61,298,C,
但是[BD，]如果一直追[C]求吃“绿色食品”而不考虑[F慮]缺少粮[F糧]食而挨饿的人的话，他们就死。,200307109525100048,日本,1,200307,绿色食品与饥饿,70,70,80,62,79,349,C,
只有这[C]样做，我们才能保持健[B建]康的生活，还能减少饥,200307109523100066,韩国,1,200307,绿色食品与饥饿,65,65,70,62,67,313,C,
因为{CD以}吃[BQ“]绿[B绝]色食品[BQ”]既[B即]能保护环境，又对身体有好处，所以人们对[BQ“]绿[B绝]色食品[BQ”]的评价{CC认识}非常好。[BC.],200307109523200113,韩国,2,200307,绿色食品与饥饿,70,55,83,62,58,312,C,
“绿色食品”是每一个家庭都想要的食品。,200307109523100148,韩国,1,200307,绿色食品与饥饿,65,60,64,41,41,254,未参加,
把鸭子[L]放在田里，鸭子就吃害虫。,200307109523100152,韩国,1,200307,绿色食品与饥饿,60,55,62,51,58,267,未参加,
其实解决这个问题并不难。[BC.],200307109523200202,韩国,2,200307,绿色食品与饥饿,70,70,78,83,87,376,C,
总的{CC之}来说[BQ，]虽我对这个问题没有什么知[B智]识，可我想一定要考虑[B心]双方{CC两例[C]}的立场。[BC.],200307109523200293,韩国,2,200307,绿色食品与饥饿,60,65,64,35,41,248,未参加,
不过，作为世友，我们也不能光为他们提供“毒食”。,200307109529100301,泰国,1,200307,绿色食品与饥饿,70,85,62,59,90,358,C,
因为，{CD在}世界上有许多国家，有一些国家不够粮食{CJX}，粮食不足会影响到人的生存{CC饥饿}，比[C]如[BD，]非洲等等，这些{CC这[C]种}国家因粮食不足而导致{CC造[C]成}许多人{CD的}死亡。,200307109523200342,韩国,2,200307,绿色食品与饥饿,65,70,46,41,58,266,未参加,
拿中国的情况来说吧。,200307109523200391,韩国,2,200307,绿色食品与饥饿,70,80,56,64,64,324,C,
对一般人来说，他们都想吃绿色食品。,200307109523200396,韩国,2,200307,绿色食品与饥饿,60,65,40,22,32,202,未参加,
随着生活水平提高，人们越来越关心自己的健[B建]康，从此也产生了[BD，]和人们最直接的关心就是食品{CJ?}。[BC.],200307109523200414,韩国,2,200307,绿色食品与饥饿,60,60,56,35,38,231,未参加,
我觉得第二个方法有些不合理，[BC.]所以还是建议第[B等]一个方法。,200307109523200430,韩国,2,200307,绿色食品与饥饿,65,95,80,59,93,383,C,
发明{CD确}克隆[C]会复制很多同样的物体。,200307109523200473,韩国,2,200307,绿色食品与饥饿,65,85,78,70,70,358,B,
我们也要考虑[L]我们的后代，[BC。]地球是子子孙孙的生活背景。{CP如果用化肥，生产了更多的作物，我觉得还[C]是没用。P},200307109523100491,韩国,1,200307,绿色食品与饥饿,65,70,59,43,47,270,未参加,
你听过“绿色食品”吗？,200307109523200496,韩国,2,200307,绿色食品与饥饿,65,50,70,46,58,270,未参加,
但如果吃的食品{CD中}，有害人的健康或生命的话，怎么能吃呢？,200307109523200504,韩国,2,200307,绿色食品与饥饿,60,50,51,33,38,212,未参加,
首先我们得看看一个国家的情况、一个国家的发展程度、一个国家的经济状[B壮]况。,200307109540200572,印度尼西亚,2,200307,绿色食品与饥饿,70,85,72,59,70,348,C,
我首先要把不挨饿放在第一位。,200307217501200036,中国,2,200307,绿色食品与饥饿,80,65,56,35,47,271,未参加,
为了生存没有不能吃的。[BC.],200307217523200080,韩国,2,200307,绿色食品与饥饿,60,60,59,30,56,247,未参加,
农作物的产量的速度有影响，但是一直吃这样有害的东西的话，[BC、]最后我们很可能生病，[BC、]那时候已经晚了吧。P},200307217523200120,韩国,2,200307,绿色食品与饥饿,65,55,46,38,58,244,未参加,
有时有菜不卖，都废弃，为了保持菜的价格{CJX}。,200307217525100123,日本,1,200307,绿色食品与饥饿,70,65,80,51,58,310,C,
所以我觉得把“绿色食品”卖得贵，把使用化肥和农药的食品卖得非常[B赏]便宜[B且]，让他们自选自己[L]需要的。,200307217523200133,韩国,2,200307,绿色食品与饥饿,65,65,67,70,70,321,C,
用大量{CC多量}的农药会导[B倒]致农作物[C]的化学污染，[BC。]但是买这些农作物之后在家里洗干净的话会预防[B放]{CJ-by疾病}。,200307204523100018,韩国,1,200307,绿色食品与饥饿,65,65,75,54,70,313,C,
人类悠久{CC长久}的历史上，我们祖先一直和挨饿战斗{CC斗战}。,200307204525200056,日本,2,200307,绿色食品与饥饿,60,60,59,72,76,309,未参加,
我觉得化学污染的东西吃得太多，{CQ对}我们的寿命也有影响，[BC。]我们不能活{CJ-zy很}长时间。,200307204525200065,日本,2,200307,绿色食品与饥饿,55,65,38,43,24,207,未参加,
所以[BQ，]为了增加{CC充足}人们需要的粮食{CC食量}，在许多的农家使用农[B浓]药。[BC.],200307204523100101,韩国,1,200307,绿色食品与饥饿,60,65,48,43,38,237,未参加,
我觉得[B的]吃绿色食品比较好，[BC。]因为不会饿死。,200307205523100109,韩国,1,200307,绿色食品与饥饿,70,60,38,17,27,197,未参加,
因为“绿色食品”的价格{CD是}比一般的农作物[C]贵很多。,200307205525200173,日本,2,200307,绿色食品与饥饿,65,65,67,64,67,312,C,
人类往往为了利益而使用{CC做出}了许多手段。{CP比如说，人们为了大大提高农作物的产量，他们使用了农药[B要]来保护农田，把农田里的害虫消灭掉。虽说把农田里的害虫消灭得一干[BD、]二净，人类同时受到若干的危害。P},200307212523100005,韩国,1,200307,绿色食品与饥饿,65,75,54,51,64,296,未参加,
我们一定要坚持下去，爱护环境，并把充满希望的美丽、健康的地球留给后孙。,200307212523100023,韩国,1,200307,绿色食品与饥饿,65,70,75,70,79,345,C,
种田的地方因为建了住宅而没有了。,200307212540200039,印度尼西亚,2,200307,绿色食品与饥饿,65,70,72,41,76,310,未参加,
那么怎么解决这个问题呢？,200307201523100011,韩国,1,200307,绿色食品与饥饿,75,65,51,43,50,271,未参加,
只要政府采取措施，为他们提供粮食，那么这种问题会大大减少。,200307201523200059,韩国,2,200307,绿色食品与饥饿,75,65,80,64,87,358,C,
所以现在很多人喜欢吃绿色食品。[BC.],200307201523200068,韩国,2,200307,绿色食品与饥饿,60,60,51,27,30,210,未参加,
为什么这种观点是不正确的呢？,200307302523200049,韩国,2,200307,绿色食品与饥饿,80,75,75,62,93,376,B,
绿色食品比普通的食品小，人们吃食品后很快就能感觉到饿，所以使用化肥和农药的食品和绿色食品各有各的缺点和优点，我觉得不挨饿还是第一位{CJsd}。[BC.],200307302523200052,韩国,2,200307,绿色食品与饥饿,70,65,51,46,44,262,未参加,
我们应该重视这些问题，也要努力，尽力解决这,200307302523200072,韩国,2,200307,绿色食品与饥饿,80,70,67,59,64,330,C,
还有一个问题是现在世界上还有几亿人因缺少粮食而挨饿。,200307302523100081,韩国,1,200307,绿色食品与饥饿,75,70,86,80,76,376,B,
现在，我们需要政府的恰到好处的政策。,200307215523250019,韩国,2,200307,绿色食品与饥饿,65,70,51,59,87,318,C,
我认为，[BC、]为了解决这[C]种问题{CD应该}需要[C]开发对人体的害处{CC2害}不大的化肥和农药，而且[C]每一个人应该注意浪费食品{CJ-sy造成}的缺粮{CC确良}的问题。,200307215525150016,日本,1,200307,绿色食品与饥饿,60,70,72,56,64,307,C,
我们应以“地球村”的意识互相帮助。,200307215523250020,韩国,2,200307,绿色食品与饥饿,65,65,59,67,96,336,C,
还有[BQ，]如果一直上女子学校（男子学校）的话，这种人的脑子里有“想像得非常好的异性”“男性{CD是}应该这样做”“这样的女性是一般的”等{CC1创造}很多跟实际不一样的对异性的看法。,200310576525200005,日本,2,200310,我对男女分班的看法,65,65,55,58,45,272,未参加,
日本也是{CJX}大部分学校采用男女混合式教育，尤其是在公立学校{CD方面}，除了几所女子大学以外都是采用男女混合式教育，但是在私立学校{CD方面}，从小学开始采用男女分班式教育的学校也不少。[BC，],200310576525100020,日本,1,200310,我对男女分班的看法,60,70,79,58,63,315,C,
同性的话不需要{CC2要}考虑，[BC。]{CQ可以}很顺利地决定。,200310576525200045,日本,2,200310,我对男女分班的看法,60,65,49,51,58,266,未参加,
教育应该是公平的。,200310576525200058,日本,2,200310,我对男女分班的看法,65,70,58,61,70,310,C,
可是，如果女生就因男生在班上淘气而学不好，这也说明了她们以后遇[B喻]到问题{CD可}就麻烦了！,200310602801250003,澳大利亚,2,200310,我对男女分班的看法,65,65,60,61,72,307,C,
我之所以学汉语，就是为了与中国进行贸易，加强同中国的经济贸易方面的合作，并以此为基础，更加巩固朝中两国的战略伙伴关系。,200304131510100065,朝鲜,1,200304,我学汉语是为了……,80,80,74,63,85,374,B,
我感到很骄傲{CJX}中国这么{CC怎么}伟大。,200304131540200088,印度尼西亚,2,200304,我学汉语是为了……,75,65,65,38,57,287,未参加,
当时我觉得中国这个国家太神奇了。,200304131542200183,越南,2,200304,我学汉语是为了……,70,80,59,54,77,330,C,
”我就要回答：为了满足我的知识需[B雪]求，为了能够跟中国人交流，为了更[B跟]好地了解中国人的想法，中国文化……可是最重要的是因为我喜欢。,200304131630100275,西班牙,1,200304,我学汉语是为了……,70,70,53,24,66,271,未参加,
现在的我逐渐成熟，已不再是从前的那个日夜只求见郭富城一面的疯狂歌迷了。,200304131634200223,英国,2,200304,我学汉语是为了……,95,90,92,74,100,450,A,
比如说，男生在逻辑学上占优势，若[B者]把男生都聚集在一起做比较，便能知道谁是这方面的真正强者。,200306680519250028,马来西亚,2,200306,我对男女分班的看法,85,85,87,68,94,414,A,
在这个社会中还是有许多人吃着普通食品。,200307271523100013,韩国,1,200307,绿色食品与饥饿,70,70,80,67,84,359,C,
虽然该国家，已经得到{CC受到}一些发达国家的帮助，不过到目前为止{CC位置}还没有改善。,200307271523100048,韩国,1,200307,绿色食品与饥饿,70,70,75,64,81,348,C,
首先这个对身体有好处。,200307271523200067,韩国,2,200307,绿色食品与饥饿,70,75,78,54,73,339,C,
现今，大多数人没有挨饿的{CD人}。,200307271523200076,韩国,2,200307,绿色食品与饥饿,75,75,75,62,79,356,B,
如果那样的话，人们会受健康的害{CJ?}。,200307271523200101,韩国,2,200307,绿色食品与饥饿,70,60,72,62,70,319,C,
这样{CD会}我们将[C]来可以生活{CQ在}一个干净[C]的环境。,200405109523200322,韩国,2,200405,吸烟对个人健康和公众利益的影响,60,65,62,75,68,313,C,
我们通过报纸[C]和{CC或}新闻{CD上}常常听到有关{CC关系}吸烟的问题。,200405109523200531,韩国,2,200405,吸烟对个人健康和公众利益的影响,85,70,59,64,53,322,C,
{CP最近吸烟的人很多，[BC。]其实人们也[C]知道对身体来说烟是一个非常不好的东西，[BC。]但是很多人都随便吸烟，[BC。]因为烟本来含有对身[C]体不好的东西，[BC.]而且那个东西就让人们一直吸烟。P},200405109523100604,韩国,1,200405,吸烟对个人健康和公众利益的影响,70,65,50,50,39,260,未参加,
据我所知，随着经济发展而富裕起来的{CQ地方的}娱[C]乐环境{CQ里}{CJ+zxy的繁华}，{CD很多}青少年的吸烟率逐[C]渐增[C]长。,200405109523100747,韩国,1,200405,吸烟对个人健康和公众利益的影响,60,60,69,66,68,305,未参加,
社会的构成人员都是这项规定的对象。,200405109523200807,韩国,2,200405,吸烟对个人健康和公众利益的影响,70,65,57,62,64,304,C,
”她从初中就开始抽烟，到了现在[BQ，]对[C]她来说戒[C]烟是一个不容易决定的选择。,200405109523200812,韩国,2,200405,吸烟对个人健康和公众利益的影响,65,65,76,66,68,324,C,
因为我是个反对吸烟的人，所以有时候去公共场所{CJ-sy看到}别人在吸烟，很难受。,200405109523200819,韩国,2,200405,吸烟对个人健康和公众利益的影响,70,65,67,48,64,300,C,
吸烟者吸烟后{CJ-sy吐}出来的烟{CC1不好的物质}对不吸烟者{CQ的}身体有3倍的不好的影响{CC反映[B影]}。,200405109523100962,韩国,1,200405,吸烟对个人健康和公众利益的影响,60,65,69,48,59,284,未参加,
其次，吸烟是空气污[C]染的一种原因。,200405109525200980,日本,2,200405,吸烟对个人健康和公众利益的影响,75,60,52,46,44,263,未参加,
究[B穷]竟什么是义和利？,200405109523101008,韩国,1,200405,吸烟对个人健康和公众利益的影响,70,65,64,56,55,296,C,
对吸烟者实行{CC2为}严厉的惩罚措施显示现代人对健康的关心度。,200405109523201052,韩国,2,200405,吸烟对个人健康和公众利益的影响,50,65,57,39,37,229,未参加,
还有边走边抽的人是最可恶{CC2恶}的，因为[C]他的手在下边时，{WWJ},200405109525101032,日本,1,200405,吸烟对个人健康和公众利益的影响,45,60,40,52,50,226,未参加,
吸烟就是为自己的感情上{CQ的}满足而养成的一种习惯。,200405109523201156,韩国,2,200405,吸烟对个人健康和公众利益的影响,70,65,67,66,66,320,C,
因为这是个人爱好的问题[BQ，]所以{CJ-zhuy别人}不要过度地干涉。,200405109523201273,韩国,2,200405,吸烟对个人健康和公众利益的影响,60,55,50,48,37,231,未参加,
接着说{CC提}吸烟对公共场所的{CJ-dy影响}问题。,200405109525201260,日本,2,200405,吸烟对个人健康和公众利益的影响,75,55,55,66,59,295,未参加,
这个{CD时}也帮助青年人{CJ-sy养}成良好的习惯，[BC。]而且环境{CQ也}越来越好，[BC。]还有{CC还是}人们的身体也越来越健康了，[BC。]抽烟{CQ的}人也{CJ+zy越来越}改变了{CC的}。,200405109523201425,韩国,2,200405,吸烟对个人健康和公众利益的影响,65,60,24,23,35,190,未参加,
我还在电[C]视上听到过这种事[C]情，说是有一些得肺癌[C]的人是因为{CC2因}吸到旁边[C]人抽的烟{CD而得到的}。,200405109523201437,韩国,2,200405,吸烟对个人健康和公众利益的影响,70,90,79,73,77,382,B,
就这样吸烟对个人健康和公众利益的影响很大而且{CC2还}很多。,200405109523101448,韩国,1,200405,吸烟对个人健康和公众利益的影响,65,65,67,44,50,275,未参加,
继续这样做下去的话，我们很快就失去我们的这个世界。,200405109523201471,韩国,2,200405,吸烟对个人健康和公众利益的影响,70,70,71,56,70,325,C,
人们经常把自己吸完了的烟随地扔，这点不仅会引起火灾{CC着火}，也会给人们不好的印象。,200405109523201472,韩国,2,200405,吸烟对个人健康和公众利益的影响,75,75,48,39,35,262,未参加,
“吸二手烟”以前没有人知道这个词，但是现在已经成为了众所周知的词。,200405109525201501,日本,2,200405,吸烟对个人健康和公众利益的影响,65,60,28,58,44,238,未参加,
第二，在公共场所抽烟的另一种危害是烟头会碰到别人身体或[B惑]衣服上，引起烫伤{CC火伤}、[BC，]燃烧{CC燃上}衣服等后果。,200405109525101581,日本,1,200405,吸烟对个人健康和公众利益的影响,95,90,67,75,95,421,B,
大部分的人口密集的商业中心已经都是禁烟{CJs}。,200405109525101600,日本,1,200405,吸烟对个人健康和公众利益的影响,65,75,55,66,75,323,C,
因为女人生{CC出生}孩子的时候孩子不正常率高一点。,200405109523201790,韩国,2,200405,吸烟对个人健康和公众利益的影响,60,70,28,25,30,198,未参加,
第四，吸[C]过{CD烟}的烟头{CJ+wy是}引起环境污[Pwú]染[B然]。,200405109523201850,韩国,2,200405,吸烟对个人健康和公众利益的影响,65,60,62,46,39,255,未参加,
有些人吸完后随便扔掉{CJ-by烟头}，面前有烟灰缸[BQ，]{CJ-zy仍}好像故意似的扔掉。,200405109525101844,日本,1,200405,吸烟对个人健康和公众利益的影响,65,60,33,52,57,250,未参加,
我们应该认为{CC再想}吸烟这个{CC1部分}{CD的}问题就是我的朋友的问[C]题[BQ，]还有孩子的问题。,200405109523201875,韩国,2,200405,吸烟对个人健康和公众利益的影响,60,70,40,35,46,236,未参加,
有很多人因得肺[Pfèi]癌[Pái]而死去。,200405109523101894,韩国,1,200405,吸烟对个人健康和公众利益的影响,65,90,57,52,53,308,未参加,
结果抽烟{CQ在}哪个方面都没有什么好处。,200405109523101894,韩国,1,200405,吸烟对个人健康和公众利益的影响,65,90,57,52,53,308,未参加,
他已经去世了。,200405109523201893,韩国,2,200405,吸烟对个人健康和公众利益的影响,65,70,57,50,46,274,未参加,
如果有怀孕的人、[BC，]孩子在的话怎么办？,200405109525200078,日本,2,200405,吸烟对个人健康和公众利益的影响,80,70,52,60,56,308,C,
可是他们也承认吸烟的危害[B胁]害性。,200405109523100521,韩国,1,200405,吸烟对个人健康和公众利益的影响,75,85,66,66,63,348,B,
不吸[C]烟[C]的人也在[C]吸[C]烟人的[C]周[C]围[B伟]{CD中}吸了烟。,200405109523100563,韩国,1,200405,吸烟对个人健康和公众利益的影响,55,65,46,52,56,256,未参加,
它总[D总]破坏{CC带来}我们人类的健康和{CC以及}社会文明的发展。[BC.],200405109523100674,韩国,1,200405,吸烟对个人健康和公众利益的影响,85,70,70,79,80,375,B,
而且很小的香烟会导致{CC发[C]生}很[C]大的火灾[C]。,200405109523200795,韩国,2,200405,吸烟对个人健康和公众利益的影响,65,70,48,58,66,293,C,
但是有些吸烟[B咽]的人却并不在乎，旁若无人地{CC的}吸烟。,200405109525200815,日本,2,200405,吸烟对个人健康和公众利益的影响,70,60,70,68,73,326,C,
希望吸烟者能不被罚[F罰]而做[B作]到讲{CC有}文明[C]、[BC，]守{CC有}规矩{CC规律}{CJ+zxy的吸烟者}。,200405109525100335,日本,1,200405,吸烟对个人健康和公众利益的影响,75,95,89,77,82,412,B,
比如说在日本香烟百分之六十是税，[BC。]所以香烟的价格很高，而给他们经济压力{CJ-zy可以}让他们不吸烟。,200405109525100784,日本,1,200405,吸烟对个人健康和公众利益的影响,70,70,57,68,65,318,C,
我估计“吸烟影响社会利益”这个观念，对一些人来说还是不能接受的，还有一些人还是坚持在公共场所场吸烟。,200405109525200934,日本,2,200405,吸烟对个人健康和公众利益的影响,95,60,79,79,80,384,C,
最近许多国家有“禁烟”的潮流。,200405204525200008,日本,2,200405,吸烟对个人健康和公众利益的影响,60,65,60,58,51,277,未参加,
在世界上，任何国家都是向这个方向{CJ-wy发展}{CJsd}。,200405204525200027,日本,2,200405,吸烟对个人健康和公众利益的影响,70,70,63,47,49,287,C,
被点燃过的香烟落在地上，也有可能引起严重的火灾。,200405204525200221,日本,2,200405,吸烟对个人健康和公众利益的影响,70,80,63,75,67,345,C,
里边反对抽烟的人们很冷酷地排斥爱好抽烟的人们。,200405204525100287,日本,1,200405,吸烟对个人健康和公众利益的影响,70,80,47,80,63,330,C,
所以{CJ+zy一律}禁止所有的抽烟{CJ-zxy行为}既不太现实，又是不应该的。,200405204525100287,日本,1,200405,吸烟对个人健康和公众利益的影响,70,80,47,80,63,330,C,
我在悲痛中[BD、]决定了向众多{CC许多}爱抽烟的人讲我们家的小故事。[BQ”],200405204525200460,日本,2,200405,吸烟对个人健康和公众利益的影响,60,60,58,65,61,286,未参加,
比如，日本的很多车站一般是禁烟区，但有一个吸烟室，想吸烟的人可以去那里吸烟。,200405205525200055,日本,2,200405,吸烟对个人健康和公众利益的影响,65,85,85,70,76,371,B,
其实{CD说}我也是个抽烟的人，知道{CJ-zhuy抽烟}对身体有很多坏影响，而且最近允许抽烟的地方也很少[BQ，]但是抽烟的人还是{CJ-zy很}多，这是因为对抽烟的人来说吸烟这个行为是{CJX}事实{CQ上}对身体没有什么好处，可是对心情{CD上}有一些好处，[BC、]这些好处是每个人都有{CQ的}{CJ-dy吸烟的}理由，[BC、]一般大概都说香烟就是{CD个}自己精神{CC心里}的镇定{CC安定}剂。,200405205525100073,日本,1,200405,吸烟对个人健康和公众利益的影响,60,60,30,42,36,210,未参加,
香烟对抽烟的人以及{CC而且}不抽烟的人都{CC也}有害。,200405205525200101,日本,2,200405,吸烟对个人健康和公众利益的影响,60,85,55,63,58,310,未参加,
前者会感到很不舒服，后者则会遭受{CC遭到}重大危机。,200405205525200204,日本,2,200405,吸烟对个人健康和公众利益的影响,60,75,71,70,90,352,C,
那么，既[B仅]然吸烟的人难以戒{CC禁}烟，大多数{CC的}吸烟的人又有着“饭后一支烟，赛过活神仙”这样的想法，政府加强惩罚在公共场所抽烟力度的这一措施就是一种大快人心的做[B作]法。,200405201525200048,日本,2,200405,吸烟对个人健康和公众利益的影响,70,85,79,63,90,379,C,
有的以吸烟来减轻{CC删余}自己的压力。,200405332540200003,印度尼西亚,2,200405,吸烟对个人健康和公众利益的影响,70,75,58,44,58,294,C,
不知何时开始人开始吸烟，只知道烟是一些人生活中很重要的东西。,200405332540200028,印度尼西亚,2,200405,吸烟对个人健康和公众利益的影响,65,60,60,39,54,261,未参加,
