错句,作文编码,国籍,性别,考试时间,作文题目,口试分数,作文分数,听力分数,阅读分数,综合分数,总分,证书
由于这样的原因[BQ，]出现的代表的例子是“绿色食品”，即不使用化肥和农药的食品。,200307109523200182,韩国,2,200307,绿色食品与饥饿,70,65,64,51,50,286,C,
如果[BD，]自己的家庭里的人因吃了这[C]些食品而得{CC造[C]成}病的话，那多么伤心而感到后悔呀！,200307109523200228,韩国,2,200307,绿色食品与饥饿,65,70,56,51,76,304,未参加,
还有应该人们{CJX}提示这个食品是不是“绿色食品”。,200307109525200244,日本,2,200307,绿色食品与饥饿,65,70,64,51,58,294,C,
到时，希望全世界不再有挨饿的人，而是全世界的人吃上“绿色,200307109523100247,韩国,1,200307,绿色食品与饥饿,75,80,83,80,100,409,B,
这[C]是理所当然的。,200307109525100262,日本,1,200307,绿色食品与饥饿,80,85,51,62,79,351,C,
这[C]是最好的办法[BQ。]其实他们没有能力做自己的饭的话，他们永远[C]不能摆脱{CC2脱}不了饥饿{CJZR}，所以[BD，]必须帮助他们的经[C]济方面的发展或者他们的土地质量。,200307109523100276,韩国,1,200307,绿色食品与饥饿,70,65,54,46,35,256,未参加,
无论什么问题比不上生命问,200307109523200293,韩国,2,200307,绿色食品与饥饿,60,65,64,35,41,248,未参加,
现代的世界无论是发达[C]国家还是发展中国家，都走向“绿色化”。,200307109523100331,韩国,1,200307,绿色食品与饥饿,65,80,64,67,76,340,C,
人是具有精神的高级动物。,200307109523100346,韩国,1,200307,绿色食品与饥饿,65,75,88,54,64,333,C,
所以谁先谁[C]后、谁第一位谁第二位并不是重要的问题。[BC.],200307109523200354,韩国,2,200307,绿色食品与饥饿,65,75,72,67,70,336,C,
回到家又想了这个问题。,200307109523200396,韩国,2,200307,绿色食品与饥饿,60,65,40,22,32,202,未参加,
如果人们不{CD是}这样做，那[B哪]么，肯定不足{CJX}农产品，[BC.]不足{CJX}农产品{CC家产品}的话，人类{CJ-zy就会}遇到{CC得到}饥饿{CJ-zxy的问题}。,200307109523100434,韩国,1,200307,绿色食品与饥饿,60,60,56,43,41,242,未参加,
这[C]就意味着我们失去那块土地。,200307109523200447,韩国,2,200307,绿色食品与饥饿,65,90,75,70,90,381,B,
我认为，世界上最宝贵的是生命。,200307109525200461,日本,2,200307,绿色食品与饥饿,80,95,80,75,93,418,B,
目前有很大的事实——“非典”证明着这种观点。,200307109523200522,韩国,2,200307,绿色食品与饥饿,85,90,75,72,93,411,B,
随着科学的大大进[C]步，人民的生活条件也一下子提高了。,200307109523100537,韩国,1,200307,绿色食品与饥饿,70,65,80,72,81,354,C,
然而现代工业化社会中，吃饭是{CJX}显然不重要{CJsd}，现代高度文明使人们想除了吃、喝、玩儿以外，还要追[C]求更高明的、[BC，]高尚的东西。,200307109523200533,韩国,2,200307,绿色食品与饥饿,75,70,78,70,73,355,B,
所以，我认[F認]为[C]不挨饿[F餓]才是第一位的。,200307109525100552,日本,1,200307,绿色食品与饥饿,75,65,88,70,100,385,B,
有的水果，[BC、]例如苹果、桃子、葡[B莆]萄、梨等又甜又易生虫子{CD的}，常常多用些农药。,200307217523200006,韩国,2,200307,绿色食品与饥饿,50,65,67,41,61,265,未参加,
在社会中，用化肥和农药，既不利于人们的健康，也有害于空气{CD污染}。,200307217523200028,韩国,2,200307,绿色食品与饥饿,90,70,54,51,76,334,未参加,
一个农民为了提高农作物的产量，使用了很多污染品，然后卖给了很多商家。,200307217523200029,韩国,2,200307,绿色食品与饥饿,70,65,70,67,70,328,C,
因为，如果地球的环境破坏[Phuài]，我们得不到生活[B浩]的条件。[BC.],200307217523100082,韩国,1,200307,绿色食品与饥饿,60,55,43,51,61,251,未参加,
食品包[B抱]括很多种，[BC。]其中，我认为最重要的是农作物。,200307204523200001,韩国,2,200307,绿色食品与饥饿,65,75,86,75,90,378,B,
那么怎么办呢？,200307204525200009,日本,2,200307,绿色食品与饥饿,60,60,46,54,67,269,未参加,
这样一来，对两个情况不同的地区都有好处。,200307204525200020,日本,2,200307,绿色食品与饥饿,65,80,83,67,99,382,B,
比如在瑞士。,200307204627100064,瑞士,1,200307,绿色食品与饥饿,65,75,51,49,67,294,未参加,
他们要吃新鲜的，对身体[B休]无害的“绿色食品”[BQ，]但世界上很多国家有着饥饿[C]现象。{CP我觉得人类都是平等的{CJ+zxy一个},200307204523100071,韩国,1,200307,绿色食品与饥饿,60,60,40,38,58,238,未参加,
那么这些问题怎样解决呢？,200307204525200067,日本,2,200307,绿色食品与饥饿,65,75,59,56,67,309,C,
所以，现在在日本开始了恢[B回]复土力的尝试。{CP这个尝试的重要的内容是不用化肥，而用人的排泄物，[BC。]而不用使用农药。P},200307204525200079,日本,2,200307,绿色食品与饥饿,60,80,70,59,64,320,C,
因为目前生产或销售绿色食品的国家可以{CC可能}说都是比较富裕、[BC，]发[C]达的国家，而在这些地方根本不会存在因缺少粮食而挨饿这[C]样的问题。,200307204525200119,日本,2,200307,绿色食品与饥饿,65,85,78,70,53,341,C,
我觉得应该{CJX}挨饿是第一位。,200307205523100012,韩国,1,200307,绿色食品与饥饿,65,70,70,51,67,309,C,
我认为不用化肥和农药是第一位的。,200307205523200013,韩国,2,200307,绿色食品与饥饿,70,65,78,62,84,345,C,
但是给平时的生活带来很多不便。,200307205525100021,日本,1,200307,绿色食品与饥饿,70,70,67,56,73,324,C,
有的人提倡吃绿色食品，[BC.]但是单靠绿色食品能够填饱人们的肚子{CC5世界人口}吗？,200307205533200031,新加坡,2,200307,绿色食品与饥饿,85,80,86,70,90,404,B,
我们已[B巳]经使用过[C]这[C]么长时间的农[C]药，却没听{CC见}过[C]有人因为这[C]个而死的消息。,200307205523100041,韩国,1,200307,绿色食品与饥饿,60,60,62,46,53,263,未参加,
如果按照这个方式做的话[BQ，]世界慢慢地{CC得}{CJ-zy就}没人用化学药品{CC污染}{CQ了}。,200307205523200101,韩国,2,200307,绿色食品与饥饿,65,65,59,35,53,261,未参加,
如果我们都生产{CC产生}“绿色食品”的话，[BC、]因缺少粮食[C]而挨饿的人会增加吗？,200307205525100177,日本,1,200307,绿色食品与饥饿,65,60,46,64,47,265,未参加,
研究对农[C]作物成长的因素可以加快农[B衣]物成长速度，会取得更多得产量。[BC.],200307212523200012,韩国,2,200307,绿色食品与饥饿,70,60,56,25,38,234,未参加,
虽然“绿色食品”也是通[C]过[C]机器或者人的加工而生产的，但现代人们[C]的生活上成为了不可缺乏[B泛]的东西了。,200307212523100062,韩国,1,200307,绿色食品与饥饿,70,75,70,56,64,324,C,
我们应该从人类共同生存的角度来解决问题的。,200307201523100022,韩国,1,200307,绿色食品与饥饿,75,65,67,67,79,340,C,
为了身体健康，应该生产未污染的农产物。[BC.],200307201523200033,韩国,2,200307,绿色食品与饥饿,60,55,35,35,44,210,未参加,
饥饿，那无论如何使用这[C]些化肥。P},200307201523200042,韩国,2,200307,绿色食品与饥饿,60,65,48,27,64,247,未参加,
有钱的人，富有{CC拥有}得不得了，没有钱的人，差不多整天在街上坐着。,200307302523100017,韩国,1,200307,绿色食品与饥饿,65,60,59,46,53,266,未参加,
{CP无论这里{CQ有}没有办法管他们，管也不能管得{CC的}很严，因为他们是无意的、别人都这[C]样才能做{CJX}这样P}。[BC.],200307302523200020,韩国,2,200307,绿色食品与饥饿,65,65,64,51,47,276,未参加,
现在在世界很多地方已解决人们吃饱的问题，在这种现实的基础上[BQ，]很多人提出不用化肥和农药[B约][BD、]制成“绿色食品”[BQ，]并且以“绿色食品”代替现在的食品，但如果用“绿色食品”代替现在所有食品的话，很多人吃不饱，甚至饿死，所以我认为应该不挨饥饿放在第一位{CJba}。,200307302523100031,韩国,1,200307,绿色食品与饥饿,75,60,78,72,81,352,C,
可是也不能让几亿人再[B在]饥饿。,200307302523100039,韩国,1,200307,绿色食品与饥饿,65,60,51,51,50,260,未参加,
还是要不挨饿。,200307302501100060,中国,1,200307,绿色食品与饥饿,85,65,80,64,76,359,C,
虽然现在绿色食品污染性很严重，但我还是喜欢吃。[BC.],200307302523100062,韩国,1,200307,绿色食品与饥饿,65,65,62,35,47,258,未参加,
虽说现在是比以前好过些了，但就{CJX}从材料中可了解到现在仍有几亿人承受{CC2是}饿死的{CJsd}！,200307302523200059,韩国,2,200307,绿色食品与饥饿,80,85,86,75,93,413,B,
所以一定要多了解，多关心这些饮食习惯。[BC.],200307302523200063,韩国,2,200307,绿色食品与饥饿,70,65,78,49,56,304,C,
现在“绿色食品”价格很高，老百姓不能普遍[C]地吃上。,200307302523200069,韩国,2,200307,绿色食品与饥饿,90,75,83,80,84,406,A,
所以，现[C]在人们把用未经污染的农产品[BD，]叫“绿色食品”。,200307302523200126,韩国,2,200307,绿色食品与饥饿,65,65,70,35,70,289,未参加,
这[C]国家的人，当时大部分都饿死了。,200307302523200137,韩国,2,200307,绿色食品与饥饿,65,60,48,35,41,232,未参加,
而且能买到人是不是有钱人而是谁也会买到。,200307206523100028,韩国,1,200307,绿色食品与饥饿,80,65,67,70,70,340,C,
对{CC为了}我们的健[B建]康没什么好处。[BC.],200307206523100045,韩国,1,200307,绿色食品与饥饿,65,60,32,25,21,186,未参加,
世界上有很多国家面临着饥饿和粮食问题。,200307206525100052,日本,1,200307,绿色食品与饥饿,70,65,54,38,61,274,未参加,
我们先控制盲目的开发。,200307215523250005,韩国,2,200307,绿色食品与饥饿,65,70,62,56,79,318,C,
若有人问，吃“绿色食品”和不挨饿哪个是第一位{CJsd}，我无法回答。,200307332540200021,印度尼西亚,2,200307,绿色食品与饥饿,60,60,54,27,53,236,未参加,
对我而言，这个教育比男女分班教育好得多，[BC。]因为接触女子的机会多。[BC，],200310576525100030,日本,1,200310,我对男女分班的看法,65,70,52,47,65,285,未参加,
第[C]一，人类社会基本上由男女所{CC为}组成的{CJsd}。,200310576525100049,日本,1,200310,我对男女分班的看法,65,75,63,61,70,321,C,
还没形成{CD了}自我{CJ-zxy意识}，根本不清楚男女分别的所以[B在]就{CC而}开始谈恋爱，这就惨了。,200310576525200046,日本,2,200310,我对男女分班的看法,55,70,49,61,65,284,未参加,
所以，[BC、]谈恋爱以后我们更了解别人的心情。,200310576525100067,日本,1,200310,我对男女分班的看法,60,70,38,58,61,272,未参加,
比如说：如果看了怎样保养{CC保健}身体的书，我们日常生活中，可减少身体的疾病。,200310540540250005,印度尼西亚,2,200310,谈有效阅读,60,60,36,53,86,277,未参加,
所以，自己要有个目标。,200310540540250068,印度尼西亚,2,200310,谈有效阅读,65,60,61,33,48,250,未参加,
无论[F論]是在工作上或者是增加自己的知识{CQ在}，都与阅读有很密切的关系，一个不爱阅读不爱看报纸的人，肯定{CD的}会跟不上时代的{CJsd}。,200310540540250071,印度尼西亚,2,200310,谈有效阅读,65,70,54,51,86,312,未参加,
因此，在提高素质还有各方领域的同时，每个人以各人的学历、[BC，]爱好选择健康有益的书籍阅读。[BC，],200310540540250080,印度尼西亚,2,200310,谈有效阅读,60,60,41,35,77,255,未参加,
但是我相信，如果今天我够努力，把今天{CJ-zxy的事情}做好{CC2作得好}，毕业后找{CC1还是}工作的时候一定好。[BD“],200304131529100010,泰国,1,200304,我学汉语是为了……,60,65,18,19,29,174,未参加,
中学是青少年{CC3孩童}生理和心理共同发育的年齡，如果按自然的规律{CC定理}，他们{CC孩童}应多接触[F觸]不同种类[F類]的人，让他们有{CJ+dy一套}全面、健康的身心发展。,200311952634130009,英国,1,200311,我对男女分班的看法,70,75,77,73,83,367,B,
所以我就来北京学习汉语。,200304131542200183,越南,2,200304,我学汉语是为了……,70,80,59,54,77,330,C,
但[BD，]如果让笔者重过中学生涯，肯定坚决反对男女分班的作法。,200306680519250010,马来西亚,2,200306,我对男女分班的看法,85,75,85,79,96,412,A,
③这也是天下父母最劳心的问题——学生早恋。,200306680519150022,马来西亚,1,200306,我对男女分班的看法,80,80,87,87,94,420,B,
绿色食品中无任何化肥和农药，吃了有利于身体健康。,200307271523200076,韩国,2,200307,绿色食品与饥饿,75,75,75,62,79,356,B,
因为“绿[C]色食品”是对身体好的{CJsd}。,200307271523100088,韩国,1,200307,绿色食品与饥饿,65,65,43,19,41,217,未参加,
从现代社会角度来看，吸烟的问题越来越严重{CC2大}。,200405109523200369,韩国,2,200405,吸烟对个人健康和公众利益的影响,60,70,59,41,48,263,未参加,
最近抽烟的人越来越多。,200405109523200379,韩国,2,200405,吸烟对个人健康和公众利益的影响,65,65,59,58,48,279,未参加,
在公共场所边走边抽烟的人将被罚款，[BC。]这[C]也是一个措施。,200405109523100604,韩国,1,200405,吸烟对个人健康和公众利益的影响,70,65,50,50,39,260,未参加,
，因一个人牺[C]牲多数人。,200405109523200598,韩国,2,200405,吸烟对个人健康和公众利益的影响,80,70,64,66,64,334,C,
实际上，关于吸烟与健康的争论{CC论争}是屡见不鲜的。,200405109523200668,韩国,2,200405,吸烟对个人健康和公众利益的影响,80,70,71,66,61,338,C,
但{CJ-zhuy我们}{CJ-zy不能}为了自己的权力，{CJ+zy不能}不管公众利益{CD的}。,200405109523200673,韩国,2,200405,吸烟对个人健康和公众利益的影响,80,65,55,62,55,305,C,
如今大街上的垃[B拉]圾80％以上是烟民扔掉的香烟。,200405109523200690,韩国,2,200405,吸烟对个人健康和公众利益的影响,70,65,59,50,48,278,未参加,
其次，吸烟对公众利益有着影响。,200405109523200694,韩国,2,200405,吸烟对个人健康和公众利益的影响,70,65,57,56,50,284,C,
据称，市政府出台该措施是为了保持市容整洁，并帮助青少年{CJ-sy养成}良好的习惯{CD了}。,200405109523100827,韩国,1,200405,吸烟对个人健康和公众利益的影响,70,65,55,29,55,260,未参加,
吸烟不仅有这个问题，还存在一个问题就是影响不吸烟的人。,200405109523100986,韩国,1,200405,吸烟对个人健康和公众利益的影响,50,60,31,46,44,211,未参加,
总之，如果想自己{CD的}健康，就[C]戒烟{CJX}最好，我们有权利享受自己的爱好，可是为别人着想这是做人的义务。,200405109523201022,韩国,2,200405,吸烟对个人健康和公众利益的影响,70,65,67,68,64,320,C,
而且教育青少年[C]的时候，应该{CJX}家长或者老师们做他们的榜[B傍]样。,200405109523201167,韩国,2,200405,吸烟对个人健康和公众利益的影响,70,65,48,50,57,276,未参加,
另外，公众利益方面的影响也有。,200405109525101279,日本,1,200405,吸烟对个人健康和公众利益的影响,60,65,40,56,50,254,未参加,
所以烟草{CC烟[F煙]}公司很容易破产。,200405109525101279,日本,1,200405,吸烟对个人健康和公众利益的影响,60,65,40,56,50,254,未参加,
所以，[BC、]虽然没有什么根据，但我反对抽烟。,200405109525101345,日本,1,200405,吸烟对个人健康和公众利益的影响,65,60,55,68,57,288,未参加,
而{CD如果}这个时期{CD多}抽烟的年轻人不如{CC2比不上}不抽烟的年轻人动脑{CJ-sy动}得更快。{CP这是由于烟里面含着不好的成分，它很快就影响到年轻人的头脑功能{CC技能},200405109523201397,韩国,2,200405,吸烟对个人健康和公众利益的影响,60,65,38,39,57,242,未参加,
首先，吸烟不利于个人的健康。[BC.],200405109523201401,韩国,2,200405,吸烟对个人健康和公众利益的影响,65,60,64,75,73,320,C,
我们韩国{CJ+sy根据}某市政府出台的一项规定，青少年没有过20岁不能买[B卖]烟，买[B卖]时[BD，]要给老板[B伴]看身[C]份证。,200405109523201430,韩国,2,200405,吸烟对个人健康和公众利益的影响,75,70,62,54,64,314,C,
吸烟者越多税款越多，可是对一般老百姓[B性]的健[C]康[C]没有好处。,200405109523101466,韩国,1,200405,吸烟对个人健康和公众利益的影响,75,65,57,52,53,289,未参加,
全世界早已有了戒烟的潮流，而最近，中国也加入{CC列入}了其队伍。,200405109523201475,韩国,2,200405,吸烟对个人健康和公众利益的影响,85,90,59,83,91,404,B,
公共场所[C]不只是为了吸烟者存在{CC2有}的，而是为了所[C]有的人存在{CC2有}的。,200405109525201493,日本,2,200405,吸烟对个人健康和公众利益的影响,70,65,55,64,59,299,C,
而且，在公共场所{CD里}禁止吸烟的原因也是这个{CJ+dy道理}。,200405109523201559,韩国,2,200405,吸烟对个人健康和公众利益的影响,70,65,57,77,66,321,C,
对这些人还需要比较严厉的措施。,200405109525201573,日本,2,200405,吸烟对个人健康和公众利益的影响,70,75,69,66,70,339,C,
我跟他说{WWJ},200405109525201659,日本,2,200405,吸烟对个人健康和公众利益的影响,65,55,59,41,44,246,未参加,
其实不吸烟者比吸烟者得癌[C]的机率{CC2率}高。,200405109525101718,日本,1,200405,吸烟对个人健康和公众利益的影响,65,65,62,46,57,279,未参加,
特别是人口密集的地方应该{CJ+zy要}开始实施这规定。,200405109525201761,日本,2,200405,吸烟对个人健康和公众利益的影响,65,60,52,54,57,271,未参加,
现在{CJ-zy可以}抽烟的地方越来越少了。,200405109523201796,韩国,2,200405,吸烟对个人健康和公众利益的影响,65,70,26,35,28,210,未参加,
现在客人很少来，店的生意{CC兴隆[C]}也很不好。[BC，],200405109525101806,日本,1,200405,吸烟对个人健康和公众利益的影响,75,65,52,41,50,270,未参加,
最近，有需多报刊、[BC，]杂志谈论关于吸烟危害的消息。,200405109525201805,日本,2,200405,吸烟对个人健康和公众利益的影响,80,80,64,66,91,373,B,
我自己有脊椎病，周围的人抽烟[F煙]，空气不好的话{CJ-zhuy我}就头晕[C]、呕吐。,200405109525201847,日本,2,200405,吸烟对个人健康和公众利益的影响,85,65,67,58,75,339,C,
吸烟对身体有害，这一点我想大家都知道。[BC，],200405109525201874,日本,2,200405,吸烟对个人健康和公众利益的影响,75,90,50,56,64,329,C,
我也认为抽烟是一种不良的习惯。,200405109525101885,日本,1,200405,吸烟对个人健康和公众利益的影响,85,90,64,64,53,352,C,
众所周知[C]，吸烟影响人的身体。,200405109523200829,韩国,2,200405,吸烟对个人健康和公众利益的影响,75,70,54,60,70,318,C,
因为在人口密集的地方成千上万的人常常扔[C]烟头，所以，政府机关终于采取了这样的{CC3这等}措施。,200405109525101145,日本,1,200405,吸烟对个人健康和公众利益的影响,70,75,58,48,68,308,C,
如今，在公共场所[C]，允许抽烟的地方越来越少了。,200405109523201162,韩国,2,200405,吸烟对个人健康和公众利益的影响,65,50,32,64,54,246,未参加,
这样一来，许多政府应该让老[C]百姓[B性]有不吸烟的观念{CC概念}，还有不允许在公共场所抽烟。,200405109525100142,日本,1,200405,吸烟对个人健康和公众利益的影响,70,65,46,62,75,304,C,
危险[C]的程度[BD，]{CJX}在旁边{CD被}吸别人的烟的人比自己吸烟的人厉害得[C]多，[BC。]而且吸烟者把吸完的垃[B拉]圾[B及]随[C]便[B边]扔{CC放}在地上，所[C]以在{CJ-sy有}吸烟者的地方，太脏了。{CJ-zhuy吸烟},200405109525200226,日本,2,200405,吸烟对个人健康和公众利益的影响,45,65,44,70,55,259,未参加,
目前，世界各国和大城[B成]市都规定在公共场所不允许抽烟。,200405109523100361,韩国,1,200405,吸烟对个人健康和公众利益的影响,50,65,69,66,57,288,未参加,
我希望[C]以后不会发生这样的情况。[BC.],200405109525100366,日本,1,200405,吸烟对个人健康和公众利益的影响,45,70,46,73,65,281,未参加,
在青少年的大脑{CC脑}里会有这种思想，都是因为大人们给他们的不良{CD好}的影响。,200405109523200826,韩国,2,200405,吸烟对个人健康和公众利益的影响,65,85,54,39,43,276,未参加,
第[C]三要[C]用{CC提[C]供[C]}比较[C]合理、[BC，]比较[C]现实的[C]事实告诉大家[C]，提[C]醒[C]大家[C]，这[C]也是非常重[C]要的[C]工作，因为[C]政府要考虑到烟厂与公众之[C]间[C]的[C]关系[C]。[BC，],200405109523200938,韩国,2,200405,吸烟对个人健康和公众利益的影响,80,70,57,52,65,314,未参加,
有的大人{CC2大成人}也有责任{CC负责}。,200405204525100257,日本,1,200405,吸烟对个人健康和公众利益的影响,65,65,41,30,49,234,未参加,
现在抽烟对身体会有什么样的影响，生活在现代社会的人们之[C]间已形成{CC2成}了一个共识，如不仅对肺[C]不好[BQ，]而且对血管有害{CD的}等。,200405204525100273,日本,1,200405,吸烟对个人健康和公众利益的影响,65,75,52,65,76,320,C,
虽然我从来不吸烟，但我反对过多地限制吸烟的措施。,200405204525100328,日本,1,200405,吸烟对个人健康和公众利益的影响,85,70,77,73,67,363,B,
关于个人健康，我对抽烟者{CC3自己抽烟的人}的健康无所谓，因为他们是按照自己的意愿抽烟的。,200405204525100341,日本,1,200405,吸烟对个人健康和公众利益的影响,75,85,63,77,76,369,B,
因为即使我们看到有人在公共场所吸烟，如果没有法律规定禁止此类行为的话，我们每个人自己去提醒这个吸烟的人也没用的{CJsd}，他不一定听别人{CC人家}的话，甚至会有可能生气。,200405204525200345,日本,2,200405,吸烟对个人健康和公众利益的影响,75,75,77,63,76,356,B,
如果不抽烟的话{CJ-dy他们}身体上{CJ-zy会}出现毛病。,200405204525200348,日本,2,200405,吸烟对个人健康和公众利益的影响,60,65,44,28,42,222,未参加,
我想这跟父母们的教育有关。[BC、],200405204525100350,日本,1,200405,吸烟对个人健康和公众利益的影响,65,80,58,56,38,285,未参加,
听到这消息，我觉得很{CC太}难过。,200405204525100433,日本,1,200405,吸烟对个人健康和公众利益的影响,70,90,68,65,79,365,C,
{CQ跟}喝咖啡、喝酒、吃蛋糕[C]等{CQ一样}，吸烟[B咽]也是爱好{CC嗜[C]好}的一种，但[BD，]在这些{CC这样}爱好{CC嗜[C]好}当中好像只有吸烟[B咽]往往让提出话题{CJjy}。,200405204525200465,日本,2,200405,吸烟对个人健康和公众利益的影响,60,70,47,28,40,230,未参加,
我们应该告诉现在的青少年吸烟{CJ+sy是}对身体健康不好，所以最好不要吸烟。,200405205525200009,日本,2,200405,吸烟对个人健康和公众利益的影响,60,80,49,63,63,302,未参加,
众所周知，[BC、]如今死亡的平均每年都增[B曾]加。,200405332540100009,印度尼西亚,1,200405,吸烟对个人健康和公众利益的影响,60,60,22,37,51,212,未参加,
的确，吸烟对身体是非常有害的，它直接影响人的肺、胆等呼吸方面，如果孕妇吸烟，它还对小孩不好，所以我们不应该吸烟。,200405684542200001,越南,2,200405,吸烟对个人健康和公众利益的影响,65,90,38,37,51,272,未参加,
虽然他们相处只一年多的时间，可是由于彼此间有着共同的人生目标与理想，尽管两人性格大相径庭，可是却过着美满的婚姻生活。,200410534533250009,新加坡,2,200410,最理想的结交方式,90,85,88,72,94,426,A,
有的是通过亲戚朋友的介绍；有的是儿时的玩伴；或者是一见[F見]钟情……在这[F這]五花八[B入]门的社会里，每一天所接触的人都不一样，再说人有千百种，各自来自不一样的生长环境，人的心更善变。,200410534519250021,马来西亚,2,200410,最理想的结交方式,65,70,71,72,77,341,C,
对我而言，有缘千里来相会已经是缘[B绝]分。,200410534533250022,新加坡,2,200410,最理想的结交方式,60,70,63,33,58,269,未参加,
在工作场合结识的好处不胜枚举。,200410534533150053,新加坡,1,200410,最理想的结交方式,80,90,66,65,96,392,C,
经过长时间了解对方的家庭背景、受教育程度{CC5教育}、为人处世{CC处事方面}和宗教信仰，那你就能正确地{CC的}断定对方是否是你的理想伴侣。,200410534533250059,新加坡,2,200410,最理想的结交方式,75,85,71,60,75,359,B,
朋友中有人是通过亲戚介绍而结识另一半的。,200410534533150115,新加坡,1,200410,最理想的结交方式,95,90,77,83,96,440,A,
由于每个人的出身、性格、际遇都不同，因此相识结交异性的方式也不尽相同。,200410534533250118,新加坡,2,200410,最理想的结交方式,95,90,80,83,94,441,A,
没有。[BC，],200404140540200074,印度尼西亚,2,200404,运动员收入,70,75,52,63,55,304,C,
反过来那些运动员不象一般的商人。,200404140529100247,泰国,1,200404,运动员收入,60,60,39,38,41,220,未参加,
我们不应评价他们对不对，我们应当尊重他们。,200404140919200281,加拿大,2,200404,运动员收入,80,85,70,71,78,378,B,
