错句,作文编码,国籍,性别,考试时间,作文题目,口试分数,作文分数,听力分数,阅读分数,综合分数,总分,证书
在家里休养差不多一年之久。,200110540540150009,印度尼西亚,1,200110,我的童年,65,85,30,44,65,279,未参加,
当时由[B尤]于住在自家的园地里，因此从小就非常好动。,200103680519101601,马来西亚,1,200103,我的童年,75,80,61,72,85,364,B,
随着年龄的增长我们已渐渐长大，刚好在我七岁那年，我家附近的米店{CJ-sy发生}火灾。[BC，],200103680519101603,马来西亚,1,200103,我的童年,80,80,75,72,85,384,B,
年幼的我便被这群所谓“顽皮”的猴子吓[F嚇]得直嚷要妈妈。,200103680519201614,马来西亚,2,200103,我的童年,85,85,91,75,85,416,A,
你应该{CD要}多注意你[D们]的身体，要多吃一些含维他命的食品。,200104124520200378,蒙古国,2,200104,一封写给父母的信,70,85,58,49,54,308,C,
你们两位知道我多么感激{CC感谢}在这个家庭出生{CJX}吗？,200105550523150007,韩国,1,200105,一封写给父母的信,75,80,74,56,72,348,B,
两国之间，虽然节日的名称不同，可是节日的意义[B议]也许是相同的，都是向父母表达感谢之意的日子。,200105550523250004,韩国,2,200105,一封写给父母的信,80,75,85,54,74,359,B,
可是不要担[B怛]心，你们也知道我从来没有生过病吧{CC吗}！,200105550523150034,韩国,1,200105,一封写给父母的信,65,75,52,37,56,272,未参加,
我在这里生活的时间已经过了半年多。,200105550523150330,韩国,1,200105,一封写给父母的信,70,75,47,39,42,262,未参加,
您在那封信里面写的内容露出了您对我的深深的爱{CC1爱情}。,200105550523250325,韩国,2,200105,一封写给父母的信,75,80,63,65,74,348,C,
妈妈，您往往埋怨我说，别的家庭妈妈和女儿的关系多么亲密，却{CJX}我对您一直保留着距离。,200105550523250325,韩国,2,200105,一封写给父母的信,75,80,63,65,74,348,C,
好久没跟他打电话。,200105550523150462,韩国,1,200105,一封写给父母的信,65,65,47,37,61,259,未参加,
请你愿谅吧。,200105550523250353,韩国,2,200105,一封写给父母的信,65,70,38,44,56,259,未参加,
你们还没发布呢”当时只想不让妈妈失望{CQ才}这么说，可现在觉得这样说是更让妈妈失望的，对吧？,200105550523250355,韩国,2,200105,一封写给父母的信,70,75,74,47,49,304,C,
父母对孩子的心情如何，我可能不能完完全全地理解。,200105550523250469,韩国,2,200105,一封写给父母的信,65,70,49,70,63,303,C,
我爱你们。,200105550523250469,韩国,2,200105,一封写给父母的信,65,70,49,70,63,303,C,
我感觉非常不好，所以刚坐火车的时候不愿意跟旁边的中国人说话。,200105224525200008,日本,2,200105,我的一个假期,70,75,77,79,83,373,B,
我感觉到非常有意思。,200105209525100055,日本,1,200105,我的一个假期,65,70,34,63,57,275,未参加,
我思考了，我们日本人也应该多穿我们的民族服饰{CC2服}。,200105209525200010,日本,2,200105,我的一个假期,80,75,82,72,90,390,B,
当时，我是才刚{CC到}十岁的小学生。,200105215525100002,日本,1,200105,我的一个假期,65,65,67,70,74,325,C,
人们都是这样：[BC。]别人在的时候想要靠别人，觉得别人对他服务是应该的。,200105109525100496,日本,1,200105,由“三个和尚没水喝”想到的……,70,70,57,62,53,300,C,
有时候我有问题，那么同学就会给我解释我的问题；有时候其他人有问题，那么我们就会给他解释他的问题，有时候我们都不懂，那么我们就会一起考虑问题。,200105109525200502,日本,2,200105,由“三个和尚没水喝”想到的……,65,80,66,80,84,363,C,
第一个和尚说：[BC，]“我们选择两个人去{CC就}抬水喝吧。,200105109525200782,日本,2,200105,由“三个和尚没水喝”想到的……,75,70,70,69,59,332,C,
有了积[F積]蓄[B畜]后[F後]，万[F萬]一丈夫拋弃[F棄]也不用怕了{CJbei}，可以找一份新的工作，在社会[F會]上创[F創]一番事业[F業]，或再另嫁也可以呀！,200106570922250001,美国,2,200106,如何看待“妻子回家”,70,85,66,65,70,348,C,
通常遇到麻烦的时候才知道没水喝的痛苦，所以我们[F們]检[F檢]讨一下自己的过错[F錯]时会发[F發]现[F現]这[F這]种[F種]情况{CD的}。,200102522522150023,缅甸,1,200102,由“三个和尚没水喝”想到的……,85,65,74,62,77,352,C,
我有困难的时[F時]候，她一定帮[L]助我。,200203522522250011,缅甸,2,200203,记对我影响最大的一个人,65,55,28,44,44,218,未参加,
相信这是我们这一代人没法体会的。,200203533533250001,新加坡,2,200203,记对我影响最大的一个人,85,85,71,70,91,397,B,
在{CJX}荷兰前几年把安乐死法制定成法律。,200205204525100005,日本,1,200205,如何看待“安乐死”,65,60,52,49,61,270,未参加,
因为在{CC对}这个问题上宗教的因素{CJ-sy影响}非常大。,200205204525100168,日本,1,200205,如何看待“安乐死”,75,85,60,65,70,348,C,
虽然他做的事情是“杀人”的行为，但是谁会责怪他呢？,200205212525200015,日本,2,200205,如何看待“安乐死”,65,80,33,72,58,296,未参加,
以前，关于人类的生死问题，大多数人认为听天由命。,200205224525200003,日本,2,200205,如何看待“安乐死”,85,80,83,67,94,402,B,
谁也不想过总是{CJX}身体上有痛苦的日子。,200205224525200041,日本,2,200205,如何看待“安乐死”,70,70,46,49,46,269,未参加,
在这一点的基础上，为了进行安乐死，我们还要确认以下两点：一、病人所得的病没有恢复的可能性。,200205209525200029,日本,2,200205,如何看待“安乐死”,80,85,88,76,89,412,B,
如果我也患了绝症的话肯定我也选择安乐死之路。,200205201525200062,日本,2,200205,如何看待“安乐死”,70,85,55,51,70,323,未参加,
因为人们怎么也脱不了生和死的束缚。,200205201525200094,日本,2,200205,如何看待“安乐死”,75,70,52,70,54,310,C,
人{CD间}不是一个机器，而且有感情。,200205201525200147,日本,2,200205,如何看待“安乐死”,80,80,55,56,44,307,C,
遗憾的是，在现代的社会里，“安乐死”已经变成了一种流行的行为，这当然是十分可恶的。,200205215635100009,俄罗斯,1,200205,如何看待“安乐死”,80,85,69,63,75,366,C,
因此，每一个社会应该具有{CC衍变}不同的，和其他许多社会因素相应的答案。,200205215616100028,德国,1,200205,如何看待“安乐死”,75,70,46,56,65,301,C,
现[F現]在，我有空就和家人谈[F談]天，一起外出{CC出外}，以便更了解他们[F們]。,200210602801250021,澳大利亚,2,200210,如何解决“代沟”问题,75,75,62,71,66,339,C,
现今的人比以前更自由，例如父母不会再为子女挑选[F選]丈夫和妻子了。,200210602801250022,澳大利亚,2,200210,如何解决“代沟”问题,70,70,73,76,82,359,C,
我认为要解决代沟问题，主要应先了解一下是由{CC在}什么问题{CD之下}{CD而}造成的代沟。,200210540540250014,印度尼西亚,2,200210,如何解决“代沟”问题,70,70,65,58,79,330,C,
了解{CC知悉}了以上的原因，[BC。]我认为解决“代沟”最好的办法是：经常和孩子们坦诚、亲切的交谈，细心聆听他们心底真正的声音，鼓励他们发表自己的意见，对的加以鼓励，不对的用耐心的态度{CD加以}劝告、指正，不要用权威、高压的手段，那样做只会把事情引向极端和不可收拾。,200210540540250025,印度尼西亚,2,200210,如何解决“代沟”问题,80,80,73,78,86,389,B,
第三个原因，[D已]经济发展，生活方式也已不一样。[BC，],200210540540150072,印度尼西亚,1,200210,如何解决“代沟”问题,60,70,48,69,44,276,未参加,
应该给他们一定的自由与选择，让他们发挥他们自己的才[B材]能与兴趣，不要{CC2勿}压制他们。,200210540540150125,印度尼西亚,1,200210,如何解决“代沟”问题,75,70,56,40,70,300,未参加,
我父亲担心我到北京一{CQ个}人会遇到许多困难[BQ，]所以临走之前他教我：[BC，]如果遇到不如意{CC如心}的事或心情不好{CQ的}事，你就轻轻地唱起歌。,200205109529200401,泰国,2,200205,如何面对挫折,85,60,67,60,70,330,C,
我{CD会}从转[B传]学的那件事{CQ中}想到{CC2想}[BQ，]我现在的专[B传]业对我最合适不过了。,200205109540200580,印度尼西亚,2,200205,如何面对挫折,75,70,78,71,59,342,B,
我想起了我请来的“感恩”这讲座主讲人心理辅导学硕士莉真所说的话：“生日其实是两个生命在生与死间挣扎的胜利，值得感恩的是我们的母亲还把我们生下了……”我教校内二百多名同学制卡片给父母{CD的当儿}，{CQ却}{CJ+zhuy我}没空给{CJ+by我爸妈}你们制一张精美的卡片，于是，我写了这封信。,200205680519250007,马来西亚,2,200205,一封写给父母的信,75,75,70,79,90,379,B,
所幸的是，在师兄弟的通力合作下，才能杀死白骨精。,200305533533250046,新加坡,2,200305,我最喜欢读的一本书,70,70,38,70,88,324,未参加,
为什么我觉得危险呢？{CJ-zhuy那},200304131525100141,日本,1,200304,我学汉语是为了……,65,70,44,38,57,260,未参加,
所以，你趁你{CD这么}年轻就开始学习汉语，一定会有利于{CC3帮助}你的将来。[BC，],200304131525200138,日本,2,200304,我学汉语是为了……,65,75,30,35,49,241,未参加,
我很高兴，来到中国亲眼{CJX}可以看到真正的中国。,200304131525200154,日本,2,200304,我学汉语是为了……,65,65,74,68,77,333,C,
我当然不敢，因为不能预见情况的变化。,200305576525100023,日本,1,200305,静音环境对人体的危害,70,60,36,30,66,247,未参加,
我们平时无法知道自己的身体里在发生什么事，万一我们都能知道这些，可能会很害怕，因为一有变化我们就要担心是否生了什么病。,200305576525200030,日本,2,200305,静音环境对人体的危害,70,70,71,68,77,344,C,
因为我现在晚上睡觉的时候，如果不放音乐我就睡不着觉了。,200305576525200049,日本,2,200305,静音环境对人体的危害,70,65,59,74,63,317,C,
为了我们的下一代，为了全体的生活，我们要从现在开始练习养成不抽烟的良好习惯{CD吧}！,200405109542100870,越南,1,200405,吸烟对个人健康和公众利益的影响,85,85,40,48,61,314,未参加,
实行该措施[L]不仅仅是对人的身体健有好处，而对环境的保护也有作用，{CJ-zhuy它}不污染环境，又整洁。,200405109529100879,泰国,1,200405,吸烟对个人健康和公众利益的影响,65,80,67,48,72,320,C,
香烟和香蕉到底有何不同？,200405209922100095,美国,1,200405,吸烟对个人健康和公众利益的影响,60,65,79,65,76,328,C,
近年来随着人文教育的普及、人们的{CQ受}教育水平{CC水准}遂渐提高，再加上与外界的接触，[BC、]人们的文化水平相对来说比以前进步了许多。,200405576533200005,新加坡,2,200405,吸烟对个人健康和公众利益的影响,75,70,85,63,82,364,C,
希望{CC望}政府有更多的有效措施出台。,200405610616150005,德国,1,200405,吸烟对个人健康和公众利益的影响,85,95,74,77,88,415,B,
可是，我母亲很努力地工作{CJ+buy下来}。,200505109525200179,日本,2,200505,父母是孩子的第一任老师,75,75,62,63,79,344,C,
因为孩子还没有各种各样的能力，所以需要父母[C]的帮助。,200505109525100248,日本,1,200505,父母是孩子的第一任老师,55,65,53,59,64,278,未参加,
为什么我这样想呢？,200505109525200304,日本,2,200505,父母是孩子的第一任老师,65,75,58,54,74,313,C,
我觉得父母是孩子的第一任老师，他们对孩子的影响最深，而且孩子长大以后也有一定的影响。,200505109525100447,日本,1,200505,父母是孩子的第一任老师,75,80,58,54,71,329,C,
我也同意这个说法。,200505109525200577,日本,2,200505,父母是孩子的第一任老师,60,45,71,63,69,286,未参加,
回来以[B一]后，他对我一句话也不说，直着看我的眼睛，只是哭了。,200505109525101108,日本,1,200505,父母是孩子的第一任老师,90,80,62,64,64,355,C,
这些人一般没[C]受过父爱[F愛]和母爱[F愛]，[BC。]他根本就理解不了别人的心[C]。,200505217525100086,日本,1,200505,父母是孩子的第一任老师,55,65,80,53,63,298,未参加,
据世界上不少的儿童教育家说:[BC；]从出生时到三岁的三年间[F間]的教育对一个孩子的性格最有影响。,200505217525200085,日本,2,200505,父母是孩子的第一任老师,70,85,56,71,69,343,C,
用什么样的说法、用什么样的词语对后来的在社会中的交流也会用影响{CJy}。,200505217525100184,日本,1,200505,父母是孩子的第一任老师,70,80,52,65,78,335,C,
父母的兴趣爱好，思想观念，行为举止，无一不是从幼年就开始在孩子心目中打下深深的烙印。,200505204525100178,日本,1,200505,父母是孩子的第一任老师,60,70,39,57,52,263,未参加,
我觉得这样绝对[C]不行。,200505204525100457,日本,1,200505,父母是孩子的第一任老师,50,65,29,39,47,211,未参加,
我的父亲是一位白领，我从小到现在他一直很忙，我和他在一起的时间不多。,200505204525200501,日本,2,200505,父母是孩子的第一任老师,75,90,67,61,78,365,C,
我个人的看法[C]是父母[C]无[C]意中影响孩子的性格、[BC，]生活方[C]式。,200505204525200503,日本,2,200505,父母是孩子的第一任老师,60,75,58,73,74,326,C,
每一个{CJ-zxy人}有小时候从父母{CQ那儿}学到的东西。,200505204525100533,日本,1,200505,父母是孩子的第一任老师,65,65,56,47,63,280,未参加,
不可能的。,200505204525200539,日本,2,200505,父母是孩子的第一任老师,80,90,65,83,91,404,B,
离开泰国后{CJ-zhuy我们}去了越南，先去{CQ了}中部，然后游览{CC访问}{CQ了}河内等地{CC1各地}。,200105205525200009,日本,2,200105,我的一个假期,65,60,75,58,74,315,C,
她{CD是}跟我同岁，不过{CQ从}毕业{CJX}短期大学之后，已经工作了四年，[BC。]现在，完全是社会人了。,200105205525200071,日本,2,200105,我的一个假期,65,65,72,54,52,292,C,
他们不但给我们{CJX}教泰国话，而且招待我们到他们的家里吃饭，[BC。]真让我感动极了。{CQ在},200105205525200080,日本,2,200105,我的一个假期,75,90,77,72,66,374,B,
每个人在一生中会碰到{CJX}多多少少{CD的}挫折。,200112576525200019,日本,2,200112,如何面对挫折,75,80,65,77,72,360,B,
但[BD，]随着时间的推[B堆]移，我了解了{CC到}中国的情况而且{CC2和}学会了旅游的时候经常用的词汇以后，再也没有发生这种情况了。,200105271525100031,日本,1,200105,我的一个假期,70,80,67,68,68,343,C,
因为上课的时候大部分的老师讲的内容{CJ-zhuy我}听不明白，我自己也不会用汉语回答{CJ-by问题}。,200105217525200052,日本,2,200105,我的一个假期,65,70,47,51,57,276,未参加,
现在住在我家的人就是母亲，祖父母这三个人。,200105217525200072,日本,2,200105,我的一个假期,65,60,67,56,41,272,未参加,
怎样过有限的假期，我认为这就是平时生活的能源，[BC。]幸福人生的真谛。,200105204525200033,日本,2,200105,我的一个假期,70,80,82,72,76,370,B,
到了晚上我一个人在房间里上网，[BC、]上{CD了}两[BD、]三个小时。[BC，],200105204525100047,日本,1,200105,我的一个假期,65,65,32,39,50,235,未参加,
我买了到西安的火车票，[BC。]因为我买不到我需要的火车票。,200105204525200082,日本,2,200105,我的一个假期,65,65,57,35,55,261,未参加,
但时间长了，{CJ-zhuy我}和职员聊天、[BC，]吃饭，很融洽。,200105204525200096,日本,2,200105,我的一个假期,80,80,67,79,70,368,B,
只想您的身体，好吗？,200105550523250070,韩国,2,200105,一封写给父母的信,65,70,27,28,40,216,未参加,
他们显得老。,200105550523250079,韩国,2,200105,一封写给父母的信,75,80,63,65,72,346,C,
在汗[B韩]城也{CJX}很多人买花了，我看那个然后感觉不好，可是现在我给{CC向}父母写信。,200105550523250094,韩国,2,200105,一封写给父母的信,70,65,49,39,45,254,未参加,
现在学校安[B按]排的课比较多。,200105550523250102,韩国,2,200105,一封写给父母的信,65,65,66,37,49,266,未参加,
爸爸的工作也顺利吧！,200105550523150109,韩国,1,200105,一封写给父母的信,65,65,60,44,61,279,未参加,
首先我想对你们说谢谢。,200105550523250124,韩国,2,200105,一封写给父母的信,70,80,58,51,54,303,C,
你们不用担心。,200105550523250137,韩国,2,200105,一封写给父母的信,70,75,49,70,49,302,C,
他们很有关心{CD于}我要学习的方面{CJy}。,200105550523150235,韩国,1,200105,一封写给父母的信,65,70,41,54,70,286,未参加,
妈说{CC写}虽然最近有很多困难，但是有我和妹妹你们{CQ就}幸福。,200105550523250271,韩国,2,200105,一封写给父母的信,65,65,68,42,58,282,C,
回到家连洗澡都不能洗。,200105550523150304,韩国,1,200105,一封写给父母的信,70,70,66,51,56,301,C,
我有信心。,200105550523150304,韩国,1,200105,一封写给父母的信,70,70,66,51,56,301,C,
妈妈为我一个人早晨起得那么早。,200105550523150319,韩国,1,200105,一封写给父母的信,65,55,63,63,81,309,C,
不过，有时您确实让我感到你是过分{CC2过}管我{CJs}。,200105550523150319,韩国,1,200105,一封写给父母的信,65,55,63,63,81,309,C,
女儿过得很好。,200105550523250385,韩国,2,200105,一封写给父母的信,75,70,52,56,70,312,C,
我是家里的老小{CC少}，××。,200105550523250392,韩国,2,200105,一封写给父母的信,70,65,52,49,65,287,未参加,
你听到我考上{CC及格}忠前南大学的消息，激动地掉下眼泪，我都知道。,200105550523250430,韩国,2,200105,一封写给父母的信,70,65,66,39,65,291,未参加,
不过，我从今天开始，要努力好好听你们的话，认真学习。,200105550523250456,韩国,2,200105,一封写给父母的信,70,70,58,35,40,261,未参加,
而且爸爸很喜欢[F歡]学习[F習]，我一直看着[F著]爸爸学习[F習]，您是我的最佳老师[F師]呢！,200105550523250477,韩国,2,200105,一封写给父母的信,70,75,52,61,74,321,C,
爹、娘[BQ，]最近{CJ-sy过}得如何？,200105550523250487,韩国,2,200105,一封写给父母的信,70,65,38,47,45,251,未参加,
一个月左右{CJX}父[B夫]亲彷徨地{CC着}流落他乡。,200105550523250503,韩国,2,200105,一封写给父母的信,70,65,38,61,63,283,未参加,
写到{CJX}就这儿。,200105550523250513,韩国,2,200105,一封写给父母的信,70,80,47,49,63,299,未参加,
总的来说，您不要担心我。,200105550523250514,韩国,2,200105,一封写给父母的信,65,70,55,68,67,311,C,
因为发生经济危机[BQ，]爸爸的公司情况不好，可是还是{CJX}爸爸[BD、]妈妈让我到中国去留[L]学。,200105550523250523,韩国,2,200105,一封写给父母的信,70,70,38,49,47,262,未参加,
目前，我们有很多问题。,200105109525200006,日本,2,200105,由“三个和尚没水喝”想到的……,70,85,54,44,50,295,未参加,
于是两个和尚，他们商量：一个人去抬两个人的水，这样比较辛苦，所以两个人一起去抬水喝。,200105109525100175,日本,1,200105,由“三个和尚没水喝”想到的……,65,60,27,51,41,227,未参加,
那个时候{CD的}我们的心里有希望别人当班长的{CJ-zxy想法}。,200105109525100207,日本,1,200105,由“三个和尚没水喝”想到的……,60,65,45,64,61,278,未参加,
我们人都有欲望。,200105109525200365,日本,2,200105,由“三个和尚没水喝”想到的……,65,75,79,49,70,325,C,
”他们帮我很多。,200105109525200370,日本,2,200105,由“三个和尚没水喝”想到的……,60,65,45,40,53,246,未参加,
过了不久，又来了第三个和尚，是一个老和尚。,200105109529200371,泰国,2,200105,由“三个和尚没水喝”想到的……,85,75,63,58,70,343,C,
于是，他每次留{CC出}的作业，我只好第二天早上去抄别人的。,200105109525200427,日本,2,200105,由“三个和尚没水喝”想到的……,85,70,82,66,75,369,B,
过一会儿，一个老人到庙{CQ里}来了，看见了三个和尚读经。,200105109525200450,日本,2,200105,由“三个和尚没水喝”想到的……,70,65,61,69,73,324,C,
我是当妈妈的。,200105109525200522,日本,2,200105,由“三个和尚没水喝”想到的……,60,65,66,73,77,324,C,
由于人类的惰性{CC懒性}，大家宁可靠别的人{CD的}工作，也不自己干活。,200105109922100618,美国,1,200105,由“三个和尚没水喝”想到的……,65,70,61,51,68,301,C,
他来到庙里就喝光了庙里的水。,200105109525200652,日本,2,200105,由“三个和尚没水喝”想到的……,65,60,57,64,59,288,未参加,
没有时间，你做吧！,200105109525100703,日本,1,200105,由“三个和尚没水喝”想到的……,70,70,63,69,70,330,C,
接着原来在庙里住的和尚说，以前他一个人{CJX}一直山下抬水{CJld}，如果从现在起去的话，太不公平，所以这个办法不能采用。,200105109525200702,日本,2,200105,由“三个和尚没水喝”想到的……,65,65,39,58,66,277,未参加,
在这个文章里面有三个和尚。,200105109525200764,日本,2,200105,由“三个和尚没水喝”想到的……,70,70,57,64,73,322,C,
所以到了末期，请你给我‘[BC“]安乐死’[BC”]。,200205205525200003,日本,2,200205,如何看待“安乐死”,60,65,58,60,49,275,未参加,
然而，日本社会还不承认“安乐死”。,200205205525200003,日本,2,200205,如何看待“安乐死”,60,65,58,60,49,275,未参加,
我觉得这篇文章中的丈夫还是应该受法律的制裁{CJsd}。,200205217525200099,日本,2,200205,如何看待“安乐死”,80,80,52,56,80,340,C,
支持安乐死的人的主张也有些道理。,200205205525100070,日本,1,200205,如何看待“安乐死”,60,70,55,54,68,292,未参加,
纸条上写着他住院时的治疗纪录，[BC。]是他亲笔写的。,200205206525200009,日本,2,200205,如何看待“安乐死”,70,65,49,81,63,314,C,
得了不治之症，想死也不能死实在太残忍{CQ了}。{CJs},200205206525100026,日本,1,200205,如何看待“安乐死”,75,70,69,72,61,336,C,
丈夫没有听妻子的意见，而且即使{CC如果}妻子说不出来也要理解妻子的心情。,200205206525100034,日本,1,200205,如何看待“安乐死”,65,60,27,51,42,228,未参加,
他家里{CD人}不是很有钱的{CJs}，因此他们都付不起{CC了}医疗费了，[BC。]生活又困难，我们同学们一起凑[D起]钱来给他家里人。,200205206525100061,日本,1,200205,如何看待“安乐死”,70,65,49,63,68,301,C,
第一是父母常常跟子女谈话。,200209550523250061,韩国,2,200209,如何解决“代沟”问题,70,75,72,71,62,339,C,
而且{CD我}，我也是不断地努力从{CC以}父亲立场来{CC而}思考{CC2想}。,200209550523250067,韩国,2,200209,如何解决“代沟”问题,60,65,60,49,60,277,未参加,
可以沟通一下父母和子女之间的关系。,200209550523250118,韩国,2,200209,如何解决“代沟”问题,65,65,69,59,78,320,C,
万一你碰到这样的代沟，你必须研[C]究这个原因。,200209550523150150,韩国,1,200209,如何解决“代沟”问题,65,60,48,64,52,272,未参加,
这种两代之间存在的“代沟”问题日益凸现。,200209550523150152,韩国,1,200209,如何解决“代沟”问题,70,80,66,79,80,365,C,
代沟，意思是指两代人之间在行为方式，生活态度以及价值观念等方面存在的差异。,200209550523250194,韩国,2,200209,如何解决“代沟”问题,65,65,66,49,50,279,未参加,
我们不能{CC得}向别人要[C]求跟我们[L]一样的方式，看法。,200209550523150199,韩国,1,200209,如何解决“代沟”问题,65,70,45,52,48,266,未参加,
以前我们一家{CD里}有至少三代人。,200209550523250247,韩国,2,200209,如何解决“代沟”问题,60,60,27,54,34,217,未参加,
在学校、公司里也有长辈晚辈之间的“代沟”问题。,200209550523250288,韩国,2,200209,如何解决“代沟”问题,70,60,63,67,64,309,C,
长辈认为现在的晚辈不像[C]他们以前一样，没有耐心，做什么事都半途[B度]而[B儿]废。,200209550523150306,韩国,1,200209,如何解决“代沟”问题,70,65,75,62,52,310,C,
”那天，我们谈了半天才{CD能}理解{CC了解}双方的心情。,200209550523250356,韩国,2,200209,如何解决“代沟”问题,65,70,60,59,56,296,C,
然而，年轻人则认为“安于本职工作并[B亚]不是不二法门，全力以赴追求别的办法也是好的”[BQ。]专[B传]家们会提出五花八门的秘诀，但在世界上并[B亚]没有万无一失的办法。,200209550523250751,韩国,2,200209,如何解决“代沟”问题,70,65,69,71,76,337,C,
关于代沟的问题只{CJX}不是现代社会的问题。,200209550523250807,韩国,2,200209,如何解决“代沟”问题,65,70,42,54,50,267,未参加,
代沟，意思是指两代人之间在行为方式、生活态度以及价值观念等方面存在的差异。,200209550501250922,中国,2,200209,如何解决“代沟”问题,60,85,63,74,78,349,C,
年轻人也不能理解长辈，他们总觉得长辈很{CC就}土。,200209550523250948,韩国,2,200209,如何解决“代沟”问题,75,65,72,76,70,345,B,
但，现在孩子们呢？,200209550523250981,韩国,2,200209,如何解决“代沟”问题,70,75,63,54,50,301,C,
