错句,作文编码,国籍,性别,考试时间,作文题目,口试分数,作文分数,听力分数,阅读分数,综合分数,总分,证书
每个时代都存在{CJ+dy这样}代沟问题。,200209550523250947,韩国,2,200209,如何解决“代沟”问题,70,65,48,54,58,281,C,
那么孩子为了解决这个问题怎么做呢？,200209550523250953,韩国,2,200209,如何解决“代沟”问题,65,70,57,62,48,288,C,
需要时间、努力。,200209550523150965,韩国,1,200209,如何解决“代沟”问题,65,65,60,62,56,292,C,
从原始时代起，人们为了生育、食物、生活等各方面就已{CD实[F實]行}形成了组群生活。,200304522522250003,缅甸,2,200304,静音环境对人体的危害,65,75,53,80,87,347,C,
今天的人们活在一个高科技、[BC，]高文明的时代里。,200304522522150027,缅甸,1,200304,静音环境对人体的危害,75,85,75,85,93,406,B,
世界上没有任何东西一成不变的{CJsd}。,200307109523100009,韩国,1,200307,绿色食品与饥饿,70,50,75,30,35,243,未参加,
人不是肉体健康就行[BQ，]而是{CQ和}精神健康一起[C]才能说身体健康。,200307109523200021,韩国,2,200307,绿色食品与饥饿,70,75,78,51,81,344,C,
把自己的肚子填那么50%，把别人的肚子填满，那种帮助别人后的快乐足以填满自己的肚子了。,200307109523200034,韩国,2,200307,绿色食品与饥饿,80,65,75,54,79,341,C,
现在有很多慈善家[C]援[Pyuàn]助这[C]些国家。,200307109523100066,韩国,1,200307,绿色食品与饥饿,65,65,70,62,67,313,C,
我认为粮食是为人们[C]而存在的东西。,200307109523200077,韩国,2,200307,绿色食品与饥饿,65,70,64,62,56,303,C,
人类[B娄]为了增加农作物的产量，大家一般使用化肥和农药。[BC.],200307109523200116,韩国,2,200307,绿色食品与饥饿,70,60,54,46,67,282,未参加,
没有食物的人是{CJX}大部分经济实力很差的人。,200307109523100127,韩国,1,200307,绿色食品与饥饿,65,85,72,59,81,352,C,
跟日本相比{CQ的}西洋国家呢？,200307109523200200,韩国,2,200307,绿色食品与饥饿,65,60,80,51,81,320,未参加,
只有地球{CJy}，我们人类才[C]能生存下去。,200307109525100262,日本,1,200307,绿色食品与饥饿,80,85,51,62,79,351,C,
我们别忘{CQ了}这个！[BQ“],200307109523200273,韩国,2,200307,绿色食品与饥饿,60,60,24,54,47,227,未参加,
不过[C]他的主要原因还[C]是在先进[C]的医疗水平卫生条件，[BC.]绿色食品给健康带来的作用是很微弱的。[BC.],200307109523100284,韩国,1,200307,绿色食品与饥饿,65,80,78,70,87,368,B,
虽然，[BC、]农作物里有些有害人体的成份[B分]，[BC、]但是[BD、]也有提高生产量的好处。[BC.],200307109523100321,韩国,1,200307,绿色食品与饥饿,65,70,51,43,67,282,未参加,
从这个角度看，农作物的化学污染是由我们人类间接导致的。,200307109523200364,韩国,2,200307,绿色食品与饥饿,80,90,88,75,93,421,B,
怎样解决这个问[B间]题呢？,200307109523200382,韩国,2,200307,绿色食品与饥饿,60,60,80,59,64,305,未参加,
我们家{CD到}3年前跟一般家庭一样每天吃一般食品。,200307109523200399,韩国,2,200307,绿色食品与饥饿,65,65,78,64,70,326,C,
为了保护自然环境和人们的健康，[BD.]最好别用化肥和农药。,200307109523200457,韩国,2,200307,绿色食品与饥饿,70,65,67,70,76,334,C,
我妈妈也常常买一些绿色食品做菜。[BC.],200307109523200459,韩国,2,200307,绿色食品与饥饿,70,80,56,49,61,306,未参加,
如果这样做的话可以渐渐地靠近完全实现绿色农业的目标。,200307109525200461,日本,2,200307,绿色食品与饥饿,80,95,80,75,93,418,B,
我们比过去生活{CQ得}更便利更丰富。,200307109523200478,韩国,2,200307,绿色食品与饥饿,70,65,56,43,47,267,未参加,
如果[B过]这[C]饥饿的问题可以解决的话，其次解决的是化肥的影响[B向]{CJ-zxy问题}。,200307109523100513,韩国,1,200307,绿色食品与饥饿,65,60,80,72,76,336,C,
我想先[C]进[C]的国家给后进[C]国家的援助是一种办法。,200307109523200525,韩国,2,200307,绿色食品与饥饿,70,60,72,56,76,319,C,
在{CC有}一定的范[B笵]围内用一些{CC有些}化肥和农药是不得以的事。,200307109525100531,日本,1,200307,绿色食品与饥饿,70,60,72,72,76,335,C,
最近人们很喜欢吃绿色食品。,200307109523200536,韩国,2,200307,绿色食品与饥饿,70,60,59,56,70,300,C,
我觉得这[C]样做，人类才{CJ-zy能}得到健康和生存。,200307109525200534,日本,2,200307,绿色食品与饥饿,70,75,62,33,64,293,未参加,
因个人利益以[B一]更好地{CC的}享[C]受{CJ?}比如：为自己的健康吃好的，而别人死不死都不管的态度是不道德、非正义的。,200307109523200544,韩国,2,200307,绿色食品与饥饿,70,60,51,51,76,293,未参加,
这是对{CD因}缺少粮食的人来说[BD，]更不好的事情。,200307109523200561,韩国,2,200307,绿色食品与饥饿,65,70,54,43,73,291,未参加,
特殊情况之外一般不吃有污染的农产品。[BC.],200307109525100557,日本,1,200307,绿色食品与饥饿,75,55,48,22,50,235,未参加,
一些。P},200307109523200574,韩国,2,200307,绿色食品与饥饿,65,50,59,30,35,220,未参加,
随着人们的生活水平提高，他们对饮食的意识也有所改变，[BC.]如买菜时选{CJ+buy好}绿色食品。[BC.],200307109523200583,韩国,2,200307,绿色食品与饥饿,75,60,72,56,84,333,C,
我认为现在的世界粮食情况[C]不公平。{CP发达国家的人们靠金钱的力量，买世界上的大部分的食品，不过，贫穷的国家不能买食品，结果在国内{CD里},200307109525100605,日本,1,200307,绿色食品与饥饿,65,70,64,67,87,339,C,
为[B未]何最近[C]市面上、[BC，]电[F電]视[F視]广[B広]告上、[BC，]杂[F雜]志[C]宣[C]传上有如此多地{CC的}强调“[BC：]绿色食品”的商品呢？,200307109525100629,日本,1,200307,绿色食品与饥饿,80,70,86,64,67,357,C,
{CQ随着}时代发展、[BC，]社会进步，人们的生活水平越来越高{CC1改善}人们还考虑{CC2想}自己的健康，所以随之而来{CC潮流而来}人们追求饮食的重要性。,200307217523100031,韩国,1,200307,绿色食品与饥饿,65,60,62,30,56,256,未参加,
我觉得这个问题没有解决的方法。,200307217525200054,日本,2,200307,绿色食品与饥饿,65,60,64,62,76,310,C,
可随[C]之出现，又引发了另一个问题：“吃‘绿色食品’和不挨饿哪个是第一位？,200307204523200001,韩国,2,200307,绿色食品与饥饿,65,75,86,75,90,378,B,
反之，北朝鲜等国家则想有化肥和农药，增加农作物[BQ，]但{CC也}没有钱，买不到这些。,200307204525100033,日本,1,200307,绿色食品与饥饿,60,70,70,62,73,320,C,
现在，比如我们日本那样的国家的情况是粮食多余的状[B况]态。,200307204525100057,日本,1,200307,绿色食品与饥饿,60,65,56,46,61,271,未参加,
这不在于农作物生产量，只在于长期的战[B站]争。,200307205523200013,韩国,2,200307,绿色食品与饥饿,70,65,78,62,84,345,C,
我认为不挨饿是第一位。,200307205525100023,日本,1,200307,绿色食品与饥饿,80,70,64,41,56,301,未参加,
如果{CJ-sy吃}使用农药的农作物的话，人们受到一定的化学污染。,200307205523200131,韩国,2,200307,绿色食品与饥饿,70,70,72,70,84,354,C,
最近，我们常常听到“绿色食品[BQ”]的重[B中]要性。[BD”],200307205523100145,韩国,1,200307,绿色食品与饥饿,65,60,54,49,58,269,未参加,
对这些人们来说，不管质量好不好，一粒粮食都不能忽视，[BC：]粮食好像生命一样。,200307205523200149,韩国,2,200307,绿色食品与饥饿,65,75,67,59,73,326,C,
但是现在世界上还[C]有几亿人因缺[C]少粮食而挨饿[C]。,200307205525100177,日本,1,200307,绿色食品与饥饿,65,60,46,64,47,265,未参加,
因它是对身体无害，[BC、]而化肥、[BC，]农药{CD的}对身体有害，我们少一点，对身来说，日积月累只会瘦了些而对身体无害处，反而吃化肥，农药的农作物久会月长梦多的，甚至死亡，变成废人等…我相信所有的{CJ-zxy人}都不{CD我}想要变成一个对社会无用的人{CC2者}。[BC，],200307212542100002,越南,1,200307,绿色食品与饥饿,60,65,35,33,30,206,未参加,
古人曾说过，“鱼与熊掌不可得兼。,200307212523100024,韩国,1,200307,绿色食品与饥饿,75,90,80,75,93,407,B,
这些地方不足{CJX}食品。,200307212525100060,日本,1,200307,绿色食品与饥饿,70,75,62,75,67,338,C,
我觉得什么难题都有解决它的方法。,200307209525100018,日本,1,200307,绿色食品与饥饿,60,75,80,64,84,349,C,
最后就是要大力生产，把那些没有的土地都开发成农地来播种粮食。,200307201523100002,韩国,1,200307,绿色食品与饥饿,90,70,72,51,79,355,C,
其实在中国很[C]多人已经习惯吃用农药的农作物，很少发生很[C]严重的问题。,200307209525100056,日本,1,200307,绿色食品与饥饿,65,65,59,67,70,310,C,
人民的健康和饥饿问题的重要性[BD、]我相信不言而喻。,200307201523200026,韩国,2,200307,绿色食品与饥饿,75,70,75,62,73,344,C,
我只是说若有一天世界上没有人会挨饿，没有人没粮食的时候[C]，那时，我们当然要开始找绿色食品啊！,200307201523100047,韩国,1,200307,绿色食品与饥饿,70,70,72,64,61,325,C,
因为人活着最重要的莫过于身,200307201523200044,韩国,2,200307,绿色食品与饥饿,70,65,64,43,61,289,C,
我们不挨饿，也可以吃到安全的食品。,200307201525200091,日本,2,200307,绿色食品与饥饿,60,55,59,64,81,300,未参加,
但是，随之带来了环境污染，很少吃“绿色食品”。,200307201523200102,韩国,2,200307,绿色食品与饥饿,60,60,54,56,47,259,未参加,
很多发达国家的人不了解他们的痛苦，还[C]在悠闲地找什么“绿色食品”。,200307302523100025,韩国,1,200307,绿色食品与饥饿,80,75,86,78,93,403,B,
第一，如果为了提高农作物[L]的产量，而不提倡吃“绿色食品”[BQ，]这虽然可以生产{CC产量}很多粮食提供给的挨[C]饿的人，又可以减少因没有粮食而感到挨饿的人，但[BD，]使用化肥和农药的粮食会大大地{CC的}危害人们的健康的。[BC，],200307302523200029,韩国,2,200307,绿色食品与饥饿,70,65,72,59,81,333,C,
然而，这是世界上几乎最荒凉、最艰[B坚]苦的地方，也是饥饿的人最多的地方吧。,200307302523100066,韩国,1,200307,绿色食品与饥饿,70,65,91,70,84,366,C,
有的人认为‘绿色食品’是第一位，有的人认为‘为挨饿’是第一位。[BC.],200307302523100068,韩国,1,200307,绿色食品与饥饿,65,65,54,51,64,283,未参加,
我的意思不是让您不维护自己的健康，放弃自己，而是让您放弃自己的一点一点奢望。,200307302523200136,韩国,2,200307,绿色食品与饥饿,75,75,67,78,79,364,B,
总之，我还[C]是想吃“绿色食品”比不上“不挨饿”。,200307206525200003,日本,2,200307,绿色食品与饥饿,70,70,59,59,73,319,C,
我不能批评他们的想法。,200307206525200007,日本,2,200307,绿色食品与饥饿,65,65,67,62,64,307,C,
首先我们该了解现在市场上的食品到底使用什么？,200307206525100014,日本,1,200307,绿色食品与饥饿,75,65,56,54,81,318,C,
虽说我喜欢吃干净的蔬菜，就是使用化肥和农药的食品。,200307206525100020,日本,1,200307,绿色食品与饥饿,65,70,51,46,44,262,未参加,
我以为绿色食品越来越多。,200307206525100020,日本,1,200307,绿色食品与饥饿,65,70,51,46,44,262,未参加,
但是，我不认为是自私，对面临饥饿{CC饥死}的人们来说[BQ，]不管导致化学污染或者对自己的身体有{CD所}损害{CC害}的因素{CJ?}，都先{CJX}必须解决最基本的“生存问题”{CJs}。,200307206525200033,日本,2,200307,绿色食品与饥饿,70,85,75,67,84,373,B,
我们首先要学会{CC学习}跟别人分享我们的食物，我们的爱心。,200307215523250004,韩国,2,200307,绿色食品与饥饿,65,70,75,72,84,352,C,
从人类存在到现在[BQ，]饥饿{CJ-zy一直}是很难解决的问题，但是随着科学的发展{CJ-zhuy存在饥饿问题的国家}已经减少了很多，{CJ-zhuy科学技术}也把很多国家从饥饿中救了出来。,200307215523150013,韩国,1,200307,绿色食品与饥饿,65,60,70,46,67,291,未参加,
我们也都知道[C]这[C]个地球上无数的孩子们在{CQ因}挨饿而死。,200307332523200001,韩国,2,200307,绿色食品与饥饿,70,65,67,49,56,293,C,
P}所以[BQ，]首先[BD，]{CQ要对}用肥料的人进行{CC开始}培训{CC培养}，就是提高农民的素质[BQ，]以及{CC和}解决他们的收入问[B门]题。[BC，],200307332525100027,日本,1,200307,绿色食品与饥饿,65,60,62,49,64,283,未参加,
但是根据我的看法就有些补充。{CP{CD对},200309529529251003,泰国,2,200309,我对男女分班的看法,0,70,55,44,58,222,未参加,
我也{CJX}上中学时恋过爱{CLH}，她是我们班的{CJ+dy同班}同学，她对我非常好。,200310576525100029,日本,1,200310,我对男女分班的看法,50,70,36,35,45,219,未参加,
不像[B想]一进实际{CC2实}社会{CD上}[BQ，]遇到{CJ+dy什么}困[C]难一下子无法应付{CC对待}{CD的}[BQ、]不会交际、[BC，]{CQ不会}交流[BQ、]{CQ不会}互相沟通的那些{CJ+dy一代}人。,200310576525200032,日本,2,200310,我对男女分班的看法,60,65,66,58,63,295,C,
总之，为了避免这种问题，就采用男女分班这样简单{CC容[B安]易}的方法绝不{CQ能}解决根本上的问题。,200310576525100039,日本,1,200310,我对男女分班的看法,65,65,19,65,65,263,未参加,
我反对男女分班的教育。,200310576525200073,日本,2,200310,我对男女分班的看法,70,80,63,80,79,362,C,
一个人在社会上总有一天会爱上另{CC别}一个人。,200310602801250006,澳大利亚,2,200310,我对男女分班的看法,70,70,79,65,65,337,C,
P}有些人还{CJ-zy一味}根据书中的不好内容，做出了一些难于令相信的事情{CJjy}。,200310540540250011,印度尼西亚,2,200310,谈有效阅读,60,70,57,51,86,309,未参加,
再讲我一位朋友，因他勤[B劝]读课外书[BQ，]有一天他竟能发明{CC创作}有电的蜡烛，供人们拜祭用[D的][BQ。]这也是从书本上学到的本领，{CD是}{CJjy}他发了一笔大财。[BC，],200310540540150020,印度尼西亚,1,200310,谈有效阅读,65,65,45,40,55,254,未参加,
他们是要[C]告诉我们什么。[BC？],200310540540250036,印度尼西亚,2,200310,谈有效阅读,65,80,59,60,84,336,C,
第二，我们要选择我们所需要的资料、有用的资料，有目的地读，才能有兴趣，不致于感到枯燥。,200310540540150058,印度尼西亚,1,200310,谈有效阅读,70,65,61,75,82,339,C,
因为我学汉语只是为了自己，[BC、]也可以说是为了父亲。,200304131539200040,印度,2,200304,我学汉语是为了……,70,70,33,49,63,273,未参加,
我从小到现在一直喜欢学语言。,200304131547200028,哈萨克斯坦,2,200304,我学汉语是为了……,75,65,62,63,77,329,C,
一首中文歌曲{CD已}改变了我的一生。,200304131542200091,越南,2,200304,我学汉语是为了……,90,85,68,63,77,380,C,
我们应该为了那些饥饿的人着想能帮助他们。[BC.],200307271523200038,韩国,2,200307,绿色食品与饥饿,70,55,46,59,53,267,未参加,
我们不用买绿[B绝]色食品。[BC.],200307271523200038,韩国,2,200307,绿色食品与饥饿,70,55,46,59,53,267,未参加,
那么我们{CD莫}不如把这些钱花在更有用的地方。,200307271523200052,韩国,2,200307,绿色食品与饥饿,75,80,83,75,100,404,B,
现在重要{CC2要}的事是绿色食品。,200307271523200068,韩国,2,200307,绿色食品与饥饿,65,65,51,46,64,275,未参加,
如果不用化肥和农药，农作物的产量又会大大降低，而现在世界上还有几亿人因缺少粮食而挨饿。,200307271523200078,韩国,2,200307,绿色食品与饥饿,70,70,70,64,79,341,C,
青少年{CD的}抽烟原因{CJX}的一个是{CJX}我想看成年人在街上抽烟。,200405109525200573,日本,2,200405,吸烟对个人健康和公众利益的影响,65,60,57,48,53,266,未参加,
根据医疗研究报告，人吸烟以后{CC2了}，{CD那}会得肺炎，造成死亡。,200405109523200598,韩国,2,200405,吸烟对个人健康和公众利益的影响,80,70,64,66,64,334,C,
真没办[C]法。P},200405109523100624,韩国,1,200405,吸烟对个人健康和公众利益的影响,90,60,55,60,57,312,未参加,
他们只看自己，别人不管{CJX}。[BC.],200405109523100676,韩国,1,200405,吸烟对个人健康和公众利益的影响,85,55,52,52,59,290,未参加,
我认为人们应该支持禁止吸烟的活动[BQ，]还有政府也{CQ应该}关注国民健[B建],200405109523200671,韩国,2,200405,吸烟对个人健康和公众利益的影响,55,55,50,52,41,233,未参加,
不仅如此，吸烟对肺健康的危害远远超过吸烟者的想象。,200405109523200982,韩国,2,200405,吸烟对个人健康和公众利益的影响,65,65,74,70,75,333,C,
总之，—开始抽烟[BD，]{CQ就}很难戒{CQ掉}。,200405109523201559,韩国,2,200405,吸烟对个人健康和公众利益的影响,70,65,57,77,66,321,C,
”我认为：这个学生抽烟的现象是成为{CC走上}失足青年的第一步。,200405109525101600,日本,1,200405,吸烟对个人健康和公众利益的影响,65,75,55,66,75,323,C,
”所以最近我们听到这样的声音：[BC.]“让我们消灭{CC消[C]除}烟[B咽]吧。,200405109525201602,日本,2,200405,吸烟对个人健康和公众利益的影响,55,75,48,58,50,271,未参加,
人们比以前社会的压力大。,200405109525201640,日本,2,200405,吸烟对个人健康和公众利益的影响,65,55,50,62,61,275,未参加,
非吸烟者也被危害身体健康{CJbei}，主要是吸烟者{CJX}吸的烟。,200405109525101736,日本,1,200405,吸烟对个人健康和公众利益的影响,65,60,55,54,59,276,未参加,
比如，[BC、]一家里边爸爸抽烟的话，家族都抽烟一样的现象{CJ？}。,200405109523201790,韩国,2,200405,吸烟对个人健康和公众利益的影响,60,70,28,25,30,198,未参加,
在我看来{CC对我来说}，{CD这}近来世界普遍{CC共同[B通]}对吸烟者的要求{CC看法}太严格。{CP我虽然知道吸烟不仅仅是对个人健康有坏处，而对周围的人的健康也{CJ-sy造成},200405109525101853,日本,1,200405,吸烟对个人健康和公众利益的影响,70,60,48,75,75,313,未参加,
可是，其实吸烟是百害无利的行为。,200405109525200425,日本,2,200405,吸烟对个人健康和公众利益的影响,75,65,74,75,66,342,B,
吸烟带来的病是很多种{CJy}，[BC。]特别多是呼吸器[C]官{CJ+zxy的病}[BD，]容易出毛病。,200405109525100533,日本,1,200405,吸烟对个人健康和公众利益的影响,85,65,62,68,54,323,C,
请大家别吸烟，创造{CC2造}个美丽的21世纪吧！,200405109523100613,韩国,1,200405,吸烟对个人健康和公众利益的影响,65,75,64,60,56,307,C,
特别是青少年吸烟的话，他们会受到{CC得}{CJX}成长障碍[C]。,200405109523200795,韩国,2,200405,吸烟对个人健康和公众利益的影响,65,70,48,58,66,293,C,
例[B列]如，最近在韩国有两个明星由于吸烟得了严重的肺[C]病{CC1疾患}，[BC。]结果他们俩都死了。,200405109523200802,韩国,2,200405,吸烟对个人健康和公众利益的影响,80,90,68,75,75,383,B,
如果他们在{CC去}公共场所看到别人吸烟，很可能再拿一支烟抽起来。,200405109523101163,韩国,1,200405,吸烟对个人健康和公众利益的影响,60,50,54,52,54,250,未参加,
为什么这样做？,200405109525100366,日本,1,200405,吸烟对个人健康和公众利益的影响,45,70,46,73,65,281,未参加,
要是真的是那样的话，为什么政府还要自己去制定在公共场所不允许抽烟的规定呢？,200405204525100384,日本,1,200405,吸烟对个人健康和公众利益的影响,60,75,71,73,88,353,C,
”又有的人说[BQ：]“不能抽烟比不吃饭更{CJ+sy有}痛苦。,200405205525200101,日本,2,200405,吸烟对个人健康和公众利益的影响,60,85,55,63,58,310,未参加,
那么有哪些坏影响呢？{CP从健康方面来说有两个。第一是损害{CC伤[F傷]害},200405205525200133,日本,2,200405,吸烟对个人健康和公众利益的影响,60,80,68,73,61,329,C,
现在孩子{CD的}吸烟成了深刻的社会问题。,200405201525200302,日本,2,200405,吸烟对个人健康和公众利益的影响,65,70,49,63,49,282,C,
一般的人多很不喜欢[F歡]烦[F煩]恼[F腦]或没有时[F時]间[F間]烦[F煩]恼[F腦]，为[F為]什么[F麼]没有时[F時]间[F間]呢？,200405332602100051,爱尔兰,1,200405,吸烟对个人健康和公众利益的影响,65,50,30,23,33,182,未参加,
为了减少吸烟的人[B大]，有一个市政府出台{CQ了}一项规定是：在公共场所边走边抽烟的人将被罚款。[BC.],200405684542200001,越南,2,200405,吸烟对个人健康和公众利益的影响,65,90,38,37,51,272,未参加,
我觉得中学生、高中生谈恋爱不太适宜，他们会把太多时间投注于对[C]方、或彼此见面沟通上，而忽略了学业。,200410534533250030,新加坡,2,200410,最理想的结交方式,75,85,71,72,96,392,B,
但是，以我的观点来看，我认为[F為]青年人到了一定恋爱时期自由恋爱是最理想的。,200410534533250061,新加坡,2,200410,最理想的结交方式,90,95,66,72,96,417,B,
尤其是欧洲国家的那些著名的球队[B对]。,200404140540200053,印度尼西亚,2,200404,运动员收入,70,50,60,55,61,279,未参加,
以印尼的明星运动员为例，他们每月的收入可达到二十万人民币，然而印尼总统的收入才两三万人民币。,200404140540200146,印度尼西亚,2,200404,运动员收入,70,85,81,69,72,369,B,
首先运动员在某些体育运动中，各人有各{CQ人}{CQ的}长处，他们能参加某种体育队，都得{CJ-sy花}长时间{CC时候}锻炼而成，他们每天除了锻炼还是锻炼。,200404140542200191,越南,2,200404,运动员收入,70,70,52,32,57,269,未参加,
在新加坡，我们不单是有混合学校，还有男校和女校。,200504534533250100,新加坡,2,200504,我对男女分班的看法,70,85,81,73,86,387,B,
异性相吸是永远改不了的事实。,200504534533250154,新加坡,2,200504,我对男女分班的看法,90,80,84,78,82,409,A,
之所以我在美好的时光里长大了，是因为他们教我教得非常周到。,200505109525200545,日本,2,200505,父母是孩子的第一任老师,65,65,69,58,72,313,C,
而且我[C]也认为{CC2想}母[C]亲做的事情没有错。,200505109525200600,日本,2,200505,父母是孩子的第一任老师,65,75,58,56,74,315,C,
我父亲是在政府当官{CQ的}，我母亲是在家做小生意{CQ的}。,200505109513200752,柬埔寨,2,200505,父母是孩子的第一任老师,70,70,44,40,51,263,未参加,
因为父母[C]教我们很多的东[C]西[C]。,200505109525100764,日本,1,200505,父母是孩子的第一任老师,55,70,20,35,33,197,未参加,
因为孩子就是模仿[B访]父母的行动成长的。,200505109525100849,日本,1,200505,父母是孩子的第一任老师,60,65,82,65,46,301,C,
自己[C]的母语[F語]都[C]是父母给我的，这[C]证[C]明小[C]孩[B孙[F孫[C]]]子的时候{CC2时}，[BC、]父母会给孩子的影响是相当大{CJsd}，[BC、]所以，小孩子的时候父母是义要好孩子的独[C]立的存[C]在[C]也唯一的存[C]在[C]{CJ？}。,200505109525101073,日本,1,200505,父母是孩子的第一任老师,60,55,53,45,55,249,未参加,
这样会使孩子成为好人，乐于助人，为国家做出贡献。,200505109529201097,泰国,2,200505,父母是孩子的第一任老师,80,70,60,58,71,329,C,
孩子一出生都是跟父母第一次接触。,200505109540101118,印度尼西亚,1,200505,父母是孩子的第一任老师,70,65,55,35,62,273,未参加,
我们也会选择自己的老师，而且个人的选择取决于个人的家庭结构[C]和人际关系的程度。,200505109525101792,日本,1,200505,父母是孩子的第一任老师,65,65,52,67,74,307,C,
因为拥有美好内心的人很受别人的欢迎，而且很有爱心。,200505109520202058,蒙古国,2,200505,父母是孩子的第一任老师,65,65,48,49,69,280,未参加,
父母是面对一个人的最初[C]的人物{CJ？}，自然最初[C]步的语[C]言是[C]向他们学习。,200505109525102044,日本,1,200505,父母是孩子的第一任老师,70,65,56,67,69,313,C,
小时候学到的语言、口音都一直影响他的说话、思考。,200505109525102044,日本,1,200505,父母是孩子的第一任老师,70,65,56,67,69,313,C,
所以我可能接受我爷爷等的很大的影响。,200505109525102110,日本,1,200505,父母是孩子的第一任老师,50,55,37,71,63,255,未参加,
父母是最早对孩子的成长产生重大影响的人。,200505109525202099,日本,2,200505,父母是孩子的第一任老师,70,60,61,67,72,315,C,
可能幸亏我[C]的家长[C]的帮助，在中国[C]跟很多好朋友会交流。,200505109525202316,日本,2,200505,父母是孩子的第一任老师,65,75,35,51,52,265,未参加,
所以我想阐述自己的想法。,200505109525102400,日本,1,200505,父母是孩子的第一任老师,55,65,46,51,64,263,未参加,
我从小时候到现在，一直[C]看着他骑摩托车的样子而长大了。,200505109525102455,日本,1,200505,父母是孩子的第一任老师,65,65,39,51,72,276,未参加,
孩子小时看坏事，以后恨坏事。,200505109525202469,日本,2,200505,父母是孩子的第一任老师,65,75,58,59,80,324,C,
他常常带我去湖边[L]来给我看湖里的鱼。,200505109525102597,日本,1,200505,父母是孩子的第一任老师,70,80,37,57,65,299,未参加,
