错句,作文编码,国籍,性别,考试时间,作文题目,口试分数,作文分数,听力分数,阅读分数,综合分数,总分,证书
每个人都有不同的童年的生活过程及机遇。,200110540540250096,印度尼西亚,2,200110,我的童年,70,90,52,51,76,332,未参加,
那[B哪]就遭糕了，爸去上班，妈住医院，我就{CQ像}一匹无缰的野马一样，无人管束，就跟那些野孩子开始{CJX}{CD了}打交道。,200110540540150106,印度尼西亚,1,200110,我的童年,75,80,41,54,83,324,未参加,
在生活漫长[F長]的岁[F歲]月里[F裡]，老人家都为了孩子的成长[F長]，辛苦养[F養]活我们[F們]一家人是很不容易的一件事。,200110540540150125,印度尼西亚,1,200110,我的童年,70,85,30,37,88,302,未参加,
我的童年充满着欢乐，不知道什么叫着“贪”……{WWJ},200110540540250120,印度尼西亚,2,200110,我的童年,75,90,71,70,88,388,B,
今早，顷阅报章，知悉贵旅游公司欲聘请导游、经理、广告设计师和司机等工作人员{CD之职位}。,199312533533200001,新加坡,2,199312,一封求职信,90,95,57,54,62,357,C,
附函附[B付]上一部分[B份]旅客的致谢信。,199312533533100032,新加坡,1,199312,一封求职信,80,70,71,76,87,374,B,
我姓×，名××。[BC.],199312533533200050,新加坡,2,199312,一封求职信,90,80,62,67,75,369,B,
本人相貌端正，衣著端庄[F荘]，语言{CC语文}表达能[C]力也强。,199312533519200079,马来西亚,2,199312,一封求职信,90,75,57,61,85,362,C,
做了五年[BQ，]因有[C]了孩子而辞职。,199312533540200116,印度尼西亚,2,199312,一封求职信,85,95,25,69,96,368,未参加,
谢谢，我等着你们的好消息[BQ，]顺{CC茄}祝健康[BQ！]×××敬上一九九三年十二月四日,199312533540200157,印度尼西亚,2,199312,一封求职信,85,65,46,47,66,300,未参加,
这[C]个健康表{CC医院表[C]}{CQ的}说明[C]{CQ得}更清[C]楚[C]。,199312123719200204,喀麦隆,2,199312,一封求职信,65,65,22,27,34,198,未参加,
李先生[BQ：]您好[C]！,199312123523100501,韩国,1,199312,一封求职信,65,50,57,41,36,230,未参加,
我的性格很开朗[B郎]，较外向，[BC.]还有很喜欢去旅游。[BC.],199312123523200709,韩国,2,199312,一封求职信,55,50,25,39,43,191,未参加,
快乐家庭旅游公司李文先生：[BC；]您好！[BC；],199312123525100807,日本,1,199312,一封求职信,75,60,64,39,48,272,未参加,
客观地看，[BC.]我的性[B情]格是开朗[B郎]、喜欢跟人交流、爱劳动。,199312123525200913,日本,2,199312,一封求职信,60,55,43,56,50,245,未参加,
他在泰国出生{CD的}。,199412123529100017,泰国,1,199412,记我的父亲,55,65,41,32,30,205,未参加,
他当一个学校的校长。,199412123523200043,韩国,2,199412,记我的父亲,65,55,36,38,51,227,未参加,
他二十岁的时候（[BC——]一九四五年）[BC——]二次大战才结束{CD了}，那时日本的社会非常[C]乱，非常贫穷[C]。,199412124525100010,日本,1,199412,记我的父亲,60,60,54,61,72,289,未参加,
我父亲{CJ+sy是}今年已到五十一岁了，他是个批发公司（专门酒品）的干部。,199412124525100033,日本,1,199412,记我的父亲,65,65,52,46,45,257,未参加,
我和他的关系也是非常好的。[BC：],199412124633200037,意大利,2,199412,记我的父亲,70,80,41,53,49,283,未参加,
第二天开始上第一节课，在教室里，彼此只望着，一句话也不说。,199412104523200627,韩国,2,199412,记对我影响最大的一个人,65,65,46,61,43,264,未参加,
虽然我有姐妹，但是我回来的时候，她们也总是不在家。,199412104525200650,日本,2,199412,记对我影响最大的一个人,65,65,62,55,57,288,C,
我也很喜欢我的老师。,199412104523200105,韩国,2,199412,记对我影响最大的一个人,65,60,65,53,49,275,未参加,
如说起对我影响最深的一个人，[BC。]我脑海即刻{CC即时}出现自童龄时{CQ起}的许许多多{CQ的}老师、朋友，再后来就是工作、学习当中所遇到的同事、同学，但要说影响最深的话[BQ，]也只能是一个人，就是伴我成长，教导我的、关心我的父亲。,199412104940200617,秘鲁,2,199412,记对我影响最大的一个人,90,75,70,61,80,370,B,
人生无常，生命只在呼吸之间。,199500533533100005,新加坡,1,199500,记对我影响最大的一个人,90,75,70,75,80,384,B,
她今年四十来岁，身材娇小，皮肤白里透红，是个求上进、[BC，]肯拼搏、[BC，]心地善良的主任。,199500533533200018,新加坡,2,199500,记对我影响最大的一个人,90,80,81,65,90,401,B,
我常常觉得忍耐及吃苦的确是一种美德，就是这种美德[C]，使得{CC使到}父亲这些年能含辛茹苦地{CC的}白手成家，养育后代。,199500533533100025,新加坡,1,199500,记对我影响最大的一个人,80,90,78,71,90,404,B,
{CP在{CQ她}的熏[B薰]陶下，{CD使}我这个顽劣的学生慢慢觉悟，同时开始走入人生应[B因]走的道路，使我在学习领域里展露头角{CC钻出茅头}。P},199500533533200021,新加坡,2,199500,记对我影响最大的一个人,95,90,62,63,67,376,C,
小时，祖父确实教了我不少做人的道理[BQ，]尤其是待人处世方面。,199500533533200030,新加坡,2,199500,记对我影响最大的一个人,95,85,41,61,76,356,未参加,
当我第一天进入讲堂上课时，就被这位圆圆的脸、光秃秃的头、服嘟嘟的身材的博士所吸引了。,199500533533100103,新加坡,1,199500,记对我影响最大的一个人,75,85,65,61,74,353,C,
每回学校假期，父亲若有带学生出游{CJy}，也必会让我与哥哥同去。,199500533533200098,新加坡,2,199500,记对我影响最大的一个人,90,90,57,69,84,388,C,
我最亲爱[F愛]的{CJ-zxy人}！,199500533533100141,新加坡,1,199500,记对我影响最大的一个人,95,80,81,75,92,419,B,
我就全心全意{CC全心全力}接受校长[F長]们的号召{CC征[F]召}，二十几[C]年来，[BC、]没有离开[C]过这一所培育{CC培植}我[C]的母校[BD、]和一直在旁呵护{CC护[F護]呵}我最深的蔡[C]校[F長]，由[F於]朝[C]夕相处[F處]，我们似{CD如}一对父女，[BC、]无[F無]所不说[F説]，[BC。]无[F無]所不谈[F談]。,199510512501200508,中国,2,199510,记对我影响最大的一个人,90,95,48,48,61,340,未参加,
小时候，我曾从大人{CQ那儿}听说过毛主席领导中国人民起来[F來]打败[F敗]日本，把国民党反动派驱赶到台湾岛[F島]上，建立了中华人民共和国。,199510512512100502,菲律宾,1,199510,记对我影响最大的一个人,80,85,59,66,73,357,B,
对{CC1为了}彼此{CC互相}，病人和家人，都是一种好办法，要是[C]有一天我也病了，我也不愿连[F連]累我家人的。,199510550523200918,韩国,2,199510,如何看待“安乐死”,90,85,59,60,53,344,C,
这是没有[C]办法{CJsd}”所以犯罪的话，[BC“]一个国[C]家怎么行呢？[BC”],199510550523100920,韩国,1,199510,如何看待“安乐死”,70,55,40,44,35,228,未参加,
我的地址如下:马来西亚吉隆坡邮箱10599{CC一O五九九}号。,199503680519200511,马来西亚,2,199503,一封求职信,80,75,67,60,73,346,C,
所以，不[C]管是千家诗[F詩]也好，唐诗[F詩]三百首也好，三字经[C]也好，我都会[F會]背上几[F幾]段。,199505529529100071,泰国,1,199505,学习汉语的苦与乐,75,90,74,70,88,391,B,
我的老[C]师强调的是[B事]：韩国[C]的知识青年应该了解{CC知道}急速变化过程中的世界，[BC。]而且对这样的变化好好儿地准备{CJ-by应对}。,199505104523100022,韩国,1,199505,记对我影响最大的一个人,75,80,62,65,63,336,C,
因此我决心不上大学，为了妈妈，而且为了两个妹妹，我发扬{CC发挥}牺牲精[C]神，默默地找[C]一找[C]{CD什么}工作。,199505104523200045,韩国,2,199505,记对我影响最大的一个人,55,75,36,30,53,234,未参加,
在现在的生活中耶稣给我他的力量，他的爱，对他{CQ来说}没有一件事是做不到的。,199505104922100054,美国,1,199505,记对我影响最大的一个人,70,70,54,59,55,296,C,
”外祖父{CD对我}一直{CD支持了}这样看我的好处的态度，树立{CC养育}了我的信心。,199505104525200060,日本,2,199505,记对我影响最大的一个人,65,90,65,67,67,345,C,
可是，到了昆明，我就得了肺炎。,199505104525200086,日本,2,199505,记对我影响最大的一个人,60,75,57,48,69,295,未参加,
我认为最可怜的人是想法落[C]后的{CJ-zxy人}[BQ，]因为他们老以为今天总不如昨天，[BC：]这种人永远不能满意开心。,199505104922200085,美国,2,199505,记对我影响最大的一个人,95,60,60,42,30,278,未参加,
{CP人生有好几个岔路口{CC歧点}。,199505104525100160,日本,1,199505,记对我影响最大的一个人,70,75,81,71,74,360,B,
现在很喜欢学汉语，如果没有见到过我的丈夫，我不可能来北京。,199505104525200171,日本,2,199505,记对我影响最大的一个人,55,70,54,53,49,265,未参加,
爸爸在家特别[C]地{CC的}关心[C]我[C]，常常用温和的话对[C]我说[BQ：]为了得[C]到一个美满的生活应在社会上占住脚[C]；[BC。]在事[C]业当中，同[C]事[C]不会轻[B经][C]视[C]你，在家里丈夫也会尊重你的理想和追[C]求，同[C]时[C]也会提高[C]你的生活水平[BQ。]我今天非常地感[C]谢{CJ+dy这[C]位}爸爸，早就懂这[C]个道[C]理，使我今天能靠自己生活，能有自己的目标。,199505104719200241,喀麦隆,2,199505,记对我影响最大的一个人,75,65,52,36,55,270,未参加,
这都是一直伴随我的{CC跟我一起过日子}。,199505104523100248,韩国,1,199505,记对我影响最大的一个人,70,55,60,67,61,297,C,
就是在他俄罗斯的家里我第一次尝了中国饭的味道，第一次说出来了几句中国话。,199505104635100249,俄罗斯,1,199505,记对我影响最大的一个人,65,70,70,55,61,307,C,
曾经{CJX}[BD，]我是一个常常怨天尤人，身{CC生}在福中不知福的人。,199508683519100553,马来西亚,1,199508,记对我影响最大的一个人,85,85,81,75,88,409,B,
我觉[F覺]得离[F離]婚，对[F對]一个[F個]家庭带来[F來]很大的影响[F響]，我并[F並]不赞[F贊]成离[F離]婚。,200010801801250006,澳大利亚,2,200010,我对离婚问题的看法,70,65,50,34,59,264,未参加,
有人说[BC「]没有爱[F愛]情的婚姻是不道德{CJsd}＂[BC」]，应该允许没有爱[F愛]情基础{CQ的}夫妻离婚。,200010602543250001,香港地区,2,200010,我对离婚问题的看法,80,75,70,62,80,358,B,
有人主张[F張]应[F應]该[F該]允许[F許]已经[F經]没有爱[F愛]情基础的夫妻离[F離]婚。,200010602543250009,香港地区,2,200010,我对离婚问题的看法,85,85,100,90,95,450,A,
这东西可以说是社会发展越来越发达以后的一些文明{CQ的}产物{CC遗产}。,200005108523200282,韩国,2,200005,关于用自然之声取代噪声的建议,65,65,53,47,46,260,未参加,
如果这种噪音能唤成大自然之声，那么多么好听呀！,200005108525200297,日本,2,200005,关于用自然之声取代噪声的建议,65,70,67,70,69,327,C,
吵的声音很大。,200005108523100305,韩国,1,200005,关于用自然之声取代噪声的建议,65,65,18,42,35,209,未参加,
第三，人类也是{CD一个}自然的{CD一个}动物。,200005108523100326,韩国,1,200005,关于用自然之声取代噪声的建议,70,65,31,50,37,239,未参加,
这样的声音是环境的污[Pwu]染[Pran]之一，我们城市里人能走近自然。,200005108523200327,韩国,2,200005,关于用自然之声取代噪声的建议,65,65,45,29,43,231,未参加,
如果这次的发明普及到世界的话，有一些噪声问题将要解决{CC决解}。,200005108523200338,韩国,2,200005,关于用自然之声取代噪声的建议,65,60,45,60,48,261,未参加,
[D在]本世界环境污染问题越来越严重。,200005108523200339,韩国,2,200005,关于用自然之声取代噪声的建议,65,70,72,57,54,304,C,
我关于用自然之声取代噪声的建议完全同意[B义]，以前我过街的时候听到了一个可爱的声音，“对不起，让开一下”，我不知不觉得转头看谁说这么可爱{CJ-zxy的话}，原来它不是人，是个汽车喇叭声，我周围的人都笑，我也不例外。,200005108523100347,韩国,1,200005,关于用自然之声取代噪声的建议,65,75,75,72,67,341,B,
有的人可能会指出，我妈（或老婆）发的牢骚也是一种噪音！,200005108525100396,日本,1,200005,关于用自然之声取代噪声的建议,65,80,80,85,91,389,B,
这些办法{CC代策}以短期的方法可以{CJ-sy起}作用。,200005108523200403,韩国,2,200005,关于用自然之声取代噪声的建议,65,65,50,67,52,283,C,
俗语[F語]说[F説]：四海之内皆兄弟。,199711801501200004,中国,2,199711,我选择朋友的标准,90,80,80,67,80,392,B,
其次就是在爱好及嗜好方面有共同点，如此一来在交际中不会对对方所谈不合口味而为了敷衍了事，勉强陪伴来活受罪。,199711802501100016,中国,1,199711,我选择朋友的标准,80,80,80,79,87,398,B,
我的童年是在异国他乡度[B渡]过的。,199705104523200127,韩国,2,199705,我的城市/乡村生活,80,55,60,49,46,276,未参加,
小时候，看书[F書]也是一个我的爱好。,199705104523200130,韩国,2,199705,我的城市/乡村生活,70,65,71,56,61,309,C,
乡村里的环境好，树木多，也还能看到泰国古老的房屋，农家的田地。[BC．],199705529529251005,泰国,2,199705,我的城市/乡村生活,80,75,49,42,30,267,未参加,
可是，我也像[B象]每天一样，一点不想{CQ吃}。,199705610501100014,中国,1,199705,我的城市/乡村生活,80,60,71,60,66,324,C,
我们全家住那里特别舒服，因为城市里的人民[C]，很多是亚[F亞]洲人，所以就像[B想]住在中国似的。,199705610610100016,法国,1,199705,我的城市/乡村生活,55,60,48,37,35,216,未参加,
就自己的亲[F親]身体[F體]会[F會]，当[F當]面临[F臨]挫折时[F時]第一要务[F務]是要使头[F頭]脑[F腦]冷静，不要太过[F過]受到情绪[F緒]影响[F響]而产[F產]生失望，灰心的感觉[F覺]。,199810602501150003,中国,1,199810,如何面对挫折,95,90,81,89,88,442,A,
在面对失败其间，我们应该反醒一下，自己的错误在哪[B那]里，反醒一下整个过程[B情]，将问题反复[F復]思考，以后[F後]可做得更好。,199810602801150011,澳大利亚,1,199810,如何面对挫折,75,70,84,80,79,377,B,
可[BD，]对我来说并不是这样。,199804123523200149,韩国,2,199804,学习汉语的苦与乐,75,75,66,52,40,298,未参加,
我刚来北京时，连[BQ“]你好[BQ”]也说不出来。,199804123523100162,韩国,1,199804,学习汉语的苦与乐,70,70,57,45,54,284,未参加,
学习汉语的苦：对我来说，汉语是难以学好的。,199804123525100152,日本,1,199804,学习汉语的苦与乐,80,65,57,71,66,327,C,
又来了，学习中文的“苦”和它给我带来的“乐”。,199804123644100238,格鲁吉亚,1,199804,学习汉语的苦与乐,65,80,54,52,40,279,未参加,
学汉语并不是很难，只要{CC都要}努力就行。,199804124523200393,韩国,2,199804,学习汉语的苦与乐,75,80,57,30,54,287,未参加,
刚刚开始学发音与语调，对我个人来说最难。,199804124523100489,韩国,1,199804,学习汉语的苦与乐,70,65,69,52,60,302,C,
没考上大学的学生当中，有的人悲观，自己也不知如何承受现实，就选择自杀{CD方式}，这种现象是在韩国很普遍的。,199904123523200008,韩国,2,199904,如何面对挫折,75,70,37,65,59,295,未参加,
总想着，在韩国享受美丽的生活。,199904123523200012,韩国,2,199904,如何面对挫折,70,55,53,34,43,239,未参加,
还有对事物、[BC，]事情的态度也有很大的变化{CC变心}，人遇到困难的时候应该正面对待它，然后冷静地{CC的}想一想，冷静想出最好的办法，想出最好的路，这样的话人可以克服[B复]这种情况，也会战胜{CC克服[B复]}自己。[BC，],199904123523200024,韩国,2,199904,如何面对挫折,65,65,53,39,50,256,未参加,
家人都在韩国，[BC。]刚来中国的时候，很想念妈妈。,199904123523200087,韩国,2,199904,如何面对挫折,70,65,48,47,37,253,未参加,
我也当兵{CJX}过。,199904123523100114,韩国,1,199904,如何面对挫折,50,65,48,57,56,257,未参加,
当时我的同屋回国了，[BC。]现在出去买东西都没问题了，[BC。]但我忘不了她的照顾。,199904123525200113,日本,2,199904,如何面对挫折,65,75,48,52,46,273,未参加,
我考上大学的时候，我要在汉城的有名的大学里学习，但我的成绩不够，只考上了我住的金山的一个大学，我看这个事情是{CJX}当时对我{CQ来说}最困难的。,199904123523200145,韩国,2,199904,如何面对挫折,60,65,48,52,39,247,未参加,
因为那时候，我不想做什么事情。,199904123525100143,日本,1,199904,如何面对挫折,45,65,53,70,37,250,未参加,
每天到很晚{CJX}学习，结果呢？,199904124525200349,日本,2,199904,如何面对挫折,70,70,45,55,50,278,未参加,
有一天，家里只有我跟妈两个人在一起。,199904124523200407,韩国,2,199904,如何面对挫折,60,65,70,57,50,285,C,
我们如何练好本领呢？,199909684542200051,越南,2,199909,如何面对挫折,80,75,62,48,67,323,C,
