错句,作文编码,国籍,性别,考试时间,作文题目,口试分数,作文分数,听力分数,阅读分数,综合分数,总分,证书
过新年的时候，我们家里人都聚[C]集在家乡[BQ，]{CD而且}大家都愉快地过新年。,199412123525200037,日本,2,199412,记我的父亲,60,90,62,63,45,310,C,
后来{CC以后}我陪他去{CC来}{CD汉城}住院{CJX}汉城{CD里}最有名的医院，动手术，可还是没有用，老天爷连一点忙也不帮他，他那年四月去世了。,199412123523100051,韩国,1,199412,记我的父亲,50,55,28,59,43,214,未参加,
最近把札晃啤[B脾]酒公司盖的一大城市，跟别的公司合同盖的{CJba}。,199412123525100065,日本,1,199412,记我的父亲,65,65,52,38,49,253,未参加,
他说[BQ：]“我不想让孩子们吃这种苦，所以到今天{CJ-zy一直都很}努力，但你……。,199412124525200006,日本,2,199412,记我的父亲,65,60,70,71,67,316,C,
离开了祖国，离开了父母，离开了朋友，一个人到中国来了。,199412124525200011,日本,2,199412,记我的父亲,85,80,46,36,63,303,未参加,
孩子们总是想当像{CJX}个{CD同}父亲这样的人。,199412124914100036,古巴,1,199412,记我的父亲,50,60,41,34,37,202,未参加,
我来{CD了}中国以后没看见她，只从姐姐{CQ那里}听{CQ到}她的新消息。,199412124525200061,日本,2,199412,记对我影响最大的一个人,60,65,62,57,55,282,C,
老师考虑到我在中国学习的时间短，想办法采取能够最快地学好二胡的办法。,199412104525200697,日本,2,199412,记对我影响最大的一个人,65,65,75,79,74,342,C,
可以说是那时{CQ我}开始学习{CC学了}怎么做好的人。,199412104523200682,韩国,2,199412,记对我影响最大的一个人,90,60,73,59,69,341,C,
我刚来北京的时候，谁都不认识，哪儿都不知道，而且只会说一点简单的汉语。,199412104525200671,日本,2,199412,记对我影响最大的一个人,65,55,60,67,59,288,C,
老师[F師]们[F們]常称[F稱]赞[F讚]他努力，他可以把所有{CD的}做过的数[F數]学[F學]题都记[F記]下来，不得{CC尤}不令我佩[B配]服。[BC，],199412104625100364,葡萄牙,1,199412,记对我影响最大的一个人,70,85,81,63,74,365,C,
我是一个[F個]从[F從]事电[F電]脑[F腦]行业[F業]的技术[F術]员[F員]。[BC，],199412104625100368,葡萄牙,1,199412,记对我影响最大的一个人,65,80,89,75,74,371,B,
生活很平淡。,199412104625200370,葡萄牙,2,199412,记对我影响最大的一个人,75,85,94,77,82,406,B,
和别人以汉语来交谈的亲切感等等。,199409543519100218,马来西亚,1,199409,学习汉语的苦与乐,75,70,71,75,82,362,B,
记[F記]得在一九九六年暑假，我跟朋友们[F們]到北京学[F學]习[F習]汉[F漢]语[F語]。,199409543634200212,英国,2,199409,学习汉语的苦与乐,90,65,67,75,88,377,C,
而在这些[F這]人之中对[F對]我的个[F個]性、[BC，]思想等各方面影响[F響]最大的人，莫过[F過]于[F於]是我的父亲[F親]了。,199500533533200012,新加坡,2,199500,记对我影响最大的一个人,85,90,100,77,90,438,A,
从这件事，我看到{CQ了}“喂”善良的一面，他并不象外婆所说的那么坏。,199500533533200034,新加坡,2,199500,记对我影响最大的一个人,90,90,89,75,90,432,A,
”外婆，我谢谢您！,199500533533200048,新加坡,2,199500,记对我影响最大的一个人,90,90,68,65,82,393,C,
我看不起{CC3小看}以向{CC跟}上司讨好而升级的他们。,199500533533100060,新加坡,1,199500,记对我影响最大的一个人,80,75,52,65,74,337,C,
而这句话，正是我从小就常[C]从妈妈的嘴里听到的。,199500533533200079,新加坡,2,199500,记对我影响最大的一个人,95,95,91,75,94,449,A,
我生长在一个封建制度极浓的大家庭中，家庭成员很多。,199500533519200096,马来西亚,2,199500,记对我影响最大的一个人,85,60,57,55,65,310,未参加,
多亏父亲带我去看医生，而且还每天为我洗头发。,199500533533200098,新加坡,2,199500,记对我影响最大的一个人,90,90,57,69,84,388,C,
最多的琐事也只是教教弟妹们温习[F習]功课[F課]。,199510512512200501,菲律宾,2,199510,记对我影响最大的一个人,85,75,62,41,59,314,未参加,
在她老人家病重离校期间，{CJ+zhuy我}更加地{CC的}勤奋，我尽力帮[F幫]她完成一些该[F該]做的校务[F務]，在工作上努[C]力，[BC、]在教学[F學]上更认[F認]真！,199510512501200508,中国,2,199510,记对我影响最大的一个人,90,95,48,48,61,340,未参加,
从[F從]小到大，影[C]响我的人不少[C]，但对我影响最深的人是……小时[F時]候，父母常出外工作，留下我独自在家，那时[F時]外婆常常来陪伴着我。,199510512501200511,中国,2,199510,记对我影响最大的一个人,90,90,79,66,82,405,B,
这[F這]天，当[F當]我爬上枝头[F頭]时[F時]，由于[F於]树[F樹]枝不负[F負]重力，咔嚓一声，我从[F從]上面跌了下来，脚摔到了，一阵[F陣]从[F從]未尝[C]试到的痛楚，令我很快掉下了眼泪[F淚]。[BC，],199510512501200511,中国,2,199510,记对我影响最大的一个人,90,90,79,66,82,405,B,
在我念[F唸]中四的那一年，有一天为[F為]了小事我暴[B咆]跳如雷，直嚷着要跟人吵架。[BC，],199510512512200509,菲律宾,2,199510,记对我影响最大的一个人,90,90,76,54,93,401,B,
韩国的法制也受到了儒教的影响。,199510550523100903,韩国,1,199510,如何看待“安乐死”,70,85,64,64,73,348,C,
如果法律允许[F許]“安乐[F樂]死”了，会[F會]引起社[F會]的矛盾。,199510550523200922,韩国,2,199510,如何看待“安乐死”,80,85,76,70,75,380,B,
类[F類]似事件，香港也曾经[F經]发[F發]生过[F過]，事因有位兄长[F長]不忍见[F見]其胞弟[BD，]长[F長]年累月地受病疾的折磨，应[F應]弟弟的要求，将其生命辅[F輔]助器取掉，以致其死亡，[BC；]而致议[F議]论[F論]纷[F紛]纷[F紛]。,199511543634200518,英国,2,199511,如何看待“安乐死”,80,80,64,66,86,368,B,
如客观[F觀]证[F證]据[F據]证[F證]明“安乐[F樂]死”是死者个[F個]人的意愿[F願]，帮[F幫]助死者自杀[F殺]的人不应[F應]该[F該]受到法律的制裁。,199511543634200520,英国,2,199511,如何看待“安乐死”,85,80,81,73,75,387,B,
4、随信我附上了我的文凭、[BC，]工作经验证明[BD，]以及简历等，以便作为贵公司的参考。,199503680519100541,马来西亚,1,199503,一封求职信,85,85,81,83,91,420,A,
其实{CC其是}我妈是个外柔内刚[B刈]的人。,199505550523200911,韩国,2,199505,记对我影响最大的一个人,70,65,62,57,39,279,未参加,
时间[C]过得真快。,199505104523100004,韩国,1,199505,记对我影响最大的一个人,80,80,60,48,61,321,C,
那天从上午九点到下午五点一直{CC一向}只有两个人上课。,199505104525100015,日本,1,199505,记对我影响最大的一个人,50,60,57,59,63,269,未参加,
我认为最可怜的人是想法落[C]后的{CJ-zxy人}[BQ，]因为他们老以为今天总不如昨天，[BC：]这种人永远不能满意开心。,199505104922200085,美国,2,199505,记对我影响最大的一个人,95,60,60,42,30,278,未参加,
我现在已经毕业了。,199505104801100137,澳大利亚,1,199505,记对我影响最大的一个人,80,75,54,53,47,300,未参加,
我和我父亲还[C]有一个共同[C]点。,199505104523200176,韩国,2,199505,记对我影响最大的一个人,70,60,65,63,57,300,C,
现在，她在中国{CQ的}小学上四年级，[BC.]叫张瑞夏。[BC.],199505104525200189,日本,2,199505,记对我影响最大的一个人,60,70,68,67,53,303,C,
对我影响最大的一个人是我的外祖母。,199505104525200190,日本,2,199505,记对我影响最大的一个人,70,80,86,79,67,372,B,
从那天以后，她在图书馆里从早到晚一直自己学习，连周末也没出去玩。,199505104523200201,韩国,2,199505,记对我影响最大的一个人,75,55,70,69,49,303,C,
”{CD为[C]}一句话使我鼓起勇气，{CD推}到香港留学。,199505104525200212,日本,2,199505,记对我影响最大的一个人,75,75,65,48,65,318,C,
父母[C]亲[C]是两个人，所[C]以不符合考试[C]题目要求写的一个[C]人。,199505104525200310,日本,2,199505,记对我影响最大的一个人,70,65,57,53,59,290,未参加,
没有他，我相信也没有我的存在。,199508680519200512,马来西亚,2,199508,记对我影响最大的一个人,85,90,78,57,59,365,B,
他鼓励我[BQ、]激励我，重新为我增加{CC加重}信心，给我奖[B将]励。,199508683519200513,马来西亚,2,199508,记对我影响最大的一个人,85,90,52,65,57,345,C,
虽[F雖]然父母再三地{CC的}说明屋后[F後]的池塘是所谓[F謂]的小孩禁地，邻[F鄰]居的小孩们[F們]依然我行我素。,199508681519100524,马来西亚,1,199508,记对我影响最大的一个人,80,80,65,69,76,362,B,
要好好的维持一段婚姻是必需要双方都付出和努力的。,200010801501150016,中国,1,200010,我对离婚问题的看法,70,75,61,80,78,353,C,
父母吵架和离婚会带[B代]给孩子不健康的心灵成长。,200010801801250015,澳大利亚,2,200010,我对离婚问题的看法,85,70,94,85,85,410,B,
第二，工场或家庭排水的问题。,200005108525200293,日本,2,200005,关于用自然之声取代噪声的建议,65,70,50,60,54,285,C,
养牛时使牛听音乐就产生物量增加{CJjy}，{CQ给}很干的地方长的植物听雨声，就{CJ+zy有点}帮助{CJX}能过干期等已经{CQ在}生活中{CC上}能看得{CC其}到[C]。,200005108523200368,韩国,2,200005,关于用自然之声取代噪声的建议,65,60,78,78,50,314,C,
如果从我们的周围中听不到噪恼的汽车喇叭声那该多好！,200005108523200629,韩国,2,200005,关于用自然之声取代噪声的建议,70,70,64,65,63,320,C,
但我们有时误解自然的存在是什么，所以很多人轻视保护环境。,200005108525200646,日本,2,200005,关于用自然之声取代噪声的建议,65,65,48,67,59,288,C,
以我个[F個]人的观[F觀]点[F點]认[F認]为[F爲]，选择朋友应注意下列各点[F奌]：第一点[F奌]有高水平技能，这[F這]些人在社会上是有好地位，经商或是从[F從]事其他行业，他们的工作经验[F驗]是值得我们向他学习[F習]的，如一位好的老师[F師]能启[F啟]示学生走向成功之路。,199711801801100022,澳大利亚,1,199711,我选择朋友的标准,75,80,52,49,54,301,未参加,
朋友的地位身份其实不太重要，只要价[F價]值观相同，互相能认[F認]同对方，这些才是重要的。,199711802543200004,香港地区,2,199711,我选择朋友的标准,85,65,69,67,68,343,C,
当然我也喜欢郊区的那些自然环境。,199705104525100004,日本,1,199705,我的城市/乡村生活,75,65,52,65,68,312,C,
到山顶俯看城里的现代化建筑物能感到莫名其妙的快乐感[BQ。]我来到中国以后我家搬到汉城郊区的乡村{CD搬家}了。,199705104523100012,韩国,1,199705,我的城市/乡村生活,70,75,74,70,61,339,C,
今后我继续{CC续[C]继}在城市里生活，希望生活充实，而且能够寻找更多的快乐。,199705104525100007,日本,1,199705,我的城市/乡村生活,75,80,66,60,80,352,C,
想回国也是没面子的因为我想来这儿的。,199705104525100081,日本,1,199705,我的城市/乡村生活,65,60,55,67,39,269,未参加,
所以我妈妈总是很担心我的身体，但她从来没有阻止我到外边玩儿。,199705104523200097,韩国,2,199705,我的城市/乡村生活,60,60,69,70,77,318,未参加,
城里有很多学校，所以城里人在自己的城市里面可以接受教育。,199705104523200105,韩国,2,199705,我的城市/乡村生活,70,75,74,58,80,346,C,
特别是爷望看历史上杰出人物的故事。,199705104523200130,韩国,2,199705,我的城市/乡村生活,70,65,71,56,61,309,C,
但是看现在的我，和过去想象[B像]的我很不一样。,199705104540200138,印度尼西亚,2,199705,我的城市/乡村生活,80,80,66,67,80,365,B,
它集中了泰国国家经[F經]济、贸[F貿]易和政治于一身，同时[F時]也招引了千千万万的人流，使得曼谷生活非常的紧迫。,199705529529151016,泰国,1,199705,我的城市/乡村生活,90,50,83,65,90,366,未参加,
我的父亲[F親]是喝当地牛的奶长[F長]大的。,199705610610100013,法国,1,199705,我的城市/乡村生活,65,70,62,48,44,275,未参加,
连一句汉语{CC2话}也不会说{CD汉语}的我到中国学习，真是不容易。,199804123523200240,韩国,2,199804,学习汉语的苦与乐,70,65,30,49,36,236,未参加,
我想了半天才想起来的是[BQ“]不听懂[BQ”]。,199804124523100474,韩国,1,199804,学习汉语的苦与乐,65,60,57,57,40,262,未参加,
每个人勇敢地对付自己的困难的话，他最终{CC终于}{CJ-zy能}得到很宝贵的成果。,199904123523100077,韩国,1,199904,如何面对挫折,65,70,50,62,50,283,C,
我认为人遇到了困难或挫折，早晚要克服它。,199904123525100066,日本,1,199904,如何面对挫折,60,55,48,44,59,247,未参加,
那是我高中时候的事情。,199904123525100143,日本,1,199904,如何面对挫折,45,65,53,70,37,250,未参加,
我觉得这样怨天尤人是很自然的。,199904123523200149,韩国,2,199904,如何面对挫折,60,65,37,47,41,233,未参加,
我赶快就回家去后{CJZR}，哭着哭着怎么也停不了[L]眼泪。,199904123525200231,日本,2,199904,如何面对挫折,65,65,45,65,69,293,未参加,
比如说，如果我在学习方面遇到困难，自己要坐下来，好好地想一想办法。,199904123818100228,瓦努阿图,1,199904,如何面对挫折,65,75,48,37,32,244,未参加,
人在生活和工作中，总要遇到许多困难或挫折。,199904124523200298,韩国,2,199904,如何面对挫折,80,70,75,72,78,365,B,
人在生活和工作中是难免遇到困难或挫折的。,199904124529100301,泰国,1,199904,如何面对挫折,75,75,80,72,82,374,B,
但，现在我[BD，]不好意思跟妈妈说，我想妈妈也会对我失望。,199904124523200407,韩国,2,199904,如何面对挫折,60,65,70,57,50,285,C,
