错句,作文编码,国籍,性别,考试时间,作文题目,口试分数,作文分数,听力分数,阅读分数,综合分数,总分,证书
在这世界上有谁敢说会爱对方一辈子呢？,200103533533150028,新加坡,1,200103,我对离婚问题的看法,75,75,77,65,90,372,B,
”我一愣，怎么，我也会说不少北京土话了。,200109529529151007,泰国,1,200109,我的童年,75,80,72,75,98,391,B,
如今我自己和我的子女谈[F談]起我的童年都很骄傲{CC自傲}。,200110540540250023,印度尼西亚,2,200110,我的童年,70,95,63,47,74,342,C,
父母才从[B以]印尼抗日时期“焦土政策”的瓦砾中逃离家园来到这新建的难民集中区，由于物质缺乏，生活很艰苦，我的诞[B庭]生加重了家庭的负担，但也增添了家庭的乐趣。,200110540540250131,印度尼西亚,2,200110,我的童年,70,90,68,73,90,384,C,
我最小，也最乖巧，他也就最疼我。,200103680519201619,马来西亚,2,200103,我的童年,80,90,80,93,98,436,B,
因为现在社[B视]会{CD的}变得很快，工作也不好找，还是在现在年轻的时候学多{CJX}一些东西，将来肯定有好处的。,200104124635200229,俄罗斯,2,200104,一封写给父母的信,70,70,63,58,65,314,C,
然后写毕业论文，一切顺利的话[BQ，]六月就要毕业了。[BC，],200104124547100232,哈萨克斯坦,1,200104,一封写给父母的信,75,65,63,39,65,294,未参加,
周末时常常跟朋友到公园去看绿绿的大树，开开心。,200104124631200365,希腊,2,200104,一封写给父母的信,80,90,60,61,65,351,C,
我还有很多书要看，很多课程要复习，这一次考试我还会让你们为我感到骄傲[Pjiaoao]！,200104124631200365,希腊,2,200104,一封写给父母的信,80,90,60,61,65,351,C,
”妈妈，您一定要长寿，跟我们去国外旅游{CD吧}[BQ。]这个世界多么美丽啊{CC哪}！,200105550523250009,韩国,2,200105,一封写给父母的信,65,70,60,68,56,305,C,
[BD“]我爱的爸爸[BQ、]妈妈[BQ：]你们好！,200105550523150054,韩国,1,200105,一封写给父母的信,70,65,58,58,49,286,C,
再见！,200105550523250295,韩国,2,200105,一封写给父母的信,80,70,47,61,42,290,C,
我现在开始[B如]努力过我们的生活。,200105550523150333,韩国,1,200105,一封写给父母的信,65,65,41,44,36,235,未参加,
我以[B一]后一定改善我的习惯{CC夜性}。,200105550523250340,韩国,2,200105,一封写给父母的信,75,65,44,47,49,267,未参加,
说清楚{CC明的}很难。,200105550523250352,韩国,2,200105,一封写给父母的信,70,60,47,51,40,253,未参加,
好久没给你们写信{CQ了}。[BC.],200105550523250354,韩国,2,200105,一封写给父母的信,65,70,41,54,54,270,未参加,
”[BC┘]祝你们身体健康2001年5月子××上,200105550523150499,韩国,1,200105,一封写给父母的信,85,85,41,68,70,344,未参加,
但中国也开始这么长{CC3这怎}的长[F長]假期我也{CQ很}高兴。,200105212525200031,日本,2,200105,我的一个假期,65,65,37,16,39,206,未参加,
因为，到那儿我就看到了穿得十分漂亮的少数民族，我兴奋得连坐长途汽车的疲劳也忘掉了。,200105209525200062,日本,2,200105,我的一个假期,75,70,77,70,83,364,B,
我们到新疆的客什去了，一共旅游了四十天。,200105224525200008,日本,2,200105,我的一个假期,70,75,77,79,83,373,B,
这些地方都给我{CJ-sy留下了}难忘的印象。,200105209525200010,日本,2,200105,我的一个假期,80,75,82,72,90,390,B,
不然的话，每个人都不想去抬水，没有人主动地去挑水。,200105109525200725,日本,2,200105,由“三个和尚没水喝”想到的……,65,70,70,58,66,315,C,
现在的社会上，随着经济发展人的生活越来越发展。,200105109525200729,日本,2,200105,由“三个和尚没水喝”想到的……,65,65,66,80,86,346,C,
这个故事也在一定的程度上涉及到很多国家正在追求的民主主义。,200105109635100786,俄罗斯,1,200105,由“三个和尚没水喝”想到的……,75,70,68,64,88,354,C,
我又是长子。,200203522522150025,缅甸,1,200203,记对我影响最大的一个人,80,75,69,62,55,332,C,
我很尊敬{CC敬爱}妈妈。,200203522522150029,缅甸,1,200203,记对我影响最大的一个人,65,60,14,27,26,175,未参加,
我以为应该尽量避免安乐死。,200205204525100076,日本,1,200205,如何看待“安乐死”,65,70,44,63,65,293,未参加,
治疗不仅是治一种病，而是现代医学的实验，实践之场[F場]。,200205204525100076,日本,1,200205,如何看待“安乐死”,65,70,44,63,65,293,未参加,
“安乐死”可不可取，这个问题，我觉得非常难说，也要考虑宗教的问题。,200205204525200080,日本,2,200205,如何看待“安乐死”,75,75,60,72,70,342,B,
如果我有什么原因，我的脑子已经死的话，我不想靠{CC有}机械的帮助才活下去，[BC。]因为我已经不能跟人交流。,200205204525200102,日本,2,200205,如何看待“安乐死”,70,85,52,72,63,334,C,
在当代社会{CD上}，“安乐死”是一种复杂的问题之一。,200205204525100190,日本,1,200205,如何看待“安乐死”,65,55,33,65,37,237,未参加,
听朋友说，在荷兰现在已经在家里人和个人的同意下允许了{CJ+dy这些}“安乐死”{CJ+zxy的东西}。,200205209525100016,日本,1,200205,如何看待“安乐死”,75,70,33,58,54,279,未参加,
关键{CC观点}不在肉体要求，而在人的要求！,200205209525100100,日本,1,200205,如何看待“安乐死”,70,60,60,65,65,305,C,
也有人会认为，[BD：]，帮助安乐死是一种犯罪{CJjy}，是杀人罪，绝对不能赞成。,200205215525200024,日本,2,200205,如何看待“安乐死”,75,70,83,67,72,356,B,
如果遇到不肯让步或不愿沟通的家人怎么办？,200210540540250033,印度尼西亚,2,200210,如何解决“代沟”问题,75,70,84,89,88,395,B,
以前，男的成家的大约二十岁，女的成家大约十八岁。,200210540540150072,印度尼西亚,1,200210,如何解决“代沟”问题,60,70,48,69,44,276,未参加,
对我影响最大的是老师[B師]。,200203522522210017,缅甸,2,200203,记对我影响最大的一个人,75,65,24,48,70,269,未参加,
从这些人物的生活{CQ中}[BQ，]我们可以学习好多东西。,200205109631200448,希腊,2,200205,如何面对挫折,80,65,42,47,41,263,未参加,
然而当我还剩下最后两门{CC次}考试的时候，有一门课叫世界经济概论，是最容易的课，所以我想复习得{CC的}比往常多，争取得满分。[BC，],200205109520100888,蒙古国,1,200205,如何面对挫折,75,70,62,80,66,342,C,
听到这个消[B肖]息[BQ，]我决定{CC解决}{CC了}帮助妈妈。,200205109548100901,塔吉克斯坦,1,200205,如何面对挫折,70,65,42,36,48,247,未参加,
您两老身体状况还好吧？,200205680519250001,马来西亚,2,200205,一封写给父母的信,85,85,41,73,84,363,未参加,
在这学院里，有着无限的知识让我去探索，我也有着广阔的生活让我去开创，也许会有险峻，也许会有崎岖之路，但我相信着，一分耕耘便有一分收获。,200205680519150022,马来西亚,1,200205,一封写给父母的信,85,75,73,75,69,369,B,
您的健康远胜于那些还能赚回来的身外钱啊！,200205680519150023,马来西亚,1,200205,一封写给父母的信,90,80,70,75,88,398,B,
我也好想，好想能喝到您熬的汤！,200205680519250019,马来西亚,2,200205,一封写给父母的信,80,85,81,75,84,399,B,
其实，我可以说是幸运的。,200205680519250026,马来西亚,2,200205,一封写给父母的信,85,85,81,77,88,411,B,
在生活当中多数的作者多把尊敬的人{CJba}，都是在描述我们的“母亲”而我所喜欢的这本书是“我最尊敬的父亲”。,200305533533250006,新加坡,2,200305,我最喜欢读的一本书,65,65,47,51,49,261,未参加,
他很懂得收买人心。,200305533533150041,新加坡,1,200305,我最喜欢读的一本书,70,65,68,65,90,344,C,
我最喜欢读[C]的一本书，是金庸所写的武侠小说《[BC“]射雕英雄传》[BC”]。,200305533533150047,新加坡,1,200305,我最喜欢读的一本书,65,70,66,84,83,354,C,
而且，跟中国人交流时，互相用第二语言说话，我觉得了解对方{CC对象}的意思更难。,200304131525200104,日本,2,200304,我学汉语是为了……,60,65,53,60,74,295,未参加,
学二胡{CQ过程}当中我理解了中国音乐的伟大。,200304131525200151,日本,2,200304,我学汉语是为了……,65,65,27,54,35,230,未参加,
也许会感到好像自己是机器人。,200305576525200030,日本,2,200305,静音环境对人体的危害,70,70,71,68,77,344,C,
我们{CJX}如果看到某一个人在禁止吸烟的公众场所吸烟的话[BQ，]{CQ我们}不能旁观[BD，]不去管，而应该有意识地去提醒他。,200405109520200966,蒙古国,2,200405,吸烟对个人健康和公众利益的影响,90,65,74,64,79,363,C,
上瘾了一天不抽就好象身体不舒服。,200405109540200094,印度尼西亚,2,200405,吸烟对个人健康和公众利益的影响,85,85,70,83,70,388,B,
但是，因经济上的因果关系[B係][BD，]而引起{CC引导}了别的问题{CD了}。,200405109634101840,英国,1,200405,吸烟对个人健康和公众利益的影响,70,65,45,37,50,253,未参加,
就算不为自己的健康着想，烟民们，请为了你们最爱的人而戒烟吧！,200405204519100095,马来西亚,1,200405,吸烟对个人健康和公众利益的影响,70,75,85,80,92,391,B,
再说，一个人生了重病，给自己、[BC，]亲人及社会带来的经济负担及责任都是极大的。,200405217533200091,新加坡,2,200405,吸烟对个人健康和公众利益的影响,80,75,85,82,92,405,B,
烟会伤害人们的健康与自然环境。,200405212529100021,泰国,1,200405,吸烟对个人健康和公众利益的影响,75,70,55,39,74,302,未参加,
有些学生呢{CC吗[F嗎]}[BQ，]为了表示他是真正{CC真真}的少男[BQ，]用{CJ+buy起来}吸{CJ-by烟}显[B现]示他们多帅[F帥]。,200405522522150003,缅甸,1,200405,吸烟对个人健康和公众利益的影响,75,65,30,58,37,252,未参加,
希望{WWJ},200405522522250008,缅甸,2,200405,吸烟对个人健康和公众利益的影响,85,85,63,60,75,363,C,
除了父母[C]的兴趣爱好、思想观念、行为之外，他们的素质也会对孩子有影响。,200505109525100205,日本,1,200505,父母是孩子的第一任老师,70,70,53,56,71,308,C,
尤其是母亲一般似乎每天都跟孩子在一起，一起吃饭、一起去买东西、一起睡觉什么的。,200505109525200407,日本,2,200505,父母是孩子的第一任老师,75,85,65,67,76,361,B,
但是我觉得[BD：]“父母是孩子的第一{CJ+dy个}任老师”这句话非常有道理。,200505109525100530,日本,1,200505,父母是孩子的第一任老师,65,50,58,38,48,240,未参加,
我家里响的不是电视的声音，而是家里人的说话声{CC3话声}和笑声。,200505109525200702,日本,2,200505,父母是孩子的第一任老师,65,85,60,74,79,353,C,
还有，我父亲特别喜欢滑雪，所以我和弟弟从小开始学滑雪。,200505109525200722,日本,2,200505,父母是孩子的第一任老师,60,65,28,70,64,270,未参加,
他们凭的就是他们的记忆。,200505217525200212,日本,2,200505,父母是孩子的第一任老师,60,50,54,77,83,304,未参加,
论[C]人的影响一定父母给他的影响最深{CJs}，因为父母{CJX}还是接触[B处]孩子的时间自然地会长[C]。,200505204525200174,日本,2,200505,父母是孩子的第一任老师,60,70,67,71,80,333,C,
所以我去外面回来时，没有人在家。,200505204525200193,日本,2,200505,父母是孩子的第一任老师,75,70,46,69,69,318,C,
我想一般[C]在小孩子的眼中的父母的形象是跟我一样的。,200505204525200252,日本,2,200505,父母是孩子的第一任老师,65,55,58,55,69,284,C,
尊敬的年轻人很多。,200505204525100380,日本,1,200505,父母是孩子的第一任老师,65,60,37,45,52,242,未参加,
从现在{CQ起}{CJ-zhuy我}也想继续[C]学他们的教训。,200505204525100541,日本,1,200505,父母是孩子的第一任老师,60,60,39,37,52,230,未参加,
父母是最早对孩子的成长产生重大影响的人，在这个意义上，可以说“父母是孩子的第一任老师。,200505204525200539,日本,2,200505,父母是孩子的第一任老师,80,90,65,83,91,404,B,
这样看来，父母的影[C]响，对我来说很重大。,200505204525100578,日本,1,200505,父母是孩子的第一任老师,55,70,63,61,67,300,C,
一九九七年他过世了，[BC。]我们按他的要求把他的骨灰{CC户尘}带回中国，埋藏在永定。,200105205540200043,印度尼西亚,2,200105,我的一个假期,65,80,42,46,68,289,未参加,
上大学以后呢，我心里有两种感受{CC感情}。,200112576525200002,日本,2,200112,如何面对挫折,65,70,62,69,74,326,C,
我去过很多地方，[BC。]如北京、[BC，]西安、[BC，]昆明、[BC，]上海等等。,200105271525200071,日本,2,200105,我的一个假期,65,80,52,37,48,270,未参加,
但是，我不会说明自己发现{CC感到}{CQ的}问题，这个意思是并不是不敢开口而是表现不出来。[BC，],200105217525100059,日本,1,200105,我的一个假期,50,60,52,44,55,241,未参加,
现在也{CJX}我还没决定以后怎么办。,200105217525200072,日本,2,200105,我的一个假期,65,60,67,56,41,272,未参加,
我没有告诉{CC2说}过你们跟这事有关{CQ的}我的想法。,200105550523150089,韩国,1,200105,一封写给父母的信,65,70,36,35,49,241,未参加,
我当交换学生去中国留学可能是最大的一件事。,200105550523250099,韩国,2,200105,一封写给父母的信,70,70,71,73,67,339,C,
古人说，风树之叹[F歎]。,200105550523150101,韩国,1,200105,一封写给父母的信,70,65,49,54,56,280,C,
最后我希望你们的健康此止{CJ？}。,200105550523150112,韩国,1,200105,一封写给父母的信,80,65,60,56,58,307,C,
因此我一边学习一边找工。,200105550523250108,韩国,2,200105,一封写给父母的信,65,70,79,58,54,312,C,
我这儿的生活很好，房东给我们租房的学生做菜，供早餐和晚餐，菜做得特别好吃，而且她的老家{CC老乡}和我们不一样，不过能做出地道的我们老家菜。,200105550523150122,韩国,1,200105,一封写给父母的信,90,75,77,68,81,385,B,
习惯了吗？,200105550523250127,韩国,2,200105,一封写给父母的信,75,70,60,49,49,292,C,
因此我一直惶恐不安。,200105550523250174,韩国,2,200105,一封写给父母的信,65,65,22,30,29,195,未参加,
我已经长大了。,200105550523250228,韩国,2,200105,一封写给父母的信,70,65,52,61,65,299,C,
故宫{CD来说}很美丽也很{CC2还}雄伟。,200105550523150396,韩国,1,200105,一封写给父母的信,70,70,36,51,56,271,未参加,
现在是5月份，树叶茂[C]盛，野花芬芳的时期{CD了}。[BC，],200105550523250397,韩国,2,200105,一封写给父母的信,75,80,66,63,74,349,C,
汉城也{CD是}快要夏天了吧。,200105550523250400,韩国,2,200105,一封写给父母的信,70,70,49,51,61,289,未参加,
只要坐[B座]飞机{CD得}三至四[B西]小时，就到达汉城[BQ。]可以看见{CC遇见}家人。,200105550523250400,韩国,2,200105,一封写给父母的信,70,70,49,51,61,289,未参加,
每次想起爸爸、妈妈，我的心就{CJ-zy很}温暖{CC暖和}{CD了}。,200105550523250400,韩国,2,200105,一封写给父母的信,70,70,49,51,61,289,未参加,
这样写给你们的信{CC事}就是今天考试的题目。[BC，],200105550523250409,韩国,2,200105,一封写给父母的信,75,65,49,51,61,288,未参加,
你们{CC宝贵}的女儿××,200105550523250409,韩国,2,200105,一封写给父母的信,75,65,49,51,61,288,未参加,
那句话你还记得吗？,200105550523250452,韩国,2,200105,一封写给父母的信,70,70,52,42,61,283,未参加,
妈妈你想像{CJ-buy一下}我们的将来多么美丽啊！,200105550523150501,韩国,1,200105,一封写给父母的信,65,65,66,44,42,266,未参加,
其实我什么也{CQ没}丢失。,200105206525200034,日本,2,200105,我的一个假期,65,70,50,56,55,282,C,
除了没有钱和{CC1或者}累得要命{CQ的}时候以外，我活动得{CC地}十分活跃。,200105206525100042,日本,1,200105,我的一个假期,65,65,37,61,50,262,未参加,
由于过分的依靠心理[B里]，而造成三个人都遭受损失的后果。,200105109525100022,日本,1,200105,由“三个和尚没水喝”想到的……,70,85,70,69,86,372,B,
不喝水就不能活下去。,200105109525200111,日本,2,200105,由“三个和尚没水喝”想到的……,65,70,45,64,44,274,未参加,
“三个和尚没水喝”让我想到的是“[BC「]踌躇不前”[BC」]{CD的}四个字。,200105109525200222,日本,2,200105,由“三个和尚没水喝”想到的……,65,65,54,64,57,289,C,
在武汉玩儿几天以后我要去广州，[BC。]但是那时也买不到火车票，[BC。]于是我决定坐大巴去广州。,200105109525100240,日本,1,200105,由“三个和尚没水喝”想到的……,70,70,59,77,59,323,C,
因为当和尚只有一个人住在一座高山的庙里时，如果他自己不到山底下挑水，就不能活下去。,200105109525100369,日本,1,200105,由“三个和尚没水喝”想到的……,60,60,43,55,55,255,未参加,
这样，对自己有什么意义呢？,200105109525200427,日本,2,200105,由“三个和尚没水喝”想到的……,85,70,82,66,75,369,B,
有一个和尚来到了一座庙里。,200105109525200652,日本,2,200105,由“三个和尚没水喝”想到的……,65,60,57,64,59,288,未参加,
我们一出生，就要学会如何跟周围的人处理[B里]关系。,200105109635200653,俄罗斯,2,200105,由“三个和尚没水喝”想到的……,65,65,70,47,57,288,C,
谁都不去山下抬水的话，怎么解决这个问题呢？,200105109525200673,日本,2,200105,由“三个和尚没水喝”想到的……,70,70,36,71,84,319,未参加,
虽然家人并不愿意让他{CD杀}死，但他们不忍心{CC3不能}继续看丈夫痛苦的样子{CQ了}，[BC。]于是他们[L]不得不让他死去。,200205217525100055,日本,1,200205,如何看待“安乐死”,65,65,49,60,63,286,C,
日本的法院还是一般不支持进行安乐死的人。,200205205525200022,日本,2,200205,如何看待“安乐死”,70,70,77,65,91,361,C,
坦率地说[BQ，]我觉得“安乐死”就是犯罪行为。,200205206525100003,日本,1,200205,如何看待“安乐死”,75,70,52,56,51,293,C,
医生也没法子了，只好同意老妇人，就让病人安乐死了。,200205206525200010,日本,2,200205,如何看待“安乐死”,80,75,55,51,51,303,未参加,
采取安乐死的时候最重要的是患者的人权。,200205206525200048,日本,2,200205,如何看待“安乐死”,70,70,74,65,68,335,C,
他们宁可让他安稳地{CD送}到天堂里去。,200205206525200082,日本,2,200205,如何看待“安乐死”,75,70,63,81,77,355,C,
一般与不认识的人打交[B教]道[C]时，也需要一定的时间，一开始会觉得没有意思，跟他的沟通与交流很困难，但时间{CD越来}越长，共同的话题越多，就使人和人之间的关系[C]更好。,200209550523250006,韩国,2,200209,如何解决“代沟”问题,65,70,60,84,66,331,C,
这几十年，社会的风气{CC气风}、生活方式已经剧烈{CC猛烈}地改变了。,200209550523250009,韩国,2,200209,如何解决“代沟”问题,75,70,57,64,68,323,C,
而且我也应该[B刻]跟她多说话。,200209550523250020,韩国,2,200209,如何解决“代沟”问题,65,65,81,79,74,348,C,
还有现代年轻人也是以自己的父亲母亲，甚至于爷爷奶奶的看法做自己的思想的基础[B楚]，而且考虑上一辈人的立场，那个代沟问题是不太{CJ-zxy难}解决的问题。,200209550523150033,韩国,1,200209,如何解决“代沟”问题,65,70,72,74,64,331,C,
所以父母和子女，或着老人和年轻人之前有不同的地方是自然{CC2顺其自然}的。,200209550523250031,韩国,2,200209,如何解决“代沟”问题,65,65,51,52,38,255,未参加,
我觉得通过真正的对话，他们能够了解[C]彼此{CC互相}之间的问[B间]题。,200209550523250044,韩国,2,200209,如何解决“代沟”问题,65,60,66,54,52,280,C,
此外{CQ应该}使他们知道休闲的重[C]要性[BQ，]以了解年轻[C]人的生活及价值[C]观。,200209550523250050,韩国,2,200209,如何解决“代沟”问题,70,70,94,76,90,388,C,
比如你的孩子喜欢流行音乐，那你也试一试{CJcd}听，如果你的爸爸不能了解你的消费观念[C]的话，你自己去赚[B镰]点钱[C]。,200209550523250101,韩国,2,200209,如何解决“代沟”问题,60,60,63,62,54,281,未参加,
旧时代的人还没适应新社会。[BC，],200209550523250105,韩国,2,200209,如何解决“代沟”问题,60,70,54,76,70,315,未参加,
所以，两代人一起拥有娱[C]乐活动{WWJ},200209550523250136,韩国,2,200209,如何解决“代沟”问题,65,60,66,57,64,295,C,
了解双方原来有的差异以后，为了根本地{CC的}解决代沟问题，还需要对话。,200209550523250145,韩国,2,200209,如何解决“代沟”问题,70,60,69,52,58,294,未参加,
还存在很多问题{CC代沟}。,200209550523250178,韩国,2,200209,如何解决“代沟”问题,65,60,60,54,42,264,未参加,
因为西方国家的父母对于孩子的所有问题{CJ-zy都}先跟孩子谈谈[BQ，]并且{CC还有}听孩子的心里话。,200209550523250187,韩国,2,200209,如何解决“代沟”问题,60,60,66,64,38,270,未参加,
年纪大的人也有年青[C]的时期，年青人也会老。,200209550523250231,韩国,2,200209,如何解决“代沟”问题,65,60,63,57,64,292,C,
随[C]着社会的发[C]展与变化，父母与子女之间存在的“代沟”成为引人注目的话题。,200209550523250245,韩国,2,200209,如何解决“代沟”问题,70,70,85,67,70,350,C,
那如何解决“代沟[C]”问题？,200209550523150279,韩国,1,200209,如何解决“代沟”问题,65,60,45,59,60,272,未参加,
但这还需要我们{CD的}用心做事。,200209550523250282,韩国,2,200209,如何解决“代沟”问题,70,65,81,84,64,350,C,
沟通交流，代沟就没有了。,200209550523250302,韩国,2,200209,如何解决“代沟”问题,70,75,72,84,76,366,B,
过去的时候，子女和父母之间的这种“代沟”现象很少。,200209550523250333,韩国,2,200209,如何解决“代沟”问题,80,65,60,74,72,339,C,
由于两代人的时代不同，所以在思想方面上理解也不同。,200209550523250769,韩国,2,200209,如何解决“代沟”问题,60,65,51,37,46,242,未参加,
现代社会文明把年青人与父母分隔{CC5分隔在父母上}了。,200209550523250818,韩国,2,200209,如何解决“代沟”问题,70,70,51,74,50,303,C,
爸爸呢以后不说“女的一定要早点回家”了。,200209550523250905,韩国,2,200209,如何解决“代沟”问题,65,65,39,59,52,264,未参加,
随着社会的发展，两代人之间的矛盾也越来越深化。,200209550523150954,韩国,1,200209,如何解决“代沟”问题,70,70,78,79,74,359,C,
上一辈，就是我们的父母，他们所拥有的价值观与今天的晚辈所拥有的价值观之差异导致了“代[C]沟”问题。,200209550523150954,韩国,1,200209,如何解决“代沟”问题,70,70,78,79,74,359,C,
可是答案不是只有一个。,200209550523250949,韩国,2,200209,如何解决“代沟”问题,65,65,39,49,50,252,未参加,
为什么呢？,200209550523250958,韩国,2,200209,如何解决“代沟”问题,65,70,63,59,54,297,C,
如果法律不惩罚你的话，谁都可以随意地杀人了。,200205271525200002,日本,2,200205,如何看待“安乐死”,70,75,58,63,68,323,C,
这是现代社会中的很微妙的问题。,200205271525200066,日本,2,200205,如何看待“安乐死”,70,80,74,83,72,369,B,
在我们的日常生活中，每一件事物[BD，]或者是每一种东西，对我们来说，都有好处[BD，]也有坏处。,200304522522150023,缅甸,1,200304,静音环境对人体的危害,65,90,59,67,87,359,C,
事事难[F難]料嘛。{CD又},200304522522250022,缅甸,2,200304,静音环境对人体的危害,65,75,48,42,74,291,未参加,
没有变化，怎么会有当今科技日新月异的变化？,200307109523100009,韩国,1,200307,绿色食品与饥饿,70,50,75,30,35,243,未参加,
我认为这个问题很重要。,200307109523200014,韩国,2,200307,绿色食品与饥饿,65,65,78,35,44,271,未参加,
食品的[BQ“]绿色革[B菜]命[BQ”]正在兴起。,200307109523200115,韩国,2,200307,绿色食品与饥饿,90,95,86,80,100,449,A,
可是农作物会受到不同程度的化学污[C]染，也会害{CQ于}人的健康。,200307109540200118,印度尼西亚,2,200307,绿色食品与饥饿,65,70,54,35,76,286,未参加,
这[C]样的话，我们可以提高人们的健康素质。,200307109540200118,印度尼西亚,2,200307,绿色食品与饥饿,65,70,54,35,76,286,未参加,
买[B卖]食物时不只是想着吃，[BC、]还{CC1一边}想着这种{CC个}食品对人体哪[B那]个方面有好处还是害处。,200307109523100133,韩国,1,200307,绿色食品与饥饿,65,60,70,43,56,277,未参加,
人类可以通[C]过[C]研发各种技术[B木]来解决“绿色食品”带来的产量降低的问题{CC后果}。,200307109523100138,韩国,1,200307,绿色食品与饥饿,80,90,83,78,90,416,A,
这就是[BQ“]绿色食品[BQ”]。,200307109523100152,韩国,1,200307,绿色食品与饥饿,60,55,62,51,58,267,未参加,
人如果吃了使用化肥的食物，只会{CC只是}有害于健康。,200307109523100154,韩国,1,200307,绿色食品与饥饿,85,85,83,67,81,396,B,
