错句,作文编码,国籍,性别,考试时间,作文题目,口试分数,作文分数,听力分数,阅读分数,综合分数,总分,证书
虽然我同意男女分班，但在一些情况下也会有例外。,200504534533250105,新加坡,2,200504,我对男女分班的看法,70,75,73,76,79,362,B,
当然女子中学在中国的出现也不仅仅只为避免早恋。,200504534533250115,新加坡,2,200504,我对男女分班的看法,75,80,84,71,88,389,B,
其实男女同班是可以继续的。,200504534533150141,新加坡,1,200504,我对男女分班的看法,60,70,70,67,68,320,C,
与其他的同学[C]相比，有很多不成熟之[C]处。,200505109525100991,日本,1,200505,父母是孩子的第一任老师,65,65,60,62,78,314,C,
因为使先[C]天性的能力发展的是环境，一个[C]人受的教育、交往的人、看的东西都有极大的影响力。{CP虽然一个[C]孩子生来有的能力很好，如果他没受好教育的话，他的能力却无法发展的。P},200505109525201089,日本,2,200505,父母是孩子的第一任老师,60,80,73,78,76,354,C,
具体来说，对中国大学生和日本大学生问关于他们的未来打算{CJ-zxy的问题}。,200505109525101365,日本,1,200505,父母是孩子的第一任老师,75,70,64,64,71,333,C,
所[C]以[C]说[C]，父母是孩子的第一任老师，也是第一个恩[C]人。,200505109525101399,日本,1,200505,父母是孩子的第一任老师,70,85,85,66,69,367,B,
他们的目的就是为了我开阔眼界{CJjy}。,200505109525201906,日本,2,200505,父母是孩子的第一任老师,55,75,41,55,52,263,未参加,
但是我觉得第一句话是“妈妈”。,200505109525102002,日本,1,200505,父母是孩子的第一任老师,60,60,50,49,76,277,未参加,
孩子容易受[C]到父母的影响。,200505109525201979,日本,2,200505,父母是孩子的第一任老师,60,65,50,49,61,268,未参加,
我个人认为当我看到别人的时候，就能猜出来他的父母是什么样的人。,200505109525102013,日本,1,200505,父母是孩子的第一任老师,75,65,50,53,54,284,未参加,
“孩子是一张白纸”。,200505109525202099,日本,2,200505,父母是孩子的第一任老师,70,60,61,67,72,315,C,
[BD《]父母是孩子的第一任老师[BD》]父母是孩子的第一任老师，这句话是完全对的。,200505109525202474,日本,2,200505,父母是孩子的第一任老师,65,70,48,67,72,308,C,
如果他们常常看书并且{CC2而}强调看书的重要性，[BC。]我们也会重视[F視]看书{CC2看不看}。[BC，],200505109922102598,美国,1,200505,父母是孩子的第一任老师,80,60,54,47,56,284,未参加,
孩子不但经[F經]过[F過]父亲[F親]和母亲[F親]的指导[F導]学[F學]怎么[F麽]用语[F語]言来表达[F達]自己的思想和意思，而且他对[F對]家里和家里以外{CC4家外}的人和事物的感情和态[F態]度都是先受{CC由}父母的影响而产[F産]生的。,200505109922202599,美国,2,200505,父母是孩子的第一任老师,80,55,61,41,43,266,未参加,
我也很感谢我的父母，他们是我最好的老师，也是我最佩[C]服，最爱的人。,200505271636200045,乌克兰,2,200505,父母是孩子的第一任老师,75,70,35,41,61,271,未参加,
第三种[F種]感情是一种[F種]激情。,200505951922250001,美国,2,200505,最理想的结交方式,85,75,82,66,84,384,B,
再看看那些从小一起长大，然后选择对方成为自己终身伴侣的那些男女，他们当中有的过着幸福美满的生活，有的却相反，但是觉得他我们都是幸福的，因为他们都{CD有}曾为{CC被}某一个人所爱，也曾经付出过真挚[B执]的爱情。,200505522522210008,缅甸,2,200505,最理想的结交方式,65,65,88,77,97,376,C,
但到了成年时，能与那小时一起哭过、笑过的人{CJ+zy能在一起}结婚，那将是一件多么快乐的事啊！,200505522522110017,缅甸,1,200505,最理想的结交方式,65,75,84,64,88,363,C,
从教他说话，教他走路，到教他唱歌、写字等，每每都离不开父母无微不至的照顾和精心{CJ+dy理[C]意}的教导。,200505201542200068,越南,2,200505,父母是孩子的第一任老师,95,75,67,51,89,372,C,
每一个孩子一定有父母，我们的父母就是我{CC他}们的老师。,200505332540200030,印度尼西亚,2,200505,父母是孩子的第一任老师,60,65,50,45,52,255,未参加,
27B，光明山道新加坡邮区574034快乐家庭旅游公司人事部经理李经理：应征导游一职本人×××，女性，自二00一年从国立大学毕业后，参加了一年的导游培训课程。,200509534533250017,新加坡,2,200509,一封求职信,80,85,75,58,79,371,B,
贵公司在我国是数一数二的旅游公司，希望借此能为贵公司效[C]劳。,200509534533250047,新加坡,2,200509,一封求职信,80,65,77,75,88,373,B,
我自小就对旅游产生了浓厚的兴趣。,200509534533250134,新加坡,2,200509,一封求职信,70,70,63,66,82,339,C,
不仅如此，我还精通日文，能说出一口流利的日语。,200509534533250162,新加坡,2,200509,一封求职信,85,70,82,69,86,383,B,
如今，有这么一个千载[B裁]难逢的机会，我一定会好好把握。,200509534533150182,新加坡,1,200509,一封求职信,65,65,70,66,84,334,C,
可是这种情况并不乐观。,200510111523200013,韩国,2,200510,我看流行歌曲,55,65,70,56,72,300,C,
一般来说，流行歌曲{CD是}对成年人比较合适[B式]，而童谣歌曲适合小孩听。,200510111523200017,韩国,2,200510,我看流行歌曲,70,70,65,38,55,286,未参加,
比如，一些歌曲让人太悲[C]痛或主[C]动陷[Pxiǎn]入黑暗的空间。,200510111523200017,韩国,2,200510,我看流行歌曲,70,70,65,38,55,286,未参加,
流行歌，我认为这是像一首诗一样。,200510111523100413,韩国,1,200510,我看流行歌曲,65,70,46,42,64,273,未参加,
总[C]之我觉得流行歌是一个跟流行的一个方法。,200510111523100413,韩国,1,200510,我看流行歌曲,65,70,46,42,64,273,未参加,
而说实话我对流行歌曲的看法是有点很容易过时{CC过[C]去}的一种文化{CJZR}。,200510111523100771,韩国,1,200510,我看流行歌曲,50,65,49,40,42,227,未参加,
又贵{CD又}机会也少，自然地{CC的}不喜欢听了。,200510111523200772,韩国,2,200510,我看流行歌曲,85,70,67,75,84,372,C,
因此，我对流行歌曲并不太熟悉，朋友们谈流行歌曲和她们最喜欢的歌星时[BQ，]{CJ+zhuy我}不知到她们说的是什么，觉得没有意[C]思[C]。,200510111626200711,瑞典,2,200510,我看流行歌曲,85,95,60,61,74,371,C,
最后，我唱流行歌的时候，觉得好像{CJX}我年轻多了，{CD就}让我感到我不是年老{CC古老}的、[BC，]传统的人，而是很时尚的人。,200510111523100811,韩国,1,200510,我看流行歌曲,80,80,70,65,72,359,B,
所以流行歌曲应该继续发展还需要社会各界的支[B技]援[B缓]{CJZR}。,200510111523200807,韩国,2,200510,我看流行歌曲,65,65,81,56,79,330,C,
下面我就来谈一谈我对流行歌曲的看法。,200510111523100822,韩国,1,200510,我看流行歌曲,65,85,60,52,72,324,C,
二则，我能够加入时尚潮流。,200510111523200826,韩国,2,200510,我看流行歌曲,75,80,72,52,82,352,C,
这不同的流行既反映国家的文化特色，又反映个人与社会的矛[B予]盾、[BC，]个性，不同的价直[B真]观[BQ、]幸福观等等。,200510111523200879,韩国,2,200510,我看流行歌曲,55,90,53,40,67,294,未参加,
有的人认为现代的年青人对自己喜欢的歌星的态度已达到了痴迷的程度，流行歌曲是个根本不值得听的{CJ-zxy歌曲}。,200510111523200893,韩国,2,200510,我看流行歌曲,65,75,49,46,59,281,未参加,
我小时候，我也特别喜欢听我喜欢{CQ的}歌手的歌，很喜欢流行的歌。{CP流行歌曲总是有着非常多的听众，有人非常蔑视流行歌曲。P},200510111523101101,韩国,1,200510,我看流行歌曲,55,65,51,28,47,228,未参加,
比如{CC如比}说2002年韩.日世界杯足球的时候有了鼓[Pgǔ]励[B力]韩国足球队的歌。,200510111523201100,韩国,2,200510,我看流行歌曲,65,70,60,50,50,281,C,
为了看自己喜欢的明[B名]星，等了很长时间。[BC，],200510111523101280,韩国,1,200510,我看流行歌曲,60,65,49,40,42,239,未参加,
我是那有些人中之[L]一{CJZR}。,200510111523201847,韩国,2,200510,我看流行歌曲,65,65,37,46,50,247,未参加,
流行歌曲的歌词是反映现代社会的状况和现在活着的人们的心理的，[BC。]不是跟我们的生活没关系的。,200510111523201849,韩国,2,200510,我看流行歌曲,60,60,51,56,64,273,未参加,
还有些人不喜欢流行歌曲的原因之一是这样的人。,200510111523201861,韩国,2,200510,我看流行歌曲,65,60,42,32,57,239,未参加,
现在在韩国很多年经人喜欢流行歌曲，所以常常听和{CC而}唱[B昌]，我也其中之一{CJs}。,200510111523201876,韩国,2,200510,我看流行歌曲,80,60,39,36,42,244,未参加,
像[B象]之前台湾[F灣]歌手张[F張]雨生，就唱有一些观点正确的歌，听了对人生与生活{CD上}多有帮助。{CP{CD如},200510512512150037,菲律宾,1,200510,我看流行歌曲,75,95,81,67,57,369,B,
我是一个非常喜欢流行的人，特别{CJX}我也喜欢流行歌。,200510205801200074,澳大利亚,2,200510,我看流行歌曲,90,75,63,42,74,338,C,
同时，家长所信仰的主义，一般也都会传给孩子。,200510956501130001,中国,1,200510,父母是孩子的第一任老师,90,95,77,68,88,416,B,
我也给我弟弟唱歌。,200510520520250002,蒙古国,2,200510,我看流行歌曲,65,80,51,40,47,271,未参加,
它起源于什么时期？,200510520520250009,蒙古国,2,200510,我看流行歌曲,80,75,77,65,91,379,B,
所以{CQ以}这样的原因来喜欢流行歌曲是不对的。,200510302523100001,韩国,1,200510,我看流行歌曲,80,60,49,22,35,233,未参加,
我是一个韩国人，我这个人很喜欢音乐，还有我的大学目标是音乐系。,200510302523100005,韩国,1,200510,我看流行歌曲,80,70,65,38,55,298,未参加,
”我得出一个结论：[BC，]在一群人中，只要一些人做出一些行为，其他[B它]人也被他们感染，也跟着做起来。,200510302523100047,韩国,1,200510,我看流行歌曲,90,75,72,73,91,395,B,
我是中学生，不知{CQ是不是}因为我是喜爱流行、时尚的人，但我认为流行歌曲是一种自己享受快乐的{CD一种}方法。,200510302523200094,韩国,2,200510,我看流行歌曲,60,75,67,46,62,296,未参加,
我也喜欢流行歌曲，现在我国甚至中国和日本等国家很有受欢迎的歌手都成为我的业余[B于]时的前途着{CJ？}，在上学路上、[BC，]放学时、[BC，]睡觉时都带着MP3去听、[BC，]唱，这样学习时的压力都飞到天空上去了。,200510302523200107,韩国,2,200510,我看流行歌曲,75,60,77,46,82,326,未参加,
总之，流行歌曲是应该要发展的。,200510302523200135,韩国,2,200510,我看流行歌曲,65,70,51,40,74,286,未参加,
它需要给人们思考的[B地]余地来创出新的音乐，[BC。]它还需要给青少年有益的内容。,200510302523100222,韩国,1,200510,我看流行歌曲,75,75,81,63,79,363,B,
不重视{CJ+zy在}歌曲的{CC得}好坏而重视{CJ+zy在}歌手{CD的身上}，[BC。]就是说不是因为歌曲好所以喜欢歌手，而是喜欢歌手所以就喜欢那首歌曲的意思。,200510302523200229,韩国,2,200510,我看流行歌曲,60,45,63,48,62,256,未参加,
我建议，{CD如果}学习外国语的人，天天听流行歌曲，{CJ+zy这时}，{CQ对}学习方面，文化方面[C]很大的帮助{CJy}。,200510302523200240,韩国,2,200510,我看流行歌曲,75,70,42,34,50,260,未参加,
现在许多男孩子非常喜欢听，[BC、]还有受了HipHoP的衣服风格{CJ-zxy的影响}。,200510501529200076,泰国,2,200510,我看流行歌曲,70,65,51,38,50,260,未参加,
随着年龄的增长[L]，我对流行歌曲的价值观也较年轻时有了不少变化。,200510529529151009,泰国,1,200510,我看流行歌曲,95,85,60,65,84,387,C,
流行歌曲总是要[C]听{CJsd}，对我自己来讲，我不会把我一生{CC一身}宝贵的时间花在这些无聊[B辽]的歌曲上。,200510532529150001,泰国,1,200510,我看流行歌曲,70,65,39,42,52,254,未参加,
40年前，学校被关闭我才读六年级，但我是在爱国家庭里长大的，所以至今{CD到后}我还是喜欢发扬中国民族音乐和舞[B午]蹈，因为现在我最小的女儿还很喜欢跳民族舞[B午]呢，在我的汉语补习班里，我就时常教学生们唱新中国歌曲，还教他们儿歌。,200510540540200070,印度尼西亚,2,200510,我看流行歌曲,50,80,60,36,69,280,未参加,
身为一个现代女性，我认为男女之间最理想的相识方式应该是从{CQ与}自己有同样生活背景和文化{CJ-zxy的人}中去认识对方{CJy}。,200505680519250009,马来西亚,2,200505,最理想的结交方式,70,85,70,71,93,381,B,
由此可见[F見]，父母的重要性不仅[F僅]在[L]于[F於]身为[F為]孩子们[F們]的养育者[BQ，]而且{CC但}父母们[F們]也是孩子出生时第一次看到和接近的人——[BC-]父母是孩子们[F們]的第一位老师[F師]。,200509602801250006,澳大利亚,2,200509,父母是孩子的第一任老师,80,70,80,88,84,392,B,
孩子对好与坏的观念就是从父母那里学的。,200509602801250013,澳大利亚,2,200509,父母是孩子的第一任老师,0,80,74,85,94,330,未参加,
但是我希望每个人都想好{CJX}先再结婚，[BC。]怎么认识那个人并不重要。,200505651634150001,英国,1,200505,最理想的结交方式,85,65,39,44,53,275,未参加,
所以我努力{WWJ},200104124525200028,日本,2,200104,一封写给父母的信,65,75,38,56,42,263,未参加,
还好吧！,200104124542200026,越南,2,200104,一封写给父母的信,80,80,60,51,54,317,C,
祝身体健康，天天好心情！[BC。],200104124523100074,韩国,1,200104,一封写给父母的信,75,60,68,54,45,288,C,
谢谢。,200104124525100118,日本,1,200104,一封写给父母的信,65,55,36,37,42,217,未参加,
妈！,200104124523100156,韩国,1,200104,一封写给父母的信,70,75,38,39,47,258,未参加,
还有他们俩是国际结婚呢！,200104124525200154,日本,2,200104,一封写给父母的信,65,80,58,68,49,308,C,
其实，去年刚刚到北京的时候觉得{CJ-zy很}害怕。,200104124523200179,韩国,2,200104,一封写给父母的信,65,75,49,25,49,250,未参加,
我来北京以前没跟你[B您]们商量，只{CQ是}我一个人决定，然后通知[B识]你[B您]们。,200104124523200190,韩国,2,200104,一封写给父母的信,65,65,47,28,47,236,未参加,
当时你们一定吓一跳了{CJX}吧，还有心里舍不得{CC3有惜}，是吧？,200104124523200272,韩国,2,200104,一封写给父母的信,65,70,36,23,49,229,未参加,
爸爸妈妈我要说给你们的话不太多，所以我把这封信要解释{CJba}，再见了爸爸妈妈。,200104124547100295,哈萨克斯坦,1,200104,一封写给父母的信,70,70,36,30,33,227,未参加,
你们好吗？,200104124523100333,韩国,1,200104,一封写给父母的信,65,55,68,58,63,291,C,
抽点时间运动一下吧，[BC。]带着小狗散散步也好。,200104124523100333,韩国,1,200104,一封写给父母的信,65,55,68,58,63,291,C,
我这里呢，不必担心了。,200104124523200390,韩国,2,200104,一封写给父母的信,70,80,52,44,42,278,未参加,
你们最近过得怎么样？,200104124540200410,印度尼西亚,2,200104,一封写给父母的信,65,90,49,37,49,281,未参加,
爸爸，妈妈，也许我这样写会让你们担心。,200104124540200411,印度尼西亚,2,200104,一封写给父母的信,80,85,66,58,76,359,C,
我想把在语言学院学到的知识传给后一代的人。,200104124542200436,越南,2,200104,一封写给父母的信,85,90,82,80,88,421,A,
我现在的工厂由于环境不佳，使我十分想去贵厂发挥我的特长，请贵厂的领导认真对待我的请求{CC衷诚}。,199200204525100022,日本,1,199200,一封求职信,,,0,0,0,0,未参加,
后来，{CQ在}去年，因为我家庭的特殊原因，{CJ-zhuy我}{CQ在}该公司辞职了。,199200008525100004,日本,1,199200,一封求职信,,,0,0,0,0,未参加,
如果您公司有兴趣雇[B顾]佣我请给我打电话（号码是二五五八三三三）说好面谈时间。,199200008632200022,匈牙利,2,199200,一封求职信,,,0,0,0,0,未参加,
想到这里的时候，我总是怀疑，病人有着极大的痛苦而生存下去，这样的生命到底有什么意义？{CD对},199604124525200156,日本,2,199604,如何看待“安乐死”,70,70,66,76,83,351,C,
即使让{CC给}病人带着痛苦的因素活下去，从他的身体消除痛苦的是一种爱情。{CQ在},199604123523100302,韩国,1,199604,如何看待“安乐死”,60,60,58,59,42,261,未参加,
我认为两种意见都有道理，对安乐死的问题从古代到在在社会上还是有很多论争，不但[BD，]中国还有西方、东方许多国家都有这种安乐死的问题，如果法律上可以实行安乐死的话[B化][BQ，]很多人[BD，]用安乐死的名[B明]义{CJ-sy杀}死病者的父母，我认为国家不应该[B孩]随便同意安乐死，还有人的生命是非常尊贵的、非常神圣的。,199604124523100046,韩国,1,199604,如何看待“安乐死”,65,70,48,61,49,278,未参加,
当时，他的生活非常有规律，但他的妻子呢，[BC！][BD。]已得了{CC得到}一种[B和]不治之症[BQ，]所以他的心情十分痛苦。,199604123523100185,韩国,1,199604,如何看待“安乐死”,60,60,27,37,24,190,未参加,
也能了解[C]这[C]位丈夫帮助妻子自杀的事都为了她{CJs}。,199604123525100217,日本,1,199604,如何看待“安乐死”,40,60,48,35,47,207,未参加,
那么，谁又会选择“安乐死”来减轻痛苦呢？,199604123521100347,孟加拉,1,199604,如何看待“安乐死”,97,90,84,88,100,457,A,
人们也该懂情况，[BC。]法官也该懂道理。,199604124529200129,泰国,2,199604,如何看待“安乐死”,60,60,40,37,42,221,未参加,
而且这里没有谁对、谁不对等等。,199604123525200212,日本,2,199604,如何看待“安乐死”,60,70,45,69,52,280,未参加,
可是今天要讲{CD对}安乐死的利弊{CC好歹}，这行为应该不应该受到法律的制裁，我一定支持{CC2靠}不受法律的制裁。,199604123523200184,韩国,2,199604,如何看待“安乐死”,60,60,35,35,26,198,未参加,
我认为“安乐死”{CJ+zy究竟}可取。,199604123540200266,印度尼西亚,2,199604,如何看待“安乐死”,50,50,35,39,31,181,未参加,
人不能{CC是}给自己或别人生命，也没有资格{CC责格}拿走自己或别人的生命。,199604124623200135,南斯拉夫,2,199604,如何看待“安乐死”,65,65,63,61,49,287,C,
两[F兩]辈[F輩]人对[F對]事情{CC2事}的态[F態]度不同，各自提出来[F來]又不满[F滿]{CJX}{CQ让}大家，双[C]方都认[F認]为[F爲]自己对[F對]的{CJsd}，对[F對]方太落后[F後]或是不听[C]话[F話]，这[C]样[F樣]产[F産]生的磨擦便是代沟[F溝]。,199610802801200004,澳大利亚,2,199610,如何解决“代沟”问题,80,80,73,71,78,374,B,
抱怨及感叹对于代沟是没有帮助的。,199610802801100023,澳大利亚,1,199610,如何解决“代沟”问题,85,80,70,71,65,364,B,
四是为自己的成见所束缚。,199610550523190002,韩国,1,199610,如何解决“代沟”问题,60,55,49,53,72,270,未参加,
我的方法就是这样：[BC。]第一，父母与子女之间谈话。,199610550523190012,韩国,1,199610,如何解决“代沟”问题,80,70,52,46,49,287,未参加,
父母也不把对子女的不满足说出的话，子女也没有机会跟父母谈话。,199610550523190024,韩国,1,199610,如何解决“代沟”问题,60,50,46,46,49,231,未参加,
父母和孩子彼此不能了解[C]，因此发[F發]生代沟的问[F問]题[F題]。,199610550523290026,韩国,2,199610,如何解决“代沟”问题,65,65,52,63,53,282,C,
我们有事情[C]就{CQ用}话来讲一讲吧！,199610550523290030,韩国,2,199610,如何解决“代沟”问题,75,70,54,55,67,310,C,
我很喜欢与父母聊天。,199610550523290032,韩国,2,199610,如何解决“代沟”问题,90,80,78,73,74,390,B,
互相了解以后，继续帮助对方就没问题了。,199610550523290041,韩国,2,199610,如何解决“代沟”问题,65,65,57,57,53,281,C,
由于[F於]以上不同的原因，以致于{CC到}代沟[F溝]在两[F兩]代之间产生{CC发[F發]生}。,199611543501100524,中国,1,199611,如何解决“代沟”问题,80,85,99,73,84,415,B,
我认[F認]为每个人应放下成见[F見]，客观地去分析情况[F況]，尝[F嘗]试[F試]从对方的角[C]度来分析事情。,199611543501200523,中国,2,199611,如何解决“代沟”问题,80,90,78,81,72,396,B,
除了不健全的人才须依赖着人，才须饭来张口外，凡健全的人都会把自己的长处、才干在社会{CQ中}发挥{CQ得}淋漓尽致{CC淋漓致[B至]尽}。,199603533533200004,新加坡,2,199603,由“三个和尚没水喝”想到的……,85,65,63,63,77,342,C,
商业[F業]机构[F構]或传[F傳]媒亦应肩负一些道义责任，尽力提倡有利{CQ于}伦[F倫]理的活动。,199611543501100533,中国,1,199611,如何解决“代沟”问题,80,85,75,73,94,401,B,
身为父母**[BQ，]可以通过平时与子女聊天，借[F藉]以多了解一下子女的内心世界。,199611543501200503,中国,2,199611,如何解决“代沟”问题,80,90,78,75,82,400,B,
结果事情就根本没办。,199603533533200034,新加坡,2,199603,由“三个和尚没水喝”想到的……,90,90,63,65,80,386,C,
分工合作对[F對]一个[F個]团[F團]体[F體]、组[F組]织[F織]是有多么[F麼]的重要。,199603533533100042,新加坡,1,199603,由“三个和尚没水喝”想到的……,90,90,58,79,89,404,B,
最后，经小组开会讨论，解决的方法便是每个人轮流分配{CQ做}某些工作。,199603533533200067,新加坡,2,199603,由“三个和尚没水喝”想到的……,90,85,66,70,77,385,B,
但如果人人都{CC的}存在这一点，将会造成社会不进步，甚至{CC反而}停顿[F頓]。,199603533533200080,新加坡,2,199603,由“三个和尚没水喝”想到的……,85,70,69,51,75,341,C,
这是大家都{CD能}知道的了。,199605104523200005,韩国,2,199605,由“三个和尚没水喝”想到的……,75,60,71,63,54,309,C,
就是缺乏积极性的结果[BQ，]人们只能这[C]样做，如果[BD，]第一个和尚曾经挑更{CJX}有着丰富的水源{CJ-zxy的水}的话，我[C]想几十个人也能喝的，所以，什么事情{CD也}第一个人的作用是非常重要的。,199605104523100033,韩国,1,199605,由“三个和尚没水喝”想到的……,80,60,58,54,65,304,C,
如果[BD，]有一个和尚很宽容，他一个人自己去山下抬水，然后愿意给别的和尚的话，虽然他一个人很累但是大家都可以喝{CQ到}水。,199605104525100030,日本,1,199605,由“三个和尚没水喝”想到的……,65,65,58,60,54,286,C,
我想这故事反映{CQ了}一般{CJX}我们的心理[B里]状态。,199605104523100113,韩国,1,199605,由“三个和尚没水喝”想到的……,65,65,74,54,63,305,C,
所以，我们应该培[B陪]养这样的主人精神。,199605104523200186,韩国,2,199605,由“三个和尚没水喝”想到的……,60,60,74,45,49,270,未参加,
他们[C]的生活快乐[C]的时[C]候，又来了一个和尚[BQ，]他们两个人感到非常高兴，因为，加了一位劳动[C]人员，就{CJX}生活比以前过得{CC地}更舒服[C]而且更方便。,199605104523100198,韩国,1,199605,由“三个和尚没水喝”想到的……,65,60,69,49,49,275,未参加,
大家开始一起住的时候，这样想，但他们实际上[BD，]不是这样生活{CC2活下去}。{CJ-zhuy他们},199605104523200212,韩国,2,199605,由“三个和尚没水喝”想到的……,65,60,33,24,23,188,未参加,
三个和尚都说{CQ了}自己的意见，[BC。]都{CJ-sy说}自己要休息了。,199605104523200212,韩国,2,199605,由“三个和尚没水喝”想到的……,65,60,33,24,23,188,未参加,
P},199605104525100240,日本,1,199605,由“三个和尚没水喝”想到的……,65,60,41,42,65,256,未参加,
一份{CC个}工作的话哪！P},199605104525100247,日本,1,199605,由“三个和尚没水喝”想到的……,65,50,58,45,27,226,未参加,
人们的心理[B里]（包括我{CQ的}）是很微妙的。,199605104523200278,韩国,2,199605,由“三个和尚没水喝”想到的……,70,70,71,51,51,301,C,
这篇短文到底说明{CC表示}{CQ了}什么呢？,199605104525100274,日本,1,199605,由“三个和尚没水喝”想到的……,70,55,69,70,65,313,C,
就是他在这个地方摆一个牌子，上面写着“这里的水{CD一个人}只能一天来一个和尚在这里喝水，那一个和尚的选择方法是，{WWJ},199605104501100297,中国,1,199605,由“三个和尚没水喝”想到的……,60,45,58,65,58,264,未参加,
因此，社会制定{CC发生}了规定，人们有义务该{CJX}遵[B准]守规定。,199605104523200320,韩国,2,199605,由“三个和尚没水喝”想到的……,65,55,69,60,58,289,C,
{CD在}两个人时[C]，先来{CC2从前知道}的人要开始介绍{CJ-by情况}，帮助另一个人。,199605104525200368,日本,2,199605,由“三个和尚没水喝”想到的……,65,55,52,67,68,289,未参加,
我阅[F閱]读[F讀]短文，就想起《论[F論]语》里[F裏]的一句话[F話]：己所不欲，勿施于[F於]人。,199605550523190013,韩国,1,199605,由“三个和尚没水喝”想到的……,70,70,52,56,65,301,C,
