错句,作文编码,国籍,性别,考试时间,作文题目,口试分数,作文分数,听力分数,阅读分数,综合分数,总分,证书
这[C]样说[BQ，]我觉得够[C]条件在贵公司做{CC当}导游[C]工作。,199312123542100902,越南,1,199312,一封求职信,70,60,32,41,52,240,未参加,
谢[F謝]谢[F謝]。,199410550523202901,韩国,2,199410,一封求职信,85,60,55,58,75,322,未参加,
工作了三年。,199410550523202902,韩国,2,199410,一封求职信,60,60,71,64,55,292,未参加,
当时我的父亲没钱，而且没有自己的家，[BC。]所以他下决[C]心{CD了}[BD，]当长工。{CQ在},199412123523100004,韩国,1,199412,记我的父亲,45,90,39,38,35,234,未参加,
父亲走得快，所[C]以那时我为了跟着他走，我每次非跑不可。,199412123525200047,日本,2,199412,记我的父亲,70,80,54,61,49,304,C,
我最喜[C]欢的是在树林{CC2林}里散步，但是我害怕一个人在黑暗[C]的地方。,199412123619200071,罗马尼亚,2,199412,记我的父亲,60,55,39,32,37,204,未参加,
我喜欢他。,199412124525200044,日本,2,199412,记我的父亲,55,75,62,55,45,277,未参加,
她对我说爸爸的坏话，我觉得这不应该的。,199412104525200676,日本,2,199412,记对我影响最大的一个人,65,75,65,67,57,316,C,
我所说“[BC‘]教过”[BC’]的理由是因为她现在不能再教学生了。,199412104523200685,韩国,2,199412,记对我影响最大的一个人,70,75,70,61,78,343,C,
对老师的这样的态度，我感到{CD了}非常{CD的}敬佩{CC敬意}。,199412104525200689,日本,2,199412,记对我影响最大的一个人,75,80,81,65,65,357,B,
记[F記]得我们[F們]念[F唸]幼稚园[F園]时[F時]已经[F經]是同学[F學]{CQ了}。[BC，],199412104625100364,葡萄牙,1,199412,记对我影响最大的一个人,70,85,81,63,74,365,C,
他总是{CC从事}想什么就做什么。,199412104525100119,日本,1,199412,记对我影响最大的一个人,65,55,36,65,69,272,未参加,
外婆凭[F凴]着不屈不挠、坚韧{CC坚执}及不向困难低头的性格，在年轻时就拥有了自己的一片胶园，除了管理自己的胶园外，还替一些外地工友洗烫衣物赚取更多{CC2多一些}的生活费，更协助外公经营小零售店的生意。,199500533533200002,新加坡,2,199500,记对我影响最大的一个人,85,80,73,63,72,366,B,
他老人家最喜欢以语重心长的语气告诉晚辈：“做人最重要的是脚踏实地，做事得按部就班来做，千万不可存有不劳而获的观念。,199500533533200003,新加坡,2,199500,记对我影响最大的一个人,95,80,78,55,69,373,B,
我母亲生长在一个大家庭[C]里，兄弟姐妹一共有八个，她排最大，弟妹们的一切便全由她照顾。,199500533533200010,新加坡,2,199500,记对我影响最大的一个人,85,85,78,67,86,396,B,
祖父也时常教我如何做个品学兼优的学生。,199500533533200030,新加坡,2,199500,记对我影响最大的一个人,95,85,41,61,76,356,未参加,
他曾经写过这么一句给我[BQ：]“希望你能写出一个春天来”。,199500533533200071,新加坡,2,199500,记对我影响最大的一个人,95,80,86,75,82,414,B,
就因为她将会继续在我的生命里扮演{CC2演}一个重要角色，我相信她对我的影响，长远来看，是最大的。,199500533533200119,新加坡,2,199500,记对我影响最大的一个人,90,70,75,71,74,373,B,
在我求学的时候，我既{CC只}认真地{CC的}把学业搞好，也在学会里努力地{CC的}从事{CJ-dy宗教}信仰活动。,199500533533200130,新加坡,2,199500,记对我影响最大的一个人,95,65,78,59,69,358,C,
每一个人都是平凡人，我也不例外。,199500533519200139,马来西亚,2,199500,记对我影响最大的一个人,95,75,81,67,78,391,B,
我对父亲感到十分失望。,199500533533200134,新加坡,2,199500,记对我影响最大的一个人,95,70,68,38,55,320,未参加,
中学[F學]毕[F畢]业[F業]后[F後]，校[F長]即刻要我回校服[C]务[F務]，在母校半工半读[F讀]{CD下}，我顺利完成了大学[F學]的学[F學]业[F業]。,199510512501200508,中国,2,199510,记对我影响最大的一个人,90,95,48,48,61,340,未参加,
他是位男老师[F師]，{CJ+zhuy他}教书[F書]很认[F認]真，务[F務]求每一字每一句的读[F讀]法标[F標]准[F準]。[BC，],199510512512200516,菲律宾,2,199510,记对我影响最大的一个人,85,80,59,39,70,326,未参加,
那时[F時]的我人还算聪明，就是十分讨厌读书，每次考试时都是靠小聪明来[C]答卷的，有机会的话还会偷看。,199510512501200524,中国,2,199510,记对我影响最大的一个人,90,90,71,75,79,403,B,
我能了解在案例中[BD，]病人和家人的病苦[C]，我[C]也有过同样的经验，前不久我的伯父得了重病，在旁看他和家人{CD的}病苦，我也很难过。,199510550523100911,韩国,1,199510,如何看待“安乐死”,80,75,86,73,82,387,B,
半生半死的状态下只靠人工呼吸机的病人，医生也{CJX}对这些病人不抱{CC1看好}希望，那么[B莫]{CD的}没[C]有另外的办法，为病人和家人[BQ，]安乐死是最好的办法，西方先进国家也容纳安乐死[BQ。],199510550523100934,韩国,1,199510,如何看待“安乐死”,65,75,64,54,68,313,C,
在什[Y甚]么[F麼]情况[F況]下{CD可}「安乐[F樂]死」可以执[F執]行，及由谁[F誰]来[F來]执[F執]行，是必须[F須]由法律严[F嚴]格地{CQ加以}规定{CC规[F規]限}{CD着[Y著]}{CJsd}。,199511543501200536,中国,2,199511,如何看待“安乐死”,85,90,76,83,95,425,A,
首先我想谈[F談]的最重要的一个[F個]关[Y関]键[F鍵]问[F問]题[F題]是那个[F個]妻子得的“不治之症”，{CD此乃}现[F現]时[F時][C][F認]为[F為]此乃{CC2是}不治之症。,199511543501200576,中国,2,199511,如何看待“安乐死”,95,85,86,68,93,425,A,
还记得一位朝鮮中期学者“李滉”。,199505550523100901,韩国,1,199505,记对我影响最大的一个人,60,55,36,55,55,242,未参加,
其实我没见过一次成龙的面。,199505550523100904,韩国,1,199505,记对我影响最大的一个人,70,65,62,69,65,317,C,
你辛[B幸]辛[B幸]苦苦学[BQ，]干吗？,199505529529100104,泰国,1,199505,学习汉语的苦与乐,70,60,24,41,44,224,未参加,
我的[C]心也痛苦得[C]不得[C]了。,199505104523200002,韩国,2,199505,记对我影响最大的一个人,80,85,65,67,57,348,B,
”外祖父{CD对我}一直{CD支持了}这样看我的好处的态度，树立{CC养育}了我的信心。,199505104525200060,日本,2,199505,记对我影响最大的一个人,65,90,65,67,67,345,C,
圆[B园]号小组已经有五个学生，其中有一个小组长{CC3小组组长}叫幸子。,199505104525200090,日本,2,199505,记对我影响最大的一个人,65,70,81,63,69,334,C,
我是从她{CJ-by那儿}学习汉语{CJsd}，不仅仅是关于中国的事情，还[C]学到她的“人生观”[BQ。]她是个忙人。,199505104525200112,日本,2,199505,记对我影响最大的一个人,75,75,73,61,65,339,C,
{CP后来，随着我长大成人，妈妈不知多少次跟我讲过姥姥的故事啊！P},199505104525200128,日本,2,199505,记对我影响最大的一个人,90,90,70,59,94,401,B,
现在她的法语{CQ和}英语水平{CJ-zy都}相当不错。,199505104523200154,韩国,2,199505,记对我影响最大的一个人,60,80,70,75,53,325,C,
这一点提醒{CQ了}在学汉语的我。,199505104523200154,韩国,2,199505,记对我影响最大的一个人,60,80,70,75,53,325,C,
他的一生所表现出[C]来的国际性、[BC，]实践性[C]、[BC，]创造性等等每天鼓励{CQ着}我[C]大胆去谋[C]求真理，作{CC1作为}对社会有用的人。,199505104525100230,日本,1,199505,记对我影响最大的一个人,70,80,65,79,78,362,C,
他分在我{CD的}前面的位置，始终笑容满面，教我工作的方法[W2ABC]。,199505104525200245,日本,2,199505,记对我影响最大的一个人,70,60,68,65,63,311,C,
人类[F類]的历[F歷]史是如此的悠久，其组成民族是如此的多，难[F難]免有{CC被}许多伟[F偉]人{CQ给我们}留下深刻的印象。,199505104610100246,法国,1,199505,记对我影响最大的一个人,85,50,62,44,72,299,未参加,
我姐姐她也能干，我也要比她干的好，她能做的我也能[C]做。[BC，],199505104525200303,日本,2,199505,记对我影响最大的一个人,0,75,86,65,76,298,未参加,
醒来时{CC時}，爸正坐在我身边，满脸泪痕地对我说我残废了，我的双脚废了。,199508680519200512,马来西亚,2,199508,记对我影响最大的一个人,85,90,78,57,59,365,B,
陪在母亲[F親]身旁廿年的岁月里，她的点点滴滴、性格思想已根深蒂固地{CC的}植入{CJ-dy我的}脑海里。,199508680519200542,马来西亚,2,199508,记对我影响最大的一个人,85,80,75,73,86,392,B,
母亲的意思是要我们这些身为子女的选择一些工资较高的职业，因为她穷怕了。,199508682519200546,马来西亚,2,199508,记对我影响最大的一个人,90,80,89,79,86,419,A,
也许会有人说：“在结婚前我是爱他/她的，但是……。,200010801801150009,澳大利亚,1,200010,我对离婚问题的看法,80,70,89,93,93,415,B,
对我来看，我有一个病，这病是把噪声越听越坏耳的{CJba}。,200005108523100285,韩国,1,200005,关于用自然之声取代噪声的建议,60,60,56,50,46,254,未参加,
我呢？,200005108525200301,日本,2,200005,关于用自然之声取代噪声的建议,65,70,70,72,59,322,C,
总之，我认为用自然之声取代噪声的方法对适合的{CJ+zxy用途}就用，不适合的就不用取代，因为自然之声不适合的话，也会让人们感觉到噪声呢{CJs}！,200005108523200369,韩国,2,200005,关于用自然之声取代噪声的建议,65,70,78,62,30,291,未参加,
心情不好的时候听到噪声的话心情更不好。,200005108523200387,韩国,2,200005,关于用自然之声取代噪声的建议,60,70,26,60,59,260,未参加,
随着人类文明的发展，现代社会的环境污染越来越厉害，所以现在世界各个国家非常重视保护环境问题，而且仔细地研究对污染[B然]物的解决{CC决解}方案。,200005108523100398,韩国,1,200005,关于用自然之声取代噪声的建议,65,60,56,60,48,272,未参加,
所以我觉得把噪声换成自然之声不是很好。,200005108523100655,韩国,1,200005,关于用自然之声取代噪声的建议,65,70,50,57,52,280,C,
还有我们也应该考虑到我们的孩子身上以后发生的事。,200005108523200705,韩国,2,200005,关于用自然之声取代噪声的建议,70,65,53,57,35,266,未参加,
如果他或她是与[F與]自己性格相反{CJsd}，那么[F麽]很难[F難]相处[F處]了。,199711801501100020,中国,1,199711,我选择朋友的标准,75,60,55,40,49,265,未参加,
我以前看过一个电影，有一个姑娘，是城市生活的人，她一去旅游去乡村，过一段时间就感觉特别新鲜。,199705104525200029,日本,2,199705,我的城市/乡村生活,65,65,69,60,63,306,C,
有时间的话，跟同学一起坐车到别的村子里去玩儿，特别{CQ是}去大海，看着雪白的波浪一起唱歌儿。,199705104523200069,韩国,2,199705,我的城市/乡村生活,70,60,55,47,56,273,未参加,
我原来是有点儿内向{CC2内向性}的，恐怕自然地埋头看书，埋没在小说的世界，我过了以书为主的生活，学会了{CD很多}妙语连珠，从文章闻到异国的新风。,199705104540100133,印度尼西亚,1,199705,我的城市/乡村生活,70,60,49,45,42,251,未参加,
另外，城市的气氛是跟乡村完全不一样了{CJsd}。,199705104523100208,韩国,1,199705,我的城市/乡村生活,70,70,58,58,68,312,C,
如果经济允话的话，我想在每周末在乡村过两天，与[B于]大自然畅谈一下，玩一玩，以使我精神充沛[B肺]。,199705104525100523,日本,1,199705,我的城市/乡村生活,50,75,60,67,65,301,未参加,
那里我尚保留一座房子，虽不十分广阔，也有百多平方米，每逢星期日，城里休息，我便带了？,199705529529153004,泰国,1,199705,我的城市/乡村生活,65,70,28,14,51,214,未参加,
我住的房子在巴黎的十六区，离铁[F鉄]塔很近。,199705610610100013,法国,1,199705,我的城市/乡村生活,65,70,62,48,44,275,未参加,
我的城市算是“[BC『]年青”[BC』]的城市，就是说在那儿住的人，很多是年青人。,199705610610100016,法国,1,199705,我的城市/乡村生活,55,60,48,37,35,216,未参加,
最后[F後]，人生的道路是漫长[F長]的，不要因一时[F時]的挫折而一蹶不振，应[F應]勇往向{CC下}前，开[F開]辟[F闢]一条[F條]给[F給]自己的康庄[F荘]大道。,199810801543150034,香港地区,1,199810,如何面对挫折,65,70,51,73,70,315,C,
随[F隨]着[F著]社会[F會]越来[F來]越繁荣[F榮]和进[F進]步，人们[F們]面对[F對]的种[F種]种[F種]问[F問]题[F題]也越来越{CC3非常}多，从[F從]社会[F會]和生活上的角度来[F來]看，面对挫折我觉得已不只是个[F個]人或家庭的问题，而是影响[F響]到整个{CC體}社会[F會]风[F風]气[F氣]及心理健康{CJ+zxy层[F層]面上了。}从[F從]个[F個]人的经[F經]历[F歷]上{CQ来看}，我从[F從]小就遇到不小的挫折，小时[F時]候觉[F覺]得自己长[F長]得不漂亮而自卑，到了青少年期，读[F讀]书[F書]成绩[F績]也比不上别人，到{CC1出来[F來]}社会[F會]做事，也总觉得技不如人。,199810602801250010,澳大利亚,2,199810,如何面对挫折,80,75,78,82,82,388,B,
他们吃饭时，经常跟我一起吃。,199804123523200258,韩国,2,199804,学习汉语的苦与乐,70,70,54,59,40,281,未参加,
反正，现在我想起这些事情，就让我感觉到学汉语中的苦与乐。,199804124523100355,韩国,1,199804,学习汉语的苦与乐,70,70,45,57,54,284,未参加,
比如“马”我要马可是把马的声调发成{CC2发音出}四声的话就让人家很生气{CD的话}了。,199804124523100478,韩国,1,199804,学习汉语的苦与乐,65,75,72,54,42,295,C,
学汉语开始的时候很难[BQ，]后来简单，就是要先吃苦后乐。,199804124529100483,泰国,1,199804,学习汉语的苦与乐,60,75,48,45,48,262,未参加,
整天不是跟她要这个，就是跟她要那个。,199910512501150011,中国,1,199910,我的童年,75,95,66,62,74,366,C,
水有到源的时候，路也有到尽的时候，当我一眼看到眼前的美景都被迷[B谜]住了，目瞪口呆，原来许多萤火虫栖[F棲]身在树丛上，远看比圣[F聖]诞[F誕]树还好看呢！,199910512501150011,中国,1,199910,我的童年,75,95,66,62,74,366,C,
我的童年回忆{CC忆起}童年是我最快乐[F樂]的事情{CC时[F時]光}。[BC，],199910512501250007,中国,2,199910,我的童年,65,80,48,47,70,298,未参加,
{CJ-sy有}从失败中吸取教训，再也不犯错误的意识。,199904123525100031,日本,1,199904,如何面对挫折,60,55,31,52,39,218,未参加,
但是有一次我去酒吧，[BC、]在那里看到了一个青年人，他吉它弹得非常好。,199904123525100052,日本,1,199904,如何面对挫折,65,70,48,78,67,314,C,
我小的时候[D儿]，只有机会跟着外祖父一起过日子，我的祖父早就去世了。,199904123529100272,泰国,1,199904,如何面对挫折,60,65,56,34,59,257,未参加,
由于日本有义务教育普及占了百分之九十九{CJy}，除了私立学校的学生之外，大概考高等学校是第一个难关。,199904124525100302,日本,1,199904,如何面对挫折,65,65,50,67,74,305,C,
当时的我的心理不能说出口，如果没有这种经历{CC经验}的人绝对不能理解。,199904124523200327,韩国,2,199904,如何面对挫折,65,65,50,52,52,268,未参加,
一般[B股]{CD的}我会面对困难，但是有的时候唉声叹气是免不了的，特别是在困难突然发生的情况{CQ下}。,199904124608200464,波兰,2,199904,如何面对挫折,65,70,34,37,48,240,未参加,
那么，遇到困难或者挫折时，不能活下去吗？,199909684542200050,越南,2,199909,如何面对挫折,70,65,54,38,65,278,未参加,
