错句,作文编码,国籍,性别,考试时间,作文题目,口试分数,作文分数,听力分数,阅读分数,综合分数,总分,证书
比如，结婚的问题{CD上}现代子女想的是男子的性格。,200209550523250303,韩国,2,200209,如何解决“代沟”问题,65,60,57,59,58,282,未参加,
他们否认上一辈（或者下一辈）的想法、[BC。]观念等。,200209550523250319,韩国,2,200209,如何解决“代沟”问题,65,65,51,59,42,266,未参加,
第二，要求多样化意见思考而不求单一或专一结[F結]论。,200209550523250324,韩国,2,200209,如何解决“代沟”问题,75,70,85,89,82,390,B,
要不然，{CP既解决不了代沟问题也成为最让人头痛的社会问题。P},200209550523250356,韩国,2,200209,如何解决“代沟”问题,65,70,60,59,56,296,C,
所[C]以不管自己是父母还是孩子，先不要想自己的身份[BQ，]最重要的是全家每个人之间的关心和{CC而}尊重。,200209550523250429,韩国,2,200209,如何解决“代沟”问题,65,65,45,40,36,235,未参加,
比如说，我们的时代被{CC令}人叫为“n时代”（n是英文的）[BQ，]可是比我们大{CC多}五岁的男女称{CJ-by之}为“X时代”这是为什么呢？,200209550523250763,韩国,2,200209,如何解决“代沟”问题,60,60,48,67,64,281,未参加,
在多多交流{CQ的}过程当中，他们自然会相互理解。,200209550523250769,韩国,2,200209,如何解决“代沟”问题,60,65,51,37,46,242,未参加,
比如说{CQ从}我[C]跟我[C]父母[B每]{CQ的}情况{CD上}我[C]可以知道。[BC.],200209550523250788,韩国,2,200209,如何解决“代沟”问题,65,60,36,49,40,233,未参加,
那么，我们怎么解决{CC解[C]开}[B了]这个问题[B提]呢？,200209550523150799,韩国,1,200209,如何解决“代沟”问题,65,60,48,49,50,255,未参加,
自古以来，特别现在父母与子女之间有很多困难，因为他们的想法、[BC，]生活方式和价值观都是{CQ在}{CD比较}很长时间内产生的，所以难以改变。,200209550523250808,韩国,2,200209,如何解决“代沟”问题,65,65,63,57,56,290,C,
另外，一起活动活动也是很好的办法。,200209550523250827,韩国,2,200209,如何解决“代沟”问题,70,70,72,71,58,329,C,
我认识的{CD有}一位中年人，[BC、]他很努力地{CC的}学现在流行歌曲[L]，[BC.]跟年青人或孩子们一起去歌厅的话[BQ，]常常唱。,200209550523250887,韩国,2,200209,如何解决“代沟”问题,70,65,39,59,40,259,未参加,
我们注意这个。,200209550523150917,韩国,1,200209,如何解决“代沟”问题,65,65,33,54,52,253,未参加,
”但过几十年那晚辈一定会变[F變]{CJ-buy成}长者。,200209550523150937,韩国,1,200209,如何解决“代沟”问题,65,65,57,64,42,277,未参加,
我也没想到那次我{CJ+zy已经}考砸了。,200205109542200002,越南,2,200205,如何面对挫折,70,75,65,54,68,321,C,
没有希望治好，最后要死的话，我选安乐死。,200205271525200109,日本,2,200205,如何看待“安乐死”,65,70,35,58,56,270,未参加,
我们作为人，都愿意帮助别人，但能有乐意帮助别人死的人吗{CC呢}？,200205271525200112,日本,2,200205,如何看待“安乐死”,75,85,52,79,80,364,C,
你曾在公园里的一个石椅上，在[B再]不好{CC下}意思的情况下坐上了个口香糖渣吗？,200306684542200002,越南,2,200306,口香糖与环境卫生,75,75,50,54,57,301,C,
其实问题在这儿。,200307109523100044,韩国,1,200307,绿色食品与饥饿,65,65,70,64,64,312,C,
我觉得最重要的是人们的意识。,200307109523200087,韩国,2,200307,绿色食品与饥饿,70,85,80,62,64,353,C,
当然[C][BQ，]饥饿问题也很严重。[BC.],200307109523100128,韩国,1,200307,绿色食品与饥饿,75,70,83,67,70,354,B,
如果世界上一部分{CC大部分}人民的生活水平{CJ-zy已经}达到较高的水准[C]，应该把健康放在首位。,200307109523100154,韩国,1,200307,绿色食品与饥饿,85,85,83,67,81,396,B,
食品也很丰富，他们考虑的是[BD“]健康[BD”][BQ，]从此他们追求[BQ“]绿色食品[BQ”]。,200307109525200166,日本,2,200307,绿色食品与饥饿,65,70,75,59,61,316,C,
听说[BQ“]绿色食品[BQ”]不仅不用化学肥料、[BC，]农药[C]，而且也不可能长在城市周围。,200307109523100197,韩国,1,200307,绿色食品与饥饿,65,70,64,49,79,313,C,
为了{CC2为}人类健康{CC无病}长[C]寿，不该用对人有[L]害{CQ的}药品。,200307109523200245,韩国,2,200307,绿色食品与饥饿,60,65,64,33,64,269,未参加,
于是，他们即使知道自己在吃的东西有慢性毒药{CC2毒}，但是为了能[C]活得更长{CJ+buy一天}，他们还[C]是只好把那个“毒食”吃下去，并且盼望明天会有更好的选择。,200307109529100301,泰国,1,200307,绿色食品与饥饿,70,85,62,59,90,358,C,
到那时候，我们所有的国家要手拉手互,200307109525200344,日本,2,200307,绿色食品与饥饿,60,85,64,62,79,339,C,
这安[B按]排是根[B本]据实况，做绿色食品还是{CC2和}用化肥和农药。,200307109523200387,韩国,2,200307,绿色食品与饥饿,65,65,48,51,50,263,未参加,
所以健康就是这么珍贵的。,200307109523200390,韩国,2,200307,绿色食品与饥饿,60,70,62,49,64,290,未参加,
化肥主要是为了刺激农[B浓]作物的生长与产品改良，而农药是为了抗病毒，抗昆虫等。,200307109540200455,印度尼西亚,2,200307,绿色食品与饥饿,70,60,67,56,81,319,C,
据说，已经开始开发这样的东西。,200307109523200504,韩国,2,200307,绿色食品与饥饿,60,50,51,33,38,212,未参加,
绿色食品是指在农作物的生长过[C]程中，不使用任何化肥或农药的食品，[BC。]而且[L]对人没有任何伤害{CC有害}的食品。,200307109523200578,韩国,2,200307,绿色食品与饥饿,75,65,75,59,87,348,C,
我认为我们要重视“绿色食品”，因为我们吃了使用化肥和农药的农作物，就会有害于人的健康，[BC。]{CQ所以}我觉得不如不吃。,200307109523200581,韩国,2,200307,绿色食品与饥饿,70,55,64,56,70,299,C,
那么怎样解决饥饿问题呢？,200307109525200580,日本,2,200307,绿色食品与饥饿,70,70,56,49,67,300,未参加,
我认为吃“绿色食品”和饥饿的问题不应该一起解决。,200307109523200594,韩国,2,200307,绿色食品与饥饿,70,70,67,54,50,299,C,
由于他领率的军次次胜利，因此当时他的君主刘备从他的马中挑选[B造]出两匹马，一匹是世人皆知的名马，另一匹是一匹普通的马。,200307217523100015,韩国,1,200307,绿色食品与饥饿,70,65,72,62,76,331,C,
从人类开始地球环境，[BC、]比如开拓荒野、森林，大量[L]杀一些{CC有些[C]}动物、生产机械等高速而且大规[B概]模改变{CC变[C]改}后，自然环境开始不能保持自己的生态{CD形}，结果有些[C]农作物{CQ在}没有化肥和农药的条件下不能产生了。,200307217525200034,日本,2,200307,绿色食品与饥饿,65,65,70,64,61,309,C,
我们每个月{CD一次}省10元，就{CC你}能让他们吃饱。,200307204523200021,韩国,2,200307,绿色食品与饥饿,60,65,48,33,61,250,未参加,
在现代生活里，消费者应该知道[C]食物方面{CQ的}知识，如吃生{CQ的}蔬菜{CC蔬2}之前，应该把生{CQ的}蔬菜{CC2蔬}放在热[C]水里“消毒”。,200307204525100051,日本,1,200307,绿色食品与饥饿,60,65,59,54,87,308,C,
其理由{CJ+zy可以}有{CC1分为}三个。[BC.],200307204523200076,韩国,2,200307,绿色食品与饥饿,55,80,59,51,70,301,未参加,
地球[C]森林日益{CJ-sy受到}破坏{CC污染}。[BC.],200307204523100101,韩国,1,200307,绿色食品与饥饿,60,65,48,43,38,237,未参加,
因为两个都有充分的理由。,200307205523100041,韩国,1,200307,绿色食品与饥饿,60,60,62,46,53,263,未参加,
而发展中{CC发达中}国家以保障人生命{CC2命}为主，即必须[B需]重视农作物生产效[C]率，[BC。]也可以用农药。,200307205525200035,日本,2,200307,绿色食品与饥饿,65,60,67,64,87,326,C,
我希望地球[C]上的人们同时享受同程度的幸福{CJ-zxy的愿望}早,200307205525200053,日本,2,200307,绿色食品与饥饿,60,75,56,49,79,305,未参加,
健[B建]康是我们生活当中非常重要的，[BC。]那么为了我们的健[B建]康，[BC、]{CD选}我们应该做什么？[BC.],200307212523200008,韩国,2,200307,绿色食品与饥饿,60,60,38,35,27,202,未参加,
但是，使用化肥和农药的食品还[C]是不能[C]肯定其安全性。,200307212525100060,日本,1,200307,绿色食品与饥饿,70,75,62,75,67,338,C,
人们不能继续吃受到污染的食品，但是又不能挨饿。,200307201523200003,韩国,2,200307,绿色食品与饥饿,75,75,72,49,79,340,C,
虽然，没有比使用化肥和农药生产高{CJbi}，但是能使{CC找}自己的健[B建]康的身体。,200307201523100034,韩国,1,200307,绿色食品与饥饿,60,60,67,54,76,299,未参加,
虽然这么做时农作物会受到污染有害于人的健康，但是世界上还有着缺少粮食的现象，所以我个人认为不挨饿是第一位。,200307201523100047,韩国,1,200307,绿色食品与饥饿,70,70,72,64,61,325,C,
对我们来说“食”是非常重要的。,200307201523100063,韩国,1,200307,绿色食品与饥饿,60,55,56,46,41,239,未参加,
更好的方法是{CJX}我提出{CQ的}通过不断的科技进步发明对身体没什么害处{CC有害}的药品。,200307201523100094,韩国,1,200307,绿色食品与饥饿,65,60,67,59,53,287,C,
因此我[C]觉得解决饥饿问题往往比绿色食品更重要。,200307302523200024,韩国,2,200307,绿色食品与饥饿,75,70,64,70,84,352,C,
可是，现在的人们不满足于吃饱，还要考虑食品的营养。,200307302523100067,韩国,1,200307,绿色食品与饥饿,70,70,75,62,58,323,C,
那么，中间的一段时间，我们该怎么办呢？,200307302523100091,韩国,1,200307,绿色食品与饥饿,65,75,78,51,73,329,C,
那我们作为一个在同一个世界上活着的人能忽视这种情况下的人吗？[BD...],200307302523100125,韩国,1,200307,绿色食品与饥饿,65,65,56,54,61,285,C,
对没有钱的人来说，无论健康食品还[C]是绿色食品都无所谓。,200307206525200004,日本,2,200307,绿色食品与饥饿,70,70,54,38,53,273,未参加,
现在[BD.]大学喜欢吃绿色食品呢?就是说，[BC.]我们发明[B作]农药以后[BQ，]大家[BD.]知[B吃]道这种[B钟]药不太好的，[BC.]可是，为什么造[B作]这种[B钟]药呢？,200307206523100045,韩国,1,200307,绿色食品与饥饿,65,60,32,25,21,186,未参加,
我不认为{WWJ}，我这[C]种想法是为我们地球考虑[B虚]了的。,200307206523200046,韩国,2,200307,绿色食品与饥饿,80,75,70,70,79,365,B,
我认为绿色食品的出现是一个理所当然的事，我之所以这样看，主要原因是因为随着社会、科学技术的发展，{CJ+zhuy那}{CJ+zy就}当然会提高人们对生活的要求，我想。,200307206525100044,日本,1,200307,绿色食品与饥饿,70,70,64,56,84,332,C,
我认为吃“绿色食品”是最重要的事情。,200307206525100056,日本,1,200307,绿色食品与饥饿,65,70,67,41,61,290,未参加,
因为现在这个世界上[BQ，]{CQ对}有一定收入有生活条件的人们来说，[BC、]最重要的是自己的身体健康。,200307206525100064,日本,1,200307,绿色食品与饥饿,65,60,70,38,47,263,未参加,
所以我觉得首先{CJX}人们{CD也}得想“为什么发生饥饿的问题？,200307215523250005,韩国,2,200307,绿色食品与饥饿,65,70,62,56,79,318,C,
吃好了，有活力了以后再想别的事情也不迟。[BC，],200307215523250018,韩国,2,200307,绿色食品与饥饿,60,60,64,54,53,273,未参加,
现在世界上有很多人在帮助{CC2帮}{CD正在}挨饿的几亿人{CQ解决}吃饭{CQ问题}，在另外一个地方还[C]有很多人在举行{CC2办}反对{CC2反}用化肥和农药的运动，这也是个事实。,200307215523250028,韩国,2,200307,绿色食品与饥饿,55,60,59,43,64,262,未参加,
跟一般正值青春发[F發]育期的男生一样[F樣]，我在課堂上开[F開]始只顾[F顧]着跟女生沟[F溝]通，而忽略了老师[F師]的讲[F講]课[F課]。,200310919922103002,美国,1,200310,我对男女分班的看法,60,70,77,65,85,342,C,
所以精挑细选和随身{CJ-sy带}一书，是我在繁忙的工作中和有限的私人空间里，作为“有效阅读”的不二法门。{CJ+sy相信},200310543533150003,新加坡,1,200310,谈有效阅读,70,75,84,84,99,401,B,
她没有{CD人}一个恋爱指导的老师，怎么能谈下去？,200310576525200046,日本,2,200310,我对男女分班的看法,55,70,49,61,65,284,未参加,
我认为男女分班是不自然的行为。,200310576525100054,日本,1,200310,我对男女分班的看法,60,60,47,44,38,231,未参加,
经过恋爱才能知道自己的爱人{CJX}作{CC是}怎样的人最合适[F適]。,200310576525100056,日本,1,200310,我对男女分班的看法,65,60,27,44,56,235,未参加,
”如果将[C]来男女分班的现象更多{CC增加}的话，[BC、]我朋友{CJX}像这样的人{CQ会}越来越多。,200310576525100067,日本,1,200310,我对男女分班的看法,60,70,38,58,61,272,未参加,
所以我觉得男女学生最好在同一个班学习，相互竞争、互相提高。,200310576525200073,日本,2,200310,我对男女分班的看法,70,80,63,80,79,362,C,
对于有效阅读，我觉得我们应该好好争取时间、机会[BD，]来阅读。,200310540540250083,印度尼西亚,2,200310,谈有效阅读,60,60,52,35,66,255,未参加,
第三我们阅读了的文章若有不懂{CC不明}之处应该写下来，尽量找机会请教别人。,200310540540250084,印度尼西亚,2,200310,谈有效阅读,65,70,39,42,73,275,未参加,
每个人学汉语的目的不同，但我希望你们与我都得到好结果。,200304131542200061,越南,2,200304,我学汉语是为了……,65,75,59,49,57,292,C,
汉语热了，大家都认为{CC成为}它是最高贵的语言之一。,200304131540200089,印度尼西亚,2,200304,我学汉语是为了……,75,70,41,41,46,262,未参加,
我从小就热爱艺术，无论是什么东西只要和艺术有关就能引起我的注[B主]意力，直到{CJ+zhuy我}十八岁时，我开始对中国的艺术产生了兴趣[BQ，]也{CC而}是我{CD的}第一次跟中国毛笔打交道{CC招呼}。,200304131529100126,泰国,1,200304,我学汉语是为了……,85,65,56,43,63,301,未参加,
二）目前，在泰国缺[Pquē]少高质量的汉语教师{CJ+zxy的数量}{CJ+sy比较高}，所以这两个原因引{WWJ},200304131529200149,泰国,2,200304,我学汉语是为了……,65,60,62,30,54,254,未参加,
总的来说，我觉得男女分班制显然是弊大于利，因为人与人之间本来就应学会共处，而两性的沟通在社会发展中当然也起着举[B取]足轻重的作用{CC角色}。,200306680519250015,马来西亚,2,200306,我对男女分班的看法,80,90,90,82,92,429,A,
依我的浅见，我本人{CD是}认为男女混合式教育是件无伤大雅的事。,200306680519250019,马来西亚,2,200306,我对男女分班的看法,80,90,82,65,74,386,B,
试想想，中学生正处于叛逆时期，{CD要是说}我们越是禁止他们去做的事或试图避免或减少问题的发生，那是否会更引起正处于叛逆期的他们的兴趣呢？,200306680519250057,马来西亚,2,200306,我对男女分班的看法,85,90,85,75,98,429,A,
一方面，人们在农作物生长过程中，为了提高农作物产量使用化肥和农药。,200307271523200006,韩国,2,200307,绿色食品与饥饿,85,80,86,54,93,391,B,
其中包[B抱]括很多类型[B形]的食品。,200307271523100084,韩国,1,200307,绿色食品与饥饿,75,65,75,70,81,353,B,
随[C]着生活水平的提高，我们的健康意识也越来越提高了。,200307271525200081,日本,2,200307,绿色食品与饥饿,70,65,75,72,99,367,C,
我认为我们首先解决饥饿问题，然后研究绿色食品。,200307271523200107,韩国,2,200307,绿色食品与饥饿,70,70,75,72,70,345,C,
我自己不抽烟，我认为世界上没有烟就好了。,200405109525200482,日本,2,200405,吸烟对个人健康和公众利益的影响,65,70,69,73,66,329,C,
首先给空气{CJ-sy带来}影响[C]，[BC。]那个空气又影响{CC2给}别[C]的环境。,200405109523200541,韩国,2,200405,吸烟对个人健康和公众利益的影响,65,65,50,46,50,260,未参加,
在一个漂漂亮亮的公园里，扔{CC掉}着如此多的烟头，真是破坏美景[C]啊！,200405109523100556,韩国,1,200405,吸烟对个人健康和公众利益的影响,90,70,79,79,73,384,B,
我的女朋友是不抽烟的人，我{CC1对我来说}是爱抽烟的人，那我{CD对}女朋友{CJX}怎[C]么[C]对待呢？,200405109523100566,韩国,1,200405,吸烟对个人健康和公众利益的影响,75,60,38,48,39,246,未参加,
为了保[C]持市容整[C]洁，采取[C]这种措[C]施还是[C]对社会有利的。P},200405109523200568,韩国,2,200405,吸烟对个人健康和公众利益的影响,90,85,55,62,50,339,C,
市[C]政府出台该措施是为了保持市容整洁，并帮助青少年养成良好的习惯。,200405109523100587,韩国,1,200405,吸烟对个人健康和公众利益的影响,80,60,48,58,55,288,未参加,
青少年时期大部分的人有模仿心理，所[C]以他们看大人的吸烟的行为以后，{CQ就}开始吸烟。,200405109523200600,韩国,2,200405,吸烟对个人健康和公众利益的影响,65,65,59,68,59,300,C,
据称，市政府出台该措施是为了保持市容整洁[C]，并帮助[C]青少年养成良好的习惯[C][BQ。],200405109523200635,韩国,2,200405,吸烟对个人健康和公众利益的影响,55,60,43,58,48,245,未参加,
女[C]人抽烟，她[C]生孩子的时候，会[C]给孩[C]子{CJ-sy带来}很严重的影[C]响。,200405109523100662,韩国,1,200405,吸烟对个人健康和公众利益的影响,50,60,57,58,50,255,未参加,
在韩国，最近的热点之一是吸烟。,200405109523200673,韩国,2,200405,吸烟对个人健康和公众利益的影响,80,65,55,62,55,305,C,
而且这种危害不管吸烟不吸烟都有可能性。,200405109523200694,韩国,2,200405,吸烟对个人健康和公众利益的影响,70,65,57,56,50,284,C,
那么，我们都戒[B截]烟，保持身体健康，保持舒适的环境吧！,200405109523201150,韩国,2,200405,吸烟对个人健康和公众利益的影响,65,65,57,62,61,294,C,
有人是在怀[B坏]孕的，有人是有病的。,200405109525101404,日本,1,200405,吸烟对个人健康和公众利益的影响,60,60,48,60,53,263,未参加,
他们明明知道吸烟损害身体，可是离不开烟，而且烟的广告也不少。,200405109525201447,日本,2,200405,吸烟对个人健康和公众利益的影响,75,60,52,46,55,274,未参加,
青少年从小{CQ就}吸烟的话，青少年的身体也从小{CQ就}坏了。,200405109523101460,韩国,1,200405,吸烟对个人健康和公众利益的影响,75,70,62,62,68,326,C,
那天的经历[B厉]对我来说太遗憾了。,200405109523201487,韩国,2,200405,吸烟对个人健康和公众利益的影响,70,85,64,50,57,318,C,
虽然非吸烟者认为没有可能伤害自己的身体的因素{CC原因}，但其实与吸烟者接近地生活的话，有巨大地可能性。,200405109525201503,日本,2,200405,吸烟对个人健康和公众利益的影响,70,70,67,52,55,302,C,
这样的政策虽然对吸烟者来{CQ说}有不利的{CJ-zxy影响}。,200405109523101778,韩国,1,200405,吸烟对个人健康和公众利益的影响,65,85,40,41,39,260,未参加,
如果我在十二层办公，我要吸的话，非下一层{CJX}去吸{CQ不可}，因为我一个人{CJ-sy带}来{CJX}给大家危害{CC损害}。,200405109523101784,韩国,1,200405,吸烟对个人健康和公众利益的影响,60,75,43,48,46,258,未参加,
这样的方案{CC方法}实践{CC实现}以后，我觉得我国越来越好{CQ了}。,200405109523201791,韩国,2,200405,吸烟对个人健康和公众利益的影响,55,65,45,50,39,236,未参加,
政府做出{CC下定}的这项规定造成了好多不好的事，引起了人们的不满。,200405109525101806,日本,1,200405,吸烟对个人健康和公众利益的影响,75,65,52,41,50,270,未参加,
现在很多餐厅、[BC，]咖啡厅、[BC，]城市里不能吸烟，[BC。]我觉得这种政策是对的。,200405109525101844,日本,1,200405,吸烟对个人健康和公众利益的影响,65,60,33,52,57,250,未参加,
韩国有俗语“三岁的习惯直到{CC达到}八十岁”，指的是从小孩子的时候，养成不好的习惯，以后不能改变不好的习惯。,200405109523101883,韩国,1,200405,吸烟对个人健康和公众利益的影响,65,65,28,44,44,230,未参加,
吸烟对身体有很多坏处。{CD很},200405109523201882,韩国,2,200405,吸烟对个人健康和公众利益的影响,85,80,64,54,48,324,C,
长时间吸烟的话，可能会得好多种{CD的}病。,200405109523201882,韩国,2,200405,吸烟对个人健康和公众利益的影响,85,80,64,54,48,324,C,
那我们怎样才能{CJ-sy解决}这个问题呢。,200405109523200539,韩国,2,200405,吸烟对个人健康和公众利益的影响,90,65,54,52,66,318,未参加,
听说吸烟的话，不利于眼睛、[BC，]鼻子等等。,200405109523200644,韩国,2,200405,吸烟对个人健康和公众利益的影响,80,65,58,77,73,341,C,
据调查表明，吸烟者患抑郁症的概率比不吸烟者小得多，然而，当代最恐怖的疾病----[BC--]癌症，特别是肺癌{CD的}患者的绝大部分都是每天吸烟量超过二十根以上的“烟鬼[C]”们。,200405109525101405,日本,1,200405,吸烟对个人健康和公众利益的影响,85,80,82,75,85,400,B,
在中国很多人吸烟。,200405109525100197,日本,1,200405,吸烟对个人健康和公众利益的影响,85,80,64,64,62,348,C,
要解决[C]这一系列的问[C]题关键在于政府和人民。,200405109523100381,韩国,1,200405,吸烟对个人健康和公众利益的影响,65,90,67,66,65,344,C,
因为吸烟给个人健康和公众利益带来恶劣[C]影响。,200405109525200395,日本,2,200405,吸烟对个人健康和公众利益的影响,65,65,54,70,70,308,C,
公共场所是老老小小{CC从小老大}所有的人来{CJ-dy的地方}。,200405204525200008,日本,2,200405,吸烟对个人健康和公众利益的影响,60,65,60,58,51,277,未参加,
比如，在街上人口密集{CQ的}地方吸烟的话[B活]，万一接触{CJ-buy到}小朋友，烟上面的火有危害性。,200405204525200151,日本,2,200405,吸烟对个人健康和公众利益的影响,70,70,82,61,58,329,C,
我的朋友喜欢吸烟[B咽]，[BC。]因为他的工作{CD上}压力太大，所以他喜欢吸烟[B咽]。,200405204525200209,日本,2,200405,吸烟对个人健康和公众利益的影响,60,65,47,51,56,262,未参加,
如果每个人{CJ-zy都}考虑别人的看法的话，不{CJ-zy会}常发生坏事。,200405204525200209,日本,2,200405,吸烟对个人健康和公众利益的影响,60,65,47,51,56,262,未参加,
我很希望大家再一次好好考虑{CC2想}吸烟对身体和对社会有害这个问题。{CJ+dy有些},200405204525100257,日本,1,200405,吸烟对个人健康和公众利益的影响,65,65,41,30,49,234,未参加,
吸烟对年轻人特别不好，比如说对大脑的发育有影响，而且他们有时为了买香烟，{CJ-zy会}犯{CD了}罪{CJX}而{CJX}{CQ为}得到资金。{CJ-zhuy吸烟},200405204525200331,日本,2,200405,吸烟对个人健康和公众利益的影响,65,70,66,65,63,315,C,
虽然吸烟只给人害处{CC2害}、没有好处，但是人们一习惯吸烟就不容易戒烟{CC禁烟}{CQ了}。,200405204525200338,日本,2,200405,吸烟对个人健康和公众利益的影响,65,70,58,61,61,301,C,
但是我也{CJX}有时候{CJ+zy不禁}想吸就吸{CC4很想吸烟就吸烟}{CJ+zxy的经验}。,200405204525100355,日本,1,200405,吸烟对个人健康和公众利益的影响,65,50,36,37,47,216,未参加,
关于吸烟的问题，我把我的意见从两个方面来讲一讲。,200405204525200417,日本,2,200405,吸烟对个人健康和公众利益的影响,65,75,60,58,58,303,C,
其次很{CC些}多吸烟者都{CJ-sy是}贫[B贪]血、食欲减退{CC退化}、虚[C]弱{CJX}体质。,200405204525200438,日本,2,200405,吸烟对个人健康和公众利益的影响,60,60,66,44,47,259,未参加,
既然如此，原本应用个人的公德[C]心来控制的事情，就非得用罚款等强制性手段来解决。,200405205525100099,日本,1,200405,吸烟对个人健康和公众利益的影响,70,95,79,82,92,411,B,
烟是国家的财政{CC2钱}的重要的来源。,200405201525200222,日本,2,200405,吸烟对个人健康和公众利益的影响,55,75,52,65,67,299,未参加,
我希望越来越{CJ-zxy多}{CQ的}国家采用这种方式减少抽烟{CJ-zxy的人}。,200405332922200024,美国,2,200405,吸烟对个人健康和公众利益的影响,60,60,41,35,38,216,未参加,
[BD《]吸烟对个人健康和公众利益的影响[BD》].[BC，]这个问题仍然存在在每个国家。[BC.],200405024542100294,越南,1,200405,吸烟对个人健康和公众利益的影响,40,50,41,42,49,197,未参加,
这些红娘朋友也可以成为{CC了}我们聚点{CJ？}，一起旅游，度[B闻]过晚年，这是很开心的事。{CD也},200410534533250068,新加坡,2,200410,最理想的结交方式,85,70,69,56,44,315,C,
”对于这点，我深信不疑。,200410534533250077,新加坡,2,200410,最理想的结交方式,95,90,63,74,82,403,B,
在我认[F認]识的朋友当中，有几对夫妇就是这样结合的。,200410534533250096,新加坡,2,200410,最理想的结交方式,80,80,66,54,65,337,C,
