错句,作文编码,国籍,性别,考试时间,作文题目,口试分数,作文分数,听力分数,阅读分数,综合分数,总分,证书
但是我们睁开{CC展开}眼睛看我们{CD的}周围的世界，现在世界上有几亿人因缺少粮食而挨饿。,200307109523200226,韩国,2,200307,绿色食品与饥饿,70,65,64,56,56,297,C,
如果每个国家都不用化肥和农药，农作物的产量又会大大降低。[BC.],200307109523200255,韩国,2,200307,绿色食品与饥饿,65,60,78,64,64,314,C,
但是这时是太晚了。,200307109523100276,韩国,1,200307,绿色食品与饥饿,70,65,54,46,35,256,未参加,
因为食品原来不是危害人的健康的，所以食品一定要安全的。,200307109501100287,中国,1,200307,绿色食品与饥饿,60,75,48,49,84,302,未参加,
没有挨过饿的人是不会理解挨饿的痛苦的，所[C]以在先进国家也只有很少的人为这些挨饿的人{CD而}去努力[B人]活动[F動]。,200307109525100315,日本,1,200307,绿色食品与饥饿,85,90,83,67,87,408,A,
化学污染与{CC对}土地有重大{CC宏大}的关系，虽[C]然可以帮助[B组]提高粮食产量，而一旦土地被污染，会影响更多的方面，甚至会破坏自然环[B怀]境，对各个[B各]人{CC1人民}来说，[BC、]问题就会比挨饿大得多。,200307109540100369,印度尼西亚,1,200307,绿色食品与饥饿,65,70,62,49,41,273,未参加,
所以现在的绿色食品的潮流是有点儿太自私[BQ，],200307109525100482,日本,1,200307,绿色食品与饥饿,65,75,70,54,81,332,C,
因此在粮食的生产过程中，“绿色食品”更居重要位置的{CJsd}。,200307109523200522,韩国,2,200307,绿色食品与饥饿,85,90,75,72,93,411,B,
没有[C]车，没有[C]工厂等等。,200307109523100563,韩国,1,200307,绿色食品与饥饿,65,65,40,35,32,221,未参加,
我认为这样的情况是由贫富差异[L]引起{CC出现}的一个问题。{CP随着资本主义市场发达，个别人先富起来，[BC。]然后他们开始追求更好的生活{CJ+zxy的原因},200307109523200612,韩国,2,200307,绿色食品与饥饿,70,75,80,78,87,379,B,
我觉得不挨饿是第一位{CQ的}。,200307217525200035,日本,2,200307,绿色食品与饥饿,60,70,54,38,56,263,未参加,
但是有害的同时，也会有一部分好成分[B份]。,200307217523200126,韩国,2,200307,绿色食品与饥饿,70,70,75,46,81,330,C,
第二，我们要考虑我们的孩子。,200307204523100024,韩国,1,200307,绿色食品与饥饿,60,80,64,70,73,334,C,
所以先救挨饿{CQ的}人，然后治疗病人。,200307204525200041,日本,2,200307,绿色食品与饥饿,60,65,51,51,44,254,未参加,
随着社会的发展，[BC、]人们的观念也改变了。,200307204525100049,日本,1,200307,绿色食品与饥饿,65,60,67,59,79,313,C,
，在{CC过[C]}生活中产生了障碍，甚至不得不结束人生生活。P},200307204525100051,日本,1,200307,绿色食品与饥饿,60,65,59,54,87,308,C,
上述的问题也是这[C]个大背景中的一个。,200307204523200084,韩国,2,200307,绿色食品与饥饿,65,75,91,64,87,369,C,
绿色食品是不用使用化肥和农药来生长的植[C]物或加工的{CJ-zxy食品}。{CP现代人们的需求来产生的食品、地球上，有的地方还在“饥饿”来艰苦P},200307204523200115,韩国,2,200307,绿色食品与饥饿,65,65,59,41,44,258,未参加,
说不定，现在就有许多人正在饿死。,200307205523100012,韩国,1,200307,绿色食品与饥饿,65,70,70,51,67,309,C,
我常常去商店买东西。,200307205523200060,韩国,2,200307,绿色食品与饥饿,65,60,62,51,61,282,未参加,
韩国土地{CC地士}这么少{CC小}，人口却这么[C]多，没办法不使用化肥和农药。,200307205523100107,韩国,1,200307,绿色食品与饥饿,65,65,56,49,61,280,未参加,
我自己也比较难说哪一个是对的。,200307205525100184,日本,1,200307,绿色食品与饥饿,60,60,59,49,58,268,未参加,
人的想象力是无限的。[BC.],200307212542200058,越南,2,200307,绿色食品与饥饿,65,70,59,30,47,257,未参加,
我个[B各]人{CJ-sy认为}应该这样解决“饥饿”的问题{CC办法}[BQ，]几十年已来，[BC.]有[C]许许多多[L]的人民有着太多的问题。,200307209628200049,圣马力诺,2,200307,绿色食品与饥饿,65,65,40,9,61,224,未参加,
因此，这就需要全人民，全社会，全世界来共同努力解决这个问题。,200307201523100001,韩国,1,200307,绿色食品与饥饿,85,70,70,64,79,359,C,
应该怎么样解[C]决这个问题？,200307201523200003,韩国,2,200307,绿色食品与饥饿,75,75,72,49,79,340,C,
我们对农药的理解深刻，就会考虑到不饿的问题。,200307209525100056,日本,1,200307,绿色食品与饥饿,65,65,59,67,70,310,C,
环[B坏]境污染的主原因是从我们[C]开始的事情。,200307201523200006,韩国,2,200307,绿色食品与饥饿,60,60,48,41,38,229,未参加,
最近几年，许[B讲]多农民在农作过程中，用大量{CC多量}的农药，[BC.]{CD这}是为了提高产量{CD的}，[BC.]因为用农药的农作和没有用农药的农作味道上没有什么不同[BQ，]所以人们明明知道这种用多量的农药的农作对身体不大好，吃的时候却没感觉到危险，[BQ.]所以人们还会买，农民们也坚持用很多农药{CD下去}。[BC.],200307201523200007,韩国,2,200307,绿色食品与饥饿,60,60,40,30,44,216,未参加,
但我们不使用这[C]些的话。,200307201523200010,韩国,2,200307,绿色食品与饥饿,65,70,59,38,61,279,未参加,
化肥能使人们收获更多的产物但其对土壤的危害也非常大。,200307201523100087,韩国,1,200307,绿色食品与饥饿,65,75,83,70,79,359,B,
{CQ就}我自己的想法来说[BQ，]还[C]是不挨饿是第一位。,200307201525200096,日本,2,200307,绿色食品与饥饿,65,60,54,51,44,257,未参加,
可是{CQ到}目前为止[BQ，]身体没有什么问题[BQ，]所[C]以我认为吃被[C]污[C]染的食物也没有问题。,200307201525200096,日本,2,200307,绿色食品与饥饿,65,60,54,51,44,257,未参加,
但另一方面缺少粮食，一天内许多孩子和老百姓饿{CC饥}死。[BC.],200307302523100002,韩国,1,200307,绿色食品与饥饿,65,65,62,56,58,290,C,
我说的不是使[B事]用过度的化肥和农药，只使[B事]用正好的量的话，生产正好的粮食，然后可以满足两边的人们。,200307302523200008,韩国,2,200307,绿色食品与饥饿,70,60,54,46,58,273,未参加,
两方都有道理。,200307302523200019,韩国,2,200307,绿色食品与饥饿,80,65,78,72,79,362,B,
如果你饿的话，你宁愿吃被污染的农作物，也不愿意饿死。,200307302523100025,韩国,1,200307,绿色食品与饥饿,80,75,86,78,93,403,B,
但是，这[C]样的话，就难以解决正在饥饿的难民问题。,200307302523100048,韩国,1,200307,绿色食品与饥饿,70,65,72,56,73,322,C,
还是选择人们的饥饿呢？,200307302523200049,韩国,2,200307,绿色食品与饥饿,80,75,75,62,93,376,B,
所以吃绿色食品的主张引起了{CC着}很多人们的关注。,200307302523200112,韩国,2,200307,绿色食品与饥饿,75,75,67,72,87,366,B,
第一，[BC、]发明无害人性农药，[BC、]但是科学家们已声明，[BC、]那发明可能性极低，[BC、]没有什么实际意义。,200307302523100133,韩国,1,200307,绿色食品与饥饿,70,60,75,59,64,313,C,
我学校的朋友{CQ的}爸爸是买{CC搞}水果的，他爸爸的水果很好吃，[BC、]他说他们的水果{CJ+sy是}很少用农药[BQ，]所以好吃。,200307302523100134,韩国,1,200307,绿色食品与饥饿,65,65,51,41,56,262,未参加,
我觉得这个运动很好。,200307206525200012,日本,2,200307,绿色食品与饥饿,65,75,48,62,61,298,C,
饥饿厉害的国家大部分气候不好，例如温度太高、缺水、土的质量不好。,200307206525100019,日本,1,200307,绿色食品与饥饿,65,65,46,51,41,252,未参加,
如此我们周围已[B以]经出现很多问题{CC后果}。,200307206523200042,韩国,2,200307,绿色食品与饥饿,65,65,59,54,67,294,C,
我不认为{CC2想}人们选择“绿色食品”是一种奢[B著]侈的行为，{CD是}因为人们都希望{CC愿意}健康[C]，[BC。]因此人们都自然而然地找用未经污染的农产品加工的“绿色食品”。,200307332523200030,韩国,2,200307,绿色食品与饥饿,60,50,56,41,44,231,未参加,
在不挨[B控]饿和{CC及}吃得{CC的}健康{CQ之间}，我认为不挨饿[C]重要，只[B欠]有在吃得{CC的}饱的基础上才能谈健康。,200307332939100025,巴西,1,200307,绿色食品与饥饿,80,70,80,70,73,363,B,
{CJ-zhuy这}其实是思想上的问題，如果发[C]觉[F覺]学[F學]生有问题，应[C]该[F該]以开[C]导[F導]的方式来教导[F導]学[F學]生。,200309529529251009,泰国,2,200309,我对男女分班的看法,65,65,74,49,85,322,C,
至[B置]于家长们为了避免学生早恋而支持男女分班{CD的原因}，我觉得这太没必要了，因为男{CQ朋友}或女朋友不仅是能够在班里面谈上的，班外面男{CQ朋友}或女朋友也是{CC总是}能够谈上的。,200310512512150010,菲律宾,1,200310,我对男女分班的看法,65,70,77,56,79,333,C,
我觉得{CD上}男女分班的学生比男女混合班的学生更可能{CC关心}早恋。,200310576525100004,日本,1,200310,我对男女分班的看法,70,75,36,63,67,300,未参加,
男女分班后就解决{CQ了}这样{CQ的}问题。,200310576525100021,日本,1,200310,我对男女分班的看法,60,70,49,70,67,301,未参加,
因为在男女混合的教室里学生可以学到很多在课上不会学到的东西。,200310576525100022,日本,1,200310,我对男女分班的看法,60,60,58,54,67,281,未参加,
班是男女混合式的。,200310576525100026,日本,1,200310,我对男女分班的看法,65,70,74,75,76,346,C,
想一想这几个方面，男女分班没有好的地方。,200310576525100044,日本,1,200310,我对男女分班的看法,70,70,66,54,61,309,C,
一般的情况来说，根本找不到恋人（对象）。,200310576525200047,日本,2,200310,我对男女分班的看法,65,70,44,44,54,263,未参加,
我朋友从小{CD时候}上男女分班的学校。,200310576525100067,日本,1,200310,我对男女分班的看法,60,70,38,58,61,272,未参加,
阅读在人生的旅途中是很重要的一环，[BC、]我们从小孩开始{CJ-zy一直}到老年是离不开阅读{CJsd}。[BC、],200310540540250044,印度尼西亚,2,200310,谈有效阅读,70,75,32,29,44,239,未参加,
每当我看到一篇好文章时，我总是喜欢用{CJ+dy有色}彩笔[F筆]把它作{CJ-buy一下}记号，而且经常把他们{CC2它}剪下来、收好{CJ+by它}，以便以后{CC将来}再阅读。,200310540540150050,印度尼西亚,1,200310,谈有效阅读,60,60,41,31,41,215,未参加,
根据{CC随[C]着}我们的喜爱，选择[C]我们所要的书籍，有来自中国大陆[F陸]{CD的}、香港、台湾、新加坡{CJ-zxy的书籍}，也{CC1甚至}{CJy有}本地{CQ的}，应有尽有，究竟哪一种书、刊物我们应该买来读{CD的}呢？,200310540540150066,印度尼西亚,1,200310,谈有效阅读,70,60,48,44,75,282,未参加,
有学问的人，谈吐风度各方面都胜人一筹。,200310540540250069,印度尼西亚,2,200310,谈有效阅读,65,70,57,49,86,313,未参加,
所以我觉得如果我们能在空闲[C]的时候，{CJ+zy常常}去逛{CJcd}书局，多翻阅翻阅有益的书籍，决定了自己的选择后把它买回家，有空时阅读它，对我们来说是百利无一[L]弊的。,200310540540250076,印度尼西亚,2,200310,谈有效阅读,65,65,73,62,84,333,C,
我是来自印度尼西亚的华人。,200304131540100055,印度尼西亚,1,200304,我学汉语是为了……,65,65,62,32,35,243,未参加,
我学汉语是为了能跟中国人做生意，了解中国人{CQ的}想法、[BC，]生活和风俗习惯。,200304131529200066,泰国,2,200304,我学汉语是为了……,65,70,56,57,60,294,C,
目前，汉语是最受人们欢迎之一{CJX}的语言。,200304131529200180,泰国,2,200304,我学汉语是为了……,70,70,65,52,68,313,C,
我学汉语不是为了想跟得{CC着}上世界的潮[B朝]流，不是因为{CC为了}中国在世界上的地位越来越高{CC1提高}，[BC。]而是为了满足自己的要求，丰富自己的知识{CD境界}，实现自己的梦想。,200304131529200180,泰国,2,200304,我学汉语是为了……,70,70,65,52,68,313,C,
如果我老了还可以在家里[B果]教汉语，[BC。]这样虽然退休了还可以赚钱。,200304131529200222,泰国,2,200304,我学汉语是为了……,65,70,53,52,52,278,未参加,
正所谓，越压抑或压制，反效果就会越大。,200306680519250005,马来西亚,2,200306,我对男女分班的看法,90,85,87,77,98,434,A,
其实也可{CD借}在学习过程中了解爱情的道理。,200306680519250011,马来西亚,2,200306,我对男女分班的看法,95,70,92,75,96,422,B,
绝不！,200306680519150023,马来西亚,1,200306,我对男女分班的看法,75,85,80,72,81,386,B,
男女合班在一起有一定的好处，例如男的多数是刚强的，有同班的女生在一起，女生可以产生辅助作用，与男生相辅相成，男的粗心，女的细心，相辅之下，学习道路上更愉快。[BC，],200306680519150044,马来西亚,1,200306,我对男女分班的看法,80,75,65,56,92,359,C,
但我记得帅哥今天回过头，看了我一眼。,200306680519250046,马来西亚,2,200306,我对男女分班的看法,70,70,87,68,90,373,C,
就绿色食品的好处而言，常吃绿色食品，首先，对身体有好处。[BC.],200307271523100090,韩国,1,200307,绿色食品与饥饿,70,80,75,75,84,374,B,
可我{CD取}反对这种现象[B想]。,200307271523200094,韩国,2,200307,绿色食品与饥饿,70,65,59,56,79,315,C,
这些问题是我们只要自觉{CQ就}可以解决的。,200307271525200097,日本,2,200307,绿色食品与饥饿,70,70,78,59,64,329,C,
目前，我们经常看到绿色食品什么的。,200307271523200107,韩国,2,200307,绿色食品与饥饿,70,70,75,72,70,345,C,
我在日本受了九年的义务教育。,200405109525200042,日本,2,200405,吸烟对个人健康和公众利益的影响,80,65,64,64,57,318,C,
从{CC1关于}公众利益的观点来考虑[F慮]，[BC、]也需要新的办法。,200405109525100132,日本,1,200405,吸烟对个人健康和公众利益的影响,70,60,55,54,53,277,未参加,
吸烟还会引起精神方面的疾病{CC坏处}。,200405109523100556,韩国,1,200405,吸烟对个人健康和公众利益的影响,90,70,79,79,73,384,B,
吸烟可以影响到{CC着}别人的健康和社会，因此，已经成为了一种社会问题。P},200405109523200575,韩国,2,200405,吸烟对个人健康和公众利益的影响,75,0,74,64,82,289,未参加,
大部分人都{CJX}第一次开始吸烟的时候不容易，[BC。]因为人们都知道吸烟对健[B建]康[C]不好，但是一开始吸烟后不能戒掉{CC掉}它，[BC。]尤[C]其是青少年。,200405109523100636,韩国,1,200405,吸烟对个人健康和公众利益的影响,70,65,43,48,46,258,未参加,
所以吸烟对个人健[B建]康和公众利益的影响不太好，[BC。]吸烟者应该考虑[C]到这些影响。,200405109523200653,韩国,2,200405,吸烟对个人健康和公众利益的影响,70,60,52,54,50,271,未参加,
但是吸烟者也没办法！,200405109523100687,韩国,1,200405,吸烟对个人健康和公众利益的影响,55,65,50,46,59,257,未参加,
这样[BQ，]吸烟不仅损害自己的健康，而且损害别人的健康。,200405109523200686,韩国,2,200405,吸烟对个人健康和公众利益的影响,65,60,50,64,46,268,未参加,
在全世界[BQ，]数以万[C]计的人因为吸烟导致的病[BD，]死亡。,200405109523200739,韩国,2,200405,吸烟对个人健康和公众利益的影响,70,65,69,54,59,303,C,
这种知识已成为人们的常识了。,200405109525200875,日本,2,200405,吸烟对个人健康和公众利益的影响,60,85,57,66,68,325,未参加,
{CP由此可见，从个人的角度来看，虽[B随[C]]然新的规定对自由方面有一定的限制，而对个人的健康有很大的帮助。P},200405109523200935,韩国,2,200405,吸烟对个人健康和公众利益的影响,80,65,62,73,55,323,C,
现在吸烟的人不少，特别在中国还很多。,200405109525100939,日本,1,200405,吸烟对个人健康和公众利益的影响,90,70,64,64,64,345,C,
我们常常看到在路上很多人抽着烟{CC在抽烟}过去过来，[BC。]是为什么{CC3因为}呢？,200405109523100992,韩国,1,200405,吸烟对个人健康和公众利益的影响,60,60,57,48,44,251,未参加,
可见双方都有正当的主张。,200405109525201009,日本,2,200405,吸烟对个人健康和公众利益的影响,70,65,67,73,70,331,C,
吸烟是百害无益的东西，现代的人们都认识到了这一点。,200405109523201053,韩国,2,200405,吸烟对个人健康和公众利益的影响,60,65,81,64,75,328,C,
如果一种习惯伤害自己的每[B母]个方面，而且损害别人的利益，何必要坚持它呢？,200405109523201156,韩国,2,200405,吸烟对个人健康和公众利益的影响,70,65,67,66,66,320,C,
社会不是私人{CC私自}的场所，每个人都要享有自己的权利。,200405109523201170,韩国,2,200405,吸烟对个人健康和公众利益的影响,70,55,69,46,66,290,未参加,
然而抽烟有[D有]些特殊情况。,200405109523201273,韩国,2,200405,吸烟对个人健康和公众利益的影响,60,55,50,48,37,231,未参加,
还有，在公共场所边走边抽烟，这引起意外的事故。,200405109525201470,日本,2,200405,吸烟对个人健康和公众利益的影响,55,60,36,41,37,210,未参加,
有的非吸烟者认为这样做可以保持整洁干净而且帮助青少年养成良[C]好的习惯，但是吸烟者就不一样了。,200405109523201477,韩国,2,200405,吸烟对个人健康和公众利益的影响,60,70,59,48,57,279,未参加,
但我努力了好多次戒[Pjìan]烟{CJX}[C]的{CJsd}。{CP已[C]吸烟的人大部分都知道吸烟对自己的健康有坏处{CC2不好处[C]},200405109523201560,韩国,2,200405,吸烟对个人健康和公众利益的影响,60,65,55,48,44,255,未参加,
实行这种措施{CC活动}后，[BC、]许多人获得{CC得到}了安全{CC安心}感。,200405109525201624,日本,2,200405,吸烟对个人健康和公众利益的影响,65,65,45,58,55,272,未参加,
当生孩子的时候或者养[F養]育孩子的时候，这种问题对她们的孩子留下很严重的影响。,200405109525201666,日本,2,200405,吸烟对个人健康和公众利益的影响,55,60,40,44,48,228,未参加,
我认为这些孩子们将[F將]来会有健康和发育不良等问题。,200405109525201847,日本,2,200405,吸烟对个人健康和公众利益的影响,85,65,67,58,75,339,C,
这样才能减少{CQ对}不吸烟[B咽]者的影响。,200405109523101891,韩国,1,200405,吸烟对个人健康和公众利益的影响,60,80,64,60,57,308,C,
保持市容整洁就是最后一个理由。,200405109525101900,日本,1,200405,吸烟对个人健康和公众利益的影响,85,90,71,66,75,383,B,
在韩国的吸烟者的生活越来越难，{CD是}因为社会不让{CQ他们}在公共场[C]所抽烟，[BC。]甚至三星企业{CJ-zy也}不允许{CQ在}公司里抽烟，[BC。]所以三星公司的工员{CJ-zy都}去外边抽烟。,200405109523200523,韩国,2,200405,吸烟对个人健康和公众利益的影响,75,65,52,33,51,263,未参加,
P}{CD如果}我的身体到什么时候能接受吸烟，[BC.]我也不知道[C].现在我想想会{WWJ},200405109523100621,韩国,1,200405,吸烟对个人健康和公众利益的影响,65,65,50,48,56,268,未参加,
但人们{CC人家}明确{CC明明}知道了烟对身体一点也没有{CJX}好处的东西以后{CJs}，一个一个戒烟了。,200405109523200794,韩国,2,200405,吸烟对个人健康和公众利益的影响,50,65,40,31,49,216,未参加,
首先，在青少年的时候培养良好的习惯。,200405109523200818,韩国,2,200405,吸烟对个人健康和公众利益的影响,70,60,58,62,75,310,C,
在很多媒体和专家们向群众宣传吸烟对人的健康很不好的今天，这是一个理所当然的趋[C]向。,200405109525200967,日本,2,200405,吸烟对个人健康和公众利益的影响,85,75,72,77,87,388,B,
因为公共场所不是个人的地方，{CP因此我们应该考虑到别人，而且抽烟不是只{CC1只有}对自己有害的，就是对周围的人有害的。P},200405109525101168,日本,1,200405,吸烟对个人健康和公众利益的影响,75,60,66,54,51,292,C,
以下[BD，]我想把这两个问题分开{CQ来}说明自己的观点。,200405109525200183,日本,2,200405,吸烟对个人健康和公众利益的影响,70,85,79,64,75,365,C,
现在，人们之间的竞争越来越激烈，个人的压力也越来越大。,200405109525200916,日本,2,200405,吸烟对个人健康和公众利益的影响,85,65,51,68,82,340,C,
最近，有些人提醒{CJ-by人们}吸烟给{CC对}周围人所带来的坏影响。,200405109525201278,日本,2,200405,吸烟对个人健康和公众利益的影响,70,65,84,56,67,328,C,
我也是抽烟的人，所[C]以不能完全地了解不抽烟人的心情。,200405204525100255,日本,1,200405,吸烟对个人健康和公众利益的影响,60,60,44,42,36,224,未参加,
总[C]之{CD来说}，吸烟不但对人体，而且对社会对环境没有任何好处。,200405204525100270,日本,1,200405,吸烟对个人健康和公众利益的影响,75,65,71,44,58,300,C,
这{CD个}两种{CC个}{CJ-zxy交通工具}都是公共的，所以禁止[L]吸烟是理所当然的事情，而且在汽车、火车里很多老人、孩子{CJy}，但是有人吸烟{CD了}。,200405204525200278,日本,2,200405,吸烟对个人健康和公众利益的影响,60,70,36,37,51,239,未参加,
筒井先生的意见也有一分道理{CC之理}，但是这个问题还有一个侧面——公众利益。,200405204525100287,日本,1,200405,吸烟对个人健康和公众利益的影响,70,80,47,80,63,330,C,
在日本也有跟左边的文章{CQ说的}一样的城市，[BC。]名叫品川市。,200405204525200318,日本,2,200405,吸烟对个人健康和公众利益的影响,65,70,44,47,29,241,未参加,
我认为[B认]对于如何控制{CQ在}公共场所[C]抽烟有两个方面的措施。,200405204525200469,日本,2,200405,吸烟对个人健康和公众利益的影响,60,60,58,58,61,279,未参加,
其实吸烟不仅是对吸烟者有害{CD的}，而且{CJ+sy是}对在吸烟者周围的人有害，所以很多不吸烟者不能接受在公共场所有人吸烟。,200405205525100069,日本,1,200405,吸烟对个人健康和公众利益的影响,65,75,60,58,63,308,C,
我想[C]对喜[C]欢抽烟的人说，要爱护{CC2爱[C]}自[C]己[C]的[C]身[C]体！,200405205525200132,日本,2,200405,吸烟对个人健康和公众利益的影响,60,75,55,42,45,263,未参加,
有[C]时他们之[C]所以在[C]吸烟是因为觉得吸烟很帅，不管有什么原因，吸烟还是不好。,200405205525200223,日本,2,200405,吸烟对个人健康和公众利益的影响,60,65,44,49,51,252,未参加,
那为什么还要抽烟呢？,200405201525200202,日本,2,200405,吸烟对个人健康和公众利益的影响,65,85,79,75,81,375,B,
我认为男女交往首先[D先]考虑的是彼此年龄[C]的差距，相差太远可能会出现沟通问题。,200410534533250006,新加坡,2,200410,最理想的结交方式,80,85,63,58,82,362,C,
当男女之间的志趣相同，两人的思维也是相似的。,200410534533250008,新加坡,2,200410,最理想的结交方式,80,80,80,79,75,386,B,
现在世界都改变了。,200410534533150091,新加坡,1,200410,最理想的结交方式,85,75,41,60,63,316,未参加,
食店和购物中心都有‘吸烟区’和‘不吸烟区’的分别{CC分开}。,200405680519150020,马来西亚,1,200405,吸烟对个人健康和公众利益的影响,65,65,41,67,87,309,未参加,
香烟，是一种会让人上瘾的东西。,200405680519250039,马来西亚,2,200405,吸烟对个人健康和公众利益的影响,75,95,85,88,87,424,A,
香烟本身已含有过多的毒质，当人吸香烟时无疑是把毒素一一地放入我们的体内，虽然那时候你会感觉到无比地快活[BQ，]但你却不知道你的寿命却比一般人少得多{CC去得快}。{CC根据},200405680519150048,马来西亚,1,200405,吸烟对个人健康和公众利益的影响,60,95,60,63,63,331,C,
在男校或女校，我们会发觉不是太过阳气就是{CC或是}太过阴气，混合学校就阴阳{CC阳阴}调合，中庸之道也。,200504534533150024,新加坡,1,200504,我对男女分班的看法,70,75,65,69,73,341,C,
我认为那是他们的过分[B份]担忧{CC担复}。,200504534533250025,新加坡,2,200504,我对男女分班的看法,75,80,70,78,84,378,B,
毕竟，到了社会上，这些孩子们还是要与形形色色的人相处，为何不提早让他们接触较为真实的环境？,200504534533250033,新加坡,2,200504,我对男女分班的看法,75,85,78,86,84,401,B,
尤其是处于发育年龄的学生，因为开始与父母疏远加上媒体和周围的朋友的影响{CD下}，开始对异性产生好感以及对爱产生幻想{CC幻觉}。,200504534533250062,新加坡,2,200504,我对男女分班的看法,65,75,78,84,75,364,B,
学生们试着了解对方，更知道如何了解异性。,200504534519150107,马来西亚,1,200504,我对男女分班的看法,55,55,70,54,62,276,未参加,
相信大家有听过{CJy}，在女儿国，全国上下，老中少都是女生，每天遇见的人都是女生。,200504534533250123,新加坡,2,200504,我对男女分班的看法,75,75,78,82,73,373,B,
