错句,作文编码,国籍,性别,考试时间,作文题目,口试分数,作文分数,听力分数,阅读分数,综合分数,总分,证书
记得五年级[C]时，为了交两{CC二}块[F塊]半钱[F錢]的杂[F雜]费，{CJ-zhuy我}打破扑[F撲]满，里面有二十{CC廿}个五分钱[F錢]，交给老师时，{CJ-zy还}被级任老师骂[C]。[BC，],199500533533200044,新加坡,2,199500,记对我影响最大的一个人,95,80,81,65,72,389,B,
当我做错了事后，他教训我之后，还{CJ-zy会}解释为什么我会犯错[F錯]，错[F錯]在哪里{CC那里}，[BC。]并[F並]鼓励我做错事要勇敢认错。,199500533533200056,新加坡,2,199500,记对我影响最大的一个人,95,80,62,67,76,376,B,
即[B既]使至今，我已为人母，仍不免表现出这些{CC1一一}的特性。,199500533533200061,新加坡,2,199500,记对我影响最大的一个人,90,85,81,67,82,402,B,
就在这时{CC1时刻}，乡村生活的一景一物，以前的往事，都会出现在我的脑海里，而给{CC对}我印象最深刻的是我的小学华文老师—赵玉琼老师，她也是对我影响大最大的一个人。,199500533533100068,新加坡,1,199500,记对我影响最大的一个人,90,80,57,65,72,359,C,
虽然外婆的{CQ受}教育程度不高，但她人生经验丰富，在思想观[B关]念上，教会我许多{CJ-by道理}。,199500533533200081,新加坡,2,199500,记对我影响最大的一个人,80,80,86,65,65,368,B,
在叔公的允许下，他又下海去{CQ了}。,199500533533100093,新加坡,1,199500,记对我影响最大的一个人,90,85,78,61,74,385,B,
我[C]终于被加拿大的大学录[F錄]取了，姐姐替我[C]感到高兴，{CJ-zy还}带我[C]去买所需[B须]的文具、用品等。,199500533533200097,新加坡,2,199500,记对我影响最大的一个人,95,70,78,69,76,382,B,
那时同学可羡慕我了，因为我不必到食堂去排队买午餐。,199500533533200098,新加坡,2,199500,记对我影响最大的一个人,90,90,57,69,84,388,C,
在处理感情的问题{CC事项}上，于先生谨慎、大度及顾及他人心理的心态使我认识到能够冷[F靜]、明智地{CC的}谈情说爱亦是一种微妙的感觉。,199500533533200102,新加坡,2,199500,记对我影响最大的一个人,85,80,83,79,76,396,B,
休息时间，大家{CJ-zy都}买了点心零食吃，只有我躲在教室{CC课室}。,199500533533200127,新加坡,2,199500,记对我影响最大的一个人,95,85,86,73,90,427,A,
从活动中，我学会了与人相处之道，一切要为别人得到{CC达到}幸福而努力。,199500533533200130,新加坡,2,199500,记对我影响最大的一个人,95,65,78,59,69,358,C,
中学毕[F畢]业[F業]后[F後]，我果然考上中文系，陈[F陳]老师[F師]得知后[F後]，非常高兴。,199510512501200519,中国,2,199510,记对我影响最大的一个人,90,90,64,64,84,390,C,
把握今天的每分每秒将使人终身受益。,199510512501200524,中国,2,199510,记对我影响最大的一个人,90,90,71,75,79,403,B,
母亲的教诲[F誨]，使我们数兄弟虽[F雖]苦犹[F猶]甘，我们懂得“[BC「]吃得苦[B若]中苦，方[C]为[F為]人上人”[BC」]，我们懂得“[BC「]艰苦有时[F時]过[F過]，只在我毅心”[BC」]，因而，母亲，我们兄弟今日有坚强[C]意志，对人生，全是您的影响。,199510512501200529,中国,2,199510,记对我影响最大的一个人,90,90,74,73,95,420,B,
在这种条件下，{CQ在}法律上也不是犯罪。,199510550523200912,韩国,2,199510,如何看待“安乐死”,80,75,67,37,61,311,未参加,
所以，若病人要求，何[C]不让[C]他「安乐死」？,199511543634200562,英国,2,199511,如何看待“安乐死”,80,90,76,81,95,417,B,
无论是传统或是新潮款式、[BC；]各{CD级}年龄人士所需[B须]求{CD等}{CQ的}{CJ-zxy款式}，本人都{CC也}可提供意见，故在推销产品时将大有帮助。,199503680519200515,马来西亚,2,199503,一封求职信,80,85,67,68,86,380,B,
致季翔先生：3月19日应征广告设计师本人于昨日——[BC，]3月18日阅读{CQ了}贵公司刊登于[BQ《]南洋商报[BQ》]{CQ的}招聘启事。,199503680519200522,马来西亚,2,199503,一封求职信,90,85,69,70,75,386,B,
三、特长：擅长电视广告设计及通晓电脑操作。,199503680519100534,马来西亚,1,199503,一封求职信,80,75,74,70,84,374,B,
日期：1995年3月19日×××雪[C]兰莪州加影镇风[F風]山花园门牌D-123号精美服装公司吉隆坡武吉敏登路门牌110号季翔先生：应征推销员本人，今日阅[BQ《]南洋商报[BQ》]贵公[L]司启[F啟]事，知贵公[L]司有意聘请职员数位。,199503680519100533,马来西亚,1,199503,一封求职信,80,80,74,83,95,404,B,
可是他不能改变已注定的命运，这是谁也不能改变的。,199505550523100914,韩国,1,199505,记对我影响最大的一个人,70,70,70,73,74,345,C,
学会汉语后，才真正是我另一段人生的开始。,199505529529200035,泰国,2,199505,学习汉语的苦与乐,90,95,76,81,99,439,A,
同别的中日合资企业{CD进行}比较起来，[BC、]这是很明显的。,199505104525100044,日本,1,199505,记对我影响最大的一个人,65,45,44,55,59,247,未参加,
母{WWJ},199505104533100053,新加坡,1,199505,记对我影响最大的一个人,85,60,52,46,78,309,未参加,
我已经成家[C]立业了，{CD当然}有[C]两个孩子了。,199505104523100056,韩国,1,199505,记对我影响最大的一个人,55,75,70,63,74,322,C,
她想如果住院的话，我得花很多钱，{CD把我}{CQ就}照顾{CQ我}{CJX}在她的家里。,199505104525200086,日本,2,199505,记对我影响最大的一个人,60,75,57,48,69,295,未参加,
我遇到了好事，她和我一起高兴，如果遇到了不好的事，她比我都伤心。,199505104525200116,日本,2,199505,记对我影响最大的一个人,80,85,68,65,67,359,C,
我对她的认识是早在我刚上幼儿园时开始的。[BC.],199505104525200128,日本,2,199505,记对我影响最大的一个人,90,90,70,59,94,401,B,
我怕妨碍他{CD的}读书，悄悄地离[C]开那里。,199505104523200161,韩国,2,199505,记对我影响最大的一个人,70,75,73,63,57,327,C,
但子女都长大{CQ了}，家里{CJ+zy该}有笑声的时候[BQ，]父亲突然去世[B逝]{CQ了}。,199505104523100196,韩国,1,199505,记对我影响最大的一个人,85,80,86,67,86,397,B,
我读大学的时候，我家庭生活很困难，他常给我钱买书，还常写信鼓励我好好学习{CC4学习好}。,199505104542200192,越南,2,199505,记对我影响最大的一个人,85,80,44,38,65,305,未参加,
从开始工作以后她继续[C]{CJX}自己{CD不断地}学习外语。,199505104525200236,日本,2,199505,记对我影响最大的一个人,65,65,44,42,47,247,未参加,
虽然这么{CJX}长大，可怎么{CJX}没有理解爸爸。[BC，],199505104523100257,韩国,1,199505,记对我影响最大的一个人,70,55,62,46,47,264,未参加,
我从小对数学和语文很有兴趣。,199505104940100285,秘鲁,1,199505,记对我影响最大的一个人,85,60,62,46,49,290,未参加,
她常对我说选择了自己所选择的路[BQ，]就一定要全力以赴去通过每一个艰难的阻碍，往后所看到的就是一片光明的未来。,199508682519200502,马来西亚,2,199508,记对我影响最大的一个人,85,80,89,75,82,404,B,
她把握每一个可识字读书的机会，[BC、]还有努力学习各种语文与方言的机会。,199508680519200533,马来西亚,2,199508,记对我影响最大的一个人,90,85,73,69,82,396,B,
对{CC在}我来说，那年是我吸收力非常强的一年。,199508682519100544,马来西亚,1,199508,记对我影响最大的一个人,75,85,86,73,84,396,B,
但是夫妻双方既然没有爱情那有为什么要结婚呢！,200010801801150009,澳大利亚,1,200010,我对离婚问题的看法,80,70,89,93,93,415,B,
我很赞同关于用自然之声取代噪声的观[B关]点。,200005108523200329,韩国,2,200005,关于用自然之声取代噪声的建议,85,65,59,60,59,317,C,
虽然很简单的方法{CJs}，但是让敏感的学生{CJX}会轻松一点儿。,200005108523200346,韩国,2,200005,关于用自然之声取代噪声的建议,70,70,80,67,67,342,C,
有一天，我听到了我弟弟玩[C]电脑[L]的声音，我觉得听这个声音很不好听，所以到弟弟的房间去让他作把声音小点{CJba}，可是我弟弟说“你可以听你喜欢的音乐！,200005108523100416,韩国,1,200005,关于用自然之声取代噪声的建议,65,60,48,52,39,247,未参加,
最近人们常常听到的两句话就是保护环境。,200005108525100523,日本,1,200005,关于用自然之声取代噪声的建议,65,80,53,75,72,333,C,
所以，在交朋友之前，最好是要清楚知道自己选[F選]择[F擇]朋友的标准[F準]，这样就可以减少自己为[F爲]自己带来的烦[F煩]恼[F惱]啦。,199711802625200003,葡萄牙,2,199711,我选择朋友的标准,85,80,46,72,89,365,C,
当[F當]然，每个[F個]人都有不同的性格，即便性格相近，也有不同的地方，所以朋友之间有时[F時]也不好彼此忍让[F讓]了。,199711802801200019,澳大利亚,2,199711,我选择朋友的标准,80,80,66,76,87,381,B,
这时我想到日本的生活，两者的距离多么远呀！,199705104525100005,日本,1,199705,我的城市/乡村生活,60,80,71,67,80,345,C,
空气新[F鮮]，富有森林、草原，对我们的健康相当有好处。,199705104525100068,日本,1,199705,我的城市/乡村生活,80,70,55,65,75,335,C,
很多城市生活者说“城市的生活让人厌倦，每天重复{CC反复}一样的事情。,199705104523100088,韩国,1,199705,我的城市/乡村生活,70,65,80,45,46,292,C,
乡村好像母亲拥抱孩子一样拥抱着我们人类。,199705104523200105,韩国,2,199705,我的城市/乡村生活,70,75,74,58,80,346,C,
特别是公园里绿[F綠]树成阴，呼吸新鲜空气也是人们[F們]的一大享受。,199705610501100007,中国,1,199705,我的城市/乡村生活,90,85,71,75,95,413,B,
首先，通过现代汉语我能跟中国人交往，[BC。]跟外国人谈话真有意思。,199804123523100099,韩国,1,199804,学习汉语的苦与乐,65,75,30,64,68,289,未参加,
还有对写作来说，我真难为情。,199804123523100160,韩国,1,199804,学习汉语的苦与乐,65,50,45,54,58,253,未参加,
”我到今天{CJ-zy也}忘[B完]不了他对我说的话，所以学习汉语的时候无论遇到什么困难，我都不怕，我很感激{CC2感}北京语言文化大学和中国教育部，{CQ否则}我的中文不会这么好。,199804123644100203,格鲁吉亚,1,199804,学习汉语的苦与乐,75,75,51,45,42,278,未参加,
不过，我觉得学习汉语的乐比苦多。,199804123525200255,日本,2,199804,学习汉语的苦与乐,85,80,63,81,80,382,B,
因为这两个语言都使用汉字的{CJsd}。,199804124525100283,日本,1,199804,学习汉语的苦与乐,85,75,57,81,80,370,C,
在我进入{CC步进}书法班时我更觉得汉字真的很美妙[BQ，]它藏着无数的秘密[BQ，]让后代人去学习去研究。,199804124542200463,越南,2,199804,学习汉语的苦与乐,75,80,75,79,66,366,B,
我们人生中常常遇到困难，比如说考不上大学，工作不顺利，失恋等等，举例子没完没了。,199904123525200084,日本,2,199904,如何面对挫折,50,65,39,47,63,245,未参加,
去商店买东西时，售货员说的价钱我听不懂，就满头大汗。,199904123525200117,日本,2,199904,如何面对挫折,75,75,70,80,69,359,B,
这样的态度不仅会伤[F傷]害自己，更伤[F傷]害家里的人所寄托{CC为讬}在你身上的希望。,199904123540200131,印度尼西亚,2,199904,如何面对挫折,70,60,70,60,56,301,C,
在遇到挫折过程当中，不少人一无所得，但最重要的这些人能否从失败中吸取教训呢{CJs}。,199904123530100247,土耳其,1,199904,如何面对挫折,65,65,53,29,54,250,未参加,
他们应该能够转[B轻]败为胜.但是他们的根本原因是没有自信、[BC，]自强的精神，[BC。]应该{CQ从}{CD学习}失败中得到胜利的办法。,199904124523200281,韩国,2,199904,如何面对挫折,60,70,64,57,41,277,未参加,
过了一年，我的父母也知道了，他们帮我出国学习，95年9月，我终[B冬]于来到{CC到达}了北京，可是我的困难从这儿开始。,199904124523200300,韩国,2,199904,如何面对挫折,60,55,64,42,61,263,未参加,
无论是谁{CJ+zhuy每个人}都有自己的理想[BQ，]而为了实现这种理想人们都{CJ+zy向自[B目]己的目的}辛辛苦苦地生活，不过有时候情况不跟着自己走。,199904124523200332,韩国,2,199904,如何面对挫折,65,55,67,65,67,301,C,
在社会生活当中无论遇到什么困难或者挫折，都要坚持下去，不怕困难，不怕挫折。,199904124525200349,日本,2,199904,如何面对挫折,70,70,45,55,50,278,未参加,
那时我的心情最难过了。,199904124523100385,韩国,1,199904,如何面对挫折,70,70,48,55,50,281,C,
