错句,作文编码,国籍,性别,考试时间,作文题目,口试分数,作文分数,听力分数,阅读分数,综合分数,总分,证书
我来中国三年了[BQ，]虽然我每年一两次{CJX}回家[BQ，]但是还是很想{CQ那位}对我影响最大的人——我亲爱{CQ的}、[BC，]伟大的母亲。,199412124506100060,巴基斯坦,1,199412,记对我影响最大的一个人,75,65,49,42,57,275,未参加,
他很勤劳，很有责任感。,199412124525100053,日本,1,199412,记对我影响最大的一个人,70,70,65,57,76,326,C,
其后，我去大陆留学两年，还到大陆去教书{CD时}，××老师每次{CQ都}教导{CC鼓励}我如何生活[BD，]{CD如何过}。,199412104525200664,日本,2,199412,记对我影响最大的一个人,70,65,70,71,67,329,C,
其实我想在留学期间{CC之間}寻找自己的毕[B辈]生事业。{CJ-zhuy我},199412104525200697,日本,2,199412,记对我影响最大的一个人,65,65,75,79,74,342,C,
这[F這]么[F麽]多年来[F來]，父亲[F親]始终[F終]诲[F誨]人不倦，连[F連]连[F連]取得各项[F項]专[F專]业[F業]奖[F獎]励[F勵]并[F並]得到师[F師]范[F範]文凭[F憑]。[BC，],199500533533200012,新加坡,2,199500,记对我影响最大的一个人,85,90,100,77,90,438,A,
丁校长所说的话，我永记在心中。,199500533533200024,新加坡,2,199500,记对我影响最大的一个人,65,85,57,77,76,350,C,
依旧被编在最差的班级。,199500533533100042,新加坡,1,199500,记对我影响最大的一个人,95,85,86,71,90,425,A,
从她身上我也继承{CQ了}善良、开朗、公正无私、无畏及乐观的性格，当然我只做到了她的百分之一，[BC。]但她永远是影响我最大的一个人。,199500533533200076,新加坡,2,199500,记对我影响最大的一个人,85,90,91,73,86,421,A,
这之后，她常带我去认识他们、去接触他们，让我那空虚又{CQ受过}创伤的心灵里，注入了无限色彩，也打开了我的眼界。,199500533533200091,新加坡,2,199500,记对我影响最大的一个人,95,90,75,53,80,392,C,
是啊！{CP要{CD不},199510512512100502,菲律宾,1,199510,记对我影响最大的一个人,80,85,59,66,73,357,B,
也许我对毛主席的一片热爱之故，我经常跟家[B穴]人{WWJ},199510512512100502,菲律宾,1,199510,记对我影响最大的一个人,80,85,59,66,73,357,B,
妈妈是一个中国传统的知识分子，在我还是个小孩子的时候，她就告诉我知识的重要。,199510512501200521,中国,2,199510,记对我影响最大的一个人,90,90,91,75,91,435,A,
另一方面，我们[F們]可以想[C]出社会[F會]上的问[F問]题[F題]。,199510550523100905,韩国,1,199510,如何看待“安乐死”,65,70,50,60,59,290,C,
我们[F們]{CQ应}以更好的方法来解决[F決]此事。,199510550523200926,韩国,2,199510,如何看待“安乐死”,80,85,62,79,66,366,B,
就以不治之症来[F來]说[F說]，既由专家评[F評]定为[F為]不治，也就只好在没有解决[F決]方法中寻[C]求办[F辦]法。{CP不错[F錯]，这就是所[C]谓[F謂]的「接受事实[C]」，但不是持消极[F極]态度，怨天由命{CC怨天认[F認]命},199511543634100537,英国,1,199511,如何看待“安乐死”,85,90,69,79,97,416,B,
最后[F後]，防止滥[F濫]用的机[F機]制也是必须[F須]的，否则[F則]，一些借“安乐[F樂]死”谋[F謀]财[F財]害命的案件就会[F會]出现。,199511543501200545,中国,2,199511,如何看待“安乐死”,85,95,83,81,91,431,A,
所以若以这两[F兩]点[F點]来[F來]下结[F結]论[F論]，则[F則]“安乐死”，即合法地结[C]束病者[C]的生命，在病者同意下，是可以接受的做法。,199511543634200553,英国,2,199511,如何看待“安乐死”,85,85,83,81,95,424,A,
特长：设计妇女及儿童时装。,199503680519200526,马来西亚,2,199503,一封求职信,80,75,69,70,91,376,B,
而你不敢做的，大家都{CD能}敢做。,199505550523200903,韩国,2,199505,记对我影响最大的一个人,75,65,41,50,49,267,未参加,
过去的是过去的。[BC.],199505550523200903,韩国,2,199505,记对我影响最大的一个人,75,65,41,50,49,267,未参加,
但在母亲那儿，当我轻而易举地{CC的}背出四句诗文时，总会有一点的奖励。,199505529529100015,泰国,1,199505,学习汉语的苦与乐,90,95,88,87,99,457,A,
第二{CC2下}次考试的时[C]候[L]获[C]得[C]了好成[C]绩。,199505104523200012,韩国,2,199505,记对我影响最大的一个人,60,55,54,36,35,221,未参加,
我{CD的}班中一个同学家庭[C]很贫困，他不能交{CC叫}学费的时候，我们班的同学都很担[B但]心他，我们就{CC都}{CD在}一起[C]去找我们班的老师。,199505104523200079,韩国,2,199505,记对我影响最大的一个人,65,65,36,40,53,243,未参加,
在{CC当}我高中一年级的时候，朋友劝我一起去教堂。,199505104523100089,韩国,1,199505,记对我影响最大的一个人,60,60,86,69,55,312,未参加,
为了买这张票，打一月前我就东奔西跑，好[B毫]不容易才买到的。,199505104525200116,日本,2,199505,记对我影响最大的一个人,80,85,68,65,67,359,C,
也许你们也曾听过或读过他那“人最宝贵的是生命，…”那句铿锵有力{CC铿锵有声}的名言，[BC.]他使我懂得人活着的意义和活着的价值。[BC.],199505104540100138,印度尼西亚,1,199505,记对我影响最大的一个人,90,95,70,65,92,410,B,
她对所有困难一点都不害怕的精[B经]神仍然在我的记忆中。[BC.],199505104529200151,泰国,2,199505,记对我影响最大的一个人,80,80,46,57,57,312,C,
我认为应该是我的哥哥。,199505104525100197,日本,1,199505,记对我影响最大的一个人,65,75,52,57,74,310,C,
我现在年龄[C]也小，没有经验。{CD我},199505104523100213,韩国,1,199505,记对我影响最大的一个人,55,60,52,44,55,247,未参加,
现在[BQ，]在我自己思想中[BQ，]我常发现她的{CJ-dy思想}{CQ的}痕[B退]迹[C]。,199505104634100228,英国,1,199505,记对我影响最大的一个人,70,55,52,57,65,283,未参加,
所[C]以我从小开始对他有一种厌[C]烦的心情[C]。,199505104525100264,日本,1,199505,记对我影响最大的一个人,60,70,54,67,61,297,未参加,
如果没有母亲在背后支持我，可能我不会有现在的成绩。,199505104540200273,印度尼西亚,2,199505,记对我影响最大的一个人,70,70,44,32,53,257,未参加,
她在我校从事{CJ-by教育工作}五六年[C]了，她的教[C]书本事相当高{CJ+zxy水平}。,199505104513100292,柬埔寨,1,199505,记对我影响最大的一个人,70,55,28,46,49,232,未参加,
我有这[C]样的父亲非常自豪，将[C]来[C]长大以后我也要像[B象]他一样，{CJ+zy很}关心[C]社会和家庭。,199505104540100288,印度尼西亚,1,199505,记对我影响最大的一个人,65,80,65,59,63,320,C,
那时，我才进入中学。,199508680519100523,马来西亚,1,199508,记对我影响最大的一个人,85,80,81,73,84,396,B,
我认为结果恰好相反；不离婚反而会造成社会问题。,200010512501150002,中国,1,200010,我对离婚问题的看法,80,90,97,90,95,447,A,
如果真的离婚后，做父亲的应该要覆行法律的规[F規]定：每个月都要付赡养费。,200010512501250011,中国,2,200010,我对离婚问题的看法,80,85,83,75,93,410,B,
人的品流复[F複]杂[F雜]。[BC.],200010543501250006,中国,2,200010,我第一次……,75,80,65,68,85,364,B,
当[F當]爱[F愛]情因某些原因而失去，婚姻亦应[F應]该[F該]终结。,200010602801250002,澳大利亚,2,200010,我对离婚问题的看法,80,75,75,83,85,389,B,
不知道是从什么时候开始，从人类生活中自然占的比率越来越少{CC1减少}了。,200005108523200280,韩国,2,200005,关于用自然之声取代噪声的建议,70,75,83,90,72,379,B,
最近环保部门设想以自然之声取代噪声是｛CQ为｝符合人们的这种要求而提出的。,200005108523100296,韩国,1,200005,关于用自然之声取代噪声的建议,70,70,70,50,76,324,C,
那么怎么改呢？,200005108523200346,韩国,2,200005,关于用自然之声取代噪声的建议,70,70,80,67,67,342,C,
在前面我言及{CJ+buy到}刺耳的汽气喇叭声，那样声音可以换成大海的波涛声，将恼人的电话铃声换成小河的流水声。,200005108523200401,韩国,2,200005,关于用自然之声取代噪声的建议,60,60,18,42,48,210,未参加,
对于选择朋友，我并[F並]不设[F設]下太苛求的标准。,199711802501100016,中国,1,199711,我选择朋友的标准,80,80,80,79,87,398,B,
童年对我来说很自由的。{CJsd},199705104543200086,香港,2,199705,我的城市/乡村生活,90,80,77,83,94,419,B,
我大学生时，曾经去过日本北海道的农村。,199705104525100529,日本,1,199705,我的城市/乡村生活,65,60,55,76,68,307,未参加,
如果某一个人让我选择一个地方的话，我难决定，我肯定对他说：“我要星期一到星期五在城市生活，每逢周末就到乡村生活。,199705104523200532,韩国,2,199705,我的城市/乡村生活,70,65,60,58,63,302,C,
城市里组办了许多学校，建了不少百货商店，供人购物．我的城市生活是：一是工作，我从星期一至星期六上班，[BC．]星期日休息。[BC．],199705529529251017,泰国,2,199705,我的城市/乡村生活,70,55,60,34,69,272,未参加,
但最好还是{WWJ},199705610501100015,中国,1,199705,我的城市/乡村生活,85,60,83,70,68,354,C,
我从[F從]小在小康家庭{CJX}成长[F長]，父母给[F給]我{CD很}足够[F夠]物质[F質]{CJ+zxy享受}，我的人生道路也是由他们[F們]安排{CC铺[F鋪]派}的，小时[F時]候我没有受过[F過]什么[F麽]挫折{CD可言}，因一切困难[F難]也由爸妈[F媽]代为[C]解决。,199810801543250026,香港地区,2,199810,如何面对挫折,80,70,56,73,73,342,C,
挫折{CJ+wy是}给我们反醒，锻[B缎]练[F練]的机会，{CJ-zy可以}籍着这些机会把自己的炼[B鏈]得更加坚[F堅]强。,199810602634150009,英国,1,199810,如何面对挫折,70,65,78,71,77,347,C,
我的母语是赛语，跟汉语一点关系也没有。,199804123623200053,南斯拉夫,2,199804,学习汉语的苦与乐,70,65,42,45,46,254,未参加,
初学时，我们就经常把话说倒了，弄得老师同学啼笑皆非。,199804123542100058,越南,1,199804,学习汉语的苦与乐,90,90,69,89,99,435,B,
学一门外语，不是一件容易的事情，{CJ+zy都}要很用功的学习态度{CJy}。,199804123523100135,韩国,1,199804,学习汉语的苦与乐,85,75,69,67,50,338,C,
看什么样的电视节目，去看话剧，去看电影，我都爱看，非常有意思[L]，这可以说明我的汉语水平提高了，我想到这儿，心情非常愉快。[BC，],199804123523200120,韩国,2,199804,学习汉语的苦与乐,90,80,78,64,62,369,B,
可现在我会说汉语和{CJ-zy能}听懂中国人说话，这就是学习汉语的乐。,199804123523200151,韩国,2,199804,学习汉语的苦与乐,75,80,51,54,56,307,C,
学习汉语的困难{CC苦难}有四方面，有四个难点：[BC。]第一是学好写法；[BC。]第二是学会声调[Pdio]；[BC。]第三是记住[B主]汉字的意义；[BC。]第四[BD，]知道说话的时候儿怎么用。,199804123635200210,俄罗斯,2,199804,学习汉语的苦与乐,60,55,48,32,46,222,未参加,
可以{CQ跟}中国人交往而且{CC2而}能知道他们的文化习惯[BQ，]这是对我{CQ来说}{CJ+zy都}很新鲜的事儿。,199804124523200398,韩国,2,199804,学习汉语的苦与乐,65,55,75,45,46,268,未参加,
我毕业回国后，继续跟他们联系，以免让我的汉语水平落后退步{CC不会}。,199804124523200455,韩国,2,199804,学习汉语的苦与乐,70,60,54,59,58,286,未参加,
到北京已经四年多了，可能你们觉得我学习汉语学得不错吧。,199804124523200479,韩国,2,199804,学习汉语的苦与乐,75,65,60,52,48,287,C,
铃[F鈴]……铃[F鈴]{CQ一响}，{CJX}学[F學]校就在我家隔壁，{CJ-zhuy我}{CJ-zy就}飞[F飛]快地跑进教室，两{CC二}分钟[F鐘]刚刚好，老师[F師]还[F還]没进学[F學]校。[BC，],199910512501250007,中国,2,199910,我的童年,65,80,48,47,70,298,未参加,
因为我在日本学过汉语，所以{CC于是}我的分班考试的成绩比较好，老师们就决定让{CC使}我念二年级了。,199904123525200085,日本,2,199904,如何面对挫折,65,65,56,80,72,322,C,
那时候我自己想，我还是一个孩子，[BC。]所有的事情我自己处理。,199904123523200087,韩国,2,199904,如何面对挫折,70,65,48,47,37,253,未参加,
当时我想找一个好办法。,199904123523100196,韩国,1,199904,如何面对挫折,55,55,37,32,41,200,未参加,
我赶快就回家去后{CJZR}，哭着哭着怎么也停不了[L]眼泪。,199904123525200231,日本,2,199904,如何面对挫折,65,65,45,65,69,293,未参加,
我是{CD也}跟中国学生一起考专业考试上本科的。,199904123523200250,韩国,2,199904,如何面对挫折,60,60,34,44,37,217,未参加,
我回国后就看{CC找}跟中国有关的公司有没有工作，[BC？]结果呢，还是没有公司雇我的{CJsd}。,199909529525251015,日本,2,199909,如何面对挫折,65,75,51,71,62,311,C,
记得[F畢]业时，我们全家有人都为他设宴[B延]庆祝。,199909529529151012,泰国,1,199909,如何面对挫折,70,80,39,30,56,265,未参加,
