错句,作文编码,国籍,性别,考试时间,作文题目,口试分数,作文分数,听力分数,阅读分数,综合分数,总分,证书
一般来说“老师”指的是在学校里的“老师”[BQ，]而有教{CC1教育}知识{CD方面}给学生的任务。[BC，],200505204529200447,泰国,2,200505,父母是孩子的第一任老师,70,55,56,45,67,277,未参加,
其三，父母的兴趣爱好无不影响着孩子，要培养孩子跟上时代的步伐。,200505205542100157,越南,1,200505,父母是孩子的第一任老师,85,70,73,75,91,385,B,
新时代的发展带领着人类走向机械化的时代，[BC.]人们的兴趣和交往方式都日新月异[B弈]，不单单只局限[B献]于以前的邻[B领]居式的往来和亲朋好友{CC亲同戚友}的电话[BQ。]由于电脑科技的发展，[BC。]ICq和互联网都已经变为结交女朋友的方式之一了。,200505951501150009,中国,1,200505,最理想的结交方式,70,60,68,62,79,324,C,
但他们[F們]都有各自{CJ-dy不同}的相遇情况。,200505522522250032,缅甸,2,200505,最理想的结交方式,50,70,41,53,48,245,未参加,
很奇怪有些人一见[F見]就彼此相爱[F愛]，人们都说这是“一见[F見]钟情”。,200505522522250032,缅甸,2,200505,最理想的结交方式,50,70,41,53,48,245,未参加,
还是活泼开朗或是冷静内向，还是……[BD。]也许我的这个[F個]方法{CQ对}有的人并[F並]不适用，但那是我理想的认识方法[BQ。]你了解了她的性格，对于以后你俩是否能共筑[F築]一个[F個]幸福美丽的家庭[BD。]有很大的{WWJ},200505522522150038,缅甸,1,200505,最理想的结交方式,60,70,66,82,88,351,C,
缘分[B份][BD’]是不[C]能忽视或{CC而}不[C]信的，古言曾说[F説]“有缘千里{CD瓢瓢}来相[B想]见，无缘相[B想]见不相[B想]识[F識]”。,200505522522210009,缅甸,2,200505,最理想的结交方式,55,60,45,42,59,242,未参加,
内容就靠你自己来读、写、念等。,200505332529100013,泰国,1,200505,父母是孩子的第一任老师,70,90,58,45,54,310,C,
孩子幼时接触最多、接触时间最长的就是父母。,200505024522200383,缅甸,2,200505,父母是孩子的第一任老师,40,40,58,39,85,234,未参加,
最后我要再说一次[BQ，]这句话是真的很有道理。,200505024542200397,越南,2,200505,父母是孩子的第一任老师,65,70,56,63,52,292,C,
孩子会[F會]留意父母的一举[F舉]一动，听[F聽]他们[F們]教导[F導]的每一句话，从[F從]而学到{CC懂}很多东西。,200509801634250008,英国,2,200509,父母是孩子的第一任老师,75,50,44,79,84,316,未参加,
本人是xxx小姐，今年二十五岁。,200509534533250140,新加坡,2,200509,一封求职信,55,65,73,62,77,314,C,
目前正担任新乐旅游公司的经理。,200509534533250140,新加坡,2,200509,一封求职信,55,65,73,62,77,314,C,
2003年的作品更代表新加坡参加了由法国举办的第四十届广告设计比赛，获得安慰奖。,200509534533250164,新加坡,2,200509,一封求职信,75,75,82,64,84,370,B,
我希望能成[L]为公司的一份子并对贵公司有贡献。,200509534533250172,新加坡,2,200509,一封求职信,60,70,88,58,91,352,C,
本人虽没古代西施的花容月貌，但本人五官端正，清秀，脸上时时都会带着亲切的笑容。,200509534533250176,新加坡,2,200509,一封求职信,75,65,82,69,73,351,B,
我毕业于{CC至}新加坡国立大学旅游科，在旅游业{CD工作}有两年的{CQ工作}经验。,200509534533250192,新加坡,2,200509,一封求职信,70,70,77,62,91,358,C,
我曾在中国居住过{CC了}两年，游过{CD了}中国不少大城市，{CJ+zy就}例如：北京、上海等，对中国的文化也大有了解{CC所知}。,200509534533250195,新加坡,2,200509,一封求职信,0,75,75,51,75,272,未参加,
流行歌曲是最近社会的一种潮流{CC风流}。,200510111523200770,韩国,2,200510,我看流行歌曲,80,80,63,69,69,353,B,
还有不能侵犯{CC侵害}别人的自由。,200510111523100779,韩国,1,200510,我看流行歌曲,50,60,28,36,32,186,未参加,
很多人很关心{CQ唱}这流行歌曲的是什么样的人，[BC。]很关心{CJX}对歌手。,200510111523200818,韩国,2,200510,我看流行歌曲,55,55,42,42,42,216,未参加,
每当[BD，]我心情[C]不好的时候[C]，就喜欢{CJ-sy听}比较悲伤的流行歌曲。,200510111407200823,朝鲜族,2,200510,我看流行歌曲,65,90,70,61,84,361,C,
尤其是小学生、中学生喜欢的程度{CC样子}太过分。,200510111523100825,韩国,1,200510,我看流行歌曲,65,70,44,40,47,252,未参加,
流行歌曲有好处，也有坏处。,200510111523200836,韩国,2,200510,我看流行歌曲,65,70,53,52,57,283,未参加,
每个国家的音乐，歌曲都表现{CC表实}他们的文化。,200510111616100849,德国,1,200510,我看流行歌曲,70,60,46,26,40,227,未参加,
所以我觉得成为一首流行歌曲的确是不容易。,200510111523200861,韩国,2,200510,我看流行歌曲,60,65,65,61,52,286,C,
因为这样的原因我听这种音乐的时候有{CC1感到}现实感和同调{CY}感。,200510111523100881,韩国,1,200510,我看流行歌曲,65,75,74,59,77,337,C,
随着社会发展，人们的想法也是改变{CJsd}。,200510111523100890,韩国,1,200510,我看流行歌曲,55,65,46,50,47,245,未参加,
我觉得流行歌曲{CD是}反映[B应]了当时的社会问题和热点，当然大部分歌曲的主题[B体]就是爱。,200510111523100895,韩国,1,200510,我看流行歌曲,55,60,37,50,52,235,未参加,
我很喜欢流行歌曲。,200510111523201035,韩国,2,200510,我看流行歌曲,70,70,56,36,59,279,未参加,
我不太喜欢流行歌曲的另一种原因是，除了流行歌曲还有许多值得去听的音乐。,200510111523101041,韩国,1,200510,我看流行歌曲,60,75,86,75,62,344,C,
随着经济的发展，人们生活节奏越来越快而且生活中的压力很大。,200510111523201255,韩国,2,200510,我看流行歌曲,70,80,70,67,74,351,B,
虽然他们不出现在电视等较大的范围内，但是在酒吧或者自己的小演唱会里做很多活动。,200510111523201264,韩国,2,200510,我看流行歌曲,65,60,67,63,62,300,C,
不管{CC虽然}认识不认识，有人唱那些歌，都感到一致感，[BC。]都在心里想“[BC‘]我们都是韩国人！,200510111523201872,韩国,2,200510,我看流行歌曲,60,60,60,48,69,279,未参加,
我能知道中国朋友喜欢哪种歌曲，关心哪个方面。,200510111523201875,韩国,2,200510,我看流行歌曲,60,55,56,34,37,223,未参加,
我关心的只是那个歌手和歌曲，没有我自己。,200510111523201876,韩国,2,200510,我看流行歌曲,80,60,39,36,42,244,未参加,
因为喜欢歌星们而喜欢到痴迷是不太好的行为，我认为歌星也是一个人吧，他们又不是神或者什么完美的东西，他们也肯{CC根}定有缺点，在这世界上有什么东西是完美的？,200510205540100087,印度尼西亚,1,200510,我看流行歌曲,60,70,65,50,57,287,未参加,
歌手们出场以后他们看起来{CQ在}唱歌，但是那只是个假动作，他们害怕万一他们唱错了，那么观众们会失望，有的人可能不喜欢他们了，所以他们得假唱。,200510302523100007,韩国,1,200510,我看流行歌曲,75,70,58,52,72,316,C,
有节奏快的，也有节奏慢的。,200510302523200020,韩国,2,200510,我看流行歌曲,75,70,72,75,89,370,B,
虽然有的歌不符合我所说的内容，但是现代社会中，成千上万的人喜欢听流行歌曲。{CP听流行歌曲是他们享受生活的一部分，可值[B直]得支[B技]持。P},200510302523200037,韩国,2,200510,我看流行歌曲,75,80,51,54,79,330,C,
那么我来说一说这种的说法。,200510302523200051,韩国,2,200510,我看流行歌曲,70,55,39,26,57,231,未参加,
年青{CD人}的时候，喜欢流行歌曲的人，长大以后都适应社会。,200510302523100079,韩国,1,200510,我看流行歌曲,65,60,60,50,55,273,未参加,
一种是歌曲不是很好，但是唱那首歌的歌星非常好看、有名所以流行的歌曲。,200510302523200092,韩国,2,200510,我看流行歌曲,65,60,63,30,50,251,未参加,
我的弟弟上幼儿园的时候，我的爸爸参加{CC参观}了演唱会{CC3演会}。,200510302523100108,韩国,1,200510,我看流行歌曲,60,60,56,50,62,270,未参加,
流行歌曲总是有着非常多的听众。,200510302523100118,韩国,1,200510,我看流行歌曲,65,45,46,34,40,209,未参加,
有人如果问{CJX}这样的话，我们能无题[C]{CY}地回答，“这首歌很好听。,200510302523200122,韩国,2,200510,我看流行歌曲,65,70,51,36,57,265,未参加,
这一点是流行歌曲带来{CC到来}的弊端。,200510302523200188,韩国,2,200510,我看流行歌曲,60,50,72,48,50,260,未参加,
很多人都喜欢听流行歌曲{CJ-zxy的原因}不仅在这一些，{CJ-sy还有}通过媒体看到歌手在舞台上跳舞唱歌时，观众有一种满足感。,200510302523200194,韩国,2,200510,我看流行歌曲,80,80,72,67,87,378,B,
”我觉得[C]这句话不对。,200510302523100214,韩国,1,200510,我看流行歌曲,70,65,58,61,59,299,C,
不太喜欢流行歌曲。,200510302523200216,韩国,2,200510,我看流行歌曲,60,45,42,28,57,210,未参加,
当然，这其中也包括正面和负[B复]面的影响：当听者以正确{CC端正}的态度去欣赏它时，这可以使听者心旷神怡，帮助听者放松在{CC以}工作、学习中紧绷的神经。,200510529529251023,泰国,2,200510,我看流行歌曲,70,75,77,79,99,389,B,
在我们泰国中，也有好多位歌星，对音[C]乐很有造诣{CC深造}，歌词内容对社会都有处世[C]的警戒。[BC！],200510529529251030,泰国,2,200510,我看流行歌曲,60,50,49,48,57,244,未参加,
因为我的母语不是汉语，这些歌曲教了我好多词或是成语。,200510540540200051,印度尼西亚,2,200510,我看流行歌曲,65,85,67,56,74,337,C,
我喜欢英文流行歌曲，喜欢那些不十分快的、[BC，]轻松的，旧的流行歌曲我更喜欢，就像那几首[BQ《]Elyway[BQ》]、[BQ《]GreenGreengress[BQ》]、[BQ《]sandmethepath[BQ》]等歌曲[BQ，]那是我高中时最喜欢听的歌曲。,200510540540200054,印度尼西亚,2,200510,我看流行歌曲,75,70,63,54,87,338,C,
至于对流行歌曲，真不是说什么没兴趣，但对我来说，如果哪首歌曲很吵杂，有点疯狂还不如不听的好，可能这与我的性格有关吧！,200510540540200070,印度尼西亚,2,200510,我看流行歌曲,50,80,60,36,69,280,未参加,
人人都说相爱容易相处难，只有通过逐渐的了解和逐步的倾心才能够让男女感受到男女之间结交的有趣之处。,200505680519250002,马来西亚,2,200505,最理想的结交方式,80,90,91,82,91,429,A,
另一对伴侣，可能因为时间或环境上的变迁，导致他们最终以分手收场。,200505680519250020,马来西亚,2,200505,最理想的结交方式,70,90,86,84,95,418,B,
我也曾[C]经有过两{CC2}段情，从[F從]朋友发展{CC增長}为恋人{CC愛伴}[BQ，]但是那[B哪]种感觉[C]没带来给[F給]我{CJX}这么深的[L]思念。,200505542542230006,越南,2,200505,最理想的结交方式,65,70,43,24,48,236,未参加,
我在这里过得很幸福，这里有很多朋友，他们对我一直是很好{CJxw}。,200104124523200004,韩国,2,200104,一封写给父母的信,70,70,74,61,51,314,C,
那时候，因为这种相识的方式是最有可能发生的，它便是男女之间最理想{CQ的}相识的方式。[BC.],200505651634150002,英国,1,200505,最理想的结交方式,85,65,52,55,64,310,C,
也可以了解我爸爸的辛苦。,200104124525200066,日本,2,200104,一封写给父母的信,65,75,27,51,47,252,未参加,
我给{CD了}你们打了电话。,200104124525200105,日本,2,200104,一封写给父母的信,65,55,41,56,47,246,未参加,
那现在开始说我的事情吧，爸、妈，我最近蛮[B满]好的，我不仅学习好、而且跟朋友关系也都蛮[B满]好{CQ的}。,200104124523200140,韩国,2,200104,一封写给父母的信,70,75,36,37,47,254,未参加,
但是可惜的是[B事][BD，]我从星期一开始{CJ-sy进行}毕业考试，[BC、]所以我应该准备考试[BQ，]无法打网球。,200104124525100262,日本,1,200104,一封写给父母的信,70,75,36,49,47,266,未参加,
我小的时候，他们管我管得太死。,200104124525200269,日本,2,200104,一封写给父母的信,65,65,74,61,54,303,C,
不过我长大来北京读书以后，好像[B象]{CJ+zhuy我}有了很大的变化，便是我会写给父母一封充满爱的信{CC爱情特别丰满的信}，有可能是离开父母的怀抱以后{CQ才}感觉[L]到他们的爱{CC1爱情}的缘故吧。,200104124523200282,韩国,2,200104,一封写给父母的信,70,70,60,61,72,321,C,
季翔同志：本人得知贵公司正在招聘，感到非常高兴，决定积极向贵公司求职，希望在贵公司当广告设计师。,199200003634100009,英国,1,199200,一封求职信,,,0,0,0,0,未参加,
首先，因为我从小到现在{CQ都}非常喜欢画画。,199200204525200019,日本,2,199200,一封求职信,,,0,0,0,0,未参加,
二是广告设计师两名，[BC。]这是为了让{CC给}大家知道我们的服务内容或{CQ为了}展览商品。,199200204525100027,日本,1,199200,一封求职信,,,0,0,0,0,未参加,
但我心里话{CJX}对你说，[BC、]我刚从日本来{CQ了}一个多月，[BC、]我的汉语水平很不好，[BC、]所以不知能不能跟公司的领导很迅速地{CC的}联络。,199200204525100039,日本,1,199200,一封求职信,,,0,0,0,0,未参加,
我在日本待了一年，上{CQ了}一个东[F東]京的大学。,199200204616100033,德国,1,199200,一封求职信,,,0,0,0,0,未参加,
我{CD很}{CQ在}一个美{CQ国}贸易公司工作了两年。,199200204722200010,莱索托,2,199200,一封求职信,,,0,0,0,0,未参加,
不过，情况完全不一样。,199604123525100061,日本,1,199604,如何看待“安乐死”,55,60,56,47,49,248,未参加,
世界上我们看如果有些病人今天不能治好，以后在不断研究上找到了办法。,199604123506100128,巴基斯坦,1,199604,如何看待“安乐死”,70,60,27,20,39,200,未参加,
总而言之，我认为“安乐死”可不可以取，我们应该看周围的情况{CD为主}。,199604124529200195,泰国,2,199604,如何看待“安乐死”,65,65,56,59,54,283,C,
在法律上，按照得了不治之症的妻子的要求来帮助她自杀的丈夫是罪人。,199604123525100161,日本,1,199604,如何看待“安乐死”,60,45,48,64,54,249,未参加,
我认[B让]为安乐死是应该承认的。,199604123525100164,日本,1,199604,如何看待“安乐死”,60,60,42,54,47,245,未参加,
若不能跟一般人一样生活，至少形式上{CC3意思表示}也不可以的话，只维持生命有什么意义{CC意味}呢？,199604123523200355,韩国,2,199604,如何看待“安乐死”,65,60,66,74,62,310,C,
还有为了一个人[BD（]的[BD）]生命维持{CJX}的{CJ-sy造成}周围人的牺牲{CD呢}。[BC？],199604123523200355,韩国,2,199604,如何看待“安乐死”,65,60,66,74,62,310,C,
是什么原因让他们这样的呢？{CJ+zhuy我},199610512501250004,中国,2,199610,如何解决“代沟”问题,80,80,44,38,53,287,未参加,
这样的{CJ-zxy事情}是韩国里面常常发生的。,199610550523190015,韩国,1,199610,如何解决“代沟”问题,60,55,28,46,32,202,未参加,
在工作[C]的时间当中，他们可以见面，而且一起说话。,199610550523290019,韩国,2,199610,如何解决“代沟”问题,75,65,36,38,41,242,未参加,
现在对我们来说，要的是理解和爱情。,199610550523190055,韩国,1,199610,如何解决“代沟”问题,70,75,0,50,53,237,未参加,
因为韩国具有儒教思想，年龄[C]小{CQ的}人要尊重年龄[C]大{CQ的}人，还有重男轻女，可是在这里{CC这段}的主要内容是儒教的五伦[C]“长幼有序”。,199610550523290076,韩国,2,199610,如何解决“代沟”问题,65,60,36,32,41,217,未参加,
比如说，按年纪的大小，[BC、]最年轻{CQ的}人承担[B坦]下山抬水{CQ工作}，[BC、]第二{CQ的}承担打扫庙里{CQ的工作}，最老的和尚承担做菜{CQ工作}。,199603533525100027,日本,1,199603,由“三个和尚没水喝”想到的……,75,65,44,60,44,275,未参加,
还有一个方法是养[F養]牛马坐{CQ着}它们下山抬水。[BC，],199603533525100027,日本,1,199603,由“三个和尚没水喝”想到的……,75,65,44,60,44,275,未参加,
我俩偷偷地拿{CC偷}了冰箱里的汽水，零食，跑到隔壁阿毛家中看电视。,199603533533200056,新加坡,2,199603,由“三个和尚没水喝”想到的……,90,80,71,72,94,402,B,
人民生活在水深火热中他们却日夜歌舞，{CJ-zhuy这}成了强烈的对照。,199603533533100068,新加坡,1,199603,由“三个和尚没水喝”想到的……,85,85,77,51,51,344,C,
尽管{CC直到}第二个和尚的出现[F現]，他还是照做不误[F誤]。[BC，],199603533533100093,新加坡,1,199603,由“三个和尚没水喝”想到的……,65,80,69,56,65,323,C,
现在的人比以往更加看重私欲，古时候的和尚都如此（虽然是传说），{CD今时}今日的我们就更{CC1更加}不用说什么{CQ了}。,199604680519100514,马来西亚,1,199604,由“三个和尚没水喝”想到的……,65,85,69,79,100,388,C,
我认为这个故事好像[B象]现在人和资源的关系。,199605104525100049,日本,1,199605,由“三个和尚没水喝”想到的……,60,50,27,58,49,224,未参加,
”P}于是他下决[C]心每天都要到山底下自己挑水成了他的习惯{CJZR}。,199605104525100085,日本,1,199605,由“三个和尚没水喝”想到的……,65,50,41,38,49,224,未参加,
是欢迎的P}。,199605104525200147,日本,2,199605,由“三个和尚没水喝”想到的……,65,65,60,79,65,318,C,
有一天牙[C]齿心里想[BQ：][BQ“]我整天精疲力竭地工作，对我有什么好处呢？[BC。],199605104523200196,韩国,2,199605,由“三个和尚没水喝”想到的……,70,60,38,65,84,302,未参加,
我把这篇文章看完以后，突然想起来了跟这个差不多的一件事情。,199605104523200220,韩国,2,199605,由“三个和尚没水喝”想到的……,70,70,71,49,49,297,C,
对中国来说，人口问题已经成为社会问题，[BC。]进一步成为世界问题。,199605104523200234,韩国,2,199605,由“三个和尚没水喝”想到的……,65,60,44,51,51,254,未参加,
不过，我想努力去{CD做}改变我自己，[BC。]我想比{CD自己}优先{CJX}别人，这样做，也许我会比别{CD的}人做什么事都困难一些。,199605104525200231,日本,2,199605,由“三个和尚没水喝”想到的……,85,65,38,60,58,295,未参加,
科学家们现在都认为水{CD的}资源愈来愈少了[BQ，]告诫[C]人们不要破坏生态系统。,199605104501100237,中国,1,199605,由“三个和尚没水喝”想到的……,80,55,46,51,56,274,未参加,
这篇{CC则}文章的大概内容{CJ+sy是}如下：很久以前，在一座高山上的一座寺庙里，有一个和尚，他一个人生活的时候，自动地每天早上到山底下挑水喝，后来又来了一个和尚时，两个人就抬水喝，可是，后来又来了别{CC1别外}的和尚时，谁也不愿[B原]意到山下去抬水。,199605104523200282,韩国,2,199605,由“三个和尚没水喝”想到的……,70,75,74,60,70,338,C,
他们希望{CC愿意}别人也是{CQ跟}自己的父母一样，{CD为自己}一心{CC衷心}地照顾自己，所以容易引起“三个和尚没水喝”的情况。,199605104523100298,韩国,1,199605,由“三个和尚没水喝”想到的……,70,70,63,74,68,333,C,
但是人多的生活比一个人的生活更方便。,199605104523200306,韩国,2,199605,由“三个和尚没水喝”想到的……,60,50,60,51,42,243,未参加,
三个和尚，你们不要追求自己的利益{CC利润[B闰]}吧。,199605104523200311,韩国,2,199605,由“三个和尚没水喝”想到的……,60,75,46,51,44,262,未参加,
我个人希望[C]每个人{CC3人家}（包[C]括我自己）更关心自己的周围[C]环[B坏]境[C]而为了{CJ-sy建设}更好的社会自觉{CC自动}地动手。,199605104525100332,日本,1,199605,由“三个和尚没水喝”想到的……,75,65,66,70,70,333,C,
我们不能[C]一下子改进社会，一步[C]一步[C]地对付吧。,199605104525100332,日本,1,199605,由“三个和尚没水喝”想到的……,75,65,66,70,70,333,C,
和尚应该[C]高尚朴素，而且应该能吃苦。[BC，],199605104525100351,日本,1,199605,由“三个和尚没水喝”想到的……,70,75,60,67,70,331,C,
三个和尚坐在一起，研究研究{CJcd}怎么找{CC得}水。,199605104523200367,韩国,2,199605,由“三个和尚没水喝”想到的……,65,60,55,58,46,267,未参加,
第二个和尚来时，他们一起抬水喝，可见[F見]他们很友好，相互协助。,199605550523290006,韩国,2,199605,由“三个和尚没水喝”想到的……,75,75,63,51,61,315,C,
所以我们应[F應]該在日常生活当中培养[F養]“谦[F謙]让[F讓]”“让[F讓]步”的习[F習]惯，[BC。]应[C]该[F該]自己做的事，[BC。]不要推到别人的身上。,199605550523290020,韩国,2,199605,由“三个和尚没水喝”想到的……,60,75,63,47,61,292,未参加,
我想[BQ，]{CQ在}这个故事中，{CJ-sy解决}那三个和尚面临的水的问题也是能够锻[B段]炼[B练]自己的一种方法。,199605550523290043,韩国,2,199605,由“三个和尚没水喝”想到的……,65,75,80,60,75,342,C,
在我的童年，我妈妈{CD常常}给我讲了那个{CC种}故事。,199605550523190063,韩国,1,199605,由“三个和尚没水喝”想到的……,70,60,77,54,54,300,C,
现代生活中，我们常常遇到这种{CC件}事情。,199605550523190063,韩国,1,199605,由“三个和尚没水喝”想到的……,70,60,77,54,54,300,C,
，这是{CJX}虽然身体很辛苦{CC艰苦}，可是一次抬水{CJ-zy能}轻松一个星期。,199605550523190070,韩国,1,199605,由“三个和尚没水喝”想到的……,60,65,49,65,61,283,未参加,
“三个和尚[C]没水喝”这句话表明了{CC着}人类[C]的一个特点，即{CC1所谓}将自己该做的事，往往叫别[C]人做。,199605550523290075,韩国,2,199605,由“三个和尚没水喝”想到的……,70,70,80,67,77,352,C,
那么这[F這]样轮[B论[F論]]流下去下山抬水，他们[F們]就有水喝了。[BC，],199605529529250148,泰国,2,199605,由“三个和尚没水喝”想到的……,60,65,44,51,46,249,未参加,
传说古时[F時]候，在一座高山上的一座庙里，有一个和尚，为了生存，他每天都要到山脚{CC山底}下自己挑水喝。,199605529529250150,泰国,2,199605,由“三个和尚没水喝”想到的……,70,65,35,38,56,250,未参加,
他没有上过学{CC1学校}。,199704123529200041,泰国,2,199704,记对我影响最大的一个人,80,90,62,56,62,345,C,
当我进初中一年级时，我的学习生活有了巨大的变化。,200110540540150105,印度尼西亚,1,200110,我的童年,65,85,68,51,90,349,C,
在生活漫长[F長]的岁[F歲]月里[F裡]，老人家都为了孩子的成长[F長]，辛苦养[F養]活我们[F們]一家人是很不容易的一件事。,200110540540150125,印度尼西亚,1,200110,我的童年,70,85,30,37,88,302,未参加,
毕业于大学旅游系，曾在旅游公司当过导游两{CC二}年，胜任愉快，与顾客的关系甚好，但因家父公职调动，全家跟着来到此地，我也只好忍痛割爱所喜欢的导游工作。[BC.],199312533533200014,新加坡,2,199312,一封求职信,85,90,78,74,80,404,B,
本人盼早日收到{CC收的}贵公司的音讯。,199312533533200050,新加坡,2,199312,一封求职信,90,80,62,67,75,369,B,
快乐家庭旅游公司闻名{CQ于}旅游业，我非常希望能为贵公司服务。,199312533533200134,新加坡,2,199312,一封求职信,80,60,69,56,75,327,C,
尊敬的李文先生，您好！,199312124525200154,日本,2,199312,一封求职信,55,85,67,83,89,367,C,
尊[B遵[C]]敬[C]的总经理我对贵{CC本}公司特别兴趣[C]{CJy}[BQ，]也想找到一个比较合适[B话]的工作。,199312124635100153,俄罗斯,1,199312,一封求职信,50,40,34,41,34,173,未参加,
本人在大学的时候，在“学生翻译协会”做过关于贸易方面、新闻方面的翻译工作，已经经过这个时间的体验[BQ，]具有了在翻释工作上所需[B须]要的基本能力、方式。,199312123523200303,韩国,2,199312,一封求职信,55,60,39,52,52,239,未参加,
1993.12.20×××,199312123525200401,日本,2,199312,一封求职信,60,70,57,54,62,288,未参加,
我相貌端正，[BC、]个子比较高。,199312124635100321,俄罗斯,1,199312,一封求职信,70,65,55,54,64,295,C,
但在中国学习，所以比韩国{CD内}学习有好处。[BC.],199312123523200407,韩国,2,199312,一封求职信,60,55,50,36,34,216,未参加,
李文先生[BQ：]您好！,199312124525100934,日本,1,199312,一封求职信,65,80,57,37,57,284,未参加,
毕业后，当过[C]某公司的经理。,199312124529100433,泰国,1,199312,一封求职信,75,60,71,37,48,277,未参加,
谢谢先生×××北[C]京1993年12月20号,199312123542100902,越南,1,199312,一封求职信,70,60,32,41,52,240,未参加,
至于容貌，希望会有机会当面详谈{CC以面相对}。,199410550523202905,韩国,2,199410,一封求职信,95,95,86,75,95,446,A,
我是祥明女子大学中文系[F係]4年级的学生[BQ，]预定在明年2月毕业。,199410550523202904,韩国,2,199410,一封求职信,55,55,48,41,53,232,未参加,
爸爸身体健康。,199412123523100004,韩国,1,199412,记我的父亲,45,90,39,38,35,234,未参加,
父亲不是只说正直[BQ，]而是{CC就是}他自己{CJ-zy也}实行。,199412123523200024,韩国,2,199412,记我的父亲,70,75,57,57,39,287,未参加,
