错句,作文编码,国籍,性别,考试时间,作文题目,口试分数,作文分数,听力分数,阅读分数,综合分数,总分,证书
吸烟不仅对个人健康，也对公众{CJ+sy产生}不利。,200405205525200196,日本,2,200405,吸烟对个人健康和公众利益的影响,60,85,68,58,88,348,C,
但是我来中国才知道了在中国很多地方可以吸烟。,200405201523100306,韩国,1,200405,吸烟对个人健康和公众利益的影响,65,70,66,58,67,312,C,
不要说别人，我爸爸也喜欢抽烟，我每次对他说，抽烟危害身体，而不只是危害个人，还影响周围人。,200405332513200018,柬埔寨,2,200405,吸烟对个人健康和公众利益的影响,65,75,71,54,85,337,C,
对我个人来说，现在的世界上不仅大人吸烟，而且小青年也如此。[BC.],200405332540100009,印度尼西亚,1,200405,吸烟对个人健康和公众利益的影响,60,60,22,37,51,212,未参加,
，心里应该倒更有个谱而不是乱点鸳鸯才是。P},200410534533250084,新加坡,2,200410,最理想的结交方式,85,90,71,67,72,381,B,
我深深{CC恳切}地相信通[C]过介绍是能寻觅到品格优良及有修养的好对象{CJsd}。,200410534533250100,新加坡,2,200410,最理想的结交方式,90,85,77,45,70,364,C,
他的短处你得多多包容，他的长处你必常常赞赏与多多学习。,200410534533250144,新加坡,2,200410,最理想的结交方式,60,90,69,63,72,344,C,
我可以确定那些人付出{CC复出}不少的广告费。,200404140540200217,印度尼西亚,2,200404,运动员收入,60,75,60,55,51,287,C,
依我看，问题的根本在于现在发达国家的大多数人从事脑力工作，天天坐办公室[C]，所以他们的兴趣爱好慢慢转向运动。,200404140635200265,俄罗斯,2,200404,运动员收入,80,75,57,67,74,344,C,
他们患上肺癌的可能性比烟民更高。,200405680519250039,马来西亚,2,200405,吸烟对个人健康和公众利益的影响,75,95,85,88,87,424,A,
烟客递增[BD，]加剧{CQ了}环境污染，烟客一人一口喷出的烟污染环境，随地乱抛的烟蒂变成垃圾，影响市容美观。,200405680519250040,马来西亚,2,200405,吸烟对个人健康和公众利益的影响,75,95,77,81,94,416,B,
这大概就是近朱者赤，近墨者黑吧！{CD一根},200405680519150050,马来西亚,1,200405,吸烟对个人健康和公众利益的影响,70,95,74,72,89,393,B,
有的{CC有者}暗中朝思暮想而不能集中精神上课；有的{CC有者}直截了当互吐情愫，谈起恋爱[BQ，]置学业于不顾。,200504534533250003,新加坡,2,200504,我对男女分班的看法,75,75,76,71,84,371,B,
一出校[D出]如色中饿鬼或出土怪物，造成在社交上的一块绊脚石。,200504534533250009,新加坡,2,200504,我对男女分班的看法,65,80,56,73,66,328,C,
教育的形式和课程内容更尤{CC显}为重要了。[BC.],200504534533250056,新加坡,2,200504,我对男女分班的看法,75,85,62,60,77,352,C,
一般[D上][BD，]女生较为早熟，[BC。]对男女关系比较早地[L]充满幻想。,200504534533150119,新加坡,1,200504,我对男女分班的看法,70,70,81,73,75,357,C,
一个能和男性或女性一起合作的人{CC人士}在社会上[D的]非常重要{CD了}。,200504534533250113,新加坡,2,200504,我对男女分班的看法,70,75,87,73,70,364,B,
但一放学，那些学生还是可以到别的学校或到网上找对象。,200504534533150153,新加坡,1,200504,我对男女分班的看法,55,65,56,69,64,291,未参加,
学校是社会的缩影，家长如果真的是为子女着想的话就会让他们趁早与异性接触，学会如何沟通、应付，让他们以后步入社会后不会吃亏。,200504534533250183,新加坡,2,200504,我对男女分班的看法,65,85,81,82,91,394,B,
这对他们往后待人接物{CC处人待物}会有较平衡的发展。,200504534533250186,新加坡,2,200504,我对男女分班的看法,80,85,81,84,86,410,B,
我对“父母是孩子的第一任老师”这个想[C]法，很{CC1可以}赞[C]成。,200505109525100082,日本,1,200505,父母是孩子的第一任老师,70,70,74,77,69,348,C,
第一，父母是孩子在世界上最早认识的人。,200505109616100502,德国,1,200505,父母是孩子的第一任老师,75,65,52,38,43,260,未参加,
但我[C]们可不是{CJ-zy无意识地}受到身边所有人的影响。,200505109525100892,日本,1,200505,父母是孩子的第一任老师,65,65,52,49,61,276,未参加,
因此，我赞[C]成这一看法。,200505109525200907,日本,2,200505,父母是孩子的第一任老师,80,90,87,58,79,389,B,
如果父亲经常喝酒很晚回家，母亲不重视家务、[BC，]卫生，孩子肯定会向他们学习这些坏事；[BC，]如果父母喜欢看书，[BC、]对科学感兴趣，孩子当然也会养成这{CJ+dy此}好的习惯。,200505109623200924,南斯拉夫,2,200505,父母是孩子的第一任老师,70,65,52,47,59,279,未参加,
一切孩子都以父母为鉴[C]地成长，所以父母是兼任{CC2兼}老师的。,200505109525201138,日本,2,200505,父母是孩子的第一任老师,60,75,57,62,78,318,未参加,
小孩子的动作、说的话等等，都是从家里学的。,200505109540201169,印度尼西亚,2,200505,父母是孩子的第一任老师,75,90,46,35,45,285,未参加,
在她看来，时间简直是永远都停顿在一个地方，好像永远都不会流失似的。,200505109525201206,日本,2,200505,父母是孩子的第一任老师,65,40,71,78,92,324,未参加,
如果父母不告诉孩子他们知道的东西，结[F結]果会很坏[B环]。,200505109525101621,日本,1,200505,父母是孩子的第一任老师,80,65,52,63,69,317,C,
如果我的爱好不是棒[C]球的话，可是是[C]跟好朋友们永远[C]不认识。,200505109525101681,日本,1,200505,父母是孩子的第一任老师,50,75,50,55,67,281,未参加,
我的很多朋友也是这样，当然程度不一样，但是大家都有跟{CC从[C］}爸爸、[BC，]妈妈学的。,200505109525101706,日本,1,200505,父母是孩子的第一任老师,75,60,48,63,72,304,未参加,
有一次，我[C]的朋友对我[C]说别的人[L]的坏话。,200505109525202041,日本,2,200505,父母是孩子的第一任老师,65,70,52,67,72,312,C,
我喜欢听收音机，这可能是受到妈妈的影响。,200505109525202335,日本,2,200505,父母是孩子的第一任老师,70,75,66,72,73,345,C,
好的老师应该把握学生的优点、[BC，]缺[B卸]点。,200505109525202420,日本,2,200505,父母是孩子的第一任老师,65,70,61,63,87,332,C,
所以父母教育孩子时，应该给孩子良好的影响，否则就会影响到孩子的未来。,200505109525202463,日本,2,200505,父母是孩子的第一任老师,65,70,52,73,87,333,C,
互相说出自己的看法，[BC、]孩子错了，[BC、]父母必须得批评他。,200505109525202570,日本,2,200505,父母是孩子的第一任老师,90,90,63,65,56,362,C,
因为这个苹果，他看见了父母所要传授于他的道理：要想成功就须去努力争取。{CD因为},200505205519200054,马来西亚,2,200505,父母是孩子的第一任老师,95,85,86,75,91,430,A,
我问[F問]她为[F為]什么要这么快结[F結]婚，我以为[F為]是某种原因[BD，]逼不得已[B以]才结[F結]的。,200505522522250006,缅甸,2,200505,最理想的结交方式,70,75,66,60,73,333,C,
但人类最基本的生存与发展条[F條]件之一是传宗接代。,200505522522110013,缅甸,1,200505,最理想的结交方式,70,70,73,49,77,327,C,
如果说父母[D父]对孩子的态度{CC行为}是很温柔的，那么说孩子对别人很可能也有很和气的{CJX}一个态度。,200505209616200082,德国,2,200505,父母是孩子的第一任老师,65,55,20,25,45,192,未参加,
所以我非常希望，所有{CJX}天下父母{CJ-zy都}应该具有健康的思想、[BC，]积极[B级]的行为，[BC。]这样你们的孩子才能成为{CQ对}社会有用的人才。,200505209542200102,越南,2,200505,父母是孩子的第一任老师,65,95,76,71,85,383,B,
我国小学的孩子总会自己做一个问卷。,200505206547200132,哈萨克斯坦,2,200505,父母是孩子的第一任老师,80,60,56,55,50,288,未参加,
这方面我们从学校没有得到{CD的}而由{CC从}家教{CD出}给我们。,200505332540200002,印度尼西亚,2,200505,父母是孩子的第一任老师,70,65,48,41,36,246,未参加,
所以，我希望每一位家长多为自己的孩子{CJ-zxy着想}而不断地{CC的}完善自己。,200505024542200386,越南,2,200505,父母是孩子的第一任老师,65,65,71,57,63,305,C,
一个人一出生，他/她所接触到的第一人就是他的母亲或父亲。,200509801801250002,澳大利亚,2,200509,父母是孩子的第一任老师,85,70,69,85,94,394,C,
西海岸大道门牌31号新加坡9号李文先生快乐家庭旅游公司经理大华街3号新加坡5号李经理：应征经理职位《联合早报》在九月三日刊载[B裁]了贵公司的一则招聘启事，特此{CJX}写信应征。,200509534533250047,新加坡,2,200509,一封求职信,80,65,77,75,88,373,B,
我曾经担任过旅游局策划小队的队长，并领导队伍开发了一套旅游软件供旅客使用。,200509534533150083,新加坡,1,200509,一封求职信,85,70,84,77,93,400,B,
×××敬上2005年9月17日,200509534533250185,新加坡,2,200509,一封求职信,70,65,75,73,91,360,C,
有时，我们烦恼[B脑]时它们可以成为一种休息，可重要的是[BD，]不要太珍惜它，要不，不能保证安全的未来。,200510111523200011,韩国,2,200510,我看流行歌曲,60,65,49,42,64,263,未参加,
那这些事情{CC2情}对社会、我们的生活有着什么样的影响呢？,200510111523100796,韩国,1,200510,我看流行歌曲,70,70,49,38,52,267,未参加,
”我想传统的歌曲没有那么多的吸引力。,200510111523100801,韩国,1,200510,我看流行歌曲,60,65,42,24,37,211,未参加,
这是我在电视上感到的印象。,200510111523100806,韩国,1,200510,我看流行歌曲,85,75,79,67,69,367,B,
它[C]形成了文化市场，而且，它形成{CC产生}了文化主流。,200510111523100831,韩国,1,200510,我看流行歌曲,60,65,49,48,64,269,未参加,
这说明流行歌曲对我们留下的影响不少。,200510111523200865,韩国,2,200510,我看流行歌曲,50,60,44,38,52,224,未参加,
我[C]非常喜欢流行歌曲[B典]和歌星。,200510111523201106,韩国,2,200510,我看流行歌曲,50,70,42,38,59,242,未参加,
据有些医学家和心理学家说，听音乐{CD是}对人体活动会有所帮助，而且{CD对}心态不好的人如果多听流行歌曲的话[BQ，]很可能会{CJX}心态越来越好。,200510111523101346,韩国,1,200510,我看流行歌曲,70,85,53,61,67,328,C,
现代人大部分都喜欢听流行歌曲。,200510111523101582,韩国,1,200510,我看流行歌曲,65,55,44,44,55,245,未参加,
我很喜欢流行歌曲。,200510111523201628,韩国,2,200510,我看流行歌曲,75,65,58,42,55,282,C,
我只是自己控[C]制自己不达到痴迷的程度，就到享受歌曲的[C]程度。,200510111523201847,韩国,2,200510,我看流行歌曲,65,65,37,46,50,247,未参加,
孩子非常可爱，他们每个{CQ人}都拥有自己的爱好和才华。,200510919919250004,加拿大,2,200510,父母是孩子的第一任老师,85,95,77,68,96,417,B,
我也是被一首叫“童[C]年”的歌[BD，]启[B起]发了{CJ+by我}，童年很短暂，里面有一句{CC一语}“一寸光阴，一寸金，寸金难买寸光阴[BQ”]{CJ-zxy的语句}，所以一首流行歌曲对于每个{CC人}年青人{CQ来说}都抱有很多的含义。,200510520520250011,蒙古国,2,200510,我看流行歌曲,85,65,63,28,74,304,未参加,
我很喜欢外国的歌星们，他们不但唱得好，{CJ+dy他们的}身材也很不错。,200510520520250015,蒙古国,2,200510,我看流行歌曲,50,50,39,40,69,226,未参加,
人人都有自己的性格，有人非常喜欢听{CC看}流行歌曲，有人不喜欢流行歌曲。,200510302523100029,韩国,1,200510,我看流行歌曲,40,60,65,44,77,263,未参加,
为了消除这种苦恼，[BC；]我们常常听歌。,200510302523100046,韩国,1,200510,我看流行歌曲,90,65,72,71,91,380,B,
就{CD给}爸爸{CJX}问了：“这到底什么歌[BQ？]”他告诉我{CD的}是黄海，我真想知道歌词的内容，所以回家查了词典等才{CD能}知道了，那个事情以后我认真学汉语了。,200510302523100074,韩国,1,200510,我看流行歌曲,45,45,60,28,57,210,未参加,
流行歌曲总是有着非常多的听众。,200510302523200094,韩国,2,200510,我看流行歌曲,60,75,67,46,62,296,未参加,
也看过有几位女中学生因跟着歌星的车而{CQ被}撞了失去生命的事情。,200510302523200105,韩国,2,200510,我看流行歌曲,65,55,60,52,74,288,未参加,
他们说唱了很{CC多}长时[L]间[C]以后觉得心里[B理]还可以。,200510302523200140,韩国,2,200510,我看流行歌曲,50,45,46,26,35,178,未参加,
说起那些蔑视流行歌曲的人，我也理解他们。,200510302523200168,韩国,2,200510,我看流行歌曲,75,80,74,67,87,374,B,
甚至有的人没有自己的想法就看因特网排第一的就以为最好听的歌曲{CJs}。[BC，],200510302523200239,韩国,2,200510,我看流行歌曲,70,55,65,59,67,300,C,
有些人特别喜欢流行歌曲，甚至对歌星也达[C]到痴迷的程度。,200510529529251022,泰国,2,200510,我看流行歌曲,60,50,58,24,69,241,未参加,
还有很多从外国近来的流行歌曲[L]，现在是中国风的时期{CC期间}，所以从台湾进来的流行歌也是更多的[BQ。],200510529529251025,泰国,2,200510,我看流行歌曲,60,55,44,40,40,220,未参加,
如果流行音乐能像{CC与}古曲音乐那么幽雅，{CD可}不是一件可喜的事吗？,200510540540200010,印度尼西亚,2,200510,我看流行歌曲,80,85,46,44,67,316,未参加,
有时候，我认为旧的歌曲比流行歌好听得多。,200510540540200037,印度尼西亚,2,200510,我看流行歌曲,65,65,56,38,69,277,未参加,
可反过来，成功的婚姻中的男女双方往往是在结婚前有着相当程度的了解，经过相当{CJ-zxy长}时间的相处，经过慎[B懂]重考虑过的。,200505610610250011,法国,2,200505,最理想的结交方式,70,90,82,75,95,405,B,
在我的同学和朋友中，有很多人是通过网络认识了自己的对象，他们现在已经是很幸福的一对对夫妻。,200505542542230008,越南,2,200505,最理想的结交方式,75,95,61,58,82,365,C,
昨天我收到了你们春节期间寄给我的信。,200104124545100108,乌兹别克斯坦,1,200104,一封写给父母的信,70,80,30,30,56,256,未参加,
你们也知道我从小就不喜欢写信了，而且现在科学发展{CJ-wy很快}，有了电话和电子邮件{CC4电子信}了，多方[B放]便啊！,200104124542100194,越南,1,200104,一封写给父母的信,80,85,63,68,76,366,B,
今天早上妹妹从英国给我打{CQ来}电话。,200104124523200256,韩国,2,200104,一封写给父母的信,70,75,41,42,45,262,未参加,
我快要毕业了，我一直{CJX}{CC2到现在}会坚持学习，是因为你们鼓励[B力]我，帮助我。,200104124525200265,日本,2,200104,一封写给父母的信,65,75,55,47,61,290,未参加,
那也可能她当哥哥的妻子吧。,200104124525100364,日本,1,200104,一封写给父母的信,75,80,52,51,56,305,未参加,
考完试以后，我们四年级学生将开始写毕业论文了，一个月后进行论文答辨。,200104124540200374,印度尼西亚,2,200104,一封写给父母的信,75,90,66,68,63,356,B,
每年的这时期和元旦那时候，我非常想家。,200104124525200444,日本,2,200104,一封写给父母的信,70,65,66,54,63,304,C,
1989年5月以“东华服装展[BD”]销[BQ”]的广告获得首届青年广告设计赛特等奖。,199200003525200007,日本,2,199200,一封求职信,,,0,0,0,0,未参加,
4月7日××××,199200008525100004,日本,1,199200,一封求职信,,,0,0,0,0,未参加,
在我们国家也提出过这个问题。,199604123523200285,韩国,2,199604,如何看待“安乐死”,65,75,45,44,42,258,未参加,
有的命不可以按夫妇关系来决定人的命运[C]，人的命不可按两个人的身分来做{CD有}害命的事，但应该依靠法律。,199604123529100273,泰国,1,199604,如何看待“安乐死”,70,65,45,39,39,243,未参加,
有的人可能会想[C]：“难道[C]杀了自己的妻子说明你爱她？,199604123605100294,保加利亚,1,199604,如何看待“安乐死”,80,65,45,52,49,279,未参加,
如果那时候他们选择“安乐死”{CQ的}话，现在没有他，而且家里人的心情也不安{CC2不平安}。,199604123523200144,韩国,2,199604,如何看待“安乐死”,80,65,69,44,47,293,C,
总之，为了病人自己、[BC，]家属、[BC，]有一些不运的人，我赞成安乐死。,199604124523200345,韩国,2,199604,如何看待“安乐死”,70,60,66,54,52,286,C,
不知道他帮助没帮助过妻子自杀{CD的时}[BQ，]可是帮助还是不帮助那个没有关系。{CP因为一个人死了还是活者[B着]的原因下别人不会那么pù负。如果一个人直到把别人杀死的话那就不是他的问题。这里“安乐死”没有把自己他的妻子杀死的.所以他不可取P},199604123521100124,孟加拉,1,199604,如何看待“安乐死”,50,45,14,27,31,142,未参加,
我的家是个[F個]大家族，父母亲[F親]非常重视[F視]祖先的恩德，我受到他们的影响[B向]{CJ+zhuy我}也尊[C]敬祖先。[BC，],199610550523290078,韩国,2,199610,如何解决“代沟”问题,60,70,41,55,45,256,未参加,
谢谢。,199610550523290078,韩国,2,199610,如何解决“代沟”问题,60,70,41,55,45,256,未参加,
我们都要向对方学的精神的话{CJy}，代沟是没什么大不了{CC3深刻}的问题[F題]。,199610550523190092,韩国,1,199610,如何解决“代沟”问题,60,65,54,55,61,278,未参加,
在文化、教育方面，父母不应[C]过[F過]早让[C]子女接受西方教育，应[C]给予{CC2与[C]}适当[F當]母语教育。[BC，],199611543634100529,英国,1,199611,如何解决“代沟”问题,85,90,83,71,80,405,A,
我这{CQ个}年青人，本身与父母、叔婶[F嬸]也存在[L]着“代沟”的问[F問]题，不少同龄[F齡]的朋友也诉[F訴]说[F說]过他们[F們]的问题{CC过案}。{CP我认[C]为[F為]，现[F現]今“代沟”的问[F問]题[F題]比以前日益严[F嚴]重是因为[F為]社会不断地{CC的},199611543501200509,中国,2,199611,如何解决“代沟”问题,85,85,75,65,74,379,B,
孩子们也一样的情况{CJs}。,199611543523100507,韩国,1,199611,如何解决“代沟”问题,75,70,46,42,43,265,未参加,
我从“三个和尚没水喝”想到了一件事情，[BC。]这事发生在我家楼下的一间面包房。,199603533533100001,新加坡,1,199603,由“三个和尚没水喝”想到的……,80,65,44,74,75,326,未参加,
设想，假如公司聘请了几位新文员，现任文员想以旧人身份欺负新人，而新人因对工作不熟而期望旧人的帮助，这么{CC那么}一来，这些文员的工作效率反而比以前低{CC差}。,199603533533100011,新加坡,1,199603,由“三个和尚没水喝”想到的……,85,80,71,81,91,401,B,
他常以这个故事来教导{CC教训}我们。,199603533533200034,新加坡,2,199603,由“三个和尚没水喝”想到的……,90,90,63,65,80,386,C,
他每天都必须负起下山挑水的任务，给两位大师兄用{CC1供用}，日子一久，两位师兄的诡计也都一一被小师弟给识破了，虽然他口里不说出来，但心里却极为不满，他认为两位师兄既然不以身作则，那么他也可以偷懒不做事了。,199603533533200040,新加坡,2,199603,由“三个和尚没水喝”想到的……,85,65,66,76,84,365,C,
有勤劳的、爱偷懒的、好吃懒做的，等等[D等]。,199603533533200076,新加坡,2,199603,由“三个和尚没水喝”想到的……,90,80,60,56,84,365,C,
同事甲想一想：由他去吧，反正会有人来换[C]的。,199603533533200078,新加坡,2,199603,由“三个和尚没水喝”想到的……,85,80,77,58,63,356,B,
如果不能取得一定的共识[F識]，一致的目标，反而成事不足，败[F敗]事有余。,199603533533200090,新加坡,2,199603,由“三个和尚没水喝”想到的……,90,90,66,70,87,401,B,
《三个和尚没水喝》这篇故事，我小时候常常听老师{CJ-sy讲}。,199603533540200112,印度尼西亚,2,199603,由“三个和尚没水喝”想到的……,90,80,69,49,77,360,C,
”于是那个和尚就把他的方法一五一十地告诉了另外两个和尚。,199604680519100516,马来西亚,1,199604,由“三个和尚没水喝”想到的……,95,75,66,72,84,387,B,
如果两个人的话呢，这个短文也说，做起来稍微麻烦{CJ-buy一点}。,199605104525200012,日本,2,199605,由“三个和尚没水喝”想到的……,65,65,60,88,84,346,C,
但是人多了我们就必须考虑[C]两个人以上的情况。,199605104525100064,日本,1,199605,由“三个和尚没水喝”想到的……,60,65,60,76,82,326,C,
古人说：[BC，]“僧多粥少。,199605104523100112,韩国,1,199605,由“三个和尚没水喝”想到的……,70,70,77,67,68,340,C,
人越来越多，工作越来越不{CJ+zy太}好{CJ-sy做}。,199605104525200160,日本,2,199605,由“三个和尚没水喝”想到的……,75,80,74,67,70,357,B,
”等，认为给别人做点儿事是{CJ+dy一种}有点吃亏的，对自己的损失似的。,199605104525200191,日本,2,199605,由“三个和尚没水喝”想到的……,90,70,55,74,77,359,C,
每个人都有懒心。,199605104525200211,日本,2,199605,由“三个和尚没水喝”想到的……,55,80,55,54,80,310,未参加,
那也是为了自己的{CJ-zxy利益}吧。,199605104523200214,韩国,2,199605,由“三个和尚没水喝”想到的……,70,55,69,65,63,306,C,
可是问题[B提]从第三个和尚来的时候发生了。,199605104525100216,日本,1,199605,由“三个和尚没水喝”想到的……,60,65,74,58,58,298,C,
比如，拿我们的留学生活来说吧。,199605104525100236,日本,1,199605,由“三个和尚没水喝”想到的……,65,55,74,67,65,308,C,
人们往往想方设法地对{CC为}人好，很善于互相[B想]照顾。,199605104523200258,韩国,2,199605,由“三个和尚没水喝”想到的……,60,65,66,65,75,314,C,
第三个和尚来到庙里的时候，他们也很幸[B辛]福[BQ：]“朋[C]友欢迎你来！,199605104610200293,法国,2,199605,由“三个和尚没水喝”想到的……,45,50,44,47,32,195,未参加,
如果你{CD会}离开{CC排除[B余]}跟社会接触能够正常地生活下去，你不投票也可以。,199605104523200329,韩国,2,199605,由“三个和尚没水喝”想到的……,85,70,74,76,70,366,B,
一起学习的计划完全失败了。,199605104525200333,日本,2,199605,由“三个和尚没水喝”想到的……,60,65,60,83,77,328,C,
人是社会动物，可[C]是该解决的问题，应该依靠自己的力量[C]来解决，不要考虑别人给自己{CD的}帮助。,199605104525200364,日本,2,199605,由“三个和尚没水喝”想到的……,70,70,69,54,54,305,C,
我第一次跟爸爸妈妈说这件事的时候，他们担心我，而坚持反对[C]。,199605104525200375,日本,2,199605,由“三个和尚没水喝”想到的……,65,70,77,60,80,338,C,
看到垃圾的人，心里一定想{CC1想到}：[BC；]“如果我把这些拉圾捡起来，扔在果皮箱里的话，这条马路变得一定很美。,199605104525100391,日本,1,199605,由“三个和尚没水喝”想到的……,75,80,69,72,65,352,B,
他们都想等一会再说，过了一段时间有人可能{CQ会}实在忍不住{CD地}去山下抬水。,199605104525100399,日本,1,199605,由“三个和尚没水喝”想到的……,55,70,71,70,63,313,C,
读了这篇“三个和尚没水喝”的传说，我想了很多。,199605550523290057,韩国,2,199605,由“三个和尚没水喝”想到的……,65,50,58,42,61,257,未参加,
你要不要跟我品尝{CC2尝}满足我们的生活的秩序的真正滋味{CC2味}{CQ呢}？,199605550523190065,韩国,1,199605,由“三个和尚没水喝”想到的……,70,80,52,60,68,320,C,
像鸟叫似的高音，特别好听。,199704124525200299,日本,2,199704,记对我影响最大的一个人,75,80,45,43,55,289,未参加,
后来，中学的国文老师余得仙{CD很}常来我家，在我房里一坐就是整个上午。,200110540540150058,印度尼西亚,1,200110,我的童年,70,80,71,75,72,358,B,
而现在，我的孩子们，不知萤[F螢]火虫为何物，[BC？]他们只知道坐在电子游[Y遊]戏机前。,200110540540250060,印度尼西亚,2,200110,我的童年,80,90,55,47,85,352,未参加,
不过我还小的时候还记得我的奶奶。,200110540540150071,印度尼西亚,1,200110,我的童年,65,85,52,49,58,299,未参加,
我看我奶奶的样子非常担心我，我真的非常感动。,200110540540150071,印度尼西亚,1,200110,我的童年,65,85,52,49,58,299,未参加,
任经理{CQ一}职期间与新加坡天信旅游公司合作开发{CC发开}新旅游点及合资建立名人酒店，开设培训班[BQ，]接受新加坡同行所派来的导游，训练他们。,199312533533100059,新加坡,1,199312,一封求职信,90,80,76,74,80,395,B,
我姓×，名××。,199312533533100071,新加坡,1,199312,一封求职信,60,55,48,69,62,275,未参加,
由于本人性格外向，喜爱[C]交游，又能听取旁人意见，每次执行任务都能与同事合作得很好。,199312533540100120,印度尼西亚,1,199312,一封求职信,85,90,60,80,100,412,B,
我目前任职于[F於]一家跨国公司。,199312533533100149,新加坡,1,199312,一封求职信,70,40,71,70,92,323,未参加,
那么请允许我自我介绍[B召]一下。[BC.],199312104523100017,韩国,1,199312,一封求职信,60,50,62,34,39,225,未参加,
