错句,作文编码,国籍,性别,考试时间,作文题目,口试分数,作文分数,听力分数,阅读分数,综合分数,总分,证书
因为许多问题孩童都是来自破碎的家庭。,200103533533250010,新加坡,2,200103,我对离婚问题的看法,80,85,72,68,90,389,B,
但因为种种的原因，导致这样{CC的}离婚现象的发生。,200103533533250012,新加坡,2,200103,我对离婚问题的看法,80,80,75,70,61,358,B,
离婚实际上不{CQ只}是夫妻之间的事而已，它周围的人也会受到波及[B极]，尤[B由]其是孩子们。,200103533533150033,新加坡,1,200103,我对离婚问题的看法,85,75,85,68,79,384,B,
离婚对孩子更是一种重大的打击，孩子的成长，不能缺少母爱和父爱，在他们小小的心灵里，也许看不出他们{CQ有}什么不妥之处，随着成长，便会影响他们性格，甚至行为。,200103533533250031,新加坡,2,200103,我对离婚问题的看法,80,90,90,70,83,408,B,
我父母是从[F從]中国来[F來]泰国有50年经历[F曆]{CJZR}，他们从[F從]18岁[F歲]来居留在曼谷作生意，可是他们有很大问[F問]题[F題]是不懂泰语[F語]，{CD至于[F於]}我出生在泰国[BQ，]知道{CC知悉}他们的困难[BQ，]就有很大的决心{CC志心}要把语[F語]言及念书[F書]方面一定达到大学的程度{CJba}。,200109529529251011,泰国,2,200109,我的童年,75,75,27,21,30,218,未参加,
从小我在这个家住。{CD我},200109529529251013,泰国,2,200109,我的童年,70,65,22,16,37,196,未参加,
我们住在店铺楼上，家里放着一大柜子的刊物、书包、当大人们在忙时，[BC、]我便先去楼上找书看。,200110540540150010,印度尼西亚,1,200110,我的童年,70,85,71,49,92,359,C,
那时[F時]外婆把一辆{CC架}没被抢[F搶]去的自行车[F車]借給我们，妈妈就以它为交通工具来谋{CC讨}生活。,200110540540250014,印度尼西亚,2,200110,我的童年,75,90,74,75,92,400,B,
我出生于马来西亚的一个农[F農]村里，我排行最大，[BC.]下有两个弟妹。,200103680519101602,马来西亚,1,200103,我的童年,80,85,61,47,76,343,C,
我知道，妈妈一定疼妹妹过于我。,200103680519201618,马来西亚,2,200103,我的童年,90,85,56,60,76,364,C,
我也特别想念你们！,200104124520200319,蒙古国,2,200104,一封写给父母的信,70,65,47,49,85,302,未参加,
现在一定很冷，你们要多穿点衣服，要不会着[B招]凉的，你年纪{CC年龄}大{CC高}了，要注意身体。,200104124520200378,蒙古国,2,200104,一封写给父母的信,70,85,58,49,54,308,C,
今天写到这儿。,200104124610200377,法国,2,200104,一封写给父母的信,70,85,47,49,56,299,未参加,
还行吧。,200105550523150034,韩国,1,200105,一封写给父母的信,65,75,52,37,56,272,未参加,
大学毕业后已经过了两年。,200105550523250037,韩国,2,200105,一封写给父母的信,65,75,47,58,56,288,C,
我真羡慕[Pxiànmù]他们，我不在爸妈的身边，所以不能给你们花的现实让我感到遗憾。,200105550523250040,韩国,2,200105,一封写给父母的信,70,70,66,63,56,313,C,
现在想一想，真的对不起你们。,200105550523250060,韩国,2,200105,一封写给父母的信,80,70,49,58,51,298,C,
写不出来的话{CD是}，剩下的时间，慢慢地{CC的}谈吧！,200105550523250329,韩国,2,200105,一封写给父母的信,75,70,52,44,58,288,未参加,
我看你们的脸，我很难过。,200105550523250339,韩国,2,200105,一封写给父母的信,65,70,63,32,56,272,未参加,
我觉得这样的情景{CC景情}只有我们有{CD的}。,200105550523250340,韩国,2,200105,一封写给父母的信,75,65,44,47,49,267,未参加,
首先在庙里只有一位和尚时，如果他要喝水的话，没办法，就该亲自到山底下挑水喝。,200105109525200441,日本,2,200105,由“三个和尚没水喝”想到的……,65,75,54,77,57,315,C,
当第一个和尚自己一个人住在一座高山上的庙里时，自己天天得下山挑水。,200105109529200478,泰国,2,200105,由“三个和尚没水喝”想到的……,85,75,70,64,79,365,B,
但是，人越多越想靠别人，就没有自己的责任感，大家都希望别人替自己做事情。,200105109525200604,日本,2,200105,由“三个和尚没水喝”想到的……,65,70,63,75,66,325,C,
追求一时的快乐，他们终于失{CQ去}了最重要的东西。,200105109525200606,日本,2,200105,由“三个和尚没水喝”想到的……,70,70,54,62,53,297,C,
但是，没过多久，山下的人也过{CJX}不来了。,200105109525100735,日本,1,200105,由“三个和尚没水喝”想到的……,75,55,63,75,73,326,C,
我想起来，母亲曾经{CC经常}跟我说过，“你爸确实是勤劳的人，还不错。,200105109525100790,日本,1,200105,由“三个和尚没水喝”想到的……,80,70,70,84,70,364,B,
他说：[BC，]“我觉得第一个和尚太自私啊！,200105109525200782,日本,2,200105,由“三个和尚没水喝”想到的……,75,70,70,69,59,332,C,
自己应该做，但觉得很麻烦。,200105109525200846,日本,2,200105,由“三个和尚没水喝”想到的……,60,55,21,40,41,198,未参加,
这[F這]是一个极[F極]坏[F壞]的习[F習]惯，我们要学会克服自己，努力地{CC的}来[F來]为大家付出。,200102522522250011,缅甸,2,200102,由“三个和尚没水喝”想到的……,75,90,64,73,91,387,B,
”这样他们{CJ+zxy的心里[B理]}都产生了计[F計]较的心理，[BC。]谁[F誰]也不到山底下去抬水。,200102522522250020,缅甸,2,200102,由“三个和尚没水喝”想到的……,70,85,57,66,88,358,C,
这就是所谓的人生。,200203522522250030,缅甸,2,200203,记对我影响最大的一个人,75,75,28,31,41,240,未参加,
所以我认为谈安乐死的话，应该按这个情况来判断。,200205204525200035,日本,2,200205,如何看待“安乐死”,65,55,63,70,51,286,C,
以前医学还没有发达的时候可以说是人{CJ-zy很}容易会死的。,200205204525100110,日本,1,200205,如何看待“安乐死”,70,80,66,63,44,313,C,
六年前我爷爷得了癌症，[BC、]而且这个是恶[F惡]性的，现代医学是治不了它{CJsd}。,200205212525100047,日本,1,200205,如何看待“安乐死”,80,65,74,79,65,351,B,
赞同安乐死的原因之一是现在的医疗对不治之症的治疗办法{CJ-sy是}只用药来减少病人的痛苦而已。{CQ在},200205209525100017,日本,1,200205,如何看待“安乐死”,70,70,52,54,49,283,C,
我想“安乐死”是通过立法{CC审理}之后才能进行的。,200205209525200095,日本,2,200205,如何看待“安乐死”,65,80,63,63,63,322,C,
如果我是那个妻子或者丈夫的话，可能选择“安乐死”。,200205201525200135,日本,2,200205,如何看待“安乐死”,85,80,38,42,42,280,未参加,
而[C]这一代的人就不同了，他们生长[F長]在[D第]二十世纪[F紀]{CD的环境中}，他们要[C]什么都有，吃的穿的各种[L]贵[F貴]的名牌的物质[F質]样样都有。,200210529529251014,泰国,2,200210,如何解决“代沟”问题,70,60,17,36,48,216,未参加,
我{CQ对}以上的见[F見]解深有{CC2得到了}体会，我们养子千万不要希望孩子报恩，孩子有恩、[BC，]孝当然好，自己老了还是存一点养老金，以防{CC2提防}万一。,200210540540150002,印度尼西亚,1,200210,如何解决“代沟”问题,65,65,20,51,15,200,未参加,
“代沟”是自然规律的产物，我们无妨看一看海边沙滩上的白浪花，它一起一落，就像人生在世。,200210540540250056,印度尼西亚,2,200210,如何解决“代沟”问题,75,70,62,73,88,357,C,
其实[F實]只要双方都肯打开[F關]心锁[F鎖]，不自以为[F為]是的话[F話]，不用说{CC话[F話]}是隔[C]一代，就算隔[C]着二、[BC，]三代，也同样[F樣]可以和[B合]和[B合]气[F氣]气[F氣]地[B的]一起生活下去。,200210540540250075,印度尼西亚,2,200210,如何解决“代沟”问题,65,65,65,54,55,288,C,
以前并[F並]不了解是怎么回事，也不曾真正地[D的]想过这个问题。[BC；],200210540540250081,印度尼西亚,2,200210,如何解决“代沟”问题,65,65,62,78,86,340,C,
或者如果{CC可能}你是独生子，若真的把父母撇下，自己搬出去另外找{CC寻}房子，这未免是不尽做儿女的责任。,200210540540250105,印度尼西亚,2,200210,如何解决“代沟”问题,70,60,28,51,57,251,未参加,
反过来，年青人常因{CC随}新时代{CQ的}丰富生活“陶醉”，每天只顾{CC1自顾[C顧]}自寻欢乐，从不理会父母的苦心劝诚，不听{CC领}管教，太令老人伤心，这也不对。,200210540540250126,印度尼西亚,2,200210,如何解决“代沟”问题,65,70,51,65,91,328,C,
因此一些做人的道理，譬如：孝顺父母、敬老尊贤……等都不重视。,200210540540250131,印度尼西亚,2,200210,如何解决“代沟”问题,65,75,81,69,75,352,B,
如果我没记错的话，今天是他开学后的第21天。,200205680519250006,马来西亚,2,200205,一封写给父母的信,65,80,46,71,80,330,C,
爸！,200205680519150010,马来西亚,1,200205,一封写给父母的信,80,75,52,73,80,351,C,
现在我阅读它，我喜爱它，是它的内涵，是《西游记》的中心精神——最低限度我是这样认为[BD——]。,200305533533150003,新加坡,1,200305,我最喜欢读的一本书,95,75,79,75,92,411,B,
爱[F愛]的重点[F點]是要给[F給]予，不是要求对[F對]象。,200305533610150023,法国,1,200305,我最喜欢读的一本书,65,60,33,51,18,210,未参加,
幸运的是在三年前，不知不觉地从心底爱上了书。,200305533533250042,新加坡,2,200305,我最喜欢读的一本书,70,65,77,65,83,346,C,
相反，放着小声的音乐，我睡得非常香。,200305576525200010,日本,2,200305,静音环境对人体的危害,70,65,74,82,88,365,C,
虽然烟这个行业对国家的经济有所帮助，但是这样的行业是对人人{CJcd}有害{CJsd}。,200405109540101248,印度尼西亚,1,200405,吸烟对个人健康和公众利益的影响,75,65,59,60,64,310,C,
最后，据调查，如果孩子成长在抽烟的环境里[BQ，]{CD就}以后他也{CJX}抽烟的比率很高，所以[BQ，]为了孩子们的健康，人人都要注意，养成好的习惯。,200405109626201552,瑞典,2,200405,吸烟对个人健康和公众利益的影响,65,60,50,33,44,235,未参加,
我们必须[B需]采用相[L]应[Pying]的措施来盯着他们。,200405109801101637,澳大利亚,1,200405,吸烟对个人健康和公众利益的影响,50,75,55,39,44,247,未参加,
这意味着吸烟是有{CQ百}害而无一利。,200405109540200344,印度尼西亚,2,200405,吸烟对个人健康和公众利益的影响,65,60,54,66,63,291,未参加,
一个烟客患肺[C]癌的机率，要比普通人高出好几倍。,200405217533200091,新加坡,2,200405,吸烟对个人健康和公众利益的影响,80,75,85,82,92,405,B,
但是最重要的还是教育。,200405204610200358,法国,2,200405,吸烟对个人健康和公众利益的影响,75,65,30,35,58,250,未参加,
吸烟的害处[B外]大家都知道的。[BC，],200405224529100068,泰国,1,200405,吸烟对个人健康和公众利益的影响,70,65,82,61,79,343,C,
更厉害的，目前危害全人类的毒品——白粉不但夺走了无数条年青的生命，同时给人类社会留下了道德败坏的后遗症。,200405522522150011,缅甸,1,200405,吸烟对个人健康和公众利益的影响,95,95,71,67,91,418,B,
有很多人都理解吸烟对人们的害处了。,200405522522250018,缅甸,2,200405,吸烟对个人健康和公众利益的影响,75,85,63,49,56,321,C,
什么好处{CC利益}也没有！,200405522522250030,缅甸,2,200405,吸烟对个人健康和公众利益的影响,90,75,35,56,61,311,未参加,
政府应该想出办法让人知道抽烟的不好的地方的原因不仅是为了那些抽烟的人的健康，而更多是为了不抽烟的人的健康。,200405206626200131,瑞典,2,200405,吸烟对个人健康和公众利益的影响,70,70,58,39,63,288,未参加,
因为[F為]烟叶[F葉]虽草本生种[F種]，{CQ但是}对土壤保持，山坡的维护都比种[F種]植林业[F業]还差。[BC，],200405209715100120,几内亚比绍,1,200405,吸烟对个人健康和公众利益的影响,80,95,74,63,74,381,B,
第二个就是父母给孩子看模范。,200505109525100098,日本,1,200505,父母是孩子的第一任老师,70,80,53,67,64,324,C,
我第一任的女老师，她也是个严[F巖]格的{CJ-zxy人}。,200505109525100334,日本,1,200505,父母是孩子的第一任老师,55,55,42,44,45,221,未参加,
父母是我的第一个，而且是最好、[BC，]最棒的老师。,200505109525200327,日本,2,200505,父母是孩子的第一任老师,70,65,58,48,59,286,C,
我从她们身上学的东西也很多。,200505109525200546,日本,2,200505,父母是孩子的第一任老师,65,80,77,67,72,349,B,
加上我也每次对周围的朋友{CJX}像我母亲一样地说，“洗手，[BC、]漱[C]口！,200505109525200727,日本,2,200505,父母是孩子的第一任老师,50,75,47,54,53,263,未参加,
我对这一问题有同感，是因为我也认为父母的兴趣爱好、思想观念、行为举止，甚至他们的习惯等都对孩子有很大的影响力。,200505109525201104,日本,2,200505,父母是孩子的第一任老师,70,70,41,41,62,272,未参加,
孩子最听谁的话？,200505109525201392,日本,2,200505,父母是孩子的第一任老师,60,80,50,66,55,298,未参加,
一是自己的父母，[BC、]二是学校的老师。,200505217525100166,日本,1,200505,父母是孩子的第一任老师,65,75,46,41,76,290,未参加,
因为孩子经常{CJ-sy看}父母的行动。,200505204525200025,日本,2,200505,父母是孩子的第一任老师,55,50,37,27,45,193,未参加,
所以{CC2之所以}我[C]入学{CJX}幼[C]儿园时已经可以念平假名了。,200505204525100088,日本,1,200505,父母是孩子的第一任老师,60,70,54,55,56,280,未参加,
我也同意[C]这种看法。,200505204525200121,日本,2,200505,父母是孩子的第一任老师,55,70,31,51,56,247,未参加,
父母{CD对这个}对孩子的思[C]想[C]上的影响一定要注意[C]。[BC、],200505204525100142,日本,1,200505,父母是孩子的第一任老师,60,65,52,57,52,269,未参加,
我还[C]记得他{CD从}以前[C]一直跟我说一句话“{CP年轻的时候[C]玩儿多[C]一点，学习也重要，但是应该玩儿很多[C]。P},200505204525100173,日本,1,200505,父母是孩子的第一任老师,65,75,50,67,52,296,C,
我已经成年了。,200505204525200252,日本,2,200505,父母是孩子的第一任老师,65,55,58,55,69,284,C,
以上的情况是普通的，可是现在，有的家庭里有家庭暴力。,200505204525100360,日本,1,200505,父母是孩子的第一任老师,65,50,50,63,72,281,未参加,
我也是从很小的时候到现在一直受到父母的影响。,200505204525100406,日本,1,200505,父母是孩子的第一任老师,75,65,48,39,65,279,未参加,
一到这个假期人们马上就准备去旅游了。,200105205525200004,日本,2,200105,我的一个假期,80,65,62,68,68,331,C,
有一天她告诉我：“我跟我父母[BD，]黄金周{CC3黄金周期}到中国去旅游[BQ，]我们四月三十号到上海。,200105205525100020,日本,1,200105,我的一个假期,70,70,52,56,61,297,C,
后来我又{CC1继续}通过{CC考上}了会计中级、高级考试。,200105205525200083,日本,2,200105,我的一个假期,70,75,77,79,87,377,B,
其实我除了中国以外什么国家也没有去过。,200105205525200086,日本,2,200105,我的一个假期,65,70,50,56,44,271,未参加,
所以我觉得很幸福。,200112576525200007,日本,2,200112,如何面对挫折,75,75,70,59,69,338,C,
我们援助的大阪队输给了福冈队，可是{CJ-zhuy我}并非垂头散气、没精打采的样子{CD了}。,200112576525100027,日本,1,200112,如何面对挫折,65,55,52,53,53,260,未参加,
我有了这么特别{CC奇特}的春节的回忆[BD，]{CJX}很感动而且十分荣幸。,200105217525100003,日本,1,200105,我的一个假期,65,75,65,61,66,319,C,
那一带以苗族、侗[B同]族为主，都是山区，路很不好走。,200105271525100096,日本,1,200105,我的一个假期,70,75,72,61,79,346,C,
而且厦门在{CC1是比}上海南边{CC2南}，气温高。,200105204525200042,日本,2,200105,我的一个假期,65,75,50,51,70,298,未参加,
有可能，别[B它]人会觉得我的这个假期很没意思，但它对我{CQ来说}极{CC其}为重要，因为它让我完成了一篇论文，还让我增添了很多知识。,200105204542100043,越南,1,200105,我的一个假期,85,75,82,75,83,392,B,
我天天这样[BQ，]度过{CC2过}{CQ了}去年的夏天，那时候我没有什么目标{CJX}生活的[BQ，]我现在很后悔。[BC，],200105204525100047,日本,1,200105,我的一个假期,65,65,32,39,50,235,未参加,
我爸爸一向最喜欢跟孩子玩。,200105550523250079,韩国,2,200105,一封写给父母的信,75,80,63,65,72,346,C,
“你继续上学吧，我希望你能够当很出名的人。,200105550523150119,韩国,1,200105,一封写给父母的信,0,70,41,25,56,187,未参加,
爸妈！,200105550523250148,韩国,2,200105,一封写给父母的信,70,70,52,32,45,257,未参加,
当时你说害怕去看病。,200105550523250190,韩国,2,200105,一封写给父母的信,65,70,52,44,58,275,未参加,
希望你们保重。,200105550523250205,韩国,2,200105,一封写给父母的信,65,70,58,49,63,291,C,
爸爸，妈[F媽]妈[F媽]，很突然吧！,200105550523250225,韩国,2,200105,一封写给父母的信,70,65,60,54,65,300,C,
妈！,200105550523250228,韩国,2,200105,一封写给父母的信,70,65,52,61,65,299,C,
——好女儿××,200105550523250241,韩国,2,200105,一封写给父母的信,65,60,38,37,47,230,未参加,
我的生活愈过愈有规律。,200105550523250262,韩国,2,200105,一封写给父母的信,70,70,52,68,72,320,C,
但我近来很难过！,200105550523150317,韩国,1,200105,一封写给父母的信,65,60,11,25,40,184,未参加,
”[BD…][BD！]现在，我应该准备毕业，还有做[B作]什么工作过日子。,200105550523250380,韩国,2,200105,一封写给父母的信,70,70,55,61,58,302,C,
请你们注意身体{CC健康}。,200105550523250394,韩国,2,200105,一封写给父母的信,75,70,66,51,54,305,C,
虽然不在{CJX}爸爸[BQ，]我们勇敢地生话吧。,200105550523250431,韩国,2,200105,一封写给父母的信,60,65,38,54,42,242,未参加,
很感谢你们这么长时间{CJX}照顾我。,200105550523250441,韩国,2,200105,一封写给父母的信,65,75,44,56,38,265,未参加,
我{CD已经}感谢你们。,200105550523250447,韩国,2,200105,一封写给父母的信,65,65,25,25,40,204,未参加,
我是大学四年级的学生{CD之}[BQ，]所以将要找工作。,200105550523250513,韩国,2,200105,一封写给父母的信,70,80,47,49,63,299,未参加,
一九九八{CC199八}年八月三日，就是我的高中最后的暑假时，我第一次来到北京旅游。,200105206525100019,日本,1,200105,我的一个假期,70,70,44,51,57,280,未参加,
有时候，做的太差，没有晚饭。,200105206525100022,日本,1,200105,我的一个假期,65,65,50,51,59,274,未参加,
这篇文章的内容告诉我互相帮助的重要性。,200105109525200212,日本,2,200105,由“三个和尚没水喝”想到的……,65,70,70,62,59,312,C,
你们得敬{CC孝}老，好好听我的话。,200105109606200214,比利时,2,200105,由“三个和尚没水喝”想到的……,85,65,77,66,82,364,B,
很可能在她心里[B理]也有同样的感觉，[BC。]因此虽然屋里有两个人，但是有时房间很乱，比一个人的时候还糟呢！,200105109525200301,日本,2,200105,由“三个和尚没水喝”想到的……,65,70,66,71,84,342,C,
{CD是}一个人不能办很大的事情，那么人多就能办很大的事情，这个说法也不对。,200105109525100364,日本,1,200105,由“三个和尚没水喝”想到的……,70,70,66,62,70,326,C,
如果自己发现{CC发觉}了宝物可能很多人都藏起来，[BC、]独自享受。,200105109525200624,日本,2,200105,由“三个和尚没水喝”想到的……,60,50,57,58,61,266,未参加,
所以只有一个人的话活不下去。,200105109525200753,日本,2,200105,由“三个和尚没水喝”想到的……,70,70,73,69,77,347,C,
对于这些东西制定{CC2做}的人应该琢磨后发布；[BC。]另一个看法是从社会{CJ-zxy方面}看的，[BC。]这{CQ个}看法十分复杂{CC麻烦}。,200205217525100017,日本,1,200205,如何看待“安乐死”,60,80,38,49,65,279,未参加,
有关安乐死的法律也要根据这样的看法制定。,200205217525100019,日本,1,200205,如何看待“安乐死”,65,80,49,67,65,314,C,
她这五年以来由于这些病受苦。,200205205525200015,日本,2,200205,如何看待“安乐死”,75,80,58,67,70,341,B,
我相信如果大家一直关心这个问题[BQ，]一定比现在好一些。,200205205525200111,日本,2,200205,如何看待“安乐死”,65,70,71,63,61,316,C,
但是{CJ-zhuy这}{CQ在}法律上是不允许{CJsd}，所以人们的意见{CD是}不同。,200205206525200008,日本,2,200205,如何看待“安乐死”,70,65,58,65,68,312,C,
要是没有的话，想想看：[BC。]如果你自己成了植物状态[F態]，[BC、]或者得{CD上}了不治之症[L][BQ，]永远痛苦{CJ+zxy的病}；[BC。]现在你睡在医院的床上……旁[B傍]边看你的人们的心情如何？,200205206525100057,日本,1,200205,如何看待“安乐死”,65,65,66,60,49,289,C,
安乐死要是{CJ-sy犯}故意杀人罪的[B得]话，哪[B那]个是对，哪[B那]个是错[BQ？]应该是法院，法律的错。,200205206525100076,日本,1,200205,如何看待“安乐死”,70,65,55,40,42,258,未参加,
我一听[B定]到这个消息就高兴了。,200205332540200011,印度尼西亚,2,200205,如何看待“安乐死”,70,85,60,47,46,300,C,
代沟是由于两代人之间互相交流、理解的不足产生的。,200209550523250009,韩国,2,200209,如何解决“代沟”问题,75,70,57,64,68,323,C,
我们年轻的朋友们跟他们的父母，至少有二十多年的年龄[B领]差。,200209550523150014,韩国,1,200209,如何解决“代沟”问题,60,65,72,57,68,305,C,
为了了解对方的想法，最好的方法就是谈话。,200209550523250039,韩国,2,200209,如何解决“代沟”问题,65,70,54,84,74,333,C,
刚开始时，找比较日常的[L]话题[C]。,200209550523250046,韩国,2,200209,如何解决“代沟”问题,60,65,63,52,64,287,未参加,
谈话是交流思想的一种办法。,200209550523250061,韩国,2,200209,如何解决“代沟”问题,70,75,72,71,62,339,C,
就拿{CC说}父母与子女之间的“代沟”问题来说吧。,200209550523250062,韩国,2,200209,如何解决“代沟”问题,65,70,63,76,76,336,C,
那样的话两代人的代沟{CJ-zxy问题}肯定{CJ-sy能}解决{CJ+buy了}。,200209550523250088,韩国,2,200209,如何解决“代沟”问题,65,65,60,52,62,288,C,
但是为什么我们只是想我们的立场呢？,200209550523250115,韩国,2,200209,如何解决“代沟”问题,65,65,60,45,44,263,未参加,
代沟是不管什么时代[BD，]都存在的。,200209550523250125,韩国,2,200209,如何解决“代沟”问题,65,65,54,74,46,288,C,
现在接受科学教育的孩子不喜欢以前的“听话”教育。,200209550523250127,韩国,2,200209,如何解决“代沟”问题,65,65,24,47,58,243,未参加,
他们在这种情况下，度过{CC2过}了他们的年轻的岁月。,200209550523250137,韩国,2,200209,如何解决“代沟”问题,60,60,39,67,64,272,未参加,
只有对话才{CC就}知道两个人{CD之间}的意见。,200209550523250141,韩国,2,200209,如何解决“代沟”问题,65,65,48,52,46,260,未参加,
尽管她经历了6.25战争，又经历了战后{CQ的}贫困时期，但是她不了解现在{CD的}经济、信息发展的新时代，我是{CQ在}新时代长大的人，我怎么能了解她那{CQ些}艰苦[C]的日子[B了]呢？,200209550523250158,韩国,2,200209,如何解决“代沟”问题,65,65,66,57,72,309,C,
这样的话子女会{CC1产生}抱怨。,200209550523250187,韩国,2,200209,如何解决“代沟”问题,60,60,66,64,38,270,未参加,
因为[C]他们认为早恋对[C]子女的学习方面没有好处。,200209550523150200,韩国,1,200209,如何解决“代沟”问题,65,65,60,57,60,291,C,
这是指两代人之间在行为方式、生活态度以及价值观念等方面存在的差异。,200209550523250210,韩国,2,200209,如何解决“代沟”问题,70,65,54,67,58,300,C,
这样下去的话，“代沟”{CJ-sy会}越来越深。,200209550523250216,韩国,2,200209,如何解决“代沟”问题,65,65,63,62,56,295,C,
还有可能的话，多多安排父母和子女一起在{CJX}的时间吧。,200209550523250228,韩国,2,200209,如何解决“代沟”问题,70,60,54,52,48,269,未参加,
其次，与长辈{CC晚辈}充分交流和对话能够解决相互矛盾。,200209550523250246,韩国,2,200209,如何解决“代沟”问题,80,60,66,64,60,317,C,
！,200209550523150253,韩国,1,200209,如何解决“代沟”问题,70,70,63,59,50,300,C,
还[C]有应该需要{CC必要}互相了解的努力。,200209550523150277,韩国,1,200209,如何解决“代沟”问题,65,60,57,57,66,288,未参加,
至善方法，却[F卻]少了付出努力与耐心耕耘两代人之间健康的关系[F係]，则后浪推前浪，但只留下一片茫茫大海而已。P},200209550523250324,韩国,2,200209,如何解决“代沟”问题,75,70,85,89,82,390,B,
原因是每个人有每个人的历史。,200209550523150361,韩国,1,200209,如何解决“代沟”问题,65,60,54,42,42,246,未参加,
