错句,作文编码,国籍,性别,考试时间,作文题目,口试分数,作文分数,听力分数,阅读分数,综合分数,总分,证书
我们居住的乡间离市区有一千五百公里，交通极不方便，去上学的时候，一大清早要比公鸡{CJ+zxy啼叫声}还要早起；而回家时的一段路程更要绕道花[B化]上两个半小时。,200110540540250024,印度尼西亚,2,200110,我的童年,75,90,47,44,79,329,未参加,
妈妈因为经济上的问题无法供养姐姐，只好硬下心肠把姐姐放在外婆家看管。,200103680519201607,马来西亚,2,200103,我的童年,90,85,50,47,80,349,未参加,
童年的岁月虽遭时间的洗礼，但脚上的疤痕却是个烙印。,200103680519201610,马来西亚,2,200103,我的童年,75,90,70,78,98,405,B,
对了，爸妈，我们学校“五一”时连续放七天假，我想去旅行，我的一个朋友请我到他们家玩儿，[BC。]我已经同意了。,200104124520200331,蒙古国,2,200104,一封写给父母的信,65,90,58,51,70,325,C,
我一收到这封信，读完信，就拿笔写信{CJX}给您。,200104124506100419,巴基斯坦,1,200104,一封写给父母的信,75,85,58,51,65,327,C,
祝你们健康！,200105550523250026,韩国,2,200105,一封写给父母的信,70,75,74,73,70,351,B,
我希望你以后教我。,200105550523250027,韩国,2,200105,一封写给父母的信,75,65,52,56,65,300,C,
最近过得怎么样？,200105550523250060,韩国,2,200105,一封写给父母的信,80,70,49,58,51,298,C,
如果爸爸跟我一起的话，我不{CC没有}怕{CD的}。,200105550523250298,韩国,2,200105,一封写给父母的信,70,75,38,61,56,289,未参加,
我很爱你们！,200105550523250339,韩国,2,200105,一封写给父母的信,65,70,63,32,56,272,未参加,
谢谢爸爸，我爱您爸爸。,200105550523250340,韩国,2,200105,一封写给父母的信,75,65,44,47,49,267,未参加,
但连一次也没给你们写信{CJX}，觉得真对不起你们。,200105550523250469,韩国,2,200105,一封写给父母的信,65,70,49,70,63,303,C,
从现在开始我{CQ要}努力学习，希望{CC2想}能有让你们快乐的机会。,200105550523250527,韩国,2,200105,一封写给父母的信,70,65,60,35,58,274,未参加,
我每天努力学习，努力锻炼自己，将来一定让{CC使}你们满意和幸福。,200105550523250529,韩国,2,200105,一封写给父母的信,65,65,55,61,63,293,C,
在潮州过的两天比较有趣。,200105212525200039,日本,2,200105,我的一个假期,65,70,55,54,55,285,C,
小时候在寒假{CQ里}因为外面很冷，所以我{CQ在}屋里玩的时间比较多。,200105209525200014,日本,2,200105,我的一个假期,65,70,80,75,72,348,C,
特别令我吃惊的事情就是他家真的很穷。,200105209525200018,日本,2,200105,我的一个假期,70,65,80,79,83,363,C,
并且{CC且而}，{CJ-zhuy那时}正好是初夏，各种各样的花盛开着，增添{CC增长}了园林的美丽。,200105201525200010,日本,2,200105,我的一个假期,70,85,82,72,90,391,B,
既然我们来到西安，就要去参观兵马俑。,200105201525100046,日本,1,200105,我的一个假期,65,75,57,58,66,308,C,
我虽然{CQ在}杂志上、[BC，]电视上看到{CC感到}{CQ过}上海的面貌，可是现实的上海比我想像的还繁华{CC荣华}，还美。,200105302525200045,日本,2,200105,我的一个假期,65,70,57,56,57,291,C,
忘了朋友之间的友谊，忘了同事之间的相互帮助，相互理解。,200105109529200478,泰国,2,200105,由“三个和尚没水喝”想到的……,85,75,70,64,79,365,B,
我是个{CJ+zy十分}被父母娇惯的孩子。,200105109525200602,日本,2,200105,由“三个和尚没水喝”想到的……,70,75,68,71,86,359,C,
我认为本文里的和尚指的是我们任何人。,200105109525200803,日本,2,200105,由“三个和尚没水喝”想到的……,80,70,77,53,82,352,C,
如果她不愿意他帮助她自杀，他该受到法律的制裁。,200205204525100019,日本,1,200205,如何看待“安乐死”,60,65,35,45,37,225,未参加,
但周围的人看死{CJ+buy下去}的过程。,200205204525100038,日本,1,200205,如何看待“安乐死”,65,55,33,49,51,235,未参加,
但是，现在的法律，没有安乐死方面的规定{CC规律}。,200205204525200045,日本,2,200205,如何看待“安乐死”,65,60,19,60,54,241,未参加,
那为什么发生这样的事情呢？,200205204525200145,日本,2,200205,如何看待“安乐死”,60,65,55,47,32,242,未参加,
周围的人劝她把他杀掉，[BC、]但她不接受，这样持续{CC继续}了共二年，[BC、]他终于醒过来了。,200205204525100166,日本,1,200205,如何看待“安乐死”,70,70,69,56,56,309,C,
对丈夫来说，看妻子难过的样子实在受不了。,200205224525100013,日本,1,200205,如何看待“安乐死”,65,80,49,70,77,329,C,
还有另外{CQ一}个原因是家人的痛苦和经济负担的增加。,200205209525100017,日本,1,200205,如何看待“安乐死”,70,70,52,54,49,283,C,
如果病人不希望的话，任何人都绝对不能进行安乐死。,200205209525200029,日本,2,200205,如何看待“安乐死”,80,85,88,76,89,412,B,
我希望尊重病人的意志。,200205209525200089,日本,2,200205,如何看待“安乐死”,80,80,77,58,89,376,B,
我的看法是基本上同意“安乐死”。,200205209525200095,日本,2,200205,如何看待“安乐死”,65,80,63,63,63,322,C,
所以我觉得安乐死是可以的。,200205201525200134,日本,2,200205,如何看待“安乐死”,80,70,66,70,58,334,C,
如果我也得了一种不治之症的话，不想活下去的。,200205201525100158,日本,1,200205,如何看待“安乐死”,75,70,60,76,51,321,C,
如果她{CJ+zy正}愿意亲自停止他的生命的话，她有尊严地结束她{CC他}的生命的权利。,200205215525100001,日本,1,200205,如何看待“安乐死”,75,75,77,56,72,345,B,
什么方面需[L]要[D拿]考虑[B虎]呢？[BD！],200210529529151018,泰国,1,200210,如何解决“代沟”问题,65,55,37,29,30,198,未参加,
以前的人，生活在简单的环境中，对于发生在身边的事情，以最简单，最单纯的眼光去看{CC1观看}，去分析，最后以最简单的方式去解决。,200210529529251023,泰国,2,200210,如何解决“代沟”问题,75,85,78,91,93,415,B,
”王太对邻居这么发牢[B劳]骚。,200210540540250015,印度尼西亚,2,200210,如何解决“代沟”问题,70,65,62,71,86,340,C,
“代沟”不是现代的社会问题，它是自古已有的一种社会现象。,200210540540150029,印度尼西亚,1,200210,如何解决“代沟”问题,90,60,62,65,86,353,C,
从我自身来[F來]说[F說]，我自己上有父母，下有儿[F兒]女，这就有二种[F種]不同{CQ的}，涉及三代的代沟问[F問]题[F題]了。,200210540540150098,印度尼西亚,1,200210,如何解决“代沟”问题,65,80,78,93,91,395,B,
其实，时代{CC现[F現]代}不同了，我们年青人更应该体谅他们，有时也不必跟[B更]他们计较什么，只要我们年青的认[F認]为是对的，只是方法不同，那我们就接受他们；[BC，]而原则性[B形]问题，我们慢慢跟他们谈谈{CJcd}，也许{CJ-zhuy他们}一时不能接受，但最后，他们终会明白，虽然他们不说，可只要{CC只是}{CJ-zy互相}体谅什么都能解决的。,200210540540250095,印度尼西亚,2,200210,如何解决“代沟”问题,65,75,53,67,77,324,C,
必念大学不可的我，会[F會]努力的。,200203522522210010,缅甸,2,200203,记对我影响最大的一个人,70,65,57,64,61,303,C,
虽然那是我的兴趣，可我总觉得为了家庭，我必须那么做。,200205109519200479,马来西亚,2,200205,如何面对挫折,70,90,78,71,77,379,B,
我娘家在马来西亚中部，我教书的学校却离家乡三百英里，那时只好租一间房，在人生地疏的地方一切{CD由}自己动手。,200205109519200479,马来西亚,2,200205,如何面对挫折,70,90,78,71,77,379,B,
但是我认为[BQ，]怕挫折而只知道娱乐的人不对并不是因为他们对别人没有用，而是因为这些人使自己的生活单调。,200205109523200979,韩国,2,200205,如何面对挫折,70,60,59,43,48,265,未参加,
十八岁对我而言，是个成年的阶段了。,200205680519250029,马来西亚,2,200205,一封写给父母的信,80,80,60,65,76,353,C,
因为这个是我的人生，我不能一辈子靠您们扶持我走下去。,200205680519250029,马来西亚,2,200205,一封写给父母的信,80,80,60,65,76,353,C,
每逢母亲节或父亲节的时候，我都面临年终大考，有时突然而来的考试总让我吃不消，透{CC压}不过气。,200205680519150033,马来西亚,1,200205,一封写给父母的信,85,65,57,67,74,337,C,
我本来是随便翻阅，却被该故事深深吸引，对它爱不释手{CD的}。,200305533533150043,新加坡,1,200305,我最喜欢读的一本书,70,65,68,51,79,319,C,
在北京认识的中国、外国朋友都{CJ+sy是}使我长了不少知识。,200304131525100006,日本,1,200304,我学汉语是为了……,75,65,74,49,68,318,C,
所以，你趁你{CD这么}年轻就开始学习汉语，一定会有利于{CC3帮助}你的将来。[BC，],200304131525200138,日本,2,200304,我学汉语是为了……,65,75,30,35,49,241,未参加,
听到这个消息以后，我就想学习。,200304131525200198,日本,2,200304,我学汉语是为了……,65,70,50,65,57,293,C,
如果现在有人提这个问题，我的答案可能是[BD“]用中文工作，[BC”]但我的意思{CD就}是[BD“]我想睡在中国，[BC”]就是我想像中国人一样生活。,200304131525100229,日本,1,200304,我学汉语是为了……,70,70,47,54,66,295,C,
之前{CC2从前}几年到现在日本的经济一向不好，[BC。]因此高中退学者不好找工作，[BC。]若找到了也不是很好的{CC高级或中级的}，[BC。]算是打工的一种。,200304131525100244,日本,1,200304,我学汉语是为了……,65,70,38,57,43,259,未参加,
谁也找不到完全没有声音的地方。,200305576525200022,日本,2,200305,静音环境对人体的危害,65,65,41,60,68,283,未参加,
我看过一本书叫《海马》。,200305576525200029,日本,2,200305,静音环境对人体的危害,65,65,56,65,71,306,C,
所以人类生存、成长时，如果没有声音的话，有可能会影响人类的正常生活。,200305576525200047,日本,2,200305,静音环境对人体的危害,70,80,74,87,88,389,B,
我来北京之后经常看到这种令[B今]人震[B振]惊的现象——人{CQ们}抽完烟[B吸]之后随地扔掉。,200405109922101901,美国,1,200405,吸烟对个人健康和公众利益的影响,80,95,52,52,53,327,未参加,
吸烟还可染上毒瘾。,200405522522110002,缅甸,1,200405,吸烟对个人健康和公众利益的影响,70,80,44,60,61,305,未参加,
但是，你抽烟不抽烟对很多人来说，是无所谓的，只要不在他们面前或在同一场所抽烟，问题就自然地[B的]解[B结]决了。,200405209605200101,保加利亚,2,200405,吸烟对个人健康和公众利益的影响,80,80,66,49,70,337,C,
这项规定如果起作用，那{CD就}对不抽烟的人来说[BQ，]{CJ-zhuy它}一定会带来好处{CC利益}。,200405206635200126,俄罗斯,2,200405,吸烟对个人健康和公众利益的影响,70,65,44,47,47,259,未参加,
但我一直这样长大，现在可以理解她的心情{CQ了}。,200505109525100277,日本,1,200505,父母是孩子的第一任老师,65,55,46,46,57,251,未参加,
学习，运动都一样。{CP自己努力，有一定的结果。P},200505109525200327,日本,2,200505,父母是孩子的第一任老师,70,65,58,48,59,286,C,
父母疼[B痛]孩子，做前述的事也不得已的{CJsd}，但这个可以反过来说父母也不够忍耐。,200505109525200405,日本,2,200505,父母是孩子的第一任老师,70,70,56,48,54,286,未参加,
如吃饭之前去洗手，全家人整齐后才开始吃饭，遇到陌生人应该先跟{CC给}他打招呼，{CJ-zy应该}很容易跟同学们交朋友，去陌生地方也可以融入新生活等。{CJ+dy他们},200505109525100452,日本,1,200505,父母是孩子的第一任老师,80,75,53,46,57,302,未参加,
好！,200505109525100530,日本,1,200505,父母是孩子的第一任老师,65,50,58,38,48,240,未参加,
礼仪、[BC，]礼貌也是这样。,200505109525100543,日本,1,200505,父母是孩子的第一任老师,60,70,71,61,64,311,C,
所有的父母的任务{CJ-zy都}是这样的。,200505109525100543,日本,1,200505,父母是孩子的第一任老师,60,70,71,61,64,311,C,
我同意“父母是孩子的第一任老师”的意见。,200505109525200640,日本,2,200505,父母是孩子的第一任老师,75,70,69,58,59,320,C,
“这个世界上没有失败，只有暂时还没{CC停止}成功。,200505109525101108,日本,1,200505,父母是孩子的第一任老师,90,80,62,64,64,355,C,
我和我妈妈的爱好是一样的，去国外旅行、买一些漂亮的东西。,200505109525201392,日本,2,200505,父母是孩子的第一任老师,60,80,50,66,55,298,未参加,
父亲给我的影响没有母亲的多。,200505217525200101,日本,2,200505,父母是孩子的第一任老师,65,90,73,63,74,356,C,
另一个方面兴趣{CC趣味}方面{CJs}。,200505217525200104,日本,2,200505,父母是孩子的第一任老师,55,80,35,63,54,273,未参加,
就我而言，我小的时候完全受到父母[C]的影响。,200505217525200233,日本,2,200505,父母是孩子的第一任老师,85,75,65,61,58,336,C,
我和妹妹从小经常跟父亲[C]一起下棋。,200505204525200516,日本,2,200505,父母是孩子的第一任老师,60,55,50,43,58,247,未参加,
我坐船到上海办入境手续的时候，有一位中国女孩看{CC1看来}我匆忙的样子{CQ就来}帮助我。,200105205525100067,日本,1,200105,我的一个假期,75,65,52,72,66,317,C,
{CD在}那段期间[F間]是我一辈[F輩]子过[F過]{CQ得}最好的假期，当[F當]第三个[F個]礼[F禮]拜来临[F臨]时[F時][BQ，]我是依依不舍[F捨]地{CC的}走{CJsd}，我和他们[F們]家的佣人也成为了好友。,200110801821250011,新西兰,2,200110,我的一个假期,90,85,77,46,55,350,C,
那时候，[BC、]我做什么都{CC也}做得不好。,200112576525200020,日本,2,200112,如何面对挫折,65,65,54,73,69,310,C,
如果有不喜欢樱花的日本人，{CJ-zhuy他}一定是害怕虫子的。,200105271525100042,日本,1,200105,我的一个假期,70,80,47,61,66,314,C,
原来她们搞错了。,200105217525200080,日本,2,200105,我的一个假期,65,70,62,70,57,310,C,
在黄金周去旅游的人很多，而且我们四月中旬才决定，[BC、]所以日本国内比较有意思的地方都满了。,200105217525200083,日本,2,200105,我的一个假期,65,75,52,58,39,276,未参加,
那时候，我们偶然遇见{CC见过}{CQ了}她{CD了}。,200105217525200083,日本,2,200105,我的一个假期,65,75,52,58,39,276,未参加,
但是，实际上{CC3实际}，开始在农村里的生活{CQ时}，我遭遇了很多没想到的事情。,200105204525200022,日本,2,200105,我的一个假期,65,65,22,42,52,230,未参加,
”虽然父母那样说，但我仍然{CJX}最喜欢的中国城市是北京，[BC。]以后有机会还{CC再}想去。,200105204525100035,日本,1,200105,我的一个假期,70,80,70,46,72,328,C,
对于当地人{CC3他}的习惯，最{CJX}觉得有意思的是他们从早上八点一直[B至]工作到下午两点左右，回家吃午饭后不再上班。,200105204525200044,日本,2,200105,我的一个假期,70,90,80,58,70,361,C,
“爸，妈！,200105550523250066,韩国,2,200105,一封写给父母的信,75,75,68,56,61,325,C,
过了时间，如果你们是{CC会}我的子女，你们这样出生的话，我尽力报达你们。,200105550523250074,韩国,2,200105,一封写给父母的信,65,70,68,54,51,294,C,
这个假期{CC放假}的时候，您有空吗？,200105550523150084,韩国,1,200105,一封写给父母的信,65,65,27,21,42,204,未参加,
你们带着很丰盛的吃的东西，乘{CC骑}公共汽车啊，乘{CC骑}火车啊，只要看你的儿子，你们走了很远的路。,200105550523150101,韩国,1,200105,一封写给父母的信,70,65,49,54,56,280,C,
异国之情会容易发生矛盾，但我最看中的是爱情和智慧。,200105550523150128,韩国,1,200105,一封写给父母的信,80,80,68,54,61,335,C,
现在是挽节期。,200105550523250134,韩国,2,200105,一封写给父母的信,65,70,44,39,49,253,未参加,
父母亲[F親]，我实在对不起你们。,200105550523250146,韩国,2,200105,一封写给父母的信,75,70,55,65,74,328,C,
×××2001年5月12日,200105550523250160,韩国,2,200105,一封写给父母的信,70,75,49,54,72,309,C,
而且不久我奶奶去世。,200105550523250175,韩国,2,200105,一封写给父母的信,70,70,52,56,61,297,C,
祝您们健康！,200105550523250187,韩国,2,200105,一封写给父母的信,65,65,44,47,47,252,未参加,
迄今为止，他不骗[B偏]我，爱我。,200105550523250194,韩国,2,200105,一封写给父母的信,65,65,14,37,45,210,未参加,
二00一年，初夏二子，××拜上,200105550523150247,韩国,1,200105,一封写给父母的信,70,65,49,47,63,280,未参加,
在学校我自己做纸花送给你们{CD了}。,200105550523250258,韩国,2,200105,一封写给父母的信,70,70,55,42,74,299,未参加,
妈说{CC写}虽然最近有很多困难，但是有我和妹妹你们{CQ就}幸福。,200105550523250271,韩国,2,200105,一封写给父母的信,65,65,68,42,58,282,C,
今年一月大学毕业以后，还没找到工作。,200105550523250302,韩国,2,200105,一封写给父母的信,65,70,33,49,51,254,未参加,
“非常感谢你们对我的照顾！,200105550523250371,韩国,2,200105,一封写给父母的信,75,70,60,58,74,326,C,
我呢，你们不用担心，身体[B本]很健康。,200105550523250394,韩国,2,200105,一封写给父母的信,75,70,66,51,54,305,C,
是吗？,200105550523250424,韩国,2,200105,一封写给父母的信,70,60,41,42,38,236,未参加,
弟弟在汉城学习。,200105550523150435,韩国,1,200105,一封写给父母的信,65,60,38,37,45,228,未参加,
我很抱歉{CC2对不起}没时间陪你们。,200105550523250441,韩国,2,200105,一封写给父母的信,65,75,44,56,38,265,未参加,
您们已知道吧？,200105550523150453,韩国,1,200105,一封写给父母的信,65,75,58,61,56,302,C,
父亲母亲:[BC；]我离开你们{CJ+zxy的时间}已经四年了。,200105550523250458,韩国,2,200105,一封写给父母的信,55,65,41,42,47,232,未参加,
我努力地帮助你们，你们[L]别忘{CQ了}，[BC！]你们的背后{CC后面}有我。,200105550523250486,韩国,2,200105,一封写给父母的信,65,60,41,35,58,242,未参加,
一个学期一完，我就回日本去。,200105206525200018,日本,2,200105,我的一个假期,65,70,42,44,57,264,未参加,
所以我放假的时候{CJX}每次{CJ-zy都}想回到日本{CD了}。,200105206525200029,日本,2,200105,我的一个假期,65,60,22,39,46,215,未参加,
总而言之，这个{CC次}假期对我来说[BD，]很有意义{CD的}。,200105206525100032,日本,1,200105,我的一个假期,65,70,77,68,63,329,C,
后来，我还是作为一个日本大学生回日本去，毕业后开始在一个贸易公司工作了。,200105206525200044,日本,2,200105,我的一个假期,65,65,70,39,63,286,未参加,
这个故事不但表示中国人的性格，而且表示世界上所有的人们的想法。,200105109525100319,日本,1,200105,由“三个和尚没水喝”想到的……,65,65,48,71,61,294,C,
目前，地球有很多问题。,200105109525100353,日本,1,200105,由“三个和尚没水喝”想到的……,65,80,39,40,55,267,未参加,
可是来了第三个和尚时，想法突然变了。,200105109525100358,日本,1,200105,由“三个和尚没水喝”想到的……,65,65,36,49,41,240,未参加,
我一边工作，一边觉得不舒服，[BC。]心理压力越来{CC了}越大了，[BC。]但是我不是新来的，打扫是{CJX}应该新来的负责的，而且我现在非常忙……[BD。]看办公室越来{CC了}越不干净，[BC、]开始影[F影]响[F響]工作{CQ了}，老板忍不住问大家擦桌子的事儿。,200105109525200424,日本,2,200105,由“三个和尚没水喝”想到的……,65,60,57,66,59,290,未参加,
教育是国家的根本。,200105109525100538,日本,1,200105,由“三个和尚没水喝”想到的……,75,65,50,55,66,298,C,
第三个和尚点了点头，说：“{CP第二个和尚说得{CC的}对。,200105109525200569,日本,2,200105,由“三个和尚没水喝”想到的……,70,65,43,62,55,281,未参加,
不过这篇{CJ-dy文章里}的和尚，三个人都是自私的。,200105109525200672,日本,2,200105,由“三个和尚没水喝”想到的……,60,70,43,55,70,283,未参加,
“依赖心”这个东西是好东西{CC2物}，还是坏东西{CC2物}？,200105109525200753,日本,2,200105,由“三个和尚没水喝”想到的……,70,70,73,69,77,347,C,
”那么，这样的措施算不算“仁”？,200205217525100019,日本,1,200205,如何看待“安乐死”,65,80,49,67,65,314,C,
为什么得活？,200205217525200082,日本,2,200205,如何看待“安乐死”,70,80,35,51,65,291,未参加,
不[B还]过，对{CC1对于}这{CQ个}问题的看法只有二{CC两}种。,200205217525200093,日本,2,200205,如何看待“安乐死”,65,60,41,31,44,224,未参加,
在现在的社会里，尤其{CQ对}“安乐死”的赞成与否{CC4赞否}是特别的在被人们注意{CJ-zxy的问题}。,200205205525200064,日本,2,200205,如何看待“安乐死”,75,75,80,54,51,325,C,
可日本的病人大多数都是在医院{CC病院}里死去的，所以{CQ即使}家人{CC家族}希望让病人安乐死，医院的医生也不会同意的。,200205206525200010,日本,2,200205,如何看待“安乐死”,80,75,55,51,51,303,未参加,
如果我{CC她}是她{CC我}的话，我就选择安乐死。,200205206525200025,日本,2,200205,如何看待“安乐死”,65,65,44,45,49,252,未参加,
应该{CJX}全世界{CJ-zy都}承认“安乐死”，否则的话她丈夫那样的事{CC人}还会{CC2又}出现。,200205206525100062,日本,1,200205,如何看待“安乐死”,70,65,27,45,49,242,未参加,
我想他的妻子也是{CD会}了解{CQ了}这一点，才向他提出要自杀的主意{CQ的}，因为她也许会想到，她得了这种不治之症，早晚{CC老早}都{CC就}会死的，所以提早死也不会连累到自己的丈夫，再说她死后，丈夫还是要生活，还是要吃饭{CJsd}，因此不如留{CJ-buy下}这些买止痛药的钱给自己的丈夫过将来的日子。,200205332513100014,柬埔寨,1,200205,如何看待“安乐死”,75,80,63,56,84,349,C,
上一辈要从下一代的立场来想，下一辈也要有从上一辈的立场来想的态[C]度。,200209550523250003,韩国,2,200209,如何解决“代沟”问题,65,70,69,54,60,304,C,
通过对话，才{CC只}能理解对方的思想、生活方式、价值观念等等。,200209550523250005,韩国,2,200209,如何解决“代沟”问题,75,70,78,79,72,363,B,
“了解对方”是解决此问题的最好方法。,200209550523150022,韩国,1,200209,如何解决“代沟”问题,65,70,75,79,76,351,C,
我相信如果两代人理解对方，而且说出来{CJX}自己的想法{CC3想的}，那这“代沟”问题会简单地{CC的}解决。,200209550523250082,韩国,2,200209,如何解决“代沟”问题,65,65,33,40,36,223,未参加,
简直可以享受[C]丰富的物质[B盾]生活。,200209550523150087,韩国,1,200209,如何解决“代沟”问题,65,60,60,69,68,305,C,
这个问题也不是一天、两天内能解决的问题嘛！,200209550523250111,韩国,2,200209,如何解决“代沟”问题,65,60,48,59,60,275,未参加,
所以，要解决代沟的问题父母应在孩子的立场理解孩子们，同样{CC相反}孩子们一定理解自己的父母，尊重自己的长辈。,200209550523150144,韩国,1,200209,如何解决“代沟”问题,60,70,48,64,52,279,未参加,
有的时候他们{CQ连}跟长[C]辈聊天都不要了。,200209550523250146,韩国,2,200209,如何解决“代沟”问题,70,65,60,64,58,303,C,
因此，我们不能忽视家庭的代沟问题。,200209550523250151,韩国,2,200209,如何解决“代沟”问题,65,65,75,76,60,325,C,
比如，建立{CD好}几个咨询所，以帮[C]助两者{CD之间}解决问题或互相了解。,200209550523250151,韩国,2,200209,如何解决“代沟”问题,65,65,75,76,60,325,C,
随着社会的发[C]展，人们的想法和生活上的观念也变化了。,200209550523150184,韩国,1,200209,如何解决“代沟”问题,65,65,63,57,66,300,C,
因此父母的对话能力很重要。,200209550523250207,韩国,2,200209,如何解决“代沟”问题,65,65,57,62,60,293,C,
而子女也{CD并}不应随随便便提出自己的主张，在{CC而}提出主张之前，应{CD要}再三{CC再次}思[C]考。,200209550523250243,韩国,2,200209,如何解决“代沟”问题,75,70,81,81,68,364,B,
如果你们知[B短]道这个问题的重要性也{CD要}理解别人的话[BQ，]这个问[B间]题可以很容易解决。,200209550523150285,韩国,1,200209,如何解决“代沟”问题,65,65,36,37,38,225,未参加,
子女们已经习惯了现代生活方式，而且他们追求新鲜的思考方式，他们常常感觉到[B倒]父母的思考方式是孤陋{CC苦陋}的，他们又想到和父母对话对他们没有帮助。,200209550523250823,韩国,2,200209,如何解决“代沟”问题,65,75,48,57,50,282,C,
总之，代沟[C]问[C]题是不会得到[C]彻底{CC完整}的解[C]决[C]。,200209550523250871,韩国,2,200209,如何解决“代沟”问题,65,65,63,79,68,324,C,
如果没有对话的话，当然不能互相了解。,200209550523250934,韩国,2,200209,如何解决“代沟”问题,65,75,54,71,64,316,C,
这个是很大的问题。,200209550523250941,韩国,2,200209,如何解决“代沟”问题,65,70,48,49,40,258,未参加,
