错句,作文编码,国籍,性别,考试时间,作文题目,口试分数,作文分数,听力分数,阅读分数,综合分数,总分,证书
就好比一个[F個]人在家，耳朵会[F會]听[F聽]到一点脚步声[F聲]，或什么[F麼]{CD之类的}东西掉下去，心里就会[F會]想，是不是灵[F靈]魂，或是小偷，心灵[F靈]上的警[D饰]声[F聲]响[F響]个不停。[BC，],200304522522250018,缅甸,2,200304,静音环境对人体的危害,75,75,39,44,61,284,未参加,
它不仅帮人们清洁口[B品]腔[BQ，]还可以使口腔有着一股清香的气味。,200306542542230005,越南,2,200306,口香糖与环境卫生,65,80,15,46,74,268,未参加,
这样，世界会变得,200307109523200005,韩国,2,200307,绿色食品与饥饿,65,80,80,56,93,362,C,
人类饥饿问题是从来就{CC常}有的问题，一下子解决不了。,200307109523200092,韩国,2,200307,绿色食品与饥饿,65,70,75,59,76,331,C,
但是对挨饿的几亿人来说，吃不吃“绿色食品”不是重要的问题。,200307109523100142,韩国,1,200307,绿色食品与饥饿,65,65,75,56,73,318,C,
这就是[BQ“]绿色食品[BQ”]。,200307109523100152,韩国,1,200307,绿色食品与饥饿,60,55,62,51,58,267,未参加,
我认为这两个问题都是不能放弃的。,200307109523200182,韩国,2,200307,绿色食品与饥饿,70,65,64,51,50,286,C,
P}但是用化肥和农药种[C]地的话，吃了会有害于我们的健康，[BC.]另外这[C]些东西{CJ-zy会}导致环境污染。[BC.],200307109523200215,韩国,2,200307,绿色食品与饥饿,60,60,59,46,47,254,未参加,
以前人们不知道“绿色食品”的重要性，[BC.]为了增[B曾]加生产量，所以用上了很多种农药，但这种食品{CJX}人们吃的话，虽然饱，但是对人体一点儿也没有好处。[BC.],200307109523100250,韩国,1,200307,绿色食品与饥饿,65,65,56,43,50,263,未参加,
还有些非洲的孩子因为饥饿甚至吃土。,200307109523200283,韩国,2,200307,绿色食品与饥饿,95,95,83,80,96,448,A,
中国的俗话说：“[BC‘]民以食为天[B主]。[BC，],200307109523200355,韩国,2,200307,绿色食品与饥饿,65,75,70,43,58,298,C,
因为世界上还有{CC还[C]是}很多人{CQ因}缺少粮食而饿[B哦]死，尤其是非洲不少国家还没解决这粮食问题。,200307109523100400,韩国,1,200307,绿色食品与饥饿,60,55,72,49,76,293,未参加,
第二不挨饿。,200307109523200404,韩国,2,200307,绿色食品与饥饿,60,55,46,49,38,229,未参加,
可见，我们为了环境和身[B良]体[B休]健康该吃绿色食品吧。[BC.],200307109523200410,韩国,2,200307,绿色食品与饥饿,60,70,62,35,58,270,未参加,
所以我们要想这[C]个污染的问题。,200307109523100432,韩国,1,200307,绿色食品与饥饿,60,60,59,49,47,257,未参加,
所以我反对多用农药和化肥的{CC和}主张。,200307109523200447,韩国,2,200307,绿色食品与饥饿,65,90,75,70,90,381,B,
不过，每个人{CJ-zy都}这样，只想自己的健康，不管别人饿死，这是做人的道理吗？,200307109523200485,韩国,2,200307,绿色食品与饥饿,60,60,67,33,35,237,未参加,
虽然[BD，]社会的发展使{CC给}人类的生活方便了很多，[BC.]可是对人类的健[B建]康来说是{CQ另}一码事。,200307109523200542,韩国,2,200307,绿色食品与饥饿,75,65,56,35,56,274,未参加,
为了满足{CC充足}消费{CC2消费量}，不得不使[C]用农药[C]。[BC，],200307109523200545,韩国,2,200307,绿色食品与饥饿,65,55,48,46,53,249,未参加,
你想过没有{CJX}我们的未来？,200307109523200562,韩国,2,200307,绿色食品与饥饿,80,70,80,64,76,360,C,
我觉得吃“绿色食品”和不饥饿两个都很重要。,200307109523200598,韩国,2,200307,绿色食品与饥饿,65,55,48,49,47,246,未参加,
每天每顿我们吃的食品要清洁，因为要是在食品上有很多脏的东西的话，将来我们的身体也{CJX}不能保证健康！,200307217523100001,韩国,1,200307,绿色食品与饥饿,70,65,59,62,84,326,C,
现在，在非洲等地区挨饿的人非常非常的多，但是现在的科学还不能解决这个问题，食用绿色食品也是不可能的，因为他们买不起。,200307217523100001,韩国,1,200307,绿色食品与饥饿,70,65,59,62,84,326,C,
吕布一眼就相上{CJ+buy出}其中的一匹是名马，他就选择了它做为自己的马了。,200307217523100015,韩国,1,200307,绿色食品与饥饿,70,65,72,62,76,331,C,
我们国家也{CJX}很久以前很穷的时候没有吃的也没有穿的。,200307217523200057,韩国,2,200307,绿色食品与饥饿,65,65,62,35,70,281,未参加,
说实话，我从来没想到绿色食品和饥饿的关系，因为我开头说过[C]，我认为{CC以为}饥饿问题在于不是{CJX}产量的降低，而是气候和土壤。,200307217525200056,日本,2,200307,绿色食品与饥饿,65,70,64,51,76,312,C,
如果让我选，我会选择去吃被污染的农作物。,200307217523200126,韩国,2,200307,绿色食品与饥饿,70,70,75,46,81,330,C,
现在情况来说，没有特别的方法。,200307217523100130,韩国,1,200307,绿色食品与饥饿,65,65,54,46,70,284,未参加,
虽然达到了提高产量的目的，但是多吃{CD了}那些化肥和农药[C]，有害于人的健康。,200307204523200001,韩国,2,200307,绿色食品与饥饿,65,75,86,75,90,378,B,
发达[C]国家应该注重食品有没有污染，同时可以对一些欠发达国家进行经济援助，帮他们生产又多又便宜的绿,200307204525200004,日本,2,200307,绿色食品与饥饿,65,65,80,70,81,345,C,
我认为，还{CJX}远在什么地方存在只有一顿饭也不能吃的人{CJl}。,200307204523200021,韩国,2,200307,绿色食品与饥饿,60,65,48,33,61,250,未参加,
如果硬要从两者中选一个的话，我认为减少饥饿、大量生产是个较好的选择[C]。P},200307204523100118,韩国,1,200307,绿色食品与饥饿,75,80,83,83,84,396,B,
平均[C]的[C]寿命也越来越长{CC高}了。,200307205525100063,日本,1,200307,绿色食品与饥饿,65,65,46,62,76,298,C,
不管对人的健康有没有好处，首先[B选]要想生活下去。,200307205523200101,韩国,2,200307,绿色食品与饥饿,65,65,59,35,53,261,未参加,
家里有个小孩，要吃好的东西。,200307205525200139,日本,2,200307,绿色食品与饥饿,75,65,72,67,76,342,B,
几亿人口[C]的确是很不少的数目。,200307212523200032,韩国,2,200307,绿色食品与饥饿,70,80,67,70,99,376,C,
第一个原因是使用化肥和农药的食品是对我们的身体有害{CQ的}。[BC.],200307212523100047,韩国,1,200307,绿色食品与饥饿,65,70,80,72,76,349,C,
其中一半是儿童[B竟]。,200307201523100005,韩国,1,200307,绿色食品与饥饿,60,60,38,25,32,197,未参加,
总而言之[B文]，我认为的是现在的我{CD是}把“绿色食品”放在不挨饿的前边儿，[BC.]还有，先解[C]决面临的问题后，解决下一步的问题，[BC.]但，我们也不能看，因为增加粮食而挨饿，使用多一些化肥,200307201523100034,韩国,1,200307,绿色食品与饥饿,60,60,67,54,76,299,未参加,
那我们应该用化肥和农药吗？,200307201523100048,韩国,1,200307,绿色食品与饥饿,65,70,78,78,100,377,C,
如今，人们都感兴趣{CJX}{CQ对}自己的健康。,200307201523100052,韩国,1,200307,绿色食品与饥饿,65,60,64,67,76,315,C,
农作物的{CJX}一半用有一点的农药，一半自然养成。,200307201523100057,韩国,1,200307,绿色食品与饥饿,55,60,48,25,47,216,未参加,
所以化肥和农药的缺点应该平衡{CC保重}一下。,200307201523200068,韩国,2,200307,绿色食品与饥饿,60,60,51,27,30,210,未参加,
起先{CC2起发点}是从人类的农业大国美国开始。,200307302523100006,韩国,1,200307,绿色食品与饥饿,70,60,62,27,56,260,未参加,
”的关系{CD中}，所以，生态的破坏是人类生活的危害。,200307302523200018,韩国,2,200307,绿色食品与饥饿,70,70,67,56,73,324,C,
首先，论化肥和农药，我觉得它是不可缺少的部分，因为现在的自然环境跟以前不大一样了，如果不用化肥和农药，不但对农作物的产量有影响，而且对挨饿的人也有所影响。,200307302523200028,韩国,2,200307,绿色食品与饥饿,85,70,67,70,76,359,C,
可是绿色食品产量少，出现了问题。,200307302523100039,韩国,1,200307,绿色食品与饥饿,65,60,51,51,50,260,未参加,
为了他们要有些农作物少用化肥和农药，多生产,200307302523100039,韩国,1,200307,绿色食品与饥饿,65,60,51,51,50,260,未参加,
其次，增加绿色食品的产量的话，会产生{CC发生}很大利润。,200307302523200094,韩国,2,200307,绿色食品与饥饿,70,65,67,56,79,323,C,
我们可以发明一种新农药只对害虫有害，对植物和人体则无害或者有利。,200307302523100103,韩国,1,200307,绿色食品与饥饿,70,75,83,67,84,368,B,
但是随着世界经济的发展，人们的知识水平的提高，慢慢地意识到使用化肥和农药的农作物会有害于人的健康，提倡[B昌]吃“绿色食[C]品”的重要性。,200307302523200140,韩国,2,200307,绿色食品与饥饿,60,60,62,54,84,302,未参加,
当然有绿色食品。,200307206525100020,日本,1,200307,绿色食品与饥饿,65,70,51,46,44,262,未参加,
我们在人类吃饭的时候，一定要用农药的水果、蔬菜等，还[C]有绿色食品，吃得平衡一点。,200307206525100052,日本,1,200307,绿色食品与饥饿,70,65,54,38,61,274,未参加,
所谓绿色食品，是不用化肥和农[B家]药而{CD所}生产的食品。,200307332523200020,韩国,2,200307,绿色食品与饥饿,65,60,72,72,73,325,C,
世界上有阴有阳有好有坏，是一种大自然的平等。,200309529529151001,泰国,1,200309,我对男女分班的看法,65,75,47,44,49,267,未参加,
老师布置{CC2给}作业时，男的跟男的{CJ-zy一起}做，女的也跟女的{CJ-zy一起}做。[BC，],200309529529251023,泰国,2,200309,我对男女分班的看法,60,65,55,44,56,263,未参加,
我从小学到大学一直接受{CD了}男女混合式教育。,200310576525200036,日本,2,200310,我对男女分班的看法,80,80,74,73,72,371,B,
我跟采访的学者一样也是反对男女分班{CJsd}。,200310576525100068,日本,1,200310,我对男女分班的看法,70,60,55,37,56,263,未参加,
具体来说，很难找到理想的工作做，也就是说我们很难在当今社会立足。[BC，],200310540540150070,印度尼西亚,1,200310,谈有效阅读,60,65,50,47,79,284,未参加,
不要为了不需之求阅读{CC习惯}。,200310540540250064,印度尼西亚,2,200310,谈有效阅读,55,60,50,35,64,245,未参加,
读书时期，我养成{CQ了}每天必读书籍的习惯，也经常看课外书，[BC。]从而受益匪浅{CC获益不浅}。,200310540540250069,印度尼西亚,2,200310,谈有效阅读,65,70,57,49,86,313,未参加,
所以我觉得如果我们能在空闲[C]的时候，{CJ+zy常常}去逛{CJcd}书局，多翻阅翻阅有益的书籍，决定了自己的选择后把它买回家，有空时阅读它，对我们来说是百利无一[L]弊的。,200310540540250076,印度尼西亚,2,200310,谈有效阅读,65,65,73,62,84,333,C,
我父亲{CJ+zy有时}告诉了我有些汉字的来源[B原]。,200304131539200040,印度,2,200304,我学汉语是为了……,70,70,33,49,63,273,未参加,
总而言之，我非常赞成男女分班的这种做法。,200306680519250008,马来西亚,2,200306,我对男女分班的看法,90,85,77,63,90,402,B,
因此，我们要避免中学男女“早恋”，就应该让他们知道“早恋”的不好之处，而非进行男女分班。,200306680519250059,马来西亚,2,200306,我对男女分班的看法,80,85,85,77,90,411,B,
而{CQ如果}不能吃饱[BQ，]一个国家、一个社会根本无法{CC不法}安稳。,200307271523100005,韩国,1,200307,绿色食品与饥饿,80,75,86,70,93,395,B,
很多人参加那个节目。,200307271523200009,韩国,2,200307,绿色食品与饥饿,70,70,70,49,70,317,C,
才是人类会做到的唯一的方法{CD了}。,200307271523100020,韩国,1,200307,绿色食品与饥饿,65,65,70,59,53,296,C,
就是说，按照大家的平均[C]经济[C]水平上升，因此，一般都{CD保}有{CQ对}经济能力和对[C]身体要选[C]择的概念[BQ。]第[C]三，农民的收入[B刀]比{CJ-sy从事}其他经济[C]活[C]动{CQ的}人低[C]一些。,200307271523100060,韩国,1,200307,绿色食品与饥饿,70,65,62,46,47,276,未参加,
那就意味着，不用化肥保障人类和大自然共同生存。,200307271523200064,韩国,2,200307,绿色食品与饥饿,75,70,54,43,67,298,未参加,
现在社会工业发展的时代{CJs}，我们到处看到农业部分都影响到了工业化。,200307271523200094,韩国,2,200307,绿色食品与饥饿,70,65,59,56,79,315,C,
粮食的质量是很重要的。,200307271523200106,韩国,2,200307,绿色食品与饥饿,70,65,67,59,58,305,C,
我同意这些规定。,200405109525100286,日本,1,200405,吸烟对个人健康和公众利益的影响,70,65,59,66,70,316,C,
因为[BD、]{CD如}在日本原来可以吸烟的人是20岁以上的，[BC。]可是实际上至少13岁以上的高中学生也偷[C]偷[C]地抽烟。,200405109525200318,日本,2,200405,吸烟对个人健康和公众利益的影响,45,60,24,35,35,178,未参加,
从社会的环境来看，吸烟没有什么好处，吸烟的时候，人们常常吐痰[Ptan]，把烟头{CC烟草}随便扔{CJ+buy下去}在街上，因此，公众感到不快{CJ+zxy的感情}。,200405109523100323,韩国,1,200405,吸烟对个人健康和公众利益的影响,50,60,59,56,61,266,未参加,
我有一段时间戒烟{CLH}过，[BC。]不过戒烟太难，大概十{CC10}个月以后又开始了抽烟。,200405109525100480,日本,1,200405,吸烟对个人健康和公众利益的影响,55,65,45,56,59,262,未参加,
其实我也是吸烟的{CJ-zxy人}，[BC。]现在开始我要戒烟了，[BC。]我还[C]要劝朋友们戒烟{CD了}。,200405109523100556,韩国,1,200405,吸烟对个人健康和公众利益的影响,90,70,79,79,73,384,B,
成长{CC长成}中吸烟会{CC是}引起可怕的后果。,200405109523200580,韩国,2,200405,吸烟对个人健康和公众利益的影响,65,65,64,66,59,303,C,
韩国政府从去年开始在公共场所吸[C]烟的人被罚款{CJ-zxy的规定}，[BC。]这样的国家越来越多。,200405109523200606,韩国,2,200405,吸烟对个人健康和公众利益的影响,65,65,64,58,53,289,C,
吸烟给我们的影响是很大的，[BC。]主要是损害吸烟者个人的健康。,200405109525200689,日本,2,200405,吸烟对个人健康和公众利益的影响,60,65,57,56,61,282,未参加,
吸烟者虽然第一次吸烟时不知道体内的变化，但是越抽越感觉到身体变弱了。,200405109523200699,韩国,2,200405,吸烟对个人健康和公众利益的影响,65,60,67,60,50,285,C,
车上写着“[BC‘]禁止吸烟”[BC’]，我也会明白这[C]指的是什么，难道他连[C]这[C]个词[C]也看不懂吗？P},200405109523200989,韩国,2,200405,吸烟对个人健康和公众利益的影响,65,60,62,64,55,289,C,
我是不抽烟的。,200405109525200984,日本,2,200405,吸烟对个人健康和公众利益的影响,65,65,45,52,59,270,未参加,
吸烟的人和不吸烟{CJ-zxy的人}得各种各样的疾病的可能性有明显的差异，这也是人们都知道的常识。,200405109523101000,韩国,1,200405,吸烟对个人健康和公众利益的影响,65,65,62,52,64,292,C,
政府说{CD的}{CJ-zhuy这}是为了帮助国民{CD的}戒[L]烟。,200405109523201005,韩国,2,200405,吸烟对个人健康和公众利益的影响,65,60,50,37,53,248,未参加,
最近，在公共场所，允许抽烟的地方越来越少了。,200405109525101011,日本,1,200405,吸烟对个人健康和公众利益的影响,75,65,50,58,64,299,C,
吸烟对个人健康和公众利益的影响是明显的，[BC。]所以，这政府的对策很有道理。,200405109525201024,日本,2,200405,吸烟对个人健康和公众利益的影响,70,60,33,56,59,263,未参加,
再有一个问题就是吸烟对公众利益也不好。[BC.],200405109523201424,韩国,2,200405,吸烟对个人健康和公众利益的影响,75,55,48,44,66,273,未参加,
保护{CC保守}公众利益也是应该的。,200405109523201446,韩国,2,200405,吸烟对个人健康和公众利益的影响,70,65,55,39,57,272,未参加,
因此政府应该保护这些{CC这[C]样}不{CD能}吸烟{CQ的}人。,200405109523201549,韩国,2,200405,吸烟对个人健康和公众利益的影响,65,60,28,52,48,236,未参加,
这是迄今为止对吸烟者最为严厉的惩罚措施。,200405109523201553,韩国,2,200405,吸烟对个人健康和公众利益的影响,60,60,59,46,44,251,未参加,
走在街上随时可以见到一些人站在那里，嘴里叼着烟，吞云吐雾似的抽着。,200405109525101606,日本,1,200405,吸烟对个人健康和公众利益的影响,80,95,74,73,86,403,B,
吸烟者伤[F傷]害自己[B乙]的肺，[BC、]这是他们自己[B乙]的责任。,200405109525201666,日本,2,200405,吸烟对个人健康和公众利益的影响,55,60,40,44,48,228,未参加,
我觉得不抽烟有很多好处，[BC。]所以我向往{CC希望}不抽烟的社会。,200405109525201699,日本,2,200405,吸烟对个人健康和公众利益的影响,55,60,36,54,41,227,未参加,
而且他们的烟味儿{CD给}别人{CJX}影响。,200405109523201776,韩国,2,200405,吸烟对个人健康和公众利益的影响,60,75,43,35,44,243,未参加,
他们也知道被动吸烟者也受到健康的威[B陒[C]]胁[B验]。,200405109523201792,韩国,2,200405,吸烟对个人健康和公众利益的影响,65,60,55,54,46,263,未参加,
每个公司[C]、[BC，]机关[B官]{CJ-zy应该}为[C]了大众的便利、[BC，]健康设立{CC2做}吸烟室。P},200405109523201827,韩国,2,200405,吸烟对个人健康和公众利益的影响,70,70,43,48,46,265,未参加,
这种政策应该有{CC要}完整{CC完全}的措施，越严厉{CC严重}越好。,200405109525101844,日本,1,200405,吸烟对个人健康和公众利益的影响,65,60,33,52,57,250,未参加,
说实话，我从来都没有吸过烟，[BC。]因为从小就不喜欢那独特的烟味。,200405109525201871,日本,2,200405,吸烟对个人健康和公众利益的影响,85,80,76,75,75,384,B,
不过避免有害的{CJ+sy抽}烟也是我们的权利。,200405109525201896,日本,2,200405,吸烟对个人健康和公众利益的影响,65,75,62,60,39,288,未参加,
这个高度{CC高低}是什么高度{CC高低}呢？,200405109525100533,日本,1,200405,吸烟对个人健康和公众利益的影响,85,65,62,68,54,323,C,
长期抽烟会使人引起癌症之类的病{CJZR}，并且对孕[Pyùn]妇[B夫]也{CJ-wy有}极其恶劣[B烈]的影响，长期抽烟的话会{CC1可[C]以}生畸形儿。,200405109523200642,韩国,2,200405,吸烟对个人健康和公众利益的影响,75,60,84,66,80,351,C,
亚州的某一个国家[BD，]{CD这个国家}有各种各样的规定，而且比较严格。,200405109523200669,韩国,2,200405,吸烟对个人健康和公众利益的影响,65,65,48,50,68,280,未参加,
总[C]之，吸烟对个人健[C]康[C]和公众利益没有什么好,200405109523101387,韩国,1,200405,吸烟对个人健康和公众利益的影响,70,65,82,79,83,365,C,
有一天不幸的事发生了，丈夫身体没事[BQ，]却{CJX}妻子得了肺癌[C]，甚至是晚期了，丈夫后悔{CQ了}[BQ，]可已[C]经{CJ-sy到了}不可逆转的地步了。,200405109523201381,韩国,2,200405,吸烟对个人健康和公众利益的影响,70,65,64,54,70,309,C,
可是我也要说，政府实行的这些政策[C]只不过是一种手段。,200405109525200116,日本,2,200405,吸烟对个人健康和公众利益的影响,75,75,64,73,72,349,B,
吸烟对人的健康很不良的影响{CJy}，[BC。]这是大家共同的认识。,200405109525100260,日本,1,200405,吸烟对个人健康和公众利益的影响,60,70,74,77,70,336,C,
几年前在美联社国吸烟者投诉了香烟公司，而他们拿{CQ了}不少钱。,200405109525100784,日本,1,200405,吸烟对个人健康和公众利益的影响,70,70,57,68,65,318,C,
这次{CC再次}公布出来的新规定{CC规律}，历史上{CJX}也算对吸烟者{CJ-zy比较}严厉[B历]{CQ的}惩罚措施。,200405204525200151,日本,2,200405,吸烟对个人健康和公众利益的影响,70,70,82,61,58,329,C,
这样的话肯定{CJ-zy能}保持{CJ+dy好的}公众场所{CJ-zxy的整洁}，而且{CJ-zy能}帮助青少年养成良好的{CJ-zxy习惯}。,200405204525200209,日本,2,200405,吸烟对个人健康和公众利益的影响,60,65,47,51,56,262,未参加,
我也知道这件事情不是故意[B依]的，可是一到人多的地方{CD的话}希望{CJ-zhuy吸烟者}自觉地{CC得}不抽{CJgd}，[BC。]再也不要碰到我这样的小朋友和不抽烟者。,200405204525200310,日本,2,200405,吸烟对个人健康和公众利益的影响,70,70,30,39,45,242,未参加,
连小孩子也不做的事，他们成人做。,200405204525200348,日本,2,200405,吸烟对个人健康和公众利益的影响,60,65,44,28,42,222,未参加,
听说，如今[BD、]在公共场所[BD，]允许抽烟的地方越来越少了。,200405205525200009,日本,2,200405,吸烟对个人健康和公众利益的影响,60,80,49,63,63,302,未参加,
吸烟{CD还有}除了{CQ对}个人以外，{CQ对}周围的人也受到不好的影响{CJy}。,200405205525100051,日本,1,200405,吸烟对个人健康和公众利益的影响,60,65,47,39,54,248,未参加,
每个人都很自觉，能考虑[C]到别人{CC人家}的话，世界会变成很美的。,200405205525100211,日本,1,200405,吸烟对个人健康和公众利益的影响,65,75,47,37,49,260,未参加,
现代的男女相识方式包括偶遇、友人介绍、甚至是政治因素所搓成的。,200410534533250008,新加坡,2,200410,最理想的结交方式,80,80,80,79,75,386,B,
大家不防看看周围这样的例子屡见不鲜。,200410534533250011,新加坡,2,200410,最理想的结交方式,70,90,91,83,100,427,B,
所以，我觉得通过介绍，慢慢了解而相爱的相识方式是最理想的，最安全的。,200410534519250021,马来西亚,2,200410,最理想的结交方式,65,70,71,72,77,341,C,
我觉得这样一种结识方式最能结识到志同道合的朋友。,200410534533250029,新加坡,2,200410,最理想的结交方式,75,90,55,54,82,350,C,
但若他们的心态正确，把感情建立在互相扶持（在学业上），那就无可厚非。,200410534533250030,新加坡,2,200410,最理想的结交方式,75,85,71,72,96,392,B,
也{CJX}彼此谅解双方的喜、怒、哀、乐。,200410534533250059,新加坡,2,200410,最理想的结交方式,75,85,71,60,75,359,B,
而这段时间足以让你去观察对方，了解对方以判断对方是否是自己合适{CC合意}的人选。,200410534533250084,新加坡,2,200410,最理想的结交方式,85,90,71,67,72,381,B,
由于双方都在大学认识{CJX}开始，以后彼此都有共同的回忆，有许多共同的话题。,200410534533250120,新加坡,2,200410,最理想的结交方式,90,90,83,76,91,428,A,
在公众人士中，孕妇是最大的受害者。,200405680519250007,马来西亚,2,200405,吸烟对个人健康和公众利益的影响,75,85,60,72,82,367,B,
然而，男女分班，男生女生少有接触，将来学有所成，[BC、]成为专业人士，聚精会神专注在事业上，由于年轻时少与异性交往，社交往来也就少了异性朋友。,200504534533250003,新加坡,2,200504,我对男女分班的看法,75,75,76,71,84,371,B,
例如你有一个男朋友，我也一定要一个，才可胜[C]你。,200504534533250015,新加坡,2,200504,我对男女分班的看法,60,60,62,47,50,261,未参加,
所以我赞同男女合班，但是这会让教职人员和家长多一份担心，那就是学生早恋，但这些早熟的学生只是占[C]少部分[B份]，大多数在父母及师长[D长]的督促下，应该会有健全的身心去读书。,200504534533250034,新加坡,2,200504,我对男女分班的看法,80,85,67,65,68,359,C,
我个人以为男[BD，]女同[B仝]班并[F並]不会带来早恋的现[F現]象。,200504534533150050,新加坡,1,200504,我对男女分班的看法,75,75,78,78,93,389,B,
与[B于]其把时间花在爱慕者的身上，何不把时间放在功课上呢？,200504534533250078,新加坡,2,200504,我对男女分班的看法,65,55,42,43,50,237,未参加,
这能对学者、[BC，]家长{CC学长}和学生三方都产生{CC有着}正面的影响。,200504534519250124,马来西亚,2,200504,我对男女分班的看法,80,70,78,67,82,367,B,
家长们也要想想，男女分班也可能会造成同性恋，这样不是更糟吗？,200504534533250133,新加坡,2,200504,我对男女分班的看法,70,80,70,71,70,351,B,
如果那女子是念女子学校，她一定会试着和另一个和她同性的同学谈恋爱。,200504534533250134,新加坡,2,200504,我对男女分班的看法,75,70,59,69,68,330,C,
但如果一个老师教一班女同学，有时也会太安静，令教书很不自在。,200504534533250148,新加坡,2,200504,我对男女分班的看法,75,75,62,45,70,317,C,
因此，我不同意[B以]男女应该分班。,200504534533150174,新加坡,1,200504,我对男女分班的看法,75,75,73,82,77,372,B,
若死粘着一方，不能解脱{CC脱解}，直到年纪大了，就会更难去应付。[BC.],200504534533250171,新加坡,2,200504,我对男女分班的看法,65,85,56,47,66,309,未参加,
所以，何[B和]必把男女分[D开]班、学校呢？,200504534533250182,新加坡,2,200504,我对男女分班的看法,65,65,59,69,59,301,C,
有些父母不断地教孩子认识{CC认}最简单东西，有的向孩子说话要让我们反应的快{CJ?}。,200505109540100081,印度尼西亚,1,200505,父母是孩子的第一任老师,50,40,44,38,59,206,未参加,
