错句,作文编码,国籍,性别,考试时间,作文题目,口试分数,作文分数,听力分数,阅读分数,综合分数,总分,证书
他们俩对那和尚说[BQ：]“[BC，]你看，你画的{CC得}不是蛇，蛇本来是没有脚[C]的，可是现在你在蛇上加了四只[B支]脚[C][BQ，]所以你画的{CD已}不是蛇[BQ，]你要替我们去山下抬水。,199605550523290053,韩国,2,199605,由“三个和尚没水喝”想到的……,60,60,66,47,32,247,未参加,
到了我稍微[B为]懂事时，才发现她曾经暗中吞下{CD过}那酸苦的泪水。,199704123610100102,法国,1,199704,记对我影响最大的一个人,65,80,78,82,84,377,B,
我的母亲今年{CD是}六十岁了，她虽然年纪大，但是身体还是{CQ很}结实。,199704123523100149,韩国,1,199704,记对我影响最大的一个人,65,80,59,73,82,347,C,
我是六岁{CD开始}入学的。,200110540540250157,印度尼西亚,2,200110,我的童年,70,85,79,63,85,374,C,
在我记忆中最清楚的就是这一点，即是老师的关怀。,200110540540250157,印度尼西亚,2,200110,我的童年,70,85,79,63,85,374,C,
本人应征的工作是导游一职。,199312533533200014,新加坡,2,199312,一封求职信,85,90,78,74,80,404,B,
）本人除[C]了精通汉语{CC2华文华语}以外，也精通英语与马来西亚文，皆荣获优越的成绩。,199312533519200079,马来西亚,2,199312,一封求职信,90,75,57,61,85,362,C,
毕业后我一直在公关行业工作。,199312533533200074,新加坡,2,199312,一封求职信,80,85,67,67,75,368,B,
因此我想从[C]大事开始我的职业经验，即[C]想当贵[C]公司的经[C]理。,199312124635100152,俄罗斯,1,199312,一封求职信,50,55,46,45,39,213,未参加,
六岁时上了村立南小学校。,199312123525100201,日本,1,199312,一封求职信,50,55,34,56,36,209,未参加,
现在在北京西单饭店当服务员。,199312123542100412,越南,1,199312,一封求职信,55,50,46,45,41,216,未参加,
自93年5月到现在，在北京语言学院学习汉语。,199312123525100509,日本,1,199312,一封求职信,50,50,46,36,39,198,未参加,
如果我可以当你们公司的导游[BQ，]我不但对西洋的历史较熟悉{CC正统}，而且还可以用英语。,199312123523200708,韩国,2,199312,一封求职信,55,60,50,36,41,223,未参加,
经过这段时间工作，可以说我有一些经验[C]，对外国风俗[C]很了解，对外宾[C]的接待{CC对待}也很熟[L]悉。,199312123523200928,韩国,2,199312,一封求职信,55,65,46,34,39,222,未参加,
我父亲是个很老实、认真、平和的人。,199412124525100010,日本,1,199412,记我的父亲,60,60,54,61,72,289,未参加,
目前家里只有我父母。,199412124525200003,日本,2,199412,记我的父亲,80,65,65,59,76,333,C,
因为我大学毕业以后，从事过{CD了}几年的经贸行业，觉得教学是最好的职[C]业。,199412124523100048,韩国,1,199412,记我的父亲,60,65,78,61,82,329,C,
到我青年时，我还记[B纪]得她在饭桌上问[B间]候[B后]我{CD今天}的情况。[BC，],199412104533100687,新加坡,1,199412,记对我影响最大的一个人,75,60,70,36,57,284,未参加,
我非常感谢他。,199412104523100683,韩国,1,199412,记对我影响最大的一个人,60,60,49,50,43,244,未参加,
虽然她不会说汉语，可是他拼命地说明（用很多方法）而且非常有礼貌。,199412104525200624,日本,2,199412,记对我影响最大的一个人,50,50,57,48,41,224,未参加,
你好好记住父亲以前跟你说过的话，到北京，肯定还会有很多困难，如果你遇到这种困境，你要勇敢地面对它，克服它。,199412104523100116,韩国,1,199412,记对我影响最大的一个人,65,90,62,50,59,317,C,
谈以我父亲时总离不开一个词，就是“努力”。,199412104525200110,日本,2,199412,记对我影响最大的一个人,85,75,73,61,67,353,B,
母亲、父亲、在大学读书时的导师、公司的好同事、甚至是小时候同我一起玩儿过的同学……。,199412104525100623,日本,1,199412,记对我影响最大的一个人,55,65,68,46,61,277,未参加,
对我影响最大的人，叫××××，{CQ是}作家。,199412104525100120,日本,1,199412,记对我影响最大的一个人,65,65,81,71,74,340,C,
目前我{CQ已}在香港落地生根。,199409543634100204,英国,1,199409,学习汉语的苦与乐,90,55,43,44,55,276,未参加,
人家不聘用你[Y妳]也不要紧嘛，就当成是经一事，长一智好了，何必{CC所必}想着自寻短见呢？,199500533533200003,新加坡,2,199500,记对我影响最大的一个人,95,80,78,55,69,373,B,
有一天当同学们在做试验时，一位同学不小心被刀片割伤了手指，血流如注。,199500533533200031,新加坡,2,199500,记对我影响最大的一个人,95,80,65,61,74,371,C,
我不知应该往收入丰厚{CC丰富}的会[B绘]计师的道路前进抑是朝着自己喜欢的汉语去。,199500533533200035,新加坡,2,199500,记对我影响最大的一个人,85,75,73,73,90,388,B,
她告诉我，一个人在创[F創]作的初期模仿是没错的，但不能做永远的文抄公，因为那并[F並]不光采，应该自己慢慢地{CC的}去摸索出一条路。,199500533533200083,新加坡,2,199500,记对我影响最大的一个人,80,90,81,73,76,395,B,
记得[BD，]当我开始踏入中学时，[BC。]那时，就认识了许多的老师、同学。,199500533501200106,中国,2,199500,记对我影响最大的一个人,50,65,31,42,49,218,未参加,
自[B白]从他唤起了我的民族志气后，我就立志当[C]一名渔[B鱼]业家。,199500533533100129,新加坡,1,199500,记对我影响最大的一个人,85,95,99,81,98,454,A,
父亲[#][#]应考，结果[BD，]考上了大学，他在大学把机械技术学好，赶上改[C]革开放[C]，自己开办机械厂，今天他成功了。,199510512501100504,中国,1,199510,记对我影响最大的一个人,90,90,81,79,73,411,A,
如今，我在教育学界{CC世界}已有七年了。,199510512501100523,中国,1,199510,记对我影响最大的一个人,90,80,40,48,64,317,未参加,
我想，我的所有这[F這]一切{CC一些}，应该[F該]归功于[F於]他——我最敬爱的父亲[F親]。,199510512501200527,中国,2,199510,记对我影响最大的一个人,85,90,69,68,93,401,B,
这[F這]比较[F較]合理。,199510550523200926,韩国,2,199510,如何看待“安乐死”,80,85,62,79,66,366,B,
我认[F認]为[F為]国[F國]家或政[C]府应[F應]该[F該]制定{CC订[F訂]立}一些法律，说明{CC记[F記]明}在哪[B那]种[F種]情[C]况[C]下病人有权[F權]要求亲[F親]人帮[F幫]助他自杀[F殺]来{CC求}解决痛苦。{CP例如{CD那},199511543634100510,英国,1,199511,如何看待“安乐死”,70,90,74,73,82,382,B,
另一方面，照顾工作已经使家人及社会负担过重{CC累不负[F負]荷}。[BC.],199511543501100526,中国,1,199511,如何看待“安乐死”,85,95,81,77,99,433,B,
曾经[F經]参[F參]加过马[F馬]来西亚广告设[F設]计[F計]比賽，并[F並]荣获{CC荣[F榮]任}第二名。,199503681501100553,中国,1,199503,一封求职信,65,65,71,79,88,352,C,
因仰慕贵公司的大名，而且也想换一下环境、[BC，]在比较大的公司任职，因此才提出申请此职。,199503682519100512,马来西亚,1,199503,一封求职信,75,85,43,52,66,314,未参加,
从[F從]我很小的时候起，我爸爸把我当成一个儿子一样。,199505550523200915,韩国,2,199505,记对我影响最大的一个人,70,70,52,40,51,271,未参加,
学习汉语唯一的苦，可能只有一种情况[C]。,199505529529100058,泰国,1,199505,学习汉语的苦与乐,75,90,81,75,93,408,B,
性格柔和{CC温暖[C]}，爱[C]交朋友。,199505104523200068,韩国,2,199505,记对我影响最大的一个人,50,70,62,67,49,281,未参加,
到中国以后自己的看法，想[C]法都{CJX}变化[C]{CD得}很大。,199505104525100083,日本,1,199505,记对我影响最大的一个人,60,65,39,32,39,218,未参加,
我父亲年龄比较大[BQ，]所以很喜欢孩子常在身边。,199505104922200091,美国,2,199505,记对我影响最大的一个人,95,85,86,69,74,407,A,
”不过[BQ，]他给我的汉语国际电话极大的{CC3十分}鼓励[C]了我。,199505104525200096,日本,2,199505,记对我影响最大的一个人,65,70,60,40,53,274,未参加,
我觉得母亲虽然{CJ+zhuy她}是一个没有文化的家庭妇女，[BC、]但是她有做生意的才能，[BC、]{CD就是}她的直觉是很对的。,199505104525200115,日本,2,199505,记对我影响最大的一个人,50,70,44,61,49,257,未参加,
后来他也辞去原来的公司工作，而抓住机会去那位律师{CC2法律家}的办公室搞理想的工作。,199505104525200131,日本,2,199505,记对我影响最大的一个人,80,80,81,77,69,379,B,
有一次，老师没参加活动时，我们参加了滑雪比赛。[BC.],199505104525200144,日本,2,199505,记对我影响最大的一个人,70,80,83,57,55,335,C,
我也不例外，不管我要做什么事，我肯定先考虑我的妈妈，至少我做的事不让她难过，我希望让她把我当成{CC2是}{CQ让}她[B他]的自豪的女儿。[BD“],199505104529200153,泰国,2,199505,记对我影响最大的一个人,80,65,70,67,55,325,C,
{CP人生有好几个岔路口{CC歧点}。,199505104525100160,日本,1,199505,记对我影响最大的一个人,70,75,81,71,74,360,B,
请你一直看着我吧！,199505104525200190,日本,2,199505,记对我影响最大的一个人,70,80,86,79,67,372,B,
老师给{CC对}这样的我们{CJX}非常热情地讲解{CC2讲}。,199505104525200223,日本,2,199505,记对我影响最大的一个人,70,65,49,69,63,302,C,
母亲的影响，使我完全地{CC的}改变{CQ了}自己以往的思想与行为。,199508682519200502,马来西亚,2,199508,记对我影响最大的一个人,85,80,89,75,82,404,B,
她和蔼可亲。,199508680519200536,马来西亚,2,199508,记对我影响最大的一个人,85,90,89,73,76,409,A,
就靠着他那炽热的心，他，一个人，解决了这场灾难。,199508682519100544,马来西亚,1,199508,记对我影响最大的一个人,75,85,86,73,84,396,B,
那么，没有爱[F愛]情的婚姻是不是真的没{CC不}道理？,200010512501150008,中国,1,200010,我对离婚问题的看法,70,80,97,75,98,410,B,
“环境保护部门最近打算征集几十种动听的自然之声，以取代生活中经常听到的噪声。,200005108523200277,韩国,2,200005,关于用自然之声取代噪声的建议,65,65,56,32,43,245,未参加,
随着社会现代化的发展，我们的生活节奏越来越快，人与人之间的竞争越来越激烈。,200005108525200286,日本,2,200005,关于用自然之声取代噪声的建议,70,85,78,83,82,390,B,
还有，有的时候，声音来说差不多，但是意思有差[Pyì][BQ。],200005108525100295,日本,1,200005,关于用自然之声取代噪声的建议,65,55,45,42,35,224,未参加,
我是从韩国来的留学生，我到北京已经十个多月了，现在在北方交通大学学汉语。,200005108523100305,韩国,1,200005,关于用自然之声取代噪声的建议,65,65,18,42,35,209,未参加,
从自然来的人类失去自然怎么行呢？,200005108525100640,日本,1,200005,关于用自然之声取代噪声的建议,65,65,56,47,43,260,未参加,
但有多少个人了解自然本身[F擁]有的规律呢？,200005108525200646,日本,2,200005,关于用自然之声取代噪声的建议,65,65,48,67,59,288,C,
所以，我很赞成这个环境保护部门的提案。,200005108525200688,日本,2,200005,关于用自然之声取代噪声的建议,65,65,83,50,52,299,C,
这[F這]样[F樣]会[F會]使他们[F們]的友谊[F誼]和感情很快的加深，还[F還]有由于[F於]他们[F們]的缺点[F點]也很相近，所以他们[F們]会[F會]懂得互相忍耐，这[F這]些都是好处[F處]。,199711801501100017,中国,1,199711,我选择朋友的标准,85,60,66,65,54,318,C,
我喜欢跟与自己性格相近的人交朋友，因为与这样的人交往，比较容易找出共同的兴趣[BQ，]思想也容易交流。,199711802801200008,澳大利亚,2,199711,我选择朋友的标准,80,80,77,56,89,374,B,
可是我父母都在农村人{CJZR}。,199705104523200060,韩国,2,199705,我的城市/乡村生活,80,65,80,42,61,316,C,
我到6岁之前在我的故乡生活，6岁后到汉城生活了。,199705104525200110,日本,2,199705,我的城市/乡村生活,75,75,66,83,87,376,B,
送他们上学的时候，早上的车[F車]辆[F輛]也多，交通很挤塞，生活很不方便。,199705529606151004,比利时,1,199705,我的城市/乡村生活,70,70,41,34,53,256,未参加,
现在才知道乡村的生活这么有意义，环境幽静，空气新鲜，大自然风光美丽，真使我感到乡村生活的好处。,199705529529251014,泰国,2,199705,我的城市/乡村生活,65,65,62,59,43,278,未参加,
因此，我最近上课时，经常遇到很多困难，再说我觉得要{CC以}学习高级水平的教材，还{CC1还是}需要了解中国历史、经济、政治等等{CJcd}方面。,199804123523200151,韩国,2,199804,学习汉语的苦与乐,75,80,51,54,56,307,C,
这首诗使我很感动。,199804123525100165,日本,1,199804,学习汉语的苦与乐,80,85,51,62,78,350,C,
虽然我不是中国人，但是希望努力学习汉语{CD和韩语的共通好处}。,199804123523100193,韩国,1,199804,学习汉语的苦与乐,65,75,51,52,34,264,未参加,
从高中毕业了。,199804123644100238,格鲁吉亚,1,199804,学习汉语的苦与乐,65,80,54,52,40,279,未参加,
我们每天应该背100个汉字。,199804123523100244,韩国,1,199804,学习汉语的苦与乐,65,70,75,62,68,326,C,
”我去了大同，在旅游中我得到的{CC得}非常多，非常高兴。,199804124523100435,韩国,1,199804,学习汉语的苦与乐,60,60,33,49,44,228,未参加,
在心理上准备一会儿，才能说出来。,199804124523200459,韩国,2,199804,学习汉语的苦与乐,70,80,72,69,58,339,C,
{TitleCD题目}[BD：][BD“]如何看待妻子回家[BD”]关[F關]于[F於]这[F這]种[F種]现[F現]象.我的看法是：近几[F幾]年来[F來]，随[F隨]着社会[F會]的发[F發]展，观[F觀]念的更新妇[F婦]女们[F們]为[F爲]了争取在社会[F會]上有一定的地位，不断[F斷]地努力，求新，遂而{CC逐而}出现[F現]了很多的女强[F強]人.但.在“事业女性”[BC，]或[BD”]女强[F強]人，{CJ-dy这样的}风[F風]潮[F裏].绝大{CC绝[F絶]}多女性仍然想拥[F擁]有一段美好的婚姻，一个[F個]幸福的家庭[BQ，]在[F覓]到了如意郎君后、和他共结{CC谐[F諧]}连[F連]理.有些妇[F婦]女婚后[F後]帮{CC1帮[F幫]忙}丈夫做生意，成为[F爲]丈夫的左右手.家务有女佣[F傭]做，孩子也有女佣[F傭]照顾[F顧]，不用操心家里的事.有钱[F錢]，[BC.]有心情{CC开[F開]心}去打扮自己，[BC.]跟丈夫去应[F應]酬，出入交际[F際]场[F塲]所，[BD、]最好的是丈夫不介意妻子不懂做菜，[BC.]煮饭[F飯].这[F這]样[F樣]的女性令人羡慕不已.但[BD.]现[F現]实[F實]有多少个[F個]妇[F婦]女能有这[F這]么[F麽]好的境遇{CC遭遇}呢？,199809542542200012,越南,2,199809,如何看待“妻子回家“,65,75,57,48,59,291,未参加,
但我不管这一切，继续下去，因为在韩国时，没有考过口语考试，所以我不知道声调、[BC，]发音和学习汉语有那么密切的关系。,199904123523200082,韩国,2,199904,如何面对挫折,65,70,42,72,56,291,未参加,
但是学知识{CQ的}过程中[BQ，]人人都会遇到许多困难、[BC，]挫折和不幸的事。,199904123635200102,俄罗斯,2,199904,如何面对挫折,60,70,70,62,72,319,C,
虽然{CC2虽}大部分同学纷纷地拿着上边写着82分的答卷，不过只有我的答卷上有28那数字。,199904123525200231,日本,2,199904,如何面对挫折,65,65,45,65,69,293,未参加,
如果说决定人生之路的问题，我们日本人第一次遇上的是参加高等学生的考试。,199904124525100302,日本,1,199904,如何面对挫折,65,65,50,67,74,305,C,
这样，我混了四年大学，毕业了以后，我开始找工作。,199904124523200314,韩国,2,199904,如何面对挫折,70,65,72,55,69,317,C,
