错句,作文编码,国籍,性别,考试时间,作文题目,口试分数,作文分数,听力分数,阅读分数,综合分数,总分,证书
这位孩子妈妈就说她没教过她的孩子，这是因为她自己本身就是这样做的，[BC。]这是孩子自己学来的。,200505212540200007,印度尼西亚,2,200505,父母是孩子的第一任老师,95,85,44,39,47,308,未参加,
所以父母一定要做好一个老师的职责。,200505212542200046,越南,2,200505,父母是孩子的第一任老师,70,90,67,73,76,369,C,
读[F讀]了上面[L]一{CQ篇}小短文后，我觉得从小一起长大的玩伴，随[F隨]着年龄[F齡]的增长，自然而然地走到了一起，这种相识{CJ-zxy方式}是最好的。,200505522522250040,缅甸,2,200505,最理想的结交方式,55,65,59,58,75,294,C,
所以我们在人生的路上选择[L]伴侣，一定要以互相了解为[F為]标志，这[F這]样才会建立{CC得到}一个美满的家庭。,200505522522110020,缅甸,1,200505,最理想的结交方式,65,75,43,35,61,266,未参加,
我在圣彼得堡大学读了中国历史专业[BQ，]像[B象]我妈妈一样[C]。,200505226635200082,俄罗斯,2,200505,父母是孩子的第一任老师,55,60,39,39,32,206,未参加,
我们出生后，是父母教我们怎样走路，怎样说话的。,200505225616200009,德国,2,200505,父母是孩子的第一任老师,85,70,65,51,85,347,C,
我目前会讲[BD：]日语、法语、英文、马来语、华语等等。,200509534519250012,马来西亚,2,200509,一封求职信,70,70,75,47,64,314,C,
在中国居住的那{CC这}段日子内，我的华文更是逐[C]日进步。,200509534533250132,新加坡,2,200509,一封求职信,65,65,68,62,86,330,C,
李文先生：您好。,200509534533250144,新加坡,2,200509,一封求职信,75,70,75,60,79,348,C,
本人的联系地址是三十路，八号，新加坡邮编{CC邮田}六九七七八八。,200509534533250146,新加坡,2,200509,一封求职信,70,65,70,55,77,323,C,
快乐家庭旅游公司李文先生：您好，最近看到了该公司招聘的启事，所以打算来应聘{CC应征}做一名导游。,200509534533150169,新加坡,1,200509,一封求职信,70,65,68,64,84,337,C,
我是×××。,200509534533250178,新加坡,2,200509,一封求职信,75,70,82,75,86,377,B,
我很希望能够被贵公司聘请{CJ+by我当导游}。,200509534533250191,新加坡,2,200509,一封求职信,65,65,77,60,73,324,C,
太喜欢歌[C]曲所以达到了痴迷的程度的话不太好。,200510111523100019,韩国,1,200510,我看流行歌曲,65,70,63,52,47,283,C,
每个时代都有自己的流行歌曲，而且每个时代的流行歌曲总被广[B扩]大人民所喜欢[F歡]，这[F這]是{CD流行}歌曲变[C]成流行歌曲的原因，我也常常听[F聽[C]]现[F現]在的流行歌曲，但是我对流行歌曲的看法并[F並]不总是乐观{CJsd}。,200510111523100417,韩国,1,200510,我看流行歌曲,75,60,56,71,69,317,未参加,
我也是很喜欢流行歌曲的，但是我还不太理解这种歌迷，我觉得歌星只是歌星，不是我们人生的全部。,200510111523100785,韩国,1,200510,我看流行歌曲,50,65,53,42,50,241,未参加,
有些人特别喜欢流行歌曲，不仅是喜欢歌曲还疯[B风]狂地喜欢歌手。,200510111523200793,韩国,2,200510,我看流行歌曲,80,65,67,46,69,315,C,
自己可以追求其它类型[B行]的音乐但不能蔑[C]视人家所爱追求的流行音乐。,200510111523200793,韩国,2,200510,我看流行歌曲,80,65,67,46,69,315,C,
所以我选择了听流行歌曲。,200510111523200826,韩国,2,200510,我看流行歌曲,75,80,72,52,82,352,C,
二则，我能够加入时尚潮流。,200510111523200826,韩国,2,200510,我看流行歌曲,75,80,72,52,82,352,C,
最近韩国日益发展流行[B星]歌[B哥]曲行业，当然有很多歌手。,200510111523100852,韩国,1,200510,我看流行歌曲,60,65,39,54,62,263,未参加,
对于流行歌曲，有些人很喜欢，但有些人不喜欢。,200510111523200860,韩国,2,200510,我看流行歌曲,65,85,53,54,72,319,C,
喜欢流行歌曲是很自然的事。,200510111523200870,韩国,2,200510,我看流行歌曲,65,65,63,52,52,281,C,
有些人特别喜欢流行歌曲，甚至对自己喜欢的歌星达到痴迷的程度。,200510111523101031,韩国,1,200510,我看流行歌曲,65,40,53,38,52,226,未参加,
听最流行的歌曲，我们多多少少会知道人们如今关心的是[B事]什么，社会怎么变化，年轻人的想法等等。,200510111523201056,韩国,2,200510,我看流行歌曲,70,85,70,44,55,316,C,
我非常喜欢听音乐。,200510111523201102,韩国,2,200510,我看流行歌曲,65,50,44,38,55,233,未参加,
它们是一种音乐让人感觉舒坦。,200510111523201255,韩国,2,200510,我看流行歌曲,70,80,70,67,74,351,B,
还有其原因带来对自己的正经事没有好处{CJ？}。,200510111523201567,韩国,2,200510,我看流行歌曲,65,60,46,38,45,237,未参加,
实际上我们很难找[C]到“又长得好看又唱得好”这样的歌手。,200510111523101576,韩国,1,200510,我看流行歌曲,65,65,56,56,59,285,C,
像现在历史学[L]家对过去的流行歌曲研究一样，后代人会研究现在的流行歌曲的{CJsd}。,200510111523201588,韩国,2,200510,我看流行歌曲,60,65,46,44,50,248,未参加,
“我非常喜欢流行[B星]歌曲！,200510111523201846,韩国,2,200510,我看流行歌曲,65,60,51,40,52,251,未参加,
我是20岁的女学生。,200510111523201854,韩国,2,200510,我看流行歌曲,60,55,44,42,37,219,未参加,
我上高中的时候，我不太喜欢一般听众听的歌。,200510111523201873,韩国,2,200510,我看流行歌曲,55,55,32,46,47,215,未参加,
因此，父母对孩子的思想行为是非常重要的。,200510919919150003,加拿大,1,200510,父母是孩子的第一任老师,80,95,71,71,99,411,B,
大街小巷放的都是流行音乐，和同学们聊天也会聊到流行音乐，简直就是不能不听嘛！,200510205540200020,印度尼西亚,2,200510,我看流行歌曲,60,85,77,71,91,373,C,
老歌都不是很适合我们了。,200510205801200079,澳大利亚,2,200510,我看流行歌曲,75,75,65,48,59,312,C,
故而，最聪明的娃娃是从小就被关在一间黑屋子里进行思考的。,200510956501130001,中国,1,200510,父母是孩子的第一任老师,90,95,77,68,88,416,B,
如果一位中国孩子被一对美国夫[B父]妻领养[Plǐngyǎng]了，而这对夫[B父]妻不会说汉语，那么那孩子也会因为父母亲的无能而不会说汉语。,200510956922230007,美国,2,200510,父母是孩子的第一任老师,90,70,80,76,66,375,B,
我的一个爱好是听歌，尤其是一些流行歌曲。,200510520520250015,蒙古国,2,200510,我看流行歌曲,50,50,39,40,69,226,未参加,
首先，影响儿童的思想。,200510302523200010,韩国,2,200510,我看流行歌曲,65,65,67,61,64,306,C,
我已经{CJ-sy是}有了两个孩子的妈妈{CQ了}。,200510302523200039,韩国,2,200510,我看流行歌曲,75,60,53,30,52,256,未参加,
我这么喜欢流行歌曲。,200510302523200065,韩国,2,200510,我看流行歌曲,95,70,67,48,77,351,C,
所以，人们常常下班[B办]以后，在家里体息的时候听音乐。,200510302523100096,韩国,1,200510,我看流行歌曲,50,60,42,40,47,219,未参加,
从我个人角度来讲，[BC。]我是满喜欢流行歌[B哥]曲的。,200510302523100098,韩国,1,200510,我看流行歌曲,75,75,65,48,77,330,C,
对异性最感兴[B性]趣的时候，这时候心态是{CJX}可能最重要的，心态又是身边的环境决定的，他们生活中都很善于听或唱流行歌曲，在学校课间活动时女同学唱起一首又一首流行歌曲[BQ，]如：《老鼠爱大米》、[BC，]《一千年以后》、《木乃伊》、《七里香》等，唱出林俊杰、王力宏、周杰伦、SHE等明星的爱情歌曲。,200510302523200103,韩国,2,200510,我看流行歌曲,90,55,65,63,72,334,C,
往往年轻人是都喜欢快速的歌[C]。,200510302523100127,韩国,1,200510,我看流行歌曲,65,55,30,28,32,192,未参加,
就是爱，朋友，家族[C]这样的{CJ-zxy内容}。,200510302523100196,韩国,1,200510,我看流行歌曲,75,50,42,40,37,228,未参加,
我们可以从我们身边的小事做起吧。,200510302523200236,韩国,2,200510,我看流行歌曲,75,80,72,50,69,337,C,
“[BC‘]青少年”[BC’]，在这个年龄段中，应该没人讨厌流行歌曲{CD的人}，我也{CJ+sy是}不例外，流行歌曲有非常多的听众，特别是青少年。,200510302523200243,韩国,2,200510,我看流行歌曲,65,75,53,48,77,305,未参加,
我是十八岁的女孩，当然我也跟朋友们一样比较喜欢听流行歌曲。,200510302523200243,韩国,2,200510,我看流行歌曲,65,75,53,48,77,305,未参加,
放一段流行歌曲来听听，还可解解闷[F悶]，防开[F開]心怀。,200510532529250003,泰国,2,200510,我看流行歌曲,65,65,42,44,55,255,未参加,
记得当我小时候，每次放学回家，吃了饭，就打开录音机听听我最爱听的音乐。,200510540540200075,印度尼西亚,2,200510,我看流行歌曲,55,65,42,36,42,222,未参加,
但是轰轰烈烈过后又剩下什么呢？,200505680519250002,马来西亚,2,200505,最理想的结交方式,80,90,91,82,91,429,A,
随着社会制度逐渐开放，年轻人无论在{CC的}学校、社团还是{CC2或}职场上[BQ，]结交异[F異]性朋友的机会也增加了。,200505680519150025,马来西亚,1,200505,最理想的结交方式,70,90,75,77,86,391,B,
上次给你打电话时，妈声音特别尖，几乎听不出来是妈。,200104124523200005,韩国,2,200104,一封写给父母的信,75,70,58,47,45,284,C,
身体健康。,200104124523200005,韩国,2,200104,一封写给父母的信,75,70,58,47,45,284,C,
这几天我听到新闻说，现在泰国很热又有雨。,200104124529100083,泰国,1,200104,一封写给父母的信,70,60,49,25,42,231,未参加,
虽然我以前有点后悔了，但是现在我觉得那时如果不来中国一定会后悔。,200104124525200101,日本,2,200104,一封写给父母的信,70,50,33,42,47,225,未参加,
你们想来中国吗？[BC，],200104124542200090,越南,2,200104,一封写给父母的信,60,65,36,25,38,207,未参加,
不知[BD，]爸爸最近的身体如何？,200104124542100109,越南,1,200104,一封写给父母的信,80,65,77,51,67,328,C,
所以从四月十七日开始我的地址[B此]是：五楼一二一号，电话是：82301878。,200104124540200184,印度尼西亚,2,200104,一封写给父母的信,70,85,52,39,67,305,未参加,
我很想带你走遍北京，参观北京的名胜古迹。,200104124542200230,越南,2,200104,一封写给父母的信,70,75,60,54,83,331,C,
果然俗话说的“上有天堂、下有苏[B办]杭是对的。,200104124540100249,印度尼西亚,1,200104,一封写给父母的信,70,75,49,44,65,292,未参加,
明天我要考试，我现在担心死{CQ了}，因为准备得{CC的}不好。,200104124523200284,韩国,2,200104,一封写给父母的信,65,60,25,28,45,206,未参加,
下次我再写信来告诉[B斥]你们吧。,200104124529200300,泰国,2,200104,一封写给父母的信,80,80,49,54,54,309,C,
妈妈这次{CJ-zy就}到这儿吧！,200104124523200312,韩国,2,200104,一封写给父母的信,70,70,74,63,58,323,C,
那时候我弟弟上的高等学校不在{CD于}我们家的附近，他住在学校里，所以只能一个月一次回{CJ+buy到}家{CLH}{CD里}。,200104124525200318,日本,2,200104,一封写给父母的信,75,65,66,49,40,282,未参加,
我妈为{CC1为了}将来怎样活下去担心极了。,200104124523100332,韩国,1,200104,一封写给父母的信,75,55,30,49,47,241,未参加,
妈妈[BQ，]我要去图书馆学习{CQ了}，今天{CJ-zy就}写到这吧。,200104124523200359,韩国,2,200104,一封写给父母的信,75,85,77,47,63,340,C,
想写的事情有很多。,199200003525200014,日本,2,199200,一封求职信,,,0,0,0,0,未参加,
我叫××××，今年二十九岁。,199200008525100009,日本,1,199200,一封求职信,,,0,0,0,0,未参加,
但是每个人的看法不一样，[BC。]这是我的看法。,199604123523200285,韩国,2,199604,如何看待“安乐死”,65,75,45,44,42,258,未参加,
“安乐死”是很难的问题。,199604123525100061,日本,1,199604,如何看待“安乐死”,55,60,56,47,49,248,未参加,
为[C]了病人进行安乐死。,199604123523200293,韩国,2,199604,如何看待“安乐死”,50,60,48,57,49,243,未参加,
再加上正处[F處]于[F於]青春期的子女们[F們]也不愿[F願]在这[F這]个[F個]时[F時]期多与[F與]父母沟[F溝]通。,199610801501200002,中国,2,199610,如何解决“代沟”问题,90,80,70,67,67,369,B,
但要明白，世上{CJ+sy是}没有哪[B那]件事是永远不变的。,199610802801100023,澳大利亚,1,199610,如何解决“代沟”问题,85,80,70,71,65,364,B,
最重要{CQ的}还是以价值观念为前提。,199610512501250009,中国,2,199610,如何解决“代沟”问题,70,80,65,42,65,312,C,
社会上的许[C]多老人了解青年[L]人，青年[L]人也理解[C]老人[BQ，]一定有美好的社会。,199610550523290039,韩国,2,199610,如何解决“代沟”问题,60,65,57,44,49,258,未参加,
现代社会中代沟问题成{CC1引起}了很大的社会问题之一。,199610550523190045,韩国,1,199610,如何解决“代沟”问题,60,65,52,55,53,268,未参加,
人们的思想也越来越开放。,199610550523290060,韩国,2,199610,如何解决“代沟”问题,65,60,49,50,53,260,未参加,
所以自然而然地减少{CJX}他们之间的对话{CQ了}。,199610550523290101,韩国,2,199610,如何解决“代沟”问题,75,80,73,75,76,370,B,
父母与[C]子女之间[F間]“[BC「]朋友”[F」]的关[F関]系[F係]慢慢地{CC的}建立起来，大家相处[F處]、倾[F傾]谈[F談]的时间相应[F應]增加，代沟[F溝]的问题自然容易解决，父母与[F舆]子女便能和睦共处[F處]了。,199611543634100527,英国,1,199611,如何解决“代沟”问题,80,85,57,75,86,377,C,
第三，开放的思想{CC思考}。,199611543523100507,韩国,1,199611,如何解决“代沟”问题,75,70,46,42,43,265,未参加,
当然，靠人不如靠己。,199603533533100019,新加坡,1,199603,由“三个和尚没水喝”想到的……,90,85,80,74,94,420,B,
我都快得骨质疏松症了，除了腰酸，背也驼了，还扛那十几桶水上上下下的，撑不住啰。,199603533533200030,新加坡,2,199603,由“三个和尚没水喝”想到的……,85,90,63,60,87,381,C,
病了就老大推老二，老二推老三，结果不饿死了{CC的}娘，病死了爹才是怪事。,199603533533200038,新加坡,2,199603,由“三个和尚没水喝”想到的……,80,75,58,54,70,328,C,
最后，经小组开会讨论，解决的方法便是每个人轮流分配{CQ做}某些工作。,199603533533200067,新加坡,2,199603,由“三个和尚没水喝”想到的……,90,85,66,70,77,385,B,
但是，人们有领悟{CC2学}到道理吗？,199603533533100083,新加坡,1,199603,由“三个和尚没水喝”想到的……,90,80,44,42,72,323,未参加,
这就明显地{CC的}揭露出人原本是善良、勤劳的，一旦遇到{CC受到}更有利的条件、更美好的环境，如果不会善于利用、善于安排，就会弄巧成拙{CC弄巧反拙}。,199603533533100093,新加坡,1,199603,由“三个和尚没水喝”想到的……,65,80,69,56,65,323,C,
两{CC二}个和尚，他们有伴了。,199603533533200101,新加坡,2,199603,由“三个和尚没水喝”想到的……,85,70,55,47,51,299,未参加,
为{CC1为了}他人做什么事，就为自己{CC2我}{CJ-sy做}{CD的}{CJ-dy什么}事情{CJs}。,199605104523200026,韩国,2,199605,由“三个和尚没水喝”想到的……,60,65,69,58,70,305,C,
开始两个人一起住的时候，我们俩争先恐后{CD主动}地去做。,199605104523100039,韩国,1,199605,由“三个和尚没水喝”想到的……,75,70,69,70,70,343,C,
但两位和尚出现以后，情况就改变了。[BC.],199605104523200036,韩国,2,199605,由“三个和尚没水喝”想到的……,60,55,46,63,49,254,未参加,
这样人的心里{CD中}这么大的毛病怎么解决呢{CJy}？,199605104523200090,韩国,2,199605,由“三个和尚没水喝”想到的……,60,65,80,63,61,312,C,
过了几天，突然天变了，下{CC降}大雨，刮{CQ的}风非常大。,199605104525200131,日本,2,199605,由“三个和尚没水喝”想到的……,55,50,49,56,44,233,未参加,
我觉得这个问题是人们怎样接受事情的问题。{CP如果有一件事情，人们认为{CJ-sy是},199605104523200162,韩国,2,199605,由“三个和尚没水喝”想到的……,70,60,66,54,42,277,未参加,
物质文明水平和精神文明水平不一致，{CQ会}发生社会上的严重的问题。,199605104523100173,韩国,1,199605,由“三个和尚没水喝”想到的……,50,40,49,38,39,191,未参加,
每个人都有懒心。,199605104525200211,日本,2,199605,由“三个和尚没水喝”想到的……,55,80,55,54,80,310,未参加,
这个故事说明的是资源有限的，所以人类应该保护资源，不要滥用{CC乱用}。,199605104525200229,日本,2,199605,由“三个和尚没水喝”想到的……,70,50,46,51,70,270,未参加,
因此，自己做完什么菜就马上亲自动手打扫干净。,199605104525100236,日本,1,199605,由“三个和尚没水喝”想到的……,65,55,74,67,65,308,C,
因为我们不会坚[F堅]持自己的意见、看法，所以周围的事情对我们的心情有很大的影响。,199605104525100286,日本,1,199605,由“三个和尚没水喝”想到的……,65,70,35,49,42,247,未参加,
一大群人、[BC，]一个国家当中常常发现每一个人等别人先来做，结[B给]果没有人考虑{CC负责}国家的利益[B义]。,199605104633100309,意大利,1,199605,由“三个和尚没水喝”想到的……,70,60,58,38,27,238,未参加,
从这个故事中我们可以体会到这一点。,199605104523200328,韩国,2,199605,由“三个和尚没水喝”想到的……,80,70,66,58,63,327,C,
一般这么高的山上，都有泉水。,199605104523200367,韩国,2,199605,由“三个和尚没水喝”想到的……,65,60,55,58,46,267,未参加,
做不好自己责任{CC负责}没有资[B只]格要求自己的权利。,199605550523290042,韩国,2,199605,由“三个和尚没水喝”想到的……,80,70,46,47,56,289,未参加,
那怎样解决我们的腐[C]败，这应该从我们的精神方面来改{CJ+zxy的部分}。,199605550523290064,韩国,2,199605,由“三个和尚没水喝”想到的……,65,65,55,51,56,276,未参加,
后来又有了第[C]三个和尚，我们叫他第[C]三{CQ个}和尚。,199605529529250144,泰国,2,199605,由“三个和尚没水喝”想到的……,65,70,21,33,46,221,未参加,
记[F記]得在我很小的时[F時]候，和同学[F學]一起到效外游玩，同学[F學]的哥哥和我们[F們]一起去，因为[F爲]只有他一个[F個]男生，那么[F麽]所有的一切{CJcd}事务他都包干了，大家玩得很高兴。,199605529529250157,泰国,2,199605,由“三个和尚没水喝”想到的……,70,90,69,54,100,376,C,
以色列国[F國]家，在二次世界大战[F戦]前之所以亡国{CD原因}，就是国[F國]民不能团结分工合作，不顾[F顧]及大家，一切为自己着想，若[C]没有联合国[F國]之成立，恐怕世界地图上[B尚]缺少一个以色列国[F國]。,199605529529150159,泰国,1,199605,由“三个和尚没水喝”想到的……,80,90,46,45,63,319,未参加,
这个愿望是从我的教师来的。,200110540540150040,印度尼西亚,1,200110,我的童年,75,75,49,49,61,299,未参加,
日本投降后，印尼独立了，我上了小学。,200110540540150053,印度尼西亚,1,200110,我的童年,70,85,82,70,92,391,B,
印象最深刻的是--红[F紅]叶[F葉]棒球队[F隊]。,200110540540250078,印度尼西亚,2,200110,我的童年,90,90,79,77,85,419,B,
陪伴我的不再是乡间的鸡[F雞]鸭[F鴨]牛羊，而是电视[F視]和录[F錄]音机。,200110540540150121,印度尼西亚,1,200110,我的童年,85,90,79,80,92,422,A,
我是家里排最小的，[BC。]跟哥哥姐姐年龄[B领]{CD距离}也差很远。,200110540540250137,印度尼西亚,2,200110,我的童年,70,80,49,37,51,277,未参加,
若获许面试，请拨电话[L]4566949与本人联络[BQ。],199312533533200004,新加坡,2,199312,一封求职信,75,80,81,83,71,381,B,
我{CJ-sy叫}×××，毕业于新[C]加坡大学，主修地理系，副修工商管理，现年30岁。[BC，],199312533540100020,印度尼西亚,1,199312,一封求职信,90,90,67,70,78,393,B,
毕业回国后，出任海洋广告公司的产品广告设计工作，并负责与客户的接洽工作。,199312533533200054,新加坡,2,199312,一封求职信,90,80,57,59,68,349,C,
在工作上，也很得上司的提拔[B拨]和同事的欣赏。,199312533533200054,新加坡,2,199312,一封求职信,90,80,57,59,68,349,C,
祝安×××谨启[F啟],199312533519200070,马来西亚,2,199312,一封求职信,95,80,50,69,85,375,C,
毕业后在政府部门当任主管达四年之久。,199312533533100091,新加坡,1,199312,一封求职信,90,70,76,74,98,401,B,
{CQ从}你们[C]公司的要求来看，我的条件不错。,199312123523200709,韩国,2,199312,一封求职信,55,50,25,39,43,191,未参加,
失望{CD了}[BQ，]他哥哥借他点钱，他用这笔钱开{CQ了}一炸[B窄]土豆条的小摊儿{CC小贩[C]子}。,199412123606100012,比利时,1,199412,记我的父亲,55,65,54,36,37,229,未参加,
以后千方不要这样，如果钱丢了[BQ，]一定说[BQ‘]我的钱丢了，对不起爸爸[BQ’]，就行了，世上最坏{CQ的}人是说假话{CC3假说}的人。[BQ”],199412123523100040,韩国,1,199412,记我的父亲,50,65,25,40,43,204,未参加,
我的父亲太保守。,199412123523200043,韩国,2,199412,记我的父亲,65,55,36,38,51,227,未参加,
“虽然[C]现在不能了解[C]。,199412123525100070,日本,1,199412,记我的父亲,50,50,39,36,39,192,未参加,
他一点儿也没有那样{CQ的}习惯。,199412123525200090,日本,2,199412,记我的父亲,60,60,49,30,47,228,未参加,
有一次，我{CJX}在小学四年级的冬天，父亲和我两个人一起去滑雪。{CP那时，假期{CC放假[B暇]},199412124525200040,日本,2,199412,记我的父亲,55,70,57,71,59,296,未参加,
这就是父亲很喜欢美术的缘故吧。,199412124525200041,日本,2,199412,记我的父亲,55,75,65,65,72,317,C,
我在天下最{CJ-zxy爱}的两个人是我的母亲和父亲。,199412124520200049,蒙古国,2,199412,记我的父亲,60,75,70,63,76,330,C,
她也是我的同学，我们每天努力学习汉语。,199412124914200063,古巴,2,199412,记对我影响最大的一个人,45,65,39,30,55,214,未参加,
他每当上课时，一边抬头看着天空讲理想，一边低头看着地上讲现实，使我们把理想与现实调和起来。,199412104523100672,韩国,1,199412,记对我影响最大的一个人,60,50,57,63,45,255,未参加,
我们的研究所属于大学的，我们自己并没有资金。,199412104523200684,韩国,2,199412,记对我影响最大的一个人,70,60,62,57,61,295,C,
可是刚刚来的时[F時]候，什么都陌生，什么都不懂，学习也学不进去，又憋闷又枯燥。[BC，],199412104523200662,韩国,2,199412,记对我影响最大的一个人,65,65,70,63,55,302,C,
年青时[F時]代的我，好动[F動]得不得了，喜欢[F歡]玩乐[F樂]，口里[F裏]喊的是“享受人生，追求自由。,199412104625100366,葡萄牙,1,199412,记对我影响最大的一个人,85,90,89,75,92,427,A,
她是一个[F個]有幽默感的人，常拿这[F這]句话[F話]来[F來]鼓励[F勵]我们[F們]姐妹们[F們]努力{CC勤力}读[F讀]书[F書]，令我们[F們]觉得我们[F們]读[F讀]书[F書]的机会[F會]比她的好，我们[F們]读[F讀]的书[F書]{CQ应该}比她要多。,199412104625200632,葡萄牙,2,199412,记对我影响最大的一个人,70,80,60,50,80,330,C,
可是有时候，他发脾气。,199412104525200621,日本,2,199412,记对我影响最大的一个人,70,60,57,50,51,273,未参加,
可是我面对{CC2对}同学不好意思。,199412104523100648,韩国,1,199412,记对我影响最大的一个人,65,65,41,46,35,236,未参加,
可是[BQ，]在学习上、[BC，]生活上或者事业上，姐姐还是我的榜样{CC目标}。,199412104525200656,日本,2,199412,记对我影响最大的一个人,70,80,65,63,74,342,C,
但是不幸的是他失明了。,199412104525100652,日本,1,199412,记对我影响最大的一个人,70,80,52,53,78,323,未参加,
加上我们[F們]生活在一个中西文化交流的地方，汉语[F語]的平等便间[F間]接地{CQ受}影响了。,199409543634200228,英国,2,199409,学习汉语的苦与乐,75,70,55,66,75,330,C,
随[F隨]后，母亲[F親]也来到新加坡与父亲[F親]团聚。,199500533533100025,新加坡,1,199500,记对我影响最大的一个人,80,90,78,71,90,404,B,
自然而然也就最喜欢上华文课，尤其是上何老师的课。,199500533533200071,新加坡,2,199500,记对我影响最大的一个人,95,80,86,75,82,414,B,
她的镇定与公正令我非常佩服。,199500533533200081,新加坡,2,199500,记对我影响最大的一个人,80,80,86,65,65,368,B,
对别人来说，他只是一个极[F極]为[F為]平凡的{CJ+dy一个}男人，可是对我来说他却是一个不平凡的平凡人。,199500533533100093,新加坡,1,199500,记对我影响最大的一个人,90,85,78,61,74,385,B,
我立志要向他学习，盼[C]望[C]将来也能在商界有有{CJcd}此名望[C]。,199500533533200088,新加坡,2,199500,记对我影响最大的一个人,80,90,91,63,72,391,B,
