错句,作文编码,国籍,性别,考试时间,作文题目,口试分数,作文分数,听力分数,阅读分数,综合分数,总分,证书
天下最关心我、爱我的人就是我父亲。,199412123523200025,韩国,2,199412,记我的父亲,55,50,54,46,53,237,未参加,
但是有时候，我也做{CD了}很多事情惹他生气，他也原谅我。P},199412123529200075,泰国,2,199412,记我的父亲,60,60,57,57,45,261,未参加,
还记得[BD，]我爸爸做的饭，不管他的工作多么忙，他还是有时候抽出时间给我们弄一些好吃的。,199412123636200092,乌克兰,2,199412,记我的父亲,70,55,39,34,51,233,未参加,
我的父亲也是一样。,199412124523200018,韩国,2,199412,记我的父亲,60,75,54,40,78,293,未参加,
爸爸[C]使我下决心学好汉语，我要学好汉语使爸爸,199412124529200027,泰国,2,199412,记我的父亲,95,75,60,46,61,332,C,
到我青年时，我还记[B纪]得她在饭桌上问[B间]候[B后]我{CD今天}的情况。[BC，],199412104533100687,新加坡,1,199412,记对我影响最大的一个人,75,60,70,36,57,284,未参加,
那时我知道我妈多爱我。,199412104523200659,韩国,2,199412,记对我影响最大的一个人,60,70,73,48,63,299,未参加,
”说[F說]完的时[F時]候，我已经[F經]躲在房子里[F裏]，不理任何[B可]人了。,199412104625200111,葡萄牙,2,199412,记对我影响最大的一个人,60,70,39,38,57,249,未参加,
我们第一次碰到是我刚[F剛]上大学时候见面了{CJZR}。,199412104523100675,韩国,1,199412,记对我影响最大的一个人,65,55,33,44,51,230,未参加,
现在的我不是像以前那样学{CC追}她{CQ了}。,199412104525200656,日本,2,199412,记对我影响最大的一个人,70,80,65,63,74,342,C,
当然，我也一样。{CD我想},199412104523100663,韩国,1,199412,记对我影响最大的一个人,55,60,75,48,51,270,未参加,
他经常给学生们说[BQ：]“我这一生里总是以[BQ‘]三人之行[BQ，]必有我师[BQ。][BQ’]这个警句{CD教训}为我的原则。[BC、],199412104523100666,韩国,1,199412,记对我影响最大的一个人,65,60,68,44,53,273,未参加,
首先从[F從]文字着[F著]手，跟小孩子一样[F樣]的，照着{CJ-by样字}{CQ在}练[F練]习[F習]本{CQ上}一笔[F筆]一划[F劃]地{CC的}写[F寫]出来，最初的时[F時]候真是有点[F點]无[F無]所适[F適]从[F從]，尤其是笔[F筆]顺[F順]必须[F須]多练[F練]才可牢记[F記]；但假以时[F時]日，必能写[F寫]{CD得}一手漂亮的汉[F漢]字。,199409543501100205,中国,1,199409,学习汉语的苦与乐,90,70,50,75,91,369,C,
直到两年前，因缘际会[F會]，我有机会学习普通话[F話]，现[F現]在可说是略懂皮毛，也开[F開[C]]始感到自己学习[F習]了汉语[F語]。,199409543501100217,中国,1,199409,学习汉语的苦与乐,85,85,69,73,88,396,B,
她是一名虔诚的佛教徒。,199500533533100026,新加坡,1,199500,记对我影响最大的一个人,95,80,68,63,80,382,C,
尤其是他对我们的教[Y敎]诲[C]，更是我们处世[C]的明灯。,199500533533200040,新加坡,2,199500,记对我影响最大的一个人,90,90,99,79,90,446,A,
不过，我爷爷却没有机会看到我的成就。,199500533533100047,新加坡,1,199500,记对我影响最大的一个人,90,90,89,77,84,428,A,
这可是父母对我的影响[BQ，]也是我一生中最难忘的。,199500533540200107,印度尼西亚,2,199500,记对我影响最大的一个人,85,80,62,57,55,332,C,
”从那天起，我一天一天地{CC的}存下了零用钱，到了一个数目后，她帮我在银行开了一个户头{CC户口}。,199500533533200127,新加坡,2,199500,记对我影响最大的一个人,95,85,86,73,90,427,A,
她并不将个人的价值局限于学[C]术、才华等领域中，她认为个人的处世态度与对世态的一种宽容、友爱的心也是极重要的。,199500533533200128,新加坡,2,199500,记对我影响最大的一个人,95,85,62,65,82,387,C,
他是何方神圣？,199500533533200130,新加坡,2,199500,记对我影响最大的一个人,95,65,78,59,69,358,C,
他以佛教信仰为根本，一生致力{CC努力}于世界和平{CD的}工作。,199500533533200130,新加坡,2,199500,记对我影响最大的一个人,95,65,78,59,69,358,C,
我的故乡在褔州[C]市，父母从[F從]事繁重的体力劳动[F動]，家庭生活并不富裕{CC充裕}。[BC，],199510512501100507,中国,1,199510,记对我影响最大的一个人,90,95,55,48,82,368,未参加,
爸爸说[F說]是向我讲[F講]解一些工厂[F廠]生产时[F時]遇到的问题[F題]，包括一些专[F專]业知识，解决方法。,199510512501200513,中国,2,199510,记对我影响最大的一个人,95,80,83,70,79,403,B,
一寸光阴一寸金，寸金难买寸光阴。,199510512501200524,中国,2,199510,记对我影响最大的一个人,90,90,71,75,79,403,B,
也许有人赞成“安乐死”。,199510550523100903,韩国,1,199510,如何看待“安乐死”,70,85,64,64,73,348,C,
那我就说明我为什么赞成“安乐死”。,199510550523200912,韩国,2,199510,如何看待“安乐死”,80,75,67,37,61,311,未参加,
对他们家族来说[BQ，]虽然妻子或者母亲去世[C]了，不过，她平平安安地死了，还有丈夫和孩子的苦恼{CQ也}早一点儿消失了。,199510550523100929,韩国,1,199510,如何看待“安乐死”,80,75,64,58,66,334,C,
既然故意杀人，就有罪。{CP做为[C]清官来[F來]讲[C]，法律应该[F該]是无情的。P},199511543634100504,英国,1,199511,如何看待“安乐死”,85,85,71,70,86,392,B,
争[F爭]论主要{CD建}基于[F於]两个截然不同的观点：道德立场与人道立场。,199511543501200533,中国,2,199511,如何看待“安乐死”,95,90,83,83,99,449,A,
十年？,199511543501200536,中国,2,199511,如何看待“安乐死”,85,90,76,83,95,425,A,
致精美服装公司季翔先生悉闻贵公司由于业务发展的需要，欲招聘[C]工作人员。,199503680519200547,马来西亚,2,199503,一封求职信,90,90,83,79,82,422,A,
学中文既[B即]有困难又能给学生带来{CC生产}乐趣。{CP只要经过刻苦{CC吃苦},199505529529100054,泰国,1,199505,学习汉语的苦与乐,65,80,57,50,82,322,未参加,
他原来{CC本来}是个船员，在韩国专门学习捕鱼，大学毕业就坐船去大海[C]捞鱼。,199505104523100042,韩国,1,199505,记对我影响最大的一个人,70,80,89,71,59,359,B,
果然，我的研究得到了很好的成果，而且别的男性工程师对我的态度也越来越好了。,199505104525200157,日本,2,199505,记对我影响最大的一个人,75,75,57,79,78,354,C,
通过那段时间，我从她{CQ那儿}学了很多很多事情，而且了解了她的情况{CC素情}。[BC.],199505104525100169,日本,1,199505,记对我影响最大的一个人,70,70,68,69,74,339,C,
祖父没有什么遗[C]产，我父亲无奈[B耐]跟别人借一比{CC批}钱开了{CC开始}一个小的铺子。,199505104523200176,韩国,2,199505,记对我影响最大的一个人,70,60,65,63,57,300,C,
她人很[C]好，长得也跟[C]西施一般[BQ，]漂亮极了。,199505104523200202,韩国,2,199505,记对我影响最大的一个人,80,85,78,69,72,378,B,
他说：“你别操心、{CQ别}担心。,199505104523100213,韩国,1,199505,记对我影响最大的一个人,55,60,52,44,55,247,未参加,
那天玩得痛快得不得了。[BC、],199505104523200290,韩国,2,199505,记对我影响最大的一个人,75,60,52,50,55,278,未参加,
有一次，被那位女人知道我从市场偷东西回来。{CP她就开始骂我一顿，记得我被她{CC他},199505104501100295,中国,1,199505,记对我影响最大的一个人,80,65,68,81,69,351,C,
有一天我给某个团体当翻[C]译[B意]。,199505104523200302,韩国,2,199505,记对我影响最大的一个人,70,55,41,40,53,243,未参加,
但是从受到他的指教以后，我慢[C]慢[C]地形成了{CJ+zhuy我}对大学生生活的我自己的想[C]法以及对专业的我个人的看[C]法：我听从{CC跟着}那位老师的意[C]见，无论是韩国的还是中国的{CJ-zxy书}{CJ-zy都}竭尽全力地读{CJ+by书}，并且慢慢地形成[C]了做为一个韩[C]国人该怎样学习中国[C]文学[C]{CJ-zxy的观点}。,199505104523200305,韩国,2,199505,记对我影响最大的一个人,65,70,68,53,69,311,C,
他说[BQ：][BQ“]只要你们能读，不管花多少钱[F錢]，卖田卖地，我都会供[B攻]你们读大学，或者出国深造。[BQ”],199508680519200525,马来西亚,2,199508,记对我影响最大的一个人,85,75,68,46,51,317,C,
她的话更点醒了我，凡事多为别人着想，不要因自己的利益而去伤害别人。,199508680519200540,马来西亚,2,199508,记对我影响最大的一个人,80,85,73,59,74,365,B,
想想，我们[F們]如此不就算是不孝了？,200010512512150004,菲律宾,1,200010,我对离婚问题的看法,80,75,78,72,95,391,B,
如果有人把它当儿戏，那么这[F這]人罪可当诛[F誅]。,200010512501250009,中国,2,200010,我对离婚问题的看法,75,80,89,80,98,413,B,
还有，跟别的人要说话的时候也是一样，可以用它们的声音来表现[BD，]自己{CC自分}的心理状态，可以表现某一个情况等等。,200005108525100295,日本,1,200005,关于用自然之声取代噪声的建议,65,55,45,42,35,224,未参加,
所以中国也应该早点儿开始用这个办法。,200005108525200294,日本,2,200005,关于用自然之声取代噪声的建议,70,70,59,50,52,289,C,
因为噪声是从各种施工的机器，汽车、飞机、火车、马路等很多地方发出来的。,200005108523100361,韩国,1,200005,关于用自然之声取代噪声的建议,65,70,45,67,56,289,未参加,
当然，这样的生活方式很好，但是社会越发展[D越]，我们丢了很多东西。,200005108523200367,韩国,2,200005,关于用自然之声取代噪声的建议,65,60,50,44,37,239,未参加,
波涛声，鸟声，流水声的确让人感到安静。,200005108523200651,韩国,2,200005,关于用自然之声取代噪声的建议,75,80,70,88,82,386,B,
我出生在日本第三个大城市——大阪市。,200005108525200691,日本,2,200005,关于用自然之声取代噪声的建议,70,75,72,90,82,378,B,
生活在社会之中，每个人都免不了与其他人交往，在交往中有可能就成了朋友。,199711801801100032,澳大利亚,1,199711,我选择朋友的标准,80,80,49,35,68,304,未参加,
今后我继续{CC续[C]继}在城市里生活，希望生活充实，而且能够寻找更多的快乐。,199705104525100007,日本,1,199705,我的城市/乡村生活,75,80,66,60,80,352,C,
我想拿我认识的两个朋友做例子，考察这个问题。,199705104525200085,日本,2,199705,我的城市/乡村生活,70,75,77,63,63,337,C,
到了公司打了卡才想起该吃的早餐[Y歺]在家里。,199705529529151016,泰国,1,199705,我的城市/乡村生活,90,50,83,65,90,366,未参加,
所以我认为将来最好的道[C]路就是能把两者合二[B而]为一，一面得到清新的休息，一面继续搞我喜欢的工作。,199705610501100002,中国,1,199705,我的城市/乡村生活,90,90,74,79,95,426,A,
经过一段时间的努力，我的汉字书写能力有了较大的提高。,199810602801150002,澳大利亚,1,199810,如何面对挫折,95,90,84,89,93,450,A,
学汉语有时候觉得叫我很厌烦{CJZR}，而且让我痛苦。,199804123523200047,韩国,2,199804,学习汉语的苦与乐,70,70,54,57,52,291,C,
我们用文字，不用图画{CC图字}来写，因此我们对应{CC对与}的思想跟亚洲人完全不一样。,199804123608200205,波兰,2,199804,学习汉语的苦与乐,75,70,45,37,46,262,未参加,
这两个问题就是在我学习汉语的时候使我痛苦{CJs}。,199804123608200205,波兰,2,199804,学习汉语的苦与乐,75,70,45,37,46,262,未参加,
它们的区别在声[B生]调。,199804123523100228,韩国,1,199804,学习汉语的苦与乐,70,55,78,57,58,302,C,
我们在生活中常常遇到很多困难，[BC。]有了困难人们{CQ就}感到挫折。,199904123523100014,韩国,1,199904,如何面对挫折,60,60,34,32,30,198,未参加,
我喜欢这一句话。,199904123525100017,日本,1,199904,如何面对挫折,55,65,26,32,37,197,未参加,
虽然遇到挫折的时候。,199904123525100031,日本,1,199904,如何面对挫折,60,55,31,52,39,218,未参加,
而且，他说：“失败是成功的母亲。,199904123523100045,韩国,1,199904,如何面对挫折,70,65,56,39,41,257,未参加,
我在高中的时候在运动上遇到了挫折。,199904123525100137,日本,1,199904,如何面对挫折,55,55,53,37,26,206,未参加,
人长大以后要去工作或在社会里服务，如从小时候他的教育不好的话就{CJX}成年时会遇到许多困难。,199904123521100159,孟加拉,1,199904,如何面对挫折,65,55,37,29,35,203,未参加,
可是他不放弃不回国，一直努力下去，我二年级的时候他还是一年级，不过[B还]他这次所有的考试都{CQ是}85分。,199904124525100289,日本,1,199904,如何面对挫折,55,65,50,29,43,224,未参加,
不过，大部分的人面对种种挫折时，总是唉声叹气，怨天尤人，这样的态度使他们始终克服不了困难，仍然灰心，一生中不会成功。[BC，],199904124529200310,泰国,2,199904,如何面对挫折,70,70,59,80,76,343,C,
可是，要勇于面对挫折绝对不是一件容易的事，虽然我们知道这么做是很好的，但是几个人能做到呢？,199904124529200310,泰国,2,199904,如何面对挫折,70,70,59,80,76,343,C,
我想因为困难、挫折使人们更成功。,199904124529200381,泰国,2,199904,如何面对挫折,70,65,42,44,56,263,未参加,
后来他们安心了，后来{CC就来}互相了解，问题就解决了。,199909529529251011,泰国,2,199909,如何面对挫折,80,85,48,52,50,309,未参加,
