错句,作文编码,国籍,性别,考试时间,作文题目,口试分数,作文分数,听力分数,阅读分数,综合分数,总分,证书
各位先生大家好！,199410550523202902,韩国,2,199410,一封求职信,60,60,71,64,55,292,未参加,
天下最关心我、爱我的人就是我父亲。,199412123523200025,韩国,2,199412,记我的父亲,55,50,54,46,53,237,未参加,
现在还继续学习，这是很不容易的事。,199412123525200029,日本,2,199412,记我的父亲,55,85,36,28,41,233,未参加,
当然，这个过程需要很长时间，而且我会遇到很多困难或问题，但他一定能来帮助{CJ-by我}。[BC，],199412123635200057,俄罗斯,2,199412,记我的父亲,70,65,31,20,39,211,未参加,
我的父亲是个技术工人。,199412123523200095,韩国,2,199412,记我的父亲,50,55,46,48,49,227,未参加,
大概{CC大约}{CQ的}内容是这样{CJsd}：“你虽然现在很难过，可是你看在天上的那么多的星星，都是为你而亮[C]。,199412123523100068,韩国,1,199412,记对我影响最大的一个人,55,60,49,50,51,246,未参加,
我觉得{CQ那是}太累的事情。,199412124525100055,日本,1,199412,记对我影响最大的一个人,65,60,60,53,49,270,未参加,
我家关于钱方面没有问题。,199412104523200658,韩国,2,199412,记对我影响最大的一个人,65,70,52,50,49,272,未参加,
虽然结婚以后生孩子、[BC，]照顾孩子等[BQ，]她生活过得{CC地}忙忙碌碌{CQ的}，可是从来没有发过牢骚，不放弃工作，坚持了{CC1下去}三十多年。,199412124525200062,日本,2,199412,记对我影响最大的一个人,65,85,62,53,53,308,C,
现在我有{CD的}孩子{CQ了}，我能与我的爱人一起把她教授{CC受教}的方法转[B专]到孩子{CQ身}上。,199412104533100687,新加坡,1,199412,记对我影响最大的一个人,75,60,70,36,57,284,未参加,
大部分的老师们{CQ都}不理我，但是{CQ班}主任老师却没有{CC不是}那样看不起我。,199412104523100683,韩国,1,199412,记对我影响最大的一个人,60,60,49,50,43,244,未参加,
对我来说，他只对我宽容{CC放松}。,199412104523200640,韩国,2,199412,记对我影响最大的一个人,70,70,54,59,61,302,C,
作为一位知心的朋友，作为一位真诚的同学，也作为一位热情的恋人，他给我{CJX}{CD付出}了太多的帮助。,199412104523200107,韩国,2,199412,记对我影响最大的一个人,65,90,60,59,78,343,C,
虽[F雖]然有很多人反对使用简体字，因为简化了的字失去了它本来所表现的意思，特别是一些原来是从象形文字演变而来的文字。,199409543501200224,中国,2,199409,学习汉语的苦与乐,85,90,88,68,99,427,A,
”所以，我得永远感谢我那亲爱的父亲。,199500533533200003,新加坡,2,199500,记对我影响最大的一个人,95,80,78,55,69,373,B,
长大后应该是懂事点，但我却给妈妈添了不少麻烦，常[C]常[C]让她操心。,199500533533200036,新加坡,2,199500,记对我影响最大的一个人,75,80,65,57,65,333,C,
她曾告诉我：“人的生命是宝贵的，不论是贫是富，是顺是逆，都是神赐的，都要珍惜。,199500533533200048,新加坡,2,199500,记对我影响最大的一个人,90,90,68,65,82,393,C,
其实当时，文章的内容我是从另一本书里抄过来的，李老师[F師]并[F並]没有当场[C]揭穿这个真相[B像]，而{CC1反而}是在下课后和我做了一次长[F長]谈。,199500533533200083,新加坡,2,199500,记对我影响最大的一个人,80,90,81,73,76,395,B,
黝黑的皮肤起初还叫我们把他误当成马的[B来]同胞呢。,199500533519200092,马来西亚,2,199500,记对我影响最大的一个人,95,90,83,85,92,444,A,
他从事教育工作数十年，从泗水迁到锡江，后来我们全家就定居于印尼苏按威西的一个城市—锡江。,199500533540200109,印度尼西亚,2,199500,记对我影响最大的一个人,85,95,78,65,84,403,B,
从小到大，都是由{CC1由于}我母亲一手带大{CJsd}。,199500533533100125,新加坡,1,199500,记对我影响最大的一个人,95,85,60,57,76,371,C,
从[F從]小到大，影[C]响我的人不少[C]，但对我影响最深的人是……小时[F時]候，父母常出外工作，留下我独自在家，那时[F時]外婆常常来陪伴着我。,199510512501200511,中国,2,199510,记对我影响最大的一个人,90,90,79,66,82,405,B,
爸爸说[F說]是向我讲[F講]解一些工厂[F廠]生产时[F時]遇到的问题[F題]，包括一些专[F專]业知识，解决方法。,199510512501200513,中国,2,199510,记对我影响最大的一个人,95,80,83,70,79,403,B,
一个[F個]月？,199511543501200536,中国,2,199511,如何看待“安乐死”,85,90,76,83,95,425,A,
并且{CC2但}死者家人也不得[F參]予作任何决[F決]定，因为[F為]只有{CC2有}医[F醫]学[F學]或生理{CC生物}上的「机[F機]能尽[F盡]失」才能作为[F為]进[F進]行「安乐[F樂]死」的理由{CC原因}。,199511543501200536,中国,2,199511,如何看待“安乐死”,85,90,76,83,95,425,A,
况且，现[F現]在香港有很多设[F設]备[F備]先进[F進]的医[F醫]院，都提供{CJX}为[F為]患了绝[F絕]症的病人{CD有}「善终服务[F務]」。,199511543501200550,中国,2,199511,如何看待“安乐死”,80,90,59,70,88,382,B,
在此，随函附上学历影印本一份，槟榔艺术学院广告设计毕业证书影印本一张以及参与海报及班级布[F佈]告板设计比赛所获得之奖状影印本一份，敬请查收。,199503681519200549,马来西亚,2,199503,一封求职信,90,90,79,66,82,405,B,
×××（×××）马来西亚，吉隆坡郊外岭仁爱路门牌八号致精美服装公司人事部经理季翔先生：应征[F徵]服装设计师本人日前于[F於][BQ《]星洲日报[BQ》][F報]招聘启事栏[C]内获悉贵公司为了业务发展的需要，{CD而}欲招聘有关服装业各方面的人员。,199503680519200501,马来西亚,2,199503,一封求职信,80,80,71,75,88,386,B,
我希望以后学到汉语和其他很多[C]知识，将[C]来成为{CC成了}跟我父亲一样伟大的企业家。,199505104525100037,日本,1,199505,记对我影响最大的一个人,75,80,70,67,80,363,B,
对我影响最大的，他{CD就}是一个日本人，现年70岁的老大爷。,199505104525100044,日本,1,199505,记对我影响最大的一个人,65,45,44,55,59,247,未参加,
当年在我国总是有大学生{CD们}的游行，[BC。]大部分都是跟政治有关的。[BC，],199505104523100074,韩国,1,199505,记对我影响最大的一个人,65,70,73,67,67,328,C,
在这商品经济大潮冲击下的时代，有的[D的]人却忘了活的真谛，而一味追求物质享受，甚至伤天害理地、不择手段地达到这种目的。[BC.],199505104540100138,印度尼西亚,1,199505,记对我影响最大的一个人,90,95,70,65,92,410,B,
他写的文章都是关于社会问题{CJsd}，[BC、]对社会的矛[B予]盾、问题等看得很清，写得也很好。,199505104525200156,日本,2,199505,记对我影响最大的一个人,95,80,78,73,65,387,B,
当然我们兄弟[L]姐妹也帮助父母，却不如父母。,199505104525200164,日本,2,199505,记对我影响最大的一个人,70,70,62,42,53,285,C,
换一个角度来看，她不老，工作的态度、穿的衣服、心情与年轻人没有两样。,199505104525200184,日本,2,199505,记对我影响最大的一个人,70,60,57,57,72,301,未参加,
在大学{CQ在}他的帮助下，我被选作交流学生来到北京[C]第二外国语学院学习[C]汉语[BQ，]正在考高级HSK。,199505104523100224,韩国,1,199505,记对我影响最大的一个人,65,75,62,57,63,309,C,
我也在日本生活[C]的时[C]候[L]，一点儿也听不懂汉语。{CP老师{CC教师},199505104525100232,日本,1,199505,记对我影响最大的一个人,60,55,39,32,35,202,未参加,
原因是[C]她根本不会做[B作]什[C]么[C]，只靠自己的漂亮来找前途[B[C徒]]。,199505104719200241,喀麦隆,2,199505,记对我影响最大的一个人,75,65,52,36,55,270,未参加,
如果，我没遇[C]到他的话，也许现在我不会{CC能[C]}在中国。,199505104525200256,日本,2,199505,记对我影响最大的一个人,70,65,81,77,86,365,C,
他以前所经历[B力]过的让我很另眼相看{CC开}。,199505104614200261,荷兰,2,199505,记对我影响最大的一个人,65,60,54,48,41,251,未参加,
我也没有小的时候[C]那样尊敬他{CQ了}。,199505104525100271,日本,1,199505,记对我影响最大的一个人,70,65,65,73,80,339,C,
她当时{CQ读}给我们听她{CD所}写的那首诗。,199505104525200282,日本,2,199505,记对我影响最大的一个人,75,75,49,53,61,303,未参加,
这全部都{CC就}是父亲给予的培养[BQ，]可以说父亲对我的影响是最大的。,199505104540100289,印度尼西亚,1,199505,记对我影响最大的一个人,70,55,49,32,35,225,未参加,
在我的一生中，对我影响最大的[BD，]可以说是我最敬爱的外公了。,199508681519200506,马来西亚,2,199508,记对我影响最大的一个人,90,80,78,69,84,396,B,
除了教学，我还阅读了有关修身养性的书籍。,199508680519200535,马来西亚,2,199508,记对我影响最大的一个人,80,90,70,69,78,382,B,
还有爸那开朗、乐观的性格，也是对我影响不浅的，每当我{CQ不}开心时，他总是温言地{CC的}安慰我，有时{CD更}逗得我笑颜逐开，一切的烦恼也烟消云散。,199508683519100550,马来西亚,1,199508,记对我影响最大的一个人,85,85,86,81,82,414,A,
首先，让[F讓]我说[F說]为[F為]什么[F麽]会[F會]影响[F響]儿[F兒]女，当[F當]有儿[F兒]女时[F時]又离[F離]婚，小孩子一定会[F會]问[F問]“[BC「]爸爸在哪[B那]里[F裡][BQ？]”[BC」]或[BC「]妈[F媽]妈[F媽]在哪[B那]里[F裡][BQ？]，作为[F為]父母的要怎样[F樣]对[F對]孩子说[F說]呢？,200010801801250006,澳大利亚,2,200010,我对离婚问题的看法,70,65,50,34,59,264,未参加,
把喇叭声换成美丽的音乐声也好的办法{CJs}，但是再好的话听几遍会听腻[Pnì]的，{CP应该我们站在别人的立场来想的话，不用为不好听的声音而烦脑。P},200005108523200299,韩国,2,200005,关于用自然之声取代噪声的建议,80,70,89,80,74,383,B,
我出生以后，已经有了很多大楼。,200005108525100625,日本,1,200005,关于用自然之声取代噪声的建议,65,65,53,57,41,265,未参加,
因为我的朋友中某一个男孩子就算是没有礼义的人。,200005108525100628,日本,1,200005,关于用自然之声取代噪声的建议,70,65,48,47,46,262,未参加,
我再提出一个例子{CC例如}：将恼人的电话铃声换[B挽]成小河的流水声，改成这样的声音，可以使有电话的人和他们的周围人一听到电话响不感到吃惊，可是这个声音使用电话者不容易听到，特别是他在有河的地方或者在一个有很多杂音的地方，他一定听不见他电话的声音，我建议应该用{CJX}不过刺耳或过大的声音，可是更不应该用过小，不引人注意{CC引人注目}的声音，可是应该改成什么样的声音，我想应该按照东西、环境，比如门的铃响可以用鸟的声音，使主人听到有门铃的声音，可以不吃惊。,200005108542200635,越南,2,200005,关于用自然之声取代噪声的建议,80,80,56,50,65,323,未参加,
虽[F雖]然那些声音是很刺耳的，但是由于它那么刺耳，所以我们感觉到危险。,200005108525200698,日本,2,200005,关于用自然之声取代噪声的建议,65,70,70,95,76,362,C,
春夏秋冬各自各有的美丽景色{CJy}.春天开的花使他高兴，夏天树叶给他休[C]息的地方，秋天红叶让他去思考深刻问题[BQ。]他现在由于他{CQ的}工作关系住在城市，虽然他不太习惯城市生活，但是他给我的感觉他住哪儿都踏踏实实，他知道怎么做就能够过舒服的日子，而且这不是从书里达到的。,199705104525200085,日本,2,199705,我的城市/乡村生活,70,75,77,63,63,337,C,
但是问题呢？,199804123523200122,韩国,2,199804,学习汉语的苦与乐,65,65,33,25,44,216,未参加,
我是来中国以后开始学汉语的，可第一次听汉语的时候是来中国之前。,199804123525200142,日本,2,199804,学习汉语的苦与乐,75,75,60,54,52,306,C,
学习汉语的{WWJ},199804123523100218,韩国,1,199804,学习汉语的苦与乐,80,60,60,54,52,293,C,
学不好，那就对不起父母，对不起朋友，对不起自己。,199804124523100378,韩国,1,199804,学习汉语的苦与乐,80,80,48,81,72,353,C,
比如说打，拍[BD，]等都{CQ跟}手有关系的{CJsd}，还有{CQ跟}足有关系，还有身体呢，前边都有月字，[BC。]所以很容易看出来。,199804124523100391,韩国,1,199804,学习汉语的苦与乐,65,85,54,47,42,283,未参加,
当我很小时{CJ-zhuy我}对学习汉语已经感兴趣了。,199804123614200506,荷兰,2,199804,学习汉语的苦与乐,75,70,30,35,34,233,未参加,
妻子的本份就是操持家务，教育孩子，照顾丈夫和孩子的利益{CC福利}。,199805529529151004,泰国,1,199805,如何看待“妻子回家“,65,55,62,69,68,301,C,
{CD对[F對]}“妻子回家”这[F這]个[F個]问[F問]题[F題]来[F來]说[F説]已[F經]不是中国[F國]的特有现[F現]象。,199809542542200002,越南,2,199809,如何看待“妻子回家“,70,75,52,58,59,303,C,
事不宜迟，于是我们就马上抄{CC塌}“家伙”，无论如何也要把它们抓回来。,199910512501150002,中国,1,199910,我的童年,85,90,97,86,80,434,A,
我也曾经遇到过许多困难。,199904123525200021,日本,2,199904,如何面对挫折,70,65,53,62,54,290,C,
世界上连一个人也不能找到{CD他}没遇到过挫折{CJ-zxy的人}{CJL}，因为挫折把人准备下次的挫折{CJba}，人生的挫折没完没了的{CJba}。[BC，],199904123639100063,阿塞拜疆,1,199904,如何面对挫折,75,65,20,44,39,230,未参加,
没有失败过的人就不知道真正的成功。,199904123523200150,韩国,2,199904,如何面对挫折,65,65,67,55,46,282,C,
有的人一旦遇到困难，就完全放弃，[BC.]甚至走到挫折的路。{CD那就},199904123523200214,韩国,2,199904,如何面对挫折,70,65,59,27,56,263,未参加,
我也{CD可}真受不了[BQ。]一段时间来，不吃饭啊、不说话啊、不想[B根]活下去。,199904123523200214,韩国,2,199904,如何面对挫折,70,65,59,27,56,263,未参加,
其中，当然有巨大的，也有容易克服的。,199904123525200231,日本,2,199904,如何面对挫折,65,65,45,65,69,293,未参加,
但要想到这种消极[B积]的情绪会给你带来什么样的后果。,199904124523200309,韩国,2,199904,如何面对挫折,75,80,83,88,91,408,B,
有些人说我学习中文有什么用，在泰国的社会里，英文泰文才重要。,199909529529151005,泰国,1,199909,如何面对挫折,75,80,27,40,72,285,未参加,
不要怕，要忍下去，目前的生活比不上以前的生活，因为现在想要做什么事情，都要靠自己的能力，好好去想，去做，才会把生活下去{CJba}。[BC，],199909529529251002,泰国,2,199909,如何面对挫折,70,70,27,37,34,226,未参加,
如果能有人从出生到死亡一直一帆风顺，那么今天我们不用为那些困难或挫折烦恼了.不过，那是根[B跟]本不可能的事实.我今年22岁，明年就毕业了。,199909529529251009,泰国,2,199909,如何面对挫折,80,80,72,64,72,360,B,
后来他们安心了，后来{CC就来}互相了解，问题就解决了。,199909529529251011,泰国,2,199909,如何面对挫折,80,85,48,52,50,309,未参加,
