错句,作文编码,国籍,性别,考试时间,作文题目,口试分数,作文分数,听力分数,阅读分数,综合分数,总分,证书
他们的担心是必要的[BQ。]因为他们怕孩子会因为男女恋爱而搞不好学业或做错事，毕竟小孩还不够成熟。,200504534533150178,新加坡,1,200504,我对男女分班的看法,70,75,67,69,66,336,C,
所以若要{CJ-zy让孩子}真正彻底了解父母的用意就必须解释给孩子听而不是用这种手法来阻止他们，否则会弄巧成拙{CC弄巧反拙}。,200504534533150178,新加坡,1,200504,我对男女分班的看法,70,75,67,69,66,336,C,
所以根本没有必要浪费人力物力去开办纯男校或纯女校。,200504534533150179,新加坡,1,200504,我对男女分班的看法,75,80,78,84,77,385,B,
如果家长不让子女在学校接受男女混合式教育的话，到头来吃亏的很可能是子女自己。,200504534533250183,新加坡,2,200504,我对男女分班的看法,65,85,81,82,91,394,B,
因为父母是孩子最早时最多{CJX}接触的人，而且父母应该有{CJX}对孩子所做的行为{CD有}责任，应该全面教育[C]{CJ-by他}{CJX}为他将来能做好人。,200505109525100451,日本,1,200505,父母是孩子的第一任老师,70,75,65,69,69,337,C,
父母是我们的第一任老师。,200505109540100729,印度尼西亚,1,200505,父母是孩子的第一任老师,75,60,63,54,59,297,C,
他们的知识比我多得多，还有{CC还是}他们的意见对我有好处的{CJsd}。,200505109525100824,日本,1,200505,父母是孩子的第一任老师,50,75,44,51,38,242,未参加,
父母应该成为自[C]己理想[B像]的父母。,200505109525100849,日本,1,200505,父母是孩子的第一任老师,60,65,82,65,46,301,C,
用爱心去关心别人、珍惜生命等[BQ，]我估计{CJ-zhuy这些}所有的父母[C]告诉孩子的内容{CJs}。,200505109525200907,日本,2,200505,父母是孩子的第一任老师,80,90,87,58,79,389,B,
例如改变饮[F飲]食习[F習]惯[F慣]，如果{CC若然}平常抽烟的，便停止抽烟，因为这[F這]样[F樣]会[F會]间[B简]接影响[F響]胎儿[F兒]的生长[F長]。,200505109634200961,英国,2,200505,父母是孩子的第一任老师,65,80,57,47,62,299,未参加,
不仅他学习某种习惯，{CQ而且}他们性格也开始形成{CC养成}。,200505109525101040,日本,1,200505,父母是孩子的第一任老师,80,65,64,66,76,339,C,
已经三十八岁了，没有结婚。,200505109525201560,日本,2,200505,父母是孩子的第一任老师,55,50,50,45,61,240,未参加,
从他们的身[C]上孩子就学会了不看红绿[C]灯{CJ+zxy的坏习惯}。,200505109525201752,日本,2,200505,父母是孩子的第一任老师,50,85,76,49,67,314,未参加,
我认为父母给孩子的影响是挺[C]大的。,200505109525201854,日本,2,200505,父母是孩子的第一任老师,45,50,41,35,52,200,未参加,
孩子成长的过程中对他最亲密的人就是他父母。,200505109539101923,印度,1,200505,父母是孩子的第一任老师,90,60,48,47,52,287,未参加,
考上大学的可能性比较小。,200505109525202420,日本,2,200505,父母是孩子的第一任老师,65,70,61,63,87,332,C,
——如果不是“父母”。P},200505109529202511,泰国,2,200505,父母是孩子的第一任老师,70,65,56,53,50,280,未参加,
通过这样的过程父母才能{CC2才}当名副其实的老师。,200505109525202534,日本,2,200505,父母是孩子的第一任老师,60,55,50,37,52,235,未参加,
没有父母，就{CJX}周围人轻视他，轻视他所有[L]{CQ的}一切。,200505109523102613,韩国,1,200505,父母是孩子的第一任老师,80,75,41,47,63,297,未参加,
说到这里，[BC、]我想说一件有趣的事。,200505204520200391,蒙古国,2,200505,父母是孩子的第一任老师,90,75,65,59,52,335,C,
在这[F這]一段时间[F間]，大家会[F會]开[F開]始了[F暸]解对[F對]方，例如，日常生活、个[F個]人喜好、人生的观[F觀]点[F點]、个[F個]人理想、家庭背景和观[F觀]念。,200505951922250006,美国,2,200505,最理想的结交方式,60,65,70,69,79,326,C,
我衷心希望未婚的男女，不要太在乎用什么[F麼]方式去相识[F識]终[F終]生伴侣[F侶]，而多花[B化]些时间[F間]去研究夫妻相处[F處]之道，那么[F麼]，他们[F們]婚后[F後]能享有美满[F滿]幸福的婚姻生活的机[F機]会[F會]更高，对[F對]个[F個]人、[BC，]家庭成员[F員]和社会[F會]的益处{CC得益}更大！,200505951922250016,美国,2,200505,最理想的结交方式,65,80,73,60,86,352,C,
这[F這]样[F様]会比较[F較]有安全感。,200505522522250024,缅甸,2,200505,最理想的结交方式,90,75,70,51,68,348,C,
不久以前我看到了一篇关于父母打孩子的文章。,200505206635100137,俄罗斯,1,200505,父母是孩子的第一任老师,95,80,71,67,80,389,B,
父母给孩子许多重要的教导非常重要。,200505024519200395,马来西亚,2,200505,父母是孩子的第一任老师,85,95,67,71,93,407,B,
我是大学毕业后就在顶尖旅游公司上班{CJsd}，这是我第一份工作[L]。,200509534533150069,新加坡,1,200509,一封求职信,65,75,77,64,82,350,C,
你好！,200509534533150141,新加坡,1,200509,一封求职信,70,70,48,51,46,273,未参加,
过去，我常喜欢和同事进行定期的小组会议，互相分享当导游时的工作经验，从每个人的经历中学习，让自己和他人能够更好地胜任导游的工作。,200509534533250137,新加坡,2,200509,一封求职信,80,75,82,71,88,387,B,
我希望贵公司能接受我的求职[D信]，并聘请我，让我成为公司里的一员，为公司效劳。,200509534533250149,新加坡,2,200509,一封求职信,70,70,86,75,84,373,C,
我的联系地址是：53号明达路，新加坡邮区912299。,200509534533250172,新加坡,2,200509,一封求职信,60,70,88,58,91,352,C,
希望您能考虑录用本人。,200509534533250185,新加坡,2,200509,一封求职信,70,65,75,73,91,360,C,
我身高1.7米，相貌端正，表达能力也强。,200509534533250194,新加坡,2,200509,一封求职信,65,70,73,71,84,349,C,
比如说，高中学生对自己喜欢的歌星达到痴迷的程度。,200510111523200015,韩国,2,200510,我看流行歌曲,60,90,65,42,62,309,未参加,
因为流行歌曲不但反映当代社会的现象，而且它的比较{CQ有}情感的歌曲让人开心、[BC，]感动。,200510111523200022,韩国,2,200510,我看流行歌曲,65,70,65,54,69,309,C,
程度上有问题，追求明[B名]星的[C]程度太过分的话，会放弃学习，放弃该做的事。[BC，],200510111523100419,韩国,1,200510,我看流行歌曲,60,65,56,42,62,268,未参加,
还有我跟朋友聊天儿时，对自己喜欢的明星讲话的是不可缺少的重要因素{CJ？}。{CD据},200510111523100432,韩国,1,200510,我看流行歌曲,75,55,67,73,74,329,C,
如果某一个人问我“你喜欢周杰伦吗？,200510111523100802,韩国,1,200510,我看流行歌曲,75,65,67,59,72,325,C,
每当[BD，]我心情[C]不好的时候[C]，就喜欢{CJ-sy听}比较悲伤的流行歌曲。,200510111407200823,朝鲜族,2,200510,我看流行歌曲,65,90,70,61,84,361,C,
因为我们是他们的歌迷。,200510111523200826,韩国,2,200510,我看流行歌曲,75,80,72,52,82,352,C,
我们不要听跟别人一样的歌，要找自己喜欢的歌听。,200510111523200868,韩国,2,200510,我看流行歌曲,65,70,46,42,77,286,未参加,
然而，流行歌曲到底给我们的生活带来了什么呢？,200510111540201015,印度尼西亚,2,200510,我看流行歌曲,95,95,88,77,89,443,A,
爱听流行歌曲的许多同学在学习的时候一边听流行歌曲，一边学习。,200510111523101041,韩国,1,200510,我看流行歌曲,60,75,86,75,62,344,C,
像中国诗一样，流行歌曲也会一直发展的。,200510111523101052,韩国,1,200510,我看流行歌曲,75,75,58,50,67,315,C,
只3-4分种的音乐给我们心[C]灵[Pling]以{CC的}安慰[BQ。]除了这个以外，[BC。]流行歌曲的发展会影响到国家的经济。,200510111523201066,韩国,2,200510,我看流行歌曲,60,65,49,42,52,251,未参加,
无论歌词、歌的风[F風]格怎[C]样，就{CJX}自已喜欢[B观]的歌手唱的歌最喜欢的歌{CJs}。,200510111523201076,韩国,2,200510,我看流行歌曲,50,65,42,40,40,218,未参加,
在美国有一次流行过[BQ“]死之赞美[BQ”]的歌曲，其声音和歌词古怪，因此美国许多年青人听着这歌开枪自杀{CC自亡}。,200510111523101097,韩国,1,200510,我看流行歌曲,80,60,81,69,84,361,C,
这样很多歌手都有{CQ具有}自己个性的歌曲。,200510111523101101,韩国,1,200510,我看流行歌曲,55,65,51,28,47,228,未参加,
在学校里，或是单位里，你不懂点儿流行歌曲，人们都会斜眼瞪你，嘲笑你很土。,200510111523101120,韩国,1,200510,我看流行歌曲,95,85,67,75,84,404,B,
”妈妈听我的话就说：“你怎么[C]这么喜欢流行歌曲？[BC，],200510111523101240,韩国,1,200510,我看流行歌曲,45,50,30,30,37,169,未参加,
但是我觉得娱乐性也是人们生活当中必需的。,200510111523201251,韩国,2,200510,我看流行歌曲,70,75,63,54,69,320,C,
虽然人们的要求越来越高，[BC。]但在人们心中永远存在的歌就是流行歌曲，真[C]正的歌曲{WWJ},200510111523101576,韩国,1,200510,我看流行歌曲,65,65,56,56,59,285,C,
随着社会的迅速发展，生活节奏也越来越快。,200510111523201587,韩国,2,200510,我看流行歌曲,70,70,77,54,72,331,C,
他们追求新的、[BC，]时髦的。,200510111523201868,韩国,2,200510,我看流行歌曲,65,55,49,44,30,225,未参加,
大多数情况下，品质优秀的父母管教出的孩子也同样优秀。,200510919501150001,中国,1,200510,父母是孩子的第一任老师,95,95,89,82,100,460,A,
他们[F們]虽[F雖]然努力赚钱[F錢]{CJ-zy为孩子}提供最好的生活，却忽略[C]了孩子心灵[F靈]上的需要。,200510919919205305,加拿大,2,200510,父母是孩子的第一任老师,70,85,47,71,80,345,C,
每天见朋友[L]说关于流行歌曲的话，还唱流行歌曲。,200510302523100001,韩国,1,200510,我看流行歌曲,80,60,49,22,35,233,未参加,
但现代人喜欢吉他，讨厌二胡，痴迷于流行歌曲，厌恶传统音乐的态度是[BD：]“消灭”传统文化的一个“快速路”。,200510302523100058,韩国,1,200510,我看流行歌曲,75,70,86,75,94,389,B,
流行歌曲，它只是给我们调[B挑]整{CJ+dy我们的}心情变化，给我们带来快乐、[BC，]乐趣。,200510302523200060,韩国,2,200510,我看流行歌曲,75,60,44,42,32,239,未参加,
我是一个喜欢流行歌曲的人，我心情不愉快时常常听歌曲，但我每次听到流行歌曲时，感到一个弊端{CC东西}：[BC，]歌曲都是关于{CC2对}爱情的。[BC，],200510302523100076,韩国,1,200510,我看流行歌曲,70,75,65,54,57,310,C,
可以说，我的生活与流行歌曲是分不开的。,200510302523200150,韩国,2,200510,我看流行歌曲,85,55,81,73,99,380,C,
我认为我们可以从流行歌曲体会到社会的发展，也能知道现在的社会是什么样的趋向。,200510302523200150,韩国,2,200510,我看流行歌曲,85,55,81,73,99,380,C,
虽然爱情歌不是坏的，但其中也有太冲击的，太乱的{CJxw}！,200510302523200244,韩国,2,200510,我看流行歌曲,65,75,51,36,64,278,未参加,
因为[F為]流行歌曲是[D表]能表达当时社会民众心声的歌曲。,200510540540100020,印度尼西亚,1,200510,我看流行歌曲,65,95,67,69,91,378,C,
彼此了[F瞭]解对[F對]方的嗜好，甚至于[F於]有共同的目标[F標]，是男女之间[F間]相识[F識]最理想的{CJ-zxy方式}。,200505610610250012,法国,2,200505,最理想的结交方式,60,75,63,69,64,317,C,
不过怎么获得好结果的呢？,200505684542200003,越南,2,200505,最理想的结交方式,75,70,43,51,79,307,未参加,
简[F簡]单[F單]来说，一般的孩子是从五岁才开始上学读[F讀]幼儿班{CJsd}。,200509602801150005,澳大利亚,1,200509,父母是孩子的第一任老师,60,65,52,67,65,292,未参加,
父母不只是子女的第一任老师[F師]，更是他们[F們]永远[F遠]的老师[F師]，一路伴随着[F著]孩子长[F長]大。,200509602801250007,澳大利亚,2,200509,父母是孩子的第一任老师,80,60,66,74,82,349,C,
再见，××。,200104124525200058,日本,2,200104,一封写给父母的信,70,75,38,37,45,254,未参加,
可您别担心[BQ，]她的年纪[Pjì]还小着呢。,200104124523200075,韩国,2,200104,一封写给父母的信,75,70,63,58,47,302,C,
爸爸、妈妈：你们身体好吗？,200104124525200078,日本,2,200104,一封写给父母的信,70,75,44,61,45,284,未参加,
我{CJ-zy没}跟你们联系太久{CJX}了，所以想知道的{CJ-zxy事}很多。,200104124523200140,韩国,2,200104,一封写给父母的信,70,75,36,37,47,254,未参加,
我来到北京已经一{CC1}年多了。,200104124523200183,韩国,2,200104,一封写给父母的信,75,85,38,47,40,278,未参加,
在这儿我自己觉得变成熟{CQ了}。,200104124523200188,韩国,2,200104,一封写给父母的信,70,60,55,49,49,268,未参加,
从那天以后，生日宴会也没有了，在我的心目中连樱花也变成了悲哀的象征。,200104124525200245,日本,2,200104,一封写给父母的信,70,70,52,56,74,310,C,
不久{CQ的}将来，你们一定会看到在韩中外交上有所作为的你们的女儿{CC女孩}，并且因此而感到自豪。,200104124523200308,韩国,2,200104,一封写给父母的信,65,70,77,58,81,337,C,
我有空{CJ-zy会}常常给你们打电话{CQ的}，,200104124523200313,韩国,2,200104,一封写给父母的信,70,65,44,44,49,258,未参加,
在北京最近天气变得{CD令人感到}非常舒服，所以我一有空就骑着自行车转转，玩一玩。,200104124523200351,韩国,2,200104,一封写给父母的信,70,75,60,54,63,311,C,
在我体会的东西之中，这是最宝贵的一个。,200104124540200410,印度尼西亚,2,200104,一封写给父母的信,65,90,49,37,49,281,未参加,
爸爸、妈妈，请你们放心。,200104124523100416,韩国,1,200104,一封写给父母的信,80,90,52,51,51,319,未参加,
妈妈一个人在山梨，爸{WWJ},200104124525200450,日本,2,200104,一封写给父母的信,75,75,93,70,83,386,B,
从去年九月起在北京师范大学学习汉语，现在在英国伦敦大学东亚系学汉语和经济。,199200003525100004,日本,1,199200,一封求职信,,,0,0,0,0,未参加,
我在街上看了招聘{CC寻人}启事。,199200204525100039,日本,1,199200,一封求职信,,,0,0,0,0,未参加,
来信请寄：上海市政通路280号,199200204533100009,新加坡,1,199200,一封求职信,,,0,0,0,0,未参加,
帮人自杀是一种犯罪，无论是死者愿意，而痛苦{CJ？}。,199604123529100273,泰国,1,199604,如何看待“安乐死”,70,65,45,39,39,243,未参加,
有的人希望奋斗着离开世界，有的人希望快点儿摆脱痛苦，愿意安乐死。,199604124525200059,日本,2,199604,如何看待“安乐死”,70,65,71,74,67,332,C,
想到这里的时候，我总是怀疑，病人有着极大的痛苦而生存下去，这样的生命到底有什么意义？{CD对},199604124525200156,日本,2,199604,如何看待“安乐死”,70,70,66,76,83,351,C,
因为我们要讨论安乐死时，应该考虑不少方面的影响，比如说，伦[B倫]理、宗教、法律、医学[BD、]等等，所以谁都不能随便说应该不应该实行安乐死。,199604124525100180,日本,1,199604,如何看待“安乐死”,65,75,79,76,67,349,B,
如果问我个人同意不同意根据文章所提出的观点{CC2活}，[BC。]我能立刻同意农村丈夫帮助妻子自杀。,199604124529200129,泰国,2,199604,如何看待“安乐死”,60,60,40,37,42,221,未参加,
生命是至高无上的。,199604123523200327,韩国,2,199604,如何看待“安乐死”,60,70,58,61,44,277,未参加,
这是因为与其受到痛苦活下去，[BC、]还不如去世。,199604123525100297,日本,1,199604,如何看待“安乐死”,65,80,61,64,52,310,C,
因为他的妻子是个病人，得了一种不治之症，[BC.]所以她的心里软弱，要求丈夫[L]帮助她自杀。,199604123523200152,韩国,2,199604,如何看待“安乐死”,55,45,50,49,39,215,未参加,
正由于[F於]工商业[F業]的繁忙，在一个[F個]家庭中，爸爸和妈[F媽]妈[F媽]很可能都要工作，于[F於]是乎往往忽略了{CQ对}子女们[F們]的管教。,199610801501200002,中国,2,199610,如何解决“代沟”问题,90,80,70,67,67,369,B,
代[C]沟是指父母与子女之间在行为方式、[BC，]生活态度以及价值观念等方面存在的差异。,199610801533200013,新加坡,2,199610,如何解决“代沟”问题,90,70,75,48,43,319,C,
因为[F為]时代改变，人类[F類]亦是不得不改变。,199610550523190046,韩国,1,199610,如何解决“代沟”问题,55,50,41,32,39,196,未参加,
他们只想的是将来、[BC，]晚辈。,199610550523190065,韩国,1,199610,如何解决“代沟”问题,60,55,62,38,37,233,未参加,
在现[F現]代社会[F會]里{CC上}，多半的家庭有代沟的问[F問]题[F題]。,199610550523290074,韩国,2,199610,如何解决“代沟”问题,65,60,54,53,45,260,未参加,
父母们常觉得现在的{CQ孩子}怎么搞的？,199610550523290086,韩国,2,199610,如何解决“代沟”问题,70,65,44,50,45,260,未参加,
例如，老少皆益的游[F遊]戏[F戯]等等。,199610550523190091,韩国,1,199610,如何解决“代沟”问题,65,70,65,75,78,339,C,
综合上述，这其实是人类的一种劣根性。,199603533533200032,新加坡,2,199603,由“三个和尚没水喝”想到的……,85,90,77,72,99,419,B,
不会节俭，好好利用目前所[C]拥有的，就像短文内的和尚们一样，P}有水就挑，没有寻求方法{CJX}如何分配、利用这些水源{CQ的}，只是一味[B昧]地{CC的}你挑水，我也挑水，到头来，全部皆没水喝。,199604680519200505,马来西亚,2,199604,由“三个和尚没水喝”想到的……,90,75,69,76,82,386,B,
每天清早他都到山底那儿去挑水[BQ、]烧饭[BQ、]煮水[BQ、]洗衣服。,199604680519200509,马来西亚,2,199604,由“三个和尚没水喝”想到的……,85,75,80,81,100,413,B,
这样，中国农民的劳动生产率{CC性}提高了，粮食{CC食粮[F糧]}问题{CC事情}也变好了。,199605104525100002,日本,1,199605,由“三个和尚没水喝”想到的……,60,65,77,79,54,318,C,
我认为，只有两个人的话，人只要考虑另一个人就行。,199605104525100064,日本,1,199605,由“三个和尚没水喝”想到的……,60,65,60,76,82,326,C,
如果自己一个人，别人不在的话，不管遇[C]到什么样的困难[F難]，应该自己克服。,199605104525200065,日本,2,199605,由“三个和尚没水喝”想到的……,65,65,55,60,61,290,C,
要不然，现代社会会更乱。,199605104523200102,韩国,2,199605,由“三个和尚没水喝”想到的……,55,70,66,63,51,289,C,
如果有四个、六个、八个……和尚的话，他们肯定织组来抬水。,199605104523200105,韩国,2,199605,由“三个和尚没水喝”想到的……,65,80,71,76,94,374,B,
首先吩咐徒弟去别的和尚那里，让他告诉别的和尚，“山底下的水已经没了。,199605104525200137,日本,2,199605,由“三个和尚没水喝”想到的……,65,70,83,58,75,337,C,
情况变化{CC2变}更{CC得}大。,199605104523200159,韩国,2,199605,由“三个和尚没水喝”想到的……,65,65,55,54,65,288,C,
我想这样的现象不仅仅在庙里发生，在社会里{CJ-zy也}已经普[B谱]遍了。,199605104523100163,韩国,1,199605,由“三个和尚没水喝”想到的……,70,65,60,63,61,305,C,
如果这种主人意识缺[C]少的话，常常发生“三个和尚没水喝”的情况。,199605104523200186,韩国,2,199605,由“三个和尚没水喝”想到的……,60,60,74,45,49,270,未参加,
三个和尚都不主动地{CC的}抬水都希望{CC愿意}别人抬水。{CP三个和尚{CJ-zxy的故事},199605104523200187,韩国,2,199605,由“三个和尚没水喝”想到的……,65,55,88,56,72,318,C,
如果这样的话，每个人{CC3个人个人}都这样想，那谁来帮助他呢？,199605104523200273,韩国,2,199605,由“三个和尚没水喝”想到的……,60,65,49,54,58,269,未参加,
那个{CC的}时候我还小，简单的事情也不太懂，[BC。]只知道两种{CJ-zxy情况}[BQ：]好的是好的，[BC。]不好的是不好的，[BC。]不了解人们的心理[B里]。,199605104523200278,韩国,2,199605,由“三个和尚没水喝”想到的……,70,70,71,51,51,301,C,
我们只在集体里可以互相帮助[BQ、]互相理解。,199605104523200307,韩国,2,199605,由“三个和尚没水喝”想到的……,55,50,46,47,63,240,未参加,
这篇短文让我们想到只{CD会}顾自己{CD时}的结果是怎样{CJsd}。{CJ-zhuy人},199605104523200318,韩国,2,199605,由“三个和尚没水喝”想到的……,65,60,74,54,80,316,C,
但是一下子{CC一趟人}增加到{CC了}三个人，人有了{CC感到}因为除了自己以外还有两个人，所以不必要亲自来干活，肯定两个人之中的一个人给自己办理{CJ-by事情}，这样{CQ的}想法{CC心情}。,199605104525200368,日本,2,199605,由“三个和尚没水喝”想到的……,65,55,52,67,68,289,未参加,
中国人{CC1人民[C]}不知道排[C]队，[BC.]只考虑自己先[C]买到票{CC1票子}、东西。,199605104525100374,日本,1,199605,由“三个和尚没水喝”想到的……,70,70,49,76,68,321,C,
在中国，孩子们看了这篇故事以后会怎么想{CD去}解决的办法呢？,199605104525200381,日本,2,199605,由“三个和尚没水喝”想到的……,70,65,80,65,63,329,C,
他们都{CJX}还是不敢主动地去山下抬水。,199605104525100399,日本,1,199605,由“三个和尚没水喝”想到的……,55,70,71,70,63,313,C,
人不能离开社会[BD、]被扶养。,199605104525200393,日本,2,199605,由“三个和尚没水喝”想到的……,60,65,58,81,77,324,C,
身为子女的应当前几天[BQ，]或者[C]起码[B马]母亲节前夕[B歹]准备好送给父母的礼物和一朵表[C]示比山高比海深父母之恩的花才对。,199605550523290026,韩国,2,199605,由“三个和尚没水喝”想到的……,75,65,52,65,65,309,C,
“三个和尚没水喝”是中国的一句俗语{CC俗话}。,199605550523190046,韩国,1,199605,由“三个和尚没水喝”想到的……,65,65,60,70,61,305,C,
我念{CJ-buy完}这篇[B片]短文以后，马上反省我们现代人们的生活态度。,199605550523290048,韩国,2,199605,由“三个和尚没水喝”想到的……,60,65,49,54,56,267,未参加,
有一天他一声[F聲]也不说地离[F離]开[B山]那座高山。,199605550523290053,韩国,2,199605,由“三个和尚没水喝”想到的……,60,60,66,47,32,247,未参加,
爷爷对中医有兴趣，因此他的房间总有一种怪味，也有许多看不懂的古籍。,199704123523200048,韩国,2,199704,记对我影响最大的一个人,70,80,65,76,50,331,C,
我从老师的手里接过{CC了}一块糖，[BC。]觉得它仿佛宝石一般。,199704124525200299,日本,2,199704,记对我影响最大的一个人,75,80,45,43,55,289,未参加,
16个家庭各租一个房间，房门口摆一张桌子和几张凳子，[F；]既是饭桌，也是孩子们读书写字的地方。,200110540540150053,印度尼西亚,1,200110,我的童年,70,85,82,70,92,391,B,
这乡亲是开豆腐厂的，房子好大。,200110540540250052,印度尼西亚,2,200110,我的童年,75,90,63,77,85,384,B,
我是家中的老大，受尽父母的宠爱，爷爷也十分爱我。[BC，],200110540540250080,印度尼西亚,2,200110,我的童年,75,90,63,58,97,377,C,
顽皮的我还死撑至{CC到}放学。,200110540540250111,印度尼西亚,2,200110,我的童年,70,80,58,61,83,342,C,
再来，前一年获得最佳报刊广告设计奖之一的服装广告，也是我的作品。,199312533533100051,新加坡,1,199312,一封求职信,95,85,78,76,87,419,B,
英语和华语是本人一直都修读{CQ的}语言，因此更加流利。,199312533533100091,新加坡,1,199312,一封求职信,90,70,76,74,98,401,B,
三，导游[F遊]，三名[BQ，]男性，年龄在二十至三十五岁之间。[BC，],199312533540200107,印度尼西亚,2,199312,一封求职信,70,55,50,54,75,288,未参加,
我非常好学，经常在闲暇时学习各种语言及参加学习书法绘画等能陶冶性情的活动。,199312533533200148,新加坡,2,199312,一封求职信,85,90,81,80,87,420,A,
下面我来介绍一下我的经验和简历。,199312104523100009,韩国,1,199312,一封求职信,55,55,50,72,68,280,未参加,
说外语也可以。,199312124525200151,日本,2,199312,一封求职信,45,45,18,27,45,154,未参加,
曾[B增]几次带内外旅游[C]团的经历{CJy}。,199312124525200260,日本,2,199312,一封求职信,65,55,71,78,73,324,未参加,
在三年级[C]{CD学}时被派[C]到美国留学。,199312124635100429,俄罗斯,1,199312,一封求职信,60,70,60,76,62,313,C,
我听他们的话，也愿意开个公司。,199312123525100703,日本,1,199312,一封求职信,55,50,46,61,55,246,未参加,
我明年2月份{CQ从}北京语言学院毕业，我在大学{CD中}参加过几次导游活动。,199312123523200710,韩国,2,199312,一封求职信,60,55,53,45,55,249,未参加,
所以说，本人的性格比较外向一些，而且也能{CC1能够}说日语、英语等两种外文，{CQ我想}必会有助于贵方快乐家庭旅[C]游公司的业务发展及所有公司的职务分担。,199410550523101902,韩国,1,199410,一封求职信,80,65,62,54,82,332,C,
已经老了，不要干活{CQ了}，跟我一起住汉城吧。[BQ”],199412123523100004,韩国,1,199412,记我的父亲,45,90,39,38,35,234,未参加,
