错句,作文编码,国籍,性别,考试时间,作文题目,口试分数,作文分数,听力分数,阅读分数,综合分数,总分,证书
我们应该尊[B遵]重别人{CC别的}的生命，大家一起长寿，走在美好的人生道路{CQ上}。,200405205525200113,日本,2,200405,吸烟对个人健康和公众利益的影响,70,75,77,75,74,360,B,
吸烟对个人健康和公众利益的影响吸烟对个人健康只有坏处没有好处。,200405205525200215,日本,2,200405,吸烟对个人健康和公众利益的影响,65,75,60,54,61,302,C,
人口稠密的城市都有几项规定让一些人烦恼[B脑]。,200405205525200218,日本,2,200405,吸烟对个人健康和公众利益的影响,65,70,52,63,70,306,C,
而且常吸{CC用}烟者一戒{CC1禁止}烟就会陷入精神不平衡{CJ-zxy的状态}。,200405201525200300,日本,2,200405,吸烟对个人健康和公众利益的影响,60,70,60,58,51,284,C,
据我了解，在中国吸烟者占最高纪录{CC占录最高}，几乎每个商店都卖烟，而且有各种各样的品牌{CC商牌}，这说明了{CC着}什么？,200405302529200007,泰国,2,200405,吸烟对个人健康和公众利益的影响,60,60,49,35,61,247,未参加,
对公众也有大危险性[BQ。]事实上，被传染者，他们受到{CC得到}的伤[B上]害更大{CC宽}。[BC.],200405332540100009,印度尼西亚,1,200405,吸烟对个人健康和公众利益的影响,60,60,22,37,51,212,未参加,
根据一项调查表示在广东省一所中学，学生{CC年生}有百分之六十吸烟。,200405024542200304,越南,2,200405,吸烟对个人健康和公众利益的影响,80,70,63,37,65,305,未参加,
王菲[B霏]和{CC及}谢霆锋的姐{CC姊}弟恋就是其中一个例子，虽然他们还没到谈[F談]婚论嫁的地步{WWJ},200410534533150018,新加坡,1,200410,最理想的结交方式,80,80,66,83,89,390,B,
我觉得通过亲戚朋友介绍，慢慢了解，逐渐相爱至结婚的方式较为理想。,200410534533250031,新加坡,2,200410,最理想的结交方式,65,75,74,42,72,315,C,
他一定是个好男人！,200410534533250077,新加坡,2,200410,最理想的结交方式,95,90,63,74,82,403,B,
他们值[B直]得有这样高{CQ的}收入，因为不仅他们的心血全放在这个职业上，而且也是人才。,200404140542200191,越南,2,200404,运动员收入,70,70,52,32,57,269,未参加,
总而言之{CC综合言之}，吸烟是个极不礼貌、不健康及不为他人着想{CC设想}的坏习惯，其害处更是损人损已。,200405680519150026,马来西亚,1,200405,吸烟对个人健康和公众利益的影响,65,95,74,85,96,406,B,
它并非生活必须品，但许多有烟瘾的人，却将它视为比食物、[BC，]水份更为重要{CJ-zxy的东西}。,200405680519250039,马来西亚,2,200405,吸烟对个人健康和公众利益的影响,75,95,85,88,87,424,A,
我认为解决学生早恋的问题，不是将他们分隔开，而是加强我们对中华传统文化和思想的教育。[BC.],200504534533150011,新加坡,1,200504,我对男女分班的看法,85,85,70,82,77,394,B,
我个人则比较支持男女混合式教育，认[B试]为那会较全面，并与时并进！,200504534533250061,新加坡,2,200504,我对男女分班的看法,65,70,62,65,88,336,C,
但我本人{CC本身}认为这种男女分班的教学方式对于学生们有着一定的效用与好处。[BC.],200504534533250079,新加坡,2,200504,我对男女分班的看法,70,80,67,76,79,362,C,
世界上只有两种人——男人和女人，而不是好人和坏人。,200504534533250169,新加坡,2,200504,我对男女分班的看法,80,80,78,71,75,376,B,
所以知道幸福的家庭是什么样的，又知道幸福的生活是什么样的。,200505109525200893,日本,2,200505,父母是孩子的第一任老师,80,75,55,65,64,330,C,
从早到晚，大部分{CJX}孩子的时间就是在家。,200505109540201169,印度尼西亚,2,200505,父母是孩子的第一任老师,75,90,46,35,45,285,未参加,
比如孩子的某些不好的行为，家长批评他{CC它}的时候，也许发现孩子的这种行为是来自自己。,200505109525201371,日本,2,200505,父母是孩子的第一任老师,75,90,85,72,76,392,B,
但是没有人可以十全十美，[BC。]父母也一样。,200505109919201445,加拿大,2,200505,父母是孩子的第一任老师,65,80,78,76,90,377,B,
我想今后作为父亲的人也应该都学会{CJ-sy做}家务[BQ，]做一个全面的老师对待自己的孩子{CD好}。,200505109525201559,日本,2,200505,父母是孩子的第一任老师,75,60,69,61,80,331,C,
为了独立、至少在经济上要独立，[BC、]我一直努力着{CC了}。,200505109525201560,日本,2,200505,父母是孩子的第一任老师,55,50,50,45,61,240,未参加,
”意思是孩子一直看着父母做什么，就{CJX}自己做什么。,200505109525201729,日本,2,200505,父母是孩子的第一任老师,65,75,44,45,63,279,未参加,
所以[C]我同意父母是孩子的第一任老师的看法[C]。,200505109525101890,日本,1,200505,父母是孩子的第一任老师,55,75,39,51,54,259,未参加,
对孩子、还没完全形成人格的青年来说，所有的成人、比自己有丰富的经验[C]的人都[C]是老师。,200505109525202122,日本,2,200505,父母是孩子的第一任老师,70,60,35,43,50,243,未参加,
因此[B些]，父母在教育孩子生命、生活、社会以及世界的道德中是起了一个很重要的作用{CJsd}，而这个接触是从孩子生下来的第一天开始的[BQ。]第二，父母随[F隨]着上述的过程{CD也是}对孩子的成长起了重要的作用。,200505109922202601,美国,2,200505,父母是孩子的第一任老师,80,65,61,71,74,339,C,
由以上例子可见[F見]，父母的确[F確]是孩子第一任{CJX}的教师，其影响程度十分深远。,200505204634100546,英国,1,200505,父母是孩子的第一任老师,90,90,82,75,96,431,A,
儿童总会吸收周边人说话的口气以及内容。,200505261635200064,俄罗斯,2,200505,父母是孩子的第一任老师,65,60,67,67,78,320,C,
父母就是孩子的第一任老师，从小就使{CC给}孩子们对事物、[BC，]对知识有简单的了解。,200505212542100030,越南,1,200505,父母是孩子的第一任老师,80,55,54,31,58,264,未参加,
我现在非常感谢他所给我的教诲。,200505275636200091,乌克兰,2,200505,父母是孩子的第一任老师,85,75,56,59,74,341,C,
有了感情基础[F礎]就不怕爱恋只是一时的，也不会发生情变了。,200505522522210007,缅甸,2,200505,最理想的结交方式,65,70,77,73,86,357,C,
因为[F為]大家从[F從]小就玩{CJX}在一起，互相了解对方的时[F時]间也比较长[F長]，一个对[C]{CQ另}一个的感情也就因为[F為]时[F時]间而{CC1也就}更深厚了。,200505522522110020,缅甸,1,200505,最理想的结交方式,65,75,43,35,61,266,未参加,
有人说生活环境是决定{CC取决}孩子未[B为]来的兴趣爱好、思想观念、行为举止等{CJs}。[BC，],200505209542100084,越南,1,200505,父母是孩子的第一任老师,55,60,56,45,58,255,未参加,
我们最经常接触的人是父母，所以可以说父母就是我们的榜样。,200505209542100107,越南,1,200505,父母是孩子的第一任老师,65,70,39,63,39,262,未参加,
他们自己已经有了自己的看法，可是父母的观念还是会在他们心里的最深处的。,200505206616200124,德国,2,200505,父母是孩子的第一任老师,95,80,65,47,63,346,C,
我认为，父母不仅仅是孩子的最早的两位老师，也是最重要的老师。,200505206635100137,俄罗斯,1,200505,父母是孩子的第一任老师,95,80,71,67,80,389,B,
虽然我同意“父母是孩子的第一任老师”这个[L]观点，可是我想再[B在]补充一个观点在里头，就是学生老师{WWJ},200505226540100072,印度尼西亚,1,200505,父母是孩子的第一任老师,70,50,41,41,45,230,未参加,
比如，我父母亲从小就对我就：“你是一个中国人”，但是虽然在中国留学和工作{CQ了}一段时间，甚至娶了一个漂[B票]亮的中国女朋友，但是我还认为自己是一个真正的菲律宾人。[BC，],200505332512100046,菲律宾,1,200505,父母是孩子的第一任老师,65,75,39,45,52,263,未参加,
孩子在幼年时期的学习能力是非常的强{CJsd}，他们通常都以父母做为他们的模范。,200509801519250004,马来西亚,2,200509,父母是孩子的第一任老师,65,55,77,83,87,349,C,
所以，在1990年回到新加坡时，已考到服务业的文凭，并且也拥有一个日语的考试文凭。,200509534533250003,新加坡,2,200509,一封求职信,60,80,75,53,55,310,未参加,
希望早日能面试[C]以更进一步详谈×××敬上联系地址：××××电话：×××手机：×××电邮：××××日期：19日九月2005,200509534533150018,新加坡,1,200509,一封求职信,70,75,70,62,93,359,C,
希望李先生能慎重考虑[F慮]，让本人有机会为贵公司效力。,200509534519250027,马来西亚,2,200509,一封求职信,70,80,86,62,82,370,C,
以下是我的联络地址与电话号码，并附上近照一张仅[F僅]供参考。,200509534533250032,新加坡,2,200509,一封求职信,85,75,91,84,95,422,A,
我一直对历史、地理等学科[B课]有很浓厚的兴趣。,200509534533250072,新加坡,2,200509,一封求职信,80,80,68,64,86,370,C,
我希望在不久的将来，我能收到贵公司招聘我的好消息。,200509534533150108,新加坡,1,200509,一封求职信,80,70,82,62,77,361,C,
希望被贵公司聘请后，能借着这个机会到更多的国家，认识更多的人[BQ，]也能获[B或]得更多的知识。,200509534533250127,新加坡,2,200509,一封求职信,60,70,79,49,77,320,未参加,
希望能够尽快得到贵公司的答复。,200509534533250146,新加坡,2,200509,一封求职信,70,65,70,55,77,323,C,
入行的第二年，我被提名为最佳导游。,200509534533250147,新加坡,2,200509,一封求职信,80,70,86,80,88,394,B,
就职于新加坡旅游局的期间，本人为公司赚取了2000年的三亿元年收入，创下了历史新高。,200509534533150159,新加坡,1,200509,一封求职信,75,75,79,77,82,378,B,
另外，我也曾因在南洋艺术学院的成绩优异，而获得奖学金到法国的一所著名[B明]艺术学院深造。,200509534533250177,新加坡,2,200509,一封求职信,85,70,77,64,82,369,C,
这样一来唱、听流行歌曲的原因是各种各样的。,200510111523200064,韩国,2,200510,我看流行歌曲,65,65,46,36,47,243,未参加,
每个社会现象[B像]都{CC就}各有千秋。,200510111523200800,韩国,2,200510,我看流行歌曲,80,85,70,50,82,361,C,
但最近我学了几首中文流行歌。,200510111523100811,韩国,1,200510,我看流行歌曲,80,80,70,65,72,359,B,
我认[F認]为我们不但[B旦]要欣赏一首曲，我们也要欣赏曲里[F裏]的词。,200510111634200808,英国,2,200510,我看流行歌曲,65,75,77,52,79,335,C,
其实我还是更喜欢听周华健的歌。,200510111523100840,韩国,1,200510,我看流行歌曲,65,60,63,42,47,260,未参加,
但是时间越久{CC过}越不流行了。,200510111523100863,韩国,1,200510,我看流行歌曲,70,65,53,36,57,267,未参加,
我们年青[B情]人也应该对那样人的目的是什么自己了解{CJ？},200510111523101029,韩国,1,200510,我看流行歌曲,65,55,60,28,55,245,未参加,
只要你听的{CC得}是不论什么歌，给你一个快乐或舒服的音乐{CJ？}，这就是音乐的美丽和它所具有的优点。,200510111523201114,韩国,2,200510,我看流行歌曲,55,60,46,46,57,245,未参加,
我认为流行歌曲是利大于[C]弊的。,200510111523201630,韩国,2,200510,我看流行歌曲,60,80,49,52,72,300,未参加,
我到北京的第一项[F項]外出活动[F動]，就是和新认[F認]识[F識]的同学[F學]去唱歌。,200510111922201641,美国,2,200510,我看流行歌曲,90,60,79,77,79,375,C,
而且我们一般所说的“流行”的区别也是随[C]着一般大部分人的决定[BD，]{CD认为}。,200510111523101843,韩国,1,200510,我看流行歌曲,65,55,39,54,67,262,未参加,
可是它[C]不是不好的，有的歌非常好听，歌词也感人{CC感动}。,200510111523201855,韩国,2,200510,我看流行歌曲,60,50,25,26,32,173,未参加,
第[B弟]二是它的旋律好听。,200510111523101864,韩国,1,200510,我看流行歌曲,95,70,67,46,74,346,C,
父母从小对孩子的教育是非常重要的。,200510919501150011,中国,1,200510,父母是孩子的第一任老师,85,90,86,74,94,425,A,
所以一个人是否能成才，除了自身后天的努力程度{CQ以外}，{CQ与}在成长期[BD，]父母对他们如何{CQ进行}教育有很大的关系。,200510919501150011,中国,1,200510,父母是孩子的第一任老师,85,90,86,74,94,425,A,
当然，这种情况我们是理{CQ应}先排除的。,200510919501250008,中国,2,200510,父母是孩子的第一任老师,75,95,86,85,88,423,A,
所以我说：“我喜欢流行歌曲，但不痴迷于它！,200510512512250003,菲律宾,2,200510,我看流行歌曲,85,90,77,71,89,408,B,
那歌曲是什么？,200510520520250009,蒙古国,2,200510,我看流行歌曲,80,75,77,65,91,379,B,
我并不否认流行歌曲的优点。,200510302523200027,韩国,2,200510,我看流行歌曲,85,95,72,71,87,406,B,
其次，有时候我有烦恼的事[BQ，]心情不好的时候听音乐或者到练歌厅去唱歌，这是很好的一个发泄方法。,200510302523200044,韩国,2,200510,我看流行歌曲,80,70,60,40,69,309,未参加,
他们唱的歌曲都好听极了。,200510302523200225,韩国,2,200510,我看流行歌曲,60,65,35,42,64,249,未参加,
这个时代有很多种的流行歌。,200510302523100250,韩国,1,200510,我看流行歌曲,65,50,65,32,52,245,未参加,
更希望中国和世界各地的音乐文化结合{CC纽聚}在一起，普遍地{CC的}流行起来。,200510627627250006,瑞士,2,200510,我看流行歌曲,80,85,60,59,74,352,C,
听听流行歌曲使我们紧张的心情得{CQ到}了放松，{CD但}我们伤心或者心里不愉快，它会带给我们无比的安慰以及畅快感，当你生气的时候，它会使你的怒火消失。,200510540540200073,印度尼西亚,2,200510,我看流行歌曲,60,70,39,32,77,263,未参加,
我想相识方式并没有什么是绝对[BD、]理想的[L]。,200505684542200004,越南,2,200505,最理想的结交方式,70,85,66,82,77,372,C,
第一，我们可以参加一些学习性的组织，例如歌咏队、舞蹈班、写作班、烹饪班等等。,200505680519150025,马来西亚,1,200505,最理想的结交方式,70,90,75,77,86,391,B,
第二，我们也可以多出席一些社交场合。,200505680519150025,马来西亚,1,200505,最理想的结交方式,70,90,75,77,86,391,B,
她比我小三岁，但好像我姐姐一样。,200104124525200018,日本,2,200104,一封写给父母的信,70,75,38,47,58,277,未参加,
除了汉语以外，我现在也学习韩语和广东话。,200104124525200044,日本,2,200104,一封写给父母的信,75,70,36,49,63,282,未参加,
现在我也长大了。,200104124525200066,日本,2,200104,一封写给父母的信,65,75,27,51,47,252,未参加,
这是为了纪[B记]念“五一劳[C]动节”所以我们{CQ才}放假的。,200104124540200086,印度尼西亚,2,200104,一封写给父母的信,55,60,25,37,40,198,未参加,
有一天，爸给我打电话{CD来}说：[BC、][BQ“]别太担心，慢[B曼]慢[B曼]来吧。[BQ”],200104124523100195,韩国,1,200104,一封写给父母的信,60,65,36,35,47,226,未参加,
家里的人都好吗？,200104124523200293,韩国,2,200104,一封写给父母的信,65,65,58,32,56,260,未参加,
你们那里还没开花，可是没有以前那么冷吧？,200104124525200303,日本,2,200104,一封写给父母的信,75,65,77,70,79,353,B,
我给您打了个电话，[BC。]但因为您工作忙，[BC。]所以不能祝贺您。,200104124523100416,韩国,1,200104,一封写给父母的信,80,90,52,51,51,319,未参加,
再见。,200104124523200451,韩国,2,200104,一封写给父母的信,70,70,52,25,45,250,未参加,
我在学校专门学服装设计。{CD在},199200204525100041,日本,1,199200,一封求职信,,,0,0,0,0,未参加,
这次上海和平饭店开了一个服装展会。,199200204616200026,德国,2,199200,一封求职信,,,0,0,0,0,未参加,
我的情况{CQ很适合}{CD对}你们[B门]公司的要求{CD十分好}。,199200204530100002,土耳其,1,199200,一封求职信,,,0,0,0,0,未参加,
有的人认为“安乐死”是{CJ+dy一种}解脱病人的痛苦。,199604123525100079,日本,1,199604,如何看待“安乐死”,55,40,27,37,39,174,未参加,
不管是实行安乐死还是不可实行安乐死，我觉得联[B关]合国和国际卫生组织应该作出一个全球[B求]性的调查{CC调检}然后作出决定。,199604124625200022,葡萄牙,2,199604,如何看待“安乐死”,85,65,56,30,39,264,未参加,
但是我们想一想吧。,199604123523200317,韩国,2,199604,如何看待“安乐死”,65,60,35,61,47,251,未参加,
反对此{CQ事}的人{CD的}人认为法律和有关部门无法控[B空]制此{CQ种}恶劣的现象。,199604123630100222,西班牙,1,199604,如何看待“安乐死”,85,65,40,47,62,288,未参加,
所[C]以[C]我[C]认为丈夫帮助妻[C]子[C]自[C]杀的[C]这[C]种[C]方[C]式还[C]是[C]{CD能[C]}可取的。,199604123529200274,泰国,2,199604,如何看待“安乐死”,97,65,50,57,47,307,C,
总[C]之，我认为安乐死应该采取这种办法来解脱病人的“{WWJ},199604124523100216,韩国,1,199604,如何看待“安乐死”,65,60,74,61,65,308,C,
他[C]如此[C]做{CD的}也[C]实在无可奈何才做出来的{CJs}，我认为。,199604123525200085,日本,2,199604,如何看待“安乐死”,80,65,63,49,67,312,C,
虽然法律认为别的，在这时候不算犯[C]什么法律。,199604124512100091,菲律宾,1,199604,如何看待“安乐死”,60,65,40,44,34,226,未参加,
我觉得这也有道理，不过我同意“安乐死”的看法，[BC。]没办法的情况下才可以使用“安乐死”。,199604124525200073,日本,2,199604,如何看待“安乐死”,50,60,32,42,49,212,未参加,
“安乐死”应该有正确的手段，比如要通过一些大夫的同意[C]，病人的[C]志愿和病人的[C]一些旁边人，该通[C]过[C]很多人的意见，才能施行。,199604124529200133,泰国,2,199604,如何看待“安乐死”,65,55,63,59,77,301,C,
问[F問]题[F題]的存在使很多家庭出现[F現]不同的意见[F見]，虽[F雖]然问[F問]题[F題]并[F並]不是非常严[C]重，但是实[F實]在有必要{CC需要}研究出一个[F個]解决[F決]的方法。,199610802801100001,澳大利亚,1,199610,如何解决“代沟”问题,85,75,73,63,69,357,B,
例如，父母[C]的管教太{CD过}严，要求子女言听计[F計]从，正所谓[F謂]物极必反，彼此的关系[F係]越弄越糟，而子女在学校或在[C]社会时，往往又不可把父母所教诲的搬上用场，{CJba}以致心里产[F產]生矛盾[C]。,199610802801100011,澳大利亚,1,199610,如何解决“代沟”问题,85,75,46,50,65,313,未参加,
皆因在两[F兩]个不同的年代长[F長]大的人，无[F無]论[F論]思想上、[BC，]行为上都{CC也}会有[C]不同的见[F見]解。,199610802543200020,香港地区,2,199610,如何解决“代沟”问题,90,85,65,46,63,346,C,
实习[F習]结束[B速]的那天，我们还一起于玩的很痛[B通]快！,199610550523290034,韩国,2,199610,如何解决“代沟”问题,70,75,83,73,84,374,B,
我差不多每天往家打个电话[BD，]还有哭。[BC，],199610550523290037,韩国,2,199610,如何解决“代沟”问题,60,70,44,48,47,254,未参加,
这也给孩子产生一种不良心态{CJjy}，即无论品德{CD感}是怎样[C]，学习是最重要{CJsd}。,199610550523290072,韩国,2,199610,如何解决“代沟”问题,80,70,25,57,55,277,未参加,
但是日益变化的现代社会里的代沟越来越严重{CC厉[B历]害}，而且由于代沟出现了很多社会问题，更需[C]要好的解决办法。,199610550523290088,韩国,2,199610,如何解决“代沟”问题,65,65,54,55,65,288,C,
我们生活在社会上，如果守株待兔，坐享其成，他人便会对我们敬而远之{CC摈而远之}。,199603533533100019,新加坡,1,199603,由“三个和尚没水喝”想到的……,90,85,80,74,94,420,B,
谁料到，一个推给[F給]另一个，结[F結]果没把事做好，父亲[F親]一个个教训了一顿。{CJba},199603533533200033,新加坡,2,199603,由“三个和尚没水喝”想到的……,85,90,77,60,80,388,B,
故事中的和尚，都以为他们是胜者。,199603533533200044,新加坡,2,199603,由“三个和尚没水喝”想到的……,95,85,69,76,87,410,B,
为求生存及满足自己，在没有选择的情况下，这和尚只有自己下山挑水喝。,199603533533100059,新加坡,1,199603,由“三个和尚没水喝”想到的……,95,80,71,72,94,408,B,
他甚至有时会空手而回，并不是他无法找到食物，而可能是因为他未尽到全力，因为他总认为如果他偷懒一点，他还有同伴可帮助{CC协助}{CQ他}。,199603533533200072,新加坡,2,199603,由“三个和尚没水喝”想到的……,85,90,71,70,82,394,B,
人们以为既[B及]然有别人，事情每次都可以吩咐别人替你做，自己不必做出什么贡献出来。,199603533533100083,新加坡,1,199603,由“三个和尚没水喝”想到的……,90,80,44,42,72,323,未参加,
为什么来了第三个和尚，反而没有水喝了呢？,199603533533200101,新加坡,2,199603,由“三个和尚没水喝”想到的……,85,70,55,47,51,299,未参加,
有时，只有一个和尚下山挑水。,199604680519200508,马来西亚,2,199604,由“三个和尚没水喝”想到的……,95,65,46,63,65,326,C,
三个和尚因为自私，再加上水源不足，所以都得不到水喝。,199604680519100516,马来西亚,1,199604,由“三个和尚没水喝”想到的……,95,75,66,72,84,387,B,
大家都渴{CJ+buy起来}了，没有力气，而且话{CJX}也没说，[BC。]大家都互相看别人的脸上表情{CC4脸色}。,199605104523100016,韩国,1,199605,由“三个和尚没水喝”想到的……,75,60,63,60,56,300,C,
这样想怎么样？,199605104523200026,韩国,2,199605,由“三个和尚没水喝”想到的……,60,65,69,58,70,305,C,
人的能力什么的没有关系的，跟精神有关系。P},199605104525200065,日本,2,199605,由“三个和尚没水喝”想到的……,65,65,55,60,61,290,C,
现在的社会中，包括{CQ我}自己，这样的情况比较多，遇到了这样的情况，如果我是和尚的话，也是感觉到空虚。,199605104525200073,日本,2,199605,由“三个和尚没水喝”想到的……,60,60,49,38,35,224,未参加,
一个人为了自己会劳动{CD的}，不过为了别人不愿意{CC容易}劳动。,199605104525200080,日本,2,199605,由“三个和尚没水喝”想到的……,60,60,33,45,37,217,未参加,
{CP除了这个原因以外，我还是{CJX}住双人房时不想一个人打扫，而不想做打扫的规定。P},199605104525200080,日本,2,199605,由“三个和尚没水喝”想到的……,60,60,33,45,37,217,未参加,
没有水，人不能生活。,199605104525200155,日本,2,199605,由“三个和尚没水喝”想到的……,50,70,52,67,65,287,未参加,
如果自己一个人住的话，肯定{CJX}自己做得好。{CJ-zhuy活儿},199605104523200203,韩国,2,199605,由“三个和尚没水喝”想到的……,65,55,41,35,37,215,未参加,
大家高兴{CQ地}喝水，[BC。]之后{CC以后}十天没问题。[BC，],199605104525100222,日本,1,199605,由“三个和尚没水喝”想到的……,55,50,35,51,44,214,未参加,
由三个和尚没水喝想到的是每个和尚按顺序到山底下去挑水。,199605104523100287,韩国,1,199605,由“三个和尚没水喝”想到的……,65,75,55,76,82,340,C,
虽然和尚们都希望别人去山下抬水的事情是由他们的善心{CC2善良心}引起的，[BC、]但是结果是失败了。,199605104525200322,日本,2,199605,由“三个和尚没水喝”想到的……,65,55,33,49,42,226,未参加,
但是他们就是和尚，再说[B话]古时候的和尚{CJs}。,199605104525200322,日本,2,199605,由“三个和尚没水喝”想到的……,65,55,33,49,42,226,未参加,
第[C]二，第[C]三个和尚{CJ+zy都}看到第[C]一个和尚每天到山底下挑水喝时，他们可能想要跟[C]第[C]一个和尚{CQ一样}自己挑水。,199605104525100353,日本,1,199605,由“三个和尚没水喝”想到的……,70,65,38,76,80,315,未参加,
第二，和别人互相协作。,199605104525200364,日本,2,199605,由“三个和尚没水喝”想到的……,70,70,69,54,54,305,C,
从这篇{CC此}短文中，我们可看出人的普遍心态。,199605550523290022,韩国,2,199605,由“三个和尚没水喝”想到的……,70,60,77,76,56,324,C,
所以我们很放心{CC满[C]足}地玩。,199605550523190046,韩国,1,199605,由“三个和尚没水喝”想到的……,65,65,60,70,61,305,C,
有一个和尚提[B题]出了一个条[F條]件{CQ说}：[BC;]“我们来画一条[F條]蛇，画得最慢的{CC得}人去抬水。,199605550523290053,韩国,2,199605,由“三个和尚没水喝”想到的……,60,60,66,47,32,247,未参加,
依[C]我看，我们在跟别人做某件{CC种}事情的时候，我们都往往情不自禁地跟别人吵架，或者无可奈[B夸]何地帮助别人。,199605550523190063,韩国,1,199605,由“三个和尚没水喝”想到的……,70,60,77,54,54,300,C,
这是一般的情况[BQ。]总之，我们既然在社会上跟别人{CC人家[C]}一起生活[BQ，]用[C]不着跟别人吵架，打架什么的。,199605550523190063,韩国,1,199605,由“三个和尚没水喝”想到的……,70,60,77,54,54,300,C,
那么水大家都有得喝[C]了。,199605529529150149,泰国,1,199605,由“三个和尚没水喝”想到的……,55,40,60,31,51,213,未参加,
