错句,作文编码,国籍,性别,考试时间,作文题目,口试分数,作文分数,听力分数,阅读分数,综合分数,总分,证书
不管是{CC从}报纸，还是电视媒体上，我们每天都会看到人违规或是犯法，这是为什么呢？,200103533533250022,新加坡,2,200103,我对离婚问题的看法,85,75,87,72,96,407,B,
又逢入学日期与出生日期有缘，能早於一般学童半年至一年，即能入学就读。,200110540540150008,印度尼西亚,1,200110,我的童年,65,80,66,58,85,342,C,
现[F現]在我的愿[F願]望终于[F於]实现[F現]了。,200111512512150008,菲律宾,1,200111,我的一个假期,75,70,52,56,68,310,C,
您不要总是挂念{CC卦着}我，您要为自己着[B找]想啊。,200104124501200069,中国,2,200104,一封写给父母的信,90,75,55,49,72,335,未参加,
对了差一点忘了。,200104124520200378,蒙古国,2,200104,一封写给父母的信,70,85,58,49,54,308,C,
我只希望你们身体好。,200105550523250010,韩国,2,200105,一封写给父母的信,75,60,74,61,76,332,C,
我和××，已经长大了，自己的事可以自己照料。,200105550523250023,韩国,2,200105,一封写给父母的信,65,70,58,65,76,320,C,
我找个时间去你们那儿吧，到我们见面的那天，希望身体健康[B隶]！,200105550523250037,韩国,2,200105,一封写给父母的信,65,75,47,58,56,288,C,
我陪您去6.3大厦，东大门市场[BD，]等等。,200105550523250299,韩国,2,200105,一封写给父母的信,60,65,41,44,49,242,未参加,
虽然，第二天再去买花回来给你们，我们还是很对不起你们。,200105550523250339,韩国,2,200105,一封写给父母的信,65,70,63,32,56,272,未参加,
上面的比喻是在冰心的小说上有的。[BC.],200105550523250354,韩国,2,200105,一封写给父母的信,65,70,41,54,54,270,未参加,
虽然哈尔滨非常冷，但是我的心里很暖和。,200105201525200012,日本,2,200105,我的一个假期,70,80,50,65,52,307,C,
多亏他我接触了很多南方的习惯。,200105201525200083,日本,2,200105,我的一个假期,70,80,50,49,61,300,未参加,
这次我回家，与以往回家不一样，积极地料理家务事，帮妈妈买菜，去看看住院的爸爸。,200105201525200084,日本,2,200105,我的一个假期,70,85,85,82,85,399,B,
如果有了长期假期我这样做，[BC、]那样做。,200105215525100008,日本,1,200105,我的一个假期,70,70,77,75,74,354,C,
首先在庙里只有一位和尚时，如果他要喝水的话，没办法，就该亲自到山底下挑水喝。,200105109525200441,日本,2,200105,由“三个和尚没水喝”想到的……,65,75,54,77,57,315,C,
我觉得人的这样的心理[B里]是人类的本能。{CP可是，反而我们知道对于所有的方面下依靠别人的话，自己不能生长，不能进步。P},200105109525200441,日本,2,200105,由“三个和尚没水喝”想到的……,65,75,54,77,57,315,C,
但抬水的话一个人可以不干，每个人的心里有不公平的意识。,200105109525200507,日本,2,200105,由“三个和尚没水喝”想到的……,65,70,50,71,73,315,C,
许多人随便扔拉圾，所以路上很脏。,200105109525200601,日本,2,200105,由“三个和尚没水喝”想到的……,70,75,73,64,59,330,C,
不然的话，人们的生活真糟糕。,200105109525200604,日本,2,200105,由“三个和尚没水喝”想到的……,65,70,63,75,66,325,C,
在“妻子回家”短文当中有两种妇女。,200106570525250015,日本,2,200106,如何看待“妻子回家”,65,65,58,70,54,296,C,
我后[F從]来才慢慢的体会到，重温是件好事，[BQ]四书[F書][BQ]中说：“温故而知新。,200203522522150025,缅甸,1,200203,记对我影响最大的一个人,80,75,69,62,55,332,C,
第二，在第二次世界大战中，德国的希特拉他利用“安乐死”的名义[B议]，杀死了精神病患者、慢性{CJX}某些病的患者。,200205204525200060,日本,2,200205,如何看待“安乐死”,70,65,74,60,54,309,C,
如果我是那个病人的爱人或者家属{CC家族}的话，心里{CJ-zy一定}很苦很苦。,200205204525100073,日本,1,200205,如何看待“安乐死”,65,60,27,26,30,191,未参加,
人生的最后价段，也就是死的时候，每个人都想安静的死去吧？,200205204525100110,日本,1,200205,如何看待“安乐死”,70,80,66,63,44,313,C,
可是这样的事情{CJX}见到的机会还是不多。{CP现在有好几种不治之症{CC不治之病},200205204525100178,日本,1,200205,如何看待“安乐死”,65,70,21,60,46,248,未参加,
我个人的意见来说，“安乐死”也并不是坏事。,200205212525200030,日本,2,200205,如何看待“安乐死”,70,60,71,76,77,339,C,
最重要的是自己的决定。,200205212525100040,日本,1,200205,如何看待“安乐死”,70,65,49,70,58,298,C,
尽管这样，但法律为什么又给他痛苦呢？,200205224525100013,日本,1,200205,如何看待“安乐死”,65,80,49,70,77,329,C,
如果满足这些条件的话，我认为可取。,200205209525200095,日本,2,200205,如何看待“安乐死”,65,80,63,63,63,322,C,
当今，全球人民正在{CJX}关于“安乐死”算不算是一种杀人罪讨论。,200205201525200139,日本,2,200205,如何看待“安乐死”,90,85,24,54,70,320,未参加,
长辈们觉得晚辈们越来越不像话、[BC，]不听长辈们的劝说。,200210602801250019,澳大利亚,2,200210,如何解决“代沟”问题,80,85,84,89,93,425,A,
因为有的父母是晚婚{CC迟婚}，他们的年纪与孩子有较大的差距{CC差别}，[BC。]思想领域也有显著的距离。,200210540540250094,印度尼西亚,2,200210,如何解决“代沟”问题,60,95,42,58,82,327,未参加,
所以，[BC！]这不是一个{CJ-dy简单的}问题，{CQ但}我们可以一起想、[BC，]一起解决。[BC，],200205109540201084,印度尼西亚,2,200205,如何面对挫折,70,60,45,38,48,246,未参加,
二{CQ种}是不畏困难、不怕挫折，能够从失败中吸取教训，把挫折变成动力[BD、]而成为强者。,200205109520101176,蒙古国,1,200205,如何面对挫折,90,70,70,67,82,372,B,
儿子××敬上5月18日,200205680519150027,马来西亚,1,200205,一封写给父母的信,80,80,60,69,86,367,B,
没有我在身边照顾[F顧]，一定要好好照顾[F顧]身体。,200205680519250030,马来西亚,2,200205,一封写给父母的信,85,75,49,69,78,348,C,
近来天气炎热，家乡靠海，想必也热不可当，爸爸的皮疹会否因而变本加厉？,200205680519250031,马来西亚,2,200205,一封写给父母的信,75,80,65,75,88,374,B,
那就是巴金先生的名著《家》、《春》、《秋》中的最后一部《秋》。,200305533533250022,新加坡,2,200305,我最喜欢读的一本书,65,60,77,73,70,328,C,
大学毕业以前，我没看过《圣经》。,200305533533250033,新加坡,2,200305,我最喜欢读的一本书,75,80,90,75,85,396,B,
我是一个爱看书的人，尤其爱看侦探小说。,200305533533250036,新加坡,2,200305,我最喜欢读的一本书,80,65,85,80,90,388,B,
之前{CC2从前}几年到现在日本的经济一向不好，[BC。]因此高中退学者不好找工作，[BC。]若找到了也不是很好的{CC高级或中级的}，[BC。]算是打工的一种。,200304131525100244,日本,1,200304,我学汉语是为了……,65,70,38,57,43,259,未参加,
如果醒过来的时候，自己的身边没有人的话，就肯定感到害怕。,200305576525100007,日本,1,200305,静音环境对人体的危害,65,70,47,41,74,283,未参加,
我每天只用电脑聊天，没有机会接触别人，没有机会说话。,200305576525200016,日本,2,200305,静音环境对人体的危害,70,85,80,76,71,374,B,
这是从这样环境解脱{CC开放}的{CJX}唯一方法。,200305576525100046,日本,1,200305,静音环境对人体的危害,65,60,38,52,57,255,未参加,
他们也用他们的身体{CJX}能感到声音的[BD…]。,200305576525200048,日本,2,200305,静音环境对人体的危害,65,65,41,41,43,239,未参加,
根据某市政府出台的一项规定，在公共场所边走边抽烟的人将被罚款。,200405109542201535,越南,2,200405,吸烟对个人健康和公众利益的影响,70,65,55,39,46,261,未参加,
第三，吸烟也会破坏人类的精[B经]神健康。,200405109540201376,印度尼西亚,2,200405,吸烟对个人健康和公众利益的影响,55,70,46,44,63,262,未参加,
在电视上看不到香烟的广告可以避免促使{CC促进}更[B便]多人买烟。,200405219635200007,俄罗斯,2,200405,吸烟对个人健康和公众利益的影响,70,65,71,58,63,313,C,
香烟里的尼古丁使你上瘾[B隐]。,200405204540200103,印度尼西亚,2,200405,吸烟对个人健康和公众利益的影响,70,70,58,47,63,296,C,
我非常支持这个新措施。,200405212529100011,泰国,1,200405,吸烟对个人健康和公众利益的影响,75,65,36,39,61,263,未参加,
对青少年人来讲，吸烟是一种{CJ-sy赶}潮流的行为[BQ，]而且还是在父母不知道{CC意识}之下学会的。,200405205529200193,泰国,2,200405,吸烟对个人健康和公众利益的影响,70,80,58,42,58,298,C,
我特别看不惯[F慣]{CQ的}还是不少吸烟人不只吸烟，而且{CC但}还有着不少不文明的举[F舉]动，比如：[BC；]在公交车[F車]里，在电影院，[BC、]到[B导]公共场[F場]所里吸烟，有时[F時]还吸了吐出来{CJX}的烟[BQ，]{CJba}不考虑到身边身后的人，看了很不習慣。,200405224529100068,泰国,1,200405,吸烟对个人健康和公众利益的影响,70,65,82,61,79,343,C,
我们在路上、车上，[BC、]甚至在家也躲不开烟。,200405522522250024,缅甸,2,200405,吸烟对个人健康和公众利益的影响,90,85,77,60,75,384,B,
一个人要是看到了另一个人悠闲地吸着烟，{CJ-zy会}觉得{CQ那人}很自在，很洒脱。,200405522522250030,缅甸,2,200405,吸烟对个人健康和公众利益的影响,90,75,35,56,61,311,未参加,
这是对周围环境的人一定有不利的影响{CJsd}。,200405209540200017,印度尼西亚,2,200405,吸烟对个人健康和公众利益的影响,70,65,52,37,47,257,未参加,
为了鼓励更多的{CJ-zxy人}远离吸烟的坏习[B吸]惯，许多国的政府也出台了很多的条例来协助减少吸烟的群体，[BC。]如对烟草公司收取很高的入口税，广播媒介严禁香烟广告等等一系列的做法，都{CC也}取得了不错的成效。,200405209519100069,马来西亚,1,200405,吸烟对个人健康和公众利益的影响,95,95,85,84,88,446,A,
这样的话，那么吸烟者为何{CC如何}无缘无故地让别[B拿]人吸您的第二手[B首]烟？[BC。],200405209542200116,越南,2,200405,吸烟对个人健康和公众利益的影响,65,65,44,35,49,242,未参加,
最简单地说，老师就是让我们得到新的知识的、启发新的想法的人。,200505109525100019,日本,1,200505,父母是孩子的第一任老师,65,55,53,50,71,276,未参加,
在这样的情况下，我觉得父母有两{CC二}个责任。,200505109525100098,日本,1,200505,父母是孩子的第一任老师,70,80,53,67,64,324,C,
”那时候我不太懂他们的意思，但是在我的脑海里留下了很深的印象。,200505109525100447,日本,1,200505,父母是孩子的第一任老师,75,80,58,54,71,329,C,
所以我的父母一辈子{CJ-zy都}是我的老师。,200505109525200513,日本,2,200505,父母是孩子的第一任老师,60,60,50,56,51,259,未参加,
我很赞同这种想法。,200505109525100554,日本,1,200505,父母是孩子的第一任老师,85,70,82,67,82,377,B,
当点菜时，父亲说“你们自己跟[C]服务员点菜吧”[BQ，]当时，我和弟弟都还很小的{CJsd}，不{CC没}习惯和陌生人说话，连点菜也{CJ+zy就}脸红了。,200505217525200027,日本,2,200505,父母是孩子的第一任老师,60,60,56,65,67,290,未参加,
我从那件事学了一些道德[BQ。]第二，父母是一个礼貌[C]老师。,200505217525100044,日本,1,200505,父母是孩子的第一任老师,65,70,54,49,76,300,未参加,
我赞同这个看法。,200505217525200085,日本,2,200505,父母是孩子的第一任老师,70,85,56,71,69,343,C,
我深[C]深体会到{CJ-by这一点}。,200505217525100210,日本,1,200505,父母是孩子的第一任老师,65,65,58,51,78,301,C,
所以我想，父母的影响，{CQ在}人形成自己的人格过[F過]程中[BD，]最深。,200505217525200207,日本,2,200505,父母是孩子的第一任老师,65,45,39,57,67,252,未参加,
比如说，父母[C]在街上随[B隋]便[B边]扔垃[B拉]圾[Pjī]，孩子也跟他父母[C]一样。,200505217525200232,日本,2,200505,父母是孩子的第一任老师,70,55,67,55,83,314,C,
我从小就看爸爸。,200505204525100173,日本,1,200505,父母是孩子的第一任老师,65,75,50,67,52,296,C,
比如，我也{CJX}最近知道{CD是}我越长大[BD，]越象我父母{CJ+zxy的想法}。,200505204525100288,日本,1,200505,父母是孩子的第一任老师,65,65,41,51,45,251,未参加,
越练越好，这也是上小学以后第八回小学生钢琴比赛里获[C]得了冠军{CJ-zxy的原因}。,200505204525200264,日本,2,200505,父母是孩子的第一任老师,55,55,52,43,56,241,未参加,
首先是关于父母的。,200505204525100395,日本,1,200505,父母是孩子的第一任老师,90,55,44,63,74,315,未参加,
这个矛盾真是麻烦。,200505204525200499,日本,2,200505,父母是孩子的第一任老师,60,55,46,55,58,255,未参加,
如果当父亲，应该考虑这个问题。,200505204525100534,日本,1,200505,父母是孩子的第一任老师,65,65,52,45,69,280,未参加,
而且很快自己也会做到。,200505204525200577,日本,2,200505,父母是孩子的第一任老师,60,65,54,61,61,284,未参加,
我希望每一个假期都过得很开心，{CD会}成为珍贵的回忆{CC记忆}。,200105205525200027,日本,2,200105,我的一个假期,65,75,50,65,68,310,C,
总而言之，最好是靠自己解决面临的挫折或者困境，但是最后靠自己解决不了的话，向{CD在}周围可靠的人商量或者听听有经验的人的意见，参考{CJ-buy一下}。,200112576525100003,日本,1,200112,如何面对挫折,65,65,75,69,49,307,C,
现在，我已经回日本，但用汉语的电子邮件{CC邮信}继续联系着{CC的}。,200112576525100013,日本,1,200112,如何面对挫折,65,65,33,48,65,260,未参加,
有一天自己出去走{CQ了}走就迷了路，从前边走过来的人问我要去哪里。,200105271525200028,日本,2,200105,我的一个假期,75,75,72,70,83,365,B,
咬一口，就像沙漠里看到绿洲似的，让我心满意足。,200105271525100095,日本,1,200105,我的一个假期,75,90,70,87,94,410,B,
现在如愿以偿，就实现了。,200105217525200017,日本,2,200105,我的一个假期,70,85,70,65,85,367,C,
桂林呢，我们坐了游览船，看了很多美丽的风景。,200105217525100066,日本,1,200105,我的一个假期,65,75,65,68,90,350,C,
有时候，我一直在房间不出去{CJ+by外面}，在房间里做{CC作}什么呢？,200105204525100003,日本,1,200105,我的一个假期,65,65,22,44,44,224,未参加,
因为在我们{CC我国}日本没有过春节的习惯，所以我对中国的春节{CJ-zy很}有兴趣。,200105204525200085,日本,2,200105,我的一个假期,65,75,42,56,68,293,未参加,
头发花白让我伤心。,200105550523250079,韩国,2,200105,一封写给父母的信,75,80,63,65,72,346,C,
谢谢您！,200105550523250080,韩国,2,200105,一封写给父母的信,70,75,63,68,63,328,C,
不过那时我一直不好意思没表达我的意思、爱情。,200105550523250082,韩国,2,200105,一封写给父母的信,65,65,47,63,51,275,未参加,
我一定要成功，为了让你们永远在我身边关注我这个女儿。,200105550523250086,韩国,2,200105,一封写给父母的信,70,65,47,32,40,240,未参加,
我认为你们是在世界上最善良的人。,200105550523250091,韩国,2,200105,一封写给父母的信,70,65,52,58,49,280,C,
所以我在期中考试之前很担心我的学习。,200105550523150121,韩国,1,200105,一封写给父母的信,70,70,58,44,58,288,C,
我已经适应了新的居住条件。,200105550523150133,韩国,1,200105,一封写给父母的信,70,65,74,56,56,307,C,
所以没有机会{CD了}跟你们谈话。,200105550523250138,韩国,2,200105,一封写给父母的信,65,75,27,39,49,242,未参加,
但我相信有你们的关心我马上站起来。,200105550523250190,韩国,2,200105,一封写给父母的信,65,70,52,44,58,275,未参加,
我准备了这么小的一件事，但是您那么高兴，让我感到好大的父母的心了。,200105550523250202,韩国,2,200105,一封写给父母的信,65,65,58,39,51,262,未参加,
怎样？,200105550523250226,韩国,2,200105,一封写给父母的信,65,60,27,32,49,216,未参加,
平时，我几乎没有表达出来我对你们的感谢和爱{CC1爱情}。,200105550523250229,韩国,2,200105,一封写给父母的信,65,70,44,63,70,298,未参加,
从现在开始我要重新走{CC1出发}人生的路。,200105550523150256,韩国,1,200105,一封写给父母的信,80,65,71,56,79,339,C,
我才明白您们的真心。,200105550523150301,韩国,1,200105,一封写给父母的信,80,70,52,47,63,302,未参加,
你们放心吧！,200105550523250302,韩国,2,200105,一封写给父母的信,65,70,33,49,51,254,未参加,
亲爱的父亲、母亲：如何天比父母之恩高？,200105550523250309,韩国,2,200105,一封写给父母的信,60,65,52,56,67,283,未参加,
现在我在考场{CC2考试场}[BQ，]这次作文题目是“一封写给父母的信”，真{CJX}我不知道写什么好。,200105550523250310,韩国,2,200105,一封写给父母的信,70,60,44,28,36,223,未参加,
你们不要担心，你们的旁边不是有我吗？,200105550523250371,韩国,2,200105,一封写给父母的信,75,70,60,58,74,326,C,
昨天回家的时候，我看见了您下班的背影，[BC。]好像没有力气、[BC，]很疲倦的样子。,200105550523150374,韩国,1,200105,一封写给父母的信,70,70,47,58,61,294,C,
今天不是周末[B未]吗！,200105550523250380,韩国,2,200105,一封写给父母的信,70,70,55,61,58,302,C,
因为你们俩无论怎么辛苦也不嫌{CC闹}烦，好好儿教育教育{CJcd}我们三个。,200105550523250388,韩国,2,200105,一封写给父母的信,70,70,52,63,58,301,C,
爸爸、妈妈，我来这儿后学到了很多，我已不是天真的小女孩{CD子}了。,200105550523250472,韩国,2,200105,一封写给父母的信,95,85,74,70,88,410,B,
放暑[B署]假的时候我打算去中国各地{CJld}。,200105550523150490,韩国,1,200105,一封写给父母的信,75,80,52,54,49,301,C,
下面我给你们介绍一下。,200105206525200018,日本,2,200105,我的一个假期,65,70,42,44,57,264,未参加,
如果我也{CQ像}上面写的那样的话，会{CC也}很难受。,200105206525100035,日本,1,200105,我的一个假期,65,70,52,51,68,292,未参加,
我以前坐[B座]过飞机，可是这次坐[B座]飞机时我还有点儿害怕！,200105206525100043,日本,1,200105,我的一个假期,70,70,72,51,59,310,C,
我们{CQ的}{CJX}在社会中，也有这种现象。,200105109525200023,日本,2,200105,由“三个和尚没水喝”想到的……,65,70,75,73,86,355,C,
我认为解决这个问题的唯一办法是“人类之间的互相帮助”。,200105109525100243,日本,1,200105,由“三个和尚没水喝”想到的……,75,85,73,84,95,405,B,
我们社会上，一个人不能生活的{CJsd}。,200105109525200334,日本,2,200105,由“三个和尚没水喝”想到的……,65,70,68,55,82,326,C,
比如说，人口的过分增加必然会导致粮[F糧]食的短缺，环境的进一步恶化，自然资源的严重不足等一系列问题。,200105109525100353,日本,1,200105,由“三个和尚没水喝”想到的……,65,80,39,40,55,267,未参加,
说[BQ：]“小时候我不爱学习添麻烦{CJX}{CQ给}姐姐，现在能够帮你我特别高兴。[BD“],200105109525200370,日本,2,200105,由“三个和尚没水喝”想到的……,60,65,45,40,53,246,未参加,
每个和尚{CJ-zy都}没想到，这么简单的事，不容易想到的{CJsd}。,200105109525200581,日本,2,200105,由“三个和尚没水喝”想到的……,65,60,52,55,55,270,未参加,
然后，去买蛋糕。,200105109525100620,日本,1,200105,由“三个和尚没水喝”想到的……,65,65,52,60,61,287,C,
那怎么{CC2怎}解决人与人之间的分工问题呢？,200105109709100772,多哥,1,200105,由“三个和尚没水喝”想到的……,70,60,48,16,32,211,未参加,
在个别{CC每个}情况下，还是需要亲人的赞同{CJsd}。{CD而},200205217525200021,日本,2,200205,如何看待“安乐死”,70,80,58,74,77,349,C,
比如得了不治之症[B病]或者遇到了事故之后[BQ，]时间{CJX}很长了，没有希望恢[B回]复过来{CQ了}，而且治疗也给病人{CJ-sy带来了}非常{CJ-zxy大}的痛[B疼]苦，{CD还有}病人的家属也{CJX}看护[L]病人{CD看得}很累，再也坚持不下{CQ去}{CQ了}，在这样的情况下才可以进行安乐死。,200205217525200084,日本,2,200205,如何看待“安乐死”,70,80,83,60,51,334,C,
在世界上{CJ-zy也}引起{CQ了}{CQ关于}这种内容{CJ-zxy的争论}。,200205217525200091,日本,2,200205,如何看待“安乐死”,60,65,19,54,44,225,未参加,
我以前很喜欢笑，不笑的我不是我。,200205217525200096,日本,2,200205,如何看待“安乐死”,65,65,21,45,35,215,未参加,
我不反对安乐死，因为人们都有权利选择自己的人生。,200205217525100097,日本,1,200205,如何看待“安乐死”,65,70,33,72,61,287,未参加,
信里说“下次我病情恶化时，请您千万{CJ-zy别}救我，我希望得到永远的安乐。,200205205525200015,日本,2,200205,如何看待“安乐死”,75,80,58,67,70,341,B,
比如癌症后期患者的精神状态往往错乱，[BC。]有时他的{CJX}说话第三者不好了解真正的要求。,200205205525200024,日本,2,200205,如何看待“安乐死”,65,60,60,65,61,294,C,
大家都讨论它究竟可不可取，[BC。]{CJ+zhuy大家}{CJ+zy都}有各种各样的想法。,200205206525200023,日本,2,200205,如何看待“安乐死”,70,65,60,58,61,300,C,
{CJ-sy认为}[BQ：]人死了以后能去极乐世界，就是死就好。,200205206525200055,日本,2,200205,如何看待“安乐死”,80,70,44,67,61,312,未参加,
我每听到这种话，{CJ-zy就}{CJ-sy觉得}{CD不得不}需要制定{CC设定}关于安乐死的法律。,200205206525200075,日本,2,200205,如何看待“安乐死”,65,65,58,56,49,277,未参加,
第二，要在对方的立场上想。,200209550523250011,韩国,2,200209,如何解决“代沟”问题,65,65,48,47,60,269,未参加,
我想，最好的办法是双方的对话。{CP子女是年轻[B情]人，所以社会上的发展很快[BQ，]也{CJX},200209550523150017,韩国,1,200209,如何解决“代沟”问题,60,60,42,71,44,259,未参加,
父母当子女，子女当父母，在被换的位置[B值]{CQ上}看对方。[BC.],200209550523150053,韩国,1,200209,如何解决“代沟”问题,0,65,51,49,54,212,未参加,
因此我跟{CJ-dy我}爸一遇到就吵架，打破了家庭的和平。,200209550523250058,韩国,2,200209,如何解决“代沟”问题,65,65,42,62,60,278,未参加,
上面的情况来看，代沟问题的最大的原因是都没有一起聊天儿的机会。,200209550523150085,韩国,1,200209,如何解决“代沟”问题,60,75,45,57,62,285,未参加,
我想最重要的是[B事]互相理解。,200209550523250088,韩国,2,200209,如何解决“代沟”问题,65,65,60,52,62,288,C,
有了一些共同语言会容易亲近{CC亲密}。,200209550523250099,韩国,2,200209,如何解决“代沟”问题,65,65,45,49,48,256,未参加,
第三，两代人自己都不断努力过生活。,200209550523250107,韩国,2,200209,如何解决“代沟”问题,65,65,57,69,52,292,C,
比如家里爸爸跟子女出现矛盾，有了“[BC‘]代沟”[BC’]。,200209550523250186,韩国,2,200209,如何解决“代沟”问题,0,60,21,15,34,122,未参加,
老人以前努力地学习和工作过{CC了}，所以现在我们享受丰衣足食的生活。,200209550523250191,韩国,2,200209,如何解决“代沟”问题,65,65,51,71,62,298,C,
首先，每个年代所享受的文化不同。,200209550523250195,韩国,2,200209,如何解决“代沟”问题,60,65,69,57,64,298,C,
因为“代沟”问题不是个人或家庭[C]问题，{CJ+zhuy这}是严重的社会[C]问题。,200209550523250204,韩国,2,200209,如何解决“代沟”问题,70,75,66,81,72,353,C,
那时候，我以为父母说的话一点都没错，父母做的事都对。,200209550523250271,韩国,2,200209,如何解决“代沟”问题,70,70,45,67,44,284,未参加,
我听说过这种叹气话。,200209550523150287,韩国,1,200209,如何解决“代沟”问题,65,60,66,52,60,286,未参加,
两代受教育方式是不同{CJsd}。,200209550523250295,韩国,2,200209,如何解决“代沟”问题,65,70,48,64,56,289,C,
社会的快速变化，人们[F們]的思维、生活习[F習]惯[BD，]和所接受{CC受到}的资[F資]讯种类[F類]也很{CC甚}多。,200209550523150322,韩国,1,200209,如何解决“代沟”问题,65,60,54,64,50,276,未参加,
我的一个邻居是五岁的孩子。,200209550523150361,韩国,1,200209,如何解决“代沟”问题,65,60,54,42,42,246,未参加,
古代社会非常看重敬老、孝道思想。,200209550523150362,韩国,1,200209,如何解决“代沟”问题,70,70,60,67,58,313,C,
我敢说{CQ能}解决这个问题。,200209550523250768,韩国,2,200209,如何解决“代沟”问题,65,60,63,54,58,283,C,
为他们增加点文化生活，讲讲我们这一代的人，让他们[BD，]不要只顾家里的活，也找一找自己的趣味生活，还要经常招待朋友们到家里做客。,200209550523250832,韩国,2,200209,如何解决“代沟”问题,70,60,48,49,72,284,未参加,
