错句,作文编码,国籍,性别,考试时间,作文题目,口试分数,作文分数,听力分数,阅读分数,综合分数,总分,证书
我等待着您的消息。,199312533533200136,新加坡,2,199312,一封求职信,75,90,64,65,87,375,C,
本人为了改变{CC转换}一下工作环境，试试到异乡工作的滋味，并了解贵[C]国公司运作[C]的情[C]况，特此诚意[C]欲[C]加[C]入{CJ-by贵公司}为贵[C]公司服务。,199312533533200137,新加坡,2,199312,一封求职信,85,80,81,81,92,413,B,
如是女导游，应该是{CJ+dy一个}二十至三十岁{CJX}两{CC二}名的女人。,199312124748200150,突尼斯,2,199312,一封求职信,60,40,22,28,41,168,未参加,
要求{CC需要}她（他）相貌端正，表达力强，有[C]大学学历。,199312124748200150,突尼斯,2,199312,一封求职信,60,40,22,28,41,168,未参加,
首先要介绍自己，我叫××，我三十四岁[C]，我的职业是当翻译。[BC，],199312123914100409,古巴,1,199312,一封求职信,40,55,20,37,39,167,未参加,
等贵公司的来信。,199312123523200912,韩国,2,199312,一封求职信,65,65,78,70,55,318,C,
本人是个对旅游方面特有兴趣的{CJ-zxy人}，而且恰好贵公司正招聘有关人员[F員]，本人觉得这是个千载难逢{CC天遇一载[F載]}的{CC之}机会。,199410550523101904,韩国,1,199410,一封求职信,65,60,43,64,50,265,未参加,
并且，在放假期间，曾经参加过一些关于导游的工作。,199410550533101907,新加坡,1,199410,一封求职信,85,75,81,75,91,400,B,
现在他已经退休了。,199412123523200043,韩国,2,199412,记我的父亲,65,55,36,38,51,227,未参加,
每次我父亲回来时他都{CC就}说不想再干了。,199412123529100085,泰国,1,199412,记我的父亲,55,55,46,30,26,192,未参加,
我也有这样的感觉。,199412123525100097,日本,1,199412,记我的父亲,55,80,39,55,51,266,未参加,
如果他明知某件事情他没有能力做{CD得}到，他不会答应别人{CJ+sy做}，并且毫[B豪]不隐讳地说出原因，不爱找借口。,199412123635200109,俄罗斯,2,199412,记我的父亲,85,85,86,61,80,392,B,
我的父亲是一个沉[B沈]默寡言的人，他对什么事，从来不肯马虎，非常认真，所以他在公司里常常得罪人，我母亲平常{CD跟}他{CJX}劝告，“你应该随和[B合]一点儿。[BC.],199412124523100002,韩国,1,199412,记我的父亲,70,75,81,71,78,364,B,
不过我对他的回忆越来越深刻。,199412124525200051,日本,2,199412,记我的父亲,65,65,52,48,41,255,未参加,
我一个人来中国，可是认识×后[BQ，]我觉得她跟我家里人{CC家庭人}一样。,199412124914200063,古巴,2,199412,记对我影响最大的一个人,45,65,39,30,55,214,未参加,
你好好记住父亲以前跟你说过的话，到北京，肯定还会有很多困难，如果你遇到这种困境，你要勇敢地面对它，克服它。,199412104523100116,韩国,1,199412,记对我影响最大的一个人,65,90,62,50,59,317,C,
他照顾我们很周到，好像[B象]父亲一样。,199412104523100677,韩国,1,199412,记对我影响最大的一个人,65,65,62,71,59,306,C,
对我来说[BQ，]影响最大的人是我的爱人。,199412104523100675,韩国,1,199412,记对我影响最大的一个人,65,55,33,44,51,230,未参加,
现在的我不是像以前那样学{CC追}她{CQ了}。,199412104525200656,日本,2,199412,记对我影响最大的一个人,70,80,65,63,74,342,C,
毕[F畢]业[F業]之后[F後]，我就投身名职[F職]。[BC，],199412104625200370,葡萄牙,2,199412,记对我影响最大的一个人,75,85,94,77,82,406,B,
整天工作18至20个小时。,199412104523100109,韩国,1,199412,记对我影响最大的一个人,60,70,54,65,74,308,未参加,
在我三十二年的岁月里，父亲可说[C]是对我影响最大的一个人。,199500533533200003,新加坡,2,199500,记对我影响最大的一个人,95,80,78,55,69,373,B,
而一个人最大的成就，不是成大富翁或拥有世上的一切财富，[BC。]而是懂得用爱心去帮助有需要的人，与人分享欢乐或悲伤，使{CC有}自己有限的生命在世上发光发热，为国家为社会服务，才是有意义的人生。,199500533533200048,新加坡,2,199500,记对我影响最大的一个人,90,90,68,65,82,393,C,
在感情的道路上，我裹足不前。,199500533533200052,新加坡,2,199500,记对我影响最大的一个人,95,90,73,79,86,422,A,
只靠他的母亲[F親]含辛茹苦去维持他们一家四口的生活。,199500533533100062,新加坡,1,199500,记对我影响最大的一个人,65,75,44,57,72,300,未参加,
那[B哪]一年，我正念[Y唸]小三，是个留[Y畄]级生，虽是重修，但成绩依旧一团糟。,199500533533200085,新加坡,2,199500,记对我影响最大的一个人,65,90,83,67,90,386,B,
根据文章所提的丈夫，我认为他是{CJcd清清白白}的。,199510550523200927,韩国,2,199510,如何看待“安乐死”,75,60,64,56,53,294,C,
但是，我也{CJX}作为一个人认为，尽[B仅]管上帝赐[C]给我，但是{CD其}一生总是艰难痛苦的话，这一生有什么意思呢？,199510550523200936,韩国,2,199510,如何看待“安乐死”,80,80,59,66,68,345,B,
{CP然而，对一些生活在贫[F貧]苦之中，孤立无[F無]援的人，既不积[F積]极[F極]{CJ-sy面对}人生，又不努力奋[F奮]斗[F鬥]，更甚者自毁生命，实在可惜[C]。P},199511543634200521,英国,2,199511,如何看待“安乐死”,80,75,52,54,79,331,C,
虽然到现在，没有一个人敢说安乐死是可以合法化的；但是现实生活中又不能不正视这个问题。,199511543634100543,英国,1,199511,如何看待“安乐死”,80,90,57,60,84,366,C,
谁[F誰]能了解末期癌症病人的痛苦？,199511543634200562,英国,2,199511,如何看待“安乐死”,80,90,76,81,95,417,B,
必竭尽所能、鞠躬尽瘁[B粹]而后已。,199503680519100502,马来西亚,1,199503,一封求职信,90,95,62,56,79,380,C,
西原大学不是一个很有名[B明]的学校，可是我非常喜欢我的学校。[BC.],199505550523200903,韩国,2,199505,记对我影响最大的一个人,75,65,41,50,49,267,未参加,
全{CC具}家的事就是我的事[BQ。]你也是个女人，[BC.]嫁给别人之后你得好好儿的记着[BQ。]”从此以后我再也不敢说{CQ了}。,199505550523200911,韩国,2,199505,记对我影响最大的一个人,70,65,62,57,39,279,未参加,
当时我的成绩是{CJX}在学校里数一数二的，于是老师知道[C]我{CJ+zy在}交女朋友的消息以后，先叫我警醒{CC警告}并且骂{CQ了}我一顿，然后叫我{CD的}妈妈来到学校里，{CD向}她{CJX}告诉{CC告状}了[C]有关我的一切。,199505104523100008,韩国,1,199505,记对我影响最大的一个人,70,75,57,50,69,310,未参加,
我[C]还[C]记得，我[C]离开台北之前[BQ，]老[C]师[C]给{CQ了}我[C]一封信。,199505104523200012,韩国,2,199505,记对我影响最大的一个人,60,55,54,36,35,221,未参加,
跟那位同学再见面的时候，他跟我[C]说要去中国。,199505104523200035,韩国,2,199505,记对我影响最大的一个人,60,65,78,67,72,325,C,
因为我不知道除了母亲以外的{CJ-dy其他}女性的生活[C]。,199505104525200034,日本,2,199505,记对我影响最大的一个人,75,85,68,57,61,339,C,
好像身体{CQ的}某个部位{CC4一部分}不太舒服[C]。,199505104523200062,韩国,2,199505,记对我影响最大的一个人,70,65,65,55,55,296,C,
但{CC真}可惜的是，现在我不知道她的情[C]况。,199505104523200101,韩国,2,199505,记对我影响最大的一个人,70,55,70,46,55,280,未参加,
那位老师的爱说话病仍然{CC还是}健在。[BC，],199505104525200103,日本,2,199505,记对我影响最大的一个人,70,65,81,63,67,332,C,
我这样说当然别人{CJ-zy会}怀疑[C]我父[L]亲是什么非凡的人，可[C]是我父亲只不过是一位普普通通的韩国中年男人。,199505104523100105,韩国,1,199505,记对我影响最大的一个人,60,50,78,65,57,290,未参加,
在我们[C]的房间[C]里她很活泼{CC热闹}。,199505104525200113,日本,2,199505,记对我影响最大的一个人,65,65,23,30,41,208,未参加,
妈妈还小，[BC、]{CQ才}五岁{CD了}。,199505104525200115,日本,2,199505,记对我影响最大的一个人,50,70,44,61,49,257,未参加,
保尔的事我不准备重述书中的描写，谁要了解他，可读一读我上面提到的那本小说。[BC.],199505104540100138,印度尼西亚,1,199505,记对我影响最大的一个人,90,95,70,65,92,410,B,
我的家是大{CC1大口}家庭[C]，我母亲结婚的时候[C]，家人的生活水平很低[B底]，但母亲跟父亲{CC爸爸}总是努力工作，可以帮我们上大学了。,199505104523100147,韩国,1,199505,记对我影响最大的一个人,65,65,57,50,45,266,未参加,
起码也得决定上高中念书还是去工作，上高中的话，那上哪一个学校呢？,199505104525100160,日本,1,199505,记对我影响最大的一个人,70,75,81,71,74,360,B,
她刚来日本时一点[C]儿也不能[C]说{CJX}日语。,199505104525100232,日本,1,199505,记对我影响最大的一个人,60,55,39,32,35,202,未参加,
和母亲一齐到了{CC去到}校长室，我感到实在很委屈，[BC、]自尊心也觉得受打击，真的好想哭，[BC。]心想：“贫穷并不是罪，何必这样对待我！,199508683519100507,马来西亚,1,199508,记对我影响最大的一个人,90,90,70,77,86,411,B,
在她耐心及慈爱地{CC的}开导之下，我已学会了怎么样去看待别人对我的观点及如何消除自己{CQ的}自卑{CJ+by的方法}了，还有我已因为常参与一些户外活动，身体的状况也逐渐好起来了。,199508680519200522,马来西亚,2,199508,记对我影响最大的一个人,90,90,78,73,88,417,B,
只有在我遇到××----一个对我影响最大的人后，我才开始晓得探讨生命的真谛，我才懂得不少的{CD做}道理。,199508682519200547,马来西亚,2,199508,记对我影响最大的一个人,85,80,89,71,78,396,B,
我们不应该把噪声换成好听的大海的波涛声、小河的流水声、鸟的叫声就放心。,200005108525200306,日本,2,200005,关于用自然之声取代噪声的建议,65,65,80,83,69,346,C,
科学家调查过。,200005108525100316,日本,1,200005,关于用自然之声取代噪声的建议,65,65,53,72,63,302,C,
去年我在人民大学上课的时候，每天听到令人吓死的大铃声。,200005108523200337,韩国,2,200005,关于用自然之声取代噪声的建议,65,55,56,65,56,279,未参加,
对于用自然之声取代噪声的问题，我认为是个好主意。,200005108529200355,泰国,2,200005,关于用自然之声取代噪声的建议,70,65,75,47,67,310,C,
车笛声、电话铃声以外，叫卖声，从人堆里传来的骂声等等真令人厌烦。,200005108525100359,日本,1,200005,关于用自然之声取代噪声的建议,70,60,48,50,67,280,未参加,
例如，我们每天能听到的刺耳的汽车声换成大海的波涛声，天天在家或公[B工]司里不停地{CC得}响而恼人的电话铃声换成小河的流水声。,200005108523100624,韩国,1,200005,关于用自然之声取代噪声的建议,75,65,80,83,76,366,B,
在东京因为人口密度非常高，所以住宅情况也同样如此，在火车站旁[C]边也是一个住宅密集地，大概十几年以前，{CD从}附近居民{CC住民}提出[BD，]出发{CC发出}时的警告音的问题。,200005108525100654,日本,1,200005,关于用自然之声取代噪声的建议,70,70,67,67,52,314,C,
不过．从生活经验中，有一种人我永远都不交朋友的{CJsd．}这种人是天生{CQ的}骗子。,199711802801100007,澳大利亚,1,199711,我选择朋友的标准,75,60,44,60,54,279,未参加,
我自己比较喜欢静，所以我朋友之中，大部分都属于好静的。,199711802801200008,澳大利亚,2,199711,我选择朋友的标准,80,80,77,56,89,374,B,
每个人的生活和社交之中总会结识[F識]到不同类[F類]型，不同性格的人。,199711802801200021,澳大利亚,2,199711,我选择朋友的标准,75,80,58,72,65,341,B,
不过郊区生活没有城市那么方便.在城市我觉得好像没什么东西买不到的，可是在郊区，因为离城市很远，想买也没有东西。,199705104525100004,日本,1,199705,我的城市/乡村生活,75,65,52,65,68,312,C,
生活在城市里确实方便，物质方面几乎什么都有，可以享受“现代生活”。,199705104525100005,日本,1,199705,我的城市/乡村生活,60,80,71,67,80,345,C,
学生的生活也差不多。,199705104525100006,日本,1,199705,我的城市/乡村生活,70,70,60,63,58,309,C,
因为，事实上在东京的有的情况容易使人家很忙，工作量太过分，精神身体能感到受不了的感觉。,199705104525200001,日本,2,199705,我的城市/乡村生活,65,75,55,67,61,310,C,
水田都填好{CQ了}，盖了很多房子。,199705104525200002,日本,2,199705,我的城市/乡村生活,60,80,58,60,75,320,C,
我是韩国人.在韩国的南方出生的。,199705104525200110,日本,2,199705,我的城市/乡村生活,75,75,66,83,87,376,B,
城外有一条河流叫永河，是湄南河一支上游菱原地，每天在农历十一月，在这条河流有举[F舉]行威会叫水灯节[F節]{CJy}，万千上万的人民在这个节[F節]日，有各种比赛[BQ。],199705529529153003,泰国,1,199705,我的城市/乡村生活,70,50,36,30,32,201,未参加,
这里[F裡]人们的生活，多从事工商，一般都是小康之家，我…………，所操的……业，是振米厂，这里[F裡]人通常……，日常以权……农[F農]民的厂子，把它……成自来水，在市场经卖[F賣]给家户，坐惹现…………{CJ？}……村我也曾经住过，那里的山青水秀，田园阡[B千]陌，小河流水，没有空气的污染，住在那一片平静，觉得比城市舒服多了。,199705529529153004,泰国,1,199705,我的城市/乡村生活,65,70,28,14,51,214,未参加,
以下是我小时[F時]候遇到的一个[F個]挫折。,199810801543150022,香港地区,1,199810,如何面对挫折,80,80,56,82,66,356,C,
我来中国已经三年了。,199804123523200004,韩国,2,199804,学习汉语的苦与乐,70,75,63,40,50,287,未参加,
我刚到北京的时候，连“你好”这{CC一}句话也不知道。,199804123523100163,韩国,1,199804,学习汉语的苦与乐,60,60,33,57,50,242,未参加,
盼望的春天来了，在这么{CC多么}舒服的天气{CC气候}里{CC下}，一起努力学习吧！,199804123525200158,日本,2,199804,学习汉语的苦与乐,70,70,45,35,52,260,未参加,
”我没想到他对我说“你是南方人吧？,199804123523200225,韩国,2,199804,学习汉语的苦与乐,75,75,48,59,40,287,未参加,
到毕业还有一年，我一定认真学习汉语。,199804123523200225,韩国,2,199804,学习汉语的苦与乐,75,75,48,59,40,287,未参加,
将来回国后，我也要继续自己学汉语。,199804124529100483,泰国,1,199804,学习汉语的苦与乐,60,75,48,45,48,262,未参加,
如何看待妻子回家，在{CC对}现在来讲[F講]是一个问题，现[F現]在的社会，不象以前的封建{CC2封}社会{CD的}，过去妇女，只能在家照料孩子和家务。,199809542542100003,越南,1,199809,如何看待“妻子回家“,60,60,48,37,64,251,未参加,
我很想{CC肯}在语言学院毕业，但按照国家教育部的规定，年过{CC年纪}三十岁的人不能毕业，我听到这消息之后，很失望，我的老师帮我的忙[BQ，]他自己主动地找办公室的老师来，诚恳地给她说明我的情况，但最后结果是还是不许的{CJs}。,199904123523200002,韩国,2,199904,如何面对挫折,75,75,50,50,52,292,未参加,
我认为男子[B学]汉不要怕苦怕累。,199904123719100033,喀麦隆,1,199904,如何面对挫折,70,65,26,32,46,225,未参加,
面对这些困难和挫折，我们不应该唉声叹气、[BC，]怨天尤人，从而变得一蹶不振，[BC。]因为这样的做法是无济于事的。,199904123540200131,印度尼西亚,2,199904,如何面对挫折,70,60,70,60,56,301,C,
在心灰[B灭]意冷的岁月中我重新建立了新的目标。,199904123525200267,日本,2,199904,如何面对挫折,65,55,53,65,78,298,未参加,
我认为他们的说法没错，但我想：我是“炎黄子孙”呀，能不学中文吗？,199909529529151005,泰国,1,199909,如何面对挫折,75,80,27,40,72,285,未参加,
我相信困难，挫折是每个人{CQ都}不想碰到的。,199909529529251008,泰国,2,199909,如何面对挫折,70,55,60,54,44,267,未参加,
