错句,作文编码,国籍,性别,考试时间,作文题目,口试分数,作文分数,听力分数,阅读分数,综合分数,总分,证书
我在这边一年，我会好好照顾自己的。,200104124501200069,中国,2,200104,一封写给父母的信,90,75,55,49,72,335,未参加,
我觉得很有意思。,200104124610200377,法国,2,200104,一封写给父母的信,70,85,47,49,56,299,未参加,
但是那件事情已经是四年前的事了。,200105550523150007,韩国,1,200105,一封写给父母的信,75,80,74,56,72,348,B,
到现在有很多的困难，但是我们都克服了，所以我相信现在的困难也可以解决。,200105550523250335,韩国,2,200105,一封写给父母的信,70,70,49,44,54,275,未参加,
特别是最近，我最近对我从事的工作{CD单[F單]位}相当不满，希望移职。,200105550523250349,韩国,2,200105,一封写给父母的信,70,65,52,54,65,292,C,
。,200105550523250465,韩国,2,200105,一封写给父母的信,60,75,38,49,51,259,未参加,
我想度假{CC2度假期}是一个很好的事情。,200105212525100023,日本,1,200105,我的一个假期,70,70,75,54,59,316,C,
这次旅行最有印象[B像]的是厦门的著名的岛“鼓浪屿”。,200105212525200039,日本,2,200105,我的一个假期,65,70,55,54,55,285,C,
如今在中国六大古都当中是排名第一，可以说是中国历史的缩影。,200105209529100050,泰国,1,200105,我的一个假期,80,95,80,70,76,396,B,
如果自己的身份不同，假期过得也会不一样。,200105201525200044,日本,2,200105,我的一个假期,70,60,65,84,63,327,C,
它有点儿笨，所以一开始看我{CD也}她好像{CC2像}不认识我{CJ+zxy的感觉}。,200105215525100007,日本,1,200105,我的一个假期,65,60,75,56,68,307,C,
”不到五秒钟[B种]，[BC、]五休说还是我来去吧！,200105109525200704,日本,2,200105,由“三个和尚没水喝”想到的……,75,65,73,53,86,339,C,
第一个和尚，他发现在山底下有水的时候就每天来{CJX}自己挑水喝，也没有告诉别人。,200105109525200719,日本,2,200105,由“三个和尚没水喝”想到的……,65,65,66,53,84,317,C,
在这样的情况下，有两种能解决这个问题的办法。,200105109525200747,日本,2,200105,由“三个和尚没水喝”想到的……,70,60,48,44,64,271,未参加,
对婚外恋也没有以前那么严格。,200106570525250007,日本,2,200106,如何看待“妻子回家”,65,60,35,74,49,266,未参加,
还有，应该[B刻]保护自[B家]己的家庭，为了丈夫的工作。,200106570525250015,日本,2,200106,如何看待“妻子回家”,65,65,58,70,54,296,C,
如有这么一个合法框架，我们会避免法院的反对。,200205204610200022,法国,2,200205,如何看待“安乐死”,80,90,66,76,77,384,B,
那对这段短文{CQ中}的情况{CJ-wy怎么看}呢？,200205204525200102,日本,2,200205,如何看待“安乐死”,70,85,52,72,63,334,C,
第二，病人有意识时亲自表明{CC面}自己同意“安乐死”。,200205212525200022,日本,2,200205,如何看待“安乐死”,75,65,83,81,75,366,B,
去年我家的猫死了，十九岁。,200205209525100045,日本,1,200205,如何看待“安乐死”,65,65,52,72,44,282,C,
“安乐死”是否可以进行，我们要仔细研究。,200205209525200068,日本,2,200205,如何看待“安乐死”,75,75,35,70,61,306,未参加,
我在电视上看过关于安乐死的说法等等东西，在生物课上也学过有关这方面的知识，和同学也谈过安乐死的好和坏。,200205201525200008,日本,2,200205,如何看待“安乐死”,80,80,69,63,68,352,C,
得到了真正的关心和爱，我会为他们尽量努力活下去。,200205209525200089,日本,2,200205,如何看待“安乐死”,80,80,77,58,89,376,B,
我觉得这两个条件下可以取安乐死的方法。,200205201525200091,日本,2,200205,如何看待“安乐死”,75,80,44,72,70,332,未参加,
究竟可不可取？,200205201525200163,日本,2,200205,如何看待“安乐死”,80,80,77,70,82,381,B,
在日本也有过跟这篇文章中提到的事件类似的案件。,200205215525100007,日本,1,200205,如何看待“安乐死”,80,65,88,83,84,388,B,
尤其是每一代{CD每一代}生来有不同的环境[D在]不同的时[F時]代，当然会产生各方面的差异。,200210529529251031,泰国,2,200210,如何解决“代沟”问题,70,70,53,54,57,292,C,
每当有不愉快的交谈，我都抱着以和为贵的态度来加以安排。,200210540540150005,印度尼西亚,1,200210,如何解决“代沟”问题,80,70,67,76,64,347,C,
唯有这样[F樣]，在这价值观、道德、生活态度{CQ存在}差异[B导]的情况下，才能和平共处。,200210540540250084,印度尼西亚,2,200210,如何解决“代沟”问题,80,65,65,58,75,331,C,
而我们[F們]对[F對]下一代呢？,200210540540150098,印度尼西亚,1,200210,如何解决“代沟”问题,65,80,78,93,91,395,B,
那么，两代人之间存在的“代沟”问题如何解决呢？[BC。],200210540540150113,印度尼西亚,1,200210,如何解决“代沟”问题,65,70,78,65,75,339,C,
如果父母与子女之间有很好的交流，我认为{CJX}一定会有和睦{CC美好}的家庭。,200210540540250114,印度尼西亚,2,200210,如何解决“代沟”问题,75,60,40,38,55,254,未参加,
现[F現]在社会进步，生活比以前好多了。,200210540540250134,印度尼西亚,2,200210,如何解决“代沟”问题,60,65,59,56,73,296,C,
她是我们每一个人应学习的好榜[B傍]样。,200205109542200302,越南,2,200205,如何面对挫折,75,75,84,73,77,374,B,
但是，女儿的观念和母亲不一样，女儿认为即[B既]使结了婚，夫妻两人都可以有自己的事业，都可以赚钱养家。,200205680519250004,马来西亚,2,200205,一封写给父母的信,85,85,81,69,86,401,B,
不知在远方的您们是否安好？,200205680519250011,马来西亚,2,200205,一封写给父母的信,80,75,70,73,78,367,B,
很快地，我就想到以员工优惠价购买了一瓶即食燕窝送给你们{CC您们}滋补，愿您俩延年益寿，身体健康。,200205680519250028,马来西亚,2,200205,一封写给父母的信,80,65,68,77,72,350,C,
我在上高中的时候，对于自己的将来没有特别的想法{CC2目标}，也没有理想。,200304131525200072,日本,2,200304,我学汉语是为了……,60,65,71,60,43,282,C,
我想没有任何声响对心理有不好的影响。,200305576525200001,日本,2,200305,静音环境对人体的危害,70,65,74,65,85,345,C,
另外，我们通过跟别人的谈话[BD，]得到消息。,200305576525200011,日本,2,200305,静音环境对人体的危害,65,75,62,82,88,359,C,
也有人发表自己的想法，然后看看对方的反应来确认自己的想法是否正确。,200305576525200011,日本,2,200305,静音环境对人体的危害,65,75,62,82,88,359,C,
静音环境下我们失去这个机会那么我们的表达能力会差很多，这样继续下去，未来很多孩子会变得{CQ像}哑巴似的。,200305576525200024,日本,2,200305,静音环境对人体的危害,70,65,80,65,80,346,C,
而政府也出台了一些新规定。,200405109542100870,越南,1,200405,吸烟对个人健康和公众利益的影响,85,85,40,48,61,314,未参加,
中国现在也采取了同样的措施[BQ，]{CJ-zhuy这}真的让我很高兴。,200405109919200958,加拿大,2,200405,吸烟对个人健康和公众利益的影响,90,85,62,54,68,356,C,
现在，某市政府通过了新的规定，我觉得烟民们{CC者}应该遵守。,200405109529201183,泰国,2,200405,吸烟对个人健康和公众利益的影响,90,80,74,58,73,370,B,
烟民的肺比一般的不抽烟的人更黑，烟民的牙齿也显得不洁白，极易患肺癌，对女性烟民{CQ来说}患肺[B浮]癌的比例就更高，对其生殖{CC产殖}能力也有一定的影响。,200405109540201037,印度尼西亚,2,200405,吸烟对个人健康和公众利益的影响,70,65,57,48,68,294,未参加,
对于{CC关于}大人来说，在{CD个}酒会{CQ上}不抽[BD，]不尊敬长辈们，[BC。]{CJs}也只好迁就他们的需要{CC需求}了。,200405109540201755,印度尼西亚,2,200405,吸烟对个人健康和公众利益的影响,60,60,28,35,50,215,未参加,
因此{CC因为如此}，我本人也决定不{CD开始}吸烟。,200405204616100011,德国,1,200405,吸烟对个人健康和公众利益的影响,65,70,36,16,56,229,未参加,
比如[BD：]某贫困家庭的{CJ+zxy人}父亲、儿子都吸烟[BQ，]那那个家庭的费用不仅{CC不及}是烟费，{CQ还有}间接的医疗费等。,200405212522200051,缅甸,2,200405,吸烟对个人健康和公众利益的影响,80,70,74,44,79,337,C,
这[F這]一新措施，已经[F經]在人口密集的地方和商业中心{CD已}开始实施，也是{CQ因为}关[F關]心公众和吸烟人士的健康而实施。,200405522522150016,缅甸,1,200405,吸烟对个人健康和公众利益的影响,85,85,74,74,82,395,B,
二十世纪世界上很多国家对这个习惯有了些反感。,200405209635100102,俄罗斯,1,200405,吸烟对个人健康和公众利益的影响,65,70,38,37,56,252,未参加,
其实不是{CJ-by这样}。[BC：],200405610616150005,德国,1,200405,吸烟对个人健康和公众利益的影响,85,95,74,77,88,415,B,
这是{CJX}对我来说一种很宝贵的东西。,200505109525200508,日本,2,200505,父母是孩子的第一任老师,70,65,41,56,77,295,未参加,
我最近觉得我也是顾虑过头{CJX}他人的人。,200505109525200513,日本,2,200505,父母是孩子的第一任老师,60,60,50,56,51,259,未参加,
他的道德观念一贯影响了我的人生道德，那就是“有志者，事竟成”[BC！]！[BC”],200505109525201107,日本,2,200505,父母是孩子的第一任老师,90,85,66,64,88,390,C,
我还{CC再}认为父母要耐心地、坚持不懈地教育孩子。,200505109525201392,日本,2,200505,父母是孩子的第一任老师,60,80,50,66,55,298,未参加,
那么，父母给孩子教育时，他们该怎么教呢？,200505109525101476,日本,1,200505,父母是孩子的第一任老师,65,55,41,37,50,230,未参加,
！,200505109525102027,日本,1,200505,父母是孩子的第一任老师,0,70,39,37,36,177,未参加,
谁也不讲。{CP这样看来，父母当孩子们的老师，应该教很多事情，使学很多修养{CJjy},200505217525100047,日本,1,200505,父母是孩子的第一任老师,60,65,39,53,67,267,未参加,
从这个看法来说，父母应该是孩子的第一任老师。,200505217525100184,日本,1,200505,父母是孩子的第一任老师,70,80,52,65,78,335,C,
但是，我多亏了母亲，健康地{CC的}长大了。,200505217525100210,日本,1,200505,父母是孩子的第一任老师,65,65,58,51,78,301,C,
所以形成{CC构成}孩子的性格时，父母是最重要的。,200505204525100092,日本,1,200505,父母是孩子的第一任老师,60,60,39,53,47,241,未参加,
她看了我的作品，给它批评，颜色怎么样，如何画更好一些。,200505204525200082,日本,2,200505,父母是孩子的第一任老师,65,55,52,57,76,287,未参加,
那{CJ+zxy一点}就是，我父亲讲的“强”是身体上的，我想[C]的“强”就是精神上的[BQ“]强[BQ”]。,200505204525100123,日本,1,200505,父母是孩子的第一任老师,65,70,48,51,69,289,未参加,
最后我想说的是，孩子最重要的就是父母给他们的影响。,200505204525100354,日本,1,200505,父母是孩子的第一任老师,50,80,69,53,41,278,未参加,
说好人也有很多种，例如性格好，文化水平高或者运动能力高等。[BC.],200505204525100355,日本,1,200505,父母是孩子的第一任老师,65,65,44,63,58,279,未参加,
所以我跟他约好{CC了}我去孟加拉看他。,200105205525200086,日本,2,200105,我的一个假期,65,70,50,56,44,271,未参加,
我现在{CQ在}日本的大阪外国语大学上学。,200112576525100027,日本,1,200112,如何面对挫折,65,55,52,53,53,260,未参加,
难忘的事{CJs}。P},200105204525200021,日本,2,200105,我的一个假期,65,75,57,63,50,297,C,
我还喜欢去早市{CC2“早上的市场”}[BQ，]在那儿{CJ-zhuy什么}都有，比如小吃、[BC，]生活用品、[BC，]衣服、[BC，]老挝特产等[BQ，]买东西很方便。,200105204525200029,日本,2,200105,我的一个假期,65,75,55,39,37,258,未参加,
天天坐{CC座}在房间的阳台{CQ上}，看书，午睡，晚上自己做饭，听听音乐。,200105204525200058,日本,2,200105,我的一个假期,70,70,47,35,59,269,未参加,
今年五一劳动节之际，我参观{CC访问}了一个苗寨。,200105204525200086,日本,2,200105,我的一个假期,70,75,57,65,70,326,C,
每天每天{CJcd}一样的生活，[BC。]累得要命。,200105204525100090,日本,1,200105,我的一个假期,70,70,57,58,66,309,C,
照顾家人真{CJ-sy是}不容易的事情，你每天每天为了我们祈祷，真感谢你呀！,200105550523150088,韩国,1,200105,一封写给父母的信,70,70,49,44,49,270,未参加,
但是当面说有点不好意思。,200105550523150089,韩国,1,200105,一封写给父母的信,65,70,36,35,49,241,未参加,
上个学期在学校里有一个节目。,200105550523150109,韩国,1,200105,一封写给父母的信,65,65,60,44,61,279,未参加,
请别忘我们老在你们身边[F邊]。,200105550523250138,韩国,2,200105,一封写给父母的信,65,75,27,39,49,242,未参加,
我知道你们疼我，你们不怕吃苦养我和妹妹，你们用所有的方法让我们开心。,200105550523250153,韩国,2,200105,一封写给父母的信,70,70,52,49,56,285,未参加,
亲[F親]爱的爸爸、妈妈。,200105550523250162,韩国,2,200105,一封写给父母的信,70,75,49,61,72,316,C,
所以妈，再有机会一定和弟弟好好说一下，好吗？,200105550523250173,韩国,2,200105,一封写给父母的信,75,65,58,51,47,283,C,
我的脸上生了青春豆{CJ+zxy的时期}，我自觉不自觉地对你们反抗，不听话，什么都随便做，从而得了爸爸的罪{CLH}，到现在我和爸爸的关系一直不好。,200105550523250198,韩国,2,200105,一封写给父母的信,70,70,58,70,72,328,C,
听妈妈说爸爸的血压又上升了。,200105550523250222,韩国,2,200105,一封写给父母的信,65,75,44,39,47,257,未参加,
到那时[L]我们家庭会更幸福。,200105550523250258,韩国,2,200105,一封写给父母的信,70,70,55,42,74,299,未参加,
你不买你的为什么只给我和哥哥买呢？,200105550523250280,韩国,2,200105,一封写给父母的信,70,70,14,30,27,199,未参加,
我从小至今一直爱你。,200105550523150304,韩国,1,200105,一封写给父母的信,70,70,66,51,56,301,C,
我突然伤心得{CC的}不得了，爸爸[BQ，]我年龄大，可是还上学，真对不起你。,200105550523250307,韩国,2,200105,一封写给父母的信,65,75,25,47,36,235,未参加,
妈：妈！,200105550523250314,韩国,2,200105,一封写给父母的信,70,60,49,44,40,248,未参加,
我将在这几个月里尽我最大的努力学习。,200105550523150320,韩国,1,200105,一封写给父母的信,75,75,66,73,81,360,B,
可不用担心。,200105550523250361,韩国,2,200105,一封写给父母的信,65,80,58,56,58,305,C,
她最近身体{CD健康}怎么样？,200105550523250394,韩国,2,200105,一封写给父母的信,75,70,66,51,54,305,C,
还有，我永远都爱你们！,200105550523250399,韩国,2,200105,一封写给父母的信,70,80,74,70,79,363,B,
我就是你们两位最骄傲[C]的男子汉{CC男汉子}。,200105550523150406,韩国,1,200105,一封写给父母的信,80,65,41,47,54,275,未参加,
我非常爱你们。,200105550523250409,韩国,2,200105,一封写给父母的信,75,65,49,51,61,288,未参加,
为什么妈妈总是偏向弟弟？,200105550523250443,韩国,2,200105,一封写给父母的信,70,90,79,70,83,385,B,
所有的东西都是有了你们的支持才得到的。,200105550523250454,韩国,2,200105,一封写给父母的信,70,75,52,51,63,300,未参加,
但接近六年的韩国生活，使我变得坚强、[BC，]勇敢了。,200105550523250472,韩国,2,200105,一封写给父母的信,95,85,74,70,88,410,B,
感谢你们对我的关怀和爱{CC1爱情}。,200105550523250482,韩国,2,200105,一封写给父母的信,65,70,49,56,54,280,C,
高兴的时候，一起高兴；[BC。]有困难的问题的时候，一起克服困难的问题。,200105550523250486,韩国,2,200105,一封写给父母的信,65,60,41,35,58,242,未参加,
这一点就是现在我最担心的事。[BC，],200105550523150497,韩国,1,200105,一封写给父母的信,70,75,60,56,65,315,C,
他们对我的友谊我一辈子都忘不了。,200105206525200001,日本,2,200105,我的一个假期,70,85,87,63,76,373,C,
我非常感谢你们[L][BQ，]也{CC而}非常爱你们[L]！,200105550523150521,韩国,1,200105,一封写给父母的信,65,65,52,28,51,245,未参加,
现在已经过了两个月了。,200105206525100043,日本,1,200105,我的一个假期,70,70,72,51,59,310,C,
我妈妈很满意{CC满足}{CJX}{CQ对}上海。,200105206525200041,日本,2,200105,我的一个假期,65,70,50,42,52,265,未参加,
他们一下也不敢坐。,200105206525200045,日本,2,200105,我的一个假期,70,70,80,70,81,359,C,
古时候庙里有一个和尚，他天天自己挑水[BQ。]又来了一个人，两个人就可以抬水，但{CJ-zy后来}又来了一个人，三个人却谁也不去抬水[BQ，]就没有水喝了。,200105109525200005,日本,2,200105,由“三个和尚没水喝”想到的……,80,85,77,82,91,409,B,
只有一个和尚遇到困难的话，他可以依靠自己解决问题。,200105109525100058,日本,1,200105,由“三个和尚没水喝”想到的……,80,75,68,77,73,364,B,
她上高中、上大学都是靠奖学金读完的。,200105109525200135,日本,2,200105,由“三个和尚没水喝”想到的……,65,75,79,69,86,361,B,
这样大家平等{CC不等}，不会出矛盾。,200105109525100310,日本,1,200105,由“三个和尚没水喝”想到的……,65,60,39,51,59,257,未参加,
每个困难{CQ都}让自己的精神{CQ得到}锻练。,200105109525200305,日本,2,200105,由“三个和尚没水喝”想到的……,65,65,45,51,61,271,未参加,
也许，这个小故事教训我们，如果我们想做人的话，首先要考虑别人在想什么。,200105109525200334,日本,2,200105,由“三个和尚没水喝”想到的……,65,70,68,55,82,326,C,
我来中国以后我发现了这就是人和人的距离。,200105109525100354,日本,1,200105,由“三个和尚没水喝”想到的……,70,65,61,64,79,325,C,
应该为别人活[B话]才是的。,200105109525100358,日本,1,200105,由“三个和尚没水喝”想到的……,65,65,36,49,41,240,未参加,
平时小小的自私[B思]不会造成{CC成}很大的问题，但如果你想一想全球性的问题，比如说战争，环境污染等等，就知道，这些问题的最根本{CC２基}的原因就是自私[B思]。,200105109525200422,日本,2,200105,由“三个和尚没水喝”想到的……,65,55,88,73,84,347,C,
我们原来一个人包一个房间住，各自过自己的日子。,200105109525200537,日本,2,200105,由“三个和尚没水喝”想到的……,65,65,63,62,68,307,C,
反对他的建议{CC意见}。,200105109525200702,日本,2,200105,由“三个和尚没水喝”想到的……,65,65,39,58,66,277,未参加,
那些传说各个都有意义，我们从传说{CC它}里可以得到启发。,200105109525100770,日本,1,200105,由“三个和尚没水喝”想到的……,65,65,66,77,68,325,C,
我觉得这并不是“杀人”，[BC。]是尊重他的人格{CC人权}的结果。,200205217525200086,日本,2,200205,如何看待“安乐死”,65,75,58,65,61,311,C,
我认为这{CQ个}国家真象{CC是}个大人、成人{CD似的}，[BC。]因为对任何事情{CJ-zy都}能冷静地思考，相信{WWJ},200205217525200093,日本,2,200205,如何看待“安乐死”,65,60,41,31,44,224,未参加,
除了这些精神上的问题以外，肉体上也出现问题。,200205205525100085,日本,1,200205,如何看待“安乐死”,80,70,49,58,77,324,C,
不。,200205205525100142,日本,1,200205,如何看待“安乐死”,75,75,66,67,56,329,C,
还要{CJ-sy规定}实行时的严格的条件。,200205206525100018,日本,1,200205,如何看待“安乐死”,75,70,44,70,61,309,未参加,
这样病人怎么能安稳{CC安慰}地过日子呢？,200205206525200043,日本,2,200205,如何看待“安乐死”,60,60,71,60,58,291,未参加,
总的来说，“代沟”问题不是不可避免的，而是能解决的。,200209550523250009,韩国,2,200209,如何解决“代沟”问题,75,70,57,64,68,323,C,
如果[C]最少一个星期一次{CJX}跟自己的家里人一起谈话[B活]的话[B活]，{CJ+dy哪个}问题{CJ-zy就会}越来越少{CC1减少}。[BC.],200209550523250070,韩国,2,200209,如何解决“代沟”问题,65,65,48,45,42,249,未参加,
我们在生活当中也经常遇到{CC发生}{CQ因}看法[B发]的差异{CC差距}引起的纠纷。,200209550523150076,韩国,1,200209,如何解决“代沟”问题,65,60,60,54,64,286,C,
因此人的寿命变长了，全球的人口也增加了。,200209550523150087,韩国,1,200209,如何解决“代沟”问题,65,60,60,69,68,305,C,
说“跟他们的沟通很难”以前，我们应该在父母的，儿女的位置{CQ上}想一想。,200209550523250089,韩国,2,200209,如何解决“代沟”问题,60,70,75,71,64,325,C,
最近，两代人（父母与子女）之间在行为方式，生活态度以及价值观念等方面存在很大的差异。,200209550523150114,韩国,1,200209,如何解决“代沟”问题,65,65,72,71,70,327,C,
不可能。,200209550523250120,韩国,2,200209,如何解决“代沟”问题,0,65,69,79,62,268,未参加,
我觉得爱对方的心，才是必不可少的。,200209550523250125,韩国,2,200209,如何解决“代沟”问题,65,65,54,74,46,288,C,
为了解决{CC决解}这样的问题，现在的父母要转变旧时代的观念。,200209550523250127,韩国,2,200209,如何解决“代沟”问题,65,65,24,47,58,243,未参加,
首先互相要[C]理解，[BC。]接[C]受对方{CC互相}的意见[F見]。,200209550523250133,韩国,2,200209,如何解决“代沟”问题,65,60,48,71,60,287,未参加,
所以，两代人一起拥有娱[C]乐活动{WWJ},200209550523250136,韩国,2,200209,如何解决“代沟”问题,65,60,66,57,64,295,C,
解决代沟的最好的办法，我觉得是父母和子女之间的对话。,200209550523250141,韩国,2,200209,如何解决“代沟”问题,65,65,48,52,46,260,未参加,
比如说，最近我有了男朋友。,200209550523250190,韩国,2,200209,如何解决“代沟”问题,65,65,57,64,50,285,C,
”我也常常有跟父母顶嘴{CC撞嘴}的事。,200209550523250194,韩国,2,200209,如何解决“代沟”问题,65,65,66,49,50,279,未参加,
我认为{CD对}这个{CC件}问题的彻底{CC确[C]实}解决的方法，任何人都没有。,200209550523150197,韩国,1,200209,如何解决“代沟”问题,70,60,45,42,34,236,未参加,
父母不理解子女，子女不理解他们的父母。,200209550523150200,韩国,1,200209,如何解决“代沟”问题,65,65,60,57,60,291,C,
”我想我们自己是否错过{CJ-buy了}缓解代沟的机会。,200209550523250218,韩国,2,200209,如何解决“代沟”问题,70,70,75,64,68,335,C,
跟父母对话[B活]中可以理解父母的思想。,200209550523150257,韩国,1,200209,如何解决“代沟”问题,65,70,54,67,64,306,C,
任何父母都{CD希望自己的孩子}“望子成[C]龙，望女成凤{CC女子成凤}”。,200209550523150279,韩国,1,200209,如何解决“代沟”问题,65,60,45,59,60,272,未参加,
我觉得这样[BD.]父母和子女之间有困难的问题的原因可能是两人之间不足{CJX}说话。{CD有},200209550523250778,韩国,2,200209,如何解决“代沟”问题,65,70,30,37,44,232,未参加,
因为[F為]父母与[C]子女之间[F間]在行为[F為]方式、[BC，]生活态[F態]度上，会[F會]有一点[F點]点[F點]的差异{CC差导[F導]}。,200209550523150858,韩国,1,200209,如何解决“代沟”问题,65,65,45,57,44,260,未参加,
所以他们之间的代沟{CC沟通}应该产生{CC发生}。,200209550523150879,韩国,1,200209,如何解决“代沟”问题,70,60,51,67,50,283,未参加,
首先，最重要的是双方之间的谈话或对话[BQ，]只有{CD存在}不满，没有谈话的话，不会了解对方的想法。,200209550523250926,韩国,2,200209,如何解决“代沟”问题,70,65,66,64,54,305,C,
很简单[F單]。,200209550523150937,韩国,1,200209,如何解决“代沟”问题,65,65,57,64,42,277,未参加,
有史以来，代沟问题一直存在，而且越来越重。,200209550523250941,韩国,2,200209,如何解决“代沟”问题,65,70,48,49,40,258,未参加,
原因是父母和孩子之间没有共同语言。,200209550523250981,韩国,2,200209,如何解决“代沟”问题,70,75,63,54,50,301,C,
如果要谈我本人如何面对挫折，首先要说的是，在{CC从}不同的人生阶[B介]段，人会用{CC有}不同的态度来{CC而}对待问题。,200205109610200077,法国,2,200205,如何面对挫折,75,70,70,56,66,326,C,
虽然说那些是自己的亲人，但是照顾久了，特别是倒屎倒尿这些脏活，别人就算嘴上不说{CC话}，但是心里也一定会不愿意的吧！,200210600919225001,加拿大,2,200210,如何看待“安乐死”,90,90,84,82,82,426,A,
比如有一位得了不治之[L]症的人，无论采取{CC措施}什么办法也{CJ+zy在痛苦中}不能解脱{CC4解不脱}{CJ+buy下去}，{CD况且}没有能活下去的希望。,200205271525100042,日本,1,200205,如何看待“安乐死”,75,60,44,58,54,277,未参加,
