错句,作文编码,国籍,性别,考试时间,作文题目,口试分数,作文分数,听力分数,阅读分数,综合分数,总分,证书
我想可能是自己胆小。,200304522522210007,缅甸,2,200304,静音环境对人体的危害,70,75,67,57,74,332,C,
人类[B娄]只为了自己的方便而用了不少的树，而且随便用了不少的化学农药。[BC.],200307109523200016,韩国,2,200307,绿色食品与饥饿,60,65,75,59,73,315,C,
为了保护消费者的利益和健康，应该{CJX}国家规定化肥和农药[B约]的使用量。,200307109525200030,日本,2,200307,绿色食品与饥饿,70,65,62,67,64,314,C,
在世界上很多国家不能吃饭，[BC.]因为那个国家没有经济能力。[BC.],200307109523200063,韩国,2,200307,绿色食品与饥饿,60,60,46,38,47,233,未参加,
因为农药是{CD个}毒品，所以我觉得尽量不使用农药最好的{CJsd}。,200307109525100068,日本,1,200307,绿色食品与饥饿,60,55,40,14,44,194,未参加,
例如，吃这[C]样的食品的人类{CJ-zy会}生产出畸[Pqí]形的孩子，甚至有的家庭的男女不能生{CJ+buy下}孩子。,200307109523100117,韩国,1,200307,绿色食品与饥饿,75,75,75,56,76,347,B,
因为没有了生命，什么都不是重要的。,200307109523200137,韩国,2,200307,绿色食品与饥饿,65,80,78,49,84,344,C,
为什么这[C]种饥饿的[C]问题呢{CJy}？,200307109523100212,韩国,1,200307,绿色食品与饥饿,65,65,51,56,56,277,未参加,
如果不吃的话无法生活下去。,200307109525200230,日本,2,200307,绿色食品与饥饿,65,80,59,43,32,267,未参加,
我个人认为吃[C][BQ“]绿色食品[BQ”]是第一位{CJsd}。,200307109523100353,韩国,1,200307,绿色食品与饥饿,60,65,46,54,35,243,未参加,
要不然，用化学品增加粮食也没有用[B有]。,200307109523100379,韩国,1,200307,绿色食品与饥饿,75,75,70,30,70,310,未参加,
我们想一想，如果在农业生产过程中不使用化肥和农药{CJ-zy会}发生什么事？,200307109523200385,韩国,2,200307,绿色食品与饥饿,65,80,64,49,73,319,C,
我认为吃“绿色食品”{CQ好}，[BC.]因为对身体好还有环境{CJX}保护。[BC.],200307109523200403,韩国,2,200307,绿色食品与饥饿,55,50,40,43,50,217,未参加,
所以我想不论哪个问题都很重要。,200307109523200404,韩国,2,200307,绿色食品与饥饿,60,55,46,49,38,229,未参加,
那么，我们怎么办才能解决这些问题呢？,200307109523200417,韩国,2,200307,绿色食品与饥饿,65,70,64,46,76,307,C,
因为绿色食品是不用化肥和农药{CJsd}，所以很安全，也{CJ-zy能}保护生态环境和地球。,200307109523200433,韩国,2,200307,绿色食品与饥饿,60,65,59,46,56,269,未参加,
我估计，一些又贫困，农业技术水平又[C]低的国家的看法恐怕是“应该先要吃得饱”。,200307109525200461,日本,2,200307,绿色食品与饥饿,80,95,80,75,93,418,B,
我看首先解决挨饿问题{CJs}。,200307109525100482,日本,1,200307,绿色食品与饥饿,65,75,70,54,81,332,C,
用化肥和农药的农产品也必不可少{CC非少不可}的{CJsd}。,200307109525100508,日本,1,200307,绿色食品与饥饿,50,60,40,62,50,242,未参加,
其实[BD、]这种食品不仅对健康好，[BC、]而且对环境也好。,200307109525200509,日本,2,200307,绿色食品与饥饿,65,50,59,67,81,303,未参加,
目前有很大的事实——“非典”证明着这种观点。,200307109523200522,韩国,2,200307,绿色食品与饥饿,85,90,75,72,93,411,B,
如果我们生产的农作物不够的话，他们就永远吃不饱。,200307109523200535,韩国,2,200307,绿色食品与饥饿,70,65,67,70,87,345,C,
以前，经济还没发达[C]时，我们不知道什么是绿色食品，因为人类[B娄]只是关注怎样{CD夫}不饥饿[BQ，]怎样吃得饱。,200307109523200540,韩国,2,200307,绿色食品与饥饿,65,65,67,46,56,283,C,
最重要的是大家{CJ-zy要}考虑到自己的生活。,200307109525200601,日本,2,200307,绿色食品与饥饿,65,60,64,46,61,279,未参加,
吃了加化肥和农药的食品的确对我们不好，但我们能够吃饱就已[B以]经很幸[B辛]福{CD的}了，至少不会饿死。,200307109523200604,韩国,2,200307,绿色食品与饥饿,75,75,75,59,56,330,C,
目前人们渐渐有了意识，{CJ-sy认识到}绿色食品的必要，从电视里或广播里经常听到绿色食品，到商场也能{CC会}{CD来}亲眼看到绿色食品{CD了}。,200307109525200607,日本,2,200307,绿色食品与饥饿,65,65,75,62,81,332,C,
谁想喝污染{CQ的}水呢？,200307109525200609,日本,2,200307,绿色食品与饥饿,75,65,75,62,73,337,C,
吃未经污染的“绿色食品”{CD来}可以保持自身健康是件好事，但我们首[B道]先要考虑到如果不用化肥和农药的话，农作物的产量又会大大降低。,200307217523200024,韩国,2,200307,绿色食品与饥饿,70,70,78,64,76,346,C,
但是有些人觉得这样不够。,200307217523200026,韩国,2,200307,绿色食品与饥饿,65,60,46,46,53,253,未参加,
甚至也有人死亡。,200307217523200029,韩国,2,200307,绿色食品与饥饿,70,65,70,67,70,328,C,
一般来说经济比较发达的国家的国民爱吃“绿色食品”[BQ，]虽[C]然那些东西比较贵[BQ，]但对身体有好处[C]。[BC.],200307217525200047,日本,2,200307,绿色食品与饥饿,60,70,40,43,32,230,未参加,
我们应该研究代替农药生产方式的方法。,200307217523100076,韩国,1,200307,绿色食品与饥饿,65,65,75,59,64,312,C,
因为饥饿是跟生命有关的。,200307217523200099,韩国,2,200307,绿色食品与饥饿,60,75,62,51,79,313,未参加,
这[C]样的话行吗？,200307217523100116,韩国,1,200307,绿色食品与饥饿,65,75,78,59,87,351,C,
这样的食品会有害于人的健康，这是众所周知的事实。,200307204523200032,韩国,2,200307,绿色食品与饥饿,60,65,70,41,79,298,未参加,
他们{CC2他}[C]饥饿的原因{CC理由}是自然环境的障碍和多年来的自然干旱{CC2旱}和洪水等做出来的。,200307204523100073,韩国,1,200307,绿色食品与饥饿,65,65,80,72,87,353,C,
当然[C]上述[C]的所有种法{CC方}都不需要一种[F種]农药，[BC。]而且日本和中国比起来，[BC、]人口差不[B分]多中国是{CC比}日本的十倍，[BC、]但面积是十倍以上。,200307204525100107,日本,1,200307,绿色食品与饥饿,60,65,75,43,56,282,未参加,
从长远[C]的角度来说，我们也应该设法减[C]轻[B清]农药和化肥对农作物的污染。[BC.],200307205533200031,新加坡,2,200307,绿色食品与饥饿,85,80,86,70,90,404,B,
因为[C]用大量的[C]化肥和农药而大量生产农作物会危害{CC2害}人们的生命。,200307205523200037,韩国,2,200307,绿色食品与饥饿,65,70,72,59,56,308,C,
我认为还是吃“绿色食品”好一点，{CD觉得}在人们的生活中{CC里}[BD，]不挨饿是不可能的，[BC。]特别是由于[L]土地的原因。[BC，],200307205523200077,韩国,2,200307,绿色食品与饥饿,70,60,62,49,47,273,未参加,
世界上很多国家都有困难{CJX}不够{CJX}{CQ的}粮食。,200307205523200078,韩国,2,200307,绿色食品与饥饿,70,70,64,46,44,282,C,
”这样的想法。,200307205525200139,日本,2,200307,绿色食品与饥饿,75,65,72,67,76,342,B,
因为最重要的是[B事][BD，]人们的身体健康。,200307205523100166,韩国,1,200307,绿色食品与饥饿,65,60,51,56,56,271,未参加,
可是他们呢[Pne]！,200307205523100170,韩国,1,200307,绿色食品与饥饿,65,60,51,38,41,238,未参加,
但是当他们在研究这种新的食品{CJ-zxy的时候}，谁来帮助挨饿的老百姓呢？,200307209610200019,法国,2,200307,绿色食品与饥饿,70,65,72,51,58,302,C,
我们普通{CC通常}人，就是说一般过日子当中没有大的温饱问题的幸福的人会{CJX}往往追求“吃绿色食品[BD。]”[BQ。]我觉得这个态度并不是错误的。,200307209525200037,日本,2,200307,绿色食品与饥饿,65,85,59,70,90,359,C,
儿童[B竟]是全世界的未来成员。,200307201523100005,韩国,1,200307,绿色食品与饥饿,60,60,38,25,32,197,未参加,
所以，我想是这样，按自己的要求，办自己最适合的事。,200307201523100034,韩国,1,200307,绿色食品与饥饿,60,60,67,54,76,299,未参加,
其实，老年人和已经成人也没关系。,200307302523200014,韩国,2,200307,绿色食品与饥饿,65,70,51,51,64,287,未参加,
我们只依靠方便给农作物用化肥和农药，将会{CJX}人再吃上这[C]些农作物。,200307302523200018,韩国,2,200307,绿色食品与饥饿,70,70,67,56,73,324,C,
化肥和农药不仅是对人或农作物有害处[B出]的，[BC.]而我们的土地上有也害处[B出][BQ，]土地也是有生命的。,200307302523200052,韩国,2,200307,绿色食品与饥饿,70,65,51,46,44,262,未参加,
最重要的关键是有食品的。,200307302525100075,日本,1,200307,绿色食品与饥饿,65,65,56,51,70,291,未参加,
比如，{CJ+zy会}给自己的钱，不管多少钱，只要有自己的心意，那{CJ+zy就}对他们来说，有很多帮助的。,200307302523200108,韩国,2,200307,绿色食品与饥饿,65,65,72,49,67,302,C,
“绿色食品”是没有被化肥和农药污染的食品。,200307302523200123,韩国,2,200307,绿色食品与饥饿,70,60,59,49,73,296,未参加,
如果我们就得吃绿色食品，那就像没有食物吃的那样都会饿死的。,200307302523200137,韩国,2,200307,绿色食品与饥饿,65,60,48,35,41,232,未参加,
现在挨饿的最大的原因不是生产量的[C]不足，而是粮食的不均[C]等分配。,200307302523100142,韩国,1,200307,绿色食品与饥饿,60,60,59,54,70,285,未参加,
其他的都被弃。,200307206525200043,日本,2,200307,绿色食品与饥饿,85,65,75,54,44,312,C,
还[C]有一个问题，是环境问题。,200307206523200046,韩国,2,200307,绿色食品与饥饿,80,75,70,70,79,365,B,
人{CD流}都是很宝贵{CC贵重}的生命。,200307206523200053,韩国,2,200307,绿色食品与饥饿,65,55,51,33,24,210,未参加,
随着科学的发展[BQ，]人类渐渐可解决生产量的问题，也{CD是}能解决食品污染的问题，但是同时[F時]解决这两个问题是{CJX}目前为止[B此]不可能的。,200307215523150008,韩国,1,200307,绿色食品与饥饿,60,60,70,67,41,280,未参加,
我们甚至可以利用农作物的基因，重新排列组合，生成一种能大量生产的新的农作物物种，在同样的自然条件下，可以提高{CD生产的}农作物{CJ-zxy的产量}。,200307215448250023,维吾尔族,2,200307,绿色食品与饥饿,95,85,83,70,93,424,A,
世界上大部分的农作物生产者都{CJX}为了增加生产量用很多农药和化肥。{CJ-zhuy这},200307215523250021,韩国,2,200307,绿色食品与饥饿,60,65,78,59,61,306,C,
目前，孩子们[F們]已经{CC2就}有这种{CC这[F這]样[F樣]}男女有别{CC分别}的想法。[BC，],200309529529251019,泰国,2,200309,我对男女分班的看法,60,65,49,25,58,240,未参加,
男女分班式学校的问题{CQ上}，支持者主要是为了避免学生早恋。P},200309529529151026,泰国,1,200309,我对男女分班的看法,75,70,71,54,67,326,C,
所以，我{CD就}反对男女分班制。,200310576525100008,日本,1,200310,我对男女分班的看法,65,65,71,77,70,332,C,
对我来说，我上女子高校{CD了}，[BC。]所以高中时代，没有机会跟男性交往。,200310576525200005,日本,2,200310,我对男女分班的看法,65,65,55,58,45,272,未参加,
比如，家长们所认为的“可以避免学生早恋”也许是{CJ+sy代表}女子学校的好处之一。,200310576525200047,日本,2,200310,我对男女分班的看法,65,70,44,44,54,263,未参加,
他长大以后突然产生要跟女孩儿玩耍{CC3交玩儿}的念头。,200310576525200063,日本,2,200310,我对男女分班的看法,60,65,52,68,63,291,未参加,
本来阅读可分为：朗读、静读等几种，要看阅读后用来做什么。,200310540540150029,印度尼西亚,1,200310,谈有效阅读,65,65,48,38,86,286,未参加,
的确，在生活越来越忙碌、紧张的今日社会，可以用来阅读的时间相形之下也就越少了。,200310540533250037,新加坡,2,200310,谈有效阅读,75,75,66,77,91,374,B,
这才能达到我们学习专[F專]业的目的。,200310540540150057,印度尼西亚,1,200310,谈有效阅读,65,80,61,53,86,333,C,
我觉得有效阅读一定是从自己开始{CJsd}。,200310540540250068,印度尼西亚,2,200310,谈有效阅读,65,60,61,33,48,250,未参加,
在{CC于}中央政府{CQ的}指导[F導]下，男生跟女生的学[F學]校{CJ+zy将[F將]}合并了，还[F還]有新的学[F學]校也{CD被}建立了。,200310650634150041,英国,1,200310,我对男女分班的看法,70,60,63,44,56,278,未参加,
首先，我来[F來]说{CC1讨[F討]论[F論]}一下为[F為]什么有人会赞[F贊]成男女分班。,200311952922230010,美国,2,200311,我对男女分班的看法,75,80,74,70,85,375,B,
当汉语老师也很好，[BC。]{CD他的}工资也很高{CD的}。,200304131540200049,印度尼西亚,2,200304,我学汉语是为了……,70,65,38,38,57,254,未参加,
来中国之前，我并不知道汉语是什么样的语言，我只听别人说，汉字像图画一样，很美，很神秘[B密]。,200304131542200091,越南,2,200304,我学汉语是为了……,90,85,68,63,77,380,C,
“你为什么学汉语？,200304131542200183,越南,2,200304,我学汉语是为了……,70,80,59,54,77,330,C,
父母害怕学生早恋，无形中给学生种下了不平衡的心理{CQ种子}。,200306680519250001,马来西亚,2,200306,我对男女分班的看法,75,85,87,75,92,407,B,
我个人是不赞同男女分班或分校的。,200306680519250005,马来西亚,2,200306,我对男女分班的看法,90,85,87,77,98,434,A,
男女分班对[B时]学生而言有利也有弊。,200306680519250006,马来西亚,2,200306,我对男女分班的看法,85,80,77,77,92,404,B,
对此，我是不能苟同的。,200306680519250013,马来西亚,2,200306,我对男女分班的看法,95,75,82,75,100,422,B,
我们也不清楚，因为他们的所有举动，我们不能观察，相处的时间很短。,200306680540250014,印度尼西亚,2,200306,我对男女分班的看法,80,75,62,65,70,343,C,
就会愈加深他们对异性关系之间的好奇心。,200306680519250031,马来西亚,2,200306,我对男女分班的看法,75,90,82,70,85,396,B,
如果连吃都吃不饱，何谈吃好，吃绿色食品呢？,200307271523100005,韩国,1,200307,绿色食品与饥饿,80,75,86,70,93,395,B,
但是这[C]样子也是非常难免环境污染{CJX}。[BC.],200307271523100011,韩国,1,200307,绿色食品与饥饿,75,65,35,49,41,252,未参加,
因为对他们来说，多是好的。,200307271523100013,韩国,1,200307,绿色食品与饥饿,70,70,80,67,84,359,C,
对这[C]样的人来说，虽然污染过[C]但让他们吃饱的食品比绿色食品更重要{CC需要}。,200307271523200018,韩国,2,200307,绿色食品与饥饿,70,80,86,80,96,402,B,
人们在吃、[BC，]穿、住的方面也有了明显地变化。,200307271407200040,朝鲜族,2,200307,绿色食品与饥饿,85,70,40,49,61,296,未参加,
还有“绿色食品”虽然对人类的健康有好处，但是，对普通人民来说{CJ-sy是}一种[L]奢侈,200307271523100042,韩国,1,200307,绿色食品与饥饿,70,65,67,59,58,305,C,
所以，平常吃绿色食品的人不经常得病。[BC.],200307271523100090,韩国,1,200307,绿色食品与饥饿,70,80,75,75,84,374,B,
现在这个时代，允许抽烟的公共场所越来越少了。,200405109525200034,日本,2,200405,吸烟对个人健康和公众利益的影响,70,65,50,60,57,288,C,
所以[BD、]左边的短消息里的措施也有效果。,200405109525100132,日本,1,200405,吸烟对个人健康和公众利益的影响,70,60,55,54,53,277,未参加,
还有时候不吸烟的人也会受到吸烟的损害。,200405109525200477,日本,2,200405,吸烟对个人健康和公众利益的影响,70,70,76,68,66,338,C,
如果抽烟者对这项规定感到不满，他们就应该{CJ-sy注意}自己平时的行为。,200405109525200482,日本,2,200405,吸烟对个人健康和公众利益的影响,65,70,69,73,66,329,C,
我个人觉得这都是从习惯上来{CC1出来}的，吸烟绝对不能消失不安和紧张感。,200405109523200531,韩国,2,200405,吸烟对个人健康和公众利益的影响,85,70,59,64,53,322,C,
第二，吸烟可能{CC可以}造成环境污染。,200405109523200575,韩国,2,200405,吸烟对个人健康和公众利益的影响,75,0,74,64,82,289,未参加,
以前{CJX}我在电视上看过的一些节目中[BD，]{CJ-sy有}一个年轻的女[C]孩[BQ，]因为[C]爸爸每天跟她在一起的时候抽烟，所以她得病了，[BC。]结果她不能{CJ-sy发出}声音。,200405109523200659,韩国,2,200405,吸烟对个人健康和公众利益的影响,65,60,52,56,48,264,未参加,
政府[D反]应人们的要求[BD，]{CJ+zhuy政府}出台了{CC的}一项规定。,200405109523200671,韩国,2,200405,吸烟对个人健康和公众利益的影响,55,55,50,52,41,233,未参加,
第一，从过去到现在很多人因吸烟{CD所}得了癌[Pǎi]症，[BC。]而且非吸者也因间接吸烟{CD所}得了癌[Pǎi]症，[BC。]然后这些人们遇到{CQ了}死亡。,200405109523100808,韩国,1,200405,吸烟对个人健康和公众利益的影响,55,60,45,44,50,235,未参加,
另外千代田也是东京最重要的景点。,200405109525200852,日本,2,200405,吸烟对个人健康和公众利益的影响,65,60,38,50,46,242,未参加,
所以现在在公共场所边走边抽烟的人被罚款。,200405109525100891,日本,1,200405,吸烟对个人健康和公众利益的影响,75,70,57,52,48,291,未参加,
一般人都希望很久很久{CJX}活得{CC着}。,200405109523200954,韩国,2,200405,吸烟对个人健康和公众利益的影响,70,65,45,39,48,253,未参加,
一旦开始[B如]吸烟，人们就觉得被中毒似的{CJbei}。{CP一旦开始[B如]吸烟，注意力{CC集中力},200405109523100995,韩国,1,200405,吸烟对个人健康和公众利益的影响,70,60,55,48,55,273,未参加,
吸烟[C]给{CC对}人们{CQ的}健康带来很大的危害。,200405109523201164,韩国,2,200405,吸烟对个人健康和公众利益的影响,80,60,76,68,77,348,C,
因此人们为了自己{CQ的}健康[B唐][BQ，]{CQ要}对抽烟{CJ-zxy问题}{CJ-sy进行}考[C]虑。,200405109523201165,韩国,2,200405,吸烟对个人健康和公众利益的影响,70,60,45,58,59,277,未参加,
第二，吸烟不会给我们带来公众利益。,200405109525201190,日本,2,200405,吸烟对个人健康和公众利益的影响,75,60,62,66,73,322,C,
我有一个朋友，他是抽烟的。,200405109525101345,日本,1,200405,吸烟对个人健康和公众利益的影响,65,60,55,68,57,288,未参加,
而且吸烟会导致各种各样的疾病。,200405109523201424,韩国,2,200405,吸烟对个人健康和公众利益的影响,75,55,48,44,66,273,未参加,
现在这个社会，各国{CC2各}政府出台各种措施[C]来减少吸烟者。,200405109523201437,韩国,2,200405,吸烟对个人健康和公众利益的影响,70,90,79,73,77,382,B,
为了保障公众利益，公益广告也很多。,200405109525201447,日本,2,200405,吸烟对个人健康和公众利益的影响,75,60,52,46,55,274,未参加,
我们也放心{CD的}出门。,200405109523201474,韩国,2,200405,吸烟对个人健康和公众利益的影响,65,55,28,44,46,220,未参加,
吸烟可以说是个人的爱好。,200405109523201487,韩国,2,200405,吸烟对个人健康和公众利益的影响,70,85,64,50,57,318,C,
那是因为吸烟[C]绝对不利于人体。,200405109523201559,韩国,2,200405,吸烟对个人健康和公众利益的影响,70,65,57,77,66,321,C,
因为{CQ在}这样的人口密集场所里抽烟的话有可能因抽烟而着火，这个损失是不堪想像的了。,200405109525101600,日本,1,200405,吸烟对个人健康和公众利益的影响,65,75,55,66,75,323,C,
为了保护老人、孩子们{CQ等}非吸烟者，[BC。]我们大家都必须{CC必要}努力。,200405109525201624,日本,2,200405,吸烟对个人健康和公众利益的影响,65,65,45,58,55,272,未参加,
据医院调查显示吸烟的人比不吸烟的人死亡率很高{CJbi}，原因都是烟里面的尼古丁。,200405109525201636,日本,2,200405,吸烟对个人健康和公众利益的影响,60,65,43,37,61,249,未参加,
非吸烟者也被危害身体健康{CJbei}，主要是吸烟者{CJX}吸的烟。,200405109525101736,日本,1,200405,吸烟对个人健康和公众利益的影响,65,60,55,54,59,276,未参加,
的[C]事情是给我们[C]充分的[C]可吸烟区，[BC。]这样的话[C]我们[C]可以遵守{CC2耐[C]}这种规定，[BC。]不然话政府侵[C]害{CD一}个人的自由。P},200405109523201841,韩国,2,200405,吸烟对个人健康和公众利益的影响,70,55,48,37,41,235,未参加,
他的注意力不在烟头上。,200405109525101848,日本,1,200405,吸烟对个人健康和公众利益的影响,80,55,71,64,61,317,C,
现在许多政府[BD，]{CJ+zhuy国家}出台在公共场所[BD，]不允许抽烟的规定，[BC。]是因为根据科学的资料，很多人{CC1人家}晓[C]得吸烟对个人没有好处。{CP这{CC1这样},200405109523101864,韩国,1,200405,吸烟对个人健康和公众利益的影响,60,70,62,54,39,270,未参加,
我觉得不能[C]忽视这些消极后果。,200405109525201876,日本,2,200405,吸烟对个人健康和公众利益的影响,70,80,76,73,75,364,B,
我自己不抽，但是我的男朋友抽烟。,200405109525201877,日本,2,200405,吸烟对个人健康和公众利益的影响,70,80,50,62,68,320,C,
烟里面{CD有}不好的成分{CC因素}太多，所以长时间一直吸烟的话[C]，可能{CC可以}导致癌[Paì]症，还有如果周围的人经常吸烟的话，被动{CC2被}吸烟的影响也很[C]大。,200405109523200525,韩国,2,200405,吸烟对个人健康和公众利益的影响,70,70,50,66,75,319,C,
我觉得吸烟没有一个好处，可是为什么那么多的人喜欢吸烟呢？,200405109523200741,韩国,2,200405,吸烟对个人健康和公众利益的影响,70,60,54,62,63,294,未参加,
关于这个{CC项}问题的回答[B达]可以{CQ从}两大方面说[C]明。,200405109523200376,韩国,2,200405,吸烟对个人健康和公众利益的影响,50,60,77,66,77,310,未参加,
大家都知道吸烟[L]对人没有好处[C]，可是很多人都不能戒[C]烟，之所以不能戒烟是因[B国]为有环境问题，自己决心问题等[BD、]{CJ+sy有[C]}各种各样的原因。[BC，],200405109523200937,韩国,2,200405,吸烟对个人健康和公众利益的影响,70,60,62,60,65,302,C,
但我认为通过一些适当的政策，社会肯定会变得{CC变成}更理想的。{CJ-zhuy那},200405109525200934,日本,2,200405,吸烟对个人健康和公众利益的影响,95,60,79,79,80,384,C,
所以对吸烟[B咽]的人来说，这就是一种{CJ-dy放松的}办法。,200405204525200146,日本,2,200405,吸烟对个人健康和公众利益的影响,65,65,38,61,67,280,未参加,
但是在公共场所是不一样的。,200405204525200177,日本,2,200405,吸烟对个人健康和公众利益的影响,60,50,58,58,65,271,未参加,
现在，可以随便抽烟的公共场所越来越少。,200405204525100287,日本,1,200405,吸烟对个人健康和公众利益的影响,70,80,47,80,63,330,C,
烟盒[C]上也明明写着吸烟有害健康。,200405204525100314,日本,1,200405,吸烟对个人健康和公众利益的影响,70,60,38,61,56,270,未参加,
看到这个结果也还能说“随[C]意抽烟”吗？,200405204525200313,日本,2,200405,吸烟对个人健康和公众利益的影响,80,60,44,54,61,286,未参加,
随着吸烟带来的{CC所}对健康问题的认识{CC知识}{CJX}广泛，人们逐渐意识到了其严峻{CC深刻}性。{CP{CQ对},200405204525100320,日本,1,200405,吸烟对个人健康和公众利益的影响,60,60,55,73,61,291,未参加,
吸烟对身体不好是不好，但是对吸烟者{CC吸烟人}{CQ来说}它是一个爱好。,200405204525200354,日本,2,200405,吸烟对个人健康和公众利益的影响,65,60,22,47,54,231,未参加,
政府说{CJ-zhuy这}“为了保持整洁，并帮青少年养成良好的习惯”{CJs}[BQ。]国家为{CC1为了}国民制定{CC2做}措施是非常有用的，[BC。]特别是用“法”。,200405205525200101,日本,2,200405,吸烟对个人健康和公众利益的影响,60,85,55,63,58,310,未参加,
这样的措施完全{CJX}会不会保护公众利益{CC4公益}？,200405205525200108,日本,2,200405,吸烟对个人健康和公众利益的影响,60,75,27,51,56,255,未参加,
原因有几个{CC种}，比如有人随便把抽完{CC好}了的烟头{CC烟根}扔[C]在马路上，污[C]然环境。,200405205525200113,日本,2,200405,吸烟对个人健康和公众利益的影响,70,75,77,75,74,360,B,
据悉，某市政府出台有关吸烟的规定。,200405205525200125,日本,2,200405,吸烟对个人健康和公众利益的影响,60,80,55,63,67,312,未参加,
”我认为人应该保证自己的权利和自由。,200405205525200175,日本,2,200405,吸烟对个人健康和公众利益的影响,65,75,47,58,51,283,C,
但是，吸烟者也有吸烟权，这两个对立{CD者}问题如何解决呢？,200405201525100141,日本,1,200405,吸烟对个人健康和公众利益的影响,70,75,49,42,47,272,未参加,
我倒认为以下两种是不错的选择。,200410534533250006,新加坡,2,200410,最理想的结交方式,80,85,63,58,82,362,C,
因此，通过熟悉当事人双方在性格上{CQ的}优[F優]点和弱点的第三者介绍安排{CD下}，就肯定能免除了男女双方在日后[F後]交往上的种种因思想价[C]值观，性格差异[F異][BD、]{CQ而产生的}日常生活上的摩擦和误会。,200410534519150014,马来西亚,1,200410,最理想的结交方式,65,80,88,79,87,387,B,
