错句,作文编码,国籍,性别,考试时间,作文题目,口试分数,作文分数,听力分数,阅读分数,综合分数,总分,证书
我上有两[F兩]个[F個]姐姐，一个[F個]哥哥，下有两[F兩]个[F個]弟弟。,200110540540250023,印度尼西亚,2,200110,我的童年,70,95,63,47,74,342,C,
常常放学回家以后，就拿着糕饼或是香烟，沿街叫卖[BQ。]虽[B剖]然生活苦，但是还是乐在其中。,200110540540150123,印度尼西亚,1,200110,我的童年,75,85,77,39,88,357,未参加,
考完以后，马上得开始写毕业论文。,200104124619100227,罗马尼亚,1,200104,一封写给父母的信,70,75,68,58,72,332,C,
同时也加强政治学习力度。,200104124510100278,朝鲜,1,200104,一封写给父母的信,85,75,74,68,79,373,B,
再见！,200104124520200331,蒙古国,2,200104,一封写给父母的信,65,90,58,51,70,325,C,
所以我看得出你们的脸{CC颜}色不太好。,200105550523150025,韩国,1,200105,一封写给父母的信,70,65,77,68,67,333,C,
我告诉你们{CC你}我一天的生活吧。,200105550523250027,韩国,2,200105,一封写给父母的信,75,65,52,56,65,300,C,
已经到了十二点，.我今天写到这儿。[BC.],200105550523250033,韩国,2,200105,一封写给父母的信,70,70,44,39,51,262,未参加,
亲爱的父母[BQ：]妈[BQ、]爸[BQ，]我是××[BQ，]妈爸的老三。,200105550523250043,韩国,2,200105,一封写给父母的信,70,70,58,58,63,307,C,
我真爱你们。,200105550523250331,韩国,2,200105,一封写给父母的信,70,75,47,44,47,272,未参加,
我的学校的学生{CC2学校生}太多，[BC。]是人山人海，[BC。]和韩国不一样。,200105550523150345,韩国,1,200105,一封写给父母的信,65,70,47,54,45,267,未参加,
亲爱的爸爸和妈妈[BQ：]您们{CC2您}好，我是你们的长女XX，好久没写{CJX}给你们{CD的}信{CQ了}，我真{CJ-sy是}不孝子。,200105550523250342,韩国,2,200105,一封写给父母的信,70,70,55,61,42,286,C,
动身时，我没想到在这个旅游当中会经历{CC经验}终身难忘的事情。,200105212525200016,日本,2,200105,我的一个假期,70,75,75,63,70,342,C,
关于工作、学习、恋爱，[BC、]话题不尽。,200105212525200027,日本,2,200105,我的一个假期,70,75,52,61,57,304,C,
我现在在中国留学。,200105209525100055,日本,1,200105,我的一个假期,65,70,34,63,57,275,未参加,
第二天，我走时，他给我很多东西：[BC。]水、药、伞等等。,200105209525100059,日本,1,200105,我的一个假期,70,70,67,65,66,326,C,
因为有人来接我，我好象是很重要的客人，而迎接的人是中国人，好像我也成为了中国人。,200105209525200013,日本,2,200105,我的一个假期,70,65,80,65,72,338,C,
我在学生{CC2同学生}中好像{CJ-sy是}比较认真的学生。,200105215525100008,日本,1,200105,我的一个假期,70,70,77,75,74,354,C,
那个和尚说[BQ：]“我已经挑好了”。,200105109525100691,日本,1,200105,由“三个和尚没水喝”想到的……,70,60,61,64,57,297,C,
因此，在中国出现了很多暴发户。,200105109525100709,日本,1,200105,由“三个和尚没水喝”想到的……,65,50,54,51,53,254,未参加,
不过，我们也可以采取另一个方法。,200105109525100726,日本,1,200105,由“三个和尚没水喝”想到的……,75,65,63,75,68,333,C,
人的懒性大家都有，和尚也不例外。,200105109525100742,日本,1,200105,由“三个和尚没水喝”想到的……,70,65,57,75,95,348,C,
暴力[B利]教师也一样[BQ。]{CP他们一个人的时候{CC2时}并{CC却}没有暴力[B利]行动[BQ，]但是一个人开始{CJ-sy实施}暴力[BQ，]连一个别的教师也开始暴力[BQ，]但他们心中希望{CD的}别人阻止自己，阻止自己的行动，又说那时没有人勇敢地{CC的}阻止{CD的}他们的行动。P},200105109525100743,日本,1,200105,由“三个和尚没水喝”想到的……,65,60,61,58,61,288,C,
那么男人也变了。,200106570525250007,日本,2,200106,如何看待“妻子回家”,65,60,35,74,49,266,未参加,
否则丈夫可能觉[F覺]得那妻子是没用的。,200106570634250017,英国,2,200106,如何看待“妻子回家”,75,80,74,60,54,334,C,
如果自己得了不治之症，没有未来的希望，而且身体很疼痛的话，就会想逃走。,200205204525200013,日本,2,200205,如何看待“安乐死”,65,65,52,79,75,320,C,
这样的话，{CQ即使}他自己不想让{CC给}她安乐死也不得不帮助她的自杀。,200205204525200035,日本,2,200205,如何看待“安乐死”,65,55,63,70,51,286,C,
现在科学发达[BQ，]医学也不断提高，[BC。]人的寿命也越来越长了。,200205204525100113,日本,1,200205,如何看待“安乐死”,75,70,77,70,63,344,B,
如果病人有权选择[F擇]“安乐死”，他可以停止自己受到更多的折磨，[BC。]他也可以让自己死得{CC的}更有尊严。,200205204922200186,美国,2,200205,如何看待“安乐死”,75,75,85,88,96,409,B,
取了和医生商量{CC2仿}好的一种方法。,200205212525200002,日本,2,200205,如何看待“安乐死”,70,60,63,42,46,266,未参加,
解除{CC绝断}病人——患有绝症的病人——的痛苦，让他们安乐地进入{WWJ},200205212542100044,越南,1,200205,如何看待“安乐死”,65,55,71,38,80,291,未参加,
“安乐死”一词对现代的人来说已不陌[B某]生了。,200205224525200003,日本,2,200205,如何看待“安乐死”,85,80,83,67,94,402,B,
因为我认为这样的情况的时候，我们都有选择“安乐死”的权利。,200205201525200135,日本,2,200205,如何看待“安乐死”,85,80,38,42,42,280,未参加,
第三者的角度来看，能跟本人{CC当人}说{CC1告诉}现实的情况吗？,200210543525250005,日本,2,200210,如何看待“安乐死”,65,60,76,71,57,312,C,
这[F這]就是人类[F類]可不可以干涉天命的老问[F問]题[F題]。,200210543616150008,德国,1,200210,如何看待“安乐死”,75,70,70,65,88,357,C,
由于子女思想不成熟，常常说父母只顾工作而不重视他们，就自暴自弃地{CC的}荒废学业、[BC，]到处游荡。,200210801519250006,马来西亚,2,200210,如何解决“代沟”问题,70,70,78,71,64,341,C,
上面的题目你可能听过，但或许你还没有真正{CJ-wy想过}如何解决呢？{CJ+zy以我个人的想法},200210540540150037,印度尼西亚,1,200210,如何解决“代沟”问题,65,65,59,45,39,257,未参加,
当前要解决这个问题，关键在于上一辈和{CC及}孩子们要形成{CC导[F導]至}一种{CD的}了解意识。,200210540540250052,印度尼西亚,2,200210,如何解决“代沟”问题,85,75,73,73,73,371,B,
只要你对小孩说[F說]的话和教他做的事，他都会记[F記]得一清二楚[B處]。,200203522522210017,缅甸,2,200203,记对我影响最大的一个人,75,65,24,48,70,269,未参加,
如果一个人的心理承受能力比较强，如果一个人会吃一点苦，[BC。]那么那个人遇到困难的时候一定不会放弃，会决定克服困难。,200205109801200398,澳大利亚,2,200205,如何面对挫折,90,85,51,58,64,345,C,
以我自己上大学为例。,200205109634200788,英国,2,200205,如何面对挫折,80,80,87,84,70,393,B,
我的父亲管教方式并不严厉，每当我做错一件事，他只会很耐心地指出我的错和应该怎样{CC什样}才对。,200205109919200622,加拿大,2,200205,如何面对挫折,85,85,76,67,77,385,B,
二是精神准备。[BC，],200205109619101098,罗马尼亚,1,200205,如何面对挫折,70,70,73,62,59,322,C,
这些小说，让我的人生改变了。,200304131525100018,日本,1,200304,我学汉语是为了……,60,65,24,32,35,199,未参加,
当时我没有打算学习中文。{CP在18岁时我决定上大专，我本来上专门学习英文的大专，但如果上英文大专，那时每个人的英文水平都不同。因为我以前学习方面特别差，所以我已对英文有劣根性。P},200304131525100229,日本,1,200304,我学汉语是为了……,70,70,47,54,66,295,C,
听说这样的方法来罚犯人是{CJX}其实最可怕的。,200305576525100025,日本,1,200305,静音环境对人体的危害,65,65,47,38,49,248,未参加,
也许会感到好像自己是机器人。,200305576525200030,日本,2,200305,静音环境对人体的危害,70,70,71,68,77,344,C,
他们不仅帮助抽烟者[BQ，]而且也给青少年{CC青少人}好的影响。,200405261606200084,比利时,2,200405,吸烟对个人健康和公众利益的影响,70,65,41,44,47,253,未参加,
总之，减少和禁止吸烟可以给我们带来许多有益的结果。,200405205922100198,美国,1,200405,吸烟对个人健康和公众利益的影响,80,90,68,77,99,409,B,
大家不管吸烟者不吸烟者[L]都承认吸烟是危害自己和周围人的健康{CJsd}，也危害环境。,200405224529100068,泰国,1,200405,吸烟对个人健康和公众利益的影响,70,65,82,61,79,343,C,
孩子是我们的將来，年青人是我们的未[B近]来力量，所以要{CD操心}[BD，]关心他们，对吸烟这[B這]方面如能教育好他们也是一个快乐的大事。[BC、],200405224529100068,泰国,1,200405,吸烟对个人健康和公众利益的影响,70,65,82,61,79,343,C,
假如说，对个人有利益而对公众也有积极利益，那么可以说是个人对公众{CJ+sy是}有贡献了。,200405522522150021,缅甸,1,200405,吸烟对个人健康和公众利益的影响,85,80,60,47,70,335,C,
学校也很重视这方面，[BC、]{CJ-sy规定}要是被抓到三次就要开除[B途]{CJ+zxy的惩罚}。[BC，],200405522522150029,缅甸,1,200405,吸烟对个人健康和公众利益的影响,65,65,63,49,39,265,未参加,
吸烟的年轻人比老年人[B年][BQ、]中年人多。,200405522522250027,缅甸,2,200405,吸烟对个人健康和公众利益的影响,75,80,58,31,54,289,未参加,
的确[F確][BQ，]吸烟会[F會]有副[B附]作用，所以我们[F們]真须提高警惕，多去些禁烟区[F區]，平时注意周[F週]围[F圍]环[F環]境，一闻[F聞]到可疑的烟味，便离[F離]开[F開]当[F當]地或[C]忍住{CC着[F著]}呼吸，以免感染到{CJbei}。,200405610610250017,法国,2,200405,吸烟对个人健康和公众利益的影响,0,80,71,56,70,274,未参加,
到此完了,200505109525100336,日本,1,200505,父母是孩子的第一任老师,60,75,62,69,76,328,C,
我们大人应该注意自己的行为和发言。{CP父母是孩子的老师，而第一任的老师{CJs},200505109525200330,日本,2,200505,父母是孩子的第一任老师,55,75,53,63,69,300,未参加,
父母的言行来判断自己的位置，看着周围的人——就是父母的兴趣爱好、思[C]想观念慢慢地吸收以后，怎么不会有那样的影响呢？P},200505109525200387,日本,2,200505,父母是孩子的第一任老师,65,70,51,61,69,302,C,
我现在很感谢我长[C]大的环境和我妈妈。,200505109525200508,日本,2,200505,父母是孩子的第一任老师,70,65,41,56,77,295,未参加,
什么路上不要跑啦，[BC、]不要跟着可疑人物啦，[BC、]想吃{CQ哪}一些菜啦等等。P},200505109525200570,日本,2,200505,父母是孩子的第一任老师,70,70,52,54,74,308,C,
父母[C]做事[C]都好的话，孩[C]子[C]也{CJX}从父母[C]{CQ那儿}学到的东西很多。,200505109525101452,日本,1,200505,父母是孩子的第一任老师,55,55,37,33,41,201,未参加,
对孩子来说，他们认识的第一个人就是父亲或母亲，而在父母的教育下，他们长大。,200505217525100006,日本,1,200505,父母是孩子的第一任老师,45,75,44,61,69,277,未参加,
”有的时候，我与我朋友们的父母相比，觉得太严格，不公平。,200505217525200085,日本,2,200505,父母是孩子的第一任老师,70,85,56,71,69,343,C,
而在这个年龄[C]最能产生影响的就是父母。,200505217525200196,日本,2,200505,父母是孩子的第一任老师,85,70,86,77,91,400,B,
后来我听他们[C]的话来中国了。,200505204525200327,日本,2,200505,父母是孩子的第一任老师,65,70,56,55,54,286,C,
无论自己有几个孩子，谁{CJ+zy也}都不能不爱他，[BC.]这是无[B天]可奈何的。[BC.],200505204525100355,日本,1,200505,父母是孩子的第一任老师,65,65,44,63,58,279,未参加,
所以我和姐姐也很开朗，爱讲话。,200505204525200347,日本,2,200505,父母是孩子的第一任老师,65,90,58,57,61,322,C,
因此我受[C]他们的影响我喜欢听音乐。,200505204525200393,日本,2,200505,父母是孩子的第一任老师,70,60,73,59,74,321,C,
孩子高兴时、悲伤[F傷]时、寂寞[B莫]时、成功时都要想妈妈的。,200505204525200502,日本,2,200505,父母是孩子的第一任老师,75,75,63,59,65,327,C,
现在很多人提倡[B唱]提高素质。,200505204525200504,日本,2,200505,父母是孩子的第一任老师,80,80,69,67,96,384,B,
例如我偶尔[B儿]会看到父母拉孩子的手闯[B串]红灯，那么这孩子真的能够体会到遵守交通规则的重要性吗？,200505204525200539,日本,2,200505,父母是孩子的第一任老师,80,90,65,83,91,404,B,
外公跟我的关系很好，虽然我是他的外孙女，但他很{CC1的确}疼我。,200105205540200043,印度尼西亚,2,200105,我的一个假期,65,80,42,46,68,289,未参加,
我自己也做过大学生，但是当时几乎都没有假日。,200105205525200060,日本,2,200105,我的一个假期,75,85,57,70,66,346,C,
我特别喜欢去岛[B导]国看看那里的生活、[BC，]文化、[BC，]习惯。,200105205525200094,日本,2,200105,我的一个假期,60,65,75,56,39,278,未参加,
列车[F車]上还[F還]有旅游[F遊]指南，活动[F動]视象介绍[F紹]香港旅游[F遊]景点。,200110602801150006,澳大利亚,1,200110,我的一个假期,75,85,80,75,98,406,B,
每个人可能都有挫折的经验。,200112576525200005,日本,2,200112,如何面对挫折,70,65,60,63,72,316,C,
为了日中友好、韩日友好开始行动。,200105271525100016,日本,1,200105,我的一个假期,65,70,55,51,61,288,未参加,
我的男朋友也喜欢看电影。,200105271525200003,日本,2,200105,我的一个假期,65,75,55,56,72,310,C,
因为中国有很多名胜古迹[F跡]，[BC。]比如北京故宫，黄山等。,200105271525200005,日本,2,200105,我的一个假期,65,75,70,65,70,332,C,
我在日本公司工作的那年只有四{CC4}天暑假，心情不好就一个人出去溜达。,200105271525200007,日本,2,200105,我的一个假期,70,75,57,65,59,315,C,
那时候{CD也}坐在我旁边的藏族的姑娘给我吃药了{CJX}。,200105271525100041,日本,1,200105,我的一个假期,70,70,42,46,63,279,未参加,
在旅游[F遊]当中，我能够跟平时不接触的人打交道，同时看到在平时生活当中不存在的事情，并能开眼界。[BC，],200105271525100061,日本,1,200105,我的一个假期,65,70,50,61,57,289,C,
我在中国的时间已有4年多了，去旅行的兴趣随着时间{CJ-zxy的增加}而减少，对我来说上海也是很有吸引力的。[BC，],200105204542100043,越南,1,200105,我的一个假期,85,75,82,75,83,392,B,
我说，你最好保重。,200105550523150090,韩国,1,200105,一封写给父母的信,65,70,38,39,61,259,未参加,
父亲，母亲，我再一次给你们这句话，“爸爸、妈妈，这孩子很爱你们！,200105550523150101,韩国,1,200105,一封写给父母的信,70,65,49,54,56,280,C,
你培养我的性格。,200105550523150117,韩国,1,200105,一封写给父母的信,70,65,38,56,45,260,未参加,
因为您们是越来越老{CJxw}，精神也是越来越弱化{CJxw}，去年{CQ年}底[B低]回国以后，上了英语课和汉语课。,200105550523150155,韩国,1,200105,一封写给父母的信,65,60,33,63,47,251,未参加,
亲爱的爸和妈你们好！,200105550523250163,韩国,2,200105,一封写给父母的信,70,75,33,32,38,237,未参加,
每天早上去学校的图书馆读书。,200105550523250187,韩国,2,200105,一封写给父母的信,65,65,44,47,47,252,未参加,
妈妈：妈！,200105550523150215,韩国,1,200105,一封写给父母的信,70,65,60,49,67,297,C,
家里好吗？,200105550523150249,韩国,1,200105,一封写给父母的信,70,80,41,47,51,279,未参加,
但是我相信爸爸、妈妈继续支持我。,200105550523250269,韩国,2,200105,一封写给父母的信,70,70,58,61,61,308,C,
可是下周末我打算回家，上次父母节日时我不能回家，这次我要看你们[BQ，]想在一起很长时间。,200105550523250313,韩国,2,200105,一封写给父母的信,65,60,49,44,61,262,未参加,
而在这[F這]里[F裏]，我想很诚[B成]恳[Pkěn]的说[F說]一声[F聲]“谢[F謝]谢[F謝]”。,200105550523250323,韩国,2,200105,一封写给父母的信,70,80,60,56,40,296,未参加,
我从来没说{CQ过}感谢的话。,200105550523250379,韩国,2,200105,一封写给父母的信,65,60,41,51,58,258,未参加,
下次我再给你们写信。,200105550523150396,韩国,1,200105,一封写给父母的信,70,70,36,51,56,271,未参加,
蓝色的天空和蓝色的海洋真的{CC得}使人感动{CD的}。,200105550523250400,韩国,2,200105,一封写给父母的信,70,70,49,51,61,289,未参加,
就{CJX}我自己觉得很害[C]羞{CD的}。,200105550523150406,韩国,1,200105,一封写给父母的信,80,65,41,47,54,275,未参加,
您们已[B一]经知道{CQ了}吧？,200105550523150407,韩国,1,200105,一封写给父母的信,65,60,38,23,42,211,未参加,
祝你们健康、[BC，]长寿！[BD。],200105550523150411,韩国,1,200105,一封写给父母的信,80,75,79,61,74,360,B,
可是真希望的事是[BD，]想见爸爸、[BC，]妈妈。,200105550523250421,韩国,2,200105,一封写给父母的信,70,60,38,30,40,223,未参加,
再见。,200105550523250422,韩国,2,200105,一封写给父母的信,65,65,44,28,42,228,未参加,
妈，您对我的爱，当我生下您的外孙之后，才明白。,200105550523250439,韩国,2,200105,一封写给父母的信,75,85,71,61,74,359,B,
您肯定明白这儿的幸福是什么。,200105550523250475,韩国,2,200105,一封写给父母的信,65,80,63,49,58,303,C,
读{CQ了}四年的大学，有很多希望、愿望。,200105550523250487,韩国,2,200105,一封写给父母的信,70,65,38,47,45,251,未参加,
请你跟我小时候[L]一样地{CC的}责怪我、[BC，]打我。,200105550523250496,韩国,2,200105,一封写给父母的信,70,70,49,54,63,294,C,
其实我心里[D上]有一点儿不好意思。,200105550523250513,韩国,2,200105,一封写给父母的信,70,80,47,49,63,299,未参加,
我也和周围的朋友们一样，从小学到现在度[B渡]过了无数的假期。,200105206525200030,日本,2,200105,我的一个假期,70,80,92,72,96,400,B,
小王提议{CC2提出的案}的内容是为了他们，一起去别的小河[BD，]抬水。,200105109525100025,日本,1,200105,由“三个和尚没水喝”想到的……,65,60,41,66,57,272,未参加,
要是那样做，最后吃亏的是自己。,200105109525200023,日本,2,200105,由“三个和尚没水喝”想到的……,65,70,75,73,86,355,C,
结果，人多了，反而水没有了。,200105109525100062,日本,1,200105,由“三个和尚没水喝”想到的……,70,65,63,75,84,343,C,
三个和尚都不想去抬水。,200105109525100207,日本,1,200105,由“三个和尚没水喝”想到的……,60,65,45,64,61,278,未参加,
只有这样，整个社会才会发展，人们的生活{CJ-zxy水平}才会有提高；[BC，]只有这样，才会有灿烂的、美好的未来。,200105109525100235,日本,1,200105,由“三个和尚没水喝”想到的……,70,80,61,77,77,355,C,
为什么？,200105109525200244,日本,2,200105,由“三个和尚没水喝”想到的……,65,70,52,60,59,292,C,
但是踢[B蹴]足球应该要准备，比如说地方、设备[BD、]等等。,200105109525100317,日本,1,200105,由“三个和尚没水喝”想到的……,75,70,41,47,57,279,未参加,
我觉得在世界上，最重要的是关怀别人，关心别人，如果我们每个人都觉得这样，都开始行动，那么我们的社会{CJ-zy将}变成什么{CC怎么}样呢？,200105109525200334,日本,2,200105,由“三个和尚没水喝”想到的……,65,70,68,55,82,326,C,
以前我参加过为菲律宾孤儿院的福利活动。,200105109525200350,日本,2,200105,由“三个和尚没水喝”想到的……,70,80,36,62,59,297,未参加,
我弟弟已经工作了。,200105109525200370,日本,2,200105,由“三个和尚没水喝”想到的……,60,65,45,40,53,246,未参加,
”以前，第一个和尚一个人的时候，他可以亲自去挑水[BQ，]{CJ+zy就}自己喝。,200105109525200510,日本,2,200105,由“三个和尚没水喝”想到的……,65,85,66,64,70,340,C,
如果没有这种感情一起生活，却很冷淡。,200105109525200626,日本,2,200105,由“三个和尚没水喝”想到的……,65,55,68,60,64,294,C,
一个人一定要靠自己的实力来谋[B某]生、自食其力。,200105109540200679,印度尼西亚,2,200105,由“三个和尚没水喝”想到的……,75,75,91,73,91,395,B,
虽然爸爸一直很痛苦，但是他给了我很珍贵的东西。,200205217525200099,日本,2,200205,如何看待“安乐死”,80,80,52,56,80,340,C,
我认为，患者是植物人状态的话，对“安乐死”的想法也有所不同。,200205205525200021,日本,2,200205,如何看待“安乐死”,70,60,69,74,80,338,C,
这表示：我们又可以考虑很多事情，又{CJX}这些,200205205525200028,日本,2,200205,如何看待“安乐死”,80,60,46,42,58,273,未参加,
1993年12月24日，圣诞夜，[BC。]我妈自己决定了给父亲{CJ-sy实施}安乐死，[BC。]{CD是}因为他得了胃癌，[BC……]已经没了意识[BQ，]变成了“植物状态[F態]”{CQ了}。,200205206525100057,日本,1,200205,如何看待“安乐死”,65,65,66,60,49,289,C,
但是，现在的我，都理解{CC了解}他们的话{CC1说话}。,200209550523250002,韩国,2,200209,如何解决“代沟”问题,60,60,27,47,29,205,未参加,
如果把这一道理轻视的话{CJba}，代沟问题永远解决不了。,200209550523250009,韩国,2,200209,如何解决“代沟”问题,75,70,57,64,68,323,C,
例如，经济水平高的美国、日本等发达{CC发展}国家，由于“代沟”问题而家庭破裂{CC崩坏}的现象也常常发生。,200209550523150054,韩国,1,200209,如何解决“代沟”问题,70,65,69,86,70,346,C,
因为比以前现在的发展速度还快{CJbi}，并且{CC还有}越来越快[BQ，]所以两代人之间的差异已经是个社会问题。,200209550523150080,韩国,1,200209,如何解决“代沟”问题,65,60,51,49,44,252,未参加,
然而子女们也常常不在家。,200209550523150085,韩国,1,200209,如何解决“代沟”问题,60,75,45,57,62,285,未参加,
很多父母认为孩子是自己的，我觉得这种想法不对。,200209550523150102,韩国,1,200209,如何解决“代沟”问题,65,70,63,62,46,292,C,
为了历史的发[C]展，个人的发[C]展，年轻[B较]一代要服从，最少{CC小}要听{CC1听重}父母时代{CC世代}人的教训。,200209550523150108,韩国,1,200209,如何解决“代沟”问题,70,65,81,74,72,348,C,
现代社[C]会的发展很快，这对长辈{CC晚辈}们来说，难以适应。,200209550523250101,韩国,2,200209,如何解决“代沟”问题,60,60,63,62,54,281,未参加,
从今天开始尽量了解长辈或者晚辈的话，不久后“代沟”问题会自然地解决。,200209550523250121,韩国,2,200209,如何解决“代沟”问题,65,70,42,67,68,298,未参加,
在晚辈的立场[C]上看，他们与上一辈之间的沟通与交流非常困难[BQ，]长辈好像喜欢找我们的毛病。,200209550523250146,韩国,2,200209,如何解决“代沟”问题,70,65,60,64,58,303,C,
另外，晚辈也要改变以前{CC此前}的想法。,200209550523150152,韩国,1,200209,如何解决“代沟”问题,70,80,66,79,80,365,C,
我哥哥已[B巳]经大学毕业了。,200209550523250159,韩国,2,200209,如何解决“代沟”问题,60,70,24,42,42,223,未参加,
通过交流，我们能了解[D晚]两代人的思想、行动和生活方式等。,200209550523250163,韩国,2,200209,如何解决“代沟”问题,65,65,78,81,58,331,C,
一般[C]来说，小孩都想很快长大{CD当成}成人。,200209550523150200,韩国,1,200209,如何解决“代沟”问题,65,65,60,57,60,291,C,
这样才可以很好的解决代沟的问题。,200209550523250204,韩国,2,200209,如何解决“代沟”问题,70,75,66,81,72,353,C,
从古代{CC古老}流传的历史书[C]中，我们常看见的就是“代沟”问题。,200209550523250212,韩国,2,200209,如何解决“代沟”问题,60,60,48,64,44,258,未参加,
现在很多家庭都因这个问题而头疼。,200209550523250214,韩国,2,200209,如何解决“代沟”问题,80,75,72,86,72,376,B,
所以我们在每天的生活当中按照我上面所说的方法去做，我想一定会解决代沟问题。,200209550523250214,韩国,2,200209,如何解决“代沟”问题,80,75,72,86,72,376,B,
首先自己应该承认{CC认定}跟对[B地]方有代沟{CD的}，而要努力去了解对方。,200209550523250233,韩国,2,200209,如何解决“代沟”问题,70,60,60,64,60,299,C,
因此，我们，即[C]晚辈应该认真地考虑[B滤]父母的意见和看法。,200209550523250244,韩国,2,200209,如何解决“代沟”问题,70,70,63,59,58,308,C,
自从那天以后，妈妈不会逼我做我不愿意做的事。,200209550523250356,韩国,2,200209,如何解决“代沟”问题,65,70,60,59,56,296,C,
家里，为了两代人和平，跟上面的情况一样的{CC地}要互相尊重。,200209550523250358,韩国,2,200209,如何解决“代沟”问题,65,65,45,76,46,281,未参加,
以后拿来各种各样的话题可以一起谈一谈。,200209550523250386,韩国,2,200209,如何解决“代沟”问题,70,65,69,74,66,330,C,
年轻人做事的时候多听老人的话，{CJ-sy吸取}经验。,200209550523150784,韩国,1,200209,如何解决“代沟”问题,65,70,54,67,50,292,C,
