错句,作文编码,国籍,性别,考试时间,作文题目,口试分数,作文分数,听力分数,阅读分数,综合分数,总分,证书
如果自己的父母做得不好，那差不多他们{CQ的}孩子也会发生一样的结果。,200505109510101332,朝鲜,1,200505,父母是孩子的第一任老师,75,65,57,51,48,283,未参加,
主要的是，让孩子无意识中感到，体会到一些道理。,200505109525201338,日本,2,200505,父母是孩子的第一任老师,75,70,66,58,64,322,C,
这个说明{CC表示}了父母是孩子的一位老师。,200505109525101584,日本,1,200505,父母是孩子的第一任老师,50,65,46,47,58,247,未参加,
孩子也有自己的个性，从同学们{CJ-zxy那里}学来不少东西，老师们、电视等也有影响，孩子不听话的话，也未必是父母之过。,200505109604101672,奥地利,1,200505,父母是孩子的第一任老师,60,75,54,51,74,300,未参加,
虽然父母的兴趣爱好、思想观念和行为举止的好与坏都对孩子有影响，但是不是唯一{CJsd}。,200505109616101922,德国,1,200505,父母是孩子的第一任老师,70,45,35,45,54,230,未参加,
因为生活环境、思想观念，还有父母的喜好对孩子的成长有一定的影响，而这影响是对孩子有利还是有害就看{CC1视乎}个人的看法了。,200505109922201930,美国,2,200505,父母是孩子的第一任老师,80,65,67,59,74,333,C,
对现在的我来说，他们不是小时候的第一任老师，而是现在也教我的、[BC，]有现实性的两个老师。,200505109525202135,日本,2,200505,父母是孩子的第一任老师,60,55,37,45,54,232,未参加,
父母对孩子的影响非常大，所以轮到我做为母亲的时候[C]，我要好好注意我的行为。,200505109525202335,日本,2,200505,父母是孩子的第一任老师,70,75,66,72,73,345,C,
我父母在泰国出生，但是他们本身是中国人。[BC，],200505109529202511,泰国,2,200505,父母是孩子的第一任老师,70,65,56,53,50,280,未参加,
那答案当[B赏[F賞]]然不是单[F單]方面的。,200505109922102600,美国,1,200505,父母是孩子的第一任老师,75,50,37,37,56,239,未参加,
父母的一种责任也是提供对外面社会的一种保护[B户]。,200505204610200383,法国,2,200505,父母是孩子的第一任老师,95,65,61,51,54,318,C,
家庭环境、[BC，]父母的兴趣爱好、[BC，]思想观念等等也正是我们所最先接触到的，是一种无形{CC2无意识形态}的早期教育！,200505217610200176,法国,2,200505,父母是孩子的第一任老师,90,95,69,77,87,416,B,
很多人认为这是不一定的，他们说如果是这样的话[BQ，]为什么孩子没有跟他们一样的兴趣而有的时候完全相反{CC绝对反相}的{CJs}。,200505217651200234,,2,200505,父母是孩子的第一任老师,80,75,54,57,58,315,C,
而七情六欲[F慾]则[F則]是控制人类走向光明大道还是步入歧途深渊的重大因素。,200505522522150023,缅甸,1,200505,最理想的结交方式,80,90,84,64,84,397,B,
每个人步入成年后，在感情方面，都会需要与[B于[F於]]他共同[L]走完人生的伙伴，[BC。]所以都会结交异[F異]性的朋友。,200505522522250041,缅甸,2,200505,最理想的结交方式,65,65,68,58,79,319,C,
每一个人在成长的过程中都受到两种教育。,200505209542200100,越南,2,200505,父母是孩子的第一任老师,70,90,78,71,78,380,B,
不良环境对他的成长会带来不好的结果。,200505201540200302,印度尼西亚,2,200505,父母是孩子的第一任老师,60,80,71,63,69,330,C,
父母的兴趣爱好、思想观念，行为举止，无一不是从幼年就开始{CQ在孩子}心目中打下了深深的烙印。[BD》],200505201542200068,越南,2,200505,父母是孩子的第一任老师,95,75,67,51,89,372,C,
我们都要记得：养孩子不可以随便，要花很多时间来教育他，跟他玩，提高他的知识水平，给他讲一些故事，讲自己的经历。,200505225635200041,俄罗斯,2,200505,父母是孩子的第一任老师,80,90,69,61,69,364,C,
希望能早日收到您的回信。,200509534533250036,新加坡,2,200509,一封求职信,85,85,77,53,95,390,C,
谢谢！,200509534533250077,新加坡,2,200509,一封求职信,80,75,82,80,93,401,B,
我的地址是样林路22新加坡邮区123456。,200509534533250121,新加坡,2,200509,一封求职信,70,65,63,42,48,274,未参加,
至于我的成绩，也是不错的。,200509534533250144,新加坡,2,200509,一封求职信,75,70,75,60,79,348,C,
我想在贵公司当一名广告设计师，为公司设计平面、[BC，]电子等广告。,200509534533150170,新加坡,1,200509,一封求职信,70,75,59,58,97,348,C,
对本人的联系地址如下：88号裕廊大道#08-80新加坡邮区244886本人会期待李先生的答复。,200509534533250188,新加坡,2,200509,一封求职信,0,65,77,55,91,281,未参加,
我非常喜欢流行歌曲，崇[C]拜我喜欢的歌星。,200510111801200201,澳大利亚,2,200510,我看流行歌曲,95,90,79,83,100,446,A,
有些人非常喜欢流行歌曲，但是有些人不喜欢流行歌曲。,200510111523100822,韩国,1,200510,我看流行歌曲,65,85,60,52,72,324,C,
我[C]们既可以享受[B手]音乐，又{CC既}可以享受[B手]帅或漂亮的歌星的样子。,200510111523200815,韩国,2,200510,我看流行歌曲,65,80,49,54,62,298,C,
我也常常听流行歌曲，所以我喜欢流行歌曲。,200510111523200844,韩国,2,200510,我看流行歌曲,60,70,51,50,52,268,未参加,
流行歌曲就是我的第二个朋友，每天都会在我的耳朵边围绕着。,200510111523200894,韩国,2,200510,我看流行歌曲,60,85,53,61,67,315,未参加,
应该不会吧。,200510111523101055,韩国,1,200510,我看流行歌曲,60,60,53,34,47,236,未参加,
最近在舞厅、长拉OK厅、咖啡厅、餐厅、商场、路上到处都能听到流行歌曲。,200510111523201058,韩国,2,200510,我看流行歌曲,65,65,51,56,59,280,C,
现在想这是[B时][BD，]我人生中一个有意义的事情。,200510111523201067,韩国,2,200510,我看流行歌曲,55,45,56,38,52,223,未参加,
如果他们喜欢的歌星举行演唱会的时候[L]，他们不去上课，就去那歌星的那儿。,200510111523201244,韩国,2,200510,我看流行歌曲,55,60,30,48,55,229,未参加,
”总之，{WWJ},200510111523101248,韩国,1,200510,我看流行歌曲,50,55,42,38,50,214,未参加,
流行歌曲的产生{CC发生}是很自然的。,200510111523201262,韩国,2,200510,我看流行歌曲,55,60,44,38,67,245,未参加,
流行歌曲的作词家{CD经常}作词时，经常写关于爱情的，比如有一个人喜欢某个人，但他却没有勇气向她表白，谈恋爱过程中的幸福，一对恋人分手后的感觉[BD，]什么的[BQ。]我平时听某首歌，无动于衷，就喜欢歌手的声音，不过要是我真正遇到了像歌词一样{CQ的}情况，眼泪就没多久{CQ流}出来。,200510111523201274,韩国,2,200510,我看流行歌曲,65,65,65,48,69,296,C,
看这两{CD种}小{CJX}件事，流星歌曲是{CJX}对我来说很重要的爱好之一。,200510111523201846,韩国,2,200510,我看流行歌曲,65,60,51,40,52,251,未参加,
有许多父母对[F對]孩子总[F總]是有求必应[F應]，但过[F過]度的宠[F寵]溺却[F卻]反而害了孩子。,200510919919250020,加拿大,2,200510,父母是孩子的第一任老师,90,85,68,85,100,425,B,
让[F讓]孩子们[F們]感受到阅[F閱]读[F讀]的益处[F處]而从[F從]中可以得{CD其}好处[F處]，训练[F練]思想和态[F態]度，使他们[F們]能够[Y夠]有修养[F養]地结交良朋益友，为[F為]将来打好基础[F礎]。{CJ-dy孩子的},200510919919150024,加拿大,1,200510,父母是孩子的第一任老师,65,85,53,65,85,343,C,
他们的一言一行[BD，]点点滴滴{CQ地}滋润着孩子的成长。,200510919919250004,加拿大,2,200510,父母是孩子的第一任老师,85,95,77,68,96,417,B,
美丽的[B地]人生是它在一旁帮[C]着我的。,200510512512150015,菲律宾,1,200510,我看流行歌曲,85,55,60,50,82,319,未参加,
不过，在西方有一种哲理大概可以翻译为“道理论”或“思维论”。,200510956501130001,中国,1,200510,父母是孩子的第一任老师,90,95,77,68,88,416,B,
流行歌曲主要唱祖国、社会、爱情，唱出来让人自豪、憎恨、同情。,200510520520150003,蒙古国,1,200510,我看流行歌曲,70,60,60,44,62,281,未参加,
就是唱一些男女之间的矛[B予]盾[BQ，]你们从小就[C]应该学习歌唱祖国的歌曲。[BC，],200510520520150010,蒙古国,1,200510,我看流行歌曲,65,70,70,36,59,286,未参加,
一些长辈常责骂我们这一代的流行歌曲是破坏{CC贩坏[C]}传统好音乐的罪魁祸首{CC4货手}，我不这样认为。,200510520520250009,蒙古国,2,200510,我看流行歌曲,80,75,77,65,91,379,B,
相对而言，最近流行的大部分的内容是对社会的批[C]评或者自己的思想等。,200510302523100019,韩国,1,200510,我看流行歌曲,65,65,44,44,64,266,未参加,
我认为像我这样只是喜欢听流行歌曲也挺好的。,200510302523200049,韩国,2,200510,我看流行歌曲,85,80,46,61,77,342,C,
你们也是这样想吗？,200510302523200060,韩国,2,200510,我看流行歌曲,75,60,44,42,32,239,未参加,
特别是，对高中学生来说这是很重要的沟[C]通手段。,200510302523100083,韩国,1,200510,我看流行歌曲,60,55,67,48,77,288,未参加,
现在的人们喜欢自由和突出个性来展现自己。,200510302523100086,韩国,1,200510,我看流行歌曲,80,85,83,65,84,391,B,
我[C]喜欢[C]，就够了，别人不[C]喜欢[C]也没[C]有关系。,200510302523200122,韩国,2,200510,我看流行歌曲,65,70,51,36,57,265,未参加,
这现象[B像]是好的。,200510302523200134,韩国,2,200510,我看流行歌曲,60,55,32,20,20,168,未参加,
随着社会的发展，也同时带动了文艺业的发展。,200510302523100203,韩国,1,200510,我看流行歌曲,80,75,88,69,89,392,B,
我认为现在流行的歌曲肯定代表现代人们的生活方式和观念。,200510302523200210,韩国,2,200510,我看流行歌曲,75,65,65,46,67,305,C,
大人们认为关于爱情的歌词影响青少年的健康成长，但我想对大人们说，歌词只是歌词而已[C]。,200510302523200212,韩国,2,200510,我看流行歌曲,75,65,58,52,69,306,C,
为什么我说，我只有和妈妈与妹妹生活呢？,200510540540200001,印度尼西亚,2,200510,我看流行歌曲,80,70,42,24,47,253,未参加,
但时代不同，歌曲也有所变化，现代的流行歌曲大致词语比较简单，语序不规范，对老年人不太适用，但却取得广大青年{CC年青}的喜爱，他们认为这象征着他们年青一代的热气飞腾的性格，因此很适于他们的生活风气[BQ，]{CQ能}表现活泼的精神。,200510540540100013,印度尼西亚,1,200510,我看流行歌曲,75,85,51,77,72,353,C,
早上上学前我们扭开收音机收听早上的流行歌曲播送节目，下午学完了功[B工]课又再收听下午到晚上的流行歌曲播送节目。,200510540540200073,印度尼西亚,2,200510,我看流行歌曲,60,70,39,32,77,263,未参加,
相遇就是命运的一种缘分。,200505684542200004,越南,2,200505,最理想的结交方式,70,85,66,82,77,372,C,
只有一个原因，就是真爱没有理由。,200505680519250003,马来西亚,2,200505,最理想的结交方式,80,80,66,53,82,353,C,
人们说，爱情和生小孩会为我们打开不一样的人生视野，我希望自己可以{CJ-wy体验}。,200505680519250017,马来西亚,2,200505,最理想的结交方式,65,85,79,82,88,389,B,
但是[L]，在另外一对以{CQ与}他们完全相同的结交方式而展开婚姻旅途的夫妇，最终可能会发现原来彼此个性相差太远，只因一时冲动而忽略了深入了解的重要性。,200505680519250020,马来西亚,2,200505,最理想的结交方式,70,90,86,84,95,418,B,
人类是大自然所造就的{CC3做}，大自然也就是人类的第一任老师。,200510600919115001,加拿大,1,200510,父母是孩子的第一任老师,90,75,65,79,68,371,B,
”我非常感谢[BD，]到今天[BD，]你们对我的理解和支持。,200104124525100057,日本,1,200104,一封写给父母的信,80,65,74,61,76,344,C,
妹妹呢？,200104124525200067,日本,2,200104,一封写给父母的信,65,75,44,39,33,243,未参加,
可我呢？,200104124523200075,韩国,2,200104,一封写给父母的信,75,70,63,58,47,302,C,
×××2001年4月15日即,200104124525200101,日本,2,200104,一封写给父母的信,70,50,33,42,47,225,未参加,
今天我暂时写到这里，最后祝您身体健康，万事如意。,200104124542100109,越南,1,200104,一封写给父母的信,80,65,77,51,67,328,C,
虽然现在我是二十八岁，但我觉得我还没长大的小孩子{CJs}。,200104124523100156,韩国,1,200104,一封写给父母的信,70,75,38,39,47,258,未参加,
你们的女孩打算好好学汉语和日语，还有英语。,200104124523200158,韩国,2,200104,一封写给父母的信,70,90,58,35,56,302,未参加,
你们最近过得怎么样？,200104124523200272,韩国,2,200104,一封写给父母的信,65,70,36,23,49,229,未参加,
亲爱的爸爸[C]、妈妈：你们好！,200104124542200356,越南,2,200104,一封写给父母的信,90,75,77,58,88,382,B,
爸、妈我真希望你们能答应我，让我在这里再留{CD下}两、三年。,200104124540200391,印度尼西亚,2,200104,一封写给父母的信,70,70,60,39,61,288,未参加,
她是一个多才多艺的人。,200104124523100457,韩国,1,200104,一封写给父母的信,70,85,49,61,51,308,C,
以前我到{CQ过}巴黎[B里][BQ，]在一个有名的服装学院里留[C]学两年{CJX}了。,199200003525200011,日本,2,199200,一封求职信,,,0,0,0,0,未参加,
在中国居住三年多{CQ了}，已具有较高的汉语水平，并已在北京语言学院得到学士学位。,199200003634100009,英国,1,199200,一封求职信,,,0,0,0,0,未参加,
因为，除了服装设计以外[BQ，]{CD的}其他[B它]业务都{CJX}对我不合适。,199200204525200019,日本,2,199200,一封求职信,,,0,0,0,0,未参加,
我希望一辈子在服装{CD的}工作{CQ中}发挥本领{CC本事}[BQ。],199200204525100041,日本,1,199200,一封求职信,,,0,0,0,0,未参加,
我认为这是丈夫给妻子最后的礼物。,199604123523200285,韩国,2,199604,如何看待“安乐死”,65,75,45,44,42,258,未参加,
我觉得法律学家和医生们要商量这个问题。,199604124635100105,俄罗斯,1,199604,如何看待“安乐死”,60,55,45,47,44,232,未参加,
假如[BD，]孩子不好，那就能[C]跟她家人，包括她孩子来说一说。,199604123529100209,泰国,1,199604,如何看待“安乐死”,60,65,24,39,34,205,未参加,
谁愿意杀自己酷爱的人，这就等于说谁愿意{CJ-sy看着}自己喜欢的人受痛苦。,199604123523100268,韩国,1,199604,如何看待“安乐死”,60,55,42,42,47,227,未参加,
那样的话有什么好结果呢？[BC.],199604123523200207,韩国,2,199604,如何看待“安乐死”,60,70,50,57,34,255,未参加,
可是丈夫也有一些错。,199604124525200206,日本,2,199604,如何看待“安乐死”,60,70,61,76,70,321,C,
“想死”和“不想死”是一样的吗？,199604124525200342,日本,2,199604,如何看待“安乐死”,65,80,77,79,88,377,B,
我们也说他们想法太古老。,199610550523190038,韩国,1,199610,如何解决“代沟”问题,65,50,75,34,61,266,未参加,
我说服了我爸爸。,199610550523290037,韩国,2,199610,如何解决“代沟”问题,60,70,44,48,47,254,未参加,
而另外一个[F個]方法是多容忍及多谅[F諒]解对[F對]方。,199611543501200534,中国,2,199611,如何解决“代沟”问题,70,80,73,63,84,360,C,
在每一个[F個]时[F時]代、每个社会里[F裡]都难[F難]免有代沟的情况出现，针[F針]对这[F這]问[F問]题我个[F個]人有以下一些建议[F議]：一〕很多时[F時]候代沟的出现[F現]是由于[F於]价值观念的不同，因为[F為]父母与[F與]子女所经历{CQ的}、所受教育及经济[F濟]状[F狀]况不同。,199611543501100505,中国,1,199611,如何解决“代沟”问题,90,85,75,69,78,394,B,
这三兄弟从此各怀鬼胎，老二没有货送出，{CJba}{CD而}却把客户订购的货品拿回家中去。[BC，],199603533533200008,新加坡,2,199603,由“三个和尚没水喝”想到的……,85,80,58,58,77,351,C,
我们的社会，应该[F該]培养小孩{CJX}从小就群策群力的观[F觀[C]]念。,199603533533200013,新加坡,2,199603,由“三个和尚没水喝”想到的……,85,90,83,58,82,394,B,
这天也是一家人周末的相聚{CC集合}。,199603533519200084,马来西亚,2,199603,由“三个和尚没水喝”想到的……,80,75,74,67,70,357,B,
又如“[BC「]天下没[C]有白吃的午餐”[BC」]。,199604680519100517,马来西亚,1,199604,由“三个和尚没水喝”想到的……,80,65,60,54,51,298,C,
“一个和尚挑水喝，两个和尚打水喝，三个和尚没水喝”[BQ，]这个故事正像以前计划经济下的中国。[BC.],199605104523100043,韩国,1,199605,由“三个和尚没水喝”想到的……,75,80,63,67,61,337,C,
人类就是这样的动物。,199605104523200042,韩国,2,199605,由“三个和尚没水喝”想到的……,85,65,63,70,65,337,C,
我本人也将{CC1将来}从事教育工作。,199605104525100044,日本,1,199605,由“三个和尚没水喝”想到的……,65,70,91,79,82,373,C,
后来，我[C]才[C]明白{CD了}，曾经我[C]爸爸、妈妈提到的“身教”是什么意思。,199605104523200063,韩国,2,199605,由“三个和尚没水喝”想到的……,65,65,60,70,63,307,C,
第二个和尚来的时候，第一个和尚一定感到高兴。,199605104525200070,日本,2,199605,由“三个和尚没水喝”想到的……,60,50,58,51,61,260,未参加,
但后来那个庙里有3个和尚时，人与人之间[BD，]突出{CJX}矛[C]盾，每个人{CC3个人}的脑里有别[C]人替自己抬水{CJ-zxy的想法}。,199605104523200079,韩国,2,199605,由“三个和尚没水喝”想到的……,70,60,63,63,56,297,C,
不过，出乎他的意料，{CD在}这里没有水。,199605104525100084,日本,1,199605,由“三个和尚没水喝”想到的……,65,70,55,70,75,321,C,
一个人能{CC会}顺利做的工作，人越多越不好办了，[BC。]我想这个原因在于{CC2在}人的本身。,199605104525200080,日本,2,199605,由“三个和尚没水喝”想到的……,60,60,33,45,37,217,未参加,
人们的生活越方便，自然环境越坏。,199605104523100134,韩国,1,199605,由“三个和尚没水喝”想到的……,55,65,52,47,63,264,未参加,
总的来说，我觉得“三个和尚”的故事让我们想[B醒]起协动的重要性。,199605104523200136,韩国,2,199605,由“三个和尚没水喝”想到的……,65,65,52,58,63,287,C,
各[B个]人把他们各[B个]人的力量结合起来，可以把{CC办}所有的事情办得比较顺利。,199605104604200158,奥地利,2,199605,由“三个和尚没水喝”想到的……,70,60,63,60,68,306,C,
可是，如果你有别人可依靠{CC2靠}的话，情况可能{CJ-zy就}变了。,199605104525100195,日本,1,199605,由“三个和尚没水喝”想到的……,65,55,66,74,75,317,C,
为什么别人不用干，把这样麻烦的事偏偏放在我身上？,199605104525200191,日本,2,199605,由“三个和尚没水喝”想到的……,90,70,55,74,77,359,C,
我想在此指出的，不是哪个民族特质好这个问题，而是两个民族性质的差别很大这一点。,199605104525200233,日本,2,199605,由“三个和尚没水喝”想到的……,70,80,74,88,94,396,B,
我用{CC从}国家领导人{CD们}的行为{CD中}举{CC起[C]}了一个例子{CC比方}，不过这样的情况在我们的生活中经常看到[BQ，]而且会在自己的身边发生。,199605104523100260,韩国,1,199605,由“三个和尚没水喝”想到的……,70,70,69,74,84,355,C,
可是，他们{CJ-zy也}不想去看看{CJ-by怎么回事儿}，只等着{CC了}。,199605104523100276,韩国,1,199605,由“三个和尚没水喝”想到的……,60,55,30,54,65,245,未参加,
我在韩国的时候已经听说过{CQ和}这“三个和尚没水喝”类似的传说。,199605104523200278,韩国,2,199605,由“三个和尚没水喝”想到的……,70,70,71,51,51,301,C,
他说你长大以后无论是做哪一行业，一定要有{CC做}诚实的原则，而且你的事情别推{CC托}在别[C]人的身上。,199605104523100283,韩国,1,199605,由“三个和尚没水喝”想到的……,65,70,58,65,61,305,C,
现代，很多人愿意干比较轻松的工作，绝对不愿意{CJ-sy干}麻烦的。[BC，],199605104523200279,韩国,2,199605,由“三个和尚没水喝”想到的……,80,70,44,49,56,289,未参加,
但是只要我们有为{CC1为了}别人服务是伟大的事情{CJ-zxy的思想}，就能做到{CD的}。,199605104523200295,韩国,2,199605,由“三个和尚没水喝”想到的……,70,80,63,63,68,334,C,
公寓里的设[F設]备，人人都{CJ-sy有}权使用。,199605104542200312,越南,2,199605,由“三个和尚没水喝”想到的……,75,85,71,58,84,366,B,
拿[BD“]投票{CC选择}[BD”]来说，发达国家的投票率一般不到90%，有时[C]甚至还不到50%。,199605104523200329,韩国,2,199605,由“三个和尚没水喝”想到的……,85,70,74,76,70,366,B,
这就是没水喝的{CJ？}。,199605104525100347,日本,1,199605,由“三个和尚没水喝”想到的……,80,60,35,54,51,267,未参加,
他[C]也[C]很快地{CC的}成为他们的好朋友。,199605104540200352,印度尼西亚,2,199605,由“三个和尚没水喝”想到的……,75,70,44,42,58,278,未参加,
然后，两个和尚想个方法，等{CQ到}了老和[C]尚出去的那一天。,199605104525200365,日本,2,199605,由“三个和尚没水喝”想到的……,70,55,41,51,56,257,未参加,
这三个和尚的故事{CC传说}，虽然是个短篇，可是印象比较深刻的故事{CJs}。,199605104525200396,日本,2,199605,由“三个和尚没水喝”想到的……,70,60,77,56,80,328,C,
这不只超越了时代，还跨越了国家的界限{CC境界}。,199605104525200396,日本,2,199605,由“三个和尚没水喝”想到的……,70,60,77,56,80,328,C,
终于{CC终而}原来的长辈和尚召[B招]开了紧[C]急会议，讨论{CC谈论}采取什么样的方法来解决[C]喝[C]水问题。,199605550523290008,韩国,2,199605,由“三个和尚没水喝”想到的……,70,65,55,65,68,309,C,
我们如果一个{CJcd}每{CC一}个人都自己首先来办事情的话，未来可能是很好过{CJX}生活[B话]的！,199605550523190031,韩国,1,199605,由“三个和尚没水喝”想到的……,60,60,52,58,51,263,未参加,
所有的人{CQ都}愿意别人替自己吃点苦，而不愿意{CD让}自己吃苦。,199605550523290060,韩国,2,199605,由“三个和尚没水喝”想到的……,65,60,71,67,72,318,C,
一直[C]到现在我{CQ还}[C]记忆[F億]犹新。[BC，],199605550523290074,韩国,2,199605,由“三个和尚没水喝”想到的……,60,65,60,54,39,261,未参加,
这次，他们也照旧[B久]的方法去做，那就是，轮流下山去挑水。,199605529529250150,泰国,2,199605,由“三个和尚没水喝”想到的……,70,65,35,38,56,250,未参加,
那简陋的小木屋，那双手沾满肥皂泡的慈祥的母亲，那长年都一身肮脏的司机父亲，还有一个喜欢笑的姐姐，总是对我呵护有加，尽管家庭生活那么清苦，他们总把最好的留给我。,200110540540250120,印度尼西亚,2,200110,我的童年,75,90,71,70,88,388,B,
所以每天真正面对的人是她，而不是我亲[F親]生母亲[F親]。,200110540540250137,印度尼西亚,2,200110,我的童年,70,80,49,37,51,277,未参加,
毕业回国后，出任海洋广告公司的产品广告设计工作，并负责与客户的接洽工作。,199312533533200054,新加坡,2,199312,一封求职信,90,80,57,59,68,349,C,
我在1985年毕业于新加坡国立大学，主修华文。[BC.],199312533533200081,新加坡,2,199312,一封求职信,95,80,67,69,82,389,B,
我的联系地址：[BC；]北京市海淀区学院路13号00公寓,199312123525200208,日本,2,199312,一封求职信,60,55,53,43,39,231,未参加,
我英语学了一共10年了，其中4年在大学的英文系专门学习。,199312123525100310,日本,1,199312,一封求职信,60,75,57,43,52,273,未参加,
两个月以后调到江苏省某旅游公司当副经理。,199312124610200318,法国,2,199312,一封求职信,60,50,64,52,57,263,未参加,
相貌端正，也{CJX}表达力强，很熟悉中国历史。,199312123525100605,日本,1,199312,一封求职信,50,55,27,56,48,214,未参加,
我看了你们{CC您们}公司的招聘启事后，想在你们{CC您们}的公司工作而写信{CC写作}了。,199312123525100807,日本,1,199312,一封求职信,75,60,64,39,48,272,未参加,
本人会等待贵公司联[C]络。,199410550523101902,韩国,1,199410,一封求职信,80,65,62,54,82,332,C,
我想那一天是我记的父亲哭的一天吧。,199412123525200037,日本,2,199412,记我的父亲,60,90,62,63,45,310,C,
父亲一直鼓励{CJ-by我}[C][BQ，]{CD而}帮助我{CD的}学习。,199412123525200090,日本,2,199412,记我的父亲,60,60,49,30,47,228,未参加,
我听这些话时，我的眼泪下来{CQ了}。,199412124525100033,日本,1,199412,记我的父亲,65,65,52,46,45,257,未参加,
我的父亲是工程师。,199412124914100036,古巴,1,199412,记我的父亲,50,60,41,34,37,202,未参加,
那时候他受伤了。,199412124525200051,日本,2,199412,记我的父亲,65,65,52,48,41,255,未参加,
这是真的。,199412124525200061,日本,2,199412,记对我影响最大的一个人,60,65,62,57,55,282,C,
我一直想[BQ：]学习、工作都是为自己而做的。,199412124525100058,日本,1,199412,记对我影响最大的一个人,80,80,81,57,76,366,B,
