错句,作文编码,国籍,性别,考试时间,作文题目,口试分数,作文分数,听力分数,阅读分数,综合分数,总分,证书
我[C]生于黑龙江省哈尔滨市，高中毕业后考上了黑龙江大学经济系，除了经济之外，我[C]学习了四年俄语。,199312123635100931,俄罗斯,1,199312,一封求职信,65,55,36,37,43,218,未参加,
人感觉孤[C]独的时[C]候，更想念[C]家乡的父母和朋友。,199412123523100007,韩国,1,199412,记我的父亲,60,65,70,61,69,308,C,
”我说[BQ：]“老师让我交[Pjiao]{CD给}十块钱，[BD”]已经用完了。[BC，],199412123523100040,韩国,1,199412,记我的父亲,50,65,25,40,43,204,未参加,
父亲的脸上已经有很多皱[C]纹儿，[BC、]头发也几乎变白了。,199412123525200076,日本,2,199412,记我的父亲,55,60,62,53,57,268,未参加,
如果有人问我：“你想像[B象]谁？,199412123635200109,俄罗斯,2,199412,记我的父亲,85,85,86,61,80,392,B,
这些[B此]都是我13岁之前{CQ的事}。,199412124727200007,马达加斯加,2,199412,记我的父亲,55,65,46,38,30,216,未参加,
所以如果我也在汉城学习的话，家里只剩老两口。,199412104523200658,韩国,2,199412,记对我影响最大的一个人,65,70,52,50,49,272,未参加,
我家有六口人：父母亲、两个哥哥、奶奶和我。,199412104525100101,日本,1,199412,记对我影响最大的一个人,70,70,54,63,65,310,C,
因为我遇到了那么好的老师。,199412104525200691,日本,2,199412,记对我影响最大的一个人,65,65,57,59,57,287,C,
我们两个人{CC两口子}住在一间很小的房子里[F裡]。,199412104625200369,葡萄牙,2,199412,记对我影响最大的一个人,65,75,70,65,80,342,C,
谈[F談]到乐[F樂]的方面，{CD在}汉[F漢]语[F語]{CD上}学到{CC2有}一定程度，就可以跟中国朋友交谈[F談]，更加了解中国文化[C]，而且{CC2和}自己{CC本身}对[F對]中国五千多年的文化历[F曆]史感{CC1感到}{CJX}非常兴趣{CC有乐[F樂]趣}，懂汉[F漢]语[F語]，能够帮助我了解中国文化{CC文法}，有机[F機]会[F會]的话[F話]，我一定和的同学[F學]们[F們]去中国旅游[F遊]，参观名[B明]胜[F勝]古迹[F跡]，我最希望{CD可以}到北京，登上万[F萬]里长[F長]城，做一个[F個]真真正正的好汉[F漢]子，还[F還]可以真正{CC实[F實]际[F際]上}用汉[F漢]语[F語]跟北京当[F當]地人谈话{CC谈[F談]语[F語]}，和他们[F們]交流文化，我想这[F這]一定是我学[F學]习[F習]汉[F漢]语[F語]最大的喜悦了。,199409543634100202,英国,1,199409,学习汉语的苦与乐,80,75,62,73,70,351,B,
我从小就体弱多病，而我们兄弟姐妹共五个，全部都是由母亲[F親]一人亲[F親]手带[F帶]大的。,199500533533200070,新加坡,2,199500,记对我影响最大的一个人,50,70,54,53,74,284,未参加,
何老师不像{CC象}其他老师，他不用填鸭式的教法而是以活泼、谈天说地的方法来教导我们。,199500533533200071,新加坡,2,199500,记对我影响最大的一个人,95,80,86,75,82,414,B,
从她身上我也继承{CQ了}善良、开朗、公正无私、无畏及乐观的性格，当然我只做到了她的百分之一，[BC。]但她永远是影响我最大的一个人。,199500533533200076,新加坡,2,199500,记对我影响最大的一个人,85,90,91,73,86,421,A,
她每天都花一些时间，以生动的语气说故事给我听，以引起我对阅读的兴趣。,199500533533200099,新加坡,2,199500,记对我影响最大的一个人,95,80,83,75,88,417,B,
我还认[F認]为这位现[F現]代{CQ的}政治家，可与唐朝的唐世宗[B文]比美呢。,199500533543200100,香港地区,2,199500,记对我影响最大的一个人,55,80,60,75,92,348,C,
他虽[F雖]然去世了，但他给[F給]我的启迪、给[F給]我的力量、我都永远[F遠]忘[B望]不了{CJ+by他}。[BC、],199510512501100514,中国,1,199510,记对我影响最大的一个人,80,85,40,73,86,358,未参加,
从[F從]不敢跟别的小孩争[F爭]东西，被人欺侮也不敢反抗的，所以使大家觉[F覚]得我很乖。,199510512501200513,中国,2,199510,记对我影响最大的一个人,95,80,83,70,79,403,B,
我主张[F張]现[F現]在政府要承认“安乐死”。,199510550523200913,韩国,2,199510,如何看待“安乐死”,0,60,31,31,35,149,未参加,
人因身体[F體]的衰老或疾病的感染等因素，导[F導]致病痛而躺卧[C]在床[F牀]上。[BC，],199510550523200919,韩国,2,199510,如何看待“安乐死”,90,85,74,68,77,391,B,
因此，我个[F個]人认[F認]为[F爲]，“[BC「]安乐死”[BC」]这个案子{CD是}不够[F夠]适[F適]合我们[F們]这[F這]个复[F復]杂[F雜]的时[F時]代。,199510550523200926,韩国,2,199510,如何看待“安乐死”,80,85,62,79,66,366,B,
这[F這]个[F個]问[F問]题[F題]至今仍未有定论[F論]，在一些国[F國]家，“安乐死”被视[F視]为[F為]合法，但在一些国[F國]家却被视[F視]为[F為]谋[F謀]杀[F殺]！,199511543634200548,英国,2,199511,如何看待“安乐死”,85,90,74,79,99,423,A,
最后[F後]，安乐[F樂]死是不道德的行为[F為]，它不但涉及法律上的责[F責]任，更涉及伦[F倫]理道德上的问[F問]题[F題]。,199511543501200569,中国,2,199511,如何看待“安乐死”,80,90,79,64,88,396,B,
虽[F雖]然本人喜爱[F愛]美术[F術]设[F設]计[F計]这[F這]一学[F學]科，却[F卻]更善于[F於]研究广[F廣]告的设[F設]计[F計]，因此也在这[F這]方面获[F獲]得了多次{CJX}{CD的}奖[F獎]项[F項]。,199503682519200516,马来西亚,2,199503,一封求职信,95,90,67,66,82,399,B,
他说：[BC;]“[BC「]你不会做的，大家都不会。,199505550523200903,韩国,2,199505,记对我影响最大的一个人,75,65,41,50,49,267,未参加,
从我四五岁的时候，每天晚上我妈朗[C]读{CD了}童话书{CC片}，以后我慢慢习惯[B贯]了读书。,199505550523200911,韩国,2,199505,记对我影响最大的一个人,70,65,62,57,39,279,未参加,
凡遇能[C]讲汉语{CJ-zxy的人}{CD或}即与其会谈[BQ，]{CJ-zhuy这}使我能[C]获悉甚[B什]多的新异[F異]见识，心情上因而甚[B什]是爽快的。,199505529529100007,泰国,1,199505,学习汉语的苦与乐,65,85,36,37,59,272,未参加,
我多么地{CC的}高兴啊！,199505529529100015,泰国,1,199505,学习汉语的苦与乐,90,95,88,87,99,457,A,
从{CC1自从}我小的时候{CJ-zhuy我}就与汉语结下{CQ了}不解之缘。,199505529529100016,泰国,1,199505,学习汉语的苦与乐,80,85,83,70,86,398,B,
那时我恨公司。,199505104525100041,日本,1,199505,记对我影响最大的一个人,70,70,54,65,67,314,C,
第三个：我的事[C]业很亨通。,199505104523100050,韩国,1,199505,记对我影响最大的一个人,0,80,62,53,53,245,未参加,
我认为，每[C]对夫妻可以有各种各样的选择。,199505104525200097,日本,2,199505,记对我影响最大的一个人,75,85,41,63,84,341,未参加,
所以我觉得结婚是一件{CC个}非常重要的事。,199505104525200132,日本,2,199505,记对我影响最大的一个人,65,65,17,48,47,226,未参加,
跟男职员一样的工作，所以没想到许多女性先辈告诉我，在这个公司里还是重男轻女的。P},199505104525200157,日本,2,199505,记对我影响最大的一个人,75,75,57,79,78,354,C,
人的一生中有一个好朋友的确是很幸福的事，而且有象朋友似的老师更幸福的事情{CJs}。,199505104523100172,韩国,1,199505,记对我影响最大的一个人,65,65,70,50,51,285,C,
在一个人的人生中，最主要的事情是对自己的诚实[C]。,199505104523100216,韩国,1,199505,记对我影响最大的一个人,65,70,89,79,80,369,C,
我通过[C]他的这种行为，了解到中国民族的多样性。,199505104525100225,日本,1,199505,记对我影响最大的一个人,65,80,65,77,82,357,C,
他在坦桑尼亚两年多的时间[BQ，]为{CC1为了}当地贫穷的人民盖起了房子。,199505104604100233,奥地利,1,199505,记对我影响最大的一个人,80,80,60,55,65,332,C,
听说他现在{CJ-zy在}读研究生。,199505104523200280,韩国,2,199505,记对我影响最大的一个人,70,60,83,67,78,343,C,
我第一次碰到他是在上海美术馆举行的[C]民间收藏品展览。,199505104608100304,波兰,1,199505,记对我影响最大的一个人,85,65,78,48,63,328,C,
父亲[C]从容不迫，具[C]有[C]大男子汉的特色{CC色彩}。,199505104525200310,日本,2,199505,记对我影响最大的一个人,70,65,57,53,59,290,未参加,
所以我母亲而今精通许多方言与大马语文[BQ。]母亲不因为不公平的制度而深感不平，她不曾因此{CC2因为如此}而悲伤、自卑。,199508680519200533,马来西亚,2,199508,记对我影响最大的一个人,90,85,73,69,82,396,B,
童年时虽然母亲极少陪我，但没关系，我有姆妈，她教了我很多，也给了我很多。,199508682519200545,马来西亚,2,199508,记对我影响最大的一个人,85,85,78,71,84,398,B,
不过[F過]，过[F過]了不久我终于[F於]能亲[F親]眼看见[F見]一颗[F顆]流星从[F從]天空的一面到另一面，那时[B是]的心情真是很轻、又难忘。,200010543501250001,中国,2,200010,我第一次……,75,65,82,70,90,369,B,
但她们[F們]尊重彼此，尊重他们[F們]的关系[F係]、婚姻，而不会[F會]轻[F輕]易或随口说[F說]出伤[F傷]害性太大的话[F話]。,200010602543250005,香港地区,2,200010,我对离婚问题的看法,90,85,83,80,93,428,A,
如果真的把这些很难听又刺耳的噪声换成这些自然声的话，我想这个世界能够变成为{CQ与}自然共度[B渡]的完美的人类根据地了。,200005108523200280,韩国,2,200005,关于用自然之声取代噪声的建议,70,75,83,90,72,379,B,
那么这噪声是谁造成的呢？,200005108523200282,韩国,2,200005,关于用自然之声取代噪声的建议,65,65,53,47,46,260,未参加,
让我看，噪音分成两个种类。,200005108525100281,日本,1,200005,关于用自然之声取代噪声的建议,70,70,67,75,72,342,C,
所以，环保部门打算征集几十种动听的自然之声，但我认为采取这种方式不那么好。,200005108523100325,韩国,1,200005,关于用自然之声取代噪声的建议,65,60,75,67,76,326,C,
如果把恼人的电话铃声换成小河的流水声，谁知道有一个电话打过来，谁也不接电话。,200005108525200328,日本,2,200005,关于用自然之声取代噪声的建议,75,65,59,65,67,318,C,
我们在生活中{CC上}随时随地听到汽车喇叭声，各种铃声等的噪声，就会让我们生气。,200005108523100634,韩国,1,200005,关于用自然之声取代噪声的建议,65,65,45,70,56,285,未参加,
我之所以觉得在这里不该用，是因为这是一种让人警醒的方法[BQ，]司机用汽车喇叭的时候是应该他感觉到危险的时候。,200005108525200701,日本,2,200005,关于用自然之声取代噪声的建议,70,80,86,83,82,391,B,
但有一点[F奌]要记[F記]住的是：近朱者赤，近墨者黑。,199711801801100022,澳大利亚,1,199711,我选择朋友的标准,75,80,52,49,54,301,未参加,
对身体肯定有不好的影响[F響]。,199705104525100004,日本,1,199705,我的城市/乡村生活,75,65,52,65,68,312,C,
在那我发现了一只鸭子，我问：“妈妈，鸭子怎么不在水上，而在草坪上呀？,199705104523200096,韩国,2,199705,我的城市/乡村生活,60,60,66,38,46,252,未参加,
她认为孩子小时候应该玩得痛快，不要整天坐在桌子上，在玩儿的过程中也可以学到很多东西。,199705104523200097,韩国,2,199705,我的城市/乡村生活,60,60,69,70,77,318,未参加,
以前我觉得奇怪。,199705104525100526,日本,1,199705,我的城市/乡村生活,65,70,60,79,65,325,C,
水中混有无[F無]数[F數]的垃[B拉]圾[B扱]。,199705529529253002,泰国,2,199705,我的城市/乡村生活,75,65,31,44,43,245,未参加,
巴黎人周末也喜欢[F歡]出去呼吸{CC2呼}新鲜空气[F氣]。,199705610610100013,法国,1,199705,我的城市/乡村生活,65,70,62,48,44,275,未参加,
城市的人口，共有两万多，而亚[F亞]洲人差不多有六千多个。,199705610610100016,法国,1,199705,我的城市/乡村生活,55,60,48,37,35,216,未参加,
不过还是一边哭一边继续学习。,199804123635200166,俄罗斯,2,199804,学习汉语的苦与乐,60,80,51,62,54,294,未参加,
这两个问题就是在我学习汉语的时候使我痛苦{CJs}。,199804123608200205,波兰,2,199804,学习汉语的苦与乐,75,70,45,37,46,262,未参加,
现在已经学汉语四年多了。,199804123525200272,日本,2,199804,学习汉语的苦与乐,60,60,48,62,36,248,未参加,
除此之外，在学习过程中，也从汉语本身得到乐趣，比如：汉语的谜[B迷]语，还有汉语的歇后语等等。,199804124529200344,泰国,2,199804,学习汉语的苦与乐,85,85,81,71,76,393,B,
刚开始学汉语时，我总是感到困难，因为{CC2之所以}我们韩国人也使用汉字，我习惯使用韩语里的汉字。,199804124523200441,韩国,2,199804,学习汉语的苦与乐,85,85,78,67,80,390,B,
我{CJX}当刚来中国时，对汉语连拼音都不懂。,199804124523100489,韩国,1,199804,学习汉语的苦与乐,70,65,69,52,60,302,C,
虽然学了这么{CC多么}长时间，但是跟中国人谈话时，还不能完全表达自己的意思，[BC。]那时我感到苦。,199804123525200494,日本,2,199804,学习汉语的苦与乐,60,65,57,67,64,296,未参加,
我想说一下，以前我体会过的、[BC，]让我最难忘的挫折。,199904123523100075,韩国,1,199904,如何面对挫折,60,55,56,47,48,247,未参加,
在人生中，人一定{CJ-zy会}遇到许多困难，有的人用所有的{CJX}自己的能力试试{CJcd}克服困难，也有的人完全逃避。,199904123525100093,日本,1,199904,如何面对挫折,60,60,45,62,56,265,未参加,
第二是没有分析能力，{CJ-zhuy我们}应该找挫折的原因和对策{CD答[B大]案}，然后想以后的{WWJ},199904123523100138,韩国,1,199904,如何面对挫折,65,55,72,65,61,300,C,
有应变能力的人才可以在遇到挫折时采取各种各样的办法面对挫折。,199904123639100201,阿塞拜疆,1,199904,如何面对挫折,75,70,26,24,52,236,未参加,
这个时候也{CJX}我想“痛了就成熟了”，“时间都把问题解决得了{CJba}。,199904123523200213,韩国,2,199904,如何面对挫折,65,65,42,52,54,262,未参加,
我想这样的情况可能我父母没离婚的话不容易感觉到的{CJsd}。,199904124525200373,日本,2,199904,如何面对挫折,60,70,53,47,59,274,未参加,
后来[F來]爸爸就把我安排到一间私人办的学校去上中学。,199909529529251007,泰国,2,199909,如何面对挫折,75,80,88,84,80,398,B,
