错句,作文编码,国籍,性别,考试时间,作文题目,口试分数,作文分数,听力分数,阅读分数,综合分数,总分,证书
另一方面，女生也怕遇人不淑，受不了男生的花言巧语[F語][BQ，]{CJ-sy导致}被诱的结局。,200504534533250078,新加坡,2,200504,我对男女分班的看法,65,55,42,43,50,237,未参加,
我个人认为，如果支持男女分班只仅仅为避免学生早恋，那是不太可能的。,200504534533250115,新加坡,2,200504,我对男女分班的看法,75,80,84,71,88,389,B,
男女的思想都很不同。,200504534533250148,新加坡,2,200504,我对男女分班的看法,75,75,62,45,70,317,C,
我认为“父母是孩子的第一任老师”是很正确{CJsd}。,200505109529100224,泰国,1,200505,父母是孩子的第一任老师,70,65,74,54,67,316,C,
我[C]上小学时，父母[C]都在外面工作。,200505109525200609,日本,2,200505,父母是孩子的第一任老师,80,70,69,65,77,351,C,
这是什么原因，[BC、]我先不提。,200505109523201266,韩国,2,200505,父母是孩子的第一任老师,55,75,57,39,52,263,未参加,
对父母来说这是能够提高自己的水平的宝贵{CC贵重}的机会。,200505109525201377,日本,2,200505,父母是孩子的第一任老师,60,65,71,62,76,317,C,
向父亲学习，现在我才{CC1才能}决定去重新学习。,200505109525201517,日本,2,200505,父母是孩子的第一任老师,85,85,84,77,93,419,A,
也是第一任老师吗？,200505109540201596,印度尼西亚,2,200505,父母是孩子的第一任老师,65,60,41,57,54,260,未参加,
[BD《]父母是孩子的第一任老师[BD》]刚出生的时候，我们什么都不知道。,200505109525201655,日本,2,200505,父母是孩子的第一任老师,45,75,37,59,50,249,未参加,
拿我朋友来说，我朋友的父亲是日本人，母亲是台湾人。,200505109525201906,日本,2,200505,父母是孩子的第一任老师,55,75,41,55,52,263,未参加,
还有很多受父母的兴趣爱好的影响长大了的孩子，[BC。]有些艺术家、[BC，]运动员等等[C]{CJs}。,200505109525201916,日本,2,200505,父母是孩子的第一任老师,40,50,26,29,30,150,未参加,
有的孩子，因为从父母{CQ身上}{CJX}没有学会什么东西而轻视父母。,200505109525202500,日本,2,200505,父母是孩子的第一任老师,70,60,56,69,74,314,未参加,
下面，我想提自己的例子。,200505109525102597,日本,1,200505,父母是孩子的第一任老师,70,80,37,57,65,299,未参加,
在我看来，很多人会把父母培养孩子的兴趣视为是惟一影响孩子的层面。,200505204523200576,韩国,2,200505,父母是孩子的第一任老师,60,65,67,71,78,324,C,
我觉得这种相识的方式是最理想的。,200505951501150007,中国,1,200505,最理想的结交方式,70,85,86,75,95,403,B,
有的是通过亲戚朋友的介绍，有的是从小一起长大的玩伴，有的则是在一个偶然的机会{CQ下}相遇，彼此一见倾心。[BC.],200505522522210008,缅甸,2,200505,最理想的结交方式,65,65,88,77,97,376,C,
人类社会[F會]{CD在}每一分每一秒都在发生变化，从[F從]前男女双方都没什么机会认[F認]识[F識]对方，都只能靠媒婆来牵红线[F缐]，糊里糊涂地{CC的}成了亲。[BC，],200505522522110015,缅甸,1,200505,最理想的结交方式,70,80,77,71,93,381,B,
对我来说[F説]，我最理想的结[F結]交方式是从小一起长[F長]大的玩伴，而我本身也处[F處]于此境，我觉[F覺]得一对男女{CC2人}从小一起玩到大，[BC、]他们不但了解对象的爱[F愛]好、心意、缺点[BQ，]而且他们也知道怎样[F様]做[BD，]能让[F讓]对方开心。,200505522522110018,缅甸,1,200505,最理想的结交方式,65,70,73,55,70,319,C,
第二种是社会的教育。,200505209542200100,越南,2,200505,父母是孩子的第一任老师,70,90,78,71,78,380,B,
孩子的房间，衣服，菜，电视节目[BD、]……没有一个不是父母先帮他选好，可能到后来，孩子会有自己的爱好，但是从小就接触的东西，很有可能保留一辈子。[BC，],200505201542200390,越南,2,200505,父母是孩子的第一任老师,75,70,88,71,89,382,B,
综上所述，父母应该要做孩子们的榜[B棒]样[B枋]，因为父母是孩子的第一任老师。,200505201635200311,俄罗斯,2,200505,父母是孩子的第一任老师,60,80,44,45,52,268,未参加,
当父母跟孩子接触的时候，两方面之间会感受到一个奇妙温暖的感觉，这就是爱。,200505502540100085,印度尼西亚,1,200505,父母是孩子的第一任老师,80,80,41,63,65,321,未参加,
本人认为身为导游除了熟悉当地的文化、历史和习俗外，更重要的是对团友要细心地{CC的}照顾，为他们提供舒适的旅游{CD和}使他们有宾至如归的感觉，这是身为导游的必备条件。,200509534533250017,新加坡,2,200509,一封求职信,80,85,75,58,79,371,B,
李文先生台鉴申请经理职位关于贵公司招聘经理一职[C]，本人{CC文}深感兴趣；凭着{CC秉着}累积{CJX}在这行业二十年的经验，申请这项重要的职位。,200509534533150101,新加坡,1,200509,一封求职信,55,75,82,66,82,345,C,
在电视传讯公司工作，让我有机会接触到各个阶层{CQ的}人士，上至部长，下至百姓。,200509534533250102,新加坡,2,200509,一封求职信,70,70,75,62,77,342,C,
谢谢。,200509534533250140,新加坡,2,200509,一封求职信,55,65,73,62,77,314,C,
我在大学时期是主修管理系的，所以我相信我一定能胜任这份工作的。,200509534533250144,新加坡,2,200509,一封求职信,75,70,75,60,79,348,C,
广告设计也有很[L]多种类，如平面广告，报刊广告，电视广告。,200509534533250164,新加坡,2,200509,一封求职信,75,75,82,64,84,370,B,
我们没有{CC2不}经历{CC经验}所有的爱情。,200510111523200010,韩国,2,200510,我看流行歌曲,60,75,42,44,59,266,未参加,
如果把我现在的汉语水平更加提高了{CJba}，我一定要学会很多的中国歌，什么时候又让[B认]中国的朋友大吃一惊。,200510111523100424,韩国,1,200510,我看流行歌曲,70,85,70,71,84,372,B,
各个[B各]都有优点和缺点。,200510111523200770,韩国,2,200510,我看流行歌曲,80,80,63,69,69,353,B,
我喜欢听这样的音乐的原因在好多方面，但最主要的是它的音乐听起来特别熟悉，一点儿都没有陌生感，甚至好像歌[B哥]手唱[BD，]在我身边发生的事情那么亲切。,200510111523200772,韩国,2,200510,我看流行歌曲,85,70,67,75,84,372,C,
但我不以为然。,200510111523200803,韩国,2,200510,我看流行歌曲,75,75,63,65,74,342,C,
我们在学习、[BC，]工作当中压力很大时{CD以}听音乐可以减轻压力。,200510111523200815,韩国,2,200510,我看流行歌曲,65,80,49,54,62,298,C,
特别是这首歌的歌词很好。,200510111523200845,韩国,2,200510,我看流行歌曲,70,65,65,52,64,302,C,
最近的流行歌曲的内容是很有意思的，所以让我感觉到轻松的感觉{CJZR}。,200510111523201035,韩国,2,200510,我看流行歌曲,70,70,56,36,59,279,未参加,
我每天听他们的歌曲，而且看他们出来的所有的节目。,200510111523201072,韩国,2,200510,我看流行歌曲,55,75,56,61,69,301,未参加,
他们必[C]须要摆脱旧思[C]想、[BC，]旧观念[C]。,200510111523201119,韩国,2,200510,我看流行歌曲,65,50,58,54,64,272,未参加,
但是，也有一些人不喜欢流行歌曲，甚至还有人非常蔑视流行歌曲{CC歌典}。,200510111542201247,越南,2,200510,我看流行歌曲,65,70,56,54,52,283,C,
他说：“流行歌曲呀，都{CJX}商业性很强，怎么每个人都喜欢一样的歌，他们都上当了。,200510111523201262,韩国,2,200510,我看流行歌曲,55,60,44,38,67,245,未参加,
既然我们的生活离不开音乐，那就可以听听流行歌曲。,200510111523201274,韩国,2,200510,我看流行歌曲,65,65,65,48,69,296,C,
这样让我们觉得这首歌是很好听{CJsd}。,200510111523201275,韩国,2,200510,我看流行歌曲,65,70,58,50,64,293,C,
如果我们没有意识地{CC得}追求它们的话[BQ，]不知不觉有{CC1受到}很多大众文化里出现的问题。,200510111523201275,韩国,2,200510,我看流行歌曲,65,70,58,50,64,293,C,
我在美国的时候，每当[B但]和朋友在一起时，我们都会用音乐来放松{CC解[C]放}我们的心情，把一天上课的不快乐和郁闷用音乐来养心{CJba}。,200510111922101395,美国,1,200510,我看流行歌曲,85,75,72,56,77,357,B,
喜欢听就听也好。,200510111523101597,韩国,1,200510,我看流行歌曲,60,55,79,48,67,290,未参加,
我再听，非常注意听流行歌曲{CC4流歌}。,200510111523201855,韩国,2,200510,我看流行歌曲,60,50,25,26,32,173,未参加,
小孩在成长的过程总是会在模仿中学习。,200510919501150011,中国,1,200510,父母是孩子的第一任老师,85,90,86,74,94,425,A,
我想，只有在父母的指导下，孩子才可以做到这一点。,200510919523250013,韩国,2,200510,父母是孩子的第一任老师,75,90,89,60,85,393,B,
我十分认[F認]同[BQ“]父母是孩子的第一任老师[F師][BQ”]这[F這]个[F個]观点[F點]。,200510919919105304,加拿大,1,200510,父母是孩子的第一任老师,75,95,53,79,96,392,C,
我本身也是非常的喜欢它的。,200510205533200183,新加坡,2,200510,我看流行歌曲,65,80,86,65,91,375,C,
这件事反映从前人们的看法和生活。,200510209529200083,泰国,2,200510,我看流行歌曲,65,45,49,44,37,219,未参加,
我对这种流行歌曲感到很满意{CC如意}，因为这样可以{CJ+zy能}和地球[C]一起转[B传]。,200510520520250015,蒙古国,2,200510,我看流行歌曲,50,50,39,40,69,226,未参加,
他们可以说我们国家的代表{CJs}。,200510302523100017,韩国,1,200510,我看流行歌曲,55,60,58,63,57,274,未参加,
可是，有些人在网上非法地{CC的}复制音乐，非法地{CC的}复制mp3[BQ，]这种行为是非常不道德的，因为流行音乐是我们创造出来的，可是，再用我们的手去毁灭它，这样不好，所以，我们每个人都{CQ要}爱护流行音乐，保护流行音乐。,200510302523100053,韩国,1,200510,我看流行歌曲,85,75,77,48,84,361,C,
可是，不久我上了学也交了很多中国朋友他们帮助我很多忙{CLH}。,200510302523200064,韩国,2,200510,我看流行歌曲,60,50,53,22,40,205,未参加,
如中学生盲目地去痴迷歌星，就是我们所说的追星族。,200510302523200094,韩国,2,200510,我看流行歌曲,60,75,67,46,62,296,未参加,
还有歌词{CJX}像诗一样的。,200510302523200094,韩国,2,200510,我看流行歌曲,60,75,67,46,62,296,未参加,
所以我觉得流行歌曲弊大于利。,200510302523100108,韩国,1,200510,我看流行歌曲,60,60,56,50,62,270,未参加,
因为发生不好[C]事情的话，唱一首流行歌曲的话[BQ，]{CJ-zhuy心情}{CJ-zy就}比以前好得多了。,200510302523100117,韩国,1,200510,我看流行歌曲,60,65,39,36,42,225,未参加,
首先流行歌曲的反[L]复性。,200510302523100127,韩国,1,200510,我看流行歌曲,65,55,30,28,32,192,未参加,
随着社会的发展，生活水平提高了，现在每户人[L]家都有电视了，在电视[B社]上播出的那些流行歌曲，有些人特别喜欢听。[BC，],200510302523100154,韩国,1,200510,我看流行歌曲,70,80,83,48,79,350,C,
在共同歌唱时能互相认识，也可以感觉到一种亲密感[BQ，]使参[B赛]加活动的人们团结一致{CC一心同体}。,200510302523100183,韩国,1,200510,我看流行歌曲,80,55,63,54,87,325,C,
所以、为[F為]了了解中国[F國]的文化，我常常跟朋友们[F們]听中国最流行的歌。,200510302523100197,韩国,1,200510,我看流行歌曲,80,75,58,44,62,310,C,
我们不能只尊重自己喜欢的。,200510302523100219,韩国,1,200510,我看流行歌曲,65,65,72,48,77,311,C,
写歌曲的知道这一点，[BC、]所以才会各种各样的流行歌曲。,200510501529200076,泰国,2,200510,我看流行歌曲,70,65,51,38,50,260,未参加,
如果我喜欢他们的歌曲我就会去听[BQ，]但不会因为{WWJ},200510501630200113,西班牙,2,200510,我看流行歌曲,70,60,63,61,72,311,C,
当欢乐的时候，音乐可以{CC2更}增加你的兴奋度{CC3兴奋[F奮]}，使你更加{CC2更}体会到音乐是多么好听啊！,200510529529251006,泰国,2,200510,我看流行歌曲,50,55,42,67,32,225,未参加,
人类的生活是离不了音乐的。,200510540540100020,印度尼西亚,1,200510,我看流行歌曲,65,95,67,69,91,378,C,
有的人还非常的痴迷。,200510540540200040,印度尼西亚,2,200510,我看流行歌曲,70,80,53,40,57,290,未参加,
不过也有例外，我认识一对{CC位}夫妻是这样认识的，经过十五年的风风雨雨的人生中{CJZR}，[BC、]爱情一直[B真]都是很深的。{CJ-zhuy这},200505610627250008,瑞士,2,200505,最理想的结交方式,70,65,43,22,32,218,未参加,
两人若能彼此了解，并互相爱护与承诺照顾对方，无论通过{CC透过}什么结交方式，都能让彼此牵着对方的手，走过人生的每一段旅程。,200505680519250020,马来西亚,2,200505,最理想的结交方式,70,90,86,84,95,418,B,
世界上没有一个人没有父母的，他们跟我们从小生活在一起。,200509602801150008,澳大利亚,1,200509,父母是孩子的第一任老师,70,40,24,24,32,170,未参加,
当然比不上我故乡的生活，但北京的生活也不错。,200104124523200008,韩国,2,200104,一封写给父母的信,65,80,58,58,63,312,C,
但是我不知道这是怎么回事，回北京只过了一个月又想家{CQ了}。,200104124523200040,韩国,2,200104,一封写给父母的信,80,75,66,49,65,326,C,
还有我最近自己做饭。,200104124525200054,日本,2,200104,一封写给父母的信,60,60,44,42,65,253,未参加,
几天前，我打了电话[BQ，]但由于谁也没接电话[BQ，]因此我很担[B但]心。,200104124523200063,韩国,2,200104,一封写给父母的信,75,60,41,39,47,248,未参加,
因为北京的樱花没有日本的那么大。,200104124525200058,日本,2,200104,一封写给父母的信,70,75,38,37,45,254,未参加,
现在我比较担心您的身体。,200104124525200066,日本,2,200104,一封写给父母的信,65,75,27,51,47,252,未参加,
“为什么我来了中国呢？,200104124525200101,日本,2,200104,一封写给父母的信,70,50,33,42,47,225,未参加,
爸爸、[BC，]妈妈我来中国已经四年多了，我在这儿学到{CQ了}很多东西。{CJ-zhuy我},200104124523200252,韩国,2,200104,一封写给父母的信,60,65,58,18,54,238,未参加,
而且，独自生活更令我想念父母的无限的亲{CC爱}情。,200104124523200258,韩国,2,200104,一封写给父母的信,70,65,60,58,56,295,C,
要说一个的话，比往年{CC常年}压力大一点。,200104124523100302,韩国,1,200104,一封写给父母的信,70,65,58,63,61,303,C,
我很担心。[BC，],200104124523200329,韩国,2,200104,一封写给父母的信,70,55,38,39,56,242,未参加,
所以{CJ-sy想}借此机会给你{CJ-dy一个}惊喜[B戏]。[BC，],200104124523200359,韩国,2,200104,一封写给父母的信,75,85,77,47,63,340,C,
女儿不在爸爸、妈妈的身边，希望爸爸、妈妈能照顾好自己的身体。,200104124529200441,泰国,2,200104,一封写给父母的信,85,90,68,82,85,406,B,
我需要工作的经验{CJX}在您的公司。,199200204738100024,塞拉利昂,1,199200,一封求职信,,,0,0,0,0,未参加,
后来，{CQ在}去年，因为我家庭的特殊原因，{CJ-zhuy我}{CQ在}该公司辞职了。,199200008525100004,日本,1,199200,一封求职信,,,0,0,0,0,未参加,
我觉得这个想法真是对[C]的。,199604124525100069,日本,1,199604,如何看待“安乐死”,55,50,40,42,39,204,未参加,
活命是由天注定的，人不能随便改变。,199604123523200353,韩国,2,199604,如何看待“安乐死”,55,60,40,37,60,233,未参加,
丈夫的行动我想是{CJX}更不合理的。,199604123635100239,俄罗斯,1,199604,如何看待“安乐死”,65,55,19,35,31,187,未参加,
治{CC争}病，这[C]是人为了自己的生命应该做[B作]的事情。,199604123523100208,韩国,1,199604,如何看待“安乐死”,60,60,63,42,52,259,未参加,
但是还没有解决。,199604123523200036,韩国,2,199604,如何看待“安乐死”,65,45,58,42,39,228,未参加,
那么，“安乐死”到底行不行？,199604123922200215,美国,2,199604,如何看待“安乐死”,75,80,56,49,60,310,未参加,
所谓“植物人”已没有思考的能力，只能{CJ-sy靠}现代高科技{CC高科学}的医疗[B料]设备维持他的生命，而且没有希望能恢[B回]复健[B建]康。,199604124523100043,韩国,1,199604,如何看待“安乐死”,60,65,77,61,65,311,C,
为了一个病人的安乐，周围的人同意把他杀死。,199604123523200149,韩国,2,199604,如何看待“安乐死”,65,50,56,61,67,279,未参加,
为[F爲]什么[F麽]他们[F們]能和他们[F們]的同学[F學]、朋友相处[F處]得那么[F麽]融洽[BQ，]而回到家与[F與]父母沟[F溝]通却[F卻]往往有“代沟[F溝]”的情况[F況]产[F産]生呢？,199610801501200002,中国,2,199610,如何解决“代沟”问题,90,80,70,67,67,369,B,
特[C]别生活在西方国[F國]家，父母与[C]子女之间[F間]的代沟[F溝]更为[F爲]显[F顯]著。,199610802801100002,澳大利亚,1,199610,如何解决“代沟”问题,95,75,44,50,69,328,未参加,
是每一个人的问题，每一个人的责任。,199610802801100005,澳大利亚,1,199610,如何解决“代沟”问题,80,75,57,61,59,323,C,
发生什么事情的时侯，一家{CC1家庭[C]}人可以集合，讨论这件事情。,199610550523290019,韩国,2,199610,如何解决“代沟”问题,75,65,36,38,41,242,未参加,
我想父母与子[C]女，这两代之间存在的“代沟”问题呢，应该用谈话的方式来[F來]解[C]决[F決]才行。,199610550523190023,韩国,1,199610,如何解决“代沟”问题,60,70,36,50,43,244,未参加,
我不是不喜欢做菜，这样的看法我觉得没有道理。,199610550523290028,韩国,2,199610,如何解决“代沟”问题,65,55,65,42,53,262,未参加,
但是年轻人接受了西方的新教育而很重视合理的思考方式。,199610550523190075,韩国,1,199610,如何解决“代沟”问题,70,65,83,48,67,319,C,
晚辈也会有老年期，也会跟下代产生另一种代沟，所以晚辈应该以尊[B遵]敬心对待长者，而且好好地听长[C]者的话。,199610550523290088,韩国,2,199610,如何解决“代沟”问题,65,65,54,55,65,288,C,
现在我在新加坡学汉语大概一年了。,199603533525100066,日本,1,199603,由“三个和尚没水喝”想到的……,80,70,55,65,72,332,C,
那是在我小时候，由于家里姐妹多，父母都出外工作，因此，家里的杂务事，包括洗衣服，扫地，煮三餐[C]等等，都需[B须]由我们几姐妹做，{CJ-zhuy我们}经常为了些芝麻小事争吵。[BC，],199603533533200067,新加坡,2,199603,由“三个和尚没水喝”想到的……,90,85,66,70,77,385,B,
这个传说故事让我想起一件事情来。,199605104525100004,日本,1,199605,由“三个和尚没水喝”想到的……,80,65,49,56,65,303,C,
但是{WWJ},199605104525100049,日本,1,199605,由“三个和尚没水喝”想到的……,60,50,27,58,49,224,未参加,
，[BC。]就是怎么分配工作的{CD分配}问题。,199605104525100051,日本,1,199605,由“三个和尚没水喝”想到的……,65,55,58,83,68,311,C,
传说古时候，有一个和尚住在一座高山上的一座庙里，他每天都去山底下挑水喝，后来有一个和尚来了，于是他们俩一起去抬水喝。,199605104525200058,日本,2,199605,由“三个和尚没水喝”想到的……,65,60,35,45,58,246,未参加,
这一方法以外没有别的办法。,199605104523100097,韩国,1,199605,由“三个和尚没水喝”想到的……,60,65,21,54,51,234,未参加,
又过了{CJ-dy一段}时间，已经没有了{CJX}水，三个人都一动不动地希望别人去山下抬水，可是谁去山下呢？,199605104523200115,韩国,2,199605,由“三个和尚没水喝”想到的……,70,55,63,63,54,289,C,
第二个和尚提[B题]了别的方法，就是最健康的和尚去山下抬水，看起来第二个和尚很瘦[BQ，]脸色也很苍[B疮]白。,199605104523200169,韩国,2,199605,由“三个和尚没水喝”想到的……,55,50,46,49,30,209,未参加,
因此，很多{CC复数}人之间很容易产生依赖的感情。,199605104525200180,日本,2,199605,由“三个和尚没水喝”想到的……,65,60,58,60,68,294,C,
我从来没过{CC搞}过集体{CC集团}生活，可是这样的情[C]况下，最好{CJX}我听妈妈说的话。,199605104523200203,韩国,2,199605,由“三个和尚没水喝”想到的……,65,55,41,35,37,215,未参加,
我在理解这短文过程中同时得到了一个教训：[BC，]要做某事必须得{CQ从}长远{CC长期}来看[BQ，]否则将会有不好的后果。,199605104525200225,日本,2,199605,由“三个和尚没水喝”想到的……,55,60,55,56,51,258,未参加,
随着社会的发展人越来越增多了。P},199605104501100237,中国,1,199605,由“三个和尚没水喝”想到的……,80,55,46,51,56,274,未参加,
可是，说起来容易，做起来难。,199605104523200367,韩国,2,199605,由“三个和尚没水喝”想到的……,65,60,55,58,46,267,未参加,
我买了T恤，知道了故事以后，{CJ+zhuy我}反省自己{CJX}了。,199605104525200375,日本,2,199605,由“三个和尚没水喝”想到的……,65,70,77,60,80,338,C,
每个人都为了得到高工资而拼[F拚]命干活。,199605550523290001,韩国,2,199605,由“三个和尚没水喝”想到的……,90,90,88,79,100,445,A,
”[BC，]当时我很生气{CD了}，但鸡[F鷄]已[B巳]飞了蛋[C]也打了，没办[C]法只把礼物好好儿包装之后送给父母[C]。,199605550523290026,韩国,2,199605,由“三个和尚没水喝”想到的……,75,65,52,65,65,309,C,
我看完这篇短文后，突然想起了我国60年代末。,199605550523290078,韩国,2,199605,由“三个和尚没水喝”想到的……,65,65,74,83,70,341,C,
”他们争论了很长时间，正好有一个农民走过来，听到他们在吵的事，于是就告诉他们：[BC，]“你们俩[B两]住在一起，应该互相帮助，就这样吧！,199605529529250142,泰国,2,199605,由“三个和尚没水喝”想到的……,80,80,66,70,75,363,B,
这种现象是不可忽视{CC无视}的。,199605550523290080,韩国,2,199605,由“三个和尚没水喝”想到的……,65,65,49,47,56,266,未参加,
我还记得，每天上学的时候妈妈就给我很多好吃东西让我带到学校去。,200110540540250033,印度尼西亚,2,200110,我的童年,70,70,44,32,42,246,未参加,
早上醒来后，刷了牙，吃了早餐，就邀集{CD了}一位赌友来我们家集赌。,200110540540150056,印度尼西亚,1,200110,我的童年,70,85,55,54,90,346,C,
就因为这样，下午时分，我开始头疼了，先是昏沉沉，[BC；]后来身体开始微热，但我不以为然，也没告诉父母。,200110540540250111,印度尼西亚,2,200110,我的童年,70,80,58,61,83,342,C,
在生活漫长[F長]的岁[F歲]月里[F裡]，老人家都为了孩子的成长[F長]，辛苦养[F養]活我们[F們]一家人是很不容易的一件事。,200110540540150125,印度尼西亚,1,200110,我的童年,70,85,30,37,88,302,未参加,
我们住在巷里，和印尼居民混杂住在一个村，天真烂漫的儿时是不分种族区别或贫富贵贱[B溅]{CJsd}[BQ，]只要是有游戏可闹可玩就乐了！,200110540540250148,印度尼西亚,2,200110,我的童年,70,85,58,54,88,347,C,
她除了做生意以外，还有一个养猪场。,200110540540250157,印度尼西亚,2,200110,我的童年,70,85,79,63,85,374,C,
因此对于做{CC1做为}一位表达力强的导游，我有信心能胜任。{CP此外{CC除此},199312533533200045,新加坡,2,199312,一封求职信,90,90,76,80,94,428,A,
祝安×××谨启[F啟],199312533519200070,马来西亚,2,199312,一封求职信,95,80,50,69,85,375,C,
我是×××，今年26岁。[BC.],199312533533200081,新加坡,2,199312,一封求职信,95,80,67,69,82,389,B,
我姓名是××，[BC。]1968年9月生在北京，[BC。]女，[BC。]今年25岁。,199312123525200208,日本,2,199312,一封求职信,60,55,53,43,39,231,未参加,
英语在本国是第一门外语，所以我也讲得还[C]可以。,199312124604100311,奥地利,1,199312,一封求职信,80,65,60,72,59,325,C,
我对社会，家庭也有一些经[C]验。,199312123523200928,韩国,2,199312,一封求职信,55,65,46,34,39,222,未参加,
我认为父亲是家庭的支柱{CC主柱}。,199412123520100046,蒙古国,1,199412,记我的父亲,60,65,62,53,61,284,未参加,
我的父亲是一个高中的老师。,199412123525200039,日本,2,199412,记我的父亲,55,80,60,48,51,280,未参加,
他常在吃饭的桌子上，训斥{CC诉骂}自己的三个孩子，那时我们肚子不太舒服。,199412123523200053,韩国,2,199412,记我的父亲,65,85,36,42,61,279,未参加,
那么，我为什么有这么多虫牙呢？,199412123523200110,韩国,2,199412,记我的父亲,60,55,44,42,41,223,未参加,
我现在在国外生活，[BC。]经常想起父亲。,199412123525200106,日本,2,199412,记我的父亲,50,50,46,57,51,232,未参加,
可是对我来说，好象一只{CC匹}龟一样{CD的}[BQ，]他也是个好父亲。,199412124525100012,日本,1,199412,记我的父亲,65,55,60,50,53,265,未参加,
因为母亲身体不大好，不能劳累{CJ+zxy地工作}，因此家里的负担都由父亲一个人承担{CC负责}。,199412124529200027,泰国,2,199412,记我的父亲,95,75,60,46,61,332,C,
