错句,作文编码,国籍,性别,考试时间,作文题目,口试分数,作文分数,听力分数,阅读分数,综合分数,总分,证书
离婚并不代表是一种不道德行为，如果感情已经破裂，双方为了面子问题，而不敢提[B题]出离婚，是很痛苦{CQ的}一件事情，每天生活在吵架中度[B渡]过{CJZR}，对家人、[BC，]对孩子、[BC，]对自己都不公平。,200103533533250004,新加坡,2,200103,我对离婚问题的看法,75,75,70,21,50,281,未参加,
童年，相信每一个人都有不同的童年，今天就让[F讓]我來回忆[F憶]一下。[BC，],200109529529251008,泰国,2,200109,我的童年,70,70,70,61,83,342,C,
我是父母亲的长女，对于我要的一切，可说是，要风得风，要雨得雨。,200103680519201618,马来西亚,2,200103,我的童年,90,85,56,60,76,364,C,
毕业以后我已经决定了跟一个在中国认识的法国朋友回国。,200104124631200365,希腊,2,200104,一封写给父母的信,80,90,60,61,65,351,C,
当时，我早就想和教皇见见面{CC4见见面面}、握握手{CQ了}。[BC，],200105610616150201,德国,1,200105,我的一个假期,80,80,57,49,83,341,未参加,
我再次对你们的关心及帮助表示深切的感谢。,200105550523150002,韩国,1,200105,一封写给父母的信,70,65,68,56,79,324,C,
您最近过得怎么样？,200105550523250008,韩国,2,200105,一封写给父母的信,70,70,58,42,61,289,C,
爸爸在世的时候，我们家不太富有，不过爸爸去世{CC逝世}以后，我的家更穷了。,200105550523250008,韩国,2,200105,一封写给父母的信,70,70,58,42,61,289,C,
因为5月被称为家庭{CD的}月，而且这个星期二就是父母节。,200105550523250040,韩国,2,200105,一封写给父母的信,70,70,66,63,56,313,C,
我真羡慕[Pxiànmù]他们，我不在爸妈的身边，所以不能给你们花的现实让我感到遗憾。,200105550523250040,韩国,2,200105,一封写给父母的信,70,70,66,63,56,313,C,
周围的人{CD对}爸爸、[BC，]妈妈{CJX}常常问我的就业情况[B兄]，[BC。]那时候你们的心里[B理]肯定不踏实。,200105550523250046,韩国,2,200105,一封写给父母的信,70,65,52,61,56,290,C,
妈妈说大姐结婚的时候跟小姐结婚的时候的你的感觉都不一样。,200105550523250295,韩国,2,200105,一封写给父母的信,80,70,47,61,42,290,C,
你们好！,200105550523250341,韩国,2,200105,一封写给父母的信,70,55,38,39,49,235,未参加,
现在我不能跟您说，以后，我肯定成为一个让别人羡[Pxiàn]慕[B目]的{CD您}女儿[F兒]，但我可以说我{CQ会}努力成为一个不愧对{CC2愧}您的好女儿[F兒]，我一定努力的。,200105550523250346,韩国,2,200105,一封写给父母的信,70,70,49,68,61,306,C,
因为怎么想也想不通，我们最后请求中国国际旅游社的帮忙才能从大同出来，不过不是直接到西安而是{CC2而}先到太原。,200105212540200001,印度尼西亚,2,200105,我的一个假期,80,80,80,70,74,376,B,
您身体{CJX}保重。,200105550523150530,韩国,1,200105,一封写给父母的信,70,60,68,63,51,297,C,
”正好那时候有一位年青人也是跟我同路的。,200105212540200041,印度尼西亚,2,200105,我的一个假期,75,75,65,63,48,316,C,
以后可能结婚。,200105224525200026,日本,2,200105,我的一个假期,70,70,52,54,46,280,C,
所以没有力气做什么。,200105201525200037,日本,2,200105,我的一个假期,70,70,67,70,61,326,C,
于是我突然弯下腰去大叫：好疼，好疼，我的脚崴了！,200105215525200003,日本,2,200105,我的一个假期,75,80,65,58,72,341,C,
一个和尚在一个高山上的一座庙里一个人的时候，他没办法{CQ只好}到山底下自己挑水喝。,200105109540200490,印度尼西亚,2,200105,由“三个和尚没水喝”想到的……,75,70,54,51,70,309,未参加,
由于怕苦、[BC，]怕麻烦，三个和尚都把应该自己做的事放在别人的身上。,200105109525200508,日本,2,200105,由“三个和尚没水喝”想到的……,70,65,54,51,66,292,未参加,
不要三个人这么多{CC都}人一起去，[BC。]要{CC1于是}决定去挑水的顺序。,200105109525200597,日本,2,200105,由“三个和尚没水喝”想到的……,65,70,61,55,57,294,C,
可依[B以]我看，现在我们的行为跟那个传说中的三个和尚很像。,200105109525100705,日本,1,200105,由“三个和尚没水喝”想到的……,85,65,66,75,77,357,C,
你一个人去吧！,200105109525100724,日本,1,200105,由“三个和尚没水喝”想到的……,65,60,57,71,82,318,未参加,
我不想去。,200105109525200782,日本,2,200105,由“三个和尚没水喝”想到的……,75,70,70,69,59,332,C,
对吧，[BC？]空和尚？,200105109525100793,日本,1,200105,由“三个和尚没水喝”想到的……,70,55,59,64,61,293,C,
这样的话，我们相信什么困难也{CQ能}克服。,200105109525200856,日本,2,200105,由“三个和尚没水喝”想到的……,70,70,59,80,68,335,C,
那时[F時]候，没[F沒]有工作、没[F沒]有收入的妻子怎么[F麼]办[F辦]呢？,200106570922250001,美国,2,200106,如何看待“妻子回家”,70,85,66,65,70,348,C,
但又多一个人时就有了你做的多[BQ，]他又不做了，我出了力，他去偷懒了，[BC。]也就斤斤计较起来了。,200102522522250007,缅甸,2,200102,由“三个和尚没水喝”想到的……,90,85,81,75,88,416,B,
我性格上极大的变化使许多老师，甚至我的父母都感到惊讶。,200203533533250022,新加坡,2,200203,记对我影响最大的一个人,90,85,71,66,77,386,B,
例如使不想做的人勉强做，只不过伤害他而已。,200205204525100002,日本,1,200205,如何看待“安乐死”,65,60,63,51,44,266,未参加,
人对生命这个东西也有不同的看法了。,200205212540200021,印度尼西亚,2,200205,如何看待“安乐死”,80,65,80,60,75,348,C,
这是我对发生于[F於]一九九四年初“安乐死”事件的一种感叹！,200205209519100027,马来西亚,1,200205,如何看待“安乐死”,95,90,94,76,87,441,A,
我在电视上看过，荷兰已承认[F認]安乐死。,200205201525200021,日本,2,200205,如何看待“安乐死”,65,70,77,65,68,331,C,
要不然病人和照顾的人都累死。,200205201525100170,日本,1,200205,如何看待“安乐死”,75,65,16,49,51,243,未参加,
人老了，接受新事物、新思想没有那么快。,200210801801250005,澳大利亚,2,200210,如何解决“代沟”问题,75,90,76,78,91,404,B,
对老人呢？,200210529529251019,泰国,2,200210,如何解决“代沟”问题,70,65,42,60,0,223,未参加,
并[F並]打下{CC种下}多方面的基础，假使{CC既使}与他们处[F處]於朋友关系，他们就会公开的聊天，无私地将自己的问题提出并寻求{CC求寻}正确的答案。,200210540540150038,印度尼西亚,1,200210,如何解决“代沟”问题,70,85,73,73,70,363,B,
现[F現]今世界交流广泛，竟争[F爭]激烈，思维方式差异很大，[BC。]{CJ-zhuy这些}往往造成不同的思想观[F觀]念。,200210540540250132,印度尼西亚,2,200210,如何解决“代沟”问题,65,60,48,49,59,264,未参加,
我认为面对挫折的时候，如果有这种{CD的}积极态度，克服困难的可能性肯定比较高。,200205109801200398,澳大利亚,2,200205,如何面对挫折,90,85,51,58,64,345,C,
我不多说了，暂且搁笔，下次再聊。,200205680519250004,马来西亚,2,200205,一封写给父母的信,85,85,81,69,86,401,B,
有时[F時]学院举办一些活动如：文娱晚会、院庆等活动，我也必须参与。,200205680519250009,马来西亚,2,200205,一封写给父母的信,75,85,70,71,78,372,B,
母亲[F親]对她的管教很严格，父亲[F親]就比较温和亲[F親]切。,200305533533250029,新加坡,2,200305,我最喜欢读的一本书,65,60,60,56,45,269,未参加,
我想应[F應]该[F該]让[F讓]更多的华[F華]人向他学[F學]习[F習]，才能让[F讓]华[F華]人站在世界的舞台，大展拳脚[F腳]{CD才是}。,200305533533250035,新加坡,2,200305,我最喜欢读的一本书,65,75,79,73,88,367,B,
每个国家学汉语是{CD很}热门。,200304131525200077,日本,2,200304,我学汉语是为了……,70,75,59,43,52,288,C,
可[BD，]我这样成绩不好的学生哪[B那]有资格去外国呢？,200304131525200136,日本,2,200304,我学汉语是为了……,60,65,41,32,29,210,未参加,
我在日本的时候，我不太喜欢日本。,200304131525100141,日本,1,200304,我学汉语是为了……,65,70,44,38,57,260,未参加,
从此我决定[BD，]去中国留学，无论如何也要学好汉语。,200304131525200181,日本,2,200304,我学汉语是为了……,70,70,50,54,46,278,未参加,
我仔细想如果我自己在完全没有声音的环境，那[B哪]会怎么样呢？,200305576525100002,日本,1,200305,静音环境对人体的危害,70,65,71,57,68,317,C,
不然的话，在这个日益发展，烦恼繁多的现代社会中，一直想不开，甚至会伤害你的身体。,200305576525200010,日本,2,200305,静音环境对人体的危害,70,65,74,82,88,365,C,
然后开始感觉到发慌。,200305576525100046,日本,1,200305,静音环境对人体的危害,65,60,38,52,57,255,未参加,
很久很久以前，在这个地球上还没有人类的时候，地球上就有声音。,200305576525200047,日本,2,200305,静音环境对人体的危害,70,80,74,87,88,389,B,
这个现象[D变]成了我们所讨论的一个热门话题之一。,200405109529201183,泰国,2,200405,吸烟对个人健康和公众利益的影响,90,80,74,58,73,370,B,
这种有关吸烟的规定引起许多人的反对。,200405204610200358,法国,2,200405,吸烟对个人健康和公众利益的影响,75,65,30,35,58,250,未参加,
还是不让在超市里，在小卖部或者在外边卖烟。,200405224520200036,蒙古国,2,200405,吸烟对个人健康和公众利益的影响,60,65,25,28,45,206,未参加,
所以我们不要交上不良少年。,200405522522150007,缅甸,1,200405,吸烟对个人健康和公众利益的影响,80,80,60,63,63,338,C,
其实[F實][BQ，]吸烟[BD，]不但不是潮流，而{CC1而且}是一种[F種]破坏[F壞]人体健康的可怕物质[F質]享受。,200405522522150016,缅甸,1,200405,吸烟对个人健康和公众利益的影响,85,85,74,74,82,395,B,
逐渐地走{CC送}到了不归之途。,200405522522250024,缅甸,2,200405,吸烟对个人健康和公众利益的影响,90,85,77,60,75,384,B,
还好现在我国政府有规定：[BC；]在公共场所里不可吸烟。{CD要是},200405522522250030,缅甸,2,200405,吸烟对个人健康和公众利益的影响,90,75,35,56,61,311,未参加,
对于个人健康来说，吸烟简直是有百害而无一利。,200405522522250032,缅甸,2,200405,吸烟对个人健康和公众利益的影响,90,95,97,95,100,475,A,
[BD…]吸烟不仅对抽烟者的健康有害，而且还会影响到周围的人的健康。,200405209542200052,越南,2,200405,吸烟对个人健康和公众利益的影响,65,60,60,47,58,273,未参加,
至于解决这个问题的可能性，我觉得并不大。[BC：],200405209633100068,意大利,1,200405,吸烟对个人健康和公众利益的影响,65,80,68,44,67,312,C,
现在得了肺[C]炎的人数量还很高，所以有很多城[B成]市不允许在公共场所抽烟。{CD如果},200405215542230091,越南,2,200405,吸烟对个人健康和公众利益的影响,80,70,44,61,70,315,未参加,
比如说，如果父母[C]打别人的时候，孩子看这样的情况，孩子认为我也可以打别人。,200505109525100248,日本,1,200505,父母是孩子的第一任老师,55,65,53,59,64,278,未参加,
我同意[C][BQ“]父母是孩子的第一任老师”的看法。,200505109525200581,日本,2,200505,父母是孩子的第一任老师,60,60,79,65,64,310,未参加,
我同意“父母是孩子的第一任老师”的意见。,200505109525200640,日本,2,200505,父母是孩子的第一任老师,75,70,69,58,59,320,C,
这对我的思想观念有些好处。,200505217525200233,日本,2,200505,父母是孩子的第一任老师,85,75,65,61,58,336,C,
我爸爸是又开朗[B郎]又大方的。[BC.],200505204525200431,日本,2,200505,父母是孩子的第一任老师,65,50,29,41,52,218,未参加,
每个父母有时候对付这些事情{CJX}觉得{CJ-zy很}麻烦，但是如果这时父母认真地听小孩子的要求，孩子能体会到[C]父母关心我，确认我可以做他们的孩子。,200505204525100500,日本,1,200505,父母是孩子的第一任老师,70,70,58,75,74,335,C,
上次和朋友去厦门的时候，把朋友寄存在{CC给}我{CQ这儿}的包我{CJX}丢了，所以{WWJ},200105205525200003,日本,2,200105,我的一个假期,75,60,72,68,74,335,C,
去年暑假，我很想买一套西装，我其他{CJX}没什么打算，那天上午就出去逛了很多百货商店{CC4百货店}，但就是找不到我喜欢的款式{CC样子}的套装。[BC，],200105205525200073,日本,2,200105,我的一个假期,70,80,75,65,74,354,C,
但是，在数学营[F營]，连在玩的时候也会想到数学，例如得到胜利的机会。,200110919919100003,加拿大,1,200110,我的一个假期,80,80,72,79,76,379,B,
本来{CC原来}根本不能得大奖。,200112576525200006,日本,2,200112,如何面对挫折,65,65,57,67,57,295,C,
但是她们在外也有教室，[BC。]所以忙得不得了。,200105271525200005,日本,2,200105,我的一个假期,65,75,70,65,70,332,C,
我们的旅游还{CJ-zy要}继续下去。,200105271525200027,日本,2,200105,我的一个假期,65,70,60,68,63,312,C,
我春节这一天正好在丽江，我跟纳西族一起过{CQ的}春节。,200105204525200001,日本,2,200105,我的一个假期,65,80,70,68,70,341,B,
不{CC没}努力。[BC，],200105204525200013,日本,2,200105,我的一个假期,65,70,60,56,50,287,C,
这次旅游给我留下了很多印象[B像][BQ，]并且{CJ-zhuy这}我第一次跟少数民族接触的旅游{CJs}。,200105204525200048,日本,2,200105,我的一个假期,70,75,60,54,55,303,C,
我{CJ-zy只能}趁{CD着}比较长的假期{CD才能}回家。,200105204525200091,日本,2,200105,我的一个假期,70,65,80,72,85,358,C,
{CP这次跟五年前不一样，我有目标，想在这儿工作。,200105204525200121,日本,2,200105,我的一个假期,65,65,57,63,57,291,C,
这样的。,200105550523250082,韩国,2,200105,一封写给父母的信,65,65,47,63,51,275,未参加,
我从明天到后天不在家。,200105550523250086,韩国,2,200105,一封写给父母的信,70,65,47,32,40,240,未参加,
你们带着很丰盛的吃的东西，乘{CC骑}公共汽车啊，乘{CC骑}火车啊，只要看你的儿子，你们走了很远的路。,200105550523150101,韩国,1,200105,一封写给父母的信,70,65,49,54,56,280,C,
”你们睡觉的时候也想我，“我们的孩子好好儿地睡吗？,200105550523150101,韩国,1,200105,一封写给父母的信,70,65,49,54,56,280,C,
过几年后，我们都在社会上已经认定吗{CJ？}。,200105550523150112,韩国,1,200105,一封写给父母的信,80,65,60,56,58,307,C,
我一切都比较顺利[B理]。,200105550523150132,韩国,1,200105,一封写给父母的信,75,90,82,77,72,390,B,
可是父母的爱比不上{CJX}别的爱。,200105550523250141,韩国,2,200105,一封写给父母的信,75,75,49,56,58,303,C,
所以我跟我的同学××一起旅行了。,200105550523250168,韩国,2,200105,一封写给父母的信,65,65,27,32,61,234,未参加,
但这[F這]只是空想而已。,200105550523150191,韩国,1,200105,一封写给父母的信,65,65,71,77,61,323,C,
5月24日我给你打电话。,200105550523150249,韩国,1,200105,一封写给父母的信,70,80,41,47,51,279,未参加,
妈妈！,200105550523150303,韩国,1,200105,一封写给父母的信,0,60,27,32,47,158,未参加,
我从小至今一直爱你。,200105550523150304,韩国,1,200105,一封写给父母的信,70,70,66,51,56,301,C,
还帮我料理{CC条理}一切麻烦事，我是非常感谢您们{CJs}。,200105550523150319,韩国,1,200105,一封写给父母的信,65,55,63,63,81,309,C,
祝[B主]你平安。,200105550523250314,韩国,2,200105,一封写给父母的信,70,60,49,44,40,248,未参加,
可现在我又告诉[B许]你我想考研究生。,200105550523250370,韩国,2,200105,一封写给父母的信,65,70,47,25,51,244,未参加,
我有信心你们的老年过得很愉快{CJjy}。,200105550523250371,韩国,2,200105,一封写给父母的信,75,70,60,58,74,326,C,
好了，[BC。]这里不多写了。,200105550523250395,韩国,2,200105,一封写给父母的信,75,70,63,51,67,315,C,
你们是我的父母，{CD所以}我没注意到你们也在老。,200105550523250404,韩国,2,200105,一封写给父母的信,70,70,85,63,63,339,C,
也许……我恨[B狼]你了吧。,200105550523150418,韩国,1,200105,一封写给父母的信,65,65,58,68,76,316,C,
天气越来越热，请注意身体{CD健康}。,200105550523250433,韩国,2,200105,一封写给父母的信,75,70,55,68,56,313,C,
我通过这次考试{CJ+zhuy我}必须向你们{CJX}要说：[BC，]“对不起[BQ！]”{CD反正}我爱你们，请原谅我。,200105550523250459,韩国,2,200105,一封写给父母的信,60,65,41,49,61,259,未参加,
我们都很感谢你们{CD了}。,200105550523250485,韩国,2,200105,一封写给父母的信,70,70,44,47,58,277,未参加,
爸爸、妈妈[BQ，]你们好好儿过日子吧。,200105550523150488,韩国,1,200105,一封写给父母的信,65,65,33,54,40,241,未参加,
我这个儿子单身到论山建阳大学学习，已快要四年了。,200105550523150521,韩国,1,200105,一封写给父母的信,65,65,52,28,51,245,未参加,
不想打了。,200105206525100024,日本,1,200105,我的一个假期,65,65,62,63,52,291,C,
我一般用打工挣下来的钱投在旅行费{CJba}，假期的前半{CQ部分}在某一个公司打工。,200105206525100047,日本,1,200105,我的一个假期,60,55,44,65,52,257,未参加,
我自己也体会过这种情况。,200105109610200059,法国,2,200105,由“三个和尚没水喝”想到的……,80,70,73,71,84,368,B,
我当时也觉[B决]得这是一件理所当然的事情。,200105109610200059,法国,2,200105,由“三个和尚没水喝”想到的……,80,70,73,71,84,368,B,
我在日本时，我们三个人的关系正是如此，形成“三个和尚没水喝[B渴]”的状况。,200105109525100114,日本,1,200105,由“三个和尚没水喝”想到的……,65,80,59,73,75,340,C,
使和尚伤脑筋，不知所错[B借]。,200105109525200333,日本,2,200105,由“三个和尚没水喝”想到的……,70,60,66,58,75,314,C,
不是，我觉得每个人都想这样的。,200105109525200334,日本,2,200105,由“三个和尚没水喝”想到的……,65,70,68,55,82,326,C,
他们为了喝水一次一次地到山底下打水，由于人太多，怕麻烦谁也不想去打水。,200105109525100385,日本,1,200105,由“三个和尚没水喝”想到的……,65,75,36,24,44,231,未参加,
这是一个非常难过的事吧。{CJ+zhuy我},200105109525100415,日本,1,200105,由“三个和尚没水喝”想到的……,65,55,39,60,59,260,未参加,
发达国家，尤其是城市里，我们往往看见这些场面。{CJ-zhuy这},200105109525200430,日本,2,200105,由“三个和尚没水喝”想到的……,65,60,32,49,68,257,未参加,
不过，当人们{CD来}住在一起的时候，就会发现每个人的能力，每个人的能力会不一样，有的适合这项工作，有的做{CC跟}这项{CJ-zxy工作}不合适，所以每个人的工作，责任，地位，收入就不同了。,200105109529200530,泰国,2,200105,由“三个和尚没水喝”想到的……,60,65,45,31,53,237,未参加,
妹妹对妈妈说：“[BC，]我从来没打扫过自己的房间，无法整理{CC管理}自己的房间了。,200105109525100558,日本,1,200105,由“三个和尚没水喝”想到的……,65,65,48,64,57,283,C,
而绝[B决]不是来这个办法生意也一定不成功{CJ？}，[BC、]因为这个办法，已经很多人知道的事{CJs}，没有什么新鲜{CQ的}。[BC、],200105109525100623,日本,1,200105,由“三个和尚没水喝”想到的……,60,55,48,53,59,256,未参加,
但是谁也不满意{CC3满足不了}这个办法，一个人又一个人离开这座庙{CD里}。,200105109525200702,日本,2,200105,由“三个和尚没水喝”想到的……,65,65,39,58,66,277,未参加,
我认为家庭幸福的人在事业上一定得到成功。,200109684542250002,越南,2,200109,我对离婚问题的看法,80,70,40,38,50,268,未参加,
世界上有很多愿意活下去的人，[BC。]可是其中也有不能活下去的人。,200205217525200101,日本,2,200205,如何看待“安乐死”,65,70,38,49,65,273,未参加,
从这样的角度来看，我个人认为“安乐死”还是要慎重地讨论到底。,200205205525200045,日本,2,200205,如何看待“安乐死”,75,70,66,60,84,344,C,
安乐死是在{CC有}自己的同意下[BD，]做安乐死的。,200205205525200051,日本,2,200205,如何看待“安乐死”,70,65,66,58,42,287,C,
我认为安乐死是可[D以]取的。,200205205525100086,日本,1,200205,如何看待“安乐死”,65,65,33,70,65,282,未参加,
死{CD的}以前，{CJ-zhuy病人}亲笔填写一张许可安乐死的表格{CC2纸}。,200205206525100007,日本,1,200205,如何看待“安乐死”,65,65,33,51,61,259,未参加,
我想没有，那么“安乐死”也是一种解脱痛苦的办法，虽然这个{WWJ},200205206525200008,日本,2,200205,如何看待“安乐死”,70,65,58,65,68,312,C,
首先，我们要知道谁可以决定，谁有实行的权利{CC权限}。,200205206525100018,日本,1,200205,如何看待“安乐死”,75,70,44,70,61,309,未参加,
那里有我的遗[D言]书。,200205206525100058,日本,1,200205,如何看待“安乐死”,65,65,52,49,46,261,未参加,
其实“安乐死”也是世界上正辩论着的热门话题。,200205332540200001,印度尼西亚,2,200205,如何看待“安乐死”,70,90,69,70,80,372,C,
那怎么解决这样的问题才好？,200209550523150012,韩国,1,200209,如何解决“代沟”问题,65,65,63,57,50,284,C,
前一辈的人们只知道往前走没闲[C]顾及{CC2顾[C]}休闲[C]什么的。,200209550523250050,韩国,2,200209,如何解决“代沟”问题,70,70,94,76,90,388,C,
他的态度并不是错的，只是跟我们的{CC3我}不一[L]样{CD的}，所以说“差异”{CJy}。,200209550523250078,韩国,2,200209,如何解决“代沟”问题,60,60,54,54,70,280,未参加,
两代人的代沟要解[C]决的话，应该两代人在一起多说多听。,200209550523250088,韩国,2,200209,如何解决“代沟”问题,65,65,60,52,62,288,C,
现代也是如此，在两代人之间产生{CC发生}的“代沟”[BQ，]让家庭成员{CC家族人员}之间产生许多问题。,200209550523250116,韩国,2,200209,如何解决“代沟”问题,65,70,66,79,76,342,C,
那么如何解决这“代沟”问题呢？,200209550523250122,韩国,2,200209,如何解决“代沟”问题,60,65,57,45,54,264,未参加,
好，你们也试一试吧。,200209550523250138,韩国,2,200209,如何解决“代沟”问题,65,65,33,54,40,241,未参加,
所以，要解决代沟的问题父母应在孩子的立场理解孩子们，同样{CC相反}孩子们一定理解自己的父母，尊重自己的长辈。,200209550523150144,韩国,1,200209,如何解决“代沟”问题,60,70,48,64,52,279,未参加,
那“代沟”问题怎样解[C]决呢？,200209550523250168,韩国,2,200209,如何解决“代沟”问题,60,60,57,59,56,274,未参加,
外国有一个人说：“韩国是东方礼[C]仪[B义]之国。,200209550523250182,韩国,2,200209,如何解决“代沟”问题,70,65,57,67,56,301,C,
如果说出来的话[BQ，]父母一点儿也不考虑{CC2想}{CJ+buy过}子女的想法，就骂他们“都不行”。,200209550523250187,韩国,2,200209,如何解决“代沟”问题,60,60,66,64,38,270,未参加,
首先，父母跟孩子们两方之间应有很多谈话的时间。,200209550523250214,韩国,2,200209,如何解决“代沟”问题,80,75,72,86,72,376,B,
因此{CC再说}，每{CQ个}时代存在“代沟”是理所当然的。,200209550523250216,韩国,2,200209,如何解决“代沟”问题,65,65,63,62,56,295,C,
我们生长的条件，教[C]育程度都比{CC1比不上}他们好。,200209550523250228,韩国,2,200209,如何解决“代沟”问题,70,60,54,52,48,269,未参加,
还有现代家庭只住两代{CQ人}，只有一个孩子，所以子女只知道自己。,200209550523250247,韩国,2,200209,如何解决“代沟”问题,60,60,27,54,34,217,未参加,
21世纪前就{CJ+zy稍微}存在的，而现在科技发达，人们的生活不断提高，年轻人就不断地追求时代。,200209550501250294,中国,2,200209,如何解决“代沟”问题,65,65,57,54,64,289,C,
那么如何解决代沟问题呢？,200209550523250291,韩国,2,200209,如何解决“代沟”问题,65,65,69,71,58,312,C,
然后，需要的是找两代人共同的兴趣。[BC.],200209550523150316,韩国,1,200209,如何解决“代沟”问题,65,70,54,64,50,289,C,
有时，因父子之间的思想差异而{CD而}产生了矛盾，甚至会产生更厉害的问题。,200209550523250773,韩国,2,200209,如何解决“代沟”问题,65,60,42,67,60,277,未参加,
年青人和老[C]年人的文化不一样。,200209550523150799,韩国,1,200209,如何解决“代沟”问题,65,60,48,49,50,255,未参加,
我们时代的人认为{CC2想}重要的是什么样儿的生活。,200209550523250794,韩国,2,200209,如何解决“代沟”问题,70,60,36,42,50,243,未参加,
不说的话，我们常常忘{CQ了}怎么爱彼此{CC相互}。,200209550523250810,韩国,2,200209,如何解决“代沟”问题,60,65,39,47,52,246,未参加,
终于他们之间渐渐地失掉共同对话主题。,200209550523250850,韩国,2,200209,如何解决“代沟”问题,70,60,54,52,48,269,未参加,
而孩子们的脑[C]子里有“应该可以吧。,200209550523150860,韩国,1,200209,如何解决“代沟”问题,65,65,60,57,44,275,未参加,
