错句,作文编码,国籍,性别,考试时间,作文题目,口试分数,作文分数,听力分数,阅读分数,综合分数,总分,证书
，这是{CJX}虽然身体很辛苦{CC艰苦}，可是一次抬水{CJ-zy能}轻松一个星期。,199605550523190070,韩国,1,199605,由“三个和尚没水喝”想到的……,60,65,49,65,61,283,未参加,
最后[C]第二和尚就说[F説]：[BQ“]假若我们还是这样推下去，到头[F頭]大家都会死掉的。,199605529529150165,泰国,1,199605,由“三个和尚没水喝”想到的……,80,65,52,47,56,288,未参加,
我那时也很用功，成绩一向优异。,200110540540250052,印度尼西亚,2,200110,我的童年,75,90,63,77,85,384,B,
1960年期间，爸爸准备乘接侨船回国。,200110540540250052,印度尼西亚,2,200110,我的童年,75,90,63,77,85,384,B,
增加了我的集休生活的经验并{CC和}{CQ使我}吸收了很多课外知识。,200110540540250082,印度尼西亚,2,200110,我的童年,75,85,74,47,92,366,C,
年龄和我相仿的别家孩子还可以尽情游玩，无忧无虑的时候，我却要帮妈妈照顾弟妹们。,200110540540250157,印度尼西亚,2,200110,我的童年,70,85,79,63,85,374,C,
本人业余曾当过义务工作者，曾到老人院和孤儿院帮忙。[BC.],199312533533200015,新加坡,2,199312,一封求职信,80,85,60,61,82,362,C,
牛津路新加坡邮区1234李文快乐家庭旅游公司新加坡本人从报章上得知贵公司的招聘启事而有意求得导游一职。,199312533533200030,新加坡,2,199312,一封求职信,75,70,69,67,78,348,C,
本人对招聘导游很有兴趣。,199312533533200055,新加坡,2,199312,一封求职信,80,75,57,63,85,351,C,
于一九八一年毕[F畢]业于南洋美专。,199312533533200076,新加坡,2,199312,一封求职信,85,65,64,72,75,352,C,
谢谢。,199312533533200128,新加坡,2,199312,一封求职信,90,80,62,72,75,374,B,
顺祝公安！,199312533533100140,新加坡,1,199312,一封求职信,90,75,74,74,100,407,B,
我很情愿在你们公司工作，[BC.]如果我被录取的时候，一定努力工作。[BC.],199312104523100016,韩国,1,199312,一封求职信,60,55,57,37,52,242,未参加,
我等贵公司的联系。,199312123525200102,日本,2,199312,一封求职信,55,70,50,74,80,313,未参加,
中国也{CQ因为}有工作的关系来过两次。,199312124525200240,日本,2,199312,一封求职信,55,75,60,56,68,299,C,
但我希望在导游方面{CJX}能工作。,199312124525100244,日本,1,199312,一封求职信,65,80,76,67,87,363,B,
我的理想是{CQ在}{CQ像}贵公司[B可]这样的[L]{CJ+sy搞}旅[C]游公司[B可]工作。,199312123523100501,韩国,1,199312,一封求职信,65,50,57,41,36,230,未参加,
我来介绍自己的简历。,199312123525100605,日本,1,199312,一封求职信,50,55,27,56,48,214,未参加,
与此同时，本人曾翻译过不少{CQ关于}海外重要人物以及某些公司的代表团{CQ的书籍}，对这一方面的经验比较多一些。,199410550523101902,韩国,1,199410,一封求职信,80,65,62,54,82,332,C,
我觉得爸爸说的{CJ+zxy意思}是对的。,199412123523100004,韩国,1,199412,记我的父亲,45,90,39,38,35,234,未参加,
爸爸喝酒时{WWJ},199412123523200110,韩国,2,199412,记我的父亲,60,55,44,42,41,223,未参加,
但这并不意味着他不乐于助人。,199412123635200109,俄罗斯,2,199412,记我的父亲,85,85,86,61,80,392,B,
他父亲也没有什么职业，要不要把孩子们送给别人养？[BC。],199412124519100038,马来西亚,1,199412,记我的父亲,60,55,52,34,32,214,未参加,
到我交女朋友时，我一直感受到她的关心和支[Pzhí]持[P待]。,199412104533100687,新加坡,1,199412,记对我影响最大的一个人,75,60,70,36,57,284,未参加,
她的教学方法很独特的。,199412104523200680,韩国,2,199412,记对我影响最大的一个人,75,70,78,65,61,338,C,
所以我现在最大的愿望是早点儿找到工作[BQ，]让她放心。,199412104525100101,日本,1,199412,记对我影响最大的一个人,70,70,54,63,65,310,C,
爷爷对他的孙子们怀着很大的期待，[BC。]所以从我和哥小的时候起{CQ就}教我们。,199412104523200103,韩国,2,199412,记对我影响最大的一个人,60,60,68,53,65,288,未参加,
我来中国，已经一年多了。,199412104525100120,日本,1,199412,记对我影响最大的一个人,65,65,81,71,74,340,C,
饭店的服务员和出租汽车的司机教给我正确的汉语发音。,199409543525100206,日本,1,199409,学习汉语的苦与乐,85,75,52,68,59,332,C,
张老师，您安息吧！,199500533533200021,新加坡,2,199500,记对我影响最大的一个人,95,90,62,63,67,376,C,
父亲自幼丧父，身为长子，为了要让年老的母亲和年幼的弟妹有更好的生活，而自愿卖身到南洋。{CJ-zhuy父亲},199500533533200040,新加坡,2,199500,记对我影响最大的一个人,90,90,99,79,90,446,A,
尤其像{CC1好像}我{CQ这样}远离故乡的人被他招待到他家去，可以享受家庭的气氛。,199500533533100060,新加坡,1,199500,记对我影响最大的一个人,80,75,52,65,74,337,C,
我立志要向他学习，盼[C]望[C]将来也能在商界有有{CJcd}此名望[C]。,199500533533200088,新加坡,2,199500,记对我影响最大的一个人,80,90,91,63,72,391,B,
这都归功于王先生的用心{CJX}良苦。,199500533533100132,新加坡,1,199500,记对我影响最大的一个人,90,80,83,75,65,388,B,
这使{CC对}我真的产[F產]生了一种讨厌的眼光对我母亲[F親]{CJjy}，父亲[F親]与哥哥呢？,199500533540200138,印度尼西亚,2,199500,记对我影响最大的一个人,85,70,39,46,43,274,未参加,
以一国来说[C]，培[B倍]养人才是国强民富[C]的基本条件。,199500533533100146,新加坡,1,199500,记对我影响最大的一个人,95,80,89,87,82,429,A,
人情味儿，宗教[C]方面说[BQ，]人死的问题不是{CD一个}个人决定的。,199510550523200927,韩国,2,199510,如何看待“安乐死”,75,60,64,56,53,294,C,
我们生活目的[C]之{CD中}一是幸[C]福。,199510550523100930,韩国,1,199510,如何看待“安乐死”,60,70,24,33,35,207,未参加,
在这种情况[F況]{CQ下}，不单病患者痛苦，家人所承受的精神压力，财政上的负担只会一天比一天大，对活着的家人，实在不太公平。,199511543634100543,英国,1,199511,如何看待“安乐死”,80,90,57,60,84,366,C,
本人自认[F認]有能力胜[F勝]任贵[F貴]公司推销[F銷]员[F員]一职[F職]，且相信以本人多年来[C]所吸取{CC取吸}之经[C]验[C]，一定能有助于[F於]贵[F貴]公司业务发展。,199503680519200548,马来西亚,2,199503,一封求职信,85,95,76,77,84,413,B,
上学后我做过很多事。,199505550523200903,韩国,2,199505,记对我影响最大的一个人,75,65,41,50,49,267,未参加,
在泰国的汉语学习，随着{CC2在}新政府对汉语学习的开放，使得{CC到}垂死的汉语文化抬头。,199505529529100001,泰国,1,199505,学习汉语的苦与乐,60,85,40,48,64,286,未参加,
我[C]非常奇怪为什么中国人会说[C]泰语，后来才知道她[C]在[C]北大学过好几年泰语，现[C]在来泰国教汉语[C]。{CP这[C]时候，我刚[C]下决心[C]了要学什么，终于我[C]{CD就},199505104529200020,泰国,2,199505,记对我影响最大的一个人,70,85,54,46,67,314,未参加,
我高中二年级的时候，我爸爸去世了。,199505104523200045,韩国,2,199505,记对我影响最大的一个人,55,75,36,30,53,234,未参加,
他什么都能干，[BC、]而且什么都干得好{CC美}[BQ。]他今天三十一岁，[BC、]已经有妻子和一个儿子，[BC、]不过显得特别年轻。[BC、],199505104525100043,日本,1,199505,记对我影响最大的一个人,70,55,70,44,69,292,未参加,
我很喜欢他，我愿意以后也跟他互相影响响着过日子。,199505104523100172,韩国,1,199505,记对我影响最大的一个人,65,65,70,50,51,285,C,
但是经过很多困难，终于得到了幸福和名誉。[BC.],199505104525200184,日本,2,199505,记对我影响最大的一个人,70,60,57,57,72,301,未参加,
我从来不爱出风头，不爱多说话。,199505104523200202,韩国,2,199505,记对我影响最大的一个人,80,85,78,69,72,378,B,
她也是一样。,199505104523200215,韩国,2,199505,记对我影响最大的一个人,75,60,83,71,76,351,C,
他自一九八九年至一九九一年在日本爱知大学任教，现在在南开大学教外国留学生。,199505104525100225,日本,1,199505,记对我影响最大的一个人,65,80,65,77,82,357,C,
所[C]以我也跟老师{CC教师}{CD在}一起{CD要}努力学习汉语。,199505104525100232,日本,1,199505,记对我影响最大的一个人,60,55,39,32,35,202,未参加,
正好{CC最好}的是[B事]我也正好喜欢学习外语。,199505104525200235,日本,2,199505,记对我影响最大的一个人,65,65,68,59,47,288,C,
我刚来的时候找不到中国朋友。,199505104525200243,日本,2,199505,记对我影响最大的一个人,80,65,68,73,63,337,C,
我有自信，所以我可以做。,199505104523200269,韩国,2,199505,记对我影响最大的一个人,75,65,70,61,45,303,C,
我读大学以后，心里不舒畅，拿不定我要追求的一件大事。[BC，],199505104525100277,日本,1,199505,记对我影响最大的一个人,70,60,60,71,65,311,C,
因为从那时开始我可能已踏上一条不归路。,199508680519100526,马来西亚,1,199508,记对我影响最大的一个人,85,75,75,77,76,380,B,
其实是舅父不想我如此{CJX}在这小村子里过日子，因为舅父他很疼爱我，一定要我好好读书，将来做个有{CQ用}的人，{CQ做}有知识的专[F專]业[F業]{CQ人才}才是我们的前途。,199508680519200532,马来西亚,2,199508,记对我影响最大的一个人,85,85,41,40,47,293,未参加,
爸爸比较不讲究生活情趣，在日常生活中的唯一嗜好，便是下棋。,199508682519200529,马来西亚,2,199508,记对我影响最大的一个人,90,85,81,75,88,416,B,
上午正常做了工作。[BC.],200010543525250005,日本,2,200010,我第一次……,70,60,62,61,59,297,C,
夫妻地位互换也不是大不了的事情。,200010801543250002,香港地区,2,200010,我对离婚问题的看法,65,75,48,85,89,349,C,
人不想听什么声音？,200005108525200287,日本,2,200005,关于用自然之声取代噪声的建议,80,70,45,83,67,335,未参加,
那么应该采取什么措施呢？,200005108525200307,日本,2,200005,关于用自然之声取代噪声的建议,65,75,70,85,82,364,B,
最后，我开始总是头疼。,200005108525100340,日本,1,200005,关于用自然之声取代噪声的建议,70,70,56,65,65,314,C,
考虑[B滤]这些后慢慢会减少很多的噪声，反而会听到你喜欢的声音的。,200005108523100350,韩国,1,200005,关于用自然之声取代噪声的建议,70,65,70,75,69,335,C,
随着社会经济发展，人们很重视自然环境，自然环境可以给人们带来舒服，快乐的心情。,200005108523100399,韩国,1,200005,关于用自然之声取代噪声的建议,65,70,64,83,72,340,C,
在我的国家日本、人们尽量分别垃[B拉]圾，回收再利用[D算]，我们都关心保护环境。,200005108525200400,日本,2,200005,关于用自然之声取代噪声的建议,70,70,48,67,69,312,C,
可遗[B愦]憾得很，最近去郊区、山野也不怎么听到真正的自然之声。,200005108525200410,日本,2,200005,关于用自然之声取代噪声的建议,70,65,70,78,76,345,C,
而盼望着到乡村听一些使人感到平静的自然之声。,200005108523200651,韩国,2,200005,关于用自然之声取代噪声的建议,75,80,70,88,82,386,B,
现在人们喜欢使用的大哥大[BQ、]手机[BQ、]电话铃声和BP机的铃声都各自不同，我希望将来我们生活的地球的噪声换[B挽]成象手机电话和BP机一样换[B挽]不刺耳的声音。,200005108523200700,韩国,2,200005,关于用自然之声取代噪声的建议,70,65,64,57,63,305,C,
我的父亲去世之前，我们家庭每天过得很好{CD了}。,199705104523200102,韩国,2,199705,我的城市/乡村生活,60,50,63,63,58,274,未参加,
但是我的生活环境不像是个城市人那样。,199705104523200194,韩国,2,199705,我的城市/乡村生活,70,70,69,72,72,341,C,
我认为两个地方都有好处{CC2好处点}。,199705104523200532,韩国,2,199705,我的城市/乡村生活,70,65,60,58,63,302,C,
一路上车水马龙，不知不觉{CC4不觉}之中在车上睡着了，一醒来已是早上的六点多，也到达了目的地。,199705529501151020,中国,1,199705,我的城市/乡村生活,70,70,78,65,76,347,C,
当然，这也不是为了天气热整天就坐在车里就凉快。,199705529529251018,泰国,2,199705,我的城市/乡村生活,85,75,44,42,57,295,未参加,
来北京没多久我打车时，司机对我说“小姐，你是什么地方人？,199804123523200225,韩国,2,199804,学习汉语的苦与乐,75,75,48,59,40,287,未参加,
比如，我到北京不到六个月的时候，想去游乐园。,199804123523100244,韩国,1,199804,学习汉语的苦与乐,65,70,75,62,68,326,C,
人在生活上或工作中是免不了{CQ会}遇到许许多多的困难或挫折的。,199904123540200073,印度尼西亚,2,199904,如何面对挫折,60,65,39,42,48,237,未参加,
有应变能力的人才可以在遇到挫折时采取各种各样的办法面对挫折。,199904123639100201,阿塞拜疆,1,199904,如何面对挫折,75,70,26,24,52,236,未参加,
大公司接连{CC一连}破产，下岗人数多得{CC2也}数不了。,199904123523200222,韩国,2,199904,如何面对挫折,70,65,56,70,76,323,C,
我爸爸就这样说，所以使我们五个在家里的女孩子感到非常地伤心和不高兴。,199904123516200240,老挝,2,199904,如何面对挫折,65,70,42,32,52,247,未参加,
在社会生活当中无论遇到什么困难或者挫折，都要坚持下去，不怕困难，不怕挫折。,199904124525200349,日本,2,199904,如何面对挫折,70,70,45,55,50,278,未参加,
我不敢说自己是英雄，却对这句话深有同感。,199909529529151004,泰国,1,199909,如何面对挫折,85,90,88,93,95,447,A,
