错句,作文编码,国籍,性别,考试时间,作文题目,口试分数,作文分数,听力分数,阅读分数,综合分数,总分,证书
他们随着岁月的过去逐渐了解对方，而不是经过了几个月的认识后便盲目拜{CD上}堂。,200410534533250130,新加坡,2,200410,最理想的结交方式,50,80,46,60,84,305,未参加,
我觉得最理想的结交方式是通过亲戚朋友的介绍，慢慢了解，逐渐相爱的{CJs}。,200410534533250135,新加坡,2,200410,最理想的结交方式,85,90,52,70,100,393,C,
我非常赞成某市政府对在公共场所边走边抽烟的人给于罚款的措施，[BC。]同时也{CJ-zy应该}在人口密集的商业中心开始实施。,200405680519150001,马来西亚,1,200405,吸烟对个人健康和公众利益的影响,60,95,52,74,68,339,未参加,
可以达[F達]到禁止的作用，并[F並]帮[F幫]助青年人远离[F離]吸烟的坏习惯[F慣]。,200405680519150027,马来西亚,1,200405,吸烟对个人健康和公众利益的影响,70,90,58,65,94,370,C,
你抽烟，[BC。]不要以为你只是把一口口的尼古丁抽入口中而已那么简单{CJZR}，过量的尼古丁可以{CJ-zy会}杀死{CC致死}一只牛{CD只}，而长期把尼古丁遗留在体内的后果是患上癌症的机会比非烟民高出一倍。,200405680519150045,马来西亚,1,200405,吸烟对个人健康和公众利益的影响,75,95,74,90,99,427,B,
它虽然可暂时帮助{CC帮到}我们松驰心情[BQ，]但它也带来{CJX}给我们极大的‘破坏性’。,200405680519150048,马来西亚,1,200405,吸烟对个人健康和公众利益的影响,60,95,60,63,63,331,C,
如此看来，抽烟不仅害自己，也害了身边的人。,200405680519250024,马来西亚,2,200405,吸烟对个人健康和公众利益的影响,80,75,46,70,77,339,C,
尤[B由]其对女生有了一些保障和安全感。,200504534533250009,新加坡,2,200504,我对男女分班的看法,65,80,56,73,66,328,C,
但在现代新的教学里老师们也负起了启[F啓]导的作用，他们通过正确的生物学知识，传给男女学生们他们所应该知道的生理常识，不但使他们更了解自己，也通过{CD了}正确的性知识引导，提高了男女学生们对异性的了解，更进一步减去了对异性因迷惑而带来的不负责的后果。,200504534533250041,新加坡,2,200504,我对男女分班的看法,80,75,81,73,93,393,B,
我反对男女分班的看法。,200504534533250094,新加坡,2,200504,我对男女分班的看法,60,55,48,34,55,233,未参加,
因为除了男女身体与心理的不同之外，相处和学习的方式也会不一样。[BC.],200504534519250099,马来西亚,2,200504,我对男女分班的看法,70,70,78,82,70,358,C,
学者认为青少年在青春期对感情发生好奇是自然不过的事，[BC。]没有必要去过于[Y於]担心和紧张。,200504534533250108,新加坡,2,200504,我对男女分班的看法,70,80,76,69,73,358,B,
最后，父母亲对于孩子的教育和观念也起着[B这]非常重要、举足轻重的作用{CC效应}。,200504534533250114,新加坡,2,200504,我对男女分班的看法,60,70,42,54,66,277,未参加,
让孩子{CD在}早一点接触异性是好的。,200504534533250122,新加坡,2,200504,我对男女分班的看法,70,70,70,76,55,329,C,
我们先从优点开始吧。,200504534533250123,新加坡,2,200504,我对男女分班的看法,75,75,78,82,73,373,B,
男和女本来就是一对，那为何要男女分班呢？,200504534533250131,新加坡,2,200504,我对男女分班的看法,75,85,70,71,84,378,B,
家长们如果担心孩子早恋而不能专[B传]心读书的话，他们大可早一天和孩子们一起坐下来谈。,200504534533150142,新加坡,1,200504,我对男女分班的看法,60,65,51,62,73,294,未参加,
道家说过[BD，]阴阳。,200504534533150146,新加坡,1,200504,我对男女分班的看法,40,80,81,71,77,331,未参加,
在混合式的学校，有些男生为了“招蜂引蝶”把自己打扮得{CC地}又酷又帅；[BC。]而有些[L]女生{CD在班上}因为{CQ而}害羞{CJX}有她自己的心上人在班{CQ上}，所以即使有疑问也不会发言。,200504534533150153,新加坡,1,200504,我对男女分班的看法,55,65,56,69,64,291,未参加,
中国的一句古话“有其父必有其子”难道没有蕴含着这个道理吗？,200505109529200216,泰国,2,200505,父母是孩子的第一任老师,95,95,67,84,79,419,B,
如果父母是个热[C]情重感[C]情的人[BQ，]孩子也同样热[C]情重感情的人[BQ；]相反{CC反而}要是父母是冷淡的人的话[BQ，]孩子很少成为热[C]情的人。,200505109525200624,日本,2,200505,父母是孩子的第一任老师,70,70,79,74,61,342,C,
虽然我的母亲是一个普通[C]的护士[C]。,200505109525100921,日本,1,200505,父母是孩子的第一任老师,55,65,55,58,66,281,未参加,
结果我参加了剑[F劍[C]]道队，但是我很[C]后悔[C]。,200505109525100927,日本,1,200505,父母是孩子的第一任老师,60,50,50,44,69,253,未参加,
是因为从小接触[C]时间最多，而且人的性格是大体上小时候[B后]确[C]认的。,200505109525201002,日本,2,200505,父母是孩子的第一任老师,65,50,64,56,64,280,未参加,
孩子很多东西都是[C]和父母[C]学的，所以在小的时候父母[C]做什么事情，孩子都会看在眼[C]睛[C]里[C]记[C]在心里的。{CP所以{CC而且},200505109525201280,日本,2,200505,父母是孩子的第一任老师,95,75,78,68,88,399,B,
父母的兴趣爱好、思想观今、行为举止，从幼年就开始在孩子心目中打下深深的烙印。,200505109637201503,白俄罗斯,2,200505,父母是孩子的第一任老师,85,75,61,47,72,332,C,
”听他{CJ-zy这么}说，爸爸不仅不高兴，反而生气了。,200505109525201871,日本,2,200505,父母是孩子的第一任老师,55,65,52,41,67,262,未参加,
有些老师对我影响很大，有时由于他们的影响下了很多决定。,200505109525202122,日本,2,200505,父母是孩子的第一任老师,70,60,35,43,50,243,未参加,
我的父母并不是严格，可是他们经常说：[BC，]“你该对自己的言语{CC发言}与行动负责任。,200505109525202452,日本,2,200505,父母是孩子的第一任老师,65,65,48,51,67,280,未参加,
所以我们应该考虑[C]这个问题的重要性。,200505109525202469,日本,2,200505,父母是孩子的第一任老师,65,75,58,59,80,324,C,
父母一直是父母，孩子一直是孩子，在人的一辈子中父母教孩子的事情最多、[BC，]最重要。,200505109525202474,日本,2,200505,父母是孩子的第一任老师,65,70,48,67,72,308,C,
别人看孩子的行为，就知道他的父母的行为。,200505109525202537,日本,2,200505,父母是孩子的第一任老师,70,60,69,61,78,323,C,
本来我孩子们不喜欢{CD说}汉语口语[L]，告诉{CC高告}他们这个方法以后他们要吃这个糖[Ptang]。,200505271736100124,尼日利亚,1,200505,父母是孩子的第一任老师,90,55,65,43,43,285,未参加,
父母无疑从幼年就开始在孩子心目中打下深深的烙印，也往往会影响孩子将来的兴趣爱好、思想观念、行为举止等等。,200505204635200497,俄罗斯,2,200505,父母是孩子的第一任老师,95,80,71,65,74,381,B,
我的女儿会听三种语言和会说三种语言。,200505212520200005,蒙古国,2,200505,父母是孩子的第一任老师,85,60,44,31,34,242,未参加,
在世界上的每个人没有人没受过教育{CC教养}，[BC。]特别是我们小的时候，对父母的教育{CC教养}印象是最深的。[BC，],200505212542100030,越南,1,200505,父母是孩子的第一任老师,80,55,54,31,58,264,未参加,
绝[B决]大多数的动物它们只{CD能}会喂[B喟]养它们的孩子。,200505275529100108,泰国,1,200505,父母是孩子的第一任老师,75,70,63,63,67,327,C,
如果顺利交上朋友了，那么以后的发展就有看头了。,200505951501150007,中国,1,200505,最理想的结交方式,70,85,86,75,95,403,B,
这[F這]是必然的也是必须[F須]的。,200505522522150002,缅甸,1,200505,最理想的结交方式,90,75,75,66,77,377,B,
因为有些人的习惯是不会影响人家{CJsd}，[BC。]但是有些人的习惯{CD是}不仅是影响而且{CC2而}会伤害别人{CC人家}。,200505522522250014,缅甸,2,200505,最理想的结交方式,60,75,45,53,55,274,未参加,
我说[F説]这[F這]句话[F話]是因为第一次见[F見]面是不会[F會]知道对方的心{CJsd}，如果对方是一个花心的人，那你就完了。[BC.],200505522522250030,缅甸,2,200505,最理想的结交方式,45,65,48,49,44,231,未参加,
她[B他]给我把作文解释[F釋]得{CC的}清清楚楚。,200505522522110010,缅甸,1,200505,最理想的结交方式,40,60,30,38,48,193,未参加,
比如有的父母认为，教育孩子时用暴力也是一种解决问题的方式。,200505209616200041,德国,2,200505,父母是孩子的第一任老师,65,65,41,41,56,252,未参加,
其次，父亲的动作更重要。,200505209922100030,美国,1,200505,父母是孩子的第一任老师,95,55,63,55,67,325,C,
不过我个人的看法是“父母是孩子的第一任老师[BQ”]。,200505209542200106,越南,2,200505,父母是孩子的第一任老师,75,75,35,43,43,261,未参加,
可能在将来他会遇到真正的邮票专[B传]家，那个人会教给他很多关于邮票{CQ的}知识，可是让他爱上邮票懂得邮票{CQ的}不是他父亲吗？,200505201542200419,越南,2,200505,父母是孩子的第一任老师,80,70,56,59,80,335,C,
一般的人从出生到离开老家{CJ-zy都}受到父母的影响。,200505207525200015,日本,2,200505,父母是孩子的第一任老师,55,45,52,55,76,260,未参加,
他们[L]不但会给自己的孩子一些科学、文学、文化等知识，也自然会带他到社会，做他的独一无二的榜样。[BC.],200505502635100056,俄罗斯,1,200505,父母是孩子的第一任老师,70,55,37,47,63,256,未参加,
”也有人谈吐[B吞]有方，就是受家长们的教育[BQ。]所以说为了孩子们的未来，父母们应当起[B取]到良好的启蒙作用！,200505332512100051,菲律宾,1,200505,父母是孩子的第一任老师,70,90,58,65,80,356,C,
要是青少年从[F從]小养[F養]成这[F這]个[F個]不好的习[F習]惯，对[F對]其未来[F來]的健康有害而无[F無][C]一利。,200509105919200005,加拿大,2,200509,吸烟对个人健康和公众利益的影响,80,70,80,74,65,359,B,
由于深知贵公司是一家{CC间}有着良好声誉的旅行社。,200509534519250010,马来西亚,2,200509,一封求职信,70,85,66,60,75,348,C,
本人自认领导能力强，故所属[B居]部下，办事认真，对顾客{CD是}殷勤招待，在同行中树立起{CQ了}非常好的口碑。,200509534533150101,新加坡,1,200509,一封求职信,55,75,82,66,82,345,C,
毕业后，我就在东[F東]京的一家{CC间}旅游公司服务到现在，服务表现也受到公司的赞赏。,200509534519250107,马来西亚,2,200509,一封求职信,75,70,73,60,68,335,C,
网络[B落]、电视等不同媒体的广告，我们都有些技能上的基础与了解。,200509534533150141,新加坡,1,200509,一封求职信,70,70,48,51,46,273,未参加,
原因可能也包括了我精通四大语言：华语、英语、马来语与法语。,200509534533250145,新加坡,2,200509,一封求职信,80,75,91,71,91,399,B,
比方说，人生像厨房[B方]里的五味瓶一样，酸、甜、苦、辣、咸样样俱全。,200510111523100413,韩国,1,200510,我看流行歌曲,65,70,46,42,64,273,未参加,
但是，有些人不喜欢流行歌曲，甚至还有人非常蔑视流行歌曲。,200510111523200414,韩国,2,200510,我看流行歌曲,60,70,60,48,64,287,未参加,
他们每天每一秒钟都一直希望与他们的歌星见面，与他们在一起，并不喜欢有人说他们的坏话，甚至觉得[B的]如果那些{CJ-zxy人}{CD是}再{CC已}{CJX}不有名了，世界就末日了。,200510111540200778,印度尼西亚,2,200510,我看流行歌曲,75,75,72,69,74,355,B,
这个问题是不能忽视的问题。,200510111523200859,韩国,2,200510,我看流行歌曲,65,70,39,44,55,259,未参加,
比如说我们有时候感到不知怎样才能对社会表达{CC发出}我们年轻人的想法时，常常会用到一些流行歌曲的歌词与该歌曲的歌手风格来展示我们。,200510111523200866,韩国,2,200510,我看流行歌曲,90,80,77,65,72,379,B,
此[B次]外，听流行歌曲来发泄，最好不过了。,200510111523201037,韩国,2,200510,我看流行歌曲,65,80,65,67,79,344,C,
虽然大人不爱听流行歌曲，可是为了理解年轻人应该多听流行歌曲。,200510111523201050,韩国,2,200510,我看流行歌曲,60,75,70,50,64,305,未参加,
在现代大部分的人{CC1人家}特别喜欢流行歌曲。,200510111523101068,韩国,1,200510,我看流行歌曲,60,55,37,40,42,215,未参加,
靠我的感觉{CC感情}选一首[B手]歌然后欣[C]赏音乐的节奏和歌曲。,200510111523201124,韩国,2,200510,我看流行歌曲,75,65,56,44,57,284,未参加,
但是，最近有些人，尤其年轻人过分地{CQ喜欢}着歌迷{CJs}，因此关于流行歌曲的问题越来越引人注目。,200510111523201256,韩国,2,200510,我看流行歌曲,65,75,56,59,74,316,C,
因为现在流行的歌曲{CD是}很快。[BC，],200510111523201265,韩国,2,200510,我看流行歌曲,65,70,56,54,59,290,C,
我觉得这也表示现代人的特点，喜欢新的。,200510111523101331,韩国,1,200510,我看流行歌曲,65,65,49,48,52,263,未参加,
”有人说我们得听高雅、[BD，]有教养性的古典音乐，可是这样的说法是没有道理的。,200510111523101367,韩国,1,200510,我看流行歌曲,65,85,65,50,59,314,C,
但是，有些人不喜欢流行歌曲。,200510111523201567,韩国,2,200510,我看流行歌曲,65,60,46,38,45,237,未参加,
身为一位流行音乐的爱好者{CC喜爱者}，{CJ-zhuy我}并不像他人随大流，而是从中寻求对生活的感触，所以也较喜爱听一些自作、自由并自唱的音乐人的歌。,200510111614201598,荷兰,2,200510,我看流行歌曲,75,60,72,65,77,335,C,
简单说，我的看法是要增加流行歌曲的普遍[B边]性。,200510111523201619,韩国,2,200510,我看流行歌曲,70,70,72,50,59,309,C,
周杰伦的《东风破[B坡]》，蔡依琳的《三十六计》，孙燕姿的《绿光》等，[BC。]都是时下最受青少年的喜爱{CC热爱}的歌曲，[BC。]这些歌曲都被称为流行歌曲。,200510111533201792,新加坡,2,200510,我看流行歌曲,95,95,70,73,94,426,B,
当时我听到朋友说话的时候，[BC。]不信他的话了。,200510111523201846,韩国,2,200510,我看流行歌曲,65,60,51,40,52,251,未参加,
如果父母经常吵嘴[BQ、]打架，[BC。]孩子就会产生恐惧心理，从而使他得上心理疾病；[BC。]如果父母经常教孩子读书写字，孩子的学习成绩就会高过其他同年龄的小朋友；[BC。]如果父母一直对[B到]孩子疏加照顾，那么孩子就会逐渐远离父母而得上自闭症。,200510919501250006,中国,2,200510,父母是孩子的第一任老师,75,95,86,87,100,437,A,
我觉得从自己的爱好来看流行歌曲很有意义。,200510302523200037,韩国,2,200510,我看流行歌曲,75,80,51,54,79,330,C,
他越来越不喜欢跟朋友一起{CJ+zxy的地方}。,200510302523100079,韩国,1,200510,我看流行歌曲,65,60,60,50,55,273,未参加,
特别是，对高中学生来说这是很重要的沟[C]通手段。,200510302523100083,韩国,1,200510,我看流行歌曲,60,55,67,48,77,288,未参加,
我觉得流行歌曲有很多好处，因此我支持听流行歌曲。,200510302523200126,韩国,2,200510,我看流行歌曲,85,75,74,48,52,326,C,
流行音乐太妙了，这也是流行音乐所特有的魅力吧！,200510302523200217,韩国,2,200510,我看流行歌曲,85,85,74,63,89,391,B,
在韩国很有名[L]的老师们说“[BC‘]如果你要更好[D好]学习某种{CC个}外语的话，你应该听该国{CC其国}的流行歌曲，用来{CJX}流行歌曲学习外语的话，进步非常大。,200510302523200221,韩国,2,200510,我看流行歌曲,65,65,46,46,52,258,未参加,
因此现代人把兴趣容易消失{CJba}。,200510302523100267,韩国,1,200510,我看流行歌曲,50,55,49,40,47,220,未参加,
节[F節]奏轻[F輕]快，文词[F詞]简[F簡]单[F單]，一般人都可以{CJ-sy唱起来}朗朗上口，而且配合节[F節]奏的速度，就有{CD着}舞蹈的出现[F現]，所以，在时[F時]风[F風]日下的现[F現]在二十一世纪[F紀]科技时[F時]代，人们[F們]每日为[F為]了竞[F競]争[F爭]，为[F為]了生存，工作忙碌，精神紧[F緊]张[F張]，所以，在工作之余[F餘]，听听轻[F輕]松[F鬆]、[BC，]节[F節]奏轻[F輕]快的流行歌曲，也算是一种[F種]享受。,200510529529251019,泰国,2,200510,我看流行歌曲,75,75,56,52,69,317,未参加,
如果自己都分不清，[BC。]那表示自己没有工作能力{CC能量}。,200510529529151026,泰国,1,200510,我看流行歌曲,65,70,70,52,79,322,C,
歌曲是人类灵魂的一件伟大的作品[C]，歌曲给人类[C]带来很[C]多的价值{CC用途}，尤其是对人类生活的方式，如对{CC给}小孩子的教育，并[F並]让孩子们有着健[C]康的成长{CC生长}。,200510532529150001,泰国,1,200510,我看流行歌曲,70,65,39,42,52,254,未参加,
有的人认为，只要流行就好听。,200510540540200037,印度尼西亚,2,200510,我看流行歌曲,65,65,56,38,69,277,未参加,
英美甚至存在十几种所谓流行音乐，{CQ如}说唱{CC话唱}、[BC，]R和B、[BC，]摇滚等。,200510634634200161,英国,2,200510,我看流行歌曲,90,65,42,34,55,277,未参加,
若是大家都能接受双方的家庭成员，则再谈论婚嫁一事。,200505680519250019,马来西亚,2,200505,最理想的结交方式,65,80,79,60,79,351,C,
我很高兴你们打算五月来北京。,200104124525200044,日本,2,200104,一封写给父母的信,75,70,36,49,63,282,未参加,
这样，我靠{CC借}许多人的帮助来生活。,200104124525200101,日本,2,200104,一封写给父母的信,70,50,33,42,47,225,未参加,
所以你们就是我最喜欢的父母。,200104124525200105,日本,2,200104,一封写给父母的信,65,55,41,56,47,246,未参加,
这{CQ真}是莫名其妙{CD吧}。,200104124525200116,日本,2,200104,一封写给父母的信,70,50,38,30,36,207,未参加,
为了我{CJ-zhuy你们}把一切都给{CQ了}我。,200104124523200179,韩国,2,200104,一封写给父母的信,65,75,49,25,49,250,未参加,
他们对我十分亲切[C]。,200104124529200174,泰国,2,200104,一封写给父母的信,75,85,41,35,58,287,未参加,
您们也要小心{CQ别}感冒了{CC吧}！,200104124523200284,韩国,2,200104,一封写给父母的信,65,60,25,28,45,206,未参加,
你一手把我拉扯到现在，[BC。]可我几乎没给你什么礼物，没跟你说什么甜蜜的话，[BC。]只是给你添麻烦。,200104124523200359,韩国,2,200104,一封写给父母的信,75,85,77,47,63,340,C,
因为我没准备好考试，所以我考得不好。,200104124540200352,印度尼西亚,2,200104,一封写给父母的信,75,85,38,37,42,270,未参加,
季同志：我在报纸上看到了您公司的招聘启事，我希望在你们公[B工]司工作。,199200008525200007,日本,2,199200,一封求职信,,,0,0,0,0,未参加,
这孩子的父母每次看自己的孩子的时候，心里很难受。,199604123525100061,日本,1,199604,如何看待“安乐死”,55,60,56,47,49,248,未参加,
信基督教{CQ的}人来说人的生命就是从上帝而来的，[BC。]这不言而喻{CC不言而晓}的原理{CJs}。,199604123523100320,韩国,1,199604,如何看待“安乐死”,70,75,61,59,60,313,C,
去世时很[D很]痛苦，难过[C]也他的命运{CC走运[C]}{CJs}。,199604123525200321,日本,2,199604,如何看待“安乐死”,60,70,63,61,39,277,未参加,
这么大的社会问题似乎没有最好的处置{CJ-zxy方法}。,199604124525200223,日本,2,199604,如何看待“安乐死”,45,55,35,49,39,200,未参加,
丈夫给妻子吃安眠药{CC安命药}是[B使]为了解脱她的痛苦，又是按[B安]照妻子要求才做[B作]的。,199604124636200101,乌克兰,2,199604,如何看待“安乐死”,75,60,45,49,42,256,未参加,
自古以来，一直存在着这个代沟问题。,199610550523290011,韩国,2,199610,如何解决“代沟”问题,70,65,65,69,67,322,C,
不过他由这件事对我的不满好像愈来愈深。,199610550523290030,韩国,2,199610,如何解决“代沟”问题,75,70,54,55,67,310,C,
爸爸的话也没有错误。,199610550523290037,韩国,2,199610,如何解决“代沟”问题,60,70,44,48,47,254,未参加,
他是{CQ在}1960年的社会情况下长大的，我是1971年以后[B候]才出生的，他跟我的{CD什么}教育[C]环境[B竟]、[BC，]{CD什么}社会情况都不一样，所以，他的想法跟我的不一样。[BC，],199610550523190094,韩国,1,199610,如何解决“代沟”问题,65,65,62,67,67,310,C,
我觉得解决这个问题，最好不要{CQ从}自己的时代视角{CC视觉}看别的时代，两个时代{CQ的}人，{CJ-zy应该}通过对话解决问题。,199610550523290096,韩国,2,199610,如何解决“代沟”问题,65,45,52,50,59,250,未参加,
这里，[BC、]我想谈两个观点。,199611543525100511,日本,1,199611,如何解决“代沟”问题,85,75,60,73,76,361,B,
从这[F從]这[F這]个[F個]故事中，我们{CC咱们[F們]}可以看得出，分工合作的重要性。,199603533533100042,新加坡,1,199603,由“三个和尚没水喝”想到的……,90,90,58,79,89,404,B,
其他几个肯定也有此想法。,199603533533200038,新加坡,2,199603,由“三个和尚没水喝”想到的……,80,75,58,54,70,328,C,
就这样，最后他们都被渴死了。{CJbei},199603533533200040,新加坡,2,199603,由“三个和尚没水喝”想到的……,85,65,66,76,84,365,C,
后来领导调派了一位副[B付]组长来帮忙，产量与品质更好更快地{CC的}达到了指标，[BC。]我们得到了表扬。,199603533540200120,印度尼西亚,2,199603,由“三个和尚没水喝”想到的……,90,95,66,74,94,417,B,
因为社会上有很多矛盾，甚至有人[L]磕磕绊[B伴]绊[B伴]，扯后腿，挤兑等人{CQ们}尽量愿意避开的场面多。,199605104525200031,日本,2,199605,由“三个和尚没水喝”想到的……,90,90,77,74,91,420,B,
在现代社会上，有很多又重要又亟待解决{CC4着急}的问题。,199605104523100040,韩国,1,199605,由“三个和尚没水喝”想到的……,65,70,35,40,42,238,未参加,
这篇文章中的第一个和尚，他因为自己不去挑水就没有水可喝了，所以[C]他不得不去挑水。[BC，],199605104523100075,韩国,1,199605,由“三个和尚没水喝”想到的……,70,70,60,70,65,323,C,
但是和尚无所谓，就强[C]调和尚为了农民每天念经，很辛苦。,199605104525200077,日本,2,199605,由“三个和尚没水喝”想到的……,65,60,52,54,61,275,未参加,
第二个{CD的}和尚是面貌很瘦，很像样的，其实他也并没有谦虚的地方，那么为什么他这么瘦[C]呢？,199605104525100144,日本,1,199605,由“三个和尚没水喝”想到的……,65,65,46,74,68,302,C,
脚也想[BQ：][BQ“]我天天忙忙碌碌地走来走去，但是对我没有好处{CC优惠}。[BQ”],199605104523200196,韩国,2,199605,由“三个和尚没水喝”想到的……,70,60,38,65,84,302,未参加,
在人类[F類]的社会里我们常面临[C]牺[F犧]牲自己利益，来[F來]使团体完成大我的时[F時]候。,199605104523100197,韩国,1,199605,由“三个和尚没水喝”想到的……,75,70,71,54,65,324,C,
为了创造{CC造成}美好的社会，我们应该站在{CC2替}别人的立场来考虑一下问题。,199605104523200207,韩国,2,199605,由“三个和尚没水喝”想到的……,70,75,69,60,63,326,C,
两个人可以团结，三个人为什么不可以呢？,199605104523200214,韩国,2,199605,由“三个和尚没水喝”想到的……,70,55,69,65,63,306,C,
第三天，因为找不到什么办法[BQ，]感觉非常失望[C]，他也不想回去[BQ，]因为另两个和尚会笑他这样自大{CC自心}。,199605104610200292,法国,2,199605,由“三个和尚没水喝”想到的……,50,50,44,26,32,180,未参加,
很多人会完成{CC办完}自己的任务，但是大多数的情况下“[BC‘]只顾自己，不顾别人”[BC’][BQ。]我觉得现在的人们太自私。,199605104523200318,韩国,2,199605,由“三个和尚没水喝”想到的……,65,60,74,54,80,316,C,
第三天，他们集[C]中在一起想个别的办法{CD了}，第一个和尚说，这样下去不行的{CJsd}，咱想个更好的办法，安装个吊桶怎样？,199605104523100344,韩国,1,199605,由“三个和尚没水喝”想到的……,55,60,77,49,51,273,未参加,
我不愿意和那种人交往。,199605104525100347,日本,1,199605,由“三个和尚没水喝”想到的……,80,60,35,54,51,267,未参加,
人需要安定的{CJsd}。,199605104525100380,日本,1,199605,由“三个和尚没水喝”想到的……,60,60,38,49,58,247,未参加,
我们应该靠自己的能力、[BC，]智慧去处理问题，克服一切难关。,199605550523290006,韩国,2,199605,由“三个和尚没水喝”想到的……,75,75,63,51,61,315,C,
办法就是一天一个人到[C]山底[C]下挑水{CD的}。,199605550523290030,韩国,2,199605,由“三个和尚没水喝”想到的……,65,60,69,42,63,282,未参加,
我们班离我们负责{CC责任}的花园比较远。,199605550523190046,韩国,1,199605,由“三个和尚没水喝”想到的……,65,65,60,70,61,305,C,
在庙里，谁也不肯挑水喝。,199605550523290044,韩国,2,199605,由“三个和尚没水喝”想到的……,60,50,24,40,37,191,未参加,
