错句,作文编码,国籍,性别,考试时间,作文题目,口试分数,作文分数,听力分数,阅读分数,综合分数,总分,证书
首先，让我进行自我介绍，我的名字叫“×××”今年22岁，今年大学毕业，在学校具有较好的成绩。,199410550533101907,新加坡,1,199410,一封求职信,85,75,81,75,91,400,B,
如果没有他的教导，我们的成绩怎么能达到{CC得到}现在的水平呢？,199412123542200026,越南,2,199412,记我的父亲,55,95,60,59,57,315,C,
这个月，有一天，是我爸爸的生日。,199412123623200027,南斯拉夫,2,199412,记我的父亲,60,85,25,44,39,242,未参加,
我的父亲是一个高中的老师。,199412123525200039,日本,2,199412,记我的父亲,55,80,60,48,51,280,未参加,
”我听他的话，我学过弹钢琴，留过学，[BC、]去过好几次{CJX}旅行……。,199412124525200001,日本,2,199412,记我的父亲,60,55,73,73,74,316,未参加,
我现在不知道我到底有没有变成他喜欢的那样，[BC。]反正毕业以后我回国他就会发现。,199412124727200007,马达加斯加,2,199412,记我的父亲,55,65,46,38,30,216,未参加,
他的弟弟、妹妹，都敬爱{CC亲爱}他，尊敬他。,199412124525200047,日本,2,199412,记我的父亲,60,70,39,38,63,255,未参加,
我以前不自信，却自卑。,199412104523200627,韩国,2,199412,记对我影响最大的一个人,65,65,46,61,43,264,未参加,
有一位日本的小姑娘[BD，]{CD他}进入入境检查时，他对那位姑娘非常热情。,199412104525200624,日本,2,199412,记对我影响最大的一个人,50,50,57,48,41,224,未参加,
那样的时候，老师给我讲以前{CD的}中国的事、[BC。]自己年轻的时候的事情等等。,199412104525200697,日本,2,199412,记对我影响最大的一个人,65,65,75,79,74,342,C,
那时候发生一件事{CC一事件}。,199412104525100649,日本,1,199412,记对我影响最大的一个人,60,60,39,48,57,246,未参加,
如果我把[B吧]这个老三给你的话，我怎么对得起{CC对不起}上帝呀。,199412104525100649,日本,1,199412,记对我影响最大的一个人,60,60,39,48,57,246,未参加,
他很尊重我{CD自己一个人}的意志、志趣、意见，他愿意按照我的意思做事。,199412104523200696,韩国,2,199412,记对我影响最大的一个人,65,75,57,50,57,291,未参加,
突然我妈妈去世了。,199412104523200678,韩国,2,199412,记对我影响最大的一个人,55,60,68,46,49,259,未参加,
我希望在爸爸身边，我不顾他，谁照顾他呢？,199412104523200678,韩国,2,199412,记对我影响最大的一个人,55,60,68,46,49,259,未参加,
他说他也是跟我一样，年轻的时候觉得生活很单纯[BQ，]而且没有自信。,199412104525100120,日本,1,199412,记对我影响最大的一个人,65,65,81,71,74,340,C,
父亲[F親]那严肃[F肅]{CQ的}[BD、]脸[F臉]上又带有历经[F經]沧[F滄]桑、饱[F飽]受时[F時]间[F閒]、历史、政治、社会[F會]变迁、人情事故、人生的分分离[F離]离[F離]的日子{CJ-by折磨的痕迹}。,199500533519100039,马来西亚,1,199500,记对我影响最大的一个人,95,65,70,61,65,348,C,
很不巧[BQ，]在当[C]天晚上，赵老师在一家{CC座}咖啡店里找到我，并[F並]对我进行{CQ了}训导。,199500533533100068,新加坡,1,199500,记对我影响最大的一个人,90,80,57,65,72,359,C,
我父亲认为我们应该继续学习华语，就让我们兄弟姐妹在家自修，我们没有一定的温课时间，但每个人都会很好地{CC的}分配时间进修，父亲要求我们平日交谈都用华语，离家时写家信[C]也用华语，[BC。]多听收音机广播[BQ，][BD「]六十年代我们总是收听中国北京电台广播[BD」]，也要我练习中国新闻社播放的新闻记录[F錄]。,199500533540200109,印度尼西亚,2,199500,记对我影响最大的一个人,85,95,78,65,84,403,B,
她是我的小学老师，现在已大约七十多岁了，但慈祥的脸似乎{CD在}让她看来仍那么{CC如此}美丽。,199500533533200127,新加坡,2,199500,记对我影响最大的一个人,95,85,86,73,90,427,A,
接下来的几年，她都以最大的耐心，最大的包容来指导我。,199500533533200127,新加坡,2,199500,记对我影响最大的一个人,95,85,86,73,90,427,A,
也不能侍[B待]候丈夫马马虎虎，毕[B必]竟以后孩子长[F長]大了，丈夫是我的老伴，而不是孩子能代替的位置。,199500533540200138,印度尼西亚,2,199500,记对我影响最大的一个人,85,70,39,46,43,274,未参加,
因为病[C]人{CJcd每天每天}感觉到深刻的痛苦[BQ，]他身边的人也总是担心，身体{CQ变}弱[C]，这不是浪费[C]吗？,199510550523100901,韩国,1,199510,如何看待“安乐死”,75,70,43,50,57,284,未参加,
可是我想这个问题并[F並]不能{CC是}那么简单地做出结论，第三者并[F並]不{CQ能}明确{CC彻[C]底}地感觉到病人跟其家人的痛苦，先生帮助太太自杀[BQ，]那太太不是先生最爱的人哪！,199510550523100934,韩国,1,199510,如何看待“安乐死”,65,75,64,54,68,313,C,
总[F總]括来[F來]说[F說]，我认[F認]为[F為]安乐[F樂]死是应该[F該]受到社会[F會]的认[F認]同的。,199511543501200565,中国,2,199511,如何看待“安乐死”,75,85,69,77,86,385,B,
情况自然是一百遍地{CC的}重写让我酸得举不起手。,199505529529100016,泰国,1,199505,学习汉语的苦与乐,80,85,83,70,86,398,B,
那时[C]母亲不是向往的对象{CC对[C]方}，[BC。]也不是反抗的对象{CC对[C]方}。,199505104525200034,日本,2,199505,记对我影响最大的一个人,75,85,68,57,61,339,C,
我从小是在台湾出生、长大的，由于在周围能接触到的韩国人很少，所以{CJ+zy从小}我[C]是跟台湾的孩子们一块儿长大的。,199505104523100092,韩国,1,199505,记对我影响最大的一个人,80,90,81,73,82,401,B,
但是，我却认为现代的妇女可以有别的选择。,199505104525200097,日本,2,199505,记对我影响最大的一个人,75,85,41,63,84,341,未参加,
当时{CC2当时候[C]}我们班的老师给{CQ了}我多多地教诲{CC教点}{CD了}[BQ。]有[C]时候老师找我问“你的理想是什么？,199505104523100117,韩国,1,199505,记对我影响最大的一个人,50,50,39,22,43,182,未参加,
我认为日本人一般来说归属国家的概念比较淡薄{CC希薄}，在学校教育方面也不太重视爱祖国教育。,199505104525200121,日本,2,199505,记对我影响最大的一个人,70,85,81,63,72,363,C,
为什么呢？{CP因为这些曾经和自己一起生活、学习或工作过的人，有些是曾经关怀过自己、帮助过自己的，他们都给自己留下过深刻的印象，甚至一定程度的影响。P},199505104540100138,印度尼西亚,1,199505,记对我影响最大的一个人,90,95,70,65,92,410,B,
可是，我认为给了我最大影响的一个人就是我上大学时的一位讲师。,199505104801100137,澳大利亚,1,199505,记对我影响最大的一个人,80,75,54,53,47,300,未参加,
我来中国的时候，母亲总[C]是担心地说：“每[C]天吃好{CD吧}，健[C]康是最重要的事。[BQ”],199505104523100147,韩国,1,199505,记对我影响最大的一个人,65,65,57,50,45,266,未参加,
结果，她决定去法国学法语。,199505104523200154,韩国,2,199505,记对我影响最大的一个人,60,80,70,75,53,325,C,
这句话跟他的学生时代的经验有关系{CD的}。,199505104525100180,日本,1,199505,记对我影响最大的一个人,85,70,57,57,67,327,C,
当时，我离开家[BQ，]生病了。[BC，],199505104523200187,韩国,2,199505,记对我影响最大的一个人,75,60,57,50,57,285,未参加,
比如说“念书”[BQ。]我还记得那天的他说的一句“[BC「]人生中一个人的体验是有限的，那怎么增进它呢？,199505104525100191,日本,1,199505,记对我影响最大的一个人,65,75,73,57,55,312,C,
当时，我的父母都是大学生。,199505104922100209,美国,1,199505,记对我影响最大的一个人,80,65,60,61,47,301,C,
老师不要借酒浇[C]愁。,199505104523100224,韩国,1,199505,记对我影响最大的一个人,65,75,62,57,63,309,C,
她一边还债{CQ一边}教育{CC2教}{CD了}我们子女。P},199505104523100259,韩国,1,199505,记对我影响最大的一个人,70,60,57,59,45,276,未参加,
可是这么好的老师，最后被[C]学校开除[Pchú]了。,199505104523200280,韩国,2,199505,记对我影响最大的一个人,70,60,83,67,78,343,C,
他是7个兄[B兑]弟的老大。,199505104523200291,韩国,2,199505,记对我影响最大的一个人,65,50,39,53,49,237,未参加,
她是我的第二故[B古]乡。[BC，],199505104523200302,韩国,2,199505,记对我影响最大的一个人,70,55,41,40,53,243,未参加,
但在我{CJ-sy到了}有思[C]考能力的岁数以后，和我同屋的姐姐，可以说给我了最大的影响。,199505104525200303,日本,2,199505,记对我影响最大的一个人,0,75,86,65,76,298,未参加,
她现在已近五十了，但她从不因为自己的事而忽略了我们。,199508680519100526,马来西亚,1,199508,记对我影响最大的一个人,85,75,75,77,76,380,B,
全班同学都取笑我，说我是爱哭鬼。,199508680519200539,马来西亚,2,199508,记对我影响最大的一个人,85,85,73,71,72,381,B,
虽然放弃了自己心爱的文学而选择经济，我并不后悔。{CP因为乌鸦尚且懂得反哺，更何况是生我、养我、教会我做人道理的父母？P},199508682519200546,马来西亚,2,199508,记对我影响最大的一个人,90,80,89,79,86,419,A,
父母因此也忽略了对我的照顾与关心。,200010512501150007,中国,1,200010,我对离婚问题的看法,80,85,83,80,82,404,A,
从小以来不肯{CQ落在}别人后边的我，[BC、]想写的比人家好一点的原因吧。,200010543525250009,日本,2,200010,我第一次……,70,65,67,63,66,317,C,
因而带来的问题，除了交通堵塞以外，还有很多刺耳的机械噪音。,200005108523200299,韩国,2,200005,关于用自然之声取代噪声的建议,80,70,89,80,74,383,B,
在日本，差不多所有的公共卫生间都设置一个机器。,200005108525200311,日本,2,200005,关于用自然之声取代噪声的建议,65,70,59,70,63,313,C,
因工业化，我们的生活水平，越来越高{CC1提高}，但是在精神{CD上}{CD的}方面，有很多困难。,200005108523100332,韩国,1,200005,关于用自然之声取代噪声的建议,70,65,78,67,65,331,C,
因为早上还没醒过来的时候，如果被人吵醒了，那么那个人对你再好也会产生有一点的反[B烦]感。,200005108525200330,日本,2,200005,关于用自然之声取代噪声的建议,75,70,50,70,54,308,C,
我认为将经常听到的噪声换成自然之声不一定是个好主意。,200005108610200627,法国,2,200005,关于用自然之声取代噪声的建议,80,65,31,50,50,264,未参加,
有时两个不同性格的人，也可以成为好朋友。[BC．],199711802801200001,澳大利亚,2,199711,我选择朋友的标准,80,80,55,63,61,331,C,
每个[F個]人对选择朋友的标准都不同，有些选择性格与自己相同或接近的，有些却[F卻]选择性格与自己不同的。,199711802543200004,香港地区,2,199711,我选择朋友的标准,85,65,69,67,68,343,C,
但，如果真的住在那儿生活的话，可能不方便得多。,199705104525200045,日本,2,199705,我的城市/乡村生活,70,65,46,67,68,302,C,
上午三个小时慌[B荒]慌[B荒]忙忙地过去已到了午休时间，但没有人休息，我也不好意思一个人休息，没办法休息，只好一边工作一边吃中午饭。,199705104525200530,日本,2,199705,我的城市/乡村生活,45,60,71,38,56,249,未参加,
昂贵的生活费用，拥[F擁]挤[F擠]的汽车[F車]和空气[F氣]污染加上忙碌[C]的人们[F們]，不知从[F從]何时[F時]开[F開]開始，我的脸[F臉]上不再有我从[F從]乡村带[F帶]来[F來]的天真笑容。,199705610501200006,中国,2,199705,我的城市/乡村生活,95,95,64,79,79,411,B,
上了一年级才发现原来印尼用的课本是这个学校出版{CC产生}的。,199804123540200096,印度尼西亚,2,199804,学习汉语的苦与乐,65,50,21,6,38,161,未参加,
无论学汉语有多苦，可它也有利的方面，就是它有它的特色，汉字能象[B像]征中国，每个汉字都{CC是}有自己的意义，自己的来源。,199804124529200427,泰国,2,199804,学习汉语的苦与乐,80,90,60,59,58,342,C,
”我尽快着直摇头，连声说[F説]：“没……没……没干什么.”我看四下无人，便拿着罐吃了起来，刚放在{CC进}舌头上，{CD嘴巴}便把它吐了出来[F來]，接着{CC便}哭了出来，眼泪不停地流出{CD眼眶}、哭声把妈妈引了进去.妈妈便急着说[F説]：“我的宝贝女儿，你怎么了呢！,199910512501250005,中国,2,199910,我的童年,70,80,42,59,58,299,未参加,
可我改变了主意来到了中国会{CJX}学了汉语。,199904123523200005,韩国,2,199904,如何面对挫折,70,65,37,60,46,264,未参加,
吃饭的时候我们留学生不知道中国家常菜，所以我们在餐[Pcan]厅工作的小姐{CQ的}帮助{CD下}点菜{CJjy}，{CD以后}结果呢？,199904123523200060,韩国,2,199904,如何面对挫折,55,65,23,29,22,176,未参加,
如此，他以后会小心翼翼，更细致地预备要搞的事，要多讲究一点，免得再不{CJ？}。,199904123605200118,保加利亚,2,199904,如何面对挫折,65,65,50,67,67,298,C,
我们的精神会变得坚强起来。,199904124525200288,日本,2,199904,如何面对挫折,75,70,56,62,76,328,C,
我也跟大家一样，经常遇到困难，有时候我感到非常痛苦。,199904124525200349,日本,2,199904,如何面对挫折,70,70,45,55,50,278,未参加,
我上高中的时候不太爱学习，经常跟朋友们出去玩玩{CJcd}，这样一[B以]来我的成绩是{CJX}毫无疑问{CC无话可说}倒数第几名{CC第几排}，所以我很担心，很害怕。[BC，],199904124523200383,韩国,2,199904,如何面对挫折,55,65,56,44,52,254,未参加,
人在生活中，遇到的困难和挫折是无法避[B必]免的。,199909684542200046,越南,2,199909,如何面对挫折,70,70,44,44,53,269,未参加,
关于[F於]工作本身问题、困难。,199909529529251014,泰国,2,199909,如何面对挫折,65,85,51,54,66,311,C,
