错句,作文编码,国籍,性别,考试时间,作文题目,口试分数,作文分数,听力分数,阅读分数,综合分数,总分,证书
我父母从我很小的时候开始强调：有机会接受[C]教育是很幸福的事。,200505109525201517,日本,2,200505,父母是孩子的第一任老师,85,85,84,77,93,419,A,
父母是孩子的第一老师我认为孩子的成长中最重要、最关键的就是父母的存在。,200505109525201696,日本,2,200505,父母是孩子的第一任老师,80,65,46,59,56,294,C,
所以父母还[C]是孩子的第一任老师。,200505109525101750,日本,1,200505,父母是孩子的第一任老师,65,60,50,55,65,278,未参加,
对于一个人来说，自己的周围[C]就是世界，那么自己的周围[C]，尤[B优]其是最{CJX}跟自己接近[C]的世界是什么？,200505109525102044,日本,1,200505,父母是孩子的第一任老师,70,65,56,67,69,313,C,
从小到{CC就}大，孩子会受到父母的重大影响。,200505109525102100,日本,1,200505,父母是孩子的第一任老师,70,70,71,69,76,334,C,
孩子也是有固有性格{CC性个}的一个人。,200505109525202131,日本,2,200505,父母是孩子的第一任老师,70,60,52,69,85,321,未参加,
可是我父亲的爱好是“考古学”，他教我很多考古方面的知识，而且有时候他带我去爬山，我们采集{CC采取}了一些古代的东西。,200505109525202284,日本,2,200505,父母是孩子的第一任老师,70,70,46,69,63,306,C,
父母要自觉，自己是孩子的第一任老师。,200505109525202583,日本,2,200505,父母是孩子的第一任老师,65,90,46,53,69,314,未参加,
可是，两[F兩]个[F個]人能不能合起来是很重要的。,200505951922250006,美国,2,200505,最理想的结交方式,60,65,70,69,79,326,C,
异[F異]性{CJX}人类[F類]相识的方式会有所不同。,200505522522250001,缅甸,2,200505,最理想的结交方式,80,90,36,51,66,318,未参加,
我的父母[BD、]他们不是从[F從]小就在一起长[F長]大的，是在偶然的机会中认[F認]识{CJsd}，他们[F們]是{CQ在}相处过一段不太短的时[F時]间、[BC，]彼此都互相了解后[F後]才走在一起的。,200505522522250034,缅甸,2,200505,最理想的结交方式,60,75,70,66,84,341,C,
某些男士与女士或许会是{CC有}一些“单身主义”者，但在{CC1对于}传统观念{CJX}“男大当婚，女大当嫁”之下还是得把自己的原则给改了。,200505522522110006,缅甸,1,200505,最理想的结交方式,70,75,66,73,91,364,C,
一天我不舒服{CC好在}，所以不去上学{CC上班}。,200505522522110010,缅甸,1,200505,最理想的结交方式,40,60,30,38,48,193,未参加,
一个孩子一出生第一次接触的，看见的人无疑是自己的父母。,200505201540200302,印度尼西亚,2,200505,父母是孩子的第一任老师,60,80,71,63,69,330,C,
他们从什么时候开始对孩子进行教育呢？,200505201542200068,越南,2,200505,父母是孩子的第一任老师,95,75,67,51,89,372,C,
越南人有一句话，大概意思是：小孩子上三岁，全家学说话。,200505201542200390,越南,2,200505,父母是孩子的第一任老师,75,70,88,71,89,382,B,
母虎{CC虎[B虑]母}会帮助它学好走路{CC2它的第几步步伐}。,200505501540100078,印度尼西亚,1,200505,父母是孩子的第一任老师,65,45,35,39,34,197,未参加,
我觉得这一点说明{CD不管}我父母把外甥女{CC3外孙[Psun]}当成了成熟[Pshu]的人和教了她好多个有用的东西，可最重要{CQ的是}他们教{CC学}会了她怎[B乍]么去爱和尊重[Pzunzhong]其他人[BQ，]尤[B又]其是自己的父母。,200505206547200132,哈萨克斯坦,2,200505,父母是孩子的第一任老师,80,60,56,55,50,288,未参加,
跟着父母长大，跟着父母学习，跟着他们思考问题，然后最后要胜过他们。,200505332529100001,泰国,1,200505,父母是孩子的第一任老师,60,55,71,67,54,288,未参加,
因为从小孩儿{CC3小时}{CJX}他们培[B陪]养我们到长大。,200505332540200004,印度尼西亚,2,200505,父母是孩子的第一任老师,55,60,31,29,34,190,未参加,
多沟通，{CD和}{CJ-zy多}了解孩子……使他们能在好的环境下成长，为社会{CJ-sy作}贡献。,200505332512100056,菲律宾,1,200505,父母是孩子的第一任老师,50,75,69,59,80,317,未参加,
因此，孩子们一定会受到父母的影响。,200505024922200390,美国,2,200505,父母是孩子的第一任老师,65,80,44,45,47,269,未参加,
现在的孩子们不仅有好的环境而且在他们的身边有着很好的父母。,200505024542200397,越南,2,200505,父母是孩子的第一任老师,65,70,56,63,52,292,C,
对于吸烟的控制越来越严厉。,200509105922200001,美国,2,200509,吸烟对个人健康和公众利益的影响,65,75,69,54,54,304,C,
姓名：×××地址：402号班丹花园新加坡快乐家庭旅游公司李文先生：应征[F徵]导游一职您好：得知贵公司正欲聘请[F請]男导游，小弟对此职位深感兴趣，故特地写信应征[F徵]此职位。,200509534533150015,新加坡,1,200509,一封求职信,65,65,77,53,93,337,C,
所谓读万卷书不如行万里路。,200509534533250094,新加坡,2,200509,一封求职信,80,90,84,64,91,404,B,
本人{CD的}中学与初级学院均在新加坡顶尖学府就读。,200509534533150105,新加坡,1,200509,一封求职信,85,80,86,75,95,414,B,
我今年二十六岁，女性，是一名新加坡公民。,200509534533250145,新加坡,2,200509,一封求职信,80,75,91,71,91,399,B,
它们包括{CD了}新加坡，马来西亚，中国，英国和法国。,200509534533250145,新加坡,2,200509,一封求职信,80,75,91,71,91,399,B,
1987年，我以优异的小学毕业成绩考入文惠中学。,200509534533150170,新加坡,1,200509,一封求职信,70,75,59,58,97,348,C,
在此本人衷心地希望贵公司可聘请我当导游。,200509534533250167,新加坡,2,200509,一封求职信,65,70,79,80,84,364,C,
在修读此科目时，我还曾经为两家公司设计广告，来推销他们的产品。,200509534533150183,新加坡,1,200509,一封求职信,65,70,75,66,82,344,C,
因为在二零零八年，我国将举办奥运会，这一定会让贵公司的旅游人士增加。,200509534533250190,新加坡,2,200509,一封求职信,70,70,84,62,77,351,C,
我毕业于{CC至}新加坡国立大学旅游科，在旅游业{CD工作}有两年的{CQ工作}经验。,200509534533250192,新加坡,2,200509,一封求职信,70,70,77,62,91,358,C,
有些人特别喜欢流行歌曲，甚至对自己喜欢{CQ的}流行歌星达到痴迷的程度，可恰[B悄]恰[B悄]相反，有些人不喜欢流行歌曲，甚至非常蔑视流行歌曲。,200510111523200022,韩国,2,200510,我看流行歌曲,65,70,65,54,69,309,C,
这样[BQ，]现在的歌星是在少[B小]年之间八九不离[C]十想做的梦{CJ？}，但是我要说有梦的人，不要看歌星的外貌，只要看歌的内涵{CC内边}，那么你可以理[B里]解歌星真正的意思，歌星不是我们的全部，歌星只是我们心理的安慰剂{CC安食地}。,200510111523100785,韩国,1,200510,我看流行歌曲,50,65,53,42,50,241,未参加,
还要自己知道自己[B已]喜欢什么样的歌不要总是学别人。,200510111523100863,韩国,1,200510,我看流行歌曲,70,65,53,36,57,267,未参加,
别人说，{CQ在}首都呢，常常能见歌手们。,200510111523200864,韩国,2,200510,我看流行歌曲,55,55,25,50,35,200,未参加,
我是个特别喜欢流行歌曲的人。,200510111523200876,韩国,2,200510,我看流行歌曲,65,90,74,67,91,378,B,
世界上有很多歌星，有很多歌。,200510111523201064,韩国,2,200510,我看流行歌曲,50,50,44,44,47,213,未参加,
还有我在中国留学，所以都不知道韩国的流行歌曲是什么。[BC？],200510111523201103,韩国,2,200510,我看流行歌曲,55,60,42,32,40,210,未参加,
首先，我是一个非常喜欢流行歌曲的人。,200510111523101253,韩国,1,200510,我看流行歌曲,75,85,72,67,55,347,B,
所以我想对流行歌曲最重要的是有分辨{CC分别}能力，有约束{CC务节}能力的{CJs}。{CP还有对流行歌曲具有批评能力的话，让流行歌曲更发展，丰富。P},200510111523201588,韩国,2,200510,我看流行歌曲,60,65,46,44,50,248,未参加,
而且，我很喜欢唱歌、跳舞。,200510111523201622,韩国,2,200510,我看流行歌曲,80,75,65,56,69,336,C,
音乐的发展变化呢，那是几乎完全随着每个民族、[BC，]每个音乐家所要求，口味的{CJ？}。,200510111523101843,韩国,1,200510,我看流行歌曲,65,55,39,54,67,262,未参加,
如今，很多著名的运动员、[BC，]艺术家都是在他们年幼时就得到了很好的栽培，在成年之后其才华便得到{CQ了}发挥。,200510919919150003,加拿大,1,200510,父母是孩子的第一任老师,80,95,71,71,99,411,B,
父母对[F對]孩子的影响[F響]是日积[F積]月累的。,200510919919250020,加拿大,2,200510,父母是孩子的第一任老师,90,85,68,85,100,425,B,
等到孩子们能简单表达自己{CQ的}思想的时候，孩子们就慢慢地学着{CC会}去判断。,200510919501250027,中国,2,200510,父母是孩子的第一任老师,85,95,92,85,94,447,A,
二来，节奏[B溱]感和唱词的速度有时异常的快，有时还听不懂。,200510205919100142,加拿大,1,200510,我看流行歌曲,95,60,67,65,91,369,C,
并且{CJ-zhuy他们}还反对对流行歌星{CD的}痴迷的人[BQ，]特别是学生，学生的任务是学习，不能因为其他的事不学习。,200510302523200002,韩国,2,200510,我看流行歌曲,75,75,65,59,72,336,C,
因此我喜欢听流行歌曲。,200510302523100024,韩国,1,200510,我看流行歌曲,70,90,63,61,77,354,C,
歌曲的种类[C]是很多，有人说看{CJ+sy有}一个人听什么样的歌就可以知道现在他的心情怎么样。,200510302523100032,韩国,1,200510,我看流行歌曲,65,55,44,32,59,237,未参加,
随着{CC按照}时代的变化流行歌曲也有了很大的变化。,200510302523200048,韩国,2,200510,我看流行歌曲,85,70,65,56,69,336,C,
我觉得除了我以外别的人也和我一样。,200510302523200065,韩国,2,200510,我看流行歌曲,95,70,67,48,77,351,C,
我也每天大概{CQ在}一{CC1}个时间听流行歌曲，我朋友很喜欢唱流行歌曲。,200510302523100070,韩国,1,200510,我看流行歌曲,65,50,46,26,40,208,未参加,
还有我觉得流行歌曲反映{CD到}现在社会的流行和我们的想法。,200510302523100077,韩国,1,200510,我看流行歌曲,65,65,67,54,74,309,C,
流行歌曲给我们感到安慰、[BC，]快乐。,200510302523100078,韩国,1,200510,我看流行歌曲,60,60,49,50,57,258,未参加,
那些高中学生站着大喊，我们又看不见，又听不见。,200510302523200080,韩国,2,200510,我看流行歌曲,70,90,60,59,79,351,C,
音乐是在人类[B娄]历史当中不能忽视的一种重要因素。,200510302523200082,韩国,2,200510,我看流行歌曲,65,85,70,61,87,358,C,
但是流行歌曲的负面影响不会使其正面影响受损，我们要的是容易接近的文化而不是高高在上，傲视一切的文化。,200510302523100123,韩国,1,200510,我看流行歌曲,80,90,81,75,91,412,B,
总而言之，我认为为了你们的将来最好是不听流行音乐。,200510302523100152,韩国,1,200510,我看流行歌曲,90,70,77,54,77,361,C,
在无味枯燥{CC干躁}的日常生活里它给人们带来一定的话题，因为流行歌曲是反映当时社会的一方面。,200510302523200188,韩国,2,200510,我看流行歌曲,60,50,72,48,50,260,未参加,
我是不太喜欢流行歌曲的。,200510302523100245,韩国,1,200510,我看流行歌曲,65,70,53,44,57,275,未参加,
中国流行音乐{CJ+sy是}含有东洋文化、也有特别的韵味{CC风味}。,200510302523100267,韩国,1,200510,我看流行歌曲,50,55,49,40,47,220,未参加,
谈到流行歌曲，如果在二十年前，我实在喜欢流行歌曲，也许因为年龄的关系吧！,200510540540200018,印度尼西亚,2,200510,我看流行歌曲,70,75,51,40,62,287,未参加,
好像生在歌词中的美景{CQ中}一样。,200510540540200018,印度尼西亚,2,200510,我看流行歌曲,70,75,51,40,62,287,未参加,
按朋友的意见，先听的歌是90年代的{CD包[B抱]括港台地区}在中国[D音]乐坛红过的[BD‘]周华健[BD’]的歌。,200510650523150186,韩国,1,200510,我看流行歌曲,70,75,60,59,72,325,C,
那时候这个情况变成命运，因为这么像[B象]的两个人怎么能在离老家远远的地方见面？,200505610610150016,法国,1,200505,最理想的结交方式,60,70,36,60,50,261,未参加,
我认为最理想的相识方式是当大家都一起参加某项活动{CQ时}而认识，{CQ然后}再结交不迟。,200505680519250019,马来西亚,2,200505,最理想的结交方式,65,80,79,60,79,351,C,
对我来说，我知道他们在我心中的重要性，也感非常幸[B兴]运[Pyun]。,200509602801250014,澳大利亚,2,200509,父母是孩子的第一任老师,65,75,85,58,77,347,C,
要是那个人是朋友或者亲戚介绍给你认识的，[BC、]那还能说自然吗？,200505651634150001,英国,1,200505,最理想的结交方式,85,65,39,44,53,275,未参加,
说实话我来到北京前，非常讨厌自己是个独生女。,200104124525200028,日本,2,200104,一封写给父母的信,65,75,38,56,42,263,未参加,
因此我曾经恨过你们……，真的。,200104124525200028,日本,2,200104,一封写给父母的信,65,75,38,56,42,263,未参加,
好吧，我先写这么多，现在我要上课去{CQ了}。,200104124542200026,越南,2,200104,一封写给父母的信,80,80,60,51,54,317,C,
我毕业以前，一定考过{CC取得}HSK高级。,200104124525200058,日本,2,200104,一封写给父母的信,70,75,38,37,45,254,未参加,
我呢？,200104124525200101,日本,2,200104,一封写给父母的信,70,50,33,42,47,225,未参加,
她跟男朋友是在北京留学期间认识的。,200104124525200154,日本,2,200104,一封写给父母的信,65,80,58,68,49,308,C,
在学校附近的业余学校学习。,200104124525100192,日本,1,200104,一封写给父母的信,75,75,44,54,54,292,未参加,
6月份[B分]是夏[B复]天了，天气有点热，可是最好下[L]个季节来游玩。,200104124540200184,印度尼西亚,2,200104,一封写给父母的信,70,85,52,39,67,305,未参加,
因为我不习惯在韩国生活，您也知道！,200104124523100197,韩国,1,200104,一封写给父母的信,80,65,27,16,29,205,未参加,
关于{CC2对}我的学习[BQ，]我也遇到了一点儿问题。,200104124540200212,印度尼西亚,2,200104,一封写给父母的信,70,65,27,23,38,209,未参加,
他对我很好，尽管平时没怎么有时间在一起，可他很细心，处处为我着想。,200104124542200213,越南,2,200104,一封写给父母的信,70,70,82,63,90,363,C,
现在有了新的同屋。,200104124523200256,韩国,2,200104,一封写给父母的信,70,75,41,42,45,262,未参加,
考试{CLH}完以后，开始写毕业论文，顺利通过的话，六月末就毕业了。,200104124525200250,日本,2,200104,一封写给父母的信,65,75,55,63,61,306,C,
再见[BQ!]×××2001年4月15日,200104124525100262,日本,1,200104,一封写给父母的信,70,75,36,49,47,266,未参加,
您最近过得怎么样？,200104124525200281,日本,2,200104,一封写给父母的信,70,60,41,44,56,256,未参加,
最近我总是想毕业以后的事情。{CQ是},200104124523100302,韩国,1,200104,一封写给父母的信,70,65,58,63,61,303,C,
爸，我对您的请求只有这个而已。,200104124523100333,韩国,1,200104,一封写给父母的信,65,55,68,58,63,291,C,
孩儿大约六月份已毕业了，将很快地与你们相逢。,200104124540200349,印度尼西亚,2,200104,一封写给父母的信,85,85,63,37,56,321,未参加,
如果爸爸、妈妈已经决定{CQ了}什么时候来北京，以[B与]及飞机的班机号码、达到时间[BQ，]{CQ请}通知我，这样我就可以去机场接你们，然后我可以当你们的导游，带们们游览北京、天津等城市。,200104124540200361,印度尼西亚,2,200104,一封写给父母的信,95,90,60,63,72,379,C,
你们为了我和哥哥，太辛苦了。,200104124523200369,韩国,2,200104,一封写给父母的信,70,60,63,56,67,301,C,
亲爱的爸爸、妈妈：你们好！,200104124540200374,印度尼西亚,2,200104,一封写给父母的信,75,90,66,68,63,356,B,
妈、爸我也好想你们。,200104124523200390,韩国,2,200104,一封写给父母的信,70,80,52,44,42,278,未参加,
{CJ-zhuy我}刚刚学习日语，所以不知道[BD，]怎么写、[BC，]怎么说。,200104124523200428,韩国,2,200104,一封写给父母的信,70,75,33,37,31,235,未参加,
我还真想跟他聊聊天呢。{CD对于},200104124525100442,日本,1,200104,一封写给父母的信,60,65,44,56,67,275,未参加,
我的最近{CD情况}是比较忙。,200104124525100446,日本,1,200104,一封写给父母的信,65,55,38,44,38,222,未参加,
雇[B顾]佣我，一个外国人[BQ，]对您公司也有利[BQ。]因为我在中国呆{CC过}的时间比较长[BQ，]语言相[L]同[BQ，]这样就容易消除文化差异。,199200008632200022,匈牙利,2,199200,一封求职信,,,0,0,0,0,未参加,
对此也有人提出不同的意见，认为丈夫帮助妻子自杀，是在死者的要求下进行的，是为了解脱死者和家人的痛苦，不应该受到法律的制裁。,199604123523200035,韩国,2,199604,如何看待“安乐死”,60,80,29,32,29,217,未参加,
他们可能为了别人为了自己想了很多次吧。,199604124523200153,韩国,2,199604,如何看待“安乐死”,70,65,69,74,42,305,C,
但我们得先理解[C]他们，同情他们。,199604124523100139,韩国,1,199604,如何看待“安乐死”,65,65,63,54,44,275,未参加,
对病人来说，不只是身体[C]很痛、最重要的是精神上的痛[C]苦。,199604124606200349,比利时,2,199604,如何看待“安乐死”,65,55,56,66,65,289,未参加,
因他很痛苦而失去生存的意志。,199604123512100261,菲律宾,1,199604,如何看待“安乐死”,70,60,56,49,60,279,未参加,
可是，[BC、]得了不治之症，[BC、]还[C]有了身心{CC心身}两方面的很大的痛苦的时候，[BC、]决定他的人生结束的时间的权利，[BC、]我觉得得在他的手[C]中。,199604123525200163,日本,2,199604,如何看待“安乐死”,60,70,74,76,65,329,C,
这篇文章里的丈夫究竟应不应该受到法律的制裁呢？,199604124525200342,日本,2,199604,如何看待“安乐死”,65,80,77,79,88,377,B,
当然不一样。,199604124525200342,日本,2,199604,如何看待“安乐死”,65,80,77,79,88,377,B,
可是我主张的是再没有办法的人，对特别是得了一种不治之症的人来说，一直活下去是一个不可想[C]象[C]的痛苦。,199604123523200145,韩国,2,199604,如何看待“安乐死”,60,60,58,61,44,265,未参加,
要思考对方所了解的世界{CD如何}。,199610802801100005,澳大利亚,1,199610,如何解决“代沟”问题,80,75,57,61,59,323,C,
许多父母都认为现代的子女难管教，而他们的子女们呢，却认为很难和他们的长辈沟通，嫌他们啰嗦[C]，那是为什么呢？,199610512501250004,中国,2,199610,如何解决“代沟”问题,80,80,44,38,53,287,未参加,
第二，到了星期天，父母跟子女一起到公园去玩儿。,199610550523190012,韩国,1,199610,如何解决“代沟”问题,80,70,52,46,49,287,未参加,
所以他们情[B请]愿辛苦地劳动挣钱，让{CC给}孩子多学知识。,199610550523190013,韩国,1,199610,如何解决“代沟”问题,60,65,75,67,59,309,C,
我一个朋友有两个女孩子。,199610550523190015,韩国,1,199610,如何解决“代沟”问题,60,55,28,46,32,202,未参加,
互相努力最好。,199610550523290028,韩国,2,199610,如何解决“代沟”问题,65,55,65,42,53,262,未参加,
目前在韩国现代社会的“代沟”问[C]题是年轻人间[C]的重要问[C]题之一。,199610550523190071,韩国,1,199610,如何解决“代沟”问题,65,70,54,40,41,256,未参加,
在做团体的工作时，若{CD名名}认为自己不用出什么力，让别人完成工作的话，后果就会是，工作不能如期完成。,199603533533200076,新加坡,2,199603,由“三个和尚没水喝”想到的……,90,80,60,56,84,365,C,
在现今社会，人多事杂[F雜[C]]。,199603533533100095,新加坡,1,199603,由“三个和尚没水喝”想到的……,60,50,58,49,68,265,未参加,
而其他两个和尚也为了比其他人更早起。,199603533533200096,新加坡,2,199603,由“三个和尚没水喝”想到的……,90,70,74,76,91,394,B,
没有人肯写意[B义]见信给上司，大家都抱着反正我来上班，上司给我什么名用，我就得服从。,199603533533100106,新加坡,1,199603,由“三个和尚没水喝”想到的……,90,80,69,74,63,371,B,
三天后，和尚们的努力终于使{CD到}庙的周围出现了不少口井，井里都装满了水。[BC，],199604680519100515,马来西亚,1,199604,由“三个和尚没水喝”想到的……,90,70,66,79,77,375,C,
想个办法吧。,199605104523100112,韩国,1,199605,由“三个和尚没水喝”想到的……,70,70,77,67,68,340,C,
我也不例外。,199605104525200116,日本,2,199605,由“三个和尚没水喝”想到的……,60,70,85,67,77,344,C,
当然，每{CC各}一个人的好处{CD是}人数越多利益越少。,199605104525200118,日本,2,199605,由“三个和尚没水喝”想到的……,65,65,58,51,68,291,C,
像这三个和尚一样大家都为自己的利益{CJX}愿意拼[C]命工作、奋斗努力的{CJsd}，但为了别人、为了大家、为了整个社会共同的利益就不想消耗自己的力量了。,199605104525100132,日本,1,199605,由“三个和尚没水喝”想到的……,85,70,88,76,87,397,B,
那时日本遭遇空前绝后的大干旱[BQ，]所以那年的大米收获情况相当差。,199605104525200251,日本,2,199605,由“三个和尚没水喝”想到的……,75,70,52,79,82,347,C,
这可能是自己不会理解别人，也可能是钱{CJ-zy不愿}用在别人的身[C]上，无论如何他是只想自己的人，如果他没钱的话呢，能让别人帮他吗？,199605104523100299,韩国,1,199605,由“三个和尚没水喝”想到的……,80,65,63,49,46,291,C,
我[C]们也是{CJX}在生活当中一定碰到不太称心的事{CJs}[BQ，]但我们[C]也[C]像[C]这些和尚一样做的话，比如说我[C]们朋友之间有矛盾，但互相不让步，最后分手了，要是这[C]样[C]怎么行呢？,199605104525100351,日本,1,199605,由“三个和尚没水喝”想到的……,70,75,60,67,70,331,C,
我觉得只有一个方法，这唯一的方法是自己的希望应该自己去求之。,199605104523100366,韩国,1,199605,由“三个和尚没水喝”想到的……,55,65,55,49,63,269,未参加,
有一个和尚要活下去的话，他应该亲自去抬水，这时所有的事情{CC5全事}{CJ-zy都}为了自己做{CJs}。,199605104525100379,日本,1,199605,由“三个和尚没水喝”想到的……,65,50,41,42,39,218,未参加,
他认为，如果只有一个人的话，他会{CC将}[C]立即去看她。,199605104525100384,日本,1,199605,由“三个和尚没水喝”想到的……,70,60,46,63,54,278,未参加,
我应该{CC2该}当大家的模范，所以就这样{CC如此}做下去{CD的}。,199605550523290081,韩国,2,199605,由“三个和尚没水喝”想到的……,65,80,80,67,70,350,B,
她确实是对我影响最大的人。,199704123610200138,法国,2,199704,记对我影响最大的一个人,85,85,53,71,68,357,C,
我的童年是很幸福的。,200110540540150059,印度尼西亚,1,200110,我的童年,70,90,74,51,83,361,C,
直到中学以后，甚至今天当了奶奶{CJ-zhuy我}还是保持这种兴趣和爱好，每天总是爱听、爱唱，再没有机会就哼哼几句也觉得满足{CC满意}。,200110540540250065,印度尼西亚,2,200110,我的童年,70,90,68,49,83,353,C,
如今看现代儿童的所谓“太空式”生活，有点不太“那个”。,200110540540250090,印度尼西亚,2,200110,我的童年,85,85,77,80,88,410,A,
看着妹妹被缝得又肿[F腫]又红的手臂，我想到自己不对{CJs}，以此不敢再对妹妹很见{CY}了。,200110540540250155,印度尼西亚,2,200110,我的童年,65,65,58,61,67,300,C,
善长：爬山、游泳、歌唱、歌剧表演等[C][BQ。]现附上成绩册以及有关证件，望您[C]查阅[C]并[F並]赐[C]以厚爱，即{CC既[C]}感激万分。,199312533533200063,新加坡,2,199312,一封求职信,90,75,41,54,75,329,未参加,
虽然我没有在旅游公司工作过的经验，但我觉得在性格{CC性子}上我很适合当导游。,199312533533200074,新加坡,2,199312,一封求职信,80,85,67,67,75,368,B,
6）有两年导游经验，精通世界人文地理。,199312533533200128,新加坡,2,199312,一封求职信,90,80,62,72,75,374,B,
我[C]希望贵公司能考虑我的申请，如果贵公司能录用我，我将尽心尽力为贵公司在旅游业方面作出贡献。,199312533533200143,新加坡,2,199312,一封求职信,90,90,55,45,75,353,未参加,
我想{CJ-sy做}经理工作，[BC.]我已经工作五年多了。,199312123525100108,日本,1,199312,一封求职信,45,55,25,48,45,195,未参加,
因而，对旅游业进行过研究。[BC.],199312124523200148,韩国,2,199312,一封求职信,80,65,74,45,57,310,C,
再见。,199312124635100149,俄罗斯,1,199312,一封求职信,70,65,43,39,43,247,未参加,
我现在是待业青[C]年。,199312123719200204,喀麦隆,2,199312,一封求职信,65,65,22,27,34,198,未参加,
我在报[F報]纸[B级]上看到了你们公司的招聘启[C]事[B示]。,199312123523200708,韩国,2,199312,一封求职信,55,60,50,36,41,223,未参加,
我在[C]等好消息。,199312123525200919,日本,2,199312,一封求职信,45,55,41,61,36,215,未参加,
另外我会点{CJX}说汉语。,199410550523101905,韩国,1,199410,一封求职信,75,65,48,58,46,280,C,
