错句,作文编码,国籍,性别,考试时间,作文题目,口试分数,作文分数,听力分数,阅读分数,综合分数,总分,证书
我也不例外，我的童年既有欢乐，也有悲伤。,200109529529151009,泰国,1,200109,我的童年,80,75,67,42,72,327,C,
而我的童年是充满伤心和悲伤。,200110540540150011,印度尼西亚,1,200110,我的童年,75,90,66,44,63,332,C,
每当被父母斥责{CC斥罰}的时候，外婆总是护着我。,200110540540250018,印度尼西亚,2,200110,我的童年,70,90,63,63,79,358,C,
白天上学时，除{CD家里}吃饱外，还有零用钱，我把这些零用钱大部分[B份]都存起来。,200110540501250129,中国,2,200110,我的童年,80,90,68,49,92,374,C,
在此，我必须说明的是，“可恨”是我的小学朋友在空闲时开玩笑时说的。,200103680519101601,马来西亚,1,200103,我的童年,75,80,61,72,85,364,B,
夕阳西下往往是我最期待的时刻，那时，玩也玩累了，就守在门前，等舅舅的渔船。[BC，],200103680519201612,马来西亚,2,200103,我的童年,85,85,86,83,93,427,A,
××2001年4月15号,200104124538100152,伊朗,1,200104,一封写给父母的信,65,85,49,39,47,275,未参加,
我最近的生活大概是这样。,200104124510100275,朝鲜,1,200104,一封写给父母的信,80,90,68,73,81,387,B,
××上。,200104124730100430,毛里求斯,1,200104,一封写给父母的信,65,85,55,23,67,285,未参加,
最近是换节期，[BC。]早晚温差{CC温度差}相当大，[BC。]{CD会}容易得感冒，[BC。]早上多穿件衣服出门吧。,200105550523250299,韩国,2,200105,一封写给父母的信,60,65,41,44,49,242,未参加,
最近过得怎么样？,200105550523250328,韩国,2,200105,一封写给父母的信,75,70,66,56,56,312,C,
第二天，我们的中国朋友带我们去郊外参观。,200105209525200056,日本,2,200105,我的一个假期,70,70,39,51,44,262,未参加,
男朋友的家人都为了我们出来到机场。,200105201525200050,日本,2,200105,我的一个假期,70,70,57,54,41,280,未参加,
我们知道了不少的事。,200105201525200075,日本,2,200105,我的一个假期,65,80,60,51,50,294,C,
之所以这样决定是因为我来中国以后{CQ除了}留学生汉语班以外没参加过其他的课程，平时老师跟我们说的汉语的发音特别清晰易于留学生理解，但跟着中国人参加培训班的话，老师讲的中文也要快一些，这样的话不仅能够锻炼汉语听力，同时还可以学会一些知识。,200105201525200078,日本,2,200105,我的一个假期,80,70,80,56,85,361,C,
真让我放松。,200105302525200046,日本,2,200105,我的一个假期,65,70,67,51,50,289,C,
冲绳县是在日本的最南边儿的一个小岛[B乌]，就像中国的海南岛[B乌]一样。,200105215525100002,日本,1,200105,我的一个假期,65,65,67,70,74,325,C,
终于人多了，反而{CC反正}没有水喝了。,200105109525200599,日本,2,200105,由“三个和尚没水喝”想到的……,70,70,48,62,53,291,C,
果然{CD在}水筒里已经挑好了满满的水。,200105109525100691,日本,1,200105,由“三个和尚没水喝”想到的……,70,60,61,64,57,297,C,
为了社会为了别人做事。,200105109525200695,日本,2,200105,由“三个和尚没水喝”想到的……,65,65,36,55,50,255,未参加,
每一个人都依赖别人帮自己做事，你看我我看你{CC6你眼看我眼}，没完没了。,200105109634100711,英国,1,200105,由“三个和尚没水喝”想到的……,80,70,68,66,84,358,C,
”但是大家都是一样的想法，就没有人去抬水。,200105109525200725,日本,2,200105,由“三个和尚没水喝”想到的……,65,70,70,58,66,315,C,
。,200105109525100732,日本,1,200105,由“三个和尚没水喝”想到的……,65,60,41,55,57,261,未参加,
有了这些[BQ，]一个人的思考和行为的一致{CJ？}和三个人之间的沟通才有可能[BQ，]三个人都能喝水。,200105109525100751,日本,1,200105,由“三个和尚没水喝”想到的……,65,60,50,62,82,302,未参加,
两[F兩]个人不能分别了，只需要两[F兩]个人抬，就{CC才}能得到水喝。,200102522522250017,缅甸,2,200102,由“三个和尚没水喝”想到的……,70,75,33,44,26,237,未参加,
每个人在成长[F長]的过程中必须要有一种自我改进[F進]的精神，把一些不良陋习[F習]改成对自己和社会都有帮助的好习[F習]惯。,200102522522150023,缅甸,1,200102,由“三个和尚没水喝”想到的……,85,65,74,62,77,352,C,
然而，由于身体原因，我未能发挥水平，没能考上清华——他梦寐以求的学府，这对他是多大的打击，可是出乎我的意外，甚至大家的意外，他竟然没有半点责备我，甚至还鼓励我继续努力。,200203533533250020,新加坡,2,200203,记对我影响最大的一个人,85,85,81,77,95,418,B,
长期在医院里过日子等死，我很痛苦，家人也痛苦的。,200205204525200045,日本,2,200205,如何看待“安乐死”,65,60,19,60,54,241,未参加,
因为许多人同意安乐死，[BC、]所以说起安乐死，几乎把全国分成{CC成为}两半，社会就议论纷纷。,200205204525200047,日本,2,200205,如何看待“安乐死”,65,60,41,60,68,277,未参加,
现在，在日本也不能进行安乐死。,200205204525200087,日本,2,200205,如何看待“安乐死”,60,75,41,45,39,246,未参加,
日本法律界也正在考虑{CD对}安乐死的问题。,200205204525100110,日本,1,200205,如何看待“安乐死”,70,80,66,63,44,313,C,
我估计这样的{CQ和}安乐死有关的事件以后会越来越多{CC4增加}。,200205204525200165,日本,2,200205,如何看待“安乐死”,75,70,69,56,70,329,C,
所以，如果妻子的要求是安乐死的话，丈夫也应该帮她自杀。,200205224525200041,日本,2,200205,如何看待“安乐死”,70,70,46,49,46,269,未参加,
这篇文章中的丈夫，为了让她自杀而帮助的{CJsd}。,200205201525200095,日本,2,200205,如何看待“安乐死”,70,70,63,63,80,334,C,
随着世界变化、社会变化、环境变化以及衣食住行的变化，我们人类怎么不会变化{CC变}！[BC。],200210529529251008,泰国,2,200210,如何解决“代沟”问题,70,65,51,40,53,265,未参加,
要解决这问题，一方面晚辈应该给{CC晚辈}一些时间让他们有一个适应的过程；另一方面，长辈也应该多学习，多接触新事物，这样就会与晚辈有更多的共同语言，在思想感情上有更多的交流，有利于解决“代沟”的问题。,200210529529151028,泰国,1,200210,如何解决“代沟”问题,95,80,87,84,93,435,A,
代沟，意思是指两代人（父母与子女）之间在行为方式、生活态度以及价值观[F觀]念等方面存在的差异。,200210540540150038,印度尼西亚,1,200210,如何解决“代沟”问题,70,85,73,73,70,363,B,
但是面对挫折时，人人都会有不同的反应{CC反映}。,200205109610101076,法国,1,200205,如何面对挫折,80,80,65,71,57,345,B,
弟弟在家里还是那么调皮吗？,200205680519250018,马来西亚,2,200205,一封写给父母的信,90,80,57,61,86,369,C,
我班的老师循循善诱，同学们也乐于助人。,200205680519250018,马来西亚,2,200205,一封写给父母的信,90,80,57,61,86,369,C,
日本的有些公司已开始把不少资金{CC2钱财}投资到中国企业，不少公司愿意与中国合作。,200304131525200046,日本,2,200304,我学汉语是为了……,70,75,59,43,63,299,C,
上高中时，电影迷之间流行了亚州电影，我也随着流行看了很多。,200304131525200072,日本,2,200304,我学汉语是为了……,60,65,71,60,43,282,C,
了解一个国家的文化，必须学习那个国家的语言，否则不能说真正的了解。,200304131525200076,日本,2,200304,我学汉语是为了……,75,85,53,68,63,337,C,
还有，环境也美化了。,200304131525200154,日本,2,200304,我学汉语是为了……,65,65,74,68,77,333,C,
还有一个感觉是不安感，如果人在一个没有声音的地方，他会想“如果我从这地方出去也听不到声音，那我应该怎么办……？,200305576525100023,日本,1,200305,静音环境对人体的危害,70,60,36,30,66,247,未参加,
如今，在公共场所，允许抽烟的地方越来越少了。,200405109540200344,印度尼西亚,2,200405,吸烟对个人健康和公众利益的影响,65,60,54,66,63,291,未参加,
从我的观点来看，吸烟是一个坏的习[L]惯。,200405109619101291,罗马尼亚,1,200405,吸烟对个人健康和公众利益的影响,55,60,46,46,57,245,未参加,
因为吸烟的问题不仅仅{CC不渐的}是健[L]康的问题，而且{CC而}涉及到经济、企业权力问题，必须有政府来援[B缓]助市民造就{CC造成}健[B建]康的公共场所。,200405204922200459,美国,2,200405,吸烟对个人健康和公众利益的影响,70,60,66,56,54,291,C,
例如：孩子们也看，觉得有意思就想试试{CJX}抽{CQ抽}。,200405224520200036,蒙古国,2,200405,吸烟对个人健康和公众利益的影响,60,65,25,28,45,206,未参加,
这一点是错误的，吸烟的人大多数会变得更加肥胖。,200405209616200089,德国,2,200405,吸烟对个人健康和公众利益的影响,80,95,79,68,85,402,B,
由此可见，许多人重视吸烟对个人和公众{CJ+dy有很大}的影响。,200405271529200088,泰国,2,200405,吸烟对个人健康和公众利益的影响,70,80,49,44,51,284,未参加,
为什么呢？{CP是因为他从小模仿[C]我长大，所以他的所作所为非常像我，而且像他父亲。P},200505109525200178,日本,2,200505,父母是孩子的第一任老师,75,60,76,67,69,333,C,
父母会给孩子的有形无形的影响的确很大。,200505109525200211,日本,2,200505,父母是孩子的第一任老师,80,85,67,88,88,402,B,
我来中国以后，感觉到{CQ了}母亲[C]对我的几个影响。,200505109525200441,日本,2,200505,父母是孩子的第一任老师,70,80,60,54,69,323,C,
父母是孩子的第一任老师，[BC。]我同意[C]此看法。,200505109525200546,日本,2,200505,父母是孩子的第一任老师,65,80,77,67,72,349,B,
他们都给我很大的影响。,200505109525200546,日本,2,200505,父母是孩子的第一任老师,65,80,77,67,72,349,B,
教育、培养孩子时重要的是感情。,200505109525200549,日本,2,200505,父母是孩子的第一任老师,70,70,85,67,56,336,C,
这些是比较好的方面。,200505217525100093,日本,1,200505,父母是孩子的第一任老师,60,75,56,57,72,306,未参加,
做[B作]什么也首先要考虑这个事情伤不伤害别的人。,200505217525200085,日本,2,200505,父母是孩子的第一任老师,70,85,56,71,69,343,C,
遇[C]到困难[F難]就想起来{CJX}母亲。[BC.],200505217525200096,日本,2,200505,父母是孩子的第一任老师,60,65,31,39,52,230,未参加,
她一直在我的身旁，我感到很大的幸福。[BC，],200505204525200363,日本,2,200505,父母是孩子的第一任老师,65,80,63,57,76,329,C,
她继续学习{CD后}、我和弟弟长大{CD后}跟父母分开{CC离开}住以后，才[C]开始{CQ在}外面工作。,200505204525200368,日本,2,200505,父母是孩子的第一任老师,70,65,58,53,61,293,C,
因为孩子对父母没有感情的话，孩子想父母的时候想起来很多父母的缺[C]点，所以并不{CJX}感觉他们是自己的老师。,200505204525100380,日本,1,200505,父母是孩子的第一任老师,65,60,37,45,52,242,未参加,
因为孩子在世界上最早认识{CQ的}最聪[C]明的人是孩子自己的父母。,200505204525100473,日本,1,200505,父母是孩子的第一任老师,45,60,37,53,58,232,未参加,
我没有上过幼儿园，所以从出生到六岁一直在家里，而且当时我母亲也没上班，因此我几乎每天跟母亲在一起。,200505204525200539,日本,2,200505,父母是孩子的第一任老师,80,90,65,83,91,404,B,
我觉得“父母是孩子的第一任老师”这样的看法是完全对的。,200505204525100578,日本,1,200505,父母是孩子的第一任老师,55,70,63,61,67,300,C,
随着导游，我们也背着机器进水了。[BC，],200105205525200064,日本,2,200105,我的一个假期,70,75,67,70,63,334,C,
与南浦大桥[B轿]比起来，扬[F揚]浦大桥[B轿]稍微小一点，不过在桥上{CJX}站{CJ+buy起来}，心胸就开阔了许多。[BC，],200105205525100076,日本,1,200105,我的一个假期,65,75,67,63,74,331,C,
我觉得“读万卷书不如行万里路[BD。]”是对的。,200110602801250001,澳大利亚,2,200110,我的一个假期,80,70,85,61,85,371,C,
我快步入四分之一的世纪了！,200110801519250003,马来西亚,2,200110,我的一个假期,80,75,77,68,66,357,B,
而我却不能和其他一般人一样，可以到处游玩、[BC，]松懈身心，这都是因为经济上的不足，所以我都把假期都花在兼职工作上。,200110801519250007,马来西亚,2,200110,我的一个假期,70,85,82,75,96,400,B,
这样，我通过上述的困难改变了自己的人生观。,200112576525200008,日本,2,200112,如何面对挫折,70,65,60,69,61,311,C,
“哎哟，这不是雪吗？,200105271525200022,日本,2,200105,我的一个假期,70,75,60,58,55,307,C,
通过旅游[F遊]我们可以了解{CC理解}中国，也可以提高自己的汉语水平。,200105271525100080,日本,1,200105,我的一个假期,65,60,44,46,50,248,未参加,
经过这次旅游，我得到了很大的收获[F獲]。,200105217525200017,日本,2,200105,我的一个假期,70,85,70,65,85,367,C,
我终于踏上了韩国{CJ-zxy的土地}，真没想到，机场到处都有日本游客。,200105217525200023,日本,2,200105,我的一个假期,65,70,62,58,57,298,C,
确实万里长城的雄伟景观让人感动{CC震动}。{CQ对},200105204525100035,日本,1,200105,我的一个假期,70,80,70,46,72,328,C,
今年五一劳动节之际，我参观{CC访问}了一个苗寨。,200105204525200086,日本,2,200105,我的一个假期,70,75,57,65,70,326,C,
”你们睡觉的时候也想我，“我们的孩子好好儿地睡吗？,200105550523150101,韩国,1,200105,一封写给父母的信,70,65,49,54,56,280,C,
顺祝身体健康儿子××敬上2001年5月12日,200105550523150118,韩国,1,200105,一封写给父母的信,70,75,71,56,67,328,C,
我想我真{CD有}幸运，有您们这样温和、[BC，]多情的父母，我感到幸福[B富]。,200105550523250152,韩国,2,200105,一封写给父母的信,75,70,71,51,47,303,C,
我为[F為]了改你的口头禅[F禪]，明年我一定找到工作后，跟妈[F媽]喜欢的××结婚。,200105550523150161,韩国,1,200105,一封写给父母的信,70,60,55,49,72,291,未参加,
给母亲[F親]和父亲[F親]今天我突然给您一封信。,200105550523150166,韩国,1,200105,一封写给父母的信,70,65,25,32,38,216,未参加,
给您们报恩！[BD！],200105550523250176,韩国,2,200105,一封写给父母的信,70,65,58,47,74,300,C,
如果他有理亏{CJy}，事后就会勇于承认错误。,200105550523250194,韩国,2,200105,一封写给父母的信,65,65,14,37,45,210,未参加,
我知道不是因为那个东西高兴而我的情义高兴{CJ？}。,200105550523250199,韩国,2,200105,一封写给父母的信,65,65,55,49,70,288,未参加,
再见。,200105550523250214,韩国,2,200105,一封写给父母的信,75,65,49,47,63,286,未参加,
妈妈！,200105550523250217,韩国,2,200105,一封写给父母的信,65,60,55,47,51,261,未参加,
不过，最近我感觉得到您们也变老，我看到您们的白色头发真的很心酸。,200105550523250239,韩国,2,200105,一封写给父母的信,65,70,60,58,58,297,C,
如果妈没打过电话[BQ，]我就不能生活在北京。,200105550523250289,韩国,2,200105,一封写给父母的信,70,65,66,42,58,287,C,
您也知道您的血压高，喝酒对高血压非常危险啊！,200105550523250356,韩国,2,200105,一封写给父母的信,75,75,74,65,65,344,B,
我要努力{CD的}。,200105550523250369,韩国,2,200105,一封写给父母的信,65,75,60,73,51,311,C,
我这次利用父母节给你们写信。,200105550523250404,韩国,2,200105,一封写给父母的信,70,70,85,63,63,339,C,
我连一天也没忘记过妈妈你的辛苦。,200105550523250428,韩国,2,200105,一封写给父母的信,70,70,47,39,54,268,未参加,
爸爸、[BC，]妈妈，您们含辛[B心]菇苦地[B的]养育了我们，如今您们才五十多岁的年纪，两鬓却染上了白霜。[BC，],200105550523250443,韩国,2,200105,一封写给父母的信,70,90,79,70,83,385,B,
我还是个小孩子您们好！[BC？],200105550523150476,韩国,1,200105,一封写给父母的信,80,75,63,65,79,353,C,
不过从小就习惯了，现在很难改过来。,200105550523250480,韩国,2,200105,一封写给父母的信,70,70,60,61,54,303,C,
我已经大学四年级了。,200105550523250480,韩国,2,200105,一封写给父母的信,70,70,60,61,54,303,C,
我有机会。,200105550523250496,韩国,2,200105,一封写给父母的信,70,70,49,54,63,294,C,
妈妈一边哭着一边跑到我身边，就背我去医院了。,200105550523250512,韩国,2,200105,一封写给父母的信,70,65,60,63,56,300,C,
有一个和尚，他本来有习惯{CJX}到山底下自己挑水喝{CQ的}，可是一旦别人来，马上就扔了这个好习惯，希望别人去山下抬水。,200105109525100062,日本,1,200105,由“三个和尚没水喝”想到的……,70,65,63,75,84,343,C,
我要强调的第一个是“谦让精神”和“自己{CQ承担}责任的精神，第二是想办法。,200105109525100102,日本,1,200105,由“三个和尚没水喝”想到的……,65,70,61,73,77,332,C,
寒假的时候，我在那儿跟孩子们过日子。,200105109525200350,日本,2,200105,由“三个和尚没水喝”想到的……,70,80,36,62,59,297,未参加,
有一天，我跟朋友们一起在校园的草坪{CC草原}上谈话，共有七[BD～]八个人，有一个人去买冰琪琳[BQ，]然后两个人又去了。,200105109525100360,日本,1,200105,由“三个和尚没水喝”想到的……,70,60,39,55,50,259,未参加,
在一座庙里有三个和尚。,200105109525100577,日本,1,200105,由“三个和尚没水喝”想到的……,65,60,45,40,44,237,未参加,
很{CC太}可惜的是连一个人也没考虑[F慮]到互相合作。,200105109525100627,日本,1,200105,由“三个和尚没水喝”想到的……,65,60,36,55,57,256,未参加,
一个人做一个事情比三个人一起合作做一个事情做起来十分容易{CJbi}。,200105109525200652,日本,2,200105,由“三个和尚没水喝”想到的……,65,60,57,64,59,288,未参加,
这样的话他们不会打架{CD呢}。,200105109510200674,朝鲜,2,200105,由“三个和尚没水喝”想到的……,70,65,61,58,57,297,C,
可以说，最有可能实现道德的人。,200105109525200753,日本,2,200105,由“三个和尚没水喝”想到的……,70,70,73,69,77,347,C,
对愿意[L]死的，无可救药的病人进行过剩的延长生命{CC4延命}{CQ的}处置可以说是一种生者的自私。{CD在},200205217525200073,日本,2,200205,如何看待“安乐死”,70,80,63,72,72,347,C,
那时候，我们看她的脸，她的样子，感觉很可怜[B令]。,200205217525200096,日本,2,200205,如何看待“安乐死”,65,65,21,45,35,215,未参加,
不过从另一个角度，就是国家、社会伦理的角度来看，这件事还是应该受到法律的制裁。,200205205525200020,日本,2,200205,如何看待“安乐死”,75,80,41,51,84,322,未参加,
我记得几年前跟我母亲谈过关于“安乐死”的话题。,200205205525200093,日本,2,200205,如何看待“安乐死”,75,70,66,33,42,275,未参加,
本来搞医学{CC2医}的人的义务是救人{CD命}，在物质方面呢，用发达的工具可以搞定。,200205206525100011,日本,1,200205,如何看待“安乐死”,70,65,49,42,58,270,未参加,
他的身上还有着体温——[BC，]几分钟以前，他还在世。,200205206525200009,日本,2,200205,如何看待“安乐死”,70,65,49,81,63,314,C,
因为我不希望自己爱的人去死，不管怎么痛苦都会希望她活下去，我还会和她去分担[B单]痛苦，[BC。]去解决问题。,200205206525200077,日本,2,200205,如何看待“安乐死”,75,70,71,40,32,277,未参加,
“安乐死”按法律{CQ上讲}是错误{CJsd}，而法律只有{CC2是为了}依法{CC依国}办事，[BC。]才能得到国家的安定{CC安稳}，法律对我们来说是无情{CJsd}，难道法律不能减少罪行吗？,200205332513200008,柬埔寨,2,200205,如何看待“安乐死”,70,60,49,40,37,241,未参加,
这个问题的主人公当然是我，[BC、]我上高中{CC高中学}的时候，我特别嫌[C]我父母每天在我的身边像教孩子一样干涉我，[BC。]所以我往往不{CC没有}上课而且老师布置{CC2交}的作业也不{CC没}做。,200209550523250030,韩国,2,200209,如何解决“代沟”问题,65,65,57,62,70,303,C,
我认为为了理解[C]的第[C]一步{CC段}是谈话。,200209550523250037,韩国,2,200209,如何解决“代沟”问题,65,55,57,57,40,256,未参加,
那{CC1那个}代沟{CJ-dy产生}的原因和解决的方法是什么？,200209550523250070,韩国,2,200209,如何解决“代沟”问题,65,65,48,45,42,249,未参加,
第一，两代人之间[C]需要共同{CC公同}的思想，而且{CQ要}互相了解对方的观点。,200209550523250107,韩国,2,200209,如何解决“代沟”问题,65,65,57,69,52,292,C,
“代沟”是指两代人之间在行为方式、生活态度以及价值观念等方面存在的差异。,200209550523250121,韩国,2,200209,如何解决“代沟”问题,65,70,42,67,68,298,未参加,
”内容就是把儿女们对父母亲的不满意{CC满足}或者父母亲对儿女的苦恼[B脑]解[C]决{CJba}。,200209550523250162,韩国,2,200209,如何解决“代沟”问题,65,60,39,52,56,255,未参加,
跟父母对话[B活]中可以理解父母的思想。,200209550523150257,韩国,1,200209,如何解决“代沟”问题,65,70,54,67,64,306,C,
所以代沟问题更受现代社会人们的观注。,200209550523250252,韩国,2,200209,如何解决“代沟”问题,65,65,48,74,52,288,C,
因此两代之间发生差异是当然的事情。,200209550523250260,韩国,2,200209,如何解决“代沟”问题,70,65,39,57,36,253,未参加,
那如何解决代沟问题？,200209550523250313,韩国,2,200209,如何解决“代沟”问题,65,75,66,76,74,343,C,
古代社会非常看重敬老、孝道思想。,200209550523150362,韩国,1,200209,如何解决“代沟”问题,70,70,60,67,58,313,C,
以前，比如在封建时代中{CC上}，这样的代沟可能是非常小的问题。,200209550523250358,韩国,2,200209,如何解决“代沟”问题,65,65,45,76,46,281,未参加,
上一辈用这个可以收集各种各样的信息。,200209550523250364,韩国,2,200209,如何解决“代沟”问题,65,65,33,45,48,240,未参加,
”可是他们什么都没有{CJX}反应{CC反映}。[BC.],200209550523250788,韩国,2,200209,如何解决“代沟”问题,65,60,36,49,40,233,未参加,
世界文化的变化速度越来越快，特别是人们之间沟通的方式。,200209550523250791,韩国,2,200209,如何解决“代沟”问题,70,70,48,71,50,297,C,
代沟{CC沟[B勾]代}问题是无论什么时代，都发生{CJsd}。,200209550523250815,韩国,2,200209,如何解决“代沟”问题,65,65,51,71,52,288,C,
不要排斥[B拆]他们的爱好{CC喜爱}，考虑一下他们为什么喜欢做这个。,200209550523250818,韩国,2,200209,如何解决“代沟”问题,70,70,51,74,50,303,C,
还有什么事情都一起做，一起工作，一起玩。,200209550523250840,韩国,2,200209,如何解决“代沟”问题,65,65,60,59,60,293,C,
聊天就是解决“代沟”问题的基本方法。,200209550523250920,韩国,2,200209,如何解决“代沟”问题,65,75,48,67,44,286,C,
我越听他们讲的话越了解{CD了}爷爷。,200209550523250980,韩国,2,200209,如何解决“代沟”问题,70,65,63,74,60,318,C,
但是应该要决定承认安乐死的判断标准。,200205271525200006,日本,2,200205,如何看待“安乐死”,65,80,60,81,82,356,C,
我所认为可取的安乐死是病人自己所要求的、得到病人的同意的安乐死。,200205271525200006,日本,2,200205,如何看待“安乐死”,65,80,60,81,82,356,C,
人们可不可以自己决定{CC愿望}自杀？,200205271525200066,日本,2,200205,如何看待“安乐死”,70,80,74,83,72,369,B,
我们家庭的人心里都很难受。,200205271525200114,日本,2,200205,如何看待“安乐死”,70,90,44,79,61,337,未参加,
还有地质污染的原因是人们随意扔了坏东西造[B招]成的{CJZR}。,200307109523200041,韩国,2,200307,绿色食品与饥饿,60,60,54,35,18,209,未参加,
放农药的一些水果或者是蔬[C]菜。,200307109523100065,韩国,1,200307,绿色食品与饥饿,65,65,64,41,53,272,未参加,
上述的短文已[B以]经说明了：[BC。]使用化肥和农药的话，产量就会大大提高，但农作物会受到不同程度的化学污染，吃了会有害于人的健康。,200307109523100130,韩国,1,200307,绿色食品与饥饿,60,65,54,25,56,243,未参加,
因为我觉得我们得为身体而寻求{CC2找}{CJ+dy这[C]}“绿色食品”[BQ。]可是挨饿的人呢[BQ？]连[C]一天{CJX}能吃饱的农作物也没有，更不用{CJ-sy说}什么“绿色食品”了。,200307109523200151,韩国,2,200307,绿色食品与饥饿,60,55,67,43,56,262,未参加,
现代社会发展这么快，科学越来越发达，[BC、]应该研究不使用化肥和农药{CJ-zy就能}生产更多农产品{CJ-zxy的技术}。,200307109523200155,韩国,2,200307,绿色食品与饥饿,70,60,70,38,44,267,未参加,
在许多国家享受现代化的物质{CJ-zxy生活}，还[C]有进一步，为了自己的健康，进[C]行“绿色食品”的研究。,200307109523200188,韩国,2,200307,绿色食品与饥饿,65,75,67,67,76,337,C,
