错句,作文编码,国籍,性别,考试时间,作文题目,口试分数,作文分数,听力分数,阅读分数,综合分数,总分,证书
他们[C]教我[C]的所有事情，都是经过[C]他们[C]的经验来的，[BC。]所以非常有说服力。{CP按他们[C]说{CQ的},200505109525200600,日本,2,200505,父母是孩子的第一任老师,65,75,58,56,74,315,C,
这个爱好一直持续{CC连续}到现在，小时候父母亲的爱好，决定了我的现在的工作，[BC、]也决定了我一辈子的爱好。,200505109525100967,日本,1,200505,父母是孩子的第一任老师,65,75,57,60,64,308,C,
各家庭都应该有“老师”嘛，孩子们从大人的行为中自然会判断{CC学会}自己举动的好坏{CD的}。,200505109525201371,日本,2,200505,父母是孩子的第一任老师,75,90,85,72,76,392,B,
也是第一任老师吗？,200505109540201596,印度尼西亚,2,200505,父母是孩子的第一任老师,65,60,41,57,54,260,未参加,
有一天因公外地出差回来，我感到非常累。,200505109525101688,日本,1,200505,父母是孩子的第一任老师,85,80,76,75,87,396,B,
后来我姐姐告诉我，“你是个小妹妹，所以他们非常担心你一个人生活{CQ不}下去。,200505109525201729,日本,2,200505,父母是孩子的第一任老师,65,75,44,45,63,279,未参加,
小的时候我哥哥很不听话，他常常做一些{CC件}让妈妈很生气的事情。,200505109540201715,印度尼西亚,2,200505,父母是孩子的第一任老师,75,65,48,31,52,258,未参加,
那时父母说的话、父母对孩子说的简单的单词{CJ-zhuy孩子}慢慢听明白。,200505109525101730,日本,1,200505,父母是孩子的第一任老师,60,65,31,47,43,229,未参加,
总的{CC得}来说，父母是{CJX}可以说老师。,200505109525201751,日本,2,200505,父母是孩子的第一任老师,45,55,48,55,61,242,未参加,
父母是孩子的第一任老师父母是孩子的第一任老师，也是终生的老师。,200505109525101788,日本,1,200505,父母是孩子的第一任老师,40,55,52,63,63,249,未参加,
“你好”是通过自己[C]以外的别人[BD、]把握自己的[D存]存在的，但是“妈妈”是好像通过自己的血把握自己的存在似的。,200505109525102002,日本,1,200505,父母是孩子的第一任老师,60,60,50,49,76,277,未参加,
我跟奶奶住在一起时因为奶奶的年纪大，许多旧社会的思想观念都能在她身上看到。,200505109922201930,美国,2,200505,父母是孩子的第一任老师,80,65,67,59,74,333,C,
举例{CC比例}说，当代的日本。,200505109525102110,日本,1,200505,父母是孩子的第一任老师,50,55,37,71,63,255,未参加,
我的母亲是家庭主妇，从小时候一回来就看她的脸，我们孩子们非常安心又高兴，她也爱教[C]育孩子，经常注意[C]我们而成了{CD对}我的第一的理解者。,200505109525202152,日本,2,200505,父母是孩子的第一任老师,60,55,33,55,47,231,未参加,
如果我对[C]孩子常常讲[BD，]有意义的、[BC，]有责任感[C]的话，孩子就会学习那些事情。,200505109525202335,日本,2,200505,父母是孩子的第一任老师,70,75,66,72,73,345,C,
若是精神发展不正常的话也会影响[B向]孩子的身体发展。,200505109540202539,印度尼西亚,2,200505,父母是孩子的第一任老师,70,70,44,61,58,291,未参加,
孩子出生后，父母亲充满着关怀培养孩子到长大，他们照顾孩子所有的事情如：[BC；]吃饭、洗澡、睡觉，更{CC还}不用说如果孩子生[B身]病，比孩子更痛苦就是父母亲。,200505204529200447,泰国,2,200505,父母是孩子的第一任老师,70,55,56,45,67,277,未参加,
这样，在不知不觉{CQ的}情况下我也爱上了音乐。,200505204635200497,俄罗斯,2,200505,父母是孩子的第一任老师,95,80,71,65,74,381,B,
我看他津津有味地观看{CC观察}运动比赛，也开始对运动着迷了。,200505204635200497,俄罗斯,2,200505,父母是孩子的第一任老师,95,80,71,65,74,381,B,
不过我来到中国留学[L]跟几个朋友住在一起时，他们老是把房子弄得很乱，每次都是我一个人收拾，才知道我这么爱干净是从我父母{CQ那儿}{CJ-sy学}来的。[BC，],200505212529100029,泰国,1,200505,父母是孩子的第一任老师,85,75,58,45,72,327,C,
我记[F記]得当我上幼[C]儿园的时候，老师有教过我一首童谣，大概是：“在家里父母也是老师，在学校老师也是父母，那么我有了很多的父母与老师。,200505212542200046,越南,2,200505,父母是孩子的第一任老师,70,90,67,73,76,369,C,
有不良生活习惯的父母更不应在孩子面前表现出来。,200505275519100022,马来西亚,1,200505,父母是孩子的第一任老师,90,80,67,73,80,385,B,
彼此一见倾心，是我{CJ-sy认为}最理想的相识方式。,200505522522210009,缅甸,2,200505,最理想的结交方式,55,60,45,42,59,242,未参加,
这当然会影响到孩子的态度。,200505332540200028,印度尼西亚,2,200505,父母是孩子的第一任老师,65,70,39,31,50,241,未参加,
此致敬礼！,200509534533250021,新加坡,2,200509,一封求职信,85,70,82,66,86,380,B,
此外，在校内我也积极地参加了数项兴趣小组，[BC。]以开拓知识面与创造性{CC3创意}思维。,200509534533250024,新加坡,2,200509,一封求职信,85,80,84,73,86,401,B,
从初级学[B院]的时候，我就经常和朋友和家人{CQ去}各地旅行，到处去增加对外国风俗的了解{CC知识}。,200509534533250038,新加坡,2,200509,一封求职信,60,75,75,58,66,320,C,
从事{CQ了}几年的教学工作后，[D现]在某旅游公司当导游已有5年之久。,200509534533150066,新加坡,1,200509,一封求职信,65,70,63,60,44,288,C,
然后就造样改广告[B造]{CJ？}。,200509534533250121,新加坡,2,200509,一封求职信,70,65,63,42,48,274,未参加,
今年二十七岁，在新加坡的某间国际公司担任{CC当任}了[D数]五年的行销经理，{CJ+zy同时}又{CC也}{CJX}在被调到中国后[BD，]当了一年半[D载]的总经理。,200509534533250132,新加坡,2,200509,一封求职信,65,65,68,62,86,330,C,
我的工作的原则是{CD说}如果要把一件事搞好，就一定要做到最好，不辜负大家和自己的期望，所以这样一来，我在过去许多大企业中{CC上}都{CJ-sy做}得很好。,200509534533150151,新加坡,1,200509,一封求职信,50,70,70,69,82,324,未参加,
谢谢！,200509534533150163,新加坡,1,200509,一封求职信,75,65,79,51,79,336,C,
在此本人衷心地希望贵公司可聘请我当导游。,200509534533250167,新加坡,2,200509,一封求职信,65,70,79,80,84,364,C,
本人也精通日语，在国际日语水平考试中考获最高级。,200509534533250175,新加坡,2,200509,一封求职信,75,70,77,73,95,379,B,
我也{CJX}以前很喜欢流行歌曲，可是现在觉得很久以前的歌曲也很好听。,200510111523200013,韩国,2,200510,我看流行歌曲,55,65,70,56,72,300,C,
有的子女对父母的孝[B教]{CJs}，有的学生对老师的感恩{CJs}，有的是提倡[B昌]环境保护的。,200510111523200415,韩国,2,200510,我看流行歌曲,70,75,65,71,79,349,C,
那么狂迷不好，要学习时就{CC是}要学习，[BC。]不要那么沉[B深]迷。,200510111523200426,韩国,2,200510,我看流行歌曲,55,60,30,24,37,187,未参加,
还有一些中国歌手来韩国开些演唱会。,200510111523200799,韩国,2,200510,我看流行歌曲,75,85,74,73,72,372,B,
我们听着音乐，可以把自己的感情充分反映到自己的心中。,200510111523101052,韩国,1,200510,我看流行歌曲,75,75,58,50,67,315,C,
现在很多有名的歌手都要[C]来中国。,200510111523101105,韩国,1,200510,我看流行歌曲,50,60,65,46,47,248,未参加,
人们需要一个自己的缓解压力、解脱{CJX}{CQ从}社会的方式，所以我赞成人们听音乐，追求自己喜欢的歌手。,200510111523201258,韩国,2,200510,我看流行歌曲,75,85,65,65,77,360,C,
很多歌星的音调不准而且有的歌星{CD做}假唱。,200510111523201263,韩国,2,200510,我看流行歌曲,60,60,28,40,55,225,未参加,
但是最重要的问题是控[B空]制自己{CD的}。,200510111523201849,韩国,2,200510,我看流行歌曲,60,60,51,56,64,273,未参加,
那么为什么还是喜欢流行歌曲呢？,200510111523101860,韩国,1,200510,我看流行歌曲,60,50,53,30,52,225,未参加,
总之，三岁前的小孩子，就像海棉一样汲取着{CD自己}各个方面的生存能力。,200510919919250026,加拿大,2,200510,父母是孩子的第一任老师,60,90,80,74,77,371,C,
当[F當]人类[F類]生活在一起的时[F時]候，行为[F為]举[F舉]止都{CQ因}被居住在身边[F邊]的人影响[F響]而变[F變]得相似，现[F現]今很多心理学[F學]的实[F實]验[F驗]都提供了有关[F関]的结[F結]果。,200510919543250005,香港地区,2,200510,父母是孩子的第一任老师,65,90,50,82,77,355,C,
所以，爸妈[F媽]的生活环[F環]境对[F對]孩子{CQ的}性格有一定的影响[F響]。,200510919919105302,加拿大,1,200510,父母是孩子的第一任老师,80,90,74,76,91,406,B,
这我同意，但{CD只能想这}不喜欢这种歌曲的人就不用花钱买这种歌。,200510204919200383,加拿大,2,200510,我看流行歌曲,90,75,65,56,84,364,C,
每天见朋友[L]说关于流行歌曲的话，还唱流行歌曲。,200510302523100001,韩国,1,200510,我看流行歌曲,80,60,49,22,35,233,未参加,
流行歌曲离不开人间。,200510302523100013,韩国,1,200510,我看流行歌曲,65,70,65,54,69,309,C,
音乐是对人有好处的一种艺术，[BC。]也{CQ有}助于人们的工作，提高效率，因此我在学习的时候，[BC。]总是放歌，一边听一边学习。,200510302523100024,韩国,1,200510,我看流行歌曲,70,90,63,61,77,354,C,
社会什么现象都有。,200510302523200039,韩国,2,200510,我看流行歌曲,75,60,53,30,52,256,未参加,
所以很多同学认为自己酷，为了表现自己酷，说话的时候平常生活中会用流行歌曲中出现的脏话等不文明语言。,200510302523200103,韩国,2,200510,我看流行歌曲,90,55,65,63,72,334,C,
但这只是我的看法。,200510302523200122,韩国,2,200510,我看流行歌曲,65,70,51,36,57,265,未参加,
因为在每个歌曲里反映着当时的流行文化，所以我们一听以前的歌曲，就可以知道那时的情况。,200510302523200135,韩国,2,200510,我看流行歌曲,65,70,51,40,74,286,未参加,
把自己当成{CC做成}一般老百[B白]姓[B性][D化]这多好啊！,200510302523200208,韩国,2,200510,我看流行歌曲,95,80,83,65,77,396,B,
这值得吗？,200510302523100213,韩国,1,200510,我看流行歌曲,75,70,63,54,79,330,C,
喜欢流行歌曲表示已经属于社会里的成员了{CJZR}。,200510302523100214,韩国,1,200510,我看流行歌曲,70,65,58,61,59,299,C,
可是不要太沉迷于{CC3迷诱}歌曲吧，我爸说什么事都{CJX}做的超过限度[B至]也会伤害身体的。,200510302523100247,韩国,1,200510,我看流行歌曲,70,50,60,38,40,241,未参加,
这个时代有很多种的流行歌。,200510302523100250,韩国,1,200510,我看流行歌曲,65,50,65,32,52,245,未参加,
我喜欢流行歌曲因为它可以让我高兴、舒服。,200510501533200021,新加坡,2,200510,我看流行歌曲,70,75,65,54,74,327,C,
我对流行歌曲，可算[C]是门外汉。,200510529529251030,泰国,2,200510,我看流行歌曲,60,50,49,48,57,244,未参加,
”[BC┐]他们就更大声地哼着，说：“[BC┌]妈，你真的不知道我们在唱的是什么歌吗？,200510540540200034,印度尼西亚,2,200510,我看流行歌曲,70,60,63,63,69,310,C,
有时候，从一首歌里，我们能得到一个安慰[Pwei]，一个解脱，{CD给别人的人生}一个鼓[Pgu]励。,200510540540200037,印度尼西亚,2,200510,我看流行歌曲,65,65,56,38,69,277,未参加,
我喜欢听歌，喜欢看人家唱歌就不用说了[BQ。]我上下班前后都会播放一些歌，上班之前喜欢听港[B香]台歌手[B首]的歌[BQ，]如梁永琪[B淇]、[BC，]刘德华，这些歌一般比较{CQ有}活力，可以带给我新的一天；下班后较累了，就选上中国内地的歌手[B首]，如孙南、[BC，]那英[BQ，]因较平静所以可以减少我的疲倦[B卷]。,200510540540200038,印度尼西亚,2,200510,我看流行歌曲,65,65,65,52,77,308,C,
湖南电视近两年有一个节目叫“超级女声”[BQ，]里边的内容是选出一名优秀{CJ-zxy的女歌手}，培养成小歌星。,200510540540200038,印度尼西亚,2,200510,我看流行歌曲,65,65,65,52,77,308,C,
因为对我来说听老歌曲就好像回到从前的时候，听老歌曲带给我回忆。,200510540540200055,印度尼西亚,2,200510,我看流行歌曲,75,95,63,59,74,360,C,
比如在卡拉厅里唱歌的年青人。,200510540540200058,印度尼西亚,2,200510,我看流行歌曲,65,75,67,54,79,327,C,
她那优美动听的金嗓[B桑]子，使我百听不厌，真是名符其实的歌后。,200510540540200073,印度尼西亚,2,200510,我看流行歌曲,60,70,39,32,77,263,未参加,
中老年人一般都不会太{CD大}喜欢流行歌曲。,200510540540100077,印度尼西亚,1,200510,我看流行歌曲,70,60,74,65,94,348,C,
经常能够在各种书刊、杂志、小说上看到一见钟情、[BC，]迅速坠入情网的故事，也许这样的故事真实地{CC的}存在，可是对于我来说，最理想的结交方式却莫[B没]过于双方通过介绍，慢慢了解，[BC。]逐渐相爱，最后步入婚姻的殿堂。,200505610610250011,法国,2,200505,最理想的结交方式,70,90,82,75,95,405,B,
何谓从{CQ与}自己同样生活背景和文化{CJ-zxy的人}中去认识另一方{CJy}？,200505680519250009,马来西亚,2,200505,最理想的结交方式,70,85,70,71,93,381,B,
在什么{CC那个}时候会遇到什么样的人，不能任由我们去主宰{CC主由}。,200505680519250011,马来西亚,2,200505,最理想的结交方式,70,85,79,75,82,383,B,
因为从小认识的男女，都有了少许的了解、[BC；]默契[C]。,200505542542130002,越南,1,200505,最理想的结交方式,45,80,68,44,70,291,未参加,
而且现在你能{CJ+zy会}在中国留学是很幸福的事。,200104124523200040,韩国,2,200104,一封写给父母的信,80,75,66,49,65,326,C,
对了，听说我弟弟考上了高中，真是件{CC个}好事，请你们替我跟{CC给}他说“恭[C]喜你！,200104124525200154,日本,2,200104,一封写给父母的信,65,80,58,68,49,308,C,
听说，新加坡的还可以，你觉得呢？,200104124540200171,印度尼西亚,2,200104,一封写给父母的信,65,70,30,25,42,218,未参加,
我虽然在日本学过汉语，但是把学过的都还给老师了。,200104124525100192,日本,1,200104,一封写给父母的信,75,75,44,54,54,292,未参加,
再说我家的菜园[B元]也比较大，如果能种菜既能改善生活，又能赚[C]一点钱。,200104124542100209,越南,1,200104,一封写给父母的信,70,90,58,51,42,304,C,
你们的生活也没有问题吧！[BC，],200104124523200310,韩国,2,200104,一封写给父母的信,60,85,44,44,33,255,未参加,
上次我给妈妈打电话的时候，妈妈得了感冒，现在怎么样？,200104124523200398,韩国,2,200104,一封写给父母的信,60,70,58,39,58,270,未参加,
毕业后回国，在一家化妆品工厂工作，当推销员。,199200003525200013,日本,2,199200,一封求职信,,,0,0,0,0,未参加,
我利用这个机会，[BC、]我想成为{CC2在}中国社会的成员。,199200204525100039,日本,1,199200,一封求职信,,,0,0,0,0,未参加,
“安乐死”是为了回避疾病的痛苦，最后选择的方法。,199604123525100061,日本,1,199604,如何看待“安乐死”,55,60,56,47,49,248,未参加,
我在小学{CD生}的时候[C]遇到了跟文章内容差不多的情况。,199604124523200015,韩国,2,199604,如何看待“安乐死”,60,65,45,49,42,244,未参加,
我认为两种意见都有道理，对安乐死的问题从古代到在在社会上还是有很多论争，不但[BD，]中国还有西方、东方许多国家都有这种安乐死的问题，如果法律上可以实行安乐死的话[B化][BQ，]很多人[BD，]用安乐死的名[B明]义{CJ-sy杀}死病者的父母，我认为国家不应该[B孩]随便同意安乐死，还有人的生命是非常尊贵的、非常神圣的。,199604124523100046,韩国,1,199604,如何看待“安乐死”,65,70,48,61,49,278,未参加,
无论什么情况，得了什么病，不应该自杀而且没有信心。[BC.],199604123523200250,韩国,2,199604,如何看待“安乐死”,60,50,61,49,44,243,未参加,
如果法院的人亲眼看了这种{CC这样}情况，一定认可{CC承认}他的行为。,199604123525100084,日本,1,199604,如何看待“安乐死”,60,60,42,52,42,238,未参加,
这[C]样的话，丈夫还[C]没死，就像[B象]死人似的了。,199604123529100209,泰国,1,199604,如何看待“安乐死”,60,65,24,39,34,205,未参加,
我想社会发展了，同时人类观念需要大大的改革开[C]放。,199604124525200223,日本,2,199604,如何看待“安乐死”,45,55,35,49,39,200,未参加,
可是我们[L]不应该利用“不合适的安乐死”。,199604123523100292,韩国,1,199604,如何看待“安乐死”,65,60,35,52,39,234,未参加,
我看完了这段短文以后就扪心自问：我自己是否也能够像[B象]那丈夫一样帮助自己的妻子自杀？,199604123639100117,阿塞拜疆,1,199604,如何看待“安乐死”,85,65,66,44,57,306,C,
现在都不那么想了。,199610801533200013,新加坡,2,199610,如何解决“代沟”问题,90,70,75,48,43,319,C,
文中指出，很多人常常感到他们与上一辈[F輩]之间的沟通与交流非常困难，而长[F長]者却抱怨说，现在{CC现今}的晚辈[F輩]不听话而且难以管教。,199610802801100009,澳大利亚,1,199610,如何解决“代沟”问题,75,80,65,65,82,358,C,
为了说的明白，我要举例说明。,199610550523190002,韩国,1,199610,如何解决“代沟”问题,60,55,49,53,72,270,未参加,
我就可以说新世代的年青人{CJs}，所以跟我的父母或者老师说话时，常觉得他们对我们的要求很严格{CC严重}，动不动{CQ就}说：“不要做这样的事”，“你应该好好儿学习”，“你必须做什么……”等等总是说，不，不，不……。,199610550523290016,韩国,2,199610,如何解决“代沟”问题,75,70,54,65,59,312,C,
我想父亲[C]的这样的想法终究{CC2归根结底}会没有的。,199610550523290030,韩国,2,199610,如何解决“代沟”问题,75,70,54,55,67,310,C,
很自然的事情{CJs}。[BC；],199610550523190038,韩国,1,199610,如何解决“代沟”问题,65,50,75,34,61,266,未参加,
其二是把自己的意见都明明白白{CQ地}阐述[B术]。,199610550523290051,韩国,2,199610,如何解决“代沟”问题,80,75,52,57,69,324,C,
所以一般年纪较大的人对文化的变化很不适应，觉得很不舒服。,199610550523190063,韩国,1,199610,如何解决“代沟”问题,60,80,54,79,59,319,未参加,
经[F經]常{CJX}对所有的事情需要多谈[F談]、忍耐，{CD回来[F來]}{CQ以}平常{CD的}心了解对[F對]方的处[F處]境和苦衷等。,199610550523290090,韩国,2,199610,如何解决“代沟”问题,60,60,52,42,63,259,未参加,
正所谓“偷鸡不着蚀把米”，就是这个道理。,199603533533100003,新加坡,1,199603,由“三个和尚没水喝”想到的……,75,70,58,60,91,343,C,
故事是一对猴兄弟种南瓜。,199603533533200034,新加坡,2,199603,由“三个和尚没水喝”想到的……,90,90,63,65,80,386,C,
当然这个{CQ只是}我个人的希望罢了{CC只了}。,199603533525100070,日本,1,199603,由“三个和尚没水喝”想到的……,70,55,30,54,49,242,未参加,
每一个人都能贡献一份光、一份热。,199603533533200073,新加坡,2,199603,由“三个和尚没水喝”想到的……,90,90,77,76,91,422,B,
果真{CC2果}如此，三个和尚不但有水喝，还天天有水可存[D余]！,199603533533200090,新加坡,2,199603,由“三个和尚没水喝”想到的……,90,90,66,70,87,401,B,
他肯定会拿水的，因为[F為]我们每个人都需要它。{CP我们不必自己动手，水肯定会有人拿的。结果我们三个都会没水喝。P},199603533540200109,印度尼西亚,2,199603,由“三个和尚没水喝”想到的……,65,80,49,49,61,292,未参加,
后来又来了第三个和尚，大家都希望别人去山下抬水，于是，人多了，反而没[B汉]有水喝了。,199604680519100513,马来西亚,1,199604,由“三个和尚没水喝”想到的……,85,70,63,83,91,383,C,
那么，我应该怎么理解这个故事呢？[BC。],199605104525100051,日本,1,199605,由“三个和尚没水喝”想到的……,65,55,58,83,68,311,C,
所以，这{CD种}三个人恐怕达不到真理。,199605104525100061,日本,1,199605,由“三个和尚没水喝”想到的……,45,50,41,51,61,225,未参加,
但是，别人遇到什么困难的事情，一般的人都不管别人的事情。,199605104523200101,韩国,2,199605,由“三个和尚没水喝”想到的……,70,65,80,65,65,331,C,
到这个时[C]候怎么办？,199605104523100128,韩国,1,199605,由“三个和尚没水喝”想到的……,60,65,66,56,72,302,C,
个人的事情的话[BQ，]可以心甘情愿{CC自己愿意}地干，可是认为{CJ-sy是}团体{CQ的}事情的话[BQ，]一般人们是{CC做}撒手不管的态度。,199605104523200162,韩国,2,199605,由“三个和尚没水喝”想到的……,70,60,66,54,42,277,未参加,
只有一个和尚的话，为了自己的生活，他不得不自己挑水喝。,199605104525100175,日本,1,199605,由“三个和尚没水喝”想到的……,65,55,60,63,63,288,C,
由于这三位和尚缺[C]乏这个观点，平添{CC带来}了很多烦恼。,199605104525100269,日本,1,199605,由“三个和尚没水喝”想到的……,65,70,49,72,75,317,C,
发展{CC2走}到极端{CD的}情况{CJX}的时候，人才想办法处理某种困难。,199605104523200308,韩国,2,199605,由“三个和尚没水喝”想到的……,70,70,49,54,61,292,C,
比如，你上街被小偷抢了钱，并不意味着你{CD一个人}今天运气差{CC没运气}，倒霉[C]了，而是说，整个社会治安状况不好{CC良}。,199605104523200329,韩国,2,199605,由“三个和尚没水喝”想到的……,85,70,74,76,70,366,B,
邻居们都跟他的父母说：“你们真幸福，有了这么好的儿子！,199605104634200326,英国,2,199605,由“三个和尚没水喝”想到的……,75,80,63,76,58,343,B,
他们俩就叫他小和尚。,199605104540200356,印度尼西亚,2,199605,由“三个和尚没水喝”想到的……,65,55,38,35,46,221,未参加,
过了一段{CC假}时间，又来了第三个和尚，两个和尚都希望第三个和尚去山下抬水给他[C]们喝{CJ+by水}。,199605104523200362,韩国,2,199605,由“三个和尚没水喝”想到的……,60,45,55,63,37,238,未参加,
我第一次跟爸爸妈妈说这件事的时候，他们担心我，而坚持反对[C]。,199605104525200375,日本,2,199605,由“三个和尚没水喝”想到的……,65,70,77,60,80,338,C,
由于人多起来，他们的脑子里{CC3脑肋}有一种不良的想法：[BC；]“[BC‘]这么麻烦的事，我不做也有人做[BQ。]”[BC’][BD。]目前的社会情况正好如此。,199605104523100397,韩国,1,199605,由“三个和尚没水喝”想到的……,75,80,52,63,70,331,C,
但是他们俩等了半天，那个和尚还不回来。,199605104525100399,日本,1,199605,由“三个和尚没水喝”想到的……,55,70,71,70,63,313,C,
在许多佛教教理之中，可贵的是博[B薄]爱思想。,199605550523190033,韩国,1,199605,由“三个和尚没水喝”想到的……,65,55,30,72,49,253,未参加,
原来住在这{CC一}座庙里的那个和尚一个人住的时候亲自{CC亲手}挑水喝，可是来了一个别的和尚以后两个人就抬水喝，然后又来了一个{CQ后}，他们{CJ-zy都}希望别人去山下抬水。[BC，],199605550523290028,韩国,2,199605,由“三个和尚没水喝”想到的……,65,50,44,49,46,235,未参加,
可是想这样做对他不利，所以他笑着说：[BQ“]那么我们三个人一起想一想哪个办法好呢？[BQ”],199605550523290051,韩国,2,199605,由“三个和尚没水喝”想到的……,55,55,30,38,32,190,未参加,
没有自己要喝的水，人们应该找{CJX}去水喝，不要只等待着别人为{CD了}他抬水。{CQ在},199605550523290078,韩国,2,199605,由“三个和尚没水喝”想到的……,65,65,74,83,70,341,C,
每天她弹着钢琴给我们唱歌。,199704124525200299,日本,2,199704,记对我影响最大的一个人,75,80,45,43,55,289,未参加,
不只是因为我继承了他对艺术的兴趣，{CD而是}原因{CQ还}在于他从来不{CC未}限制我的自由，未曾影响我对任何{CQ事物}的选择。,199704124540200318,印度尼西亚,2,199704,记对我影响最大的一个人,70,80,53,60,70,323,C,
它教我学习爸爸的这种教育方式，至今，我也以“爱”来教育我的子女。,200110540540250146,印度尼西亚,2,200110,我的童年,70,85,63,68,74,352,C,
外祖父、外祖母，都很疼我。,200110540540250156,印度尼西亚,2,200110,我的童年,75,80,33,47,72,298,未参加,
(B)女性，2名。,199312533533200017,新加坡,2,199312,一封求职信,75,45,50,65,68,285,未参加,
我的特长[F長]是会一门外语，即英语，另外人也亲[F親]切随和、有耐心，能与客人沟[F溝]通。[BC，],199312533533200062,新加坡,2,199312,一封求职信,90,80,74,76,75,390,B,
敬祝安康×××上一九九三年十二月四日,199312533533100067,新加坡,1,199312,一封求职信,95,80,74,74,96,415,B,
