错句,作文编码,国籍,性别,考试时间,作文题目,口试分数,作文分数,听力分数,阅读分数,综合分数,总分,证书
我认为男女同班才是上上之策，而不应该是男女分班。,200504534533250169,新加坡,2,200504,我对男女分班的看法,80,80,78,71,75,376,B,
将男女分班，可让老师更有效地针对学生的特点进行教学。,200504534533250184,新加坡,2,200504,我对男女分班的看法,90,85,87,89,97,445,A,
我认为，父母真的是孩子的第一任老师。,200505109616100502,德国,1,200505,父母是孩子的第一任老师,75,65,52,38,43,260,未参加,
这样{CQ对}孩子的成长大大{CJX}有了影响。,200505109540101118,印度尼西亚,1,200505,父母是孩子的第一任老师,70,65,55,35,62,273,未参加,
比如说一个不{CQ负责}的家长每天不管自己的儿女，这个孩子将来可能也会和他的父母一样。,200505109801101134,澳大利亚,1,200505,父母是孩子的第一任老师,95,65,89,70,73,384,B,
，父母一直教育孩子，怎么善于生活，跟别人接触，遇到{CD什么}困难怎么解决。P},200505109540201596,印度尼西亚,2,200505,父母是孩子的第一任老师,65,60,41,57,54,260,未参加,
这样的情况下，父母的人性很会影响孩子。,200505109525101622,日本,1,200505,父母是孩子的第一任老师,70,80,39,53,65,297,未参加,
拿我自己来证明，我小时候[L]影响{CJX}{CQ对}我最重大的并不是我爸爸，而是我妈妈。,200505109801201857,澳大利亚,2,200505,父母是孩子的第一任老师,60,45,61,49,69,262,未参加,
父母不管孩子的看法，把自己的思想强[C]迫了解{CJba}，或者把自己的期待强加{CC2摆[C]}在孩子的身上，那样的话孩子就糟了。,200505109525202398,日本,2,200505,父母是孩子的第一任老师,60,65,41,56,62,267,未参加,
我父亲有一个旧的照相机。,200505109525102455,日本,1,200505,父母是孩子的第一任老师,65,65,39,51,72,276,未参加,
以上说的我朋友也和这个[C]一样。,200505109525202469,日本,2,200505,父母是孩子的第一任老师,65,75,58,59,80,324,C,
我父母都是爱读书的人。,200505109512202592,菲律宾,2,200505,父母是孩子的第一任老师,90,90,71,55,67,371,B,
而要如何使这张纸填满的是人生的道理而不是无理的涂鸦呢？,200505217519100138,马来西亚,1,200505,父母是孩子的第一任老师,75,65,73,59,76,335,C,
孟母发现孟子受环境{CJX}不良影响时而选择搬迁来避免影响{CC4改良}。,200505217519100138,马来西亚,1,200505,父母是孩子的第一任老师,75,65,73,59,76,335,C,
同样，孩子从小受到父母的影响是最明显的。,200505271922200146,美国,2,200505,父母是孩子的第一任老师,80,65,50,53,61,297,未参加,
最后，[BC、]因为父母跟孩子的时间最长，父母是唯一最有影响的老师，不但{CJX}父母有耐心和真心去教孩子，父母会对{CC为}孩子的全部方面关怀。,200505271922200146,美国,2,200505,父母是孩子的第一任老师,80,65,50,53,61,297,未参加,
我认[F認]为[F為]男女之间[F間]最理想的结[F結]交方式，是先[D經]由普通朋友{CD階段}认[F認]识[F識]一段时间[F間]以后[F後]，再慢慢进[F進]展到男女朋友较[F較]亲[F親]密的阶[F階]段，然后[F後]经[F經]过[F過]一定的相处[F處]了解之后[F後]，再步入婚姻殿堂。,200505951922250014,美国,2,200505,最理想的结交方式,95,90,93,80,97,454,A,
因为得到了亲戚朋友的认[F認]同和祝福，才可以幸福地{CC的}走进婚姻殿堂。,200505522522210021,缅甸,2,200505,最理想的结交方式,60,70,66,58,82,321,C,
当然，这些过程和关系平时不是那么明显的，而是常常在表面上看不出来的。,200505209616200082,德国,2,200505,父母是孩子的第一任老师,65,55,20,25,45,192,未参加,
也可以说父母是第一{CD个}任老师。,200505201540100303,印度尼西亚,1,200505,父母是孩子的第一任老师,60,60,48,37,45,232,未参加,
更不是。,200505332540200012,印度尼西亚,2,200505,父母是孩子的第一任老师,65,60,52,53,47,260,未参加,
”也有人谈吐[B吞]有方，就是受家长们的教育[BQ。]所以说为了孩子们的未来，父母们应当起[B取]到良好的启蒙作用！,200505332512100051,菲律宾,1,200505,父母是孩子的第一任老师,70,90,58,65,80,356,C,
谁的父母不希望自己的孩子长大会成为{CQ对}社会有用的人才{CD的}呢。,200505024542200397,越南,2,200505,父母是孩子的第一任老师,65,70,56,63,52,292,C,
我今年40岁，从25岁毕业那年就开始在一家餐馆（家乐餐店）当{CD了}副[B负]经理，直到五年前才被转到（圆圆旅行公司）当副[B负]经理。,200509534533250003,新加坡,2,200509,一封求职信,60,80,75,53,55,310,未参加,
会说华、英两种口语，希望贵公司能给我工作的机会{CC6机会服务}。,200509534533250006,新加坡,2,200509,一封求职信,65,60,43,47,68,266,未参加,
我也会努力工作，来报答贵公司对于我的栽培。,200509534533250007,新加坡,2,200509,一封求职信,70,75,88,62,86,370,C,
二）二零零一年至二零零三年：任{CC1任职}导游于太阳旅游[C]公司。,200509534519250091,马来西亚,2,200509,一封求职信,70,70,84,69,84,365,C,
本人也很喜欢旅游。,200509534533250094,新加坡,2,200509,一封求职信,80,90,84,64,91,404,B,
本人对贵公司积极发展业务深感兴趣，并期望能加入贵公司并分享本人过去的工作经验，也从而有机会继续开拓我的工作前景{CD及发展}。,200509534519250100,马来西亚,2,200509,一封求职信,95,75,93,77,95,430,B,
我在大学[D就]读的是历史考察与人物交流系{CD的}。,200509534533250125,新加坡,2,200509,一封求职信,55,70,79,75,75,338,C,
对于您的考虑，本人先此致谢。,200509534519250156,马来西亚,2,200509,一封求职信,70,75,79,77,95,385,B,
在这三年里，我吸取了许多宝贵的经验。,200509534533150151,新加坡,1,200509,一封求职信,50,70,70,69,82,324,未参加,
我本身对这份职业深感兴趣。,200509534533250162,新加坡,2,200509,一封求职信,85,70,82,69,86,383,B,
这两家公司对我所设计的广告非常满意，给了我一笔酬劳费，并且表示有意招聘我。,200509534533150183,新加坡,1,200509,一封求职信,65,70,75,66,82,344,C,
《[BC“]月亮代表我的心》[BC”]表示爱情。,200510111523100413,韩国,1,200510,我看流行歌曲,65,70,46,42,64,273,未参加,
就像[C]这[F這]个{CC种}例子一样，流行歌曲在很多时候是[BD，]一种为社会活[C]动而付[B服]出的一个基本教养[F養]，之所以如此，我在日常生活中，常常听[B聽]流行歌曲，但{CD却[F卻]}我所喜欢的音乐[F樂]不是流行歌曲，我喜欢听[F聽[C]]古典音乐[F樂]。,200510111523100417,韩国,1,200510,我看流行歌曲,75,60,56,71,69,317,未参加,
烦燥的{CJ-zxy时候}可以听摇滚乐[C]，让歌手的呐喊替自己宣[B喧]泄内心的狂燥；人静夜深时，可以听抒情的慢歌来安慰自己孤独的内心；快乐时，可以和朋友一起唱欢乐的歌[BQ，]共饮友情的美[C]酒……无疑流行音乐之所以流行是因为此时此景此情此境听着歌可以与之产生共鸣，使人心情舒畅[B唱][BQ。]但当代流行歌[C]坛也存在着严重的夸张之风，商业味过于浓厚，内容也多有颓废之感，使不少沿未成熟的青少年误入岐[C]途，这说明中国目前流行乐坛的运营体制[C]还不够完善，仍需不断的改进。,200510111922200436,美国,2,200510,我看流行歌曲,95,95,86,81,100,456,A,
比如，听了中文歌以后可以了解一些{CJX}很多国家{CQ的}人的情绪[C]或者[B着]中国的情况。,200510111523100796,韩国,1,200510,我看流行歌曲,70,70,49,38,52,267,未参加,
比如在韩国的一名歌[C]手曾经被总统干儿{CY}了。,200510111523100819,韩国,1,200510,我看流行歌曲,70,80,60,61,64,325,C,
首先，听流行歌曲可以缓解我们的压力。,200510111523200815,韩国,2,200510,我看流行歌曲,65,80,49,54,62,298,C,
音乐包括很多种类，我们所能接触的音乐有传统音乐、西方古典音乐、流行音乐等。,200510111523200835,韩国,2,200510,我看流行歌曲,85,75,79,59,67,357,B,
但我们可以一起听流行音乐，就{CC对}音乐{CQ进行}交谈[B淡]。,200510111523200860,韩国,2,200510,我看流行歌曲,65,85,53,54,72,319,C,
这样，听流行歌曲能了解当时的情况。,200510111523100896,韩国,1,200510,我看流行歌曲,65,60,58,63,57,286,C,
比如说，有个朋友十分喜欢叫“RAIN”{CQ的}这个歌[C]手。,200510111523201060,韩国,2,200510,我看流行歌曲,60,65,53,42,59,262,未参加,
当时我听的歌是家喻户晓的周华健的“朋友”[BQ，]听啊听啊我很快就迷上它了，我不懂其意思，但我就爱听，听了很久，经过查词典我完全征服了它，会唱，会听，会写。,200510111523101125,韩国,1,200510,我看流行歌曲,70,85,83,69,89,388,B,
所以自然习惯了。,200510111523201262,韩国,2,200510,我看流行歌曲,55,60,44,38,67,245,未参加,
虽然很多人不喜欢流行歌曲，可是喜欢听流行歌曲也不奇怪{CD的}。,200510111523101331,韩国,1,200510,我看流行歌曲,65,65,49,48,52,263,未参加,
如果在社会里没[C]有流行音乐的话，那{CJ-zhuy人们}就对生活没有什么兴趣了。,200510111523201591,韩国,2,200510,我看流行歌曲,70,70,53,56,77,314,C,
它们虽然{CQ在}有些地方对人们{CJ-sy有}不好的影响，但我认为因为{CC通过}流行歌曲人们的生活更快乐、[BC，]幸[B辛]富。,200510111523201624,韩国,2,200510,我看流行歌曲,70,75,60,59,69,322,C,
但是那么强烈的方式和行为我不太理解{CC了解}。,200510111523201627,韩国,2,200510,我看流行歌曲,70,70,51,50,59,288,未参加,
人们很喜欢用歌曲表现他们的生活、感情等等。,200510111523201858,韩国,2,200510,我看流行歌曲,50,65,53,24,52,225,未参加,
父母是孩子的第一任老师。,200510919919250026,加拿大,2,200510,父母是孩子的第一任老师,60,90,80,74,77,371,C,
首先，教给{CC教育}他们最基本的知识，然后，发掘他们优秀的才华，予以培养。,200510919919250004,加拿大,2,200510,父母是孩子的第一任老师,85,95,77,68,96,417,B,
最好让人们听有意义的歌曲，让人们通过听[D唱]歌更好地了解自己……[BC…],200510217635200093,俄罗斯,2,200510,我看流行歌曲,75,75,49,46,47,282,未参加,
其实在这“歌艺圈”里，歌手的知名度也是非常重要的。,200510512512250031,菲律宾,2,200510,我看流行歌曲,60,90,72,67,87,366,C,
我的朋友被歌星迷上了{CJbei}，整天拿着歌星[B行]的相片高兴得{CC的}不得了，不管是在学校、[BC，]在家里，也不学习，只在{CD指}[BD，]听他的歌曲，上课时，经常偷偷地{CC的}听他的歌。,200510302523200002,韩国,2,200510,我看流行歌曲,75,75,65,59,72,336,C,
歌手们出场以后他们看起来{CQ在}唱歌，但是那只是个假动作，他们害怕万一他们唱错了，那么观众们会失望，有的人可能不喜欢他们了，所以他们得假唱。,200510302523100007,韩国,1,200510,我看流行歌曲,75,70,58,52,72,316,C,
有可以提高学生的文化水平{CJ-zxy的作用}。,200510302523100009,韩国,1,200510,我看流行歌曲,60,60,63,44,37,246,未参加,
200510青岛大学.00003100017目前不管男女老少都喜欢听流行歌曲。,200510302523100017,韩国,1,200510,我看流行歌曲,55,60,58,63,57,274,未参加,
通过这个问题我们就会想到一个问题，儿童应该少接触流行歌。,200510302523200010,韩国,2,200510,我看流行歌曲,65,65,67,61,64,306,C,
当我考完试后取[B曲]得不优秀{CC优越}的成绩时，我可以听一下很酷的流行歌曲来让{CC给}我放松放松自己。,200510302523100028,韩国,1,200510,我看流行歌曲,80,65,65,46,64,308,C,
有一些歌曲给{CC让}我鼓励[B厉]，做什么事都很有意思。,200510302523200037,韩国,2,200510,我看流行歌曲,75,80,51,54,79,330,C,
对这个现象我非常支持{CC同意}，没有什么特忧[C]虑的心理。,200510302523200042,韩国,2,200510,我看流行歌曲,75,75,70,54,89,353,B,
因此，你的家庭一定会平安。,200510302523100055,韩国,1,200510,我看流行歌曲,65,75,70,42,67,306,C,
因为，我们听流行歌曲会听出来时代{CC每代}的文化，人们的生活、思想等等，[BC。]我们都能在歌词上看出来。,200510302523200099,韩国,2,200510,我看流行歌曲,65,70,39,38,57,255,未参加,
对[F對]于[F於]我的看法，我非常喜欢流行歌曲，这[F這]{CJ-zy主要}因为[F為]我对流行歌曲的印象{CC应像}{CJ-wy很好}。[BC，],200510529529151013,泰国,1,200510,我看流行歌曲,60,55,53,42,47,238,未参加,
因为我小时有过被撞伤脑部的原因，因此我的听觉能力较差，而古典音乐节奏地较复杂，歌曲中部音调常常改变格式或拍节从慢变快，这种情况需要优等的听觉能力，不然因听不出它的变化而觉得古典[B曲]歌曲不顺耳。,200510540540200007,印度尼西亚,2,200510,我看流行歌曲,75,90,56,50,74,339,未参加,
”[BC┐]流行歌，谁不喜欢听？,200510540540200034,印度尼西亚,2,200510,我看流行歌曲,70,60,63,63,69,310,C,
在我看来，随着人类对音乐的需求越来越高{CD时}，出现了一种现象[B像]，[BC。]那就是现代人无论是男女老少都喜欢听流行歌曲。,200510540540200055,印度尼西亚,2,200510,我看流行歌曲,75,95,63,59,74,360,C,
无[F無]非就是一首歌啊，无[F無]论是爱国[F國]歌曲还[F還]是流行歌曲，甚至是已经[F經]退{CQ出}流行的老掉牙的歌曲，只要好听[F聽]就成。,200510540540200057,印度尼西亚,2,200510,我看流行歌曲,95,90,86,87,96,453,A,
流行歌曲是从那角度来看而能分好坏{CJs}。,200510540540200072,印度尼西亚,2,200510,我看流行歌曲,55,70,51,36,55,251,未参加,
现在过得怎么样？,200104124523100074,韩国,1,200104,一封写给父母的信,75,60,68,54,45,288,C,
身体还好吗？,200104124525200061,日本,2,200104,一封写给父母的信,65,60,44,39,54,245,未参加,
好久不见。,200104124523200077,韩国,2,200104,一封写给父母的信,65,60,38,42,40,228,未参加,
今年我已22岁了。,200104124525100118,日本,1,200104,一封写给父母的信,65,55,36,37,42,217,未参加,
但是有一个“东西”还没有掌握，也还不完全习惯。,200104124525100129,日本,1,200104,一封写给父母的信,70,80,44,42,56,282,未参加,
我最近有了美国朋友。,200104124523200173,韩国,2,200104,一封写给父母的信,70,65,52,37,56,266,未参加,
有很{CD美丽}[BD，]幸福的，也有{CC还有}很难过的{CJ+zxy时间}。,200104124523200179,韩国,2,200104,一封写给父母的信,65,75,49,25,49,250,未参加,
我先{CJX}到这儿给你们{CC您们}写{CD信}，有时间{WWJ},200104124540200175,印度尼西亚,2,200104,一封写给父母的信,60,60,27,25,24,178,未参加,
最后，玩够了{CC2得足够}，我们才回北京，这时候，离开学的日期也只有几天{CD罢}了。,200104124540200241,印度尼西亚,2,200104,一封写给父母的信,70,85,68,44,67,326,C,
还有关于我毕业后{CD的我的}工作的事情。,200104124525100262,日本,1,200104,一封写给父母的信,70,75,36,49,47,266,未参加,
我的生活是跟平常没有什么不同的。,200104124523100302,韩国,1,200104,一封写给父母的信,70,65,58,63,61,303,C,
除了家里的事以外，生意挺好吗？,200104124529200350,泰国,2,200104,一封写给父母的信,70,85,49,30,51,277,未参加,
他们对我非常好，我们经常在一起玩，{CQ在}一起学习，真的{CJ-zy很}有意思。,200104124523200393,韩国,2,200104,一封写给父母的信,65,75,66,65,67,325,C,
那，我们下个月见！,200104124525200434,日本,2,200104,一封写给父母的信,70,80,58,54,47,299,C,
爸爸、[BC，]妈妈，我很想你们。,200104124523200458,韩国,2,200104,一封写给父母的信,65,80,36,23,27,219,未参加,
家里人们因为解脱病人的痛苦所[C]以帮他的忙。,199604123525100079,日本,1,199604,如何看待“安乐死”,55,40,27,37,39,174,未参加,
这多么可悲的事儿啊{CC呢}{CJs}！[BC？],199604124523200045,韩国,2,199604,如何看待“安乐死”,70,60,66,66,47,293,C,
还有一种[B钟]是他已经{CJ-sy得了}不治之症但是以后一定治好，这样想法的另外一个人，这个人的想法是他活着那{CD儿}肯定对病人幸福。,199604124525100069,日本,1,199604,如何看待“安乐死”,55,50,40,42,39,204,未参加,
可是，采取安乐死的时候应该需要再三考虑后实行。,199604124523200345,韩国,2,199604,如何看待“安乐死”,70,60,66,54,52,286,C,
我认为有[C]病{CC疾}的人应该通过法律办这件[C]事，就是说他应该跟医生，法律人员和亲人商[C]量这个问题[C]，而不是让一个人（比如[BD，]丈夫）帮助她[B他]自杀。,199604124635200104,俄罗斯,2,199604,如何看待“安乐死”,0,60,32,37,29,150,未参加,
我的意见不应该受到法律的制裁。,199604123525100255,日本,1,199604,如何看待“安乐死”,50,60,37,52,52,230,未参加,
当然，不应该乱杀得了一种不治之症的人。[BC，],199604123525100181,日本,1,199604,如何看待“安乐死”,70,60,58,66,65,303,C,
赞成安乐死的人认为：[BC；]用这[C]个办法，病人和家人不仅仅可以解脱痛苦，而且还可以减少家人在经济和精神上的负担。,199604124525200155,日本,2,199604,如何看待“安乐死”,85,75,58,74,70,354,B,
他因病饱[C]受痛[C]苦，加上使{CC因}旁[C]边的家里人受痛苦。,199604123523200330,韩国,2,199604,如何看待“安乐死”,70,45,50,61,60,266,未参加,
我认为很多人对安乐死采取{CC2取}了反对的态度。,199604123523200211,韩国,2,199604,如何看待“安乐死”,60,60,61,61,44,268,未参加,
看来，丈夫还[C]未看到法律的重要性{CC主要性}。,199604123540200276,印度尼西亚,2,199604,如何看待“安乐死”,70,55,71,61,67,307,C,
他们[F們]心理所想的东[F東]西除了在学[F學]校朝夕相处[F處]的同学[F學]之外，大概也没有其他人能够[F夠]了解了。,199610801501200002,中国,2,199610,如何解决“代沟”问题,90,80,70,67,67,369,B,
随着经济[F濟]的发[F發]展，人民的生活水平提高，年青人结了婚通常也组织[F織]自己的小家庭、不与[C]父母[C]同住。[BC，],199610802801200024,澳大利亚,2,199610,如何解决“代沟”问题,75,85,89,69,78,389,B,
至于中年一代与[C]青年一代的代沟[F溝]问题[F題]多半是因为[C]父母整天忙着在外工作，无[F無]暇照顾[F顧]孩子，往往以为[F爲]尽[F盡]量满[F滿]足孩子的每样要求[C]，就是疼爱{CC痛爱}他们，或走向{CC2在}另一极[F極]端[BQ，]有些父母以[F爲]孩子是父母[C]的附属[C]品，可以任意打骂[F駡]，或把父母的地位放在高高在上{CJba}，使孩子遇到问题[F題]时[F時]因怕父母的责[F責]骂[F駡]而不敢提出，这也形成中年和青年两代的代沟，也是当[F當]今的一个[F個]严[F嚴]重的社会[F會]问题。,199610802801200024,澳大利亚,2,199610,如何解决“代沟”问题,75,85,89,69,78,389,B,
我也知道这种‘代沟[C]’问题[F題]不是{CJX}只现代的问题，而是古今以来一直存在{CC提出}的问题[F題]，可是我觉[C]得到现在这问题在社会上更严[F嚴]重了。,199610550523290020,韩国,2,199610,如何解决“代沟”问题,70,60,73,44,57,289,未参加,
那么，这现象的最主要原因在何处呢？,199610550523290025,韩国,2,199610,如何解决“代沟”问题,65,60,62,63,69,302,C,
在韩[F韓]国与中国之间保留着孔子思想，但此思想难以了解[C]个[F個]人主义[F義]的新一代的思想。[BC，],199610550523190054,韩国,1,199610,如何解决“代沟”问题,65,55,57,59,43,261,未参加,
现在年[C]青人过很富裕的物质[F質]生活。,199610550523190092,韩国,1,199610,如何解决“代沟”问题,60,65,54,55,61,278,未参加,
但孩子呢？,199610550523290090,韩国,2,199610,如何解决“代沟”问题,60,60,52,42,63,259,未参加,
在生活方式上面，两[F兩]代可以一起进[F進]行同类[F類]型[B形]的活动。,199611543634100525,英国,1,199611,如何解决“代沟”问题,80,85,75,75,82,391,B,
现在随隨着社会、{CC，}教育的发展，两代人的代沟，成为社会问题。[BC，],199611543501100513,中国,1,199611,如何解决“代沟”问题,90,80,73,57,72,367,B,
多聊天、多接触、多关怀；懂得互相尊重，懂得耐心聆听，是为人子女应尽的责任。,199611543501200503,中国,2,199611,如何解决“代沟”问题,80,90,78,75,82,400,B,
例如鼓励成绩好的学生多在学业[F業]上帮助成绩差的学生。,199603533533200013,新加坡,2,199603,由“三个和尚没水喝”想到的……,85,90,83,58,82,394,B,
要是这类人在一个国家的劳动群体{CC4劳动群}中占了大多数，那么该国的生产的{CJ-zxy效率}就会大跌，经济便不能起飞了。,199603533533200021,新加坡,2,199603,由“三个和尚没水喝”想到的……,90,80,60,63,75,363,C,
“三个和尚没水喝”可说是一个好的比喻，我们人生目标应该以服务人群为目的，不要{CD老}光想着，我付出了多少，最少应得到多少的回报，我们想到的应该是国家大众的利益，“舍一己而利天下”是多么高尚的情操！[BC。],199603533533200088,新加坡,2,199603,由“三个和尚没水喝”想到的……,90,80,74,63,96,398,B,
关于{CC针对}这点，许多在商场上打滚的人体会{CJX}可能较深。,199603533533200092,新加坡,2,199603,由“三个和尚没水喝”想到的……,80,95,80,79,89,418,B,
就是因为和尚的懒憜促使他不愿意下山抬水。[BC，],199603533533200108,新加坡,2,199603,由“三个和尚没水喝”想到的……,70,70,85,65,84,362,C,
与动物界中其它的动物比起来，人类可要自叹不如了。,199604680519100507,马来西亚,1,199604,由“三个和尚没水喝”想到的……,90,85,63,83,94,412,B,
突然在一个风和{CC高}日丽的早上，他被山下一阵悦耳的歌声吵醒了。,199604680519200509,马来西亚,2,199604,由“三个和尚没水喝”想到的……,85,75,80,81,100,413,B,
结果如何？,199604680519200509,马来西亚,2,199604,由“三个和尚没水喝”想到的……,85,75,80,81,100,413,B,
”另一个和尚焦急地{CQ对}对方说：“想到了方法，还不赶快把方法说出来。,199604680519100516,马来西亚,1,199604,由“三个和尚没水喝”想到的……,95,75,66,72,84,387,B,
时间过去，{CJ-zhuy和尚们}越来越多地{CC的}来到山底喝水，终于没有[C]水[C]喝了。,199605104523200117,韩国,2,199605,由“三个和尚没水喝”想到的……,75,65,58,51,63,299,C,
但是，我相信人类会用其智慧和良心保护地球的环境[C][BQ，]而且{CC2而}还能实现更富裕的社会。,199605104525200123,日本,2,199605,由“三个和尚没水喝”想到的……,60,85,74,79,84,371,C,
后来又来了一个很老的和尚。,199605104523200178,韩国,2,199605,由“三个和尚没水喝”想到的……,65,55,60,45,46,253,未参加,
而且，这样集团生活上，他们能要求自己需要的{CC得}权利[C]。,199605104523100205,韩国,1,199605,由“三个和尚没水喝”想到的……,60,45,33,67,46,229,未参加,
现代的地球人，尤其是发展国家的人{CD都}为了满足自己的欲望几乎随便用地球的资源。,199605104525200229,日本,2,199605,由“三个和尚没水喝”想到的……,70,50,46,51,70,270,未参加,
现代年轻人改正{CC补充}这样的缺点的话，我们的世界一定会有进步，一定会有快乐的社会{CJ-zxy生活}。,199605104523200282,韩国,2,199605,由“三个和尚没水喝”想到的……,70,75,74,60,70,338,C,
这是一个从古代传下来的传说，它不但是传说，而且包含着教训。,199605104523100299,韩国,1,199605,由“三个和尚没水喝”想到的……,80,65,63,49,46,291,C,
如果没有成员{CC2构成员}的努力的话，这船不能往前走了，[BC。]社会不能发展了，[BC。]国家也一样{CQ不能发展}了。,199605104523200311,韩国,2,199605,由“三个和尚没水喝”想到的……,60,75,46,51,44,262,未参加,
她本来{CQ就}很傲自满，[BC。]父母走了以后，马上就跟我们{CJ-dy这些}妹妹说：[BC，]“大妹妹，你打扫屋子。,199605104525200321,日本,2,199605,由“三个和尚没水喝”想到的……,55,65,38,58,56,254,未参加,
但是要拿[C]水的和尚[B当]毅然地不听他[C]们的话[C]。,199605104616100327,德国,1,199605,由“三个和尚没水喝”想到的……,85,65,44,33,56,272,未参加,
{CD在}两个人时[C]，先来{CC2从前知道}的人要开始介绍{CJ-by情况}，帮助另一个人。,199605104525200368,日本,2,199605,由“三个和尚没水喝”想到的……,65,55,52,67,68,289,未参加,
这三个和尚的故事{CC传说}，虽然是个短篇，可是印象比较深刻的故事{CJs}。,199605104525200396,日本,2,199605,由“三个和尚没水喝”想到的……,70,60,77,56,80,328,C,
小心，他们三个人也都担[C]心了P}。,199605550523290024,韩国,2,199605,由“三个和尚没水喝”想到的……,60,50,21,35,23,169,未参加,
我们会觉得很累。,199605550523190056,韩国,1,199605,由“三个和尚没水喝”想到的……,70,50,55,47,56,261,未参加,
