错句,作文编码,国籍,性别,考试时间,作文题目,口试分数,作文分数,听力分数,阅读分数,综合分数,总分,证书
吸烟对个人健康和吸烟者周围的人影响极大。,200405680519150020,马来西亚,1,200405,吸烟对个人健康和公众利益的影响,65,65,41,67,87,309,未参加,
所以，政府禁止在公共场所吸烟，特别是人口密集的商业中心，是一个明智的决定[BQ。]除此之外，若要在减少{CC减轻}国人吸烟的事业有更好的突破，还{CC并}需三管齐下。,200405680519150021,马来西亚,1,200405,吸烟对个人健康和公众利益的影响,75,95,83,88,91,426,A,
香烟，是一种会让人上瘾的东西。,200405680519250039,马来西亚,2,200405,吸烟对个人健康和公众利益的影响,75,95,85,88,87,424,A,
香烟的尼古丁将吸烟者的牙齿熏成{CC薰得}黄色，十分不符合人体口腔的卫生指数。,200405680519250044,马来西亚,2,200405,吸烟对个人健康和公众利益的影响,80,95,63,81,94,408,B,
我认[F認]为混合式教育[L]不但不会造成大多数学生早恋[B变]，反而能增加男女生对彼此有更深一层的了解。,200504534533250004,新加坡,2,200504,我对男女分班的看法,70,70,56,62,66,312,C,
一出校[D出]如色中饿鬼或出土怪物，造成在社交上的一块绊脚石。,200504534533250009,新加坡,2,200504,我对男女分班的看法,65,80,56,73,66,328,C,
难道，就不能和邻校的学生谈恋爱吗？,200504534533150028,新加坡,1,200504,我对男女分班的看法,70,70,84,62,77,351,C,
无论混合式或男女分班式教育，都有其利与弊。,200504534533250065,新加坡,2,200504,我对男女分班的看法,65,75,65,82,86,360,C,
这不是危言耸听，的的确确在现实中，常发生的事{CJs}。[BC.],200504534533150084,新加坡,1,200504,我对男女分班的看法,70,90,76,69,93,391,B,
我毕业于{CC自}女子中学。,200504534533250116,新加坡,2,200504,我对男女分班的看法,95,75,76,78,86,405,B,
这世上会有男有女，是因为上帝不想让人间太单调。,200504534533250131,新加坡,2,200504,我对男女分班的看法,75,85,70,71,84,378,B,
这方面，家长应该教导孩子。,200504534533150176,新加坡,1,200504,我对男女分班的看法,85,70,70,80,70,366,B,
在同一个教室里学习，同学们不仅从课本上吸收到许多知识，而且也在互相相处、交流时学到了更多的大学问。[BC.],200504534533250169,新加坡,2,200504,我对男女分班的看法,80,80,78,71,75,376,B,
对我而言，父母不仅是孩子的第一任老师，同时也是孩子的最好的老师。,200505109529200216,泰国,2,200505,父母是孩子的第一任老师,95,95,67,84,79,419,B,
那我[C]想注意自已的语言{CC发[C]言}和[C]行[C]为[C]，因为他们注意[C]关注我[C]。,200505109525100552,日本,1,200505,父母是孩子的第一任老师,60,65,63,61,69,301,C,
我现在认为没有他们的教育的话，可能{CJX}我会是个没有特别的个性的大人。,200505109525200545,日本,2,200505,父母是孩子的第一任老师,65,65,69,58,72,313,C,
总[C]之，我认为作为父母，大人们应该面对孩子，教育孩子。,200505109525200545,日本,2,200505,父母是孩子的第一任老师,65,65,69,58,72,313,C,
我家的三个孩子长大以后，都选[C]择[C]自己办[C]的父母的工作{CJ？}，一个是大学的教授[C]，另一个{CC二个}是自己开公司。,200505109525200976,日本,2,200505,父母是孩子的第一任老师,60,60,64,53,57,276,未参加,
对于“父母是孩子的第一任老师”这一句话，我不仅十分同意而且看过了举不胜举的关于这个问题的例子。,200505109529201322,泰国,2,200505,父母是孩子的第一任老师,65,65,41,43,64,262,未参加,
”,200505109525101706,日本,1,200505,父母是孩子的第一任老师,75,60,48,63,72,304,未参加,
过[C]了一段[C]时间之后，就是到了一岁左右，[BC。]他们慢[B漫[C]]慢[B漫]地学会词语。,200505109525101890,日本,1,200505,父母是孩子的第一任老师,55,75,39,51,54,259,未参加,
父母的态度会帮助孩子成长为{CC3长到}{CQ一}个好的居民。,200505109539101923,印度,1,200505,父母是孩子的第一任老师,90,60,48,47,52,287,未参加,
如果我是中国人的话它是汉语，[BC、]我[C]是法国人的话它是法语。,200505109525102002,日本,1,200505,父母是孩子的第一任老师,60,60,50,49,76,277,未参加,
钱呢？,200505109525201934,日本,2,200505,父母是孩子的第一任老师,65,45,37,51,50,227,未参加,
除了一般的知识、[BC，]兴趣、[BC，]爱好[BQ，]父母会“教[B交]给”孩子自己的坏习惯和缺点。,200505271636200079,乌克兰,2,200505,父母是孩子的第一任老师,55,55,56,45,72,263,未参加,
第三种[F種]感情是一种[F種]激情。,200505951922250001,美国,2,200505,最理想的结交方式,85,75,82,66,84,384,B,
虽然我还没有结婚，[BC。]但我想要有一个幸福美满的家庭。,200505522522250011,缅甸,2,200505,最理想的结交方式,70,85,41,44,64,296,未参加,
为什么这样幸福呢？{CD从},200505522522250013,缅甸,2,200505,最理想的结交方式,65,75,61,71,84,343,C,
而七情六欲[F慾]则[F則]是控制人类走向光明大道还是步入歧途深渊的重大因素。,200505522522150023,缅甸,1,200505,最理想的结交方式,80,90,84,64,84,397,B,
在我心目中，是她让[F讓]我不害怕，[BC、]是她让[F讓]我勇敢，是她让[F讓]我成功，所以在我心里[F裡]，[BC、]最理想的结[F結]交方式是从小到大的伴侣。,200505522522110018,缅甸,1,200505,最理想的结交方式,65,70,73,55,70,319,C,
比如{CJ+sy是}听音乐，集邮{CC2集邮票}，种花等，五花八门的兴趣。,200505201542200419,越南,2,200505,父母是孩子的第一任老师,80,70,56,59,80,335,C,
根据理论上来说，父母是初次跟孩子接触的人，所以父母对孩子的影响颇为重大。,200505219529100021,泰国,1,200505,父母是孩子的第一任老师,75,55,54,63,76,308,未参加,
在公众[F衆]地方吸烟[F煙]可以把吸烟[F煙]者身体[F體]的细[F細]菌传[F傳]染给[F給]没有吸烟[F煙]的人。,200509105922100003,美国,1,200509,吸烟对个人健康和公众利益的影响,75,75,46,70,63,319,C,
抽烟当然不{CQ能}帮助人们保持身体{CQ健康}，恰恰相反，它对抽烟者和社会{CQ来说}[BQ，]成为了一个巨大的问题。,200509105922200004,美国,2,200509,吸烟对个人健康和公众利益的影响,80,60,35,51,44,257,未参加,
这些对孩子都起着潜移默[B漠]化的教育作用，有利于孩子的智[B知]力开发。,200509801801250002,澳大利亚,2,200509,父母是孩子的第一任老师,85,70,69,85,94,394,C,
就读语文系。,200509534533250021,新加坡,2,200509,一封求职信,85,70,82,66,86,380,B,
贵公司的服务水准及配套深受欢迎，两年来也逐渐受到媒体的推荐及旅游界的好评。,200509534533250164,新加坡,2,200509,一封求职信,75,75,82,64,84,370,B,
谢谢。,200509534533150183,新加坡,1,200509,一封求职信,65,70,75,66,82,344,C,
据音乐评论家们说，现代的流行歌曲太多而且{CC就}相似的歌曲也多。,200510111523200013,韩国,2,200510,我看流行歌曲,55,65,70,56,72,300,C,
所以我认为{CQ应该}{CD发展到}减少其副作用[BQ，]适当地喜欢流行歌曲。,200510111523200414,韩国,2,200510,我看流行歌曲,60,70,60,48,64,287,未参加,
如今的歌或许以不如30、40年前那么积极，光明，但是这不断多元化的流行歌坛正代表着大众对文化需求的日益个性化。,200510111922200436,美国,2,200510,我看流行歌曲,95,95,86,81,100,456,A,
我认为每{CQ个}年代，每{CQ个}种类的音乐都有自己的特性和价值[B直]。,200510111523200770,韩国,2,200510,我看流行歌曲,80,80,63,69,69,353,B,
第一，我老了。[BC.],200510111523100806,韩国,1,200510,我看流行歌曲,85,75,79,67,69,367,B,
随着人们的生活水平日益提高，人们对流行歌曲的看法也变了。,200510111523200884,韩国,2,200510,我看流行歌曲,60,70,63,63,62,303,C,
十有八九都是从电视看韩国节目或者听韩国歌手唱的歌的。,200510111523101054,韩国,1,200510,我看流行歌曲,60,70,63,46,57,281,未参加,
我看那些文化媒体，尤其是流行歌曲具有一定的吸引力。[BC，],200510111523101054,韩国,1,200510,我看流行歌曲,60,70,63,46,57,281,未参加,
流行歌曲总是有着非常多的听众。,200510111523201067,韩国,2,200510,我看流行歌曲,55,45,56,38,52,223,未参加,
随着社会的发展，人们的生活水平越来越高。,200510111523101104,韩国,1,200510,我看流行歌曲,50,60,46,46,47,229,未参加,
现在文化贸[C]易跟别的贸[C]易相比，更大、[BC，]有更大的潜力。,200510111523101261,韩国,1,200510,我看流行歌曲,40,60,23,56,45,201,未参加,
我们一起床，就开始听到各种各样的音乐。,200510111523201274,韩国,2,200510,我看流行歌曲,65,65,65,48,69,296,C,
所以{CC2之所以}我们不得不放松自己，要不然很容易像一颗{CC块}炸弹{CC弹}爆炸起来{CD的}。,200510111542201697,越南,2,200510,我看流行歌曲,90,75,67,56,62,344,C,
结果中国朋友们不认为{CC2看}我是韩国人[BQ，]我也是觉得{CC决得}我不是韩国人，我也是中国人。,200510111523101848,韩国,1,200510,我看流行歌曲,45,55,30,20,42,170,未参加,
边休息，边听音乐，对我们来说，很好的休息方法{CJs}。,200510111523201858,韩国,2,200510,我看流行歌曲,50,65,53,24,52,225,未参加,
喜欢歌手、歌曲都{CJX}当然自己的自由{CJs}，可歌迷{CC2歌手迷}常常强要让别人喜欢他们喜欢的歌手，甚至[B直]有的人对某一个歌手说不好的话，那个人可能不会活着。,200510111523201883,韩国,2,200510,我看流行歌曲,75,70,60,50,69,313,C,
一方面是她们的嗓子都很不错，另一方面是她们都{CQ是}很美丽的女孩儿呀！,200510271634100130,英国,1,200510,我看流行歌曲,85,65,46,36,62,283,未参加,
流行歌曲是我生活很大的的部分，在琴上弹曲也让我发挥我的创造{CC创[F創]意}力，消除{CC融化}我的担忧[B悠]。,200510543801200001,澳大利亚,2,200510,我看流行歌曲,80,95,58,56,74,358,C,
如果说父母在平时很习惯读书[BQ，]孩子也会学做同样的事情，从而养成他或她的习惯。,200510956501230005,中国,2,200510,父母是孩子的第一任老师,90,95,68,63,91,405,C,
父母对孩子的影响是非常重要的。[BC，],200510956922130002,美国,1,200510,父母是孩子的第一任老师,80,85,74,52,71,356,C,
我是个喜欢听流行歌曲的人。{CJ-zhuy歌曲},200510302523100024,韩国,1,200510,我看流行歌曲,70,90,63,61,77,354,C,
她说：“我听流行歌曲时，才{CJX}心情非常舒畅。,200510302523200037,韩国,2,200510,我看流行歌曲,75,80,51,54,79,330,C,
总之来说，流行歌曲也有[BD，]在社会方面、[BC，]在经济方面{CQ的}好处。,200510302523100041,韩国,1,200510,我看流行歌曲,65,60,51,59,62,280,未参加,
当我因学习的压力苦恼的时候，听着音乐心情自然就好了。,200510302523100046,韩国,1,200510,我看流行歌曲,90,65,72,71,91,380,B,
我在学习过程当中，不能集中精神，需要休息的时候听音乐，可以使自己放松放松，然后再回去学习，这样会更加{CJ-sy提高}学习效率。,200510302523200044,韩国,2,200510,我看流行歌曲,80,70,60,40,69,309,未参加,
也看过有几位女中学生因跟着歌星的车而{CQ被}撞了失去生命的事情。,200510302523200105,韩国,2,200510,我看流行歌曲,65,55,60,52,74,288,未参加,
我们听了{CD唱}都高兴这就是好的音乐，听了以后感觉反感只是声音{CJ+zhuy这}不是音乐。,200510302523200124,韩国,2,200510,我看流行歌曲,65,75,51,46,67,291,未参加,
但是我呢？,200510302523200139,韩国,2,200510,我看流行歌曲,70,60,37,40,50,242,未参加,
不过曲调不同把{CC让}我吸引住了。,200510302523100173,韩国,1,200510,我看流行歌曲,70,65,56,42,72,291,未参加,
有些人特别喜欢流行歌曲，甚至对自己喜欢的歌星达到痴迷的程[C]度。,200510302523200188,韩国,2,200510,我看流行歌曲,60,50,72,48,50,260,未参加,
听歌只是一[L]些人的爱好而已，但会{CJX}总有一天，{CD听}流行歌曲{CQ会}成为每个人的朋友、[BC，]影子。,200510302523200209,韩国,2,200510,我看流行歌曲,60,65,60,50,50,268,未参加,
“萝[Pluo]卜[Pbo]白菜，各有所爱”[BC。]。[BC”],200510302523100219,韩国,1,200510,我看流行歌曲,65,65,72,48,77,311,C,
我听着有些流行歌曲，{CJ+zhuy我}感觉到为什么日本还有中国以及其它国家{CJ-sy会}产生“韩流”，歌曲实在是好听极了！,200510302523200212,韩国,2,200510,我看流行歌曲,75,65,58,52,69,306,C,
第一组是古典音乐，[BC。]另一组就是现代乐。,200510529529151026,泰国,1,200510,我看流行歌曲,65,70,70,52,79,322,C,
过不久到了考[C]试[C]，孩子就考[C]不及[B级]格了，[BC。]会招来{CC遭来}很多问题。,200510529529151026,泰国,1,200510,我看流行歌曲,65,70,70,52,79,322,C,
有一些中文流行歌曲我喜欢听，比如《[BC“]来生缘》[BC”]，还有是《[BC“]冬恋》[BC”]，歌词内容生动，有讲生活上所发生的{CJ-zxy事情}。,200510540540200022,印度尼西亚,2,200510,我看流行歌曲,50,70,56,56,82,297,未参加,
但有一些人不喜欢这种歌曲。,200510540540200026,印度尼西亚,2,200510,我看流行歌曲,65,60,46,32,72,258,未参加,
当我们听到脍炙人口的流行歌曲{CQ时}我们一定会开朗一些，还有开心一些。,200510634634200162,英国,2,200510,我看流行歌曲,80,70,63,36,57,296,未参加,
我认为通过亲戚朋友的介绍，慢慢了解，逐渐相爱，是最理想的结交方式。[BC.],200505680519250008,马来西亚,2,200505,最理想的结交方式,85,95,82,73,88,419,A,
信教的人会说人的第一任老师是神，因为他们认为孩子是神给他们的。,200510600919115001,加拿大,1,200510,父母是孩子的第一任老师,90,75,65,79,68,371,B,
我跟那个人已经打听好了。,200104124525200031,日本,2,200104,一封写给父母的信,70,65,63,75,54,313,C,
到目前{CQ为止}，我不会忘记你们的照顾。,200104124525100118,日本,1,200104,一封写给父母的信,65,55,36,37,42,217,未参加,
我第一次亲眼看到怎样做成可口可乐、芬达等饮料。,200104124545100108,乌兹别克斯坦,1,200104,一封写给父母的信,70,80,30,30,56,256,未参加,
最近过得很愉快，[BC。]可能这意味着[BD，]我已经习惯了在中国的生活吧！,200104124523200179,韩国,2,200104,一封写给父母的信,65,75,49,25,49,250,未参加,
妈妈也{CJ-zy已经}老多了，[BC。]所以请您别再担心我的事，担心您自己的健康{CQ吧}。,200104124523100201,韩国,1,200104,一封写给父母的信,70,60,66,58,72,311,C,
我知道我在中国的时候，您俩一直很担心我，很关心我。,200104124523100243,韩国,1,200104,一封写给父母的信,70,65,74,56,85,336,C,
爸爸的生意做得如何？,200104124540200241,印度尼西亚,2,200104,一封写给父母的信,70,85,68,44,67,326,C,
虽然我打算用我自己的钱来付全部的费用，比如学费、[BC，]生活费等等，但是我想在你们的支持下[BD，]到北京留学。,200104124523200304,韩国,2,200104,一封写给父母的信,70,70,55,49,54,286,未参加,
我已经不是小孩子{CQ了}，{CJ-zhuy我}会照顾{CJ-buy好}自己，{CJ-zhuy你们}不要太担心我了。,200104124523100333,韩国,1,200104,一封写给父母的信,65,55,68,58,63,291,C,
有的时候，我想早{CD就}没{CC不}来就好了。,200104124523200456,韩国,2,200104,一封写给父母的信,70,70,71,51,63,313,C,
我一九六七年出生，今年二十五岁[BQ，]是个日本人[BQ，]女性{CC女的}[BQ，]一九八五年高中毕业后，就在某服装公司做{CC1担任}{CD了}推销[B锁]工作。,199200008525200007,日本,2,199200,一封求职信,,,0,0,0,0,未参加,
人老了以后，应该穿漂亮的衣服。,199200008525200012,日本,2,199200,一封求职信,,,0,0,0,0,未参加,
这个部分法律管不了。,199604123523200285,韩国,2,199604,如何看待“安乐死”,65,75,45,44,42,258,未参加,
虽然那个妻子得[C]了一种不治之症，十分痛苦，不过[C]她还[C]活着呢。,199604124525200064,日本,2,199604,如何看待“安乐死”,60,60,61,61,65,289,未参加,
有人认为这是一种犯罪的行为。,199604123523200317,韩国,2,199604,如何看待“安乐死”,65,60,35,61,47,251,未参加,
总之，为了病人自己、[BC，]家属、[BC，]有一些不运的人，我赞成安乐死。,199604124523200345,韩国,2,199604,如何看待“安乐死”,70,60,66,54,52,286,C,
如果得了一种不[D可]治之症、一种不可救药的病，那当[C]然那个人本人和她周围的人会感[C]到十分痛[C]苦。,199604124606200349,比利时,2,199604,如何看待“安乐死”,65,55,56,66,65,289,未参加,
她的丈夫不应该受到法律的制裁。,199604124606200349,比利时,2,199604,如何看待“安乐死”,65,55,56,66,65,289,未参加,
因为现代人有更多机会发挥自己的权力，于是人能有权利{CC自权}提出自己的要求。,199604123529200228,泰国,2,199604,如何看待“安乐死”,60,65,40,37,49,234,未参加,
这[C]不是“与人方便自己方便”吗？[BD。],199604123523200331,韩国,2,199604,如何看待“安乐死”,55,60,66,54,26,242,未参加,
而且，身体和心理[B里]也受不能忍受{CJ+buy到}的痛苦。,199604123523200165,韩国,2,199604,如何看待“安乐死”,60,60,61,61,44,268,未参加,
从法律上来看[C]，“安乐死”是违[C]法{CJsd}。,199604123523100268,韩国,1,199604,如何看待“安乐死”,60,55,42,42,47,227,未参加,
第一是为了病人自己。,199604123523200211,韩国,2,199604,如何看待“安乐死”,60,60,61,61,44,268,未参加,
因为可以从好几个角度来看“安乐死”。[BC.],199604124636200100,乌克兰,2,199604,如何看待“安乐死”,65,70,53,66,49,288,C,
不仅他自己感觉不到{CC4天觉}世界，也给家里人、[BC，]朋友们带来很大痛苦。[BC.],199604124636200100,乌克兰,2,199604,如何看待“安乐死”,65,70,53,66,49,288,C,
我们也是常常和我们的长辈交流时遭到困难。,199610550523290016,韩国,2,199610,如何解决“代沟”问题,75,70,54,65,59,312,C,
社会也一样。,199610550523290039,韩国,2,199610,如何解决“代沟”问题,60,65,57,44,49,258,未参加,
若我们仔细地观察一般家庭的生活模式，就不难{CD会}发现，几乎没有父母和子女之间对话的时间。,199610550523290083,韩国,2,199610,如何解决“代沟”问题,80,85,68,71,76,374,B,
父母可以从[F從]生活过[F過]程之中知道儿[F兒]女的生活态[F態]度和观[F觀]念，[BC。]把不对的观[F觀]念改正过[F過]来，对{CC把}对的观[F觀]念加以表扬[F揚]。,199611543634100525,英国,1,199611,如何解决“代沟”问题,80,85,75,75,82,391,B,
第一他们[F們]可用教育方法，感化{CQ他们}，使他们[F們]明白没有不劳[D力]而获[F獲]，每个人都有责[F責]任照顾[F顧]自己，别人没有这个义务[F務]，{WWJ},199603533533200085,新加坡,2,199603,由“三个和尚没水喝”想到的……,75,55,35,31,58,239,未参加,
万物之灵的我们，应该时时刻刻做到“人人爱我，我爱人人”才是啊！,199603533533200102,新加坡,2,199603,由“三个和尚没水喝”想到的……,95,95,74,65,94,422,B,
那手工艺品的要求是要各组去找一些废物，例如：旧报纸、旧纸盒等，去做我们心里头的玩具。,199604680519100521,马来西亚,1,199604,由“三个和尚没水喝”想到的……,80,60,63,58,84,332,C,
可是，众多的人认为，为了更多地享受生活，{CJ-zy应该}在自己的工作上很热[C]心，很{WWJ}。,199605104523100075,韩国,1,199605,由“三个和尚没水喝”想到的……,70,70,60,70,65,323,C,
可是有一天新来了一个和尚，[BC。]他们两个人一起把水抬来喝{CD了}。,199605104523100083,韩国,1,199605,由“三个和尚没水喝”想到的……,60,55,58,54,54,262,未参加,
三个和尚{CQ应}一起合作开拓{CC开阔}市场，不能满足于现在的情况。,199605104523100112,韩国,1,199605,由“三个和尚没水喝”想到的……,70,70,77,67,68,340,C,
终于三个人一起跑下去。,199605104525200107,日本,2,199605,由“三个和尚没水喝”想到的……,65,65,55,70,75,314,C,
上星期她发表{CD了}，这周{CD是}我发表{CD的}，你{CJX}{CD是}下周发表{CD吧}……[BD，]这样，{CQ在}很{CJ+sy有}热烈{CC精神}的气氛中进行{CD了}活动。,199605104525100177,日本,1,199605,由“三个和尚没水喝”想到的……,65,70,66,74,65,326,C,
但是[BD，]三个人的想法{CC心情}都一样，[BC。]一个人也没让步，[BC。]甚至想：[BC，]“与其我一个人去挑{CC抬}水喝，不如就这样渴死。,199605104523100217,韩国,1,199605,由“三个和尚没水喝”想到的……,65,80,74,65,72,344,C,
最后，任务气我{CJjy}，可是我那个时候没有办法。,199605104525200255,日本,2,199605,由“三个和尚没水喝”想到的……,50,50,55,47,35,215,未参加,
为[C]了学会{CC体会}体贴别人，首先我们应该教孩子们。,199605104525200256,日本,2,199605,由“三个和尚没水喝”想到的……,60,55,35,58,56,245,未参加,
”其他的和尚都[B者]不愿意。,199605104540200277,印度尼西亚,2,199605,由“三个和尚没水喝”想到的……,65,65,44,33,58,249,未参加,
这意味着，人的心本身不是强的，而是比较弱的。,199605104525100354,日本,1,199605,由“三个和尚没水喝”想到的……,75,55,69,74,82,340,C,
除了这座庙里以外，他能{CC的[C]}去哪里糊口呢？,199605550523190002,韩国,1,199605,由“三个和尚没水喝”想到的……,70,65,83,76,82,362,C,
可是到了现代，人们的观念却改变了，重视[B是]个人的利益，以利己为重，不重视社会共同的利益[C]。,199605550523190047,韩国,1,199605,由“三个和尚没水喝”想到的……,70,85,94,72,70,383,B,
但{CD至到}一九六六年的四月的某一天，我第二次哭了，这次哭的不只是我，还包括了我的父母亲和弟妹们。,200110540540150039,印度尼西亚,1,200110,我的童年,75,85,77,87,88,405,B,
因为我在两岁[C]时父亲便已去世。,200110540540250030,印度尼西亚,2,200110,我的童年,70,80,77,77,90,384,B,
小的时候我的三哥住在别的城市，他应母亲的要求，一星期写给母亲一封信[C]。,200110540540250030,印度尼西亚,2,200110,我的童年,70,80,77,77,90,384,B,
小学三年级开始，我意识到若不努力，将来很难赚钱帮[F幫]父亲，他年纪够大了，头发开始发白，妈又不断地勉励我，使我的成绩一天比一天好，每次考试成绩都名列前茅。,200110540540150063,印度尼西亚,1,200110,我的童年,70,90,52,51,92,348,未参加,
人人都经[B进]过童年这个阶段。,200110540540250064,印度尼西亚,2,200110,我的童年,70,90,77,63,83,376,C,
我还记得妈妈经常对我说，我小时候非常顽皮。,200110540540150077,印度尼西亚,1,200110,我的童年,70,95,66,51,83,358,C,
由于一向对旅游业很有兴趣，所以当看到报[C]刊上的启事，马上写此信待聘。,199312533533200049,新加坡,2,199312,一封求职信,95,90,83,70,78,415,A,
兹将本人的简历与情况写明如{CC余}下：小弟为新加坡人，贵国大概称为华侨[F僑]吧！,199312533533100064,新加坡,1,199312,一封求职信,80,65,57,70,73,334,C,
现附[B符]上我的简历、工作经验[C]一表。,199312533533100068,新加坡,1,199312,一封求职信,85,70,55,58,78,338,C,
还有我的容貌特别端正，表达力很强。,199312104523100009,韩国,1,199312,一封求职信,55,55,50,72,68,280,未参加,
我喜欢为客人服务[BQ。]在一个大饭馆里干活，看到每个客人非常满意[C]地微[C]笑的时候，我感到一种非常温暖的幸福。,199312123525100210,日本,1,199312,一封求职信,55,50,53,39,32,208,未参加,
司机：男，3名，20至40岁。,199312123519100304,马来西亚,1,199312,一封求职信,50,40,27,28,41,160,未参加,
在美国旧金山的大学学了十个月，成绩优秀[C]。[BC，],199312124635100429,俄罗斯,1,199312,一封求职信,60,70,60,76,62,313,C,
我这时回忆{CJ-buy起}以前的很多事儿。,199412123525100023,日本,1,199412,记我的父亲,50,70,36,42,45,226,未参加,
我父亲今年五十四岁，[BC。]在一个地区报[F報]纸公司工作。,199412123523200055,韩国,2,199412,记我的父亲,70,55,57,42,51,259,未参加,
我记得[B的]我爸爸也是这样的人。,199412123619200080,罗马尼亚,2,199412,记我的父亲,55,60,54,44,47,241,未参加,
虽然父亲{CJ-sy是}没读[B卖]书{CJX}过的人，不过他对我的感情、[BC，]爱还在我的身上。[BC.],199412123523100100,韩国,1,199412,记我的父亲,50,60,36,38,37,201,未参加,
因此，已经经过各种各样的事情。,199412124523100020,韩国,1,199412,记我的父亲,70,65,65,77,65,328,C,
目前，父亲的健康不太好。,199412124523100020,韩国,1,199412,记我的父亲,70,65,65,77,65,328,C,
特别是在少年时期，我非常独断专行，难以管束，但是父亲没打我，他一直对我们讲{CC说}道理。,199412124529200027,泰国,2,199412,记我的父亲,95,75,60,46,61,332,C,
其中，我父亲对我的影响更大。,199412124525100057,日本,1,199412,记对我影响最大的一个人,75,55,73,67,74,329,C,
那是我最后{CQ一次}看到{CC的}她。,199412124525200061,日本,2,199412,记对我影响最大的一个人,60,65,62,57,55,282,C,
