错句,作文编码,国籍,性别,考试时间,作文题目,口试分数,作文分数,听力分数,阅读分数,综合分数,总分,证书
”其实离婚的问题是夫妻双方的问题，也是很私人的问题。,200103533533250015,新加坡,2,200103,我对离婚问题的看法,75,75,75,77,96,388,B,
过去的婚姻，往往都是应父母之命而进行的，为何这些夫妻们，大多数都能白头偕老呢？,200103533533150033,新加坡,1,200103,我对离婚问题的看法,85,75,85,68,79,384,B,
有一天，我们参加了一个比赛，我获得等一{CJX}奖，[BC。]高兴得不得了。,200110540540250020,印度尼西亚,2,200110,我的童年,65,85,36,39,54,269,未参加,
父亲便请了一个伙计来协助料理店里的工作。,200103680519101602,马来西亚,1,200103,我的童年,80,85,61,47,76,343,C,
可是，我九岁那年，考验来了。,200103680519201609,马来西亚,2,200103,我的童年,85,75,64,80,85,381,B,
我不希望她还{CC也}没有选好，就试着去首都{CD来}参加大学考试。,200104124545100107,乌兹别克斯坦,1,200104,一封写给父母的信,75,90,47,54,58,318,C,
我送给你们的照片是在云南拍的。,200104124619100227,罗马尼亚,1,200104,一封写给父母的信,70,75,68,58,72,332,C,
毕业以后，我想在北京找工作。,200104124630200404,西班牙,2,200104,一封写给父母的信,65,75,38,37,49,251,未参加,
由于天气与气候{CC气氛}的关系我有时生病，总觉得全身不对劲儿，[BC。]可现在总算好多了。,200104124545100462,乌兹别克斯坦,1,200104,一封写给父母的信,70,80,41,37,42,260,未参加,
所以我这次回去实在感到放心。,200104124730100430,毛里求斯,1,200104,一封写给父母的信,65,85,55,23,67,285,未参加,
就写这些吧。,200104124730100430,毛里求斯,1,200104,一封写给父母的信,65,85,55,23,67,285,未参加,
我再次对你们的关心及帮助表示深切的感谢。,200105550523150002,韩国,1,200105,一封写给父母的信,70,65,68,56,79,324,C,
然后到了我在中国进修汉语的时候{CC时期}，我重新开始给{CC向}母亲写信，问问她的生活如何，心情又如何！,200105550523250004,韩国,2,200105,一封写给父母的信,80,75,85,54,74,359,B,
真对不起您。,200105550523250008,韩国,2,200105,一封写给父母的信,70,70,58,42,61,289,C,
祝每天幸福，健[B建]康{CJjy}。,200105550523250018,韩国,2,200105,一封写给父母的信,65,65,33,42,42,231,未参加,
但是，我还没决定，因为我最希望去中国工作。,200105550523150028,韩国,1,200105,一封写给父母的信,65,70,41,47,67,276,未参加,
我{CJX}当被决定来中国留学的时候{CJbei}你们不仅不反对还支持我，完全同意我的计划。,200105550523250026,韩国,2,200105,一封写给父母的信,70,75,74,73,70,351,B,
你们的恩情{CC恩爱}我不能忘掉。,200105550523250046,韩国,2,200105,一封写给父母的信,70,65,52,61,56,290,C,
亲爱的爸爸，妈妈：[BC，]你们最近过得怎么样？,200105550523250343,韩国,2,200105,一封写给父母的信,65,80,58,51,54,296,C,
既不会说当地话，也不太了解当地的风俗习惯。,200105212525100023,日本,1,200105,我的一个假期,70,70,75,54,59,316,C,
我在大学的时候，一放了假，就去国外旅游，尤其是中国。,200105212525200010,日本,2,200105,我的一个假期,65,75,77,75,90,369,B,
连过马路也要一对径儿。,200105212525200039,日本,2,200105,我的一个假期,65,70,55,54,55,285,C,
我住在沈阳一年多，虽然我住在中国，但是我的汉语水平没有进步。,200105224525200013,日本,2,200105,我的一个假期,65,75,42,61,57,287,未参加,
那时我还是年轻[B经]。,200105209525100022,日本,1,200105,我的一个假期,60,60,32,65,74,273,未参加,
将来会不会产生坏结果？,200105201525200037,日本,2,200105,我的一个假期,70,70,67,70,61,326,C,
那年的暑假发生的事情，永远在我心里，是一个难忘的假期。,200105201525200088,日本,2,200105,我的一个假期,80,90,87,72,83,407,B,
最好是首先靠自己努力做，以后如果还不行的话，{CJ-zy再}靠别人{CC自己}。,200105109525200441,日本,2,200105,由“三个和尚没水喝”想到的……,65,75,54,77,57,315,C,
当然原来第三个和尚偷偷地喝{CQ了}水。,200105109525100485,日本,1,200105,由“三个和尚没水喝”想到的……,75,65,70,75,77,349,B,
这时，或者到别的地方去找水，或者把那里的水分给三个和尚一起用。,200105109525200681,日本,2,200105,由“三个和尚没水喝”想到的……,70,70,52,64,82,326,C,
我们{CJ-zy应该}好好考虑这一点。,200105109525200725,日本,2,200105,由“三个和尚没水喝”想到的……,65,70,70,58,66,315,C,
总结这些就是让每个人有每个人的责任。,200105109520200854,蒙古国,2,200105,由“三个和尚没水喝”想到的……,70,70,57,49,70,304,未参加,
因为从小我父亲[F親]就离[F離]开[F開]我们[F們]，到现[F現]在音讯[F訊]全无[F無]，一点消息都没有。,200203522522150008,缅甸,1,200203,记对我影响最大的一个人,75,90,50,52,55,316,未参加,
我从来没想到今天我会真正明白对我影响最大的人竟是我那七十四高龄的母亲。,200203533533250021,新加坡,2,200203,记对我影响最大的一个人,90,80,50,64,86,365,C,
这样我觉得比较好，是因为如果朋友的话[BQ，]{CJ-zhuy自己}容易受骗。,200205204525100031,日本,1,200205,如何看待“安乐死”,70,60,21,42,54,232,未参加,
如果我对他们说“我不想死，请你们照顾我。,200205204525200036,日本,2,200205,如何看待“安乐死”,65,65,52,56,54,276,未参加,
因为我不想给孩子们好多麻烦，而脑死的话，发生了什么事也不能看到。,200205204525200060,日本,2,200205,如何看待“安乐死”,70,65,74,60,54,309,C,
听起来非常不好{CJ+zxy的印象}，[BC。]但是我觉得因为很爱{CJX}互相所以能做到的东西{CJs}。,200205204525200175,日本,2,200205,如何看待“安乐死”,65,75,35,60,58,280,未参加,
在我们国家有很像这件事情的故事。,200205212525100004,日本,1,200205,如何看待“安乐死”,65,65,49,65,56,284,C,
所以“安乐死”是非常难的话题，也许这些话题就是对{CC从}人类而言进退两难{CD吧}的东西吧！,200205209525100016,日本,1,200205,如何看待“安乐死”,75,70,33,58,54,279,未参加,
1994年初在[D在]中国农村发生一{CD个}件事：[BC；]就是妻子得了一种不治之症，[BC。]十分痛苦的妻子要求丈夫帮助自杀。,200205209525100058,日本,1,200205,如何看待“安乐死”,60,65,52,65,49,274,未参加,
可是要用“安乐死”应该有几个条件。,200205201540100083,印度尼西亚,1,200205,如何看待“安乐死”,80,80,35,54,65,306,未参加,
虽然今天医学{CD界}很发达[F達]，但还是有很多疾病不能医治，如癌症，当这疾病攻击人时，那种痛苦不是每个人都能忍受得了的，试想，这种情况，如果让这病人每天在等死，又要受疾病的侵击，那这人生还有什么意思呢？,200205201519200129,马来西亚,2,200205,如何看待“安乐死”,90,80,74,54,91,384,B,
我的看法是同意安乐死。,200205201525100158,日本,1,200205,如何看待“安乐死”,75,70,60,76,51,321,C,
在日本最初提出安乐死问题的人是×××。,200205201525200145,日本,2,200205,如何看待“安乐死”,80,80,49,58,46,305,C,
我家里的问题幸好没有过得解决不了的{CC不可治疗}。,200210529529251002,泰国,2,200210,如何解决“代沟”问题,65,60,31,47,50,236,未参加,
但是如果他们能用理由来考虑[B虎]，这个问题就很容易解决了{CC的}。,200210529529151018,泰国,1,200210,如何解决“代沟”问题,65,55,37,29,30,198,未参加,
现代是{CJ+wy处于[F於]}高科技时代，年青人的接触面很广泛，[BC。]知识面也更广。,200210540540250020,印度尼西亚,2,200210,如何解决“代沟”问题,70,80,67,78,86,371,C,
所谓虎毒不食子就是{CQ这样}[D了]吧。,200210540540150069,印度尼西亚,1,200210,如何解决“代沟”问题,80,65,76,65,55,329,C,
其次，在处理各种客观问题上应抱着坦诚的态度，决不隐[F隱]满。,200210540540250089,印度尼西亚,2,200210,如何解决“代沟”问题,65,85,65,82,75,362,C,
尤其目前社会{CQ中}充满[F滿]污染，{CD就是}吸毒现象{CD的}泛滥[F濫]。,200210540540250094,印度尼西亚,2,200210,如何解决“代沟”问题,60,95,42,58,82,327,未参加,
如何解决代沟这{CQ个}问题？,200210540540250117,印度尼西亚,2,200210,如何解决“代沟”问题,70,70,48,60,79,315,C,
晚上就{CJ+sy是}想在天津的丈夫和[B的]孩子，[BC。]不知孩子三餐怎样，功课有没有问题等等。,200205109519200479,马来西亚,2,200205,如何面对挫折,70,90,78,71,77,379,B,
2000年12月[BQ，]我就想转[B传]学{CQ了}，我想学中文。,200205109540200580,印度尼西亚,2,200205,如何面对挫折,75,70,78,71,59,342,B,
学校假期我会回家看望你们{CC您们}，希望你们{CC您们}多保重。,200205680519250013,马来西亚,2,200205,一封写给父母的信,75,85,70,65,84,372,B,
弟弟和妹妹还好吗？,200205680519250019,马来西亚,2,200205,一封写给父母的信,80,85,81,75,84,399,B,
在现代，{CD而}有许多人从这本著作史{CQ中}吸取灵感，大量运用于现代企业管理的理论和管理哲学中。,200305533533150019,新加坡,1,200305,我最喜欢读的一本书,75,80,82,70,90,388,B,
新约主要讲到耶稣的生平和教导，还有使徒的书信。,200305533533250033,新加坡,2,200305,我最喜欢读的一本书,75,80,90,75,85,396,B,
刚开始学语言的时候，没有什么好玩儿的事。,200304131525200096,日本,2,200304,我学汉语是为了……,70,60,56,65,54,290,未参加,
我觉得现在会说汉语的人很少，所以我想当一个会说汉语的人。,200304131525100279,日本,1,200304,我学汉语是为了……,60,75,27,24,52,224,未参加,
因此，我的看法是：不管在什么环境下，都不应该为“杞人犹天”的事情而操[B燥]心。,200305576525200010,日本,2,200305,静音环境对人体的危害,70,65,74,82,88,365,C,
可是，我们容易听到相互{CC互相}的声音。,200305576525200013,日本,2,200305,静音环境对人体的危害,65,65,44,41,46,245,未参加,
如果有一个人突然{CD放}进到监狱{CJbei}，那里没有电视，没有别的人，他不能听到任何声音的话，他会觉得害怕。,200305576525200044,日本,2,200305,静音环境对人体的危害,65,65,44,46,77,281,未参加,
比如说，家长[B张]可以自己不要抽烟。,200405109540100892,印度尼西亚,1,200405,吸烟对个人健康和公众利益的影响,75,85,74,60,66,353,B,
以前大部分[B份]吸烟的人都是男孩子。,200405109604201526,奥地利,2,200405,吸烟对个人健康和公众利益的影响,70,75,45,35,50,264,未参加,
我周围抽烟的人不多，家里没有，有时候去抽烟朋友的家或者与抽烟同学聚会，也就是了。,200405109616101587,德国,1,200405,吸烟对个人健康和公众利益的影响,70,90,69,75,84,381,C,
他们应该关照非吸烟者的权利{CC2保护环境}，因为他们也有权利[B力]享受{CJX}好好环境，无论谁人人都喜欢美好{CQ的}环境{CJ+dy的现实}{CD的}。,200405109626201552,瑞典,2,200405,吸烟对个人健康和公众利益的影响,65,60,50,33,44,235,未参加,
但实际上这{CC他}对其他人{CC3别人}以及[B极]空气的影响有多大呢？,200405109540100488,印度尼西亚,1,200405,吸烟对个人健康和公众利益的影响,75,85,72,56,78,359,B,
社会公众也被这种无形的伤害而被连累到{CJbei}，公众的利益也因此受到破坏[Phuài]。,200405204922200191,美国,2,200405,吸烟对个人健康和公众利益的影响,85,95,88,65,90,419,B,
因此需要加强教育，同时把“吸烟百害而无一利”当作这一措施的口号。,200405261635200095,俄罗斯,2,200405,吸烟对个人健康和公众利益的影响,90,90,55,54,81,368,C,
现[F現]在大多数[C]的小孩子[BD。]还不到一定的岁[F歲]数就开[F開]始[B结]吸烟了。,200405522522250001,缅甸,2,200405,吸烟对个人健康和公众利益的影响,60,55,35,49,42,222,未参加,
在他的成长中，这些黑影是一定会跟着去的。,200405522522250020,缅甸,2,200405,吸烟对个人健康和公众利益的影响,80,70,66,74,80,360,C,
{CQ被}发现在公共场所边走边抽烟的人将被罚款{CJbei}。,200405522522250030,缅甸,2,200405,吸烟对个人健康和公众利益的影响,90,75,35,56,61,311,未参加,
他们抽烟，不仅危害自己的健康{CC身体}，而且{CQ使}他们{CD的}周围的人们也受到了很多影响。,200405271529200088,泰国,2,200405,吸烟对个人健康和公众利益的影响,70,80,49,44,51,284,未参加,
但是实际上这孩子在这种生活中学会了一种温暖的人情道理。,200505109525200265,日本,2,200505,父母是孩子的第一任老师,60,75,58,56,62,297,C,
所以{CC2之所以}，[BC、]我的运动能力是我爸爸培养出来的。,200505109525200570,日本,2,200505,父母是孩子的第一任老师,70,70,52,54,74,308,C,
我父母说，以养动物为{CJ-by乐趣}{CJ-zy能}学会爱有生命的{CJ-zxy人}。,200505109525200721,日本,2,200505,父母是孩子的第一任老师,45,50,36,40,27,175,未参加,
我非常同意[C]这个看法。,200505204525100094,日本,1,200505,父母是孩子的第一任老师,70,80,63,67,65,335,C,
比如说在公开的地方小孩子玩得太过分，给人们找麻烦，这时如果他母亲不告诉他这是不太好的行为，那就{CJX}孩子一直不懂社会上的规律、秩序、礼貌等人生中非常重要的东西。,200505204525200152,日本,2,200505,父母是孩子的第一任老师,60,60,33,53,54,242,未参加,
孩子们在成长的的过程中受到很大的影响。,200505204525200193,日本,2,200505,父母是孩子的第一任老师,75,70,46,69,69,318,C,
我跟妈妈一直很担心呢！,200505204525200197,日本,2,200505,父母是孩子的第一任老师,70,80,56,55,52,303,C,
我是出生在中国，长大{CJX}在日本，所以我曾经[B径]看过在两个国家生活的父亲，他对我的态[F態]度也是两种的{CJy}，给我的印像也是两种。[BC，],200505204525100354,日本,1,200505,父母是孩子的第一任老师,50,80,69,53,41,278,未参加,
每天在一起，一定会习惯。,200505204525200577,日本,2,200505,父母是孩子的第一任老师,60,65,54,61,61,284,未参加,
一直[C]听爸爸说什么[BQ，]妈妈在做什么，[BC、]都在看着。,200505204525200587,日本,2,200505,父母是孩子的第一任老师,45,70,46,53,52,248,未参加,
我就坐了下来听他与{CJ-by我}“说话”。,200105205919100022,加拿大,1,200105,我的一个假期,90,75,77,39,41,316,未参加,
虽然一开始觉得那是那么漫长，但结[F結]束以后又{CJ-sy觉得}似乎有点短暂。,200105205922200033,美国,2,200105,我的一个假期,70,70,77,58,68,331,C,
{CP但通过那一次的经验，除了赚了一点钱以外，我还学到了不少东西。P},200105205525200049,日本,2,200105,我的一个假期,70,80,60,63,92,355,C,
”正在那时候，好像是这里的老板娘从里边走出来了，她仔细地听完了我的要求后，拿过来另外一件西装上衣，然后把里边的垫肩剪掉[BQ，]把它缝在我想买的套装上了。,200105205525200073,日本,2,200105,我的一个假期,70,80,75,65,74,354,C,
当年学到的中文和中国人的习惯方面的东西最多。,200110919919100005,加拿大,1,200110,我的一个假期,65,55,27,11,28,168,未参加,
我喜欢喝茶，所以春季假期打算去杭[B抗]州西湖。,200105271525200005,日本,2,200105,我的一个假期,65,75,70,65,70,332,C,
一阵吹{CJX}过风，花瓣就[C]飘然而下，花雨中跟祖父并肩着{CJX}走。,200105271525200005,日本,2,200105,我的一个假期,65,75,70,65,70,332,C,
东巴文字即他们很久以前用过的形象文字。,200105271525200032,日本,2,200105,我的一个假期,65,80,57,70,59,319,C,
每次假期{CJ-zy都}有各种各样的度过{CC过期}方式。,200105217525200006,日本,2,200105,我的一个假期,65,70,67,70,63,321,C,
所以，往[B住]往[B住]{CJX}我需要一个人的时间，想思考时一直呆在房子里看书，一边读书一边对{CC对于}书的内容{CJ+wy进行}思考。[BC，],200105217525100059,日本,1,200105,我的一个假期,50,60,52,44,55,241,未参加,
不要担心我，我[C]很健康。,200105550523150011,韩国,1,200105,一封写给父母的信,65,70,55,61,67,304,C,
但她们很有热情，有智慧。,200105550523150128,韩国,1,200105,一封写给父母的信,80,80,68,54,61,335,C,
他们很热情，使我们了解中国文化、[BC。]风俗习惯。,200105550523150130,韩国,1,200105,一封写给父母的信,65,75,44,47,49,267,未参加,
父母节刚刚过去了。,200105550523150172,韩国,1,200105,一封写给父母的信,80,70,66,65,76,347,C,
我在考试中？,200105550523250186,韩国,2,200105,一封写给父母的信,60,70,60,51,54,280,未参加,
上一次我说我想去留学时，我可以看出你的心情。,200105550523150304,韩国,1,200105,一封写给父母的信,70,70,66,51,56,301,C,
祝[B主]你平安。,200105550523250314,韩国,2,200105,一封写给父母的信,70,60,49,44,40,248,未参加,
爸爸[BQ，]我今天看了您的白色的头发。,200105550523250324,韩国,2,200105,一封写给父母的信,70,65,47,30,40,238,未参加,
妈，最近您的腰疼怎么样？,200105550523250388,韩国,2,200105,一封写给父母的信,70,70,52,63,58,301,C,
每次想起爸爸、妈妈，我的心就{CJ-zy很}温暖{CC暖和}{CD了}。,200105550523250400,韩国,2,200105,一封写给父母的信,70,70,49,51,61,289,未参加,
每次那样的时候{CC2时}我就想起在家里爸爸妈妈怎么对待我。,200105550523150438,韩国,1,200105,一封写给父母的信,70,65,60,51,61,293,C,
”可妈妈心里肯定希望我努力学习。,200105550523250433,韩国,2,200105,一封写给父母的信,75,70,55,68,56,313,C,
妈妈你对我影响也很大，你虽然对我的错误大声批评，但你对我更关心，在我病时或有重大事情时非常耐心又[B有]和蔼[B谒]地{CC得}关心并{CC又}劝告了我。,200105550523150445,韩国,1,200105,一封写给父母的信,75,65,44,58,58,287,未参加,
我常觉得爸爸妈妈不再是能受打击[F擊]的年轻[F輕]人了，我不想要你们受苦，我不会让你们受苦的。,200105550523250484,韩国,2,200105,一封写给父母的信,80,70,66,65,65,336,C,
请你不要整天干活儿[BQ。]我希望你也跟别的妈妈一样花钱买东西[BQ，]出去玩打发时间。,200105550523250496,韩国,2,200105,一封写给父母的信,70,70,49,54,63,294,C,
我被托付给姥姥{CJ+zxy家}。,200105550523250503,韩国,2,200105,一封写给父母的信,70,65,38,61,63,283,未参加,
但是去{CQ了}以后，我感觉到了很多文化差异。,200105206525200009,日本,2,200105,我的一个假期,85,80,72,63,63,356,B,
我们在三亚宾馆睡了一个晚上。,200105206635100038,俄罗斯,1,200105,我的一个假期,70,75,34,28,33,229,未参加,
但是要生活{CC2生}下去的话把应该做的事情自己一个人一定要做完全{CC全部}{CJba}。,200105109525100019,日本,1,200105,由“三个和尚没水喝”想到的……,75,60,41,51,59,272,未参加,
比方说，{CD在}上课老师向学生问{CJ-by问题}的时候，学生多的话，谁也不主动{CD地}回答。,200105109525200030,日本,2,200105,由“三个和尚没水喝”想到的……,65,65,70,77,68,329,C,
又{CJX}晚上来了。,200105109525100577,日本,1,200105,由“三个和尚没水喝”想到的……,65,60,45,40,44,237,未参加,
和尚们的行为是一点儿也没有错的。,200105109525200624,日本,2,200105,由“三个和尚没水喝”想到的……,60,50,57,58,61,266,未参加,
朋友还是感谢你。,200105109525100637,日本,1,200105,由“三个和尚没水喝”想到的……,60,55,30,35,37,198,未参加,
我不要他们三个和尚那样的结果，[BC。]也{CC又}希望我们没有他们三个{CD的}固执，[BC、]也没有{CJ-zy那么}笨。{CJ-zhuy我们},200105109525100703,日本,1,200105,由“三个和尚没水喝”想到的……,70,70,63,69,70,330,C,
传说古时候，在一座高山的一座庙里，有一个和尚，他每天都要到山底下自己挑水喝。[BC，],200105109525200768,日本,2,200105,由“三个和尚没水喝”想到的……,70,80,77,77,93,387,B,
那么这个看病的人或大夫的行为是杀人吗？,200205205525100087,日本,1,200205,如何看待“安乐死”,60,65,16,49,23,196,未参加,
但是还有别的意见。[BC，],200205302540200034,印度尼西亚,2,200205,如何看待“安乐死”,75,70,52,47,68,301,未参加,
因为他们俩是一对夫妻的{CJs}，不可能的事也要互相相信的{CJsd}。,200205206525100034,日本,1,200205,如何看待“安乐死”,65,60,27,51,42,228,未参加,
那么前者是怎样看待安乐死呢？{CJsd},200205206525100039,日本,1,200205,如何看待“安乐死”,65,65,52,67,51,284,C,
我能够{CC2十分可以}理解他的心理[B里]。,200205206525200038,日本,2,200205,如何看待“安乐死”,60,60,38,51,54,245,未参加,
现代医疗{CJ-zxy技术}进步得很快，可同时病人的痛苦也增加了。[BC，],200205206525200075,日本,2,200205,如何看待“安乐死”,65,65,58,56,49,277,未参加,
因此造成的代沟问题变成社会问题了。,200209550523250006,韩国,2,200209,如何解决“代沟”问题,65,70,60,84,66,331,C,
强迫的方法只能引起反{CC复}作用。,200209550523150013,韩国,1,200209,如何解决“代沟”问题,65,60,54,52,58,272,未参加,
”然后我们努力{CJ+sy要}了解相互{CC互相}的心情。,200209550523250058,韩国,2,200209,如何解决“代沟”问题,65,65,42,62,60,278,未参加,
应该想{CJcd}解决的方法。,200209550523250099,韩国,2,200209,如何解决“代沟”问题,65,65,45,49,48,256,未参加,
这个问题的解决方法是显而易见的。,200209550523150147,韩国,1,200209,如何解决“代沟”问题,65,60,45,62,58,273,未参加,
所以现在的父母都要好好地照顾自己的孩子，但是在极忙的{CJX}工作情况下，现在的父母没有时间跟孩子聊天，而且孩子上学以后，除了吃饭时间以外，很少跟孩子见面。,200209550523250181,韩国,2,200209,如何解决“代沟”问题,65,65,91,71,72,348,C,
当然年轻人不了解老人，老人也不了解年轻人的生活态度。,200209550523250191,韩国,2,200209,如何解决“代沟”问题,65,65,51,71,62,298,C,
最终{CC终于}，孩子们越来越{CJX}离父母远{CJ+sy去}了。,200209550523250203,韩国,2,200209,如何解决“代沟”问题,75,80,66,86,82,380,B,
我们听他们的看法以后一定{CQ会}了解他们的想法。,200209550523150217,韩国,1,200209,如何解决“代沟”问题,65,65,45,49,36,244,未参加,
我认为拉大子女与父母之间的距离的主要原因是，他们没有时间一起分享{CC享受}共同关心的事。,200209550523150236,韩国,1,200209,如何解决“代沟”问题,75,60,63,62,64,310,C,
上面我已经说过两代人的代沟不可避免的。,200209550523150257,韩国,1,200209,如何解决“代沟”问题,65,70,54,67,64,306,C,
那时候，我常想为什么出现这样的问题，有没有能把它解决的办法。,200209550523250271,韩国,2,200209,如何解决“代沟”问题,70,70,45,67,44,284,未参加,
简单地{CC的}说，由于父母与子女之间追求不同而形成的。,200209550523150279,韩国,1,200209,如何解决“代沟”问题,65,60,45,59,60,272,未参加,
再行动，那问题不是解决了[BQ？]互相理解，为别人着想只少一次。,200209550523250320,韩国,2,200209,如何解决“代沟”问题,65,65,78,79,70,341,C,
为了养育孩子父母必须做[B作]工作，[BC。]一般都是双职工。,200209550523250355,韩国,2,200209,如何解决“代沟”问题,60,65,54,59,58,279,未参加,
为了解决代沟问题的关键是两代人之间的互相理解{CJZR}。,200209550523250773,韩国,2,200209,如何解决“代沟”问题,65,60,42,67,60,277,未参加,
许多家长有望子成龙的想法，他们以强迫的方法教育孩子，但那时候孩子的心里则有反感{CC2反对感}，因此父母们待[B待]子女时不应强迫。,200209550523250792,韩国,2,200209,如何解决“代沟”问题,70,70,57,67,56,308,C,
两个人都要看电视的时候，我应该让步。,200209550523250863,韩国,2,200209,如何解决“代沟”问题,65,70,54,69,48,292,C,
还有互相多多{CJcd}谈[B淡]一谈[B淡]，交流交流自己的想法也{CJ-sy是}很好的方法。,200209550523150901,韩国,1,200209,如何解决“代沟”问题,70,65,33,49,38,241,未参加,
我们解决“[BC‘]代沟”[BC’]做什么？,200209550523250914,韩国,2,200209,如何解决“代沟”问题,70,65,51,67,50,289,C,
你也体验{CC2觉}过代沟吗？,200209550523250918,韩国,2,200209,如何解决“代沟”问题,70,80,54,52,44,290,未参加,
第一，[BC。]要解决“代沟”问题，我想年轻人（子女）应该{CD要}有忍耐性。,200209550501250922,中国,2,200209,如何解决“代沟”问题,60,85,63,74,78,349,C,
那，[BC、]代沟问题怎么解决呢？,200209550523250941,韩国,2,200209,如何解决“代沟”问题,65,70,48,49,40,258,未参加,
于是代沟问题应该{CD要}好好解决。,200209550523250969,韩国,2,200209,如何解决“代沟”问题,75,65,51,69,72,319,C,
