错句,作文编码,国籍,性别,考试时间,作文题目,口试分数,作文分数,听力分数,阅读分数,综合分数,总分,证书
我面[L]对他们的时候常有{CC觉}差[L]异感。,200209550523250904,韩国,2,200209,如何解决“代沟”问题,70,60,54,57,44,270,未参加,
第二，子女应该尊重自己的父母。,200209550523150917,韩国,1,200209,如何解决“代沟”问题,65,65,33,54,52,253,未参加,
互相努力了解对方的话，代沟问题会得到解决。,200209550523250927,韩国,2,200209,如何解决“代沟”问题,65,75,66,84,68,345,C,
下一辈的话，他们想上一辈的观念太老土而且它已经是过时的。,200209550523250947,韩国,2,200209,如何解决“代沟”问题,70,65,48,54,58,281,C,
”那我以后不再试图跟父母对话。,200209550523250976,韩国,2,200209,如何解决“代沟”问题,70,65,72,74,64,331,C,
不是药，是为了生存的、不能死的毒品。,200205271525200044,日本,2,200205,如何看待“安乐死”,65,55,41,60,49,252,未参加,
这样会引起神经[B精]错乱[BQ，]导致你成为精神病。,200304522522250020,缅甸,2,200304,静音环境对人体的危害,70,70,61,55,80,324,C,
他们自然而然会害羞而不会再犯错误{CC过错}。,200306542542130004,越南,1,200306,口香糖与环境卫生,70,70,24,10,46,208,未参加,
在公[B工]共地方一个只是要保持{CC2守}卫生和清洁，{CD而}还要讲究{CC2守}礼貌和文明，因为[F為]乱吐口香糖影响{CC制成}环保卫生更导致{CC制成}清理费用高{CD和}，增加{CC加多}人力清理[BQ，]{CJ-sy也增加了}罚款或严重处理的规定{CC定规}。,200306542542230008,越南,2,200306,口香糖与环境卫生,85,75,74,71,99,396,B,
其次，想一想遭遇{CC遇到}饥饿的孩子。[BC.],200307109523200057,韩国,2,200307,绿色食品与饥饿,75,85,80,62,76,371,B,
我们[C]使用化肥和农药的结果是产量的提高，但农作物会受到不同程度的化学污染，吃[B呼]了对身体健康有害。,200307109523200086,韩国,2,200307,绿色食品与饥饿,80,90,78,56,84,383,B,
人是必须[B雪]要以[BD“]吃饭[BD”]来补[F補]充能量的。,200307109525100119,日本,1,200307,绿色食品与饥饿,85,90,75,62,87,395,B,
世界的经济越来越发展，可是还存在饥饿现象[B像]，这是我们人类应该解决{CC克服}的问题。,200307109523200134,韩国,2,200307,绿色食品与饥饿,65,90,54,54,61,315,C,
因此{CC于是}如果坚持使用这[C]些化肥和农药，那后果是不堪设想{CC不可设想}的。,200307109523200136,韩国,2,200307,绿色食品与饥饿,70,90,83,80,87,403,B,
但是对挨饿的几亿人来说，吃不吃“绿色食品”不是重要的问题。,200307109523100142,韩国,1,200307,绿色食品与饥饿,65,65,75,56,73,318,C,
所以人们做农产品加工{CD了}。,200307109523100146,韩国,1,200307,绿色食品与饥饿,60,55,30,9,21,156,未参加,
可是，从现在的饥饿问题来讲，我们{CJ-z要y}先解决在世界上还存在的几亿人因缺少粮食而挨饿的问题。,200307109525100157,日本,1,200307,绿色食品与饥饿,70,80,62,72,58,332,C,
但另[L]一方面我也不认为应该吃污[C]染的农产品，为[C]了解决这个问题，我有以下三个建议：[BC。]第一，[BC、]要开发对身体无害的化肥和农药。,200307109525100160,日本,1,200307,绿色食品与饥饿,70,75,80,75,81,370,B,
现代的人开始考虑到生活的质量和内容了。,200307109523200176,韩国,2,200307,绿色食品与饥饿,65,60,70,35,56,269,未参加,
那我们为我们人类以身,200307109523200187,韩国,2,200307,绿色食品与饥饿,75,70,72,46,70,322,C,
绿色食品[BQ”]是人们{CD把}用未经污染的农产品加工的食品。,200307109523200200,韩国,2,200307,绿色食品与饥饿,65,60,80,51,81,320,未参加,
我们都有吃[BQ“]绿色食品[BQ”]的权利，当然{CC可是}也有不挨饿的权利。[BC，],200307109523100223,韩国,1,200307,绿色食品与饥饿,75,75,51,33,47,271,未参加,
地球上的资源是有限的。,200307109525200359,日本,2,200307,绿色食品与饥饿,60,90,64,64,81,349,C,
”但我还是认为不能用化肥和农药。,200307109523100423,韩国,1,200307,绿色食品与饥饿,70,85,72,54,44,317,C,
第二，为了我们的后代，我们不应该使用化肥和农药。,200307109523200543,韩国,2,200307,绿色食品与饥饿,70,80,67,46,70,323,C,
韩国人从90年代末开始对绿色食品关注了。,200307109523200585,韩国,2,200307,绿色食品与饥饿,65,65,75,51,70,310,C,
现在因缺少粮食而挨饿[B饥]的人数达几亿。,200307109523200602,韩国,2,200307,绿色食品与饥饿,60,50,48,46,79,263,未参加,
但与此相反，发达国家的人，只有他们才能吃又安全又丰富的食品[BD，]生存下去。,200307109525100605,日本,1,200307,绿色食品与饥饿,65,70,64,67,87,339,C,
所以为了发展我们的文明，提高我们生活的水平应该{CJX}富裕[C]的国家帮助还不发达的国家。,200307217523200099,韩国,2,200307,绿色食品与饥饿,60,75,62,51,79,313,未参加,
人们过快乐的生活要求中最重要的是健康。,200307204523200058,韩国,2,200307,绿色食品与饥饿,60,55,54,33,58,241,未参加,
现代是全球一体化{CC5地球化}，一坐飞机就到了别的国家。,200307204525200066,日本,2,200307,绿色食品与饥饿,60,75,46,46,64,277,未参加,
如果有人问我吃“绿色食品”和不挨饿哪个是第一位的，我即回答吃“绿色食品”好。,200307204525200126,日本,2,200307,绿色食品与饥饿,65,70,72,67,81,341,C,
绿色食品，虽然表面上不好看，但是吃了不会有害于人的健康。,200307205523200008,韩国,2,200307,绿色食品与饥饿,65,60,67,49,58,282,未参加,
人们的生活已经提高了，对他们{CQ来说}最关键的是享受乐趣和健康。,200307205523200010,韩国,2,200307,绿色食品与饥饿,60,55,67,54,44,261,未参加,
他们的问题是很不容易解决的问题。,200307205523200019,韩国,2,200307,绿色食品与饥饿,60,60,46,35,50,233,未参加,
虫子，这些{CC这种}虫子在地球的温暖化里{CD更}增加了，[BC.]所以我们在一般生活中，尽量少点生产{CC2做}汽车，不要在路上随便扔[B拎]垃圾等等的[BQ，]实现环保精神。P},200307205523200045,韩国,2,200307,绿色食品与饥饿,60,65,54,49,53,264,未参加,
但是同时，[BC.]人们研究出来了农药和化肥是对人有害{CJsd}[BQ。]现在的问题就是不用农药和化肥而减少[B小]危害{CC2害}[BD.]还是用农药和化肥使农作物的产量大大提高而不挨饿。[BC.],200307205523200057,韩国,2,200307,绿色食品与饥饿,70,65,54,59,61,295,C,
比如，[BC、]吃好以后留下的菜、动物的便等等。,200307205523200078,韩国,2,200307,绿色食品与饥饿,70,70,64,46,44,282,C,
先说我的结论，[BC、]不挨饿是第一位的。,200307205525100134,日本,1,200307,绿色食品与饥饿,65,70,43,51,64,279,未参加,
目前对人{CQ来说}最重要的{CJ-sy是}保护环境和人自己的健康。,200307205523200169,韩国,2,200307,绿色食品与饥饿,55,45,40,35,41,193,未参加,
我们{CJX}虽然天天能够吃上三顿饭，[BC.]但是有些人还[C]是因缺少粮食而挨饿。,200307205523200175,韩国,2,200307,绿色食品与饥饿,65,65,67,59,79,319,C,
当务之急{CJ-sy是}提供食[C]物资助。,200307205525200181,日本,2,200307,绿色食品与饥饿,90,80,83,83,99,430,A,
比较发达国家就生产很多绿色食品，[BC、]然后这些国家就帮助还没发达的国家。,200307212523100027,韩国,1,200307,绿色食品与饥饿,65,70,51,43,67,282,未参加,
现在人口[C]多了。,200307212540200039,印度尼西亚,2,200307,绿色食品与饥饿,65,70,72,41,76,310,未参加,
当然，加大这方面工作的宣传也是很重要的。,200307209519100052,马来西亚,1,200307,绿色食品与饥饿,75,90,70,80,90,399,B,
目前，在世界上还有几亿人因缺少粮食而挨饿，[BC.]这是和绿色食品离不开的问题。[BC.],200307201523100037,韩国,1,200307,绿色食品与饥饿,60,70,54,54,64,287,未参加,
我们一听到“绿色食品”，就想没有污染的食品。,200307201523100063,韩国,1,200307,绿色食品与饥饿,60,55,56,46,41,239,未参加,
总的来讲，[BC.]这[C]一小小的问题也不是要从人的小小的习惯上来改正。,200307201523100064,韩国,1,200307,绿色食品与饥饿,65,60,70,27,58,263,未参加,
更可以吃真正的绿色食品。,200307302523200009,韩国,2,200307,绿色食品与饥饿,70,65,59,43,67,290,C,
因为美[B饥]食文化越来越{CJX}变化{CQ快}。,200307302523100036,韩国,1,200307,绿色食品与饥饿,60,50,27,30,21,168,未参加,
因为用化肥和农药不只是害了人们的身体，还把大自然也害了。,200307302523100082,韩国,1,200307,绿色食品与饥饿,65,60,64,59,67,298,C,
这样才能每个人都公平。,200307302523100091,韩国,1,200307,绿色食品与饥饿,65,75,78,51,73,329,C,
很多食品专家认为应该吸取没污染食品中的营养，总不能给身体造成不少的伤害。,200307302523200086,韩国,2,200307,绿色食品与饥饿,75,70,70,64,73,341,C,
因为，眼下，吃不下而掉到垃圾[C]箱的粮食多得{CC的}多呢。,200307302523200086,韩国,2,200307,绿色食品与饥饿,75,70,70,64,73,341,C,
所以“绿色食品”第一，[BC、]饥饿第二了。,200307302523100133,韩国,1,200307,绿色食品与饥饿,70,60,75,59,64,313,C,
的问题都解决{CC给解}以后{CC一后}，世界{CC世纪}上没有饥饿，做[C]个好[C]国[C]民[C]。P},200307206523100021,韩国,1,200307,绿色食品与饥饿,70,55,56,25,15,205,未参加,
所以我们通[C]过[C]绿色食品这一边[C]提高这[C]种世界粮食{CC食粮[B料]}问题的{CJsd}[BQ。],200307206525100018,日本,1,200307,绿色食品与饥饿,70,60,62,46,73,296,未参加,
我常常[C]想这种情况，用什么样的水把野菜洗好呢？,200307206525200024,日本,2,200307,绿色食品与饥饿,65,65,48,38,41,241,未参加,
可是吃绿色食品也很重要。,200307206523200042,韩国,2,200307,绿色食品与饥饿,65,65,59,54,67,294,C,
世界上有很多国家面临着饥饿和粮食问题。,200307206525100052,日本,1,200307,绿色食品与饥饿,70,65,54,38,61,274,未参加,
我想尽[B紧]快找到可以保护环境的农药或化肥。,200307215523150013,韩国,1,200307,绿色食品与饥饿,65,60,70,46,67,291,未参加,
但受污染还是会导致痛苦。,200307332523100018,韩国,1,200307,绿色食品与饥饿,80,70,75,70,70,355,B,
我在高中时，我看过有很多学生，他们是一对儿一对儿{CQ地}谈恋爱。[BC，],200309529529151017,泰国,1,200309,我对男女分班的看法,60,60,30,16,31,179,未参加,
所以他们[F們]的前途就毁{CC1黑暗}了。,200309529529151027,泰国,1,200309,我对男女分班的看法,65,60,25,32,40,205,未参加,
现在大部分[B份]学生都有什么{CC2样}学什么{CC2样}，他们根本就{CC都}不知道什么是好[BQ，]什么是坏。,200309529529151030,泰国,1,200309,我对男女分班的看法,80,75,49,51,76,322,未参加,
还有[BQ，]我们要是坚持高龄[F齡]化社会，[BC。]那父母不是对儿女的将[C]来有帮助，[BC。]而是给儿女的将[C]来加大负担。,200310576525100008,日本,1,200310,我对男女分班的看法,65,65,71,77,70,332,C,
我在上中学时，我的班除了我以外都是女的。,200310576525100029,日本,1,200310,我对男女分班的看法,50,70,36,35,45,219,未参加,
可是对我来说，那个看法只不过是痴人说梦。,200310576525100040,日本,1,200310,我对男女分班的看法,60,80,68,63,65,323,C,
第[C]一，人类社会基本上由男女所{CC为}组成的{CJsd}。,200310576525100049,日本,1,200310,我对男女分班的看法,65,75,63,61,70,321,C,
一般的情况来说，根本找不到恋人（对象）。,200310576525200047,日本,2,200310,我对男女分班的看法,65,70,44,44,54,263,未参加,
有好几件犯罪事件中，有不少共同点，例如犯人是比较年轻的男人，被害者是五至十岁左右的少女等。,200310576525200063,日本,2,200310,我对男女分班的看法,60,65,52,68,63,291,未参加,
总[C]结一句{CJ-zxy话}{CQ即}“采[F採]精取要”。,200310540540150003,印度尼西亚,1,200310,谈有效阅读,70,75,59,40,57,290,未参加,
因为象我们国家印尼语没有这些{CC这个}方面，[BC。]所以有时{CJ-zhuy这}是一优[B尤]点{CJX}[BQ，]对我们来说，[BC。]可以很快学{CJ-buy会}别的{CC得}语言。,200310540540250068,印度尼西亚,2,200310,谈有效阅读,65,60,61,33,48,250,未参加,
例如女生比较倾向于感性思维[B惟]，而男生则偏向理性思维[B惟]。,200310650519150042,马来西亚,1,200310,我对男女分班的看法,80,70,74,73,85,372,B,
目前在印尼找{CC谋}工作十分困难。,200304131540200003,印度尼西亚,2,200304,我学汉语是为了……,65,60,38,60,54,260,未参加,
总而言之，男女分班不该实行[BQ，]因为它{CD在}存在许多缺点{CC好处}。,200306680519250011,马来西亚,2,200306,我对男女分班的看法,95,70,92,75,96,422,B,
不外是教导，训育人，特别是年轻一辈，好让他们为将来是为国家栋梁的好准备{CJZR}。,200306680519250047,马来西亚,2,200306,我对男女分班的看法,75,70,85,77,96,392,B,
给后代{CJX}传给好的环境也是一个{CJX}我们的责任。,200307271523100085,韩国,1,200307,绿色食品与饥饿,70,65,51,41,50,263,未参加,
但是那样的东西吃多了对身体不好。,200307271523100088,韩国,1,200307,绿色食品与饥饿,65,65,43,19,41,217,未参加,
其次，拿自然环境保护方面来说，经常用化学肥料{CQ会}破坏土地的质量。[BC.],200307271523100090,韩国,1,200307,绿色食品与饥饿,70,80,75,75,84,374,B,
我希望有朝一日实现这种愿望，而且，要{CD向}人们{CJX}劝不要,200307271523100099,韩国,1,200307,绿色食品与饥饿,65,60,62,49,67,286,未参加,
而且在公共场所吸烟的话，给没有吸烟的人带来不好的影响。,200405109525200034,日本,2,200405,吸烟对个人健康和公众利益的影响,70,65,50,60,57,288,C,
但是说实话，这样做说起来容易，做起来难。,200405109525100190,日本,1,200405,吸烟对个人健康和公众利益的影响,75,75,45,73,64,322,未参加,
但是因为烟是一种易上瘾{CC重挫[C]性}的东西{CJ}，所以抽烟者不能放[C]弃抽烟的习惯[BQ。]抽烟不但对{CC给}{CJ+by他}抽烟者{CJ-sy有}坏处，而且{CJ-zy也}给别人{CJ-sy带来}坏处，所以曾经{CC经曾}{CJ-sy有}很多国家要努力地进行[C]禁止抽烟运动。[BC.],200405109523100368,韩国,1,200405,吸烟对个人健康和公众利益的影响,65,60,38,54,61,261,未参加,
对青少年来说[BQ，]吸烟是致命的，他们[C]还在成长期[D的]，需要很多营养来帮助他们[C]{CD的}正常发育，但是香烟里的好多恶性的成分还阻碍{CD吸收[B受]}营养的正常的吸收[B受]，而且他们[C]在这种不良的生活中经常跟不好的朋友交往，一来二去，会堕[C]落{CJ-buy到}犯[B范][C]罪[C]的深渊{CC深海}。P},200405109523200358,韩国,2,200405,吸烟对个人健康和公众利益的影响,70,70,71,70,59,328,C,
我赞成{CQ在}公共场所[C]不允许抽烟。,200405109525200412,日本,2,200405,吸烟对个人健康和公众利益的影响,75,70,69,64,77,344,C,
最近我国也很关注吸烟的问题。,200405109523200531,韩国,2,200405,吸烟对个人健康和公众利益的影响,85,70,59,64,53,322,C,
为了人的健康和青少年的生活环境，我们应该要保持敏感的思维{CC看法}，[BC。]这是我们大人的责任。,200405109525200537,日本,2,200405,吸烟对个人健康和公众利益的影响,85,70,69,66,53,334,C,
这件事实谁都知道。,200405109523200580,韩国,2,200405,吸烟对个人健康和公众利益的影响,65,65,64,66,59,303,C,
这次市政府提出{CJ-zxy这项措施}的另一个根据[C]是为了培养{CC养成}青少年的良好习惯。,200405109523100785,韩国,1,200405,吸烟对个人健康和公众利益的影响,65,75,57,62,66,312,C,
因为烟是阻碍{CC停着}成长{CJsd}，还有容易发现病等等。,200405109525200780,日本,2,200405,吸烟对个人健康和公众利益的影响,60,60,28,35,23,188,未参加,
吸烟是对人身体很不好的{CJsd}。{CP因为如果你一吸[C]{CJ+buy到},200405109523100827,韩国,1,200405,吸烟对个人健康和公众利益的影响,70,65,55,29,55,260,未参加,
总而言之{CC总[B兑[C]]言而之}，抽烟是{CJX}可以说个人的[C]自由，但是为了我们的未来，我们在公共场所{CD上}{CJX}不要抽烟了{CC吧}！,200405109523200963,韩国,2,200405,吸烟对个人健康和公众利益的影响,65,60,48,56,55,267,未参加,
但是吸烟还对{CC给}大家不利{CC2不利益}。,200405109523101054,韩国,1,200405,吸烟对个人健康和公众利益的影响,65,60,57,41,48,254,未参加,
还是有了规定比较好。,200405109523201446,韩国,2,200405,吸烟对个人健康和公众利益的影响,70,65,55,39,57,272,未参加,
吸烟者损坏{CC害}自己的身体是没有办法，[BC。]因为他们知道烟是对身体有害的，不过停不了。{CP但如果自己控制不了吸烟[BQ，]损坏{CC害},200405109525201761,日本,2,200405,吸烟对个人健康和公众利益的影响,65,60,52,54,57,271,未参加,
我听说过吸烟的人的寿命是很短的。,200405109525101787,日本,1,200405,吸烟对个人健康和公众利益的影响,70,70,21,37,44,230,未参加,
而我想说站在{CC2当}吸烟者{CJ-zxy的立场}来看，[BC。]他们已经上瘾{CC过瘾}[BQ，]谁说什么他们[C]不要听。{CJ-zhuy吸烟},200405109523201792,韩国,2,200405,吸烟对个人健康和公众利益的影响,65,60,55,54,46,263,未参加,
对我来说，我很不喜欢抽烟。{CP因为是这样的，第[B弟]一，抽烟对自己的身体不好[BQ，]而是{CQ对},200405109523101803,韩国,1,200405,吸烟对个人健康和公众利益的影响,40,75,33,39,28,196,未参加,
吸烟对人体的影响非常不好。{CP先{CQ说},200405109523201827,韩国,2,200405,吸烟对个人健康和公众利益的影响,70,70,43,48,46,265,未参加,
我毕竟是一个吸烟者，但如果{CQ从}我{CD一}个人开始努力戒烟的话[BQ，]我[C]相信{CC想相}能形成{CC做到}整洁的社[C]会。,200405109523201839,韩国,2,200405,吸烟对个人健康和公众利益的影响,75,80,57,44,50,297,未参加,
应该从小C就开始教良好的习惯。,200405109523200510,韩国,2,200405,吸烟对个人健康和公众利益的影响,75,65,54,54,51,286,C,
在韩国的吸烟者的生活越来越难，{CD是}因为社会不让{CQ他们}在公共场[C]所抽烟，[BC。]甚至三星企业{CJ-zy也}不允许{CQ在}公司里抽烟，[BC。]所以三星公司的工员{CJ-zy都}去外边抽烟。,200405109523200523,韩国,2,200405,吸烟对个人健康和公众利益的影响,75,65,52,33,51,263,未参加,
不只{CC不管}是男[C]性，女性甚至许多青少年也吸烟。,200405109523200741,韩国,2,200405,吸烟对个人健康和公众利益的影响,70,60,54,62,63,294,未参加,
我认为该市政府出台的该项规定，为了保持市容整洁和帮助青少年养成良好习惯，是个很好的规定{CC规则}。,200405109525100789,日本,1,200405,吸烟对个人健康和公众利益的影响,65,70,62,48,73,304,C,
现在[C]人们的社会不是一个人生活的，而是一个团体一起生活的。,200405109523100806,韩国,1,200405,吸烟对个人健康和公众利益的影响,70,65,48,54,39,262,未参加,
我最近去了新加坡[Ppó]，那儿的城[B成[C]]市特别干净[BQ，]而且我从来没有见{CC2看}过有人在外边抽烟。[BC，],200405109523200801,韩国,2,200405,吸烟对个人健康和公众利益的影响,60,60,46,37,44,229,未参加,
我惊讶[B呀]了。,200405109525200263,日本,2,200405,吸烟对个人健康和公众利益的影响,65,70,59,75,65,320,C,
有的地方以前可以抽烟，现在不可以的地方很多了。,200405204525200239,日本,2,200405,吸烟对个人健康和公众利益的影响,65,65,36,54,40,244,未参加,
从健康{CJ-zxy角度}来说，由于{CC2由}吸烟{CJ-zxy得病}的病人也肯定{CJ-zy会}减[C]少。,200405204525200269,日本,2,200405,吸烟对个人健康和公众利益的影响,60,60,36,30,58,226,未参加,
我很赞成在公共场所边走边抽烟的人将被罚款的观[B关]点。,200405204525200281,日本,2,200405,吸烟对个人健康和公众利益的影响,85,70,77,82,85,390,B,
我也{CJ+sy是}曾经抽过几支香烟。,200405204525200418,日本,2,200405,吸烟对个人健康和公众利益的影响,60,60,52,49,58,261,未参加,
因为抽烟这样的行为明显侵犯别人的空间，甚至侵犯别人的生存权利。,200405204525100443,日本,1,200405,吸烟对个人健康和公众利益的影响,65,75,63,61,67,318,C,
开始工作以后{CJ-zhuy我}更离不开香烟了，[BC、]特别是干完苦活以后深深的吸{CD了}一口，那种幸福的感觉任何其他东西都不能代替。,200405205525100043,日本,1,200405,吸烟对个人健康和公众利益的影响,65,90,36,68,72,322,未参加,
但是那天是周末[BQ，]{CD而且}人太多了，[BC。]所以里面非常挤，[BC。]动也动不了{CJ+zxy的状态}{CD了}。,200405205525200070,日本,2,200405,吸烟对个人健康和公众利益的影响,55,65,52,35,54,243,未参加,
吸烟的人和不吸烟的人{CD的}能否共存{CC4共存有没有}？,200405205525200106,日本,2,200405,吸烟对个人健康和公众利益的影响,60,75,38,51,49,259,未参加,
吸好几年{CJ-by烟}的话，很有可能会导致疾病，最有可能性的是肺癌。,200405201525100294,日本,1,200405,吸烟对个人健康和公众利益的影响,60,70,66,44,65,290,未参加,
可能这样会使他们觉得不好、[BC，]不方便，其实如果他们眼光深远的话，{CP应该理解这样的规定不仅仅是为了公众利益，而也为了吸烟者个人的健康P}。,200405201525200305,日本,2,200405,吸烟对个人健康和公众利益的影响,60,75,74,75,67,337,C,
为什么他们都离不开{CJ+sy抽}烟？,200405201525100321,日本,1,200405,吸烟对个人健康和公众利益的影响,70,70,71,56,56,311,C,
他也不会害人害己。,200405332540200005,印度尼西亚,2,200405,吸烟对个人健康和公众利益的影响,75,65,66,54,70,317,C,
抽二手烟不但很毒，而且还很辛苦，想想看呼吸是多么地{CC的}不顺畅，反过{CC回}来说也就是一样的[BQ。]不但呼吸困难而且多病体弱，体力下降，那会慢慢地{CC的}被尼古丁包围着，牙齿也开始变黄，慢慢地就会有肺癌、[BC，]鼻癌或皮肤癌的现象出现。,200405332519100053,马来西亚,1,200405,吸烟对个人健康和公众利益的影响,60,70,47,44,56,262,未参加,
从朋友的角度看，我们这一对也给了他们一种启[B起]发。,200410534533250022,新加坡,2,200410,最理想的结交方式,60,70,63,33,58,269,未参加,
当双方逐渐感应到对方的好，学会包容对方的“不好”，把自我溶[B容]入你我的时候[L]，那时感情的地基[B机]也算打好了吧。,200410534533250069,新加坡,2,200410,最理想的结交方式,85,80,60,76,58,352,B,
能[B散]用电脑科技应该尽量使用。,200410534533150091,新加坡,1,200410,最理想的结交方式,85,75,41,60,63,316,未参加,
一般{CD上}通过介绍人介绍的异性多数[B属]会是害羞{CD型}且工作忙碌的一群，这批人多数有学问{CD的基础[F礎]}[BD，]他们的学历也高，又有经济基础[F礎]，只要[C]有足够的时间培养彼此的情趣，又能进一步去认识对方的品性修养、处世待人和嗜好，跟他们进一步地{CC的}了解，你就能发现这样的异性是否适合你的要[C]求标准[F準]。,200410534533250100,新加坡,2,200410,最理想的结交方式,90,85,77,45,70,364,C,
男女之间相爱，最终的目的应该是共结连理，成为夫妻。,200410534533150113,新加坡,1,200410,最理想的结交方式,90,85,74,88,100,434,A,
等到大学毕业后，大家找到了工作，发现彼此仍然深爱对方，那就可以开始建立家庭。,200410534533250120,新加坡,2,200410,最理想的结交方式,90,90,83,76,91,428,A,
烟烟相报何时了？,200405680519250039,马来西亚,2,200405,吸烟对个人健康和公众利益的影响,75,95,85,88,87,424,A,
从青少年心理成长及发育方面来看，我们可以把这个问题分成{CC1分开}两个方面来谈:[BC；]从青少年生理发育及心理健康的角度，进一步探讨这个问题。,200504534533150012,新加坡,1,200504,我对男女分班的看法,65,85,92,89,95,416,B,
学校分开男生和女生来上课并不是现在才有，[BC。]在国外的教会学校大多数是分开男[BD、]女生来上课的。,200504534533250017,新加坡,2,200504,我对男女分班的看法,65,80,70,62,75,340,C,
还有，如果说一名女士要和另外一个{CC间}公司谈生意，而对方的公司派出一名男士，那么那位女士不是会感到非常地[B的]紧张，一句话都说不出？,200504534533250136,新加坡,2,200504,我对男女分班的看法,70,70,51,56,57,292,C,
在一个混合班，男和女都会有不同的想法所以对{CC从}一件事情{CD上}可以从很多角度讨论而不是以单单男或女的角度来看。[BC.],200504534533250155,新加坡,2,200504,我对男女分班的看法,70,80,78,86,75,379,B,
一切的一切，都离不开父母教导，许多第一次在父母身上受益匪[B非]浅。,200505109510200529,朝鲜,2,200505,父母是孩子的第一任老师,85,95,74,79,72,401,A,
当然是父母。P},200505109525201003,日本,2,200505,父母是孩子的第一任老师,60,65,39,43,62,252,未参加,
