错句,作文编码,国籍,性别,考试时间,作文题目,口试分数,作文分数,听力分数,阅读分数,综合分数,总分,证书
因此，我认为双方都必须[B需]考虑清楚，双方地位变化，并非能影响婚姻，有爱情的婚姻是经得起考验{CJsd}。,200103533533250004,新加坡,2,200103,我对离婚问题的看法,75,75,70,21,50,281,未参加,
这样使我学会了爱惜时间。,200110540540250001,印度尼西亚,2,200110,我的童年,70,95,49,63,72,342,C,
每当被父母斥责{CC斥罰}的时候，外婆总是护着我。,200110540540250018,印度尼西亚,2,200110,我的童年,70,90,63,63,79,358,C,
在爸坐牢的日子里，我过着非常孤独的生活，因为我妈把全部文件烧掉后，她就出埠去处理爸爸的事，留下幼下的我在{CC的}家，过着完全独立的生活，还好婷婷每天晚上陪我入眠，她还很{CQ会}唱动听的催[B摧]眠曲呢。,200110540540250019,印度尼西亚,2,200110,我的童年,65,85,44,42,85,311,未参加,
父母才从[B以]印尼抗日时期“焦土政策”的瓦砾中逃离家园来到这新建的难民集中区，由于物质缺乏，生活很艰苦，我的诞[B庭]生加重了家庭的负担，但也增添了家庭的乐趣。,200110540540250131,印度尼西亚,2,200110,我的童年,70,90,68,73,90,384,C,
一提起它，我的脑海里有短暂的空白，然后，一些琐碎的小事才慢慢地拼凑起来。,200103680519201611,马来西亚,2,200103,我的童年,90,85,94,90,95,451,A,
我想写的已经写得差不多了。,200104124631200365,希腊,2,200104,一封写给父母的信,80,90,60,61,65,351,C,
爸爸你还记得我们俩的合同吗？,200104124545100426,乌兹别克斯坦,1,200104,一封写给父母的信,70,80,47,39,49,275,未参加,
对了，妈妈，我上个月去过了{CJX}上海。,200104124545100427,乌兹别克斯坦,1,200104,一封写给父母的信,65,80,60,44,70,307,C,
您们{CC2您}好，父母节刚刚过去了，遇到这样的节日更想念你们。,200105550523250023,韩国,2,200105,一封写给父母的信,65,70,58,65,76,320,C,
请注意身体[BQ!]2001年5月,200105550523150031,韩国,1,200105,一封写给父母的信,65,65,44,25,42,225,未参加,
我都知道。,200105550523250061,韩国,2,200105,一封写给父母的信,65,65,47,32,42,235,未参加,
现在到这儿。,200105550523250296,韩国,2,200105,一封写给父母的信,75,70,58,73,65,330,C,
吧！P},200105550523150330,韩国,1,200105,一封写给父母的信,70,75,47,39,42,262,未参加,
我的朋友{CQ在}火车里碰到一个维吾[B乌]尔[B八]族的女人，她说：“我本来不太喜欢汉族，不过参加工作以后，这种看法改变了，因为他们工作得很勤奋。,200105212525100005,日本,1,200105,我的一个假期,70,85,70,68,81,366,B,
这次暑假，虽然不是去看什么名胜[B声]古迹，但我觉得在这次假期里，我获得不少知识，和朋友们的感情也更加密切。,200105212540200009,印度尼西亚,2,200105,我的一个假期,70,90,77,68,92,390,B,
我在元阳认识了许多哈尼族{CJ-zxy人}，他们很好客而且对我这样的外地人也很热情。,200105209525200062,日本,2,200105,我的一个假期,75,70,77,70,83,364,B,
虽然以前听说过桂林的奇山异峰，但是我到那里的时候还是吃了一惊。,200105209525200010,日本,2,200105,我的一个假期,80,75,82,72,90,390,B,
我住在二舅家，二舅只有一个儿子，他在广州打工，这暑假他带他的女朋友回来。,200105201540200025,印度尼西亚,2,200105,我的一个假期,75,75,75,49,66,330,C,
我们[F們]骑{CC踩}着[F著]自行车[F車]，背着[F著]野餐的材料，开[F開]始了我渴望已久的假期。,200105215919100012,加拿大,1,200105,我的一个假期,85,65,75,65,92,371,C,
我认为在发达国家人和人之间的关系有点冷漠{CC冷淡}，而发展中国家的人{CQ与人}之间的关系比较亲密{CC亲热}。,200105109525100590,日本,1,200105,由“三个和尚没水喝”想到的……,70,75,68,71,75,348,C,
要是我们不改变这样的态度，山底下的水早就没有了。,200105109525100705,日本,1,200105,由“三个和尚没水喝”想到的……,85,65,66,75,77,357,C,
对了！,200105109525200695,日本,2,200105,由“三个和尚没水喝”想到的……,65,65,36,55,50,255,未参加,
比如{CC比例}像现在的我的留学生活。,200105109525100718,日本,1,200105,由“三个和尚没水喝”想到的……,65,60,57,53,77,295,未参加,
但一般这种想法不起作用。,200105109525200803,日本,2,200105,由“三个和尚没水喝”想到的……,80,70,77,53,82,352,C,
可是应该{CJX}大家一起开始打扫，保持卫生。,200105109525200841,日本,2,200105,由“三个和尚没水喝”想到的……,70,65,57,66,61,305,C,
但是{WWJ},200106570525250007,日本,2,200106,如何看待“妻子回家”,65,60,35,74,49,266,未参加,
男女平等的观[F觀]念越来越大。,200106570525250015,日本,2,200106,如何看待“妻子回家”,65,65,58,70,54,296,C,
因为[F爲]父亲[F親]真的是一个[F個]伟[F偉]大的父亲[F親]，他以身作则[F則]，教导[F導]我们[F們]，让[F讓]我们[F們]知道到做人要脚[F腳]踏实[F實]地，凡事都必须[F須]自己来[F來]做，因为[F爲]在指使別人之前，自己必须[F須]懂，在说[F說]別人是非时[F時]，自己是否做对[F對]了呢？,200203522522250002,缅甸,2,200203,记对我影响最大的一个人,85,80,62,62,66,348,C,
”[BC┘]第一句话[F話]就打进了我的心坎！{CJ-zhuy她},200203522522250009,缅甸,2,200203,记对我影响最大的一个人,85,80,79,77,91,405,B,
现在，“安乐死”成了一种很难解决的问题。,200205204525100044,日本,1,200205,如何看待“安乐死”,70,70,52,45,58,283,未参加,
不过谈到这个话题很伤脑筋，[BC。]双方都有各的道理，而且都并没有矛盾，[BC。]所以如果谈到这个问题，我就想到哲学方面的事情。,200205204525100121,日本,1,200205,如何看待“安乐死”,65,85,46,51,61,298,未参加,
文中说到法律本身的“无情”的性质。,200205209525100004,日本,1,200205,如何看待“安乐死”,80,70,85,83,77,385,B,
我得了病的时候也一样。,200205201525200135,日本,2,200205,如何看待“安乐死”,85,80,38,42,42,280,未参加,
免得冤枉他们这些人。P},200205215525200024,日本,2,200205,如何看待“安乐死”,75,70,83,67,72,356,B,
晚上回到家的时候，就不要把外面的事件去想{CJba}。,200210801540150011,印度尼西亚,1,200210,如何解决“代沟”问题,70,65,53,69,50,293,C,
既然这变了，就{CJgd也}会有新的。,200210529529251008,泰国,2,200210,如何解决“代沟”问题,70,65,51,40,53,265,未参加,
他们的见解、[BC，]看法跟上一辈的当然有不同之处，有时候[BD，]他们的看法、[BC，]观点是正确[F確]的。,200210540540250020,印度尼西亚,2,200210,如何解决“代沟”问题,70,80,67,78,86,371,C,
所以，若{CJ+sy有}在彼此方面产生一些矛盾，应该{CQ用}平心静气的态度和他们面谈{CJ+sy或对谈}，即我们要想方设法去了解他们的思想，也无妨把我们对有关问题的看法提出以商讨，以求找到{CC谋出}共同点。,200210540540150040,印度尼西亚,1,200210,如何解决“代沟”问题,70,75,53,60,75,322,C,
这是我的浅见。,200210540540250052,印度尼西亚,2,200210,如何解决“代沟”问题,85,75,73,73,73,371,B,
子女要是能体会得到这一点，那代沟这个问题就容易解决了。,200210540540150069,印度尼西亚,1,200210,如何解决“代沟”问题,80,65,76,65,55,329,C,
可是，二十一世纪的子女，可{CJ-zy和以前}不同了。,200210540540150097,印度尼西亚,1,200210,如何解决“代沟”问题,65,70,51,58,77,307,C,
使他们有爱心，远离罪恶。,200210540540250094,印度尼西亚,2,200210,如何解决“代沟”问题,60,95,42,58,82,327,未参加,
记得小时候，我生了一场大病，家里的钱几乎都用在我的医药费上。,200203522522210001,缅甸,2,200203,记对我影响最大的一个人,80,90,33,66,82,346,未参加,
那时候遇到了很多挫折和困难，当时说实话我真的很想放弃[BQ，]马上回家去。[BC，],200205109513100399,柬埔寨,1,200205,如何面对挫折,70,60,67,65,75,322,C,
我活到现在遇到不少困难，大多数{CC大都数}我{CJ-zy都}忘了，可是{CJ-sy有}一件事我一辈子也忘不了。,200205109548100901,塔吉克斯坦,1,200205,如何面对挫折,70,65,42,36,48,247,未参加,
只要肯努力，面对人生，天无绝人之路。,200205109520101176,蒙古国,1,200205,如何面对挫折,90,70,70,67,82,372,B,
中华人民共和国的迅速发展给世界上各个国家一个{CJ-dy学习}的榜样。,200205109610101141,法国,1,200205,如何面对挫折,75,70,53,65,62,314,C,
我也好想，好想能喝到您熬的汤！,200205680519250019,马来西亚,2,200205,一封写给父母的信,80,85,81,75,84,399,B,
没想到念大传系毕[F畢]业[F業]的我，第一份工作却[B即]是电脑公司的行销兼策划执[F執]行人员。,200205680519250024,马来西亚,2,200205,一封写给父母的信,80,75,73,67,74,360,B,
内容以三国争雄为主线，反映与描述了许多战争场面，而通过战争的描述，又包含了许多{CD包括}{CQ关于}智慧和人生哲理的内容。,200305533533150019,新加坡,1,200305,我最喜欢读的一本书,75,80,82,70,90,388,B,
介绍作家的同时，老师也让大家阅读了他{CQ的}其中一个作品。,200305533533250037,新加坡,2,200305,我最喜欢读的一本书,65,65,77,80,90,361,C,
我在北京{CJX}中国留学已经三年了。,200304131525200046,日本,2,200304,我学汉语是为了……,70,75,59,43,63,299,C,
为了实现目标，我一定坚持下去。,200304131525200076,日本,2,200304,我学汉语是为了……,75,85,53,68,63,337,C,
被动吸烟者包括吸烟者的家里人，吸烟者所到的地方的人。,200405109542200574,越南,2,200405,吸烟对个人健康和公众利益的影响,65,75,62,39,57,285,未参加,
我国几个月之前才开始{CD了}公布烟对健康的坏处。,200405109633200975,意大利,2,200405,吸烟对个人健康和公众利益的影响,70,65,57,46,46,270,未参加,
一个人边走边抽烟会影响尚未成熟的青少年的思想。,200405109542201482,越南,2,200405,吸烟对个人健康和公众利益的影响,90,75,81,73,84,397,B,
对[F對]他们[F們]而言，抽烟者等于[F於]在自我伤[F傷]害，口头[F頭]虽[F雖]说[F說]是种[B总[F總]]解闷[F悶]解愁{CJcd}的工具，实[F實]际[F際]上抽烟者不但在寻[F尋]死，而且还[F還]连[F連]累了不抽烟者，容易伤[F傷]身。,200405610610250017,法国,2,200405,吸烟对个人健康和公众利益的影响,0,80,71,56,70,274,未参加,
在家{CC1家庭}{CQ里}老公地位比妻子高得多。,200505109525200131,日本,2,200505,父母是孩子的第一任老师,70,60,30,36,45,226,未参加,
喜欢交流的话，既能{CC会}提高汉语水平又能{CC会}跟很多人成为{CC2成}朋友。,200505109525100205,日本,1,200505,父母是孩子的第一任老师,70,70,53,56,71,308,C,
这样，我们才能保持很好的人际关系。,200505109525100447,日本,1,200505,父母是孩子的第一任老师,75,80,58,54,71,329,C,
有的时候[B们]，把他们带到{CC去}有大自然的地方。,200505109525100452,日本,1,200505,父母是孩子的第一任老师,80,75,53,46,57,302,未参加,
第三，父母[C]当然是个老师。,200505109525100516,日本,1,200505,父母是孩子的第一任老师,70,80,77,81,84,382,B,
上了高中以后，我的学习压力很大。,200505109525200949,日本,2,200505,父母是孩子的第一任老师,60,85,64,62,85,345,C,
父亲的爱好是钓鱼，他儿子也很喜欢钓鱼。,200505217525200104,日本,2,200505,父母是孩子的第一任老师,55,80,35,63,54,273,未参加,
我小时候如果把垃[B拉]圾[Pjī]扔在马路上，我母[C]亲非得我去捡[B俭]不可{CJjy}。,200505217525200232,日本,2,200505,父母是孩子的第一任老师,70,55,67,55,83,314,C,
可是她除了工作以外，也有家务。,200505204525200046,日本,2,200505,父母是孩子的第一任老师,55,55,41,43,43,217,未参加,
我小学三年级的时候就开始学做菜。,200505204525100110,日本,1,200505,父母是孩子的第一任老师,65,65,63,43,74,294,C,
我的父母亲说，他们很想要一个男孩子[BQ，]所以他们知道[C]第一个孩子是男孩子的时候非常高兴。,200505204525100173,日本,1,200505,父母是孩子的第一任老师,65,75,50,67,52,296,C,
我对父母从来{CJ+zy一会儿}也没看不起过。,200505204525100260,日本,1,200505,父母是孩子的第一任老师,65,50,37,41,52,226,未参加,
我很尊敬爸爸的活法{CC活得}、爸爸的爱好、爸爸的想法。,200505204525200398,日本,2,200505,父母是孩子的第一任老师,60,55,33,49,56,234,未参加,
所以父母的行为举止无论[B伦]在哪方面对孩子都有很大的影响。,200505204525200483,日本,2,200505,父母是孩子的第一任老师,90,60,73,67,74,354,C,
当时我听说过那条路的名字，而且知道很繁华的地方{CJs}，但是我还是很担心。,200105205525200092,日本,2,200105,我的一个假期,80,80,85,63,87,387,B,
这样以来，如果碰到困难时，我觉得以后一定{CJ-zy要}打破这个困难，我相信我一定可以办好。,200112576525100017,日本,1,200112,如何面对挫折,65,70,46,53,53,273,未参加,
同时我的一切烦恼、忧虑都已统统{CC白白}解除了。,200112576525100027,日本,1,200112,如何面对挫折,65,55,52,53,53,260,未参加,
对历史感{CC有}兴趣的人有机会可以看一下。,200105204525100095,日本,1,200105,我的一个假期,75,75,50,58,74,322,C,
但是当面说有点不好意思。,200105550523150089,韩国,1,200105,一封写给父母的信,65,70,36,35,49,241,未参加,
不过我趁着这个{CC次}机[F機]会[F會]向你们表达{CC表现}我的心。,200105550523250148,韩国,2,200105,一封写给父母的信,70,70,52,32,45,257,未参加,
但我活忙。,200105550523150167,韩国,1,200105,一封写给父母的信,70,70,27,58,45,258,未参加,
我也{CJX}小的时候{CD很}冤[B怨]枉[B望]了爸爸。,200105550523250171,韩国,2,200105,一封写给父母的信,70,70,74,61,63,326,C,
真对不起。,200105550523250179,韩国,2,200105,一封写给父母的信,65,65,27,49,56,246,未参加,
我也很爱您，感谢您。,200105550523250216,韩国,2,200105,一封写给父母的信,80,75,79,73,76,374,B,
我真[B直]想找工作，挣多钱以后让你休息。,200105550523250228,韩国,2,200105,一封写给父母的信,70,65,52,61,65,299,C,
感谢父母，我爱你们。,200105550523250231,韩国,2,200105,一封写给父母的信,70,70,38,35,47,248,未参加,
对我{CJX}结婚不重要，你们别{CC不}强迫我。,200105550523250245,韩国,2,200105,一封写给父母的信,70,65,52,56,65,294,C,
我呢，过得真好。,200105550523250260,韩国,2,200105,一封写给父母的信,65,70,63,49,51,284,C,
我只能在心里{CD上}担心你们，不能在你们的身边，我更心疼。,200105550523250290,韩国,2,200105,一封写给父母的信,70,65,60,51,65,297,C,
如果没有你们的话！,200105550523150303,韩国,1,200105,一封写给父母的信,0,60,27,32,47,158,未参加,
谢谢您们，要不是您们，没有今天的我。,200105550523250311,韩国,2,200105,一封写给父母的信,70,60,38,44,38,235,未参加,
爸爸在四月[B份]开始{CJ-sy开}药店，整天都在药店里吃苦，妈妈也在爸爸旁[B方]边帮他的忙，早{CC在}上八点[B占]上班，晚上十一点左右才回来，看你们累的样子，抽不出{CC了}时间而没给你们什么帮助的我，就{CJ-sy觉得}{CJ-zy很}对不起{CJ+buy得很}。,200105550523250392,韩国,2,200105,一封写给父母的信,70,65,52,49,65,287,未参加,
不要太担[B胆]心。,200105550523250393,韩国,2,200105,一封写给父母的信,70,65,66,49,51,287,C,
我现在在考场上，是写作文的时间，正巧作文题目是“一封写给父母的信”。,200105550523250399,韩国,2,200105,一封写给父母的信,70,80,74,70,79,363,B,
已经五月了，树都变绿[D色]了{CC的}，天气也不错。,200105550523250421,韩国,2,200105,一封写给父母的信,70,60,38,30,40,223,未参加,
我想你们也知道我已经长大了，已过二十二岁了，是不是？,200105550523250424,韩国,2,200105,一封写给父母的信,70,60,41,42,38,236,未参加,
那就是你们最幸[B辛]福的事，对吗？,200105550523250424,韩国,2,200105,一封写给父母的信,70,60,41,42,38,236,未参加,
爸爸一定不希望妈妈现在的样子{CJs}。,200105550523250431,韩国,2,200105,一封写给父母的信,60,65,38,54,42,242,未参加,
谢谢你们！,200105550523250446,韩国,2,200105,一封写给父母的信,65,60,38,39,51,236,未参加,
我来这儿以后交了很多中国以及外国朋友，[BC。]他们对我很好。,200105550523250457,韩国,2,200105,一封写给父母的信,70,85,63,68,74,352,C,
你们相信我吧！,200105550523150506,韩国,1,200105,一封写给父母的信,85,70,49,47,58,300,未参加,
给我自由的好机会。,200105206525100042,日本,1,200105,我的一个假期,65,65,37,61,50,262,未参加,
没有水喝[BQ”]也就是说“生命的危机”。,200105109525200006,日本,2,200105,由“三个和尚没水喝”想到的……,70,85,54,44,50,295,未参加,
他们的每一句{CJ-zy都}是我们应该仔细聆听{CC洗耳恭听}的。,200105206525100046,日本,1,200105,我的一个假期,70,65,52,61,57,291,C,
如果有人遇到困难，{CJ-zhuy我们}应该尽量帮助。,200105109525200031,日本,2,200105,由“三个和尚没水喝”想到的……,65,80,59,51,61,304,C,
有一天我到场地时，只有我一个人。,200105109525200061,日本,2,200105,由“三个和尚没水喝”想到的……,70,70,61,66,48,303,C,
和尚不是喜欢帮助别人的吗？,200105109525200091,日本,2,200105,由“三个和尚没水喝”想到的……,95,90,66,69,84,403,B,
我觉得比较理想的爱是彼此相爱，换句话说{CJ-sy是}自我牺牲的爱。{CJ+zhuy我们},200105109525200103,日本,2,200105,由“三个和尚没水喝”想到的……,60,75,63,62,55,301,C,
比如，{CD他}从上小学时他就有家教，一直吃小灶。,200105109525200135,日本,2,200105,由“三个和尚没水喝”想到的……,65,75,79,69,86,361,B,
终于每个人不能达到目的的东西了{CJ？}。,200105109525200210,日本,2,200105,由“三个和尚没水喝”想到的……,70,75,57,69,73,333,C,
我们应该看重这些问题，而采取有效的{CC地}措施来解决问题。,200105109525100243,日本,1,200105,由“三个和尚没水喝”想到的……,75,85,73,84,95,405,B,
总之应该了解一下“人多了”的意思。,200105109525200291,日本,2,200105,由“三个和尚没水喝”想到的……,70,70,41,64,70,303,未参加,
虽然人类科学技术[F術]的不断进步，人类已经把目光投向了宇宙[BQ，]希望能拓展自己的生存空间。,200105109525100353,日本,1,200105,由“三个和尚没水喝”想到的……,65,80,39,40,55,267,未参加,
有一天我和朋友们一共四个人在我的房间说话，首先两个朋友来了我的房间。,200105109525100381,日本,1,200105,由“三个和尚没水喝”想到的……,65,65,59,66,64,303,C,
帮别人的忙，虽然自己不用费劲儿，但是结果没有达到目的。,200105109525200394,日本,2,200105,由“三个和尚没水喝”想到的……,65,65,57,53,68,292,未参加,
我{CD就}这个人信佛教的，[BC。]所以可能对他们{CQ太}苛刻{CC严格}了。,200105109525100415,日本,1,200105,由“三个和尚没水喝”想到的……,65,55,39,60,59,260,未参加,
可是现在学生的数目越来越多，学校的规模越来越大，反而{CJX}家长们对学校的活动一点儿也不在乎似的。,200105109525200522,日本,2,200105,由“三个和尚没水喝”想到的……,60,65,66,73,77,324,C,
这里修行的和尚名字叫“甲和尚”。,200105109525100545,日本,1,200105,由“三个和尚没水喝”想到的……,70,65,43,44,59,267,未参加,
所以这天三个人一起去山下抬水。,200105109525100577,日本,1,200105,由“三个和尚没水喝”想到的……,65,60,45,40,44,237,未参加,
如果人们都觉得“我随时都可以死”[BC。]的话[BQ，]会不会增加容易放弃自己的生命的人{CJ-zxy的数量}？,200205217525100013,日本,1,200205,如何看待“安乐死”,70,85,60,63,70,340,C,
但是按照现在的法律，{CJ-sy实施}“安乐死”{CJ-zy就}是{CJ-sy犯了}杀人罪。,200205217525100033,日本,1,200205,如何看待“安乐死”,70,65,49,65,61,296,C,
国家{CJ-zxy公民}先谈论，听很多专家的意见。,200205217525100097,日本,1,200205,如何看待“安乐死”,65,70,33,72,61,287,未参加,
如果需要法律来制裁的话，应该早点儿公开这种法律。,200205205525100116,日本,1,200205,如何看待“安乐死”,60,65,44,47,61,260,未参加,
法律应该从“生存权”的角度考虑“安乐死”问题。,200205205525200109,日本,2,200205,如何看待“安乐死”,75,75,69,67,68,344,B,
所以可以说他的选择也是在伦理上正确的。,200205205525100143,日本,1,200205,如何看待“安乐死”,70,75,55,79,82,350,C,
现在呢？,200205206525100003,日本,1,200205,如何看待“安乐死”,75,70,52,56,51,293,C,
至少我是这么认为的。,200205206525200048,日本,2,200205,如何看待“安乐死”,70,70,74,65,68,335,C,
虽然她很痛苦，但是我觉得不应该死。,200205206525200060,日本,2,200205,如何看待“安乐死”,55,50,71,72,87,314,未参加,
除了这[F這]两[F兩]个[F個]方面以外，还[F還]可以说[F說]宗教{CQ的}问[F問]题[F題]{CJs}。,200205206627100065,瑞士,1,200205,如何看待“安乐死”,80,75,46,42,37,271,未参加,
这样的话我觉得{CQ就}没问题{CQ了}。,200205206525100078,日本,1,200205,如何看待“安乐死”,65,60,58,67,49,282,C,
可是很严格[C]，首先要得到家人、医生[BD、]与法律的认可才可以实行。,200205332540200001,印度尼西亚,2,200205,如何看待“安乐死”,70,90,69,70,80,372,C,
我估计丈夫帮她自杀也是因为不想{CC要}让妻子受更多的痛苦{CD或悲哀}。,200205332540200009,印度尼西亚,2,200205,如何看待“安乐死”,70,85,60,47,61,315,C,
还有中年人教青年人缺[C]少的传统观念、[BC，]道德{CD的话}，通过这样的事情{CC时间}他们慢慢了解以前不知道的文化和知识，而逐[C]渐克服代沟这{CQ个}问题。,200209550523250006,韩国,2,200209,如何解决“代沟”问题,65,70,60,84,66,331,C,
现在的社会和几十年前的社会的差异很大。,200209550523250079,韩国,2,200209,如何解决“代沟”问题,65,60,51,71,54,284,未参加,
。,200209550523250100,韩国,2,200209,如何解决“代沟”问题,65,65,69,54,58,295,C,
所以我们应该解决代沟问题。,200209550523150117,韩国,1,200209,如何解决“代沟”问题,60,65,33,54,56,251,未参加,
人们的思想也会变得快。,200209550523250146,韩国,2,200209,如何解决“代沟”问题,70,65,60,64,58,303,C,
而且他们那一代人的儒家思想根深蒂固。,200209550523250148,韩国,2,200209,如何解决“代沟”问题,65,75,78,69,74,348,B,
由于使用电脑，或{CD着}看电视的时间太多，[BC。]所以他们根[C]本没有时间跟[C]父母在一起相见。,200209550523150183,韩国,1,200209,如何解决“代沟”问题,70,65,75,54,44,294,C,
其次孩子应该尊重父母。,200209550523150196,韩国,1,200209,如何解决“代沟”问题,60,65,63,69,58,298,C,
现在我家里有六{CC6}口人。,200209550523250206,韩国,2,200209,如何解决“代沟”问题,65,65,48,59,48,269,未参加,
可是，他们的孩子们从小的时候就过着{CC受到}富裕{CC富贵}{CD和发展}的生活。,200209550523250231,韩国,2,200209,如何解决“代沟”问题,65,60,63,57,64,292,C,
上一辈的{CC之}人该不断学习，[BC、]努力适应变化极大的环境。,200209550523250326,韩国,2,200209,如何解决“代沟”问题,65,65,54,54,58,280,C,
在世界杯足球赛中，我们韩国老百性[B生]都一起当拉拉队了。,200209550523150782,韩国,1,200209,如何解决“代沟”问题,65,70,45,67,50,283,未参加,
不能在一起，也不能聊天。,200209550523250809,韩国,2,200209,如何解决“代沟”问题,70,70,54,79,56,317,C,
一般生活当中我们常常发现两代之间在行为方式、生活态度以及价值观念[C]等方面存在的差异[B导]。,200209550523250853,韩国,2,200209,如何解决“代沟”问题,70,70,54,76,50,308,C,
我们知道这是不太好，不过没办法。,200209550523250929,韩国,2,200209,如何解决“代沟”问题,65,60,63,69,58,298,C,
这就{CQ能}给我们带来真正的幸福，也{CQ能}给我们{CJ-sy带来}美好的生活。,200209550523250973,韩国,2,200209,如何解决“代沟”问题,75,85,75,69,78,375,B,
大家请记得，吃口香糖{CC香口糖}时，不{CC别}要乱吐啊！,200306684542200003,越南,2,200306,口香糖与环境卫生,70,70,15,21,43,207,未参加,
我期待日本，中[C]国[C]等[C]的国家{CJ-sy用}互相帮[F幫]助彼此友好{CC相爱}的态度来解决这个问题。,200307109525100040,日本,1,200307,绿色食品与饥饿,65,65,56,56,64,290,C,
现在我们的生活水平跟以前相比提高了{CC得}好多了。,200307109523100051,韩国,1,200307,绿色食品与饥饿,65,70,70,43,64,298,C,
但是，这种{CC1这}“绿色食品”有以下的问题：在市场“绿色食品”越来越多，但{CC便}普通[C]农作物产量又会大大{CC2大}降低，而现在世界上还[C]有几亿人因缺[C]少粮食而挨饿。,200307109525200108,日本,2,200307,绿色食品与饥饿,85,65,70,46,53,308,C,
