错句,作文编码,国籍,性别,考试时间,作文题目,口试分数,作文分数,听力分数,阅读分数,综合分数,总分,证书
回答是不清楚的。[BC，],200306684542200001,越南,2,200306,口香糖与环境卫生,90,90,41,27,85,331,未参加,
实在是大大的[B地]浪费{CD了}。,200306542542230012,越南,2,200306,口香糖与环境卫生,50,50,24,30,21,153,未参加,
在农作物的生长过程中，如果使用农药的话，虽然产量会提高，但是农作物会受到污染，[BC。]对人的健康有害。{CP如果不用农药的话，农作物的产量又会降低[BQ，]而有些国家因缺少粮食而挨饿。P},200307109523200058,韩国,2,200307,绿色食品与饥饿,65,75,86,64,76,353,C,
举几个例子来看“饥饿”这[C]个问题。,200307109523100073,韩国,1,200307,绿色食品与饥饿,70,70,80,62,70,340,C,
依我看来，目前人们所普[C]及的什么“绿色食品”是一个很不错的开端[C]。,200307109540200118,印度尼西亚,2,200307,绿色食品与饥饿,65,70,54,35,76,286,未参加,
而现实社会中{CC上}因贫穷[B穹]{CQ而}受饥饿的人还{CC又}有几亿人，如果推广价格贵的[BQ“]绿色食品[BQ”]，岂[B乞]不是会恶化贫穷[B穹]者的经济状况{CC情况}吗？,200307109523200153,韩国,2,200307,绿色食品与饥饿,80,85,72,67,93,391,B,
有人{CD家}认为{CC看法}，这是没有办法{CC方法}解决的。[BC.],200307109523100164,韩国,1,200307,绿色食品与饥饿,65,60,56,41,47,252,未参加,
而且，现代人的生活水平{CC方式}也提高了。,200307109523100193,韩国,1,200307,绿色食品与饥饿,60,50,38,25,27,180,未参加,
因为[BQ“]绿色食品[BQ”]里没有[C]农药，所以对身体没有危[B为]害。,200307109523200203,韩国,2,200307,绿色食品与饥饿,75,85,72,70,73,368,B,
有时候我也吃惊在那里放置了{CC的}过多的食物垃圾。,200307109525200329,日本,2,200307,绿色食品与饥饿,65,85,78,64,73,355,C,
可是要增加产量，不得不多使用这些东西。,200307109523200336,韩国,2,200307,绿色食品与饥饿,70,85,86,49,76,358,C,
我认为应把生产和食用{CC2吃}[BQ“]绿色食品[BQ”]放在首位，但同时也要解[C]决饥饿问题。,200307109525100333,日本,1,200307,绿色食品与饥饿,65,95,64,67,84,366,C,
现代农业技[C]术[C]越来越发达{CC发展}。,200307109523200349,韩国,2,200307,绿色食品与饥饿,70,80,67,54,53,314,C,
第二点，我想强调的是每件事都会有利弊{CC先后}。[BC.],200307109523200381,韩国,2,200307,绿色食品与饥饿,65,85,80,62,50,332,C,
第{CC每}一个方法使用更多面积[B织]，生产更多“绿色食品”{CJs}。,200307109523100395,韩国,1,200307,绿色食品与饥饿,60,55,59,35,38,228,未参加,
因此这个“绿色食品”有讲究,200307109523200414,韩国,2,200307,绿色食品与饥饿,60,60,56,35,38,231,未参加,
我们不应该再自私了。,200307109523100424,韩国,1,200307,绿色食品与饥饿,70,90,70,54,67,344,C,
{CP他说他的农场决[B绝]不许用化肥和农药[C]，[BC、]可是那里的植物都比在市场卖的{CJX}不差且很新鲜，我很好奇地{CC的}问了他怎么不用化肥与农药[C]能培养出这么好的绿色植物，他说他的农场用来自地下100米的地下水{CJ+zy用来}培养植物，[BC、]然而我们带一些绿菜在家食用，[BC、]那些绿菜都很好且吃起来非常可口，[BC、]习惯于吃他农场的农作物之后不敢吃在市场卖的绿菜，[BC.]所以在市场买绿菜的时候[B后]一定会买一些中国政府认可的“绿色食品”。[BC、],200307109523100425,韩国,1,200307,绿色食品与饥饿,65,85,78,56,67,341,C,
为了保护自然环境和人们的健康，[BD.]最好别用化肥和农药。,200307109523200457,韩国,2,200307,绿色食品与饥饿,70,65,67,70,76,334,C,
“[BC‘]绿色食品”[BC’]和“[BC‘]饥饿”[BC’]这两{CC1个俩}条道[C]路上大家先选“[BC‘]绿色食品”[BC’]吧。P},200307109523200459,韩国,2,200307,绿色食品与饥饿,70,80,56,49,61,306,未参加,
但这足[C]有点对题了{CJ?}。,200307109523100467,韩国,1,200307,绿色食品与饥饿,65,65,62,59,79,314,C,
他们也有他们的意[B竞]见和希望。,200307109525100482,日本,1,200307,绿色食品与饥饿,65,75,70,54,81,332,C,
在这个世界上挨饿的人也是一样。,200307109523200499,韩国,2,200307,绿色食品与饥饿,65,60,78,49,58,293,未参加,
现在处于饥饿状[B壮]态的人们也需要安全的“绿色食品”。,200307109523100513,韩国,1,200307,绿色食品与饥饿,65,60,80,72,76,336,C,
减少{CQ使用}化肥使农地恢[B回]复正常的状态。,200307109525200509,日本,2,200307,绿色食品与饥饿,65,50,59,67,81,303,未参加,
我认为“绿色食品”{CQ的}生产和农作物产量问题一定{CJ-zy要}同时{CD被}进行、[BC，]被解决。,200307109523200530,韩国,2,200307,绿色食品与饥饿,70,70,72,64,76,340,C,
人得有饮食才能活下去。,200307109523200542,韩国,2,200307,绿色食品与饥饿,75,65,56,35,56,274,未参加,
现在“绿色食品”红起来了。,200307109523200585,韩国,2,200307,绿色食品与饥饿,65,65,75,51,70,310,C,
但是我们一直吃化学污染的东西。P},200307217523200097,韩国,2,200307,绿色食品与饥饿,65,65,51,22,67,254,未参加,
像中国{CJ-dy这样的}大国家，不稳定的供给{CJ-zy会}引起老百姓的不满甚至{CC至于}农民的不满。,200307217525100098,日本,1,200307,绿色食品与饥饿,60,60,43,46,70,261,未参加,
到时候{CC之前}，我们人类都应该多多关心现在{CQ快}饿死,200307217523100130,韩国,1,200307,绿色食品与饥饿,65,65,54,46,70,284,未参加,
最近{CD对于}“绿色食品”的意识[B只]被人们越来越重视。,200307217523200133,韩国,2,200307,绿色食品与饥饿,65,65,67,70,70,321,C,
但我经常在电视上看到一些落后国家的现实，每次看到那些{CC幅}画面，给我带来的震[B振]动是无法表达的。{CD在},200307204525200046,日本,2,200307,绿色食品与饥饿,65,80,78,64,96,371,C,
现在社会发展越来越快，人口也越来[B未]越多{CC1增加}[BQ，]可是我住的地球[C]呢?有限。[BC.],200307204523100101,韩国,1,200307,绿色食品与饥饿,60,65,48,43,38,237,未参加,
从而使挨饿地区和发达地区{CJ-zxy的问题}都得,200307205525200016,日本,2,200307,绿色食品与饥饿,80,65,70,49,100,352,C,
也有过[C]一次因为日本国内{CD发生}大米生产不理想，[BC、]政府决定把大米从国外进[C]口{CJba}，[BC、]弥补了日本国内的大米供应{CJ-sy不足}。,200307205525100023,日本,1,200307,绿色食品与饥饿,80,70,64,41,56,301,未参加,
虽然吃“绿色食品”对身[C]体好，对环境也好，但是这点是吃饱以后再想的东西。,200307205523200101,韩国,2,200307,绿色食品与饥饿,65,65,59,35,53,261,未参加,
现在人们已经积累了{CC到}一些{CC2一定程度}什么样的化肥和农药对人体有严重的害处等知识。,200307205525200120,日本,2,200307,绿色食品与饥饿,65,75,62,72,90,351,C,
我自己也比较难说哪一个是对的。,200307205525100184,日本,1,200307,绿色食品与饥饿,60,60,59,49,58,268,未参加,
街上走，在家看电视，看报纸的时候可能看过餐厅吃饭中毒事件，也可能看过在非洲的人们因[B田]不{CC1无法}忍心{CC忍耐}看着自己孩子挨饿而杀自己又瘦又矮的孩子{CJ-zxy的事件}。,200307212523100006,韩国,1,200307,绿色食品与饥饿,65,80,86,67,87,373,B,
到底使用还是不使用？,200307212523100024,韩国,1,200307,绿色食品与饥饿,75,90,80,75,93,407,B,
因此，种植[B值]“绿[C]色食品”是个很好的办法来尊重大自然的规律。,200307209610200019,法国,2,200307,绿色食品与饥饿,70,65,72,51,58,302,C,
现在什么都有，[BC.]再说科学的发展能力已开始慢慢增[B曾]高了。,200307209628200049,圣马力诺,2,200307,绿色食品与饥饿,65,65,40,9,61,224,未参加,
那时候，我们[C]人类的环[B坏]境问题可以都,200307201523200006,韩国,2,200307,绿色食品与饥饿,60,60,48,41,38,229,未参加,
由[B有]于人类大量地杀死鸟类，使一些鸟类濒临灭绝，使昆虫无节制地繁殖[B植]，因此粮食被昆虫取走。,200307201523200008,韩国,2,200307,绿色食品与饥饿,75,75,70,75,81,366,B,
当然衣和住，行也重要。,200307201523200025,韩国,2,200307,绿色食品与饥饿,65,60,59,46,41,254,未参加,
我们都已经认识到，随着经济的发展，越{CQ为}着想{CC想}{CJX}我们自己的身体和健[B建]康。,200307201523100034,韩国,1,200307,绿色食品与饥饿,60,60,67,54,76,299,未参加,
为了自己的健康无论价格高低都不在乎。,200307201523100051,韩国,1,200307,绿色食品与饥饿,60,60,51,51,50,254,未参加,
这[C]{CJ-sy是}一个绿色食品问题，我是一个这[C]样想的人。,200307201523200061,韩国,2,200307,绿色食品与饥饿,60,60,48,27,35,212,未参加,
可是，绿色食品的产量不多。,200307302523200012,韩国,2,200307,绿色食品与饥饿,70,65,54,35,56,266,未参加,
当你吃这完美的美餐时，你是否考虑[B滤]过[C]在别的国家，有很多人因没有一粒可吃的粮食，在痛苦中悲惨地饿死。,200307302523100025,韩国,1,200307,绿色食品与饥饿,80,75,86,78,93,403,B,
另一个是保护环境。,200307302523200043,韩国,2,200307,绿色食品与饥饿,70,70,67,70,61,326,C,
如果我们[C]饥饿，会失去所有的欲求、希望、生命力，只剩下绝望。,200307206525200003,日本,2,200307,绿色食品与饥饿,70,70,59,59,73,319,C,
不好的作用。[BC.],200307206523200048,韩国,2,200307,绿色食品与饥饿,65,60,27,38,32,205,未参加,
笔[F筆]者{CQ也}{CD有}{CD是}买[F買]绿色食品，但是比较[F較]少。[BC.],200307206627100060,瑞士,1,200307,绿色食品与饥饿,75,65,62,43,58,290,C,
但是世上呢，不{CJX}是能一个人生活{CJsd}。,200307215523250006,韩国,2,200307,绿色食品与饥饿,60,65,67,67,73,315,C,
日本也是{CJX}大部分学校采用男女混合式教育，尤其是在公立学校{CD方面}，除了几所女子大学以外都是采用男女混合式教育，但是在私立学校{CD方面}，从小学开始采用男女分班式教育的学校也不少。[BC，],200310576525100020,日本,1,200310,我对男女分班的看法,60,70,79,58,63,315,C,
社会{CD的}成员的一半是异性，[BC、]而且男性和女性在某个方面有所不同。,200310576525100033,日本,1,200310,我对男女分班的看法,60,70,71,70,56,312,C,
我觉得早恋不一定是坏的。,200310576525100053,日本,1,200310,我对男女分班的看法,60,65,36,58,65,267,未参加,
要是学生的时候，男女分开了，那开始面对社会的时候，男女两个都有可能产生{CD了}矛盾，不能适应社会，有可能引起社会问题。,200310576525200065,日本,2,200310,我对男女分班的看法,60,70,49,68,58,290,未参加,
而且，中学生的时候不知道的话，毕业以后怎么办呢？,200310576525200072,日本,2,200310,我对男女分班的看法,60,70,25,32,49,221,未参加,
阅读杂志[F誌]或报刊当然可以扫读、跳读，但阅读评论书籍，例如{CC尤如}专业型的理论书籍就不同了。,200310540540150055,印度尼西亚,1,200310,谈有效阅读,65,70,50,58,75,304,C,
这样也{CC亦}更好{CC甚}于独自阅读。,200310540540250051,印度尼西亚,2,200310,谈有效阅读,65,90,77,73,95,391,B,
这就是我认为的有效的读书法。,200310540540150057,印度尼西亚,1,200310,谈有效阅读,65,80,61,53,86,333,C,
所以有了这些经验之后，我能阅读许多[BD，]我从前不能阅读的书籍。,200310540540250078,印度尼西亚,2,200310,谈有效阅读,65,65,48,58,86,306,C,
我来中国之后，能亲眼看到了伟[B违]大的长城，能够有这样的伟[B违]大工程要多少老百姓的汗水才能建成{CJZR}。,200304131542200131,越南,2,200304,我学汉语是为了……,75,60,62,54,63,300,C,
进了师范学院，学汉语成了必修的科目。,200304131519200190,马来西亚,2,200304,我学汉语是为了……,90,95,86,68,96,433,A,
人们的生活水平是随[C]着社会经济的发展有了很大的提高。,200307271448200008,维吾尔族,2,200307,绿色食品与饥饿,65,40,75,62,79,299,未参加,
所以我认为不挨饿因该是第一位{CJs}。,200307271523100013,韩国,1,200307,绿色食品与饥饿,70,70,80,67,84,359,C,
但我们要知道，现在很多非发达国家还面临着[BD，]饥饿问[C]题。,200307271523100036,韩国,1,200307,绿色食品与饥饿,70,70,70,54,53,305,C,
可是在农作物的生长过[C]程中，如果使用化肥和农药，产量是大大提高{CQ了}，但农作物会受到不同程度的化学污染。,200307271407200040,朝鲜族,2,200307,绿色食品与饥饿,85,70,40,49,61,296,未参加,
现[C]代人不断地追求健康、娱乐、美[C]丽什么的。,200307271523200064,韩国,2,200307,绿色食品与饥饿,75,70,54,43,67,298,未参加,
但这种情况下也起码必须[B需]制定化肥和农药的使[C]用量，并且限制使[C]用的化肥和农药的种类。,200307271525200097,日本,2,200307,绿色食品与饥饿,70,70,78,59,64,329,C,
这个问题的背景包括{CC2有}对青少年的教育。,200405109525200146,日本,2,200405,吸烟对个人健康和公众利益的影响,85,65,38,60,50,287,未参加,
21世纪刚开始的那段[C]时间里有几个国家流行了戒烟，但这种活动{CC行为}没有超过几个月就没了。[BC，],200405109523200324,韩国,2,200405,吸烟对个人健康和公众利益的影响,70,60,64,64,68,311,C,
随着社会的剧[B极]变，激烈的竞争让人{CJX}常常感[C]到生存的危机。,200405109523200544,韩国,2,200405,吸烟对个人健康和公众利益的影响,95,70,62,60,73,354,C,
现在社会里很多人都是吸过烟的[C]或者是在吸着烟。,200405109523200554,韩国,2,200405,吸烟对个人健康和公众利益的影响,90,65,69,62,64,341,C,
尤其吸烟对孩子们[C]、青少年的影[C]响最大。,200405109523200600,韩国,2,200405,吸烟对个人健康和公众利益的影响,65,65,59,68,59,300,C,
在韩国，最近的热点之一是吸烟。,200405109523200673,韩国,2,200405,吸烟对个人健康和公众利益的影响,80,65,55,62,55,305,C,
这是人们的权力。,200405109523200673,韩国,2,200405,吸烟对个人健康和公众利益的影响,80,65,55,62,55,305,C,
拿{CC对}我来说，我是一个吸烟者。,200405109523100692,韩国,1,200405,吸烟对个人健康和公众利益的影响,70,65,55,41,64,281,未参加,
全世界烟民（吸烟者）最多的国家，[BC。]不{CC1没有}管理这些未成年吸烟者，决不会减少总{CJX}烟民数，而且还会增加。P},200405109523100785,韩国,1,200405,吸烟对个人健康和公众利益的影响,65,75,57,62,66,312,C,
因为在公共场所抽烟不但[B旦]影响着抽烟的人{CC1个人}，而且还影响周围的人。,200405109523200756,韩国,2,200405,吸烟对个人健康和公众利益的影响,80,70,76,66,82,364,B,
为什么吸烟的地方有限！,200405109525200814,日本,2,200405,吸烟对个人健康和公众利益的影响,65,65,31,52,46,243,未参加,
如果{CQ在}成人之间{CJX}小孩走路的话，[BC、]小孩的头[F頭]部在成人拿烟的位置，[BC。]一不小心，[BC、]烟就碰到小孩的头[F頭]部。,200405109525200852,日本,2,200405,吸烟对个人健康和公众利益的影响,65,60,38,50,46,242,未参加,
与此相反，对吸烟者们而言{CJ-zhuy他们}有一些不公平的感觉。P},200405109523100991,韩国,1,200405,吸烟对个人健康和公众利益的影响,75,60,55,56,64,296,未参加,
这种现象可以说是良好的社会气氛[C]。,200405109523100997,韩国,1,200405,吸烟对个人健康和公众利益的影响,80,70,67,75,66,348,C,
比如，有吸烟者的家庭的孩子，他们的成长可难会受到{CC导致}消极的影响。,200405109523201053,韩国,2,200405,吸烟对个人健康和公众利益的影响,60,65,81,64,75,328,C,
吸烟对个人健康和公众利益的影响是明显的，[BC。]所以，这政府的对策很有道理。,200405109525201024,日本,2,200405,吸烟对个人健康和公众利益的影响,70,60,33,56,59,263,未参加,
有的时候，商店里不能抽烟，所以抽烟者不去那[C]个商店，{CJ-zhuy这}会导致经济上的问题。,200405109523201166,韩国,2,200405,吸烟对个人健康和公众利益的影响,70,60,59,60,44,278,未参加,
但是有人{CC人家}{CJX}还是吸烟[BQ，]损[B把]害自己的身体{CQ和}公众利益。,200405109523101395,韩国,1,200405,吸烟对个人健康和公众利益的影响,60,60,52,50,53,257,未参加,
不仅影响到身体{CJ+wy虚弱}，而且影响到他们的头脑。,200405109523201397,韩国,2,200405,吸烟对个人健康和公众利益的影响,60,65,38,39,57,242,未参加,
如果任何地方都允许抽烟的话，{CD会}街上{CD有}被扔的烟太多了。,200405109523201446,韩国,2,200405,吸烟对个人健康和公众利益的影响,70,65,55,39,57,272,未参加,
有很多人不喜欢闻烟味儿，但就因为那些抽烟者不得不{CJ+zy要}吸已污染的空气。[BC.],200405109523201471,韩国,2,200405,吸烟对个人健康和公众利益的影响,70,70,71,56,70,325,C,
吸烟的坏处不只[B止]{CQ体现在损害}个人健康一个方面，[BC。]其{CD影响是}对{CC在}公众利益{CD方面}也有所影响。,200405109523101484,韩国,1,200405,吸烟对个人健康和公众利益的影响,70,80,50,37,59,286,未参加,
青少年时期，{CJ-zhuy他们}很容易受到各种各样的影响，[BC。]{CP不但被动吸烟等生理构造方面，而关于吸烟者的习惯和想法。P},200405109525201503,日本,2,200405,吸烟对个人健康和公众利益的影响,70,70,67,52,55,302,C,
因为每个国家的政府公布在公共场[C]合不能吸烟[BQ，]{CD如果}在公共场所边走边抽烟的人将被罚[C]款。,200405109523201549,韩国,2,200405,吸烟对个人健康和公众利益的影响,65,60,28,52,48,236,未参加,
我知道抽烟是对个人健康不好[C]的，[BC。]但是我也无法戒[Pjiè]。,200405109523101826,韩国,1,200405,吸烟对个人健康和公众利益的影响,60,70,52,37,44,248,未参加,
还有一个是像[C]我{CQ这样}的烟鬼的[C]反应。,200405109523201841,韩国,2,200405,吸烟对个人健康和公众利益的影响,70,55,48,37,41,235,未参加,
青少年的身体是最重要的。,200405109523201899,韩国,2,200405,吸烟对个人健康和公众利益的影响,60,65,31,39,39,217,未参加,
第二，为了减[F減]肥。,200405109525100347,日本,1,200405,吸烟对个人健康和公众利益的影响,65,65,38,46,51,249,未参加,
除了肺[C]炎以外，[BC.]还导致许多的疾病。,200405109525200425,日本,2,200405,吸烟对个人健康和公众利益的影响,75,65,74,75,66,342,B,
我认为这[C]个最大的[]问题是人们的意识还差，我们应该从小就开始教{CD到}抽烟的影响。,200405109523200510,韩国,2,200405,吸烟对个人健康和公众利益的影响,75,65,54,54,51,286,C,
然而，据2003年统计，在中国，高中生吸烟人数高达30%。,200405109523100524,韩国,1,200405,吸烟对个人健康和公众利益的影响,90,95,88,79,100,450,A,
何况周边的人是孩子的话[C]，可能{CC应该}产生更[C]严重的[C]后果[C]。,200405109523200526,韩国,2,200405,吸烟对个人健康和公众利益的影响,80,65,56,68,73,330,C,
我先说吸烟对个人{CD的}健康{CJ-zxy的影响}。,200405109523100621,韩国,1,200405,吸烟对个人健康和公众利益的影响,65,65,50,48,56,268,未参加,
再{CC1还有}说{CJ-zhuy吸烟}对公众利益的影响很[C]大。[BC.],200405109523100621,韩国,1,200405,吸烟对个人健康和公众利益的影响,65,65,50,48,56,268,未参加,
如果女人吸烟[C]的话，她可能{CC也许}得不孕症{CC不孕病}。,200405109523200616,韩国,2,200405,吸烟对个人健康和公众利益的影响,65,70,54,48,56,279,未参加,
随着社会科学的发展，人们的生活压力也越来越大，吸烟的人{CQ也}越来越多了。,200405109523200802,韩国,2,200405,吸烟对个人健康和公众利益的影响,80,90,68,75,75,383,B,
如果吸烟者够文明，没有给别人带来{CC2受}恶性影响，可以吸烟。,200405109525200263,日本,2,200405,吸烟对个人健康和公众利益的影响,65,70,59,75,65,320,C,
可是有些人说吸烟是完全无益的[BQ，]而且是损害{CC2害}公众[C]利益的行为，[BC。]所以他们主张{CC2要}在公共场所不让吸烟。,200405109523200380,韩国,2,200405,吸烟对个人健康和公众利益的影响,80,70,57,70,70,337,C,
肯定有。,200405204525200146,日本,2,200405,吸烟对个人健康和公众利益的影响,65,65,38,61,67,280,未参加,
可不仅吸烟者本人{CD之外}，{CD而}周围[C]的人也[C]{CJX}{CD对}身体受到香烟的危害。,200405204525200154,日本,2,200405,吸烟对个人健康和公众利益的影响,60,65,30,51,45,234,未参加,
我们吸烟者还需要注意对非吸烟者的态度。,200405204525200245,日本,2,200405,吸烟对个人健康和公众利益的影响,65,65,52,49,56,271,未参加,
所以这次某市政府采取{CC规定}的措施是非常正确{CJsd}，{CD而}一定会得到大家的赞成。,200405204525100290,日本,1,200405,吸烟对个人健康和公众利益的影响,70,65,58,56,61,296,C,
我走路时常常想抽烟，可能别的{CC另外}抽烟者也想{CJX}这样。,200405204525100352,日本,1,200405,吸烟对个人健康和公众利益的影响,65,60,30,49,40,227,未参加,
我认为这是很好的规定。,200405205525200009,日本,2,200405,吸烟对个人健康和公众利益的影响,60,80,49,63,63,302,未参加,
吸烟对人体好不好？[BC，],200405205525200055,日本,2,200405,吸烟对个人健康和公众利益的影响,65,85,85,70,76,371,B,
这[C]就是保[C]护自己的身[C]体[C]的权利。,200405205525100217,日本,1,200405,吸烟对个人健康和公众利益的影响,60,70,58,56,61,290,C,
他们说，吸烟是一种药。,200405201525100049,日本,1,200405,吸烟对个人健康和公众利益的影响,65,75,52,44,70,293,未参加,
我不吸烟，但我也理解烟民的心情。,200405201525200047,日本,2,200405,吸烟对个人健康和公众利益的影响,60,55,49,65,56,266,未参加,
这项措施在人口密集的商业中心已开始实施。[BC.],200405332540200003,印度尼西亚,2,200405,吸烟对个人健康和公众利益的影响,70,75,58,44,58,294,C,
但也不能以偏概全，有一部分有知识的人也没有意识到烟危害身体。,200405332513200018,柬埔寨,2,200405,吸烟对个人健康和公众利益的影响,65,75,71,54,85,337,C,
我认[F認]为爱，不管媒妁[C]之言，自由恋爱，还是无[F無]心插柳的情，都必须[F須]{CD付出}真心真意，宁可自己吃亏，也不愿意{CC在意}让爱有所损伤。,200410534533150013,新加坡,1,200410,最理想的结交方式,70,90,66,49,63,331,C,
对我而言，有缘千里来相会已经是缘[B绝]分。,200410534533250022,新加坡,2,200410,最理想的结交方式,60,70,63,33,58,269,未参加,
世界上没有什么事情是简单{CC单一}的，就拿男女结交来说吧，每一对结合的夫妻都有他们不同的结交方式，不同的背景，当然也就有着不同的故事情节。,200410534533150105,新加坡,1,200410,最理想的结交方式,95,95,85,85,99,458,A,
但不论如何，更重要的是相敬如宾，相互关爱，{CQ只有这样}才能白[B百]头偕老。,200410534533250099,新加坡,2,200410,最理想的结交方式,95,80,83,65,91,410,B,
一般的运动员的收入不会太高的，尤其是不太受人们热爱的运动项目的运动员。,200404140540200299,印度尼西亚,2,200404,运动员收入,70,70,75,59,84,346,C,
所谓男女有别，男女授受不亲[F親]。[BC.],200504534533150005,新加坡,1,200504,我对男女分班的看法,65,85,65,78,70,353,C,
正确的思想观念及价[F價]值{CQ观}也需要家长们与老师们的不断灌输。,200504534519250040,马来西亚,2,200504,我对男女分班的看法,70,80,67,62,73,342,C,
如果男女同班，很容易出现早恋现象，还可能提早吃禁果，后悔莫及。[BC.],200504534533250056,新加坡,2,200504,我对男女分班的看法,75,85,62,60,77,352,C,
所以，家长的顾虑并非杞人忧天。,200504534533250062,新加坡,2,200504,我对男女分班的看法,65,75,78,84,75,364,B,
因为他们会先站在异性的角度看待问题及解决方法。,200504534519250093,马来西亚,2,200504,我对男女分班的看法,70,80,78,78,79,375,B,
这可能发生在快餐店或图书馆{CC读书馆}。,200504534533250113,新加坡,2,200504,我对男女分班的看法,70,75,87,73,70,364,B,
这样是一个不实际、[BC，]又违反自然的做法。,200504534533250117,新加坡,2,200504,我对男女分班的看法,80,85,87,84,86,416,A,
家长最不放心的就是这一点，因此而支持男女分班。,200504534533250138,新加坡,2,200504,我对男女分班的看法,65,65,59,71,62,306,C,
当我们年轻人成人后，踏入这个社会时，我们必须与外界沟通。,200504534533250154,新加坡,2,200504,我对男女分班的看法,90,80,84,78,82,409,A,
我朋友教了他狗是不好{CQ的}。,200505109922100247,美国,1,200505,父母是孩子的第一任老师,65,55,39,29,49,219,未参加,
天天{CJX}我努力实[C]现这个目标，[BC、]做生活，[BC、]做工作。,200505109525100552,日本,1,200505,父母是孩子的第一任老师,60,65,63,61,69,301,C,
几岁的孩子什么都不懂[C]。,200505109525100578,日本,1,200505,父母是孩子的第一任老师,65,65,79,72,64,329,C,
