错句,作文编码,国籍,性别,考试时间,作文题目,口试分数,作文分数,听力分数,阅读分数,综合分数,总分,证书
她的脸上经常带着微笑。,199412104523200637,韩国,2,199412,记对我影响最大的一个人,80,70,70,71,76,357,B,
我爸爸是个特别友好的人。,199412104922100690,美国,1,199412,记对我影响最大的一个人,55,55,36,36,28,190,未参加,
而且，我觉得女子大学[D生]的生活太单调，没有在学习方面下功夫。,199412104523200680,韩国,2,199412,记对我影响最大的一个人,75,70,78,65,61,338,C,
他上的是工业高中，高中毕业后在日立工厂工作了一段时间后才上大学。,199412104525200110,日本,2,199412,记对我影响最大的一个人,85,75,73,61,67,353,B,
小学毕业以后，{CJ-zhuy我妈}一边上学，一边工作[BQ，]仅仅上完{CC结束}了中学。{CJ-zhuy她},199412104523200653,韩国,2,199412,记对我影响最大的一个人,60,60,52,48,45,247,未参加,
我的父亲比较严格，{CJ-zhuy我们}有事不敢跟他商量。,199412104523200692,韩国,2,199412,记对我影响最大的一个人,70,70,68,67,72,335,C,
那一年，我班[C]成为{CC得到}全年级[BD，]数[F數]学最好的一班[C]。,199500533533200044,新加坡,2,199500,记对我影响最大的一个人,95,80,81,65,72,389,B,
天真活泼的我和妹妹一吃饱饭，又想溜出去找小朋友玩耍了，当我们要踏出大门口时，爸爸正从外面回来，面色苍白，似乎生病了，我们喊了一声爸爸就缩回屋内，不敢出门去玩。,199500533533200069,新加坡,2,199500,记对我影响最大的一个人,90,85,70,50,63,355,C,
因为大表妹和大表弟都能顺利进入拉隆功大学就读，尤其是大表妹[BQ，]还是名誉奖学金的医科生；公婆姑姑都被她的美德感化了；[BC。]姨丈更是二十年如一日地{CC的}疼爱她。,199500533533200080,新加坡,2,199500,记对我影响最大的一个人,80,80,57,67,80,356,C,
小时候，时常看见一位印度叔叔来{CC1进去}我家，每一次，我都看见父亲交出一生笔钱给他，当时我并[F並]不知道[C]是什么一回事，也没去问。,199500533533100094,新加坡,1,199500,记对我影响最大的一个人,85,70,81,69,86,382,B,
”“难道你不承认你错{CQ了}吗？,199500533540200112,印度尼西亚,2,199500,记对我影响最大的一个人,65,65,75,73,82,344,C,
朱先生的话使我从此改变了对他人的看法与要求，我学会如何宽容地接受别人的优、缺点，学会如何去体谅他人的处境，这一心境的放松与思想上的顿悟，使我一生获益不浅。,199500533533200122,新加坡,2,199500,记对我影响最大的一个人,95,90,78,69,90,421,B,
它让我从此不再那样{CC那儿}的斤斤计较，愤世嫉俗。[BC，],199500533533200122,新加坡,2,199500,记对我影响最大的一个人,95,90,78,69,90,421,B,
”他的那两句话，至今仍然深{CJcd}烙{CC烙[B骆]印}在我的脑海里，也是我这些日子来处事的座右铭[B名]。,199500533533100135,新加坡,1,199500,记对我影响最大的一个人,95,85,83,71,80,412,A,
父亲是那么地{CC的}平易近人，令我难以用言语来表达。,199510512501100504,中国,1,199510,记对我影响最大的一个人,90,90,81,79,73,411,A,
每逢客人来[F來][BQ，]我们[F們]兄妹三人就[B最]得挤[F擠]在一张[F張]小床上，常为[F為]此生病不能上[C]学[C]。[BC，],199510512501100507,中国,1,199510,记对我影响最大的一个人,90,95,55,48,82,368,未参加,
出生之后很自然地拥有{CC带来}自己的权力和自由。,199510550523100916,韩国,1,199510,如何看待“安乐死”,65,55,55,46,41,244,未参加,
本文里[F裏]的先生帮[F幫]他太太，把他太太杀[B希]掉。,199510550523200925,韩国,2,199510,如何看待“安乐死”,65,70,69,50,46,286,C,
病人于[F於]痛苦的生活中渡过[F過]，受着治疗[F療]过[F過]程中的折磨；家人为[F為]了照顾[F顧]病人所费[F費]的心力精神也是相当[F當]大{CJsd}。,199511543634200522,英国,2,199511,如何看待“安乐死”,85,90,71,62,77,381,B,
中国没有什么主流宗教，我们则应从道德的角度去考虑。[BC，],199511543501100540,中国,1,199511,如何看待“安乐死”,85,80,69,77,97,401,B,
以往很多{CQ的}病例，{CQ那些}患了绝[F絕]症的病人，甚至植物人，在医护[F護]人员[F員]{CQ的}努力拯救，亲[F親]友的鼓励[F勵]、关[F關]怀[F懷]下，经[F經]过[F過]很长[F長]的时[F時]间[F間]，{CD而}最终[F終]痊愈或苏[C]醒[C]过[F過]来[F來]。[BC，],199511543501200541,中国,2,199511,如何看待“安乐死”,90,90,64,83,99,424,B,
以下为本人之简历：㈠姓名：×××㈡年龄：二十七岁[C]㈢性别：女本人在高中毕业后曾到吉隆坡中央艺术学院专修服装设计，之后转至美国进修女性服装设计。,199503681519200555,马来西亚,2,199503,一封求职信,75,80,69,60,79,354,C,
本人向来充分利用业余{CC工余}时间自修电脑课程，故对一般电脑操作商业文件，乃可应付。,199503680519200547,马来西亚,2,199503,一封求职信,90,90,83,79,82,422,A,
一九九一年任职于吉隆坡美华广告公司，为广告设计组组员。,199503680519200504,马来西亚,2,199503,一封求职信,85,90,69,73,86,399,B,
学中文既[B即]有困难又能给学生带来{CC生产}乐趣。{CP只要经过刻苦{CC吃苦},199505529529100054,泰国,1,199505,学习汉语的苦与乐,65,80,57,50,82,322,未参加,
我[C]是很容易受别人影响的人。,199505104525200006,日本,2,199505,记对我影响最大的一个人,75,55,73,44,67,299,未参加,
这一年中我跟他学[C]了乒乓球。,199505104523100040,韩国,1,199505,记对我影响最大的一个人,65,60,68,57,39,272,未参加,
对我影[C]响最大的一个人是耶酥[B苏]。,199505104523100050,韩国,1,199505,记对我影响最大的一个人,0,80,62,53,53,245,未参加,
她在一个很小的农村出生{CD以后}，现在还{CC也}在农村生活[C]。,199505104523200062,韩国,2,199505,记对我影响最大的一个人,70,65,65,55,55,296,C,
虽然我[C]的汉语水平还不高，但是我{CJ-zy会}往我的目标继续努[C]力学习。,199505104523100071,韩国,1,199505,记对我影响最大的一个人,65,55,65,65,51,283,C,
他教我们日本历史，[BC。]但是上课时候他给我们谈了很多日本民俗方面的事儿。,199505104525200106,日本,2,199505,记对我影响最大的一个人,60,60,44,59,47,252,未参加,
我以后再也不丢东西了，和她上课时，我每[B没]次想起她的话，{CQ就}努力学习。,199505104730200136,毛里求斯,2,199505,记对我影响最大的一个人,70,80,62,32,32,266,未参加,
他本来是我临[F臨]时工作的酒店的客人。,199505104525100168,日本,1,199505,记对我影响最大的一个人,70,65,44,48,53,266,未参加,
我读大学的时候，我家庭生活很困难，他常给我钱买书，还常写信鼓励我好好学习{CC4学习好}。,199505104542200192,越南,2,199505,记对我影响最大的一个人,85,80,44,38,65,305,未参加,
这{CD个}十八年来，我的母亲又当爹又当妈，把我和我的弟弟很辛苦地拉扯[B址]长大{CC一长}。,199505104922100209,美国,1,199505,记对我影响最大的一个人,80,65,60,61,47,301,C,
写文章的时候，我总是想起他的话来。,199505104525200217,日本,2,199505,记对我影响最大的一个人,75,65,44,53,57,281,未参加,
{CP他发现[B见]了我们的缺点，以后在厨房里[B黑]细细{CJ-sy提醒}{CJ-by我们}注意。,199505104525200231,日本,2,199505,记对我影响最大的一个人,70,75,75,55,69,333,C,
我跟妈妈在一起[C]的时间不多。,199505104542200239,越南,2,199505,记对我影响最大的一个人,90,95,86,81,78,428,A,
可我爸爸与众不同，他不但让[C]我[C]上学，而且经常说：“我[C]女[C]儿和儿子[C]都一样”。,199505104719200241,喀麦隆,2,199505,记对我影响最大的一个人,75,65,52,36,55,270,未参加,
随[C]着想[C]法的改变，生活上的想法也改变了。,199505104525200252,日本,2,199505,记对我影响最大的一个人,70,60,62,73,69,319,C,
一直到今天，只要心里有埋怨，有不平时，总会忆[F憶]起白牧师。,199508680519200510,马来西亚,2,199508,记对我影响最大的一个人,90,95,89,79,92,443,A,
每个人都会有不同的童年梦境，有的童年充满了悲哀[B衰]，有的童年充满了快乐的色彩。,200009542542200001,柬埔寨,2,200009,我的童年,70,80,38,33,56,267,未参加,
可能没那么厉害，但是当时人家至少好象很生气。,200010543922250004,美国,2,200010,我第一次……,80,75,67,44,57,314,C,
那种乐[F樂]于在书海中寻知识的态度和追求的执著，教人鼓舞。,200010543501150007,中国,1,200010,我第一次……,75,70,80,68,87,369,B,
有人主张[F張]应[F應]该[F該]允许[F許]已经[F經]没有爱[F愛]情基础的夫妻离[F離]婚。,200010602543250009,香港地区,2,200010,我对离婚问题的看法,85,85,100,90,95,450,A,
如果这次的发明普及到世界的话，有一些噪声问题将要解决{CC决解}。,200005108523200338,韩国,2,200005,关于用自然之声取代噪声的建议,65,60,45,60,48,261,未参加,
（162Z）,200005108523200339,韩国,2,200005,关于用自然之声取代噪声的建议,65,70,72,57,54,304,C,
虽然需[B许]要一定的资金和时间，但是这件事是很有价值的事。,200005108523200368,韩国,2,200005,关于用自然之声取代噪声的建议,65,60,78,78,50,314,C,
比如，{CD将}刺耳的汽车{CC汽气}喇叭声，恼人的电话铃声等等。,200005108523200401,韩国,2,200005,关于用自然之声取代噪声的建议,60,60,18,42,48,210,未参加,
同自己性格相同的人作朋友才容易发生友爱[BQ，]互相尊重[BQ，]互相忍让的情操[BQ。]但换一句话来说[BQ，]如果与一个在性格[BQ、]学业[BQ、]家庭背境[BQ、]语言[BQ、]性情不相同的人作朋友会很容易发生误会[BQ，]很容易发生冲突[BQ，]很容易发生互相不了解的事情[BQ，]因为性不相近的人会常常对事情的看法同做法有不同角度的看法。,199711802801100023,澳大利亚,1,199711,我选择朋友的标准,80,80,60,56,70,338,C,
现在的城市生活使我们“不自然”。,199705104525100010,日本,1,199705,我的城市/乡村生活,70,70,46,72,68,314,C,
因为我觉得，生活在一个繁荣的城市里会使你进步得较快。,199705104540200036,印度尼西亚,2,199705,我的城市/乡村生活,65,85,49,54,58,301,C,
我从小{CC少}身体不结实，常常得病。,199705104525200047,日本,2,199705,我的城市/乡村生活,75,70,71,58,65,328,C,
一次一次不愉快的事令我对人生产[F產]生怀[F懷]疑，自卑，孤独感{CC3离[F離]群[F羣]}成为[F爲]我逃避现[F現]实[F實]的借口。,199810602801250010,澳大利亚,2,199810,如何面对挫折,80,75,78,82,82,388,B,
可一开始，就知道了没那么容易。,199804123525100038,日本,1,199804,学习汉语的苦与乐,70,70,39,28,36,231,未参加,
现在我想起那时候的我，很可笑。,199804123523200044,韩国,2,199804,学习汉语的苦与乐,75,40,48,57,72,273,未参加,
我对中国话的发音非常有兴趣。,199804123523200085,韩国,2,199804,学习汉语的苦与乐,60,65,48,49,56,261,未参加,
谁知道我的声调那么不{CC没}准确啊！[BC？],199804123523200120,韩国,2,199804,学习汉语的苦与乐,90,80,78,64,62,369,B,
这也不是{CJ-zy能}马上学会的[BQ，]要得{CQ像}磨杵成针一样坚持下去。,199804123525100143,日本,1,199804,学习汉语的苦与乐,90,80,48,54,52,319,C,
要学好{CD学习}是一个苦，但同时也是一个乐[BQ，]我是这样想的。,199804123525100143,日本,1,199804,学习汉语的苦与乐,90,80,48,54,52,319,C,
对我来说学汉语是一件不容易的事。,199804123523100162,韩国,1,199804,学习汉语的苦与乐,70,70,57,45,54,284,未参加,
可是生活中，比如，买菜时，并不觉得困难，因为只有问多少钱，听得{CC的}见菜的价格{CC价值}，就够了。,199804124523200412,韩国,2,199804,学习汉语的苦与乐,80,55,51,54,56,282,未参加,
中泰贸易迅速发展，对懂中文的贸易人员的需求量越来越大，再有，我父亲是中国人[BQ，]就更给我极大的影响，我从小{CC幼}就喜欢中国文化。,199804124529200427,泰国,2,199804,学习汉语的苦与乐,80,90,60,59,58,342,C,
可以说我学习汉语的时间不短，然而我一旦不注意声调，中国人{CJ-zy就}听不懂我说的话。,199804124523200441,韩国,2,199804,学习汉语的苦与乐,85,85,78,67,80,390,B,
“妇[F婦]女辞职回家”问[F問]题，在表面上看来似乎是在时[F時]代的须[F須]求下是有正确[F確]理由{CJsd}。,199805529529151002,泰国,1,199805,如何看待“妻子回家“,60,60,59,47,55,263,未参加,
只要她喜欢做的事，我都会尊[C]重她的意见[F見]，不断[B段]鼓励她，让她对我有{CD个}种[B中]安全感{CC3全感}，这才是男人大丈[B长]夫啊！,199809542542100009,越南,1,199809,如何看待“妻子回家“,75,75,38,44,50,272,未参加,
这个[F個]计还真灵，我{CQ就}不{CC产}哭哭闹闹的{CQ了}.你知道那是什么吗？,199910512501250005,中国,2,199910,我的童年,70,80,42,59,58,299,未参加,
因为这时我一个朋友{CC人}也没有{CJ+by好朋友}，不得不总是一个人看书{CD过}。,199904123525100034,日本,1,199904,如何面对挫折,60,65,45,65,43,261,未参加,
他们因战争的原因不喜欢日本人，所以会说日语的人也不说日语。,199904123525200158,日本,2,199904,如何面对挫折,60,70,37,55,56,263,未参加,
”[BQ。]我也知道我父母说的有道理，可是一直到毕业{CJ-zy都}过得闷闷不乐。,199904124525200308,日本,2,199904,如何面对挫折,75,80,78,88,85,397,B,
