错句,作文编码,国籍,性别,考试时间,作文题目,口试分数,作文分数,听力分数,阅读分数,综合分数,总分,证书
知道您公司招聘。,199312123542100412,越南,1,199312,一封求职信,55,50,46,45,41,216,未参加,
李文先生[BQ：]您好！,199312124525100934,日本,1,199312,一封求职信,65,80,57,37,57,284,未参加,
两年后，我在那儿当导游[BQ，]一直到现在。[BC，],199312123523200928,韩国,2,199312,一封求职信,55,65,46,34,39,222,未参加,
虽然他认为旅游是很有意思的[BQ，]可是他非常讨厌公司的领导。,199412123606100012,比利时,1,199412,记我的父亲,55,65,54,36,37,229,未参加,
”“别跟着陌生人走。,199412123525200049,日本,2,199412,记我的父亲,85,90,60,61,67,359,C,
那是我高中入学时他为我买回来的[BD。]从那时九年{CJX}一直跟我一起的表。,199412123525200076,日本,2,199412,记我的父亲,55,60,62,53,57,268,未参加,
爷爷经常打{CC1挨打}[BD，]骂{CC1挨骂}我父亲。,199412123525100102,日本,1,199412,记我的父亲,55,50,49,38,39,210,未参加,
若有人向他请求帮忙，只要他能做到，肯定会答应，而且不要回报。,199412123635200109,俄罗斯,2,199412,记我的父亲,85,85,86,61,80,392,B,
果然有一天我们收到爸爸的来信，说手续已[B己]办好了。,199412124604200022,奥地利,2,199412,记我的父亲,85,80,70,57,55,340,B,
他告诉我怎么对待社会上各种各样的人。,199412104523100683,韩国,1,199412,记对我影响最大的一个人,60,60,49,50,43,244,未参加,
我很爱他们。,199412104523200645,韩国,2,199412,记对我影响最大的一个人,65,65,49,40,59,262,未参加,
”,199412104525100643,日本,1,199412,记对我影响最大的一个人,50,65,44,59,72,271,未参加,
从小学开始，我的成绩一直不错，很顺利地考上了重点高中、重点大学了。,199412104525100120,日本,1,199412,记对我影响最大的一个人,65,65,81,71,74,340,C,
父亲[F親]；你虽[F雖]然已离[F離]我远[F遠]去；可是现[F現]在我不知道有多少后悔的话[F話]要向你说[F說]，使你在有[L]生之时[F時]令你为我操心{CJjy}。,199500533519100039,马来西亚,1,199500,记对我影响最大的一个人,95,65,70,61,65,348,C,
直到小学六年经，我遇到我的班主任{CC班导师}—赵玉琼老师。,199500533533100068,新加坡,1,199500,记对我影响最大的一个人,90,80,57,65,72,359,C,
我哀伤[F傷]！,199510512501200508,中国,2,199510,记对我影响最大的一个人,90,95,48,48,61,340,未参加,
年纪转[F轉]大，加上忽略自己健康的老人家，终于[F於]病[C]倒了！{CJ+zhuy我},199510512501200508,中国,2,199510,记对我影响最大的一个人,90,95,48,48,61,340,未参加,
只有爸爸发觉[F覚]到我这[F這]种太过内向的性格。,199510512501200513,中国,2,199510,记对我影响最大的一个人,95,80,83,70,79,403,B,
文章里说明了，他们住的是农村，想必生活不是非常富有，如果在贫穷[F窮]的生活里，{CD要是}为[F爲]了一个得了不治之症的人{CD在}支出家计[F計]，也许是一种很大的负[C]担。,199510550523200918,韩国,2,199510,如何看待“安乐死”,90,85,59,60,53,344,C,
病人是经[F經]过[F過]医[F醫]生的诊[F診]断[F斷]后{CC下}，认[F認]为[F為]是无[F無]药[F藥]可救{CJbei}，只是用药[F藥]物或仪[F儀]器来{CC求}维持生命或尽[F儘]量减轻{CC减[F減]低}病者的痛苦，那样[F樣]，如在病人的要求下，医[F醫]生或亲[F親]人有权[F權]可以为[F為]病人进[F進]行安乐[F樂]死，因为[F為]这[F這]样[F樣]既可以了断[F斷]病人的痛苦，也可以使其亲[F親]人不必承受长[F長]期心理上的痛苦。P},199511543634100510,英国,1,199511,如何看待“安乐死”,70,90,74,73,82,382,B,
比如说按妻子的要求，丈夫[B丈]杀死{CJ-by妻子}，还是虽然没有她的要求，可是为了解脱自己或者家人的痛苦，杀死妻子，这二者{CC个}分别不太清楚。,199511543525100560,日本,1,199511,如何看待“安乐死”,80,75,31,58,59,294,未参加,
所以无[F無]论[F論]如何，我是认为{CC应[F應]为[F為]}安乐[F樂]死在现[C]今社会[F會]上是没有可取的价[F價]值和意义[F義]{CJsd}，而且[C]不是文明人的构[F構]思。,199511543634200567,英国,2,199511,如何看待“安乐死”,85,90,62,68,57,358,B,
西原大学不是一个很有名[B明]的学校，可是我非常喜欢我的学校。[BC.],199505550523200903,韩国,2,199505,记对我影响最大的一个人,75,65,41,50,49,267,未参加,
但是，{CD从[F從]}现[F現]在想起來，由[B有]于[F於]从[F從]小学{CC1被培养[F養]}过[F過]中文，长[F長]大以后[F後]才知道它的用处[F處]可真是不小，尤其在我们[F們]泰国{CJ+zxy的地方}，原本就有很多华人居住{CC居留}，而现[F現]在开[F開]始有很多大公司都需要会{CC1认[F認]识[F識]}中文的人才，这[F這]都对[F對]一些{CJ+sy有}学{CC读[F讀]}过[F過]中文的人有帮助，但是也要看个[F個]人学[F學]习的程度，有些只懂得说[F說]话[F話]而不识[F識]字不会[F會]写[F寫]，那就比较[F較]没用，不如再用点[C]心去进[F進]行更{CC再}好的一程。,199505529529200037,泰国,2,199505,学习汉语的苦与乐,65,80,69,52,64,318,C,
我们刚见面的时候，语言不同而且{CC2和}习[B系]惯[B贯]不一样[BQ，]所以很不舒[B舍]服。,199505104523100036,韩国,1,199505,记对我影响最大的一个人,55,65,62,40,41,245,未参加,
对[C]我影响最大的一个人是我妈妈。,199505104523200045,韩国,2,199505,记对我影响最大的一个人,55,75,36,30,53,234,未参加,
什么叫普通呢？,199505104525200067,日本,2,199505,记对我影响最大的一个人,85,90,65,71,78,385,B,
人们[C]生活中见面的朋友，同事等[C]等{WWJ}。,199505104523100089,韩国,1,199505,记对我影响最大的一个人,60,60,86,69,55,312,未参加,
他开设了一个独立公司，是“[BC《]中山产业贸易公司”[BC》]。{CP我是个年轻学生，[BC、]可我当了个公司经理。别说，[BC、]我全力以赴{CC兴奋起来},199505104525100168,日本,1,199505,记对我影响最大的一个人,70,65,44,48,53,266,未参加,
1993年4月份来北京以后，我慢慢地开始学汉语了。,199505104525200171,日本,2,199505,记对我影响最大的一个人,55,70,54,53,49,265,未参加,
我从他身上学到了不少东西。,199505104542200192,越南,2,199505,记对我影响最大的一个人,85,80,44,38,65,305,未参加,
比如决定一个事情每次由她决定，[BC.]对我自己{CD有些事情}是无所谓的。[BC.],199505104525200204,日本,2,199505,记对我影响最大的一个人,65,65,57,63,61,295,C,
她也是一样。,199505104523200215,韩国,2,199505,记对我影响最大的一个人,75,60,83,71,76,351,C,
我已经20多岁了，到现在应该不知不觉地受到了他们的影响。,199505104523200247,韩国,2,199505,记对我影响最大的一个人,65,50,46,67,51,260,未参加,
”我看到老师的态[C]度以后，我受{CJ-buy到}很大的影响，改变{CQ了}自己的想[C]法。,199505104525200252,日本,2,199505,记对我影响最大的一个人,70,60,62,73,69,319,C,
两个月过{CJ-buy去}了，我[C]还[C]是个老样子。,199505104540100294,印度尼西亚,1,199505,记对我影响最大的一个人,60,60,70,61,65,298,未参加,
父亲小时候[L]没念[F唸]过书[F書]，生活穷苦，十岁时要做苦工，廿[C]岁跟随[F隨]大家[C]来到马来西亚。,199508680519100503,马来西亚,1,199508,记对我影响最大的一个人,85,70,57,48,72,323,未参加,
这时，外公就会向我一一分析我应该走的方向{CC路向}。,199508681519200506,马来西亚,2,199508,记对我影响最大的一个人,90,80,78,69,84,396,B,
虽然宋校长已去世多年，他的关怀与支持，仍然深印在我脑海中。,199508683519100507,马来西亚,1,199508,记对我影响最大的一个人,90,90,70,77,86,411,B,
每当懈怠或松驰便赶紧督促自己再努力地{CC的}学习，同时以世界名人作为学习的榜样，从中激励自己往更高峰冲刺。,199508681519100509,马来西亚,1,199508,记对我影响最大的一个人,75,90,75,79,84,397,B,
这[F這]也会影响他对未来[F來]的婚姻构[F構]成不信任。,200010801543250005,香港地区,2,200010,我对离婚问题的看法,60,80,20,32,54,233,未参加,
但是，如果夫妻双方感情已完全破裂，要他们免强继续[F續]一起生活下去亦是于理不合的。,200010602801150003,澳大利亚,1,200010,我对离婚问题的看法,80,90,67,83,95,410,B,
有的人有了这个噪声，所以人们的生活越来越容易。,200005108523200282,韩国,2,200005,关于用自然之声取代噪声的建议,65,65,53,47,46,260,未参加,
声音会打扰的不仅是你一个人，也会打扰你周围的人。,200005108525200306,日本,2,200005,关于用自然之声取代噪声的建议,65,65,80,83,69,346,C,
下课呢？,200005108523100332,韩国,1,200005,关于用自然之声取代噪声的建议,70,65,78,67,65,331,C,
将刺耳的汽车喇叭声换成大海的波涛声，这是一件令人高兴的事，但得考虑什么时候该用。,200005108525200348,日本,2,200005,关于用自然之声取代噪声的建议,70,60,75,67,69,326,C,
我们有小时候用到现[F現]在的秘语，也有这几[F幾]年在工作上学到的作事方法，都是我们谈得来的原因。,199711802801100018,澳大利亚,1,199711,我选择朋友的标准,75,75,55,74,80,349,C,
她说：“东京不是人家住的地方。,199705104525200001,日本,2,199705,我的城市/乡村生活,65,75,55,67,61,310,C,
花也很多、野生动物也很多。,199705104523200135,韩国,2,199705,我的城市/乡村生活,70,65,46,54,44,265,未参加,
他需要休息，还需要享受余下{CC余与}的人生。,199705104523200522,韩国,2,199705,我的城市/乡村生活,65,60,46,35,37,226,未参加,
我刚来时，不知道这件事，所以休息时间随时打开电视机和录象机等，看从城市播来的节目。,199705104525100529,日本,1,199705,我的城市/乡村生活,65,60,55,76,68,307,未参加,
我也闹过许多笑话，对我们外国人来说，汉语的声调是最难的地方之一。,199804123523200120,韩国,2,199804,学习汉语的苦与乐,90,80,78,64,62,369,B,
总之，我认为，真正体会到学习汉语的苦与乐的人，才会达到最高的汉语水平。,199804123523200151,韩国,2,199804,学习汉语的苦与乐,75,80,51,54,56,307,C,
另{CC这}一个方面是在找工作的时候很重要的，[BC。]特别是因为随着中国开放外国公司想在中国建立业务。,199804123608200205,波兰,2,199804,学习汉语的苦与乐,75,70,45,37,46,262,未参加,
我认为最难改的东西是语调。,199804123523100228,韩国,1,199804,学习汉语的苦与乐,70,55,78,57,58,302,C,
学汉语的好处也有很多。,199804123525200249,日本,2,199804,学习汉语的苦与乐,65,75,51,54,44,276,未参加,
还有我自己看一本中文书时觉得好象我是一个学者一样{CC2样}{CJ+zxy的感觉}，真是高兴{CD了}。,199804124523200445,韩国,2,199804,学习汉语的苦与乐,75,70,60,64,42,300,C,
最近中韩之间的交流越来越多，所以学汉语以后我{CJ-sy有}更多的机会，这也是学习汉语的一种乐。,199804124523100491,韩国,1,199804,学习汉语的苦与乐,70,60,51,37,46,249,未参加,
然后，我就好好地问她：“亲爱[B受]的，今天你为什么回来得很晚呢！,199805529529151007,泰国,1,199805,如何看待“妻子回家“,70,70,48,58,62,296,C,
但其次[F餈]，[BC、]有些妻子不愿[B原]在外工作的，想在家操持家务，教育孩子，这[F這]我们又如何看待呢？,199809542542100015,越南,1,199809,如何看待“妻子回家“,65,65,38,33,46,231,未参加,
因为每个月发红利的时候是按人数平均分的，[BC。]多了一个我就少了他们的份儿。,199904123522200055,缅甸,2,199904,如何面对挫折,80,75,70,70,76,362,B,
可以说那是我第一次碰到的挫折。,199904123525100057,日本,1,199904,如何面对挫折,75,75,80,83,76,379,B,
另外在生活上{CD也}这样{CQ的}{CJX}遇到挫折，千万不要怨天尤人觉得没有面子。,199904123542200068,越南,2,199904,如何面对挫折,60,55,50,37,39,222,未参加,
人们一生中免不了遇到挫折。,199904123525200081,日本,2,199904,如何面对挫折,55,55,26,50,43,209,未参加,
人生中不可能一帆风顺{CC一路顺风}，不{CC1没有}遇见{CD过}困难或挫折，但是由于个人的性格[B各][BD，]与生活的看法不同所以对待困难或挫折{CD由此}{CJ-zxy的态度}{CQ也}不同。,199904123542200180,越南,2,199904,如何面对挫折,65,70,34,47,46,248,未参加,
第一的表现就是离开家人来到中国留学的事儿。,199904124523200320,韩国,2,199904,如何面对挫折,70,65,45,34,43,243,未参加,
两年之前终于解决了{CJ-by这个问题}。,199904124523100362,韩国,1,199904,如何面对挫折,65,65,42,52,46,254,未参加,
所以，一定要克服这种困难变成良好的成果{CJba}。,199904124523100395,韩国,1,199904,如何面对挫折,70,70,56,50,39,273,未参加,
（反正这儿有我的很多{CC多少}努力）那么我认为这种面对挫折的现象中自己有一定的自信感的活这就没问题。,199904124523100395,韩国,1,199904,如何面对挫折,70,70,56,50,39,273,未参加,
生活上和工作上没有强者弱者，所以大家都有培养自信感吧{CJy}。,199904124523100395,韩国,1,199904,如何面对挫折,70,70,56,50,39,273,未参加,
从早晨5点起床去补习班学习，下班后又去补习班学习学到晚上11点才回家。,199904124523200397,韩国,2,199904,如何面对挫折,65,75,78,65,74,344,C,
