错句,作文编码,国籍,性别,考试时间,作文题目,口试分数,作文分数,听力分数,阅读分数,综合分数,总分,证书
这意味着他是好的老师。,200505109525100578,日本,1,200505,父母是孩子的第一任老师,65,65,79,72,64,329,C,
我认为在遇到这样的情况的时候，[BC、]孩子一定会开阔眼界。,200505109525200823,日本,2,200505,父母是孩子的第一任老师,65,50,55,56,59,266,未参加,
他们自己的父母关系不好而不能想象幸福的家庭是什么样的。{CP孩子一直看父母长大，看父母学了不少东西。夫妻关系也是。除了夫妻关系以外也学了很多东西。比如他们的思想，行为，爱好什么的。P},200505109525200893,日本,2,200505,父母是孩子的第一任老师,80,75,55,65,64,330,C,
并且不要忘[B望]记，举止[B耻]行为不仅是出生之后发展的，{CQ从}父母{CQ那里}继承[B乘]下来的基因[B音]也构成一个不能忽视的因素，只{CJX}在这我们想重视社会上存在的一些问题。{CP首先要说{CD定},200505109616101113,德国,1,200505,父母是孩子的第一任老师,70,50,53,43,57,256,未参加,
父母肯定是孩子的第一任老师。,200505109525201210,日本,2,200505,父母是孩子的第一任老师,80,75,73,62,69,350,B,
因为现代男女平等，父母都工作的家庭越来越多。,200505109525102078,日本,1,200505,父母是孩子的第一任老师,60,65,41,67,50,266,未参加,
跟小孩子说的人大部分是他或者{CC还是}她的父母。{CP之[C]所[C]以对小孩子来说，父母的影响很大。上小学以后，孩子有了很多跟父母以外的人聊天的机会。但那个时候也{CJX},200505109525102146,日本,1,200505,父母是孩子的第一任老师,60,55,54,45,43,238,未参加,
我请教父亲，学习[C]很多很多的拍[C]照片的技术。,200505109525102455,日本,1,200505,父母是孩子的第一任老师,65,65,39,51,72,276,未参加,
他们以为只要所花的时[L]间比较{CJX}质[B制]量好{CD的}就可以了。,200505109922102567,美国,1,200505,父母是孩子的第一任老师,85,75,48,47,45,292,未参加,
在幼年的时候，我们的不同的兴趣也会受到父母的影响。,200505109922102598,美国,1,200505,父母是孩子的第一任老师,80,60,54,47,56,284,未参加,
这就很容易扩大我们的社交圈子，从而去认识更多的朋友。,200505951501150007,中国,1,200505,最理想的结交方式,70,85,86,75,95,403,B,
如果你们成家以后他不想甩掉{CC解脱}他的负担，你怎么办呢？,200505522522250014,缅甸,2,200505,最理想的结交方式,60,75,45,53,55,274,未参加,
但每个[F個]人[BD，]都有不相同的结[F結]交方式。,200505522522250026,缅甸,2,200505,最理想的结交方式,70,75,70,60,73,337,C,
男女相爱{CJX}、[BC，]相知地{CC的}走进[F進]礼堂，这是我们都知道的，但也有很多相爱{CJX}相知而不能结成夫妻的，为什么呢？,200505522522210007,缅甸,2,200505,最理想的结交方式,65,70,77,73,86,357,C,
最后祝[BD「]天下有情人，终[F終]成眷属[F屬]。[BD」],200505522522110019,缅甸,1,200505,最理想的结交方式,65,80,77,73,88,371,B,
特别是孩子在成长的时期，都是看父母的榜样来学，来做。,200505024533200393,新加坡,2,200505,父母是孩子的第一任老师,40,65,48,43,63,237,未参加,
为了教育好孩子，父母应改正自己的恶[C]习。,200505024922200379,美国,2,200505,父母是孩子的第一任老师,75,65,63,57,76,323,C,
原本而言，吸烟是个[B各]人的选择。,200509105922200007,美国,2,200509,吸烟对个人健康和公众利益的影响,80,75,55,40,46,287,未参加,
致：李文先生快乐家庭旅游公司,200509534519250020,马来西亚,2,200509,一封求职信,60,0,54,40,68,212,未参加,
我在“今天日报”看到贵公司的招聘启事，对女导游一职深感兴趣。,200509534533250054,新加坡,2,200509,一封求职信,80,60,73,51,82,333,未参加,
×××21号卓园路新加坡邮区3031应聘快乐家庭旅游公司李文君台鉴：从报章上得知贵公司业务[F務]发展{CJX}蓬[B逢]勃，并[F並]欲[B卻]聘请广告设计师2名[C]，本人对此工作甚感[C]兴趣，斗胆应征[F徵]，希望获得公司青睐，以能展现一技之长。,200509534533250059,新加坡,2,200509,一封求职信,55,60,45,44,86,271,未参加,
由于这样，家庭负担就落在我{CD本人}身上，一家五口需要生活。,200509534533250093,新加坡,2,200509,一封求职信,65,75,43,42,61,273,未参加,
李主任：我写信来是为了应征{CC要}广告设计师这个职位{CJsd}。,200509534533250121,新加坡,2,200509,一封求职信,70,65,63,42,48,274,未参加,
希望能听到贵公司的回应。,200509534533250127,新加坡,2,200509,一封求职信,60,70,79,49,77,320,未参加,
因此，本人目前于太平乐园旅行社担任营业部经理一职。,200509534519250156,马来西亚,2,200509,一封求职信,70,75,79,77,95,385,B,
对我而言，{CD我认为}广告对一家{CC间}公司是非常重要的。,200509534533150163,新加坡,1,200509,一封求职信,75,65,79,51,79,336,C,
除此之外，我的特长是对许多国家有深刻了解，对旅游也有浓厚的兴趣。,200509534533250164,新加坡,2,200509,一封求职信,75,75,82,64,84,370,B,
我在1999年从新加坡大学的{CC导}历史系毕业，因此对历史、文化都有一些{CC门}知识。,200509534533250193,新加坡,2,200509,一封求职信,65,70,41,64,79,305,未参加,
因为这样的内容[BD，]影响到最敏感的青少年的心情。,200510111523100421,韩国,1,200510,我看流行歌曲,70,55,74,46,77,306,未参加,
现在只为了学习语言[BD，]听音乐。,200510111523100424,韩国,1,200510,我看流行歌曲,70,85,70,71,84,372,B,
喜欢歌星就达到痴迷的程度是一时的现[C]象的话，我觉得这是年轻[C]人的特性[C][BQ。]总而[B儿]言之，喜欢歌[C]曲是没问题的[C]。,200510111523100777,韩国,1,200510,我看流行歌曲,60,55,35,28,47,206,未参加,
我首先拿{CC对}韩国的歌曲情况来说，最近韩国的歌迷水平越来越高，{CD还有}甚至一般人们的水平也越来越高，所以我觉得音乐的音感、[BC，]节奏等所有的{CJX}具备关于音乐的要素的歌曲可以流行。,200510111523100784,韩国,1,200510,我看流行歌曲,55,60,35,40,42,213,未参加,
听了以后，会给我们带来了一种新鲜感，会让你{CJ+sy觉得}兴奋{CJ-buy起来}。,200510111540200778,印度尼西亚,2,200510,我看流行歌曲,75,75,72,69,74,355,B,
现在在中国比较多的韩国歌曲引进了国内市场{CJbei}，许多青少年爱听韩国流行歌曲。,200510111523200793,韩国,2,200510,我看流行歌曲,80,65,67,46,69,315,C,
可是不用别[B另]人喜欢[L]那个歌，所以我也要喜欢那个歌的思想。[BC.],200510111523100817,韩国,1,200510,我看流行歌曲,60,65,53,40,47,248,未参加,
所以我说听几次就行，[BC。]不用过分。,200510111523100825,韩国,1,200510,我看流行歌曲,65,70,44,40,47,252,未参加,
因为[BD、]它里面反映[B应]了我们同时代的人都拥[C]有的想法、话题。,200510111523200848,韩国,2,200510,我看流行歌曲,70,70,63,32,52,275,未参加,
有时跟同学们一起去KTV，一起唱一首中国歌或者{CC还有}英语歌很有意思。,200510111523100857,韩国,1,200510,我看流行歌曲,75,65,67,50,57,301,C,
总起来说，我们还需要听以前的歌我觉得喜欢歌[B哥]可以分种类[B娄]喜欢，[BC。]但是不应该分时间喜欢。,200510111523100863,韩国,1,200510,我看流行歌曲,70,65,53,36,57,267,未参加,
换一句话说，如果我现在向往比较强劲的音乐、歌曲，那么新的歌曲如是摇滚之类的，我就会对它特别地感兴趣。,200510111922200867,美国,2,200510,我看流行歌曲,85,65,67,61,84,351,C,
作曲人只想这个歌{CD这}利用{CJX}{CQ变}{CD得}红。,200510111523200874,韩国,2,200510,我看流行歌曲,55,60,44,48,50,238,未参加,
第二，流行歌曲反映[B央]现在的[C]时代{CC世代}。,200510111523100890,韩国,1,200510,我看流行歌曲,55,65,46,50,47,245,未参加,
只是少数的专家{CC2专门家}才承认的歌曲{CD也}有什么意义呢？,200510111523200893,韩国,2,200510,我看流行歌曲,65,75,49,46,59,281,未参加,
是从我刚来中国而没有适应的那时期开始的。,200510111523101054,韩国,1,200510,我看流行歌曲,60,70,63,46,57,281,未参加,
还有年青人一般都说以前的不好{CJsd}，土[B士]的，看不起，这样的[C]想法下只想享受现在[C]的流行歌。[BC，],200510111523101127,韩国,1,200510,我看流行歌曲,70,65,70,54,55,300,C,
但是，我觉得流行歌曲也是{CD一种}音乐的一部分，没有任何理由蔑[C]视它。,200510111523201251,韩国,2,200510,我看流行歌曲,70,75,63,54,69,320,C,
流行歌曲还能团结人们。,200510111523201352,韩国,2,200510,我看流行歌曲,85,90,79,69,94,413,B,
但，对自己喜欢的歌星达到痴迷的程度的人们确是存在{CQ的}。,200510111523201352,韩国,2,200510,我看流行歌曲,85,90,79,69,94,413,B,
但，我当时喜欢[B观]的流行歌曲{CJ-zhuy我}现在不太喜欢[B观]，[BC。]因为听起来有点儿不舒服，有点儿土[B士]还有音乐的速[B迅]度太快，所以我[C]觉得有点儿别扭。,200510111523201572,韩国,2,200510,我看流行歌曲,60,60,37,42,52,233,未参加,
反复听那歌，自然能赞扬上帝，感谢我现在所能接触的一切。,200510111523201590,韩国,2,200510,我看流行歌曲,80,60,79,63,84,353,C,
所以我把音乐当成是一种艺术。,200510111523201623,韩国,2,200510,我看流行歌曲,60,75,42,48,50,261,未参加,
比如说，那时的气氛、[BC，]感情什么的。,200510111523201873,韩国,2,200510,我看流行歌曲,55,55,32,46,47,215,未参加,
一听他的歌就平安、[BC，]幸福。,200510111523201876,韩国,2,200510,我看流行歌曲,80,60,39,36,42,244,未参加,
为什么？,200510111523201877,韩国,2,200510,我看流行歌曲,50,50,42,32,42,194,未参加,
最近主导流行的人就是学生，但是他们对喜欢的标准不是对自己合适不合适，而是喜欢不喜欢唱歌的歌手。,200510111523201883,韩国,2,200510,我看流行歌曲,75,70,60,50,69,313,C,
父母可以给自己的孩子找五花八门的辅导老师，[BC。]但在孩子心目中有些事情是早已被父母教导过{CQ了}{CJsd}。,200510919523250014,韩国,2,200510,父母是孩子的第一任老师,70,85,68,46,54,315,C,
父母不仅[F僅]是孩子最重要的人，也是孩子的第一任老师[F師]。,200510919543250005,香港地区,2,200510,父母是孩子的第一任老师,65,90,50,82,77,355,C,
我很喜爱[F愛]流行歌曲，但不到痴迷的程度。,200510205919100143,加拿大,1,200510,我看流行歌曲,80,70,53,59,67,319,C,
当孩子小的时候，他们总是会学着自己身边[L]的人的一举一动，所以父母是孩子第一任老师。[BC，],200510956922130002,美国,1,200510,父母是孩子的第一任老师,80,85,74,52,71,356,C,
我听一名歌星的歌曲，模仿着唱，模仿着跳，甚至模仿穿他们的漂亮衣服。,200510520520250014,蒙古国,2,200510,我看流行歌曲,75,65,53,50,55,285,未参加,
对我来讲{CC4来我讲}，我是非常喜欢流行歌曲的其中一个人{CJZR}。,200510302523100001,韩国,1,200510,我看流行歌曲,80,60,49,22,35,233,未参加,
因为听流行歌曲让我感到高兴{CJ+zxy的感情}。,200510302523100026,韩国,1,200510,我看流行歌曲,60,65,42,38,52,240,未参加,
国际化的潮流充斥全世界的今天{CC如今}，无论哪个国家，也都会{CC有}出现人、[BC，]特别是年轻人喜欢流行歌曲的现象。,200510302523200042,韩国,2,200510,我看流行歌曲,75,75,70,54,89,353,B,
如果我这么一问，有多少人会说“是”呢？,200510302523100058,韩国,1,200510,我看流行歌曲,75,70,86,75,94,389,B,
现在人们喜不喜欢流行歌曲是{CJX}不大问题，但是喜欢就喜欢吧，没有什么大的问题。[BC，],200510302523100074,韩国,1,200510,我看流行歌曲,45,45,60,28,57,210,未参加,
每个歌曲里都有一个人的希望。,200510302523200080,韩国,2,200510,我看流行歌曲,70,90,60,59,79,351,C,
我反对那些蔑视流行歌曲原因是：[BC。]{CD如果}他{CJX}除非是一个不喜欢音乐的人，如果{CC应该}是喜欢音乐的，无论他喜欢的是古典音乐还是京剧音乐，那些音乐在以前也是所谓的“流行音乐”。,200510302523100095,韩国,1,200510,我看流行歌曲,65,85,77,65,87,369,C,
但是我呢？,200510302523200139,韩国,2,200510,我看流行歌曲,70,60,37,40,50,242,未参加,
也有明星得{CC的}不好看，而这明星唱歌好听，成了一个流行歌曲，所以我喜欢听这种明星唱的流行歌曲。,200510302523200261,韩国,2,200510,我看流行歌曲,60,65,51,44,55,258,未参加,
总之，各有各的看法。,200510529529251014,泰国,2,200510,我看流行歌曲,80,80,83,81,94,410,B,
有一些歌曲很有意思，内容很好，听了以后心里觉得很舒服，留了很深刻的印象{CC影响}。,200510540540200002,印度尼西亚,2,200510,我看流行歌曲,85,95,63,56,67,362,C,
我是属于喜欢享受流行歌曲的其中一个。,200510540540100013,印度尼西亚,1,200510,我看流行歌曲,75,85,51,77,72,353,C,
音乐能让生活更加充实{CC充满}。,200510540540200026,印度尼西亚,2,200510,我看流行歌曲,65,60,46,32,72,258,未参加,
上大学以后，我有一个叫张艳翠的同班同学，她跟我说她是刘德华的歌迷。,200510540540200036,印度尼西亚,2,200510,我看流行歌曲,65,65,60,34,67,275,未参加,
比如：一起吃饭，一起购物等。,200505680519250018,马来西亚,2,200505,最理想的结交方式,60,65,61,44,64,277,未参加,
因此，跟过去相比，父母和孩子之间自然而然就出现了代沟的问题，[BC。]他们的关系越来越远[B元]。,200509602523150010,韩国,1,200509,父母是孩子的第一任老师,0,60,55,58,54,219,未参加,
我会靠自己生活下去的。,200104124523200005,韩国,2,200104,一封写给父母的信,75,70,58,47,45,284,C,
但这件{CC个}事情让我非常高兴而且{CC2而}更喜欢××了。,200104124525200061,日本,2,200104,一封写给父母的信,65,60,44,39,54,245,未参加,
其实[B是]在北京也有樱花树。,200104124525200067,日本,2,200104,一封写给父母的信,65,75,44,39,33,243,未参加,
我跟××每天一起吃那些菜，她也很感谢你[B您]们。,200104124523200077,韩国,2,200104,一封写给父母的信,65,60,38,42,40,228,未参加,
2001年04月14日,200104124545100108,乌兹别克斯坦,1,200104,一封写给父母的信,70,80,30,30,56,256,未参加,
不知不觉快要毕业了。,200104124540200136,印度尼西亚,2,200104,一封写给父母的信,75,90,44,28,45,276,未参加,
身体还好吗？,200104124523100172,韩国,1,200104,一封写给父母的信,70,60,38,49,54,256,未参加,
有的{CQ老师}{CD是}发音准确。,200104124525100192,日本,1,200104,一封写给父母的信,75,75,44,54,54,292,未参加,
听说前几天下了大雨。,200104124523200256,韩国,2,200104,一封写给父母的信,70,75,41,42,45,262,未参加,
她去了美国留学后，改变了很多吧！,200104124525200265,日本,2,200104,一封写给父母的信,65,75,55,47,61,290,未参加,
现在，北京已经是春天了。,200104124525200267,日本,2,200104,一封写给父母的信,65,70,58,61,67,307,C,
您也可能不知道我的姥姥{CC老老}就爱打扮的人{CJZR}，一到我家就去美容室剪头发、染发什么的。,200104124525200281,日本,2,200104,一封写给父母的信,70,60,41,44,56,256,未参加,
也许不少外国人还认为中国人都穿着中山装坐[B作]马车，但现在这里的上海人（也有很多外地人）{CJ-zy都}穿得花花绿绿的，而且在马路上各种各样的汽车在飞驰着{CJy}。,200104124523200366,韩国,2,200104,一封写给父母的信,70,90,66,77,81,377,C,
这公司的经理是我们学校以前的校长，经朋友介绍[BQ，]我上星期一到他那里签了个协议后就把稿子接回来做了。,200104124529100379,泰国,1,200104,一封写给父母的信,80,85,82,68,88,397,B,
我们都很了解这点。,200104124525100439,日本,1,200104,一封写给父母的信,65,70,58,77,61,317,C,
女儿在北京一切都很顺利，饮食、住宿等也都适应，女儿已长[C]大了，会照顾自己，爸爸、妈妈不必挂念。,200104124529200441,泰国,2,200104,一封写给父母的信,85,90,68,82,85,406,B,
我正准备找工作，现在还打算考HSK。,200104124525200450,日本,2,200104,一封写给父母的信,75,75,93,70,83,386,B,
对{CC在}中国流行的服装[C]风格要{CQ进行}一定的宣传。,199200204539100038,印度,1,199200,一封求职信,,,0,0,0,0,未参加,
如今有一位妻子得了一种不治之症，十分痛苦，要求丈夫帮助她自杀，是否丈夫犯[C]了故意杀人罪？[BC。],199604123529100273,泰国,1,199604,如何看待“安乐死”,70,65,45,39,39,243,未参加,
这种情况下我们全家人不给爷爷药[C]，[BC、]过{CQ了}一天就出现了爷爷的身体已[C]经快倒[B到]了。,199604124523200015,韩国,2,199604,如何看待“安乐死”,60,65,45,49,42,244,未参加,
看起来她的病不能治但是实际[B院]上她的病可能治好。,199604123506100128,巴基斯坦,1,199604,如何看待“安乐死”,70,60,27,20,39,200,未参加,
谁愿意当医生。,199604123523100208,韩国,1,199604,如何看待“安乐死”,60,60,63,42,52,259,未参加,
现在一个人能完全靠机器生活下去，[BC.]有的时候这些人被称作植物[B扬]人[BQ，]不能有有意义的正常的生活。[BC.],199604123634100260,英国,1,199604,如何看待“安乐死”,60,60,45,42,49,238,未参加,
但是，[BC.]从感情来想，[BC.]自己的妻子十分痛苦，[BC.]得了不治之症，[BC.]这时候谁都想解脱病人的痛苦，[BC.]甚至于[BD.]如果可以解脱病人的痛苦什么都做。[BC.],199604123525100164,日本,1,199604,如何看待“安乐死”,60,60,42,54,47,245,未参加,
可是，现在我面对着“安乐死”问题要表明“反对”。,199604123523200149,韩国,2,199604,如何看待“安乐死”,65,50,56,61,67,279,未参加,
从古代以后，人们的生活不断地发展起来了，从{CC在}人们使用的工具{CC用具}上来看，有很大的进步。,199610550523290009,韩国,2,199610,如何解决“代沟”问题,65,50,54,55,65,270,未参加,
子女先得了解[C]父母的成长过程。,199610550523190036,韩国,1,199610,如何解决“代沟”问题,50,50,44,32,47,201,未参加,
那时候我爸爸不让我去，因为他担心{CC2怕}我的安全和孤独。,199610550523290037,韩国,2,199610,如何解决“代沟”问题,60,70,44,48,47,254,未参加,
因为[F為]现在社会，经济、[BC，]政治上，各国都很关注{CC注目}他们，{CJ-zhuy他们}在经济的消费形[B型]态[F態]上跟老年人不同，很快{CQ就}适[B实][C]应世界消费形[B型]态[F態]，所以前一代先要了解这“新新人类[F類]”。,199610550523190054,韩国,1,199610,如何解决“代沟”问题,65,55,57,59,43,261,未参加,
怎么解[C]决？[BC。],199610550523290064,韩国,2,199610,如何解决“代沟”问题,75,65,36,59,47,269,未参加,
想想看，[BC；]两个和尚起初都愿意为他人着想，分工合作。,199603533533200012,新加坡,2,199603,由“三个和尚没水喝”想到的……,65,75,74,65,91,357,C,
在最近的台湾竞[F競]选运动中。,199603533533100018,新加坡,1,199603,由“三个和尚没水喝”想到的……,85,65,58,76,82,355,C,
糟就糟在，你这么想，别人也不是傻瓜[B光]，于是，你等我，我等你，在这个时刻，大家的耐性似乎[B呼]特别强，最多也不过是大家同归于尽。,199603533533200028,新加坡,2,199603,由“三个和尚没水喝”想到的……,90,90,49,70,99,396,C,
在现今这个功利主义至上的大环境里，多数人都套上了多面的面具，这个面具会随着{CD不同}场合的不同而转变，所以，如果不小心遇上这种人，可要小心谨慎{CC好自为之}。,199603533533200062,新加坡,2,199603,由“三个和尚没水喝”想到的……,95,85,52,74,89,393,C,
当然大家都希望“平和”[BQ。]{CQ这}就{CQ是}“三个和尚的故事”[BQ。],199603533525100070,日本,1,199603,由“三个和尚没水喝”想到的……,70,55,30,54,49,242,未参加,
总之，尽本份，凭良心，无法做到损己利人也罢，然而损人利己亦不可为，文中三个和尚最终损己损人，大家都没水喝了，又有什么意思呢？,199603533533200086,新加坡,2,199603,由“三个和尚没水喝”想到的……,90,95,74,72,99,428,B,
不然，自己人互相斗，不团结，吃亏的也还是自己。,199603533540200112,印度尼西亚,2,199603,由“三个和尚没水喝”想到的……,90,80,69,49,77,360,C,
果然有水。,199605104922200100,美国,2,199605,由“三个和尚没水喝”想到的……,90,50,41,45,49,263,未参加,
他[C]们生活的主要任务应该可以三个人互相合作、互相解决了吧！,199605104540200201,印度尼西亚,2,199605,由“三个和尚没水喝”想到的……,70,60,69,42,46,272,未参加,
我喜欢照顾别{CD的}人，关心别人。{CP可看见一点不关心别人{CC人家},199605104525200231,日本,2,199605,由“三个和尚没水喝”想到的……,85,65,38,60,58,295,未参加,
第一个和尚终于忍不住对两个和尚提出一个意见：“我们已经好几天没喝过水{CQ了}，如果这样一直下去的话，三个人都渴死了。,199605104523200280,韩国,2,199605,由“三个和尚没水喝”想到的……,70,65,74,72,68,335,C,
这个阅读短文也体现{CC表示}{CQ了}这个趋势。{CP如果一部分的人{CJ+zy也},199605104525100286,日本,1,199605,由“三个和尚没水喝”想到的……,65,70,35,49,42,247,未参加,
这三个和尚因为没有水喝开始找一个办法。,199605104610200292,法国,2,199605,由“三个和尚没水喝”想到的……,50,50,44,26,32,180,未参加,
我们是不是一起{CC公同}{CD的}坐[B做]船了吧？[BC，],199605104523200311,韩国,2,199605,由“三个和尚没水喝”想到的……,60,75,46,51,44,262,未参加,
自自然然，任何人都会[F會]先用这[B進]办[F辦]法找别人替他做好要做的事情，[BC。]这是人之常情。,199605104634200317,英国,2,199605,由“三个和尚没水喝”想到的……,65,70,41,45,63,270,未参加,
这意味着，人的心本身不是强的，而是比较弱的。,199605104525100354,日本,1,199605,由“三个和尚没水喝”想到的……,75,55,69,74,82,340,C,
“变质者”感到非常不利，此后他马上离开这座公寓。,199605104525100384,日本,1,199605,由“三个和尚没水喝”想到的……,70,60,46,63,54,278,未参加,
于是乎，中国的经济也落后于别的国家，而改革开放以后，多劳多得[BQ，]少劳少得，不劳不得，并允许部分人先富起来。,199605550523290001,韩国,2,199605,由“三个和尚没水喝”想到的……,90,90,88,79,100,445,A,
随着人口的增长，以前忽略{CC轻视}的问题日渐严重{CJ-buy起来}了。,199605550523190058,韩国,1,199605,由“三个和尚没水喝”想到的……,60,70,49,65,65,294,未参加,
每个人都知道人应该生活得很勤[B谨]劳，不应该自己要干的委托别人{CJba}，或者依靠别人。,199605550523290060,韩国,2,199605,由“三个和尚没水喝”想到的……,65,60,71,67,72,318,C,
其他两位这时[B是]也同时说：[BQ“]好吧！,199605529529150165,泰国,1,199605,由“三个和尚没水喝”想到的……,80,65,52,47,56,288,未参加,
他不埋怨，也没有说些什么，虽然我知道他私下里必定很失望。,199704124540200318,印度尼西亚,2,199704,记对我影响最大的一个人,70,80,53,60,70,323,C,
父亲说[F說]：“你要好好读书，做个有用的人，为家争[F爭]光，为国服务”。,200110540540150057,印度尼西亚,1,200110,我的童年,65,85,63,47,70,320,C,
哥哥们呢？,200110540540250076,印度尼西亚,2,200110,我的童年,70,90,36,47,76,312,未参加,
每逢除夕我们一家人团圆{CJ-zy在一起}吃年饭，正月初一照例到每个亲[F親]戚{CD的}家拜年，儿童们也就在这一天领到许多的红包（称之为压岁钱）。,200110540540150091,印度尼西亚,1,200110,我的童年,65,85,52,63,88,343,C,
而最高的学历是毕业于中华大学商业系的荣誉班。,199312533533100025,新加坡,1,199312,一封求职信,90,75,76,74,80,389,B,
兹此，一道寄上我的毕业文凭、奖状及个人简历复印{CC2复[F複]}本，希望贵公司能考虑我的申请。,199312533533100051,新加坡,1,199312,一封求职信,95,85,78,76,87,419,B,
谢谢。,199312533533200050,新加坡,2,199312,一封求职信,90,80,62,67,75,369,B,
快乐[C]家庭旅游公司联系人李文先生台鉴：从招聘启事中得知，贵公司有意招聘导游，本人愿试[L]一试此种工作。,199312533540200113,印度尼西亚,2,199312,一封求职信,80,90,67,78,94,404,B,
想转换工作环境，在贵公司当司机，希望能有机会在旅游业这方面发展。,199312533533200159,新加坡,2,199312,一封求职信,80,90,60,50,57,332,C,
我自己觉得工资不太重要。[BC.],199312123523100501,韩国,1,199312,一封求职信,65,50,57,41,36,230,未参加,
请您看我的照[C]片。,199312123523200928,韩国,2,199312,一封求职信,55,65,46,34,39,222,未参加,
