错句,作文编码,国籍,性别,考试时间,作文题目,口试分数,作文分数,听力分数,阅读分数,综合分数,总分,证书
父母应该要意识到这一点。,200505109525101621,日本,1,200505,父母是孩子的第一任老师,80,65,52,63,69,317,C,
没有办法得{CJX}他看父母学习许多事情。,200505109525101761,日本,1,200505,父母是孩子的第一任老师,55,55,39,29,41,199,未参加,
因此，孩子所看到的父母的行为、举止{CC谈止}、包括家庭环境，而且孩子所意识到的、所感觉到的都是父母身上学到的。,200505109510201804,朝鲜,2,200505,父母是孩子的第一任老师,80,75,67,57,87,357,C,
所以，可以说，[BD《]父母是孩子的第一任老师[BD》]。,200505109525101902,日本,1,200505,父母是孩子的第一任老师,55,70,46,45,72,272,未参加,
可是我觉得父母给孩子的最主要{CQ的}东西应该是极强的思维方式和美好的内心。,200505109520202058,蒙古国,2,200505,父母是孩子的第一任老师,65,65,48,49,69,280,未参加,
有的父母在孩子遇到困难的事情时就会劝他说，“如果你不会做、做不到，那[C]放弃就可以了”或者任何事情都替他解决，如果这样下去，孩子一直会遇到困难，无法解决。,200505109525102057,日本,1,200505,父母是孩子的第一任老师,65,70,61,59,78,319,C,
从小到{CC就}大，孩子会受到父母的重大影响。,200505109525102100,日本,1,200505,父母是孩子的第一任老师,70,70,71,69,76,334,C,
不管[B关]什么，父母永远{CJ+zy还[F還]}是我们第一任老师。,200505109614202385,荷兰,2,200505,父母是孩子的第一任老师,55,45,7,13,15,112,未参加,
也就是说，父母自然地当成孩子的第一任老师。,200505109525102400,日本,1,200505,父母是孩子的第一任老师,55,65,46,51,64,263,未参加,
不管是在道德[B得]上还是行为上，从小如父母教得{CC的}好[BQ，]那么孩子也可以把它变成一种习惯，跟着他一辈子。,200505212542200016,越南,2,200505,父母是孩子的第一任老师,85,65,73,65,74,351,C,
有的社会学专家、心理专家认为因孩子以父母的日常生活行为为教材的缘故，父母用自己的动作表示美德比让孩子读孔子的《论语》等对培养孩子的道德有更好{CC1优秀}的效果。,200505224922100102,美国,1,200505,父母是孩子的第一任老师,65,70,50,53,45,269,未参加,
父母们大多数一生下女儿来就决定要嫁出去，若一生出儿子来就要当家，[BC。]把所有的家事{CC责任}都交[B教]给他管理，所以说做儿子的{CD若}要是找不到一个理想的对象[B相]，{CD给}父母这个家就不会有安宁[F寧]；[BC，]{CD若}要是听[F聼]从父母的决定后，大家又彼[B比]此互相认[F認]识，互相了解对方的想法，然后[F後]再做决定也不迟[F遟]。,200505522522150007,缅甸,1,200505,最理想的结交方式,70,65,59,69,75,324,C,
大家彼此相聚在一起，互相聊天、互相认识。,200505522522150023,缅甸,1,200505,最理想的结交方式,80,90,84,64,84,397,B,
对于自己选择的人，他的性格与[B于]自己的相同和合不合得{CC的}来{CJ+zhuy这}是最重要的。,200505522522210012,缅甸,2,200505,最理想的结交方式,50,70,43,64,68,278,未参加,
所以为了国家的将来，为了整个社会，为了孩子[BQ，]家长除了应该注意到自己的思想，行为，爱好以外，还应该不断培养自己的能力，这才能成为孩子的最好榜样。,200505201542200069,越南,2,200505,父母是孩子的第一任老师,85,85,67,49,76,357,C,
学校里如果遇到什么不开心的事情，孩子吃饭时就有可能会说到，而父母就会帮助孩子解决[B觉]问题。,200505206616200124,德国,2,200505,父母是孩子的第一任老师,95,80,65,47,63,346,C,
总而言之，“父母是孩子的第一任老师”{CJ+zy都}是很重要的。,200505024533200393,新加坡,2,200505,父母是孩子的第一任老师,40,65,48,43,63,237,未参加,
李先生：本人看了{CC经过}贵公司的招聘启事。,200509534533250003,新加坡,2,200509,一封求职信,60,80,75,53,55,310,未参加,
我是马来西亚人。,200509534519250012,马来西亚,2,200509,一封求职信,70,70,75,47,64,314,C,
相信这一特长有助[B住]于拉近[B进]游客与导游的距离，也让少数不谐中，英文{CJ？}，尤[B由]其是老一辈的游客们能够更清楚旅游点的典故等。,200509534533250099,新加坡,2,200509,一封求职信,50,65,91,47,86,320,未参加,
在念大学的那一段时期，我也曾因兴趣而另外报读了淡迷尔文，掌[B撑]握了基本的语言能力，表达方面也不逊[C]色。,200509534533250132,新加坡,2,200509,一封求职信,65,65,68,62,86,330,C,
我的地址是123大明路。,200509534533250134,新加坡,2,200509,一封求职信,70,70,63,66,82,339,C,
李文先生：你好。,200509534533250153,新加坡,2,200509,一封求职信,75,70,75,69,84,362,B,
素闻贵公司的营业手法了得，我想，以我对设计广告的热忱与喜爱，才华也被许多公司肯定，希望贵公司能聘请我当广告设计师。,200509534533250177,新加坡,2,200509,一封求职信,85,70,77,64,82,369,C,
这家公司的业绩也日渐增长，而本人为他们所设计的广告也得到了当地著名的“最有创意广告”奖。,200509534533250187,新加坡,2,200509,一封求职信,70,75,77,64,86,361,C,
热爱社交的我性格开朗，也很幽默，但办起事来从不马虎，不但认真，而且也有责任感。,200509534533250193,新加坡,2,200509,一封求职信,65,70,41,64,79,305,未参加,
我对流行歌曲{CD有}感兴趣。,200510111523200009,韩国,2,200510,我看流行歌曲,60,60,53,40,35,230,未参加,
我在高中时候很喜欢听流行歌曲，甚至当过一名歌手的歌迷。,200510111523200009,韩国,2,200510,我看流行歌曲,60,60,53,40,35,230,未参加,
大众比较喜欢流行歌，尤其是青少年听流行歌的最多。,200510111523200799,韩国,2,200510,我看流行歌曲,75,85,74,73,72,372,B,
作为爱听流行歌曲的人[BQ，]我希望流行歌曲的继续发展。,200510111523200807,韩国,2,200510,我看流行歌曲,65,65,81,56,79,330,C,
而且最近年轻人之间说话的时候，这个流行歌是很好的话题[B提]。,200510111523100822,韩国,1,200510,我看流行歌曲,65,85,60,52,72,324,C,
最近我在网上看到的消息让我很吃惊。,200510111523200818,韩国,2,200510,我看流行歌曲,55,55,42,42,42,216,未参加,
如果有人问我：“你喜欢流行歌曲吗[C]？,200510111523100883,韩国,1,200510,我看流行歌曲,65,65,65,61,82,322,C,
可[C]是我觉得喜欢听流行歌曲是很正常的。,200510111523201026,韩国,2,200510,我看流行歌曲,70,70,58,61,57,304,C,
喜欢只是喜欢而已。,200510111523201053,韩国,2,200510,我看流行歌曲,45,65,49,46,50,235,未参加,
大多数人都喜欢流行歌曲的，但也有人会蔑视流行歌曲。,200510111610101397,法国,1,200510,我看流行歌曲,75,70,77,67,84,362,B,
我觉得歌手是唱歌的人，所以不管他长得好不好看，只要{CC是}他的歌唱能[L]力好就行[BQ，]别的什么都不管。,200510111523101576,韩国,1,200510,我看流行歌曲,65,65,56,56,59,285,C,
我来中国不久{CQ的时候}不太喜流行歌曲，但我{CJ-sy参加}中国大学生交流的时候才知道了[BQ，]不知道流行歌曲的话[BQ，]我可能不能交中国朋友[BQ，]所以我开始听{CD了}中国的流行歌曲，然后过了不久[BQ，]我跟中国朋友交流的时候感觉跟以[B一]前不一样[BQ，]好像更亲密的样子。,200510111523201575,韩国,2,200510,我看流行歌曲,65,55,51,38,45,236,未参加,
如果在社会里没[C]有流行音乐的话，那{CJ-zhuy人们}就对生活没有什么兴趣了。,200510111523201591,韩国,2,200510,我看流行歌曲,70,70,53,56,77,314,C,
这些歌曲不仅朗朗上口，而且歌词也很贴近我们生活中所遇见的问题。,200510111533201792,新加坡,2,200510,我看流行歌曲,95,95,70,73,94,426,B,
所以听流行歌的时候，我的心情{CC气氛}都变成寂寞{CQ的了}，[BC。]所以我不太[B态]喜欢流行歌曲。,200510111523201844,韩国,2,200510,我看流行歌曲,60,60,51,42,40,235,未参加,
由此我们可以发现父母是孩子的第一任老师。,200510919501250006,中国,2,200510,父母是孩子的第一任老师,75,95,86,87,100,437,A,
最重要的只有自己的感觉，自己的印象。,200510205630200049,西班牙,2,200510,我看流行歌曲,65,65,53,30,67,264,未参加,
因此，父母的一言一行都会[F會]成为[F爲]孩子的模仿对[F對]象。,200510950922250002,美国,2,200510,父母是孩子的第一任老师,90,90,65,79,88,410,B,
也有一些父母过[F過]量的安排各种[F種]各样[F樣]的培养项[F項]目给[F給]孩子，让[F讓]孩子的天份不但得不到发[F發]挥[F揮]，还[F還]会[F會]引起孩子对[F對]这[F這]些活动[F動]的反感，形成{CD了}相[L]反{CQ的}效果。,200510950922250002,美国,2,200510,父母是孩子的第一任老师,90,90,65,79,88,410,B,
音乐家也可以在{CQ这个}过程中互相切磋。,200510543801200001,澳大利亚,2,200510,我看流行歌曲,80,95,58,56,74,358,C,
我希望我们每人都能喜欢一些没有人喜欢的音乐[F樂][BQ。],200510543801200001,澳大利亚,2,200510,我看流行歌曲,80,95,58,56,74,358,C,
人要互相尊重对方。,200510302523100052,韩国,1,200510,我看流行歌曲,95,70,67,61,91,378,C,
像这样，流行歌曲在我们的生活当中占了不少的部分。,200510302523200066,韩国,2,200510,我看流行歌曲,75,50,74,52,74,309,未参加,
还有[C]流行歌曲带来的经济效[B交]果也很大。{CD看},200510302523200100,韩国,2,200510,我看流行歌曲,45,40,37,32,50,178,未参加,
但是因为有许多人喜欢，出现了免费下载音乐的坏现象。,200510302523200189,韩国,2,200510,我看流行歌曲,75,75,77,63,74,354,B,
其中一部分就是以前听不到的流行歌曲的出现。,200510302523100219,韩国,1,200510,我看流行歌曲,65,65,72,48,77,311,C,
出现节奏慢一点儿的，就是有一种[BQ。]但现在呢？,200510302523100220,韩国,1,200510,我看流行歌曲,65,60,56,28,69,261,未参加,
如果你想知道，就听流行歌曲吧。,200510302523100227,韩国,1,200510,我看流行歌曲,60,60,42,34,50,228,未参加,
我是一个学生，[BC。]当然我也喜欢流行歌[B哥]曲。,200510529529151026,泰国,1,200510,我看流行歌曲,65,70,70,52,79,322,C,
还有它的意思马上就直接说出来[BQ，]容易明白，听众不用猜。,200510529529251032,泰国,2,200510,我看流行歌曲,60,50,56,38,52,236,未参加,
反之，我想我更喜欢民族艺术歌曲，有悠美的音响，歌词都含有代表文化风俗的语言，每一首民族乐曲都代表了一种民族的特色、风俗文化，[BC、]当中有喜、怒、哀、乐，[BC、]每一个歌曲都能表达心中的感受。,200510540540100021,印度尼西亚,1,200510,我看流行歌曲,55,85,63,42,59,292,未参加,
我今天的汉语水平全都自修而来{CD的}，大多数是从华语歌曲及华语电影学来{CJsd}。,200510540540100035,印度尼西亚,1,200510,我看流行歌曲,60,40,44,30,37,188,未参加,
第一，大多数唱流行歌曲的歌手是多么的年轻，长得好看，唱的歌儿好听，符合[B和]现代人的要求。,200510540540200055,印度尼西亚,2,200510,我看流行歌曲,75,95,63,59,74,360,C,
看到你的爱[F愛]人在你身边，你会[F會]发现[F現]{CJ+buy到}你过[F過]去的努力并[F並]没有白费[F費]。,200505610610150002,法国,1,200505,最理想的结交方式,55,65,27,42,39,210,未参加,
父母的高尚品德可以教会[F會]小孩子如何与[F與]人相处[F處]。,200509602801250011,澳大利亚,2,200509,父母是孩子的第一任老师,0,75,88,81,84,324,未参加,
不是每[B没]个人{CJ-zy都}有同样的幸福。,200509602801250014,澳大利亚,2,200509,父母是孩子的第一任老师,65,75,85,58,77,347,C,
爸爸的工作怎么样，[BC？]没问题吗？,200104124523200025,韩国,2,200104,一封写给父母的信,70,60,58,47,54,274,未参加,
虽然在北京看不到像家乡一样美丽{CD不止}的樱花和[B可]梅花，{CQ但是}桃花比日本的还香。,200104124525200031,日本,2,200104,一封写给父母的信,70,65,63,75,54,313,C,
现在我非常盼望{CC2盼}暑假的到来。,200104124525200039,日本,2,200104,一封写给父母的信,65,75,68,51,63,309,C,
我过得很{CC都}好。,200104124523100074,韩国,1,200104,一封写给父母的信,75,60,68,54,45,288,C,
快要有一个考[B老]试{CQ了}。,200104124525200058,日本,2,200104,一封写给父母的信,70,75,38,37,45,254,未参加,
亲爱的父母：你们好！,200104124523100180,韩国,1,200104,一封写给父母的信,75,70,41,32,47,254,未参加,
因为有一天好像冬天一[B以]样的天气，有风，下雨，[BC、]感觉到很冷[BQ，]所以{CJ-zhuy我}多穿{CQ了}衣服。,200104124523200176,韩国,2,200104,一封写给父母的信,75,60,14,21,33,189,未参加,
春天容易{CC2好}感冒，要“春捂秋冻”注意身体。,200104124525200215,日本,2,200104,一封写给父母的信,75,75,85,70,85,380,B,
亲爱的爸[BQ、]妈，您好吗？[BD。],200104124525200303,日本,2,200104,一封写给父母的信,75,65,77,70,79,353,B,
有一天，我妈叫我到她{CC妈}面前坐下[BQ，]{CJ-zhuy我}终于跟{CC给}她说了我的想法，听了{CD到}我的话[BQ，]妈毫[Phái]不犹豫[Pyóuyù]地答应了我的请求。,200104124523100332,韩国,1,200104,一封写给父母的信,75,55,30,49,47,241,未参加,
代我向奶奶问好。,200104124542200384,越南,2,200104,一封写给父母的信,65,80,47,35,61,276,未参加,
温暖的春天，终于来到我们的身边了。,200104124523200390,韩国,2,200104,一封写给父母的信,70,80,52,44,42,278,未参加,
2001年4月15日在北京长女××上[BD。],200104124523200390,韩国,2,200104,一封写给父母的信,70,80,52,44,42,278,未参加,
我已经寄给一点中药您{CJshb}，妈妈一定要吃{CQ啊}。,200104124523200393,韩国,2,200104,一封写给父母的信,65,75,66,65,67,325,C,
爸爸、[BC，]妈妈你们好。,200104124523100420,韩国,1,200104,一封写给父母的信,70,70,52,42,49,271,未参加,
按照你公[B工]司{CQ的}招聘启事写{CQ了}一封求职信，请你看一下。,199200204525100007,日本,1,199200,一封求职信,,,0,0,0,0,未参加,
你好。,199200205525100015,日本,1,199200,一封求职信,,,0,0,0,0,未参加,
我要进贵公司，[BC、]利用经验产出新潮{CC2新潮流}的服装[D型]，[BC、]为{CC2被}消费者{CQ所}{CD受}欢迎。,199200205525200016,日本,2,199200,一封求职信,,,0,0,0,0,未参加,
关于身份地址如下：姓名[B外]：×××外语名字：xxxxxxTRASINGH年龄：21岁国别：印[C]度工作经验：在印度三年，印度精美服装公司地址：复旦大学国际文化交流[C]学院1-504室敬礼{CC致礼}!×××92年04月21号,199200204539100038,印度,1,199200,一封求职信,,,0,0,0,0,未参加,
然后在出版社呆了三年，在美术学校学习了两年。,199200008525100003,日本,1,199200,一封求职信,,,0,0,0,0,未参加,
精美服装公司：我叫[C]××××，[BC。]现在在XX公司做服装设计的工作。,199200008525200012,日本,2,199200,一封求职信,,,0,0,0,0,未参加,
在法国我跟着有名的老师学习，所以我觉得我的水平比[B此]较高。,199200008525200014,日本,2,199200,一封求职信,,,0,0,0,0,未参加,
丈夫应该到医院去找大夫，大夫有权利用安乐死的方法，不过丈夫和得了病的妻子应该下定{CC做好}决心。,199604123529100273,泰国,1,199604,如何看待“安乐死”,70,65,45,39,39,243,未参加,
本人有生命的时候写一篇{CC条}文章，[BC.]万一得了一种不治之症的话，按[B安]照本人的要求做“安乐死”。,199604123525200065,日本,2,199604,如何看待“安乐死”,45,45,24,32,37,157,未参加,
我不想看爷爷的样子。,199604123525100255,日本,1,199604,如何看待“安乐死”,50,60,37,52,52,230,未参加,
周围的{CJ-zxy人}都不放弃叔叔的命。,199604123523100305,韩国,1,199604,如何看待“安乐死”,70,65,42,44,49,255,未参加,
但[BD，]社会需要原则。,199604123525200508,日本,2,199604,如何看待“安乐死”,90,65,84,86,88,403,B,
主动杀人和在死者的要求下杀人之间有极大的差距，也就是说，感情上的差距。,199604124525200342,日本,2,199604,如何看待“安乐死”,65,80,77,79,88,377,B,
泳衣已是普遍{CJX}被接受的游[F遊]泳[C]用品/{CJbei}，但太性感[C]的新款泳[C]衣仍难[F難]被年老[C]一辈[F輩]人所接受。,199610802801200004,澳大利亚,2,199610,如何解决“代沟”问题,80,80,73,71,78,374,B,
我想可能是年龄的差距。[BC，],199610512501250005,中国,2,199610,如何解决“代沟”问题,80,90,91,75,74,405,B,
而作为儿女的也要顾及父母的想法，不要总固执地认为自己是对的。,199610512501250013,中国,2,199610,如何解决“代沟”问题,85,95,97,77,90,440,A,
可以想象{CC了解}现在的年轻人过了{CJ-dy很长}时间以后，变[C]成长[F長]辈[F輩]，才{CC1也是}可能体会到长[F長]辈[F輩]的困难。,199610550523290078,韩国,2,199610,如何解决“代沟”问题,60,70,41,55,45,256,未参加,
而如果和长[F長]辈[F輩]有意见[F見]冲[F衝]突，我们[F們]应[F應]多礼[F禮]让[F讓]他们[F們]。,199610550523190091,韩国,1,199610,如何解决“代沟”问题,65,70,65,75,78,339,C,
希望我们的社会有更多这类的人士，那么，由他们同心协[F協]力，把他们所学的用来造福人类{CC人群}，使我们的国家更美好，更进步。,199603533533200017,新加坡,2,199603,由“三个和尚没水喝”想到的……,90,90,74,56,72,380,B,
抚养是父母的责任，但当子女长大了，有经济能力后，也应分担家庭的负担，并且{CC以及}对父母要负有赡养的义务。[BC，],199603533501200026,中国,2,199603,由“三个和尚没水喝”想到的……,90,85,91,79,89,431,A,
集合这一点一滴的光，就能熔成一个大火球，奉献更多给社会。,199603533533200073,新加坡,2,199603,由“三个和尚没水喝”想到的……,90,90,77,76,91,422,B,
互相照顾、互相帮[B邦]忙，于是两个人就抬水喝。,199603533533200101,新加坡,2,199603,由“三个和尚没水喝”想到的……,85,70,55,47,51,299,未参加,
这一回，又遇到了另一位对手，往后[F後]的生活怎么过呢？,199604680519200520,马来西亚,2,199604,由“三个和尚没水喝”想到的……,80,75,63,42,61,312,C,
在几乎忍不住渴{CC2渴症}的情况下，这座庙里来得最早的和尚建议说[BQ：]“我是这座庙里来得最早的和尚，你们来到这里以前，我每天亲自去山下抬水，所以比{CJX}我来{CQ得}晚的你们辛苦得{CJ+zy更}多，[BC。]你们应该尊重我这位和尚，对不对？,199605104523100016,韩国,1,199605,由“三个和尚没水喝”想到的……,75,60,63,60,56,300,C,
他们之间没有利他主义思想{CC心理}。,199605104523200079,韩国,2,199605,由“三个和尚没水喝”想到的……,70,60,63,63,56,297,C,
他一看{CJ-zy就}非常喜欢她，要求她每天{CQ在}这山底见面。,199605104525200091,日本,2,199605,由“三个和尚没水喝”想到的……,70,65,55,58,68,302,C,
那里的环境{CC地欧}很安静，只听见鸟叫、[BC，]风吹声，真舒服{CQ真}凉[B谅]快。,199605104922200100,美国,2,199605,由“三个和尚没水喝”想到的……,90,50,41,45,49,263,未参加,
以后他们轮班去远远的地方挑水。,199605104525200137,日本,2,199605,由“三个和尚没水喝”想到的……,65,70,83,58,75,337,C,
我想，不论是一家企业、[BC，]社[B设]会团体还是一群[B君]朋友，为了达到这伙人的目的，为了满足全体的利益，必须达成{CC达到}共识，牺牲一部分个人的利益，[BC。]这样才{CJX}全部人能获利。,199605104608100141,波兰,1,199605,由“三个和尚没水喝”想到的……,80,55,83,67,58,329,C,
我们人类，中国也好，外国也好，都存在这个问题。,199605104801200167,澳大利亚,2,199605,由“三个和尚没水喝”想到的……,90,70,63,51,61,328,C,
这段短文还反映了人们在社会上的消极的方面。,199605104523200187,韩国,2,199605,由“三个和尚没水喝”想到的……,65,55,88,56,72,318,C,
大家[C]吵{CC噪}了半天，后来水没有{CQ了}，他们都不能[C]喝了。,199605104540200201,印度尼西亚,2,199605,由“三个和尚没水喝”想到的……,70,60,69,42,46,272,未参加,
可是我不大同意[C]这观点{CC意[C]见}。,199605104525200215,日本,2,199605,由“三个和尚没水喝”想到的……,80,75,52,72,72,342,C,
”然后又来了第三个和尚，他也挑水{CD就}喝了，对他们说[BD，]：“非常好喝啊，非常凉[C]快。,199605104525200241,日本,2,199605,由“三个和尚没水喝”想到的……,50,55,46,49,63,242,未参加,
李一着急[C]，怎么办，水快要完了。,199605104525200241,日本,2,199605,由“三个和尚没水喝”想到的……,50,55,46,49,63,242,未参加,
我在这儿提[C]意[C]见，作[B做]一个规定，这样大家{CJ-zy才}平等。,199605104525200266,日本,2,199605,由“三个和尚没水喝”想到的……,65,60,66,51,37,262,未参加,
因为如果自己不去挑水，也可以别人挑来的水喝{CJX}，[BC。]并且有别人{CJ-zxy的时候}[BQ，]{CD但}自己{CJ-zy还}去让其他人喝水，就觉得自己吃点亏。,199605104525200303,日本,2,199605,由“三个和尚没水喝”想到的……,65,65,41,58,68,281,未参加,
公寓里的居民就想{CD着}：不用担心，会有人去修理换[C]新的。,199605104542200312,越南,2,199605,由“三个和尚没水喝”想到的……,75,85,71,58,84,366,B,
两个人都认为这是为自己的生存{CC生命}应该做的事。,199605550523290030,韩国,2,199605,由“三个和尚没水喝”想到的……,65,60,69,42,63,282,未参加,
他们在老百姓面前说“你们[F們]要做好[C]{CJ-zxy事}才能去天堂”，“不能撒谎[C]”等等各种好听[F聼[C]]的话，可是他们三个人中谁也不肯{CC敢}去打水。[BC，],199605550523190062,韩国,1,199605,由“三个和尚没水喝”想到的……,60,55,60,79,63,298,未参加,
但我们面对{CC当面}这种自己会损失的情况时可不是这样。{CJ-zhuy我们},199605550523190065,韩国,1,199605,由“三个和尚没水喝”想到的……,70,80,52,60,68,320,C,
”两个和尚听了高兴地说[BQ：]“你的主意不错，可是我俩现在这么老了，[BC。]一天抬一个星期的水，真受不了。,199605550523190070,韩国,1,199605,由“三个和尚没水喝”想到的……,60,65,49,65,61,283,未参加,
总[F總]之，三个和尚没水喝是个简单的例子[BQ，]足以作为[F爲]一个警惕。,199605529529150163,泰国,1,199605,由“三个和尚没水喝”想到的……,65,95,60,60,77,348,C,
你不想学习的时候尽量玩得高兴吧！[BC，],199704123523200033,韩国,2,199704,记对我影响最大的一个人,65,85,65,54,53,312,C,
一开始就继续上四年级，那年学校举办了独唱比赛，我作为一个刚转校的新生，被音乐老师推荐{CC推举}，参加了比赛，还获了冠军，真是出乎意料。,200110540540250065,印度尼西亚,2,200110,我的童年,70,90,68,49,83,353,C,
我的童年使我早熟了，也使我能正确地对待后来碰到的各种各样的人生{CJ-zxy境况}。,200110540540250094,印度尼西亚,2,200110,我的童年,75,90,82,70,90,401,B,
祖上三代都是贫穷的教书匠。,200110540540150143,印度尼西亚,1,200110,我的童年,80,85,79,65,88,391,B,
本人因对女导游这份工作[BD，]深感兴趣，特此呈上一份履历表，工作经验，成绩等作详细的说明：姓名：×××年龄[F齡]：二十七岁性别：女程度：大学行政系毕[F畢]业语言：精通华语，英语，日语经验：无经验，但有信心把工作做好，外表：相貌端正，表达力强，有女性的温柔、贤淑，大方得体。,199312533533200007,新加坡,2,199312,一封求职信,80,80,62,67,64,345,B,
我也自认能够以我的三寸不烂之舌把旅客招待得服服贴贴[BQ，]因为我是一个可以和不同种类人都合作愉快的人。,199312533533200008,新加坡,2,199312,一封求职信,90,90,57,61,75,371,C,
敬执事李文先生获悉{CC2悉}贵旅游公司欲聘广告设计师，特此致函应聘，并希望给于面试机会。[BC.],199312533533200013,新加坡,2,199312,一封求职信,80,95,69,70,82,392,B,
次年，进入××旅行社担任行政助理，一年后擢升行政主管至今。,199312533533100022,新加坡,1,199312,一封求职信,95,85,83,83,96,440,A,
在此附上个人简历表一张。,199312533533200029,新加坡,2,199312,一封求职信,80,65,60,54,66,314,C,
如今，贵公司的招聘启事正给了我一个机会。,199312533533100067,新加坡,1,199312,一封求职信,95,80,74,74,96,415,B,
我对贵{CC本}公司特别感兴趣。,199312104523100003,韩国,1,199312,一封求职信,65,45,41,63,59,252,未参加,
在香港呆了一年的时间{CC之期间}，我不仅体会很丰富的经验而且学习先进旅游的规范。,199312104523100009,韩国,1,199312,一封求职信,55,55,50,72,68,280,未参加,
当导[C]游又是我的专业又是我的爱好。,199312124604100311,奥地利,1,199312,一封求职信,80,65,60,72,59,325,C,
请您相信我。,199312123525200402,日本,2,199312,一封求职信,70,65,69,48,48,287,C,
