错句,作文编码,国籍,性别,考试时间,作文题目,口试分数,作文分数,听力分数,阅读分数,综合分数,总分,证书
许多夫妻会因此而沮丧。,200103533533250010,新加坡,2,200103,我对离婚问题的看法,80,85,72,68,90,389,B,
每一个[F個]人都会经过{CQ富有}童心，想法纯[B頓]真，毫无[F無]烦[F煩]恼[L]的时[F時]代。,200109529529151002,泰国,1,200109,我的童年,85,65,50,30,66,285,未参加,
回想过来实在是内心有所愧疚，真对不起父母{CQ的}养育之恩。,200110540540150006,印度尼西亚,1,200110,我的童年,65,75,47,39,56,269,未参加,
每当[BD，]我去他家玩的时候，总看到小希的妈妈为小希做饭或讲故事给小希听时。,200110540540150011,印度尼西亚,1,200110,我的童年,75,90,66,44,63,332,C,
我的双亲出于[F於]对祖籍[B藉]文化的热[F熱]爱，把我送进了私立的「崇文小学」。,200110540540250014,印度尼西亚,2,200110,我的童年,75,90,74,75,92,400,B,
上课时，老师总喜欢当场提问题，考核我们是否把当天教授的课掌握了。,200111512512250003,菲律宾,2,200111,我的一个假期,80,95,87,75,98,430,B,
我唯有偷偷地瞒住家人把它[C]安顿在我家。,200103680519201606,马来西亚,2,200103,我的童年,85,85,64,70,74,373,B,
你们很了解我，也很了解我的情况，希望你们能给我提一些好意见。,200104124635200229,俄罗斯,2,200104,一封写给父母的信,70,70,63,58,65,314,C,
电话也没打，信也没写。,200104124635100402,俄罗斯,1,200104,一封写给父母的信,75,65,49,51,63,290,未参加,
妈妈您好！,200104124545100427,乌兹别克斯坦,1,200104,一封写给父母的信,65,80,60,44,70,307,C,
您不用担[B怛]心我的学校生活。,200105550523150031,韩国,1,200105,一封写给父母的信,65,65,44,25,42,225,未参加,
尽[B仅]管如此，正好这一次有机会给你们写信表达{CQ我}这一不孝之子的感情{CD了}。,200105550523150292,韩国,1,200105,一封写给父母的信,70,75,74,77,81,366,B,
这是为了自己，也为了对得起你们。,200105550523150297,韩国,1,200105,一封写给父母的信,70,70,71,56,63,318,C,
我们说：“怎么办？,200105550523250339,韩国,2,200105,一封写给父母的信,65,70,63,32,56,272,未参加,
但他家由于海拔稍微高{CQ一些}，白天头顶烈日，可晚上很凉爽，只有一条被子还不够暖和{CC2暖}。,200105209525200018,日本,2,200105,我的一个假期,70,65,80,79,83,363,C,
这次假期，虽然{CC因为}我一人晚上待在宽大的房间里，觉得时间很长，但我帮助了需要帮助的人，觉得很有意义。,200105209525200065,日本,2,200105,我的一个假期,90,90,77,51,79,385,C,
我在南斯拉夫的时候，最喜欢的{CD之中}是他们本地做饭{CQ的}方式[B试]。,200105209635100041,俄罗斯,1,200105,我的一个假期,75,75,52,35,37,264,未参加,
本来其次的目的竟带来了很多有意义的事。,200105201525200009,日本,2,200105,我的一个假期,70,85,80,70,90,387,B,
我在日本的时候，[BC。]因为工作很忙没有长期假期。,200105215525100008,日本,1,200105,我的一个假期,70,70,77,75,74,354,C,
可人多了，主意多问题也就多。,200105109529200478,泰国,2,200105,由“三个和尚没水喝”想到的……,85,75,70,64,79,365,B,
我们都知道这些东西都是有限的，我们继续保持现在的生活{CJ+zy就}这些东西{CJ+zy早}就{CQ会}没有了。,200105109525100705,日本,1,200105,由“三个和尚没水喝”想到的……,85,65,66,75,77,357,C,
意味着是{WWJ},200105109525100709,日本,1,200105,由“三个和尚没水喝”想到的……,65,50,54,51,53,254,未参加,
我们那里这些“领导”“管理”非常地少，[BC。]这是我们日本人的民族特色。,200105109525100726,日本,1,200105,由“三个和尚没水喝”想到的……,75,65,63,75,68,333,C,
因此他们从这个道理学会{CQ了}节约的精神。,200105109525200728,日本,2,200105,由“三个和尚没水喝”想到的……,65,55,52,53,66,273,未参加,
我小时候还可以理解{CC了解}，因为那时候父亲工作特别忙，很早上班去，很晚才能回家，而且母亲没有工作，当家庭主妇。,200105109525100790,日本,1,200105,由“三个和尚没水喝”想到的……,80,70,70,84,70,364,B,
第一，三个和尚中性格最软弱的一个[BD，]被强迫下山抬水，结果他为了在寺庙里继续生活而自已担任抬水任务。,200105109525100791,日本,1,200105,由“三个和尚没水喝”想到的……,75,80,68,69,88,371,B,
我想日本随着步入{CC走入}现代化，{CJ-zy已经}不知道{CD了}互相帮助的重要性，因为日本在经济发展的过程中建了很多高楼大厦，在那里住的人们非常自私，只顾自己的利益忘记了互相帮助的重要性和人与人之间的关系。,200105109525100815,日本,1,200105,由“三个和尚没水喝”想到的……,70,70,61,60,77,326,C,
在这个故事中出现的第一个和尚就是{CQ在}这样的心理[B里]中解决问题；[BC。]再如在一个地方只有两个人，并且有一件该做的事情，这时候那两个人怎么想呢？,200105109525100838,日本,1,200105,由“三个和尚没水喝”想到的……,70,65,70,55,73,319,C,
俗话说得好“有其父必有其子”，父母亲[F親]的教诲和指导[F導]当然是儿[F兒]女们的人生路途指南。,200203522522150006,缅甸,1,200203,记对我影响最大的一个人,70,75,69,70,35,308,未参加,
王老师是我小学四年级到六年级的华文老师。,200203533533250022,新加坡,2,200203,记对我影响最大的一个人,90,85,71,66,77,386,B,
近年来，我国把安乐死视为一种难题。,200205204525200047,日本,2,200205,如何看待“安乐死”,65,60,41,60,68,277,未参加,
这个问题没办法解决，我想。,200205204627100057,瑞士,1,200205,如何看待“安乐死”,65,60,24,38,58,228,未参加,
这样的话，以后没有像{CC1根据}文章那样的纷纠。,200205204525100076,日本,1,200205,如何看待“安乐死”,65,70,44,63,65,293,未参加,
那些{CC那个}专家{CC2专门家}应该尊重{CC遵敬}他们的意见。,200205204525200156,日本,2,200205,如何看待“安乐死”,65,75,44,79,70,320,未参加,
绝对不要看亲人吃苦的样子。,200205204525100187,日本,1,200205,如何看待“安乐死”,65,70,44,58,56,279,未参加,
例如，在短文中的妻子得的是一种不治之症，这样才可以进行安乐死。,200205209525200029,日本,2,200205,如何看待“安乐死”,80,85,88,76,89,412,B,
“安乐死”是否可以进行，我们要仔细研究。,200205209525200068,日本,2,200205,如何看待“安乐死”,75,75,35,70,61,306,未参加,
对我而言，我认为丈夫不应受到法律的制裁。,200205201529200182,泰国,2,200205,如何看待“安乐死”,80,80,77,51,63,343,C,
谁能感觉到自己的痛苦程度？,200205215525100026,日本,1,200205,如何看待“安乐死”,75,65,80,65,65,337,C,
他们应[B因]当去陪孩子们，去听听他们的心里话，看看能帮上什么忙。,200210801540150011,印度尼西亚,1,200210,如何解决“代沟”问题,70,65,53,69,50,293,C,
作为父母者更因为{CC以为}以前他们的父母是如此{CD的}教育他们，所以也要照着以前的教法来教导[F導]子女。,200210540540250013,印度尼西亚,2,200210,如何解决“代沟”问题,70,60,42,58,64,279,未参加,
天下哪有不爱子女的父母？,200210540540150069,印度尼西亚,1,200210,如何解决“代沟”问题,80,65,76,65,55,329,C,
我父母就这样管教{CC教管}我们三姐弟。,200210540540250077,印度尼西亚,2,200210,如何解决“代沟”问题,75,60,73,60,59,313,C,
感谢母亲[F親]的好{WWJ},200210540540250110,印度尼西亚,2,200210,如何解决“代沟”问题,65,60,26,45,50,229,未参加,
祝：安康！,200205680519250002,马来西亚,2,200205,一封写给父母的信,80,75,78,67,92,383,B,
槟城正当雨季，空气非常潮湿。,200205680519250017,马来西亚,2,200205,一封写给父母的信,90,85,81,77,92,422,B,
吉隆坡也常常下雨吧。,200205680519250017,马来西亚,2,200205,一封写给父母的信,90,85,81,77,92,422,B,
这本书里哈利还不太会用魔法。,200305533525250016,日本,2,200305,我最喜欢读的一本书,60,65,55,63,58,284,未参加,
还有武则天控制天下的故事十分令人恐惧，[BC、]但是我觉得她虽然是个霸[F覇]道天后、但她在历史上{CJ-sy是}非常能干的政治人物。,200305533525250030,日本,2,200305,我最喜欢读的一本书,60,65,49,56,72,285,未参加,
以前{CC从早}，中日之间有很密切的交流。,200304131525200102,日本,2,200304,我学汉语是为了……,60,60,74,52,82,310,未参加,
不然的话，在这个日益发展，烦恼繁多的现代社会中，一直想不开，甚至会伤害你的身体。,200305576525200010,日本,2,200305,静音环境对人体的危害,70,65,74,82,88,365,C,
所以，{CJ+sy有可能}没有人在他附[B付]近的话更危险。,200305576525100055,日本,1,200305,静音环境对人体的危害,60,60,47,54,57,260,未参加,
我吸了烟之后[BQ，]我身体上都有那一种很持续的味道{CC闻}，[BC。]牙也会变颜色了。,200405109633200975,意大利,2,200405,吸烟对个人健康和公众利益的影响,70,65,57,46,46,270,未参加,
一方面吸烟对身体有害。,200405204610200358,法国,2,200405,吸烟对个人健康和公众利益的影响,75,65,30,35,58,250,未参加,
烟气先由鼻{CQ进}入气管，再由气管进[F進]入肺[C]，导[F導]致肺[C]上沾有烟油而影响呼吸。,200405522522250004,缅甸,2,200405,吸烟对个人健康和公众利益的影响,75,95,74,74,99,411,B,
“吸[C]烟”看似潇洒，但和服慢性[C]自杀性的药差不多。,200405522522250012,缅甸,2,200405,吸烟对个人健康和公众利益的影响,85,95,74,70,75,395,B,
吸烟对人有害是众所周知的事。,200405209519100069,马来西亚,1,200405,吸烟对个人健康和公众利益的影响,95,95,85,84,88,446,A,
这样一来就造成了对公众利益的影响。,200405206922200008,美国,2,200405,吸烟对个人健康和公众利益的影响,85,90,71,70,81,393,B,
这才是利己，利人，利国家的明智之举。,200405215533230021,新加坡,2,200405,吸烟对个人健康和公众利益的影响,85,95,85,77,90,428,A,
后来孟子因这样的{CJ+zy母[C]亲}教育而成为中国古代中最有名的思想家之一。,200505109525100248,日本,1,200505,父母是孩子的第一任老师,55,65,53,59,64,278,未参加,
我认为我之所以受这么大的影响是因为我父母爱我，父母跟孩子在一起的时间越多，我受的影响也会越[D增]增加。,200505109525200295,日本,2,200505,父母是孩子的第一任老师,60,65,69,73,74,324,C,
十年后，这些{CC个}孩子{CD们}当了爸妈，他们会当孩子们的老师吗？,200505109525200405,日本,2,200505,父母是孩子的第一任老师,70,70,56,48,54,286,未参加,
我长大以后没有原来的坏毛病了，[BC。]因为我知道真正的痛苦。,200505109525101108,日本,1,200505,父母是孩子的第一任老师,90,80,62,64,64,355,C,
孩子们长大的根，我认为就在孩子们的小时候的生活里边，在社会上有用的人，做人，发挥自己的能力，各方面的成就、成功，都{CQ跟}这个父母[C]的教育关系{CD的}{CJy}。,200505217525100230,日本,1,200505,父母是孩子的第一任老师,60,65,44,51,56,259,未参加,
父亲的爱好是书法。,200505204525200014,日本,2,200505,父母是孩子的第一任老师,60,55,48,59,67,270,未参加,
我们要帮助妈妈！,200505204525200193,日本,2,200505,父母是孩子的第一任老师,75,70,46,69,69,318,C,
总之，对孩子来说，父母是{CD这}在成长的过程中最重要的{CJ+zxy东西}。,200505204525200326,日本,2,200505,父母是孩子的第一任老师,65,75,52,63,65,307,C,
母亲[C]五十岁的时候才[C]开始在初中学校工作，我也{CQ在}快要四十岁的两年[C]前决定去中国留学学习汉语。,200505204525200368,日本,2,200505,父母是孩子的第一任老师,70,65,58,53,61,293,C,
我个人认为父母是孩子的第一任老师。,200505204525200469,日本,2,200505,父母是孩子的第一任老师,65,60,41,51,36,236,未参加,
比如说，孩子在习得语言时很容易受到父母的影响。,200505204525100485,日本,1,200505,父母是孩子的第一任老师,65,60,54,51,65,278,未参加,
所以父母给孩子的影响是最深的，而且父母是世界上唯一{CC2只有一个人}的。,200505204525100517,日本,1,200505,父母是孩子的第一任老师,75,55,54,51,69,289,未参加,
我以前以为对父亲来说工作比家庭重要。,200505204525200503,日本,2,200505,父母是孩子的第一任老师,60,75,58,73,74,326,C,
可是，父母对孩子成长的影响{CJX}还是最大。,200505204525100534,日本,1,200505,父母是孩子的第一任老师,65,65,52,45,69,280,未参加,
孩子是看父母成长[F長]的。,200505204525200587,日本,2,200505,父母是孩子的第一任老师,45,70,46,53,52,248,未参加,
但那一次却是个特别的假期。,200105205922200033,美国,2,200105,我的一个假期,70,70,77,58,68,331,C,
但今次回港最难[F難]忘的，还[F還]是能和久别了的亲[F親]人重逢。,200110602801150006,澳大利亚,1,200110,我的一个假期,75,85,80,75,98,406,B,
“如何面对挫折”——这是个很难回答的{CD一个}问题。,200112576525200019,日本,2,200112,如何面对挫折,75,80,65,77,72,360,B,
怎么办呢？,200105271525200003,日本,2,200105,我的一个假期,65,75,55,56,72,310,C,
最近在日本大学生当中流行着国外旅游。,200105271525100029,日本,1,200105,我的一个假期,80,75,67,79,94,386,B,
假期，我以前认为假期{CJ+sy是}{CJX}只不过是休息的时间而已。,200105271525100080,日本,1,200105,我的一个假期,65,60,44,46,50,248,未参加,
、[BC，]寒假{CD期间}都在日本度过{CC渡过}。P},200105204525200023,日本,2,200105,我的一个假期,60,65,60,49,46,263,未参加,
因为我已经开始了长期{CJX}{CQ在}中国留学，所以我像以前那样不能{CJX}经常和他们见面。,200105204525100057,日本,1,200105,我的一个假期,60,55,47,35,57,235,未参加,
我正在考试呢。,200105550523250064,韩国,2,200105,一封写给父母的信,65,65,58,65,72,309,C,
好了，我说到这吧。,200105550523250064,韩国,2,200105,一封写给父母的信,65,65,58,65,72,309,C,
请原凉。,200105550523150118,韩国,1,200105,一封写给父母的信,70,75,71,56,67,328,C,
亲爱的妈妈：岁月真不饶[B绕]人。,200105550523250140,韩国,2,200105,一封写给父母的信,75,75,79,63,70,352,B,
我最小{CC少}的女儿已经二十四岁了。,200105550523250162,韩国,2,200105,一封写给父母的信,70,75,49,61,72,316,C,
这件事对我而言永远忘不了的。,200105550523250189,韩国,2,200105,一封写给父母的信,65,70,58,58,54,291,C,
现在我们俩相处得{CC的}很好。,200105550523150204,韩国,1,200105,一封写给父母的信,70,75,68,42,72,316,C,
只得向前面的女同学求救，我刚到台湾不久，中文还不太灵光。,200105550523150209,韩国,1,200105,一封写给父母的信,65,75,66,28,56,277,未参加,
因此，上大学后一直离家生活。,200105550523150211,韩国,1,200105,一封写给父母的信,65,70,49,56,63,289,C,
那天我没跟你们在一起，您们也应该不高兴了吧？,200105550523250210,韩国,2,200105,一封写给父母的信,80,70,52,56,67,315,C,
你们相信我吧。,200105550523250220,韩国,2,200105,一封写给父母的信,70,65,44,35,63,263,未参加,
因此，最近自己感到的压力太大，可是您们两位不用担心，您们的儿子是比别的小伙子更有能力，更有实力的。,200105550523150227,韩国,1,200105,一封写给父母的信,70,65,47,58,58,284,C,
这女儿一直觉得很对不起。,200105550523250228,韩国,2,200105,一封写给父母的信,70,65,52,61,65,299,C,
2001年5月12日女儿,200105550523250230,韩国,2,200105,一封写给父母的信,65,65,44,54,61,273,未参加,
而且你们不爱她吗？,200105550523150235,韩国,1,200105,一封写给父母的信,65,70,41,54,70,286,未参加,
我一直到现在没孝顺{CQ过}{CJ-by你们}，我年纪大了[BQ，]到现在才懂事了。,200105550523250253,韩国,2,200105,一封写给父母的信,65,65,58,51,58,281,C,
请身体{CJX}保重。,200105550523250258,韩国,2,200105,一封写给父母的信,70,70,55,42,74,299,未参加,
但是我还没找到工作，所以你们很担心。,200105550523250264,韩国,2,200105,一封写给父母的信,70,75,60,44,58,296,C,
可我从这时开始使用我的全心全意学习翻译专业{CC学业}。,200105550523150267,韩国,1,200105,一封写给父母的信,65,75,44,25,51,247,未参加,
我当他们的老师看起来合适吧！,200105550523250285,韩国,2,200105,一封写给父母的信,70,65,55,49,61,286,未参加,
多亏妈妈{CJ+zxy的辛苦}，我们到现在这么健康、[BC，]幸[B辛]福。,200105550523250388,韩国,2,200105,一封写给父母的信,70,70,52,63,58,301,C,
尊敬的爸爸、妈妈：爸爸、妈妈，我是你们的大女儿。,200105550523250399,韩国,2,200105,一封写给父母的信,70,80,74,70,79,363,B,
只要坐[B座]飞机{CD得}三至四[B西]小时，就到达汉城[BQ。]可以看见{CC遇见}家人。,200105550523250400,韩国,2,200105,一封写给父母的信,70,70,49,51,61,289,未参加,
我觉得昨天晚上我睡的时候{CC3中}爸爸给我打电话，我接了。,200105550523250424,韩国,2,200105,一封写给父母的信,70,60,41,42,38,236,未参加,
我已经把所有的入境手续和入学手续办好了，你们可以放心{CQ了}。,200105550523150497,韩国,1,200105,一封写给父母的信,70,75,60,56,65,315,C,
她把新被子给我盖好，还关心地问我“××，你不冷吗？,200105206525200001,日本,2,200105,我的一个假期,70,85,87,63,76,373,C,
时间不早了。,200105550523250513,韩国,2,200105,一封写给父母的信,70,80,47,49,63,299,未参加,
因为不仅是日本，韩国也有排斥{CC排除}外国人的看法。,200105206525200003,日本,2,200105,我的一个假期,75,80,62,58,61,327,C,
我到{CC来}北京机场后，就去我妈的中国朋友家。,200105206525100019,日本,1,200105,我的一个假期,70,70,44,51,57,280,未参加,
这个故事表现{CQ了}我们的一种心理状态，如果我们有一项可以不做的事，我们{CQ就}不想做，可是如果不做，有关自己的生命的话，我们{CQ就}一定会做那个事。,200105109525100205,日本,1,200105,由“三个和尚没水喝”想到的……,65,60,45,71,61,285,未参加,
原因[B困]不是因[B困]为他真的渴，而是因[B困]为他不想落[B洛]后，这种现象表明了什么？,200105109922100303,美国,1,200105,由“三个和尚没水喝”想到的……,65,50,54,42,59,251,未参加,
不过又一个和尚来后，如果新来的和尚到山底下挑水的话，自己可以避免麻烦，而且可以喝水。,200105109525100369,日本,1,200105,由“三个和尚没水喝”想到的……,60,60,43,55,55,255,未参加,
”我听了父亲的话，感到很有道理。,200105109525200384,日本,2,200105,由“三个和尚没水喝”想到的……,75,75,75,64,84,363,B,
咱们边走边吃梅解渴吧！[BD！],200105109525100432,日本,1,200105,由“三个和尚没水喝”想到的……,70,65,54,69,73,317,C,
我们招[B昭]聘一个青年人，让他去山下抬水。,200105109525200509,日本,2,200105,由“三个和尚没水喝”想到的……,65,60,52,60,73,293,未参加,
为了社会的发展[BD，]{CQ和}良好的人际关系，我们应该从这个故事接受教训{CJgd}。,200105109525200522,日本,2,200105,由“三个和尚没水喝”想到的……,60,65,66,73,77,324,C,
人当然不都是君子。,200105109525100524,日本,1,200105,由“三个和尚没水喝”想到的……,70,75,79,77,91,381,B,
于是大家一起去山下找了找{CC找一找}。,200105109525200690,日本,2,200105,由“三个和尚没水喝”想到的……,65,60,50,60,53,271,未参加,
人是具有社会性的。,200105109525200753,日本,2,200105,由“三个和尚没水喝”想到的……,70,70,73,69,77,347,C,
我认为“安乐死”不应该受到法律的制裁。,200205217525200021,日本,2,200205,如何看待“安乐死”,70,80,58,74,77,349,C,
我不太懂法律，所以不知道{CJ-zhuy那个丈夫}应该不应该受法律的制裁。,200205217525100092,日本,1,200205,如何看待“安乐死”,70,75,71,63,82,350,C,
她的出发点是爱，所以从这个角度来看，选择“安乐死”不是错的。,200205205533200006,新加坡,2,200205,如何看待“安乐死”,75,65,63,58,75,323,C,
我不想别人跟短文里的丈夫一样麻烦{CJy}。,200205206525200025,日本,2,200205,如何看待“安乐死”,65,65,44,45,49,252,未参加,
因为父母与子女的成长背景不一样，他们成长的时候社会、经济、政治、教育环境都不同。,200209550523250005,韩国,2,200209,如何解决“代沟”问题,75,70,78,79,72,363,B,
因为我们都是不同{CJxw}，所以想法、生活方式也不同。,200209550523250138,韩国,2,200209,如何解决“代沟”问题,65,65,33,54,40,241,未参加,
最重要的是[B事]亲人{CC亲情}，没有他们，我们就不{CD能}存在，我们都记住这[C]一点吧！,200209550523250158,韩国,2,200209,如何解决“代沟”问题,65,65,66,57,72,309,C,
我[C][BD，]已经长大了，现在还没结婚{CJ+buy了}。[BC，],200209550523250209,韩国,2,200209,如何解决“代沟”问题,65,60,66,64,50,288,C,
而且{CQ要}互相关心和爱{CC1爱情}。,200209550523250232,韩国,2,200209,如何解决“代沟”问题,65,65,75,69,54,312,C,
互相说明自己的想法，这更有助于互相交流[C]。,200209550523250276,韩国,2,200209,如何解决“代沟”问题,65,70,57,71,66,315,C,
然后，需要的是找两代人共同的兴趣。[BC.],200209550523150316,韩国,1,200209,如何解决“代沟”问题,65,70,54,64,50,289,C,
他们一般来说，保守性很强。,200209550523150317,韩国,1,200209,如何解决“代沟”问题,70,65,51,54,48,274,未参加,
到了周末[B未]去旅游或者[B着]一起去运动等。,200209550523250429,韩国,2,200209,如何解决“代沟”问题,65,65,45,40,36,235,未参加,
过去两[C]代人之间的代沟问题不大。,200209550523250840,韩国,2,200209,如何解决“代沟”问题,65,65,60,59,60,293,C,
第二，子女们[F們]想做[B作]什么[F麼]，父母们[F們]要答应[F應]子女们[F們]想做[B作]的东[F東]西。,200209550523150858,韩国,1,200209,如何解决“代沟”问题,65,65,45,57,44,260,未参加,
长辈不努力了解晚辈，就说今天的晚辈不听话，难以管教。,200209550523250894,韩国,2,200209,如何解决“代沟”问题,70,60,51,81,54,301,未参加,
既然早晚都要死，为何不早点解脱痛苦，带着微笑升上天堂呢？,200210600919225001,加拿大,2,200210,如何看待“安乐死”,90,90,84,82,82,426,A,
如果病人自己还有能力自己决定自己的人生的话，那自己{CC自分}决定的事别人不能干预。,200205271525100075,日本,1,200205,如何看待“安乐死”,80,75,55,60,80,341,C,
因为，现代社会是法制社会，如果没有法，那其后果不堪设想；同时，我们做为人，不谈情也是不应该的，或者[L]说根本不可能的。,200205271525100079,日本,1,200205,如何看待“安乐死”,90,95,88,88,99,458,A,
那时[B是]，我马上告诉妈妈。,200304522522250011,缅甸,2,200304,静音环境对人体的危害,70,65,45,39,54,259,未参加,
噪音对于[F於]人类来说，的确[F確]危害到健康，所以人们需要宁静的生活环境。,200304522522150023,缅甸,1,200304,静音环境对人体的危害,65,90,59,67,87,359,C,
人口日益增多的当今世界，许多人对环境噪声已感到厌恶了。,200304522522110012,缅甸,1,200304,静音环境对人体的危害,65,85,26,57,74,297,未参加,
要{CC于[F於]}我来想要{CQ如何}解决这[F這]个问题呢？,200306684542200003,越南,2,200306,口香糖与环境卫生,70,70,15,21,43,207,未参加,
还要提出如果某人乱吐口香糖{CC香口糖}，除了罚钱[F錢]以外{CC以后}还要求他清理乱吐的口香糖{CC香口糖}。,200306684542200003,越南,2,200306,口香糖与环境卫生,70,70,15,21,43,207,未参加,
但是“绿色食品”也{CJX}{CD是}对于人类来说是必须{CC必需}要考虑的一个问题。,200307109525100119,日本,1,200307,绿色食品与饥饿,85,90,75,62,87,395,B,
到目前为止，一般满足生活的基本要求后，才注意{CC认出}环境的污染。,200307109523200125,韩国,2,200307,绿色食品与饥饿,65,70,70,62,79,332,C,
为了几亿人的生存[BQ，]人们要生产{CC研究}更快地{CC的}{CJX}更多的粮食。,200307109523200161,韩国,2,200307,绿色食品与饥饿,60,60,56,41,50,249,未参加,
世界上既有[BQ“]绿色食品[BQ”]又没有饥饿{CC挨饿}{CJ-zxy的现象}，如果{CJ+sy实现}有这[C]样的世界[BD，]多好！,200307109525200162,日本,2,200307,绿色食品与饥饿,60,65,78,67,76,329,C,
而现在世界上还有几亿人因缺少粮食而挨饿。[BC.],200307109523100168,韩国,1,200307,绿色食品与饥饿,60,40,22,17,12,128,未参加,
我觉得更重要{CQ的}是保护环境。,200307109523200171,韩国,2,200307,绿色食品与饥饿,60,55,62,46,47,251,未参加,
对挨饿的人们来说是想也[B他]想不到的。P},200307109523200302,韩国,2,200307,绿色食品与饥饿,65,65,80,70,73,337,C,
这个{CD的}意思是，先需要适当{CC合当}的安[B按]排。,200307109523200387,韩国,2,200307,绿色食品与饥饿,65,65,48,51,50,263,未参加,
