错句,作文编码,国籍,性别,考试时间,作文题目,口试分数,作文分数,听力分数,阅读分数,综合分数,总分,证书
在我朦胧的记忆[D录]中，{CJ-zhuy我}清晰地理解{CC看见}{CQ了}父母在我小时候教我的格言：胜者淡然，败者坦然。,200505109510200529,朝鲜,2,200505,父母是孩子的第一任老师,85,95,74,79,72,401,A,
孩子从小[C]通过和父母一起过的日常生活，一直看父母的样子。,200505109525100638,日本,1,200505,父母是孩子的第一任老师,75,75,60,67,56,323,C,
因为父母[C]教我们很多的东[C]西[C]。,200505109525100764,日本,1,200505,父母是孩子的第一任老师,55,70,20,35,33,197,未参加,
父母应该教孩子，保持稳[C]定的心情的重要性，勇敢地面对困难的重要性。,200505109525200865,日本,2,200505,父母是孩子的第一任老师,65,85,66,65,87,358,C,
地铁上人山人海，不过幸好有座位，所以我们坐着看书。,200505109525200909,日本,2,200505,父母是孩子的第一任老师,60,80,74,74,74,349,C,
千万不要轻视教育和教养，他们的想法、行为、对人生的观点、对别人的态度，对生活的理解都是{CD对}孩子{CQ的}榜[P]bàng样[B羊]。,200505109623200924,南斯拉夫,2,200505,父母是孩子的第一任老师,70,65,52,47,59,279,未参加,
我想可能这是跟[C]父母对我所希望他们要求的[C]反映有关系{CJ？}。,200505109525101130,日本,1,200505,父母是孩子的第一任老师,85,60,60,68,78,339,C,
我的父亲爱发脾气，一发就是没完没了。,200505109523201266,韩国,2,200505,父母是孩子的第一任老师,55,75,57,39,52,263,未参加,
俄罗斯著名作者[C]扎尔斯坦曾经说道[C]：“爱情是在人类生活中既最高又唯[C]一的规则，人类是通[C]过[C]父母学会这[C]条规则的。,200505109525101284,日本,1,200505,父母是孩子的第一任老师,65,60,53,45,62,268,未参加,
孩子一直看父母的行为。,200505109525201366,日本,2,200505,父母是孩子的第一任老师,70,65,57,43,55,276,未参加,
从出生到上学以前，孩子在家庭的时间最长{WWJ},200505109525102151,日本,1,200505,父母是孩子的第一任老师,60,45,39,65,58,245,未参加,
有一天我跟妈妈出去走走，我们发现马路上有一个人。,200505109525202272,日本,2,200505,父母是孩子的第一任老师,80,55,61,61,52,295,C,
看那个人的行[C]为、思想可以知道他小时候受到什么样的教育。,200505109525202349,日本,2,200505,父母是孩子的第一任老师,60,60,39,47,48,236,未参加,
另外，我[C]们在成[C]长的过[C]程中，还认识不少父母以外的老师，他们的影响也很大。,200505109525102428,日本,1,200505,父母是孩子的第一任老师,90,70,71,75,87,386,B,
因为我在国外生活{CD着}，十分了解[C]英语的重要性。,200505109525102436,日本,1,200505,父母是孩子的第一任老师,60,55,48,35,58,237,未参加,
所有的人应该注意日常生活，[BC！]好好儿照顾孩子吧！,200505109525202421,日本,2,200505,父母是孩子的第一任老师,60,80,50,77,78,332,未参加,
这方面我们应该严格教育。,200505109525202473,日本,2,200505,父母是孩子的第一任老师,60,50,48,59,63,260,未参加,
那么，每一个作父母应该考虑一个问[B间]题：“我的孩子的老师是谁？,200505109922102567,美国,1,200505,父母是孩子的第一任老师,85,75,48,47,45,292,未参加,
因此，很多老年人在回忆以往的日子时{CC里}，仍会回想到青年时期{CD中}父母曾经指导的话。,200505204922200401,美国,2,200505,父母是孩子的第一任老师,85,55,46,45,67,285,未参加,
孩子跌倒了，可母亲不去扶他而是告诉他要站起来。,200505205519200054,马来西亚,2,200505,父母是孩子的第一任老师,95,85,86,75,91,430,A,
人不是常说“因相知、而相爱”吗？[BC！],200505522522210007,缅甸,2,200505,最理想的结交方式,65,70,77,73,86,357,C,
{CP以后[F後]要一起生活的、[BC，]一起走进婚姻殿堂的一对男女，我想从[F從]小一起长[F長]大的玩伴比较[F較]好，P}不知别人怎样想，我觉得那种相识是最理想的。,200505522522210016,缅甸,2,200505,最理想的结交方式,55,70,39,29,39,216,未参加,
“[BC《]父母是孩子的第一任老师”[BC》]在社会上也是一个热门{CC2热}的话题。,200505209542200106,越南,2,200505,父母是孩子的第一任老师,75,75,35,43,43,261,未参加,
总体而言，我完全同意父母是孩子的第一任老师这句话。,200505302635200282,俄罗斯,2,200505,父母是孩子的第一任老师,70,65,58,59,56,294,C,
也要看那孩子运[F運]气[F氣]好不好吧！,200505226939100080,巴西,1,200505,父母是孩子的第一任老师,40,65,67,51,56,257,未参加,
因此，其现在规定不能在{CD许多}人稠广众之地吸烟。,200509105922200007,美国,2,200509,吸烟对个人健康和公众利益的影响,80,75,55,40,46,287,未参加,
我公司有主办[C]{CQ过}中国游、香港、欧洲之游等{CJy}，[BC、]每次我都有跟团一齐出发到不同的国家{CJy}，[BC、]所以我对不同国家的名胜景点了如指掌{CC了[F瞭]如手掌}，[BC、]{CQ对}历史背影、文物[BD、]认识颇[B破]深，[BC、]酒店、知名{CC名食}小吃，我也知道不少，可以{CC2可}说经验丰富。,200509534533250016,新加坡,2,200509,一封求职信,50,60,45,53,32,220,未参加,
尊敬的李文先生：你好！,200509534533250029,新加坡,2,200509,一封求职信,75,85,66,69,88,376,B,
希望您能给我这个机会为贵公司服务，{CD则}感激不尽。,200509534533250037,新加坡,2,200509,一封求职信,75,75,75,64,70,349,B,
近日于[F於]报纸上看见贵公司招聘启事，我对于[F於]贵公司之经理一职很感兴趣。,200509534922250070,美国,2,200509,一封求职信,65,70,70,62,82,335,C,
我会把我所懂的知识以轻松有趣的方式表达给贵公司的游客。[BC，],200509534533250079,新加坡,2,200509,一封求职信,60,80,70,62,82,341,C,
本人也很喜欢旅游。,200509534533250094,新加坡,2,200509,一封求职信,80,90,84,64,91,404,B,
由于我喜欢与[B于]其他人沟[B构]通，我应该能胜任成为[L]一个亲切的导游，让{CC认}大家专心志致地听我说各地的历史。,200509534533250125,新加坡,2,200509,一封求职信,55,70,79,75,75,338,C,
我希望贵公司能考虑我的应聘。,200509534533250136,新加坡,2,200509,一封求职信,75,70,88,66,84,372,B,
我也喜欢{CQ用}讲话说笑[BD，]来娱乐旅客们。,200509534533250153,新加坡,2,200509,一封求职信,75,70,75,69,84,362,B,
我在1975年出世。,200509534533150170,新加坡,1,200509,一封求职信,70,75,59,58,97,348,C,
敬候佳音！,200509534533250168,新加坡,2,200509,一封求职信,70,75,86,71,88,379,B,
我相貌端正，本身也喜欢到处旅游，赏尽各地的{CJ+dy异国}风情。,200509534533250188,新加坡,2,200509,一封求职信,0,65,77,55,91,281,未参加,
所以我觉得流行歌曲是{CQ在}{CJX}各个世代有区别，都{CC还[C]有}不一样。,200510111523100784,韩国,1,200510,我看流行歌曲,55,60,35,40,42,213,未参加,
比如，在韩国每个年代流行的歌曲是关于老百姓[B性]的生活状态的歌曲，比如，《[BC“]妈妈，给我买饭。,200510111523200856,韩国,2,200510,我看流行歌曲,65,60,44,36,57,245,未参加,
我喜欢[B观]流行歌曲，[BC.]但我喜欢[B观]的不是歌手而是他的歌曲和歌词。[BC.],200510111523100862,韩国,1,200510,我看流行歌曲,70,75,63,54,77,328,C,
第二是音乐性的问题。,200510111523201044,韩国,2,200510,我看流行歌曲,60,70,58,42,57,272,未参加,
虽然大人不爱听流行歌曲，可是为了理解年轻人应该多听流行歌曲。,200510111523201050,韩国,2,200510,我看流行歌曲,60,75,70,50,64,305,未参加,
这样{CJ-zhuy我}觉得我的心情好多了。,200510111523201571,韩国,2,200510,我看流行歌曲,65,60,58,46,40,252,未参加,
那我们怎么看流行歌曲呢？,200510111523201588,韩国,2,200510,我看流行歌曲,60,65,46,44,50,248,未参加,
《听海》的歌词让我激动，而且音律也很好听，一去卡拉[B泣]OK就唱那首歌儿。,200510111523201591,韩国,2,200510,我看流行歌曲,70,70,53,56,77,314,C,
我来中国以后更喜欢了{CJX}那些流行歌曲。,200510111523201875,韩国,2,200510,我看流行歌曲,60,55,56,34,37,223,未参加,
以前韩国的流行歌曲让离家出走{CC4家出}的高中学生回家了。,200510111523201877,韩国,2,200510,我看流行歌曲,50,50,42,32,42,194,未参加,
即使父母经常说赃话，孩子们还是会习惯这个语言环境[BQ，]然后进行模仿。,200510919501250027,中国,2,200510,父母是孩子的第一任老师,85,95,92,85,94,447,A,
每个人都有自己的长处{CC好处}和短处{CC坏处}。,200510520520250002,蒙古国,2,200510,我看流行歌曲,65,80,51,40,47,271,未参加,
比如说，我[C]国现在大多数的女学生都喜欢一个歌星，[BC。]所以为了看他唱歌，女学生们差不多两天以上在演场的入口等他{CJX}，[BC。]所以很多女学生去病院就住院{CJ？}。,200510302523100025,韩国,1,200510,我看流行歌曲,55,60,56,40,50,242,未参加,
还有，有些歌手们在唱歌的时候竟然会在歌[B各]词{CQ中}无缘无故插上几句脏话，这也使听者皱起了眉头。,200510302523200027,韩国,2,200510,我看流行歌曲,85,95,72,71,87,406,B,
我会用流行歌曲，向{CC给}别人表达我的心，所以我很喜欢流行歌曲。,200510302523200038,韩国,2,200510,我看流行歌曲,70,65,53,50,72,296,未参加,
随着社会的发展{CC2发}经济水平的提高{CC2高}，很多人重视自己的爱好，而且在他们的爱好中听音乐、[BC，]听歌曲是非常普遍的一种爱好{CJZR}[BQ，]但是他们听的歌曲{CJ+sy是}一般都是流行歌曲。,200510302523100041,韩国,1,200510,我看流行歌曲,65,60,51,59,62,280,未参加,
流行歌曲总是有非常多的听众。,200510302523200060,韩国,2,200510,我看流行歌曲,75,60,44,42,32,239,未参加,
原因有以下几点：第一，[BC。]流行歌曲内容的问题。,200510302523100097,韩国,1,200510,我看流行歌曲,70,65,42,44,69,276,未参加,
我认为音乐[C]歌曲应该{CJ-sy是}大家可以听{CJ+buy到}的歌曲才是好{CJxw}，就像[B象]一篇诗一样。,200510302523200124,韩国,2,200510,我看流行歌曲,65,75,51,46,67,291,未参加,
特别是在年轻人[L]{CQ中}受欢迎。,200510302523200135,韩国,2,200510,我看流行歌曲,65,70,51,40,74,286,未参加,
但是我呢？,200510302523200139,韩国,2,200510,我看流行歌曲,70,60,37,40,50,242,未参加,
但也有很多人不喜欢流行歌曲{CD的人}。,200510302523200167,韩国,2,200510,我看流行歌曲,70,80,49,34,52,275,未参加,
那时候韩国明星在中国非常受欢迎，[BC。]因此很多同学喜欢韩国歌曲，[BC。]让我唱韩国歌给他们唱，我唱完后顺便把我学的《甜蜜蜜》也唱了。,200510302523200200,韩国,2,200510,我看流行歌曲,75,65,74,63,74,338,C,
我今年21岁。,200510540540200005,印度尼西亚,2,200510,我看流行歌曲,65,80,49,48,62,292,未参加,
有的流行歌曲是快节奏，像那些RSB的歌曲，让人听了就想舞起来，可以边听边舞，或{CD许}边唱边舞。,200510540540200040,印度尼西亚,2,200510,我看流行歌曲,70,80,53,40,57,290,未参加,
怎么才能当别人的朋友呢？,200505684542200005,越南,2,200505,最理想的结交方式,75,80,63,64,48,321,C,
也因为[F為]如此，父母的兴趣和爱好，思想和观[F觀]念，行为[F為]和举[F舉]止，都是正在牙牙学[F學]语[F語]的孩子们[F們]唯一能学习和效仿{CJ-zxy的对象}。,200509602801250006,澳大利亚,2,200509,父母是孩子的第一任老师,80,70,80,88,84,392,B,
父母永远[F遠]是那么[F麼]无私地{CC的}付出，期望自己的孩子能成器。,200509602801250011,澳大利亚,2,200509,父母是孩子的第一任老师,0,75,88,81,84,324,未参加,
我认为父母的确[B却]是孩子的第一任老师。,200509602801250014,澳大利亚,2,200509,父母是孩子的第一任老师,65,75,85,58,77,347,C,
妈妈，春天来了，那儿{CJ-zxy的春天}也来了吧。,200104124523200075,韩国,2,200104,一封写给父母的信,75,70,63,58,47,302,C,
我很想见你们。,200104124523200176,韩国,2,200104,一封写给父母的信,75,60,14,21,33,189,未参加,
在印尼怎么样？,200104124540200175,印度尼西亚,2,200104,一封写给父母的信,60,60,27,25,24,178,未参加,
时间过得很快。,200104124523200226,韩国,2,200104,一封写给父母的信,70,70,52,35,49,264,未参加,
还有，快要到妈妈的生日{CQ了}。,200104124523200226,韩国,2,200104,一封写给父母的信,70,70,52,35,49,264,未参加,
我好不容易到了北京，在这呆[B带]了已经{CJX}好几{CC不少}年了。[BC，],200104124523200272,韩国,2,200104,一封写给父母的信,65,70,36,23,49,229,未参加,
您最近过得怎么样？,200104124525200281,日本,2,200104,一封写给父母的信,70,60,41,44,56,256,未参加,
我已经很长时间没有收到你{CQ们}写给我的信{CQ了}，所以我现在很着急。,200104124547100295,哈萨克斯坦,1,200104,一封写给父母的信,70,70,36,30,33,227,未参加,
再见。,200104124525100364,日本,1,200104,一封写给父母的信,75,80,52,51,56,305,未参加,
为了准备下一次高级和初中级汉语水平考试，{CJ-zhuy我}每天{CQ从早}到晚一直努力学习。,200104124525100413,日本,1,200104,一封写给父母的信,60,55,47,47,56,246,未参加,
还有你们也会来{CD到}这儿看我，而且来{CD到}中国旅游。,200104124523100457,韩国,1,200104,一封写给父母的信,70,85,49,61,51,308,C,
一九七二年本人被录取了{CJX}小、中学校。,199200008636100019,乌克兰,1,199200,一封求职信,,,0,0,0,0,未参加,
如果法律在人们生活上有障碍的话，{CD该}法律应该被改变。,199604123523100302,韩国,1,199604,如何看待“安乐死”,60,60,58,59,42,261,未参加,
自己虽然觉得痛苦，但不能做这样的{CJ-zxy事}。,199604123523200353,韩国,2,199604,如何看待“安乐死”,55,60,40,37,60,233,未参加,
有些宗[B综]教不让人们自杀。,199604123635100239,俄罗斯,1,199604,如何看待“安乐死”,65,55,19,35,31,187,未参加,
我们应该改变法律吗？,199604124529100259,泰国,1,199604,如何看待“安乐死”,70,65,32,27,52,231,未参加,
这样我认[B让]为只要病人本身愿[B原]意断[B继]绝自己的生命，而且{CC2而}他在一种非常痛苦难受的情况下，并[F並]且一点生机也没有。,199604123512100261,菲律宾,1,199604,如何看待“安乐死”,70,60,56,49,60,279,未参加,
“安乐死”这个问题来说的话很难说，[BC.]因为人们的看[C]法是各种各样的，[BC.]所以我也说起来很难。[BC.],199604123523100231,韩国,1,199604,如何看待“安乐死”,65,60,37,39,42,226,未参加,
我如何看待“安乐死”。,199604123525100272,日本,1,199604,如何看待“安乐死”,60,60,50,61,39,252,未参加,
人的生命是宝[C]贵的。,199604124523100235,韩国,1,199604,如何看待“安乐死”,85,60,79,81,77,370,C,
“安乐死”这个现象也是同样一个热门话题，人人都有意见，可最后必须有解决{CJy}。,199604123922200215,美国,2,199604,如何看待“安乐死”,75,80,56,49,60,310,未参加,
总之，在医生的严格的考虑下，在患者本人和家里人的同意下进行，而且国家有关[B失]部门也制定适当{CC合当}的法律规定。,199604124523200005,韩国,2,199604,如何看待“安乐死”,70,80,74,64,60,337,C,
我希望中国在法律方面也将允许“安乐死”{CQ的}措施。,199604124525100075,日本,1,199604,如何看待“安乐死”,80,55,66,54,67,308,C,
为了能尽量把“[BC‘]代沟”[BC’]的影响减少，专家们不时地{CC的}{CQ在}报章与广播{CQ上}发表了不少意见[F見]。,199610802801100006,澳大利亚,1,199610,如何解决“代沟”问题,90,70,54,36,78,321,未参加,
但是另一方面{CQ对}长[F長]者来说，现在年青人越来越不听[F聽]话，观[F覌]念也不正确[F確]。,199610802801200012,澳大利亚,2,199610,如何解决“代沟”问题,75,65,46,59,61,293,C,
父母应该让孩子们理解[C]他们为什么希望孩子们做{CJX}这样或那样。,199610550523190006,韩国,1,199610,如何解决“代沟”问题,80,80,81,73,69,375,B,
如果每个家庭{CQ都}做{CJX}这样的话可以解决这个问题。,199610550523190012,韩国,1,199610,如何解决“代沟”问题,80,70,52,46,49,287,未参加,
如果他们两代人对话的时间不长[F長]的话，他们两[F兩]代人不[C]太了解对方的思想、[BC，]行为方式、[BC，]生活态度以及价值[C]观念[C]等。,199610550523290019,韩国,2,199610,如何解决“代沟”问题,75,65,36,38,41,242,未参加,
”当时我非常高兴，因为我父亲{CC父父}没生我的气，要用对话的方法解[C]决问题，所以我回答问题回答得也非常轻松{CD了}。,199610550523190021,韩国,1,199610,如何解决“代沟”问题,70,70,68,50,57,303,C,
人类愈来愈退步吗？,199610550523290041,韩国,2,199610,如何解决“代沟”问题,65,65,57,57,53,281,C,
我想“代沟”是在社会发展{CC发达}过程中{CC上}出现的一种普遍的现象。,199610550523290056,韩国,2,199610,如何解决“代沟”问题,60,60,54,65,61,282,未参加,
总而言之，代沟的问[F問]题[F題]是因为[F為]没有互相对[F對]话[F話]{CJsd}。,199610550523290074,韩国,2,199610,如何解决“代沟”问题,65,60,54,53,45,260,未参加,
两代之间的对话的确有好处。,199610550523290088,韩国,2,199610,如何解决“代沟”问题,65,65,54,55,65,288,C,
在家庭讨[F討]论[F論]中{CJ-zhuy父母}{CQ要}发[F發]挥[F揮]一些{CJ-by引导作用}，让[F讓]子女有发[F發]表{CJ-by言论}的机会[F會]，再加以正确[F確]的例子说明{CC表达[F達]}。,199611543634100525,英国,1,199611,如何解决“代沟”问题,80,85,75,75,82,391,B,
{CD从}“三个和尚没水喝”的故事，我们可以从中了解到做人不可以太{CD过}自私的道理。,199603533533100003,新加坡,1,199603,由“三个和尚没水喝”想到的……,75,70,58,60,91,343,C,
如果没有团结的精神，又怎么能齐心协力地{CC的}解决{CC克服}社会问题呢？,199603533533200012,新加坡,2,199603,由“三个和尚没水喝”想到的……,65,75,74,65,91,357,C,
例如鼓励成绩好的学生多在学业[F業]上帮助成绩差的学生。,199603533533200013,新加坡,2,199603,由“三个和尚没水喝”想到的……,85,90,83,58,82,394,B,
这么一来，公司的利润也少了，连分红{CC花红}也没得拿。,199603533533200064,新加坡,2,199603,由“三个和尚没水喝”想到的……,90,80,63,70,80,378,B,
然而当他们知道和尚一并[F並]未为他们提供饮用水{CC食水}时，他们却又感到极度的失望和{CC及}愤怒。,199603533533100065,新加坡,1,199603,由“三个和尚没水喝”想到的……,90,65,69,72,91,378,C,
记得小时候，祖母时常对我七{CQ个}兄弟姐妹所说的一则三只小羊与一只老虎的故事。,199603533533200081,新加坡,2,199603,由“三个和尚没水喝”想到的……,85,85,77,76,82,400,B,
问了明白后，对大伙说“：为什么你们不会轮流下山去挑水呢？,199603533533200096,新加坡,2,199603,由“三个和尚没水喝”想到的……,90,70,74,76,91,394,B,
{CJ-zhuy我}{CQ由}“三个和尚没水喝”想到的{CQ是}我们每个人都会有很自私自利的想法，如以上所讲的为[F為]什么三个和尚没水喝。[BC，],199603533540200109,印度尼西亚,2,199603,由“三个和尚没水喝”想到的……,65,80,49,49,61,292,未参加,
跟人交际、观[C]察自然，考虑社会的道[C]理以后{CJ？}，才能达到真理。,199605104525100061,日本,1,199605,由“三个和尚没水喝”想到的……,45,50,41,51,61,225,未参加,
传说古时候，在一座山上的一座庙里，有一个和尚，他每天都要到山底下自[C]己挑水喝。[BC，],199605104523100072,韩国,1,199605,由“三个和尚没水喝”想到的……,50,50,38,47,42,205,未参加,
但是，别人遇到什么困难的事情，一般的人都不管别人的事情。,199605104523200101,韩国,2,199605,由“三个和尚没水喝”想到的……,70,65,80,65,65,331,C,
他想新来的和尚说的有理，于是两个人下山{CC山下}去抬水了。,199605104525200108,日本,2,199605,由“三个和尚没水喝”想到的……,70,65,71,63,82,337,C,
很简单，他只不过是一个穷[C]和尚[C]，而且他的说教也不怎么样，老百姓终于不理他了。,199605104525100144,日本,1,199605,由“三个和尚没水喝”想到的……,65,65,46,74,68,302,C,
我妈妈不知道他是谁。,199605104525100145,日本,1,199605,由“三个和尚没水喝”想到的……,70,55,46,56,61,272,未参加,
这三个和尚也必须{CC必要}这样的想法{CJy}。,199605104523200178,韩国,2,199605,由“三个和尚没水喝”想到的……,65,55,60,45,46,253,未参加,
那时候，我也才想起来了以前我母亲告诉我的一句话，“比你健康、身体{CC身材}好的人很多，为什么你常常去献血？,199605104525200185,日本,2,199605,由“三个和尚没水喝”想到的……,65,65,55,63,56,288,C,
人想达到{CC得到}目的，或者满足需要的时候，如果只有自己一个人，除了自己以外，连一个人也没有可依靠{CC2靠}的，他只好自己动手达到{CC得到}目的[BD，]或满足需要。,199605104525100195,日本,1,199605,由“三个和尚没水喝”想到的……,65,55,66,74,75,317,C,
比如大城市的人自己不愿意做的事推给外地人，发[B友]达国家自己不愿意做的事推给发展中国家。,199605104525200211,日本,2,199605,由“三个和尚没水喝”想到的……,55,80,55,54,80,310,未参加,
有人说人类在这个世界上是最{CQ高}等的，所以人类{CC人间}以外的动物应该服从{CJ-by人类}，但是我有别的看法。{CJ-zhuy我},199605104523100264,韩国,1,199605,由“三个和尚没水喝”想到的……,45,60,35,49,51,219,未参加,
我们个人应该考虑[B虚]自己的未来，那么应该保护社会、自然环境。,199605104523200272,韩国,2,199605,由“三个和尚没水喝”想到的……,55,60,38,38,46,218,未参加,
从这短文我可以想到有什么情况让我们做什么事情无论任何情况[BQ、]任何事情，都会发生{CC发现}这种情况，[BC。]因为人们心里看不出来的自私是任何人都有的。,199605104523200310,韩国,2,199605,由“三个和尚没水喝”想到的……,85,70,60,51,51,308,C,
这就是[C]我们人类以前只重视[F視]发展，当时没[B设]想到发展的结果一定引起环境污染[C]的。,199605550523190003,韩国,1,199605,由“三个和尚没水喝”想到的……,65,70,49,58,58,286,C,
这样，所有{CC整个}中国人都行动起来，打破大锅饭，中国的经济也因此越来越发展。[BQ”],199605550523290001,韩国,2,199605,由“三个和尚没水喝”想到的……,90,90,88,79,100,445,A,
美丑[F醜]和价[F價]值[C]是成人世界里[F裏]的东西。,199605550523190010,韩国,1,199605,由“三个和尚没水喝”想到的……,65,85,35,42,44,261,未参加,
如果{CJ+sy有}一个人生活在一座高山上的一座庙里的话，没有办法依靠别人，只靠他自己到山底下自己挑水喝，算是一种生活方法。,199605550523190036,韩国,1,199605,由“三个和尚没水喝”想到的……,60,60,63,58,63,286,未参加,
主人跟仆[B卜]人的差别是什么？,199605550523290048,韩国,2,199605,由“三个和尚没水喝”想到的……,60,65,49,54,56,267,未参加,
可是，后来又来了一个和尚，然后又来了第[B弟]三个和尚，人越来越多，大家都不想辛[B幸]辛[B幸]苦苦地到山底下抬水喝，只希望别人去山下抬水。,199605550523290083,韩国,2,199605,由“三个和尚没水喝”想到的……,65,60,44,63,51,266,未参加,
三个和尚没[F沒]水喝，我想到的是，世界上{CQ的}人住在一起越多，发生的事情也越{CC很}多一样。,199605529529250147,泰国,2,199605,由“三个和尚没水喝”想到的……,60,40,27,26,37,167,未参加,
本来是挑水，有{CQ了}两{CQ个}人，就抬水来喝，两个[F個]和尚还[C]可以一同工作，{CD在}他们的想[C]法是，谁也不会吃亏[C]。,199605529529150154,泰国,1,199605,由“三个和尚没水喝”想到的……,55,60,35,29,25,185,未参加,
我很惊讶[B呀]。,199704124525200319,日本,2,199704,记对我影响最大的一个人,70,80,70,80,77,367,B,
那年，我才五岁，正是天真无邪、无忧无虑的年龄{CC年代}。,200110540540150039,印度尼西亚,1,200110,我的童年,75,85,77,87,88,405,B,
我叔叔每星期都会带我到城市去玩，买{CJX}给我漂亮的玩具，带我到好玩的地方玩。,200110540540250033,印度尼西亚,2,200110,我的童年,70,70,44,32,42,246,未参加,
在家里，父母从未定下条条框框，[BC；]只要功课做好了，我可以自由自在地到处玩。,200110540540250054,印度尼西亚,2,200110,我的童年,65,90,77,65,94,382,C,
×××谨启1993年12月5日,199312533533100012,新加坡,1,199312,一封求职信,95,85,78,70,92,418,B,
我于[F於]六年前毕业于{CC自}新加坡大学历史系。,199312533533200078,新加坡,2,199312,一封求职信,75,70,74,70,82,360,B,
本人在去年曾获得旅游促进局颁发的“最佳导游奖”之一。,199312533533200087,新加坡,2,199312,一封求职信,85,90,62,76,78,388,B,
