错句,作文编码,国籍,性别,考试时间,作文题目,口试分数,作文分数,听力分数,阅读分数,综合分数,总分,证书
93年12月20日在报纸[C]上我看{CJ-buy到}你们的公司的招聘{CC需要}。,199312124505100325,阿曼,1,199312,一封求职信,55,55,39,25,27,181,未参加,
大学时代的成绩也不错。[BC.],199312123525200404,日本,2,199312,一封求职信,50,50,29,47,34,187,未参加,
在等被{CC受}取录的时间我将尽力，把我的缺点{CC短点}[BD，]补充{CJba}，提高自己本领、能力{CC机能}，将来能够把所交的岗位、[BC，]任务做得更出色。,199312123542100412,越南,1,199312,一封求职信,55,50,46,45,41,216,未参加,
这是我的简历[C]，但我认为我自己的特点是会说三种{CC个}语[F語]言[BD.]（日语、[BC，]英语、[BC.]汉语）和国际贸易方面的工作经验{CJy}。,199312123525100509,日本,1,199312,一封求职信,50,50,46,36,39,198,未参加,
”我呆住了。,199412123614200006,荷兰,2,199412,记我的父亲,70,90,75,69,63,360,B,
为什么我这样说父亲？,199412123512100035,菲律宾,1,199412,记我的父亲,45,60,39,34,37,194,未参加,
但他对妈妈的态[F態]度一直不好，到现在还没有什么好的办[B为]法让{CC把}他们俩恢复{CD了}正常的夫妻关系。,199412123525200028,日本,2,199412,记我的父亲,50,70,41,65,69,278,未参加,
我的父亲{CJ+sy是}好像朱[B洙]自清作品{CD中}《背影》{CQ中}的爸爸一样，经常照顾我。,199412123523100051,韩国,1,199412,记我的父亲,50,55,28,59,43,214,未参加,
他教我们很多社会的重要问题，他教我们怎么走向生活{CD道路}，他告诉我们怎么能解决生活各个{CC各各}方面的问题。,199412123619200080,罗马尼亚,2,199412,记我的父亲,55,60,54,44,47,241,未参加,
战争结束以后，他开始{CJ-sy做}了小买卖。,199412124533100065,新加坡,1,199412,记我的父亲,65,70,60,48,74,303,C,
生活很艰苦。,199412124506100060,巴基斯坦,1,199412,记对我影响最大的一个人,75,65,49,42,57,275,未参加,
那时候常常想，我这一生要做什么？,199412104525200697,日本,2,199412,记对我影响最大的一个人,65,65,75,79,74,342,C,
因为他是我爸爸，[BC。]我从小一直{CQ和他}一起住，所以爸爸给我影响很大。,199412104523100648,韩国,1,199412,记对我影响最大的一个人,65,65,41,46,35,236,未参加,
说起来给我{CQ很大}影响的人很多，[BC。]我的父亲、[BC，]母亲，还有老师们。,199412104523100663,韩国,1,199412,记对我影响最大的一个人,55,60,75,48,51,270,未参加,
在我上大学[F學]的时[F時]候，他已转[F轉]投一家电[F電]脑[F腦]公司工作，我们[F們]俩[F倆]有几年没有见[F見]面{CQ了}。[BC，],199412104625100368,葡萄牙,1,199412,记对我影响最大的一个人,65,80,89,75,74,371,B,
先说苦吧。,199409543501100217,中国,1,199409,学习汉语的苦与乐,85,85,69,73,88,396,B,
音乐系当时又没有主任，而舞蹈系又较少找我办事。,199500533533200018,新加坡,2,199500,记对我影响最大的一个人,90,80,81,65,90,401,B,
渐渐地我们发展成{CQ了}情侣关系，我经常帮忙打理家务，也从他那儿学习了西方的礼仪、[BC，]葡萄牙语，甚至学会煮西餐，我俨然像[B象]他家的女主人[BQ。]可是我这个主人等[C]了十年一直[C]没有名份。,199500533533200087,新加坡,2,199500,记对我影响最大的一个人,85,90,68,67,84,390,B,
虽然他说他爱我，将会{CJX}有一天带我回{CJ+buy去}里斯本农庄[F莊]，可是他始终没有实现诺言。,199500533533200087,新加坡,2,199500,记对我影响最大的一个人,85,90,68,67,84,390,B,
因为在工作上常有同事因为缺勤而增加了我们的工作量，朱先生在劝慰大家的不满时就常用{CC以}这一句话：“施”比“爱”要让你更感到生活的充实与满足，我们在别人有难有苦时给予[B于]及时的帮忙，让他感觉快乐安慰，就是我们最大的满足了。,199500533533200122,新加坡,2,199500,记对我影响最大的一个人,95,90,78,69,90,421,B,
当[F當]时[F時]我除了学校功[F課]繁忙{CC紧[F緊]忙}外[C]，又好玩，而且觉[F覚]得跟我读[F讀]的商业没有关系[C]，所以不是很热[F熱]衷。,199510512501200513,中国,2,199510,记对我影响最大的一个人,95,80,83,70,79,403,B,
他人很好，对我是百般体贴[F貼]，但绝不会像[B象]别的女孩子男朋友一样[BD，]百般依[F順]，他时常有事没事地{CC的}开导我，与我谈一些有关他的人生观[F覌]念。,199510512512200517,菲律宾,2,199510,记对我影响最大的一个人,90,85,62,58,68,360,C,
是他，时刻提醒我，我是个身上有{CC流}着中国人血统的菲律宾人。,199510512512200520,菲律宾,2,199510,记对我影响最大的一个人,90,90,74,73,91,416,B,
她那种任劳[F勞]任怨的品德，使我十分钦[F钦]佩。,199510512512200522,菲律宾,2,199510,记对我影响最大的一个人,90,95,64,58,91,396,C,
这是人的世界。,199510550523100921,韩国,1,199510,如何看待“安乐死”,95,80,62,64,64,361,C,
没有人享有权利{CC权力}去结束别人的生命。,199511543501100529,中国,1,199511,如何看待“安乐死”,80,90,76,79,91,411,B,
一个[F個]月？,199511543501200536,中国,2,199511,如何看待“安乐死”,85,90,76,83,95,425,A,
本人读{CC阅[F閱]}了“安乐[F樂]死”风波一文，{CJ-sy认为}发[F發]生了此事也是很难[F難]避免的。,199511543634200568,英国,2,199511,如何看待“安乐死”,85,75,52,66,59,329,C,
此致,199503680519200501,马来西亚,2,199503,一封求职信,80,80,71,75,88,386,B,
2、申请以上职位者，有经验者为佳，而申请服装设计师和广告设计师的人，希望有相关的文凭为佳。,199503682519100507,马来西亚,1,199503,一封求职信,50,0,64,52,77,231,未参加,
对我影响最大的一个人[BD——]是我姐姐。,199505550523200902,韩国,2,199505,记对我影响最大的一个人,60,50,62,50,53,255,未参加,
其实{CC其是}我妈是个外柔内刚[B刈]的人。,199505550523200911,韩国,2,199505,记对我影响最大的一个人,70,65,62,57,39,279,未参加,
汉语是世界公认非常难的一门语言，为了学好它，我不仅要每天背诵、阅读，更因为不肯学它而被打了几次，其艰难程度可想而知了。,199505529529200035,泰国,2,199505,学习汉语的苦与乐,90,95,76,81,99,439,A,
总之，我认为学汉语是乐多于苦，而且受益良多。,199505529529200035,泰国,2,199505,学习汉语的苦与乐,90,95,76,81,99,439,A,
也不知过[F過]了多少时间[F間]，我{CJ-zy才}能朗[B郎[C]]读[C]一些简[F簡]单[F單]的如信封，地名什么[F麼]的[C]。,199505529529100081,泰国,1,199505,学习汉语的苦与乐,95,75,59,50,77,351,C,
记[C]得{CC的}有一次，我高[C]中三年级时，妈妈突然生病了，{CQ在}晚上动也不{CJ-zy能}动的情况{CC程度}下，我认为第二天，我得早点[C]起床，自己[C]做饭吃然后上课，万万没料[C]到[C]，第[C]二天早上，妈妈已[C]经准备好饭{CD后}，等待我起床。,199505104523200016,韩国,2,199505,记对我影响最大的一个人,65,80,62,59,76,330,C,
他的广大性给我一种平安的心里{CC2心[C]}，他的无所不在性让我很勇敢等等。,199505104523100050,韩国,1,199505,记对我影响最大的一个人,0,80,62,53,53,245,未参加,
他们以前很想[C]念[C]书，好像他们希望{CC愿[C]意[C]}把他们的遗[C]憾[C]{CJba}，通过我们子女可以化解{CC解[C]结}。,199505104523200068,韩国,2,199505,记对我影响最大的一个人,50,70,62,67,49,281,未参加,
她跟同事一起去旅游的时候，遇[C]到了车祸，突然去世了。,199505104525200090,日本,2,199505,记对我影响最大的一个人,65,70,81,63,69,334,C,
虽然父亲永远[C]离开{CQ了}我们，可他永远[C]留在我的心里。,199505104523100130,韩国,1,199505,记对我影响最大的一个人,70,90,78,75,76,382,B,
所以我可以留学，可以享受了大学生活。,199505104523200133,韩国,2,199505,记对我影响最大的一个人,65,60,54,50,43,255,未参加,
本来开始[C]的时候[BQ，]非常苦是众所周知的，我差点儿放弃的时候也很多。,199505104523200139,韩国,2,199505,记对我影响最大的一个人,70,60,44,48,67,274,未参加,
她喜欢的是日本古典文学，我大学时候，[BC、]{CJ+zhuy我}在日本文学系学习日本古典文学。,199505104525100145,日本,1,199505,记对我影响最大的一个人,65,60,78,83,78,347,C,
那时，我是个不听话的孩子。,199505104523100177,韩国,1,199505,记对我影响最大的一个人,65,65,52,48,47,261,未参加,
我和我父亲还[C]有一个共同[C]点。,199505104523200176,韩国,2,199505,记对我影响最大的一个人,70,60,65,63,57,300,C,
看起来好像是跟牧师{CC牧士}相比，他的性格刚强{CC强健}，对学生十分严格，如果{CC万一}学习{CD得}偷懒{CC2懒}，{CJ-zhuy他}一看{CJ-buy到}就批评我们{CD了}。,199505104523200187,韩国,2,199505,记对我影响最大的一个人,75,60,57,50,57,285,未参加,
但是我认为她还在天堂上看着我。,199505104525200190,日本,2,199505,记对我影响最大的一个人,70,80,86,79,67,372,B,
现在他住在日本的奈良县。,199505104525100197,日本,1,199505,记对我影响最大的一个人,65,75,52,57,74,310,C,
而我父亲，他的思[C]想[C]很开放。,199505104525200212,日本,2,199505,记对我影响最大的一个人,75,75,65,48,65,318,C,
，那时我发现了非常重要的事。P},199505104525200243,日本,2,199505,记对我影响最大的一个人,80,65,68,73,63,337,C,
那时我们几个同学经常去看他。,199505104523200280,韩国,2,199505,记对我影响最大的一个人,70,60,83,67,78,343,C,
我[C]去中国[C]留学的时候，他和朋友给我[C]开告别宴会。,199505104525100297,日本,1,199505,记对我影响最大的一个人,70,55,62,69,67,307,C,
在生活上他也教会我如何{CD的}去面对困境，而我也觉[F覺]得，自己的言行举止方面，受他的影响很深。,199508682519200508,马来西亚,2,199508,记对我影响最大的一个人,90,80,86,67,86,404,B,
在他所参与的教会中，他也表现出了良好的风范[F範]。,199508683519100511,马来西亚,1,199508,记对我影响最大的一个人,85,85,75,71,84,395,B,
反观我自己，简直惨不忍睹。[BC.],199508680519100523,马来西亚,1,199508,记对我影响最大的一个人,85,80,81,73,84,396,B,
是罗老师，使我对数学这一科改观；是他，使我有信心迈前一步——[BC，]选修数理科，也是罗老师，使我明白[L]了许多待人处事之道。,199508680519200537,马来西亚,2,199508,记对我影响最大的一个人,90,90,83,77,84,422,A,
虽然她已去世，但她的每一个教诲，我都紧记于心。,199508682519200545,马来西亚,2,199508,记对我影响最大的一个人,85,85,78,71,84,398,B,
现在的我即将毕业，思想也日成熟，开始会为将来做打算。,199508682519200546,马来西亚,2,199508,记对我影响最大的一个人,90,80,89,79,86,419,A,
既然法律允许离婚，那么为什么不可以呢？,200010512501250009,中国,2,200010,我对离婚问题的看法,75,80,89,80,98,413,B,
有人主张[F張]应[F應]该[F該]允许[F許]已经[F經]没有爱[F愛]情基础的夫妻离[F離]婚。,200010602543250009,香港地区,2,200010,我对离婚问题的看法,85,85,100,90,95,450,A,
如果真是实现这个建议的话，在马路上的车或老百姓，还有在城市的内部[BD。]都变成一个美丽的城市。,200005108523100285,韩国,1,200005,关于用自然之声取代噪声的建议,60,60,56,50,46,254,未参加,
我以为自然声音是就在自然里边能听到的话才{CJ-sy是}美好的声音。,200005108523200313,韩国,2,200005,关于用自然之声取代噪声的建议,65,70,78,44,48,291,C,
为什么？,200005108523200346,韩国,2,200005,关于用自然之声取代噪声的建议,70,70,80,67,67,342,C,
我认为，在中国环境保护部门不需要进行短文上的政策。,200005108525200348,日本,2,200005,关于用自然之声取代噪声的建议,70,60,75,67,69,326,C,
不会[F會]产[F産]生太大的问[F問]题[F題]在两[F兩]人之间[F間]。,199711801801100019,澳大利亚,1,199711,我选择朋友的标准,75,75,71,45,37,293,未参加,
特别有时[F時]候，对学[F學]习[F習]失了信心，或不知如何选[F選]择[F擇]之时[F時]，他们一句的提议或鼓励[F勵]，都成了我生活的动力，使我不再感到寂寞[B莫]和无助。,199711802543200012,香港地区,2,199711,我选择朋友的标准,80,80,60,70,72,354,B,
第二是我总是有很多人跟我一起玩儿。,199705104523100072,韩国,1,199705,我的城市/乡村生活,65,60,55,49,46,258,未参加,
总而言之，我对我的都市生活再满意不过了。,199705104523200078,韩国,2,199705,我的城市/乡村生活,70,75,77,63,87,361,C,
所以最近离开乡村的年青人越来越多{CC1增加}。,199705104523200123,韩国,2,199705,我的城市/乡村生活,60,70,66,67,68,316,C,
”我说“不行，不行，一定要买。,199705104523200129,韩国,2,199705,我的城市/乡村生活,65,65,38,56,49,257,未参加,
我们全家住那里特别舒服，因为城市里的人民[C]，很多是亚[F亞]洲人，所以就像[B想]住在中国似的。,199705610610100016,法国,1,199705,我的城市/乡村生活,55,60,48,37,35,216,未参加,
有些人只会[F會]怨天怨地而不会[F會]想出解决方法；相反有些人抱着积[F積]极[F極]的态[F態]度去面对[F對]。,199810801543150022,香港地区,1,199810,如何面对挫折,80,80,56,82,66,356,C,
我们国家虽然用汉字，但是有的字跟中国的汉字意思不一样。,199804123525200142,日本,2,199804,学习汉语的苦与乐,75,75,60,54,52,306,C,
”这样做，别人看见我的时候{CC时间}，感觉特别不好意思，声音不由得小起[B越]来。,199804124525100283,日本,1,199804,学习汉语的苦与乐,85,75,57,81,80,370,C,
还有，{CD自}国外的朋友也越来越多。,199804124525200288,日本,2,199804,学习汉语的苦与乐,60,65,33,42,29,212,未参加,
可是，无论如何，我学会了{CC到}汉语，能产生{CD了}很多好处，首先[B选]跟中国的朋友自由地交换相互的想法和观念，心里就会体会到自豪感，所以这样情况下，我认为到中国学习汉语，就定在我的人生当中一个正确的选择{CJs}，第二是，在我国内，{CQ对}能说汉语的人才的需要越来越多，因而{CC从而}我们学完后回国时，能找到自己满意的工作因此感到幸福，我料想今后来大陆学习汉语的外国人{CJ-zy会}更多，在世界上汉语的地位{CJ-zy会}更重要。,199804124523100442,韩国,1,199804,学习汉语的苦与乐,70,75,57,69,58,318,C,
当然没有好的基础{CD上}怎么能写出优秀的文章呢？,199804124523200445,韩国,2,199804,学习汉语的苦与乐,75,70,60,64,42,300,C,
不过也有有趣{CC乐趣[B取]}的时候{CC部分}。,199804124523200445,韩国,2,199804,学习汉语的苦与乐,75,70,60,64,42,300,C,
我也遇到{CQ过}很多挫折，还记得我第一次的挫折。,199904123523200010,韩国,2,199904,如何面对挫折,65,70,70,50,48,289,C,
面对挫折，有的人唉声叹气，怨无尤人，从而变得一蹶不振。,199904123523200062,韩国,2,199904,如何面对挫折,65,65,72,62,74,322,C,
所以我得住医院，没法参加入学考试，这虽然不是我的错，但我受到了这么大的打击{CC2应}，那时候就是对我{WWJ},199904123523100075,韩国,1,199904,如何面对挫折,60,55,56,47,48,247,未参加,
学语言，永远遥远的一条路{CJs}。,199904123525200081,日本,2,199904,如何面对挫折,55,55,26,50,43,209,未参加,
对我来说，“如何面对挫折”{CJX}关于这个问题我从来没有深深地思考{CQ过}，但是我也是在生活和学习中[BD，]遇到许多困难或挫折，特别是我来中国以后发生了许多问题。,199904124523200281,韩国,2,199904,如何面对挫折,60,70,64,57,41,277,未参加,
”听了这一句，我下了决心，我无论如何也要毕业！,199904124525200308,日本,2,199904,如何面对挫折,75,80,78,88,85,397,B,
我中学的时候，我的成绩很好，[BC、]所以我考了重点高中{CD学校}。,199904124525200316,日本,2,199904,如何面对挫折,55,65,61,52,52,267,未参加,
那个时候我没有学费，所以我不可能上三年级。,199904124523100362,韩国,1,199904,如何面对挫折,65,65,42,52,46,254,未参加,
我的经历来说，克服困难以后的自己比以前的喜欢多了{CJbi}。,199904124525200388,日本,2,199904,如何面对挫折,60,65,50,65,35,258,未参加,
同学们在小学期负我的时候使我习惯{CQ了}一个人过{CJ+by时间}。,199904124608200464,波兰,2,199904,如何面对挫折,65,70,34,37,48,240,未参加,
小时候[BD，]念书，也要有耐性，[BC、]{CJ-wy要}勤劳、不畏困难、{CJ-wy有}不怕挫折的精神，才能把书念好，求到学问，达到我们的目的。,199909529529251014,泰国,2,199909,如何面对挫折,65,85,51,54,66,311,C,
