错句,作文编码,国籍,性别,考试时间,作文题目,口试分数,作文分数,听力分数,阅读分数,综合分数,总分,证书
在家里，学校里等等。,200209550523150217,韩国,1,200209,如何解决“代沟”问题,65,65,45,49,36,244,未参加,
“代沟”这个问题，不是[BD]现在[BD”]出现的。,200209550523250212,韩国,2,200209,如何解决“代沟”问题,60,60,48,64,44,258,未参加,
古时候，有一个洞里的墙壁{CC壁面}上写着：“现在孩子真不听话，没有礼貌。,200209550523250216,韩国,2,200209,如何解决“代沟”问题,65,65,63,62,56,295,C,
我认为，如果他们想起那时{CC天}的感觉就更接近孩子的心情。,200209550523250232,韩国,2,200209,如何解决“代沟”问题,65,65,75,69,54,312,C,
要[C]了解两人之间的想法{CJ-buy了}。,200209550523250248,韩国,2,200209,如何解决“代沟”问题,65,60,51,45,36,240,未参加,
第一个是两代人之间的了解。,200209550523250299,韩国,2,200209,如何解决“代沟”问题,60,65,48,54,54,264,未参加,
代沟现象是在家庭[C]中最深刻[B核]的问题。,200209550523250303,韩国,2,200209,如何解决“代沟”问题,65,60,57,59,58,282,未参加,
父母可能觉得男朋友配[C]不上女儿。,200209550523250358,韩国,2,200209,如何解决“代沟”问题,65,65,45,76,46,281,未参加,
因为他们也是人，所以这是很正常的。,200209550523250806,韩国,2,200209,如何解决“代沟”问题,70,70,42,57,46,273,未参加,
与此同时，晚辈[B悲]们的自由和开放的态度能为{CC对}社会提供发展的原动力。,200209550523250825,韩国,2,200209,如何解决“代沟”问题,80,85,63,64,56,342,C,
如果父母们[F們]不答应[F應]子女们[F們]想做[B作]{CJ-zxy的事情}的话[F話]，在这[F這]里[F裡]，子女们[F們]也会[F會]认[F認]为[F為]父母们[F們]都不喜欢[F歡]自己{CC2我}，所以父母们[F們]一定要答应[F應]子女们[F們]想做[B作]的东[F東]西。,200209550523150858,韩国,1,200209,如何解决“代沟”问题,65,65,45,57,44,260,未参加,
我想这是因为时代的进步[C]，一些年青人认为“老观念”已经过时了，应该淘汰[B太]了。,200209550501250861,中国,2,200209,如何解决“代沟”问题,75,75,78,69,76,363,B,
所以我觉得解决代沟的方法只能{CC只是}通过互相对话来解决[L]。,200209550523250865,韩国,2,200209,如何解决“代沟”问题,65,70,51,79,74,325,C,
我下面从三个方面来谈谈其方法吧。,200209550523250873,韩国,2,200209,如何解决“代沟”问题,70,80,85,81,82,388,B,
我和我父母的审美观点不同。,200209550523250874,韩国,2,200209,如何解决“代沟”问题,80,70,91,69,60,360,B,
所以，两代人之间应该需要彼此{CC互相}的批评[B平]、彼此{CC互相}的关心、彼此{CC互相}的相处模式[B试]。,200209550523250893,韩国,2,200209,如何解决“代沟”问题,70,70,45,54,50,277,未参加,
而这种观念，对自我主张很强[C]的年轻一代来说简[C]直不可理喻[Pyù]。,200209550523250923,韩国,2,200209,如何解决“代沟”问题,80,60,85,74,72,358,C,
通过“对话”与“理解”，要逐渐消除两代之间{CQ的}矛盾，才能解决“代沟”问题。,200209550523150954,韩国,1,200209,如何解决“代沟”问题,70,70,78,79,74,359,C,
所以我认为我们不应该害怕挫折，而是应该以坚强勇敢的一面去面对它、征服它。,200205109533200016,新加坡,2,200205,如何面对挫折,95,85,90,84,88,440,A,
因为人的生[L]命是有限的。,200205271525100037,日本,1,200205,如何看待“安乐死”,65,65,58,51,42,265,未参加,
这不是在中国独有的问题。,200205271525100075,日本,1,200205,如何看待“安乐死”,80,75,55,60,80,341,C,
第二要提高人民的知识，{CQ使他们}对卫生有初步认[F認]识，渐渐提高。,200306542542130010,越南,1,200306,口香糖与环境卫生,80,75,41,30,63,280,未参加,
因为我们不能一个人好{CJX}过日子。[BC.],200307109523200063,韩国,2,200307,绿色食品与饥饿,60,60,46,38,47,233,未参加,
我[C]不太明白怎么解决，[BC。]可是世界上的人们应该{CJ+zy互相}帮助缺[C]少粮食的人,200307109525100068,日本,1,200307,绿色食品与饥饿,60,55,40,14,44,194,未参加,
因为{CC2是因为}农民生产{CC2养}“绿色食品”的时候，很多麻烦{CJy}。[BC.],200307109523200112,韩国,2,200307,绿色食品与饥饿,70,90,83,56,70,362,C,
比如，生产肥大的农作物，用很短的时间生产农作物等等。[BC.],200307109523200131,韩国,2,200307,绿色食品与饥饿,70,85,67,59,58,331,C,
我相信总有一天能够解决这[C]个问题{CD的}。,200307109523200190,韩国,2,200307,绿色食品与饥饿,65,60,75,67,76,326,C,
这个问题的前提条件下，我们才可以谈[C]绿色食品的问题。P},200307109525100243,日本,1,200307,绿色食品与饥饿,65,80,62,80,90,365,C,
所以，虽然这样的[BQ“]绿色食品[BQ”]不会有害于{CC对}人的健康，[BC。]但是，农作物的产量会大大降低[BQ。]不过[C]，生产农作物的时候使用化肥和农药的话，虽然农作物的产量{CC2生产量}会很高{CC大}，但是会有害于{CC对}人的健康。,200307109523200268,韩国,2,200307,绿色食品与饥饿,65,70,43,54,64,282,未参加,
我们应该尊重食物，[BC。]要保,200307109523100397,韩国,1,200307,绿色食品与饥饿,65,55,54,43,64,263,未参加,
可是如果你有很多食物[BQ，]可不如那些好的食物，你虽[C]然不会很健康，但你能吃的饱[B咆]，所以我认为先[B现]解决缺少粮食而挨饿的问题[BQ。]我认为我们解决了缺[C]少粮食而挨饿{CJ-zxy的问题}后再[B在]解决绿色食品问[B间]题的话，[BC、]会非常成功，但先[B现]解决绿色食品问题{CQ的}话[BQ，]我认为几亿人就因为这种问题而死。,200307109523100427,韩国,1,200307,绿色食品与饥饿,65,60,72,49,73,302,未参加,
我认为{CD这}当然吃“绿色食品”是第一位的。,200307109523100467,韩国,1,200307,绿色食品与饥饿,65,65,62,59,79,314,C,
所以我们把它吃下去，也有可能对身体有害{CC障害}。,200307109525200469,日本,2,200307,绿色食品与饥饿,65,70,64,54,64,303,C,
应该[C]{CJX}咱们努力保护自然环境，[BC。]还[C]有{CD一边}{CD让}努力发展对自然[C]无害,200307109523200554,韩国,2,200307,绿色食品与饥饿,65,55,43,33,38,216,未参加,
我认为不挨饿还[C]是第一位。,200307109525200624,日本,2,200307,绿色食品与饥饿,60,70,56,49,56,276,未参加,
{CP现在应该{CJ-sd是}自己照顾自己的时候了，我们也应该好好去做，也没有什么太大的问题，农民也{CJX}用农药少了。[BC，],200307217523100014,韩国,1,200307,绿色食品与饥饿,70,60,27,43,35,220,未参加,
吃的东西也很重要[BQ。]所以最近喜欢吃“绿色食品”的人增加了。,200307217523200026,韩国,2,200307,绿色食品与饥饿,65,60,46,46,53,253,未参加,
那我们该怎么办才能解决这个问题呢？,200307217523200026,韩国,2,200307,绿色食品与饥饿,65,60,46,46,53,253,未参加,
以上所述，就是我对这一问题的看法。,200307217523200028,韩国,2,200307,绿色食品与饥饿,90,70,54,51,76,334,未参加,
在比较高级的超市里，有许多写着“这是无农药、无化肥的绿色蔬菜”被出售。,200307217525200049,日本,2,200307,绿色食品与饥饿,65,75,70,59,81,337,C,
所[C]以用化肥和农药也不能解决挨饿问题。,200307217525200090,日本,2,200307,绿色食品与饥饿,65,60,54,59,58,279,未参加,
现在世界的情况来看，还有几亿人因缺粮食而挨饿。,200307217523100108,韩国,1,200307,绿色食品与饥饿,75,70,62,43,81,320,C,
一分[B份]钱一分[B份]货，[BC、]我们还是选“绿色食品”比较合算。,200307205525200026,日本,2,200307,绿色食品与饥饿,65,70,64,51,73,309,C,
虽然在农作物生长过程中，使用化肥和农药能大大提高产量，但农作物会受到不同程度的化学污染。,200307205523200058,韩国,2,200307,绿色食品与饥饿,70,75,70,72,87,363,B,
为了保障{CC保持}人类的健康，食品污染问题是一定要解决的。,200307205525100067,日本,1,200307,绿色食品与饥饿,70,80,67,75,76,358,C,
而食品的增[B曾]加数量就是由“n十1”——就是1，2，3，等的格式{CJ-sy进行的}。,200307205540200088,印度尼西亚,2,200307,绿色食品与饥饿,75,65,54,51,53,285,未参加,
但是同时，绿色食品也渐渐消失，而用过化肥和农药[B约]的菜则越来越多{CD起来}了。,200307205523200113,韩国,2,200307,绿色食品与饥饿,80,65,67,59,90,349,C,
因此目前越[B趣]来越多的人重视“绿色食品”。{CP从表面来看，“绿色食品”是没有缺点{CJsd},200307205525200144,日本,2,200307,绿色食品与饥饿,60,55,62,54,84,296,未参加,
饥饿问[B门]题会造成人类[B米]想不到的后果——[BC一]战争。,200307205523200152,韩国,2,200307,绿色食品与饥饿,75,70,88,75,87,384,B,
在世界上不是一个人生活，而是很多人一起生活。,200307205523100155,韩国,1,200307,绿色食品与饥饿,60,65,62,49,47,266,未参加,
因为最重要的是[B事][BD，]人们的身体健康。,200307205523100166,韩国,1,200307,绿色食品与饥饿,65,60,51,56,56,271,未参加,
对我来说，就是环[B坏]境。,200307212523200008,韩国,2,200307,绿色食品与饥饿,60,60,38,35,27,202,未参加,
所以大多数人都吃绿色食品。,200307212523100027,韩国,1,200307,绿色食品与饥饿,65,70,51,43,67,282,未参加,
但如此的话，[C]我们也没有理由去把世界上的所有人民推入生命危险中{CD的}！,200307212523200032,韩国,2,200307,绿色食品与饥饿,70,80,67,70,99,376,C,
只不过好多国家都想着自己的利益和怎么样才不会亏本，所以像把自己买回来的东西给别[B另]人的这种行为他们都不太想去做……国家是从个人联合{CC团集}起来建成的，那么我们每一个人自动去做上述[B术]{CQ的}{CJ-zxy事}的话，总合起来也是很大多数的！,200307212525100035,日本,1,200307,绿色食品与饥饿,65,65,62,49,70,295,C,
食文化的高质量{CC高质化}。,200307209523200015,韩国,2,200307,绿色食品与饥饿,60,60,64,41,30,237,未参加,
当你没东西吃的时候，就谈不上吃得好吃不好，所以我们必须想尽办法让至今挨饿的几亿人得[B很]到他们需要的食品。,200307209635200010,俄罗斯,2,200307,绿色食品与饥饿,60,70,88,64,96,363,C,
当然，加大这方面工作的宣传也是很重要的。,200307209519100052,马来西亚,1,200307,绿色食品与饥饿,75,90,70,80,90,399,B,
我总觉得那些要饭的人多可怜{CC可悲}啊！,200307209628200049,圣马力诺,2,200307,绿色食品与饥饿,65,65,40,9,61,224,未参加,
对人类很好。,200307201523200042,韩国,2,200307,绿色食品与饥饿,60,65,48,27,64,247,未参加,
绿色食品与饥饿问题之间发生矛盾的主要原因就是供给不合。,200307201523200077,韩国,2,200307,绿色食品与饥饿,80,70,64,67,84,355,C,
随着全球社会的发展，出现想像不到的问题。,200307201525200082,日本,2,200307,绿色食品与饥饿,65,65,62,56,79,311,C,
我个人认为不挨饿放在第一位。,200307302523100003,韩国,1,200307,绿色食品与饥饿,80,65,70,59,73,335,C,
我想如果真能够成功的办到以上三点的话那么粮食问题就能解决。,200307302523100015,韩国,1,200307,绿色食品与饥饿,90,75,75,78,90,402,B,
我们要养成良好的饮食习惯的话，能克服饥,200307302523100055,韩国,1,200307,绿色食品与饥饿,70,60,64,43,64,286,未参加,
我想“绿色食品”和{CD对}此有大大的关系{CJ?}。,200307302523200070,韩国,2,200307,绿色食品与饥饿,85,70,75,59,76,356,C,
我认为吃“绿[C]色食品”比不挨饿还重要，因为吃“绿[C]色食品”会保持身体健康，所以想我们人类的未来起来该重视生命的质量。,200307206525200006,日本,2,200307,绿色食品与饥饿,65,55,40,51,64,257,未参加,
已经[BD，]{CJX}我的地球的天然资[C]源都是污染[B然]的。,200307206523100021,韩国,1,200307,绿色食品与饥饿,70,55,56,25,15,205,未参加,
现在我希望大家都重视“绿色食品”，[BC.]希望{CD着}不发生由农药来影响到孩子们{CJ-zxy的健康}{CJ-by的事情}。,200307206525100056,日本,1,200307,绿色食品与饥饿,65,70,67,41,61,290,未参加,
不可能{CC2可以能}让那些非[B菲]洲[B州]难民吃绿色食品[BQ，]也不可能让那些美国或日本等发展国家的人不{CD要}吃绿色食品。,200307206523100069,韩国,1,200307,绿色食品与饥饿,75,75,80,59,73,352,B,
经济发展的时候我们应该先考虑到将{CC1以后}造成的环境上的后果。P},200307332523200019,韩国,2,200307,绿色食品与饥饿,60,65,62,43,53,266,未参加,
而且{CJ+zhuy我们}应该好好地努力读书哦！,200310512512250016,菲律宾,2,200310,我对男女分班的看法,65,70,58,35,49,263,未参加,
怎么[F麼]能使[B氫]这[F這]简[F簡]单[F單]的概念生活化起來呢？,200310543919250004,加拿大,2,200310,谈有效阅读,60,85,79,75,86,374,C,
从{CC对}一个在澳大利亚长大的{CQ人的}角度来看，如果一个青年人想谈恋爱，他们不会被男女分班的问题所{CC而}影响。,200310801801150002,澳大利亚,1,200310,我对男女分班的看法,60,65,27,61,49,245,未参加,
比如，男女职工都在一个地方工作。,200310576525100006,日本,1,200310,我对男女分班的看法,60,75,66,75,67,329,C,
在早恋的过程中，少男少女们慢慢培[B陪]养{CJ-buy出}了感情，这年代的孩子们吸收能力很强，所以他们可以学到很{CC好}多东西。,200310576525200046,日本,2,200310,我对男女分班的看法,55,70,49,61,65,284,未参加,
一本书有的不用从第一页看到最后一页[BQ，]可以只看{CC念}你所想要的那部分。,200310540540150028,印度尼西亚,1,200310,谈有效阅读,70,65,88,38,59,306,未参加,
因为各行各业都是先看而后[F後]行，三思而行方能事半功倍。,200310540540250042,印度尼西亚,2,200310,谈有效阅读,65,60,43,33,84,268,未参加,
我{CJ+zhuy自己}本人认为，作为一个教师[BQ，]{CD对}选择书籍、刊物极其重要，我们对时间{CJ+zxy的宝贵}很{CC多}重视[BQ，]利用有限的时间阅读有关的书籍。[BC，],200310540540150066,印度尼西亚,1,200310,谈有效阅读,70,60,48,44,75,282,未参加,
学校作[B做]为一个重要的学习场所{CC场地}，不单只是学术上的，在另一方面，它更是一个可以让人学习人与人{CD的}{CJ-zy如何}交际的地方。,200310650519150042,马来西亚,1,200310,我对男女分班的看法,80,70,74,73,85,372,B,
现在在泰国能说汉语的人越来越多，竞争力也越来越大。,200304131529200222,泰国,2,200304,我学汉语是为了……,65,70,53,52,52,278,未参加,
对于青春期的少男少女，混合式的教育无疑是开放式的[BQ，]让他们彼此有更好的环境，通过正常的途径来了解异性，[BC。]并学习如何尊重异性与自重。,200306680519250005,马来西亚,2,200306,我对男女分班的看法,90,85,87,77,98,434,A,
所以，对于男女分班也一样，我的立场是中立的。,200306680519250048,马来西亚,2,200306,我对男女分班的看法,75,90,75,75,83,392,B,
这样，男女分班则变成坏事了。,200306680519250048,马来西亚,2,200306,我对男女分班的看法,75,90,75,75,83,392,B,
因为在未来的日子里，当他们毕业后，开始踏入社会工作的时候，这种人与人之间的相处{CC相片}之道也是他们必须面对的。,200306680519250057,马来西亚,2,200306,我对男女分班的看法,85,90,85,75,98,429,A,
那么怎么会解决饥饿问题呢？,200307271523100037,韩国,1,200307,绿色食品与饥饿,70,65,78,56,73,328,C,
根据报告，只吃绿[B绝]色食品的人的劳动力比吃肉的低一些。[BC.],200307271637200049,白俄罗斯,2,200307,绿色食品与饥饿,65,65,32,30,50,226,未参加,
因此，我们应该重视自己的健康问题。,200307271525200062,日本,2,200307,绿色食品与饥饿,70,80,56,59,53,308,C,
现在也正在{CJX}很多人因缺少粮食而挨饿，甚至死亡。,200307271523100077,韩国,1,200307,绿色食品与饥饿,70,70,75,54,61,318,C,
常听人说，[BC、]“我们只有一个地球。,200307271523100079,韩国,1,200307,绿色食品与饥饿,70,70,67,67,58,320,C,
但我是一个没经历{CC经验}过挨饿而很平安的生活{CC2生}过来的现代人。,200307271525200097,日本,2,200307,绿色食品与饥饿,70,70,78,59,64,329,C,
我本人也是吸烟的人，[BC.]但我也了解{CJ-zhuy吸烟}对个人健康有不好的影响，[BC.]所以我{CD对}自己控制{CJX}不要老吸[BQ、]少吸烟。[BC.],200405109525200152,日本,2,200405,吸烟对个人健康和公众利益的影响,65,70,64,64,59,308,C,
如果孩子每天看到成年人在吸烟，孩子会认为吸烟是一种正常的事，感觉不到[BD，]吸烟是一种病态，[BC。]所以我觉得这种措施应[B因]该继续{CC连续}下去。,200405109523200322,韩国,2,200405,吸烟对个人健康和公众利益的影响,60,65,62,75,68,313,C,
既然如此，抽烟者应该遵[B尊]守社会规律。,200405109525200482,日本,2,200405,吸烟对个人健康和公众利益的影响,65,70,69,73,66,329,C,
到外面就{CJX}很多人都在公共场所吸烟。,200405109523200582,韩国,2,200405,吸烟对个人健康和公众利益的影响,65,65,69,62,61,306,C,
非典和吸烟都对呼吸的问题{WWJ},200405109523100652,韩国,1,200405,吸烟对个人健康和公众利益的影响,45,55,33,41,35,187,未参加,
其实非吸烟者得了有关肺[C]的病的次数也挺多。,200405109523200694,韩国,2,200405,吸烟对个人健康和公众利益的影响,70,65,57,56,50,284,C,
有的地方如果被[C]发现就得罚款。,200405109523100811,韩国,1,200405,吸烟对个人健康和公众利益的影响,70,65,55,41,50,267,未参加,
P}如[C]果你常常吸烟的话[BQ，]肺[B腓]就[C]{CQ会}变成一个黑黑的东[C]西，一旦[B但]发现{CC发生}黑色东西在里面的话[BQ，]你{CQ应}立刻{CC一刻}停止吸[C]烟。,200405109523100827,韩国,1,200405,吸烟对个人健康和公众利益的影响,70,65,55,29,55,260,未参加,
影响很严重，还有让别人感到不[C]快[C]。P},200405109523200987,韩国,2,200405,吸烟对个人健康和公众利益的影响,70,70,76,75,70,349,C,
根据某市政府出台一项规定，在公共场所边走边抽烟的人将被罚款。,200405109523101002,韩国,1,200405,吸烟对个人健康和公众利益的影响,55,65,52,68,64,286,未参加,
坦白地说，我也曾经是一个吸烟者。,200405109523201006,韩国,2,200405,吸烟对个人健康和公众利益的影响,65,65,81,70,70,335,C,
自己的健康[BQ，]而对{CC给}大家不利{CC2不利益}。,200405109523101054,韩国,1,200405,吸烟对个人健康和公众利益的影响,65,60,57,41,48,254,未参加,
但是另一方面我们的烦恼[B脑]和压力{CJ+zxy的事}也愈来愈多。,200405109523201159,韩国,2,200405,吸烟对个人健康和公众利益的影响,70,50,48,62,57,270,未参加,
”他的意见是这样，[BC、]但是吸烟对个人健康带[C]来很多不好{CQ的}影响，[BC、]它是个毒[C]品。,200405109525101403,日本,1,200405,吸烟对个人健康和公众利益的影响,45,60,40,48,44,216,未参加,
公共场[C]所[C]是一个大家共用的{CJ-zxy地方}，应该{CJX}大家不{CJ+zy要}乱用，不要弄脏，但是抽烟者[BD，]可能会抽完之后[BD，]随地{CQ乱扔}{CD支}烟头{CC2烟}。,200405109523101473,韩国,1,200405,吸烟对个人健康和公众利益的影响,65,65,50,25,37,226,未参加,
不能轻视环境，什么也不能代替人的生命。,200405109523201472,韩国,2,200405,吸烟对个人健康和公众利益的影响,75,75,48,39,35,262,未参加,
对于这个问题议论纷[B粉]纷[B粉]，但我们应该{CJX}总考虑青少年的身体。,200405109525101711,日本,1,200405,吸烟对个人健康和公众利益的影响,70,65,74,62,64,321,C,
如果你抽烟的话，一天抽几根{CC个}烟？,200405109523201774,韩国,2,200405,吸烟对个人健康和公众利益的影响,65,75,48,48,48,271,未参加,
韩国现在流[B留]行戒烟[B咽[C]]，有了各种药什么的，我也知道，吸烟[B咽[C]][BD，]{CQ和}不吸烟[B咽[C]]者都知道，烟[B咽[C]]不好。,200405109523101784,韩国,1,200405,吸烟对个人健康和公众利益的影响,60,75,43,48,46,258,未参加,
因为他们[C]都知道吸烟是害人的，不仅是害吸烟者自己，而且害他们周[C]围[C]的人们。,200405109525201833,日本,2,200405,吸烟对个人健康和公众利益的影响,60,55,50,48,53,247,未参加,
烟含有{CC着}数百种不好的物质，其所引起的疾病也有{CC1列为}几十种，[BC。]尤其对呼吸器官{CC机管}影响极大。,200405109523101872,韩国,1,200405,吸烟对个人健康和公众利益的影响,70,95,81,73,70,382,B,
结果抽烟{CQ在}哪个方面都没有什么好处。,200405109523101894,韩国,1,200405,吸烟对个人健康和公众利益的影响,65,90,57,52,53,308,未参加,
最近开始抽烟的年龄越来越低了，[BC。]这个原因之一是很多成人在外边毫不犹[B郁]豫[C]地抽烟。,200405109525201896,日本,2,200405,吸烟对个人健康和公众利益的影响,65,75,62,60,39,288,未参加,
我认为某些政府{CC政治}出台的这项规定是应该制定{CC措施}的。,200405109525200464,日本,2,200405,吸烟对个人健康和公众利益的影响,50,70,70,52,75,300,未参加,
吸烟者会说：“现在我们没地方吸烟，[BC。]真是无家可归，[BC。]而且在路上也不让我们抽烟。,200405109523200539,韩国,2,200405,吸烟对个人健康和公众利益的影响,90,65,54,52,66,318,未参加,
怎么这么没有礼[Plǐ]貌[mào]？{CQ对},200405109523200836,韩国,2,200405,吸烟对个人健康和公众利益的影响,60,55,54,58,54,262,未参加,
这些情景真让人不愉快[L]。,200405109523100356,韩国,1,200405,吸烟对个人健康和公众利益的影响,55,65,54,50,55,261,未参加,
比方说不喜欢吸烟的人也得闻{CJ+buy到}烟味，而且青少年虽然还没有长大[BQ，]也有可能模仿成年人开始吸烟。,200405109525100856,日本,1,200405,吸烟对个人健康和公众利益的影响,85,65,62,83,85,369,C,
如今政府也开始重视有关[B于]吸烟的问题了。,200405204525200009,日本,2,200405,吸烟对个人健康和公众利益的影响,65,85,58,75,72,345,C,
如果在公共场所没有人边走边抽烟，[BC、]那么可以保持市容整洁，并帮助青少年养成良好的习惯。,200405204525200177,日本,2,200405,吸烟对个人健康和公众利益的影响,60,50,58,58,65,271,未参加,
某市政府出台了{CC的}一项规定，在公共场所边走边抽烟的人将被罚款。,200405204525200209,日本,2,200405,吸烟对个人健康和公众利益的影响,60,65,47,51,56,262,未参加,
若明白这些道理{CC地方}，吸烟就会把更多的利益提供{CC会供}给我们。,200405204525100243,日本,1,200405,吸烟对个人健康和公众利益的影响,65,60,30,58,63,259,未参加,
要是大部分的公共场所不准抽烟的话很多抽烟的{CJ-zxy人}不{CJ-zy会}去那里。,200405204525100305,日本,1,200405,吸烟对个人健康和公众利益的影响,65,65,38,44,36,232,未参加,
其中，最为重要的应该是第三个目的，因为前二者都可以由别的、[BC，]更为宽容的措施{CJ+zy能}达到，但只有禁止在公共场所吸烟才能防止第三者受害。,200405204525200345,日本,2,200405,吸烟对个人健康和公众利益的影响,75,75,77,63,76,356,B,
所[C]以我希望，政府设立{CC2做}一个能抽烟的地方。,200405204525100352,日本,1,200405,吸烟对个人健康和公众利益的影响,65,60,30,49,40,227,未参加,
还有，如果你是女性的话[BQ，]怀孕[C]的时候千万不要吸烟。,200405204525200417,日本,2,200405,吸烟对个人健康和公众利益的影响,65,75,60,58,58,303,C,
也可以说通过政府制定{CC提出}的规定{CC规则}，可以控制吸烟者的数量，同时也可以保护{CC考虑}个人的身体健康。{CD再加上},200405205525100085,日本,1,200405,吸烟对个人健康和公众利益的影响,65,80,52,39,63,287,未参加,
[BD，]除此{CC1了政府所提出的规定}之外，也有可能避免火灾，还有环境{CJX}保护等等。,200405205525100085,日本,1,200405,吸烟对个人健康和公众利益的影响,65,80,52,39,63,287,未参加,
我觉[C]得政府还[C]有一个事应该{CJ-sy采取}措[C]施的。,200405205525100126,日本,1,200405,吸烟对个人健康和公众利益的影响,65,75,66,70,67,330,C,
吸烟对个人健康和公众利益的影响我认为吸烟对个人健康和公众利益有不好的影响。,200405205525200133,日本,2,200405,吸烟对个人健康和公众利益的影响,60,80,68,73,61,329,C,
“[BC「]大家都[B到]会这样的呀，你假如管我的话，每个人都要管的。,200405205525100211,日本,1,200405,吸烟对个人健康和公众利益的影响,65,75,47,37,49,260,未参加,
在日本吸烟者越来越少，[BC。]可是一部分{CD的}人还很爱吸烟。,200405201525100049,日本,1,200405,吸烟对个人健康和公众利益的影响,65,75,52,44,70,293,未参加,
我父亲的一句话我认为极其有道理，他说：人是有思考能力的高级动物，但为什么人会做对自己的健康有害的行为呢？,200405207549100011,土库曼,1,200405,吸烟对个人健康和公众利益的影响,90,90,71,61,83,393,B,
