错句,作文编码,国籍,性别,考试时间,作文题目,口试分数,作文分数,听力分数,阅读分数,综合分数,总分,证书
父亲是我永远的老师，为了报答[B达]父母养育之恩，我在这里应该继续努力学习，天天向上。,199704124542200314,越南,2,199704,记对我影响最大的一个人,95,80,67,84,70,392,B,
小的时候我的三哥住在别的城市，他应母亲的要求，一星期写给母亲一封信[C]。,200110540540250030,印度尼西亚,2,200110,我的童年,70,80,77,77,90,384,B,
每次假期，不是去参加学校组织的旅游团，就是让爸爸带我去参观水族馆、动物园、植物园。{CJ-zhuy这},200110540540250082,印度尼西亚,2,200110,我的童年,75,85,74,47,92,366,C,
从那{CC今}以后，我一直努力用功，几乎每年考第一，过后还当了班干部。{CP后来经历了过早的失学也拦不住我的继续求知的愿[F願]望。P},200110540540250094,印度尼西亚,2,200110,我的童年,75,90,82,70,90,401,B,
我出生在苏门答腊的一个小岛[F島]上，岛[F島]上居民大概不到一万人，大都以捕鱼[F魚]为[F為]业[F業]，由于[F於]小岛[F島]四面环海，交通很不方便，直到七岁那年，我从没看{CJ-buy见}过汽车[F車]，更不用说火车[F車]或飞机了。,200110540540150121,印度尼西亚,1,200110,我的童年,85,90,79,80,92,422,A,
有这样的童年，我对自己说，以后有{CQ了}孩子，我一定好好珍惜他们，爱护他们，关心他们，使他们在心理[B里]上{CD有一个}健康地{CC的}成长。,200110540540250137,印度尼西亚,2,200110,我的童年,70,80,49,37,51,277,未参加,
电话4587660,199312533533200007,新加坡,2,199312,一封求职信,80,80,62,67,64,345,B,
以下是我的履历表：（一）姓名：（二）国[F國]藉：新加坡（三）居民证[F證]号码[F碼]：S6973147C（四）学历：一九八三年至一九八九年中华中学毕[F畢]业考取普通文凭[F憑]第一级（美术特优）一九八九年至一九九一年现洋美专广告设[F設]计[F計]文凭[F憑]（五）经验[F驗]：目前任职[F職]于[F於]联合早报[F報]美术设[F設]计[F計]员[F員]（已有一年经验）（六）特长[F長]：水彩量、设[F计][F計]字体如果贵[F貴]公司打算面试[F試]我，请[F請]照下列地址回邮[F郵]BLK551，ANGMOK10AVE10#11-26新加坡2056希望能按时收到贵[F貴]公司回函安康启一九九三年十二月四日,199312533533100099,新加坡,1,199312,一封求职信,85,75,67,80,85,385,B,
谢谢。,199312533533200136,新加坡,2,199312,一封求职信,75,90,64,65,87,375,C,
本人在酒店服务了两年后，离开了酒店到明明旅游公司担任{CC胜任}导游一职，以增广见闻。,199312533533200152,新加坡,2,199312,一封求职信,75,80,62,58,73,339,C,
我在大学也学过[C]英语。,199312123719200204,喀麦隆,2,199312,一封求职信,65,65,22,27,34,198,未参加,
要是我在您的公司工作[BQ，]我的外国朋友都会{CQ通过}您[C]的公司去中国各地旅[C]游。,199312123719200204,喀麦隆,2,199312,一封求职信,65,65,22,27,34,198,未参加,
现在我想辞掉{CC辞职}现在的职业，到贵公司任导游。,199312124525200260,日本,2,199312,一封求职信,65,55,71,78,73,324,未参加,
那时候，[BC、]我不行。,199312123525200307,日本,2,199312,一封求职信,50,55,29,45,36,193,未参加,
我的专业是经济学，现在学习汉语。[BC，],199312124940100313,秘鲁,1,199312,一封求职信,50,50,48,34,45,204,未参加,
没有受到[C]{{CJ-buy过}领导的指责，在该公司工作了三年。,199312124635100429,俄罗斯,1,199312,一封求职信,60,70,60,76,62,313,C,
我的性格很开朗[B郎]，较外向，[BC.]还有很喜欢去旅游。[BC.],199312123523200709,韩国,2,199312,一封求职信,55,50,25,39,43,191,未参加,
我的英语比较流利而且会说韩语{CC朝语}、[BC，]地道的普通话，虽然我没有工作的经验，可是，用业余{CC余务}时间打工，上个学期参加过实习活动。[BC.],199312123523200911,韩国,2,199312,一封求职信,50,55,43,47,43,216,未参加,
我认为，对我来说，他是{CJ+dy个}人生中的最好的老师。,199412123525200049,日本,2,199412,记我的父亲,85,90,60,61,67,359,C,
现在，我爸爸老了，[BC。]头发也全白了。,199412124525200006,日本,2,199412,记我的父亲,65,60,70,71,67,316,C,
我会尽力帮助你的。,199412104525200674,日本,2,199412,记对我影响最大的一个人,70,60,78,65,69,327,C,
自九月起[BQ，]××老师去上海复旦大学研究上海话。,199412104525200664,日本,2,199412,记对我影响最大的一个人,70,65,70,71,67,329,C,
因为为了自己的丈夫、孩子们的幸福。{CD对},199412104523200639,韩国,2,199412,记对我影响最大的一个人,65,60,60,57,55,280,C,
现[F現]在，虽[F雖]然她已经[F經]与[F與]世长[F長]辞[F辭]{CQ了}，但她说[F說]话[F話]的声[F聲]音，对[F對]我来[F來]说[F說]，仍犹[F猶]然在耳；[BC，]她喜悦的笑容，在我脑[F腦]海里[F裏]不时[F時]浮现[F現]。,199412104625200632,葡萄牙,2,199412,记对我影响最大的一个人,70,80,60,50,80,330,C,
不知道的话，用{CC把}毛巾蒙上眼睛。,199412104525100652,日本,1,199412,记对我影响最大的一个人,70,80,52,53,78,323,未参加,
我妈妈的教育方法有点特别。,199412104525100622,日本,1,199412,记对我影响最大的一个人,75,80,81,65,55,347,B,
高瘦的身材，微白的头发，一脸历经沧[B苍]桑的倦容，说话时总是[B时]未语先笑，他就是我的父亲[F親]——[BC——－]一个对我影响最大的人。,199500533533100019,新加坡,1,199500,记对我影响最大的一个人,90,80,75,67,82,389,B,
因为我刚离开[F開]学校，所以对工作、[BC，]对人际关系都缺乏经验。,199500533519200049,马来西亚,2,199500,记对我影响最大的一个人,95,95,0,34,61,284,未参加,
我及两个妹妹，从[F從]小在母亲[F親]的鼓励[F勵]及管教下，课[F課]业[F業]一直不落人后[F後]，但有时[F時]也会埋怨一下家境的困苦，但母亲[F親]时[F時]时[F時]提醒我们，“[BC「]吃得苦中苦，方为人上人”[BC」]“[BC「]天将降大任于斯人也，必先[B充]苦其心志，劳其筋骨，空乏其身……”[BC」]。,199500533501200078,中国,2,199500,记对我影响最大的一个人,95,90,83,71,82,420,A,
那时我心里很是感激。,199500533533200098,新加坡,2,199500,记对我影响最大的一个人,90,90,57,69,84,388,C,
她看到母亲那么辛苦，所以每天一放学，就帮妈妈洗衣、煮饭和看妹妹。,199500533519200117,马来西亚,2,199500,记对我影响最大的一个人,85,90,62,65,86,384,C,
过了一年多的时间，也就是我们快毕[F畢]业前，却[F卻]发生了一件令我[C]性格大变的事情……有一天，我们班上出郊外旅行，同学们[B间]都兴[F興]高采烈地一路有说[F說]有笑，大谈[F談]今天的行程会有甚么{WWJ},199510512634100512,英国,1,199510,记对我影响最大的一个人,85,65,74,77,91,381,B,
最后[F後]痛苦的一瞬间也是我们[F們]宝贵{CC珍贵[F貴]}人生的一部分。,199510550523200922,韩国,2,199510,如何看待“安乐死”,80,85,76,70,75,380,B,
我认为丈夫没有罪。,199510550523100930,韩国,1,199510,如何看待“安乐死”,60,70,24,33,35,207,未参加,
所[C]以[C]采取{CC2取}“安乐[F樂]死”是让[F讓]快要死[C]的人和其家人减[C]少痛[C]苦的唯[C]一方[C]法。,199510550523100932,韩国,1,199510,如何看待“安乐死”,0,70,50,50,41,206,未参加,
人的生命是上天赋[F賦]给[F給]的。,199510550523200928,韩国,2,199510,如何看待“安乐死”,90,85,48,58,57,335,C,
可是{CQ从}另一方面想，有一个人得了重病，没有康复{CC回生}的可能，本人也活得很痛苦，家人也会[F會]因为{CC为[F為]了}照顾[F顧]一个病人一起痛苦的。,199510550523200928,韩国,2,199510,如何看待“安乐死”,90,85,48,58,57,335,C,
但这一措施必须得到病人的要求后，才实行。,199510550523200933,韩国,2,199510,如何看待“安乐死”,80,80,52,68,57,329,C,
比如说：[BC，]第一，实行安乐死必须有病人的要求；[BC，]第二，大夫确认病人患的病是一种不{CQ能}治的病的时候才可以实行。,199510550523200937,韩国,2,199510,如何看待“安乐死”,70,85,55,68,68,338,C,
只要病人同意离[F離]开[F開]这[F這]个[F個]世界，家人又同意病人的决定，同时[F時]，医[F醫]生证[C]明了这[F這]个[F個]做法是对[F對]病人最后[F後]的解决方案时[F時]，[BC；]那么[F麼]，此「安乐[F樂]死」不是已给[F給]予他们一条[F條]生路{CQ了}么[F麼]？,199511543634200522,英国,2,199511,如何看待“安乐死”,85,90,71,62,77,381,B,
因为[F為]每一个[F個]人，都拥[F擁]有属[F屬]于[F於]自己的生存权[F權]利。,199511543501200569,中国,2,199511,如何看待“安乐死”,80,90,79,64,88,396,B,
今年22岁，未婚。,199503682519200517,马来西亚,2,199503,一封求职信,90,85,69,77,95,413,B,
本人欲应聘服装设计师一职。,199503680519100541,马来西亚,1,199503,一封求职信,85,85,81,83,91,420,A,
本人在美国求学时[F時]曾夺得该校所举办的第七十届服装设计比赛[C]优秀奖。{CJ-zhuy我},199503681519200555,马来西亚,2,199503,一封求职信,75,80,69,60,79,354,C,
本人姓×名×，女，现年廿五岁。,199503680519200547,马来西亚,2,199503,一封求职信,90,90,83,79,82,422,A,
[C]依赖[C]于美国[C]和日本，还有对日逆差的幅度也越来越大，北朝鲜的核武[C]器等朝鲜[C]半岛[C]的危机也很深。P},199505104523100022,韩国,1,199505,记对我影响最大的一个人,75,80,62,65,63,336,C,
所以他说的这[C]些话，{CJ-zy对我}有很大{CC强烈}的影响。,199505104525100030,日本,1,199505,记对我影响最大的一个人,70,65,54,65,65,305,C,
我在学校里是学生会主席，每天有很多事要做。,199505104922200091,美国,2,199505,记对我影响最大的一个人,95,85,86,69,74,407,A,
比如说，我将来有个孩子，他也跟我一样想的话，我{CQ会}很满足的。,199505104525200132,日本,2,199505,记对我影响最大的一个人,65,65,17,48,47,226,未参加,
如果我有一个不容易解决的问题，我就给他打电话，向{CC让}他请教我。,199505104614200175,荷兰,2,199505,记对我影响最大的一个人,80,65,44,42,49,268,未参加,
我认为应该是我的哥哥。,199505104525100197,日本,1,199505,记对我影响最大的一个人,65,75,52,57,74,310,C,
其中有一个大学的朋友可以说对我影响最大的一个人{CJs}，我上大学后就认识了她。[BC.],199505104525200204,日本,2,199505,记对我影响最大的一个人,65,65,57,63,61,295,C,
经过青少年时期，我的性格变得{CC成}了{CJX}不好{CJ+zxy的方向}，对什么都不满意，不知道什么是满足。,199505104523200214,韩国,2,199505,记对我影响最大的一个人,65,65,83,55,78,330,C,
他不但在训练过程中一直照顾我们，而且平时邀请我们到他家里去{CC来}做客。,199505104635100249,俄罗斯,1,199505,记对我影响最大的一个人,65,70,70,55,61,307,C,
从那时起，这种态度{CJ-zy就}成为{CC作成}我的座右铭。,199505104523200262,韩国,2,199505,记对我影响最大的一个人,55,70,68,59,76,312,C,
但他每次遇[C]到我{CJ-zy都}对我说“孩子[BQ，]学习怎[C]么样，[BC。]作业做好了没有。,199505104525100264,日本,1,199505,记对我影响最大的一个人,60,70,54,67,61,297,未参加,
那时，我[C]遇[C]到他了。,199505104525100297,日本,1,199505,记对我影响最大的一个人,70,55,62,69,67,307,C,
散会的时候，我[C]们含着泪水互相拥{CC抱}了。,199505104525100297,日本,1,199505,记对我影响最大的一个人,70,55,62,69,67,307,C,
他并不是多话{CC1说话}{CQ的}人，但对工作责任心{CC责任感}非常强，这是他至今总算走上{CC到}成功道[C]路的一个[C]很大的原因。,199505104525200310,日本,2,199505,记对我影响最大的一个人,70,65,57,53,59,290,未参加,
堂哥为我安排一系列的补课[B可]，安排好我的时间，更拿了好多有关的书籍为我打发以往我用以玩乐的时间。,199508683519200513,马来西亚,2,199508,记对我影响最大的一个人,85,90,52,65,57,345,C,
她的话更点醒了我，凡事多为别人着想，不要因自己的利益而去伤害别人。,199508680519200540,马来西亚,2,199508,记对我影响最大的一个人,80,85,73,59,74,365,B,
我常以这句话勉励自己向上。,199508683519100548,马来西亚,1,199508,记对我影响最大的一个人,85,95,81,77,78,412,B,
我现在就是以他的处世态度来做为我的处世态度。,199508683519100549,马来西亚,1,199508,记对我影响最大的一个人,80,85,65,61,67,352,C,
我也有一个不是很好，但还[F還]可以的方法就是如果{CC如约[F約]}我喜欢[F歡]了一个人，自己又是有家室的，我会[F會]和妻子先谈[F談]，离婚固[B估]然不好，但是勉强[F強]{CQ在}一起也不是一件好事，我会[F會]继[F繼]续[F續]供她们[F們]生活，但离婚，我知道这[F這]样[F樣]对[F對]孩子有心理不平衡{CC平均}[BQ，]但人是自私的，如果{CC如约[F約]}妻子不答应[F應]，也不好勉强[F強]，免得{CC2勉}她们[F們]自杀[F殺]就不好了{CJZR}。,200010801501250014,中国,2,200010,我对离婚问题的看法,65,70,26,44,52,243,未参加,
这是每个受到过噪音伤害人的希望，也是活在噪音中的人们最想得到的。,200005108523100284,韩国,1,200005,关于用自然之声取代噪声的建议,75,85,83,88,91,415,A,
所以我们{CJ-zhuy}慢慢地改变自己的生活方式，那么可以喜欢上它了。,200005108523200282,韩国,2,200005,关于用自然之声取代噪声的建议,65,65,53,47,46,260,未参加,
上课的铃声是对学生来说，在世界{CC世际}上最讨厌的声。,200005108523100332,韩国,1,200005,关于用自然之声取代噪声的建议,70,65,78,67,65,331,C,
例如[B比]，洗衣服的时候，过达实用洗分制{CJ?}。,200005108525100523,日本,1,200005,关于用自然之声取代噪声的建议,65,80,53,75,72,333,C,
我认[F認]为[F爲]能在茫茫人海中遇到一个知己良朋，[BC；]是一件很难[F難]得的事。,199711801501200015,中国,2,199711,我选择朋友的标准,85,70,94,79,96,415,B,
但是，我却[F卻]有这样的生活经[F經]验[F驗]，就是两个不同性格的人走在一起会较[F較]容易产[F産]生不愉快的事情。,199711802625200003,葡萄牙,2,199711,我选择朋友的标准,85,80,46,72,89,365,C,
我当时不喜欢爸爸，因为有这个原因。,199705104525100077,日本,1,199705,我的城市/乡村生活,65,55,46,35,58,241,未参加,
我妈妈生{CC1出生}我时，她已经33岁，我爸已经39岁。,199705104523100173,韩国,1,199705,我的城市/乡村生活,60,40,13,42,32,164,未参加,
另一个方面，在乡村里，象在试卷上的短文那样，人们都能享受与[B于]大自然在一起的欢乐。,199705104525100523,日本,1,199705,我的城市/乡村生活,50,75,60,67,65,301,未参加,
对于[F於]解决困难，[BC。]{CP可以有很多方法去解决，不至于{CC置于[F於]}意志消，变得一蹶不振。P},199810602801150011,澳大利亚,1,199810,如何面对挫折,75,70,84,80,79,377,B,
两年的时间是有价[B介]值的，在学习过程中会遇到许多困难，可是我会努力学习，克服困难的。,199804123523200120,韩国,2,199804,学习汉语的苦与乐,90,80,78,64,62,369,B,
每次学习举行“汉语表演节目”我们班的气氛{CJ-zy就}好像[B象]迎接{CD了}节日那么高兴。,199804123542200164,越南,2,199804,学习汉语的苦与乐,60,65,48,52,44,252,未参加,
我{CJ+sy觉得}不太清楚到底哪[B那]儿不对{CC顺}，脑[C]子里总是想学习的时候大声读课文，但一开始学习就忘记{CQ了}。,199804123523200225,韩国,2,199804,学习汉语的苦与乐,75,75,48,59,40,287,未参加,
但是这时候我的汉语水平降低了很多。,199804123525200227,日本,2,199804,学习汉语的苦与乐,75,75,57,49,50,296,未参加,
这时，我重新开始查字典。,199804123525200227,日本,2,199804,学习汉语的苦与乐,75,75,57,49,50,296,未参加,
所以我决定了，到天津去。,199804123523100245,韩国,1,199804,学习汉语的苦与乐,75,70,54,49,52,289,未参加,
因此有时不会念字也会懂它的意思，有可能会念不认识的字。,199804124525200387,日本,2,199804,学习汉语的苦与乐,70,60,63,67,68,313,C,
但是我后来发现了学汉语并不简单！,199804123614200506,荷兰,2,199804,学习汉语的苦与乐,75,70,30,35,34,233,未参加,
这时候供给一家生活费[C]的丈夫是不应该表现“大男人主义”更不应该看到妻子整天操持家务而厌弃。,199805529529151011,泰国,1,199805,如何看待“妻子回家“,90,85,76,80,88,416,A,
我认为这是必然的，如果我们生活中没有这种困难、挫折，那就不是“人生”了{CC的}。,199904123523200008,韩国,2,199904,如何面对挫折,75,70,37,65,59,295,未参加,
当时我家比较穷，只能考一个国立大学而已。,199904123525100053,日本,1,199904,如何面对挫折,75,75,67,83,89,379,B,
我初中时，属于我们学校{CC4该校}的篮球队{CJ-zxy的一员}，经过每天的刻苦努力，取得了“最优秀选手奖”。,199904123525200133,日本,2,199904,如何面对挫折,65,70,42,67,69,299,未参加,
我担心得心跳剧烈，满身大汗。,199904124623200296,南斯拉夫,2,199904,如何面对挫折,65,75,75,57,80,339,C,
没想到妈妈对我{CJ-sy说了}这些话。,199904124523200407,韩国,2,199904,如何面对挫折,60,65,70,57,50,285,C,
实际上，面对挫折，有的人唉声叹气，怨天尤人，从而变得一蹶不振。,199909684542200050,越南,2,199909,如何面对挫折,70,65,54,38,65,278,未参加,
