错句,作文编码,国籍,性别,考试时间,作文题目,口试分数,作文分数,听力分数,阅读分数,综合分数,总分,证书
这其实是一项正面的措施。,200405680519250002,马来西亚,2,200405,吸烟对个人健康和公众利益的影响,80,90,74,60,75,374,B,
所以父母谁不爱子女，其出发点永远都是以孩子的利益为中心。,200504534533250009,新加坡,2,200504,我对男女分班的看法,65,80,56,73,66,328,C,
男女同校能促使他们一起学习，成长，分享彼此的喜乐。,200504534533150024,新加坡,1,200504,我对男女分班的看法,70,75,65,69,73,341,C,
如能与孩子们一起上网，便可避免孩子受到不良的讯息{CQ的影响}。,200504534533150027,新加坡,1,200504,我对男女分班的看法,70,75,76,67,84,361,B,
家长们辛苦地[B的]赚钱供孩子们上学是抱着望子成龙的心态，要求孩子专心向学，好让他们在未来的日子里有优越的生活。,200504534533250033,新加坡,2,200504,我对男女分班的看法,75,85,78,86,84,401,B,
如果能够正确引导男生和女生在交[B双]往时所应该注意的行为和道德观念，让这些“青苹果”成长阶段的孩子有机会学习交往，也是一件好事。,200504534533250088,新加坡,2,200504,我对男女分班的看法,70,80,70,89,91,390,B,
其[B起]实，男女分班有利也有弊。,200504534533250136,新加坡,2,200504,我对男女分班的看法,70,70,51,56,57,292,C,
男生面对问题时，只顾{CQ从}大局{CC大场}着想，因此忽[B呼]略了很多小细节。,200504534533250157,新加坡,2,200504,我对男女分班的看法,80,75,76,78,79,379,B,
女生和男生的性格{CC格性}都不同。,200504534533250163,新加坡,2,200504,我对男女分班的看法,75,70,65,65,64,328,C,
一些人长期只跟同性的人来往，从来不接触异[F異]性，如果没有好好地控制，他们可能会变成同性恋。,200504534533250181,新加坡,2,200504,我对男女分班的看法,65,70,76,62,73,332,C,
父母的所做所为{CC所作所说}都会深深地影响{CC印象}一个孩子的行为，态度，生活习惯等等。,200505109634200017,英国,2,200505,父母是孩子的第一任老师,75,85,51,71,67,342,C,
他是个记者，工作非常忙，但他尽量抽时间做家务事。,200505109525200480,日本,2,200505,父母是孩子的第一任老师,60,75,74,74,82,351,C,
我们见的第一个人也是我们自己的父母，养我们长大的也是自己的父母。,200505109540100729,印度尼西亚,1,200505,父母是孩子的第一任老师,75,60,63,54,59,297,C,
他们找工作时，有很多困难[C]。,200505109525100922,日本,1,200505,父母是孩子的第一任老师,65,70,28,65,56,270,未参加,
我认为现在的自己，{WWJ},200505109525201338,日本,2,200505,父母是孩子的第一任老师,75,70,66,58,64,322,C,
还有我自己觉得{CC4自觉}我也受到父母的影响。,200505109525201368,日本,2,200505,父母是孩子的第一任老师,60,65,46,58,62,274,未参加,
所以，做为父母不管在什么地方，都是孩子的老师。,200505109525201372,日本,2,200505,父母是孩子的第一任老师,70,75,57,53,59,303,未参加,
在世上的每个人刚出生时，就像一张白纸一样容易受到周围的影响。,200505109513101448,柬埔寨,1,200505,父母是孩子的第一任老师,75,75,48,37,71,296,未参加,
从第一天我们睁[B争]开眼睛看到{CQ的}第一个人就是父母。,200505109529201441,泰国,2,200505,父母是孩子的第一任老师,70,60,48,53,57,273,未参加,
你应该感谢他们才对。,200505109525201729,日本,2,200505,父母是孩子的第一任老师,65,75,44,45,63,279,未参加,
父母是最早对孩子的成长产生重大的影响的人。,200505109542102008,越南,1,200505,父母是孩子的第一任老师,70,75,46,49,65,294,未参加,
只有父母照顾孩子、教孩子，孩子才能活下去。,200505109525202284,日本,2,200505,父母是孩子的第一任老师,70,70,46,69,63,306,C,
一说到什么就做到什么，言而有信{CC一言为定}，朋友们信赖我，所以我常常被朋友推荐为班长。,200505109525202452,日本,2,200505,父母是孩子的第一任老师,65,65,48,51,67,280,未参加,
他们强调教育是为{CC有}我们有更好的将[F將]来，他们要我们的生活比他们生活好一点。,200505109922102598,美国,1,200505,父母是孩子的第一任老师,80,60,54,47,56,284,未参加,
再说，孩子们那个时候想学习，他们的生活全部是学习。,200505205604200019,奥地利,2,200505,父母是孩子的第一任老师,75,65,52,47,56,282,未参加,
虽然我不是中国人[BQ，]但我还是[D我]教女儿中文。,200505212520200005,蒙古国,2,200505,父母是孩子的第一任老师,85,60,44,31,34,242,未参加,
这[F這]种[F種]人往往热[F熱]情感性才会[F會]很容易有“[BC「]一见[F見]钟[F鍾]情”[BC」]的事发[F發]生在他们[F們]身上。,200505951922250001,美国,2,200505,最理想的结交方式,85,75,82,66,84,384,B,
就像我的一位表姊，她和姊夫也只不过是相识[F識]三个月，就结[F結]婚了，连[F連]我都吓[F嚇]一跳。,200505522522250006,缅甸,2,200505,最理想的结交方式,70,75,66,60,73,333,C,
我想，从[F從]小一起长[F長]大的玩伴就会[F會]比较[F較]了解对[F對]方是什么[F麽]样[F樣]的一个[F個]人，也能知道他对[F對]你有多好，有多少耐心{CC忍耐}。,200505522522250030,缅甸,2,200505,最理想的结交方式,45,65,48,49,44,231,未参加,
所以我觉[F覺]得如果一个[F個]人要找自己的另一半[B伴]组[F組]成家庭，那要先对[F對]对[F對]方{CJ-sy进行}了解。,200505522522250031,缅甸,2,200505,最理想的结交方式,60,80,61,40,50,278,未参加,
反正{CD真的}真的好多好多问[F問]题[F題]，[BC．]最主要的是会[F會]不会[F會]爱上别人。,200505522522210016,缅甸,2,200505,最理想的结交方式,55,70,39,29,39,216,未参加,
所以我同意父母是孩子的第一任老师。,200505502540100040,印度尼西亚,1,200505,父母是孩子的第一任老师,80,65,50,43,52,278,未参加,
当然我能读书不仅仅是因为学校的老师而且{CQ也因为}父母亲给了我不少的影响。,200505332540200002,印度尼西亚,2,200505,父母是孩子的第一任老师,70,65,48,41,36,246,未参加,
”从此，我就在垃圾桶{CJ-zxy里}扔东西，除此之外，在家里，母亲有早睡早起的习惯，她每天早上一起床就准备了我们的早餐。,200505332540200012,印度尼西亚,2,200505,父母是孩子的第一任老师,65,60,52,53,47,260,未参加,
因为当{CC从}我们还在肚子里面{CJ-zxy的时候}母亲一定教我{CC他}们说话了。{CJ-zhuy我们},200505332540200030,印度尼西亚,2,200505,父母是孩子的第一任老师,60,65,50,45,52,255,未参加,
首先我们要认识到父母的确是孩子的榜样。,200505332542100031,越南,1,200505,父母是孩子的第一任老师,70,50,54,57,56,270,未参加,
我有能力[L]在贵公司上班。,200509534533250007,新加坡,2,200509,一封求职信,70,75,88,62,86,370,C,
我是个求上进的人，也不满于现状。,200509534922250071,美国,2,200509,一封求职信,80,70,82,55,79,356,C,
最后，脸上要一直[B值]保持着笑容，待人要亲切。,200509534533250126,新加坡,2,200509,一封求职信,55,70,79,60,86,334,C,
我的名字叫×××，今年二十三岁。,200509534519250148,马来西亚,2,200509,一封求职信,85,70,75,77,88,386,B,
但是我最擅长的还是日语。,200509534533250168,新加坡,2,200509,一封求职信,70,75,86,71,88,379,B,
我先来谈一谈流行歌曲的好处吧。,200510111523200015,韩国,2,200510,我看流行歌曲,60,90,65,42,62,309,未参加,
很多人听一样的流行歌曲但他们都不一[L]样{CJX}自己感觉到的东西。,200510111523200055,韩国,2,200510,我看流行歌曲,60,65,39,44,35,226,未参加,
我在山东省烟台市的师范[B氾]大学里学过汉语{CJX}一年。,200510111523100771,韩国,1,200510,我看流行歌曲,50,65,49,40,42,227,未参加,
所以一听就听腻[C]呢，我不喜欢。,200510111523200874,韩国,2,200510,我看流行歌曲,55,60,44,48,50,238,未参加,
我们能知道流行歌曲的好处和坏处。,200510111523201028,韩国,2,200510,我看流行歌曲,65,60,42,42,42,234,未参加,
我来谈谈我的看法。,200510111523101115,韩国,1,200510,我看流行歌曲,55,60,60,38,59,253,未参加,
我想一定会是一个“黑白”的世界，没有一点欢乐。,200510111523101120,韩国,1,200510,我看流行歌曲,95,85,67,75,84,404,B,
我也是非常喜欢听歌的人，心烦恼的时候听开心的歌曲的话{CQ有}烦恼好像一下子消失[B共]的感觉[C]，但是我认为最近的歌曲内容不怎么好，所以我认为需要法津上或什么组织的管理。,200510111523201257,韩国,2,200510,我看流行歌曲,70,65,60,34,69,284,未参加,
依我看没有创造性的音乐就不能进一步发展，[BC。]也就意味着没有音乐的未来。,200510111523201264,韩国,2,200510,我看流行歌曲,65,60,67,63,62,300,C,
在现代社会上，有各种各样的歌曲。,200510111523101277,韩国,1,200510,我看流行歌曲,55,45,35,38,52,202,未参加,
很多歌词内容都关于爱情、批判社会等等。,200510111523201278,韩国,2,200510,我看流行歌曲,80,90,67,56,79,367,C,
我平时喜欢听流行歌曲。,200510111523101279,韩国,1,200510,我看流行歌曲,55,45,39,44,55,215,未参加,
还有流行歌曲是可以烘托{CC表示}当时的人们的社会气氛，可以[C]了解当时情况。,200510111523101455,韩国,1,200510,我看流行歌曲,70,65,46,28,55,250,未参加,
我又想参加艺术节，这次唱的话。,200510111523101848,韩国,1,200510,我看流行歌曲,45,55,30,20,42,170,未参加,
更{CC还[F還]}不好的是看到一家人每一个[F個]{CJ-zxy人}的行为[F為]举止都{CC1也是}很差的时[F時]候。,200510919919150015,加拿大,1,200510,父母是孩子的第一任老师,70,75,47,60,66,307,C,
父母是每个人生命中最重要{CC的}[BQ，]也是接触最多的人，所以我认为每个孩子的第一任老师理所当然的也是他们了。,200510919501250012,中国,2,200510,父母是孩子的第一任老师,75,90,80,71,100,410,B,
每个孩子都是天真无邪的。,200510919919250004,加拿大,2,200510,父母是孩子的第一任老师,85,95,77,68,96,417,B,
因此说[F說]父母是孩子的第一任老师[F師]、第一个[F個]榜样[F樣]是没错[F錯]的。,200510919919105304,加拿大,1,200510,父母是孩子的第一任老师,75,95,53,79,96,392,C,
我觉得流行歌有很多的好处。,200510302523100013,韩国,1,200510,我看流行歌曲,65,70,65,54,69,309,C,
200510青岛大学.00003100017目前不管男女老少都喜欢听流行歌曲。,200510302523100017,韩国,1,200510,我看流行歌曲,55,60,58,63,57,274,未参加,
大多数的人都喜欢流行歌曲，当然我也不例外。,200510302523100029,韩国,1,200510,我看流行歌曲,40,60,65,44,77,263,未参加,
流行歌曲是特别对十多岁到三十多岁的人们多听的{CJ？}。,200510302523100050,韩国,1,200510,我看流行歌曲,75,70,63,40,55,292,未参加,
虽然流行歌曲符合人们的胃口而被人们喜欢，但我认为它却没有缊含着那种希望。,200510302523200080,韩国,2,200510,我看流行歌曲,70,90,60,59,79,351,C,
流行歌曲总是随着时代的变化而变化着，而它永不变的主题就是爱。,200510302523100222,韩国,1,200510,我看流行歌曲,75,75,81,63,79,363,B,
同时[BQ，]吸引听众来参加{CJ+dy一个}展览会。,200510529529251004,泰国,2,200510,我看流行歌曲,60,60,53,56,72,283,未参加,
我欣赏的是他们的作品和实力，而不是他们的外貌，更不会随着社会的浪潮而改变{CC失去}了自己的看法[BD，]和歌曲{CC歌声}带给人们的快感{CJ+zxy的意旨}。,200510529529251014,泰国,2,200510,我看流行歌曲,80,80,83,81,94,410,B,
这时，我忽然听到录音机播放的一首歌：《[BC“]明天会更好》[BC”]。,200510540540200026,印度尼西亚,2,200510,我看流行歌曲,65,60,46,32,72,258,未参加,
我喜欢流行歌曲，特别喜欢《[BC“]老鼠爱大米》[BC”]，我的外甥女唱这首歌时特别生动，她那甜甜的声音打动我们家的每个成员，连奶奶也跟着唱：[BQ“]我爱你，爱着你，就象老鼠爱大米[BQ”]，后来，奶奶神奇地把歌词改唱：[BQ“]我爱你，爱着你，就象奶奶爱孙女……[BQ”]，这[F這]种气氛带来开心温馨。,200510540540200069,印度尼西亚,2,200510,我看流行歌曲,85,70,60,36,62,304,未参加,
大一点的时候，我们俩[D儿]常一起玩。,200510634634100164,英国,1,200510,我看流行歌曲,80,55,70,40,69,300,未参加,
对这个主题我也有同感。,200509602801250014,澳大利亚,2,200509,父母是孩子的第一任老师,65,75,85,58,77,347,C,
爸爸、[BC，]妈妈，我很想你们。,200104124523200025,韩国,2,200104,一封写给父母的信,70,60,58,47,54,274,未参加,
祝你们生活愉快！,200104124523200140,韩国,2,200104,一封写给父母的信,70,75,36,37,47,254,未参加,
亲爱的爸爸、妈妈：你们最近怎么样？,200104124523200158,韩国,2,200104,一封写给父母的信,70,90,58,35,56,302,未参加,
我身体不错，学习情况也好，请你们不要担心。,200104124525200154,日本,2,200104,一封写给父母的信,65,80,58,68,49,308,C,
一封写给父母的信{CD向}亲爱的父母：首先，我真的没想到趁这考试的机会写{CJX}给父母{CD的}信。,200104124523200160,韩国,2,200104,一封写给父母的信,70,60,55,21,38,229,未参加,
我的中国留学生活{CJ+zy都}很好，所以你[B您]们放心吧。,200104124523200173,韩国,2,200104,一封写给父母的信,70,65,52,37,56,266,未参加,
我不知道{CJ-zy该}怎么做，{CJ-zy该}怎么生活。,200104124523100195,韩国,1,200104,一封写给父母的信,60,65,36,35,47,226,未参加,
我想，我的家乡也应该差不多吧。,200104124525200273,日本,2,200104,一封写给父母的信,65,90,79,80,81,386,B,
因为我心中有我最爱的妈妈、[BC，]爸爸。,200104124523200313,韩国,2,200104,一封写给父母的信,70,65,44,44,49,258,未参加,
我快毕业{CQ了}，学生时代也要结束了。,200104124525100364,日本,1,200104,一封写给父母的信,75,80,52,51,56,305,未参加,
女儿会努力考好，把论文写好，为你们{CC您们}争光。,200104124529200441,泰国,2,200104,一封写给父母的信,85,90,68,82,85,406,B,
我过得真的很好。,200104124523100457,韩国,1,200104,一封写给父母的信,70,85,49,61,51,308,C,
平时，妈妈的睡眠常常不够，您要好好休息，请爸爸妈妈注意保重身体，好让远在异国他乡的我放心学习。,200104124542100448,越南,1,200104,一封写给父母的信,75,90,66,73,83,381,B,
根据贵公司的招聘启事，我给您写{CQ了}{CQ这封}信。,199200204525100048,日本,1,199200,一封求职信,,,0,0,0,0,未参加,
精美服装业务{CD的}需要：服装设计[L]师{CD有}两名；广告设计[L]师也要{CC有}两名{CC种}；[BC。]推销员两[B由]名，他们{CQ要}有两年以上推销经验，{CD他们}精通一门外语。,199200204712200011,刚果,2,199200,一封求职信,,,0,0,0,0,未参加,
将来您公司愿雇[B顾]我的话{CJ-zhuy我}可以通过这些渠道推销您{CQ的}产品。,199200008632200022,匈牙利,2,199200,一封求职信,,,0,0,0,0,未参加,
它是没有治疗的办法、对病人来说，死比生好的特别情况。,199604124525100072,日本,1,199604,如何看待“安乐死”,60,50,32,39,62,222,未参加,
人都有继续生活下去的一种愿[C]望，但是那本人扔下生活，选择死的世界，这是他自己有受不了的痛苦。,199604123523200317,韩国,2,199604,如何看待“安乐死”,65,60,35,61,47,251,未参加,
如果孩[C]受[C]了以后，在[C]的时后要自[C]的[C]不是父[C]的责任呢？[C],199604124523100046,韩国,1,199604,如何看待“安乐死”,65,70,48,61,49,278,未参加,
关于病人的要求，[BC。]如果{CC即使}有一个病人，她的病很严重，自己折腾得不能忍受了，所[C]以自选那种死的方法来解决问题。,199604123529200228,泰国,2,199604,如何看待“安乐死”,60,65,40,37,49,234,未参加,
例如家里人方面，谁也不愿意让自己亲爱[B受]的人永远离开他们身边，可是他们哪知道病人有多么痛苦，既[B即]然病人心甘情愿地安乐死，那为何还再留她在这个世间{CJ-sy受}折[B拆]磨呢？,199604123529200228,泰国,2,199604,如何看待“安乐死”,60,65,40,37,49,234,未参加,
因为人的生命不是自己的[BQ，]是社会、家庭也自己的{CJs}，[BC。]所以应该重视自己的生命。[BC.],199604123523200316,韩国,2,199604,如何看待“安乐死”,60,55,48,64,49,257,未参加,
我认为世界{CC世际}上最重要的是生命。,199604123523200327,韩国,2,199604,如何看待“安乐死”,60,70,58,61,44,277,未参加,
通过这些过程而来的结论[B伦]是“杀”的话，法院承认这不是犯罪。,199604124525200206,日本,2,199604,如何看待“安乐死”,60,70,61,76,70,321,C,
不过一般安乐死应该只在医院里能做[B作]的。,199604124512100091,菲律宾,1,199604,如何看待“安乐死”,60,65,40,44,34,226,未参加,
结果{CJ-sy出现}患者想自杀、想解脱痛苦的现象。[BC.],199604123525200242,日本,2,199604,如何看待“安乐死”,65,60,58,57,75,298,C,
我设想她的丈夫帮助她自杀是正常的，她可[C]以安乐而死。,199604123542200141,越南,2,199604,如何看待“安乐死”,70,60,32,49,0,195,未参加,
是一种[B和]杀人的行动，还是一种解脱死者和家人的痛苦？,199604124623200135,南斯拉夫,2,199604,如何看待“安乐死”,65,65,63,61,49,287,C,
他是人，我也是人；[BC。]他是学生，我也是学生。,199610550523290028,韩国,2,199610,如何解决“代沟”问题,65,55,65,42,53,262,未参加,
不久前，我在中学当老师。,199610550523290034,韩国,2,199610,如何解决“代沟”问题,70,75,83,73,84,374,B,
{CP“代沟”问题是无论东西古今有的。P},199610550523290069,韩国,2,199610,如何解决“代沟”问题,0,50,25,40,41,146,未参加,
那怎样解[C]决呢？,199610550523190092,韩国,1,199610,如何解决“代沟”问题,60,65,54,55,61,278,未参加,
本人并[F並]不是社会学[F學]家，希望在这里[F裏]一抒[B舒]已见[F見]，错[F錯]对与[C]否，请自行判定，如有不[B天]对，望见[F見]谅。,199611543634100529,英国,1,199611,如何解决“代沟”问题,85,90,83,71,80,405,A,
世界上有许多国家，例如：中国、印度、印尼、美国、日本、巴西[BD……]等国，众所周知{CC众所皆知}，他们的人口都以亿{CQ来}计算{CC2计}。,199603533533100045,新加坡,1,199603,由“三个和尚没水喝”想到的……,90,60,63,60,82,345,C,
”和尚乙听到和尚丙的话，自己也拿不定主意，只好犹犹豫豫{CC没头没脑}地也答应了。,199603533533200096,新加坡,2,199603,由“三个和尚没水喝”想到的……,90,70,74,76,91,394,B,
从这篇故事里，我想起了现在的人们都趋向于先顾自己，后顾别人。{CJ-dy这种},199603533540200112,印度尼西亚,2,199603,由“三个和尚没水喝”想到的……,90,80,69,49,77,360,C,
可是过了一段时间，我们开始懒{CQ得}做，谁也不愿意去做[B作]。,199605104523100039,韩国,1,199605,由“三个和尚没水喝”想到的……,75,70,69,70,70,343,C,
谁也不挑水了。P},199605104523100040,韩国,1,199605,由“三个和尚没水喝”想到的……,65,70,35,40,42,238,未参加,
手拉手，大家都努力创造{CC建流}美好的生活。,199605104523200095,韩国,2,199605,由“三个和尚没水喝”想到的……,60,65,55,54,54,271,未参加,
但是，一旦人浮于事，准谁也不肯去做。,199605104523200105,韩国,2,199605,由“三个和尚没水喝”想到的……,65,80,71,76,94,374,B,
我认为人本是自私的存在。,199605104523200214,韩国,2,199605,由“三个和尚没水喝”想到的……,70,55,69,65,63,306,C,
他们三个人都是懒惰的，[BC。]天天起晚{CD来}后，{CD只}一个人都{CC也}不打扫[B妇]寺庙{CC境内}。,199605104525100245,日本,1,199605,由“三个和尚没水喝”想到的……,65,50,38,51,39,224,未参加,
如果真的必要，那{CJ-zy就}自己去。,199605104525200266,日本,2,199605,由“三个和尚没水喝”想到的……,65,60,66,51,37,262,未参加,
在这样的情况下{CC上}，三个和尚{CQ该}一起想个办法，怎么能解决这个问题{CC情况}。,199605104523200308,韩国,2,199605,由“三个和尚没水喝”想到的……,70,70,49,54,61,292,C,
那个时候十个人团结起来，商量分配工作。,199605104525200323,日本,2,199605,由“三个和尚没水喝”想到的……,65,80,66,67,70,336,C,
。,199605104525200335,日本,2,199605,由“三个和尚没水喝”想到的……,60,65,74,65,63,310,C,
那个男性是“变质者”，要{CC以}执行暴行而{CC为}接近了她。,199605104525100384,日本,1,199605,由“三个和尚没水喝”想到的……,70,60,46,63,54,278,未参加,
这样下去，剩下{CC出下}的水都没有了。,199605550523190004,韩国,1,199605,由“三个和尚没水喝”想到的……,70,70,49,63,63,303,C,
可是还有一个和尚来[F來]，你看三个人都想人多了，我不做他们[F們]当[F當]然{CJ-zy会}做。,199605529529250166,泰国,2,199605,由“三个和尚没水喝”想到的……,65,65,19,38,27,198,未参加,
你是不是在家里练了好多次？,199704124525200322,日本,2,199704,记对我影响最大的一个人,85,90,84,89,79,423,A,
父母忙着[F著]工作，哥哥姐姐都去外地留学，[BC。]一个人在家里，感到很独单[F單]。,200110540540250137,印度尼西亚,2,200110,我的童年,70,80,49,37,51,277,未参加,
相貌端正，为人诚实，熟悉中国历史，表达力强，有大学学历。,199312533533200017,新加坡,2,199312,一封求职信,75,45,50,65,68,285,未参加,
本人曾参与创作的广告包括“云雾[F霧]牌香烟”、“麦[F麥]当劳快餐店”和“蓝带啤酒”等。,199312533533100035,新加坡,1,199312,一封求职信,90,70,83,76,100,412,B,
并[F並]有{CC在}一次受邀到香港当顾问。,199312533533200036,新加坡,2,199312,一封求职信,80,80,41,65,73,331,未参加,
在此先说声谢谢！,199312533533100058,新加坡,1,199312,一封求职信,85,70,60,70,75,352,C,
此外，我应征这个职位的目的是为了开阔对中国市场的视野，也希望能在事业上攀登另一个高峰，毕竟中国{CD是}站起来了！,199312533533100154,新加坡,1,199312,一封求职信,90,50,50,56,85,319,未参加,
因为我觉得学好中文以后肯定有用。[BC.],199312123523200101,韩国,2,199312,一封求职信,75,55,60,59,45,279,未参加,
我的心愿能够实现吗？,199312124542200235,越南,2,199312,一封求职信,95,80,76,48,50,345,C,
联系[C]人：李文先生。{CJ+sy希望},199312123519100304,马来西亚,1,199312,一封求职信,50,40,27,28,41,160,未参加,
我也常常拉外国人，[BC。]所以我自己学习英语。,199312124525200323,日本,2,199312,一封求职信,55,65,43,43,62,251,未参加,
业余时间[C]常常去游行。,199312123542100924,越南,1,199312,一封求职信,60,60,67,27,48,244,未参加,
我[C]生于黑龙江省哈尔滨市，高中毕业后考上了黑龙江大学经济系，除了经济之外，我[C]学习了四年俄语。,199312123635100931,俄罗斯,1,199312,一封求职信,65,55,36,37,43,218,未参加,
有时我们也觉[B学]得他的要求又严格既[C]不合理{CJX}，可是现在长大了以后，我们才了解父亲那时对我们的要求是对的。,199412123542200026,越南,2,199412,记我的父亲,55,95,60,59,57,315,C,
父亲的去世，这件事儿{CD向我}最近发生的{CJsd}[BQ，]也最难忘的事{CJs}。,199412123523100051,韩国,1,199412,记我的父亲,50,55,28,59,43,214,未参加,
来这儿以后，我一个星期给他打一次电话，他仍然担心我，我再也不生气，我只希望他健康。,199412123523200053,韩国,2,199412,记我的父亲,65,85,36,42,61,279,未参加,
”他的教训都堆[B推]积在我心底，可能永远忘不了。[BC.],199412123525200049,日本,2,199412,记我的父亲,85,90,60,61,67,359,C,
最重要是他培养我独立地{CC的}生活。,199412123635200057,俄罗斯,2,199412,记我的父亲,70,65,31,20,39,211,未参加,
父亲已过七旬了，身体欠佳。,199412123533200089,新加坡,2,199412,记我的父亲,95,70,86,73,82,400,B,
我家{CC1家人}一共八口人，[BC.]父亲、[BC，]母亲和六个孩子。,199412124523200018,韩国,2,199412,记我的父亲,60,75,54,40,78,293,未参加,
所以{CC司以}说{CC谈}，在我们家里，给我最大的{CJX}影响{CQ的}是父亲。,199412124533100065,新加坡,1,199412,记我的父亲,65,70,60,48,74,303,C,
他耐心地帮助我学习，鼓励{CD了}我的信心，在老师的热心帮助下，我对学习有了很大的兴趣。,199412104523100108,韩国,1,199412,记对我影响最大的一个人,75,70,78,65,76,353,C,
可现在没多余{CQ的}时间来介绍[B给]他们。,199412104525100623,日本,1,199412,记对我影响最大的一个人,55,65,68,46,61,277,未参加,
在我还没懂事的时[F時]候，我母亲{CQ就}因病去世{CQ了}。[BC，],199412104625200373,葡萄牙,2,199412,记对我影响最大的一个人,85,80,73,63,69,363,B,
其中最生动的，是中国后秦时代，印度高僧佛陀跋陀罗，来中国庐山译佛经；东汉时，中国皇帝派蔡愔到大月氏取佛经，回国时带了印度僧摄摩腾竺法兰，用白马驮[C]佛经，返回{CC回返}洛阳。,199500533533100026,新加坡,1,199500,记对我影响最大的一个人,95,80,68,63,80,382,C,
