错句,作文编码,国籍,性别,考试时间,作文题目,口试分数,作文分数,听力分数,阅读分数,综合分数,总分,证书
那我们如何来理解{CC了解}这个现象呢？,200103533533150002,新加坡,1,200103,我对离婚问题的看法,90,70,42,30,39,264,未参加,
离婚是一个{CC种}非常痛[B通]苦的课题。,200103533533150002,新加坡,1,200103,我对离婚问题的看法,90,70,42,30,39,264,未参加,
在结婚之前没有深入了解对方，而踏上婚姻的旅途的夫妻都会因为爱情基础建立得{CC的}不稳固而离婚。,200103533533250010,新加坡,2,200103,我对离婚问题的看法,80,85,72,68,90,389,B,
家和万事成，家和万事兴，人人皆知。,200103533533150024,新加坡,1,200103,我对离婚问题的看法,70,75,52,25,66,277,未参加,
望子成龙[F龍]{CD都}是每个父母对孩子的愿[F願]望，每到假期父母亲{CQ都}向朋友借{CD了}一部轿[F轎]车带我们姐弟游山玩水，我们玩得{CQ地}很高兴，我父亲是一位中医[D士][BQ，]他关心病人[BQ，]把别人的病当自[L]己{CQ的}病[BQ。]不幸[B辛]百劳成疾最终{CC终}于一九七四年离开我们去{CD由}天国{CC天家}了。,200110540540150003,印度尼西亚,1,200110,我的童年,70,80,41,47,70,298,未参加,
每天会[F會]把自己的事做好，学[F學]校的功课[F課]也做得好，每一学[F學]期{CQ都}名列前茅。,200110540540250023,印度尼西亚,2,200110,我的童年,70,95,63,47,74,342,C,
父亲经营一间咖啡店，供养一家十多口及一位老祖母。,200110540540250132,印度尼西亚,2,200110,我的童年,65,70,52,49,92,314,未参加,
我很幸运，有这样的父亲，每当我忆起童年{CJ+zxy的回忆}，不由{CC直接}地会想[B悲]起他慈祥的面孔。,200110540540150141,印度尼西亚,1,200110,我的童年,60,95,41,39,85,310,未参加,
所以，回到家第一件事就是扑到母亲怀里痛哭流涕！,200103680519201604,马来西亚,2,200103,我的童年,85,90,83,83,100,437,A,
现在时间不早了，以后再跟{CC给}你们联系。,200104124520200331,蒙古国,2,200104,一封写给父母的信,65,90,58,51,70,325,C,
妈妈！,200104124506100419,巴基斯坦,1,200104,一封写给父母的信,75,85,58,51,65,327,C,
我不在家时不许让妈妈感到寂寞，因为你只有一个亲爱的{CJ-zxy妻子}，而我只有一个妈妈。,200104124545100426,乌兹别克斯坦,1,200104,一封写给父母的信,70,80,47,39,49,275,未参加,
其实不是时间的问题。,200105550523250004,韩国,2,200105,一封写给父母的信,80,75,85,54,74,359,B,
我希望{CQ你们}身体建康[BQ！],200105550523150030,韩国,1,200105,一封写给父母的信,65,55,36,16,51,205,未参加,
你们两位健康吗？,200105550523250047,韩国,2,200105,一封写给父母的信,70,70,38,49,61,276,未参加,
我考完试以后，去釜山看望你们。,200105550523250060,韩国,2,200105,一封写给父母的信,80,70,49,58,51,298,C,
我也不知道为什么这[B达]样，[BC、]可能有点不好意思吧！,200105550523250331,韩国,2,200105,一封写给父母的信,70,75,47,44,47,272,未参加,
谁言寸草心，报得三春晖？[BD┘],200105550523150499,韩国,1,200105,一封写给父母的信,85,85,41,68,70,344,未参加,
在那金黄的沙滩上站着的时候，心里总会觉得很舒服，很轻松。,200105212540200009,印度尼西亚,2,200105,我的一个假期,70,90,77,68,92,390,B,
但是刚开始集训不久，我们就碰到了几个问题。,200105209525100026,日本,1,200105,我的一个假期,80,75,80,75,98,399,B,
广场上有很多五光十色的冰灯、冰雕，我们一时忘了时间{CD过去}。,200105302525100061,日本,1,200105,我的一个假期,65,80,44,75,76,328,未参加,
果然，现在发达国家和发展中国家之间有了明显的差别。{CP而且，发达国家在发展过程中破环了自然环境，给环境带来了很大的损失。P},200105109525200681,日本,2,200105,由“三个和尚没水喝”想到的……,70,70,52,64,82,326,C,
三个人在思想{CC思考}上、[BC，]行为上不一致的话，把最理想的状态先描述出来{CC4设起来}也没有用，首先应该把三个人的目标和达到目标的过程、方法等统一起来，然后三个和尚一起向那目标——[BC，]就是抬水喝迈进。,200105109525100751,日本,1,200105,由“三个和尚没水喝”想到的……,65,60,50,62,82,302,未参加,
虽然我头一次来到这里，{CP不过佛[B沸]教的道理来说如果别人有困难该帮助，你这么说的话，还有资格当和尚吗？P},200105109525100793,日本,1,200105,由“三个和尚没水喝”想到的……,70,55,59,64,61,293,C,
这[F這]两种妇女都是开心的，因为[F為]她们[F們]都在做她们[F們]自己想做的事情。,200106570919250013,加拿大,2,200106,如何看待“妻子回家”,70,85,85,85,80,397,B,
我也有我{CJX}影响的人。,200203522522250011,缅甸,2,200203,记对我影响最大的一个人,65,55,28,44,44,218,未参加,
为什么呢？,200205204525200036,日本,2,200205,如何看待“安乐死”,65,65,52,56,54,276,未参加,
人死以后，就没有办法判断那个人被杀死了或者他自己决定不生活下去。,200205204627100057,瑞士,1,200205,如何看待“安乐死”,65,60,24,38,58,228,未参加,
但除了他们夫妻以外的人{CD们}都不能够了解他们当时的痛苦，而且丈夫的处境也非常困难，总之这是{CJX}不那么简单的事。,200205212525100009,日本,1,200205,如何看待“安乐死”,65,80,66,54,61,314,C,
我的对安乐死的看法是肯定的,200205215525100001,日本,1,200205,如何看待“安乐死”,75,75,77,56,72,345,B,
在病的痛苦之下，患者早已{CC最已}成为疾病{CC疾}的受害者。,200205215606200008,比利时,2,200205,如何看待“安乐死”,80,65,58,42,58,291,C,
这{CD儿}不但会造成家庭{CD的}问题而且会影响社会{CJ+zxy问题}。{CP其次要给孩子多一点空间，[BC。]如给孩子选自己喜爱的活动，[BC。]使他们能{CC有},200210540540150037,印度尼西亚,1,200210,如何解决“代沟”问题,65,65,59,45,39,257,未参加,
当我们的子女[BD，]对我们诉说一件事的时候，[BC。]我们做父母的应该静静的听他们{CD子女}{CD的}诉说完{CD了}，才给意[B遇]见，[BC。]告诉子女们要怎样做。,200210540540250065,印度尼西亚,2,200210,如何解决“代沟”问题,70,60,65,54,62,296,C,
让孩子逐渐[F漸]明白为人处事的道理。,200210540540250084,印度尼西亚,2,200210,如何解决“代沟”问题,80,65,65,58,75,331,C,
假如我们[F們]自己不求上进{CC自进[F進]}，就只会[F會]跟时[F時]代脱离[F離]。,200210540540150098,印度尼西亚,1,200210,如何解决“代沟”问题,65,80,78,93,91,395,B,
从那{CC其}以后[BQ，]我对自己说，我该好好读书[BQ，]不再让我的父母失望。,200205109540200580,印度尼西亚,2,200205,如何面对挫折,75,70,78,71,59,342,B,
我非常爱好体育，可以说到了痴迷的程度。,200205109801100490,澳大利亚,1,200205,如何面对挫折,85,75,84,89,91,416,A,
我的思想使我被社会慢慢地淘汰。,200205109533200961,新加坡,2,200205,如何面对挫折,80,60,34,62,48,271,未参加,
因此我开始加快步伐，赶上城市的节奏。,200205680519250011,马来西亚,2,200205,一封写给父母的信,80,75,70,73,78,367,B,
毕[F畢]竟在精明计划里，利用电脑作为[F爲]教与学的辅助教材在本国来说[F說]还是个较新颖[F穎]的事件{CC课[F課]件}，并不是所有的教育从[F從]事者都{CC所}能接受的。,200205680519250024,马来西亚,2,200205,一封写给父母的信,80,75,73,67,74,360,B,
妈，我也要想{CQ对}你说出迟来的祝福，母亲节快乐！,200205680519150033,马来西亚,1,200205,一封写给父母的信,85,65,57,67,74,337,C,
我相信。,200205680519250034,马来西亚,2,200205,一封写给父母的信,70,65,36,48,61,266,未参加,
在这本书里的其中一章，介绍了斯米坦那的一个有名的精致作品《我的祖国》。,200305533533250024,新加坡,2,200305,我最喜欢读的一本书,60,60,68,65,81,316,未参加,
特别是长征时期丈夫的身份虽比自己高，可以使用车子，但她母亲因为职位低的关[B因]系[BQ，]在怀胎时期也必须[B需]爬山下海而导[F導]致[B至]孩子的流产。,200305533525250038,日本,2,200305,我最喜欢读的一本书,65,65,68,75,65,322,C,
牛顿又说：“那唯一的一本书。,200305533533250033,新加坡,2,200305,我最喜欢读的一本书,75,80,90,75,85,396,B,
这本虽是漫画书，但每一次读它时都让我有着不同的感觉，初看时，被其活泼可爱的漫画所吸引。,200305533533250034,新加坡,2,200305,我最喜欢读的一本书,75,75,79,70,83,372,B,
沙丽认识李查时，她的丈夫儿女刚好去城{CQ里}几天，为了参加展览会和小狗宠物的比赛{CJX}。,200305533533150043,新加坡,1,200305,我最喜欢读的一本书,70,65,68,51,79,319,C,
书中道出了唐三藏、孙悟空、猪八戒和沙和尚上西天取经的艰辛过程。,200305533533250046,新加坡,2,200305,我最喜欢读的一本书,70,70,38,70,88,324,未参加,
我和中国人交流的机会日益增多，越交流越失望{CC3失望越大}。,200304131525200266,日本,2,200304,我学汉语是为了……,65,65,59,60,57,290,C,
我们不要勉强避开声音。,200305576525100003,日本,1,200305,静音环境对人体的危害,65,65,36,65,57,272,未参加,
那，我们跟{CC对}任何人{CJX}拒绝交际吗？,200305576525200015,日本,2,200305,静音环境对人体的危害,65,65,56,63,57,290,C,
我常看见很多青少年到公共厕所里去吸烟。,200405109540100892,印度尼西亚,1,200405,吸烟对个人健康和公众利益的影响,75,85,74,60,66,353,B,
他们是国家的希望，社会的发展核心{CC人物}。,200405109540100892,印度尼西亚,1,200405,吸烟对个人健康和公众利益的影响,75,85,74,60,66,353,B,
在这里我毫不犹豫{CC疑问}地说吸烟是百害而无一利{CJsd}{CJy}。,200405109542100870,越南,1,200405,吸烟对个人健康和公众利益的影响,85,85,40,48,61,314,未参加,
90年代变成了整天疲劳的老百姓的调节办法。,200405109616200700,德国,2,200405,吸烟对个人健康和公众利益的影响,85,65,48,54,55,296,C,
如果香烟{CC烟品}很{CC太}贵[B贯]，必然{CD抽}吸烟者的人数{CJ-zy会}下降{CD了}。,200405109616101491,德国,1,200405,吸烟对个人健康和公众利益的影响,70,70,43,33,41,245,未参加,
第三[BQ，]所有吸烟都影响每个国家或城市甚至人类的未来—青少年与孩子。,200405109547101837,哈萨克斯坦,1,200405,吸烟对个人健康和公众利益的影响,60,70,40,35,48,238,未参加,
许多病也与长期吸烟有关，例如气管炎、心脏病都会随着吸烟而大幅[B复]度上升，危害吸烟人的身体。,200405204922200191,美国,2,200405,吸烟对个人健康和公众利益的影响,85,95,88,65,90,419,B,
不过，政府的这个新规定还是好的。,200405212519200036,马来西亚,2,200405,吸烟对个人健康和公众利益的影响,85,75,68,68,74,362,B,
我发现那些吸烟的人比较容易发火。,200405212540200108,印度尼西亚,2,200405,吸烟对个人健康和公众利益的影响,75,90,58,42,56,315,C,
第二：种[F種]植烟叶[F葉]所造成的环[F環]境破[B迫]坏。,200405209715100120,几内亚比绍,1,200405,吸烟对个人健康和公众利益的影响,80,95,74,63,74,381,B,
”[BC」][BD。]由这[F這]个笑话我们可以体验[F驗]吸烟真有害健康。,200405610610150010,法国,1,200405,吸烟对个人健康和公众利益的影响,70,80,68,63,81,352,C,
这是我的看法。,200505109525100037,日本,1,200505,父母是孩子的第一任老师,60,70,49,61,67,292,未参加,
”{CJ-zhuy这}就是我一辈子难[C]改变{CC2念}的信念。,200505109525200179,日本,2,200505,父母是孩子的第一任老师,75,75,62,63,79,344,C,
其他的方面{CC科[B课]目}也一样{CC2有}。,200505109525100334,日本,1,200505,父母是孩子的第一任老师,55,55,42,44,45,221,未参加,
这是父亲给我留下的{CC了}最深刻的印象。,200505109525101108,日本,1,200505,父母是孩子的第一任老师,90,80,62,64,64,355,C,
我第一次到中国[C]来的时候是1997年。,200505217525200032,日本,2,200505,父母是孩子的第一任老师,65,90,61,63,67,337,C,
谁都不相信我，[BC、]我受到写不出来的打击。,200505217525200049,日本,2,200505,父母是孩子的第一任老师,65,80,46,47,63,289,未参加,
”我认为父母有责任好好教育孩子。,200505217525100147,日本,1,200505,父母是孩子的第一任老师,60,70,54,67,67,303,未参加,
我有二个妹妹。,200505204525100036,日本,1,200505,父母是孩子的第一任老师,75,65,50,55,78,310,C,
从上述{CJ-zxy阐述}可以看出{CC2说}，[BC、]很重要{CJX}在孩子的成长[C]中父母亲的行为和思想观念。,200505204525200107,日本,2,200505,父母是孩子的第一任老师,65,65,52,53,58,277,未参加,
这样对孩子肯定有坏影[C]响。,200505204525100118,日本,1,200505,父母是孩子的第一任老师,55,65,50,49,61,262,未参加,
这{CJX}我觉得非常有意思。,200505204525200115,日本,2,200505,父母是孩子的第一任老师,50,65,39,45,56,236,未参加,
上学以后的孩子尤其受到同学和教师的影响，但在上学之前，父母给孩子的影响确实很大{CD的/CJsd}。,200505204525100485,日本,1,200505,父母是孩子的第一任老师,65,60,54,51,65,278,未参加,
谈教育的时候，父母先考虑的还是学校，哪个学校{CC学生[C]}的教学方式好，哪个学校{CC学生}的老师质量好等等。,200505204525200504,日本,2,200505,父母是孩子的第一任老师,80,80,69,67,96,384,B,
我很想再去北京，很想再有那亲切的感情，能和朋友一起旅游真好！,200105205540200042,印度尼西亚,2,200105,我的一个假期,80,90,67,49,79,360,C,
这是一个三星期的假期，我把这三个星期分为两个阶段{CC段落}。,200110801519150009,马来西亚,1,200110,我的一个假期,85,80,85,63,76,382,B,
虽[F雖]然今年春天的假期已经[F經]过了好一段时间[F間]，可是我真的忘不了当[F當]时跟我姐一家过的开心日子！,200110919919200018,加拿大,2,200110,我的一个假期,75,90,57,70,83,369,C,
我觉得还是和中国人聊天是最有益的，而且很有意思。,200112576525100017,日本,1,200112,如何面对挫折,65,70,46,53,53,273,未参加,
因为我的很多朋友汉语{CJX}学了一年后就要走，所以分别之前一起去了{CJX}旅行。,200105271525200020,日本,2,200105,我的一个假期,65,70,52,58,48,279,未参加,
”[BC’]这个主任的话，我现在[B现]也记得很清楚。,200105271525100074,日本,1,200105,我的一个假期,65,60,44,51,48,251,未参加,
我打算来中国以后去旅游。,200105271525200071,日本,2,200105,我的一个假期,65,80,52,37,48,270,未参加,
那时[B是]候，我认识的一个导游给我们建议{CD了}，[BC。]她说[BQ：]“去台湾好不好？,200105217525200083,日本,2,200105,我的一个假期,65,75,52,58,39,276,未参加,
到了北海道[BQ，]{CJ-zhuy我们}{CJ-sy发现}到处都有雪。,200105204525100014,日本,1,200105,我的一个假期,65,70,57,35,52,265,未参加,
这儿{CD地方}的主要农产品{CC农产物}是做{CC用}沙拉的素菜。,200105204525200022,日本,2,200105,我的一个假期,65,65,22,42,52,230,未参加,
前年寒假，为了去旅行，我决定留在中国。{CP本来我打算去云南，但是因为那时春节{CD的},200105204525200031,日本,2,200105,我的一个假期,65,95,70,65,83,369,C,
他们很热情地招待客人。,200105204525200048,日本,2,200105,我的一个假期,70,75,60,54,55,303,C,
开始之前我看见他们时非常非常{CJcd}高兴{CD地}，但因为那时准备时间{CJs}[BQ，]不能{CJ+sy实现}跟他们见面，表演结束后才见面{CC2实现了}。,200105204525200049,日本,2,200105,我的一个假期,65,75,47,51,48,273,未参加,
首先我很感谢你们。,200105550523250074,韩国,2,200105,一封写给父母的信,65,70,68,54,51,294,C,
我一次也没想过衰弱的爸爸，妈妈，可是去年你们两位都得癌症。,200105550523150087,韩国,1,200105,一封写给父母的信,65,70,71,61,76,329,C,
身体好吗？,200105550523250085,韩国,2,200105,一封写给父母的信,65,70,49,25,49,244,未参加,
以后我想要你们也感受{CC觉得}那种幸福{CC感觉}。,200105550523250124,韩国,2,200105,一封写给父母的信,70,80,58,51,54,303,C,
在北京有很多韩国公司，韩国商品，什么都买得到。,200105550523150130,韩国,1,200105,一封写给父母的信,65,75,44,47,49,267,未参加,
我的爸爸因为种种子，您的脸晒得多，很辛苦，我每见到爸爸的黑色{CJX}脸。,200105550523250162,韩国,2,200105,一封写给父母的信,70,75,49,61,72,316,C,
当孩子一定多次写给你们信{CJshb}，在你们培养我的时间中好像最多五次吧。,200105550523150177,韩国,1,200105,一封写给父母的信,70,65,49,39,47,256,未参加,
我只能去全心全力的努[B怒]力学习，这才是我为你们能做的唯一的事情。,200105550523150181,韩国,1,200105,一封写给父母的信,70,75,71,68,65,338,C,
爸爸，妈妈看见我，就吃惊了。,200105550523250187,韩国,2,200105,一封写给父母的信,65,65,44,47,47,252,未参加,
请原[B愿]谅[B凉]我吧。,200105550523150192,韩国,1,200105,一封写给父母的信,60,60,27,42,45,216,未参加,
好多了吗？,200105550523250260,韩国,2,200105,一封写给父母的信,65,70,63,49,51,284,C,
因为，你们到现在没有休息[BQ，]一直工作。,200105550523250290,韩国,2,200105,一封写给父母的信,70,65,60,51,65,297,C,
最近看起来你很不高兴，我了解你最近的心情。,200105550523250307,韩国,2,200105,一封写给父母的信,65,75,25,47,36,235,未参加,
亲爱的妈妈妈妈，您好！,200105550523250361,韩国,2,200105,一封写给父母的信,65,80,58,56,58,305,C,
在北京学汉语的韩国学生特别多，要是自己不努力学习的话，来中国也没用了，我想多交中国朋友肯定对学汉语有帮助，借此机会，我参加舞会认识了很多朋友。,200105550523250361,韩国,2,200105,一封写给父母的信,65,80,58,56,58,305,C,
现在呢，其中考试也考完了，比一个月前轻松多了。,200105550523250394,韩国,2,200105,一封写给父母的信,75,70,66,51,54,305,C,
为什么偏偏要让我成为{CQ和}你一样的人呢？,200105550523150418,韩国,1,200105,一封写给父母的信,65,65,58,68,76,316,C,
我真谢谢你们的鼓[C]励和关怀。,200105550523150502,韩国,1,200105,一封写给父母的信,70,70,27,51,45,251,未参加,
谢谢[C]！,200105550523250512,韩国,2,200105,一封写给父母的信,70,65,60,63,56,300,C,
我就用水平不够高的汉语{CD但}真诚地回答了。,200105206525100031,日本,1,200105,我的一个假期,65,65,62,77,81,334,C,
不喝水就不能活下去。,200105109525200111,日本,2,200105,由“三个和尚没水喝”想到的……,65,70,45,64,44,274,未参加,
考试也一样，不想学习很长时间，[BC、]这个每个人都一样的。,200105109525100219,日本,1,200105,由“三个和尚没水喝”想到的……,70,65,48,38,35,242,未参加,
因此可以说，[BC、]人的本性中很大的是懒[C]惰[C]，这个懒[C]惰[C]性给人的能力的影响可不少。,200105109525200222,日本,2,200105,由“三个和尚没水喝”想到的……,65,65,54,64,57,289,C,
那文章里头的和尚也一样。,200105109525200301,日本,2,200105,由“三个和尚没水喝”想到的……,65,70,66,71,84,342,C,
他们{CD在}一个人的话，无论是主动的或被动的，{CJ-zy都}有独立意识{CC２心}，靠自己去做某种事，可是如果身旁有人的话，他们就有了依靠心理{CC２心}，不愿意主动地去做。,200105109525200316,日本,2,200105,由“三个和尚没水喝”想到的……,70,65,59,66,79,325,C,
想到这里我不禁感到很矛盾。,200105109525200322,日本,2,200105,由“三个和尚没水喝”想到的……,70,60,61,64,73,313,C,
由“三个和尚没水喝”想到的是和尚也是个人。,200105109525200372,日本,2,200105,由“三个和尚没水喝”想到的……,65,60,43,44,55,250,未参加,
”[BC」]听起来，好美。,200105109525200372,日本,2,200105,由“三个和尚没水喝”想到的……,65,60,43,44,55,250,未参加,
”其语气十分不满。,200105109525100574,日本,1,200105,由“三个和尚没水喝”想到的……,70,70,70,62,97,357,C,
一人{CJX}个说[BQ：][BQ“]没办法。,200105109525100577,日本,1,200105,由“三个和尚没水喝”想到的……,65,60,45,40,44,237,未参加,
是这样的：“我想到{CQ了}好办法，是交替{CC交代}制。,200105109525200622,日本,2,200105,由“三个和尚没水喝”想到的……,60,55,45,47,41,229,未参加,
他们根本没有真正地体会婚姻的重大意义。,200109684542250003,越南,2,200109,我对离婚问题的看法,75,80,70,65,53,334,C,
我也早就开始关心这个问题{CQ了}，一直{CJ-zy在}想“该不该支持安乐死”。,200205217525200068,日本,2,200205,如何看待“安乐死”,70,75,77,72,75,358,B,
我从一般的情况来说，对“自杀”坚决{CJX}采取否定的态度。,200205217525200082,日本,2,200205,如何看待“安乐死”,70,80,35,51,65,291,未参加,
但是就{CC对}人的感情来说[BQ，]这样的情况{CD下}不应该受到法律的制裁。,200205217525100092,日本,1,200205,如何看待“安乐死”,70,75,71,63,82,350,C,
可是，为了实现安乐死，社会一定要有适当的法律制度。,200205205525200016,日本,2,200205,如何看待“安乐死”,75,70,60,67,63,324,C,
如果国家同意这种选择，那么安乐死是可能实现{CJsd}。,200205205529200061,泰国,2,200205,如何看待“安乐死”,75,70,71,74,54,333,C,
我认为，许多患重病的人都想到安乐死问题，[BC。]其中有的人可以告诉家人自己对安乐死的看法。,200205205525200145,日本,2,200205,如何看待“安乐死”,65,80,60,70,80,343,C,
我在日本的时候，{CQ在}电视节目里看到过这种{CC样}事情。,200205206525100007,日本,1,200205,如何看待“安乐死”,65,65,33,51,61,259,未参加,
除了她自己以外，家人也{CJX}可能感到非常难过。,200205206525200025,日本,2,200205,如何看待“安乐死”,65,65,44,45,49,252,未参加,
我们应该还要考虑，因为得了一种重病的人，可能不会{CJ-sy做出}适当的判断，虽然病情很严重，[BC；]还是应该等待他们{CC自己}的末[B未]期。,200205206525200081,日本,2,200205,如何看待“安乐死”,75,70,49,65,54,302,C,
为什么要让它结束[C]呢？,200205332540200001,印度尼西亚,2,200205,如何看待“安乐死”,70,90,69,70,80,372,C,
还应该知道各自{CC互相}的生长环境[C]不一样[BQ。]社会的变化这么快，[BC。]当然{CJX}环境[C]不一样。,200209550523250036,韩国,2,200209,如何解决“代沟”问题,60,60,63,49,42,256,未参加,
谈话是交流思想的一种办法。,200209550523250061,韩国,2,200209,如何解决“代沟”问题,70,75,72,71,62,339,C,
互相不经常见面的时候[L]，至[B只]少每星期一次[B决]{CJX}给父母打电话，父母可能{CJ-sy会}很高兴地跟你聊{CJ+buy了}天。,200209550523250065,韩国,2,200209,如何解决“代沟”问题,60,65,60,81,62,311,C,
我高中的时候，{CJ+zhuy我}也不喜欢在家里，也不喜欢跟父母谈话。,200209550523250095,韩国,2,200209,如何解决“代沟”问题,60,65,36,57,38,239,未参加,
同时，对方也有他们的立场。,200209550523250099,韩国,2,200209,如何解决“代沟”问题,65,65,45,49,48,256,未参加,
两代人在一个时代{CD的人}，[BC。]虽然代沟{CJX}有，但是会解决这代沟问题。,200209550523250125,韩国,2,200209,如何解决“代沟”问题,65,65,54,74,46,288,C,
古代的时候，家庭成员一般做一样的工作。,200209550523250155,韩国,2,200209,如何解决“代沟”问题,65,65,57,52,38,261,未参加,
为什么呢？,200209550523250178,韩国,2,200209,如何解决“代沟”问题,65,60,60,54,42,264,未参加,
现在我们应该开始从对方{CQ的}角度来看问题{CC对方}。,200209550523250192,韩国,2,200209,如何解决“代沟”问题,60,65,60,67,64,299,C,
这样做，两代[L]之间的不理解{CJ+zxy部分}越来越少。,200209550523250202,韩国,2,200209,如何解决“代沟”问题,65,60,36,52,54,250,未参加,
意见是没有正确的。,200209550523150257,韩国,1,200209,如何解决“代沟”问题,65,70,54,67,64,306,C,
也许孩子们跟父母的关系就像朋友一样。,200209550523250262,韩国,2,200209,如何解决“代沟”问题,65,65,30,42,50,236,未参加,
他们对很多事情，比如说，交朋友、考大学等等，有自己的看法。,200209550523250333,韩国,2,200209,如何解决“代沟”问题,80,65,60,74,72,339,C,
然后，在这样心理的基础上开始跟子女真心地谈话，那么肯定子女们都能够{CJ-sy成为}最亲[B新]切的朋友。,200209550523250336,韩国,2,200209,如何解决“代沟”问题,65,60,45,49,56,258,未参加,
我认为每个家都{CJX}无论大小有“代沟”问题。,200209550523250358,韩国,2,200209,如何解决“代沟”问题,65,65,45,76,46,281,未参加,
到底{CJX}“[BC‘]代沟”[BC’]是什么？,200209550523250773,韩国,2,200209,如何解决“代沟”问题,65,60,42,67,60,277,未参加,
在父母眼里他们的子女只是小孩子。,200209550523250802,韩国,2,200209,如何解决“代沟”问题,70,75,54,62,62,312,C,
过去两[C]代人之间的代沟问题不大。,200209550523250840,韩国,2,200209,如何解决“代沟”问题,65,65,60,59,60,293,C,
