错句,作文编码,国籍,性别,考试时间,作文题目,口试分数,作文分数,听力分数,阅读分数,综合分数,总分,证书
我已辞掉秘书工作，白天也一定在家。,199312123525200102,日本,2,199312,一封求职信,55,70,50,74,80,313,未参加,
两{CC二}名。,199312124748200150,突尼斯,2,199312,一封求职信,60,40,22,28,41,168,未参加,
那么我期待着{CD等}贵公司的回答。,199312124523200156,韩国,2,199312,一封求职信,65,65,57,56,57,285,C,
我性格开朗[B郎]，爱活动，爱说话。,199312123525200403,日本,2,199312,一封求职信,70,50,60,52,45,260,未参加,
明年[D（六）]6月左右要毕业。,199312123523100504,韩国,1,199312,一封求职信,60,60,64,67,52,285,未参加,
我出生于汉城，住在麻浦[BQ。]1男3女之中者二{CJ？}。,199410550523202904,韩国,2,199410,一封求职信,55,55,48,41,53,232,未参加,
十几年了，我还是这样想。,199412123625200056,葡萄牙,2,199412,记我的父亲,80,85,54,28,37,278,未参加,
我们互相理解[C]才五年，父亲得了肝癌。,199412123525200073,日本,2,199412,记我的父亲,60,60,54,63,67,286,未参加,
但是当时我家经济条件不好{CC足}，他没{CJ-sy进}高等学校，中学毕业以后马上进入社会开始工作。,199412124525100010,日本,1,199412,记我的父亲,60,60,54,61,72,289,未参加,
我{CD本来}要去外国上大学时他也没有同意，结果我留在我的国家一年没作什么。,199412124727200007,马达加斯加,2,199412,记我的父亲,55,65,46,38,30,216,未参加,
我离开自己家庭那种温暖的气氛到实际生活中去追求亲自确定的目的已[B己]有不少的年头了。,199412124635100013,俄罗斯,1,199412,记我的父亲,65,65,68,67,80,329,C,
他现在还在家里受到家人的批判，{CJ-sy承受}冷淡的目光{CC眼光}。,199412124525100021,日本,1,199412,记我的父亲,65,70,68,77,59,325,C,
她一直没有埋怨或说不高兴的话，但是我们都能看出她对我们的牺[Pxī]牲[B生]和爱护。,199412104533100687,新加坡,1,199412,记对我影响最大的一个人,75,60,70,36,57,284,未参加,
但[BD，]我妈给{CC对}我们三个人一样{CQ的}待遇。,199412104523200659,韩国,2,199412,记对我影响最大的一个人,60,70,73,48,63,299,未参加,
我在这种教育环境下学{CQ到}了公平的观[B欢]念[BQ。]我上高中的时候，过青春期{CQ时}叛逆{CC2过}得比较厉[B厄]害[BQ。]但[BD，]那时我妈一直鼓励[B力]我，同时解决我的很多的烦恼[C]。,199412104523200659,韩国,2,199412,记对我影响最大的一个人,60,70,73,48,63,299,未参加,
就我自己而言，到今天{CD来}我见{CQ过}面的人、我在人物传记里接触的人物不算少，但是他们对我的印象或者影响并[F並]不是很大的。,199412104523100677,韩国,1,199412,记对我影响最大的一个人,65,65,62,71,59,306,C,
考上大学以后，不到一个月我的母亲{CC親母}去世了。,199412104523100675,韩国,1,199412,记对我影响最大的一个人,65,55,33,44,51,230,未参加,
他要让他的儿子看自己的人生{CQ能力}[BD、]{CD强壮}，才能被他的儿子认为{CQ是}父亲。,199412104525100670,日本,1,199412,记对我影响最大的一个人,50,50,46,53,49,226,未参加,
我们[F們]经常讨[F討]论[F論]人生{CQ的}问[F問]题，都得到他的启[F啟]发。[BC，],199412104625100364,葡萄牙,1,199412,记对我影响最大的一个人,70,85,81,63,74,365,C,
他教我怎么[F麼]对待人，爱[F愛]护[F護]人，对自己所做{CC作}的一切要负[F負]责[F責]任；在我最失意的时[F時]候，他时[F時]常安慰我，用一些鼓励的话{CC2說話}，使我振作起来。,199412104625200367,葡萄牙,2,199412,记对我影响最大的一个人,65,65,57,69,69,309,C,
在我生命中的每一天从来都没有这种感受，直到林校长的出现。,199500533533100005,新加坡,1,199500,记对我影响最大的一个人,90,75,70,75,80,384,B,
正当我行结业礼当天，一个{CQ如}睛天霹雳的消息传来，张老师为了赶[F趕]来观礼，而被车撞死了。,199500533533200021,新加坡,2,199500,记对我影响最大的一个人,95,90,62,63,67,376,C,
他对我们要[C]求极为严格，不许我们赌、喝及抽烟，因为他以身作则[F則][BQ，]所以我们几[F幾]{CQ个}兄弟才能有所小成，他是我心中{CQ的}模范。,199500533533100029,新加坡,1,199500,记对我影响最大的一个人,80,85,81,73,82,395,B,
对于她这种凡事要求完美、不能有半点瑕疵的性格，起初我是挺不满的，人又不是机器、电[C]脑，怎会每次一百分？,199500533533200124,新加坡,2,199500,记对我影响最大的一个人,95,90,99,75,90,448,A,
今天，在我们所处的时代，民族自强的中心点，就是在经济层面上，在世界市场上与他人争霸。,199500533533100129,新加坡,1,199500,记对我影响最大的一个人,85,95,99,81,98,454,A,
在那一年我破天荒得到了奖励，得了班里第三名。,199510512501200524,中国,2,199510,记对我影响最大的一个人,90,90,71,75,79,403,B,
上课[F課]的时[F時]间[F間]是每天晚上，吃过晚饭[C]是我们休息的时[F時]候，他却{CD是}刚{CC正}开[C]始他的工作。,199510512501200527,中国,2,199510,记对我影响最大的一个人,85,90,69,68,93,401,B,
所以我常看韩[F韓]国[F國]电[F電]视节[F節]目的一项“[BC「]动物的世界”[BC」]，从[F從]中得出人与动物没有什么两样。,199510550523200904,韩国,2,199510,如何看待“安乐死”,75,75,48,52,41,281,未参加,
是人类无法侵犯的‘神’的[C]领域。[BC、],199510550523100935,韩国,1,199510,如何看待“安乐死”,70,60,64,66,64,309,C,
别人或本人根本就不能控制{CD着}这些人生必经的阶段{CC历[F歷]程}。,199511543501100511,中国,1,199511,如何看待“安乐死”,80,90,79,73,93,410,B,
要知道[C]人有{CJ-sy决定}他自己生存与否的权利，而且若在死者精神[C]清醒的时[F時]候，选[F選]择[F擇]死亡这[F這]条[F條]路，亦不是第三者可[C]左右或可[C]影响的。{CP安乐[C]死[C]是一些[B此]病人得了{CC得到},199511543634200525,英国,2,199511,如何看待“安乐死”,75,90,52,62,68,341,C,
在讨[F討]论[F論]安乐[F樂]死这[F這]{CQ个}问[F問]题[F題]时[F時]，除了动[F動]机[F機]一环[F環]外，有很多实[F實]际[F際]的问[F問]题[F題]我们[F們]{CQ也}需要考虑[F慮]{CD的}。[BC，],199511543501200541,中国,2,199511,如何看待“安乐死”,90,90,64,83,99,424,B,
有关[F關]的辩[F辯]论[F論]已进[F進]行了十多年，世界上还[F還]没有一个[F個]普遍接受的说[F說]法。,199511543501200545,中国,2,199511,如何看待“安乐死”,85,95,83,81,91,431,A,
在使用前，法律必须[F須]先设立一些限制条件{CC4规[F規]限}。,199511543501200559,中国,2,199511,如何看待“安乐死”,80,90,76,75,82,398,B,
如住外地者，本公司尚有专用巴士接送，也有员工宿舍供员工居住。,199503680501100536,中国,1,199503,一封求职信,90,0,86,75,88,337,未参加,
本公司的联络处：中国福建省厦门市中正路5{CC五}段10{CC十}号[BD。]联络电话：07-8886618联系人：季翔[BD。],199503680501100536,中国,1,199503,一封求职信,90,0,86,75,88,337,未参加,
祝贵公司生意兴隆申请人，×××谨启95年3月19日,199503680519100534,马来西亚,1,199503,一封求职信,80,75,74,70,84,374,B,
“[BC「]生为炎黄子孙[F孫]的我们，如果不懂汉语汉文，是多么丢人的事[BQ。]”[BC」]{CP这是我{CJ+sy做}孩提时候，父亲[F親]常提出[C]来训斥{CC训[F訓]示}我的话。,199505529529100009,泰国,1,199505,学习汉语的苦与乐,80,90,52,54,77,348,C,
然而，我的父亲是华人，他一直{CD的}坚持要我学华语。,199505529533200034,新加坡,2,199505,学习汉语的苦与乐,60,95,74,58,88,365,C,
现在{CC当[F當]今}谈起{CJ-sy学}汉[B汗]语的苦，则[C]是受到父母{CD家长[F長]}逼迫到华文[C]学校{CC学[C]生[C]}去学习{CC会书}，心中不情愿{CC3有不小心甘情愿[F願]}去上学，[BC。]而父母{CQ的}命令怎[C]能违[F違]背？[BC，],199505529529100096,泰国,1,199505,学习汉语的苦与乐,55,65,33,37,66,238,未参加,
现[C]在不愿意消极的人问[C]。P},199505104523100021,韩国,1,199505,记对我影响最大的一个人,70,75,60,50,55,299,C,
他是日本著名作家{CC作者}夏日[B目]漱石的关门弟子，而且{CJ-sy是}夏日[B目]最疼爱的弟子之一。,199505104525200026,日本,2,199505,记对我影响最大的一个人,70,75,75,69,69,347,B,
但是最大的原因就[C]是上大学以[C]后我没去过[C]老师的学校[BQ，]原[C]因虽然我很繁忙{CC2忙}地生活[B浩]{CJs}[BQ，]但是最大的原[C]因就是我的不关心[BQ。]我现在打[C]算回国[C]后马上找[C]老师[BQ，]以后继[B断]续联系[BQ。]我希望{CC愿[C]望}我结[C]婚时{CD应[C]该}老师主持{CC2管}结婚{CC2婚}仪[B议]式[B试]。,199505104523100117,韩国,1,199505,记对我影响最大的一个人,50,50,39,22,43,182,未参加,
这种做[B作]法让我们[C]培养了创造性和想像力[BQ。]有一次，我们班的一个男同学犯{CC错}了错误。[BC，],199505104523200126,韩国,2,199505,记对我影响最大的一个人,65,70,68,53,65,307,C,
我认识她，已经十年了。,199505104523100146,韩国,1,199505,记对我影响最大的一个人,65,70,52,73,65,311,C,
他是个搞韩医的人。,199505104523100248,韩国,1,199505,记对我影响最大的一个人,70,55,60,67,61,297,C,
我来到日本以后生{CQ的}孩子，一边抚养孩子，一边工作。,199505104525200252,日本,2,199505,记对我影响最大的一个人,70,60,62,73,69,319,C,
他{CD的}语言不通[BQ，]而且人生路不熟。,199505104614200261,荷兰,2,199505,记对我影响最大的一个人,65,60,54,48,41,251,未参加,
我的汉语水平一般，我[C]不知道{CD了}{CJ-dy我}发音上的问题。,199505104523200269,韩国,2,199505,记对我影响最大的一个人,75,65,70,61,45,303,C,
徐老伯是一家华[C]文报馆[C]的老前辈[F輩][C]，他平时{CQ从}早{CQ到}晚[C]都[C]呆在办公室里，为华文教育贡献{CC献出}[C]{CJ+dy一份}心血。,199505104519200293,马来西亚,2,199505,记对我影响最大的一个人,90,70,46,53,72,324,未参加,
第二点是知识分子的问题。,199505104525100299,日本,1,199505,记对我影响最大的一个人,60,60,46,55,45,248,未参加,
没有她[BQ，]今天的我依然孤独。[BC，],199508682519200547,马来西亚,2,199508,记对我影响最大的一个人,85,80,89,71,78,396,B,
我们一班同学都称他为刘老师。,199508683519200552,马来西亚,2,199508,记对我影响最大的一个人,80,90,83,87,80,415,A,
只能自食其力的每天去卖[F賣]彩票，她为了我将来不要像她一样做个{CQ因}文盲去卖[F賣]彩票的人，所以她努力地卖[F賣]彩票来赚钱，来供给我读书，她为了赚钱就不息劳苦地早出晚归摸黑才回家，所以家里只剩下我一个人，早上就上学去，下午回来就吃妈妈早上做的早粥来[F來]作午饭，直到晚上妈妈才回来陪伴我。,200009542542200001,柬埔寨,2,200009,我的童年,70,80,38,33,56,267,未参加,
虽[F雖]说[F說]没有爱[F愛]情的婚姻是不道德的，但是爱[F愛]情是否真的是整段婚姻的全部。,200010801501250008,中国,2,200010,我对离婚问题的看法,75,80,37,62,72,317,未参加,
我是从韩国来的留学生，我到北京已经十个多月了，现在在北方交通大学学汉语。,200005108523100305,韩国,1,200005,关于用自然之声取代噪声的建议,65,65,18,42,35,209,未参加,
我们不应该把噪声换成好听的大海的波涛声、小河的流水声、鸟的叫声就放心。,200005108525200306,日本,2,200005,关于用自然之声取代噪声的建议,65,65,80,83,69,346,C,
我想在这里提出一个方案。,200005108525100396,日本,1,200005,关于用自然之声取代噪声的建议,65,80,80,85,91,389,B,
那么这么严重的问题怎么处理好呢？,200005108523200707,韩国,2,200005,关于用自然之声取代噪声的建议,75,60,64,65,59,309,C,
如今随着人们生活方式的现代化，各种各样的环境污[C]染也逐[B遂]浙增加了。,200005108523200713,韩国,2,200005,关于用自然之声取代噪声的建议,70,60,61,83,72,331,C,
不会有人了解自己的心情，家庭问题和对人生的希望。,199711802801100017,澳大利亚,1,199711,我选择朋友的标准,80,60,52,65,61,305,未参加,
白天随[F隨]便逛街很有意思。,199705104525200023,日本,2,199705,我的城市/乡村生活,75,60,58,54,54,287,C,
周末或假期去乡村时，感觉很好、想住在那儿。,199705104525200045,日本,2,199705,我的城市/乡村生活,70,65,46,67,68,302,C,
但因为我{CD怕}害羞，不常跟别人说话，因此没有几个朋友。,199705104525200110,日本,2,199705,我的城市/乡村生活,75,75,66,83,87,376,B,
一般有工作的人，在公司里工作时自己的成就比别人少，这成为自己给自己的压力。,199705104523200123,韩国,2,199705,我的城市/乡村生活,60,70,66,67,68,316,C,
这也是妈妈给我的爱{CC1爱情的}标志[B致]吧。,199705104523100173,韩国,1,199705,我的城市/乡村生活,60,40,13,42,32,164,未参加,
这个大学里还有幼儿园、小学、中学，我从小就在这里学习。,199705104523200194,韩国,2,199705,我的城市/乡村生活,70,70,69,72,72,341,C,
那里空气清新，不象城市里的空气污染{CJ-buy那么严重}。,199705529529151007,泰国,1,199705,我的城市/乡村生活,80,85,91,77,90,417,B,
原有的那种情景竟然消失了，不免令我十分伤心。,199705529529151024,泰国,1,199705,我的城市/乡村生活,65,80,81,61,88,363,C,
我觉得热我一定到商店去坐一坐，走一走，歇[B竭]一歇[B竭]，所以我很喜欢住在城市如果我住到乡下去一下活不了，交通又不方便，天气又热，很多设[Pshe]备都不方便。,199705529529251018,泰国,2,199705,我的城市/乡村生活,85,75,44,42,57,295,未参加,
有人认为汉语难学，[BC。]然而在我学习汉语的过程中，从中获得的乐趣使我深深地爱上了这种具有攸久历史的方块字。,199804123542100058,越南,1,199804,学习汉语的苦与乐,90,90,69,89,99,435,B,
当然这样学习很不简单，但韩非子曾说，“天下之大事必作于细，天下之难事必作于易”。,199804123525100165,日本,1,199804,学习汉语的苦与乐,80,85,51,62,78,350,C,
跟以前相比，现在我更兴致勃勃地听一听{CJcd}老师讲的课。,199804123525200170,日本,2,199804,学习汉语的苦与乐,70,70,54,45,62,289,未参加,
汉字{CC中文}是形象文字，因此一个字一个字都有意义。,199804124523100391,韩国,1,199804,学习汉语的苦与乐,65,85,54,47,42,283,未参加,
怎么学得了？,199804124529200427,泰国,2,199804,学习汉语的苦与乐,80,90,60,59,58,342,C,
如果这样做便是伤害天理了。,199805529529151011,泰国,1,199805,如何看待“妻子回家“,90,85,76,80,88,416,A,
记得，在我七岁那年的夏天。,199910512501150002,中国,1,199910,我的童年,85,90,97,86,80,434,A,
在这么多人面前我没{CC不}胆表白，[BC。]把妈妈拉到一边说。,199910512501150006,中国,1,199910,我的童年,75,90,60,64,76,359,C,
一看见她，我们就愣住了。,199904123520200020,蒙古国,2,199904,如何面对挫折,65,65,42,29,37,222,未参加,
我{CJ-zy就}鼓起勇气从容不迫地面对挫折。,199904123522200055,缅甸,2,199904,如何面对挫折,80,75,70,70,76,362,B,
我本来不想到外国上学[BQ，]可没考上好大学{CC3高级大学}后，跟父亲谈了半天终于决定去中国上学。,199904123523100065,韩国,1,199904,如何面对挫折,65,60,48,47,39,242,未参加,
如果不可能避免挫折的话，怎么对待它好呢？,199904123525200084,日本,2,199904,如何面对挫折,50,65,39,47,63,245,未参加,
后来，我慢慢知道最重要的不是我当时想[B相]像的那些东西，而是{CC2而更是}无形的某一个东西。,199904123525200086,日本,2,199904,如何面对挫折,70,60,56,55,65,291,未参加,
有些人就全心全意地{CC的}为事业而老老实实地做。,199904123529200115,泰国,2,199904,如何面对挫折,60,65,45,55,54,262,未参加,
怀着这样的想法再{CQ在}前进{CJX}生活中，最终就成为生活的强者。,199904123523200213,韩国,2,199904,如何面对挫折,65,65,42,52,54,262,未参加,
我们国家有这种俗语“过了困难以后，会得到更好的事”。,199904124523200304,韩国,2,199904,如何面对挫折,60,60,23,39,41,205,未参加,
那时候我开始自己学习英语，几年以后因为我的英语很好我得到{CQ了}奖学金出国学习，[BC。]把困难变成{CC成为}了好处。,199904124608200464,波兰,2,199904,如何面对挫折,65,70,34,37,48,240,未参加,
