错句,作文编码,国籍,性别,考试时间,作文题目,口试分数,作文分数,听力分数,阅读分数,综合分数,总分,证书
活着的时候，很可能我们的生活范[C]围和地位不一样，[BC。]所以我们有时候看不起别人，尊敬比我地位高的人P}。,199605550523290064,韩国,2,199605,由“三个和尚没水喝”想到的……,65,65,55,51,56,276,未参加,
要是您是前者，您太消[C]极地面对世界{CD的}了。,199605550523290075,韩国,2,199605,由“三个和尚没水喝”想到的……,70,70,80,67,77,352,C,
那时期，我国还没发展，只不过{CJ-sy是}落后国家之一。,199605550523290078,韩国,2,199605,由“三个和尚没水喝”想到的……,65,65,74,83,70,341,C,
她[B他]很耐心地{CC的}陪着我到学校读书，还会准备很好的东西，吃的、穿的给我们。,200110540540150040,印度尼西亚,1,200110,我的童年,75,75,49,49,61,299,未参加,
我出[C]生在一个[F個]祖孙[F孫]共居的大家庭里[F裡]，父亲[F親]继承祖父五金铜[F銅]铁[F鐵]店的业[F業]主经理职位，负[F負]起一家几十口生活重担。,200110540540250048,印度尼西亚,2,200110,我的童年,65,70,49,37,45,252,未参加,
自此我们就是孤儿[F兒]寡妇[F婦]更得不到照顾[F顧]了，生活贫苦，一日三餐由祖母供应，清茶淡饭[F飯]过日子，上学读书的费用也得向祖母讨[F討]。,200110540540250048,印度尼西亚,2,200110,我的童年,65,70,49,37,45,252,未参加,
但是，那时[F時]的人（不分是原住民或非原住民）均能和谐融洽相处。,200110540540150061,印度尼西亚,1,200110,我的童年,60,90,47,68,90,345,未参加,
我们生活在世上大致有三个过程，即童年、[BC，]中年以及老年。,200110540540150091,印度尼西亚,1,200110,我的童年,65,85,52,63,88,343,C,
父亲无奈，顺着我意报名去了，哇，当时，{CJ-zhuy我}高兴得不得了，小鸟般地{CC的}飞出门外，跳呀、蹦呀的，表示如愿似偿。,200110540540250096,印度尼西亚,2,200110,我的童年,70,90,52,51,76,332,未参加,
”P}而这些发生的事{CJ-zhuy我}都是由养母口中得知{CJsd}。,200110540540250124,印度尼西亚,2,200110,我的童年,75,80,71,68,70,355,B,
在大学我专修我国人文地理及自然地理[BQ，]并曾在暑[B署]假担任兼职{CD地陪}于人人旅游公司{CJX}。,199312533533100059,新加坡,1,199312,一封求职信,90,80,76,74,80,395,B,
我为了当导游准备了很长时间，[BC.]我先向你们谈谈{CC告诉}我的成绩[C]和经验。[BC.],199312104523100007,韩国,1,199312,一封求职信,65,55,57,47,55,261,未参加,
我在报纸上看到你们{CC您们}快乐家庭旅游公司的招聘启事，我以为，这次{CC件}招聘是{CJX}对我来说很难得的机会，所以给您写这封信。,199312123525200205,日本,2,199312,一封求职信,55,65,55,67,55,280,未参加,
我的TOFEL的成绩一起寄给您，请您看一下，第二外语学了两{CC二}年的日语，考上了日语水平考试的二级。,199312123525100310,日本,1,199312,一封求职信,60,75,57,43,52,273,未参加,
××,199312123605100512,保加利亚,1,199312,一封求职信,55,60,50,39,32,217,未参加,
我在大学学习的时候，已经考上了《日语水平考试》一级。,199312123525200903,日本,2,199312,一封求职信,55,60,43,52,52,243,未参加,
那[C]时我的周围的人{CJ-zy都}强烈{CC尖锐}反对我{CD的}留学。,199412123523200005,韩国,2,199412,记我的父亲,50,65,60,53,55,264,未参加,
但是，后来{CC以后}他觉得吸烟对自己的身体和{CD在}自己旁边的人不好，[BC。]所以不吸了，{CQ这样}已经过了七[BD、]八年{CQ了}。,199412123525200029,日本,2,199412,记我的父亲,55,85,36,28,41,233,未参加,
虽然父亲没告诉我们他很寂寞[B慕]，但是我十分理解{CC感到}他的心情。,199412123525200037,日本,2,199412,记我的父亲,60,90,62,63,45,310,C,
我父亲有一个很好{CQ的}性格特点——[BC—]他很爱他的事业。,199412123635100088,俄罗斯,1,199412,记我的父亲,45,50,60,34,57,223,未参加,
我每次{CC当}回家时，遇到困难时，总是想{CJ-buy起}他。,199412124525200006,日本,2,199412,记我的父亲,65,60,70,71,67,316,C,
我记得我上初中二年级的时候，随[C]着社会经济发展，不少从事教学的人离[C]开教坛[B坦]{CJ+zxy的时候}，很多{CJX}父亲的朋友劝[B欢]他下海[BQ，]{CD而}参加他们的事业，但父亲拒[B构]绝了一切劝[B欢]告而依然如故地在课堂上教学。,199412124523100048,韩国,1,199412,记我的父亲,60,65,78,61,82,329,C,
他一九一{CC十}一年在日本的高知县出生{CD的/CJsd}。,199412124525200051,日本,2,199412,记我的父亲,65,65,52,48,41,255,未参加,
虽然她已经不在这世界{CQ上}{CQ了}，可是她{CQ还}在我心里活着。,199412104523200654,韩国,2,199412,记对我影响最大的一个人,60,65,68,65,57,298,C,
而{CQ对}盲人来说，自己不知道什么时候才能把那毛巾摘下来{CD了}。,199412104525100652,日本,1,199412,记对我影响最大的一个人,70,80,52,53,78,323,未参加,
我们[F們]经常讨[F討]论[F論]人生{CQ的}问[F問]题，都得到他的启[F啟]发。[BC，],199412104625100364,葡萄牙,1,199412,记对我影响最大的一个人,70,85,81,63,74,365,C,
但后[F後]来[F來]她鼓励[F勵]我，我心想，有姑姑在怕什么[F麼]。,199412104625200371,葡萄牙,2,199412,记对我影响最大的一个人,55,80,68,48,57,294,未参加,
但是学习汉语的“[BC「]乐”[BC」]也很多。,199409543525100206,日本,1,199409,学习汉语的苦与乐,85,75,52,68,59,332,C,
至于[F於]学[F學]习[F習]汉语[F語]的乐[F樂]趣，我认[F認]为[F為]能够[F夠]流利地使用汉语[F語]就是我最大的乐[F樂]趣。,199409543501200226,中国,2,199409,学习汉语的苦与乐,85,90,71,52,86,381,C,
从未受过[C]教[Y敎]育，但因为勤奋好学，而写得一手好字。,199500533533200040,新加坡,2,199500,记对我影响最大的一个人,90,90,99,79,90,446,A,
对我影响最大的一个人就是我的第一位上司林大明先生。,199500533519200049,马来西亚,2,199500,记对我影响最大的一个人,95,95,0,34,61,284,未参加,
那小花裙、[BC，]小糊蝶结、[BC，]小灯笼袖，再配上五颜色六色的花边，是多么诱人。[BC，],199500533533200061,新加坡,2,199500,记对我影响最大的一个人,90,85,81,67,82,402,B,
时[F時]间就这样[F樣]过了很多年，我已离[F離]开[F開]那所学[F學]校[BQ。]{CP更离[F離]开[F開]了教会到社会{CQ上}工作，在工作中，我遇到了很多挫折[B拆]，尤其在人事方面，弄到每[B母]在人生旅程中丧[C]失信[Y伩]心，很莫名其妙{CC4奇[B其]妙}。P},199500533533200063,新加坡,2,199500,记对我影响最大的一个人,85,85,36,44,57,302,未参加,
虽然我的“恶”婆婆{CC家婆}给[C]我的生活中{CC上}留{CC创}下了很多不愉快的回忆[BQ，]但无可否认的，她也影响了我的一生，改变了我的性格[BQ，]我还是会感激她，孝敬她的[BQ。],199500533533200075,新加坡,2,199500,记对我影响最大的一个人,95,90,62,61,76,383,C,
最难忘的是，当时她不断利用课堂上多余的时间，教我们许多课外的古典文学，如唐诗、宋词、典故、神话等，使我在唯一用华文教学的华文课学到许多当时[L]无法接触到的东西。,199500533533200144,新加坡,2,199500,记对我影响最大的一个人,85,90,81,53,90,395,C,
如果我们有什么问题，他总是给我们反复讲解，直到我们完全明白为止，但在下课的时候，他会一改他那严肃的外表，和我们大家有说有笑的。,199510512501100503,中国,1,199510,记对我影响最大的一个人,85,85,81,85,100,431,A,
在我人生的旅途中[BQ，]有一个[F個]人经常在我失意、在我悲痛的时[F時]间[F間]想起他{CJZR}。[BC，],199510512501100514,中国,1,199510,记对我影响最大的一个人,80,85,40,73,86,358,未参加,
同学们无[F無]不记[F記]得他。[BC，],199510512501200519,中国,2,199510,记对我影响最大的一个人,90,90,64,64,84,390,C,
其一是涉及伦理道德方面的剖析身为万物之灵长[L]的我们除了产生以外随时随地都易于知遇[C]到应该下决[F決]定、[BC，]做选[C]择的情况。,199510550523100902,韩国,1,199510,如何看待“安乐死”,75,65,48,64,75,314,C,
既然双方都要承受，安乐[F樂]死不失为[F為]一种[F種]好的解决方法。[BC，],199511543501100503,中国,1,199511,如何看待“安乐死”,65,95,79,70,84,384,B,
有那么一次，爷爷教我读书以后，就考我对昨日的单词{CC字}的记忆，[BQ“]东西南北[BQ”]还是{CC或是}[BQ“]东酉南北[BQ”]？[BC。],199505529529100016,泰国,1,199505,学习汉语的苦与乐,80,85,83,70,86,398,B,
我家是三代同堂。{CJ+dy我},199505104523100004,韩国,1,199505,记对我影响最大的一个人,80,80,60,48,61,321,C,
我本人是个没有大学毕业的人。,199505104525100030,日本,1,199505,记对我影响最大的一个人,70,65,54,65,65,305,C,
不愿[C]意[C]{CD把}自己的一切{CJX}为丈夫和孩子贡献[C]。,199505104525200034,日本,2,199505,记对我影响最大的一个人,75,85,68,57,61,339,C,
我的负罪{CC责罪}感现在一点也没有了。,199505104523100050,韩国,1,199505,记对我影响最大的一个人,0,80,62,53,53,245,未参加,
而且他并不是一位没有活过{CC了}的神，他是复活了的。,199505104922100054,美国,1,199505,记对我影响最大的一个人,70,70,54,59,55,296,C,
他三年前已死亡了。,199505104525100061,日本,1,199505,记对我影响最大的一个人,65,55,49,63,57,271,未参加,
他{CJX}是在我人生中最难忘的人之中{CQ的}一位{CC2一}。,199505104523100074,韩国,1,199505,记对我影响最大的一个人,65,70,73,67,67,328,C,
过[C]去，结婚后，不工作，在家里[C]好好照顾丈夫，养孩子，是典型的妇女的人生道[C]路。,199505104525200097,日本,2,199505,记对我影响最大的一个人,75,85,41,63,84,341,未参加,
我是{CJ-dy一个}今年二十七岁的男人。,199505104523100107,韩国,1,199505,记对我影响最大的一个人,65,55,28,59,55,244,未参加,
多亏我父亲的教[C]育，虽然我是个独生女儿，可是常常听别[C]人说我跟一般[C]的独生女儿不一样，而且他们认识我以后改变{CQ了}对独生女儿的偏见。,199505104523200158,韩国,2,199505,记对我影响最大的一个人,70,55,54,50,55,268,未参加,
老师的这种{CC这[C]么}认认真真的态[C]度时不时给我很多启发，[BC。]再加上[BD，]对英文课的兴趣[BQ，]使我{CJ-zy很}容易考上大学了。,199505104523200161,韩国,2,199505,记对我影响最大的一个人,70,75,73,63,57,327,C,
父亲这[C]种坚强的精[C]神能够把我们兄弟姐妹培养成为正常的人{CC1成人}。,199505104523100163,韩国,1,199505,记对我影响最大的一个人,70,80,73,59,76,348,C,
她让我打开心的门，拉我到活泼明[C]朗[C]的世界。,199505104523200202,韩国,2,199505,记对我影响最大的一个人,80,85,78,69,72,378,B,
我能在大学学习{CD有关}国际关系系{CJX}觉得很幸福。[BC.],199505104525100208,日本,1,199505,记对我影响最大的一个人,60,60,39,53,63,257,未参加,
比如我父母或者我的一些老师[F師]。,199505104610100246,法国,1,199505,记对我影响最大的一个人,85,50,62,44,72,299,未参加,
因为我知道了他不是伟人[BQ，]{CD而}只[C]是个平凡的老百姓[C]而已。,199505104525100271,日本,1,199505,记对我影响最大的一个人,70,65,65,73,80,339,C,
听说他现在{CJ-zy在}读研究生。,199505104523200280,韩国,2,199505,记对我影响最大的一个人,70,60,83,67,78,343,C,
因为父母的工作很多，他们没时间照顾我弟弟和我[BQ，]所以由奶奶来代替他们，可以说她是我们的妈。,199505104540200286,印度尼西亚,2,199505,记对我影响最大的一个人,70,65,78,61,61,321,C,
外公是一名裁缝，他每天不分昼夜地裁剪布料，缝制衣服，目的就是赚取更多的金钱，养活妻儿，供书教子，让儿女们将来生活得更好。,199508681519200506,马来西亚,2,199508,记对我影响最大的一个人,90,80,78,69,84,396,B,
外公，我答应您，我一定会考上大学！,199508681519200506,马来西亚,2,199508,记对我影响最大的一个人,90,80,78,69,84,396,B,
父亲不但引我走入一条[F條]光明大道，也影响了我长[F長]大之后[F後]找对象的条[F條]件。[BC，],199508680519200525,马来西亚,2,199508,记对我影响最大的一个人,85,75,68,46,51,317,C,
我的童年是一个愉快的年代，现在回想起来就象刚发生过的事。[BC，],200009542542100004,柬埔寨,1,200009,我的童年,70,75,60,65,63,322,C,
电子声音让人恶心。,200005108525100316,日本,1,200005,关于用自然之声取代噪声的建议,65,65,53,72,63,302,C,
我觉得最大的是习惯的问题，如果把汽车、电话等所有的噪音一下子变成自然之声，人们的脑子一定赶不上其变化，肯定发生电话响了半天也没有人接，在马路上行人没发觉汽车过来而被车撞到等的问题，虽然社会体制那样的东西可以一下子变化，但人不那么完美，人的习惯、思想，经过很长时间才能做到彻底的变化。,200005108525100318,日本,1,200005,关于用自然之声取代噪声的建议,70,70,64,80,89,361,C,
我个人认为[D对]噪声的问题很严重，人类虽然有很大的社会变化的成功但也没有解决的方法。,200005108523100326,韩国,1,200005,关于用自然之声取代噪声的建议,70,65,31,50,37,239,未参加,
但是这样的话是不是只能适应优美的，而缺乏辨别能力，缺乏辨别真假的能力？,200005108523200344,韩国,2,200005,关于用自然之声取代噪声的建议,75,80,83,83,72,384,B,
噪声也是一个人们不想让它存在的问题，所以想方设法地去调节这些不爱听的声音。,200005108529200355,泰国,2,200005,关于用自然之声取代噪声的建议,70,65,75,47,67,310,C,
而此，我们[F們]也可以从[F從]她们[F們]处[F處]学[F學]习[F習]对方的好处和提高自己的素质[F質]。,199711802625200003,葡萄牙,2,199711,我选择朋友的标准,85,80,46,72,89,365,C,
在社会生活中，与他人交往的很自然的，我本人的个性是重感情，所以我用感情配合的因素来选择朋友。[BC．],199711802801100007,澳大利亚,1,199711,我选择朋友的标准,75,60,44,60,54,279,未参加,
班里[F裏]的同学知道了真相以后[F後]也远[F遠]离[F離]了这[F這]个损[F損]友，但是这[F這]人仍然没有改过[F過]。,199711802801100020,澳大利亚,1,199711,我选择朋友的标准,85,75,69,65,84,370,C,
生活在北京一年多的时间{CC目前}，这种感情越深，让我[#][#]这种深刻、美好的印象，也许，我和周围接触的人，有很大的关系。,199705104523100034,韩国,1,199705,我的城市/乡村生活,75,65,69,74,75,345,C,
一边走，一边摘，不知不觉到{CQ了}离我家太远[B运]的水田。,199705104525100089,日本,1,199705,我的城市/乡村生活,65,65,46,45,49,254,未参加,
这种心里每个人都会体[B吃]验[C]过的，简单的说，我对乡村的印象是平稳和安静，会联想到辽阔的平原，温暖的人情味。,199705104523100208,韩国,1,199705,我的城市/乡村生活,70,70,58,58,68,312,C,
这里生活舒适，吃、住、行都很方便，但在人与人之间的关系上却无法寻找过去哪种浓厚情谊[B宜]和诚实的对待。,199705529529151024,泰国,1,199705,我的城市/乡村生活,65,80,81,61,88,363,C,
现在我住在二十五层[F層]高的大厦里[F裡]，每天所看到的是像蚂[F螞]蚁[F蟻]似的忙碌的人们[F們]，在街上跑来跑去，无[F無]数[F數]的车[F車]子在那大大小小的路上跑着，从[F從]窗口望去看不到我记[F記]忆[F憶]中的小河，也看不到那座青山。,199705529529253002,泰国,2,199705,我的城市/乡村生活,75,65,31,44,43,245,未参加,
当他一见到我[BQ，]就把两{CC二}天在乡下的安排跟{CC与}我讲了。,199705610501200005,中国,2,199705,我的城市/乡村生活,95,95,59,73,77,398,B,
那边，又有妈妈在不停的叫：“快点，[BC；]又要晚了……[BC…]”我就用全力的力气把我那像[B象]一百八十斤的身体运动起来，慢慢地走到饭桌上，一桌丰盛{CC丰富}的早饭，就象每天一样，又在等着我。,199705610501100014,中国,1,199705,我的城市/乡村生活,80,60,71,60,66,324,C,
学习之后，没有学习上那么多的进步。,199804123523100188,韩国,1,199804,学习汉语的苦与乐,70,60,36,57,62,270,未参加,
学习汉语，首先汉语的声调{CJX}来说吧[B把]，[BC！]汉语的声调对外国学生{CQ来说}最难掌握的{CD一种}{CJs}，因为我们{CD语言}国语里没有声调，而这么多年一直用韩语{CC2韩国语}，所以很难改韩语{CC2韩国语}的口音，有时候跟中国朋友一块儿谈话的时候，我说的话[BD，]错了{CJX}声调，中国朋友就听不懂，还有汉字，汉字也是觉得不好学，有的汉字读音{CC发音}上一样，可是意思呢，却{CC倒}不一样，这点刚开始学习汉语的学生很难学会的{CJsd}[BQ，]汉字{CC写字}也很难写，很复杂，很容易忘了。,199804123523100192,韩国,1,199804,学习汉语的苦与乐,65,65,42,59,46,261,未参加,
欧洲各国家的语言可以分成{CC分到}三组[BQ，]但是它们都有差不多一样{CQ的}来源{CC2多回源}，我说的是拉丁语。,199804123608200205,波兰,2,199804,学习汉语的苦与乐,75,70,45,37,46,262,未参加,
第三是语调。,199804123523100228,韩国,1,199804,学习汉语的苦与乐,70,55,78,57,58,302,C,
说话应该注意用词汇，应该小心发音等。,199804124523200332,韩国,2,199804,学习汉语的苦与乐,75,75,51,49,52,292,未参加,
我想汉字是最有意思{CJsd}，最别致[B至]的文字{CC字母}。,199804124520200433,蒙古国,2,199804,学习汉语的苦与乐,65,80,75,59,60,327,C,
比如“马”我要马可是把马的声调发成{CC2发音出}四声的话就让人家很生气{CD的话}了。,199804124523100478,韩国,1,199804,学习汉语的苦与乐,65,75,72,54,42,295,C,
他说在公司发生了一件事得去看看，说完就走了，走了后没回来。,199904123523200024,韩国,2,199904,如何面对挫折,65,65,53,39,50,256,未参加,
可是到了上{CJ+zxy学}高年级，大家都懂好歹，成了{CD比较}大人，他们的价值观念变成{CC变成为}以学习成绩为中心的。,199904123525100034,日本,1,199904,如何面对挫折,60,65,45,65,43,261,未参加,
我{CJX}好象抢{CQ了}他们的饭碗似的。,199904123522200055,缅甸,2,199904,如何面对挫折,80,75,70,70,76,362,B,
人在生活和工作中，{CJ-zy会}遇到很多困难。,199904123523200087,韩国,2,199904,如何面对挫折,70,65,48,47,37,253,未参加,
我感到十分害羞丢脸。,199904123540200234,印度尼西亚,2,199904,如何面对挫折,85,75,67,52,72,343,C,
一边学习汉语，一边交流{CQ和}{CJX}很多国家的朋友们。,199904124525200380,日本,2,199904,如何面对挫折,60,65,45,47,52,252,未参加,
“从失败[F敗]中吸取教训”，这种说法在泰国也常听到.我认为人类的一辈子都会遇到不愉快、不顺利的时刻。,199909529529251003,泰国,2,199909,如何面对挫折,75,75,66,74,54,334,C,
那时候，我小小的心灵的确是很痛苦的。,199909529529251007,泰国,2,199909,如何面对挫折,75,80,88,84,80,398,B,
