错句,作文编码,国籍,性别,考试时间,作文题目,口试分数,作文分数,听力分数,阅读分数,综合分数,总分,证书
抽二手烟不但很毒，而且还很辛苦，想想看呼吸是多么地{CC的}不顺畅，反过{CC回}来说也就是一样的[BQ。]不但呼吸困难而且多病体弱，体力下降，那会慢慢地{CC的}被尼古丁包围着，牙齿也开始变黄，慢慢地就会有肺癌、[BC，]鼻癌或皮肤癌的现象出现。,200405332519100053,马来西亚,1,200405,吸烟对个人健康和公众利益的影响,60,70,47,44,56,262,未参加,
可是吸烟者还是那么喜欢。,200405024542200304,越南,2,200405,吸烟对个人健康和公众利益的影响,80,70,63,37,65,305,未参加,
是人们不满足自己现在的婚姻家庭。[BC，],200410534533250061,新加坡,2,200410,最理想的结交方式,90,95,66,72,96,417,B,
男女之间哪种相识的方式是最理想的？,200410534533250121,新加坡,2,200410,最理想的结交方式,90,85,60,49,77,358,C,
当我们还是个孩子时，我敢说没有哪个孩子认为金钱比自己喜欢的职业更重要。,200404140529200248,泰国,2,200404,运动员收入,70,65,49,40,59,269,未参加,
这样对整个社会都有间接的影响。,200405680519150057,马来西亚,1,200405,吸烟对个人健康和公众利益的影响,70,90,49,65,80,347,C,
这样，当他们毕业后，并步入社会上工作时，他们才会懂得与人交往与交流的技巧。,200504534533250014,新加坡,2,200504,我对男女分班的看法,65,80,67,56,84,340,C,
这或许是因为我本人从小到大的教育{CD方式}都是以这类形[B型]式进行。,200504534533250033,新加坡,2,200504,我对男女分班的看法,75,85,78,86,84,401,B,
至于在活动方面，如露营，男同学一般来说可以胜任搭营或负担较粗重的工作。,200504534533250042,新加坡,2,200504,我对男女分班的看法,80,85,76,84,93,412,B,
我对男女应否分班的看法是，这基本上还得视男女所处的教育阶段而定。,200504534519250073,马来西亚,2,200504,我对男女分班的看法,75,85,90,89,88,420,A,
但是在今天这个时代，青少年男女不单只是在校园里才有相识的机会；平时在空闲[F閒]时到娱乐场[C]所、购物中心等也有许多机会结识{CC相识}异[F異]性朋友。[BC.],200504534519150083,马来西亚,1,200504,我对男女分班的看法,70,90,90,86,79,408,B,
我觉得分班是可在学校避免学生早恋，但这样不是最好的做法。,200504534533250159,新加坡,2,200504,我对男女分班的看法,65,70,65,73,70,329,C,
上帝创[L]造了人类，并把它分为男性与女性，目的[B地]就是要让对方有个心灵上的伙伴。,200504534533250164,新加坡,2,200504,我对男女分班的看法,75,85,70,58,70,351,B,
孩子学习很差，我们肯定说是父母的教育不好，不可能说是学校的老师{CQ的}教育{CD的}不好；[BC，]还有比如有一位孩子的爸爸是不好的人，在大家的脑袋[B代]里也肯定觉得他的孩子大了也会象他{CQ那样}不好。,200505109540200541,印度尼西亚,2,200505,父母是孩子的第一任老师,60,75,71,51,79,322,未参加,
父母也不知道孩子能不能懂他们说的内容[C]。,200505109525100621,日本,1,200505,父母是孩子的第一任老师,60,50,58,67,64,279,未参加,
那种教育方式对我有特别的好处[C]，帮助我{CD了}形成现在{CQ的}我。,200505109525201246,日本,2,200505,父母是孩子的第一任老师,65,75,69,60,66,322,C,
一个人的个性，性格及教育不是与生俱来的，而是渐渐得到的。,200505109748101351,突尼斯,1,200505,父母是孩子的第一任老师,90,80,41,35,55,296,未参加,
”经过这些{CJX}父母的指导，现在我还在中国学习。,200505109525201729,日本,2,200505,父母是孩子的第一任老师,65,75,44,45,63,279,未参加,
我觉得对孩子的教育有三个部分。,200505109525102114,日本,1,200505,父母是孩子的第一任老师,45,55,37,59,58,232,未参加,
父母是我们的第一任老师，是他们教我们怎样成为有用的人。,200505204540200394,印度尼西亚,2,200505,父母是孩子的第一任老师,95,75,63,59,72,359,C,
我从小就看到爸爸坐在电视[F視]机前看足球比赛[BQ，]所以我也常坐在他旁边看。,200505204947100410,委内瑞拉,1,200505,父母是孩子的第一任老师,75,75,78,73,76,367,B,
或许[F許]那样的想法与[F與]观[B關]念对[F於]老一辈[F輩]的人，例如：爷[F爺]爷[F爺]、[BC，]奶奶、[BC，]外公、[BC，]外婆[BD…]等，[BC。]是{CD一种[F種]}无[C]法被接受和认[F認]可的，不过我相信在未来的世界和生活里[F裡]这[F這]样的理论[F論]是会慢慢地[B的]被接受而认[F認]同{CJsd}。[BC，],200505951501250002,中国,2,200505,最理想的结交方式,0,75,75,51,64,261,未参加,
所以说[F説]一段好的婚姻能够造就人的一生，但一段坏[F壞]的婚姻是可以{CC能够}破坏{CC践[B贱]踏}{CD了}人的一生的。,200505522522150002,缅甸,1,200505,最理想的结交方式,90,75,75,66,77,377,B,
我跟他说：“结了婚不能在家呆着，还{CQ像}没结婚以前那样在学校教电脑课。,200505522522250016,缅甸,2,200505,最理想的结交方式,65,70,52,49,73,295,未参加,
偶然的机会{CQ下}相遇，彼此一见倾心[BQ，]这才是真正的缘分，这样认识了{CQ之}后双方了解情况后{CC1后来}结婚，结了婚不管发生什么事他们都能解决[BQ，]因为他们是互相恩爱而结的婚[D姻]{CJs}，两个人即使{CC一旦}有冲突{CC突冲}也不会长久{CD的}[BQ，]因为爱才能退步或有耐心{CC忍心}。,200505522522250019,缅甸,2,200505,最理想的结交方式,65,70,50,42,50,263,未参加,
现在虽然有不同的观念[BQ，]但仍然不能取代父母对孩子的重要性。,200505209542100084,越南,1,200505,父母是孩子的第一任老师,55,60,56,45,58,255,未参加,
《三字经》曾有“人之初，性本善”，每个孩子一生下来他们的本性{CC2性}还是善良的。,200505209542200083,越南,2,200505,父母是孩子的第一任老师,85,85,56,55,65,341,C,
有一天吃午饭的时候，我不小心把几粒米饭掉到桌子上。[BC，],200505209542200101,越南,2,200505,父母是孩子的第一任老师,65,80,58,61,52,304,C,
我[C]完全同意“父母是孩子的第一任老师”这个想法。,200505226540100072,印度尼西亚,1,200505,父母是孩子的第一任老师,70,50,41,41,45,230,未参加,
他们也有自己的思想，所以你们只应该分析给孩子{CJ-wy听}[BQ，]让他们能够明白。,200505024542200364,越南,2,200505,父母是孩子的第一任老师,45,70,48,49,61,255,未参加,
一种果只能从一种树产出来，所以父母永远是孩子独一无二的老师。,200505225542200037,越南,2,200505,父母是孩子的第一任老师,80,65,56,45,50,284,未参加,
我希望在服务业当上经理，是因为我本身认为新加坡的服务很差。,200509534533250003,新加坡,2,200509,一封求职信,60,80,75,53,55,310,未参加,
快乐家庭旅游公司文明路一号新加坡123456二零零五年九月十七日李文小姐：快乐家庭旅游公司招聘启事我在九月十日的[BQ《]联合早报[BQ》]看到您的招聘启事。,200509534533250030,新加坡,2,200509,一封求职信,65,70,63,58,73,315,C,
BIK862#05-398Tampinesst83sipore520862尊敬的李文先生：本人是新加坡人，女性，年龄25岁，毕业于新加坡理工学院，广告设计系。,200509534533250036,新加坡,2,200509,一封求职信,85,85,77,53,95,390,C,
静候佳音。,200509534533250086,新加坡,2,200509,一封求职信,70,70,63,66,88,345,C,
快乐家庭旅游公司人力资源部经理：看到贵公司的招聘启事，本人对导游一职非常感兴趣。,200509534533250118,新加坡,2,200509,一封求职信,75,70,88,73,88,383,B,
我的名字叫×××，今年二十五岁。,200509534533250122,新加坡,2,200509,一封求职信,70,70,61,51,77,317,C,
×××2005年9月17日,200509534533250122,新加坡,2,200509,一封求职信,70,70,61,51,77,317,C,
希望可以尽快得到贵公司的回应。,200509534533250144,新加坡,2,200509,一封求职信,75,70,75,60,79,348,C,
所以，我恳请您仔细考虑我的请求。,200509534533250153,新加坡,2,200509,一封求职信,75,70,75,69,84,362,B,
至此，本人敬候佳音{CC待候佳音}。,200509534533250160,新加坡,2,200509,一封求职信,70,65,77,73,88,359,C,
我是23岁的大学生[BQ，]身高1.67米，有一张瓜子脸和一双炯炯有神的眼睛。,200509534533150182,新加坡,1,200509,一封求职信,65,65,70,66,84,334,C,
我能够保证我是一个尽心尽力的员工，也会多读书[L]，充实自己，带来更丰富和愉快的旅程{CJX}给游客。,200509534533250191,新加坡,2,200509,一封求职信,65,65,77,60,73,324,C,
对蔑视流行歌曲的人感到很不理解。,200510111801200201,澳大利亚,2,200510,我看流行歌曲,95,90,79,83,100,446,A,
有的时候，流行歌曲听起来，太重视爱情，所以一般老人不太喜欢流行歌曲。,200510111523200420,韩国,2,200510,我看流行歌曲,70,50,56,48,45,252,未参加,
流行歌曲有很多好外，也{CC1相反}有很多缺[C]点，特别是给学生不好的影向。[BC，],200510111523100794,韩国,1,200510,我看流行歌曲,55,50,46,34,55,219,未参加,
因为他通过歌[C]词批评[B平]当时社会的一些不足{CD的}，而提倡[B昌]一些社会需[C]要[C]的要求。,200510111523100819,韩国,1,200510,我看流行歌曲,70,80,60,61,64,325,C,
由于每个人的爱好、想法不同，[BC、]对流行歌曲的看法也不一样。,200510111523200848,韩国,2,200510,我看流行歌曲,70,70,63,32,52,275,未参加,
有些人认为、流行歌曲只为{CC1为了}年轻人制作[B做]的{CJsd}，歌词的内容也不值得。,200510111523200848,韩国,2,200510,我看流行歌曲,70,70,63,32,52,275,未参加,
有的时候，流行歌曲是很好的老师，很好的朋友。,200510111523201032,韩国,2,200510,我看流行歌曲,75,80,58,46,67,317,C,
流行歌曲为什么有很多观众去听呢？,200510111523101253,韩国,1,200510,我看流行歌曲,75,85,72,67,55,347,B,
比如说，我感到不愉快的时候会播[Pbō]放光良的歌然后感到安慰，因为光良的歌往往都是比较平静，而这会让我放松心情[B清]，忘掉烦恼[B脑]。,200510111801201260,澳大利亚,2,200510,我看流行歌曲,75,70,72,56,59,321,C,
因为，什么新鲜的事，我接[C]受得{CC的}{CJ-zy都}太慢[C]，[BC。]流行歌曲也不例外。,200510111419101651,哈萨克族,1,200510,我看流行歌曲,75,75,56,48,67,311,未参加,
我比较喜欢流行歌曲。,200510111523201872,韩国,2,200510,我看流行歌曲,60,60,60,48,69,279,未参加,
小{CD个}孩子在出生后大多都是在父母的关怀和爱护下长大的。,200510919501250016,中国,2,200510,父母是孩子的第一任老师,75,85,95,79,99,426,A,
而我对流行歌曲的看法是它是最好的。,200510520520150013,蒙古国,1,200510,我看流行歌曲,75,75,63,50,69,322,C,
但流行歌曲有弊的一面更强一些，特别是对像我一样得认真学习的青少年们。,200510302523200012,韩国,2,200510,我看流行歌曲,85,90,86,79,89,425,A,
我喜欢流行歌曲，而且经常听。,200510302523200020,韩国,2,200510,我看流行歌曲,75,70,72,75,89,370,B,
我们韩国流行歌手非常多，而且{CQ在}亚州里边很有名。,200510302523100087,韩国,1,200510,我看流行歌曲,50,55,44,36,50,214,未参加,
到了现代，随着社会经济的发展和职业的多样化{CD而}音乐也变了很多，类型也繁多了。,200510302523200082,韩国,2,200510,我看流行歌曲,65,85,70,61,87,358,C,
喜欢流行歌曲的原因有很多。,200510302523200167,韩国,2,200510,我看流行歌曲,70,80,49,34,52,275,未参加,
可是有些人并不喜欢流行歌曲，甚至蔑视流行歌曲。,200510302523200194,韩国,2,200510,我看流行歌曲,80,80,72,67,87,378,B,
这有个例子，有位港星，叫张国荣。,200510302523100203,韩国,1,200510,我看流行歌曲,80,75,88,69,89,392,B,
那时，拿出十分钟[L]左右来听喜欢的歌曲，就会放松，[BC。]跟外国人交流起[L]来时也有很大的帮助，[BC。]拿流行歌曲与外国人交流，你给外国人介绍祖国现代文化并且你可以学外语。{CJ-zhuy流行音乐},200510302523100214,韩国,1,200510,我看流行歌曲,70,65,58,61,59,299,C,
当然这要靠{CC看}我们每个人的努力，{CJ-sy靠}中国音乐爱好者的努力。[BC，],200510627627250006,瑞士,2,200510,我看流行歌曲,80,85,60,59,74,352,C,
它之所以受到喜欢，我认[F認]为[F為]应该[F該]是它以轻[F輕]快的节[F節]奏以及平淡的歌词[F詞]内容，让[F讓]听者容易吸收，甚至于[F於]跟从[F從]，以至最终{CC终}痴迷。,200510529529251019,泰国,2,200510,我看流行歌曲,75,75,56,52,69,317,未参加,
这类歌曲有时代的命脉，有时代的豪[C]迈，它是歌曲界的姣姣者，听或唱时代歌{CJ+sy是}意味着我们正与时代同步，我指的是有价值有代表性的时代歌曲。[BC.],200510529529151036,泰国,1,200510,我看流行歌曲,55,75,70,56,94,335,C,
我有一个妹妹，在家就只有和妈妈一起生活。,200510540540200001,印度尼西亚,2,200510,我看流行歌曲,80,70,42,24,47,253,未参加,
流行歌曲对我来说是带着新鲜感，充满活力，甚至也能改变我们的心情。,200510540540200051,印度尼西亚,2,200510,我看流行歌曲,65,85,67,56,74,337,C,
但是，并不是每一首歌我都喜欢。,200510540540200053,印度尼西亚,2,200510,我看流行歌曲,70,65,70,69,64,324,C,
有些人可能说[F說]，父母不教的话[F話]，老师可以教好。,200509602801250009,澳大利亚,2,200509,父母是孩子的第一任老师,70,70,71,63,77,339,C,
可惜这次旅游没有{CQ和}你们{CC2您}一起去，不然女儿{CC2女}肯定会更加愉快的。,200104124529200012,泰国,2,200104,一封写给父母的信,70,80,68,35,58,301,未参加,
贸易工作方面我在中国有一些人际关系。,200104124525200031,日本,2,200104,一封写给父母的信,70,65,63,75,54,313,C,
天气{CJ+zy都}暖和了，不太冷，我又没有得什么病。,200104124523200088,韩国,2,200104,一封写给父母的信,65,55,60,35,58,255,未参加,
虽然我没给你们打电话，但是我天天想你们，只不过有的时候忘了日子[BD……]。,200104124523200104,韩国,2,200104,一封写给父母的信,70,80,44,25,31,240,未参加,
我希望爸爸身体健康，[BC。]妈妈也一样。,200104124523200183,韩国,2,200104,一封写给父母的信,75,85,38,47,40,278,未参加,
啊！,200104124523200183,韩国,2,200104,一封写给父母的信,75,85,38,47,40,278,未参加,
妈，爸你们{CC您们}在印尼过得怎么样？,200104124540200193,印度尼西亚,2,200104,一封写给父母的信,65,60,25,30,31,194,未参加,
我们从下星期三就开始期末考试了。,200104124523200390,韩国,2,200104,一封写给父母的信,70,80,52,44,42,278,未参加,
比如说，[BC、]自己的孩子得了永远治不好{CC3不治}的病。,199604123525100061,日本,1,199604,如何看待“安乐死”,55,60,56,47,49,248,未参加,
我觉得“安乐死”应该{CJ+sy看待}肯定的。,199604124523200045,韩国,2,199604,如何看待“安乐死”,70,60,66,66,47,293,C,
我也不敢提议最合理的意见。,199604124627200009,瑞士,2,199604,如何看待“安乐死”,55,55,45,39,42,216,未参加,
从现在我不知道制定什么规律，提出什么问题。,199604123525100255,日本,1,199604,如何看待“安乐死”,50,60,37,52,52,230,未参加,
如果这件事在日本发生的话，那我就同意中国法院的决定。,199604124525100180,日本,1,199604,如何看待“安乐死”,65,75,79,76,67,349,B,
短文中的妻子得了一种不治之症，而且十分痛苦，她为了解决痛苦，决定自杀。,199604124525200206,日本,2,199604,如何看待“安乐死”,60,70,61,76,70,321,C,
法院不追究{CC推求}医生的责任，优先{CJ-sy考虑}了“人权”。,199604124525100068,日本,1,199604,如何看待“安乐死”,50,50,42,52,47,217,未参加,
对他——病人来说是很痛苦，她对亲人造成无穷的辛[B幸]苦。,199604123542200098,越南,2,199604,如何看待“安乐死”,70,65,50,49,49,268,未参加,
这样只给亲戚{CC2亲戚人}添[C]麻烦而且她继续{CC续继}受到痛苦，最好应该早自己结束自己的生命{CC命运}。,199604123542200141,越南,2,199604,如何看待“安乐死”,70,60,32,49,0,195,未参加,
首先孩子们[F們]应该[F該]可以从学校和家里认识到长[F長]辈[F軰]们[F們]是出生{CC出身}在不同的时代和生活环境，他们[F們]的人生观{CJ+sy是}主要定型于当年的特定环境里。,199610802801100021,澳大利亚,1,199610,如何解决“代沟”问题,90,75,70,61,72,362,B,
两代人之间的“代沟”问题，现在不管是哪[B那]个国家都会出现{CC2出}{CJ+by这个问题}。,199610512501250009,中国,2,199610,如何解决“代沟”问题,70,80,65,42,65,312,C,
现代青少年喜欢跳舞，父母了解[C]那个情况后可以去{CJld}，但是告诉{CC2说}他们出去后早回家吧。,199610550523190036,韩国,1,199610,如何解决“代沟”问题,50,50,44,32,47,201,未参加,
人生若一事无成，就好比掷下千两黄金未买一物！,199603533533200022,新加坡,2,199603,由“三个和尚没水喝”想到的……,85,95,74,54,72,376,B,
想办法呀！,199603533533200030,新加坡,2,199603,由“三个和尚没水喝”想到的……,85,90,63,60,87,381,C,
在黑暗中，仿佛看到表姐阿心趴在地下，一只野狗正朝她的脸上抓。,199603533533200056,新加坡,2,199603,由“三个和尚没水喝”想到的……,90,80,71,72,94,402,B,
我不是自费来的留学生，而是公司派来的。,199603533525100066,日本,1,199603,由“三个和尚没水喝”想到的……,80,70,55,65,72,332,C,
两{CC二}个和尚，他们有伴了。,199603533533200101,新加坡,2,199603,由“三个和尚没水喝”想到的……,85,70,55,47,51,299,未参加,
在公司里，可以觉察到：复印机不能操作，[BC。]不是因为失灵，而是机里的纸用完了，没人主动去添。,199603533533100105,新加坡,1,199603,由“三个和尚没水喝”想到的……,90,85,83,79,75,409,A,
人脑的某些功[B工]能，开始进入“退休”状况。,199603533533200104,新加坡,2,199603,由“三个和尚没水喝”想到的……,90,75,80,72,96,407,B,
挑的人多了，自然地{CC的}水也{CC了}增多了。,199604680519200508,马来西亚,2,199604,由“三个和尚没水喝”想到的……,95,65,46,63,65,326,C,
”第三位矮和尚也是如此想。,199604680519200509,马来西亚,2,199604,由“三个和尚没水喝”想到的……,85,75,80,81,100,413,B,
”[BC」]虽然电脑[F腦]网[B纲]络带给人民极大的方便，许多资讯{CC知讯}可随[F隨]手而得；但[BD，]我们是{CC有}否想过，若滥用这先进的科技，许多犯罪的事件也不断的增加。,199604680519200518,马来西亚,2,199604,由“三个和尚没水喝”想到的……,95,70,58,76,75,368,C,
如果人类都有慈悲的的话，都不会发生的，或者不{CJ-zy能}解决的问题。,199605104525100030,日本,1,199605,由“三个和尚没水喝”想到的……,65,65,58,60,54,286,C,
80年代，中国改革开放以后，这个“三个和尚没水喝”的现象渐渐改变了，[BC。]因为中国政府用有效的政策调动了中国人民的积极性。,199605104523100043,韩国,1,199605,由“三个和尚没水喝”想到的……,75,80,63,67,61,337,C,
但是对于很容易丧失{CC消失}志气的我们现代年青人来说，这可是很难坚[B竖]持{CJ+zxy的态度}的{CC了}。,199605104525100044,日本,1,199605,由“三个和尚没水喝”想到的……,65,70,91,79,82,373,C,
所以一旦参与这个项目{CC事业}的话，不能随[F隨]便下台。P},199605104523200067,韩国,2,199605,由“三个和尚没水喝”想到的……,80,65,71,76,75,355,B,
不过应该看现在的社会趋向，然后互相[B想]提醒防止自私[C]的现象{CY}。,199605104523100074,韩国,1,199605,由“三个和尚没水喝”想到的……,65,65,52,65,72,303,C,
过了一会儿，B和尚到这里{CJX}来，他觉得非常渴，想喝点儿水解解渴。,199605104525100084,日本,1,199605,由“三个和尚没水喝”想到的……,65,70,55,70,75,321,C,
”[BC。]过了一段时间，老和尚也难以抑制{CC死心}他们的好奇心[BQ，]{CQ于是}就下山了，终于知道了年轻和尚的秘密。,199605104525200091,日本,2,199605,由“三个和尚没水喝”想到的……,70,65,55,58,68,302,C,
因为那{CC这}时他们俩可以相互帮助。,199605104523100097,韩国,1,199605,由“三个和尚没水喝”想到的……,60,65,21,54,51,234,未参加,
老大今年十五岁，[BC、]老二十四岁，老三十岁。,199605104525200096,日本,2,199605,由“三个和尚没水喝”想到的……,90,80,69,58,77,369,C,
对自己有好处{CC长处}或者坏处{CC短处}是以后的问题，不要先考虑自己的利益。,199605104523200101,韩国,2,199605,由“三个和尚没水喝”想到的……,70,65,80,65,65,331,C,
在那座庙里许多和尚{CJy}，他们之中，除了地位高的和尚以外，其他{CC其它}的大部分人天天干活。,199605104525200168,日本,2,199605,由“三个和尚没水喝”想到的……,65,65,66,70,75,325,C,
我觉得三个和尚的心理[B里]是人类共有{CC拥有}的，所以{CQ要}好好研究{CC说谈}。,199605104525100175,日本,1,199605,由“三个和尚没水喝”想到的……,65,55,60,63,63,288,C,
我们日常生活中也常常遇到这种情况。,199605104525100195,日本,1,199605,由“三个和尚没水喝”想到的……,65,55,66,74,75,317,C,
可是呢，对别人的“依赖感”太大的话，那个人可以说“不独立的人”了{CJs}。,199605104525100195,日本,1,199605,由“三个和尚没水喝”想到的……,65,55,66,74,75,317,C,
这个故事里的第一个和尚只能挑自己{CJX}够用的水，[BC。]他一个人的力量不大，所以{CD就以}少量的水就满足。,199605104525200229,日本,2,199605,由“三个和尚没水喝”想到的……,70,50,46,51,70,270,未参加,
我也不例外。,199605104525100249,日本,1,199605,由“三个和尚没水喝”想到的……,60,65,38,54,56,256,未参加,
他们[C]三位和尚都没想出来别的办法，[BC。]能想出来那[#]可能不会没有了{CJX}喝{CJX}水。,199605104525200243,日本,2,199605,由“三个和尚没水喝”想到的……,55,50,55,45,35,219,未参加,
但是，实际上和尚也是一个跟普普通通的老百姓[B性]一样[BD、]{CQ的}人。,199605104525100252,日本,1,199605,由“三个和尚没水喝”想到的……,70,60,66,67,72,320,C,
为了满足自己的要求、欲望、目的，{CJ-zhuy人们}往往会浪费人类宝贵的自然财产，[BC。]甚至有些人不顾自己的行为，总是批评他人过分[B份]地使用自然资源。,199605104525100274,日本,1,199605,由“三个和尚没水喝”想到的……,70,55,69,70,65,313,C,
他们就做礼拜请求上帝给他们水。,199605104540200277,印度尼西亚,2,199605,由“三个和尚没水喝”想到的……,65,65,44,33,58,249,未参加,
我们就是公民[BQ，]不能总等国家为公民做什么，[BC。]公民{CQ应}先主动{CC2找}为国家做{CQ些}什么。,199605104523200306,韩国,2,199605,由“三个和尚没水喝”想到的……,60,50,60,51,42,243,未参加,
突然想起了韩国的故事。,199605104523200325,韩国,2,199605,由“三个和尚没水喝”想到的……,75,75,52,47,80,319,未参加,
这[C]是因为日本[C]人特别重视人和人之间[C]的和谐。,199605104525100360,日本,1,199605,由“三个和尚没水喝”想到的……,65,70,80,72,80,353,C,
谁也不让谁，互相等待，终于都没有水喝了。,199605104540100358,印度尼西亚,1,199605,由“三个和尚没水喝”想到的……,65,60,60,65,58,291,C,
你要不要跟我品尝{CC2尝}满足我们的生活的秩序的真正滋味{CC2味}{CQ呢}？,199605550523190065,韩国,1,199605,由“三个和尚没水喝”想到的……,70,80,52,60,68,320,C,
可是，我也提出一个意见。,199605550523290080,韩国,2,199605,由“三个和尚没水喝”想到的……,65,65,49,47,56,266,未参加,
故乡[F鄉]对我的影响不太深刻是因为我七岁的时候已经搬到椰加达去了。,200110540540150071,印度尼西亚,1,200110,我的童年,65,85,52,49,58,299,未参加,
而在大学时期，我乃是探险队的会长，有着无数向高山征服的记录。,199312533533100025,新加坡,1,199312,一封求职信,90,75,76,74,80,389,B,
×××美芝路5号新加坡00554.12.93李文先生应征广告设计师本人在报上阅读到贵公司的招聘启事，在此想应征贵公司广告设计师一职。,199312533533100066,新加坡,1,199312,一封求职信,85,65,76,76,78,371,B,
相信对往后的工作，一定有用。,199312533533100082,新加坡,1,199312,一封求职信,90,75,85,70,75,389,B,
本人×××，在新加坡国立大学{CD国立大学}毕业，曾在某间旅游公司担任高级主任六年。,199312533533200143,新加坡,2,199312,一封求职信,90,90,55,45,75,353,未参加,
快乐家庭旅游公司：您好！[BC？],199312123523200603,韩国,2,199312,一封求职信,60,50,41,67,50,248,未参加,
李文先生：[BC，]你好[C]！,199312123523200708,韩国,2,199312,一封求职信,55,60,50,36,41,223,未参加,
我叫×××，今年把大学毕[C]业了{CJba}。[BC.],199312123523200709,韩国,2,199312,一封求职信,55,50,25,39,43,191,未参加,
