错句,作文编码,国籍,性别,考试时间,作文题目,口试分数,作文分数,听力分数,阅读分数,综合分数,总分,证书
当时我父亲是个理发匠，在中国家乡和母亲结婚{CC2婚[C]}后只身南来，他没受过教育[BQ，]靠手艺讨生活{CC3讨活}。,199500533533200126,新加坡,2,199500,记对我影响最大的一个人,90,80,70,59,78,372,B,
我时常在想[BQ，]如果没有乐于助人的李大姐，我现在一定是个文盲。,199500533533200126,新加坡,2,199500,记对我影响最大的一个人,90,80,70,59,78,372,B,
她没有结婚，没[C]有子女，可是被她培育{CC培植}出来的学[F學]生是桃李满[F滿]天下。[BC，],199510512501200508,中国,2,199510,记对我影响最大的一个人,90,95,48,48,61,340,未参加,
妈[F媽]妈[F媽]也不勉[B免]强我，就带我到公园[F園]散步。[BC，],199510512512100506,菲律宾,1,199510,记对我影响最大的一个人,90,95,55,54,57,349,C,
你再刻苦一年就要毕[F畢]业了，再怎么说也应该[F該]继续读下去，完成学业。,199510512501200532,中国,2,199510,记对我影响最大的一个人,90,85,62,46,79,359,C,
所以在这儿很多问题{CJX}产生{CC发生}{CJ+buy起来}。,199510550523100901,韩国,1,199510,如何看待“安乐死”,75,70,43,50,57,284,未参加,
长期的如此，极有可能产生更严重的后果，到那时候，恐怕会{CC是}又多几个卧病不起的患者。[BC.],199511543501100526,中国,1,199511,如何看待“安乐死”,85,95,81,77,99,433,B,
但任何的社会[F會]，甚至[C]国[F國]家都是用法律去约束人们[F們]的行为[F為]{CJsd}，任何人都没有权利{CC权[F權]力}去结束另一个[F個]人的生命，包括医[F醫]生在内。,199511543501200550,中国,2,199511,如何看待“安乐死”,80,90,59,70,88,382,B,
兹附{CD下}个人资料与履历如下：姓名：×××性别：男年龄：四十七岁[C]学历：一九六八年毕业于柔佛新山宽柔中学{CD高中三}商科履历：一九六九年至一九八0年任职于大山服装公司，为一名推销员，负责推销与收账的工作[BQ。]一九八一年至一九九五年，任职于顺利服装公司，为一名推销主任，有两{CC二}位下属[C]协[F協]助打理公司的营业部门。,199503682519100512,马来西亚,1,199503,一封求职信,75,85,43,52,66,314,未参加,
毕业后曾在美国一家{CC件}服装设计公司服务两年，而今欲返回故国发展。,199503681519200555,马来西亚,2,199503,一封求职信,75,80,69,60,79,354,C,
大学毕业后，{CJ-zhuy我}曾在母校担任助教一年，这段时间给了我一个很好磨练{CJX}的机会，也获得{CQ了}教授们{CQ的}称许{CJjy}。,199503680519100502,马来西亚,1,199503,一封求职信,90,95,62,56,79,380,C,
我希望我也{CQ能}当跟我妈一样{CQ的}好妈妈。,199505550523200911,韩国,2,199505,记对我影响最大的一个人,70,65,62,57,39,279,未参加,
乐也，就是学汉语之后[F後]，增加了在[C]泰语中所没有的成语故事的知识{CC成语}，如叶公好龙，不入虎穴，焉得虎子，中国的俗语如：望子成龙，珠联璧[C]合等[C]……。,199505529529100066,泰国,1,199505,学习汉语的苦与乐,85,90,57,41,57,326,未参加,
他在家里总是{CJ+sy说}开玩笑，逗[C]笑，带[C]给{CC来}家里人不少的幽默[C]，甚至这些样子好象装傻子似的。,199505104525200023,日本,2,199505,记对我影响最大的一个人,65,80,52,61,65,311,C,
我是在东京上业余汉语学校的时候认识他的。,199505104525100043,日本,1,199505,记对我影响最大的一个人,70,55,70,44,69,292,未参加,
他的教育方法跟别的教师不一样。{CP一般来说，[BC、]日本的教育想法是“平等第一”，[BC、]所以一般的公立学校没有班之间的能力区别，[BC、]何况跳级制度。P},199505104525100052,日本,1,199505,记对我影响最大的一个人,65,65,44,69,53,280,未参加,
我是已经毕业了{CQ的}研究生。,199505104523200068,韩国,2,199505,记对我影响最大的一个人,50,70,62,67,49,281,未参加,
虽然工作很辛苦，但是肯定不说“太累了，我不想[C]工作[BD。]”这[C]类话，而且她每[C]次都鼓励我。,199505104525200069,日本,2,199505,记对我影响最大的一个人,80,80,73,79,65,369,B,
老师的人生观、学问观，使我认识到做人一些道理、做学问{CC学人}的一些道理。,199505104523100119,韩国,1,199505,记对我影响最大的一个人,70,85,78,69,72,366,B,
我们只{CC1只有[C]}一起住{CQ了}半年[C]，不过[C]给我留下了{CC的}深刻的印象。,199505104525200113,日本,2,199505,记对我影响最大的一个人,65,65,23,30,41,208,未参加,
我认识她，已经十年了。,199505104523100146,韩国,1,199505,记对我影响最大的一个人,65,70,52,73,65,311,C,
参加活动时他手里拿着很多水果、面包等等，叫我们吃让我们好好练习。[BC.],199505104525200144,日本,2,199505,记对我影响最大的一个人,70,80,83,57,55,335,C,
他为了生活放弃学习的希望开始工作。,199505104525200155,日本,2,199505,记对我影响最大的一个人,65,90,70,83,80,379,B,
对我影响最的就是我的母亲[F親]。,199505104525200174,日本,2,199505,记对我影响最大的一个人,70,55,75,67,67,318,C,
虽[C]然她的一生如此{CC多么}坎坷，也她{CJX}是我最尊敬的人，[BC。]而且给我的影响也极大。,199505104523100196,韩国,1,199505,记对我影响最大的一个人,85,80,86,67,86,397,B,
他念大学的时候，[BC；]一个人住在公寓生活{CJZR}。,199505104525100197,日本,1,199505,记对我影响最大的一个人,65,75,52,57,74,310,C,
她也是一样。,199505104523200215,韩国,2,199505,记对我影响最大的一个人,75,60,83,71,76,351,C,
我听{CQ了}他的话，觉得[C]颇有[C]道[C]理。,199505104525200211,日本,2,199505,记对我影响最大的一个人,65,65,46,73,67,300,C,
我想[C]去中国留学。,199505104525200212,日本,2,199505,记对我影响最大的一个人,75,75,65,48,65,318,C,
还有母亲[C]告诉我许多事情，给我念许多的书等等。,199505104523200219,韩国,2,199505,记对我影响最大的一个人,75,70,65,59,61,319,C,
对于一对[C]母[C]女[BQ，]这[C]肯定是够[C]难受了。{CP因此我[C]的母[C]亲特别着急[C]，走来走去，整理这[C]个收[C]拾[C]那个，其[C]实我觉得她有点不对劲。P},199505104801100281,澳大利亚,1,199505,记对我影响最大的一个人,75,80,52,34,43,275,未参加,
虽然如此，父亲依旧想尽办法为我们筹足日常生活所需{CJ-zxy的用品}。,199508681519100509,马来西亚,1,199508,记对我影响最大的一个人,75,90,75,79,84,397,B,
还记得在九三年的七月份{CD里}，我国教育部课程中心在马六甲的五屿岛{CQ的}一间酒店里举办了为期一周的小学课程修订研讨会。,199508680519100517,马来西亚,1,199508,记对我影响最大的一个人,90,90,54,67,88,387,C,
在上第一堂课{CQ时}，老师要求每位同学作简单的自我介绍。,199508680519200539,马来西亚,2,199508,记对我影响最大的一个人,85,85,73,71,72,381,B,
由于我体质比较[F較]差，所以很少参加一些体育运[F運]动。,200009542542200002,柬埔寨,2,200009,我的童年,65,70,69,74,96,360,C,
夫妻相处[F處]之道在于互相了解、关[F關]怀[F懷]及鼓励，不应[F應]因女方工作表现[F現]比男方出色而感到自卑，亦不需把别人的看法看得太重。,200010801543250002,香港地区,2,200010,我对离婚问题的看法,65,75,48,85,89,349,C,
随着人的生活水平的提高，地球上的自然环境的污染逐渐恶化。,200005108525200293,日本,2,200005,关于用自然之声取代噪声的建议,65,70,50,60,54,285,C,
那个原因之一是电话铃声太吵闹。,200005108525200294,日本,2,200005,关于用自然之声取代噪声的建议,70,70,59,50,52,289,C,
人们的工作很累，因此人们都需要休息的时间，不过由于噪声而睡不着，所以肯定{CQ对}第二天的工作有影响。,200005108523100358,韩国,1,200005,关于用自然之声取代噪声的建议,70,65,42,32,46,241,未参加,
噪声、自然之声都有各自的作用和意义。,200005108525200363,日本,2,200005,关于用自然之声取代噪声的建议,65,70,53,72,65,311,C,
所以这样做也可以减少交通事故。,200005108523100624,韩国,1,200005,关于用自然之声取代噪声的建议,75,65,80,83,76,366,B,
几十种动听的自然之声，以取代生活中经常听到的噪声，我觉得这是一个很有意思的打算。,200005108523200629,韩国,2,200005,关于用自然之声取代噪声的建议,70,70,64,65,63,320,C,
对，[BC、]他跳失败了。,199705104523100076,韩国,1,199705,我的城市/乡村生活,70,45,44,42,56,238,未参加,
我小时候曾经住过好多地方。,199705104523100084,韩国,1,199705,我的城市/乡村生活,75,65,46,51,49,273,未参加,
想做什么就做什么。,199705104525200082,日本,2,199705,我的城市/乡村生活,50,55,69,90,87,330,未参加,
城市生活和乡村生活的最大的区别是生活的环境不同。,199705104523200105,韩国,2,199705,我的城市/乡村生活,70,75,74,58,80,346,C,
以我所知城市生活有一种比较重要的优越性：信[B新]息流通得很快、很广泛[B方]。,199705104633200203,意大利,2,199705,我的城市/乡村生活,85,70,69,58,70,343,C,
现在正是荔枝成熟的季节[F節]，假若你有空到这[F這]山城清来省来逛逛，品尝[F嘗]这里的季节[F節]水果，你会深深的爱上这[F這]个[F個]半山半城的清美城．啊我差点[F點]忘了还有一个[F個]地方你一定会想去一下[BQ，]那就是在世界上出了名的黄金三角地方的金三角地点[F奌]。,199705529529153010,泰国,1,199705,我的城市/乡村生活,80,60,46,30,47,250,未参加,
在幼年时[F時]遇上挫折，往往都靠父母关[F關]怀[F懷]，由他们[F們]代为[F爲]解决。,199810602501150003,中国,1,199810,如何面对挫折,95,90,81,89,88,442,A,
怎么办？,199810602801150002,澳大利亚,1,199810,如何面对挫折,95,90,84,89,93,450,A,
每次当我拿到成绩册的时候[BQ，]我都要面对我的父母[BQ，]因为在我小的时候他们的要求特别高。[BC，],199810801533150032,新加坡,1,199810,如何面对挫折,90,75,76,60,55,350,B,
跟我一起开始学习的很多同学们，埋怨地说：“烦死我啦！,199804123525100038,日本,1,199804,学习汉语的苦与乐,70,70,39,28,36,231,未参加,
我相信一切{CJX}明天会[F會]更好。,199804123801100277,澳大利亚,1,199804,学习汉语的苦与乐,90,85,75,84,93,424,A,
学了两{CC二}年以后{CJ-zhuy我}觉得汉语比较容易，再过了两{CC二}年以后呢，我{CD的}感觉汉语真难。,199804124523200324,韩国,2,199804,学习汉语的苦与乐,75,75,60,52,54,306,C,
而保守派的丈夫则希望结了婚的太太应学做个贤妻良母，在家相夫教子，把家庭打理得井井有条{CC头头是道}，这样就是取悦丈夫的良策了.女人欲征服丈夫不难.想成为丈夫的宠[F寵]儿也可以.只要多了解他的性格.就行了.,199809542542100007,越南,1,199809,如何看待“妻子回家“,65,65,57,46,84,301,未参加,
男人女人有一样的权利和义务[F務]，对家庭有共同的责[F責]任和负[F負]担。,199809542542200028,越南,2,199809,如何看待“妻子回家“,75,90,71,64,82,376,B,
在韩国[BQ，]俗话说“失败是成功的母亲”。,199904123523200005,韩国,2,199904,如何面对挫折,70,65,37,60,46,264,未参加,
当时，我不太上课，学习也不认真，含含糊糊过大学生活。,199904123525100057,日本,1,199904,如何面对挫折,75,75,80,83,76,379,B,
所以刚开始上二年级的课时，老师们的{CJX}讲话我怎么听也听不懂，老师让我回答问题时，我也说不出来。,199904123525200085,日本,2,199904,如何面对挫折,65,65,56,80,72,322,C,
我现在想[BQ：]谈恋爱[L]就是互相让步，[BC.]互相理解。,199904123525200192,日本,2,199904,如何面对挫折,60,65,45,47,56,256,未参加,
我每次遇到困难或挫折时，{CJ-zy就}想这两句话，原来这两句话出现{CC抽出}在歌词里。,199904123523200213,韩国,2,199904,如何面对挫折,65,65,42,52,54,262,未参加,
”这表示家庭教育环境的重要性。,199904124523100315,韩国,1,199904,如何面对挫折,75,55,42,32,35,224,未参加,
这样的人，从而成为生活的强者，可以达到自己的目标，享受美满的生活。,199904124523200312,韩国,2,199904,如何面对挫折,65,70,50,60,63,294,C,
我这{CC1这个}二十多年当中遇到了许多困难和挫折。,199904124523200337,韩国,2,199904,如何面对挫折,70,70,42,60,41,271,未参加,
只不过[B够]{CJ-sy没有}{CJ+dy四年的}学历，社会就不接受{CC2受}我，我在电视上也看过有很多科学家、[BC，]企业家、[BC，]总统等都没有上{CQ过}大学{CD了}。,199904124523100385,韩国,1,199904,如何面对挫折,70,70,48,55,50,281,C,
人在生活和工作中，总要遇到许多困难或挫折。,199909684542200053,越南,2,199909,如何面对挫折,80,60,57,38,61,283,未参加,
我们也应该抱有自动的精神，把工作做[B作]好，尽力去做[B作]，不得因错误而气馁，{CQ应该}虚心请教，{CJ-zhuy这样}一定会把工作作好。,199909529529251014,泰国,2,199909,如何面对挫折,65,85,51,54,66,311,C,
