错句,作文编码,国籍,性别,考试时间,作文题目,口试分数,作文分数,听力分数,阅读分数,综合分数,总分,证书
有的人因为家庭不和，没心情工作，这对社会也会造成影响。[BC，],200103533533250004,新加坡,2,200103,我对离婚问题的看法,75,75,70,21,50,281,未参加,
我在学校学习过程中遇到不少困难，[BC。]因为我不聪明。[BC，],200109529529251005,泰国,2,200109,我的童年,70,75,39,49,61,283,未参加,
当我们醒来时，正是父亲叫我们的时候，因为三宝垅站已到了。,200110540540150005,印度尼西亚,1,200110,我的童年,70,90,52,75,90,370,C,
一年中我们最快乐的一天就是春节。,200110540540250127,印度尼西亚,2,200110,我的童年,65,85,33,54,85,312,未参加,
他们似乎已遭岁月带走了{CJbei}。,200103680519201610,马来西亚,2,200103,我的童年,75,90,70,78,98,405,B,
因为我知道，寂寞[B莫]是很难受的。,200104124501200069,中国,2,200104,一封写给父母的信,90,75,55,49,72,335,未参加,
爸爸，您工作顺利吗？,200104124545100107,乌兹别克斯坦,1,200104,一封写给父母的信,75,90,47,54,58,318,C,
爸爸您{CD还}是跟我哥哥一起工作还是您一个人？,200104124545100107,乌兹别克斯坦,1,200104,一封写给父母的信,75,90,47,54,58,318,C,
我希望你们了解我。,200104124605200375,保加利亚,2,200104,一封写给父母的信,75,85,52,58,72,335,C,
儿女长大了[BQ，]早已到三十还没成家，[BC、]给父母送礼物怎么能使您们{CC2您}高兴呢！,200105550523150012,韩国,1,200105,一封写给父母的信,70,60,79,65,74,333,C,
您虽然不说出任何心里的话，但我明白你的心。,200105550523150293,韩国,1,200105,一封写给父母的信,80,70,77,73,79,369,B,
你们常说的就是“健康是最重要的[BQ”]。,200105550523250295,韩国,2,200105,一封写给父母的信,80,70,47,61,42,290,C,
你们知道吗？,200105550523250329,韩国,2,200105,一封写给父母的信,75,70,52,44,58,288,未参加,
爸爸，妈妈请你们注[B主]意身体健[B建]康。[BC.],200105550523250354,韩国,2,200105,一封写给父母的信,65,70,41,54,54,270,未参加,
在丽江拍[D照]的几张照片，我装在相框里，摆在我办公室里的桌子上。,200105212525200006,日本,2,200105,我的一个假期,70,80,60,68,68,336,C,
我感觉有点儿奇怪，真搞不懂他们为什么问我那些问题。,200105224525200008,日本,2,200105,我的一个假期,70,75,77,79,83,373,B,
第二天，我们的中国朋友带我们去郊外参观。,200105209525200056,日本,2,200105,我的一个假期,70,70,39,51,44,262,未参加,
我有一个假期，在家写毕业论文。,200105201525200014,日本,2,200105,我的一个假期,60,70,52,54,57,278,未参加,
与以前相比{CC5比以前}没有新鲜的感觉。,200105201525200050,日本,2,200105,我的一个假期,70,70,57,54,41,280,未参加,
我们五个人和一个从北京来的日本留学生一共六个人去敦煌的夜市。,200105215525100004,日本,1,200105,我的一个假期,70,65,60,82,74,337,C,
当时的我向往[B望]着长期假期。,200105215525100008,日本,1,200105,我的一个假期,70,70,77,75,74,354,C,
在{CC有}以上的情况下，我们轻松地过学生生活。,200105215525100008,日本,1,200105,我的一个假期,70,70,77,75,74,354,C,
这件事情{CQ的}发生主要是因为他们三个人里边没一个愿意为别人做事。{CP这其实也不是完全为别人好，而是也为自己好。P},200105109540200490,印度尼西亚,2,200105,由“三个和尚没水喝”想到的……,75,70,54,51,70,309,未参加,
比如：[BC，]三个和尚之中，第一个和尚，他一个人住在一座高山上的一座庙里的时候，他每天都要到山底下自己挑水喝，这是{CJX}可以说他的习惯之一。,200105109525200694,日本,2,200105,由“三个和尚没水喝”想到的……,65,80,54,60,53,300,C,
我们人类不是一个人生活，而是家里人、[BC，]朋友们等大家{CC别人}一起生活。,200105109525200805,日本,2,200105,由“三个和尚没水喝”想到的……,65,70,48,47,53,269,未参加,
很多人不经常跟中国人在一起，而是{CC2却}跟日本人在一起，[BC。]这简直就是{CJX}不像留学。,200105109525100850,日本,1,200105,由“三个和尚没水喝”想到的……,65,60,52,64,84,308,未参加,
然而，一旦有了同伴，[BC、]他的这种观念便会改变{CC改革}，[BC、]独[F獨]立的勇气[F氣]也会消退{CC退色}，相对的依赖性却[F卻]会大大地{CC的}增加，[BC。]养[F養]成了一种只想依赖他人，把一切责任推给他人，好让[F讓]自己的负担[F擔]减轻[F輕]{CJ-zxy的心理}。,200102522522250011,缅甸,2,200102,由“三个和尚没水喝”想到的……,75,90,64,73,91,387,B,
为了保护他们的生活，我想选{CC挑}安乐死之路。,200205204525200036,日本,2,200205,如何看待“安乐死”,65,65,52,56,54,276,未参加,
近年来，我国把安乐死视为一种难题。,200205204525200047,日本,2,200205,如何看待“安乐死”,65,60,41,60,68,277,未参加,
得了不治之症，十分痛苦的时候，为什么自己不能选择[C]自己的死期呢？,200205204525100074,日本,1,200205,如何看待“安乐死”,65,60,49,51,42,250,未参加,
因为根据[B剧]不同的条件，[BC、]每一个家都有他们的想法。,200205204525100174,日本,1,200205,如何看待“安乐死”,65,60,46,31,44,229,未参加,
作为一个人，还是要尊重个人的意见。,200205212525200030,日本,2,200205,如何看待“安乐死”,70,60,71,76,77,339,C,
这样的话才能避免像文章中{CC上}{CQ写}的冲突。,200205212525100040,日本,1,200205,如何看待“安乐死”,70,65,49,70,58,298,C,
因为，我小时候，刚刚上了高中那个时候我体验了一次又一次的事故和疾病。,200205212525200054,日本,2,200205,如何看待“安乐死”,80,80,58,67,61,338,C,
可以说怎样面临{CC临望}“死”是人的重要权利{CC权力}之一。,200205224525100028,日本,1,200205,如何看待“安乐死”,65,75,44,72,65,308,未参加,
但是我估计没有一个国家承认人们选择死亡{CQ的}权利。,200205201525200094,日本,2,200205,如何看待“安乐死”,75,70,52,70,54,310,C,
可是在这两种问题上加一个“个人”的想法，就能解决这个“安乐死”的问题。,200205201525100155,日本,1,200205,如何看待“安乐死”,80,85,69,65,70,363,C,
奖[F獎]赏的方式与方法都大同小异[F異]，不是难题；但是批评的方式与方法就必须细[F細]微小心，全是心理上跟面子问题有关的得失。,200210529529251001,泰国,2,200210,如何解决“代沟”问题,70,60,40,69,68,292,未参加,
她总[C]是跟我说这样轻[F輕]松约会[F會]使她的工作得到更好的成就[BQ。]但提到我妈妈的个性，她是个过单调的生活{CJ-zxy的人}，[BC。]不爱化妆，不喜欢{CC希喜}现代社会[F會]的速急变[F變]化，而且是个总有“古比新好”的思想。,200210529529251002,泰国,2,200210,如何解决“代沟”问题,65,60,31,47,50,236,未参加,
做父亲[F親]的忙着[B的]赚[F賺]钱[F錢]，做母亲[F親]的一般也要赶[F趕]着[B著]上班，变[F變]成各忙各的。[BC，],200210529529151033,泰国,1,200210,如何解决“代沟”问题,80,90,76,89,73,403,B,
要有知识，才能[L]为人民服务。,200210540540250003,印度尼西亚,2,200210,如何解决“代沟”问题,75,60,23,36,46,226,未参加,
他们对学习不像[B象]过去的孩子那样{CC一样}认真。{CP因此做父母的人担心孩子们变坏，于是时常在子女面前唠叨，叫他们读{CC学},200210540540250024,印度尼西亚,2,200210,如何解决“代沟”问题,65,65,51,58,79,302,C,
就算对父母或老师有不满之处，也只能埋在心里，不敢说出来。,200210540540250027,印度尼西亚,2,200210,如何解决“代沟”问题,70,70,78,65,93,364,C,
我和我的子女{WWJ},200210540540250065,印度尼西亚,2,200210,如何解决“代沟”问题,70,60,65,54,62,296,C,
两代人，由于出生的年代不同，所受到的教育方式、教育程度也不一样[B同]，使家长和孩子之间必然产生距离，这就是所谓的“代沟”。,200210540540250096,印度尼西亚,2,200210,如何解决“代沟”问题,80,90,65,78,88,396,B,
依我看{CC想}，这总不是个好办法，因为人的一生不可能平平安安地走过去。,200205109542200302,越南,2,200205,如何面对挫折,75,75,84,73,77,374,B,
当然不是每次都会那么冷静地去做[BQ，]但是至[B只]少有这些积极的想法[L][BQ，]我觉得{CJ+sy是}已[B以]经不错了！,200205109606200397,比利时,2,200205,如何面对挫折,90,60,67,38,53,298,未参加,
我认为面对挫折的时候，如果有这种{CD的}积极态度，克服困难的可能性肯定比较高。,200205109801200398,澳大利亚,2,200205,如何面对挫折,90,85,51,58,64,345,C,
为了学业离家将近{CC过}半年了。,200205680519250013,马来西亚,2,200205,一封写给父母的信,75,85,70,65,84,372,B,
内容到作者母亲时，刚好[B如]是抗日时期，但中国共产党实行男女平等。,200305533525250038,日本,2,200305,我最喜欢读的一本书,65,65,68,75,65,322,C,
现在我知道只有汉语{CC2语言}说得好的话，{CQ也}难以找工作，[BC。]要{CD更}了解{CC理解}中国的习俗、中国人的价值观，还要知道在中国做生意的话，哪[B那]些方面{CD有}跟日本不一样{CD的地方}。,200304131525100143,日本,1,200304,我学汉语是为了……,60,70,12,10,54,191,未参加,
我在快要高中毕业时候，每天都听到日本的经济情况越来越不好，而且很多大学毕业生找不到工作，[BC。]特别是女学生。,200304131525200198,日本,2,200304,我学汉语是为了……,65,70,50,65,57,293,C,
还有我们判断事情的时候，也靠听力。,200305576525200011,日本,2,200305,静音环境对人体的危害,65,75,62,82,88,359,C,
人类在生活当中有好多杂音。,200305576525100025,日本,1,200305,静音环境对人体的危害,65,65,47,38,49,248,未参加,
吸烟的人是要注[B主]意旁边的人的。,200405109604201526,奥地利,2,200405,吸烟对个人健康和公众利益的影响,70,75,45,35,50,264,未参加,
现在科学家已[B以]经证[B正]明烟给身体带来的坏影响，所以世界上到[L]处都有政府去控制{CQ吸}烟的坏习惯。,200405109801101671,澳大利亚,1,200405,吸烟对个人健康和公众利益的影响,60,85,45,33,55,267,未参加,
我之所以这么说是因为吸烟者自己本身做了一个选择，他们选择吸烟，也知道这项选择可能会造成{CJX}对他们身体健康不良的影响。,200405109922101715,美国,1,200405,吸烟对个人健康和公众利益的影响,75,95,79,68,68,379,B,
政府{CJ-zy应}尽量想办法阻止这种不良习惯{CC6犯罪行为}。{CJ-zhuy政府},200405109636201817,乌克兰,2,200405,吸烟对个人健康和公众利益的影响,70,85,38,35,57,277,未参加,
然而美中不足{CQ的}是{CD在于}国家的经济方面。,200405109540200094,印度尼西亚,2,200405,吸烟对个人健康和公众利益的影响,85,85,70,83,70,388,B,
我们都知道吸烟对个人的身体有害，对肺不好。,200405109529200749,泰国,2,200405,吸烟对个人健康和公众利益的影响,70,65,62,54,54,291,C,
如今，他的身体{CC生休}一直不健康[C]，做什么事都会觉得很累。,200405522522150009,缅甸,1,200405,吸烟对个人健康和公众利益的影响,65,80,60,40,51,284,未参加,
有医学家表明说：“在一个家庭里有一个人抽烟的话，这个家庭的每位家人能感染[C]到病毒{CD的}或能患上癌的{CJ-zhuy机率}比抽烟的人还要大{CC严重}[BD，]{CJ+sy还要快}。,200405522522250005,缅甸,2,200405,吸烟对个人健康和公众利益的影响,80,70,49,56,56,301,C,
社会不但应该保护弱者，而且应该禁止{CC停止}别人{CJX}损害{CC带害}的行为。,200405209608200074,波兰,2,200405,吸烟对个人健康和公众利益的影响,70,60,60,61,58,294,C,
现在，大家都承认烟会引起癌[C]症[BQ。]所以最重要的态度是：1)有这个习惯的人，很快把这个习惯改变{CJba}！,200405610610250001,法国,2,200405,吸烟对个人健康和公众利益的影响,70,55,36,58,56,259,未参加,
有很多人吸烟，其实不是{CC没有}为了什么，不过他们常说：“已经习惯了，不能不抽。[BC。],200405271529200088,泰国,2,200405,吸烟对个人健康和公众利益的影响,70,80,49,44,51,284,未参加,
我的父母都爱植物、爱看书，[BC、]性格内向、不爱说话，[BC、]但很实在。,200505109525100175,日本,1,200505,父母是孩子的第一任老师,75,75,65,65,79,349,C,
年代的日本，像我父母那样没上过高中的人不少。,200505109525200179,日本,2,200505,父母是孩子的第一任老师,75,75,62,63,79,344,C,
我想分析[B枚]父母是孩子的第一任老师{CQ的}{CD这个}原因。,200505109525200249,日本,2,200505,父母是孩子的第一任老师,65,60,49,48,52,257,未参加,
只要他们明白这个，我相信{CJ-zhuy他们}将[C]会当个好老师，[BC。]{CJ-zhuy他们}也需要努力天天提高自己，不断地学习。,200505109525200405,日本,2,200505,父母是孩子的第一任老师,70,70,56,48,54,286,未参加,
我也同意这个说法。,200505109525200577,日本,2,200505,父母是孩子的第一任老师,60,45,71,63,69,286,未参加,
比如说孩子把杯子破碎了{CJba}，这样的时候父母应该要给孩子说明，这个事情为什么不好的事{CJs}，还需要说明这个情况下孩子应该怎样处理合适。,200505217525200104,日本,2,200505,父母是孩子的第一任老师,55,80,35,63,54,273,未参加,
我的看法也是一样{CJxw}。,200505217525200160,日本,2,200505,父母是孩子的第一任老师,60,60,48,45,50,245,未参加,
他们有一定的生活规律。,200505217525200191,日本,2,200505,父母是孩子的第一任老师,70,75,58,57,78,327,C,
一般{CJ+sy是}他们的父母也是小偷。,200505204525200025,日本,2,200505,父母是孩子的第一任老师,55,50,37,27,45,193,未参加,
还有他给宋庆龄学音乐{CJjy}。{CP父亲认为学音乐{CJ+sy是},200505204525200107,日本,2,200505,父母是孩子的第一任老师,65,65,52,53,58,277,未参加,
我还[C]记得他{CD从}以前[C]一直跟我说一句话“{CP年轻的时候[C]玩儿多[C]一点，学习也重要，但是应该玩儿很多[C]。P},200505204525100173,日本,1,200505,父母是孩子的第一任老师,65,75,50,67,52,296,C,
父母有教育[C]孩子的义务。{CP如果父母不管孩子，孩子长得很调皮。如果父母跟孩子不{CC1没有},200505204525100437,日本,1,200505,父母是孩子的第一任老师,65,45,46,45,45,225,未参加,
父母对孩子的爱[F愛]是无私的。,200505204525100446,日本,1,200505,父母是孩子的第一任老师,70,75,65,63,74,336,C,
所以我从小对外国感兴趣。,200505204525200516,日本,2,200505,父母是孩子的第一任老师,60,55,50,43,58,247,未参加,
这点我为我妈妈感到佩[C]服和骄傲[C]{CJ？}。,200505204525200519,日本,2,200505,父母是孩子的第一任老师,55,70,69,53,76,307,未参加,
从现在{CQ起}{CJ-zhuy我}也想继续[C]学他们的教训。,200505204525100541,日本,1,200505,父母是孩子的第一任老师,60,60,39,37,52,230,未参加,
吃坏{CJ-by肚子}呀、[BC，]回家以后发烧呀这种有关身体的事[BD，]还算好。,200105205525200003,日本,2,200105,我的一个假期,75,60,72,68,74,335,C,
调查必须[B耐]要{CD做}采访居民，[BC。]所以我想了两种办法。,200105205525200017,日本,2,200105,我的一个假期,70,80,55,35,52,282,未参加,
我的梦想终于实现了。,200105205525200056,日本,2,200105,我的一个假期,75,85,80,63,85,381,B,
这次我可以亲身体验到祖国文化[BD，]源远的历史，对我实在增益不少。,200110602801250001,澳大利亚,2,200110,我的一个假期,80,70,85,61,85,371,C,
正当我在想办法的时候，拍了{CC一}拍我，我转身一看，是导[F導]游[F遊]先生和妈妈[BQ。],200110602801250007,澳大利亚,2,200110,我的一个假期,70,75,55,63,85,337,C,
接过[F過]行李后[F後]，他们[F們]立即带我去吃我最喜爱[F愛]的中国菜，因真的很久没有尝[F嘗]试[F試]吃正宗的中国菜了，还[F還]记[F記]起那天的中国菜真的很好吃啊！,200110919919200012,加拿大,2,200110,我的一个假期,75,85,50,58,74,335,C,
通过这经验，我得到了一个教训。,200112576525100013,日本,1,200112,如何面对挫折,65,65,33,48,65,260,未参加,
那时我丢了信心。,200112576525100017,日本,1,200112,如何面对挫折,65,70,46,53,53,273,未参加,
最近，我没有机会去旅行。,200105271525200020,日本,2,200105,我的一个假期,65,70,52,58,48,279,未参加,
现在的我虽[C]然什么都不会，[BC、]但我将来进{CC出}了社会{CJ+zhuy我}一定要好好孝顺我的父母亲。,200105217525200046,日本,2,200105,我的一个假期,70,80,65,51,44,300,C,
过了十分钟左右，[BC、]她爸爸坐出租汽车来到了火车站。,200105217525200080,日本,2,200105,我的一个假期,65,70,62,70,57,310,C,
可是现[F現]在我想还是{CJX}当时我应该{CC2该}当老师，[BC。]因为通过这个经历{CC经验}，我得到{CC2得}了很多好处{CC利益}。,200105204525100090,日本,1,200105,我的一个假期,70,70,57,58,66,309,C,
因为我{CJX}虽然在不{CJ+zy太}平时的状态中，但他放在{CC2给}我{CD的}脑子里的伦敦地图，一直支撑[Pcheng]我、[BC，]指示我。,200105204525100109,日本,1,200105,我的一个假期,70,70,77,72,81,358,C,
进名牌大学以后，别人看来，我的学习虽然没有明显的进步，也没有考上任何一门考试。,200105550523150087,韩国,1,200105,一封写给父母的信,65,70,71,61,76,329,C,
再见祝你健康女儿××2001年5月12日,200105550523250102,韩国,2,200105,一封写给父母的信,65,65,66,37,49,266,未参加,
我想大学毕业以后还给你们幸福。,200105550523250124,韩国,2,200105,一封写给父母的信,70,80,58,51,54,303,C,
敬爱的爸爸、妈妈！,200105550523250158,韩国,2,200105,一封写给父母的信,70,70,49,58,74,309,C,
妈妈！,200105550523250163,韩国,2,200105,一封写给父母的信,70,75,33,32,38,237,未参加,
身体好吗？,200105550523250168,韩国,2,200105,一封写给父母的信,65,65,27,32,61,234,未参加,
我接受了你们的爱{CC1受情}，但从现在我给你们我的爱{CC1受情}！,200105550523250169,韩国,2,200105,一封写给父母的信,65,60,44,35,49,236,未参加,
给您们报恩！[BD！],200105550523250176,韩国,2,200105,一封写给父母的信,70,65,58,47,74,300,C,
你也知道嘛[B么][BQ，]服兵役多么苦[BQ。],200105550523150201,韩国,1,200105,一封写给父母的信,65,60,47,56,63,274,未参加,
就是我不了解父母之心，还有我和弟弟不知道父母如何奋斗而养育我们。,200105550523250200,韩国,2,200105,一封写给父母的信,65,70,52,65,63,301,C,
爸爸也没说“我爱你”可是我理解爸爸的心情。,200105550523150211,韩国,1,200105,一封写给父母的信,65,70,49,56,63,289,C,
我爱妈妈……身体保重！,200105550523250224,韩国,2,200105,一封写给父母的信,65,65,47,39,61,261,未参加,
虽然我还是很任性，随便，但你们总是在我心上。,200105550523250225,韩国,2,200105,一封写给父母的信,70,65,60,54,65,300,C,
回宿舍后，跟同屋聊天儿，写日记，还有办更重要的事，就给妈妈打电话。,200105550523250262,韩国,2,200105,一封写给父母的信,70,70,52,68,72,320,C,
哈哈哈！,200105550523250271,韩国,2,200105,一封写给父母的信,65,65,68,42,58,282,C,
不过我很努力去做我的事情和生活。,200105550523150301,韩国,1,200105,一封写给父母的信,80,70,52,47,63,302,未参加,
我知道现在你们对我要的是什么，只有一个吧。,200105550523250310,韩国,2,200105,一封写给父母的信,70,60,44,28,36,223,未参加,
你快起来呀！,200105550523250324,韩国,2,200105,一封写给父母的信,70,65,47,30,40,238,未参加,
但还是老样子，每天向你们发脾气。,200105550523250369,韩国,2,200105,一封写给父母的信,65,75,60,73,51,311,C,
汉城也{CD是}快要夏天了吧。,200105550523250400,韩国,2,200105,一封写给父母的信,70,70,49,51,61,289,未参加,
真{CC太}遗[C]憾[C]我们三个人都不在老家大邱。,200105550523250408,韩国,2,200105,一封写给父母的信,65,65,30,47,51,242,未参加,
今年也{CJX}我买一些东西带回去家{CJX}。,200105550523250420,韩国,2,200105,一封写给父母的信,70,65,58,39,47,265,未参加,
我现在这么[D长]大还是对你们不太孝顺，可是我心里却很希望{CC愿[F願]意}对得起父母。,200105550523250433,韩国,2,200105,一封写给父母的信,75,70,55,68,56,313,C,
我在韩[F韓]国{CD过}日子过得很好。,200105550523250449,韩国,2,200105,一封写给父母的信,70,65,47,49,38,255,未参加,
他们{CJX}我不在还乖乖听话吗？,200105550523250457,韩国,2,200105,一封写给父母的信,70,85,63,68,74,352,C,
我不写了，我应该[L]做作业。,200105550523150490,韩国,1,200105,一封写给父母的信,75,80,52,54,49,301,C,
读{CQ了}四年的大学，有很多希望、愿望。,200105550523250487,韩国,2,200105,一封写给父母的信,70,65,38,47,45,251,未参加,
妈妈{CC姆姆}[BQ，]您好！[BC？],200105550523150501,韩国,1,200105,一封写给父母的信,65,65,66,44,42,266,未参加,
请你骂我[BQ，]怪我[BQ，]让我做得[B的]更好。,200105550523250496,韩国,2,200105,一封写给父母的信,70,70,49,54,63,294,C,
他的朋友叫做车先生。,200105206525200003,日本,2,200105,我的一个假期,75,80,62,58,61,327,C,
虽然，父母、老师不同意{CC愿意}这个想法。,200105206525200040,日本,2,200105,我的一个假期,65,65,62,39,46,261,未参加,
所以{CC可是}我们首先{CJ-zy应该}努力去理解对方和他的想法。,200105109525200005,日本,2,200105,由“三个和尚没水喝”想到的……,80,85,77,82,91,409,B,
但其中有很多种人。P},200105206525100047,日本,1,200105,我的一个假期,60,55,44,65,52,257,未参加,
他们和尚也喝{CJX}水{CJX}没了，应该有人抬水。,200105109525200029,日本,2,200105,由“三个和尚没水喝”想到的……,65,65,48,51,55,268,未参加,
就像没有看见似的。,200105109525200080,日本,2,200105,由“三个和尚没水喝”想到的……,65,70,66,73,79,339,C,
这个故事给我们的教训是：人少的时候，一切都顺利；[BC。]人多了，反而一切不顺利。,200105109525100113,日本,1,200105,由“三个和尚没水喝”想到的……,65,70,84,71,84,360,C,
从目前的情况来看，世界人口已超过六十亿，而且发达国家跟发展中国家之间的生活水平的差距越来越大了。,200105109525100243,日本,1,200105,由“三个和尚没水喝”想到的……,75,85,73,84,95,405,B,
这样做下去，喝水的问题解决了。,200105109525100310,日本,1,200105,由“三个和尚没水喝”想到的……,65,60,39,51,59,257,未参加,
那文章里头的和尚也一样。,200105109525200301,日本,2,200105,由“三个和尚没水喝”想到的……,65,70,66,71,84,342,C,
但他们一找到了妻子，就不管家务了。,200105109525100335,日本,1,200105,由“三个和尚没水喝”想到的……,70,75,73,73,70,350,B,
上次的以色列的事情也让我们但心。,200105109525100415,日本,1,200105,由“三个和尚没水喝”想到的……,65,55,39,60,59,260,未参加,
比如说，夏天快到了，温度可能高一点儿，下雨也{CC1大概}少{CQ了}。,200105109525100434,日本,1,200105,由“三个和尚没水喝”想到的……,65,55,27,49,44,222,未参加,
他为他们想了办法。,200105109525100545,日本,1,200105,由“三个和尚没水喝”想到的……,70,65,43,44,59,267,未参加,
大家一边怀疑每个和尚的话，一边要得到他们说的{CJ-dy好}事。,200105109525100566,日本,1,200105,由“三个和尚没水喝”想到的……,70,65,45,49,53,268,未参加,
我觉得应该{CJ+zy要}{CJ-sy有}互相帮助的意识{CC心情}。,200105109525100620,日本,1,200105,由“三个和尚没水喝”想到的……,65,65,52,60,61,287,C,
太麻烦的事情谁也不敢做，但不{CC1没有}做{CJ-zy就}一直不能{CC没有}解决问题{CD了}。,200105109525200699,日本,2,200105,由“三个和尚没水喝”想到的……,65,60,48,38,55,249,未参加,
虽然家人并不愿意让他{CD杀}死，但他们不忍心{CC3不能}继续看丈夫痛苦的样子{CQ了}，[BC。]于是他们[L]不得不让他死去。,200205217525100055,日本,1,200205,如何看待“安乐死”,65,65,49,60,63,286,C,
我想我们{CQ如果}{CJ-sy得了}{CD在}痛苦{CQ的}不治的病{CD上}[BQ，]{CJ-zy就}不要勉强地活下去，所以我赞成“安乐死”。,200205217525200071,日本,2,200205,如何看待“安乐死”,70,75,60,58,63,315,C,
在法院{CC法庭}上女医生说[BQ：]“他教给我们[L]医生{CC医者}该尊重什么，是个人{CC各个}的尊严。,200205217525200094,日本,2,200205,如何看待“安乐死”,65,75,30,60,54,271,未参加,
信里说“下次我病情恶化时，请您千万{CJ-zy别}救我，我希望得到永远的安乐。,200205205525200015,日本,2,200205,如何看待“安乐死”,75,80,58,67,70,341,B,
我头一次知道“安乐死”是高中的时候。,200205205525200030,日本,2,200205,如何看待“安乐死”,75,80,41,65,68,320,未参加,
