错句,作文编码,国籍,性别,考试时间,作文题目,口试分数,作文分数,听力分数,阅读分数,综合分数,总分,证书
我在超级市场任职，在我的周围有不少情侣，但是其中有一对很令人注目。,200410534533250090,新加坡,2,200410,最理想的结交方式,80,85,74,47,72,352,C,
因为亲戚朋友都知道双方男女的家庭背景、对对象[B像]的要求以及生活方式等，除此之外，亲戚朋友也是可靠之人，他们也是本着一颗为一对男女拉红线、创造幸福之心而做红娘。,200410534533150114,新加坡,1,200410,最理想的结交方式,95,90,69,81,96,430,B,
我自己不喜欢看运动比赛，但是我当然可以理解别人怎么会喜欢。,200404140634100168,英国,1,200404,运动员收入,60,75,33,46,51,251,未参加,
如果问人们运动员的月收入有多高，恐怕没有几个人可以说得上来。,200404140520200300,蒙古国,2,200404,运动员收入,80,90,91,63,74,393,B,
很多吸烟者口腔有异味，而且牙齿变黄。,200405680519250041,马来西亚,2,200405,吸烟对个人健康和公众利益的影响,75,95,71,81,100,416,B,
现代的中学生，由于科技上的发达[C]，他们很多时候都在和电脑“交往”，造成心智上不像往常那样成熟。,200504534533250025,新加坡,2,200504,我对男女分班的看法,75,80,70,78,84,378,B,
两性之间本来就存在不少问题，一般素质较好的学校都是单性学生，因为方便师长去管理和教育。,200504534533250034,新加坡,2,200504,我对男女分班的看法,80,85,67,65,68,359,C,
在同班的情况下，男女同学可以互惠互利。,200504534519250059,马来西亚,2,200504,我对男女分班的看法,80,75,76,84,91,397,B,
说到男女分班是为了避免学生早恋，这个是讲不过去的。,200504534519250109,马来西亚,2,200504,我对男女分班的看法,70,65,73,82,86,362,C,
在一所{CC间}男校里，男生们最喜欢的就是电脑游戏[C]的踢{CC玩}足球。,200504534533250128,新加坡,2,200504,我对男女分班的看法,65,70,56,62,59,298,C,
我个人认为，反而男女同班会比较好。,200504534533250148,新加坡,2,200504,我对男女分班的看法,75,75,62,45,70,317,C,
他们不勉强我去不去。,200505109525200005,日本,2,200505,父母是孩子的第一任老师,65,60,46,44,62,260,未参加,
因此，父母是孩子的第一任老师，更是孩子们永远的老师。,200505109510200529,朝鲜,2,200505,父母是孩子的第一任老师,85,95,74,79,72,401,A,
无[F無]论[F論]是做[F作]人的道理或科学的事实，父母影响{CD了}孩子的程度远远超过任何其他的人或事。,200505109922200576,美国,2,200505,父母是孩子的第一任老师,75,60,63,51,69,304,未参加,
父母中谁更重要还是要根本改这个问题{CJ？}：对于孩子的成长过程，哪个人有最大的影响{CJ-zxy力}？,200505109616101113,德国,1,200505,父母是孩子的第一任老师,70,50,53,43,57,256,未参加,
每个孩子从小就学会做事，在他们眼里所看到的大多数是父母所做的事。,200505109520101444,蒙古国,1,200505,父母是孩子的第一任老师,75,70,69,37,66,306,未参加,
从此，父母亲就会教我们{CC咱们}爬行、走路、[BC。]叫爸爸妈妈。[BC，],200505109634201470,英国,2,200505,父母是孩子的第一任老师,90,65,69,68,80,363,C,
[BD《]父母是孩子的第一任老师[BD》]刚出生的时候，我们什么都不知道。,200505109525201655,日本,2,200505,父母是孩子的第一任老师,45,75,37,59,50,249,未参加,
我小时候，母亲[C]很严格。,200505109525202316,日本,2,200505,父母是孩子的第一任老师,65,75,35,51,52,265,未参加,
不过我小的时候并不喜欢摩[C]托车[BQ，]因为它的声音太吵，那个时候的我很害怕它的声音，差点哭了。,200505109525102455,日本,1,200505,父母是孩子的第一任老师,65,65,39,51,72,276,未参加,
否则会影响到孩子。,200505109525202587,日本,2,200505,父母是孩子的第一任老师,65,60,63,49,69,289,未参加,
比如，我是美国[F國]人，我的父母都是美国[F國]人，并[F並]且我是在美国[F國]长[F長]大的。,200505109922102600,美国,1,200505,父母是孩子的第一任老师,75,50,37,37,56,239,未参加,
对孩子来说父母是日常生活当中最主要的人物。,200505109922202602,美国,2,200505,父母是孩子的第一任老师,85,60,58,53,56,300,未参加,
我们在世界上的存在是由父母的因素而存在的。,200505204540200394,印度尼西亚,2,200505,父母是孩子的第一任老师,95,75,63,59,72,359,C,
由此，孩子也就会从每天生活{CD中}听到的音乐中培养欣赏音乐的才能。,200505204922200401,美国,2,200505,父母是孩子的第一任老师,85,55,46,45,67,285,未参加,
有一句话是这样说的：“有其父必有其子”。,200505205533200045,新加坡,2,200505,父母是孩子的第一任老师,70,90,78,61,65,357,C,
有的孩子还有悲观的思想，他们总是觉得他们很笨，所以影响到他们学习的成绩。,200505212542200041,越南,2,200505,父母是孩子的第一任老师,65,75,41,51,58,277,未参加,
我问[F問]她为[F為]什么要这么快结[F結]婚，我以为[F為]是某种原因[BD，]逼不得已[B以]才结[F結]的。,200505522522250006,缅甸,2,200505,最理想的结交方式,70,75,66,60,73,333,C,
偶然的相遇，然后相爱相惜，[BC。]在其他人看来也许会觉[F覚]得这样{CD的}太仓[B倡]促，欠[B倩]慎重的思考，但在我看来[L]这却[F卻]是一种罗曼[B漫]蒂[C]克式的缘分，因为我深信，两[B俩]个有结为夫妻{CD的}缘分的人，在潜意识[B示]中，在相遇的时[F時]候，会有心灵感应{CC感足}的体会，而这种感受就是促[B足]进[F進]恋爱的阶[B皆]段。,200505522522150029,缅甸,1,200505,最理想的结交方式,65,70,63,71,79,334,C,
会说话的时候，第一个从口中说出来的词{CC字}是妈妈，而不是其他{CC任何}人的名字[B子]。,200505209542100084,越南,1,200505,父母是孩子的第一任老师,55,60,56,45,58,255,未参加,
父母给我们的教育[B弃]不一定是有意的，我们[L]从他们{CJ-zxy身上}学到的东西常常只是看他们的生活习惯，而不知不觉地按照他们的行为{CC例子}学会怎么做很多事。,200505209919100149,加拿大,1,200505,父母是孩子的第一任老师,70,50,54,57,47,261,未参加,
可是最严重的{CJX}抽烟问题就是其对少年的影响。,200509105922200009,美国,2,200509,吸烟对个人健康和公众利益的影响,80,65,71,63,65,332,C,
毕业以后，我离开新加坡，到日本的大学继续{CC续继}读服务{CQ专业}。,200509534533250003,新加坡,2,200509,一封求职信,60,80,75,53,55,310,未参加,
本人也曾在新加坡美术馆工作了三年，累积了不少的经验[C]。,200509534533250059,新加坡,2,200509,一封求职信,55,60,45,44,86,271,未参加,
快乐家庭旅游公司：您好，本人前天在《录中晚报》看到贵公司的招聘启示，觉得{CC自觉}自己的条件十分适合{CC适于}在贵公司当一名导游。,200509534519250085,马来西亚,2,200509,一封求职信,80,65,79,77,88,377,B,
我的旅行团的人也十分配合我。,200509534533250126,新加坡,2,200509,一封求职信,55,70,79,60,86,334,C,
从课程中[B种]，我学到了很多如何[B合]做个好导游的方法。,200509534533250127,新加坡,2,200509,一封求职信,60,70,79,49,77,320,未参加,
能够凭此广告获得这项奖完全是因为我对旅游事项有着深厚的了解。,200509534533250178,新加坡,2,200509,一封求职信,75,70,82,75,86,377,B,
我非常喜欢流行歌曲，崇[C]拜我喜欢的歌星。,200510111801200201,澳大利亚,2,200510,我看流行歌曲,95,90,79,83,100,446,A,
我们培养流行歌曲的{CJX}好方面{CC方向}[BQ。],200510111523200836,韩国,2,200510,我看流行歌曲,65,70,53,52,57,283,未参加,
其中可以分为老歌曲和新歌曲。,200510111523200861,韩国,2,200510,我看流行歌曲,60,65,65,61,52,286,C,
我想对大家说，如果你们希望成功，一定要找自己的爱好{CC爱护}。,200510111523200868,韩国,2,200510,我看流行歌曲,65,70,46,42,77,286,未参加,
但是现在的流行歌曲的享受范[C]围太小。,200510111523100889,韩国,1,200510,我看流行歌曲,75,80,67,59,74,346,C,
十有八九都是从电视看韩国节目或者听韩国歌手唱的歌的。,200510111523101054,韩国,1,200510,我看流行歌曲,60,70,63,46,57,281,未参加,
对年轻人来说，歌曲也[C]是一种时髦[C]。,200510111523201070,韩国,2,200510,我看流行歌曲,60,70,49,61,67,292,未参加,
尤其是流行歌曲。,200510111523101115,韩国,1,200510,我看流行歌曲,55,60,60,38,59,253,未参加,
我也是一个喜欢流行歌曲的人。,200510111523201122,韩国,2,200510,我看流行歌曲,55,50,67,67,72,290,未参加,
我想流行歌曲有魅[C]力。,200510111523201329,韩国,2,200510,我看流行歌曲,65,65,79,79,69,341,C,
古典歌曲也是古代人类的流行歌曲。,200510111523101367,韩国,1,200510,我看流行歌曲,65,85,65,50,59,314,C,
随着网络{CC网上}的发展，流行歌曲被{CQ以}更快的速[B束[C]]度[C]传给全世界。,200510111523201567,韩国,2,200510,我看流行歌曲,65,60,46,38,45,237,未参加,
还有其原因带来对自己的正经事没有好处{CJ？}。,200510111523201567,韩国,2,200510,我看流行歌曲,65,60,46,38,45,237,未参加,
没有音乐的帮助，我就会东想西想，无法看书。,200510111922101395,美国,1,200510,我看流行歌曲,85,75,72,56,77,357,B,
我们常常有唱歌的机会。,200510111523201579,韩国,2,200510,我看流行歌曲,65,60,51,36,45,240,未参加,
但，不是说不喜欢不流行的歌曲。,200510111523101860,韩国,1,200510,我看流行歌曲,60,50,53,30,52,225,未参加,
还有一个问题是它可能把音乐的多样性打坏。,200510111523101864,韩国,1,200510,我看流行歌曲,95,70,67,46,74,346,C,
所以我觉[F覺]得“父母是孩子的第一任老师[F師]”一题是对[F對]的。,200510919544250021,澳门地区,2,200510,父母是孩子的第一任老师,65,65,83,76,91,364,C,
我觉得每个人对不同的歌曲都有不同的看法，因为[F為]随[C]着岁数的不同{CJdp}，爱[F愛]好的音乐也会跟着不同。,200510512512150015,菲律宾,1,200510,我看流行歌曲,85,55,60,50,82,319,未参加,
又因{CQ在}国外出生，{CQ在}国外长[F長]大，对[F對]国内的歌曲并[F並]不清楚，对[F對]国际[F際]上的流行歌也不是那么热衷[B中]，主要因大多都是重金属{CJ？}，对[F對]时[F時]下台湾[F灣]与[C]香港流行歌倒是知道一点[F點]。,200510512512150037,菲律宾,1,200510,我看流行歌曲,75,95,81,67,57,369,B,
比如说：《两只蝴蝶》、《老鼠爱大米》、《雨》等等。,200510520520250002,蒙古国,2,200510,我看流行歌曲,65,80,51,40,47,271,未参加,
我们还想强调一个问题。,200510209644200004,格鲁吉亚,2,200510,我看流行歌曲,65,65,63,44,72,293,C,
有的人喜欢这样的流行歌曲，有的人是不喜欢这样的流行歌曲。,200510302523100001,韩国,1,200510,我看流行歌曲,80,60,49,22,35,233,未参加,
可是我把音乐当成提高我的学习效率的工具{CC道具}，[BC。]或者闲着没事干的时候听几首流行歌曲就很舒服。,200510302523100024,韩国,1,200510,我看流行歌曲,70,90,63,61,77,354,C,
那样就不如不听[B看]呢。,200510302523100029,韩国,1,200510,我看流行歌曲,40,60,65,44,77,263,未参加,
你听过传统音乐吗？,200510302523100058,韩国,1,200510,我看流行歌曲,75,70,86,75,94,389,B,
2000年HOT举行一场演[B宴]唱会，在{CC右}表演的时候HOT的一个团员摔到{CC摔倒}地下去了。,200510302523100093,韩国,1,200510,我看流行歌曲,65,65,56,52,47,269,未参加,
他们说流行歌曲的歌词不适于年轻人看，且那些女歌手的动作更不适合我们看。,200510302523100106,韩国,1,200510,我看流行歌曲,70,65,67,69,77,334,C,
所以呢[BQ，]我的看法是不要这么做不要这么行动。,200510302523100138,韩国,1,200510,我看流行歌曲,50,55,72,38,62,256,未参加,
学生们每天学习到很晚，他们会感觉到很累。,200510302523100214,韩国,1,200510,我看流行歌曲,70,65,58,61,59,299,C,
有些人特别喜欢流行歌曲，有些人不喜欢流行歌曲，每个人的爱好是不一样的。,200510302523200216,韩国,2,200510,我看流行歌曲,60,45,42,28,57,210,未参加,
它需要给人们思考的[B地]余地来创出新的音乐，[BC。]它还需要给青少年有益的内容。,200510302523100222,韩国,1,200510,我看流行歌曲,75,75,81,63,79,363,B,
学习的[C]时间听音乐，这样时间不够。,200510302523200242,韩国,2,200510,我看流行歌曲,70,60,56,32,37,240,未参加,
我看现在大家{CC人家}都对流行歌曲很感[C]兴趣[BQ，]不管男女老少[BQ。]你不知道现在是什么时候了，[BC。]小孩子连两三岁都爱听这首[Pshǒu]歌。,200510529529251024,泰国,2,200510,我看流行歌曲,60,65,39,22,35,204,未参加,
在工作繁忙的情况下，应该要好好地{CC的}休息。,200510529529151034,泰国,1,200510,我看流行歌曲,60,65,49,22,57,236,未参加,
在我们泰国中，也有好多位歌星，对音[C]乐很有造诣{CC深造}，歌词内容对社会都有处世[C]的警戒。[BC！],200510529529251030,泰国,2,200510,我看流行歌曲,60,50,49,48,57,244,未参加,
它是有了很触意{CJ？}，一方面是歌的内容：如果是靠当时[F時]环境的动作或是当时[F時]社会一般的情况，这一种歌曲就不{CQ能}长[F長]期流行。,200510532529250004,泰国,2,200510,我看流行歌曲,75,80,25,38,25,234,未参加,
现代人都活在“速食”的年代，什么东西都讲究快捷，而忘了如何享受与体验获取丰硕果实的过程。,200505680519250011,马来西亚,2,200505,最理想的结交方式,70,85,79,75,82,383,B,
因此也或许误把友情当爱情也不一定。,200505680519250013,马来西亚,2,200505,最理想的结交方式,65,80,82,80,84,379,B,
你们保重身体。,200104124542200009,越南,2,200104,一封写给父母的信,85,80,63,61,70,352,C,
看上去{CC看}你的先生也很不错。,200104124525200067,日本,2,200104,一封写给父母的信,65,75,44,39,33,243,未参加,
××4月13日,200104124525200078,日本,2,200104,一封写给父母的信,70,75,44,61,45,284,未参加,
你每天过得怎么样？,200104124525200101,日本,2,200104,一封写给父母的信,70,50,33,42,47,225,未参加,
祝你身体好！,200104124525200101,日本,2,200104,一封写给父母的信,70,50,33,42,47,225,未参加,
敬礼！,200104124542200213,越南,2,200104,一封写给父母的信,70,70,82,63,90,363,C,
我也有些担心因为过去的太多时间[C]被花在工作上去了{CJbei}，准备可能不会很充分，也许会影响到考试成绩，不过我还是尽力而为吧！,200104124529100379,泰国,1,200104,一封写给父母的信,80,85,82,68,88,397,B,
下午有课的时候，我常常去图书馆学习，[BC。]在图书馆学习的时候见面{CJX}{CQ和}好多中国朋友。,200104124523200454,韩国,2,200104,一封写给父母的信,65,80,27,23,33,216,未参加,
工作顺利！,199200204525100039,日本,1,199200,一封求职信,,,0,0,0,0,未参加,
名字[B子]:×××姓别:女生于:71-1-27身高:1.75米体{CC身}重:45公斤学习方面:大学毕业{CD了}:现在攻读{CC入进}硕士学位经验:{CD为了}四年{CJX}当了[BD“]美加净的模特。,199200204539200042,印度,2,199200,一封求职信,,,0,0,0,0,未参加,
夫妻之间的感情很好，什么都不会破裂他们的爱情{CJjy}。,199604123605100294,保加利亚,1,199604,如何看待“安乐死”,80,65,45,52,49,279,未参加,
我举一个例子。[BC.],199604123523200250,韩国,2,199604,如何看待“安乐死”,60,50,61,49,44,243,未参加,
因为在法律上杀人是违法的。,199604123523100268,韩国,1,199604,如何看待“安乐死”,60,55,42,42,47,227,未参加,
我觉得如果妻子不放弃自己的生命，努力{CC奋寸}治病的话，根本不会导致{CC致导}这种悲剧。,199604124525200206,日本,2,199604,如何看待“安乐死”,60,70,61,76,70,321,C,
我想社会发展了，同时人类观念需要大大的改革开[C]放。,199604124525200223,日本,2,199604,如何看待“安乐死”,45,55,35,49,39,200,未参加,
所[C]有的人希望保持着好的名声{CC4正经的脑子}死。,199604124525100068,日本,1,199604,如何看待“安乐死”,50,50,42,52,47,217,未参加,
别说奶奶就是{CC2还}我们家里人也特别痛苦。,199604124525100077,日本,1,199604,如何看待“安乐死”,60,55,56,61,52,265,未参加,
但是这样的病，人一定要死的这样的病是肯定会给人很大的痛苦{CJsd}。,199604124523200004,韩国,2,199604,如何看待“安乐死”,60,60,48,42,42,234,未参加,
不知道他帮助没帮助过妻子自杀{CD的时}[BQ，]可是帮助还是不帮助那个没有关系。{CP因为一个人死了还是活者[B着]的原因下别人不会那么pù负。如果一个人直到把别人杀死的话那就不是他的问题。这里“安乐死”没有把自己他的妻子杀死的.所以他不可取P},199604123521100124,孟加拉,1,199604,如何看待“安乐死”,50,45,14,27,31,142,未参加,
人人都要生存在这时时刻刻急[C]变的社会里，互不相让地竞争[F爭]而达到{CC成就}自己的目的。,199610550523190031,韩国,1,199610,如何解决“代沟”问题,70,50,46,46,41,236,未参加,
如今社会出现不佳的景象，就是社会最基本单位{CD这一}[BQ——]家庭的父母{CQ和子女}之间不能沟通的现象[BQ。]依我看，主要原因在于父母与子女之间不存在紧密的世代纽带[C]感。,199610550523290051,韩国,2,199610,如何解决“代沟”问题,80,75,52,57,69,324,C,
“代沟”，指的是什么呢？,199610550523290077,韩国,2,199610,如何解决“代沟”问题,65,55,54,57,65,278,未参加,
代沟的确[F確]是长[F長]期以来[F來]一直存在的社会问题[F題]，[BC。]它是从[F從]人与[C]人之间的行为[F為]、思想反映出来[F來]的，[BC。]因此要解决[F決]这[F這]问题[F題]，我们应[F應]从[F從]这[F這]方面着[Y著]手。,199611543533200501,新加坡,2,199611,如何解决“代沟”问题,85,75,65,63,86,366,C,
长大了，人生阅历丰富了，见到的世面广了，思想也改变了。,199603533533200028,新加坡,2,199603,由“三个和尚没水喝”想到的……,90,90,49,70,99,396,C,
大家就能共存。,199603533533200037,新加坡,2,199603,由“三个和尚没水喝”想到的……,90,90,66,70,82,396,B,
那么这是个{CQ有}进步，有道德，有礼貌的社会。,199603533519100058,马来西亚,1,199603,由“三个和尚没水喝”想到的……,85,90,63,74,77,385,B,
现在我在新加坡学汉语大概一年了。,199603533525100066,日本,1,199603,由“三个和尚没水喝”想到的……,80,70,55,65,72,332,C,
当然，他的同伴也有可能产生同样的依赖心理。,199603533533200072,新加坡,2,199603,由“三个和尚没水喝”想到的……,85,90,71,70,82,394,B,
本来，最多两[F兩]个人去抬水喝就够[F夠]{CQ了}，第三个人是多余[F餘]的。,199605104634200006,英国,2,199605,由“三个和尚没水喝”想到的……,60,85,66,76,89,365,C,
只有一个人的时候，他为了解渴{CJ+by自己}，每天都要到山底下挑水喝。,199605104523200026,韩国,2,199605,由“三个和尚没水喝”想到的……,60,65,69,58,70,305,C,
这是不太好的生活态度。,199605104523200026,韩国,2,199605,由“三个和尚没水喝”想到的……,60,65,69,58,70,305,C,
一个人准备做饭，另一个人准备做菜。,199605104523100046,韩国,1,199605,由“三个和尚没水喝”想到的……,55,75,52,63,65,295,未参加,
这个故事说的{CD却}很简单，但是故事里蕴含{CC含蓄}着很深刻的道理{CC内容}。,199605104523200067,韩国,2,199605,由“三个和尚没水喝”想到的……,80,65,71,76,75,355,B,
三个人一起到山底下看，水特别多{CD了}。,199605104525200078,日本,2,199605,由“三个和尚没水喝”想到的……,65,60,52,60,42,262,未参加,
要不然谈不上经济发展。,199605104523100112,韩国,1,199605,由“三个和尚没水喝”想到的……,70,70,77,67,68,340,C,
人多就有用，互相能发挥自己的能力。,199605104523200159,韩国,2,199605,由“三个和尚没水喝”想到的……,65,65,55,54,65,288,C,
勤[B谨]劳的人多，那国家的将来也{CQ会}很好{CC大}。,199605104523200159,韩国,2,199605,由“三个和尚没水喝”想到的……,65,65,55,54,65,288,C,
有时候，人和人之间{CQ会}发生矛盾、争论，[BC。]国家和国家之间{CQ会}有战争什么的，[BC。]但是，那时候应该好好谈{CC1谈论}，考虑[F慮]考虑[F慮]。,199605104525100175,日本,1,199605,由“三个和尚没水喝”想到的……,65,55,60,63,63,288,C,
他很聪明，英俊。[BC，],199605104523200192,韩国,2,199605,由“三个和尚没水喝”想到的……,65,60,63,45,61,277,未参加,
[BQ”],199605104523100209,韩国,1,199605,由“三个和尚没水喝”想到的……,75,50,63,42,68,282,未参加,
”听完，他就举手赞[C]成了。,199605104523100217,韩国,1,199605,由“三个和尚没水喝”想到的……,65,80,74,65,72,344,C,
真正的自爱到底是什么？,199605104523200258,韩国,2,199605,由“三个和尚没水喝”想到的……,60,65,66,65,75,314,C,
理解宗教{CD的}精神的行为，[BC。]现实生活当中我们常常[C]看到这些现象。P},199605104525200301,日本,2,199605,由“三个和尚没水喝”想到的……,60,65,38,45,46,237,未参加,
公寓里的设[F設]备，人人都{CJ-sy有}权使用。,199605104542200312,越南,2,199605,由“三个和尚没水喝”想到的……,75,85,71,58,84,366,B,
两个和尚看老和尚不在的时候，进了老和尚的庙{CD里}。,199605104525200365,日本,2,199605,由“三个和尚没水喝”想到的……,70,55,41,51,56,257,未参加,
所以，有了三个和尚[BD，]{CD就}互相[B想]希望别人去山下抬水，这种情况[C]{CD是}实在是难以置信{CC难以相信}。,199605104525100395,日本,1,199605,由“三个和尚没水喝”想到的……,80,60,74,81,82,364,C,
他们也实在忍不住了。,199605104525100399,日本,1,199605,由“三个和尚没水喝”想到的……,55,70,71,70,63,313,C,
那么，[BC、]怎么办呢？,199605104525200394,日本,2,199605,由“三个和尚没水喝”想到的……,70,55,52,63,56,280,未参加,
人的本性都{CJ+sy是}有问[F問]题[F題]，有事的时[F時]候，都想这[F這]件事[BD，]别人来帮[F幫]忙，或者[B着]是别人来替我做。,199605550523190009,韩国,1,199605,由“三个和尚没水喝”想到的……,65,70,30,33,39,223,未参加,
”,199605550523290008,韩国,2,199605,由“三个和尚没水喝”想到的……,70,65,55,65,68,309,C,
这是众所周知的事情。,199605550523190021,韩国,1,199605,由“三个和尚没水喝”想到的……,70,70,58,70,72,328,C,
在社会里，亦容易这看见{CC看出}这种人。{CJ-zhuy他},199605550523290022,韩国,2,199605,由“三个和尚没水喝”想到的……,70,60,77,76,56,324,C,
许多人生活以后，感到不满、不方便、一个人生活才好{CJ+zxy的感情}的话，他们都[C]不会愿[C]意[C]共同生活。,199605550523290029,韩国,2,199605,由“三个和尚没水喝”想到的……,65,50,71,70,61,298,未参加,
所以三个人都希望[C]别人去山下抬水喝。,199605550523190036,韩国,1,199605,由“三个和尚没水喝”想到的……,60,60,63,58,63,286,未参加,
可现在{CJ-zhuy我}却感到后悔。,199704123523200048,韩国,2,199704,记对我影响最大的一个人,70,80,65,76,50,331,C,
我一向都较懂事，[BC。]还是妈妈的小助手，然而，这懂事的小助手，并不像爸妈心中{CQ以为}的那么懂事。,200110540540250080,印度尼西亚,2,200110,我的童年,75,90,63,58,97,377,C,
继母待我总的还不错。,200110540540150095,印度尼西亚,1,200110,我的童年,70,95,82,73,92,405,B,
童年的离家造就了如今性格独力，凡事豁达的我。,200110540540250104,印度尼西亚,2,200110,我的童年,70,85,71,65,85,368,C,
我们大家共八位，六个妹妹，一个弟弟。,200110540540250156,印度尼西亚,2,200110,我的童年,75,80,33,47,72,298,未参加,
联络处：××街，[BC。]×号[F號]，[BC.]×楼邮政信箱××××××敬上一九九三年×月×日,199312533533200013,新加坡,2,199312,一封求职信,80,95,69,70,82,392,B,
小弟曾上过语文课程和语言表达课程。,199312533533100058,新加坡,1,199312,一封求职信,85,70,60,70,75,352,C,
在这三年当中，我时[F時]常接待海外侨[F僑]胞及旅客，也带队[F隊]去了很多名胜[F勝]古迹[C]{CJ+zxy的地方}，对我国的历史及地理、[BC.]风[F風]土民情了解了一些，也增进[F進]了很多见识[F識]及经验[F驗]，对这个工作充满了信心。,199312533533200062,新加坡,2,199312,一封求职信,90,80,74,76,75,390,B,
我刚刚在三月底以特优成绩毕业，现正在寻找{CC找寻}一份工作，以学以致[B至]用。,199312533533200095,新加坡,2,199312,一封求职信,90,80,69,78,75,387,B,
）年龄[C]四十五岁[C]，[BC、]曾经[F經]受过中、英中等教育，[BC、]精通[BD:]英、中文及通晓[BD:]日语[F語]及{CD方言}[BD：]闽、粤、潮、客等方言。,199312533533100098,新加坡,1,199312,一封求职信,80,65,39,52,36,261,未参加,
说外语也可以。,199312124525200151,日本,2,199312,一封求职信,45,45,18,27,45,154,未参加,
本人要找一个翻译工作。,199312123523200303,韩国,2,199312,一封求职信,55,60,39,52,52,239,未参加,
