错句,作文编码,国籍,性别,考试时间,作文题目,口试分数,作文分数,听力分数,阅读分数,综合分数,总分,证书
有一次我上数学，[BC。]老师让我和同学们在课堂上做作业，[BC。]我怎么算和想也想不出来，心里很着急[BQ，]很{CC而}害怕。,200109529529251005,泰国,2,200109,我的童年,70,75,39,49,61,283,未参加,
所以她根本提不起精神来教导我和[D一]众兄弟姐妹们。,200110540540150122,印度尼西亚,1,200110,我的童年,70,90,55,70,72,350,C,
当我正式进入小学时，我就开始我那“可恨”的特性。,200103680519101601,马来西亚,1,200103,我的童年,75,80,61,72,85,364,B,
来的话，请你提前和我打个招呼，以便有时间准备一下你们所需要的一切。,200104124619100227,罗马尼亚,1,200104,一封写给父母的信,70,75,68,58,72,332,C,
虽三年来多少次的写信不常见{CJ？}，但姐姐的信里往往说到全家的事以及国家的最新新闻[B门]，[BC、]{CQ所以}也不觉得我被忘掉了[BQ。]几天前居然来了叔叔写的一封{CJ-zxy信}，[BC、]给我送了一幅亲手画的画，我觉得十[B意]分愉快。[BC、],200104124632100219,摩洛哥,1,200104,一封写给父母的信,70,65,63,58,76,318,C,
可是这个世界不断变化，或许我和我的母亲也会有一天{CJX}敞天心门谈心事。,200105550523250004,韩国,2,200105,一封写给父母的信,80,75,85,54,74,359,B,
请原谅。,200105550523150015,韩国,1,200105,一封写给父母的信,75,75,71,54,65,330,C,
我永远[F遠]爱你。,200105550523250340,韩国,2,200105,一封写给父母的信,75,65,44,47,49,267,未参加,
保重身体。,200105550523250340,韩国,2,200105,一封写给父母的信,75,65,44,47,49,267,未参加,
我觉得，我们在西安玩得最开心，也许因为气温已经没有北京和大同冷了。,200105212540200001,印度尼西亚,2,200105,我的一个假期,80,80,80,70,74,376,B,
我的想法却不一样。,200105212525200036,日本,2,200105,我的一个假期,65,70,57,77,74,329,C,
还可以提高{CC加强}我们的胆量，还有最重要的{CJ-sy是}我们可以了解{CD了}各种各样的人。,200105212540200041,印度尼西亚,2,200105,我的一个假期,75,75,65,63,48,316,C,
现在也是我读大学的一个城市了。,200105224525200005,日本,2,200105,我的一个假期,80,70,87,70,87,384,B,
我一看到它，心里就充满了不安和恐惧。,200105209525200066,日本,2,200105,我的一个假期,75,75,65,58,68,331,C,
在那里，到处吃的东西都很香，一种{CC点}{CJX}没有菜不使人感动。,200105209525100022,日本,1,200105,我的一个假期,60,60,32,65,74,273,未参加,
我特别[F緊]张地[B白]过了几天。,200105201525200050,日本,2,200105,我的一个假期,70,70,57,54,41,280,未参加,
因此如果大家一起学习的话，我们的水平提高得就会更快。,200105109525200502,日本,2,200105,由“三个和尚没水喝”想到的……,65,80,66,80,84,363,C,
这个故事教我人是应该怎么做的{CJsd}和帮助人的重要性。,200105109525100807,日本,1,200105,由“三个和尚没水喝”想到的……,55,70,48,49,64,270,未参加,
每天两个人一起挑水。,200105109525100807,日本,1,200105,由“三个和尚没水喝”想到的……,55,70,48,49,64,270,未参加,
所以应该要互相帮助。,200105109525200805,日本,2,200105,由“三个和尚没水喝”想到的……,65,70,48,47,53,269,未参加,
[BQ”]于是大家都从[F從]其他地方挑水来放，可是一放下水，水就没了。[BC，],200102522522150016,缅甸,1,200102,由“三个和尚没水喝”想到的……,75,65,38,48,64,277,未参加,
还有人人共同努力，[BC。]共同进步。,200102522522150021,缅甸,1,200102,由“三个和尚没水喝”想到的……,80,55,28,50,66,265,未参加,
可是妈妈一点都不让我们放松。,200203522522250024,缅甸,2,200203,记对我影响最大的一个人,85,85,69,73,68,375,B,
老师[F師]经[F經]常说[F說]：[BD┏]我们的地球是用数学来创[F創]造的。[BD┓],200203522522250030,缅甸,2,200203,记对我影响最大的一个人,75,75,28,31,41,240,未参加,
他一生{CQ的}职业只是一个默默无名的木匠，至到他三十余岁时被他所要拯救的犹太同胞用铁钉钉死于十字架上，受尽折磨而死。,200203533533150023,新加坡,1,200203,记对我影响最大的一个人,95,65,74,79,88,393,B,
而有人认为如果别人在十分痛苦{CJX}处在{CJ+zxy苦境}的情况下，愿意死而需要他人的帮助的话，可以采取这个方法。,200205204525100014,日本,1,200205,如何看待“安乐死”,80,70,69,65,75,349,C,
我想到最后{CD为止}看他的笑容，[BC。]不管遇到什么病。,200205204525100038,日本,1,200205,如何看待“安乐死”,65,55,33,49,51,235,未参加,
不过，绝不是“我要安乐死”这句话。,200205204525200058,日本,2,200205,如何看待“安乐死”,75,60,33,45,46,245,未参加,
但是“自杀”这个杀人行为的确带来社会公众的损失，而以后有可能发生经济损失。,200205204525100113,日本,1,200205,如何看待“安乐死”,75,70,77,70,63,344,B,
我觉得她不希望他死去，[BC。]因为她很爱他，她{CD心情}已经都依靠{CC靠上}了他，所以她绝对想他{CQ即使}只呼吸也行，他活下的话[B活]，自己也能坚持下去[BQ，]自己活下的心情{CJy}。,200205204525200124,日本,2,200205,如何看待“安乐死”,65,80,35,76,58,302,未参加,
有些国家根据[B剧]法律{CJ-sy认为}安乐死是非法的。,200205204525100174,日本,1,200205,如何看待“安乐死”,65,60,46,31,44,229,未参加,
第三，病人的痛苦达到无法忍耐的程度。,200205212525200022,日本,2,200205,如何看待“安乐死”,75,65,83,81,75,366,B,
有些不治之症痛得痛入骨髓，没有人希望过像[B象]人间地狱[F獄]一样的日子。,200205212525100052,日本,1,200205,如何看待“安乐死”,70,60,49,76,65,305,未参加,
但是我个人却同意安乐死。,200205209525200035,日本,2,200205,如何看待“安乐死”,85,80,80,79,84,401,B,
人们都有权利。,200205201525200096,日本,2,200205,如何看待“安乐死”,75,85,58,70,77,358,B,
在日本，这些案件的主犯大多数是医生，[BC。]有些医生不能忍受{CC忍耐}看{CJ-buy到}病人的痛苦，或者受患者或他的家人的拜托{CC2托}，犯了这些罪行{CC案件}。,200205215525100007,日本,1,200205,如何看待“安乐死”,80,65,88,83,84,388,B,
因为我绝不愿意，我的周围的人为我的事{CC2难事}而{CC所}痛苦，对这事情详细说明一下：为自己的治疗费家庭经济困难{CJjy}，这是我最不愿意{CJ+wy做}而最忌讳{CC忌嫌}的事情，为自己的{CJ+sy看}病{CJ-sy影响}别人的身体健康{CJ+wy困败}，[BC。]这是{CJX}也让{CC对}我非常难受{CJsd}，[BC。]我真不愿意发生这种事情。,200205215525100023,日本,1,200205,如何看待“安乐死”,60,65,33,60,39,240,未参加,
结果[BQ，]人们为了争[B珍]取时间工作，往往把工作都带回家，[BC。]这就造成没时间照顾子女。,200210801519250006,马来西亚,2,200210,如何解决“代沟”问题,70,70,78,71,64,341,C,
比如：孩子不想学数学也不要勉强{CC免强}他们。,200210529529251008,泰国,2,200210,如何解决“代沟”问题,70,65,51,40,53,265,未参加,
问题当面提出之后，大家有话尽量说，不仅要心平气和{CC4心平语气}地[B的]说，{CQ而且}说的时候态度要好{CJgd}，之后，大家对问题有不同看法的，尽量提出来{CC2出}，然后决定行事。,200210529529251023,泰国,2,200210,如何解决“代沟”问题,75,85,78,91,93,415,B,
子女在新社会中工作，要让他们跟得上时代。,200210529529151025,泰国,1,200210,如何解决“代沟”问题,75,65,67,73,62,329,C,
生活在上一代的父母与现代的子女，由于社会环境的不同，思想不同，于是呢，就无形中产生了代沟了。,200210540540250014,印度尼西亚,2,200210,如何解决“代沟”问题,70,70,65,58,79,330,C,
哪[B那]一个不对，哪[B那]一个做对了，都要指出来，[BC。]供大家来讨论，结果，在不伤和气也不伤尊严的情况下，把问题一个一个都来研究[BD，]如何解决[BQ，]如何从好的方面来处理{CJ+by这些事}。{CP两代“代沟”{CJX},200210540540250055,印度尼西亚,2,200210,如何解决“代沟”问题,65,70,48,67,73,309,C,
这是{CD跟}现代社会{CD的}复杂，学校教育不够严格所致。{CJ-zhuy他们},200210540540150064,印度尼西亚,1,200210,如何解决“代沟”问题,70,65,51,60,73,305,C,
所以做父母的应该作出让步，适当的放松{CJ-by管教}孩子，但不要忘记时时善言提醒子女们，什么事应该多注意，什么事不可花太多的时间与精力，说明若子女们什么新潮流都要追随，则要花很多钱的{CJsd}。[BC，],200210540540150086,印度尼西亚,1,200210,如何解决“代沟”问题,75,80,59,58,73,336,C,
”身为父母的我们[BD。]感到难过，伤心。,200210540540250109,印度尼西亚,2,200210,如何解决“代沟”问题,75,85,59,60,88,360,C,
父母与子女之间在行为方式、生活态度以及价值观念等方面存在差异。,200210540540250114,印度尼西亚,2,200210,如何解决“代沟”问题,75,60,40,38,55,254,未参加,
对我始终是呵护和安慰。,200203522522210001,缅甸,2,200203,记对我影响最大的一个人,80,90,33,66,82,346,未参加,
而我们身为家长时常劝他们不必拥有如此长远的想法，{CD大家庭}与父母住在一块儿有何不好？,200210540540150135,印度尼西亚,1,200210,如何解决“代沟”问题,65,60,53,60,77,298,未参加,
而且也能{WWJ},200210540540250130,印度尼西亚,2,200210,如何解决“代沟”问题,60,60,34,58,62,256,未参加,
我也相信我父母和亲朋好友都不会不管我的，会一直支持我。,200205109540200518,印度尼西亚,2,200205,如何面对挫折,75,65,78,69,57,331,C,
但{CJX}[BD，]我到现在，虽然有很多困难，因为上帝、[BC，]家里人、[BC，]朋友，我可以解决这些困难。,200205109540201084,印度尼西亚,2,200205,如何面对挫折,70,60,45,38,48,246,未参加,
我认为年[L]人{WWJ},200304131525200266,日本,2,200304,我学汉语是为了……,65,65,59,60,57,290,C,
还有[BQ，]孕妇最好不要吸烟，那样{CD使}对自己和对胎儿都会影响。,200405212522200052,缅甸,2,200405,吸烟对个人健康和公众利益的影响,85,75,74,63,79,368,B,
像广州{CJ-buy这样}比较乱的地方也会变成很干净整洁的城市。,200405212529100021,泰国,1,200405,吸烟对个人健康和公众利益的影响,75,70,55,39,74,302,未参加,
从市政府采取这种措施以来，在公共场所[BD，]抽烟的人越来越少了，[BC。]市环境也越来越整洁。,200405212540200109,印度尼西亚,2,200405,吸烟对个人健康和公众利益的影响,70,65,36,25,47,229,未参加,
吸烟有很多种：[BC；]抽烟，抽大烟，抽大麻，这些都是有损害于人的，而且吸烟不仅{CC不竟}是个人的问题，还包括了公众利益。[BC，],200405522522250005,缅甸,2,200405,吸烟对个人健康和公众利益的影响,80,70,49,56,56,301,C,
我在学校上课时，看到有些老师{CQ和}学生烟不离手，在谈话时也抽着烟。,200405522522250024,缅甸,2,200405,吸烟对个人健康和公众利益的影响,90,85,77,60,75,384,B,
先听他们{CD的}说话，然后我说跟他们一样的语言。,200505109525100334,日本,1,200505,父母是孩子的第一任老师,55,55,42,44,45,221,未参加,
所以家庭中的老师即{CC1就是}父母的责任是挺大的。,200505109525100540,日本,1,200505,父母是孩子的第一任老师,70,70,63,65,77,333,C,
常言道，“父母是孩子的第一任老师”。,200505109525200514,日本,2,200505,父母是孩子的第一任老师,70,60,63,65,66,309,C,
孩子做坏事这家的父母{CJ-zy肯定}也在孩子面前做不好的事。,200505109525200550,日本,2,200505,父母是孩子的第一任老师,65,85,60,47,79,326,C,
所以父母作为孩子的老师，[BC。]应该当一个好老师。,200505109525100709,日本,1,200505,父母是孩子的第一任老师,85,65,69,79,66,353,C,
日语中有一个词“反面老师”，就是说，如果自己周围的人不能当好的模范{CC规范}，就把那个人当作不好的模范{CC规范}而改正自己。,200505217525100006,日本,1,200505,父母是孩子的第一任老师,45,75,44,61,69,277,未参加,
比如说，地方话等等。,200505217525100009,日本,1,200505,父母是孩子的第一任老师,50,60,33,59,52,234,未参加,
后来{CC以后}我也喜欢上钓鱼{CQ了}。,200505217525200003,日本,2,200505,父母是孩子的第一任老师,60,60,50,51,52,255,未参加,
他不善于说话的人{CJs}，但是他用自己的行动告诉我，认真的重要性。,200505217525200059,日本,2,200505,父母是孩子的第一任老师,75,65,84,77,76,364,B,
在休息[C]日，他常常去高尔夫球场{CC2场}出汗。,200505204525200255,日本,2,200505,父母是孩子的第一任老师,60,70,52,65,63,295,未参加,
这可以说到小皇帝的父母亲。,200505204525200259,日本,2,200505,父母是孩子的第一任老师,50,55,37,43,45,209,未参加,
你绝对[C]不要伤害[C]你的朋友。,200505204525100533,日本,1,200505,父母是孩子的第一任老师,65,65,56,47,63,280,未参加,
总的来说，平时啊玩{CQ的}时候玩、[BC，]学的时候学[BQ，]这样[BQ，]{CD的}放假{CD的}时就不会手忙脚乱、[BC，]坐立不安地{CC的}去想功课了。,200105205525100055,日本,1,200105,我的一个假期,80,90,77,61,74,377,B,
我们虽[F雖]然哪[B那]儿[B几]也没有去，但是这假期我们{CQ在}浦东[F東]世纪公园过{CQ得}很有趣。,200105205512200061,菲律宾,2,200105,我的一个假期,75,80,80,49,63,338,C,
面对挫折时，{CQ如果}我没有想到好机会，只想自己的苦境，那么现在的我到底怎样生活呢。,200112576525200005,日本,2,200112,如何面对挫折,70,65,60,63,72,316,C,
她不是{CJ-sy学}中国课程的人。,200112576525200012,日本,2,200112,如何面对挫折,60,65,39,63,80,290,未参加,
挫折是避免不了的。,200112576525100018,日本,1,200112,如何面对挫折,80,75,86,79,76,387,B,
前年的暑假，考完期末考试的7月1号，我和两个日本同学{CJ-sy登}上了9点27分开往西安的火车。,200105271525200027,日本,2,200105,我的一个假期,65,70,60,68,63,312,C,
第四天，我们坐比较便宜的公共汽车，去参观{CC观光}兵马俑，秦始皇陵，华清池等。,200105271525200027,日本,2,200105,我的一个假期,65,70,60,68,63,312,C,
我在绍兴参观{CC访问}了名胜古迹，其中最{CJ-sy有}印象的还是鲁迅纪[B记]念馆。,200105217525100050,日本,1,200105,我的一个假期,65,65,65,56,55,290,C,
第二天，我和我太太去参观[F觀]大阪城[BD，]及其他一些观[F觀]光地点。,200105217525100069,日本,1,200105,我的一个假期,75,75,77,68,81,366,B,
有个朋友，陪着我一起看比赛，她给我解释[B择]我不懂的部分。,200105217525200076,日本,2,200105,我的一个假期,65,80,60,61,66,320,C,
原来我对丝绸之路很感兴趣，[BC。]因为我小学的时候看的日本的电视台{CJ-sy播出}在中国新疆拍的电[F電]视节目{CJ-dy对我}的影响[L]很大，[BC。]还有后来我在高中的时候看的一本小说也让我产生{CQ了}对这个方面的兴趣。,200105204525200004,日本,2,200105,我的一个假期,65,70,60,58,59,298,C,
如果真想了解的话[B活][BQ，]一定需要用勇气{CD的}{CJ-sy去}冒[B昌]险[F險]。,200105204525200013,日本,2,200105,我的一个假期,65,70,60,56,50,287,C,
我在这假期期间{CC时间}没有目标{CJX}生活{CD了}，我天天跟外国同学一起运动{CD了}。[BC，],200105204525100047,日本,1,200105,我的一个假期,65,65,32,39,50,235,未参加,
我打工时经理天天让我练习，[BC。]但是能做好吃的炒饭{CJ-zhuy我}花了两个星期左右。,200105204525100076,日本,1,200105,我的一个假期,60,65,17,21,52,198,未参加,
我一吃就想起家乡来了。,200105204525200091,日本,2,200105,我的一个假期,70,65,80,72,85,358,C,
最近你们看着我的所作所为，是{CC会}否感到失望呢？,200105550523250078,韩国,2,200105,一封写给父母的信,70,70,60,54,63,305,C,
我是你们的儿子。,200105550523150089,韩国,1,200105,一封写给父母的信,65,70,36,35,49,241,未参加,
2001.5.12你们的老大,200105550523150090,韩国,1,200105,一封写给父母的信,65,70,38,39,61,259,未参加,
离开父母，虽然得到了很多自由与欢乐，但是现在想起来，现在什么事都要依靠我自己，没有人可以帮住我，我是多么的辛苦，多么的劳累啊！,200105550523150113,韩国,1,200105,一封写给父母的信,90,75,74,70,61,364,B,
即颂大安！,200105550523250138,韩国,2,200105,一封写给父母的信,65,75,27,39,49,242,未参加,
有很好吃的东西，你们说，“我们不喜欢那个，你们都吃吧。,200105550523250144,韩国,2,200105,一封写给父母的信,65,70,60,58,65,304,C,
很想受您们的关照，妈妈爸爸，但是别误会，我现在很努力地学习。,200105550523250176,韩国,2,200105,一封写给父母的信,70,65,58,47,74,300,C,
我现在在考汉语水平考试，题目就是给您们的信。,200105550523250210,韩国,2,200105,一封写给父母的信,80,70,52,56,67,315,C,
××,200105550523250228,韩国,2,200105,一封写给父母的信,70,65,52,61,65,299,C,
这几年，我每次看你们的脸的时候[BQ，]感{CD得}到你们越来越老，不过你们的脸含着岁月的美[BQ，]还是跟年轻人一样。,200105550523150233,韩国,1,200105,一封写给父母的信,80,65,47,23,56,259,未参加,
爸爸！,200105550523250239,韩国,2,200105,一封写给父母的信,65,70,60,58,58,297,C,
我希望以后多多赚钱，买一个很大的房子[BQ，]我们一起在那儿愉快得生活下去。,200105550523250254,韩国,2,200105,一封写给父母的信,60,65,49,54,51,262,未参加,
如果没有你们的话！,200105550523150303,韩国,1,200105,一封写给父母的信,0,60,27,32,47,158,未参加,
最后[F後]，我想跟您说[F說]一声[F聲]“谢[F謝]谢[F謝]”而且，“我爱您！,200105550523250323,韩国,2,200105,一封写给父母的信,70,80,60,56,40,296,未参加,
你特别要对他留神。,200105550523250384,韩国,2,200105,一封写给父母的信,65,65,79,61,67,321,C,
这是永远不会变的事实！,200105550523250384,韩国,2,200105,一封写给父母的信,65,65,79,61,67,321,C,
前几天{CC3目前}5月8号父母节时，我没抽空去你们那儿，很不好意思。,200105550523250394,韩国,2,200105,一封写给父母的信,75,70,66,51,54,305,C,
现在一定很热吧？,200105550523250449,韩国,2,200105,一封写给父母的信,70,65,47,49,38,255,未参加,
我自己生活太困难{CC苦难}。,200105550523250458,韩国,2,200105,一封写给父母的信,55,65,41,42,47,232,未参加,
虽然我每天给你们打电话，[BC、]{CQ但}比不上在您们身边。,200105550523250483,韩国,2,200105,一封写给父母的信,65,65,52,47,61,274,未参加,
父母的养育之恩终生难报，可是我可以全心全力，以孝忠报答[B达]你们。{CD无论},200105550523150507,韩国,1,200105,一封写给父母的信,80,75,66,70,76,358,B,
我在{CC的}{CD放}两个月的假日中，花了一个月{CJX}半的时间去学开车。,200105206525100023,日本,1,200105,我的一个假期,65,70,39,65,44,269,未参加,
我上次{CD去}旅游的地方是越南、[BC，]泰国那里。,200105206525100047,日本,1,200105,我的一个假期,60,55,44,65,52,257,未参加,
到南京时[F時]，马[F馬]上感觉[F覺]{CJ-zy很}舒服，因为[F為]人比上海少，路比较[F較]宽[F寬]，绿[F綠]化可见[F見]已经[F經]成功。,200105206627100050,瑞士,1,200105,我的一个假期,70,65,34,37,39,231,未参加,
是因为语言、[BC，]文化[BD，]{CQ和}社会背[B北]景等都不一样的{CJsd}。,200105109525100193,日本,1,200105,由“三个和尚没水喝”想到的……,75,65,63,66,66,322,C,
人应该考虑[F慮]大家的利益。,200105109525100317,日本,1,200105,由“三个和尚没水喝”想到的……,75,70,41,47,57,279,未参加,
三个和尚，[BC、]他们住在同一个{CC的}地方[BQ，]生活在一起，[BC、]他们都想喝水{CD一}[BQ，]事情{CQ就}是这样，[BC、]很简单，[BC。]然而他们不是在一起去喝水[BQ，]而是每个人自己走。[BC…],200105109525200322,日本,2,200105,由“三个和尚没水喝”想到的……,70,60,61,64,73,313,C,
于是，和尚让老百姓[B性]提个意见，同时三个和尚也考虑有什么办法才能令人满意。,200105109525200333,日本,2,200105,由“三个和尚没水喝”想到的……,70,60,66,58,75,314,C,
”一个和尚对其他两个说了。,200105109525200450,日本,2,200105,由“三个和尚没水喝”想到的……,70,65,61,69,73,324,C,
由“三个和尚没水喝”这个故事{CJ-zhuy我}得到{CQ了}很好的启发，就是[BQ：]{CD当}人们在困难的时候都能坚持克服困难，坚强{CC2艰难困苦}地生活着。,200105109540200506,印度尼西亚,2,200105,由“三个和尚没水喝”想到的……,85,85,54,53,77,349,未参加,
那时候我觉得妈妈对我的教育方针还是不错{CJsd}，不管打扫还是{CC2或者是}洗衣服，对现在的我来说都是{CJX}应该自己来管的，而且不应该总是靠别人{CD的事情了}。,200105109525100558,日本,1,200105,由“三个和尚没水喝”想到的……,65,65,48,64,57,283,C,
不然的话最后责任感也没有了。,200105109525100558,日本,1,200105,由“三个和尚没水喝”想到的……,65,65,48,64,57,283,C,
然后，在庙里{CD来到了}另一个和尚也这么想。,200105109525200581,日本,2,200105,由“三个和尚没水喝”想到的……,65,60,52,55,55,270,未参加,
我们非常地焦急。,200105109525100620,日本,1,200105,由“三个和尚没水喝”想到的……,65,65,52,60,61,287,C,
“在家从父，出嫁从夫，夫死从子”这个保守观[C]念深深地影响{CQ了}我们封建妇女的整{CJcd}一代。,200109684542250003,越南,2,200109,我对离婚问题的看法,75,80,70,65,53,334,C,
开始的时候最严重的问题是身体上的痛苦，可是长期这样下去时，最难过的问题是精神上的痛苦了。,200205205525200015,日本,2,200205,如何看待“安乐死”,75,80,58,67,70,341,B,
如果这些事实正式地写在纸上、还有签个名，[BC、]然后跟医生谈一谈情况来决定，[BC、]就应该会得到社会的理解。,200205205525200084,日本,2,200205,如何看待“安乐死”,70,80,44,54,56,294,未参加,
但是，天有不测风云，他们决定的晚上，爷爷自然地死了。,200205205525100110,日本,1,200205,如何看待“安乐死”,70,75,46,56,54,290,C,
“安乐死”这个问题引起了人们的不同意见。,200205206525200008,日本,2,200205,如何看待“安乐死”,70,65,58,65,68,312,C,
奶奶住[B往]在医院里照顾他，我们每天早上和晚上去{CD了}他的病房。,200205206525200009,日本,2,200205,如何看待“安乐死”,70,65,49,81,63,314,C,
活着才会知道[B到]什么是痛苦，[BC。]什么是幸福。[BC，],200205206525200077,日本,2,200205,如何看待“安乐死”,75,70,71,40,32,277,未参加,
我只是努力说服他，[BC.]不会打他。,200209550523150013,韩国,1,200209,如何解决“代沟”问题,65,60,54,52,58,272,未参加,
只是可以表达自己的真正的心理[B里]，任何方式都可以{CD了}。,200209550523250030,韩国,2,200209,如何解决“代沟”问题,65,65,57,62,70,303,C,
为了解[C]决问题，人们要了解[C]他人的思想{CC思考}，尊重他人的生活方式，互相交流个人的看法，可以创造{CC造成}美好的人际{CC人间}关系。,200209550523250048,韩国,2,200209,如何解决“代沟”问题,60,55,36,49,40,221,未参加,
无论是现在还是过去，长辈经常对晚辈说[C]，现在的年青人不好管教。,200209550523250051,韩国,2,200209,如何解决“代沟”问题,65,70,45,64,56,286,未参加,
第[C]三就是互相包容{CC容纳}，自己觉得对方有什么错误，但是如果大大方方地宽容对方的错误的话，人和人之间的代沟一定能解[C]决到一定的程[C]度。,200209550523250051,韩国,2,200209,如何解决“代沟”问题,65,70,45,64,56,286,未参加,
还有为什么产生{CC发生}？,200209550523250070,韩国,2,200209,如何解决“代沟”问题,65,65,48,45,42,249,未参加,
这样的情况下，我[C]们应[C]该努力听对方{CQ的}意见。,200209550523250098,韩国,2,200209,如何解决“代沟”问题,65,60,66,62,50,286,C,
如果不要那么严肃{CC深刻}，那么紧张的话，{CJ-zhuy它}不是那么严重{CC深刻}的问题。,200209550523250100,韩国,2,200209,如何解决“代沟”问题,65,65,69,54,58,295,C,
那么，我们怎样解决代沟的问题才好呢？,200209550523250128,韩国,2,200209,如何解决“代沟”问题,65,75,60,71,56,314,C,
这样的现象，一方面是利大于弊[C]，但是，别一方面[B间]是弊[C]大于利。,200209550523150147,韩国,1,200209,如何解决“代沟”问题,65,60,45,62,58,273,未参加,
其实也不一定吧！,200209550523250180,韩国,2,200209,如何解决“代沟”问题,65,60,63,69,78,318,C,
为了缓解父母和孩子们的紧张局势，我们{CQ的}社会制度{CD上}，应该有变化，特别是在教育制度上有很大的变化。,200209550523150188,韩国,1,200209,如何解决“代沟”问题,65,60,69,54,62,293,C,
这样下去的话，“代沟”{CJ-sy会}越来越深。,200209550523250216,韩国,2,200209,如何解决“代沟”问题,65,65,63,62,56,295,C,
