错句,作文编码,国籍,性别,考试时间,作文题目,口试分数,作文分数,听力分数,阅读分数,综合分数,总分,证书
其实，世上没有哪一件事是能有保证的，婚姻也是。,200410534519150039,马来西亚,1,200410,最理想的结交方式,75,90,85,88,100,432,A,
我觉得现代生活方式改变了，社交圈子也随之{CC之随}变广。,200410534540250070,印度尼西亚,2,200410,最理想的结交方式,65,70,71,51,84,327,C,
因为亲戚朋友都知道双方男女的家庭背景、对对象[B像]的要求以及生活方式等，除此之外，亲戚朋友也是可靠之人，他们也是本着一颗为一对男女拉红线、创造幸福之心而做红娘。,200410534533150114,新加坡,1,200410,最理想的结交方式,95,90,69,81,96,430,B,
通过朋友介绍的交友方式只是一个开始，最终还需两个人不断地{CC的}努力经营，才能创造出一段刻骨[C]铭心、天长地久{CC天长地老}的感情。,200410534533150114,新加坡,1,200410,最理想的结交方式,95,90,69,81,96,430,B,
现在的年代跟以前{CC一前}不太一样了，只要你有名[B明]，只要人家喜欢你，只要你跟其他人有特点你就会成有钱的人了。,200404140540200217,印度尼西亚,2,200404,运动员收入,60,75,60,55,51,287,C,
他们患上肺癌的可能性比烟民更高。,200405680519250039,马来西亚,2,200405,吸烟对个人健康和公众利益的影响,75,95,85,88,87,424,A,
而家中的长[F長]者也不会向其儿女灌输性知识或性教育。,200504534533150005,新加坡,1,200504,我对男女分班的看法,65,85,65,78,70,353,C,
因为在当今社会中，互[B户]联网或交友热线无所不在。,200504534533250014,新加坡,2,200504,我对男女分班的看法,65,80,67,56,84,340,C,
而女同学则可负责节目安排及策划的工作。,200504534533250042,新加坡,2,200504,我对男女分班的看法,80,85,76,84,93,412,B,
到了高中和大学阶段，我认为男女应该以混合式受教育。[BC.],200504534533250056,新加坡,2,200504,我对男女分班的看法,75,85,62,60,77,352,C,
这种想法大多数发生在男性身上。,200504534533150076,新加坡,1,200504,我对男女分班的看法,75,90,84,86,82,411,A,
男生之间的脾气是大了一点，和女生就不同了！,200504534533250130,新加坡,2,200504,我对男女分班的看法,70,85,70,73,64,354,B,
以下是几个主要原因：思想差异和性别差异。,200504534533250157,新加坡,2,200504,我对男女分班的看法,80,75,76,78,79,379,B,
我最终认为分班这个做法不对，因而{CC2而}不应该做。,200504534533250162,新加坡,2,200504,我对男女分班的看法,70,75,70,78,64,346,B,
男女混合式教育是鼓励男性和女性交流的好方法。,200504534533250164,新加坡,2,200504,我对男女分班的看法,75,85,70,58,70,351,B,
现在不论在哪个国家，混合式教育占了大多数，但单一式的教育也存在[D这]。,200504534533250168,新加坡,2,200504,我对男女分班的看法,60,80,76,76,79,358,C,
工作上，常常跟外国人接触，觉得很有意思。,200505109525200269,日本,2,200505,父母是孩子的第一任老师,65,75,62,69,84,342,C,
如果父母只说不做到，孩子就对父母的教育[C]心里有了疑问，就会不听话。,200505109525100451,日本,1,200505,父母是孩子的第一任老师,70,75,65,69,69,337,C,
所以父母的一举一动都{CJ-zy应该}有好{CJ-zxy的行为}，一旦有不好的行为，对孩子有深深的影响{CC烙印}。,200505109540200542,印度尼西亚,2,200505,父母是孩子的第一任老师,65,65,63,35,48,260,未参加,
与其他的同学[C]相比，有很多不成熟之[C]处。,200505109525100991,日本,1,200505,父母是孩子的第一任老师,65,65,60,62,78,314,C,
有的人为了挣钱而活，有的人为了享受人生而活，我呢，跟父亲一样，为别人有力而活着{CJ？}！,200505109525201138,日本,2,200505,父母是孩子的第一任老师,60,75,57,62,78,318,未参加,
我想[C]不要把自己看成孩子的老师。,200505109525201209,日本,2,200505,父母是孩子的第一任老师,60,80,60,74,64,325,C,
达到这个要求的父母才是真正{CQ的}孩子的第一任老师。,200505109635101213,俄罗斯,1,200505,父母是孩子的第一任老师,95,85,60,51,71,360,C,
我想拿我自己家庭说一下这问题。,200505109523201266,韩国,2,200505,父母是孩子的第一任老师,55,75,57,39,52,263,未参加,
这[C]是对人类来说最重要的东西。,200505109525101284,日本,1,200505,父母是孩子的第一任老师,65,60,53,45,62,268,未参加,
一直这样做下去{CQ会}引起什么样的后果呢？,200505109525201366,日本,2,200505,父母是孩子的第一任老师,70,65,57,43,55,276,未参加,
父母有良好{CC完好}的行为，说话合理[BQ，]那么以后孩子一定是好人，所以才说“父母是孩子的第一任老师”。,200505109542101450,越南,1,200505,父母是孩子的第一任老师,55,75,60,37,50,262,未参加,
每天从早到[C]晚一直跟朋友一起打棒球。,200505109525101681,日本,1,200505,父母是孩子的第一任老师,50,75,50,55,67,281,未参加,
一般都高高兴兴地大声地说：“我回来啦！,200505109525101688,日本,1,200505,父母是孩子的第一任老师,85,80,76,75,87,396,B,
发现性格大不一样了。,200505109525201751,日本,2,200505,父母是孩子的第一任老师,45,55,48,55,61,242,未参加,
而使他慢慢加工为{CC到}好喝的饮料的主导因素{CC4主导员}是{CC的}父母，这个纯净水变成{CD对}有利{CD于}人体的饮料，[BC、]还是有害于人体的饮料，这关健在于酝酿{CC酿成}的过程。,200505109510201804,朝鲜,2,200505,父母是孩子的第一任老师,80,75,67,57,87,357,C,
虽然他们身体长大了，已经二十多岁了，但是思想观念还是{CQ跟}孩子一样。,200505109525201916,日本,2,200505,父母是孩子的第一任老师,40,50,26,29,30,150,未参加,
我有一个朋友。,200505109525202469,日本,2,200505,父母是孩子的第一任老师,65,75,58,59,80,324,C,
而我的朋友没有这样的机会。,200505109529202511,泰国,2,200505,父母是孩子的第一任老师,70,65,56,53,50,280,未参加,
我承认了[BQ，]然后我被[C]带[B代]到了学校[C]，老师把我[L]的家人叫来了，过了几分钟妈妈来了。,200505109525102595,日本,1,200505,父母是孩子的第一任老师,65,60,54,53,56,271,未参加,
父母不但{CJ-sy给孩子}营养和保护[BQ，]而他们更重要的任务[B物]在于[B与]教育孩子，让他成为具有很高的{CC3高度}文化[BQ、]有利于社会的人。,200505205635100169,俄罗斯,1,200505,父母是孩子的第一任老师,60,60,56,31,61,250,未参加,
现[F現]代社会风俗多半[B伴]是以上两种{CD的}情况。,200505522522250040,缅甸,2,200505,最理想的结交方式,55,65,59,58,75,294,C,
其次孩子是在{CC从}家庭的生活{CJ-zxy中}长大{CJ+wy而存在}的[BQ，]但还有孩子的老师、[BC，]朋友。,200505201635200311,俄罗斯,2,200505,父母是孩子的第一任老师,60,80,44,45,52,268,未参加,
每个孩子都需要{CD一个}父母。,200505502540200084,印度尼西亚,2,200505,父母是孩子的第一任老师,80,60,39,51,54,271,未参加,
这样的孩子以后也会打自己的后代。,200505206635100137,俄罗斯,1,200505,父母是孩子的第一任老师,95,80,71,67,80,389,B,
我在圣彼得堡大学读了中国历史专业[BQ，]像[B象]我妈妈一样[C]。,200505226635200082,俄罗斯,2,200505,父母是孩子的第一任老师,55,60,39,39,32,206,未参加,
如果父母亲对孩子的一切都一无所知，这样会{CJ-sy给}孩子很不好的教育{CJ+zxy培养}。,200505332540200028,印度尼西亚,2,200505,父母是孩子的第一任老师,65,70,39,31,50,241,未参加,
父母亲的思想观念，也直接影响着孩子的成长。,200505332512100051,菲律宾,1,200505,父母是孩子的第一任老师,70,90,58,65,80,356,C,
但[B旦]是你的朋友们不一定知道对你最好的是什么{CC2哪}样的人。,200505650634250184,英国,2,200505,最理想的结交方式,70,50,34,47,37,221,未参加,
古代孟母三迁就是为了给孟子一个好的环境。,200505024519200395,马来西亚,2,200505,父母是孩子的第一任老师,85,95,67,71,93,407,B,
目前是待[B带]业在家。,200509534533150026,新加坡,1,200509,一封求职信,55,75,52,44,59,270,未参加,
我喜欢交新朋友，在人际方面我沟通完全没有问题[BQ。]除了在人与[B于]人之间{CJ-zxy的沟通}[BD，]和语言方面我能胜任之外，我还能唱中文[BQ、]{CD和}西洋歌曲和弹吉它[B打]。,200509534533150056,新加坡,1,200509,一封求职信,70,80,52,49,77,318,未参加,
在此附上本人的履历表一份、推荐信一封，希望{CQ能}有机会上贵公司面识。,200509534533250102,新加坡,2,200509,一封求职信,70,70,75,62,77,342,C,
当然的，英语和汉语，我的母语，我也不会忽略{CC忽悟}了它们。,200509534533250124,新加坡,2,200509,一封求职信,65,65,68,49,77,308,C,
为了能让学生学以致用，我们{CQ修}广告设计课程的学生在放暑假的时候都会分配到不同公司{CJbei}，帮[L]助公司设计广告。,200509534533150141,新加坡,1,200509,一封求职信,70,70,48,51,46,273,未参加,
对于您的考虑，本人先此致谢。,200509534519250156,马来西亚,2,200509,一封求职信,70,75,79,77,95,385,B,
2005年9月17日,200509534533150170,新加坡,1,200509,一封求职信,70,75,59,58,97,348,C,
我有兴趣应聘{CC征求}成为贵公司的广告设计师。,200509534533150183,新加坡,1,200509,一封求职信,65,70,75,66,82,344,C,
对本人的联系地址如下：88号裕廊大道#08-80新加坡邮区244886本人会期待李先生的答复。,200509534533250188,新加坡,2,200509,一封求职信,0,65,77,55,91,281,未参加,
但是，我觉得“歌曲”是代表当时人们的心。,200510111523200009,韩国,2,200510,我看流行歌曲,60,60,53,40,35,230,未参加,
我喜欢这样的流行歌[B哥]曲。,200510111523200055,韩国,2,200510,我看流行歌曲,60,65,39,44,35,226,未参加,
对年情人来说流行歌曲是不{CC无}可缺少的。[BC.],200510111523100794,韩国,1,200510,我看流行歌曲,55,50,46,34,55,219,未参加,
甚至我睡觉前{CQ也要}带耳机听音乐睡觉。,200510111523100817,韩国,1,200510,我看流行歌曲,60,65,53,40,47,248,未参加,
有些人特别喜欢流行歌曲，相反有些人却不喜欢流行歌曲。,200510111523200878,韩国,2,200510,我看流行歌曲,60,90,56,48,67,311,未参加,
首[B手]先流行歌曲都{CJ+sy有}自由自在。,200510111523101029,韩国,1,200510,我看流行歌曲,65,55,60,28,55,245,未参加,
随着社会的发展，人们的文化水平也提高了。,200510111523201066,韩国,2,200510,我看流行歌曲,60,65,49,42,52,251,未参加,
他[B它]们真诚地安慰我。,200510111523101267,韩国,1,200510,我看流行歌曲,65,65,56,30,50,250,未参加,
现代人都免不了听很[C]多种类的歌曲。[BC、],200510111523101277,韩国,1,200510,我看流行歌曲,55,45,35,38,52,202,未参加,
听这些流行歌曲，那我的心里可以变得很平静{CC平安}，很舒畅。,200510111523201271,韩国,2,200510,我看流行歌曲,70,70,42,40,62,272,未参加,
这样以来，我喜欢流行歌曲。,200510111523201869,韩国,2,200510,我看流行歌曲,65,55,49,40,45,236,未参加,
哇哇坠地之后，我们往往第一个说出的词就是“爸爸”或者“妈妈”，因为我们从出世起，最常接触的就是父母。,200510919501150001,中国,1,200510,父母是孩子的第一任老师,95,95,89,82,100,460,A,
比如有一个人听很欢乐{CC乐欢}的歌那他现在的心情特别好，反之{CC反而}听比较痛[B通]苦的歌那他现在的心情相当寂[B叔]寞。[BC，],200510302523100032,韩国,1,200510,我看流行歌曲,65,55,44,32,59,237,未参加,
我们需要把那些学生的想法改变[B遍]{CJba}。,200510302523200057,韩国,2,200510,我看流行歌曲,50,50,42,26,47,193,未参加,
我高中的时候常常看到这些歌迷，[BC。]为了看喜欢偶像[B象]的演[B寅]唱会，一整天等在门口。,200510302523200084,韩国,2,200510,我看流行歌曲,65,60,63,48,55,274,未参加,
我们都知道，到卡拉OK，有人唱我们所喜欢的流行歌曲，[BC。]{CQ感到}很高兴，觉得他是和我们同一代人，很亲切。,200510302523100098,韩国,1,200510,我看流行歌曲,75,75,65,48,77,330,C,
可我从初中{CD学生}到现在{CQ只}喜欢一个男歌手。,200510302523200101,韩国,2,200510,我看流行歌曲,60,55,37,40,35,208,未参加,
流行歌曲也有教育性的。,200510302523200208,韩国,2,200510,我看流行歌曲,95,80,83,65,77,396,B,
一般人认为流行歌曲是很多人都喜欢听喜欢唱的就是流行歌曲，但是实际上人们喜欢的，流行{CC红火}的那些流行歌曲是值得喜欢、值得流行{CC红火}{CQ的}吗？,200510302523200239,韩国,2,200510,我看流行歌曲,70,55,65,59,67,300,C,
我也是这样。,200510302523200240,韩国,2,200510,我看流行歌曲,75,70,42,34,50,260,未参加,
这可能与自己的性格或思想观念有一些关[C]联吧。,200510302523200258,韩国,2,200510,我看流行歌曲,55,65,63,65,82,312,C,
我最喜欢听华语流行歌曲，因为我懂中文，所以当我听华语歌曲的时候，我懂得歌词的意义，我听邓丽君[C]唱的流行歌曲最多，因为她的歌声悦耳动听，有时连续五六个小时听邓[B对]丽君[C]唱的流行歌曲，一点也不烦[C]，有时也跟着她的歌声唱个不停。,200510529529151020,泰国,1,200510,我看流行歌曲,50,60,53,36,62,241,未参加,
有些人不喜欢流行歌曲，他们说太俗气了，他们说流行歌曲没有高尚的情操，没有气派，我却不以为然，反正音乐，只要悦耳动{CC顺}听就可以了，你说是吗？,200510540540200054,印度尼西亚,2,200510,我看流行歌曲,75,70,63,54,87,338,C,
但也有一些上了年纪的老人就经常摇头说：“流行歌曲一点儿也没有内涵[B函]，没有音乐价值。,200510540540200058,印度尼西亚,2,200510,我看流行歌曲,65,75,67,54,79,327,C,
这是流行歌曲的魄力吧！,200510540540200062,印度尼西亚,2,200510,我看流行歌曲,70,75,60,44,84,322,C,
可是，孩子们要到几[F幾]周岁以上才开[F開]始有上学校或幼儿[F兒]园的机会，坏的习惯[F慣]可能{CD一}早已养[F養]成了，那时已经太迟[F遲]，可以把他们教好{CD的}。,200509602801250009,澳大利亚,2,200509,父母是孩子的第一任老师,70,70,71,63,77,339,C,
这儿的天气跟汉城差不多，但风太大。,200104124523200005,韩国,2,200104,一封写给父母的信,75,70,58,47,45,284,C,
我一定让你们高兴。,200104124523200032,韩国,2,200104,一封写给父母的信,65,70,60,42,54,277,未参加,
我疼爱的弟弟也好吗？,200104124523200085,韩国,2,200104,一封写给父母的信,65,50,58,61,63,278,未参加,
我一定{CQ会}学好很多东西。,200104124525200101,日本,2,200104,一封写给父母的信,70,50,33,42,47,225,未参加,
身体好吗？,200104124540200136,印度尼西亚,2,200104,一封写给父母的信,75,90,44,28,45,276,未参加,
如果我在汉城，也许不能感受[L]到{CD的}。,200104124523200188,韩国,2,200104,一封写给父母的信,70,60,55,49,49,268,未参加,
妈，爸，我想问你们{CC您们}印尼的情况什么样？,200104124540200193,印度尼西亚,2,200104,一封写给父母的信,65,60,25,30,31,194,未参加,
那天，天气非常好。,200104124529100328,泰国,1,200104,一封写给父母的信,75,80,63,39,56,304,未参加,
妈妈[BQ，]最近我有了一件特别高兴的事，您知道吗？,200104124525200438,日本,2,200104,一封写给父母的信,65,90,71,54,56,327,C,
日本和中国关系很密切{CC5很有关系}的。,199200204525100021,日本,1,199200,一封求职信,,,0,0,0,0,未参加,
精美服装公司你好。,199200008525100003,日本,1,199200,一封求职信,,,0,0,0,0,未参加,
某{CC一}种[C]不治之症的病人，十分痛苦[C]，痛得不得了，在这样[C]的[C]情况下[C]，病人自己要求别人帮助她自杀，还[C]有为[C]了病人安乐而死，亲戚[C]和大夫故意放弃{CJX}被[C]死亡{CC2死[C]}了{CJbei}，从这样[C]的[C]角[C]度来[C]说，支持[B技]安乐死[C]的人也不少。P},199604123523100280,韩国,1,199604,如何看待“安乐死”,65,50,37,44,42,218,未参加,
再说，虽然有的病治了十几年也没治好，但人是不应该放弃每一次的机会。,199604124625200022,葡萄牙,2,199604,如何看待“安乐死”,85,65,56,30,39,264,未参加,
一个是真正为了病人{CD的}{CJ-sy减轻}痛苦，一个是这样勉强活下去对家人没有好处，而且更难受。,199604124523200150,韩国,2,199604,如何看待“安乐死”,50,50,45,47,44,212,未参加,
然而，我的看法是这样：生命是被上帝而给我们的{CJbei}，[BC。]所以必须认真对待{CC4评价}这一辈子{CC2辈}的每一分钟。,199604123635100241,俄罗斯,1,199604,如何看待“安乐死”,80,55,24,37,39,221,未参加,
因为最后没有办法的时候，不能看病人的痛苦。,199604123523100305,韩国,1,199604,如何看待“安乐死”,70,65,42,44,49,255,未参加,
如果问我个人同意不同意根据文章所提出的观点{CC2活}，[BC。]我能立刻同意农村丈夫帮助妻子自杀。,199604124529200129,泰国,2,199604,如何看待“安乐死”,60,60,40,37,42,221,未参加,
我们应该对上帝没完没了地要求很快好了，还[C]有等上帝的恩惠[B慧]。,199604123523200327,韩国,2,199604,如何看待“安乐死”,60,70,58,61,44,277,未参加,
而且只有医生判断死不死[BQ，]{CJ+zy实[B是]在}医生心理负担[B坦]也挺大。,199604124525100068,日本,1,199604,如何看待“安乐死”,50,50,42,52,47,217,未参加,
特[C]别生活在西方国[F國]家，父母与[C]子女之间[F間]的代沟[F溝]更为[F爲]显[F顯]著。,199610802801100002,澳大利亚,1,199610,如何解决“代沟”问题,95,75,44,50,69,328,未参加,
首先[BQ，]多说话，多在一起自然就问题{CJX}少发生。,199610550523190059,韩国,1,199610,如何解决“代沟”问题,60,60,46,44,51,243,未参加,
那么怎么解决代沟的问题？,199610550523290076,韩国,2,199610,如何解决“代沟”问题,65,60,36,32,41,217,未参加,
教育方法对解决[F決]代沟[F溝]问题来说[L]必能有立竿见[F見]影之效，但百年树[F樹]人，时间更可把基础[F礎]打牢{CC固}。,199611543501100533,中国,1,199611,如何解决“代沟”问题,80,85,75,73,94,401,B,
那些想不劳而获的人，我们应该对他们嗤之以鼻，不屑一顾。,199603533533200017,新加坡,2,199603,由“三个和尚没水喝”想到的……,90,90,74,56,72,380,B,
刚才说完的和尚{CJ-sy用}有点儿得意[C]的样子看别人，他估计这样说{CJ+by话}[BQ，]肯定{CJX}别的和尚{CD们}感觉到应该{CJX}来得晚的他们去山下抬水，[BC。]但是[BD，]一直没[C]有人去抬水{CD的}。,199605104523100016,韩国,1,199605,由“三个和尚没水喝”想到的……,75,60,63,60,56,300,C,
喝水问题就不方便[B使]多了，因为在那座庙里{CD的人}多两人以后他们都想依靠别人，不肯自己干活。P},199605104523100017,韩国,1,199605,由“三个和尚没水喝”想到的……,60,60,49,45,54,250,未参加,
现在是秋天怎么能下雨。,199605104529200011,泰国,2,199605,由“三个和尚没水喝”想到的……,65,65,52,29,49,244,未参加,
如果每个人{CC3个人}{CD各自}都想这是自己的事儿，不能放弃{CJX}这样。,199605104523200036,韩国,2,199605,由“三个和尚没水喝”想到的……,60,55,46,63,49,254,未参加,
有一天，他在山底碰到卖吃的{CQ的}漂[C]亮的姑娘。,199605104525200091,日本,2,199605,由“三个和尚没水喝”想到的……,70,65,55,58,68,302,C,
我想从小把孩子培养成为能够互相体贴，互相[B想]爱护的人是很重要的。,199605104525200096,日本,2,199605,由“三个和尚没水喝”想到的……,90,80,69,58,77,369,C,
我刚到中国的时候学校的一位老师对我非常好，常常给我听老师讲的故事和笑话，然后让我说听{CQ过}以后{CQ所}想的。,199605104523200110,韩国,2,199605,由“三个和尚没水喝”想到的……,55,60,69,51,70,286,未参加,
我们看文章中的三个和尚，其实他们不是一般的俗人，但他们还是人类{CC人间}，所以谁也不愿意打水去。,199605104523100128,韩国,1,199605,由“三个和尚没水喝”想到的……,60,65,66,56,72,302,C,
可是，目前，随着工业{CC产业}的发展，周[C]围的环境越来越坏。,199605104523100134,韩国,1,199605,由“三个和尚没水喝”想到的……,55,65,52,47,63,264,未参加,
人物P}，给中国[F國]人民想要说的内容{CJ-zy与这个故事}很像似的P}。,199605104523100181,韩国,1,199605,由“三个和尚没水喝”想到的……,80,65,77,54,75,339,C,
人没必要非得我{CD来}去挑水不可，[BC。]都{CJX}心里盼着别人替我去打水。P},199605104523200226,韩国,2,199605,由“三个和尚没水喝”想到的……,85,85,60,72,82,379,B,
因为日本人和中国人都是东方人，外貌相似，所以人们以为思想也差不多。,199605104525200233,日本,2,199605,由“三个和尚没水喝”想到的……,70,80,74,88,94,396,B,
我们大家一起保护自然资源吧。,199605104523200272,韩国,2,199605,由“三个和尚没水喝”想到的……,55,60,38,38,46,218,未参加,
人们都这样。,199605104523200278,韩国,2,199605,由“三个和尚没水喝”想到的……,70,70,71,51,51,301,C,
社会上这样的情况很多。,199605104523100296,韩国,1,199605,由“三个和尚没水喝”想到的……,55,60,38,42,32,208,未参加,
我们应该消除{CC排除}这种弊病，应该主动地{CC的}帮助别人，主动地{CC的}去解决任何问题。,199605104523100305,韩国,1,199605,由“三个和尚没水喝”想到的……,70,85,71,60,61,339,C,
可是人们在一起的时候，同时{CQ会}犯{CC1产生}{CJ+sy有}一些毛病。,199605104523200307,韩国,2,199605,由“三个和尚没水喝”想到的……,55,50,46,47,63,240,未参加,
这当然{CJsd}。[BC，],199605104525200303,日本,2,199605,由“三个和尚没水喝”想到的……,65,65,41,58,68,281,未参加,
在这么严肃的考试当中读“三个和尚没水喝”的短文让我轻松{CQ了}一些。,199605104633100309,意大利,1,199605,由“三个和尚没水喝”想到的……,70,60,58,38,27,238,未参加,
学会了做[B作]饭、[BC，]打扫卫生。,199605104525200330,日本,2,199605,由“三个和尚没水喝”想到的……,75,75,55,63,56,314,C,
重新看看这故事。,199605104525100343,日本,1,199605,由“三个和尚没水喝”想到的……,80,70,44,49,42,275,未参加,
所以应[C]该把人际关系搞好一点[BQ，]做什么也是[BQ，]基本的原则是搞好人际关系。[BC、],199605104525100351,日本,1,199605,由“三个和尚没水喝”想到的……,70,75,60,67,70,331,C,
结[C]果，人多[C]了，反而没有水喝了。,199605104525100353,日本,1,199605,由“三个和尚没水喝”想到的……,70,65,38,76,80,315,未参加,
于是，朋友给我讲{CC听}一个故事{CJX}了。,199605104525200375,日本,2,199605,由“三个和尚没水喝”想到的……,65,70,77,60,80,338,C,
”另[B别]一个和尚说：“这不是很{CC真[F眞]}笨笨{CJcd}的思想吗？{CD做},199605550523190015,韩国,1,199605,由“三个和尚没水喝”想到的……,70,60,55,58,58,286,未参加,
他们同意了这个主意[B义]。[BC，],199605550523190056,韩国,1,199605,由“三个和尚没水喝”想到的……,70,50,55,47,56,261,未参加,
就是人们都希望{CC愿意}的理想社会。,199605550523290083,韩国,2,199605,由“三个和尚没水喝”想到的……,65,60,44,63,51,266,未参加,
可喜的是[BQ，]在中学毕业之时[BQ，]我的考试成绩名列[B例]第三。,199704123523200139,韩国,2,199704,记对我影响最大的一个人,75,80,53,73,68,340,C,
我生长在一个小康之家，父亲是在一间洋货店当职员兼收账员，[BC。]母亲是标准的家庭主妇。,200110540540250049,印度尼西亚,2,200110,我的童年,70,90,71,49,85,358,C,
在那里没有车[F車]祸、没有抢[F搶]劫。,200110540540150121,印度尼西亚,1,200110,我的童年,85,90,79,80,92,422,A,
可惜好景不常在，1996年9月30号印尼发生了政变。,200110540540150143,印度尼西亚,1,200110,我的童年,80,85,79,65,88,391,B,
我在家里是长女，所以我感觉到我的童年并[F並]不那么长。,200110540540250157,印度尼西亚,2,200110,我的童年,70,85,79,63,85,374,C,
(B)女性，2名。,199312533533200017,新加坡,2,199312,一封求职信,75,45,50,65,68,285,未参加,
五官端正、态度诚[F誠]恳、品德[C]兼优[F優]、能刻[B克]苦耐劳；曾经当过：家庭补[F補]习老师五年、店员、推销[F銷]员[F員]等等，近年来曾当过导游员十年，如蒙不弃[F棄]请速回[F囬]示[C]此致快乐公司旅[C]游[F遊]公司贵经理{CD先生}[BD:]×××4/12/93,199312533533100098,新加坡,1,199312,一封求职信,80,65,39,52,36,261,未参加,
自一九九零{CC一九九十}年从{CC在}英国的维尔欺斯大学毕业后，我就一直担任这份工作，念[F唸]大学以前，我曾在经济发展[C]局当一名工艺指导员，负责指导来自{CC近}不同{CC仝}背景的成年人，也给我累积了不少人际沟[C]通的技巧。,199312533533100141,新加坡,1,199312,一封求职信,90,70,55,69,85,362,C,
快乐家庭旅游公司李文先生：您好。,199312123525200510,日本,2,199312,一封求职信,60,65,46,59,39,253,未参加,
