错句,作文编码,国籍,性别,考试时间,作文题目,口试分数,作文分数,听力分数,阅读分数,综合分数,总分,证书
我自己觉得对于一个国家的政府来说，控制吸烟者数量{CC数率}最好的办法还是教育。,200405207635200033,俄罗斯,2,200405,吸烟对个人健康和公众利益的影响,65,55,58,39,40,239,未参加,
自古已来[F來]，许[F許]多帝王都是通过介绍，相亲这一方式得以{CC于[F於]}延续[F續]皇朝的血统{CC存在}。,200410534533150018,新加坡,1,200410,最理想的结交方式,80,80,66,83,89,390,B,
各种方式，真令人眼花缭乱，目不暇[C]接[B给]。,200410534533250024,新加坡,2,200410,最理想的结交方式,85,85,80,70,89,404,B,
性格不合也是使离婚率上升的其中一个原因。,200410534533250076,新加坡,2,200410,最理想的结交方式,80,85,63,56,75,353,C,
通过亲戚朋友介绍的结交方式最有保障。,200410534533150114,新加坡,1,200410,最理想的结交方式,95,90,69,81,96,430,B,
找个理想的伴侣陪你过完这一生……怎么样才能让他人接[B结]受你，和你交往呢？,200410534533250144,新加坡,2,200410,最理想的结交方式,60,90,69,63,72,344,C,
随着经济发[C]展，人们的收入也不断提高。,200404140529200134,泰国,2,200404,运动员收入,75,85,60,61,65,339,C,
他们值[B直]得有这样高{CQ的}收入，因为不仅他们的心血全放在这个职业上，而且也是人才。,200404140542200191,越南,2,200404,运动员收入,70,70,52,32,57,269,未参加,
政府已经多次{CD的}呼吁人民减少抽烟，由政府所举办的一系列禁烟活动、禁烟广告等等措施来看，政府在鼓励国民禁烟方面的确作出了不少努力。,200405680519150029,马来西亚,1,200405,吸烟对个人健康和公众利益的影响,70,95,74,79,99,410,B,
无可否认，香烟里的确含有使人可以放松心情的含料[BQ，]但这就代表说它真正地帮到我们{CQ了}吗？,200405680519150048,马来西亚,1,200405,吸烟对个人健康和公众利益的影响,60,95,60,63,63,331,C,
另外一个好处就是上体育课时，若某些活动的玩法女生感到一窍不通，而男生反而了如指掌，男生也能乘[B剩]那个机会教女生怎么玩那游戏。,200504534533150039,新加坡,1,200504,我对男女分班的看法,70,70,73,45,62,308,C,
大部分家长支持男女分班，他们自然有他们的隐忧：由于门户开放，西风（甚至日风、[BC，]韩风）日渐，再加上网络传播媒介，一些学生对异性不仅起了幻想，有些甚至学了一些坏招术，然后“近水楼台先得月”，与同班异性搞早恋。,200504534533250066,新加坡,2,200504,我对男女分班的看法,70,70,87,84,84,383,C,
就{CC对}我个人的看法，我也坚决支持男女分班。[BC.],200504534533250078,新加坡,2,200504,我对男女分班的看法,65,55,42,43,50,237,未参加,
要谈恋爱一定要找班内的人吗？,200504534533250118,新加坡,2,200504,我对男女分班的看法,70,80,81,69,82,372,B,
异[F異]性之间的相处是非常重要的。,200504534533250118,新加坡,2,200504,我对男女分班的看法,70,80,81,69,82,372,B,
我本身是反对男女分班{CJsd}，其中的原因[L]有好几个。[BC.],200504534533250126,新加坡,2,200504,我对男女分班的看法,70,75,67,62,73,336,C,
那，不就很可惜吗？,200504534533250159,新加坡,2,200504,我对男女分班的看法,65,70,65,73,70,329,C,
以后{CC下次}进入社会工作，不知异性的性格可能会惹火了顾客；在公司里，男士与女士不能沟通。,200504534533150176,新加坡,1,200504,我对男女分班的看法,85,70,70,80,70,366,B,
这不是没有根[B跟]据的。[BC.],200504534533250181,新加坡,2,200504,我对男女分班的看法,65,70,76,62,73,332,C,
父母的一举一动，父母的每一句话无意中都会影响到孩子的成长。,200505109523200177,韩国,2,200505,父母是孩子的第一任老师,85,65,56,44,42,281,未参加,
我妈妈虽[C]然有时候照顾[C]得不[Pgōu]够，不过很努力，是世界上最好的妈妈。,200505109525200976,日本,2,200505,父母是孩子的第一任老师,60,60,64,53,57,276,未参加,
如果一个孩子在幼年时没有受到父母的关心、教育和培[B陪]养的话，这都会在他的未来体现出来。,200505109801101134,澳大利亚,1,200505,父母是孩子的第一任老师,95,65,89,70,73,384,B,
孩子与父母是“镜子”的关系{CC作用}。,200505109525201210,日本,2,200505,父母是孩子的第一任老师,80,75,73,62,69,350,B,
通[C]过[C]语言的[C]接[C]触，让孩子扩大视野。,200505109525101284,日本,1,200505,父母是孩子的第一任老师,65,60,53,45,62,268,未参加,
这六年左右就是人人建立他自己的基本性格{CJ-zxy的时间}，这六年能决定人的内心[B性]是否好。,200505109614201497,荷兰,2,200505,父母是孩子的第一任老师,70,60,41,37,41,234,未参加,
这是因为每天父母对孩子说话[BQ，]所以孩子慢慢会说了。,200505109525201655,日本,2,200505,父母是孩子的第一任老师,45,75,37,59,50,249,未参加,
从而有孩子的夫妻应该注意孩子的环境。,200505109525201854,日本,2,200505,父母是孩子的第一任老师,45,50,41,35,52,200,未参加,
父母是孩子的第一任老师我也认为父母是最早对孩子的成长产生重大影响的人。,200505109525101895,日本,1,200505,父母是孩子的第一任老师,70,75,54,67,67,322,C,
如果学习外语的话，[BC、]学会的第一句话不是“妈妈”而是“你好”。,200505109525102002,日本,1,200505,父母是孩子的第一任老师,60,60,50,49,76,277,未参加,
三是老人的问题。,200505109525102078,日本,1,200505,父母是孩子的第一任老师,60,65,41,67,50,266,未参加,
”因此，我认为父母给孩子的影响很[C]大，父母在孩子的面前要好好地表[C]现自己。,200505109525202085,日本,2,200505,父母是孩子的第一任老师,75,75,54,67,72,333,C,
特别是生活习惯、爱好等方面的影响可以说是决定性的。,200505109525102221,日本,1,200505,父母是孩子的第一任老师,65,60,48,63,72,291,未参加,
所以十分注意自己吃饭的样子。,200505109525202301,日本,2,200505,父母是孩子的第一任老师,70,70,54,55,74,311,C,
所有的人应该注意日常生活，[BC！]好好儿照顾孩子吧！,200505109525202421,日本,2,200505,父母是孩子的第一任老师,60,80,50,77,78,332,未参加,
我同意“父母是孩子的第一任老师”的看法。,200505109525202434,日本,2,200505,父母是孩子的第一任老师,70,75,61,73,72,340,C,
”这意味着不仅仅父母的好行为给孩子的影响很大，而且他们的坏行为给孩子的影响也很大。,200505109525102448,日本,1,200505,父母是孩子的第一任老师,65,60,37,61,74,280,未参加,
从{CC在}教育[C]学[C]的角度[C]来看，孩子的理解[C]能力、[BC．]学习能力、艺术能力等[C]{CD能力}是到[C]五[C]岁[C]才{CC1已经}决[C]定下来{CJsd}。,200505109525102501,日本,1,200505,父母是孩子的第一任老师,75,55,48,71,69,303,未参加,
我非常感[C]谢父母。,200505109525102597,日本,1,200505,父母是孩子的第一任老师,70,80,37,57,65,299,未参加,
这说明了父母对孩子的成长过程有着重大的影响。,200505212542200011,越南,2,200505,父母是孩子的第一任老师,90,70,63,51,74,341,C,
因为有些人的习惯是不会影响人家{CJsd}，[BC。]但是有些人的习惯{CD是}不仅是影响而且{CC2而}会伤害别人{CC人家}。,200505522522250014,缅甸,2,200505,最理想的结交方式,60,75,45,53,55,274,未参加,
父母也要把自己作为孩子的好榜样，尽量拿出自己的优点或好的习惯来教养孩子。,200505219529100021,泰国,1,200505,父母是孩子的第一任老师,75,55,54,63,76,308,未参加,
到了考试那一天，我特别紧张。,200505332529100013,泰国,1,200505,父母是孩子的第一任老师,70,90,58,45,54,310,C,
所以，根据{CC对}我个人的意见，当父母不是很容易的事。,200505332540200012,印度尼西亚,2,200505,父母是孩子的第一任老师,65,60,52,53,47,260,未参加,
但是毫无疑问，父母给孩子带来的影响不仅是最深而且是最重要的。,200505024634100375,英国,1,200505,父母是孩子的第一任老师,75,85,58,43,54,308,C,
希望贵公司能给予[B于]面试的机会，而一旦被录[F錄]取，本人将竭尽所能，做好所给予[B于]的工作。,200509534533150015,新加坡,1,200509,一封求职信,65,65,77,53,93,337,C,
开始时，由旅游主任做起，负责组团，安排机票，旅店等基层工作。,200509534533150101,新加坡,1,200509,一封求职信,55,75,82,66,82,345,C,
由于工作的需要，我本人不断进修，参加外国语文班，并[F並]通过严格的考试，获得鉴定水平的证书。,200509534533150101,新加坡,1,200509,一封求职信,55,75,82,66,82,345,C,
我现在还{CQ在}努力自修，想考到一级的文凭。,200509534533150104,新加坡,1,200509,一封求职信,70,65,50,69,84,324,C,
除此之外，我曾经在新加坡担任过三年的导游，从三年多{CC来}的经历{CC经验}中学到了不少。,200509534533250130,新加坡,2,200509,一封求职信,60,70,77,69,82,343,C,
快乐家庭旅游公司业绩高，而且所给予客人的服务也是顶级的。,200509534533250187,新加坡,2,200509,一封求职信,70,75,77,64,86,361,C,
此致，敬礼！,200509534533250187,新加坡,2,200509,一封求职信,70,75,77,64,86,361,C,
我在这方面有一些{CC不些}{CD的}经验，也知道当一个导游的基本规则{CC条则}和知识。,200509534533250191,新加坡,2,200509,一封求职信,65,65,77,60,73,324,C,
我是×××，今年二十五岁。,200509534533250192,新加坡,2,200509,一封求职信,70,70,77,62,91,358,C,
我会知道很多别的人的想[B相]法，也{CJX}有时候会觉得很轻松。{CP然后，我也可以忘了别的事[BQ，]特别是会让压力不太大。P},200510111540200586,印度尼西亚,2,200510,我看流行歌曲,50,40,30,16,20,131,未参加,
所以我觉得最近歌迷喜欢听歌声歌厚的。,200510111523100784,韩国,1,200510,我看流行歌曲,55,60,35,40,42,213,未参加,
我小学的时候有一个朋友。,200510111523200868,韩国,2,200510,我看流行歌曲,65,70,46,42,77,286,未参加,
而且我认为一个东西因为受太广泛的人们的欢迎，认为它的价值很低[B底]想法是非常错误{CC2错}的想法，因为这些通俗音乐不一定全都是庸俗的。,200510111523200876,韩国,2,200510,我看流行歌曲,65,90,74,67,91,378,B,
然后过了一段时间之后，再听现在流行的歌曲听着干事什么的。,200510111523100886,韩国,1,200510,我看流行歌曲,55,65,67,61,55,285,C,
我认为流行歌可以代表[D当]时代。,200510111523201100,韩国,2,200510,我看流行歌曲,65,70,60,50,50,281,C,
，因为流行歌曲内有很多或者大部分是跳舞类音乐，但有的人比较喜欢的是浪漫歌曲。P},200510111523201114,韩国,2,200510,我看流行歌曲,55,60,46,46,57,245,未参加,
我喜欢听流行歌曲，我的{CC们}朋友和同学们也特别喜欢，可有一些朋友过度喜欢歌星甚至{CC2连}达到痴迷的程度。,200510111523101346,韩国,1,200510,我看流行歌曲,70,85,53,61,67,328,C,
为什么？,200510111523201877,韩国,2,200510,我看流行歌曲,50,50,42,32,42,194,未参加,
在我很小的时候，那时我姥姥还在世，爸爸[BQ、]妈妈对我姥姥是非常孝顺的。,200510919501150007,中国,1,200510,父母是孩子的第一任老师,85,95,86,82,91,435,A,
我的中国朋友们，跟我一起学日语（真的！,200510271634100130,英国,1,200510,我看流行歌曲,85,65,46,36,62,283,未参加,
不过每个人对{CJ+dy这}流行歌曲的看法都不一致[B至]。,200510512512150025,菲律宾,1,200510,我看流行歌曲,75,75,79,59,67,345,B,
而父母是我们在成长过程中接触最多的人，所以我们的一些习惯和性格大部分都是从父母身上“学”来的{CC了}。,200510956501230005,中国,2,200510,父母是孩子的第一任老师,90,95,68,63,91,405,C,
每天早上叫我起床的是母亲，帮我穿衣的是母亲，送我上学的还是母亲。,200510956919130006,加拿大,1,200510,父母是孩子的第一任老师,85,95,86,76,100,438,A,
然而这流行歌引起了很不好的影响——{CJ-zhuy他}不听儿童歌而且不喜欢学习。,200510302523200010,韩国,2,200510,我看流行歌曲,65,65,67,61,64,306,C,
流行歌曲总是有着非常多的听众，有些人特别喜欢流行歌曲，为什么呢？,200510302523100026,韩国,1,200510,我看流行歌曲,60,65,42,38,52,240,未参加,
流行歌曲的第一长处就是能消除紧张。,200510302523100046,韩国,1,200510,我看流行歌曲,90,65,72,71,91,380,B,
从学习方面、工作方面产生的所有的压力能放松一下，并且给人们带来一种喜爱、[BC，]兴奋、[BC，]各种各样的能解压的感觉。,200510302523100089,韩国,1,200510,我看流行歌曲,60,65,65,42,57,272,未参加,
社会各阶[B介]层的人们对此议论纷纷，有的人喜欢它，有的{CJ-zxy人}烦它。,200510302523100219,韩国,1,200510,我看流行歌曲,65,65,72,48,77,311,C,
但现在不如以前那么爱艺术的感觉{CJy}。,200510302523200215,韩国,2,200510,我看流行歌曲,75,65,53,34,45,259,未参加,
我看流行歌曲[BQ，]{CD针对}本人的看法流行歌曲很快红[BQ，]也很快被众人抛弃{CC消失}{CJs}[BQ。]因为目前的歌谱文字简单，没有像古代{CC古早}歌曲那么生动{CC深动}。,200510532529250002,泰国,2,200510,我看流行歌曲,65,70,37,40,42,240,未参加,
虽然我的歌喉不好，但我不管，我经常在洗澡时唱，在厕所时也唱，当我烦恼时，也打开收音机听歌，这样我就能很快地把烦恼从脑[B恼]海里赶出去，心情能感到愉快，做起事来顺利。,200510540540200072,印度尼西亚,2,200510,我看流行歌曲,55,70,51,36,55,251,未参加,
这是{CC1就是}为了我的汉语水平的提高，朋友推荐{CC劝告}的一个方法。,200510650523150186,韩国,1,200510,我看流行歌曲,70,75,60,59,72,325,C,
对，明年的春天我可能在日本。,200104124525200017,日本,2,200104,一封写给父母的信,70,65,68,80,63,332,C,
但他的工司在上海，我不太喜欢上海。{CP要是在上海要做贸易工作，那么，我觉得还是在日本做好吧。P},200104124525200031,日本,2,200104,一封写给父母的信,70,65,63,75,54,313,C,
因为我最近很想念父母。,200104124525200056,日本,2,200104,一封写给父母的信,70,65,47,47,45,260,未参加,
其实[B是]在北京也有樱花树。,200104124525200067,日本,2,200104,一封写给父母的信,65,75,44,39,33,243,未参加,
亲爱的爸爸、[BC，]妈妈[BQ：]你们最近过得怎么样？,200104124523200179,韩国,2,200104,一封写给父母的信,65,75,49,25,49,250,未参加,
可听说现在韩国经济{CJ-zxy情况}不好，恐怕{CJ-zy会}给你[B您]们{CJ-sy带来}不好的影响。{CD在},200104124523200190,韩国,2,200104,一封写给父母的信,65,65,47,28,47,236,未参加,
如果你们有时间，就来机场接我，好吗？,200104124525100192,日本,1,200104,一封写给父母的信,75,75,44,54,54,292,未参加,
我很好。,200104124525200250,日本,2,200104,一封写给父母的信,65,75,55,63,61,306,C,
××呢，她也很紧张，因为她是六年级{CJ-zxy的学生}，马上有毕业考试{CQ了}[BQ，]中国学生上初中有考试，所以他们都没有时间来玩。[BC，],200104124523200293,韩国,2,200104,一封写给父母的信,65,65,58,32,56,260,未参加,
祝身体健康！,200104124525200294,日本,2,200104,一封写给父母的信,75,90,60,70,58,347,B,
它很奇妙。,200104124540200291,印度尼西亚,2,200104,一封写给父母的信,90,70,52,47,76,328,未参加,
现在北京已经是春天了，到处都是绿油油的树叶，五颜六色的花也到处都{CC满处到}是，美丽极了！,200104124540200361,印度尼西亚,2,200104,一封写给父母的信,95,90,60,63,72,379,C,
我7月份就要毕业了。,200104124542200356,越南,2,200104,一封写给父母的信,90,75,77,58,88,382,B,
上个星期天，无聊的时候有个朋友带我去拜访他以前的老师。,200104124540200391,印度尼西亚,2,200104,一封写给父母的信,70,70,60,39,61,288,未参加,
从{CD写}信{CQ的}内容来看，你们最近身体很好，工作也顺利。,200104124525100413,日本,1,200104,一封写给父母的信,60,55,47,47,56,246,未参加,
妈妈我很喜欢看古建筑吧，它的样子我从来没看过的{CJsd}，所以我写了一篇文章。,200104124525200438,日本,2,200104,一封写给父母的信,65,90,71,54,56,327,C,
我这25年的思想毕竟是{CD个}空虚的。,200104124525100439,日本,1,200104,一封写给父母的信,65,70,58,77,61,317,C,
我希望你们公司早日跟{CC给}我联系。,199200204525200008,日本,2,199200,一封求职信,,,0,0,0,0,未参加,
我最终{CC究竟}{CJ-sy觉得}应有“安乐[C]死”。,199604124529200129,泰国,2,199604,如何看待“安乐死”,60,60,40,37,42,221,未参加,
我如下{CJX}有几个观点，因此，同意这见仁[B人]见智的“安乐死”。,199604124523200005,韩国,2,199604,如何看待“安乐死”,70,80,74,64,60,337,C,
他们[F們]心理所想的东[F東]西除了在学[F學]校朝夕相处[F處]的同学[F學]之外，大概也没有其他人能够[F夠]了解了。,199610801501200002,中国,2,199610,如何解决“代沟”问题,90,80,70,67,67,369,B,
问[F問]题[F題]的存在使很多家庭出现[F現]不同的意见[F見]，虽[F雖]然问[F問]题[F題]并[F並]不是非常严[C]重，但是实[F實]在有必要{CC需要}研究出一个[F個]解决[F決]的方法。,199610802801100001,澳大利亚,1,199610,如何解决“代沟”问题,85,75,73,63,69,357,B,
故此{CQ作为}长[F長]辈[F輩]的[C]我们[F們]必须[B需]理解[F觧]{CD到}这[F這]一点[F點]，多方面都应[F應]该[F該]和子女有商有量，同时[F時]还[B远[F遠]]需要对[F對]待儿[C]女[C]们[F們]如[C]对[F對]待[C]朋友一番地客气[F氣]，以公平和理由为[F爲]前提{CC先题[F題]}，什么[F麽]事[C]情[C]最好来[F來]个[F個]家庭会[F會]议[C]，以[C]多数的票[C]数作决[F決]定才能合乎{CC合附}现[F現]代父母与[C],199610802801100002,澳大利亚,1,199610,如何解决“代沟”问题,95,75,44,50,69,328,未参加,
我想最有效的{CC地}办法就是父母采取主动，在节假日时多陪子女，多去参加一些儿女的节目、活动[F動]，多与子女交谈[F談]，认真地听取他们[F們]在某个[F個]问题上的看法，多试着去接近他们、[BC，]去了解他们，多给他们一些机会发表个人看法[BQ，]多去了解他们[F們]的内心，[BC。]使他们[F們]觉得{CC感得}自己正拥有亲人的关心和爱。,199610512501250005,中国,2,199610,如何解决“代沟”问题,80,90,91,75,74,405,B,
在二十世纪的今天，社会一步一步地向前进，思想观念等在当[F當]今的青少年中也正慢慢地变化，也由于变化，而慢慢出现{CC现出}两代人的隔膜{CC间隔}问题。,199610512501150011,中国,1,199610,如何解决“代沟”问题,80,90,86,79,84,414,A,
多元化的社会对他们[C]来说，也是不能忽视的。,199610550523190008,韩国,1,199610,如何解决“代沟”问题,75,70,68,77,76,355,C,
”但，年轻人却反过来说：[BC；]“他们不肯听我们的话，话还没说完就开始说他们自己的主张、[BC，]道理。,199610550523290040,韩国,2,199610,如何解决“代沟”问题,70,60,68,63,59,305,C,
对[C]两[F兩]代问题{CQ的}解[C]决{CD上}提两{CC二}个[C]看法{CD说[F説]明}。,199610550523190054,韩国,1,199610,如何解决“代沟”问题,65,55,57,59,43,261,未参加,
他是{CQ在}1960年的社会情况下长大的，我是1971年以后[B候]才出生的，他跟我的{CD什么}教育[C]环境[B竟]、[BC，]{CD什么}社会情况都不一样，所以，他的想法跟我的不一样。[BC，],199610550523190094,韩国,1,199610,如何解决“代沟”问题,65,65,62,67,67,310,C,
此外，讲道理时[F時]，也要摆事实[F實]，给他示范[F範]一下洗衣机、干[F乾]衣机的方便，让[C]他亲历其境，那种[C]做法当然比吵架和争[F爭]论好得多。,199611543634100532,英国,1,199611,如何解决“代沟”问题,70,80,78,71,90,379,B,
有人做了就会利用，在没有的利用的时候{CC情候}就让[B浪]它空着，这种自私自利，懒散的人，处处可见，可我们千万不要有这种想法去利用别人，懒散是要不得的。,199603533533200033,新加坡,2,199603,由“三个和尚没水喝”想到的……,85,90,77,60,80,388,B,
自己的事自己做。,199603533533200048,新加坡,2,199603,由“三个和尚没水喝”想到的……,90,70,55,58,65,331,C,
尽管{CC直到}第二个和尚的出现[F現]，他还是照做不误[F誤]。[BC，],199603533533100093,新加坡,1,199603,由“三个和尚没水喝”想到的……,65,80,69,56,65,323,C,
”于是抬{CC拎}了两个水桶，大摇大摆也下山去了。,199603533533200099,新加坡,2,199603,由“三个和尚没水喝”想到的……,0,75,80,65,89,305,未参加,
古往今来[BQ，]从[F從]远[F遠]古的穴居到现[F現]今的高楼[F樓]大厦的群居习[F習]惯的变迁[F遷]，人类[F類]群体的协[F協]作精神都是不可或缺，至关{CC為}重要{CJsd}。,199604680519100519,马来西亚,1,199604,由“三个和尚没水喝”想到的……,85,60,44,54,75,306,未参加,
水是人类生活中{CC上}不可缺少的东西，我想他们应该共同合作，互相想{CJ+buy好}办法才对{CD了}。,199605104525200052,日本,2,199605,由“三个和尚没水喝”想到的……,70,55,44,67,68,288,未参加,
我又看到今天的短文中责任的回[C]避。{CD一个},199605104523100076,韩国,1,199605,由“三个和尚没水喝”想到的……,65,60,55,49,54,266,未参加,
他觉得非常奇怪，平时{CJ-zy都}在这里喝水，今天怎么回事儿？,199605104525100084,日本,1,199605,由“三个和尚没水喝”想到的……,65,70,55,70,75,321,C,
我立刻联想起现代社会的状况来了。,199605104525200123,日本,2,199605,由“三个和尚没水喝”想到的……,60,85,74,79,84,371,C,
所以我想还是{CJX}人不要那么多。,199605104525200160,日本,2,199605,由“三个和尚没水喝”想到的……,75,80,74,67,70,357,B,
但是，有一天，他们知道了[BD，]这个水源{CQ水}量不多，很快要没有了，[BC。]大家都觉得有人{CC谁}{CJX}应该去另一个水源。[BC，],199605104525200230,日本,2,199605,由“三个和尚没水喝”想到的……,60,55,46,70,75,287,未参加,
举个例子，[BC；]如果生活中干有的事情时，感觉麻烦[C]的话，有一些人不敢自己干，就是靠别人，让别人干这个事情。,199605104525100286,日本,1,199605,由“三个和尚没水喝”想到的……,65,70,35,49,42,247,未参加,
”第二个和尚又回答：“不能喝。,199605104616100315,德国,1,199605,由“三个和尚没水喝”想到的……,60,60,49,40,46,237,未参加,
第一个和尚先在一座高山上的一座庙里{CJ+zy只}一个人生活。,199605104525200341,日本,2,199605,由“三个和尚没水喝”想到的……,60,65,58,70,58,294,C,
没有依靠{CC2靠}，只能自己照顾[C]自己，{CQ在}这些条件下谁都没有时间听他心里的两种意见，只能为了做到某一件{CC个}事而努力下[C]去。,199605104525100354,日本,1,199605,由“三个和尚没水喝”想到的……,75,55,69,74,82,340,C,
后来又来{CQ了}一个和尚，于是两个人就抬水喝。,199605104610100357,法国,1,199605,由“三个和尚没水喝”想到的……,55,50,27,42,27,180,未参加,
我想第一个和尚是在我们社会上像[B象]领导人似的{CJ-dy那样的}{CJ-zxy人}，因为那个和尚自己挑水而不是别人挑水喝{CD的}，所以我想在社会{CQ上}也是一样道理。,199605104523200363,韩国,2,199605,由“三个和尚没水喝”想到的……,60,45,52,47,46,228,未参加,
有人想，“现在不做，以后做吧！[BQ”],199605104525100370,日本,1,199605,由“三个和尚没水喝”想到的……,65,55,33,47,39,221,未参加,
然后，两个和尚想个方法，等{CQ到}了老和[C]尚出去的那一天。,199605104525200365,日本,2,199605,由“三个和尚没水喝”想到的……,70,55,41,51,56,257,未参加,
这[F這]件事，{CQ从}小的{CJ-zxy方面}来说[F說]，是一个[F個]集团的问[F問]题，{CQ从}大的{CJ-zxy方面}来说，适用于[F於]世界上的任何{CD大小}集团。{CD比方说[F説]},199605550523190013,韩国,1,199605,由“三个和尚没水喝”想到的……,70,70,52,56,65,301,C,
现代又要求[C]国民的参与，[BC。]要是没有国民的积极活动，我[C]们国家是少数政治家的，并[F並]不是国民的。,199605550523190016,韩国,1,199605,由“三个和尚没水喝”想到的……,60,55,44,60,63,263,未参加,
哥儿俩上幼儿园后[BQ，]她更没空去{CQ做}妇女本性喜欢做的事，更谈不上有{CC1想像}什么事业上的个人发展或成就。,199704123610100102,法国,1,199704,记对我影响最大的一个人,65,80,78,82,84,377,B,
我出生的年代，正好是日军南侵第二次世界大战的时期。[BC，],200110540540250038,印度尼西亚,2,200110,我的童年,70,70,38,51,67,284,未参加,
我从父母的工作中感受到劳动人民的痛苦，我非常希望广大的农民的子女，以后不再像我这一代{CD的}童年那么多的辛酸痛苦。,200110540540250069,印度尼西亚,2,200110,我的童年,75,85,63,58,79,353,C,
